Id,AccountId,City,State,Country,StageName,Applicant_Type__c,income_as_a_of_DP200_income__c,Deposit_spent_on_DOD__c,Monthly_ongoing_financial_commitments__c,DP_Primary_income_frequency__c,DP_enders_with_uncleared_dishonours_233__c,Primary_regular_benefit_frequency__c,Largest_income_source_day_of_week__c,Frequency_for_largest_income_source__c,Total_monthly_income_ongoin_Reg_231__c,DP_Dishonours_Across_Primary_Acct_244__c,DP_No_Direct_Debits_On_Primary_Acct_355__c,Amount_of_SACC_commitments_due__c,Largest_income_Src_Avg_freq__c,Largest_income_Src_last_payment_amt__c,agency_collection_providers__c,income_DP200_spend_on_high_risk_merch__c,most_recent_loan_has_no_repayments__c,Income_source_is_other_income_549__c,Summary_Income__c,Summary_Expenses__c,Rent_Mortgage__c,Loan_Amount__c,Total_Repayment_Amount__c,Total_Repayments__c,Term_in_Weeks__c,Payment_Frequency__c,Applicant_Age__c,Summary_Income_CV__c,Amount_Requested__c,Employment_Status__c,Dishonours_203__c,DP_Insolvency_Indicator__c,DP_Days_in_Overdrawn_For_Period__c,Dishonours_For_Last_30_Days_DP907__c,Salary_Gov_Allowances_all_types_2117__c,DP_Monthly_avg_of_SACC_repayments__c,DP_Avg_Monthly_Loan_Liability_269__c,Repayment_Amount__c,Opportunity_Origin__c,Current_Balance__c,Opp_Number__c,loan_dishonours__c,CloseDate,Bank_Report_Gov_Benefit__c,Purpose_of_Loan__c,Loan_apply_date,DE_Results,DP_Total_Monthly_Benefit_Income__c,Total_monthly_credits__c,Summary_Income_BS__c
0062x00000EbhUoAAJ,0010K0000274jiaQAA,Quakers Hill,NSW,Australia,Loan Paid,Existing Client-Granted Loan Before,0.0,96.4,6907.8129,2.0,3.0,0.0,3.0,2.0,7622.8499,18.0,49.0,3192.6496,2352.2566,2547.07,1.0,0.0,0.0,0.0,3809.0,899.0,800.0,3500,4446.33,15.0,29.0,Fortnightly,57.0,7627.85,5000.0,Full-Time Employment,18.0,0.0,0.0659,12.0,4704.5133,3718.0,6723.9466,296.43,Financier-2,0.0,6306766,9.0,24-08-2023,False,Relocation Expenses,2023-08-23,Orange,0.0,7233.0,7627.85
0062x00000EOJilAAH,0012x000003EmAoAAK,Kanahooka,NSW,Australia,Loan Paid,Existing Client-Granted Loan Before,0.13,80.93,5163.1626,1.0,0.0,0.0,2.0,1.0,12576.8981,0.0,28.0,857.0724,2231.0578,2280.23,0.0,0.0,0.0,0.0,0.0,899.0,1400.0,3500,4191.43,16.0,15.714,Weekly,34.0,14876.9,3500.0,Full-Time Employment,0.0,0.0,0.011,0.0,10411.6033,2501.0,7104.4566,261.97,MoneySpot,0.0,6249209,0.0,18-08-2023,False,Travel Expenses,2023-08-17,Green,25.0,19125.0,14876.9
0062x00000GECufAAH,0012x00000ckopDAAQ,Stirling North,SA,Australia,Closed Lost,Existing Client-Granted Loan Before,49.13,96.88,1873.0733,2.0,0.0,2.0,4.0,2.0,7162.6641,0.0,15.0,0.0,1652.6,1548.6,0.0,0.0,0.0,0.0,8666.67,899.0,410.0,3500,4152.12,7.0,13.143,Fortnightly,46.0,7660.71,3500.0,Unemployed,0.0,0.0,0.2527,0.0,6870.2566,1040.0,2500.17,593.16,MoneySpot,,8453544,0.0,2024-03-14,False,Vehicle Expenses,2024-03-13,Orange,3565.0,7256.0,7660.71
0062x00000GBjODAA1,0012x00000TsTsqAAF,Mernda,VIC,Australia,Closed Lost,Existing Client-No Loan Granted Ever,0.0,98.28,0.0,4.0,0.0,0.0,1.0,4.0,2562.0,0.0,0.0,0.0,141.551,200.0,0.0,2.95,0.0,1.0,1175.75,899.0,0.0,3500,4099.73,5.0,9.714,Fortnightly,25.0,5501.33,3500.0,Unemployed,4.0,0.0,0.0879,0.0,1710.7133,0.0,0.0,819.95,Financier-2,,8708271,0.0,2024-04-03,False,Veterinary Expenses,2024-04-03,Orange,0.0,10507.0,5501.33
0062x00000DrFaoAAF,0012800001b1zl5AAA,Bendigo,VIC,Australia,Loan Paid,Existing Client-Granted Loan Before,16.17,86.53,4090.4598,2.0,0.0,4.0,3.0,2.0,5439.9456,0.0,20.0,0.0,1696.2183,1651.16,0.0,0.0,0.0,0.0,2795.0,1499.0,680.0,3450,4124.07,8.0,14.857,Fortnightly,33.0,5444.95,4000.0,Part-Time Employment,12.0,0.0,0.033,7.0,4344.5266,0.0,5671.4433,515.51,MoneySpot,0.0,5154499,0.0,28-04-2023,False,Vehicle Expenses,2023-04-28,Green,995.0,6150.0,5444.95
0062x00000EOAbiAAH,0012x000003FBUFAA4,Brassall,QLD,Australia,Loan Paid,Existing Client-Granted Loan Before,0.21,96.97,4364.0832,3.0,0.0,0.0,1.0,3.0,8689.055,3.0,34.0,1853.7173,4998.9933,4918.51,0.0,2.69,0.0,1.0,4030.0,1499.0,200.0,3500,4366.7,5.0,21.571,Monthly,44.0,8689.06,3500.0,Full-Time Employment,3.0,0.0,0.022,0.0,0.0,2653.0,8120.9533,873.34,Financier-2,0.0,6238078,3.0,17-08-2023,False,Vehicle Expenses,2023-08-16,Orange,50.0,23157.0,8689.06
0062x00000EdMjhAAF,0012x00000iIVu9AAG,Algester,QLD,Australia,Closed Lost,Existing Client-No Loan Granted Ever,0.0,83.14,455.3071,2.0,0.0,0.0,1.0,2.0,4029.4365,5.0,29.0,455.3071,694.7585,883.62,0.0,6.87,0.0,0.0,3380.0,400.0,800.0,3400,3992.07,10.0,10.143,Weekly,41.0,4029.44,3400.0,Full-Time Employment,5.0,0.0,0.044,1.0,1621.1033,454.0,564.06,399.21,MoneySpot,,6417897,2.0,05-09-2023,False,Living Expenses,2023-09-04,Orange,0.0,7483.0,4029.44
0062x00000EzlxBAAR,0012x00000XCeihAAD,Auburn,NSW,Australia,Loan Paid,Existing Client-Granted Loan Before,0.0,95.86,501.7623,2.0,0.0,0.0,4.0,2.0,6373.2654,0.0,33.0,0.0,2361.9416,2296.06,1.0,0.0,0.0,0.0,4064.67,400.0,150.0,3300,4214.69,14.0,27.857,Fortnightly,32.0,6373.27,3300.0,Full-Time Employment,0.0,0.0,0.0,0.0,4723.8833,331.0,1718.84,301.06,QuickCash,0.03,6834310,0.0,14-10-2023,False,Home Maintenance & Repairs,2023-10-14,Orange,0.0,7528.0,6373.27
0062x00000EbABSAA3,0012x00000kaFNEAA2,Sanctuary Point,NSW,Australia,Closed Lost,Existing Client-No Loan Granted Ever,0.0,57.48,950.3733,2.0,0.0,0.0,4.0,2.0,4803.5697,0.0,9.0,0.0,2152.6571,2152.65,1.0,0.0,0.0,0.0,0.0,1500.0,2200.0,3500,4247.74,9.0,17.714,Fortnightly,41.0,4803.57,3500.0,Full-Time Employment,0.0,0.0,0.0,0.0,5022.8666,0.0,1091.1766,471.98,MoneySpot,,6272800,0.0,20-08-2023,False,Living Expenses,2023-08-20,Green,0.0,5595.0,4803.57
0062x00000DGbnwAAD,0012x00000TFJbJAAX,Botanic Ridge,VIC,Australia,Loan Paid,Existing Client-Granted Loan Before,0.0,83.33,3203.0738,0.0,0.0,0.0,0.0,0.0,0.0,0.0,12.0,0.0,0.0,0.0,0.0,0.0,0.0,0.0,3961.33,1499.0,0.0,3500,4196.89,16.0,15.857,Weekly,44.0,26358.22,4500.0,Full-Time Employment,0.0,0.0,0.0659,0.0,0.0,325.0,3647.5266,262.31,MoneySpot,0.09,4731480,0.0,22-02-2023,False,Home Maintenance & Repairs,2023-02-22,Orange,0.0,27833.0,26358.22
0062x00000E4LZ5AAN,0012x000003D3q3AAC,Canley Heights,NSW,Australia,Loan Paid,Existing Client-Granted Loan Before,0.0,54.01,4645.3978,2.0,0.0,0.0,1.0,2.0,7431.0371,1.0,50.0,1043.8709,3374.2857,3388.0,0.0,0.17,0.0,0.0,0.0,899.0,0.0,3500,4388.57,12.0,24.429,Fortnightly,36.0,7431.04,5000.0,,1.0,0.0,0.0,0.0,7873.3333,3014.0,7191.2133,365.72,QuickCash,0.0,5560744,1.0,12-06-2023,False,Vehicle Expenses,2023-06-12,Orange,0.0,12155.0,7431.04
0062x00000DJGv0AAH,0012800001QCdGOAA1,Blacktown,NSW,Australia,Loan Paid,Existing Client-Granted Loan Before,0.0,39.61,4581.3144,1.0,0.0,0.0,2.0,1.0,9775.1896,0.0,166.0,903.6647,1661.3007,1493.86,1.0,0.0,0.0,0.0,5200.0,899.0,170.0,3500,4340.79,24.0,23.714,Weekly,61.0,9775.19,3500.0,Full-Time Employment,0.0,0.0,0.0,0.0,7198.97,3473.0,4743.3766,180.87,MoneySpot,0.0,4880422,0.0,17-03-2023,False,Furniture or Appliances,2023-03-17,Orange,0.0,11281.0,9775.19
0062x00000DXX5UAAX,0012x00000KKZgyAAH,Blacktown,NSW,Australia,Loan Paid,Existing Client-Granted Loan Before,0.0,54.25,3963.4236,1.0,1.0,0.0,6.0,1.0,16171.8525,4.0,21.0,0.0,2080.75,3441.0,0.0,0.01,0.0,1.0,0.0,899.0,1000.0,3500,4284.32,10.0,19.714,Fortnightly,27.0,7848.85,3500.0,Self Employed,4.0,0.0,0.033,1.0,6818.4966,1456.0,3386.03,428.44,MoneySpot,0.0,4979557,3.0,02-04-2023,False,Medical Expenses,2023-04-01,Green,0.0,20466.0,7848.85
0062x00000DYILmAAP,0012x00000gAZmqAAG,Launceston,TAS,Australia,Loan Paid,Existing Client-Granted Loan Before,0.0,90.21,3498.2748,1.0,0.0,0.0,2.0,1.0,4821.5191,3.0,20.0,0.0,1000.5369,1023.69,0.0,0.35,0.0,0.0,4519.67,400.0,900.0,3150,3945.97,24.0,24.571,Weekly,33.0,4821.52,5000.0,Full-Time Employment,3.0,0.0,0.0549,0.0,4335.66,1059.0,4384.77,165.91,MoneySpot,0.0,5024319,0.0,08-04-2023,False,Living Expenses,2023-04-08,Green,0.0,8588.0,4821.52
0062x00000DrtGDAAZ,0012x00000Ve6mIAAR,Condobolin,NSW,Australia,Loan Paid,Existing Client-Granted Loan Before,0.0,61.76,3717.1854,4.0,0.0,0.0,3.0,4.0,6899.191,2.0,26.0,0.0,1781.3637,1832.35,1.0,0.0,0.0,0.0,4243.5,899.0,800.0,3100,3917.88,12.0,23.857,Fortnightly,54.0,9232.52,15001.0,Full-Time Employment,3.0,0.0,0.1209,0.0,5447.1933,820.0,5929.57,326.5,MoneySpot,0.0,5201743,2.0,05-05-2023,False,Living Expenses,2023-05-05,Green,0.0,12692.0,9232.52
0062x00000DZ7EsAAL,0012x00000XOorgAAD,Emerald,QLD,Australia,Loan Paid,Existing Client-Granted Loan Before,0.0,86.36,1505.362,2.0,0.0,0.0,2.0,2.0,3819.6393,0.0,4.0,1184.0,1649.7633,1613.82,1.0,2.25,1.0,0.0,1550.0,899.0,1500.0,3200,4051.09,12.0,24.429,Fortnightly,24.0,3819.64,5000.0,Full-Time Employment,0.0,0.0,0.0,0.0,3299.5266,1253.0,2404.01,337.6,QuickCash,-0.44,5074163,0.0,16-04-2023,False,Relocation Expenses,2023-04-16,Green,0.0,4315.0,3819.64
0062x00000DX88xAAD,0012x00000WXA7DAAX,Gillieston Heights,NSW,Australia,Loan Paid,Existing Client-Granted Loan Before,38.11,95.8,4115.0423,2.0,1.0,1.0,2.0,2.0,9765.5447,7.0,80.0,1091.086,2104.5985,2025.04,3.0,0.03,0.0,0.0,4671.85,899.0,1020.0,3300,4111.06,11.0,22.0,Fortnightly,44.0,14687.99,3500.0,Full-Time Employment,40.0,0.0,0.8352,9.0,13751.3933,3461.0,5133.85,373.74,MoneySpot,0.0,4955962,22.0,29-03-2023,False,Life Event Expenses,2023-03-29,Green,3978.0,10437.0,14687.99
0062x00000D7PkIAAV,0012x00000OKV25AAH,Wodonga,VIC,Australia,Loan Paid,Existing Client-Granted Loan Before,0.0,60.19,4503.0502,1.0,0.0,0.0,2.0,1.0,4727.4484,0.0,43.0,318.0714,938.3723,938.68,0.0,0.09,0.0,0.0,3752.67,400.0,0.0,3500,4218.75,16.0,16.429,Weekly,43.0,4727.45,5000.0,Full-Time Employment,0.0,0.0,0.0,0.0,4066.28,1507.0,4595.86,263.68,MoneySpot,0.32,4482875,0.0,15-01-2023,False,Medical Expenses,2023-01-15,Orange,0.0,5585.0,4727.45
0062x00000DIChOAAX,0012x00000GcQRtAAN,Shelly Beach,NSW,Australia,Loan Paid,Existing Client-Granted Loan Before,0.0,41.34,2922.4257,1.0,0.0,0.0,3.0,1.0,13200.5474,1.0,65.0,716.9026,1423.9792,1765.97,1.0,0.0,0.0,0.0,4983.33,599.0,640.0,3500,4244.6,18.0,18.143,Weekly,51.0,13787.55,3500.0,Full-Time Employment,1.0,0.0,0.0879,1.0,12151.74,660.0,2897.61,235.82,MoneySpot,0.0,4821572,0.0,08-03-2023,False,Life Event Expenses,2023-03-08,Green,0.0,24727.0,13787.55
0062x00000E5MjFAAV,0012x00000iJHtXAAW,Queens Park,WA,Australia,Closed Lost,New Client-New Loan,0.0,16.55,0.0,1.0,0.0,0.0,3.0,1.0,3216.018,0.0,0.0,0.0,740.125,570.5,0.0,0.0,0.0,0.0,4333.33,400.0,100.0,3400,3990.29,9.0,9.571,Weekly,37.0,3216.02,3400.0,Part-Time Employment,0.0,0.0,0.2637,0.0,2467.0833,0.0,0.0,443.37,MoneySpot,,5648108,0.0,18-06-2023,False,Living Expenses,2023-06-18,Orange,0.0,2640.0,3216.02
0062x00000DWrDOAA1,0012x00000Ve3TPAAZ,Doveton,VIC,Australia,Loan Paid,Existing Client-Granted Loan Before,1.13,54.76,3686.6872,1.0,0.0,0.0,2.0,1.0,9004.0816,0.0,195.0,412.2327,1435.46,1435.46,1.0,0.0,0.0,0.0,5258.76,899.0,0.0,3300,4085.39,21.0,21.286,Weekly,32.0,9695.16,3500.0,Full-Time Employment,0.0,0.0,0.033,0.0,6373.41,1742.0,6012.4833,194.55,MoneySpot,0.0,4941630,0.0,27-03-2023,False,Home Maintenance & Repairs,2023-03-27,Green,103.0,9112.0,9695.16
0062x00000DUuoOAAT,0012x00000GbdrCAAR,Canning Vale,WA,Australia,Loan Paid,Existing Client-Granted Loan Before,0.0,90.32,3756.4455,1.0,2.0,0.0,4.0,1.0,5268.3631,12.0,79.0,555.2345,1350.5833,1403.0,0.0,2.63,0.0,0.0,4368.5,400.0,100.0,3300,3986.55,16.0,16.0,Weekly,45.0,5268.36,3300.0,Full-Time Employment,12.0,0.0,0.5934,4.0,5402.3333,1942.0,3826.9033,249.16,MoneySpot,0.03,5400810,9.0,26-05-2023,False,Vehicle Expenses,2023-05-26,Green,0.0,6399.0,5268.36
0062x00000DZbj7AAD,0012x00000cACHSAA4,Surfers Paradise,QLD,Australia,Loan Paid,Existing Client-Granted Loan Before,0.0,76.74,5764.2515,1.0,0.0,0.0,1.0,1.0,9890.8931,4.0,101.0,1676.2571,1260.3284,999.75,1.0,0.0,0.0,0.0,5633.33,400.0,400.0,3250,4062.45,24.0,23.714,Weekly,37.0,9941.54,4500.0,Full-Time Employment,4.0,0.0,0.0,3.0,5461.4233,2653.0,5748.7133,169.27,MoneySpot,0.0,5102250,4.0,20-04-2023,False,Travel Expenses,2023-04-20,Green,0.0,9927.0,9941.54
0062x00000DsbdXAAR,0012x00000XJvv3AAD,Glendenning,NSW,Australia,Loan Paid,Existing Client-Granted Loan Before,4.13,81.43,3393.2442,2.0,2.0,2.0,3.0,2.0,6036.1524,24.0,17.0,716.5111,1408.0514,1148.73,1.0,0.23,0.0,0.0,3747.81,400.0,0.0,3050,3729.36,8.0,15.857,Fortnightly,45.0,6036.15,3050.0,Full-Time Employment,24.0,0.0,0.0549,8.0,3576.84,2263.0,4684.0266,466.18,QuickCash,0.02,5251638,17.0,12-05-2023,False,Living Expenses,2023-05-11,Orange,361.0,8738.0,6036.15
0062x00000EBzvoAAD,0012x00000fpb1NAAQ,Kingsgrove,NSW,Australia,Loan Paid,Existing Client-Granted Loan Before,0.0,86.4,2591.4599,1.0,0.0,0.0,4.0,1.0,5071.9175,0.0,39.0,0.0,923.2141,1004.78,1.0,0.0,0.0,1.0,0.0,1499.0,350.0,3500,4395.11,26.0,26.143,Weekly,51.0,5071.92,3500.0,,0.0,0.0,0.2418,0.0,0.0,660.0,4003.4533,169.05,MoneySpot,0.0,5846875,0.0,06-07-2023,False,Other Expenses,2023-07-06,Orange,0.0,6062.0,5071.92
0062x00000DXMPQAA5,0012x00000GbViEAAV,Quakers Hill,NSW,Australia,Loan Paid,Existing Client-Granted Loan Before,0.0,56.57,6460.2361,2.0,1.0,0.0,3.0,2.0,7280.3427,5.0,43.0,1154.7688,2457.1285,1977.19,0.0,0.98,0.0,0.0,1500.0,899.0,1200.0,3300,3999.11,8.0,15.857,Fortnightly,45.0,7421.57,3500.0,Full-Time Employment,5.0,0.0,0.011,1.0,7783.7333,1215.0,7183.2966,499.89,MoneySpot,0.0,4968705,2.0,31-03-2023,False,Vehicle Expenses,2023-03-31,Green,0.0,8712.0,7421.57
0062x00000FWE9lAAH,0012x00000g9xCBAAY,Wallamore,NSW,Australia,Loan Paid,Existing Client-Granted Loan Before,0.0,17.42,634.0933,4.0,0.0,0.0,2.0,4.0,6927.5833,0.0,24.0,1815.5636,2968.9642,3799.95,0.0,0.0,0.0,0.0,0.0,599.0,300.0,3500,4221.07,8.0,16.0,Fortnightly,40.0,6927.58,4000.0,,0.0,0.0,0.0,0.0,6927.5833,1860.0,1941.93,527.64,MoneySpot,0.0,7653208,0.0,27-12-2023,False,Vehicle Expenses,2023-12-27,Orange,0.0,8721.0,6927.58
0062x00000D8nXeAAJ,0012x00000GdxXfAAJ,CASTLE HILL,NSW,Australia,Closed Lost,Existing Client-No Loan Granted Ever,0.0,94.86,677.38,4.0,1.0,0.0,2.0,4.0,413.3333,0.0,3.0,0.0,413.3333,1205.0,1.0,14.21,0.0,1.0,2214.7,899.0,0.0,3500,4062.94,3.0,13.286,Monthly,23.0,620.0,3500.0,Full-Time Employment,7.0,0.0,0.1538,2.0,0.0,0.0,757.0833,1354.32,MoneySpot,,4550206,6.0,25-01-2023,False,Home Maintenance & Repairs,2023-01-25,Orange,0.0,1175.0,620.0
0062x00000DZ1jdAAD,0010K00001uITjmQAG,Mandurah,WA,Australia,Loan Paid,Existing Client-Granted Loan Before,0.0,72.14,531.6629,0.0,3.0,0.0,0.0,0.0,0.0143,6.0,30.0,1263.2481,0.0,0.0,1.0,0.0,0.0,0.0,3358.33,899.0,1000.0,3500,4375.61,5.0,21.857,Monthly,43.0,0.0,3500.0,Full-Time Employment,6.0,0.0,0.3187,1.0,0.0,1229.0,4612.69,875.13,MoneySpot,0.0,5067528,5.0,15-04-2023,False,Veterinary Expenses,2023-04-15,Green,0.0,7228.0,0.0
0062x00000F3RjQAAV,0012x00000RrWp6AAF,Bonnyrigg Heights,NSW,Australia,Loan Paid,Existing Client-Granted Loan Before,0.33,57.77,1862.6833,2.0,0.0,0.0,4.0,2.0,4558.8607,0.0,5.0,0.0,1961.6933,1899.43,1.0,0.0,0.0,0.0,3463.2,400.0,150.0,3100,4093.89,18.0,35.0,Fortnightly,33.0,15394.76,3300.0,Full-Time Employment,0.0,0.0,0.022,0.0,3923.3866,1908.0,4038.5733,227.44,QuickCash,0.0,7048782,0.0,03-11-2023,False,Vehicle Expenses,2023-11-03,Green,61.0,18017.0,15394.76
0062x00000FUajyAAD,0012x00000g7nY4AAI,Morayfield,QLD,Australia,Loan Paid,Existing Client-Granted Loan Before,0.0,79.82,985.61,2.0,0.0,0.0,4.0,2.0,4821.8625,0.0,24.0,234.5342,1998.42,3077.14,0.0,0.06,0.0,0.0,0.0,1500.0,0.0,3100,3754.41,8.0,15.0,Fortnightly,19.0,4912.87,3100.0,Full-Time Employment,0.0,0.0,0.0,0.0,3343.9,286.0,1079.3433,469.31,MoneySpot,0.0,7520817,0.0,16-12-2023,False,Vehicle Expenses,2023-12-16,Orange,0.0,5105.0,4912.87
0062x00000FJCVrAAP,0012x00000WY1klAAD,Blackett,NSW,Australia,Loan Paid,Existing Client-Granted Loan Before,4.74,72.6,592.2884,4.0,0.0,4.0,3.0,4.0,21739.7955,0.0,13.0,0.0,626.8,1105.0,0.0,0.0,0.0,1.0,5850.0,599.0,480.0,3500,4177.81,8.0,14.857,Fortnightly,44.0,24588.7,3500.0,Full-Time Employment,0.0,0.0,0.0,0.0,5829.4566,717.0,819.9533,522.23,MoneySpot,-0.68,7305092,0.0,24-11-2023,False,Vehicle Expenses,2023-11-24,Green,1358.0,28601.0,24588.7
0062x00000DH4wjAAD,0012x00000cJtZNAA0,Mount Barker,SA,Australia,Loan Paid,Existing Client-Granted Loan Before,0.0,90.23,4089.5851,2.0,1.0,0.0,4.0,2.0,8733.6933,4.0,29.0,224.0,2069.1366,1693.95,0.0,17.58,1.0,0.0,4378.64,599.0,1050.0,3150,3962.39,13.0,26.571,Fortnightly,22.0,7185.94,5000.0,Full-Time Employment,16.0,0.0,0.1209,10.0,4138.2733,921.0,4565.8033,310.35,MoneySpot,0.0,4761157,10.0,28-02-2023,False,Other Expenses,2023-02-28,Green,0.0,10402.0,7185.94
0062x00000EyEUmAAN,0012x00000OJ4byAAD,Alphington,VIC,Australia,Loan Paid,Existing Client-Granted Loan Before,0.0,59.16,3229.2165,3.0,0.0,0.0,4.0,3.0,5881.8431,2.0,17.0,0.0,4768.4966,4768.49,0.0,0.0,0.0,0.0,1950.0,599.0,495.0,3250,4319.93,7.0,32.143,Monthly,28.0,7158.62,3250.0,Full-Time Employment,2.0,0.0,0.0549,0.0,4768.4966,1279.0,4234.0233,617.14,MoneySpot,0.0,6721728,2.0,03-10-2023,False,Travel Expenses,2023-10-02,Orange,0.0,9117.0,7158.62
0062x00000FVOOhAAP,0012x00000SIShiAAH,Ulladulla,NSW,Australia,Loan Paid,Existing Client-Granted Loan Before,0.0,49.1,3153.7077,1.0,0.0,0.0,4.0,1.0,5105.3816,0.0,36.0,0.0,1006.5,1006.5,1.0,2.67,0.0,0.0,920.0,599.0,1000.0,3500,4207.7,16.0,16.143,Weekly,35.0,5110.38,5000.0,Full-Time Employment,0.0,0.0,0.011,0.0,4026.0,1486.0,3702.1633,262.99,MoneySpot,1.66,7587917,0.0,22-12-2023,False,Living Expenses,2023-12-21,Orange,0.0,5091.0,5110.38
0062x00000ELVlnAAH,0012x00000KLlo0AAD,North Warrandyte,VIC,Australia,Loan Paid,Existing Client-Granted Loan Before,0.8,34.73,3919.1193,2.0,0.0,0.0,3.0,2.0,8349.8014,0.0,39.0,0.0,3720.4571,4528.7,1.0,0.77,0.0,0.0,6736.17,899.0,2600.0,3050,3729.1,8.0,15.857,Fortnightly,64.0,8324.8,3050.0,Full-Time Employment,0.0,0.0,0.0,0.0,8681.0666,2115.0,4227.4233,466.14,MoneySpot,0.0,6037949,0.0,28-07-2023,False,Medical Expenses,2023-07-28,Green,96.0,11931.0,8324.8
0062x00000ECdZOAA1,0012x00000IO7msAAD,Dardanup West,WA,Australia,Loan Paid,Existing Client-Granted Loan Before,0.0,77.39,5842.6643,1.0,0.0,0.0,4.0,1.0,8176.2051,2.0,56.0,803.0,1837.3076,1947.5,1.0,0.1,0.0,0.0,8666.67,599.0,250.0,3500,4594.64,36.0,36.286,Weekly,35.0,8176.21,5000.0,Full-Time Employment,2.0,0.0,0.022,2.0,7961.6666,1580.0,5880.5,127.64,MoneySpot,-0.15,5890918,2.0,12-07-2023,False,Life Event Expenses,2023-07-12,Orange,0.0,11606.0,8176.21
0062x00000DtHcPAAV,0012x00000LPks3AAD,Goulburn,NSW,Australia,Loan Paid,Existing Client-Granted Loan Before,1.51,47.07,2011.2863,2.0,0.0,0.0,3.0,2.0,11203.8709,4.0,45.0,1688.0672,2304.5,2382.0,1.0,0.01,0.0,0.0,5842.37,1500.0,640.0,3500,4226.8,8.0,16.143,Fortnightly,43.0,11732.64,3500.0,Full-Time Employment,4.0,0.0,0.7802,2.0,9458.3166,1665.0,4439.6666,528.36,QuickCash,0.0,5300443,0.0,17-05-2023,False,Vehicle Expenses,2023-05-17,Green,196.0,12957.0,11732.64
0062x00000Ef9BHAAZ,0012x00000SIJVtAAP,Kirwan,QLD,Australia,Closed Lost,Existing Client-Granted Loan Before,0.0,58.07,4176.9223,1.0,0.0,0.0,2.0,1.0,11364.4085,1.0,54.0,310.9724,1305.8915,1567.65,0.0,0.75,0.0,0.0,4337.04,899.0,100.0,3500,4186.02,16.0,16.571,Weekly,30.0,11364.41,3500.0,Full-Time Employment,1.0,0.0,0.0,0.0,7592.1966,1147.0,6304.8866,261.63,MoneySpot,,6547790,0.0,16-09-2023,False,Home Maintenance & Repairs,2023-09-15,Green,0.0,18350.0,11364.41
0062x00000DUkxGAAT,0010K00001rHH93QAG,Ayr,QLD,Australia,Loan Paid,Existing Client-Granted Loan Before,0.0,68.69,3766.1238,1.0,0.0,0.0,2.0,1.0,5126.6983,10.0,92.0,2408.1235,1164.8846,1050.05,1.0,0.0,0.0,0.0,4181.67,899.0,300.0,3500,4252.26,19.0,18.857,Weekly,52.0,8202.76,3500.0,Full-Time Employment,10.0,0.0,0.978,6.0,5047.8333,2331.0,4437.5366,223.81,MoneySpot,-0.01,5387977,9.0,25-05-2023,False,Home Maintenance & Repairs,2023-05-25,Green,0.0,10036.0,8202.76
0062x00000EO5ALAA1,0012x00000XNQIPAA5,Rowville,VIC,Australia,Loan Paid,Existing Client-Granted Loan Before,23.28,61.94,2250.7234,4.0,0.0,0.0,5.0,4.0,5621.88,3.0,35.0,0.0,2108.205,2380.92,0.0,0.13,0.0,0.0,4753.07,899.0,0.0,3500,4349.3,12.0,23.429,Fortnightly,44.0,6305.21,3500.0,Full-Time Employment,3.0,0.0,0.0769,2.0,5621.88,658.0,2253.9466,362.45,MoneySpot,0.0,6229532,0.0,16-08-2023,False,Medical Expenses,2023-08-16,Green,2380.0,10220.0,6305.21
0062x00000DITd9AAH,0012x00000NRVajAAH,Blacktown,NSW,Australia,Loan Paid,Existing Client-Granted Loan Before,0.0,70.99,2837.3147,2.0,1.0,0.0,5.0,2.0,7442.3655,6.0,38.0,485.64,2784.5657,2683.28,0.0,0.0,0.0,0.0,0.0,1499.0,1100.0,3200,3970.66,10.0,20.143,Fortnightly,51.0,6961.47,3500.0,,6.0,0.0,0.1319,2.0,6497.32,1373.0,3850.5366,397.07,QuickCash,0.0,4835550,3.0,10-03-2023,False,Living Expenses,2023-03-10,Green,0.0,8941.0,6961.47
0062x00000DAgrtAAD,0012x00000d9hG7AAI,Banora Point,NSW,Australia,Loan Paid,Existing Client-Granted Loan Before,0.0,71.27,1786.157,1.0,2.0,0.0,3.0,1.0,3449.0098,2.0,25.0,616.3025,561.1476,671.79,0.0,83.25,0.0,0.0,0.0,899.0,1600.0,3200,4022.46,24.0,24.143,Weekly,21.0,3449.01,5000.0,Full-Time Employment,6.0,0.0,0.967,4.0,2431.64,974.0,1628.5666,167.61,QuickCash,0.0,4641117,5.0,08-02-2023,False,Home Maintenance & Repairs,2023-02-08,Green,0.0,3141.0,3449.01
0062x00000DG08aAAD,0012x00000OxQA0AAN,Mowbray,TAS,Australia,Loan Paid,Existing Client-Granted Loan Before,0.98,92.3,3338.0961,2.0,0.0,0.0,2.0,2.0,6431.9789,1.0,35.0,1163.8494,2350.9166,2440.17,0.0,1.62,0.0,0.0,2647.24,400.0,2120.0,3500,4216.16,8.0,15.857,Fortnightly,50.0,6431.98,3500.0,Full-Time Employment,1.0,0.0,0.4945,1.0,4701.8333,1224.0,4923.0966,527.03,QuickCash,0.0,4697252,1.0,16-02-2023,False,Medical Expenses,2023-02-16,Green,68.0,6902.0,6431.98
0062x00000E5sPyAAJ,0012x00000g9ptqAAA,Melton South,VIC,Australia,Loan Paid,Existing Client-Granted Loan Before,0.0,39.58,719.2659,4.0,0.0,0.0,3.0,4.0,5351.3433,0.0,27.0,0.0,1638.0037,1885.25,0.0,0.0,0.0,0.0,3722.33,899.0,1000.0,3500,4221.29,8.0,16.0,Fortnightly,55.0,6514.4,3500.0,Full-Time Employment,0.0,0.0,0.6264,0.0,4368.01,1929.0,7429.0333,527.67,MoneySpot,0.0,5688290,0.0,22-06-2023,False,Home Maintenance & Repairs,2023-06-22,Green,0.0,8087.0,6514.4
0062x00000E4WsfAAF,0012x00000gpob6AAA,Lara,VIC,Australia,Closed Lost,Existing Client-Granted Loan Before,0.28,57.87,0.0,4.0,0.0,0.0,5.0,4.0,1527.8571,0.0,10.0,0.0,364.4444,300.0,0.0,0.0,0.0,1.0,0.0,899.0,1.5,3100,3780.91,16.0,16.286,Weekly,50.0,4057.95,3100.0,Full-Time Employment,0.0,0.0,0.3736,0.0,0.0,519.0,846.16,236.31,MoneySpot,,5580455,0.0,12-06-2023,False,Other Expenses,2023-06-11,Orange,13.0,4505.0,4057.95
0062x00000DHY8LAAX,0012x00000MgK2EAAV,Bexley,NSW,Australia,Loan Paid,Existing Client-Granted Loan Before,0.0,50.97,2134.8567,2.0,0.0,0.0,3.0,2.0,7931.8772,5.0,90.0,1730.0885,2167.278,2286.54,1.0,0.87,0.0,0.0,5868.91,599.0,2540.0,3100,3786.84,9.0,17.0,Fortnightly,60.0,7933.35,3500.0,Full-Time Employment,5.0,1.0,0.033,0.0,6835.34,1610.0,3513.84,420.77,MoneySpot,0.0,4784204,1.0,02-03-2023,False,Living Expenses,2023-03-02,Green,0.0,8076.0,7933.35
0062x00000EEUk4AAH,0012x00000fmY01AAE,Manoora,QLD,Australia,Loan Paid,Existing Client-Granted Loan Before,0.0,97.39,30.0,2.0,0.0,0.0,3.0,2.0,6624.4169,0.0,8.0,0.0,2271.9666,2037.99,0.0,11.8,0.0,1.0,3683.33,400.0,740.0,3500,4337.69,12.0,23.143,Fortnightly,22.0,6940.01,3500.0,Part-Time Employment,0.0,0.0,0.011,0.0,0.0,162.0,265.5633,361.48,MoneySpot,-0.47,6016565,0.0,26-07-2023,False,Travel Expenses,2023-07-26,Orange,0.0,10042.0,6940.01
0062x00000FTnLrAAL,0010K00002ARu2BQAT,Blue Haven,NSW,Australia,Loan Paid,Existing Client-Granted Loan Before,0.11,93.85,3863.6537,1.0,0.0,0.0,3.0,1.0,7818.4692,0.0,34.0,1052.0811,1034.1138,1044.15,1.0,0.77,0.0,0.0,3466.67,599.0,300.0,3500,4261.21,18.0,18.571,Weekly,28.0,6935.14,5000.0,Full-Time Employment,0.0,0.0,0.0,0.0,4481.16,3175.0,4616.0433,236.74,MoneySpot,0.0,7458348,0.0,10-12-2023,False,Medical Expenses,2023-12-10,Orange,12.0,10219.0,6935.14
0062x00000DGzqEAAT,0012x00000Oxk3CAAR,Carlton,VIC,Australia,Closed Lost,Existing Client-Granted Loan Before,0.0,69.41,2494.7042,1.0,0.0,0.0,2.0,1.0,4455.4697,4.0,0.0,1917.8288,962.0807,971.85,0.0,0.0,0.0,1.0,2506.55,400.0,120.0,3400,4078.55,16.0,16.571,Weekly,38.0,4455.47,3400.0,Full-Time Employment,4.0,0.0,0.0,0.0,0.0,1790.0,2489.89,254.92,MoneySpot,,4754507,3.0,25-02-2023,False,Home Maintenance & Repairs,2023-02-25,Green,0.0,5771.0,4455.47
0062x00000Dsw9TAAR,0012x00000SG4Q8AAL,Noble Park North,VIC,Australia,Loan Paid,Existing Client-Granted Loan Before,0.0,89.56,1014.9175,3.0,1.0,0.0,5.0,3.0,4602.9975,2.0,10.0,698.9199,4602.9975,4602.99,0.0,0.0,0.0,0.0,4347.34,1500.0,850.0,3500,4296.31,4.0,17.571,Monthly,38.0,4603.0,3500.0,Full-Time Employment,2.0,0.0,0.5714,1.0,6137.33,888.0,1237.04,1074.08,QuickCash,0.0,5274149,1.0,15-05-2023,False,Living Expenses,2023-05-15,Green,0.0,6483.0,4603.0
0062x00000DVxRJAA1,0012x00000GcF1SAAV,Monash,ACT,Australia,Loan Paid,Existing Client-Granted Loan Before,0.13,53.12,1826.866,2.0,0.0,0.0,3.0,2.0,8507.7057,0.0,54.0,861.8056,1637.27,1611.47,0.0,2.27,0.0,0.0,1849.87,599.0,400.0,3400,4137.73,10.0,18.714,Fortnightly,47.0,8507.71,3500.0,Part-Time Employment,0.0,0.0,0.022,0.0,4130.69,1298.0,1860.81,413.78,MoneySpot,-0.02,4885671,0.0,18-03-2023,False,Travel Expenses,2023-03-18,Green,13.0,9311.0,8507.71
0062x00000EDfucAAD,0012x000008JfgAAAS,Huntfield Heights,SA,Australia,Closed Lost,Existing Client-No Loan Granted Ever,0.0,86.44,70.6666,0.0,1.0,0.0,0.0,0.0,0.0,0.0,0.0,0.0,0.0,0.0,0.0,0.0,0.0,0.0,0.0,0.0,100.0,3500,4095.19,9.0,9.571,Weekly,25.0,8406.12,3500.0,Unemployed,2.0,0.0,0.0,0.0,1455.6,25.0,170.3233,455.03,MoneySpot,,5958096,2.0,20-07-2023,False,Vehicle Expense,2023-07-20,Orange,0.0,3487.0,8406.12
0062x00000F3GtDAAV,0010K00001xO0UyQAK,Croydon,VIC,Australia,Loan Paid,Existing Client-Granted Loan Before,0.0,32.94,1516.7243,1.0,0.0,0.0,2.0,1.0,7338.2763,0.0,13.0,0.0,1688.8092,1688.81,0.0,0.75,0.0,0.0,6595.33,1499.0,1900.0,3500,4196.25,16.0,15.857,Weekly,37.0,34964.94,3500.0,Full-Time Employment,0.0,0.0,0.033,0.0,7318.1733,1220.0,2496.0166,262.27,MoneySpot,0.0,7034216,0.0,02-11-2023,False,Child Expenses,2023-11-02,Green,0.0,37114.0,34964.94
0062x00000Fv83DAAR,0012x00000hXPnFAAW,Saint Clair,NSW,Australia,Loan Paid,Existing Client-Granted Loan Before,0.0,43.43,163.3333,4.0,0.0,0.0,2.0,4.0,2116.6733,0.0,36.0,502.5268,1220.0,850.0,1.0,13.41,0.0,1.0,1320.0,599.0,800.0,3500,4154.28,14.0,13.714,Weekly,47.0,8007.8,3500.0,Full-Time Employment,0.0,0.0,0.0549,0.0,0.0,1336.0,2673.3633,296.74,MoneySpot,0.0,8292708,0.0,2024-02-26,False,Home Maintenance & Repairs,2024-02-26,Orange,0.0,8896.0,8007.8
0062x00000DsCFYAA3,0012x00000gAZmqAAG,Launceston,TAS,Australia,Loan Paid,Existing Client-Granted Loan Before,0.0,81.64,4074.4897,1.0,0.0,0.0,2.0,1.0,4657.5915,3.0,19.0,0.0,976.55,1007.25,0.0,0.31,0.0,0.0,4519.67,400.0,900.0,3100,3910.5,24.0,24.143,Weekly,33.0,4855.92,5000.0,Full-Time Employment,3.0,0.0,0.0769,0.0,3906.2,2215.0,4824.49,162.94,MoneySpot,0.0,5226926,0.0,09-05-2023,False,Living Expenses,2023-05-08,Green,0.0,11044.0,4855.92
0062x00000EeGXEAA3,0010K00001sZsCqQAK,Elizabeth Vale,SA,Australia,Closed Lost,Existing Client-Granted Loan Before,25.55,47.75,1856.6954,2.0,0.0,4.0,3.0,2.0,6395.4728,0.0,31.0,538.8095,2117.2342,2484.44,0.0,0.0,0.0,0.0,1096.33,400.0,300.0,3500,4242.15,9.0,17.571,Fortnightly,31.0,6475.47,5000.0,Unemployed,0.0,0.0,0.2308,0.0,6560.0733,2789.0,2941.48,471.35,MoneySpot,,6476833,0.0,14-09-2023,False,Living Expenses,2023-09-09,Orange,1870.0,7317.0,6475.47
0062x00000FWSCSAA5,0012x00000G2DqgAAF,The Ponds,NSW,Australia,Closed Lost,Existing Client-Granted Loan Before,9.2,81.34,1436.1899,4.0,0.0,4.0,5.0,4.0,5565.8589,0.0,44.0,422.0964,705.393,448.24,2.0,1.29,0.0,0.0,120.43,899.0,400.0,3250,3892.83,14.0,13.857,Weekly,25.0,6440.54,3250.0,Casual Employment,0.0,0.0,0.0,0.0,4227.1833,982.0,1647.46,278.06,MoneySpot,,7671899,0.0,01-01-2024,False,Vehicle Expenses,2023-12-29,Orange,615.0,6681.0,6440.54
0062x00000E7JMAAA3,0012x00000FEyJlAAL,Bentley,WA,Australia,Loan Paid,Existing Client-Granted Loan Before,0.0,43.24,1933.7376,2.0,0.0,0.0,4.0,2.0,7038.4105,1.0,38.0,1068.2135,2979.39,3264.29,3.0,0.0,0.0,0.0,5689.34,599.0,800.0,3200,3846.16,8.0,16.571,Fortnightly,43.0,7038.41,3200.0,Full-Time Employment,1.0,0.0,0.022,0.0,5958.78,1819.0,2860.43,489.53,MoneySpot,0.0,5811485,1.0,03-07-2023,False,Vehicle Expenses,2023-07-03,Green,0.0,6731.0,7038.41
0062x00000ENqEsAAL,0012x00000gmzpQAAQ,Traralgon,VIC,Australia,Loan Paid,Existing Client-Granted Loan Before,0.0,21.8,887.53,3.0,1.0,0.0,1.0,3.0,5462.0,1.0,10.0,0.0,5462.0,5285.0,0.0,8.44,0.0,0.0,6985.0,599.0,600.0,3500,4300.58,4.0,17.571,Monthly,41.0,5462.0,3500.0,Full-Time Employment,4.0,0.0,0.011,2.0,5462.0,1676.0,3038.01,1075.15,Financier-2,0.0,6208268,3.0,14-08-2023,False,Living Expenses,2023-08-14,Green,0.0,12499.0,5462.0
0062x00000ELQp6AAH,0012x000002ccurAAA,Kings Park,VIC,Australia,Closed Lost,Existing Client-No Loan Granted Ever,0.0,88.16,1070.2499,1.0,0.0,0.0,3.0,1.0,3470.1949,0.0,24.0,47.48,798.6207,798.51,0.0,0.0,0.0,0.0,4112.33,1500.0,1.0,3500,4086.46,10.0,9.857,Weekly,43.0,3470.19,3500.0,Full-Time Employment,0.0,0.0,0.0,0.0,3460.69,539.0,2336.98,408.65,MoneySpot,,6034352,0.0,28-07-2023,False,Vehicle Expenses,2023-07-27,Orange,0.0,4284.0,3470.19
0062x00000DFoWKAA1,0012x00000FEx28AAD,Dromedary,TAS,Australia,Loan Paid,Existing Client-Granted Loan Before,0.0,52.6,3927.8806,1.0,0.0,0.0,2.0,1.0,6221.672,1.0,33.0,0.0,1258.4676,1273.12,0.0,0.07,0.0,0.0,6500.0,899.0,1000.0,3500,4314.47,22.0,22.0,Weekly,42.0,5513.5,3500.0,Full-Time Employment,1.0,0.0,0.0,0.0,5453.36,2422.0,4237.6133,196.12,MoneySpot,0.0,4687656,0.0,15-02-2023,False,Life Event Expenses,2023-02-15,Orange,0.0,6867.0,5513.5
0062x00000EMmsbAAD,0010K00001oeqoKQAQ,Rooty Hill,NSW,Australia,Loan Paid,Existing Client-Granted Loan Before,0.0,44.76,3565.0319,1.0,0.0,0.0,4.0,1.0,9372.286,0.0,78.0,324.5024,1933.2338,2454.15,2.0,5.71,0.0,0.0,5416.67,1499.0,0.0,3250,4201.5,30.0,30.571,Weekly,58.0,9683.01,3250.0,Full-Time Employment,0.0,0.0,0.0,0.0,8377.3466,915.0,5926.1266,140.05,MoneySpot,0.0,6131026,0.0,07-08-2023,False,Home Maintenance & Repairs,2023-08-07,Orange,0.0,12935.0,9683.01
0062x00000EfAJbAAN,0012x000002aNJmAAM,Mooroolbark,VIC,Australia,Loan Paid,Existing Client-Granted Loan Before,0.0,93.46,928.7843,0.0,1.0,0.0,0.0,0.0,0.04,17.0,47.0,2107.4405,0.0,0.0,0.0,0.0,0.0,0.0,6283.33,400.0,400.0,3500,4577.06,36.0,35.857,Weekly,55.0,4925.7,4000.0,Full-Time Employment,17.0,0.0,0.2747,5.0,0.0,2797.0,2796.9766,127.15,Financier-2,0.0,6549129,17.0,16-09-2023,False,Furniture or Appliances,2023-09-16,Orange,0.0,5165.0,4925.7
0062x00000Ed3BAAAZ,0012x00000lGP8ZAAW,Melton West,VIC,Australia,Closed Lost,New Client-New Loan,13.74,85.6,0.0,4.0,0.0,0.0,3.0,4.0,1249.5496,0.0,0.0,0.0,25.5833,30.0,0.0,0.0,0.0,1.0,0.0,0.0,0.0,3500,4094.39,9.0,9.571,Weekly,25.0,1309.36,3500.0,,0.0,0.0,0.0,0.0,0.0,0.0,0.0,454.94,MoneySpot,,6393497,0.0,01-09-2023,False,Vehicle Expense,2023-09-01,Orange,234.0,1702.0,1309.36
0062x00000EwbGaAAJ,0012800001QDf5jAAD,Earlston,VIC,Australia,Loan Paid,Existing Client-Granted Loan Before,0.0,57.91,3775.0992,2.0,0.0,0.0,2.0,2.0,4549.842,0.0,18.0,0.0,1834.8866,1928.93,1.0,1.3,0.0,0.0,3683.33,1499.0,400.0,3150,4147.55,18.0,34.857,Fortnightly,61.0,5129.04,5000.0,Full-Time Employment,0.0,0.0,0.0769,0.0,4248.9733,1890.0,5213.6966,230.42,MoneySpot,0.0,6600590,0.0,21-09-2023,False,Home Maintenance & Repairs,2023-09-21,Green,0.0,4850.0,5129.04
0062x00000DHZFwAAP,0012x00000dzj2oAAA,Meridan Plains,QLD,Australia,Loan Paid,Existing Client-Granted Loan Before,0.0,97.33,3598.6531,0.0,0.0,0.0,0.0,0.0,0.0,7.0,47.0,1172.2486,0.0,0.0,0.0,50.93,1.0,0.0,0.0,899.0,285.0,3500,4281.52,20.0,20.143,Weekly,30.0,12539.58,5000.0,Full-Time Employment,8.0,0.0,0.1209,5.0,1271.6566,1320.0,4868.5533,214.08,MoneySpot,0.0,4784917,1.0,02-03-2023,False,Other Expenses,2023-03-02,Orange,0.0,3727.0,12539.58
0062x00000EcWUAAA3,0012x00000IPlLkAAL,Forestdale,QLD,Australia,Loan Paid,Existing Client-Granted Loan Before,45.37,97.08,951.1563,1.0,0.0,4.0,2.0,1.0,14906.1104,0.0,7.0,0.0,2080.8336,3434.81,3.0,0.0,0.0,0.0,0.0,400.0,550.0,3500,4609.09,18.0,36.143,Fortnightly,58.0,15150.23,3500.0,,20.0,0.0,0.033,6.0,15140.23,870.0,2241.0,256.07,MoneySpot,0.0,6361968,0.0,29-08-2023,False,Medical Expenses,2023-08-29,Orange,6394.0,14090.0,15150.23
0062x00000FjuMEAAZ,0012x00000g7cJNAAY,Warragul,VIC,Australia,Loan Paid,Existing Client-Granted Loan Before,0.0,35.53,4016.9758,3.0,0.0,0.0,2.0,3.0,6171.4333,0.0,39.0,521.7545,3847.0,4736.0,0.0,0.0,0.0,0.0,4346.18,599.0,100.0,3050,3776.3,4.0,16.714,Monthly,44.0,8652.61,3050.0,Full-Time Employment,0.0,0.0,0.0,0.0,3847.0,1052.0,5352.4866,944.08,MoneySpot,0.0,8097724,0.0,2024-02-03,False,Life Event Expenses,2024-02-03,Orange,0.0,11070.0,8652.61
0062x00000FjyomAAB,0012x00000INVMWAA5,Maidstone,VIC,Australia,Loan Paid,Existing Client-Granted Loan Before,0.0,29.79,1736.7183,2.0,0.0,0.0,3.0,2.0,15288.5397,0.0,6.0,0.0,2098.9457,1869.99,0.0,0.43,0.0,0.0,3297.48,599.0,500.0,3500,4167.82,7.0,13.571,Fortnightly,30.0,14576.87,5000.0,Full-Time Employment,0.0,0.0,0.0,0.0,4897.54,0.0,3690.59,595.41,MoneySpot,0.0,8103076,0.0,2024-02-06,False,Home Maintenance & Repairs,2024-02-06,Orange,0.0,25091.0,14576.87
0062x00000ELkz6AAD,0012x00000gq2PvAAI,Victoria Point,QLD,Australia,Loan Paid,Existing Client-Granted Loan Before,0.29,48.67,3267.9453,1.0,0.0,4.0,3.0,1.0,10026.7579,0.0,76.0,495.99,1208.1246,1213.27,0.0,2.78,0.0,0.0,0.0,899.0,680.0,3500,4217.85,16.0,16.429,Weekly,28.0,10326.76,3500.0,Full-Time Employment,0.0,0.0,0.0,0.0,5277.24,3963.0,5586.9433,263.62,MoneySpot,0.0,6059554,0.0,31-07-2023,False,Other Expenses,2023-07-31,Green,60.0,20685.0,10326.76
0062x00000GBk8SAAT,0012x00000Wt22wAAB,Marayong,NSW,Australia,Closed Lost,Existing Client-Granted Loan Before,0.0,94.9,883.4944,1.0,0.0,0.0,3.0,1.0,6600.7397,0.0,15.0,0.0,1153.4615,1341.0,0.0,13.11,0.0,0.0,3640.0,599.0,0.0,3200,3883.54,16.0,16.143,Weekly,34.0,11578.41,3200.0,Full-Time Employment,0.0,0.0,0.0,0.0,4998.3333,631.0,695.4566,242.73,MoneySpot,,8709029,0.0,2024-04-03,False,Home Maintenance & Repairs,2024-04-03,Orange,0.0,11285.0,11578.41
0062x00000F2uXkAAJ,0012x00000g9hqWAAQ,Blacktown,NSW,Australia,Loan Paid,Existing Client-Granted Loan Before,0.37,58.15,1878.1066,3.0,0.0,0.0,5.0,3.0,7839.33,0.0,19.0,0.0,7339.33,7085.33,1.0,0.16,0.0,0.0,0.0,899.0,2000.0,3500,4294.65,4.0,17.429,Monthly,30.0,8306.0,3500.0,,0.0,0.0,0.0549,0.0,7339.33,1103.0,2726.2066,1073.67,MoneySpot,0.0,7006040,0.0,01-11-2023,False,Medical Expenses,2023-10-31,Green,38.0,10227.0,8306.0
0062x00000E4qLVAAZ,0012x00000RqMdNAAV,Thornlie,WA,Australia,Loan Paid,Existing Client-Granted Loan Before,0.0,33.63,1437.9581,2.0,1.0,0.0,1.0,2.0,2971.6779,3.0,26.0,0.0,1367.7871,1415.61,1.0,0.29,0.0,0.0,10209.53,599.0,400.0,3500,4215.81,8.0,15.857,Fortnightly,57.0,5165.37,3500.0,Full-Time Employment,3.0,0.0,0.5055,2.0,5291.5033,2060.0,2523.33,526.98,QuickCash,0.0,5603255,1.0,14-06-2023,False,Child Expenses,2023-06-14,Green,0.0,3425.0,5165.37
0062x00000DYmRQAA1,0012x00000LPcw9AAD,Wyong,NSW,Australia,Closed Lost,Existing Client-Granted Loan Before,0.0,58.46,688.2835,1.0,0.0,0.0,4.0,1.0,4902.0393,0.0,10.0,0.0,656.6681,186.95,0.0,0.0,0.0,0.0,1839.48,899.0,1740.0,3500,4097.61,10.0,10.143,Weekly,44.0,4958.71,3500.0,Casual Employment,0.0,0.0,0.0769,0.0,2951.7833,528.0,545.4166,409.77,MoneySpot,,5052869,0.0,13-04-2023,False,Medical Expenses,2023-04-13,Orange,0.0,5046.0,4958.71
0062x00000EeNB5AAN,0012x00000VdzL6AAJ,Cairnlea,VIC,Australia,Closed Lost,Existing Client-Granted Loan Before,0.0,68.67,3618.9377,2.0,0.0,0.0,4.0,2.0,6952.9983,4.0,31.0,307.078,1668.965,1914.38,0.0,0.22,0.0,0.0,4680.01,599.0,650.0,3500,4168.15,7.0,13.571,Fortnightly,26.0,6953.0,3500.0,Part-Time Employment,4.0,0.0,0.044,2.0,4561.01,1029.0,3593.3533,595.46,MoneySpot,,6484054,2.0,11-09-2023,False,Home Maintenance & Repairs,2023-09-11,Orange,0.0,16311.0,6953.0
0062x00000Ez6aiAAB,0010K00001oAno2QAC,Tiwi,NT,Australia,Loan Paid,Existing Client-Granted Loan Before,0.0,87.25,0.0,2.0,0.0,0.0,4.0,2.0,5665.8493,0.0,7.0,0.0,2607.8433,2541.86,0.0,0.0,0.0,0.0,2036.67,400.0,0.0,3500,4432.5,13.0,26.571,Fortnightly,25.0,6519.52,4100.0,Part-Time Employment,0.0,0.0,0.0,0.0,5215.6866,0.0,458.4933,340.97,MoneySpot,-0.44,6784205,0.0,09-10-2023,False,Life Event Expenses,2023-10-09,Green,0.0,6166.0,6519.52
0062x00000EC9LqAAL,0012x00000XMRPgAAP,Hillsdale,NSW,Australia,Loan Paid,Existing Client-Granted Loan Before,0.22,17.28,720.295,2.0,0.0,0.0,2.0,2.0,8087.0447,0.0,14.0,0.0,3544.7933,3703.38,1.0,1.22,0.0,0.0,2900.0,400.0,100.0,3100,3744.41,8.0,14.714,Fortnightly,48.0,7728.86,3100.0,Full-Time Employment,0.0,0.0,0.0,0.0,7089.5866,1528.0,3047.15,468.06,MoneySpot,0.0,5856541,0.0,07-07-2023,False,Vehicle Expenses,2023-07-07,Green,17.0,7628.0,7728.86
0062x00000FKF1AAAX,0012x000004UfhEAAS,Bilambil Heights,NSW,Australia,Closed Lost,Existing Client-Granted Loan Before,47.24,77.67,3250.7073,2.0,0.0,1.0,3.0,2.0,5840.688,2.0,39.0,0.0,1340.07,1369.04,1.0,0.0,0.0,0.0,3683.33,599.0,500.0,3500,4397.75,13.0,25.714,Fortnightly,34.0,6143.83,3500.0,Full-Time Employment,2.0,0.0,0.0,2.0,6303.17,624.0,3304.6933,338.29,MoneySpot,,7378187,0.0,06-12-2023,False,Veterinary Expenses,2023-12-01,Green,3176.0,6722.0,6143.83
0062x00000D1dODAAZ,0012x00000WUuPQAA1,Blacktown,NSW,Australia,Closed Lost,Existing Client-Granted Loan Before,0.0,43.18,412.7652,2.0,0.0,0.0,3.0,2.0,2781.8118,1.0,12.0,768.0,1151.7516,1259.88,0.0,0.0,0.0,0.0,3900.0,599.0,280.0,3500,4084.33,4.0,8.286,Fortnightly,24.0,2897.16,3500.0,Part-Time Employment,1.0,0.0,0.0,1.0,2303.5033,78.0,777.2966,1021.09,QuickCash,,4401460,0.0,03-01-2023,False,Medical Expenses,2023-01-03,Orange,0.0,3511.0,2897.16
0062x00000E5t1TAAR,0012x00000RqVtYAAV,Glenvale,QLD,Australia,Loan Paid,Existing Client-Granted Loan Before,1.46,84.45,5715.9588,4.0,0.0,0.0,4.0,4.0,3038.4804,1.0,1.0,929.398,172.3043,788.0,0.0,0.93,0.0,1.0,4593.33,599.0,200.0,3350,4106.79,20.0,19.857,Weekly,42.0,8859.47,3350.0,Full-Time Employment,1.0,0.0,0.0549,0.0,5425.31,2227.0,7716.4466,205.34,MoneySpot,0.0,5688864,0.0,22-06-2023,False,Life Event Expenses,2023-06-22,Orange,156.0,10669.0,8859.47
0062x00000Ews2LAAR,0010K0000260QTfQAM,Jurien Bay,WA,Australia,Loan Paid,Existing Client-Granted Loan Before,0.0,29.09,2735.75,3.0,0.0,0.0,4.0,3.0,9291.7766,8.0,21.0,3506.1814,9291.7766,9377.33,1.0,22.14,0.0,0.0,7800.0,899.0,500.0,3500,4418.27,6.0,25.0,Monthly,50.0,9291.78,3500.0,Full-Time Employment,8.0,0.0,0.0,0.0,9291.7766,4805.0,7944.29,736.39,MoneySpot,0.0,6621731,0.0,23-09-2023,False,Vehicle Expenses,2023-09-23,Orange,0.0,10260.0,9291.78
0062x00000DXGwUAAX,0012x00000KKm7IAAT,Nyah,VIC,Australia,Loan Paid,Existing Client-Granted Loan Before,0.0,92.87,2431.2369,1.0,0.0,0.0,1.0,1.0,17683.6424,0.0,19.0,0.0,662.5,650.0,0.0,0.0,0.0,1.0,3590.11,599.0,780.0,3350,4065.23,18.0,17.714,Weekly,37.0,13015.47,3500.0,Full-Time Employment,0.0,0.0,0.0,0.0,0.0,915.0,2352.3066,225.85,MoneySpot,0.33,4963666,0.0,30-03-2023,False,Other Expenses,2023-03-30,Green,0.0,44022.0,13015.47
0062x00000EwL82AAF,0012x00000IN2g3AAD,Adelaide,SA,Australia,Loan Paid,Existing Client-Granted Loan Before,0.11,53.51,1353.1364,2.0,0.0,0.0,4.0,2.0,8375.632,0.0,56.0,0.0,2467.2066,2488.46,0.0,0.37,0.0,0.0,2751.72,899.0,730.0,3500,4350.67,11.0,22.429,Fortnightly,39.0,8375.63,3500.0,Full-Time Employment,0.0,0.0,0.0,0.0,4934.4133,1124.0,4176.54,395.52,MoneySpot,0.0,6580795,0.0,20-09-2023,False,Child Expenses,2023-09-19,Green,11.0,9551.0,8375.63
0062x00000FISfnAAH,0012x00000iJ1h8AAC,Ripley,QLD,Australia,Closed Lost,Existing Client-Granted Loan Before,0.0,67.99,1642.4333,3.0,1.0,0.0,2.0,3.0,7682.6433,5.0,20.0,96.0,6856.1433,4696.08,0.0,0.0,0.0,0.0,0.0,899.0,880.0,3500,4434.71,6.0,25.429,Monthly,26.0,7682.64,5000.0,Full-Time Employment,5.0,0.0,0.0,0.0,6856.1433,595.0,2695.8233,739.13,MoneySpot,,7251639,3.0,19-11-2023,False,Living Expenses,2023-11-19,Green,0.0,8516.0,7682.64
0062x00000D1pg4AAB,0010K00001ezIKJQA2,Shell Cove,NSW,Australia,Loan Paid,Existing Client-Granted Loan Before,0.0,82.24,5234.0609,2.0,0.0,0.0,2.0,2.0,7160.6383,0.0,41.0,922.0711,3186.696,3269.0,1.0,3.48,0.0,0.0,6374.33,599.0,0.0,3500,4215.65,8.0,15.857,Fortnightly,42.0,7160.64,3500.0,Full-Time Employment,0.0,0.0,0.0989,0.0,5311.16,918.0,5252.2,526.96,MoneySpot,0.0,4413570,0.0,05-01-2023,False,Medical Expenses,2023-01-04,Orange,0.0,8848.0,7160.64
0062x00000ENJV0AAP,0012800001HkJJTAA3,Blacktown,NSW,Australia,Loan Paid,Existing Client-Granted Loan Before,0.0,75.41,2573.1738,1.0,0.0,0.0,3.0,1.0,4892.0128,0.0,77.0,799.7981,1125.8333,1175.0,1.0,0.0,0.0,0.0,3726.67,400.0,300.0,3500,4295.25,21.0,21.0,Weekly,53.0,10830.53,3500.0,Full-Time Employment,0.0,0.0,0.2418,0.0,2251.6666,2603.0,6857.0066,204.54,MoneySpot,0.0,6164901,0.0,10-08-2023,False,Vehicle Expenses,2023-08-10,Green,0.0,5677.0,10830.53
0062x00000DVfecAAD,0012x00000KMJLHAA5,Eagleby,QLD,Australia,Loan Paid,Existing Client-Granted Loan Before,0.0,88.27,716.9634,1.0,0.0,0.0,3.0,1.0,5161.7201,5.0,80.0,1804.9339,978.632,1290.68,0.0,0.0,1.0,0.0,0.0,2000.0,800.0,3150,3960.71,24.0,24.0,Weekly,36.0,5943.86,9600.0,,5.0,0.0,0.0549,1.0,3262.1066,2718.0,3939.8366,165.04,MoneySpot,0.03,5465564,5.0,01-06-2023,False,Living Expenses,2023-06-01,Green,0.0,5409.0,5943.86
0062x00000DtasqAAB,0010K000028frbdQAA,Blacktown,NSW,Australia,Loan Paid,Existing Client-Granted Loan Before,0.0,39.93,5520.3459,1.0,0.0,0.0,4.0,1.0,16510.9635,2.0,115.0,4040.4056,3799.784,3110.36,0.0,0.0,0.0,0.0,13000.0,599.0,300.0,3200,3879.0,16.0,16.0,Weekly,70.0,19629.3,3200.0,Full-Time Employment,2.0,0.0,0.011,0.0,12665.9466,5526.0,5525.64,242.44,Financier-2,0.0,5325876,0.0,19-05-2023,False,Vehicle Expenses,2023-05-19,Green,0.0,16018.0,19629.3
0062x00000F3mMkAAJ,0012x00000RrIDtAAN,Margate,QLD,Australia,Closed Lost,Existing Client-Granted Loan Before,0.0,56.78,3139.7681,1.0,0.0,0.0,5.0,1.0,5658.8261,0.0,64.0,0.0,1302.3053,1197.54,2.0,0.0,0.0,0.0,0.0,2000.0,1400.0,3500,4196.5,16.0,15.857,Weekly,46.0,5663.83,3500.0,,16.0,0.0,0.3407,8.0,5643.3233,113.0,2267.6166,262.29,MoneySpot,,7077819,0.0,06-11-2023,False,Living Expenses,2023-11-05,Green,0.0,6426.0,5663.83
0062x00000FWUb2AAH,0012x00000ha67QAAQ,Redcliffe,QLD,Australia,Loan Paid,Existing Client-Granted Loan Before,0.0,22.56,3556.8004,1.0,0.0,0.0,2.0,1.0,170051.7949,0.0,32.0,0.0,6918.9383,6039.94,2.0,0.04,0.0,0.0,7150.0,400.0,450.0,3150,3802.71,8.0,14.857,Fortnightly,57.0,219769.04,3150.0,Full-Time Employment,0.0,0.0,0.0,0.0,169291.5633,849.0,3685.3566,475.34,MoneySpot,0.0,7674175,0.0,29-12-2023,False,Veterinary Expenses,2023-12-29,Orange,0.0,210241.0,219769.04
0062x00000FTfGlAAL,0012x00000WXbSAAA1,Woody Point,QLD,Australia,Loan Paid,Existing Client-Granted Loan Before,0.0,71.09,996.231,4.0,0.0,0.0,1.0,4.0,11429.7601,0.0,13.0,0.0,2797.8571,5000.0,0.0,0.01,0.0,1.0,5464.37,599.0,400.0,3500,4191.26,16.0,15.714,Weekly,30.0,17396.43,3500.0,Full-Time Employment,0.0,0.0,0.5055,0.0,4888.0,994.0,993.5033,261.96,MoneySpot,0.0,7448942,0.0,09-12-2023,False,Relocation Expenses,2023-12-09,Green,0.0,68758.0,17396.43
0062x00000D7RYfAAN,0012x00000WWdpDAAT,Footscray,VIC,Australia,Loan Paid,Existing Client-Granted Loan Before,0.0,81.22,3167.7512,4.0,0.0,0.0,1.0,4.0,29928.1364,0.0,19.0,577.6994,6300.0,5400.0,0.0,0.0,0.0,1.0,0.0,400.0,567.0,3500,4213.31,16.0,16.286,Weekly,40.0,41158.95,3500.0,,0.0,0.0,0.0,0.0,0.0,1670.0,2552.5833,263.34,MoneySpot,0.0,4484107,0.0,16-01-2023,False,Other Expenses,2023-01-16,Orange,0.0,67556.0,41158.95
0062x00000DZXz1AAH,0010K00001yn8KmQAI,Rosenthal Heights,QLD,Australia,Loan Paid,Existing Client-Granted Loan Before,0.0,48.53,1877.5044,1.0,1.0,0.0,2.0,1.0,6904.6971,5.0,34.0,809.9524,1494.2869,1557.73,2.0,0.0,0.0,0.0,5611.67,400.0,480.0,3500,4196.84,16.0,15.857,Weekly,49.0,6918.03,3500.0,Full-Time Employment,5.0,0.0,0.0,0.0,6475.2433,1285.0,2465.3,262.31,MoneySpot,0.0,5099548,5.0,20-04-2023,False,Other Expenses,2023-04-20,Green,0.0,7035.0,6918.03
0062x00000Da6hDAAR,0010K000029GPkVQAW,Jindera,NSW,Australia,Loan Paid,Existing Client-Granted Loan Before,0.0,82.91,999.1903,1.0,0.0,0.0,1.0,1.0,4592.0027,0.0,21.0,610.0119,866.3012,866.3,1.0,1.43,0.0,1.0,3939.0,1499.0,600.0,3400,4351.74,30.0,30.0,Weekly,29.0,9042.95,3500.0,Full-Time Employment,0.0,0.0,0.0,0.0,0.0,541.0,757.23,,QuickCash,0.0,5135121,0.0,25-04-2023,False,Vehicle Expenses,2023-04-25,Green,0.0,5737.0,9042.95
0062x00000DYfXeAAL,0012x00000VeAZnAAN,Singleton,NSW,Australia,Loan Paid,Existing Client-Granted Loan Before,0.0,79.18,3305.6227,2.0,1.0,0.0,3.0,2.0,5684.5806,9.0,33.0,0.0,2479.9166,2269.75,0.0,1.57,0.0,0.0,6204.67,899.0,1440.0,3100,3893.15,12.0,23.143,Fortnightly,34.0,6019.91,3200.0,Full-Time Employment,9.0,0.0,0.2857,3.0,4959.8333,440.0,4411.7866,324.43,QuickCash,-0.06,5046047,6.0,12-04-2023,False,Medical Expenses,2023-04-12,Green,0.0,7442.0,6019.91
0062x00000F2BpnAAF,0012x00000MkC1CAAV,South Gladstone,QLD,Australia,Loan Paid,Existing Client-Granted Loan Before,0.06,47.82,2674.429,2.0,0.0,0.0,3.0,2.0,5587.128,0.0,28.0,946.4472,2571.61,2587.46,0.0,3.93,0.0,0.0,3144.62,599.0,240.0,3250,4308.32,18.0,36.0,Fortnightly,56.0,5587.13,3250.0,Full-Time Employment,0.0,0.0,0.0,0.0,6000.4233,2379.0,2665.7566,239.36,MoneySpot,0.0,6951122,0.0,26-10-2023,False,Vehicle Expenses,2023-10-25,Orange,6.0,8668.0,5587.13
0062x00000ENOhBAAX,0010K00001cPk5UQAS,Cobdogla,SA,Australia,Loan Paid,Existing Client-Granted Loan Before,0.43,84.38,3596.6378,2.0,0.0,0.0,5.0,2.0,9122.041,0.0,51.0,0.0,3204.9066,4408.61,1.0,0.99,0.0,0.0,3683.33,400.0,920.0,3500,4568.19,18.0,35.143,Fortnightly,55.0,9167.76,3500.0,Full-Time Employment,0.0,0.0,0.0,0.0,6409.8133,2832.0,4175.9866,253.79,MoneySpot,0.0,6170369,0.0,11-08-2023,False,Travel Expenses,2023-08-10,Orange,41.0,9486.0,9167.76
0062x00000EOMtJAAX,0012x00000OxWAoAAN,Dawesville,WA,Australia,Loan Paid,Existing Client-Granted Loan Before,0.05,39.57,2634.0112,3.0,1.0,0.0,5.0,3.0,17726.54,8.0,15.0,0.0,11026.54,11026.54,0.0,49.87,0.0,0.0,8860.8,1499.0,2000.0,3500,4389.27,5.0,22.143,Monthly,36.0,23188.21,5000.0,Full-Time Employment,16.0,0.0,0.0,5.0,11026.54,1070.0,4736.15,877.86,MoneySpot,0.0,6253132,9.0,18-08-2023,False,Home Maintenance & Repairs,2023-08-18,Orange,13.0,24785.0,23188.21
0062x00000E4qufAAB,0012x00000iIj6xAAC,Lyneham,ACT,Australia,Closed Lost,New Client-New Loan,0.0,75.25,309.8943,2.0,0.0,0.0,5.0,2.0,4791.4878,0.0,3.0,0.0,1410.065,471.59,0.0,0.0,0.0,1.0,5200.0,1500.0,1000.0,3100,3670.35,5.0,9.429,Fortnightly,27.0,4788.41,3100.0,Full-Time Employment,0.0,0.0,0.0,0.0,35.6966,0.0,248.3333,734.08,MoneySpot,,5603684,0.0,18-06-2023,False,Living Expenses,2023-06-14,Orange,0.0,5721.0,4788.41
0062x00000DrnzTAAR,0012x00000NxKdaAAF,Blacktown,NSW,Australia,Closed Lost,Existing Client-Granted Loan Before,0.0,57.15,1756.6871,1.0,0.0,0.0,4.0,1.0,6572.2728,3.0,16.0,1439.1261,1493.3453,1388.0,0.0,0.0,0.0,0.0,0.0,599.0,2130.0,3500,4207.17,16.0,16.143,Weekly,30.0,6574.77,3500.0,Full-Time Employment,3.0,0.0,0.0,0.0,6471.1633,1400.0,1851.53,262.95,MoneySpot,,5194797,0.0,04-05-2023,False,Living Expenses,2023-05-04,Green,0.0,9065.0,6574.77
0062x00000DHYChAAP,0012x00000ADZt4AAH,Inverell,NSW,Australia,Loan Paid,Existing Client-Granted Loan Before,0.0,47.64,2109.779,4.0,0.0,0.0,4.0,4.0,5927.2335,0.0,47.0,1541.2065,1892.24,1874.1,1.0,0.0,0.0,0.0,3250.0,899.0,600.0,3500,4263.32,9.0,18.143,Fortnightly,59.0,6013.17,3500.0,Full-Time Employment,0.0,0.0,0.0,0.0,4073.8466,1518.0,2128.1466,473.71,MoneySpot,0.03,4784240,0.0,05-03-2023,False,Life Event Expenses,2023-03-05,Orange,0.0,7154.0,6013.17
0062x00000EMh2BAAT,0012x00000g7xJrAAI,Regents Park,QLD,Australia,Loan Paid,Existing Client-Granted Loan Before,0.0,60.76,3808.1135,1.0,0.0,0.0,4.0,1.0,4086.6342,4.0,113.0,1395.8736,940.4861,952.34,3.0,0.0,0.0,0.0,0.0,400.0,75.0,3100,4101.89,36.0,35.714,Weekly,34.0,4669.2,5000.0,Full-Time Employment,4.0,0.0,0.1209,0.0,4075.44,1869.0,3950.46,113.95,MoneySpot,0.0,6122761,3.0,06-08-2023,False,Vehicle Expenses,2023-08-05,Green,0.0,5835.0,4669.2
0062x00000EyyE3AAJ,0010K00002BSLgyQAH,Chatswood,NSW,Australia,Loan Paid,Existing Client-Granted Loan Before,0.0,70.29,2870.9179,1.0,0.0,0.0,3.0,1.0,6935.8632,0.0,56.0,377.4274,1183.6561,1419.54,0.0,0.52,0.0,0.0,5200.0,599.0,2610.0,3100,3959.82,26.0,26.571,Weekly,54.0,6918.4,3100.0,Full-Time Employment,0.0,0.0,0.022,0.0,5129.1766,1324.0,3883.1033,152.31,Financier-2,0.0,6775961,0.0,08-10-2023,False,Life Event Expenses,2023-10-08,Orange,0.0,9165.0,6918.4
0062x00000E5RzmAAF,0012800001SDUChAAP,Blacktown,NSW,Australia,Loan Paid,Existing Client-Granted Loan Before,0.0,6.77,740.16,3.0,0.0,0.0,3.0,3.0,10184.0066,0.0,21.0,9.6,10184.0066,10184.0,0.0,9.7,0.0,0.0,0.0,1499.0,3600.0,3500,4271.42,4.0,16.857,Monthly,42.0,10186.5,3500.0,,0.0,0.0,0.0659,0.0,10184.0066,0.0,740.16,1067.86,QuickCash,0.0,5654343,0.0,19-06-2023,False,Travel Expenses,2023-06-19,Green,0.0,13509.0,10186.5
0062x00000FKy9QAAT,0010K0000280xtKQAQ,Upper Ferntree Gully,VIC,Australia,Loan Paid,Existing Client-Granted Loan Before,0.0,39.94,1575.7567,1.0,0.0,0.0,4.0,1.0,5648.536,0.0,14.0,0.0,1292.65,1020.2,0.0,0.0,0.0,0.0,4095.0,1499.0,1000.0,3500,4207.38,16.0,16.143,Weekly,41.0,5648.54,3500.0,Full-Time Employment,0.0,0.0,0.0,0.0,5601.4833,1571.0,1673.58,262.97,QuickCash,0.0,7427425,0.0,07-12-2023,False,Other Expenses,2023-12-07,Green,0.0,5633.0,5648.54
0062x00000DVXSEAA5,0012x00000dy6rwAAA,Bundoora,VIC,Australia,Loan Paid,Existing Client-Granted Loan Before,0.25,68.35,4865.2512,2.0,0.0,0.0,4.0,2.0,6320.5446,1.0,74.0,179.2,2191.0014,2265.57,1.0,0.0,0.0,0.0,4264.0,400.0,950.0,3100,3897.48,12.0,12.286,Weekly,39.0,6325.88,4000.0,Full-Time Employment,1.0,0.0,0.011,1.0,5112.3366,1963.0,6040.47,324.8,MoneySpot,0.0,5453903,0.0,01-06-2023,False,Home Maintenance & Repairs,2023-05-31,Green,17.0,6690.0,6325.88
0062x00000DZ1ydAAD,0012x00000LP2zCAAT,Oakford,WA,Australia,Loan Paid,Existing Client-Granted Loan Before,0.0,81.44,5763.3007,1.0,0.0,0.0,4.0,1.0,9133.3653,4.0,104.0,1147.5192,960.04,960.04,0.0,1.01,0.0,0.0,2376.12,400.0,100.0,3500,4196.83,16.0,15.857,Weekly,50.0,9133.37,3500.0,Part-Time Employment,4.0,0.0,0.0879,0.0,6465.94,3018.0,6311.0366,262.31,MoneySpot,0.0,5067534,3.0,15-04-2023,False,Home Maintenance & Repairs,2023-04-15,Green,0.0,9582.0,9133.37
0062x00000EzXW7AAN,0012x00000XL8L4AAL,Parkes,NSW,Australia,Loan Paid,Existing Client-Granted Loan Before,0.0,79.36,2469.6768,2.0,0.0,0.0,3.0,2.0,3794.7488,0.0,53.0,683.1837,1616.2142,1701.0,1.0,0.0,0.0,0.0,4102.33,599.0,200.0,3100,3855.4,10.0,20.0,Fortnightly,64.0,3794.75,3100.0,Full-Time Employment,0.0,0.0,0.0,0.0,3771.1666,1533.0,2686.8933,385.55,MoneySpot,0.01,6815852,0.0,12-10-2023,False,Medical Expenses,2023-10-12,Green,0.0,5011.0,3794.75
0062x00000FVY9gAAH,0010K000023R2h3QAC,Saint Marys,NSW,Australia,Loan Paid,Existing Client-Granted Loan Before,0.0,48.98,1073.3333,1.0,0.0,0.0,5.0,1.0,10787.3289,0.0,3.0,500.5714,2196.81,2034.6,0.0,0.0,0.0,0.0,14300.0,899.0,600.0,3500,4207.67,16.0,16.143,Weekly,47.0,9771.17,3500.0,Full-Time Employment,0.0,0.0,0.011,0.0,2196.81,617.0,2321.6266,262.98,MoneySpot,0.0,7602462,0.0,22-12-2023,False,Relocation Expenses,2023-12-22,Orange,0.0,12056.0,9771.17
0062x00000DIIKWAA5,0012x00000IMPUzAAP,Sunshine West,VIC,Australia,Loan Paid,Existing Client-Granted Loan Before,0.0,74.06,2151.3289,1.0,0.0,0.0,3.0,1.0,4424.8074,0.0,44.0,1578.9802,909.9584,845.4,1.0,0.46,0.0,0.0,2317.01,400.0,250.0,3200,4017.06,24.0,47.0,Fortnightly,29.0,4502.86,5000.0,Full-Time Employment,0.0,0.0,0.011,0.0,3943.1533,2163.0,3462.3766,167.38,MoneySpot,0.0,4825779,0.0,10-03-2023,False,Life Event Expenses,2023-03-10,Green,0.0,4815.0,4502.86
0062x00000D7l2fAAB,0012x00000WY7ddAAD,Kogarah,NSW,Australia,Loan Paid,Existing Client-Granted Loan Before,3.74,79.95,5414.1448,2.0,0.0,0.0,3.0,2.0,4756.3179,0.0,24.0,337.92,1659.52,1758.03,0.0,0.54,0.0,0.0,2023.64,599.0,400.0,3500,4227.1,8.0,16.143,Fortnightly,27.0,4227.32,3500.0,Full-Time Employment,0.0,0.0,0.0,0.0,3872.2133,4189.0,6366.32,528.39,MoneySpot,0.0,4498611,0.0,18-01-2023,False,Other Expenses,2023-01-17,Green,250.0,6671.0,4227.32
0062x00000FWb4jAAD,0012x00000gADseAAG,Quakers Hill,NSW,Australia,Closed Lost,Existing Client-Granted Loan Before,0.0,94.79,247.0299,3.0,0.0,0.0,3.0,3.0,26.0,2.0,55.0,0.0,26.0,40.0,1.0,2.52,0.0,1.0,0.0,1500.0,860.0,3500,4235.27,14.0,15.857,Weekly,24.0,4160.6,3500.0,,2.0,0.0,0.5714,0.0,0.0,692.0,1185.6666,302.53,MoneySpot,,7684362,2.0,03-01-2024,False,Travel Expenses,2023-12-30,Orange,0.0,4875.0,4160.6
0062x00000E7BiXAAV,0012x00000IOP2vAAH,Hampton Park,VIC,Australia,Loan Paid,Existing Client-Granted Loan Before,22.82,85.04,1396.8035,2.0,0.0,4.0,3.0,2.0,6164.0928,1.0,37.0,0.0,1921.59,2162.06,0.0,0.64,0.0,0.0,0.0,400.0,1000.0,3200,3880.91,8.0,15.571,Fortnightly,37.0,8197.93,3200.0,,1.0,0.0,0.1978,0.0,5811.7766,1109.0,1808.8566,485.12,MoneySpot,0.0,5802237,1.0,02-07-2023,False,Living Expenses,2023-07-02,Green,2201.0,9643.0,8197.93
0062x00000DtF7FAAV,0012x00000KMuLMAA1,Manly Vale,NSW,Australia,Loan Paid,Existing Client-Granted Loan Before,0.0,20.12,4019.253,3.0,0.0,0.0,5.0,3.0,17586.9233,0.0,50.0,1562.1215,17586.9233,11793.05,1.0,0.52,0.0,0.0,10900.0,1499.0,3600.0,3450,4230.32,4.0,17.286,Monthly,50.0,17592.75,3500.0,Full-Time Employment,0.0,0.0,0.0,0.0,17586.9233,2985.0,10244.2666,1057.58,MoneySpot,0.0,5298653,0.0,17-05-2023,False,Travel Expenses,2023-05-17,Green,0.0,28485.0,17592.75
0062x00000DYGe5AAH,0012x00000IMvZkAAL,Berrinba,QLD,Australia,Loan Paid,Existing Client-Granted Loan Before,0.0,53.28,1777.1544,1.0,0.0,0.0,2.0,1.0,5975.4089,1.0,39.0,1894.8649,1375.163,1450.79,0.0,0.25,0.0,0.0,4983.33,899.0,800.0,3500,4185.87,16.0,16.571,Weekly,64.0,6708.74,3500.0,Full-Time Employment,1.0,0.0,0.0,0.0,5959.04,1677.0,1676.81,263.99,MoneySpot,0.0,5022445,1.0,08-04-2023,False,Other Expenses,2023-04-08,Green,0.0,7951.0,6708.74
0062x00000DWCwmAAH,0012x00000NxpfbAAB,Shoal Point,QLD,Australia,Loan Paid,Existing Client-Granted Loan Before,0.32,57.1,3275.1166,3.0,1.0,0.0,2.0,3.0,8475.1699,7.0,27.0,1115.2778,8153.5033,8285.04,1.0,0.0,0.0,0.0,8662.32,899.0,1950.0,3500,4261.9,4.0,16.571,Monthly,51.0,8153.5,3500.0,Full-Time Employment,7.0,0.0,0.7033,2.0,8153.5033,2220.0,3948.9633,1065.48,MoneySpot,0.0,4902173,3.0,21-03-2023,False,Vehicle Expenses,2023-03-20,Green,31.0,9422.0,8153.5
0062x00000DXm38AAD,0012x00000FFpQgAAL,Kangaroo Point,QLD,Australia,Loan Paid,Existing Client-Granted Loan Before,0.47,32.39,5444.7271,2.0,0.0,0.0,3.0,2.0,8573.9777,0.0,20.0,0.0,3401.0,3401.0,1.0,1.25,0.0,1.0,6008.76,1500.0,800.0,3300,4050.27,9.0,18.286,Fortnightly,56.0,8961.48,3500.0,Full-Time Employment,0.0,0.0,0.0,0.0,0.0,592.0,5943.2433,450.04,MoneySpot,0.0,4994818,0.0,04-04-2023,False,Child Expenses,2023-04-04,Green,46.0,9766.0,8961.48
0062x00000FTOcJAAX,0012x00000lga0gAAA,Monkland,QLD,Australia,Closed Lost,Existing Client-No Loan Granted Ever,0.0,83.46,1342.7064,1.0,1.0,0.0,5.0,1.0,3332.1458,18.0,53.0,507.2435,876.4,1021.0,1.0,0.0,1.0,0.0,0.0,2000.0,195.0,3500,4081.1,10.0,9.714,Weekly,20.0,3573.81,3500.0,Part-Time Employment,18.0,0.0,0.7033,8.0,2921.3333,781.0,1927.9633,408.11,MoneySpot,,9031960,12.0,2024-05-02,False,Vehicle Expenses,2024-04-29,Orange,0.0,3741.0,3573.81
0062x00000E5CzeAAF,0012x00000TrZn8AAF,Mermaid Waters,QLD,Australia,Loan Paid,Existing Client-Granted Loan Before,0.0,58.86,799.8066,1.0,0.0,0.0,3.0,1.0,4653.6423,0.0,37.0,935.6704,966.5384,1015.0,0.0,1.03,0.0,1.0,3813.33,400.0,100.0,3500,4384.31,26.0,25.857,Weekly,23.0,4653.64,4500.0,Full-Time Employment,0.0,0.0,0.6154,0.0,0.0,1515.0,1514.99,168.63,MoneySpot,0.0,5630623,0.0,16-06-2023,False,Home Maintenance & Repairs,2023-06-16,Orange,0.0,4642.0,4653.64
0062x00000EcFu0AAF,0012x00000lFUl7AAG,Shepparton,VIC,Australia,Closed Lost,Existing Client-No Loan Granted Ever,0.0,92.31,0.0,1.0,0.0,0.0,5.0,1.0,4245.3214,0.0,3.0,0.0,732.5233,736.34,0.0,31.01,0.0,1.0,3250.0,599.0,960.0,3500,4081.29,10.0,9.714,Weekly,34.0,3822.38,3500.0,Casual Employment,0.0,0.0,0.0,0.0,0.0,0.0,0.0,408.13,MoneySpot,,6345465,0.0,27-08-2023,False,Travel Expenses,2023-08-27,Orange,0.0,11366.0,3822.38
0062x00000DWtMDAA1,0012x00000XCZJhAAP,Hassall Grove,NSW,Australia,Loan Paid,Existing Client-Granted Loan Before,0.0,84.46,3131.915,1.0,0.0,0.0,4.0,1.0,3883.0205,0.0,43.0,0.0,986.8333,1291.0,0.0,0.0,0.0,0.0,3831.0,400.0,1400.0,3100,3890.22,24.0,23.571,Weekly,25.0,4203.69,3500.0,Full-Time Employment,0.0,0.0,0.0,0.0,3947.3333,2191.0,4630.9466,162.1,QuickCash,0.0,4943009,0.0,27-03-2023,False,Child Expenses,2023-03-27,Green,0.0,7077.0,4203.69
0062x00000FUNKNAA5,0010K0000282ZjzQAE,Croydon Park,NSW,Australia,Loan Paid,Existing Client-Granted Loan Before,0.64,22.14,552.2783,1.0,0.0,0.0,2.0,1.0,4036.7235,0.0,0.0,397.6753,929.0,929.0,0.0,3.35,1.0,1.0,3258.67,899.0,1040.0,3500,4233.95,18.0,17.857,Weekly,48.0,5538.39,3500.0,Full-Time Employment,0.0,0.0,0.0,0.0,0.0,2728.0,3018.4133,235.23,MoneySpot,0.0,7504898,0.0,14-12-2023,False,Travel Expenses,2023-12-14,Orange,78.0,12042.0,5538.39
0062x00000EbgByAAJ,0012x00000ILmCwAAL,Maddington,WA,Australia,Loan Paid,Existing Client-Granted Loan Before,0.0,28.8,5231.6324,1.0,0.0,0.0,4.0,1.0,17000.0,0.0,0.0,284.4827,4250.0,5000.0,0.0,0.4,0.0,1.0,2080.0,899.0,800.0,3500,4271.08,20.0,19.857,Weekly,65.0,25516.03,3500.0,Unemployed,0.0,0.0,0.3187,0.0,8505.4033,2871.0,7348.4166,213.56,MoneySpot,0.0,6305048,0.0,23-08-2023,False,Travel Expenses,2023-08-23,Orange,0.0,18279.0,25516.03
0062x00000EEaTjAAL,0012x00000TJRxhAAH,Seymour,VIC,Australia,Loan Paid,Existing Client-Granted Loan Before,0.0,91.24,0.0,1.0,0.0,0.0,3.0,1.0,6586.4948,0.0,0.0,0.0,1037.3276,1049.08,0.0,0.0,0.0,0.0,4219.28,400.0,170.0,3500,4351.6,24.0,24.0,Weekly,26.0,6587.22,5000.0,Full-Time Employment,0.0,0.0,0.0,0.0,4495.0866,0.0,100.0,181.32,MoneySpot,0.0,6024274,0.0,27-07-2023,False,Vehicle Expenses,2023-07-27,Orange,0.0,7542.0,6587.22
0062x00000E3an6AAB,0010K00002BT2VBQA1,Bondi,NSW,Australia,Loan Paid,Existing Client-Granted Loan Before,1.22,37.0,1206.4999,0.0,1.0,0.0,0.0,0.0,0.0,7.0,49.0,3211.5432,0.0,0.0,0.0,0.07,0.0,0.0,5000.0,1500.0,1240.0,3500,4356.45,5.0,21.286,Monthly,33.0,495.22,3500.0,Full-Time Employment,7.0,0.0,0.0769,0.0,0.0,4490.0,8112.08,871.3,MoneySpot,0.0,5500654,2.0,05-06-2023,False,Furniture or Appliances,2023-06-04,Green,148.0,12094.0,495.22
0062x00000Dr6jUAAR,0012x00000LQaHpAAL,Campsie,NSW,Australia,Loan Paid,Existing Client-Granted Loan Before,0.0,64.35,2465.2434,2.0,0.0,0.0,3.0,2.0,7997.6045,0.0,21.0,506.9372,1983.4066,2105.58,0.0,0.0,0.0,0.0,1670.0,1499.0,150.0,3050,3832.17,12.0,23.0,Fortnightly,47.0,8072.52,3500.0,Casual Employment,0.0,0.0,0.0,0.0,4666.52,1869.0,4562.3,319.35,MoneySpot,0.0,5147058,0.0,27-04-2023,False,Life Event Expenses,2023-04-27,Green,0.0,8767.0,8072.52
0062x00000DFBROAA5,0012x00000Geg9FAAR,Ulverstone,TAS,Australia,Loan Paid,Existing Client-Granted Loan Before,12.18,84.76,4339.8094,4.0,0.0,4.0,1.0,4.0,11730.5716,0.0,36.0,378.3182,478.9566,307.2,0.0,48.57,0.0,1.0,3274.23,599.0,1060.0,3500,4301.71,10.0,20.143,Fortnightly,48.0,14121.69,3500.0,Part-Time Employment,0.0,1.0,0.0,0.0,2087.4,2174.0,6278.02,430.18,MoneySpot,0.0,4654584,0.0,10-02-2023,False,Vehicle Expenses,2023-02-10,Green,1719.0,14113.0,14121.69
0062x00000FIrydAAD,0012x00000gpcYKAAY,Paralowie,SA,Australia,Loan Paid,Existing Client-Granted Loan Before,0.6,43.07,2410.5016,2.0,0.0,0.0,4.0,2.0,5920.9567,0.0,21.0,0.0,2556.4957,2537.3,1.0,15.95,0.0,1.0,5269.33,1499.0,1600.0,3500,4498.34,15.0,30.286,Fortnightly,51.0,6145.49,5000.0,Full-Time Employment,0.0,0.0,0.0,0.0,0.0,329.0,2552.9966,299.89,MoneySpot,0.0,7282479,0.0,23-11-2023,False,Furniture or Appliances,2023-11-22,Orange,41.0,6776.0,6145.49
0062x00000EeDqKAAV,0012x00000hYcoGAAS,Oran Park,NSW,Australia,Closed Lost,Existing Client-Granted Loan Before,12.15,58.03,1842.8753,2.0,0.0,4.0,2.0,2.0,17023.445,12.0,63.0,0.0,3135.0966,2942.3,0.0,0.45,0.0,0.0,0.0,899.0,1040.0,3300,3953.46,8.0,16.571,Fortnightly,35.0,17038.45,3300.0,Full-Time Employment,12.0,0.0,0.2527,2.0,7813.8033,876.0,2181.7266,494.19,MoneySpot,,6472805,0.0,09-09-2023,False,Travel Expenses,2023-09-09,Green,2443.0,20095.0,17038.45
0062x00000ECnsaAAD,0012x00000XByxWAAT,Oak Flats,NSW,Australia,Loan Paid,Existing Client-Granted Loan Before,0.0,94.86,4548.4328,1.0,1.0,0.0,3.0,1.0,5921.337,5.0,90.0,0.0,1271.7509,1005.78,1.0,0.0,0.0,0.0,826.17,599.0,1200.0,3250,3932.75,16.0,16.0,Weekly,22.0,5921.34,3250.0,Unemployed,5.0,0.0,0.0,4.0,4663.0866,798.0,5106.18,245.8,MoneySpot,0.0,5900647,5.0,13-07-2023,False,Living Expenses,2023-07-13,Green,0.0,6448.0,5921.34
0062x00000D81j7AAB,0012x00000n1SdEAAU,South Lake,WA,Australia,Loan Paid,Existing Client-Granted Loan Before,0.0,41.25,3285.4677,1.0,0.0,0.0,2.0,1.0,3802.4027,6.0,64.0,1285.4518,875.0741,270.73,0.0,0.0,0.0,0.0,3791.67,599.0,500.0,3500,4191.62,16.0,15.714,Weekly,38.0,6428.4,5000.0,Full-Time Employment,6.0,0.0,0.7033,5.0,3500.2966,2201.0,4153.5,261.98,MoneySpot,0.0,4510677,5.0,21-01-2023,False,Vehicle Expenses,2023-01-21,Orange,0.0,10418.0,6428.4
0062x00000DYdcTAAT,0012x00000bmkXwAAI,Deebing Heights,QLD,Australia,Loan Paid,Existing Client-Granted Loan Before,0.0,74.51,785.4458,1.0,0.0,0.0,3.0,1.0,9472.8161,0.0,16.0,678.5958,2180.0454,2409.5,0.0,0.26,0.0,1.0,6500.0,599.0,400.0,3500,4244.88,18.0,18.143,Weekly,25.0,7993.5,3500.0,Full-Time Employment,0.0,0.0,0.5604,0.0,0.0,625.0,912.49,235.83,MoneySpot,0.0,5044766,0.0,12-04-2023,False,Vehicle Expenses,2023-04-12,Green,0.0,9385.0,7993.5
0062x00000DY9AQAA1,0012x00000INSeOAAX,Herne Hill,VIC,Australia,Loan Paid,Existing Client-Granted Loan Before,0.83,59.13,2920.0132,1.0,0.0,0.0,3.0,1.0,3047.6861,0.0,0.0,1322.0825,701.3853,892.4,0.0,0.0,0.0,1.0,3827.57,400.0,370.0,3150,3956.12,24.0,23.857,Weekly,31.0,5810.42,5000.0,Full-Time Employment,13.0,0.0,0.0989,6.0,5782.4766,1383.0,3763.2033,164.84,MoneySpot,0.0,5015266,3.0,07-04-2023,False,Living Expenses,2023-04-07,Green,26.0,3131.0,5810.42
0062x00000DYxcqAAD,0012800001SDTysAAH,Wantirna South,VIC,Australia,Loan Paid,Existing Client-Granted Loan Before,0.23,75.12,2977.8137,2.0,0.0,0.0,4.0,2.0,5151.344,0.0,40.0,1853.9678,2363.8533,2988.92,0.0,0.07,1.0,0.0,0.0,599.0,240.0,3100,3888.16,12.0,23.0,Fortnightly,34.0,5151.34,3500.0,Full-Time Employment,0.0,0.0,0.8681,0.0,4727.7066,2289.0,5043.57,324.02,MoneySpot,0.0,5062386,0.0,14-04-2023,False,Medical Expenses,2023-04-14,Green,13.0,5512.0,5151.34
0062x00000E5uGPAAZ,0012x000002bFbPAAU,Point Cook,VIC,Australia,Loan Paid,Existing Client-Granted Loan Before,0.28,60.64,11390.892,1.0,0.0,0.0,2.0,1.0,8675.727,0.0,41.0,358.4666,1996.6057,1893.6,0.0,1.21,0.0,0.0,5633.33,599.0,400.0,3500,4196.74,16.0,15.857,Weekly,44.0,9317.49,3500.0,Full-Time Employment,0.0,0.0,0.0,0.0,9317.4933,2646.0,11891.1866,262.3,MoneySpot,0.0,5689792,0.0,23-06-2023,False,Travel Expenses,2023-06-22,Green,27.0,9494.0,9317.49
0062x00000Eb6vYAAR,0012x00000iHeQ3AAK,Somerton Park,SA,Australia,Closed Lost,Existing Client-No Loan Granted Ever,0.0,49.73,1852.8383,0.0,0.0,0.0,0.0,0.0,0.0,0.0,26.0,1313.3437,0.0,0.0,0.0,1.26,0.0,0.0,0.0,0.0,0.0,3500,4095.29,9.0,9.571,Weekly,34.0,2920.09,3500.0,,0.0,0.0,0.0,0.0,0.0,928.0,1681.0533,455.04,QuickCash,,6267410,0.0,19-08-2023,False,debt_consolidation,2023-08-19,Orange,0.0,3172.0,2920.09
0062x00000FUuTDAA1,0012x000002dcFRAAY,Wyndham,WA,Australia,Loan Paid,Existing Client-Granted Loan Before,0.0,77.09,4489.7813,2.0,0.0,0.0,4.0,2.0,8514.153,0.0,10.0,266.2715,1770.4983,1775.31,0.0,10.66,0.0,0.0,3575.0,599.0,450.0,3500,4243.3,8.0,16.571,Fortnightly,54.0,12389.23,5000.0,Full-Time Employment,0.0,0.0,0.0,0.0,3540.9966,1666.0,5606.77,530.42,MoneySpot,0.0,7549238,0.0,18-12-2023,False,Travel Expenses,2023-12-17,Orange,0.0,13375.0,12389.23
0062x00000DrQSrAAN,0012x00000hXkbyAAC,Kelmscott,WA,Australia,Loan Paid,Existing Client-Granted Loan Before,0.33,68.85,3585.1917,4.0,0.0,0.0,4.0,4.0,4755.6766,0.0,20.0,2611.2,1658.4912,1904.38,1.0,0.93,0.0,0.0,0.0,899.0,400.0,3100,3907.57,12.0,23.571,Fortnightly,23.0,4809.01,4550.0,,0.0,0.0,0.0,0.0,4422.6433,3318.0,5617.33,325.64,QuickCash,0.0,5167014,0.0,30-04-2023,False,Home Maintenance & Repairs,2023-04-30,Green,27.0,7953.0,4809.01
0062x00000FjZuiAAF,0012x00000kfkx8AAA,Camillo,WA,Australia,Loan Paid,Existing Client-Granted Loan Before,0.0,49.25,1810.6966,1.0,2.0,0.0,4.0,1.0,5221.7634,6.0,26.0,0.0,1167.2,1026.46,0.0,0.0,0.0,0.0,0.0,599.0,1400.0,3500,4281.68,20.0,20.143,Weekly,29.0,10027.05,5000.0,Full-Time Employment,6.0,0.0,0.1099,2.0,1167.2,1806.0,2651.23,214.09,MoneySpot,0.0,8072690,6.0,2024-02-01,False,Vehicle Expenses,2024-02-01,Green,0.0,6053.0,10027.05
0062x00000EdGvTAAV,0010K0000260mcbQAA,Terrigal,NSW,Australia,Loan Paid,Existing Client-Granted Loan Before,0.0,86.54,6681.4782,2.0,0.0,0.0,3.0,2.0,6566.9513,4.0,48.0,1289.9067,2942.97,2942.97,0.0,4.65,1.0,0.0,0.0,899.0,1240.0,3250,3935.02,8.0,15.571,Fortnightly,43.0,6603.47,3250.0,,4.0,0.0,0.956,0.0,6866.93,1443.0,7421.0466,491.88,Financier-2,0.0,6412012,2.0,03-09-2023,False,Life Event Expenses,2023-09-04,Green,0.0,7608.0,6603.47
0062x00000EwbS2AAJ,0010K000023R2h3QAC,Saint Marys,NSW,Australia,Loan Paid,Existing Client-Granted Loan Before,0.0,60.11,3502.5533,2.0,0.0,0.0,3.0,2.0,12020.6849,0.0,38.0,522.4497,3343.22,3353.36,0.0,0.0,0.0,0.0,14300.0,1499.0,900.0,3300,4004.89,8.0,16.0,Fortnightly,47.0,10762.02,3300.0,Full-Time Employment,0.0,0.0,0.0,0.0,11388.7733,3356.0,4545.8333,500.62,MoneySpot,0.0,6600747,0.0,21-09-2023,False,Travel Expenses,2023-09-21,Green,0.0,14643.0,10762.02
0062x00000FHGA7AAP,0010K00001jMkEjQAK,Roxby Downs,SA,Australia,Closed Lost,Existing Client-Granted Loan Before,0.08,88.26,1005.63,3.0,4.0,0.0,4.0,3.0,10491.62,7.0,19.0,156.1389,8423.62,7237.33,1.0,2.84,0.0,0.0,2075.67,1500.0,200.0,3050,3675.23,4.0,13.857,Monthly,36.0,10902.29,3050.0,Full-Time Employment,7.0,0.0,0.0769,3.0,8423.62,1799.0,3392.32,918.81,QuickCash,,7155305,5.0,11-11-2023,False,Other Expenses,2023-11-10,Orange,10.0,11178.0,10902.29
0062x00000E4zxVAAR,0012x00000g9HzWAAU,Nannup,WA,Australia,Loan Paid,Existing Client-Granted Loan Before,0.0,50.58,1566.7837,2.0,1.0,0.0,4.0,2.0,4709.8873,4.0,12.0,0.0,2114.125,2055.9,1.0,17.24,0.0,0.0,2100.0,599.0,100.0,3500,4151.24,8.0,16.143,Fortnightly,24.0,4709.89,3500.0,Full-Time Employment,4.0,0.0,0.0,2.0,4228.25,1982.0,3215.18,528.35,MoneySpot,0.0,5615421,3.0,15-06-2023,False,Vehicle Expenses,2023-06-15,Green,0.0,5494.0,4709.89
0062x00000Exj5aAAB,0012x00000dyTzFAAU,Usher,WA,Australia,Loan Paid,Existing Client-Granted Loan Before,0.0,49.12,2693.047,3.0,0.0,0.0,1.0,3.0,8733.824,0.0,12.0,0.0,4872.0266,3748.54,0.0,12.55,0.0,0.0,5586.69,899.0,400.0,3150,3856.42,4.0,16.0,Monthly,22.0,10320.49,3150.0,Full-Time Employment,0.0,0.0,0.0,0.0,4872.0266,539.0,2966.6966,964.11,MoneySpot,0.0,6683048,0.0,30-09-2023,False,Travel Expenses,2023-09-30,Green,0.0,19264.0,10320.49
0062x00000EE2m2AAD,0012x00000Zv43eAAB,Southport,QLD,Australia,Loan Paid,Existing Client-Granted Loan Before,0.0,75.33,2045.5854,4.0,2.0,0.0,3.0,4.0,1128.6666,34.0,96.0,0.0,340.0,340.0,0.0,1.97,0.0,1.0,4150.0,899.0,1340.0,3500,4185.89,16.0,16.571,Weekly,28.0,6305.1,3500.0,Full-Time Employment,34.0,0.0,0.6044,3.0,0.0,977.0,3777.2533,264.0,MoneySpot,0.0,5986668,9.0,23-07-2023,False,Vehicle Expenses,2023-07-23,Green,0.0,7503.0,6305.1
0062x00000F3C7KAAV,0010K00001cxBQGQA2,Inala,QLD,Australia,Loan Paid,Existing Client-Granted Loan Before,10.45,72.85,3044.4667,1.0,0.0,4.0,2.0,1.0,5816.304,0.0,103.0,1144.2058,1117.5107,1521.59,1.0,0.54,0.0,0.0,3462.33,599.0,200.0,3500,4233.23,18.0,17.857,Weekly,44.0,5816.3,3500.0,Full-Time Employment,0.0,0.0,0.0,0.0,5641.0033,1990.0,3322.9033,235.18,MoneySpot,0.0,7027426,0.0,02-11-2023,False,Life Event Expenses,2023-11-01,Green,798.0,7630.0,5816.3
0062x00000D8cfSAAR,0012x000008HMVBAA4,North Nowra,NSW,Australia,Loan Paid,Existing Client-Granted Loan Before,6.79,45.0,2901.6908,1.0,0.0,2.0,3.0,1.0,9192.6284,0.0,75.0,0.0,1349.3816,1399.45,1.0,1.26,0.0,0.0,6851.0,1499.0,2150.0,3400,4087.1,15.0,15.286,Weekly,32.0,8933.4,5000.0,Full-Time Employment,0.0,0.0,0.0,0.0,6316.3833,3546.0,4573.8933,272.48,MoneySpot,0.0,4541991,0.0,25-01-2023,False,Home Maintenance & Repairs,2023-01-24,Green,919.0,13521.0,8933.4
0062x00000EC7IkAAL,0010K000023ztsKQAQ,The Gemfields,QLD,Australia,Loan Paid,Existing Client-Granted Loan Before,0.0,38.64,1451.2412,1.0,0.0,0.0,4.0,1.0,8093.0081,0.0,23.0,0.0,1862.5007,1762.0,1.0,7.38,0.0,0.0,6933.33,899.0,920.0,3100,3770.96,16.0,16.0,Weekly,35.0,8093.01,3100.0,Full-Time Employment,0.0,0.0,0.033,0.0,8070.8366,1109.0,1833.6933,235.69,MoneySpot,0.0,5855258,0.0,07-07-2023,False,Living Expenses,2023-07-07,Green,0.0,8496.0,8093.01
0062x00000DtpCLAAZ,0012x00000fmu6SAAQ,White Rock,QLD,Australia,Closed Lost,Existing Client-Granted Loan Before,0.0,60.14,915.8691,2.0,0.0,0.0,3.0,2.0,3685.7408,0.0,32.0,96.0,1647.66,1590.68,1.0,0.0,1.0,0.0,0.0,599.0,550.0,3400,4276.06,12.0,24.429,Fortnightly,21.0,3685.74,5000.0,,0.0,0.0,0.0769,0.0,3295.32,988.0,2231.0566,356.34,MoneySpot,,5351146,0.0,26-05-2023,False,Vehicle Expenses,2023-05-21,Green,0.0,3462.0,3685.74
0062x00000EzmerAAB,0012x00000g8wIzAAI,Highland Park,QLD,Australia,Loan Paid,Existing Client-Granted Loan Before,0.0,67.91,3966.2673,2.0,0.0,0.0,3.0,2.0,6963.3699,0.0,22.0,0.0,2497.6285,2435.98,0.0,1.19,0.0,0.0,4628.96,1500.0,3000.0,3200,4130.99,15.0,29.714,Fortnightly,58.0,7543.37,5000.0,Full-Time Employment,0.0,0.0,0.5934,0.0,5827.8,891.0,4049.2933,275.4,QuickCash,0.0,6834052,0.0,14-10-2023,False,Living Expenses,2023-10-14,Orange,0.0,10114.0,7543.37
0062x00000EdvOBAAZ,0012x00000cmFahAAE,Murringo,NSW,Australia,Closed Lost,Existing Client-Granted Loan Before,0.0,40.87,2454.6238,1.0,0.0,0.0,4.0,1.0,6157.425,0.0,25.0,1129.5,843.78,836.7,1.0,2.99,0.0,0.0,0.0,899.0,240.0,3100,4117.99,36.0,36.143,Weekly,41.0,6160.94,4450.0,Full-Time Employment,0.0,0.0,0.0,0.0,4143.38,1528.0,4411.8633,114.39,MoneySpot,,6451011,0.0,07-09-2023,False,Child Expenses,2023-09-07,Green,0.0,7129.0,6160.94
0062x00000Edvn6AAB,0012x00000VeXX6AAN,Bunbury,WA,Australia,Loan Paid,Existing Client-Granted Loan Before,15.19,53.59,271.25,1.0,0.0,4.0,5.0,1.0,7368.7406,0.0,18.0,0.0,434.6153,650.0,0.0,11.81,0.0,0.0,7800.0,599.0,1400.0,3500,4212.83,16.0,16.286,Weekly,59.0,10453.9,3500.0,Self Employed,0.0,0.0,0.0,0.0,4231.49,132.0,735.8366,263.31,MoneySpot,0.0,6451267,0.0,07-09-2023,False,Vehicle Expenses,2023-09-07,Green,1343.0,8839.0,10453.9
0062x00000DUixEAAT,0012x00000e0KXnAAM,North Strathfield,NSW,Australia,Loan Paid,Existing Client-Granted Loan Before,0.0,87.29,4653.3317,2.0,0.0,0.0,3.0,2.0,5066.7393,0.0,44.0,701.4952,2301.6028,1853.42,0.0,0.0,0.0,0.0,6933.33,899.0,400.0,3100,3923.14,12.0,24.0,Fortnightly,28.0,5066.74,5000.0,Full-Time Employment,0.0,0.0,0.0,0.0,5370.4066,753.0,4963.4533,326.93,MoneySpot,0.0,5385996,0.0,25-05-2023,False,Other Expenses,2023-05-25,Green,0.0,17801.0,5066.74
0062x00000FIUWvAAP,0012x00000WtOzAAAV,Yarraville,VIC,Australia,Loan Paid,Existing Client-Granted Loan Before,0.0,77.62,2227.4409,2.0,0.0,0.0,4.0,2.0,7569.3288,0.0,26.0,0.0,2097.73,2097.73,0.0,15.1,0.0,0.0,4614.61,1499.0,1400.0,3500,4550.66,18.0,34.714,Fortnightly,29.0,5067.55,3500.0,Full-Time Employment,0.0,0.0,0.0,0.0,4195.46,546.0,4004.1366,252.82,MoneySpot,0.0,7253375,0.0,20-11-2023,False,Travel Expenses,2023-11-19,Orange,0.0,9741.0,5067.55
0062x00000FKlwDAAT,0012x000002aCejAAE,Canadian,VIC,Australia,Loan Paid,Existing Client-Granted Loan Before,0.55,22.18,892.8614,2.0,0.0,0.0,1.0,2.0,3654.3435,2.0,21.0,0.0,1682.0,1629.68,0.0,0.0,0.0,0.0,0.0,400.0,200.0,3500,4214.43,9.0,16.857,Fortnightly,46.0,3654.34,3500.0,Self Employed,2.0,0.0,0.7582,0.0,3364.0,909.0,1063.2766,468.28,MoneySpot,0.0,7413912,0.0,06-12-2023,False,Medical Expenses,2023-12-06,Green,27.0,4903.0,3654.34
0062x00000FKzpmAAD,0012x00000TrZ6NAAV,Brunswick,VIC,Australia,Loan Paid,Existing Client-Granted Loan Before,0.0,68.96,624.1666,1.0,0.0,0.0,2.0,1.0,5112.4607,0.0,20.0,0.0,1008.4857,948.15,0.0,0.0,0.0,0.0,3436.33,1500.0,800.0,3500,4233.58,18.0,17.857,Weekly,30.0,5112.46,3500.0,Full-Time Employment,0.0,0.0,0.0,0.0,4706.2666,439.0,3052.6566,235.2,MoneySpot,0.4,7429075,0.0,08-12-2023,False,Life Event Expenses,2023-12-07,Green,0.0,5087.0,5112.46
0062x00000DtHMJAA3,0012x00000g8ME6AAM,Williams Landing,VIC,Australia,Loan Paid,Existing Client-Granted Loan Before,0.0,76.06,3175.6599,4.0,1.0,0.0,3.0,4.0,7682.6866,12.0,48.0,0.0,441.045,770.83,0.0,6.64,0.0,1.0,6856.26,899.0,0.0,3300,4128.77,24.0,24.0,Weekly,29.0,7329.35,4000.0,Full-Time Employment,12.0,0.0,0.0989,1.0,0.0,803.0,3312.12,172.04,MoneySpot,0.0,5300228,7.0,18-05-2023,False,Vehicle Expenses,2023-05-17,Green,0.0,9710.0,7329.35
0062x00000DW283AAD,0012x00000IN4iXAAT,Katoomba,NSW,Australia,Closed Lost,Existing Client-No Loan Granted Ever,0.0,42.8,195.5335,4.0,1.0,0.0,6.0,4.0,843.5965,0.0,0.0,0.0,262.8,1000.0,0.0,0.29,0.0,1.0,2040.69,899.0,300.0,3500,4095.29,9.0,9.571,Weekly,22.0,8765.78,3500.0,Part-Time Employment,20.0,0.0,0.0,4.0,5144.5833,0.0,870.2133,455.04,QuickCash,,4891958,20.0,19-03-2023,False,Vehicle Repairs & Maintenance,2023-03-18,Orange,0.0,8242.0,8765.78
0062x00000EChpIAAT,0012800001QEJbNAAX,FERNTREE GULLY,VIC,Australia,Loan Paid,Existing Client-Granted Loan Before,0.18,74.55,5303.8586,2.0,0.0,0.0,3.0,2.0,5166.2189,7.0,66.0,0.0,2069.4928,1893.76,0.0,0.0,0.0,0.0,1937.0,400.0,300.0,3500,4570.28,17.0,34.143,Fortnightly,51.0,5271.89,3500.0,Full-Time Employment,7.0,0.0,0.033,0.0,4828.8166,2245.0,6480.09,268.85,MoneySpot,0.0,5894041,6.0,13-07-2023,False,Child Expenses,2023-07-13,Green,13.0,7206.0,5271.89
0062x00000FuoqMAAR,0012x00000nThi8AAC,Frankston,VIC,Australia,Closed Lost,Existing Client-No Loan Granted Ever,71.69,99.81,0.0,2.0,0.0,4.0,3.0,4.0,1831.6033,2.0,5.0,320.0,640.8016,1183.92,0.0,9.19,0.0,0.0,2002.0,899.0,100.0,3500,4068.65,5.0,8.857,Fortnightly,73.0,2497.76,3500.0,Unemployed,2.0,0.0,0.1319,1.0,1947.7633,167.0,166.6666,813.73,MoneySpot,,8271170,0.0,2024-02-23,True,Life Event Expenses,2024-02-23,Orange,1482.0,2067.0,2497.76
0062x00000DWLsFAAX,0010K0000241CDvQAM,Nambour,QLD,Australia,Loan Paid,Existing Client-Granted Loan Before,0.0,90.92,7781.2222,1.0,2.0,0.0,4.0,1.0,6485.292,6.0,103.0,2805.9494,1344.0676,1368.0,1.0,2.63,1.0,1.0,6500.0,899.0,800.0,3500,4213.12,16.0,16.286,Weekly,50.0,6485.29,3500.0,Full-Time Employment,6.0,0.0,0.4835,2.0,0.0,3661.0,8107.4566,263.32,MoneySpot,0.0,4911417,6.0,22-03-2023,False,Medical Expenses,2023-03-22,Green,0.0,7097.0,6485.29
0062x00000DAqfXAAT,0010K00001xNyiUQAS,BLAIR ATHOL,NSW,Australia,Loan Paid,Existing Client-Granted Loan Before,0.0,78.13,7449.3455,2.0,0.0,0.0,3.0,2.0,9083.5575,0.0,60.0,1850.6217,2959.1557,2752.83,1.0,0.13,0.0,0.0,5620.33,599.0,560.0,3300,4004.88,8.0,16.0,Fortnightly,50.0,7338.42,3300.0,Full-Time Employment,0.0,0.0,0.044,0.0,6998.03,4864.0,13900.53,500.62,MoneySpot,0.0,4648219,0.0,09-02-2023,False,Vehicle Expenses,2023-02-09,Orange,0.0,17779.0,7338.42
0062x00000DHmdDAAT,0012x00000THl8OAAT,Dural,NSW,Australia,Loan Paid,Existing Client-Granted Loan Before,0.0,54.61,2874.2446,2.0,0.0,0.0,3.0,2.0,6267.0395,0.0,32.0,719.2455,2226.21,2472.15,0.0,32.23,0.0,0.0,3869.33,599.0,1100.0,3500,4209.96,8.0,15.714,Fortnightly,30.0,6267.04,3500.0,Full-Time Employment,0.0,0.0,0.8132,0.0,5194.49,979.0,3302.5366,526.25,MoneySpot,0.0,4797517,0.0,04-03-2023,False,Medical Expenses,2023-03-04,Green,0.0,6732.0,6267.04
0062x00000DGrr0AAD,0012x00000TGqi4AAD,Lawnton,QLD,Australia,Loan Paid,Existing Client-Granted Loan Before,14.18,63.6,2837.3874,1.0,0.0,2.0,3.0,1.0,5897.3261,0.0,96.0,0.0,1172.8192,1414.4,2.0,1.59,0.0,0.0,5033.09,400.0,400.0,3500,4196.79,16.0,15.857,Weekly,47.0,5897.33,3500.0,Full-Time Employment,0.0,0.0,0.1868,0.0,5942.63,1774.0,3662.6633,262.3,MoneySpot,-0.27,4747485,0.0,24-02-2023,False,Travel Expenses,2023-02-24,Green,864.0,6089.0,5897.33
0062x00000DUio2AAD,0012x00000WWZFgAAP,O'Briens Hill,QLD,Australia,Loan Paid,Existing Client-Granted Loan Before,0.0,29.25,670.67,3.0,2.0,0.0,5.0,3.0,19329.5366,2.0,6.0,1460.9684,5977.58,5977.58,0.0,83.45,0.0,0.0,4760.67,899.0,800.0,3500,4235.59,4.0,16.0,Monthly,42.0,17255.91,3500.0,Full-Time Employment,2.0,0.0,0.0,2.0,5977.58,1098.0,1344.3433,1058.9,MoneySpot,0.0,5385774,2.0,25-05-2023,False,Medical Expenses,2023-05-24,Green,0.0,26757.0,17255.91
0062x00000E4zzlAAB,0012x00000hYHUzAAO,Ballarat North,VIC,Australia,Closed Lost,Existing Client-No Loan Granted Ever,0.0,65.73,468.9055,0.0,0.0,0.0,0.0,0.0,1540.0066,0.0,0.0,0.0,0.0,0.0,0.0,100.0,0.0,0.0,0.0,899.0,0.0,3500,4079.3,5.0,9.143,Fortnightly,24.0,5341.14,3500.0,Full-Time Employment,0.0,0.0,0.0,0.0,2915.94,0.0,431.65,815.87,MoneySpot,,5615453,0.0,15-06-2023,False,Vehicle Expenses,2023-06-15,Orange,0.0,1790.0,5341.14
0062x00000EOLIXAA5,0012x00000BFfvPAAT,Killarney Vale,NSW,Australia,Loan Paid,Existing Client-Granted Loan Before,8.59,64.67,4800.3653,2.0,0.0,2.0,3.0,2.0,8200.7821,22.0,82.0,638.9733,2796.57,2687.26,0.0,0.0,0.0,0.0,3250.0,899.0,1240.0,3050,3729.46,8.0,15.857,Fortnightly,40.0,8200.78,3050.0,Unemployed,22.0,0.0,0.1648,6.0,7270.2466,1780.0,5072.36,466.19,MoneySpot,0.0,6252026,7.0,18-08-2023,False,Living Expenses,2023-08-18,Green,745.0,8669.0,8200.78
0062x00000DYnmPAAT,0010K00001viuIuQAI,Clayfield,QLD,Australia,Closed Lost,Existing Client-Granted Loan Before,0.38,93.37,1813.4737,2.0,4.0,0.0,1.0,2.0,2875.1533,33.0,65.0,141.716,1280.4,1290.0,2.0,0.0,0.0,0.0,6489.17,899.0,0.0,3500,4068.78,5.0,8.857,Fortnightly,44.0,3004.57,3500.0,Full-Time Employment,33.0,0.0,0.4945,8.0,2134.0,270.0,1809.21,813.76,MoneySpot,,5053920,17.0,13-04-2023,False,Living Expenses,2023-04-13,Orange,13.0,3339.0,3004.57
0062x00000DFxnQAAT,0012x00000XEGkUAAX,Calala,NSW,Australia,Loan Paid,Existing Client-Granted Loan Before,0.15,34.13,2200.6156,2.0,0.0,0.0,2.0,2.0,6766.7149,2.0,30.0,0.0,3011.2883,4401.23,1.0,0.21,0.0,0.0,6020.0,899.0,1400.0,3050,3696.02,8.0,14.857,Fortnightly,48.0,6945.71,3050.0,Full-Time Employment,2.0,0.0,0.0879,0.0,6022.5766,1203.0,2388.2466,462.01,MoneySpot,0.0,4695782,2.0,16-02-2023,False,Relocation Expenses,2023-02-16,Green,13.0,8443.0,6945.71
0062x00000EzJd5AAF,0012x00000hXMecAAG,Phillip,ACT,Australia,Loan Paid,Existing Client-Granted Loan Before,0.13,59.68,1847.8336,2.0,0.0,2.0,4.0,2.0,6135.9967,0.0,37.0,0.0,2817.64,2817.64,1.0,0.0,0.0,0.0,0.0,899.0,1260.0,3500,4498.29,15.0,30.286,Fortnightly,30.0,9284.9,3500.0,,0.0,0.0,0.1209,0.0,5650.68,802.0,3258.5533,299.89,MoneySpot,0.0,6800559,0.0,11-10-2023,False,Living Expenses,2023-10-10,Orange,15.0,10791.0,9284.9
0062x00000FK1bJAAT,0012x00000LPZdzAAH,South Yarra,VIC,Australia,Loan Paid,Existing Client-Granted Loan Before,0.0,85.18,2059.0999,3.0,0.0,0.0,2.0,3.0,16135.5765,0.0,16.0,1812.4585,9377.13,11019.34,0.0,0.0,2.0,0.0,3981.95,1499.0,1130.0,3500,4198.38,4.0,14.857,Monthly,41.0,22923.47,3500.0,Full-Time Employment,0.0,0.0,0.0,0.0,9537.6266,1913.0,5344.8966,1049.6,MoneySpot,0.0,7361652,0.0,01-12-2023,False,Relocation Expenses,2023-11-30,Green,0.0,23327.0,22923.47
0062x00000FVU9nAAH,0012x000008JbgwAAC,Maddington,WA,Australia,Loan Paid,Existing Client-Granted Loan Before,0.0,44.24,3356.0648,4.0,0.0,0.0,2.0,4.0,8705.3833,2.0,13.0,0.0,3111.0262,3786.77,0.0,0.36,0.0,0.0,0.0,1499.0,250.0,3500,4215.94,8.0,15.857,Fortnightly,26.0,8705.38,3500.0,Full-Time Employment,2.0,0.0,0.4505,1.0,8296.07,1859.0,6565.28,527.0,MoneySpot,0.0,7595472,0.0,21-12-2023,False,Relocation Expenses,2023-12-21,Green,0.0,10820.0,8705.38
0062x00000Ef8teAAB,0012x00000cvsEwAAI,Riverstone,NSW,Australia,Loan Paid,Existing Client-Granted Loan Before,0.36,43.35,1422.8009,2.0,0.0,0.0,3.0,2.0,5190.8596,0.0,15.0,234.5342,2389.2183,2256.7,1.0,0.15,0.0,0.0,11230.18,1500.0,1360.0,3500,4435.03,15.0,28.714,Fortnightly,38.0,8365.86,5000.0,Full-Time Employment,0.0,0.0,0.1538,0.0,7877.48,662.0,1354.1933,295.67,MoneySpot,0.0,6547482,0.0,16-09-2023,False,Travel Expenses,2023-09-15,Orange,19.0,5246.0,8365.86
0062x00000FJqIeAAL,0012x00000Ttg54AAB,Lockwood,VIC,Australia,Loan Paid,Existing Client-Granted Loan Before,37.76,43.07,2250.7074,2.0,0.0,1.0,2.0,2.0,13051.359,0.0,14.0,1239.1004,3576.7285,3548.52,1.0,20.11,0.0,0.0,0.0,1499.0,100.0,3500,4220.81,8.0,16.0,Fortnightly,28.0,13051.36,3500.0,,0.0,0.0,0.0,0.0,13493.14,2201.0,2396.39,527.61,QuickCash,-0.65,7350498,0.0,02-12-2023,False,Vehicle Expenses,2023-12-01,Green,5165.0,13678.0,13051.36
0062x00000DWZZqAAP,0012x00000BIt8HAAT,Long Beach,NSW,Australia,Loan Paid,Existing Client-Granted Loan Before,0.16,32.24,3667.8141,4.0,1.0,0.0,3.0,4.0,4580.2665,1.0,24.0,0.0,2044.16,565.63,0.0,45.27,0.0,0.0,4506.67,599.0,0.0,3100,3882.92,12.0,22.857,Fortnightly,39.0,4580.27,5000.0,Full-Time Employment,1.0,1.0,0.011,1.0,3406.9333,868.0,3706.13,323.58,MoneySpot,0.0,4923814,1.0,24-03-2023,False,Other Expenses,2023-03-24,Green,13.0,7831.0,4580.27
0062x00000D2EJsAAN,0012x00000WqCAAAA3,Burswood,WA,Australia,Loan Paid,Existing Client-Granted Loan Before,0.0,51.26,3863.9511,2.0,0.0,0.0,4.0,2.0,6396.1939,0.0,66.0,2120.0693,2034.31,2034.31,1.0,0.46,0.0,1.0,4376.67,599.0,400.0,3500,4215.79,8.0,15.857,Fortnightly,44.0,6723.14,3500.0,Full-Time Employment,0.0,0.0,0.5165,0.0,0.0,2854.0,4136.3066,526.98,MoneySpot,0.0,4434454,0.0,08-01-2023,False,Medical Expenses,2023-01-08,Orange,0.0,8747.0,6723.14
0062x00000E5DgAAAV,0012x00000BIaK0AAL,Dee Why,NSW,Australia,Loan Paid,Existing Client-Granted Loan Before,0.13,84.91,830.8332,3.0,0.0,0.0,5.0,3.0,8979.0533,4.0,0.0,0.0,8365.1133,7928.0,1.0,0.0,0.0,1.0,6770.0,1500.0,3250.0,3300,4157.63,5.0,22.0,Monthly,39.0,8979.05,3300.0,Full-Time Employment,4.0,0.0,0.5604,1.0,0.0,593.0,1456.6666,831.53,QuickCash,0.0,5631298,1.0,16-06-2023,False,Life Event Expenses,2023-06-16,Orange,13.0,9430.0,8979.05
0062x00000DYXQLAA5,0012x00000hXhD6AAK,Eastwood,NSW,Australia,Closed Lost,New Client-New Loan,0.0,61.28,0.0,1.0,0.0,0.0,2.0,1.0,5782.867,1.0,0.0,0.0,621.685,13.72,0.0,0.0,0.0,1.0,7800.0,400.0,2200.0,3200,3770.45,9.0,9.286,Weekly,49.0,6280.53,3200.0,Self Employed,1.0,0.0,0.011,1.0,0.0,0.0,449.2733,418.94,MoneySpot,,5038946,0.0,11-04-2023,False,Living Expenses,2023-04-11,Orange,0.0,7544.0,6280.53
0062x00000DG2neAAD,0012x00000clyzKAAQ,Fairfield,NSW,Australia,Loan Paid,Existing Client-Granted Loan Before,0.0,36.77,847.9497,2.0,0.0,0.0,3.0,2.0,5364.2681,0.0,20.0,847.9515,2469.0342,2700.91,0.0,0.0,0.0,0.0,4550.0,599.0,250.0,3500,4216.18,8.0,15.857,Fortnightly,32.0,5364.27,3500.0,Casual Employment,0.0,0.0,0.0,0.0,5761.08,911.0,1117.55,527.03,MoneySpot,0.0,4700722,0.0,17-02-2023,False,Vehicle Expenses,2023-02-17,Green,0.0,7148.0,5364.27
0062x00000Ew4oCAAR,0012x000003F8pHAAS,Yagoona,NSW,Australia,Loan Paid,Existing Client-Granted Loan Before,0.0,87.32,1790.5272,1.0,0.0,0.0,3.0,1.0,7896.8036,16.0,93.0,0.0,1014.0153,1183.25,1.0,0.0,0.0,0.0,3436.33,1499.0,800.0,3500,4186.02,16.0,16.571,Weekly,32.0,9386.8,3500.0,Full-Time Employment,42.0,0.0,0.4066,13.0,4394.0666,660.0,1785.98,264.01,MoneySpot,0.0,6559149,1.0,17-09-2023,False,Vehicle Expenses,2023-09-17,Green,0.0,15775.0,9386.8
0062x00000E3WgtAAF,0012x00000dwekVAAQ,Bakewell,NT,Australia,Loan Paid,Existing Client-Granted Loan Before,0.0,84.91,5499.03,4.0,0.0,0.0,4.0,4.0,8548.6666,2.0,36.0,969.5111,2928.25,4836.0,1.0,0.0,0.0,1.0,7555.0,899.0,1600.0,3400,4180.02,10.0,19.857,Fortnightly,36.0,8642.0,3400.0,Full-Time Employment,2.0,0.0,0.967,0.0,0.0,2302.0,6187.1233,418.01,MoneySpot,0.0,5491959,2.0,03-06-2023,False,Vehicle Expenses,2023-06-03,Orange,0.0,9579.0,8642.0
0062x00000D1pCLAAZ,0012x00000TJQj6AAH,Point Pass,SA,Australia,Loan Paid,Existing Client-Granted Loan Before,0.0,88.12,4927.6417,1.0,5.0,0.0,3.0,1.0,8777.4188,23.0,122.0,1719.5038,1382.6771,1706.34,1.0,0.06,0.0,0.0,6440.78,899.0,577.0,3500,4201.96,16.0,16.0,Weekly,50.0,8075.75,5000.0,Full-Time Employment,23.0,0.0,0.1758,4.0,6452.4933,3015.0,7847.74,262.63,MoneySpot,0.0,4413125,15.0,05-01-2023,False,Home Maintenance & Repairs,2023-01-05,Orange,0.0,10776.0,8075.75
0062x00000DVVRyAAP,0012x00000WXo1hAAD,Frenchville,QLD,Australia,Loan Paid,Existing Client-Granted Loan Before,3.95,98.92,2840.7553,1.0,0.0,0.0,3.0,1.0,4595.2648,13.0,71.0,1136.1494,1057.5408,1057.54,1.0,0.0,0.0,0.0,4476.33,1499.0,400.0,3150,3965.87,24.0,24.143,Weekly,31.0,5146.73,3500.0,Full-Time Employment,14.0,0.0,0.044,4.0,4403.9833,2462.0,2695.2,165.25,MoneySpot,0.0,5452494,9.0,31-05-2023,False,Medical Expenses,2023-05-31,Green,174.0,4404.0,5146.73
0062x00000FHoy7AAD,0012x000002ajqOAAQ,Maudsland,QLD,Australia,Loan Paid,Existing Client-Granted Loan Before,1.61,46.72,1386.5496,1.0,0.0,0.0,2.0,1.0,5959.6439,0.0,54.0,1267.0945,1371.5346,1376.38,1.0,0.27,0.0,0.0,6123.33,400.0,600.0,3500,4202.25,16.0,16.0,Weekly,52.0,5959.64,3500.0,Full-Time Employment,0.0,0.0,0.044,0.0,5943.3166,1964.0,2135.3433,262.65,Financier-2,0.0,7203168,0.0,15-11-2023,False,Travel Expenses,2023-11-14,Green,101.0,6256.0,5959.64
0062x00000E5H6gAAF,0012x00000Wqq4cAAB,Cabramatta,NSW,Australia,Closed Lost,Existing Client-Granted Loan Before,0.0,75.46,2205.2119,1.0,0.0,0.0,2.0,1.0,4632.4696,0.0,71.0,365.55,924.1853,938.48,1.0,0.0,0.0,0.0,4103.79,400.0,400.0,3500,4185.99,16.0,16.571,Weekly,32.0,6378.47,3500.0,Part-Time Employment,0.0,0.0,0.3626,0.0,4004.8033,2521.0,2729.99,261.63,MoneySpot,,5637824,0.0,21-06-2023,False,Vehicle Expenses,2023-06-16,Green,0.0,7994.0,6378.47
0062x00000E4F7sAAF,0012x00000gmVxiAAE,Austral,NSW,Australia,Loan Paid,Existing Client-Granted Loan Before,20.86,61.95,1526.728,1.0,0.0,4.0,2.0,1.0,4598.4996,2.0,36.0,1027.6306,691.4925,915.37,0.0,0.05,0.0,0.0,0.0,599.0,1760.0,3500,4191.3,16.0,15.714,Weekly,40.0,4598.5,3500.0,Full-Time Employment,2.0,0.0,0.044,0.0,3958.2333,946.0,1941.8833,261.96,MoneySpot,-0.17,5552710,2.0,09-06-2023,False,Furniture or Appliances,2023-06-09,Green,1192.0,5712.0,4598.5
0062x00000EwiTYAAZ,0012800001SDTHFAA5,Niddrie,VIC,Australia,Loan Paid,Existing Client-Granted Loan Before,0.53,67.61,4785.1117,4.0,0.0,0.0,3.0,4.0,6561.0466,0.0,43.0,511.0,2087.0155,3006.63,1.0,1.87,0.0,0.0,0.0,400.0,0.0,3300,4251.15,15.0,29.857,Fortnightly,33.0,6561.05,3300.0,Full-Time Employment,0.0,0.0,0.2088,0.0,6261.0466,2665.0,5354.3233,283.42,QuickCash,0.0,6609809,0.0,22-09-2023,False,Home Maintenance & Repairs,2023-09-24,Orange,40.0,7505.0,6561.05
0062x00000DAOCdAAP,0012x00000XOFuZAAX,Tarneit,VIC,Australia,Loan Paid,Existing Client-Granted Loan Before,0.0,91.27,5775.9766,1.0,0.0,0.0,2.0,1.0,11068.123,7.0,87.0,3093.1583,2325.793,2745.05,1.0,0.0,0.0,0.0,2899.45,599.0,250.0,3500,4213.01,16.0,16.286,Weekly,41.0,11068.12,5000.0,Full-Time Employment,7.0,0.0,0.044,1.0,10078.4366,2877.0,5275.7266,263.32,MoneySpot,0.0,4627547,7.0,07-02-2023,False,Living Expenses,2023-02-07,Green,0.0,11090.0,11068.12
0062x00000D9HmjAAF,0012x00000gmeRTAAY,Millstream,QLD,Australia,Closed Lost,New Client-New Loan,0.0,58.55,445.8704,4.0,1.0,0.0,3.0,4.0,1334.9933,13.0,17.0,0.0,1334.9933,3322.15,0.0,0.0,0.0,0.0,0.0,0.0,300.0,3300,3884.79,9.0,9.571,Weekly,23.0,1334.99,3300.0,,13.0,0.0,0.7692,3.0,1334.9933,454.0,597.85,431.65,MoneySpot,,4575066,13.0,29-01-2023,False,Other,2023-01-29,Orange,0.0,1582.0,1334.99
0062x00000DXEMVAA5,0012x00000IMO9qAAH,Dry Creek,SA,Australia,Loan Paid,Existing Client-Granted Loan Before,7.8,34.73,2845.6994,2.0,1.0,2.0,3.0,2.0,5529.3174,11.0,0.0,2014.6236,1853.59,1853.59,1.0,0.0,0.0,1.0,0.0,599.0,600.0,3100,3922.8,12.0,24.0,Fortnightly,43.0,9211.41,5000.0,,11.0,0.0,0.3956,5.0,385.7466,2177.0,2846.6833,326.91,MoneySpot,-0.04,4961749,6.0,30-03-2023,False,Vehicle Expenses,2023-03-30,Green,618.0,7914.0,9211.41
0062x00000FHkw2AAD,0012x00000cyYI7AAM,Browns Plains,QLD,Australia,Closed Lost,Existing Client-Granted Loan Before,35.3,81.42,391.6866,4.0,0.0,4.0,1.0,4.0,8576.4456,0.0,14.0,0.0,595.49,22.25,0.0,0.0,0.0,1.0,0.0,400.0,410.0,3500,4377.37,12.0,24.143,Fortnightly,24.0,10328.2,3500.0,Part-Time Employment,0.0,0.0,0.0,0.0,3594.1933,177.0,568.9766,364.79,MoneySpot,,7196509,0.0,14-11-2023,False,Home Maintenance & Repairs,2023-11-14,Green,3892.0,11025.0,10328.2
0062x00000EeeOGAAZ,0010K00001iJM6RQAW,Boulder,WA,Australia,Loan Paid,Existing Client-Granted Loan Before,0.0,63.01,2109.8041,1.0,0.0,0.0,3.0,1.0,8602.6047,0.0,68.0,1343.4023,1632.885,1639.0,1.0,1.23,0.0,0.0,6066.67,400.0,0.0,3500,4416.28,25.0,26.143,Weekly,39.0,9045.94,5000.0,Full-Time Employment,0.0,0.0,0.0,0.0,6531.54,1798.0,3713.24,176.66,MoneySpot,0.0,6508567,0.0,13-09-2023,False,Vehicle Expenses,2023-09-12,Orange,0.0,9385.0,9045.94
0062x00000DHhQnAAL,0012x00000IMwoPAAT,Mount Sheridan,QLD,Australia,Loan Paid,Existing Client-Granted Loan Before,0.0,48.62,5380.2678,2.0,0.0,0.0,3.0,2.0,6757.0241,0.0,34.0,338.8417,1996.22,1904.45,0.0,0.0,0.0,0.0,3466.67,1500.0,300.0,3500,4288.74,11.0,20.857,Fortnightly,59.0,7509.93,3500.0,Full-Time Employment,0.0,0.0,0.0769,0.0,3992.44,1709.0,5408.3766,389.89,MoneySpot,0.0,4791927,0.0,03-03-2023,False,Other Expenses,2023-03-03,Orange,0.0,12582.0,7509.93
0062x00000FJ5ZFAA1,0012x00000TGqHDAA1,Waterloo,NSW,Australia,Closed Lost,Existing Client-Granted Loan Before,0.0,20.93,78384.0198,2.0,0.0,0.0,5.0,2.0,28670.6542,0.0,26.0,0.0,7649.6916,7649.69,0.0,0.72,0.0,0.0,7518.69,899.0,1000.0,3500,4556.34,18.0,34.857,Fortnightly,42.0,36421.33,3500.0,Full-Time Employment,0.0,0.0,0.5495,0.0,22716.9233,0.0,83748.0566,253.13,MoneySpot,,7300180,0.0,24-11-2023,False,Living Expenses,2023-11-23,Orange,0.0,37390.0,36421.33
0062x00000DGHXgAAP,0012x00000OvWQPAA3,Blacktown,NSW,Australia,Loan Paid,Existing Client-Granted Loan Before,0.0,51.61,1483.1905,1.0,0.0,0.0,2.0,1.0,8260.0414,0.0,33.0,173.8095,1821.3812,2271.5,0.0,0.0,0.0,1.0,3502.98,400.0,1120.0,3500,4274.61,19.0,19.429,Weekly,28.0,8260.04,5000.0,Full-Time Employment,0.0,0.0,0.044,0.0,0.0,289.0,1459.9033,224.99,MoneySpot,0.0,4714252,0.0,19-02-2023,False,Life Event Expenses,2023-02-19,Orange,0.0,8313.0,8260.04
0062x00000Ds5RcAAJ,0012x00000clyr1AAA,Langwarrin,VIC,Australia,Loan Paid,Existing Client-Granted Loan Before,0.0,96.87,2482.7573,4.0,1.0,0.0,6.0,4.0,30420.037,16.0,43.0,1469.7777,486.496,500.0,1.0,7.65,0.0,1.0,2026.5,899.0,1000.0,3200,4032.53,24.0,24.429,Weekly,24.0,8618.19,5000.0,Full-Time Employment,17.0,0.0,0.6374,10.0,3654.14,1379.0,4540.4233,168.03,MoneySpot,0.0,5219296,16.0,08-05-2023,False,Travel Expenses,2023-05-08,Green,0.0,56795.0,8618.19
0062x00000F2fCWAAZ,0012x00000g8rhcAAA,Bunbury,WA,Australia,Closed Lost,Existing Client-Granted Loan Before,0.59,36.66,511.0,2.0,0.0,0.0,1.0,2.0,478.3333,0.0,37.0,0.0,287.0,410.0,0.0,14.36,0.0,1.0,5850.0,1500.0,460.0,3500,4193.77,8.0,15.286,Fortnightly,27.0,7338.31,3500.0,Full-Time Employment,0.0,0.0,0.033,0.0,0.0,0.0,1950.2266,524.23,MoneySpot,,6987274,0.0,29-10-2023,False,Other Expenses,2023-10-28,Green,54.0,9117.0,7338.31
0062x00000DYvkOAAT,0012x00000IOLDRAA5,Wyndham Vale,VIC,Australia,Closed Lost,Existing Client-Granted Loan Before,4.24,98.95,1222.3415,1.0,1.0,2.0,3.0,1.0,6731.8616,16.0,8.0,0.0,809.9223,797.03,2.0,0.32,0.0,0.0,0.0,400.0,100.0,3500,4160.09,14.0,13.857,Weekly,27.0,6731.86,3500.0,Full-Time Employment,26.0,0.0,0.0,9.0,4961.5066,0.0,3995.1866,297.15,MoneySpot,,5061064,26.0,14-04-2023,False,Veterinary Expenses,2023-04-14,Orange,880.0,20754.0,6731.86
0062x00000DYwwVAAT,0012x000003DJfGAAW,Point Cook,VIC,Australia,Loan Paid,Existing Client-Granted Loan Before,0.0,94.92,5212.3881,4.0,2.0,0.0,4.0,4.0,2876.6666,8.0,93.0,0.0,245.0,400.0,0.0,3.42,0.0,1.0,25725.07,599.0,500.0,3500,4340.8,24.0,23.714,Weekly,56.0,7570.39,3500.0,Full-Time Employment,8.0,0.0,0.1099,3.0,924.7133,3007.0,7577.96,180.87,MoneySpot,0.0,5061929,8.0,14-04-2023,False,Vehicle Expenses,2023-04-14,Green,0.0,6987.0,7570.39
0062x00000EdFxBAAV,0012x00000TrVe5AAF,Wetherill Park,NSW,Australia,Loan Paid,Existing Client-Granted Loan Before,0.0,52.14,2627.3405,2.0,0.0,0.0,3.0,2.0,6224.5982,1.0,36.0,803.7605,2393.24,2664.57,1.0,0.16,0.0,0.0,4251.07,599.0,400.0,3500,4204.53,8.0,15.571,Fortnightly,52.0,10416.61,3500.0,Full-Time Employment,1.0,0.0,0.6593,0.0,5584.2266,863.0,3035.51,525.57,MoneySpot,0.0,6410333,0.0,03-09-2023,False,Travel Expenses,2023-09-03,Green,0.0,17836.0,10416.61
0062x00000EzKtXAAV,0012x00000fnA13AAE,Lakemba,NSW,Australia,Loan Paid,Existing Client-Granted Loan Before,0.0,46.03,3878.1156,1.0,0.0,0.0,2.0,1.0,11204.2493,10.0,105.0,873.6,1212.9814,1132.49,1.0,0.0,0.0,0.0,5200.0,899.0,1100.0,3500,4582.83,36.0,36.0,Weekly,37.0,10469.58,3500.0,Full-Time Employment,10.0,0.0,0.2088,0.0,5660.58,1688.0,4940.65,127.31,MoneySpot,0.0,6801548,1.0,11-10-2023,False,Vehicle Expenses,2023-10-11,Orange,0.0,21828.0,10469.58
0062x00000EMXboAAH,0012x00000kg7SxAAI,Narrogin,WA,Australia,Closed Lost,Existing Client-No Loan Granted Ever,0.0,15.98,0.0,4.0,0.0,0.0,2.0,4.0,2793.6033,0.0,0.0,0.0,1013.1012,1357.65,0.0,0.0,0.0,1.0,2383.33,400.0,160.0,3200,3891.14,8.0,15.857,Fortnightly,18.0,2807.1,3200.0,Full-Time Employment,0.0,0.0,0.6593,0.0,0.0,0.0,0.0,486.4,MoneySpot,,6108825,0.0,04-08-2023,False,Vehicle Expenses,2023-08-04,Orange,0.0,2960.0,2807.1
0062x00000D75RNAAZ,0012x00000MhUv5AAF,Springvale,VIC,Australia,Loan Paid,Existing Client-Granted Loan Before,0.0,88.03,2186.8737,1.0,0.0,0.0,4.0,1.0,4812.7029,1.0,79.0,0.0,784.9291,619.22,0.0,7.18,0.0,0.0,5621.97,400.0,100.0,3500,4276.78,20.0,20.0,Weekly,37.0,4817.7,5000.0,Full-Time Employment,1.0,0.0,0.0879,1.0,3139.7166,2131.0,4344.1,213.84,MoneySpot,0.0,4466442,1.0,13-01-2023,False,Living Expenses,2023-01-13,Orange,0.0,5225.0,4817.7
0062x00000GFOfKAAX,0012x00000BIIQDAA5,Biloela,QLD,Australia,Closed Lost,Existing Client-Granted Loan Before,0.0,51.78,6476.5968,1.0,0.0,0.0,3.0,1.0,8018.396,2.0,87.0,161.7298,1845.33,1994.0,0.0,1.58,0.0,0.0,2806.92,1499.0,1280.0,3150,3892.85,20.0,20.0,Weekly,23.0,8018.4,4750.0,Full-Time Employment,2.0,0.0,0.0,2.0,7996.43,2426.0,10072.5666,194.65,MoneySpot,,8552106,0.0,2024-03-21,False,Vehicle Expenses,2024-03-21,Green,0.0,8166.0,8018.4
0062x00000ENn4nAAD,0012x00000hYLvdAAG,Chatswood West,NSW,Australia,Closed Lost,Existing Client-No Loan Granted Ever,0.0,74.14,175.5933,2.0,1.0,0.0,4.0,2.0,302.3333,4.0,4.0,0.0,114.6666,40.0,0.0,0.0,0.0,1.0,3349.67,400.0,200.0,3500,4095.08,5.0,9.571,Fortnightly,37.0,427.83,3500.0,Full-Time Employment,4.0,0.0,0.0,0.0,0.0,0.0,252.26,819.02,MoneySpot,,6204942,4.0,14-08-2023,False,Other Expenses,2023-08-14,Orange,0.0,594.0,427.83
0062x00000DH8z9AAD,0012x00000IMPUzAAP,Sunshine West,VIC,Australia,Closed Lost,Existing Client-Granted Loan Before,0.0,77.57,2146.9994,1.0,0.0,0.0,3.0,1.0,4527.8204,0.0,44.0,1542.3599,936.9507,831.67,1.0,0.15,0.0,0.0,2317.01,400.0,250.0,3250,4088.44,24.0,24.429,Weekly,29.0,4527.82,5000.0,Full-Time Employment,0.0,0.0,0.7033,0.0,4060.12,2077.0,3385.7733,170.36,MoneySpot,,4763653,0.0,27-02-2023,False,Life Event Expenses,2023-02-27,Green,0.0,4825.0,4527.82
0062x00000ExSjTAAV,0012x000008GbCtAAK,Durack,NT,Australia,Loan Paid,Existing Client-Granted Loan Before,0.0,77.79,1515.6985,1.0,0.0,0.0,1.0,1.0,6367.6775,2.0,14.0,0.0,1248.7261,1190.46,0.0,3.54,0.0,0.0,3749.2,599.0,1000.0,3500,4340.29,24.0,23.714,Weekly,49.0,6226.01,5000.0,Full-Time Employment,2.0,0.0,0.0,0.0,5411.1466,770.0,1573.0333,180.85,MoneySpot,0.0,6664577,1.0,28-09-2023,False,Other Expenses,2023-09-28,Green,0.0,7337.0,6226.01
0062x00000FX2QQAA1,0012x00000g9fktAAA,Murray Bridge,SA,Australia,Loan Paid,Existing Client-Granted Loan Before,0.0,79.33,2596.8826,1.0,1.0,0.0,2.0,1.0,6710.0747,14.0,77.0,341.6532,917.98,910.98,0.0,0.02,0.0,0.0,0.0,400.0,440.0,3500,4201.73,16.0,16.0,Weekly,29.0,8403.41,3500.0,Full-Time Employment,20.0,0.0,0.011,14.0,3977.9133,1466.0,5551.99,262.61,MoneySpot,0.07,7718610,3.0,2024-01-03,False,Vehicle Expenses,2024-01-03,Orange,0.0,10618.0,8403.41
0062x00000DrrVuAAJ,0010K000022oMDdQAM,Doonside,NSW,Australia,Loan Paid,Existing Client-Granted Loan Before,0.0,59.19,3285.1493,1.0,0.0,0.0,2.0,1.0,6348.5783,0.0,46.0,374.1912,931.1715,1525.33,0.0,0.0,0.0,0.0,2600.0,1500.0,180.0,3350,4173.35,24.0,23.714,Weekly,29.0,9358.58,5000.0,Part-Time Employment,0.0,0.0,0.0,0.0,4035.0766,1961.0,3757.02,173.9,MoneySpot,0.0,5199500,0.0,05-05-2023,False,Travel Expenses,2023-05-04,Green,0.0,9720.0,9358.58
0062x00000DZwmvAAD,0012800001FMjJlAAL,Mundingburra,QLD,Australia,Closed Lost,Existing Client-Granted Loan Before,0.0,72.88,1726.9367,4.0,0.0,0.0,4.0,4.0,2664.3333,2.0,71.0,766.4574,1140.5,1116.0,0.0,42.63,0.0,0.0,1863.33,899.0,400.0,3500,4185.87,16.0,16.571,Weekly,27.0,4896.33,3500.0,Full-Time Employment,2.0,0.0,0.4176,0.0,2281.0,1287.0,2969.48,261.62,MoneySpot,,5126146,2.0,24-04-2023,False,Vehicle Expenses,2023-04-23,Orange,0.0,5524.0,4896.33
0062x00000DrTQNAA3,0012x00000bdKHZAA2,Nuriootpa,SA,Australia,Loan Paid,Existing Client-Granted Loan Before,0.52,75.13,2107.7736,2.0,0.0,0.0,4.0,2.0,4316.5046,0.0,40.0,1297.9064,1784.1383,1735.82,1.0,2.71,0.0,0.0,58000.0,599.0,600.0,3100,3907.42,12.0,23.571,Fortnightly,24.0,4316.5,4000.0,Full-Time Employment,0.0,0.0,0.033,0.0,3568.2766,1446.0,4791.4033,325.62,QuickCash,0.0,5170432,0.0,01-05-2023,False,Vehicle Expenses,2023-04-30,Green,26.0,4939.0,4316.5
0062x00000ECx00AAD,0012x00000gn6muAAA,Ryde,NSW,Australia,Loan Paid,Existing Client-Granted Loan Before,0.14,33.58,716.4341,2.0,0.0,0.0,3.0,2.0,3970.2741,0.0,9.0,0.0,1584.2371,1125.09,0.0,0.0,0.0,0.0,1920.0,599.0,1200.0,3500,4215.76,8.0,15.857,Fortnightly,29.0,5363.52,3500.0,Full-Time Employment,0.0,0.0,0.044,0.0,3696.5533,769.0,769.4333,526.97,MoneySpot,0.0,5909734,0.0,14-07-2023,False,Living Expenses,2023-07-14,Green,10.0,7040.0,5363.52
0062x00000ECNMJAA5,0012x00000KMMfgAAH,Moil,NT,Australia,Closed Lost,Existing Client-No Loan Granted Ever,27.6,86.42,413.6366,4.0,0.0,2.0,4.0,4.0,3200.5275,1.0,27.0,614.196,803.445,543.86,1.0,0.0,0.0,0.0,0.0,899.0,346.0,3500,4071.03,10.0,9.429,Weekly,33.0,3108.86,3500.0,Unemployed,1.0,0.0,0.0,1.0,2870.3766,523.0,649.4033,407.11,Financier-2,,5874530,1.0,10-07-2023,False,Living Expenses,2023-07-10,Orange,1263.0,4576.0,3108.86
0062x00000DtmLBAAZ,0012800001ZeeWFAAZ,West Mackay,QLD,Australia,Loan Paid,Existing Client-Granted Loan Before,0.0,21.87,2880.4434,3.0,0.0,0.0,5.0,3.0,8293.9166,0.0,45.0,1123.0235,8293.9166,8439.64,1.0,10.69,0.0,0.0,7150.0,1500.0,1500.0,3200,3935.22,4.0,16.714,Monthly,41.0,8293.92,3200.0,Casual Employment,4.0,0.0,0.0,3.0,8293.9166,2075.0,3361.9333,983.81,MoneySpot,0.0,5346628,0.0,22-05-2023,False,Life Event Expenses,2023-05-21,Green,0.0,10237.0,8293.92
0062x00000ED57mAAD,0012x00000Zuc7NAAR,High Wycombe,WA,Australia,Loan Paid,Existing Client-Granted Loan Before,0.0,99.25,715.038,1.0,0.0,0.0,4.0,1.0,4376.1466,0.0,13.0,0.0,1000.7669,1251.19,0.0,0.31,0.0,0.0,4585.33,400.0,200.0,3250,3927.72,16.0,15.857,Weekly,21.0,4407.75,3250.0,Full-Time Employment,0.0,0.0,0.0,0.0,4336.6566,713.0,786.6133,245.49,MoneySpot,0.0,5918390,0.0,15-07-2023,False,Medical Expenses,2023-07-14,Green,0.0,6177.0,4407.75
0062x00000FWTdjAAH,0012x000008IgBgAAK,Bonnells Bay,NSW,Australia,Loan Paid,Existing Client-Granted Loan Before,0.0,4.34,2534.7125,0.0,0.0,0.0,0.0,0.0,11886.6533,0.0,0.0,362.1973,0.0,0.0,0.0,0.0,0.0,0.0,4333.33,899.0,0.0,3500,4177.62,8.0,14.857,Fortnightly,61.0,15282.69,5000.0,Full-Time Employment,0.0,0.0,0.7473,0.0,9518.9266,884.0,3021.41,522.21,MoneySpot,0.0,7673982,0.0,29-12-2023,False,Travel Expenses,2023-12-29,Orange,0.0,11887.0,15282.69
0062x00000DVU94AAH,0012x00000LQayRAAT,Narrogin,WA,Australia,Loan Paid,Existing Client-Granted Loan Before,35.87,74.96,1736.7479,2.0,0.0,4.0,3.0,2.0,3960.3928,0.0,18.0,721.1357,1124.1516,1340.41,1.0,0.0,0.0,0.0,1700.0,599.0,0.0,3100,3927.77,12.0,24.143,Fortnightly,62.0,4048.43,3500.0,Full-Time Employment,0.0,0.0,0.0,0.0,3657.7133,664.0,1669.3433,327.32,MoneySpot,-0.26,5451202,0.0,31-05-2023,False,Home Maintenance & Repairs,2023-05-31,Green,1409.0,3927.0,4048.43
0062x00000FHpKMAA1,0010K00001xMHoxQAG,Algester,QLD,Australia,Loan Paid,Existing Client-Granted Loan Before,0.0,94.9,1505.9074,0.0,0.0,0.0,0.0,0.0,0.0,0.0,0.0,0.0,0.0,0.0,0.0,66.02,0.0,0.0,4333.33,899.0,100.0,3500,4331.07,22.0,22.429,Weekly,31.0,11415.36,3500.0,Casual Employment,0.0,0.0,0.0,0.0,10925.9233,934.0,1783.3566,196.87,MoneySpot,0.0,7204285,0.0,15-11-2023,False,Home Maintenance & Repairs,2023-11-14,Orange,0.0,2169.0,11415.36
0062x00000DsIGZAA3,0012x00000Oy1rUAAR,Zetland,NSW,Australia,Loan Paid,Existing Client-Granted Loan Before,0.0,75.7,6835.0517,2.0,0.0,0.0,3.0,2.0,18737.3034,1.0,43.0,675.8583,2925.62,2925.62,0.0,1.11,0.0,0.0,5633.33,599.0,1000.0,3500,4307.0,10.0,20.286,Fortnightly,22.0,29877.59,3500.0,Full-Time Employment,1.0,0.0,0.0,1.0,7601.24,1175.0,6950.2633,430.71,MoneySpot,0.0,5230638,1.0,09-05-2023,False,Life Event Expenses,2023-05-09,Green,0.0,60072.0,29877.59
0062x00000EM2OGAA1,0012x00000SI2FSAA1,Tingalpa,QLD,Australia,Loan Paid,Existing Client-Granted Loan Before,0.0,57.5,5349.7567,2.0,2.0,0.0,3.0,2.0,7093.4537,16.0,82.0,151.1942,3210.9428,3201.3,1.0,1.85,0.0,0.0,6525.41,599.0,720.0,3100,3763.34,8.0,15.286,Fortnightly,22.0,7123.22,3100.0,Full-Time Employment,16.0,0.0,0.1868,7.0,7492.2,2975.0,7158.8333,470.42,QuickCash,0.0,6075356,9.0,01-08-2023,False,Medical Expenses,2023-08-01,Green,0.0,11272.0,7123.22
0062x00000D9NDuAAN,0012x00000SHupzAAD,Rockville,QLD,Australia,Closed Lost,Existing Client-No Loan Granted Ever,0.0,89.28,1539.76,2.0,0.0,0.0,1.0,2.0,3929.7147,0.0,0.0,0.0,1808.7466,1590.03,0.0,0.0,0.0,0.0,2434.31,599.0,300.0,3500,4078.66,5.0,9.143,Fortnightly,25.0,4066.38,3500.0,Full-Time Employment,20.0,0.0,0.0,2.0,3617.4933,84.0,1673.92,815.74,MoneySpot,,4579421,9.0,30-01-2023,False,Vehicle Expenses,2023-01-29,Orange,0.0,4408.0,4066.38
0062x00000DWwgkAAD,0012x00000XBx3pAAD,Broadmeadows,VIC,Australia,Loan Paid,Existing Client-Granted Loan Before,0.0,90.13,3995.197,4.0,2.0,0.0,1.0,4.0,6212.1199,11.0,62.0,1653.7356,1881.8714,2213.78,1.0,3.53,0.0,0.0,3855.2,599.0,700.0,3100,3887.7,12.0,23.0,Fortnightly,26.0,6274.84,4000.0,Full-Time Employment,11.0,0.0,0.1538,6.0,4391.0333,1832.0,4992.5333,323.98,QuickCash,0.0,4946454,7.0,28-03-2023,False,Vehicle Expenses,2023-03-27,Green,0.0,6326.0,6274.84
0062x00000E4qeYAAR,0012x00000TH47DAAT,Corio,VIC,Australia,Closed Lost,Existing Client-No Loan Granted Ever,0.0,77.31,0.0,4.0,0.0,0.0,2.0,4.0,98.9899,0.0,0.0,0.0,40.7425,150.0,0.0,0.0,0.0,1.0,0.0,599.0,630.0,3500,4097.62,10.0,10.143,Weekly,29.0,6997.92,3500.0,Unemployed,2.0,0.0,0.011,0.0,858.4333,0.0,0.0,409.77,MoneySpot,,5603781,2.0,14-06-2023,False,Vehicle Expenses,2023-06-14,Orange,0.0,1195.0,6997.92
0062x00000ELWOWAA5,0012x00000MiPcVAAV,Logan Central,QLD,Australia,Loan Paid,Existing Client-Granted Loan Before,0.0,76.67,3702.782,1.0,0.0,0.0,3.0,1.0,5490.7071,15.0,97.0,1465.6633,1263.6153,1208.0,0.0,0.0,0.0,0.0,2142.75,400.0,400.0,3200,3873.63,16.0,15.857,Weekly,22.0,5490.71,3200.0,Full-Time Employment,15.0,0.0,0.0,7.0,5475.6666,2730.0,4507.8233,242.11,QuickCash,-0.28,6038462,12.0,28-07-2023,False,Home Maintenance & Repairs,2023-07-28,Green,0.0,6329.0,5490.71
0062x00000F02MDAAZ,0012x00000gpWsjAAE,BUTLER,SA,Australia,Loan Paid,Existing Client-Granted Loan Before,0.0,47.95,3456.7366,2.0,0.0,0.0,5.0,2.0,5902.9933,0.0,25.0,0.0,3220.796,5147.76,1.0,3.1,0.0,0.0,0.0,1500.0,680.0,3300,4306.99,7.0,30.286,Monthly,56.0,5902.99,3300.0,,0.0,0.0,0.0,0.0,5367.9933,642.0,3548.4666,615.29,MoneySpot,0.0,6851470,0.0,16-10-2023,False,Home Maintenance & Repairs,2023-10-16,Orange,0.0,6345.0,5902.99
0062x00000F3ZCZAA3,0012x00000Rrr5TAAR,Wyndham Vale,VIC,Australia,Closed Lost,Existing Client-Granted Loan Before,0.28,59.97,4050.4105,1.0,0.0,0.0,3.0,1.0,14694.1712,0.0,84.0,1643.173,1395.5358,1358.22,1.0,0.32,0.0,0.0,3300.0,599.0,2000.0,3500,4191.03,16.0,15.714,Weekly,40.0,14694.17,3500.0,Full-Time Employment,2.0,0.0,0.3407,0.0,10750.2,3428.0,7713.13,261.94,MoneySpot,,7059045,0.0,08-11-2023,False,Living Expenses,2023-11-03,Green,42.0,14998.0,14694.17
0062x00000FJI1JAAX,0010K00001g6vz1QAA,Edgeworth,NSW,Australia,Loan Paid,Existing Client-Granted Loan Before,6.83,73.66,2960.2503,4.0,0.0,4.0,4.0,4.0,21601.2314,0.0,12.0,0.0,684.5454,90.0,1.0,0.01,0.0,1.0,4766.67,599.0,600.0,3500,4548.68,16.0,32.571,Fortnightly,35.0,34417.23,5000.0,Full-Time Employment,0.0,0.0,0.1538,0.0,2828.1466,734.0,10392.7766,284.3,MoneySpot,0.0,7312888,0.0,25-11-2023,False,Vehicle Expenses,2023-11-25,Orange,2828.0,41369.0,34417.23
0062x00000DtQP7AAN,0012800001IzGBwAAN,Carindale,QLD,Australia,Closed Lost,Existing Client-Granted Loan Before,0.0,67.5,2992.3599,3.0,0.0,0.0,5.0,3.0,6490.65,0.0,13.0,1456.0892,6490.65,6211.61,1.0,0.0,0.0,0.0,0.0,1499.0,1240.0,3500,4265.96,7.0,16.143,Fortnightly,31.0,7003.98,3500.0,,0.0,0.0,0.3077,0.0,6490.65,1079.0,3059.0266,609.43,MoneySpot,,5312938,0.0,18-05-2023,False,Travel Expenses,2023-05-18,Orange,0.0,11402.0,7003.98
0062x00000DsbyLAAR,0010K000026MKClQAO,Wangaratta,VIC,Australia,Closed Lost,Existing Client-Granted Loan Before,0.0,99.39,189.8533,0.0,2.0,0.0,0.0,0.0,0.0,41.0,60.0,0.0,0.0,0.0,0.0,0.3,0.0,0.0,4277.0,400.0,255.0,3500,4196.74,16.0,15.857,Weekly,28.0,6386.91,3500.0,Full-Time Employment,55.0,0.0,0.4176,14.0,0.0,1077.0,1524.5266,262.3,MoneySpot,,5252009,12.0,12-05-2023,False,Relocation Expenses,2023-05-11,Orange,0.0,6680.0,6386.91
0062x00000Ezv0DAAR,0012x00000Tv1wWAAR,Lakemba,NSW,Australia,Loan Paid,Existing Client-Granted Loan Before,0.0,72.17,3312.2448,2.0,0.0,0.0,3.0,2.0,9958.2609,8.0,41.0,1884.5066,3325.2116,2829.07,0.0,0.34,1.0,0.0,4348.48,1500.0,0.0,3050,3887.3,12.0,24.571,Fortnightly,29.0,7224.42,3050.0,Full-Time Employment,8.0,0.0,0.2857,0.0,6650.4233,2713.0,4952.89,323.95,QuickCash,0.0,6844045,4.0,15-10-2023,False,Travel Expenses,2023-10-15,Green,0.0,11189.0,7224.42
0062x00000DVlcQAAT,0012x000002bOhNAAU,Spearwood,WA,Australia,Closed Lost,Existing Client-Granted Loan Before,0.0,26.34,1732.0366,2.0,0.0,0.0,3.0,2.0,12154.7495,0.0,30.0,1548.0508,4219.2033,4826.5,1.0,7.27,0.0,1.0,0.0,400.0,250.0,3100,3882.49,12.0,22.857,Fortnightly,53.0,12154.75,5000.0,,0.0,0.0,0.0659,0.0,2988.03,1865.0,2098.7833,323.55,MoneySpot,,5474895,0.0,02-06-2023,False,Travel Expenses,2023-06-01,Green,0.0,8317.0,12154.75
0062x00000DUdAqAAL,0012x000002cncMAAQ,Greenvale,VIC,Australia,Loan Paid,Existing Client-Granted Loan Before,0.0,70.34,4762.8104,1.0,0.0,0.0,5.0,1.0,11841.7728,0.0,73.0,1347.1976,1305.6153,1340.0,1.0,1.36,0.0,0.0,4368.0,1499.0,1560.0,3150,3976.61,24.0,24.429,Weekly,34.0,14752.32,5000.0,Full-Time Employment,0.0,0.0,0.8352,0.0,5657.6666,2502.0,4707.19,165.7,MoneySpot,0.0,5377276,0.0,24-05-2023,False,Home Maintenance & Repairs,2023-05-24,Green,0.0,19727.0,14752.32
0062x00000FJvStAAL,0012x00000kaJgZAAU,Derby,WA,Australia,Loan Paid,Existing Client-Granted Loan Before,0.0,65.48,1396.9533,4.0,0.0,0.0,3.0,4.0,6658.0008,0.0,26.0,94.9696,2193.1175,2471.36,1.0,1.48,0.0,0.0,4461.17,400.0,300.0,3500,4257.88,9.0,18.0,Fortnightly,30.0,7152.98,3500.0,Full-Time Employment,0.0,0.0,0.0,0.0,5848.3133,2672.0,7351.55,473.1,MoneySpot,0.0,7357054,0.0,30-11-2023,False,Vehicle Expenses,2023-11-30,Green,0.0,10370.0,7152.98
0062x00000E6nJGAAZ,0010K00002421R8QAI,Junee,NSW,Australia,Loan Paid,Existing Client-Granted Loan Before,0.0,88.36,7725.2734,2.0,1.0,0.0,3.0,2.0,11780.0287,4.0,40.0,1597.8115,5116.7257,4220.63,1.0,5.68,0.0,0.0,8233.33,1499.0,1000.0,3250,3950.2,8.0,16.0,Fortnightly,47.0,12506.42,3250.0,Full-Time Employment,4.0,0.0,0.7802,0.0,11939.0266,1988.0,9963.5133,493.78,MoneySpot,0.0,5769532,2.0,29-06-2023,False,Home Maintenance & Repairs,2023-06-29,Green,0.0,14902.0,12506.42
0062x00000DXccJAAT,0012x00000dwdlKAAQ,Blakeview,SA,Australia,Loan Paid,Existing Client-Granted Loan Before,0.23,56.79,2909.5398,2.0,0.0,1.0,5.0,2.0,9461.7406,0.0,70.0,1326.426,2338.7085,2273.81,1.0,0.0,0.0,0.0,7604.77,599.0,600.0,3100,3912.76,12.0,23.714,Fortnightly,43.0,19687.41,5000.0,Part-Time Employment,0.0,0.0,0.1209,0.0,9496.79,2163.0,4520.4566,326.07,MoneySpot,0.0,4987070,0.0,03-04-2023,False,Home Maintenance & Repairs,2023-04-03,Green,91.0,38526.0,19687.41
0062x00000DYmI5AAL,0012x00000XOomqAAD,Newman,WA,Australia,Loan Paid,Existing Client-Granted Loan Before,7.42,79.54,3434.7395,2.0,0.0,2.0,4.0,2.0,7445.824,0.0,55.0,720.158,2954.4583,2437.45,0.0,0.0,0.0,0.0,4766.67,599.0,0.0,3100,4189.76,7.0,14.143,Fortnightly,46.0,7445.82,3500.0,Full-Time Employment,2.0,0.0,0.0,2.0,6424.2633,2248.0,5761.94,537.15,MoneySpot,0.0,5053034,0.0,13-04-2023,False,Life Event Expenses,2023-04-13,Green,515.0,6934.0,7445.82
0062x00000DXVlGAAX,0012x00000SIKijAAH,Thornlands,QLD,Australia,Loan Paid,Existing Client-Granted Loan Before,0.0,72.65,7221.177,1.0,0.0,0.0,3.0,1.0,7632.4724,0.0,148.0,1260.0956,1248.9375,1258.0,1.0,0.0,0.0,1.0,1700.0,599.0,300.0,3350,4029.59,16.0,15.714,Weekly,24.0,1908.9,3350.0,Full-Time Employment,0.0,0.0,0.022,0.0,0.0,1645.0,7078.6433,251.85,MoneySpot,0.0,4978839,0.0,01-04-2023,False,Life Event Expenses,2023-04-01,Orange,0.0,11933.0,1908.9
0062x00000EzB18AAF,0012x00000WpuDfAAJ,Innaloo,WA,Australia,Loan Paid,Existing Client-Granted Loan Before,0.0,79.57,2494.3867,2.0,0.0,0.0,3.0,2.0,5527.1585,0.0,9.0,570.3342,2544.0085,2632.16,0.0,0.27,0.0,0.0,2794.19,899.0,950.0,3250,4172.01,15.0,29.286,Fortnightly,37.0,5527.16,3250.0,Full-Time Employment,0.0,0.0,0.0,0.0,5936.02,1393.0,2956.4233,278.14,MoneySpot,0.0,6790318,0.0,10-10-2023,False,Child Expenses,2023-10-10,Orange,0.0,7681.0,5527.16
0062x00000DZXqiAAH,0012x00000SGDR1AAP,Slacks Creek,QLD,Australia,Loan Paid,Existing Client-Granted Loan Before,0.0,49.72,1909.7926,1.0,0.0,0.0,3.0,1.0,6484.1735,0.0,90.0,4018.7341,1319.5276,1145.97,0.0,0.0,0.0,0.0,6489.51,400.0,100.0,3150,3961.36,24.0,24.0,Weekly,29.0,6484.17,5000.0,Full-Time Employment,0.0,0.0,0.3956,0.0,6218.4666,3493.0,4682.65,165.06,MoneySpot,0.0,5099459,0.0,20-04-2023,False,Vehicle Expenses,2023-04-20,Green,0.0,6535.0,6484.17
0062x00000FhNUPAA3,0010K00001xOgrHQAS,Drouin,VIC,Australia,Loan Paid,Existing Client-Granted Loan Before,0.22,55.22,2945.9262,1.0,0.0,0.0,4.0,1.0,8648.0661,0.0,31.0,0.0,1868.5053,2138.69,1.0,0.24,0.0,0.0,6881.33,899.0,100.0,3500,4250.51,18.0,18.286,Weekly,34.0,8648.07,3500.0,Full-Time Employment,0.0,0.0,0.0,0.0,8309.1566,1174.0,2711.7,236.14,MoneySpot,0.0,7891123,0.0,2024-01-17,False,Other Expenses,2024-01-17,Orange,41.0,18470.0,8648.07
0062x00000F8lveAAB,0012x00000fmRLrAAM,Brassall,QLD,Australia,Loan Paid,Existing Client-Granted Loan Before,0.0,67.1,2961.436,1.0,1.0,0.0,3.0,1.0,4870.7665,22.0,49.0,0.0,995.9207,1093.85,4.0,0.98,0.0,0.0,3800.33,1499.0,0.0,3500,4351.97,24.0,24.0,Weekly,44.0,4870.77,3500.0,Full-Time Employment,22.0,0.0,0.022,0.0,4647.63,1094.0,4504.2366,181.34,MoneySpot,0.0,6876689,8.0,19-10-2023,False,Life Event Expenses,2023-10-18,Green,0.0,6004.0,4870.77
0062x00000DrFkFAAV,0012x00000GeBk1AAF,Oaklands Park,SA,Australia,Loan Paid,Existing Client-Granted Loan Before,0.0,59.51,2662.0647,1.0,0.0,0.0,2.0,1.0,7405.4756,6.0,58.0,748.3925,1006.6423,1143.65,0.0,1.99,0.0,0.0,1100.0,899.0,880.0,3350,4070.55,18.0,17.857,Weekly,26.0,7456.48,3500.0,Full-Time Employment,6.0,0.0,0.1429,3.0,4362.1166,1565.0,3637.8033,226.15,MoneySpot,0.0,5154658,4.0,28-04-2023,False,Vehicle Expenses,2023-04-28,Green,0.0,9298.0,7456.48
0062x00000Dt4TvAAJ,0010K0000240umfQAA,Sandringham,VIC,Australia,Closed Lost,Existing Client-Granted Loan Before,0.0,19.48,631.84,2.0,0.0,0.0,4.0,2.0,3614.0615,0.0,2.0,303.0528,1663.4585,408.85,1.0,0.7,0.0,0.0,5200.0,599.0,250.0,3050,3842.49,12.0,23.286,Fortnightly,46.0,4021.96,5000.0,Full-Time Employment,0.0,0.0,0.0,0.0,3881.4033,3008.0,6385.51,320.21,MoneySpot,,5284639,0.0,20-05-2023,False,Vehicle Expenses,2023-05-16,Green,0.0,4566.0,4021.96
0062x00000F8jmtAAB,0012x00000cKsifAAC,Ellenbrook,WA,Australia,Loan Paid,Existing Client-Granted Loan Before,0.07,34.75,2053.3738,2.0,0.0,0.0,1.0,2.0,13594.3885,0.0,20.0,0.0,6257.1433,7210.0,1.0,0.0,0.0,0.0,15166.67,1499.0,300.0,3500,4869.7,12.0,49.714,Monthly,31.0,13692.56,3500.0,Full-Time Employment,0.0,0.0,0.0,0.0,12514.2866,919.0,2161.7066,405.82,MoneySpot,0.0,6874207,0.0,18-10-2023,False,Life Event Expenses,2023-10-18,Orange,14.0,18848.0,13692.56
0062x00000E4RxYAAV,0012x00000THef3AAD,Kippa-Ring,QLD,Australia,Loan Paid,Existing Client-Granted Loan Before,0.0,63.74,3570.281,4.0,0.0,0.0,4.0,4.0,7752.2033,4.0,5.0,1451.868,2325.66,3438.5,1.0,0.0,0.0,1.0,7443.43,1499.0,850.0,3500,4360.44,12.0,23.714,Fortnightly,52.0,7752.2,3500.0,Full-Time Employment,4.0,0.0,0.0,2.0,0.0,2063.0,3490.5166,363.38,MoneySpot,0.0,5574378,1.0,11-06-2023,False,Life Event Expenses,2023-06-11,Orange,0.0,8884.0,7752.2
0062x00000ENmxRAAT,0012x00000hWfHzAAK,Grafton,NSW,Australia,Closed Lost,Existing Client-Granted Loan Before,0.77,57.96,3806.8913,1.0,0.0,0.0,3.0,1.0,7887.4887,0.0,101.0,234.4256,1815.203,1376.93,1.0,0.0,0.0,0.0,0.0,599.0,500.0,3250,3878.33,14.0,14.429,Weekly,38.0,10512.28,3250.0,Full-Time Employment,0.0,0.0,0.4396,0.0,7865.88,948.0,3831.4166,277.03,MoneySpot,,6204765,0.0,14-08-2023,False,Other Expenses,2023-08-13,Orange,83.0,10646.0,10512.28
0062x00000EyhsaAAB,0012800001SDTvUAAX,Blacktown,NSW,Australia,Loan Paid,Existing Client-Granted Loan Before,0.0,69.74,5713.2554,2.0,0.0,0.0,3.0,2.0,8021.1852,2.0,49.0,0.0,3691.9428,3136.77,0.0,21.05,0.0,0.0,0.0,899.0,1760.0,3500,4215.6,8.0,15.857,Fortnightly,51.0,8021.19,3500.0,,2.0,0.0,0.1429,0.0,8614.5333,857.0,5914.4166,526.95,QuickCash,0.0,6756292,1.0,06-10-2023,False,Furniture or Appliances,2023-10-05,Green,0.0,10926.0,8021.19
0062x00000Ez3IPAAZ,0012x00000XMRPgAAP,Hillsdale,NSW,Australia,Loan Paid,Existing Client-Granted Loan Before,0.51,57.51,578.6684,4.0,0.0,2.0,2.0,4.0,12226.9208,0.0,11.0,962.5913,2750.0587,3002.63,1.0,12.75,0.0,0.0,2900.0,400.0,100.0,3100,3763.92,8.0,15.286,Fortnightly,48.0,11704.97,3100.0,Full-Time Employment,0.0,0.0,0.0,0.0,7341.2466,2407.0,3343.6466,470.5,MoneySpot,0.0,6781126,0.0,09-10-2023,False,Travel Expenses,2023-10-08,Green,79.0,15322.0,11704.97
0062x00000FK7JBAA1,0012800001FzYDSAA3,Miles End,QLD,Australia,Loan Paid,Existing Client-Granted Loan Before,0.0,26.25,3388.3596,4.0,0.0,0.0,4.0,4.0,12675.88,0.0,84.0,2531.1881,4019.78,2208.0,0.0,0.0,0.0,0.0,6933.33,1499.0,1640.0,3500,4196.07,16.0,15.857,Weekly,35.0,12675.88,3500.0,Full-Time Employment,0.0,0.0,0.033,0.0,12059.34,3175.0,4464.46,262.26,MoneySpot,0.0,7368444,0.0,01-12-2023,False,Life Event Expenses,2023-12-01,Green,0.0,16087.0,12675.88
0062x00000DYdaCAAT,0012x00000foYPWAA2,Calamvale,QLD,Australia,Closed Lost,Existing Client-Granted Loan Before,22.81,53.1,848.5908,1.0,0.0,4.0,2.0,1.0,4093.5445,1.0,30.0,1024.0,705.7869,735.85,0.0,0.0,0.0,0.0,3126.1,400.0,0.0,3500,4165.41,14.0,14.0,Weekly,49.0,627.22,3500.0,Full-Time Employment,2.0,0.0,0.0,0.0,3967.1166,609.0,1974.8633,297.53,MoneySpot,,5044697,1.0,17-04-2023,False,Furniture or Appliances,2023-04-12,Orange,909.0,3985.0,627.22
0062x00000E4xP2AAJ,0012x00000dxpqAAAQ,Torbanlea,QLD,Australia,Loan Paid,Existing Client-Granted Loan Before,0.0,86.96,603.1475,1.0,6.0,0.0,3.0,1.0,4691.1472,9.0,44.0,1495.4354,1233.836,1135.36,1.0,0.09,0.0,0.0,3423.33,1499.0,600.0,3500,4202.22,16.0,16.0,Weekly,22.0,4691.15,3500.0,Full-Time Employment,9.0,0.0,0.3516,6.0,4112.7866,1664.0,3222.0533,262.64,Financier-2,0.0,5612257,9.0,15-06-2023,False,Vehicle Expenses,2023-06-14,Green,0.0,5550.0,4691.15
0062x00000DtGqqAAF,0012x00000XO5NBAA1,Saint Marys,NSW,Australia,Loan Paid,Existing Client-Granted Loan Before,0.0,52.62,5241.7114,1.0,0.0,0.0,1.0,1.0,2366.6665,3.0,9.0,2286.0102,78.125,50.0,0.0,0.0,0.0,1.0,9913.93,599.0,1000.0,3500,4282.19,20.0,20.143,Weekly,46.0,12217.2,3500.0,Full-Time Employment,3.0,0.0,0.0,0.0,0.0,3302.0,5935.0833,214.11,MoneySpot,0.01,5299862,1.0,17-05-2023,False,Life Event Expenses,2023-05-17,Orange,0.0,12507.0,12217.2
0062x00000E5eY0AAJ,0012x00000XLtqgAAD,Griffith,NSW,Australia,Loan Paid,Existing Client-Granted Loan Before,0.0,9.98,633.1442,1.0,0.0,0.0,2.0,1.0,6113.1823,0.0,39.0,872.5021,1332.459,1291.93,0.0,1.39,0.0,0.0,4333.33,400.0,400.0,3500,4202.19,16.0,16.0,Weekly,34.0,6113.18,3500.0,Contract Employment,0.0,0.0,0.0,0.0,4885.6833,993.0,1150.2733,262.64,MoneySpot,-0.04,5669417,0.0,21-06-2023,False,Travel Expenses,2023-06-20,Green,0.0,6524.0,6113.18
0062x00000E6KR6AAN,0012x00000INLIXAA5,Caboolture,QLD,Australia,Loan Paid,Existing Client-Granted Loan Before,0.29,43.33,1623.6811,1.0,0.0,0.0,2.0,1.0,9283.7628,0.0,38.0,0.0,1831.3178,2055.27,0.0,0.0,0.0,0.0,4744.26,599.0,2800.0,3200,3888.75,16.0,16.286,Weekly,53.0,9283.76,3200.0,Full-Time Employment,0.0,0.0,0.011,0.0,8546.15,1205.0,2415.7866,243.05,QuickCash,0.0,5729658,0.0,26-06-2023,False,Vehicle Expenses,2023-06-26,Green,26.0,8905.0,9283.76
0062x00000FJIUzAAP,0012x00000cwnDkAAI,Colyton,NSW,Australia,Loan Paid,Existing Client-Granted Loan Before,0.0,58.07,3974.9075,1.0,0.0,0.0,1.0,1.0,10373.2176,0.0,56.0,0.0,2302.8776,2161.36,1.0,0.96,0.0,0.0,2000.0,599.0,1500.0,3500,4218.35,16.0,16.429,Weekly,46.0,10443.73,3500.0,Full-Time Employment,0.0,0.0,0.0,0.0,9979.1366,908.0,3984.9266,263.65,QuickCash,0.0,7313446,0.0,25-11-2023,False,Other Expenses,2023-11-25,Green,0.0,10612.0,10443.73
0062x00000EMBZYAA5,0012x000003F2o8AAC,Middlebrook,QLD,Australia,Loan Paid,Existing Client-Granted Loan Before,0.0,99.61,579.5013,2.0,0.0,0.0,3.0,2.0,7460.2684,0.0,6.0,0.0,3433.7683,3624.05,0.0,0.0,0.0,0.0,0.0,899.0,600.0,3500,4188.13,8.0,15.143,Fortnightly,38.0,7460.27,3500.0,Full-Time Employment,0.0,0.0,0.0,0.0,6867.5366,533.0,563.46,523.52,QuickCash,0.0,6085350,0.0,02-08-2023,False,Medical Expenses,2023-08-02,Green,0.0,6957.0,7460.27
0062x00000DrJRuAAN,0012x00000FEzn9AAD,Loganlea,QLD,Australia,Loan Paid,Existing Client-Granted Loan Before,19.81,46.7,1965.4173,4.0,0.0,2.0,4.0,4.0,4816.1405,0.0,42.0,1155.1598,1549.9342,1806.87,2.0,0.0,0.0,0.0,4049.5,599.0,1500.0,3100,3887.64,12.0,23.0,Fortnightly,36.0,4837.47,5000.0,Full-Time Employment,0.0,0.0,0.0549,0.0,4904.8833,1063.0,3067.7033,323.97,MoneySpot,0.0,5156948,0.0,02-05-2023,False,Medical Expenses,2023-05-01,Green,1288.0,6499.0,4837.47
0062x00000DJ0UpAAL,0012x00000bno0IAAQ,Bankstown,NSW,Australia,Loan Paid,Existing Client-Granted Loan Before,0.0,68.28,841.9033,1.0,0.0,0.0,3.0,1.0,10585.9777,0.0,45.0,984.918,1069.3841,1092.06,0.0,0.0,0.0,0.0,0.0,899.0,550.0,3500,4282.18,20.0,20.143,Weekly,24.0,10761.82,3900.0,,0.0,0.0,0.011,0.0,4277.5366,1829.0,3530.25,214.11,MoneySpot,0.01,4867024,0.0,15-03-2023,False,Other Expenses,2023-03-15,Orange,0.0,16148.0,10761.82
0062x00000FVcHGAA1,0012x00000gpa8KAAQ,Prestons,NSW,Australia,Loan Paid,Existing Client-Granted Loan Before,0.0,54.47,1451.2519,1.0,0.0,0.0,3.0,1.0,13824.5095,0.0,16.0,0.0,2434.4242,2410.39,0.0,0.89,0.0,0.0,0.0,1499.0,400.0,3500,4196.81,16.0,15.857,Weekly,49.0,13824.51,3500.0,Full-Time Employment,0.0,0.0,0.0879,0.0,11360.6466,1073.0,2706.0266,262.31,MoneySpot,0.0,7606171,0.0,22-12-2023,False,Other Expenses,2023-12-22,Green,0.0,14489.0,13824.51
0062x00000Eb975AAB,0012x00000khIGBAA2,Labrador,QLD,Australia,Closed Lost,New Client-New Loan,11.61,83.91,0.0,1.0,0.0,2.0,5.0,1.0,15688.2801,0.0,2.0,0.0,2958.3333,2850.0,0.0,0.54,0.0,0.0,0.0,0.0,1000.0,3300,3885.25,9.0,9.571,Weekly,50.0,18563.36,3300.0,self_employed_contract,0.0,0.0,0.0,0.0,4510.3333,0.0,15.1333,431.7,MoneySpot,,6271209,0.0,20-08-2023,False,Car Other,2023-08-19,Orange,1552.0,13361.0,18563.36
0062x00000EOMeiAAH,0012x00000hWvIcAAK,Redbank Plains,QLD,Australia,Loan Paid,Existing Client-Granted Loan Before,0.0,79.13,3976.0199,1.0,0.0,0.0,3.0,1.0,4212.9957,0.0,97.0,0.0,910.1146,903.68,0.0,0.0,0.0,0.0,0.0,599.0,460.0,3100,4003.26,30.0,29.857,Weekly,28.0,4213.0,3100.0,Full-Time Employment,0.0,0.0,0.0659,0.0,3943.83,1042.0,4746.7433,133.45,MoneySpot,-0.17,6253031,0.0,18-08-2023,False,Travel Expenses,2023-08-18,Orange,0.0,4787.0,4213.0
0062x00000FiDoSAAV,0012x00000ha2hDAAQ,Tumut,NSW,Australia,Closed Lost,Existing Client-Granted Loan Before,0.0,79.54,717.0418,4.0,0.0,0.0,1.0,4.0,4097.695,0.0,6.0,664.64,98.7712,160.0,1.0,67.7,0.0,1.0,180000.0,400.0,2400.0,3500,4301.69,10.0,20.143,Fortnightly,27.0,24633.71,5000.0,Full-Time Employment,0.0,0.0,0.0549,0.0,0.0,990.0,1874.24,430.18,MoneySpot,,7966596,0.0,2024-01-23,False,Living Expenses,2024-01-22,Orange,0.0,10235.0,24633.71
0062x00000DZ1lsAAD,0012x00000VdzL6AAJ,Cairnlea,VIC,Australia,Loan Paid,Existing Client-Granted Loan Before,0.0,76.44,2032.3378,2.0,1.0,0.0,4.0,2.0,9016.4327,2.0,21.0,1368.2532,1602.3428,2209.67,0.0,0.0,0.0,0.0,4680.01,599.0,600.0,3300,4106.34,11.0,21.857,Fortnightly,26.0,5720.1,3550.0,Part-Time Employment,2.0,0.0,0.0659,2.0,5177.28,1399.0,2869.7666,373.31,MoneySpot,0.0,5067568,2.0,15-04-2023,False,Home Maintenance & Repairs,2023-04-15,Green,0.0,16715.0,5720.1
0062x00000FJAmaAAH,0012x00000GdzhEAAR,Villawood,NSW,Australia,Loan Paid,Existing Client-Granted Loan Before,0.0,59.59,3742.962,1.0,0.0,0.0,3.0,1.0,6683.4143,0.0,78.0,1239.4931,965.676,1345.98,2.0,2.31,0.0,0.0,4896.67,599.0,694.0,3500,4346.18,24.0,23.857,Weekly,31.0,11236.43,3500.0,Casual Employment,0.0,0.0,0.0,0.0,1609.46,2444.0,4384.2566,181.1,MoneySpot,0.0,7303561,0.0,24-11-2023,False,Living Expenses,2023-11-24,Green,0.0,11015.0,11236.43
0062x00000EDZznAAH,0012x00000cKFbPAAW,Seville Grove,WA,Australia,Loan Paid,Existing Client-Granted Loan Before,0.0,69.17,0.0,1.0,0.0,0.0,4.0,1.0,8506.1181,2.0,104.0,0.0,1957.5725,2062.0,1.0,0.36,0.0,0.0,8796.67,599.0,1520.0,3250,3937.91,16.0,16.143,Weekly,54.0,8536.45,3250.0,Full-Time Employment,2.0,0.0,0.0,1.0,7830.29,5673.0,8868.0533,246.13,MoneySpot,0.0,5952588,2.0,20-07-2023,False,Home Maintenance & Repairs,2023-07-20,Green,0.0,34039.0,8536.45
0062x00000FWMGfAAP,0012x00000WYiVCAA1,Wahroonga,NSW,Australia,Loan Paid,Existing Client-Granted Loan Before,0.0,32.6,1301.0911,2.0,0.0,0.0,3.0,2.0,6382.0966,0.0,24.0,524.8179,2682.1771,2421.43,1.0,0.31,0.0,0.0,4518.0,400.0,520.0,3500,4220.98,8.0,16.0,Fortnightly,35.0,6382.1,3500.0,Full-Time Employment,0.0,0.0,0.0,0.0,6258.4133,1642.0,1935.2866,527.63,MoneySpot,0.0,7663354,0.0,28-12-2023,False,Life Event Expenses,2023-12-28,Green,0.0,7111.0,6382.1
0062x00000EzSEjAAN,0012800001YIjrHAAT,Northmead,NSW,Australia,Loan Paid,Existing Client-Granted Loan Before,0.0,36.38,2593.3977,2.0,0.0,0.0,3.0,2.0,5558.1241,0.0,7.0,1208.6063,1897.0671,2126.27,1.0,0.0,0.0,1.0,4116.67,599.0,560.0,3500,4603.69,18.0,36.0,Fortnightly,59.0,5558.12,3500.0,Full-Time Employment,0.0,0.0,0.0,0.0,0.0,2685.0,2859.02,255.77,MoneySpot,0.0,6809917,0.0,12-10-2023,False,Home Maintenance & Repairs,2023-10-11,Orange,0.0,7359.0,5558.12
0062x00000DWJ3oAAH,0012x00000dblt6AAA,Margate,QLD,Australia,Loan Paid,Existing Client-Granted Loan Before,2.83,59.28,1832.5293,2.0,0.0,0.0,2.0,2.0,5791.6293,0.0,47.0,944.3767,1821.0714,1799.5,1.0,0.57,0.0,0.0,5484.71,899.0,1200.0,3100,3923.27,12.0,24.0,Fortnightly,38.0,6177.52,5000.0,Part-Time Employment,0.0,0.0,0.0,0.0,6039.4933,1953.0,2735.0,326.95,MoneySpot,0.0,4909183,0.0,22-03-2023,False,Relocation Expenses,2023-03-21,Green,250.0,8828.0,6177.52
0062x00000DG2gLAAT,0012x00000TrdllAAB,Balmoral,QLD,Australia,Loan Paid,Existing Client-Granted Loan Before,0.0,84.91,1635.8909,1.0,0.0,0.0,2.0,1.0,7234.291,0.0,38.0,1067.8249,790.1738,814.73,0.0,8.44,0.0,0.0,2616.94,400.0,200.0,3200,3937.69,20.0,19.714,Weekly,22.0,7094.46,3200.0,Full-Time Employment,0.0,0.0,0.022,0.0,4124.0866,1340.0,2372.73,196.89,MoneySpot,0.0,4700045,0.0,17-02-2023,False,Vehicle Expenses,2023-02-16,Green,0.0,12079.0,7094.46
0062x00000E3lglAAB,0012800001WbmjaAAB,Grafton,NSW,Australia,Loan Paid,Existing Client-Granted Loan Before,0.0,76.95,1222.23,4.0,0.0,0.0,1.0,4.0,10313.4502,1.0,23.0,0.0,496.5,700.0,0.0,67.98,0.0,1.0,3263.0,599.0,900.0,3500,4374.16,24.0,24.571,Weekly,42.0,18814.56,3500.0,Full-Time Employment,1.0,0.0,0.1648,0.0,2550.0,1289.0,1360.5266,182.26,MoneySpot,-0.22,5516155,1.0,06-06-2023,False,Furniture or Appliances,2023-06-05,Orange,0.0,12339.0,18814.56
0062x00000FJu4bAAD,0012x00000TGzB9AAL,Tugun,QLD,Australia,Loan Paid,Existing Client-Granted Loan Before,0.0,41.11,4313.0398,2.0,0.0,0.0,2.0,2.0,11864.7613,0.0,73.0,391.0714,3010.1842,3739.09,1.0,2.17,0.0,0.0,9204.04,599.0,750.0,3500,4215.27,8.0,15.857,Fortnightly,59.0,11864.76,3500.0,Full-Time Employment,0.0,0.0,0.1319,0.0,11048.17,1949.0,4701.19,526.91,MoneySpot,0.0,7355811,0.0,30-11-2023,False,Travel Expenses,2023-11-30,Green,0.0,15223.0,11864.76
0062x00000Dr1r5AAB,0012x00000g8xxaAAA,West Kempsey,NSW,Australia,Loan Paid,Existing Client-Granted Loan Before,0.0,69.67,1899.5664,2.0,0.0,0.0,3.0,2.0,5387.6293,0.0,12.0,0.0,2082.7233,1703.75,0.0,0.0,0.0,0.0,4333.33,400.0,300.0,3500,4226.52,8.0,16.143,Fortnightly,43.0,5387.63,3500.0,Full-Time Employment,0.0,0.0,0.4835,0.0,4165.4466,1043.0,2255.4566,528.32,Financier-2,-0.09,5142040,0.0,26-04-2023,False,Vehicle Expenses,2023-04-26,Green,0.0,6445.0,5387.63
0062x00000DXVrHAAX,0012x00000fnHqxAAE,Manly,NSW,Australia,Closed Lost,Existing Client-Granted Loan Before,0.39,78.58,481.2,1.0,0.0,0.0,3.0,1.0,1106.6666,1.0,3.0,35.2,474.2857,1550.0,0.0,0.17,0.0,1.0,5633.33,400.0,0.0,3500,4137.27,4.0,9.714,Fortnightly,41.0,29636.57,3500.0,Full-Time Employment,1.0,0.0,0.011,0.0,0.0,279.0,772.8866,1034.32,MoneySpot,,4977918,1.0,02-04-2023,False,Medical Expenses,2023-04-01,Orange,126.0,31977.0,29636.57
0062x00000EdG49AAF,0012x000008KDGVAA4,Secret Harbour,WA,Australia,Closed Lost,Existing Client-No Loan Granted Ever,22.75,85.85,0.0,0.0,1.0,0.0,0.0,0.0,0.0,4.0,3.0,0.0,0.0,0.0,0.0,1.03,0.0,0.0,2383.33,400.0,100.0,3050,3622.14,9.0,9.571,Weekly,28.0,1476.61,3050.0,Unemployed,6.0,0.0,0.0,0.0,0.0,0.0,4.6366,402.47,QuickCash,,6410092,1.0,03-09-2023,False,Vehicle Expense,2023-09-02,Orange,1102.0,4843.0,1476.61
0062x00000D7JYLAA3,0012x00000LShyoAAD,Oran Park,NSW,Australia,Loan Paid,Existing Client-Granted Loan Before,0.0,63.4,3689.7753,1.0,0.0,0.0,3.0,1.0,8262.0838,0.0,65.0,992.3185,1563.6469,492.57,0.0,0.0,0.0,0.0,6500.0,400.0,350.0,3500,4191.54,16.0,15.714,Weekly,31.0,8262.08,5000.0,Casual Employment,0.0,0.0,0.0,0.0,6775.8033,1915.0,3805.9166,261.98,MoneySpot,0.0,4477842,0.0,14-01-2023,False,Furniture or Appliances,2023-01-14,Orange,0.0,11228.0,8262.08
0062x00000DZ7FMAA1,0010K000023NlT6QAK,Balaclava,VIC,Australia,Loan Paid,Existing Client-Granted Loan Before,0.0,58.85,6330.898,2.0,0.0,0.0,5.0,2.0,10964.7788,9.0,81.0,0.0,5002.31,5002.31,0.0,0.0,0.0,0.0,7663.5,1499.0,2673.0,3500,4215.9,8.0,15.857,Fortnightly,44.0,10992.78,3500.0,Full-Time Employment,9.0,0.0,0.956,1.0,11672.0566,1942.0,6995.5933,526.99,MoneySpot,0.0,5074171,2.0,16-04-2023,False,Home Maintenance & Repairs,2023-04-16,Green,0.0,12575.0,10992.78
0062x00000FUfaGAAT,0012x000002cyFjAAI,Melton West,VIC,Australia,Loan Paid,Existing Client-Granted Loan Before,0.0,64.84,0.0,4.0,0.0,0.0,3.0,4.0,1086.1432,0.0,26.0,0.0,492.8,445.2,0.0,30.0,0.0,1.0,4766.67,599.0,400.0,3500,4191.41,16.0,15.714,Weekly,58.0,8280.3,3500.0,Full-Time Employment,0.0,0.0,0.2967,0.0,0.0,1287.0,3660.2366,261.97,MoneySpot,0.0,7529717,0.0,16-12-2023,False,Vehicle Expenses,2023-12-15,Green,0.0,8221.0,8280.3
0062x00000FUQYGAA5,0012x00000g9mGcAAI,Pakenham,VIC,Australia,Loan Paid,Existing Client-Granted Loan Before,0.0,19.82,1309.3632,3.0,0.0,0.0,4.0,3.0,8365.31,2.0,18.0,1174.041,8365.31,8365.31,0.0,0.56,0.0,0.0,5576.87,1499.0,180.0,3500,4306.17,4.0,17.714,Monthly,41.0,8365.31,3500.0,Full-Time Employment,2.0,0.0,0.011,0.0,8365.31,926.0,2431.3866,1076.55,MoneySpot,0.0,7508046,0.0,15-12-2023,False,Travel Expenses,2023-12-14,Green,0.0,10222.0,8365.31
0062x00000Ed6MrAAJ,0012x00000gnTpYAAU,Warrawong,NSW,Australia,Loan Paid,Existing Client-Granted Loan Before,35.54,72.04,1028.9118,2.0,0.0,1.0,4.0,2.0,7199.7786,0.0,15.0,0.0,1333.655,1411.02,0.0,0.0,0.0,0.0,0.0,599.0,800.0,3250,4269.13,18.0,35.0,Fortnightly,32.0,7291.78,3250.0,Part-Time Employment,0.0,0.0,0.0,0.0,5311.9933,164.0,3244.7433,237.18,QuickCash,0.0,6395807,0.0,01-09-2023,False,Vehicle Expenses,2023-09-01,Green,3248.0,9138.0,7291.78
0062x00000DZ3yJAAT,0012x00000XCx28AAD,North Beach,WA,Australia,Loan Paid,Existing Client-Granted Loan Before,0.0,46.5,387.5843,1.0,0.0,0.0,4.0,1.0,1811.13,0.0,12.0,0.0,375.0,375.0,0.0,0.4,0.0,1.0,249166.67,400.0,1250.0,3150,3956.32,24.0,23.857,Weekly,64.0,1811.13,3500.0,Self Employed,0.0,0.0,0.033,0.0,0.0,430.0,429.76,164.85,MoneySpot,0.0,5069523,0.0,16-04-2023,False,Travel Expenses,2023-04-15,Green,0.0,3471.0,1811.13
0062x00000DseUOAAZ,0012x00000GeW9oAAF,Narre warren,VIC,Australia,Loan Paid,Existing Client-Granted Loan Before,0.0,33.76,3639.1781,4.0,0.0,0.0,2.0,4.0,10181.4299,0.0,33.0,1875.6855,2563.9166,2695.0,0.0,0.0,0.0,1.0,2800.0,899.0,400.0,3500,4399.9,12.0,24.714,Fortnightly,30.0,9786.43,5000.0,Full-Time Employment,0.0,0.0,0.0,0.0,3421.5333,2614.0,4414.0566,366.66,MoneySpot,0.0,5253956,0.0,14-05-2023,False,Travel Expenses,2023-05-13,Orange,0.0,14686.0,9786.43
0062x00000EydNJAAZ,0012x00000RqUiWAAV,Brompton,SA,Australia,Loan Paid,Existing Client-Granted Loan Before,0.0,81.63,7076.6473,1.0,1.0,0.0,3.0,1.0,6363.5832,1.0,7.0,0.0,1053.8081,952.94,1.0,40.92,0.0,0.0,3678.89,599.0,640.0,3050,4053.68,36.0,36.0,Weekly,52.0,6367.25,3150.0,Full-Time Employment,1.0,0.0,0.3077,0.0,3863.9633,3007.0,7381.2633,112.61,MoneySpot,0.0,6750273,1.0,05-10-2023,False,Medical Expenses,2023-10-05,Green,0.0,7346.0,6367.25
0062x00000EdM0EAAV,0012x00000g9ObQAAU,Moorooka,QLD,Australia,Closed Lost,Existing Client-Granted Loan Before,0.0,74.47,502.0,2.0,0.0,0.0,2.0,2.0,6787.3825,0.0,9.0,0.0,3085.7,3065.7,0.0,0.28,0.0,0.0,0.0,1500.0,1100.0,3500,4420.77,13.0,26.286,Fortnightly,44.0,7004.64,5000.0,Full-Time Employment,0.0,0.0,0.0,0.0,6371.4,445.0,3722.0166,340.06,MoneySpot,,6417386,0.0,04-09-2023,False,Vehicle Expenses,2023-09-03,Green,0.0,6836.0,7004.64
0062x00000ECeJoAAL,0012x00000RpqjcAAB,Emu Plains,NSW,Australia,Loan Paid,Existing Client-Granted Loan Before,31.93,70.38,761.4142,4.0,0.0,2.0,1.0,4.0,6693.9091,1.0,26.0,0.0,1250.8844,1603.96,1.0,0.0,0.0,1.0,0.0,400.0,375.0,3500,4442.41,14.0,27.857,Fortnightly,59.0,7887.48,3500.0,Unemployed,1.0,0.0,0.3846,1.0,527.9266,631.0,817.74,317.32,MoneySpot,0.66,5891278,0.0,12-07-2023,False,Vehicle Expenses,2023-07-12,Orange,2901.0,9085.0,7887.48
0062x00000DtgRRAAZ,0012x00000SFHryAAH,Roma,QLD,Australia,Loan Paid,Existing Client-Granted Loan Before,0.0,68.22,3465.7508,0.0,0.0,0.0,0.0,0.0,96.6666,7.0,61.0,802.4008,0.0,0.0,0.0,24.96,0.0,0.0,4766.67,599.0,0.0,3200,4001.64,24.0,24.571,Weekly,59.0,5567.53,4000.0,Full-Time Employment,7.0,0.0,0.1099,1.0,0.0,1366.0,4833.48,168.25,MoneySpot,-0.18,5335340,0.0,20-05-2023,False,Travel Expenses,2023-05-20,Green,0.0,6712.0,5567.53
0062x00000FsrOgAAJ,0012x00000kgdNDAAY,Treeby,WA,Australia,Closed Lost,Existing Client-Granted Loan Before,0.0,43.64,1878.5147,2.0,0.0,0.0,2.0,2.0,5753.4643,0.0,25.0,0.0,2314.0116,2078.99,0.0,0.0,0.0,0.0,0.0,400.0,1000.0,3500,4141.25,7.0,12.857,Fortnightly,29.0,5753.46,5000.0,Full-Time Employment,0.0,0.0,0.0549,0.0,4628.0233,1167.0,2219.41,591.61,MoneySpot,,8135870,0.0,2024-02-12,False,Vehicle Expenses,2024-02-07,Orange,0.0,6394.0,5753.46
0062x00000FXZkfAAH,0012x00000Nxl4RAAR,Exmouth,WA,Australia,Closed Lost,Existing Client-Granted Loan Before,0.0,66.03,2717.7991,2.0,0.0,0.0,4.0,2.0,5367.1547,0.0,45.0,914.6799,2065.3214,2065.51,1.0,2.23,0.0,0.0,6523.69,899.0,524.0,3250,4080.79,12.0,23.714,Fortnightly,47.0,4593.82,34500.0,Full-Time Employment,0.0,0.0,1.0,0.0,4819.0833,361.0,3120.0466,340.07,MoneySpot,,7766731,0.0,2024-01-07,False,Living Expenses,2024-01-07,Green,0.0,7027.0,4593.82
0062x00000ENnWnAAL,0012x00000SIT39AAH,Brassall,QLD,Australia,Closed Lost,Existing Client-No Loan Granted Ever,0.0,49.22,731.8366,1.0,0.0,0.0,5.0,1.0,5934.247,0.0,0.0,0.0,1290.8953,1231.6,0.0,0.0,0.0,0.0,4983.33,599.0,400.0,3200,3785.16,9.0,9.714,Weekly,33.0,5934.25,3200.0,Full-Time Employment,0.0,0.0,0.0,0.0,5593.88,0.0,865.3366,420.58,MoneySpot,,6206037,0.0,14-08-2023,False,Living Expenses,2023-08-14,Orange,0.0,6954.0,5934.25
0062x00000DsCg9AAF,0012x00000Tuj7hAAB,Bonbeach,VIC,Australia,Loan Paid,Existing Client-Granted Loan Before,0.0,59.0,3004.7756,1.0,1.0,0.0,3.0,1.0,7909.0465,4.0,50.0,0.0,1047.3846,976.0,0.0,0.0,0.0,0.0,7137.44,599.0,1738.0,3500,4212.87,16.0,16.286,Weekly,36.0,7947.14,3500.0,Full-Time Employment,4.0,0.0,0.0549,1.0,6279.3433,0.0,3144.84,263.31,MoneySpot,0.0,5227275,3.0,09-05-2023,False,Living Expenses,2023-05-09,Green,0.0,7980.0,7947.14
0062x00000DsxmqAAB,0012x00000KMt8fAAD,Bellbird Park,QLD,Australia,Loan Paid,Existing Client-Granted Loan Before,0.34,52.02,4784.0975,1.0,0.0,0.0,1.0,1.0,9381.9527,0.0,29.0,401.5,1084.7925,1064.15,0.0,0.0,0.0,0.0,3386.12,599.0,600.0,3200,4022.37,24.0,24.143,Weekly,43.0,6255.29,5000.0,Full-Time Employment,0.0,0.0,0.0,0.0,4339.17,3573.0,5200.1266,167.6,MoneySpot,0.0,5275350,0.0,15-05-2023,False,Travel Expenses,2023-05-15,Green,46.0,13305.0,6255.29
0062x00000ENSvFAAX,0010K00001vInDHQA0,Dundas,NSW,Australia,Closed Lost,Existing Client-No Loan Granted Ever,0.0,41.4,0.0,1.0,0.0,0.0,1.0,1.0,3881.8905,0.0,0.0,0.0,893.3666,922.01,0.0,0.0,0.0,0.0,3466.67,599.0,1000.0,3500,4071.16,10.0,10.429,Weekly,35.0,5915.22,3500.0,Full-Time Employment,0.0,0.0,0.0,0.0,893.3666,0.0,13.9933,407.12,MoneySpot,,6175514,0.0,11-08-2023,False,Veterinary Expenses,2023-08-10,Orange,0.0,3300.0,5915.22
0062x00000F42YAAAZ,0012x00000g95JAAAY,Diggers Rest,VIC,Australia,Loan Paid,Existing Client-Granted Loan Before,0.0,15.65,2741.4689,1.0,0.0,0.0,3.0,1.0,18001.5718,2.0,84.0,0.0,4142.8276,5083.1,0.0,0.0,0.0,0.0,0.0,899.0,1680.0,3500,4212.83,16.0,16.286,Weekly,40.0,18001.57,3500.0,Full-Time Employment,2.0,0.0,0.011,0.0,17952.2533,0.0,2768.8066,263.31,MoneySpot,-0.04,7100253,1.0,07-11-2023,False,Vehicle Expenses,2023-11-07,Green,0.0,18136.0,18001.57
0062x00000DJIYXAA5,0012x000002aLuLAAU,Allenstown,QLD,Australia,Loan Paid,Existing Client-Granted Loan Before,0.0,55.61,4163.6133,2.0,0.0,0.0,3.0,2.0,4216.4598,0.0,51.0,769.5417,1673.9142,1582.19,1.0,0.0,0.0,0.0,3924.05,599.0,100.0,3350,4089.64,9.0,17.857,Fortnightly,54.0,5011.46,3500.0,Full-Time Employment,0.0,0.0,0.0,0.0,3905.8,3201.0,5086.2466,454.41,MoneySpot,0.0,4881592,0.0,17-03-2023,False,Medical Expenses,2023-03-17,Green,0.0,12298.0,5011.46
0062x00000EcFaKAAV,0012x00000SIBFmAAP,Nanango,QLD,Australia,Loan Paid,Existing Client-Granted Loan Before,0.0,54.0,1378.1645,1.0,0.0,0.0,2.0,1.0,5502.3068,6.0,36.0,0.0,936.0,956.0,0.0,0.0,0.0,0.0,3684.97,599.0,0.0,3500,4311.77,21.0,21.429,Weekly,38.0,4067.14,3500.0,Full-Time Employment,6.0,0.0,0.011,0.0,4056.0,654.0,1753.79,205.33,QuickCash,0.0,6345035,1.0,27-08-2023,False,Other Expenses,2023-08-27,Green,0.0,6290.0,4067.14
0062x00000DXQzwAAH,0012x00000OxjX9AAJ,Bassendean,WA,Australia,Loan Paid,Existing Client-Granted Loan Before,0.0,75.67,6550.9683,2.0,0.0,0.0,4.0,2.0,14594.9431,0.0,63.0,2850.9807,3337.6757,3274.2,1.0,3.63,0.0,0.0,6283.33,1500.0,1300.0,3100,5844.06,8.0,16.0,Fortnightly,50.0,14581.69,5000.0,Full-Time Employment,0.0,0.0,0.6154,0.0,7787.91,2754.0,7329.4266,473.48,MoneySpot,0.0,4971923,0.0,31-03-2023,False,Life Event Expenses,2023-03-31,Green,0.0,15856.0,14581.69
0062x00000DAOBBAA5,0012x000003FNq7AAG,Hillbank,SA,Australia,Loan Paid,Existing Client-Granted Loan Before,0.17,70.05,3022.4865,2.0,0.0,0.0,3.0,2.0,6440.9168,0.0,0.0,1356.2181,2120.7516,2115.6,0.0,0.0,0.0,1.0,0.0,1499.0,812.0,3150,3925.64,10.0,20.429,Fortnightly,39.0,6440.92,5000.0,,3.0,0.0,0.1429,0.0,0.0,1411.0,6221.2266,392.57,MoneySpot,0.0,4627530,0.0,06-02-2023,False,Home Maintenance & Repairs,2023-02-06,Green,13.0,7480.0,6440.92
0062x00000Fw49eAAB,0012x00000hZ3wWAAS,Raymond Terrace,NSW,Australia,Closed Lost,Existing Client-Granted Loan Before,27.51,64.0,3028.781,4.0,0.0,4.0,2.0,4.0,6449.8899,1.0,35.0,0.0,1250.7128,1426.96,0.0,0.0,0.0,0.0,0.0,1500.0,1500.0,3500,4231.77,8.0,16.286,Fortnightly,38.0,7296.56,5000.0,,1.0,0.0,0.0,0.0,5575.75,2681.0,4085.8333,528.98,MoneySpot,,8354345,1.0,2024-03-08,False,Living Expenses,2024-03-03,Orange,2657.0,9658.0,7296.56
0062x00000EdwcUAAR,0012x00000TtMcaAAF,BANKSTOWN,NSW,Australia,Loan Paid,Existing Client-Granted Loan Before,0.0,70.19,11737.8508,4.0,0.0,0.0,3.0,4.0,5064.9809,0.0,1.0,0.0,273.2857,100.0,0.0,0.12,0.0,1.0,0.0,1499.0,1500.0,3500,4474.94,15.0,29.714,Fortnightly,38.0,18398.04,5000.0,,0.0,0.0,0.8462,0.0,12516.3766,525.0,20514.3966,298.33,MoneySpot,0.0,6452050,0.0,09-09-2023,False,Other Expenses,2023-09-09,Orange,0.0,17362.0,18398.04
0062x00000FTunrAAD,0012x00000OK6ZyAAL,Lindenow,VIC,Australia,Closed Lost,Existing Client-Granted Loan Before,0.12,26.99,1024.6492,1.0,0.0,0.0,2.0,1.0,4610.3484,0.0,18.0,309.6417,1061.0123,1020.72,0.0,0.0,0.0,0.0,216666.67,400.0,350.0,3500,4250.28,18.0,18.286,Weekly,41.0,4763.68,5000.0,Full-Time Employment,0.0,0.0,0.0,0.0,4597.72,583.0,1281.5366,236.13,MoneySpot,,7465835,0.0,11-12-2023,False,Vehicle Expenses,2023-12-11,Orange,6.0,4791.0,4763.68
0062x00000E6bgCAAR,0010K0000241RkTQAU,Springwood,QLD,Australia,Loan Paid,Existing Client-Granted Loan Before,0.0,48.12,2998.2933,1.0,0.0,0.0,2.0,1.0,7105.3686,6.0,73.0,0.0,1357.265,1432.66,0.0,14.64,0.0,0.0,5200.0,400.0,600.0,3500,4351.44,24.0,24.0,Weekly,55.0,14018.39,3500.0,Full-Time Employment,6.0,0.0,0.0,5.0,2714.53,1167.0,3656.6,181.32,MoneySpot,0.0,5754659,4.0,28-06-2023,False,Relocation Expenses,2023-06-28,Green,0.0,10427.0,14018.39
0062x00000D8QIwAAN,0010K00001hUCrGQAW,Jundah,QLD,Australia,Loan Paid,Existing Client-Granted Loan Before,0.33,81.06,11454.8582,2.0,2.0,0.0,3.0,2.0,8193.4835,4.0,79.0,2938.1332,3771.2485,3552.24,0.0,4.82,2.0,0.0,5200.0,1500.0,400.0,3500,4199.81,8.0,15.429,Fortnightly,42.0,8193.48,3500.0,Full-Time Employment,4.0,0.0,0.044,0.0,8799.58,6697.0,14016.6266,524.98,MoneySpot,0.0,4532552,3.0,23-01-2023,False,Vehicle Expenses,2023-01-22,Orange,31.0,9217.0,8193.48
0062x00000Drx2PAAR,0010K00002AQFkiQAH,Woodend,VIC,Australia,Loan Paid,Existing Client-Granted Loan Before,0.6,76.41,3349.1014,2.0,0.0,4.0,3.0,2.0,6268.4883,9.0,56.0,1411.0918,2228.8457,2470.22,1.0,1.51,0.0,0.0,0.0,599.0,902.0,3100,3912.91,12.0,23.714,Fortnightly,40.0,4906.98,5000.0,Part-Time Employment,12.0,0.0,0.033,12.0,5265.19,1892.0,4228.61,326.08,MoneySpot,0.0,5208262,10.0,06-05-2023,False,Medical Expenses,2023-05-05,Green,65.0,10799.0,4906.98
0062x00000DZWF7AAP,0012x00000L3AaSAAV,Marrara,NT,Australia,Loan Paid,Existing Client-Granted Loan Before,0.0,62.66,5559.1099,4.0,1.0,0.0,5.0,4.0,4347.4633,11.0,37.0,1005.5288,4057.4633,5432.35,0.0,2.61,0.0,0.0,800.0,1499.0,1400.0,3300,4298.03,8.0,32.429,Monthly,53.0,4474.8,3300.0,Casual Employment,11.0,0.0,0.2857,7.0,4057.4633,1092.0,5856.61,537.26,MoneySpot,0.0,5097377,8.0,20-04-2023,False,Living Expenses,2023-04-19,Green,0.0,8552.0,4474.8
0062x00000DXnVSAA1,0010K00001y98qcQAA,Canning Vale,WA,Australia,Loan Paid,Existing Client-Granted Loan Before,0.0,56.17,400.9432,0.0,0.0,0.0,0.0,0.0,1.7633,0.0,27.0,0.0,0.0,0.0,1.0,0.0,0.0,0.0,3977.0,1500.0,1920.0,3400,4194.37,5.0,20.0,Monthly,41.0,1.76,3400.0,Full-Time Employment,0.0,0.0,0.0,0.0,0.0,2559.0,5092.0133,838.88,MoneySpot,0.0,4995810,0.0,04-04-2023,False,Travel Expenses,2023-04-04,Orange,0.0,8753.0,1.76
0062x00000D7JchAAF,0010K00001ynerBQAQ,Bordertown,SA,Australia,Loan Paid,Existing Client-Granted Loan Before,0.0,36.45,2928.9307,1.0,2.0,0.0,3.0,1.0,8837.9302,5.0,30.0,2025.2895,807.3953,801.04,0.0,0.11,0.0,0.0,3209.7,599.0,260.0,3350,4066.97,16.0,16.714,Weekly,45.0,15670.99,3350.0,Full-Time Employment,6.0,0.0,0.1319,6.0,3498.7133,1235.0,3073.84,254.19,QuickCash,0.0,4477909,6.0,14-01-2023,False,Living Expenses,2023-01-14,Orange,0.0,26896.0,15670.99
0062x00000ExKdBAAV,0010K0000241XWiQAM,ELLENBROOK,WA,Australia,Loan Paid,Existing Client-Granted Loan Before,0.0,80.37,4119.0689,2.0,0.0,0.0,2.0,2.0,6121.4483,0.0,58.0,247.3418,2206.045,2226.43,0.0,0.0,0.0,1.0,4550.0,599.0,2240.0,3500,4561.95,18.0,35.0,Fortnightly,34.0,8562.71,3500.0,Full-Time Employment,2.0,0.0,0.0,2.0,1276.9066,1010.0,4388.14,253.45,MoneySpot,0.0,6656720,0.0,27-09-2023,False,Home Maintenance & Repairs,2023-09-26,Orange,0.0,7765.0,8562.71
0062x00000DHBRyAAP,0012x00000KLK0eAAH,Belconnen,ACT,Australia,Closed Lost,Existing Client-Granted Loan Before,0.0,54.01,3574.7616,2.0,0.0,0.0,2.0,2.0,9255.0799,0.0,23.0,1804.007,1505.2585,1557.54,0.0,0.28,0.0,0.0,5357.59,599.0,820.0,3100,3897.81,12.0,23.286,Fortnightly,43.0,8228.77,5000.0,Full-Time Employment,0.0,0.0,0.0,0.0,6216.1766,1712.0,3820.1766,324.82,MoneySpot,,4765111,0.0,04-03-2023,False,Travel Expenses,2023-02-27,Green,0.0,18797.0,8228.77
0062x00000ELcdvAAD,0012x00000ADlKNAA1,St Albans,VIC,Australia,Closed Lost,Existing Client-Granted Loan Before,0.0,90.93,2534.3312,1.0,0.0,0.0,3.0,1.0,6282.1913,0.0,69.0,210.6137,1403.573,1177.46,1.0,0.0,0.0,0.0,3846.72,1499.0,700.0,3500,4190.95,16.0,15.714,Weekly,31.0,6282.19,3500.0,Full-Time Employment,0.0,0.0,0.0,0.0,6082.15,3795.0,5158.8,261.94,MoneySpot,,6048329,0.0,29-07-2023,False,Relocation Expenses,2023-07-29,Green,0.0,8583.0,6282.19
0062x00000EMK5lAAH,0010K00001g8yGPQAY,Merrylands West,NSW,Australia,Loan Paid,Existing Client-Granted Loan Before,0.0,67.63,3331.657,0.0,0.0,0.0,0.0,0.0,0.0,0.0,43.0,323.9158,0.0,0.0,1.0,0.27,0.0,0.0,6526.0,599.0,780.0,3500,4520.91,15.0,30.857,Fortnightly,44.0,9298.54,3500.0,Full-Time Employment,0.0,0.0,0.0989,0.0,0.0,1842.0,3475.63,301.4,MoneySpot,-0.39,6096151,0.0,03-08-2023,False,Life Event Expenses,2023-08-03,Orange,0.0,10009.0,9298.54
0062x00000E5M8cAAF,0012x00000WYlSBAA1,Nangwarry,SA,Australia,Loan Paid,Existing Client-Granted Loan Before,0.0,41.67,3360.5236,1.0,1.0,0.0,4.0,1.0,4613.5493,5.0,42.0,0.0,1144.1666,1006.0,1.0,25.7,0.0,0.0,5115.23,599.0,200.0,3500,4191.4,16.0,15.714,Weekly,38.0,5073.55,3500.0,Full-Time Employment,5.0,0.0,0.0,0.0,4576.6666,771.0,3827.42,261.97,QuickCash,0.0,5646952,5.0,18-06-2023,False,Vehicle Expenses,2023-06-18,Green,0.0,10267.0,5073.55
0062x00000EyXXCAA3,0012x00000Gdv9IAAR,Kaleen,ACT,Australia,Loan Paid,Existing Client-Granted Loan Before,0.0,81.77,2848.5799,2.0,0.0,0.0,3.0,2.0,7195.0179,0.0,15.0,0.0,2378.8583,2443.12,0.0,54.83,0.0,0.0,3900.0,400.0,400.0,3500,4561.84,18.0,35.0,Fortnightly,39.0,7621.68,3500.0,Full-Time Employment,0.0,0.0,0.989,0.0,4757.7166,1001.0,5129.29,253.44,MoneySpot,0.0,6744576,0.0,05-10-2023,False,Travel Expenses,2023-10-04,Orange,0.0,10105.0,7621.68
0062x00000E5wHzAAJ,0012x00000dx10BAAQ,West Wodonga,VIC,Australia,Loan Paid,Existing Client-Granted Loan Before,0.0,92.12,2290.85,3.0,3.0,0.0,4.0,3.0,13625.24,13.0,23.0,1143.1117,13625.24,13671.95,1.0,2.25,0.0,0.0,0.0,1499.0,1400.0,3150,3989.02,5.0,22.0,Monthly,39.0,22977.98,3150.0,,19.0,0.0,0.1319,7.0,19338.77,3161.0,11480.86,797.81,MoneySpot,0.0,5691647,15.0,23-06-2023,False,Home Maintenance & Repairs,2023-06-22,Orange,0.0,13901.0,22977.98
0062x00000FiDR2AAN,0012x00000XOKDEAA5,Wolli Creek,NSW,Australia,Loan Paid,Existing Client-Granted Loan Before,0.0,86.88,284.2566,4.0,0.0,0.0,3.0,4.0,9716.0532,0.0,57.0,0.0,2335.2222,2162.0,1.0,0.0,1.0,0.0,900.0,599.0,265.0,3500,4213.18,16.0,16.286,Weekly,28.0,9716.05,3500.0,Full-Time Employment,0.0,0.0,0.0,0.0,7005.6666,534.0,817.8666,263.33,QuickCash,0.0,7966943,0.0,2024-01-23,False,Life Event Expenses,2024-01-22,Orange,0.0,17771.0,9716.05
0062x00000DG30kAAD,0012x00000SI4ZTAA1,Broken Hill,NSW,Australia,Loan Paid,Existing Client-Granted Loan Before,0.0,86.87,6388.4345,2.0,2.0,0.0,4.0,2.0,10911.6119,15.0,52.0,0.0,3718.9985,4590.58,0.0,0.54,0.0,0.0,1300.0,1499.0,2000.0,3200,3896.88,8.0,16.0,Fortnightly,33.0,8079.97,3800.0,Self Employed,29.0,0.0,0.033,11.0,8677.6633,1643.0,7489.41,487.12,MoneySpot,0.0,4700429,11.0,17-02-2023,False,Living Expenses,2023-02-17,Orange,0.0,12910.0,8079.97
0062x00000DsSjaAAF,0012x00000GefwLAAR,Gundagai,NSW,Australia,Loan Paid,Existing Client-Granted Loan Before,0.17,68.12,4666.6305,1.0,1.0,0.0,3.0,1.0,7281.8034,5.0,32.0,2293.4058,1329.0,1329.0,0.0,0.0,0.0,0.0,5008.85,899.0,400.0,3500,4202.12,16.0,16.0,Weekly,47.0,11094.67,3500.0,Full-Time Employment,5.0,0.0,0.0,2.0,9268.93,2876.0,5011.61,262.64,MoneySpot,0.0,5243408,5.0,11-05-2023,False,Home Maintenance & Repairs,2023-05-11,Green,13.0,7552.0,11094.67
0062x00000EDP1SAAX,0012x00000OJvorAAD,Camillo,WA,Australia,Loan Paid,Existing Client-Granted Loan Before,0.0,70.01,3229.4509,1.0,0.0,0.0,4.0,1.0,6494.8992,0.0,20.0,0.0,1483.21,1441.26,1.0,1.61,0.0,0.0,5620.01,599.0,800.0,3500,4600.67,36.0,36.429,Weekly,51.0,6494.9,5000.0,Full-Time Employment,0.0,0.0,0.0,0.0,6427.2433,2018.0,4136.7733,127.8,MoneySpot,0.0,5941700,0.0,20-07-2023,False,Vehicle Expenses,2023-07-20,Orange,0.0,7334.0,6494.9
0062x00000FhDE6AAN,0012x00000hYOweAAG,Woolloongabba,QLD,Australia,Closed Lost,Existing Client-Granted Loan Before,0.0,82.39,517.7958,1.0,0.0,0.0,2.0,1.0,4528.6797,4.0,13.0,0.0,1191.1054,1633.05,1.0,8.24,0.0,0.0,0.0,1499.0,1000.0,3500,4207.79,16.0,16.143,Weekly,34.0,4903.72,3500.0,Full-Time Employment,16.0,0.0,0.8352,2.0,4367.3866,428.0,1010.0,262.99,Financier-2,,7876241,2.0,2024-01-16,False,Furniture or Appliances,2024-01-16,Green,0.0,4900.0,4903.72
0062x00000DFSEgAAP,0012x00000IMZrvAAH,Randwick,NSW,Australia,Loan Paid,Existing Client-Granted Loan Before,0.13,69.21,8433.1353,2.0,0.0,0.0,3.0,2.0,15647.7712,0.0,25.0,973.1378,5994.81,5994.81,1.0,0.0,0.0,0.0,12880.95,1499.0,1700.0,3450,4150.39,9.0,18.571,Fortnightly,44.0,19903.68,3500.0,Full-Time Employment,0.0,0.0,0.1209,0.0,13918.86,2241.0,9536.8033,469.57,MoneySpot,0.0,4669323,0.0,12-02-2023,False,Veterinary Expenses,2023-02-12,Green,23.0,17646.0,19903.68
0062x00000DYthXAAT,0012x00000XOgP3AAL,Bowen Hills,QLD,Australia,Loan Paid,Existing Client-Granted Loan Before,0.0,66.05,3026.7089,2.0,0.0,0.0,4.0,2.0,4975.6008,0.0,33.0,1276.799,2128.3,2128.3,0.0,2.03,0.0,0.0,3769.18,599.0,900.0,3450,4315.69,12.0,24.0,Fortnightly,40.0,5033.6,5000.0,Full-Time Employment,0.0,0.0,0.1209,0.0,4256.6,1322.0,3302.4966,359.65,MoneySpot,0.0,5059647,0.0,14-04-2023,False,Living Expenses,2023-04-13,Green,0.0,6269.0,5033.6
0062x00000EwXjAAAV,0010K00001sZJwWQAW,Raymond Terrace,NSW,Australia,Closed Lost,Existing Client-No Loan Granted Ever,35.24,63.18,2433.7838,2.0,0.0,2.0,3.0,2.0,5298.2333,0.0,59.0,2088.2985,2223.2066,2066.15,1.0,0.45,1.0,0.0,2942.33,899.0,1970.0,3100,3675.15,9.0,9.571,Weekly,38.0,6820.87,3100.0,Full-Time Employment,0.0,0.0,0.0,0.0,4850.43,1651.0,2481.4233,408.36,MoneySpot,,6597584,0.0,21-09-2023,False,medical_dental_bill,2023-09-20,Orange,3534.0,10026.0,6820.87
0062x00000EySC9AAN,0010K000029GZiVQAW,Panania,NSW,Australia,Loan Paid,Existing Client-Granted Loan Before,0.0,70.5,6011.9736,2.0,0.0,0.0,3.0,2.0,12340.3525,0.0,71.0,1714.9892,2588.1683,2676.54,0.0,8.41,0.0,0.0,4069.0,899.0,400.0,3500,4582.35,36.0,36.0,Weekly,34.0,12379.32,3500.0,Full-Time Employment,0.0,0.0,0.0,0.0,10684.0766,2774.0,8491.1966,127.29,MoneySpot,0.0,6737506,0.0,04-10-2023,False,Vehicle Expenses,2023-10-04,Orange,0.0,15916.0,12379.32
0062x00000FwPOGAA3,0012x00000IN27rAAD,Wodonga,VIC,Australia,Closed Lost,Existing Client-Granted Loan Before,0.0,55.65,299.6957,1.0,2.0,0.0,3.0,1.0,4187.2113,10.0,35.0,0.0,761.8333,753.68,1.0,0.0,0.0,0.0,850.0,899.0,760.0,3150,3897.6,20.0,20.143,Weekly,22.0,4456.09,5000.0,Full-Time Employment,10.0,0.0,0.044,2.0,3047.3333,612.0,956.6633,194.88,MoneySpot,,8377607,3.0,2024-03-06,False,Vehicle Expenses,2024-03-06,Green,0.0,4838.0,4456.09
0062x00000D7wBbAAJ,0012x00000VcatYAAR,South Ripley,QLD,Australia,Loan Paid,Existing Client-Granted Loan Before,0.21,66.84,1757.7332,3.0,0.0,0.0,5.0,3.0,7087.4933,0.0,19.0,960.1577,5927.4933,5927.49,0.0,0.0,0.0,0.0,5200.0,899.0,515.0,3500,4265.04,4.0,16.571,Monthly,52.0,7247.83,3500.0,Contract Employment,0.0,0.0,0.0,0.0,5927.4933,1006.0,3288.3,1066.27,MoneySpot,0.0,4507121,0.0,19-01-2023,False,Vehicle Expenses,2023-01-19,Orange,17.0,7762.0,7247.83
0062x00000D7nByAAJ,0012x00000TGobiAAD,Wingham,NSW,Australia,Loan Paid,Existing Client-Granted Loan Before,0.0,77.59,3619.3815,1.0,0.0,0.0,1.0,1.0,6217.7455,1.0,61.0,0.0,965.4673,844.7,0.0,15.89,0.0,0.0,0.0,400.0,175.0,3200,3874.19,16.0,15.857,Weekly,21.0,6175.41,3200.0,Casual Employment,1.0,0.0,0.011,0.0,4827.3366,1691.0,4180.74,242.14,MoneySpot,0.0,4500247,1.0,18-01-2023,False,Home Maintenance & Repairs,2023-01-18,Orange,0.0,7954.0,6175.41
0062x00000DsmoSAAR,0012800001Z5xvYAAR,Camillo,WA,Australia,Loan Paid,Existing Client-Granted Loan Before,3.9,57.91,2998.2254,2.0,0.0,0.0,3.0,2.0,4269.1816,0.0,27.0,1669.6093,1948.2328,1929.68,2.0,0.0,0.0,0.0,3056.0,1500.0,400.0,3400,4243.2,12.0,23.571,Fortnightly,53.0,4269.18,5000.0,Full-Time Employment,5.0,0.0,0.0,2.0,4545.8766,1755.0,2894.5066,353.61,MoneySpot,0.0,5264976,4.0,14-05-2023,False,Life Event Expenses,2023-05-14,Green,186.0,4768.0,4269.18
0062x00000FIrVMAA1,0012x00000goEkCAAU,Hassall Grove,NSW,Australia,Closed Lost,Existing Client-Granted Loan Before,0.0,71.98,280.0705,2.0,0.0,0.0,3.0,2.0,8597.7668,1.0,37.0,280.0723,2124.672,1018.93,0.0,6.73,0.0,0.0,0.0,599.0,1020.0,3500,4188.7,8.0,15.143,Fortnightly,27.0,13811.66,3500.0,,1.0,0.0,0.022,1.0,3541.12,987.0,1378.01,523.59,MoneySpot,,7282019,0.0,23-11-2023,False,Travel Expenses,2023-11-22,Green,0.0,15063.0,13811.66
0062x00000FWZXaAAP,0010K00002421R8QAI,Junee,NSW,Australia,Loan Paid,Existing Client-Granted Loan Before,0.0,72.21,7825.6026,2.0,0.0,0.0,3.0,2.0,9902.065,24.0,48.0,1717.0981,4370.44,4682.02,1.0,4.48,0.0,0.0,8233.33,1500.0,500.0,3350,4088.91,9.0,17.857,Fortnightly,47.0,9902.07,3350.0,Full-Time Employment,24.0,0.0,0.956,0.0,10311.0266,2915.0,9246.71,454.33,MoneySpot,-7.89,7682357,12.0,30-12-2023,False,Veterinary Expenses,2023-12-29,Orange,0.0,11747.0,9902.07
0062x00000D9iu1AAB,0010K00001dOj5SQAS,Tapping,WA,Australia,Loan Paid,Existing Client-Granted Loan Before,0.19,72.04,1811.8556,2.0,0.0,0.0,2.0,2.0,5130.4947,0.0,0.0,1045.4638,1854.8742,1135.66,0.0,0.0,0.0,0.0,3033.33,599.0,0.0,3500,4295.78,10.0,20.0,Fortnightly,49.0,5634.62,3500.0,Full-Time Employment,0.0,0.0,0.0,0.0,4328.04,1516.0,1881.3866,429.58,MoneySpot,0.0,4595419,0.0,01-02-2023,False,Life Event Expenses,2023-02-01,Green,13.0,6751.0,5634.62
0062x00000DYdUnAAL,0012x00000TuDHhAAN,Googong,NSW,Australia,Loan Paid,Existing Client-Granted Loan Before,0.0,36.32,877.9114,2.0,1.0,0.0,2.0,2.0,1899.6548,2.0,25.0,535.6416,820.2971,658.14,0.0,0.0,0.0,0.0,3944.77,400.0,0.0,3050,3867.29,12.0,24.0,Fortnightly,24.0,2040.3,4000.0,Full-Time Employment,2.0,0.0,0.022,1.0,1914.0266,462.0,838.0433,322.28,MoneySpot,0.0,5044640,1.0,12-04-2023,False,Medical Expenses,2023-04-12,Green,0.0,2451.0,2040.3
0062x00000F8jsIAAR,0012x00000gmmMZAAY,Ascot Vale,VIC,Australia,Closed Lost,Existing Client-Granted Loan Before,0.0,32.79,4325.2145,2.0,0.0,0.0,2.0,2.0,6282.2662,5.0,113.0,0.0,1643.1433,1768.85,1.0,0.0,0.0,0.0,0.0,899.0,0.0,3500,4562.43,18.0,35.0,Fortnightly,50.0,6282.27,3500.0,,5.0,0.0,0.011,5.0,4960.7766,439.0,4062.6033,253.47,MoneySpot,,6874302,0.0,23-10-2023,False,Vehicle Expenses,2023-10-18,Orange,0.0,10687.0,6282.27
0062x00000ENUlpAAH,0012x00000G2DeVAAV,Upper Coomera,QLD,Australia,Closed Lost,Existing Client-Granted Loan Before,0.0,16.4,0.0,4.0,0.0,0.0,5.0,4.0,9099.0152,0.0,17.0,0.0,3480.5728,4090.07,0.0,0.0,0.0,0.0,850.0,899.0,800.0,3250,3920.29,8.0,15.143,Fortnightly,43.0,9021.34,3250.0,Full-Time Employment,0.0,0.0,0.0,0.0,8121.3366,444.0,444.2533,490.04,MoneySpot,,6177297,0.0,11-08-2023,False,Home Maintenance & Repairs,2023-08-11,Green,0.0,16525.0,9021.34
0062x00000DI51BAAT,0012x00000BIIQDAA5,Biloela,QLD,Australia,Loan Paid,Existing Client-Granted Loan Before,0.34,45.13,4406.0165,1.0,0.0,0.0,3.0,1.0,7725.4031,3.0,60.0,821.8102,1714.9207,2086.0,0.0,1.25,0.0,0.0,2806.92,899.0,760.0,3500,4231.33,17.0,17.286,Weekly,23.0,7725.4,3500.0,Full-Time Employment,3.0,0.0,0.0,0.0,7431.3233,1931.0,4670.6366,248.91,MoneySpot,0.0,4815622,3.0,07-03-2023,False,Veterinary Expenses,2023-03-07,Green,27.0,7777.0,7725.4
0062x00000FSvtcAAD,0012x00000FGcreAAD,Goranba,QLD,Australia,Closed Lost,Existing Client-Granted Loan Before,17.2,77.93,745.1931,2.0,0.0,2.0,2.0,2.0,4454.1817,0.0,24.0,224.0,1512.736,1504.3,0.0,2.64,2.0,0.0,2080.0,899.0,500.0,3500,4135.79,7.0,12.714,Fortnightly,48.0,4494.18,3500.0,Full-Time Employment,0.0,0.0,0.011,0.0,3299.8766,1341.0,2021.05,590.83,MoneySpot,,8992440,0.0,2024-04-26,False,Vehicle Expenses,2024-04-25,Orange,939.0,5457.0,4494.18
0062x00000DXlASAA1,0012x00000deT8bAAE,Coburg,VIC,Australia,Loan Paid,Existing Client-Granted Loan Before,0.0,43.7,1606.2,3.0,3.0,0.0,5.0,3.0,10772.0599,14.0,19.0,681.7592,8676.8,8676.8,1.0,0.0,0.0,0.0,0.0,1499.0,2000.0,3050,3769.99,4.0,16.571,Monthly,45.0,10772.06,3050.0,,14.0,0.0,0.1099,0.0,8676.8,672.0,2409.8966,942.5,MoneySpot,0.0,4994023,9.0,04-04-2023,False,Medical Expenses,2023-04-04,Orange,0.0,15658.0,10772.06
0062x00000EbLZzAAN,0012800001PUgvDAAT,Hopetoun,WA,Australia,Loan Paid,Existing Client-Granted Loan Before,0.0,66.45,4640.4899,3.0,0.0,0.0,5.0,3.0,10333.0599,0.0,15.0,1458.3217,9743.39,9743.39,1.0,5.65,0.0,0.0,6920.0,400.0,220.0,3500,4283.92,4.0,17.143,Monthly,38.0,10333.06,3500.0,Full-Time Employment,0.0,0.0,0.989,0.0,9743.39,2633.0,8844.1533,1070.98,MoneySpot,0.0,6283658,0.0,22-08-2023,False,Travel Expenses,2023-08-21,Green,0.0,10801.0,10333.06
0062x00000DWrfrAAD,0010K0000282d71QAA,Sunbury,VIC,Australia,Loan Paid,Existing Client-Granted Loan Before,0.09,92.45,2680.0934,1.0,0.0,0.0,1.0,1.0,7299.3678,0.0,77.0,646.9952,1479.7888,1466.0,1.0,4.88,0.0,0.0,4987.67,899.0,1040.0,3500,4207.43,16.0,16.143,Weekly,40.0,24485.35,3500.0,Full-Time Employment,9.0,0.0,0.0,4.0,10730.52,2743.0,9389.3433,262.97,MoneySpot,0.0,4941949,1.0,27-03-2023,False,Relocation Expenses,2023-03-27,Orange,13.0,13532.0,24485.35
0062x00000DUlKAAA1,0012x00000dzpsSAAQ,Burpengary,QLD,Australia,Loan Paid,Existing Client-Granted Loan Before,13.61,69.93,2069.7841,1.0,0.0,2.0,2.0,1.0,8950.9376,0.0,47.0,1804.3769,997.46,946.18,0.0,0.0,1.0,0.0,0.0,599.0,732.0,3150,3956.09,24.0,23.857,Weekly,47.0,8420.28,4000.0,,0.0,0.0,0.0,0.0,5701.3433,1012.0,3497.8033,164.84,MoneySpot,0.0,5388288,0.0,25-05-2023,False,Other Expenses,2023-05-25,Green,1379.0,10125.0,8420.28
0062x00000DWlQ8AAL,0012x00000TuUC5AAN,SUNNYBANK HILLS,QLD,Australia,Loan Paid,Existing Client-Granted Loan Before,0.2,64.45,3712.465,2.0,0.0,4.0,2.0,2.0,8591.3177,2.0,48.0,477.3077,3753.068,3395.78,1.0,0.25,0.0,0.0,6109.02,1500.0,1180.0,3500,4167.92,7.0,13.429,Fortnightly,45.0,9080.98,3500.0,Full-Time Employment,2.0,0.0,0.0549,1.0,6272.4466,2503.0,6671.64,594.66,MoneySpot,0.0,4936205,1.0,26-03-2023,False,Living Expenses,2023-03-26,Green,20.0,9660.0,9080.98
0062x00000DZZElAAP,0012x00000WYmCcAAL,Currimundi,QLD,Australia,Loan Paid,Existing Client-Granted Loan Before,0.0,71.15,631.5266,1.0,0.0,0.0,4.0,1.0,8537.4005,4.0,55.0,1582.5593,1282.7983,1464.64,0.0,20.11,0.0,0.0,1100.0,599.0,50.0,3300,3991.91,16.0,16.143,Weekly,20.0,13895.57,3300.0,Full-Time Employment,8.0,0.0,0.0879,4.0,3833.5966,876.0,3281.6333,249.5,QuickCash,0.0,5100413,2.0,20-04-2023,False,Living Expenses,2023-04-20,Green,0.0,10884.0,13895.57
0062x00000FtfuqAAB,0012x00000gpMG8AAM,Rose Park,SA,Australia,Loan Paid,Existing Client-Granted Loan Before,0.0,51.28,10005.9241,1.0,0.0,0.0,2.0,1.0,16163.6766,0.0,122.0,2361.3144,4023.3236,4717.5,2.0,0.0,0.0,0.0,23833.33,1500.0,4251.94,3250,3898.52,14.0,14.0,Weekly,58.0,16695.39,3250.0,Full-Time Employment,0.0,0.0,0.033,0.0,14752.1866,4445.0,12282.9066,278.47,MoneySpot,0.0,8194012,0.0,2024-02-14,False,Vehicle Expenses,2024-02-14,Orange,0.0,20381.0,16695.39
0062x00000FV9j2AAD,0012x00000LPmtnAAD,Kingston,QLD,Australia,Loan Paid,Existing Client-Granted Loan Before,0.0,51.04,1948.6806,1.0,0.0,0.0,3.0,1.0,5328.4289,0.0,67.0,156.0375,1173.1223,1653.21,2.0,9.25,0.0,0.0,2827.03,899.0,400.0,3500,4175.2,16.0,16.286,Weekly,25.0,5438.43,3500.0,Full-Time Employment,0.0,0.0,0.0,0.0,5083.53,433.0,2220.5,263.33,MoneySpot,0.0,7568562,0.0,19-12-2023,False,Vehicle Expenses,2023-12-19,Green,0.0,6768.0,5438.43
0062x00000Ef8CDAAZ,0012x00000INBuiAAH,North Mackay,QLD,Australia,Loan Paid,Existing Client-Granted Loan Before,0.0,34.72,1523.5976,1.0,0.0,0.0,2.0,1.0,4741.0549,0.0,41.0,945.9076,1246.9625,1375.6,0.0,0.0,0.0,0.0,0.0,899.0,800.0,3500,4186.02,16.0,16.571,Weekly,58.0,4741.05,3500.0,,0.0,0.0,0.0,0.0,4987.85,1522.0,1591.64,264.01,MoneySpot,0.0,6547301,0.0,16-09-2023,False,Life Event Expenses,2023-09-16,Green,0.0,5196.0,4741.05
0062x00000D25ecAAB,0012x00000SIONiAAP,Nightcliff,NT,Australia,Loan Paid,Existing Client-Granted Loan Before,0.0,71.06,1991.7295,1.0,0.0,0.0,3.0,1.0,9552.4153,0.0,19.0,568.6,2087.1315,1349.22,0.0,11.07,0.0,1.0,7800.0,1499.0,640.0,3500,4271.0,20.0,19.857,Weekly,34.0,14919.08,3500.0,Full-Time Employment,0.0,0.0,0.0,0.0,0.0,1771.0,4161.29,213.55,MoneySpot,-0.08,4426744,0.0,06-01-2023,False,Life Event Expenses,2023-01-06,Orange,0.0,15694.0,14919.08
0062x00000E7BtoAAF,0012x00000THPxXAAX,Wentworthville,NSW,Australia,Loan Paid,Existing Client-Granted Loan Before,3.34,78.06,2915.4336,4.0,0.0,4.0,4.0,4.0,5900.6632,0.0,42.0,0.0,804.3682,897.88,0.0,0.94,0.0,0.0,2780.42,599.0,10.0,3450,4137.0,16.0,15.714,Weekly,33.0,5682.33,3450.0,Full-Time Employment,0.0,0.0,0.0,0.0,4730.38,1905.0,3123.35,258.57,MoneySpot,0.0,5802982,0.0,02-07-2023,False,Living Expenses,2023-07-02,Green,203.0,6061.0,5682.33
0062x00000Drry9AAB,0012x00000TuWGVAA3,Cannington,WA,Australia,Loan Paid,Existing Client-Granted Loan Before,0.0,79.33,4116.6528,4.0,2.0,0.0,4.0,4.0,1708.5727,7.0,73.0,1589.4702,168.9347,110.74,1.0,0.0,0.0,1.0,3479.33,400.0,400.0,3100,3905.21,24.0,24.0,Weekly,30.0,1909.19,4000.0,Full-Time Employment,7.0,0.0,0.0989,4.0,0.0,3426.0,4958.1866,162.72,QuickCash,0.0,5200202,6.0,05-05-2023,False,Home Maintenance & Repairs,2023-05-05,Green,0.0,9544.0,1909.19
0062x00000DAOxjAAH,0010K00001rnR7XQAU,NANUM,QLD,Australia,Loan Paid,Existing Client-Granted Loan Before,0.0,96.99,5990.0201,1.0,1.0,0.0,1.0,1.0,10703.9433,7.0,95.0,411.0161,1416.25,1455.75,1.0,0.0,0.0,1.0,4723.33,1499.0,800.0,3300,4002.14,16.0,16.429,Weekly,45.0,10697.08,3300.0,Full-Time Employment,7.0,0.0,0.956,4.0,0.0,3564.0,8213.7066,250.14,MoneySpot,0.0,4628222,6.0,06-02-2023,False,Travel Expenses,2023-02-06,Green,0.0,10883.0,10697.08
0062x00000DUy8CAAT,0012x00000dzxf0AAA,Gatton,QLD,Australia,Loan Paid,Existing Client-Granted Loan Before,0.0,93.37,2810.7771,1.0,0.0,0.0,4.0,1.0,4267.0836,0.0,85.0,495.6903,1108.1866,1076.8,1.0,0.0,0.0,0.0,4488.76,400.0,400.0,3250,4072.74,24.0,24.0,Weekly,33.0,4267.08,5000.0,Full-Time Employment,0.0,0.0,0.2527,0.0,4432.7466,2820.0,3081.77,169.7,MoneySpot,0.0,5403684,0.0,26-05-2023,False,Travel Expenses,2023-05-26,Green,0.0,5464.0,4267.08
0062x00000E49HOAAZ,0012x00000INxaqAAD,Wentworthville,NSW,Australia,Loan Paid,Existing Client-Granted Loan Before,0.0,73.08,5967.5478,2.0,0.0,0.0,3.0,2.0,5401.6689,1.0,31.0,880.0,2329.8616,2381.13,0.0,0.58,0.0,0.0,2583.03,899.0,440.0,3500,4257.32,10.0,19.0,Fortnightly,45.0,5401.67,5000.0,Full-Time Employment,2.0,0.0,0.033,2.0,4791.49,3573.0,7553.6066,425.74,MoneySpot,0.0,5543533,2.0,08-06-2023,False,Other Expenses,2023-06-08,Orange,0.0,5549.0,5401.67
0062x00000FjIGTAA3,0012x00000g8sKpAAI,Frenchs Forest,NSW,Australia,Loan Paid,Existing Client-Granted Loan Before,0.0,67.96,2105.6627,1.0,0.0,0.0,3.0,1.0,5552.878,10.0,38.0,0.0,974.7607,1079.04,0.0,0.0,0.0,0.0,4333.33,599.0,1100.0,3050,3792.58,20.0,20.286,Weekly,67.0,5552.88,3500.0,Full-Time Employment,10.0,0.0,0.1209,2.0,4548.8833,915.0,4543.68,189.64,QuickCash,0.0,8052002,5.0,2024-01-30,False,Furniture or Appliances,2024-01-30,Green,0.0,6422.0,5552.88
0062x00000DYB90AAH,0010K000021WjyvQAC,Kelmscott,WA,Australia,Loan Paid,Existing Client-Granted Loan Before,0.0,53.05,4681.4185,2.0,0.0,0.0,4.0,2.0,4608.2557,0.0,51.0,940.3568,1690.245,2061.84,0.0,1.85,0.0,1.0,3683.33,1499.0,300.0,3100,3887.89,12.0,23.0,Fortnightly,49.0,4613.26,4500.0,Part-Time Employment,0.0,0.0,0.0,0.0,0.0,1480.0,4485.7266,324.0,MoneySpot,0.0,5016811,0.0,07-04-2023,False,Home Maintenance & Repairs,2023-04-07,Green,0.0,5467.0,4613.26
0062x00000Ey7pMAAR,0012x00000gpBu8AAE,Point Cook,VIC,Australia,Loan Paid,Existing Client-Granted Loan Before,0.0,73.09,2663.3203,1.0,0.0,0.0,3.0,1.0,6814.2092,0.0,17.0,0.0,1326.5208,868.0,0.0,1.5,0.0,0.0,6933.33,599.0,800.0,3500,4349.13,23.0,23.429,Weekly,32.0,8120.88,3500.0,Casual Employment,0.0,0.0,0.0,0.0,5306.0833,1815.0,3718.3833,189.1,Financier-2,0.0,6712683,0.0,02-10-2023,False,Other Expenses,2023-10-02,Green,0.0,12103.0,8120.88
0062x00000DUpnGAAT,0012x00000iH2pgAAC,Kalkarindji,NT,Australia,Closed Lost,New Client-New Loan,14.22,55.12,0.0,4.0,0.0,0.0,5.0,4.0,1472.2699,0.0,0.0,0.0,812.362,957.94,0.0,0.0,0.0,0.0,3250.0,400.0,600.0,3500,4084.91,4.0,8.286,Fortnightly,60.0,1472.27,3500.0,Full-Time Employment,0.0,0.0,0.0769,0.0,1353.9366,0.0,0.0,1021.23,MoneySpot,,5392169,0.0,27-05-2023,False,Living Expenses,2023-05-25,Orange,333.0,2341.0,1472.27
0062x00000DroxhAAB,0010K0000240umfQAA,Sandringham,VIC,Australia,Closed Lost,Existing Client-Granted Loan Before,0.0,21.22,665.6566,2.0,0.0,0.0,4.0,2.0,4068.3594,0.0,6.0,303.0528,1872.56,2201.8,1.0,0.64,0.0,0.0,5200.0,599.0,500.0,3100,3655.51,5.0,9.0,Fortnightly,46.0,3885.68,5000.0,Full-Time Employment,0.0,0.0,0.0,0.0,3745.12,3337.0,6765.8533,731.11,MoneySpot,,5195653,0.0,08-05-2023,False,Home Maintenance & Repairs,2023-05-04,Green,0.0,3886.0,3885.68
0062x00000Ezg73AAB,0010K00001wUbtPQAS,Doolandella,QLD,Australia,Loan Paid,Existing Client-Granted Loan Before,0.6,65.51,4276.9017,2.0,0.0,0.0,3.0,2.0,11059.7678,1.0,55.0,0.0,2290.8183,2229.54,1.0,0.0,0.0,0.0,4565.17,599.0,1100.0,3500,4480.97,15.0,29.857,Fortnightly,36.0,11133.7,3500.0,Part-Time Employment,1.0,0.0,0.033,1.0,10282.9766,2104.0,8298.5733,298.74,MoneySpot,0.0,6824927,0.0,13-10-2023,False,Living Expenses,2023-10-13,Orange,74.0,12202.0,11133.7
0062x00000FvXF9AAN,0012x00000g8t9LAAQ,Point Cook,VIC,Australia,Loan Paid,Existing Client-Granted Loan Before,0.0,57.54,1178.6426,2.0,0.0,0.0,3.0,2.0,6735.0742,2.0,22.0,1135.1935,3099.98,2995.52,1.0,4.29,0.0,0.0,0.0,899.0,1400.0,3500,4146.08,7.0,13.0,Fortnightly,47.0,6735.07,5000.0,,6.0,0.0,0.1648,6.0,6199.96,1373.0,2491.6466,592.3,QuickCash,0.0,8318677,0.0,2024-02-29,False,Medical Expenses,2024-02-29,Orange,0.0,6383.0,6735.07
0062x00000FjkiiAAB,0012x00000IMPUzAAP,Sunshine West,VIC,Australia,Closed Lost,Existing Client-Granted Loan Before,0.0,85.79,1580.172,2.0,0.0,0.0,4.0,2.0,4766.2862,0.0,25.0,791.6557,1977.5383,1977.54,0.0,4.47,0.0,0.0,2317.01,400.0,300.0,3500,4257.09,10.0,19.0,Fortnightly,29.0,6289.95,5000.0,Full-Time Employment,0.0,0.0,0.5604,0.0,3955.0766,635.0,1627.57,425.71,MoneySpot,,8085081,0.0,2024-02-04,False,Life Event Expenses,2024-02-02,Orange,0.0,6259.0,6289.95
0062x00000E6kkCAAR,0012x00000TGp4GAAT,Virginia,NT,Australia,Loan Paid,Existing Client-Granted Loan Before,0.0,87.15,10533.5241,2.0,1.0,0.0,2.0,2.0,9692.7249,7.0,80.0,2319.9075,4179.9285,4962.37,1.0,9.07,0.0,0.0,7014.99,1499.0,900.0,3500,4215.34,8.0,15.857,Fortnightly,41.0,9692.72,3500.0,Full-Time Employment,9.0,0.0,0.011,6.0,9753.1666,4447.0,11387.2366,526.92,QuickCash,0.0,5767151,8.0,29-06-2023,False,Furniture or Appliances,2023-06-29,Green,0.0,10766.0,9692.72
0062x00000DGCahAAH,0012x00000MkC1CAAV,South Gladstone,QLD,Australia,Loan Paid,Existing Client-Granted Loan Before,0.0,30.56,1775.942,2.0,0.0,0.0,3.0,2.0,4366.2577,0.0,15.0,0.0,2009.675,2587.46,0.0,9.96,0.0,0.0,3144.62,1499.0,240.0,3200,3919.95,10.0,18.714,Fortnightly,56.0,4366.26,3200.0,Full-Time Employment,0.0,0.0,0.0,0.0,4019.35,871.0,1799.0466,392.0,MoneySpot,0.0,4708746,0.0,18-02-2023,False,Medical Expenses,2023-02-18,Green,0.0,6095.0,4366.26
0062x00000DqzT4AAJ,0010K000022NHcrQAG,Camp Hill,QLD,Australia,Loan Paid,Existing Client-Granted Loan Before,0.12,50.17,2168.3766,3.0,0.0,0.0,5.0,3.0,10145.22,0.0,14.0,1119.7035,5542.45,3658.91,1.0,0.76,1.0,0.0,3466.67,1499.0,0.0,3500,4313.63,5.0,20.286,Monthly,60.0,5542.45,3500.0,Full-Time Employment,0.0,0.0,0.0,0.0,5542.45,1143.0,2315.0433,862.73,MoneySpot,0.0,5140481,0.0,26-04-2023,False,Furniture or Appliances,2023-04-26,Green,13.0,10592.0,5542.45
0062x00000Ez6RPAAZ,0012800001OBEITAA5,Whitfield,QLD,Australia,Loan Paid,Existing Client-Granted Loan Before,0.0,63.71,3286.1704,2.0,0.0,0.0,3.0,2.0,4271.7951,2.0,56.0,350.9679,1697.7042,1678.24,1.0,0.0,0.0,0.0,3033.33,400.0,800.0,3500,4349.11,12.0,23.429,Fortnightly,49.0,4905.13,3500.0,Part-Time Employment,2.0,0.0,0.022,0.0,3961.31,1143.0,3732.8133,362.43,QuickCash,0.0,6783946,1.0,09-10-2023,False,Vehicle Expenses,2023-10-09,Green,0.0,6111.0,4905.13
0062x00000Ecen9AAB,0012x00000WpiMIAAZ,Hamlyn Heights,VIC,Australia,Loan Paid,Existing Client-Granted Loan Before,0.0,76.06,4178.5039,1.0,0.0,0.0,2.0,1.0,14009.4868,0.0,48.0,377.8619,1300.0,1000.0,0.0,49.86,0.0,1.0,1250.0,1499.0,0.0,3100,4112.27,36.0,36.0,Weekly,64.0,15359.49,3100.0,Full-Time Employment,0.0,0.0,0.022,0.0,0.0,1481.0,4688.0266,114.24,MoneySpot,0.0,6371027,0.0,31-08-2023,False,Home Maintenance & Repairs,2023-08-30,Orange,0.0,14971.0,15359.49
0062x00000FXZ3RAAX,0012x00000d8Ke4AAE,Collingwood Park,QLD,Australia,Closed Lost,Existing Client-Granted Loan Before,0.0,87.11,3286.8055,2.0,0.0,0.0,3.0,2.0,7823.6046,0.0,20.0,0.0,3601.0016,3601.0,1.0,0.56,0.0,0.0,6222.16,1499.0,600.0,3500,4279.35,10.0,19.571,Fortnightly,32.0,20976.49,5000.0,Full-Time Employment,0.0,0.0,0.011,0.0,7202.0033,980.0,5087.5533,427.94,MoneySpot,,7765761,0.0,2024-01-07,False,Life Event Expenses,2024-01-06,Orange,0.0,24022.0,20976.49
0062x00000EcH9zAAF,0012x000008IoVDAA0,Herbert,NT,Australia,Loan Paid,Existing Client-Granted Loan Before,0.03,69.15,11311.2307,1.0,0.0,0.0,5.0,1.0,26836.0538,2.0,42.0,640.0,3223.5669,4047.01,1.0,0.36,0.0,0.0,6933.33,899.0,2760.0,3500,4191.11,16.0,15.714,Weekly,33.0,27896.05,3500.0,Full-Time Employment,2.0,0.0,0.0,0.0,13968.79,7214.0,13988.01,261.95,MoneySpot,0.0,6347030,1.0,28-08-2023,False,Furniture or Appliances,2023-08-27,Green,13.0,41064.0,27896.05
0062x00000DsrgGAAR,0010K0000260mmqQAA,WILMINGTON,SA,Australia,Loan Paid,Existing Client-Granted Loan Before,0.4,38.29,1677.2601,1.0,0.0,0.0,4.0,1.0,6340.5733,0.0,15.0,0.0,864.68,864.68,0.0,0.0,0.0,0.0,4333.33,400.0,0.0,3150,3981.85,24.0,24.571,Weekly,46.0,6340.57,5000.0,Full-Time Employment,0.0,0.0,0.0,0.0,3746.9466,1623.0,3469.9666,165.92,MoneySpot,0.0,5271393,0.0,15-05-2023,False,Vehicle Expenses,2023-05-15,Green,26.0,6489.0,6340.57
0062x00000E6o3XAAR,0012x00000LRcfbAAD,Main Beach,QLD,Australia,Loan Paid,Existing Client-Granted Loan Before,0.0,64.22,1549.3063,2.0,0.0,0.0,3.0,2.0,3324.3409,0.0,7.0,0.0,1530.1085,1367.44,0.0,1.89,0.0,0.0,0.0,400.0,200.0,3100,3787.87,8.0,16.0,Fortnightly,58.0,7818.94,3100.0,Full-Time Employment,3.0,0.0,0.0,2.0,8052.5366,1619.0,1632.7166,473.49,MoneySpot,0.0,5770183,3.0,29-06-2023,False,Furniture or Appliances,2023-06-29,Green,0.0,3751.0,7818.94
0062x00000DYumiAAD,0012800001SDTysAAH,Wantirna South,VIC,Australia,Closed Lost,Existing Client-Granted Loan Before,0.23,75.12,2977.8137,2.0,0.0,0.0,4.0,2.0,5151.344,0.0,40.0,1853.9678,2363.8533,2988.92,0.0,0.07,1.0,0.0,0.0,599.0,240.0,3100,5349.29,10.0,19.0,Fortnightly,34.0,5151.34,4500.0,Full-Time Employment,0.0,0.0,0.8681,0.0,4727.7066,2289.0,5043.57,534.93,MoneySpot,,5060398,0.0,14-04-2023,False,Medical Expenses,2023-04-14,Green,13.0,5512.0,5151.34
0062x00000E5uuoAAB,0012x00000goH1eAAE,Risdon Park South,SA,Australia,Loan Paid,Existing Client-Granted Loan Before,0.0,63.84,1265.3504,4.0,1.0,0.0,1.0,4.0,10538.8667,2.0,0.0,15.9688,1458.8888,200.0,0.0,0.55,0.0,1.0,3107.0,400.0,1400.0,3500,4343.46,12.0,23.286,Fortnightly,39.0,10538.87,3500.0,Full-Time Employment,2.0,0.0,0.011,2.0,2868.0,949.0,2753.0466,361.96,Financier-2,0.0,5690267,2.0,22-06-2023,False,Travel Expenses,2023-06-22,Green,0.0,11608.0,10538.87
0062x00000Ey9AFAAZ,0012x00000clzwqAAA,Melton South,VIC,Australia,Loan Paid,Existing Client-Granted Loan Before,0.0,95.35,722.4323,1.0,0.0,0.0,2.0,1.0,6598.4427,0.0,24.0,0.0,1518.5376,1393.53,0.0,0.0,0.0,0.0,6066.67,899.0,1521.0,3500,4438.81,28.0,28.286,Weekly,49.0,6603.44,3500.0,Full-Time Employment,0.0,0.0,0.0,0.0,6580.33,760.0,760.04,158.53,MoneySpot,-0.2,6713825,0.0,02-10-2023,False,Travel Expenses,2023-10-02,Orange,0.0,7996.0,6603.44
0062x00000EzMWfAAN,0012x00000gmawoAAA,Homebush West,NSW,Australia,Closed Lost,Existing Client-Granted Loan Before,0.0,45.65,609.1788,1.0,0.0,0.0,2.0,1.0,7213.9527,0.0,21.0,0.0,638.1292,806.09,1.0,8.63,0.0,0.0,0.0,400.0,100.0,3500,4146.61,7.0,13.0,Fortnightly,23.0,7213.95,3500.0,Full-Time Employment,0.0,0.0,0.0,0.0,2765.2266,253.0,585.2433,592.38,MoneySpot,,6803000,0.0,11-10-2023,False,Other Expenses,2023-10-11,Orange,0.0,8693.0,7213.95
0062x00000Dtf9tAAB,0012x00000IOea7AAD,Wantirna South,VIC,Australia,Loan Paid,Existing Client-Granted Loan Before,0.0,54.87,6924.2679,2.0,0.0,0.0,3.0,2.0,10966.7701,0.0,85.0,1881.9128,2883.63,2118.38,1.0,0.06,0.0,0.0,5416.67,899.0,1300.0,3500,4210.45,8.0,15.714,Fortnightly,49.0,16447.03,3500.0,Full-Time Employment,0.0,0.0,0.011,0.0,14323.97,5092.0,9495.13,526.31,MoneySpot,0.0,5333143,0.0,20-05-2023,False,Home Maintenance & Repairs,2023-05-19,Green,0.0,32155.0,16447.03
0062x00000DtVuYAAV,0012x00000Fz1iwAAB,Maddingley,VIC,Australia,Loan Paid,Existing Client-Granted Loan Before,0.0,27.92,100.0,1.0,1.0,0.0,4.0,1.0,2500.7967,4.0,34.0,0.0,533.3333,500.0,0.0,8.17,0.0,1.0,22528.64,599.0,1600.0,3250,3932.87,16.0,16.0,Weekly,53.0,7041.6,3250.0,Full-Time Employment,4.0,0.0,0.1429,4.0,0.0,606.0,1339.6,245.81,MoneySpot,0.0,5321310,2.0,19-05-2023,False,Living Expenses,2023-05-18,Green,0.0,7434.0,7041.6
0062x00000EdHAnAAN,0012x00000MgzitAAB,Crestwood,NSW,Australia,Loan Paid,Existing Client-Granted Loan Before,0.6,55.52,1504.3462,2.0,0.0,0.0,4.0,2.0,4925.1518,0.0,54.0,589.4583,2266.92,2266.92,0.0,0.0,0.0,0.0,3353.38,400.0,1000.0,3500,4284.53,10.0,19.714,Fortnightly,49.0,4967.55,3500.0,Full-Time Employment,0.0,0.0,0.033,0.0,5289.48,1515.0,2792.3566,428.46,QuickCash,0.0,6412030,0.0,03-09-2023,False,Home Maintenance & Repairs,2023-09-03,Green,33.0,5481.0,4967.55
0062x00000FUFInAAP,0012x000002cjmaAAA,East Perth,WA,Australia,Loan Paid,Existing Client-Granted Loan Before,0.0,78.42,679.193,4.0,0.0,0.0,3.0,4.0,4423.3333,11.0,31.0,87.8535,1044.3,982.0,1.0,0.0,0.0,0.0,3466.67,400.0,250.0,3250,3937.89,16.0,16.143,Weekly,33.0,4423.33,3250.0,Full-Time Employment,11.0,0.0,0.0769,1.0,3481.0,1112.0,1234.3966,246.12,MoneySpot,0.0,7493346,3.0,13-12-2023,False,Other Expenses,2023-12-13,Green,0.0,8337.0,4423.33
0062x00000DYl5GAAT,0012x00000BJ2NJAA1,Wellington Point,QLD,Australia,Loan Paid,Existing Client-Granted Loan Before,0.0,64.96,5920.192,2.0,0.0,0.0,2.0,2.0,6749.2534,0.0,28.0,0.0,1760.415,1654.0,0.0,3.62,0.0,0.0,2658.12,599.0,0.0,3500,4183.48,8.0,14.857,Fortnightly,24.0,6291.25,3500.0,Full-Time Employment,0.0,0.0,0.0879,0.0,6113.39,2017.0,6303.7366,522.27,MoneySpot,0.0,5051907,0.0,13-04-2023,False,Home Maintenance & Repairs,2023-04-13,Green,0.0,7311.0,6291.25
0062x00000FKgBdAAL,0012x00000iHDusAAG,Holmview,QLD,Australia,Loan Paid,Existing Client-Granted Loan Before,0.0,76.96,5834.9659,4.0,0.0,0.0,1.0,4.0,1431.7266,4.0,59.0,217.2619,102.2661,10.37,0.0,0.0,0.0,1.0,8666.67,1499.0,1160.0,3500,4609.22,18.0,36.143,Fortnightly,32.0,7527.88,5000.0,Full-Time Employment,8.0,0.0,0.1429,0.0,0.0,1722.0,7599.58,256.07,MoneySpot,0.0,7407125,2.0,05-12-2023,False,Vehicle Expenses,2023-12-05,Orange,0.0,10693.0,7527.88
0062x00000FvcVLAAZ,0012x00000NuCTrAAN,Forrestfield,WA,Australia,Loan Paid,Existing Client-Granted Loan Before,0.0,70.7,355.4566,1.0,0.0,0.0,3.0,1.0,3532.2738,0.0,0.0,0.0,812.4792,838.81,0.0,0.0,0.0,0.0,0.0,899.0,1600.0,3350,4111.67,20.0,20.0,Weekly,35.0,3919.78,4000.0,,0.0,0.0,0.0,0.0,3929.1466,1681.0,2158.09,205.59,MoneySpot,0.0,8323265,0.0,2024-03-01,False,Relocation Expenses,2024-03-01,Green,0.0,3535.0,3919.78
0062x00000FTgI2AAL,0012x00000SIRelAAH,Bentley,WA,Australia,Closed Lost,Existing Client-Granted Loan Before,0.13,56.15,2050.3316,2.0,0.0,0.0,3.0,2.0,7180.4859,2.0,25.0,0.0,2393.344,2337.82,0.0,0.08,0.0,0.0,5696.79,899.0,800.0,3100,3744.54,8.0,14.714,Fortnightly,36.0,7059.56,3100.0,Full-Time Employment,2.0,1.0,0.3077,0.0,3988.9066,1361.0,4203.8066,468.07,MoneySpot,,7450358,1.0,09-12-2023,False,Other Expenses,2023-12-09,Green,14.0,10525.0,7059.56
0062x00000EeLvfAAF,0012x000003Ce5QAAS,Coogee,NSW,Australia,Loan Paid,Existing Client-Granted Loan Before,0.0,80.85,6044.1045,2.0,0.0,0.0,3.0,2.0,11953.5811,0.0,37.0,0.0,3090.9928,3091.0,1.0,1.31,0.0,0.0,5761.17,599.0,1040.0,3500,4580.03,18.0,35.429,Fortnightly,36.0,11806.58,3500.0,Full-Time Employment,1.0,0.0,0.044,1.0,7212.3166,1507.0,8333.4166,254.45,MoneySpot,0.0,6482881,0.0,11-09-2023,False,Living Expenses,2023-09-11,Orange,0.0,14682.0,11806.58
0062x00000DYKLHAA5,0012x00000MhR9yAAF,Victor Harbor,SA,Australia,Loan Paid,Existing Client-Granted Loan Before,0.0,48.21,3506.1532,2.0,0.0,0.0,4.0,2.0,6953.6392,0.0,23.0,0.0,1338.7716,1067.53,1.0,1.06,0.0,0.0,0.0,400.0,400.0,3350,4154.98,12.0,22.714,Fortnightly,53.0,6953.64,3500.0,,0.0,0.0,0.0,0.0,2677.5433,1343.0,4192.28,346.25,MoneySpot,0.0,5028027,0.0,09-04-2023,False,Home Maintenance & Repairs,2023-04-09,Green,0.0,9434.0,6953.64
0062x00000ECWWqAAP,0012x00000GbMC8AAN,Brightwaters,NSW,Australia,Loan Paid,Existing Client-Granted Loan Before,3.26,58.4,2245.9421,2.0,0.0,0.0,2.0,2.0,3095.3934,0.0,54.0,0.0,932.865,882.61,1.0,0.0,0.0,0.0,5728.26,599.0,100.0,3050,4041.01,18.0,35.143,Fortnightly,49.0,4451.03,3050.0,Part-Time Employment,0.0,0.0,0.0,0.0,1865.73,760.0,3977.0033,224.51,MoneySpot,0.0,5883875,0.0,11-07-2023,False,Life Event Expenses,2023-07-11,Orange,176.0,5394.0,4451.03
0062x00000FTM4oAAH,0012x00000g6ZIYAA2,Hampton Park,VIC,Australia,Closed Lost,Existing Client-Granted Loan Before,0.0,19.0,3735.6289,1.0,1.0,0.0,3.0,1.0,6160.4802,8.0,72.0,0.0,1100.0842,1154.17,0.0,0.0,0.0,0.0,0.0,899.0,2000.0,3500,4255.18,18.0,18.429,Weekly,47.0,6165.15,5000.0,,9.0,0.0,0.011,0.0,5133.7266,3089.0,16432.5233,236.4,MoneySpot,,9029431,3.0,2024-04-29,False,Home Maintenance & Repairs,2024-04-29,Orange,0.0,21162.0,6165.15
0062x00000EeBCfAAN,0012x00000KKebbAAD,Werribee,VIC,Australia,Closed Lost,Existing Client-Granted Loan Before,0.0,46.26,825.8333,1.0,0.0,0.0,3.0,1.0,7529.003,0.0,22.0,0.0,1419.2391,1379.94,0.0,1.85,0.0,0.0,5723.67,899.0,1100.0,3500,4191.3,16.0,15.714,Weekly,23.0,7262.06,3500.0,Full-Time Employment,0.0,0.0,0.0,0.0,5676.9566,987.0,3039.8566,261.96,MoneySpot,,6469188,0.0,13-09-2023,False,Travel Expenses,2023-09-08,Green,0.0,8528.0,7262.06
0062x00000DroWVAAZ,0012x00000RrrzxAAB,Coowonga,QLD,Australia,Loan Paid,Existing Client-Granted Loan Before,0.72,62.3,5464.0933,3.0,0.0,0.0,2.0,3.0,8282.062,4.0,30.0,933.083,4388.7666,4453.58,0.0,1.18,0.0,1.0,6638.13,1499.0,400.0,3150,3967.31,13.0,24.714,Fortnightly,39.0,7993.28,4000.0,Full-Time Employment,4.0,0.0,0.1978,1.0,0.0,1633.0,9590.25,305.18,QuickCash,0.0,5195037,3.0,05-05-2023,False,Life Event Expenses,2023-05-04,Green,90.0,12448.0,7993.28
0062x00000Ef4mhAAB,0012x00000SFt5WAAT,Narrabri,NSW,Australia,Loan Paid,Existing Client-Granted Loan Before,0.11,26.43,877.0552,2.0,0.0,0.0,5.0,2.0,3020.1383,0.0,1.0,0.0,745.0616,129.25,0.0,0.0,0.0,0.0,40000.0,400.0,1000.0,3500,4300.47,11.0,21.143,Fortnightly,27.0,2891.53,3500.0,Full-Time Employment,0.0,0.0,0.0549,0.0,2891.5266,13.0,882.1233,390.96,QuickCash,-0.38,6539484,0.0,18-09-2023,False,Vehicle Expenses,2023-09-17,Green,11.0,9228.0,2891.53
0062x00000FwI2nAAF,0012x000002axURAAY,Pearsall,WA,Australia,Closed Lost,Existing Client-Granted Loan Before,0.0,20.03,0.0,1.0,0.0,0.0,3.0,1.0,4232.4335,0.0,13.0,0.0,974.04,685.83,0.0,0.0,0.0,0.0,0.0,599.0,1000.0,3500,4207.32,16.0,16.143,Weekly,32.0,4232.43,3500.0,,0.0,0.0,0.0,0.0,3571.48,0.0,25.0,262.96,MoneySpot,,8369222,0.0,2024-03-06,False,Vehicle Expenses,2024-03-05,Green,0.0,3964.0,4232.43
0062x00000EyyEsAAJ,0012x00000iIMphAAG,Caboolture,QLD,Australia,Loan Paid,Existing Client-Granted Loan Before,0.0,86.84,1721.2508,1.0,0.0,0.0,1.0,1.0,6123.4024,0.0,55.0,1137.9103,1240.1784,1266.53,0.0,3.36,1.0,0.0,0.0,400.0,100.0,3300,4067.59,20.0,20.286,Weekly,30.0,7650.27,3300.0,Full-Time Employment,0.0,0.0,0.3846,0.0,5374.1066,1936.0,1964.3233,203.39,MoneySpot,0.0,6776137,0.0,08-10-2023,False,Life Event Expenses,2023-10-08,Green,0.0,9452.0,7650.27
0062x00000DIyqTAAT,0012x00000XOJ9IAAX,Strathtulloh,VIC,Australia,Loan Paid,Existing Client-Granted Loan Before,0.0,93.39,3747.2802,4.0,0.0,0.0,5.0,4.0,3096.6666,4.0,21.0,661.8993,403.913,900.0,0.0,0.0,0.0,1.0,7583.33,400.0,100.0,3100,3893.17,12.0,23.143,Fortnightly,28.0,9207.82,5000.0,Full-Time Employment,4.0,0.0,0.0879,2.0,5621.01,1546.0,3613.88,324.44,MoneySpot,-0.18,4865683,4.0,15-03-2023,False,Medical Expenses,2023-03-15,Green,0.0,3234.0,9207.82
0062x00000DUp8mAAD,0012x00000g8KYQAA2,Glenorchy,TAS,Australia,Loan Paid,Existing Client-Granted Loan Before,0.34,80.11,5202.2151,2.0,0.0,0.0,2.0,2.0,6395.0466,3.0,43.0,950.292,1767.52,1721.94,1.0,0.0,0.0,0.0,3416.55,899.0,800.0,3050,3827.38,12.0,22.857,Fortnightly,43.0,6395.05,5000.0,Full-Time Employment,3.0,0.0,0.0769,0.0,3535.04,1064.0,5118.79,318.95,MoneySpot,0.01,5391357,0.0,25-05-2023,False,Medical Expenses,2023-05-25,Green,27.0,7726.0,6395.05
0062x00000Ed7C4AAJ,0010K00001viSMTQA2,Southbank,VIC,Australia,Closed Lost,Existing Client-No Loan Granted Ever,0.0,41.2,1756.2564,3.0,0.0,0.0,1.0,3.0,4063.5266,2.0,27.0,1152.0,4063.5266,4046.0,1.0,1.39,0.0,0.0,3510.0,599.0,900.0,3100,3699.12,3.0,10.714,Monthly,46.0,4063.53,3100.0,Full-Time Employment,5.0,0.0,0.1319,1.0,4063.5266,281.0,3119.8,1233.04,MoneySpot,,6396868,1.0,02-09-2023,False,Living Expenses,2023-09-01,Orange,0.0,4249.0,4063.53
0062x00000Du7bnAAB,0012x00000XESYLAA5,Rockdale,NSW,Australia,Loan Paid,Existing Client-Granted Loan Before,0.0,74.2,440.4733,4.0,0.0,0.0,5.0,4.0,5480.7669,0.0,12.0,712.4887,214.3181,50.0,0.0,0.0,0.0,1.0,6500.0,899.0,880.0,3100,3776.01,16.0,16.143,Weekly,29.0,10179.07,3100.0,Full-Time Employment,0.0,0.0,0.044,0.0,2298.6433,711.0,1016.3233,236.01,MoneySpot,-0.18,5374969,0.0,24-05-2023,False,Medical Expenses,2023-05-24,Green,0.0,18393.0,10179.07
0062x00000F4Eu1AAF,0012x00000IOlQdAAL,Sydney,NSW,Australia,Closed Lost,Existing Client-Granted Loan Before,0.0,67.85,1936.8354,1.0,0.0,0.0,2.0,1.0,13845.6365,0.0,41.0,0.0,1034.0481,1081.2,0.0,1.87,0.0,0.0,2999.86,400.0,150.0,3300,4347.71,36.0,36.0,Weekly,46.0,15887.58,5000.0,Full-Time Employment,0.0,0.0,0.011,0.0,3791.51,1649.0,3600.34,120.78,MoneySpot,,7116327,0.0,08-11-2023,False,Home Maintenance & Repairs,2023-11-08,Green,0.0,16194.0,15887.58
0062x00000E3aUhAAJ,0012800001OCAbPAAX,Penshurst,NSW,Australia,Loan Paid,Existing Client-Granted Loan Before,0.0,90.12,7371.2419,2.0,0.0,0.0,3.0,2.0,5046.6675,0.0,75.0,3410.9641,2272.22,2272.22,1.0,0.52,0.0,0.0,4001.83,599.0,200.0,3100,3907.78,12.0,23.571,Fortnightly,44.0,6146.67,4700.0,Full-Time Employment,0.0,0.0,0.8791,0.0,5301.8466,2302.0,9160.1833,325.65,MoneySpot,0.0,5500086,0.0,04-06-2023,False,Medical Expenses,2023-06-04,Green,0.0,6747.0,6146.67
0062x00000EeFuHAAV,0012x00000dBl1wAAC,Sydney Olympic Park,NSW,Australia,Loan Paid,Existing Client-Granted Loan Before,0.0,42.78,1684.5999,3.0,0.0,0.0,3.0,3.0,8425.5166,0.0,20.0,0.0,6597.1833,6663.57,0.0,0.0,0.0,0.0,6500.0,1499.0,3000.0,3500,4253.91,4.0,16.429,Monthly,41.0,9658.85,3500.0,Full-Time Employment,0.0,0.0,0.4066,0.0,6597.1833,225.0,2872.6766,1063.48,MoneySpot,0.0,6475967,0.0,10-09-2023,False,Medical Expenses,2023-09-09,Green,0.0,11165.0,9658.85
0062x00000FUNudAAH,0012x00000n1L6CAAU,Rangeway,WA,Australia,Closed Lost,New Client-New Loan,0.0,79.56,0.0,2.0,0.0,0.0,4.0,2.0,3882.0865,0.0,0.0,0.0,2065.4,2287.5,0.0,0.0,0.0,0.0,4550.0,599.0,400.0,3500,4052.91,5.0,10.429,Fortnightly,20.0,3882.09,3500.0,Casual Employment,0.0,0.0,0.2198,0.0,3442.3333,0.0,0.0,810.59,MoneySpot,,7505452,0.0,14-12-2023,False,Vehicle Expenses,2023-12-14,Orange,0.0,3945.0,3882.09
0062x00000Fi1s6AAB,0012x00000iK5biAAC,Coorparoo,QLD,Australia,Loan Paid,Existing Client-Granted Loan Before,0.0,61.5,3029.9828,2.0,0.0,0.0,2.0,2.0,10269.4768,0.0,44.0,0.0,2998.575,2537.35,1.0,6.49,5.0,0.0,0.0,599.0,0.0,3200,4051.18,12.0,24.429,Fortnightly,26.0,10269.48,5000.0,Full-Time Employment,0.0,0.0,0.0,0.0,5997.15,2487.0,10137.3533,337.6,MoneySpot,0.0,7950976,0.0,2024-01-21,False,Vehicle Expenses,2024-01-21,Green,0.0,17468.0,10269.48
0062x00000FTfD0AAL,0012x00000IOmmaAAD,Nimbin,NSW,Australia,Loan Paid,Existing Client-Granted Loan Before,0.0,63.12,5298.8082,1.0,0.0,0.0,3.0,1.0,7867.0233,0.0,105.0,1536.5977,1177.9746,1627.13,1.0,0.08,0.0,0.0,3250.0,400.0,400.0,3500,4228.26,18.0,17.714,Weekly,49.0,6071.68,5000.0,Full-Time Employment,0.0,0.0,0.0,0.0,5889.8733,2623.0,4416.26,234.91,MoneySpot,0.0,7449312,0.0,09-12-2023,False,Medical Expenses,2023-12-09,Orange,0.0,8323.0,6071.68
0062x00000EzgGKAAZ,0012x00000XBCYoAAP,Chester Hill,NSW,Australia,Loan Paid,Existing Client-Granted Loan Before,29.81,39.28,764.0027,4.0,0.0,0.0,3.0,4.0,2277.6876,1.0,25.0,0.0,1416.72,721.72,1.0,0.27,0.0,0.0,2634.54,400.0,200.0,3300,4362.02,18.0,35.857,Fortnightly,28.0,3177.68,4000.0,Part-Time Employment,1.0,0.0,0.1319,0.0,1888.96,531.0,1829.67,242.34,MoneySpot,0.0,6825055,0.0,13-10-2023,False,Home Maintenance & Repairs,2023-10-13,Green,2282.0,7653.0,3177.68
0062x00000D79BvAAJ,0010K00001g6uMtQAI,Park Ridge,QLD,Australia,Loan Paid,Existing Client-Granted Loan Before,0.0,96.59,1629.5512,1.0,0.0,0.0,4.0,1.0,5596.9999,0.0,17.0,1004.2782,728.0,728.0,0.0,0.0,0.0,0.0,3076.67,400.0,800.0,3500,4202.35,16.0,16.0,Weekly,32.0,7893.27,3500.0,Full-Time Employment,0.0,0.0,0.2198,0.0,3154.6666,1090.0,3248.84,262.65,MoneySpot,0.0,4469751,0.0,13-01-2023,False,Vehicle Expenses,2023-01-13,Orange,0.0,10095.0,7893.27
0062x00000E40ikAAB,0012x00000GeBMOAA3,Riverview,QLD,Australia,Loan Paid,Existing Client-Granted Loan Before,0.0,60.33,1731.2167,2.0,0.0,0.0,2.0,2.0,3559.6576,0.0,22.0,776.0023,1235.2916,1360.75,1.0,0.0,0.0,0.0,3611.14,400.0,200.0,3100,3887.86,12.0,23.0,Fortnightly,25.0,3559.66,5000.0,Full-Time Employment,0.0,0.0,0.0,0.0,2470.5833,1065.0,1840.66,324.0,MoneySpot,3.04,5532351,0.0,07-06-2023,False,Life Event Expenses,2023-06-07,Green,0.0,3670.0,3559.66
0062x00000DsMB4AAN,0012x00000foAoLAAU,South Albury,NSW,Australia,Closed Lost,Existing Client-Granted Loan Before,0.24,27.88,325.6866,4.0,0.0,0.0,3.0,4.0,4512.3033,1.0,9.0,0.0,1139.391,1396.45,0.0,0.0,0.0,0.0,0.0,899.0,800.0,3500,4212.91,16.0,16.286,Weekly,59.0,4512.3,3500.0,Full-Time Employment,1.0,0.0,0.0,0.0,3797.97,55.0,1214.2233,263.31,MoneySpot,,5235791,0.0,10-05-2023,False,Life Event Expenses,2023-05-09,Orange,13.0,5348.0,4512.3
0062x00000Eea4nAAB,0012x00000gn483AAA,Gosnells,WA,Australia,Loan Paid,Existing Client-Granted Loan Before,0.0,75.78,7801.8833,2.0,0.0,0.0,3.0,2.0,15768.7077,1.0,75.0,457.1367,4720.6666,6044.0,1.0,1.64,1.0,0.0,0.0,599.0,200.0,3500,4232.17,8.0,16.286,Fortnightly,39.0,12606.21,3500.0,,1.0,0.0,0.2967,0.0,9441.3333,4779.0,9698.6766,529.03,MoneySpot,0.0,6500729,0.0,12-09-2023,False,Vehicle Expenses,2023-09-12,Green,0.0,15666.0,12606.21
0062x00000FUfPdAAL,0012x00000iJ1h8AAC,Ripley,QLD,Australia,Closed Lost,Existing Client-Granted Loan Before,0.0,57.54,2393.3466,3.0,0.0,0.0,4.0,3.0,5629.3799,2.0,15.0,0.0,4929.38,5058.62,0.0,0.0,0.0,0.0,0.0,899.0,990.0,3300,4152.53,5.0,21.714,Monthly,26.0,5927.88,3500.0,Full-Time Employment,2.0,0.0,0.0,0.0,4929.38,361.0,3447.17,830.51,MoneySpot,,7528127,2.0,16-12-2023,False,Living Expenses,2023-12-15,Green,0.0,6513.0,5927.88
0062x00000FSdcKAAT,0012x00000RquAPAAZ,Blacktown,NSW,Australia,Closed Lost,Existing Client-Granted Loan Before,0.0,63.38,1331.3857,3.0,3.0,0.0,5.0,3.0,6276.4166,20.0,29.0,946.0,6158.0833,4807.06,0.0,1.0,2.0,0.0,4445.0,599.0,1603.0,3500,4247.95,4.0,16.286,Monthly,47.0,6276.42,3500.0,Full-Time Employment,20.0,0.0,0.2637,8.0,6158.0833,853.0,3330.8766,1061.99,MoneySpot,,8967151,4.0,2024-04-24,False,Home Maintenance & Repairs,2024-04-24,Orange,0.0,6426.0,6276.42
0062x00000FUFKzAAP,0012x00000hZ3hgAAC,Ravenswood,TAS,Australia,Closed Lost,Existing Client-Granted Loan Before,33.54,39.07,508.1726,1.0,0.0,2.0,3.0,1.0,5531.6692,0.0,12.0,0.0,769.4638,585.72,0.0,0.0,0.0,0.0,0.0,400.0,1200.0,3500,4207.6,16.0,16.143,Weekly,28.0,5531.67,3500.0,,0.0,0.0,0.0,0.0,5085.9066,425.0,526.1733,262.98,MoneySpot,,7493540,0.0,13-12-2023,False,Medical Expenses,2023-12-13,Green,1752.0,5223.0,5531.67
0062x00000EODNDAA5,0010K00002BTI3KQAX,Blacktown,NSW,Australia,Loan Paid,Existing Client-Granted Loan Before,0.0,99.46,662.6562,2.0,0.0,0.0,4.0,2.0,12690.507,0.0,12.0,0.0,5764.3983,5764.4,0.0,4.03,0.0,0.0,7646.17,599.0,1600.0,3200,3901.7,8.0,16.143,Fortnightly,33.0,13548.84,3200.0,Full-Time Employment,0.0,0.0,0.0,0.0,11528.7966,543.0,615.8333,487.72,Financier-2,0.0,6240882,0.0,17-08-2023,False,Living Expenses,2023-08-17,Green,0.0,16432.0,13548.84
0062x00000E5jOAAAZ,0012x00000g8un5AAA,Homebush West,NSW,Australia,Loan Paid,Existing Client-Granted Loan Before,0.0,58.18,766.26,1.0,0.0,0.0,3.0,1.0,6607.7258,0.0,15.0,0.0,1152.77,1152.77,0.0,0.0,0.0,0.0,1550.0,899.0,2200.0,3200,3848.99,16.0,16.143,Weekly,34.0,9388.39,3200.0,Full-Time Employment,0.0,0.0,0.044,0.0,5582.3366,1537.0,1585.4966,242.75,MoneySpot,0.0,5676583,0.0,21-06-2023,False,Travel Expenses,2023-06-21,Green,0.0,14151.0,9388.39
0062x00000DXlJAAA1,0012x00000KLg0KAAT,Cranbourne,VIC,Australia,Loan Paid,Existing Client-Granted Loan Before,0.0,63.05,4025.9751,1.0,0.0,0.0,2.0,1.0,9879.7358,0.0,77.0,1699.741,925.4741,861.0,0.0,0.03,0.0,0.0,2300.0,400.0,550.0,3100,3910.26,24.0,24.143,Weekly,24.0,10287.74,5000.0,Full-Time Employment,0.0,0.0,0.011,0.0,3701.8966,2104.0,4609.6266,162.93,MoneySpot,0.0,4994202,0.0,04-04-2023,False,Vehicle Expenses,2023-04-03,Green,0.0,17609.0,10287.74
0062x00000EbdF9AAJ,0010K00001vInpAQAS,Girraween,NSW,Australia,Loan Paid,Existing Client-Granted Loan Before,0.0,59.39,9864.8432,3.0,1.0,0.0,2.0,3.0,9263.4833,14.0,28.0,0.0,7910.15,7910.15,0.0,0.0,0.0,0.0,6500.0,899.0,1890.0,3500,4422.03,6.0,25.286,Monthly,45.0,9546.82,3500.0,Full-Time Employment,24.0,0.0,0.011,2.0,7910.15,1194.0,10549.4033,737.01,MoneySpot,0.0,6302906,5.0,23-08-2023,False,Home Maintenance & Repairs,2023-08-23,Orange,0.0,14416.0,9546.82
0062x00000E5A6eAAF,0010K00001zFfncQAC,Rozelle,NSW,Australia,Loan Paid,Existing Client-Granted Loan Before,0.04,28.01,1888.321,3.0,0.0,0.0,3.0,3.0,24827.2432,0.0,7.0,0.0,14960.5766,12380.0,0.0,0.0,0.0,0.0,29250.0,1499.0,3000.0,3250,4015.06,5.0,19.571,Monthly,42.0,24933.91,3250.0,Full-Time Employment,0.0,0.0,0.0,0.0,14960.5766,1008.0,1929.87,803.02,MoneySpot,0.0,5628146,0.0,16-06-2023,False,Living Expenses,2023-06-16,Orange,13.0,30115.0,24933.91
0062x00000F3syzAAB,0010K00001qljvUQAQ,West End,QLD,Australia,Loan Paid,Existing Client-Granted Loan Before,0.0,64.47,2013.1022,2.0,0.0,0.0,2.0,2.0,5889.2757,0.0,25.0,494.6836,2405.3642,2269.69,1.0,4.43,0.0,0.0,4168.67,599.0,1500.0,3500,4193.94,8.0,15.286,Fortnightly,29.0,5460.53,3500.0,Full-Time Employment,0.0,0.0,0.011,0.0,5847.1033,1103.0,3218.2333,524.25,MoneySpot,0.0,7086456,0.0,06-11-2023,False,Life Event Expenses,2023-11-06,Green,0.0,7156.0,5460.53
0062x00000FVGHcAAP,0010K00001mDFtxQAG,Safety Beach,VIC,Australia,Loan Paid,Existing Client-Granted Loan Before,0.35,73.47,1720.483,1.0,0.0,0.0,1.0,1.0,5661.8418,4.0,44.0,524.3631,745.2015,653.1,1.0,0.0,0.0,0.0,3466.67,400.0,390.0,3400,4094.53,16.0,15.857,Weekly,41.0,6270.45,3400.0,Full-Time Employment,4.0,0.0,0.0,4.0,5321.56,2067.0,2350.4933,255.58,MoneySpot,0.0,7578125,2.0,20-12-2023,False,Veterinary Expenses,2023-12-20,Green,27.0,7615.0,6270.45
0062x00000EN4XiAAL,0012x000002bu2oAAA,Oakhurst,NSW,Australia,Loan Paid,Existing Client-Granted Loan Before,30.79,88.6,4334.8568,1.0,0.0,2.0,2.0,1.0,11173.8538,0.0,46.0,0.0,872.5646,921.45,1.0,0.15,0.0,0.0,0.0,599.0,0.0,3100,3939.49,26.0,26.0,Weekly,27.0,11126.27,3100.0,Full-Time Employment,0.0,0.0,0.0,0.0,6872.0233,976.0,4611.45,151.52,MoneySpot,0.0,6149372,0.0,09-08-2023,False,Vehicle Expenses,2023-08-08,Green,3602.0,11695.0,11126.27
0062x00000Dt4XsAAJ,0012x00000LOiDiAAL,Bondi,NSW,Australia,Loan Paid,Existing Client-Granted Loan Before,0.0,66.94,111.5,4.0,0.0,0.0,5.0,4.0,10727.1717,0.0,4.0,0.0,3083.64,8821.6,0.0,0.15,0.0,1.0,0.0,400.0,600.0,3500,4357.56,24.0,24.143,Weekly,24.0,12847.7,5000.0,,0.0,0.0,0.0,0.0,0.0,485.0,644.0,181.57,MoneySpot,-0.01,5284709,0.0,16-05-2023,False,Life Event Expenses,2023-05-16,Orange,0.0,11273.0,12847.7
0062x00000DtktgAAB,0012x00000haL8AAAU,Bungarribee,NSW,Australia,Closed Lost,Existing Client-No Loan Granted Ever,0.0,80.26,0.0,1.0,0.0,0.0,5.0,1.0,8293.311,0.0,0.0,0.0,1800.5333,2025.6,0.0,0.17,0.0,0.0,8883.33,400.0,200.0,3500,4196.79,16.0,15.857,Weekly,24.0,14344.07,3500.0,Full-Time Employment,0.0,0.0,0.0,0.0,1800.5333,0.0,0.0,262.31,MoneySpot,,5343986,0.0,21-05-2023,False,Travel Expenses,2023-05-20,Orange,0.0,10520.0,14344.07
0062x00000DYlYaAAL,0012x00000XAypTAAT,Campsie,NSW,Australia,Closed Lost,Existing Client-Granted Loan Before,0.0,81.11,2976.7932,1.0,2.0,0.0,3.0,1.0,9937.4012,17.0,61.0,460.2413,1231.3092,1306.63,0.0,2.81,0.0,0.0,4000.0,400.0,490.0,3250,3898.42,14.0,14.0,Weekly,23.0,5435.05,3250.0,Full-Time Employment,17.0,0.0,0.1868,11.0,5335.6733,770.0,2537.2666,278.46,MoneySpot,,5052180,14.0,13-04-2023,False,Living Expenses,2023-04-13,Orange,0.0,11891.0,5435.05
0062x00000Fk7EmAAJ,0012x00000n3SM8AAM,Lake Cathie,NSW,Australia,Loan Paid,Existing Client-Granted Loan Before,0.0,48.85,660.3759,1.0,1.0,0.0,2.0,1.0,12068.0673,10.0,46.0,0.0,1392.42,507.71,0.0,0.0,0.0,0.0,0.0,899.0,2280.0,3500,4212.84,16.0,16.286,Weekly,30.0,12413.73,3500.0,Full-Time Employment,10.0,0.0,0.1538,8.0,7357.1433,278.0,1286.6733,263.31,MoneySpot,0.0,8110485,3.0,2024-02-05,False,Relocation Expenses,2024-02-05,Green,0.0,9557.0,12413.73
0062x00000DXYukAAH,0012x00000e035ZAAQ,South Nowra,NSW,Australia,Closed Lost,Existing Client-Granted Loan Before,0.0,77.12,1046.5409,2.0,0.0,0.0,1.0,2.0,3832.7803,1.0,41.0,417.4173,1605.1816,1642.16,0.0,0.83,0.0,0.0,3125.15,1499.0,1040.0,3500,4084.32,4.0,8.286,Fortnightly,31.0,3754.11,3500.0,Part-Time Employment,1.0,0.0,0.033,0.0,3210.3633,1022.0,2554.9033,1021.09,QuickCash,,4982451,1.0,02-04-2023,False,Other Expenses,2023-04-01,Orange,0.0,3746.0,3754.11
0062x00000ExhCoAAJ,0010K00001ewhcxQAA,Norman Gardens,QLD,Australia,Loan Paid,Existing Client-Granted Loan Before,0.15,66.36,7439.0407,1.0,0.0,0.0,3.0,1.0,8237.5177,0.0,122.0,1483.247,1888.8538,1895.0,1.0,2.39,0.0,0.0,3900.0,899.0,1000.0,3350,4034.94,16.0,15.857,Weekly,41.0,8560.85,3350.0,Full-Time Employment,0.0,0.0,0.0549,0.0,8185.0333,2467.0,7635.0933,252.19,MoneySpot,0.0,6681105,0.0,29-09-2023,False,Vehicle Expenses,2023-09-28,Green,14.0,9128.0,8560.85
0062x00000DUcAGAA1,0012x00000g8nzIAAQ,Ashfield,NSW,Australia,Loan Paid,Existing Client-Granted Loan Before,0.0,22.16,2932.0399,3.0,1.0,0.0,1.0,3.0,19590.7365,1.0,3.0,765.3254,14531.5133,14531.52,0.0,0.0,0.0,0.0,16486.96,1499.0,6000.0,3500,4246.57,4.0,16.286,Monthly,54.0,19590.74,3500.0,Full-Time Employment,1.0,0.0,0.011,1.0,14531.5133,780.0,4285.3733,1061.65,MoneySpot,0.0,5376354,1.0,24-05-2023,False,Furniture or Appliances,2023-05-24,Green,0.0,20718.0,19590.74
0062x00000Eb9G5AAJ,0012x00000TJJjRAAX,Huntingdale,WA,Australia,Loan Paid,Existing Client-Granted Loan Before,0.0,28.32,2752.1325,2.0,1.0,0.0,3.0,2.0,7163.7025,2.0,14.0,0.0,3296.5157,4446.0,0.0,15.52,0.0,0.0,4348.62,599.0,600.0,3500,4550.86,15.0,31.571,Fortnightly,26.0,7168.7,4000.0,Full-Time Employment,2.0,0.0,0.4176,2.0,7691.87,697.0,2362.9666,303.4,MoneySpot,0.0,6272165,1.0,20-08-2023,False,Vehicle Expenses,2023-08-20,Orange,0.0,7694.0,7168.7
0062x00000EDEO1AAP,0012x00000dyYdfAAE,Wyndham Vale,VIC,Australia,Closed Lost,Existing Client-Granted Loan Before,0.0,64.78,4020.6344,1.0,0.0,0.0,3.0,1.0,8394.427,0.0,62.0,0.0,1705.1838,1542.63,0.0,0.0,0.0,0.0,5792.21,899.0,480.0,3150,3839.94,16.0,16.429,Weekly,27.0,8394.43,3150.0,Full-Time Employment,0.0,0.0,0.0,0.0,7389.13,904.0,4335.5333,240.0,Financier-2,,5930186,0.0,21-07-2023,False,Life Event Expenses,2023-07-17,Green,0.0,10087.0,8394.43
0062x00000DtgEKAAZ,0012x00000OyUSsAAN,Leonora,WA,Australia,Loan Paid,Existing Client-Granted Loan Before,0.0,65.36,3435.1121,2.0,0.0,0.0,2.0,2.0,6877.2502,0.0,28.0,1496.2352,2330.9428,2402.34,0.0,0.0,0.0,0.0,4306.71,899.0,400.0,3500,4204.99,8.0,15.571,Fortnightly,61.0,6963.92,3500.0,Full-Time Employment,0.0,0.0,0.0,0.0,5438.8666,1740.0,3689.22,525.63,MoneySpot,0.0,5335362,0.0,20-05-2023,False,Vehicle Expenses,2023-05-20,Green,0.0,7446.0,6963.92
0062x00000DVB8AAAX,0012x00000RpqjXAAR,Pawtella,TAS,Australia,Closed Lost,Existing Client-Granted Loan Before,3.82,47.79,1734.1708,2.0,0.0,2.0,3.0,2.0,6232.3162,3.0,29.0,0.0,1224.6942,1565.63,3.0,0.23,0.0,0.0,2000.0,899.0,560.0,3500,4193.77,8.0,15.286,Fortnightly,43.0,6190.63,3500.0,Full-Time Employment,3.0,0.0,0.0,2.0,5917.8466,665.0,1942.0833,524.23,MoneySpot,,5427914,0.0,29-05-2023,False,Home Maintenance & Repairs,2023-05-28,Green,412.0,10765.0,6190.63
0062x00000FHAFFAA5,0012x00000OvJ5iAAF,Holland Park,QLD,Australia,Loan Paid,Existing Client-Granted Loan Before,0.17,85.54,2725.5409,2.0,0.0,2.0,4.0,2.0,5326.6214,0.0,41.0,492.4676,2445.1057,2357.94,2.0,0.88,0.0,0.0,4381.0,1499.0,580.0,3500,4525.52,16.0,32.0,Fortnightly,26.0,5326.62,3500.0,Full-Time Employment,0.0,0.0,0.0,0.0,5718.4466,1322.0,2776.9866,282.85,QuickCash,0.0,7144952,0.0,10-11-2023,False,Life Event Expenses,2023-11-10,Orange,13.0,7608.0,5326.62
0062x00000ENyznAAD,0010K0000240CLNQA2,Griffith,NSW,Australia,Loan Paid,Existing Client-Granted Loan Before,0.0,35.88,1548.0835,1.0,0.0,0.0,2.0,1.0,9724.125,2.0,18.0,0.0,1391.78,1351.47,1.0,0.0,0.0,1.0,2600.0,899.0,280.0,3500,4512.89,30.0,31.143,Weekly,26.0,10554.75,3500.0,Unemployed,2.0,0.0,0.022,2.0,0.0,1251.0,1786.0333,150.43,QuickCash,0.0,6221025,0.0,16-08-2023,False,Travel Expenses,2023-08-16,Orange,0.0,10618.0,10554.75
0062x00000EbfVsAAJ,0012x00000hWlc0AAC,Newstead,VIC,Australia,Loan Paid,Existing Client-Granted Loan Before,0.0,41.65,1417.9067,2.0,2.0,0.0,4.0,2.0,7922.822,6.0,40.0,494.7054,3386.615,3416.44,1.0,0.0,0.0,0.0,0.0,400.0,820.0,3500,4659.52,18.0,38.286,Fortnightly,33.0,7923.82,5000.0,Full-Time Employment,16.0,0.0,0.0,6.0,6773.23,850.0,3466.83,261.1,Financier-2,0.0,6304618,5.0,24-08-2023,False,Medical Expenses,2023-08-24,Orange,0.0,9138.0,7923.82
0062x00000E3Zc6AAF,0010K000021FMQtQAO,Goonellabah,NSW,Australia,Loan Paid,Existing Client-Granted Loan Before,0.0,64.84,6274.8381,4.0,0.0,0.0,4.0,4.0,11570.4515,0.0,51.0,531.9006,3736.81,3324.57,1.0,0.53,0.0,0.0,6578.0,1499.0,2400.0,3500,4210.06,8.0,15.714,Fortnightly,41.0,11575.45,3500.0,Full-Time Employment,0.0,0.0,0.011,0.0,9964.8266,3750.0,6886.4633,526.26,MoneySpot,0.0,5498256,0.0,05-06-2023,False,Home Maintenance & Repairs,2023-06-04,Orange,0.0,13131.0,11575.45
0062x00000D8ZntAAF,0012x000002b7COAAY,Heidelberg Heights,VIC,Australia,Loan Paid,Existing Client-Granted Loan Before,0.0,90.84,9443.9349,1.0,1.0,0.0,3.0,1.0,15126.3366,9.0,92.0,1253.3983,1861.7623,1952.77,1.0,21.59,0.0,0.0,6867.68,899.0,2560.0,3500,4287.81,20.0,20.286,Weekly,44.0,12894.03,5000.0,Full-Time Employment,9.0,0.0,0.0769,4.0,8469.3266,2573.0,12522.91,214.4,MoneySpot,-0.01,4540179,1.0,26-01-2023,False,Home Maintenance & Repairs,2023-01-26,Orange,0.0,16420.0,12894.03
0062x00000D1xdEAAR,0012x00000XO8FKAA1,Mermaid Waters,QLD,Australia,Closed Lost,Existing Client-No Loan Granted Ever,0.0,71.43,0.0,4.0,0.0,0.0,2.0,4.0,2576.6666,0.0,3.0,0.0,483.125,500.0,0.0,0.0,0.0,1.0,6231.56,400.0,700.0,3500,4092.04,10.0,10.0,Weekly,40.0,28356.48,3500.0,Self Employed,0.0,0.0,0.0,0.0,0.0,0.0,570.5,409.21,MoneySpot,,4419785,0.0,09-01-2023,False,Other Expenses,2023-01-05,Orange,0.0,26106.0,28356.48
0062x00000FtnyhAAB,0012x00000fmcmjAAA,South Bunbury,WA,Australia,Closed Lost,Existing Client-Granted Loan Before,0.0,64.83,1684.4336,2.0,0.0,0.0,3.0,2.0,5535.7895,0.0,9.0,0.0,1926.61,1926.61,0.0,0.0,2.0,0.0,0.0,400.0,250.0,3300,4147.62,12.0,24.0,Fortnightly,32.0,8665.79,5000.0,Contract Employment,0.0,0.0,0.0,0.0,2568.8133,1238.0,1990.25,345.64,MoneySpot,,8201824,0.0,2024-02-15,False,Vehicle Expenses,2024-02-15,Green,0.0,10189.0,8665.79
0062x00000DAOeDAAX,0012x00000THAhuAAH,Bridgewater,TAS,Australia,Loan Paid,Existing Client-Granted Loan Before,29.57,48.76,917.4648,2.0,0.0,4.0,4.0,2.0,6175.7381,1.0,39.0,996.5077,1607.0814,1345.24,0.0,3.78,0.0,0.0,1733.33,599.0,1200.0,3250,3935.5,8.0,15.571,Fortnightly,30.0,6582.4,3250.0,Part-Time Employment,1.0,0.0,0.7363,1.0,6225.3033,985.0,985.3333,491.94,MoneySpot,0.0,4627974,0.0,06-02-2023,False,Vehicle Expenses,2023-02-06,Green,2489.0,8415.0,6582.4
0062x00000E3dgvAAB,0012x00000iHxiHAAS,Portland,VIC,Australia,Closed Lost,New Client-New Loan,0.0,82.82,0.0,0.0,0.0,0.0,0.0,0.0,0.0,0.0,0.0,0.0,0.0,0.0,0.0,0.0,0.0,0.0,850.0,2000.0,1880.0,3500,4076.08,10.0,10.571,Weekly,29.0,3850.62,3500.0,Casual Employment,0.0,0.0,0.0,0.0,0.0,0.0,0.0,407.61,MoneySpot,,5505267,0.0,05-06-2023,False,Personal,2023-06-04,Orange,0.0,3900.0,3850.62
0062x00000EdlJkAAJ,0012x00000dxe2VAAQ,Hillside,VIC,Australia,Loan Paid,Existing Client-Granted Loan Before,8.82,84.51,2664.2024,3.0,0.0,4.0,2.0,3.0,8389.1665,1.0,2.0,0.0,2933.3333,3000.0,0.0,0.0,0.0,1.0,2000.0,599.0,150.0,3500,4492.21,15.0,30.143,Fortnightly,46.0,21937.47,5000.0,Part-Time Employment,1.0,0.0,0.0,0.0,6661.4733,2018.0,3653.9,299.49,MoneySpot,0.0,6441266,0.0,06-09-2023,False,Other Expenses,2023-09-06,Orange,1936.0,21943.0,21937.47
0062x00000FKwznAAD,0012x00000dyHutAAE,Dean Park,NSW,Australia,Loan Paid,Existing Client-Granted Loan Before,0.0,98.55,1538.6332,1.0,0.0,0.0,2.0,1.0,5834.8439,0.0,36.0,0.0,789.15,989.56,0.0,0.0,0.0,1.0,4290.0,400.0,712.0,3500,4270.9,20.0,19.857,Weekly,30.0,5906.9,3500.0,Casual Employment,0.0,0.0,0.0,0.0,0.0,1063.0,1817.05,213.55,MoneySpot,0.36,7426244,0.0,07-12-2023,False,Travel Expenses,2023-12-07,Orange,0.0,6185.0,5906.9
0062x00000EzPN7AAN,0012x00000dBe87AAC,Oberon,NSW,Australia,Loan Paid,Existing Client-Granted Loan Before,0.0,61.61,1021.8598,1.0,0.0,0.0,3.0,1.0,4521.2788,0.0,35.0,0.0,866.1466,805.77,0.0,12.26,0.0,0.0,711.0,599.0,400.0,3500,4207.52,16.0,16.143,Weekly,23.0,4893.63,3500.0,Full-Time Employment,0.0,0.0,0.0,0.0,3464.5866,326.0,1785.8933,262.98,MoneySpot,0.0,6805888,0.0,12-10-2023,False,Vehicle Expenses,2023-10-11,Green,0.0,5302.0,4893.63
0062x00000DWGEtAAP,0012x000002dTotAAE,Minto,NSW,Australia,Loan Paid,Existing Client-Granted Loan Before,0.0,47.35,3857.9035,1.0,1.0,0.0,3.0,1.0,8124.9468,14.0,13.0,335.322,864.4984,898.2,1.0,0.0,0.0,0.0,3898.0,599.0,500.0,3500,4287.72,20.0,20.286,Weekly,45.0,8124.95,3500.0,Full-Time Employment,14.0,0.0,0.0549,3.0,7877.31,833.0,4794.96,214.39,MoneySpot,0.0,4905985,10.0,21-03-2023,False,Travel Expenses,2023-03-21,Orange,0.0,9366.0,8124.95
0062x00000DVWsRAAX,0012x00000AAP8pAAH,Haberfield,NSW,Australia,Loan Paid,Existing Client-Granted Loan Before,0.0,16.8,472.7999,4.0,0.0,0.0,4.0,4.0,3479.4966,0.0,11.0,1110.8911,1507.28,1520.8,0.0,7.96,0.0,1.0,3463.63,400.0,0.0,3500,4267.83,10.0,19.286,Fortnightly,43.0,3479.5,3500.0,Full-Time Employment,0.0,0.0,0.0,0.0,0.0,1493.0,1493.4666,426.79,MoneySpot,0.0,5453578,0.0,31-05-2023,False,Other Expenses,2023-05-31,Orange,0.0,4195.0,3479.5
0062x00000EwIAnAAN,0012x00000lIq9tAAC,Pakenham,VIC,Australia,Closed Lost,Existing Client-No Loan Granted Ever,0.0,68.86,969.0775,2.0,0.0,0.0,1.0,2.0,4378.5552,0.0,0.0,0.0,2015.336,2475.45,0.0,0.0,0.0,0.0,2200.0,899.0,800.0,3500,4226.88,8.0,16.143,Fortnightly,42.0,7486.5,3500.0,Full-Time Employment,1.0,0.0,0.0,0.0,3358.8933,0.0,1787.31,528.37,MoneySpot,,6577497,0.0,20-09-2023,False,Other Expenses,2023-09-19,Orange,0.0,4282.0,7486.5
0062x00000DrNZJAA3,0012x00000IOld1AAD,South Ripley,QLD,Australia,Loan Paid,Existing Client-Granted Loan Before,0.0,96.66,1642.3485,1.0,0.0,0.0,1.0,1.0,7405.1621,2.0,56.0,954.9694,1385.539,1134.5,3.0,0.0,0.0,1.0,2428.53,599.0,210.0,3150,3976.23,24.0,24.429,Weekly,35.0,7405.16,5000.0,Full-Time Employment,5.0,0.0,0.022,2.0,0.0,1257.0,2567.2166,165.68,MoneySpot,0.0,5162582,3.0,29-04-2023,False,Vehicle Expenses,2023-04-29,Green,0.0,7409.0,7405.16
0062x00000E54BzAAJ,0012x00000cxU5mAAE,Maylands,WA,Australia,Loan Paid,Existing Client-Granted Loan Before,0.0,89.95,978.84,2.0,0.0,0.0,4.0,2.0,6596.4712,1.0,32.0,0.0,1899.2366,1984.62,0.0,0.0,0.0,0.0,0.0,599.0,600.0,3500,4377.34,12.0,24.143,Fortnightly,26.0,8616.31,5000.0,Part-Time Employment,1.0,0.0,0.7802,1.0,4676.1033,786.0,1156.0133,364.78,MoneySpot,-0.45,5618923,0.0,15-06-2023,False,Vehicle Expenses,2023-06-15,Orange,0.0,9050.0,8616.31
0062x00000Dr7p9AAB,0012x00000XApUnAAL,Casino,NSW,Australia,Loan Paid,Existing Client-Granted Loan Before,0.0,44.91,3036.7391,1.0,0.0,0.0,3.0,1.0,11201.1256,1.0,22.0,1011.5086,2267.1084,2326.43,0.0,29.37,0.0,0.0,0.0,899.0,600.0,3500,4201.93,16.0,16.0,Weekly,32.0,12570.8,3500.0,,2.0,0.0,0.4505,0.0,9824.1366,990.0,2430.59,262.63,MoneySpot,0.0,5147788,2.0,27-04-2023,False,Medical Expenses,2023-04-27,Green,0.0,15886.0,12570.8
0062x00000FUJLqAAP,0012x00000NQsoTAAT,Melbourne,VIC,Australia,Loan Paid,Existing Client-Granted Loan Before,0.0,83.62,4977.6775,4.0,3.0,0.0,3.0,4.0,8694.4656,20.0,84.0,805.2378,3526.9514,3004.8,1.0,1.99,0.0,0.0,7817.06,899.0,1825.0,3500,4221.26,8.0,16.0,Fortnightly,37.0,8694.47,3500.0,Full-Time Employment,20.0,0.0,0.3846,7.0,8558.07,2290.0,8855.0966,527.66,MoneySpot,0.0,7499479,15.0,14-12-2023,False,Home Maintenance & Repairs,2023-12-13,Orange,0.0,11015.0,8694.47
0062x00000DrNoiAAF,0010K000028gX4ZQAU,Brinsmead,QLD,Australia,Loan Paid,Existing Client-Granted Loan Before,0.0,75.99,1316.9904,2.0,0.0,0.0,2.0,2.0,9287.5648,12.0,20.0,136.0746,2002.745,1996.72,1.0,0.64,0.0,0.0,0.0,599.0,290.0,3500,4317.77,10.0,20.571,Fortnightly,46.0,10711.69,3500.0,,12.0,0.0,0.033,2.0,4005.49,162.0,1551.3766,431.78,MoneySpot,0.0,5162875,6.0,29-04-2023,False,Vehicle Expenses,2023-04-29,Orange,0.0,10474.0,10711.69
0062x00000FX7EUAA1,0012x00000gA4P5AAK,Munno Para West,SA,Australia,Closed Lost,Existing Client-Granted Loan Before,0.6,54.2,731.3156,0.0,0.0,0.0,0.0,0.0,0.0266,3.0,6.0,0.0,0.0,0.0,0.0,0.0,0.0,0.0,4883.46,400.0,100.0,3500,4295.69,10.0,20.0,Fortnightly,23.0,7029.01,5000.0,Full-Time Employment,3.0,0.0,0.044,1.0,3456.79,0.0,718.5433,429.58,MoneySpot,,7726200,0.0,2024-01-04,False,Travel Expenses,2024-01-03,Orange,28.0,4632.0,7029.01
0062x00000Fj4joAAB,0012x000003F9ELAA0,NEW FARM,QLD,Australia,Loan Paid,Existing Client-Granted Loan Before,0.0,71.3,453.2733,1.0,0.0,0.0,5.0,1.0,5038.0168,0.0,44.0,0.0,969.0,969.0,0.0,0.72,0.0,0.0,12721.94,400.0,300.0,3500,4204.18,17.0,17.571,Weekly,26.0,18615.72,3500.0,Full-Time Employment,0.0,0.0,0.0,0.0,2584.0,1833.0,2768.1733,249.55,MoneySpot,0.0,8037655,0.0,2024-01-29,False,Travel Expenses,2024-01-29,Green,0.0,26638.0,18615.72
0062x00000EcEJiAAN,0012x00000lFT65AAG,Gold coast,QLD,Australia,Closed Lost,New Client-New Loan,0.0,95.48,0.0,4.0,0.0,0.0,5.0,4.0,201.0499,0.0,0.0,0.0,31.6666,50.0,0.0,3.0,0.0,1.0,0.0,0.0,400.0,3500,4094.68,9.0,9.571,Weekly,26.0,717.78,3500.0,unemployment_benefits,0.0,0.0,0.0,0.0,0.0,0.0,0.0,454.97,MoneySpot,,6343316,0.0,27-08-2023,False,Vehicle Repairs & Maintenance,2023-08-26,Orange,0.0,1335.0,717.78
0062x00000FKu0sAAD,0012x00000SHwb8AAD,Colebrook,TAS,Australia,Loan Paid,Existing Client-Granted Loan Before,0.0,55.36,1857.8255,2.0,0.0,0.0,3.0,2.0,4905.5048,0.0,24.0,0.0,1922.8766,1829.6,1.0,0.0,0.0,0.0,4252.34,1500.0,480.0,3250,4019.19,11.0,21.0,Fortnightly,45.0,5073.01,3250.0,Full-Time Employment,0.0,0.0,0.0,0.0,4037.7533,665.0,2712.3733,365.39,MoneySpot,0.0,7423279,0.0,07-12-2023,False,Travel Expenses,2023-12-06,Green,0.0,4599.0,5073.01
0062x00000FU0dXAAT,0012x00000KLbUhAAL,Fairfield West,NSW,Australia,Loan Paid,Existing Client-Granted Loan Before,0.0,6.26,2648.1161,2.0,0.0,0.0,3.0,2.0,7327.8768,2.0,27.0,1136.5694,3372.8316,3734.09,1.0,0.0,0.0,0.0,6500.0,400.0,350.0,3500,4269.62,9.0,18.286,Fortnightly,68.0,7327.88,3500.0,Full-Time Employment,2.0,0.0,0.3187,0.0,6745.6633,2306.0,2738.6866,474.41,MoneySpot,0.0,7475827,1.0,12-12-2023,False,Furniture or Appliances,2023-12-12,Orange,0.0,10006.0,7327.88
0062x00000FVTMCAA5,0010K00001zHwdnQAC,Brahma Lodge,SA,Australia,Closed Lost,Existing Client-Granted Loan Before,0.0,46.27,2140.5896,1.0,0.0,0.0,1.0,1.0,4543.5708,0.0,36.0,607.4999,897.9725,896.0,0.0,0.0,0.0,0.0,3466.67,400.0,1600.0,3200,3942.6,20.0,19.857,Weekly,45.0,6295.58,5000.0,Full-Time Employment,0.0,0.0,0.0,0.0,2894.5933,1427.0,3493.6533,197.14,MoneySpot,,7594702,0.0,21-12-2023,False,Living Expenses,2023-12-21,Green,0.0,6073.0,6295.58
0062x00000EDEAYAA5,0010K00001qHs9fQAC,Tapping,WA,Australia,Loan Paid,Existing Client-Granted Loan Before,0.07,85.59,5181.8885,2.0,0.0,0.0,3.0,2.0,11963.4571,0.0,56.0,3768.2135,5330.03,5192.23,0.0,0.01,0.0,0.0,9750.0,1500.0,1250.0,3500,4312.75,10.0,20.429,Fortnightly,47.0,15641.19,3500.0,Full-Time Employment,0.0,0.0,0.0,0.0,8883.3833,5020.0,6634.9166,431.28,MoneySpot,0.0,5929908,0.0,17-07-2023,False,Medical Expenses,2023-07-17,Orange,13.0,16322.0,15641.19
0062x00000Fi4yIAAR,0010K00001xP2dsQAC,Epping,VIC,Australia,Closed Lost,Existing Client-Granted Loan Before,0.0,99.01,242.1866,2.0,0.0,0.0,4.0,2.0,7542.7476,0.0,21.0,0.0,1715.94,1750.4,0.0,0.17,0.0,0.0,4311.67,899.0,0.0,3500,4218.65,16.0,16.429,Weekly,32.0,7542.75,4550.0,Full-Time Employment,0.0,0.0,0.0,0.0,6202.5733,0.0,569.1866,263.67,QuickCash,,7955725,0.0,2024-01-22,False,Travel Expenses,2024-01-21,Orange,0.0,11493.0,7542.75
0062x00000EegTrAAJ,0012x00000goEvfAAE,Mooroopna North,VIC,Australia,Loan Paid,Existing Client-Granted Loan Before,18.02,37.33,1974.0183,1.0,0.0,2.0,2.0,1.0,4759.3536,2.0,44.0,629.2672,1034.9225,1362.08,2.0,0.63,0.0,0.0,0.0,1499.0,1280.0,3500,4314.25,22.0,22.0,Weekly,36.0,4836.02,3500.0,,2.0,0.0,0.8242,0.0,4898.6766,1349.0,2448.25,196.11,MoneySpot,0.0,6510654,0.0,13-09-2023,False,Travel Expenses,2023-09-13,Green,942.0,5226.0,4836.02
0062x00000FuCMfAAN,0012x00000INSQbAAP,ALEXANDRIA,NSW,Australia,Closed Lost,Existing Client-Granted Loan Before,0.0,80.73,676.6,2.0,0.0,0.0,2.0,2.0,6603.4564,4.0,4.0,0.0,1801.57,1904.11,0.0,0.18,0.0,1.0,876.0,1499.0,800.0,3500,4199.69,8.0,15.429,Fortnightly,52.0,19660.12,5000.0,Full-Time Employment,4.0,0.0,0.0,0.0,0.0,1293.0,1619.83,524.97,MoneySpot,,8231346,3.0,2024-02-18,False,Home Maintenance & Repairs,2024-02-18,Orange,0.0,18932.0,19660.12
0062x00000FWARGAA5,0012x00000ADWxDAAX,Huon,VIC,Australia,Loan Paid,Existing Client-Granted Loan Before,0.24,58.47,2101.0833,3.0,0.0,0.0,4.0,3.0,9054.9632,0.0,19.0,1346.2943,8888.2966,10999.87,0.0,1.49,0.0,0.0,6716.67,1500.0,800.0,3500,4294.92,4.0,17.429,Monthly,57.0,9054.96,3500.0,Full-Time Employment,0.0,0.0,0.022,0.0,8888.2966,1337.0,2101.0833,1073.73,MoneySpot,0.0,7650535,0.0,27-12-2023,False,Medical Expenses,2023-12-27,Green,22.0,9077.0,9054.96
0062x00000Ebq0lAAB,0012x00000gpKRRAA2,Blacktown,NSW,Australia,Loan Paid,Existing Client-Granted Loan Before,3.6,38.25,2059.7198,1.0,0.0,2.0,1.0,1.0,4736.0665,4.0,0.0,605.4772,1043.8,1093.27,0.0,0.0,0.0,1.0,0.0,599.0,1680.0,3500,4454.88,30.0,29.714,Weekly,38.0,9865.12,5000.0,,4.0,0.0,0.0,1.0,215.3433,1919.0,2504.6466,148.5,MoneySpot,0.0,6315378,2.0,24-08-2023,False,Medical Expenses,2023-08-24,Orange,243.0,6738.0,9865.12
0062x00000FXZNiAAP,0012x00000TuRyUAAV,Goodna,QLD,Australia,Closed Lost,Existing Client-Granted Loan Before,0.0,45.29,2855.9302,2.0,0.0,0.0,2.0,2.0,5341.5626,0.0,59.0,211.6745,2153.2685,2397.41,0.0,0.0,0.0,0.0,3641.19,599.0,0.0,3500,4199.44,8.0,15.429,Fortnightly,38.0,5341.56,3500.0,Full-Time Employment,0.0,0.0,0.0,0.0,5024.2933,995.0,2865.13,524.93,MoneySpot,,7766628,0.0,2024-01-07,False,Vehicle Expenses,2024-01-07,Orange,0.0,7218.0,5341.56
0062x00000DGOXYAA5,0010K00001y4upAQAQ,Leumeah,NSW,Australia,Loan Paid,Existing Client-Granted Loan Before,0.0,51.91,2455.8886,2.0,0.0,0.0,3.0,2.0,6379.7012,1.0,67.0,1227.3738,1780.97,1780.97,1.0,0.0,1.0,0.0,3538.0,599.0,180.0,3500,4350.69,11.0,22.429,Fortnightly,51.0,6379.7,3500.0,Full-Time Employment,1.0,0.0,0.4505,0.0,3561.94,1280.0,3423.3833,395.52,MoneySpot,0.0,4720719,0.0,20-02-2023,False,Medical Expenses,2023-02-20,Green,0.0,6463.0,6379.7
0062x00000DrnjsAAB,0012x00000hZ45sAAC,Kenmore,QLD,Australia,Closed Lost,New Client-New Loan,0.0,40.42,2324.5966,1.0,1.0,0.0,5.0,1.0,4408.8366,19.0,21.0,0.0,1102.2091,726.26,0.0,0.0,0.0,0.0,0.0,0.0,120.0,3200,3779.64,9.0,9.571,Weekly,65.0,4408.84,3200.0,,19.0,0.0,0.2418,2.0,4408.8366,0.0,2324.5966,419.96,MoneySpot,,5194118,8.0,04-05-2023,False,Vehicle Expense,2023-05-04,Orange,0.0,4462.0,4408.84
0062x00000ELdGYAA1,0012x00000OvWQPAA3,Blacktown,NSW,Australia,Closed Lost,Existing Client-Granted Loan Before,0.0,50.81,1596.0182,1.0,0.0,0.0,2.0,1.0,7396.5137,3.0,58.0,0.0,1650.0071,1684.4,0.0,0.0,0.0,1.0,3502.98,899.0,1120.0,3500,4488.98,30.0,30.571,Weekly,28.0,7396.51,25100.0,Full-Time Employment,3.0,0.0,0.044,1.0,0.0,1326.0,2429.21,149.64,MoneySpot,,6049025,3.0,30-07-2023,False,Living Expenses,2023-07-29,Orange,0.0,5545.0,7396.51
0062x00000DXfAmAAL,0012x00000hXBq3AAG,South melbourne,VIC,Australia,Closed Lost,New Client-New Loan,0.0,51.18,0.0,4.0,0.0,0.0,1.0,4.0,4178.7733,0.0,0.0,0.0,550.0,100.0,0.0,39.16,0.0,1.0,0.0,0.0,1412.0,3500,4094.61,9.0,9.571,Weekly,23.0,13439.28,3500.0,,0.0,0.0,0.4176,0.0,0.0,0.0,147.2266,454.96,MoneySpot,,4988802,0.0,03-04-2023,False,Other,2023-04-03,Orange,0.0,25606.0,13439.28
0062x00000EDXXvAAP,0012x00000THlZXAA1,Mount Cotton,QLD,Australia,Closed Lost,Existing Client-Granted Loan Before,0.0,90.15,1646.0772,1.0,0.0,0.0,3.0,1.0,6788.5332,8.0,34.0,0.0,958.2323,1000.17,0.0,76.65,0.0,0.0,3839.09,599.0,940.0,3500,4510.85,32.0,32.143,Weekly,30.0,11256.38,3500.0,Full-Time Employment,8.0,0.0,0.0,3.0,5210.46,954.0,2964.31,140.97,MoneySpot,,5949995,1.0,24-07-2023,False,Vehicle Expenses,2023-07-19,Orange,0.0,15547.0,11256.38
0062x00000EymISAAZ,0010K00001eHWqOQAW,South Hedland,WA,Australia,Closed Lost,Existing Client-No Loan Granted Ever,31.18,67.95,1783.9032,1.0,0.0,2.0,3.0,1.0,4986.8302,0.0,36.0,1653.7426,728.5136,1006.19,0.0,15.91,0.0,0.0,5200.0,400.0,1000.0,3100,3684.36,9.0,9.857,Weekly,43.0,5048.16,3100.0,Full-Time Employment,0.0,0.0,0.2308,0.0,4590.3666,844.0,1832.8266,409.38,MoneySpot,,6759961,0.0,06-10-2023,False,Living Expenses,2023-10-06,Orange,1919.0,6153.0,5048.16
0062x00000ENuANAA1,0010K00001vJgeGQAS,Riverstone,NSW,Australia,Loan Paid,Existing Client-Granted Loan Before,0.0,29.53,2235.0786,2.0,0.0,0.0,3.0,2.0,9458.5704,0.0,43.0,2095.6308,4353.5342,4448.5,0.0,0.0,0.0,0.0,10833.33,1499.0,1000.0,3500,4194.23,8.0,15.286,Fortnightly,50.0,9470.08,3500.0,Full-Time Employment,0.0,0.0,0.0,0.0,10158.2466,3746.0,4395.11,524.28,MoneySpot,0.0,6217107,0.0,15-08-2023,False,Medical Expenses,2023-08-15,Green,0.0,12092.0,9470.08
0062x00000Dr1SDAAZ,0012x00000MhCKLAA3,Bayswater,VIC,Australia,Closed Lost,Existing Client-Granted Loan Before,0.0,77.43,2761.8932,4.0,1.0,0.0,3.0,4.0,5799.1332,0.0,11.0,0.0,1718.425,1890.92,0.0,0.0,0.0,0.0,0.0,899.0,800.0,3100,3928.1,12.0,24.143,Fortnightly,22.0,6787.51,5000.0,Full-Time Employment,15.0,0.0,0.1209,0.0,4582.4666,1175.0,5571.1766,327.35,MoneySpot,,5141787,15.0,26-04-2023,False,Other Expenses,2023-04-26,Green,0.0,9109.0,6787.51
0062x00000DUxjqAAD,0010K00001yn4FlQAI,Hampton,VIC,Australia,Loan Paid,Existing Client-Granted Loan Before,0.22,49.54,4191.3897,4.0,0.0,0.0,3.0,4.0,2281.5766,1.0,127.0,1653.1796,1255.946,1591.81,1.0,0.0,0.0,0.0,5065.67,1499.0,100.0,3500,4346.07,24.0,23.857,Weekly,47.0,8552.76,3500.0,Full-Time Employment,1.0,0.0,0.0879,0.0,2093.2433,2425.0,4195.6633,181.09,MoneySpot,-0.24,5403392,0.0,26-05-2023,False,Travel Expenses,2023-05-26,Green,17.0,7468.0,8552.76
0062x00000FhCJ5AAN,0010K000022OJ6PQAW,Kepnock,QLD,Australia,Closed Lost,Existing Client-Granted Loan Before,62.17,35.64,820.4621,4.0,0.0,4.0,4.0,4.0,4613.4674,0.0,9.0,0.0,599.225,655.4,0.0,2.46,0.0,0.0,2275.0,599.0,600.0,3500,4168.3,7.0,13.571,Fortnightly,40.0,4613.47,3500.0,Unemployed,0.0,0.0,0.0,0.0,3006.38,583.0,1718.3066,595.48,Financier-2,,7875415,0.0,2024-01-16,False,Home Maintenance & Repairs,2024-01-16,Orange,3006.0,4835.0,4613.47
0062x00000DVogWAAT,0012x00000NRTIVAA5,Truganina,VIC,Australia,Loan Paid,Existing Client-Granted Loan Before,0.0,47.26,1903.5433,2.0,1.0,0.0,5.0,2.0,4453.8668,3.0,25.0,0.0,2050.0,2108.0,0.0,0.58,0.0,0.0,5548.41,400.0,1600.0,3200,4003.74,12.0,23.143,Fortnightly,31.0,10804.04,5000.0,Full-Time Employment,3.0,0.0,0.1648,1.0,2050.0,492.0,2396.0233,333.65,MoneySpot,0.0,5477668,3.0,02-06-2023,False,Living Expenses,2023-06-02,Green,0.0,9650.0,10804.04
0062x00000ENy6KAAT,0012x00000kgw0HAAQ,Waterview Heights,NSW,Australia,Closed Lost,New Client-New Loan,0.0,91.28,0.0,0.0,0.0,0.0,0.0,0.0,0.0,4.0,11.0,0.0,0.0,0.0,0.0,3.33,0.0,0.0,8450.0,400.0,0.0,3500,4138.36,2.0,8.857,Monthly,34.0,8319.11,3500.0,Full-Time Employment,7.0,0.0,0.0,6.0,0.0,0.0,1495.25,2069.18,MoneySpot,,6219927,0.0,15-08-2023,False,Living Expenses,2023-08-15,Orange,0.0,2309.0,8319.11
0062x00000FUbaOAAT,0012x00000TJBXsAAP,Gailes,QLD,Australia,Closed Lost,Existing Client-Granted Loan Before,0.02,33.93,326.5133,4.0,0.0,2.0,4.0,4.0,6067.8949,2.0,19.0,54.9632,3803.7925,4944.77,0.0,0.0,0.0,0.0,1391.41,599.0,2140.0,3500,4300.64,4.0,17.571,Monthly,38.0,5073.9,3500.0,Part-Time Employment,2.0,0.0,0.0,0.0,5073.7233,541.0,922.1833,1075.16,MoneySpot,,7521674,0.0,20-12-2023,False,Living Expenses,2023-12-15,Green,2.0,6827.0,5073.9
0062x00000DtKImAAN,0012x00000TJOyEAAX,Granville,NSW,Australia,Loan Paid,Existing Client-Granted Loan Before,0.0,46.95,1366.5346,2.0,0.0,0.0,4.0,2.0,5125.5052,2.0,31.0,827.9634,1350.995,1244.11,1.0,0.0,0.0,0.0,5682.44,400.0,1180.0,3500,4262.99,10.0,19.143,Fortnightly,34.0,5130.51,3500.0,Part-Time Employment,2.0,0.0,0.033,1.0,3925.07,909.0,1523.07,426.31,MoneySpot,0.0,5305163,0.0,18-05-2023,False,Vehicle Expenses,2023-05-18,Orange,0.0,7923.0,5130.51
0062x00000E3yevAAB,0012x00000cwXxZAAU,Parkes,NSW,Australia,Loan Paid,Existing Client-Granted Loan Before,0.68,49.78,2172.9893,4.0,0.0,0.0,2.0,4.0,3733.2999,0.0,15.0,719.7887,607.8277,117.16,1.0,0.4,0.0,1.0,0.0,599.0,480.0,3150,3943.42,12.0,23.0,Fortnightly,45.0,8019.46,5000.0,Casual/Contract,0.0,0.0,0.2308,0.0,3945.62,663.0,2734.7133,328.62,MoneySpot,0.0,5530725,0.0,07-06-2023,False,Travel Expenses,2023-06-07,Green,26.0,3776.0,8019.46
0062x00000DArrZAAT,0012x00000g7meIAAQ,Willetton,WA,Australia,Loan Paid,Existing Client-Granted Loan Before,0.0,49.66,2848.7274,4.0,0.0,0.0,4.0,4.0,16622.5011,0.0,0.0,0.0,2528.48,3905.66,0.0,0.0,0.0,1.0,5633.33,400.0,1980.0,3050,3707.82,16.0,15.714,Weekly,41.0,16850.06,3050.0,Part-Time Employment,0.0,0.0,0.0,0.0,4638.6666,341.0,3921.3266,231.74,MoneySpot,0.0,4649025,0.0,09-02-2023,False,Home Maintenance & Repairs,2023-02-09,Green,0.0,19235.0,16850.06
0062x00000ENi5RAAT,0012x00000BGf3jAAD,Blackett,NSW,Australia,Loan Paid,Existing Client-Granted Loan Before,0.0,40.62,5403.1312,4.0,0.0,0.0,6.0,4.0,990.9532,2.0,65.0,880.4824,120.7144,50.0,1.0,0.0,0.0,1.0,0.0,599.0,1000.0,3100,3949.84,26.0,26.286,Weekly,23.0,7049.4,3100.0,Full-Time Employment,2.0,0.0,0.044,1.0,0.0,2670.0,5576.6733,151.92,MoneySpot,0.0,6198368,2.0,13-08-2023,False,Vehicle Expenses,2023-08-13,Orange,0.0,9180.0,7049.4
0062x00000E6H7XAAV,0012x00000VddN8AAJ,Wellard,WA,Australia,Loan Paid,Existing Client-Granted Loan Before,0.29,62.13,773.346,0.0,0.0,0.0,0.0,0.0,1866.67,3.0,39.0,0.0,0.0,0.0,0.0,0.0,0.0,0.0,5946.5,599.0,3000.0,3250,4017.76,20.0,20.429,Weekly,55.0,8489.48,3250.0,Full-Time Employment,3.0,0.0,0.1209,1.0,0.0,806.0,1829.24,200.89,MoneySpot,-0.26,5726877,0.0,26-06-2023,False,Child Expenses,2023-06-25,Orange,27.0,9078.0,8489.48
0062x00000FWMX2AAP,0012x00000RrGhRAAV,EDMONDSON PARK,NSW,Australia,Closed Lost,Existing Client-Granted Loan Before,0.0,55.68,3031.9297,2.0,0.0,0.0,3.0,2.0,4981.0365,0.0,27.0,0.0,1832.3683,1745.68,1.0,12.92,0.0,0.0,3249.99,400.0,1640.0,3200,3929.68,10.0,19.0,Fortnightly,38.0,4914.37,4000.0,Full-Time Employment,0.0,0.0,0.0,0.0,3664.7366,2338.0,4043.39,392.97,MoneySpot,,7663608,0.0,28-12-2023,False,Furniture or Appliances,2023-12-28,Orange,0.0,7316.0,4914.37
0062x00000F299oAAB,0010K00001vGtWcQAK,Pemberton,WA,Australia,Loan Paid,Existing Client-Granted Loan Before,8.35,63.4,4899.1436,2.0,0.0,1.0,3.0,2.0,5486.2965,15.0,7.0,1822.4836,2146.54,2205.56,1.0,1.47,0.0,0.0,4493.67,599.0,1050.0,3300,4333.82,18.0,35.143,Fortnightly,47.0,9886.29,3300.0,Full-Time Employment,16.0,0.0,0.5495,5.0,9747.1033,4475.0,6164.5033,240.77,MoneySpot,0.0,6947652,2.0,26-10-2023,False,Vehicle Expenses,2023-10-25,Orange,637.0,7626.0,9886.29
0062x00000EDycAAAT,0010K000020JfhDQAS,Bankstown,NSW,Australia,Loan Paid,Existing Client-Granted Loan Before,0.0,94.56,1044.8125,4.0,0.0,0.0,1.0,4.0,107.8333,0.0,16.0,0.0,54.75,50.0,0.0,3.62,0.0,1.0,2946.67,400.0,100.0,3500,4479.0,16.0,30.857,Fortnightly,48.0,5550.79,3500.0,Part-Time Employment,0.0,0.0,0.7692,0.0,3619.2533,971.0,2524.5433,279.94,MoneySpot,0.0,5980175,0.0,22-07-2023,False,Vehicle Expenses,2023-07-22,Orange,0.0,552.0,5550.79
0062x00000DXIFhAAP,0012x00000WtF7hAAF,Craigie,WA,Australia,Loan Paid,Existing Client-Granted Loan Before,0.57,75.02,1827.45,2.0,0.0,0.0,2.0,2.0,4414.7601,0.0,20.0,1073.8626,2002.0,2002.0,0.0,0.28,0.0,0.0,5769.54,1499.0,740.0,3100,3917.74,12.0,23.857,Fortnightly,30.0,5049.57,5000.0,Full-Time Employment,0.0,0.0,0.0,0.0,5060.9166,2017.0,4518.2933,326.49,MoneySpot,0.0,4964383,0.0,30-03-2023,False,Living Expenses,2023-03-30,Green,39.0,6729.0,5049.57
0062x00000Ef9wsAAB,0012x00000KMuLMAA1,Manly Vale,NSW,Australia,Loan Paid,Existing Client-Granted Loan Before,0.12,26.13,1624.7466,3.0,0.0,0.0,4.0,3.0,12856.0932,0.0,53.0,1584.1406,11793.1566,11793.16,1.0,0.6,0.0,0.0,10900.0,1499.0,3600.0,3500,4297.77,4.0,17.571,Monthly,50.0,12856.09,3500.0,Full-Time Employment,0.0,0.0,0.0,0.0,11793.1566,3476.0,10918.6033,1074.45,MoneySpot,3.26,6548707,0.0,16-09-2023,False,Vehicle Expenses,2023-09-16,Green,27.0,21941.0,12856.09
0062x00000EeLUaAAN,0012800001SDTJkAAP,Geelong West,VIC,Australia,Loan Paid,Existing Client-Granted Loan Before,0.0,59.37,4433.4431,2.0,0.0,0.0,3.0,2.0,11271.8935,2.0,12.0,0.0,5188.16,5355.03,1.0,0.0,0.0,0.0,0.0,1500.0,1320.0,3500,4199.61,8.0,15.429,Fortnightly,44.0,11674.27,3500.0,Full-Time Employment,2.0,0.0,0.0,0.0,12105.7066,1350.0,4915.4633,524.96,MoneySpot,0.0,6482524,0.0,11-09-2023,False,Relocation Expenses,2023-09-10,Green,0.0,12629.0,11674.27
0062x00000Ds9AAAAZ,0010K00002ARFMfQAP,Butler,WA,Australia,Loan Paid,Existing Client-Granted Loan Before,23.23,98.31,3194.2081,2.0,0.0,4.0,2.0,2.0,4767.3988,0.0,29.0,0.0,1187.02,981.43,0.0,0.2,0.0,0.0,2816.67,400.0,200.0,3500,4306.97,10.0,20.286,Fortnightly,44.0,8451.19,3500.0,Part-Time Employment,0.0,0.0,0.0,0.0,4488.4966,1252.0,4841.4433,430.7,MoneySpot,0.0,5221654,0.0,09-05-2023,False,Life Event Expenses,2023-05-09,Orange,2141.0,9216.0,8451.19
0062x00000EwAKQAA3,0012x00000Ws837AAB,Willaston,SA,Australia,Loan Paid,Existing Client-Granted Loan Before,0.0,59.42,4995.5726,2.0,0.0,0.0,4.0,2.0,6368.9108,1.0,34.0,1149.8932,2922.2366,2947.08,1.0,1.31,1.0,0.0,5712.48,400.0,860.0,3500,4205.03,8.0,15.571,Fortnightly,53.0,6368.91,3500.0,Full-Time Employment,1.0,0.0,0.2198,1.0,5844.4733,1646.0,5698.4966,525.63,MoneySpot,0.0,6566352,1.0,18-09-2023,False,Living Expenses,2023-09-18,Green,0.0,9339.0,6368.91
0062x00000DqxdlAAB,0012x00000XDztbAAD,Sunnybank Hills,QLD,Australia,Loan Paid,Existing Client-Granted Loan Before,9.39,77.82,7785.1728,2.0,0.0,2.0,3.0,2.0,7291.3502,1.0,47.0,715.5304,2884.0266,2425.12,0.0,0.0,0.0,0.0,4853.33,1499.0,1120.0,3100,3928.1,12.0,24.143,Fortnightly,45.0,7697.68,3250.0,Full-Time Employment,1.0,0.0,0.011,1.0,6319.0733,1985.0,9978.8933,327.35,MoneySpot,0.0,5139097,1.0,26-04-2023,False,Vehicle Expenses,2023-04-25,Green,853.0,9075.0,7697.68
0062x00000Ey1yrAAB,0010K00001mh6JqQAI,Hurstville Grove,NSW,Australia,Loan Paid,Existing Client-Granted Loan Before,0.0,80.32,3088.3955,2.0,0.0,0.0,4.0,2.0,6314.7707,0.0,7.0,0.0,2906.525,2723.18,1.0,0.0,0.0,0.0,7150.0,400.0,0.0,3150,3797.49,8.0,14.714,Fortnightly,53.0,6427.53,3150.0,Full-Time Employment,0.0,0.0,0.0,0.0,5813.05,0.0,3771.3433,474.69,MoneySpot,0.0,6706203,0.0,01-10-2023,False,Travel Expenses,2023-10-01,Green,0.0,7594.0,6427.53
0062x00000E7YJbAAN,0010K00001iI7RIQA0,Maddington,WA,Australia,Loan Paid,Existing Client-Granted Loan Before,0.0,88.09,3911.0113,1.0,0.0,0.0,4.0,1.0,9892.7855,0.0,95.0,1432.8423,2040.723,2052.12,1.0,0.0,0.0,0.0,4940.0,1499.0,2300.0,3500,4343.78,23.0,23.286,Weekly,45.0,8867.43,5000.0,Full-Time Employment,0.0,1.0,0.0,0.0,8843.1333,2280.0,7065.05,188.86,MoneySpot,0.0,5831361,0.0,05-07-2023,False,Travel Expenses,2023-07-04,Green,0.0,9876.0,8867.43
0062x00000DYovdAAD,0012800001SDTysAAH,Wantirna South,VIC,Australia,Closed Lost,Existing Client-Granted Loan Before,0.23,75.12,2977.8137,2.0,0.0,0.0,4.0,2.0,5151.344,0.0,39.0,1853.9678,2363.8533,2988.92,0.0,0.07,1.0,0.0,0.0,599.0,240.0,3100,3893.15,12.0,23.143,Fortnightly,34.0,5151.34,5000.0,Full-Time Employment,0.0,0.0,0.8681,0.0,4727.7066,2289.0,5043.57,324.44,MoneySpot,,5054888,0.0,13-04-2023,False,Medical Expenses,2023-04-13,Green,13.0,5512.0,5151.34
0062x00000EwK02AAF,0012x00000g9n3iAAA,Docklands,VIC,Australia,Closed Lost,Existing Client-Granted Loan Before,0.0,50.12,2281.5991,2.0,0.0,0.0,3.0,2.0,9421.6935,0.0,83.0,254.2326,1932.142,2485.98,1.0,0.0,0.0,0.0,0.0,899.0,1200.0,3500,4478.06,30.0,30.286,Weekly,28.0,9421.69,3500.0,Employed full-time,3.0,0.0,0.5714,1.0,4502.52,735.0,2597.7933,149.28,MoneySpot,,6579127,0.0,19-09-2023,False,Relocation Expenses,2023-09-19,Green,0.0,8004.0,9421.69
0062x00000ENCksAAH,0012x00000Wsg4vAAB,South Brisbane,QLD,Australia,Loan Paid,Existing Client-Granted Loan Before,0.0,39.13,429.0362,4.0,0.0,0.0,3.0,4.0,4611.6233,0.0,28.0,43.4524,1976.41,2135.09,0.0,0.0,0.0,0.0,8603.19,899.0,1200.0,3500,4409.72,13.0,26.0,Fortnightly,33.0,4611.62,3500.0,Full-Time Employment,0.0,0.0,0.0,0.0,4611.6233,1169.0,2070.9033,339.21,MoneySpot,0.0,6156670,0.0,10-08-2023,False,Furniture or Appliances,2023-08-09,Green,0.0,7314.0,4611.62
0062x00000EzJvSAAV,0010K00001rHH93QAG,Ayr,QLD,Australia,Loan Paid,Existing Client-Granted Loan Before,0.0,71.26,3641.8181,1.0,0.0,0.0,2.0,1.0,7445.7398,6.0,84.0,1337.6041,1163.8969,880.05,1.0,0.0,0.0,0.0,4181.67,899.0,310.0,3500,4276.59,20.0,20.0,Weekly,52.0,7780.74,3500.0,Full-Time Employment,6.0,0.0,0.978,0.0,5043.5533,2193.0,3574.9066,213.83,MoneySpot,0.0,6800518,1.0,11-10-2023,False,Home Maintenance & Repairs,2023-10-10,Green,0.0,8900.0,7780.74
0062x00000DUd2NAAT,0012x00000g8ECUAA2,Burleigh Waters,QLD,Australia,Loan Paid,Existing Client-Granted Loan Before,0.0,63.2,886.3416,1.0,0.0,0.0,3.0,1.0,8032.3453,2.0,49.0,1206.3416,1409.8116,1062.31,0.0,0.0,1.0,0.0,4570.76,599.0,400.0,3500,4207.56,16.0,16.143,Weekly,23.0,8032.35,3500.0,Full-Time Employment,2.0,0.0,0.1429,2.0,5639.2466,700.0,1364.02,262.98,MoneySpot,0.0,5377164,0.0,24-05-2023,False,Living Expenses,2023-05-24,Green,0.0,7546.0,8032.35
0062x00000EDXMvAAP,0012x00000g8xxaAAA,West Kempsey,NSW,Australia,Loan Paid,Existing Client-Granted Loan Before,0.0,71.58,982.5933,4.0,0.0,0.0,1.0,4.0,1076.6666,0.0,2.0,0.0,358.8888,200.0,0.0,0.0,0.0,1.0,4333.33,400.0,0.0,3500,4609.65,18.0,36.143,Fortnightly,43.0,1076.67,4500.0,Full-Time Employment,0.0,0.0,0.0769,0.0,0.0,678.0,1197.9666,256.1,Financier-2,-0.32,5949961,0.0,19-07-2023,False,Relocation Expenses,2023-07-19,Orange,0.0,8532.0,1076.67
0062x00000DWW0OAAX,0012x00000gqTdPAAU,Gawler,SA,Australia,Closed Lost,New Client-New Loan,0.0,51.16,497.5,1.0,0.0,0.0,3.0,1.0,6836.3716,3.0,3.0,0.0,1009.62,1064.15,0.0,0.0,0.0,0.0,1035.0,2000.0,150.0,3050,3619.91,10.0,10.0,Weekly,26.0,7783.44,3050.0,Casual Employment,3.0,0.0,0.0,3.0,2019.24,0.0,1013.68,362.0,MoneySpot,,4920018,0.0,27-03-2023,False,Other Expenses,2023-03-23,Orange,0.0,6200.0,7783.44
0062x00000FHa8EAAT,0012x00000hZ1Y6AAK,Railton,TAS,Australia,Loan Paid,Existing Client-Granted Loan Before,0.0,54.19,3600.4351,1.0,0.0,0.0,3.0,1.0,5195.6875,0.0,29.0,0.0,1148.5423,1073.18,1.0,0.03,0.0,0.0,4550.0,400.0,440.0,3450,4541.72,36.0,36.429,Weekly,25.0,5195.69,5000.0,Full-Time Employment,0.0,0.0,0.0,0.0,4977.0166,2934.0,3622.7,126.17,MoneySpot,0.0,7181667,0.0,13-11-2023,False,Living Expenses,2023-11-13,Green,0.0,6542.0,5195.69
0062x00000EeBVDAA3,0012x00000g7iMmAAI,South Mackay,QLD,Australia,Loan Paid,Existing Client-Granted Loan Before,0.0,65.74,1039.6325,0.0,1.0,0.0,0.0,0.0,0.0,6.0,32.0,0.0,0.0,0.0,0.0,2.2,0.0,0.0,5615.29,599.0,200.0,3500,4261.22,18.0,18.571,Weekly,25.0,5066.75,3500.0,Full-Time Employment,14.0,0.0,0.0,9.0,0.0,619.0,2400.57,236.74,MoneySpot,0.0,6469626,8.0,09-09-2023,False,Life Event Expenses,2023-09-09,Orange,0.0,6601.0,5066.75
0062x00000FKR5QAAX,0010K00001rGvFrQAK,Berry Springs,NT,Australia,Closed Lost,Existing Client-Granted Loan Before,0.21,63.65,1436.7287,2.0,1.0,0.0,4.0,2.0,6408.6883,16.0,69.0,266.1458,2810.1366,2624.74,1.0,0.0,0.0,0.0,4333.33,599.0,800.0,3250,3940.99,7.0,14.714,Fortnightly,43.0,6429.69,3250.0,Full-Time Employment,16.0,0.0,0.8132,10.0,5620.2733,1193.0,4734.2666,563.0,MoneySpot,,7391928,6.0,04-12-2023,False,Relocation Expenses,2023-12-03,Orange,14.0,6587.0,6429.69
0062x00000EC6ouAAD,0012x00000g8bCCAAY,Randwick,NSW,Australia,Loan Paid,Existing Client-Granted Loan Before,12.25,32.0,2434.2533,3.0,0.0,4.0,4.0,3.0,9216.6498,6.0,31.0,1609.8048,5975.6666,5975.67,0.0,0.0,0.0,1.0,5416.67,599.0,400.0,3500,4391.63,6.0,24.429,Monthly,34.0,9466.65,5000.0,Full-Time Employment,6.0,0.0,0.6484,1.0,1286.8166,1342.0,3380.3066,731.94,MoneySpot,0.0,5854891,5.0,07-07-2023,False,Vehicle Expenses,2023-07-07,Orange,1287.0,10499.0,9466.65
0062x00000EbT8XAAV,0012x00000OyQ0CAAV,Pooraka,SA,Australia,Loan Paid,Existing Client-Granted Loan Before,0.0,68.5,1415.0593,1.0,0.0,0.0,2.0,1.0,4631.4287,2.0,47.0,0.0,709.6616,694.95,0.0,1.07,0.0,0.0,1672.12,400.0,50.0,3500,4319.77,22.0,22.143,Weekly,35.0,4996.98,3500.0,Full-Time Employment,2.0,0.0,0.033,0.0,2838.6466,586.0,1749.2566,196.36,MoneySpot,-0.01,6292315,1.0,22-08-2023,False,Other Expenses,2023-08-22,Green,0.0,5787.0,4996.98
0062x00000DHlliAAD,0012x00000fltEkAAI,White Hills,VIC,Australia,Loan Paid,Existing Client-Granted Loan Before,0.0,67.84,1594.2197,1.0,0.0,0.0,2.0,1.0,3071.9752,0.0,30.0,0.0,494.8557,502.46,1.0,0.0,0.0,0.0,0.0,400.0,0.0,3200,4018.64,25.0,25.571,Weekly,34.0,3723.76,5000.0,,0.0,0.0,0.044,0.0,3009.3266,1043.0,1993.98,162.21,MoneySpot,0.0,4797341,0.0,04-03-2023,False,Medical Expenses,2023-03-04,Green,0.0,7216.0,3723.76
0062x00000FID8JAAX,0010K00001mF9HgQAK,Kallangur,QLD,Australia,Loan Paid,Existing Client-Granted Loan Before,0.0,73.29,2581.7735,1.0,0.0,0.0,1.0,1.0,740.9533,0.0,35.0,1322.0125,106.3636,100.0,1.0,0.0,0.0,1.0,4745.0,1499.0,100.0,3500,4481.08,15.0,29.857,Fortnightly,39.0,6798.84,3500.0,Full-Time Employment,0.0,0.0,0.0,0.0,5924.5566,1335.0,7318.95,298.75,MoneySpot,0.0,7232463,0.0,17-11-2023,False,Vehicle Expenses,2023-11-17,Orange,0.0,3680.0,6798.84
0062x00000FwptjAAB,0012x00000kZhozAAC,Taringa,QLD,Australia,Loan Paid,Existing Client-Granted Loan Before,0.0,84.36,3803.553,2.0,0.0,0.0,3.0,2.0,5082.8413,0.0,57.0,256.6298,2312.6666,3406.0,0.0,14.14,6.0,0.0,4394.0,899.0,488.0,3250,3905.02,8.0,14.714,Fortnightly,41.0,5082.84,3250.0,Full-Time Employment,0.0,0.0,0.011,0.0,4625.3333,1997.0,5096.43,488.13,MoneySpot,0.0,8409940,0.0,2024-03-09,False,Home Maintenance & Repairs,2024-03-09,Orange,0.0,4944.0,5082.84
0062x00000FVSc9AAH,0012x00000WtHxdAAF,Springwood,QLD,Australia,Loan Paid,Existing Client-Granted Loan Before,0.0,49.2,3217.8885,1.0,0.0,0.0,5.0,1.0,10471.6854,0.0,13.0,0.0,2625.32,2910.67,0.0,0.11,0.0,1.0,9100.0,1500.0,1200.0,3500,4175.19,16.0,16.286,Weekly,43.0,10471.69,3500.0,Self Employed,0.0,0.0,0.0,0.0,0.0,586.0,3222.8533,263.33,MoneySpot,0.02,7593902,0.0,21-12-2023,False,Other Expenses,2023-12-21,Orange,0.0,11889.0,10471.69
0062x00000DAgONAA1,0012x00000TtYw7AAF,Yangebup,WA,Australia,Loan Paid,Existing Client-Granted Loan Before,0.0,34.17,5636.94,2.0,2.0,0.0,5.0,2.0,10046.5866,4.0,12.0,0.0,5023.2933,4305.68,0.0,0.02,0.0,0.0,10330.91,1500.0,2000.0,3250,3931.36,7.0,14.429,Fortnightly,54.0,10316.59,3250.0,Full-Time Employment,23.0,0.0,0.0989,4.0,10046.5866,0.0,6900.2733,561.63,MoneySpot,0.0,4640825,13.0,08-02-2023,False,Medical Expenses,2023-02-08,Green,0.0,10848.0,10316.59
0062x00000F2ZmdAAF,0012x00000SFwcjAAD,Norlane,VIC,Australia,Loan Paid,Existing Client-Granted Loan Before,0.0,63.27,1551.0679,2.0,0.0,0.0,3.0,2.0,5349.4339,14.0,73.0,454.7505,2462.2057,2620.02,0.0,0.29,0.0,0.0,4665.08,899.0,1600.0,3400,4102.15,8.0,15.714,Fortnightly,39.0,5349.43,3400.0,Full-Time Employment,14.0,0.0,0.1978,0.0,5745.1466,973.0,1710.34,512.77,MoneySpot,0.0,6979922,1.0,28-10-2023,False,Vehicle Expenses,2023-10-28,Green,0.0,6454.0,5349.43
0062x00000DGKvMAAX,0012x00000XJtjYAAT,Queanbeyan East,NSW,Australia,Loan Paid,Existing Client-Granted Loan Before,0.0,71.34,3614.7218,2.0,0.0,0.0,4.0,2.0,11313.9875,0.0,13.0,832.0,2891.4357,3138.34,1.0,0.0,0.0,0.0,5164.82,599.0,600.0,3500,4279.64,10.0,19.571,Fortnightly,38.0,9158.65,5000.0,Full-Time Employment,0.0,0.0,0.1978,0.0,6746.6833,1828.0,8910.9766,427.97,MoneySpot,0.0,4717973,0.0,20-02-2023,False,Travel Expenses,2023-02-20,Orange,0.0,12655.0,9158.65
0062x00000ECVVIAA5,0012x00000XJue7AAD,Surrey Hills,VIC,Australia,Closed Lost,Existing Client-Granted Loan Before,0.0,97.54,3243.9605,2.0,0.0,0.0,3.0,2.0,7042.0424,8.0,52.0,339.6673,2382.0571,2358.9,1.0,54.5,0.0,0.0,6152.21,899.0,200.0,3500,4157.33,7.0,13.286,Fortnightly,35.0,7149.97,3500.0,Part-Time Employment,8.0,0.0,0.1319,6.0,5558.1333,1444.0,4243.82,593.91,MoneySpot,,5883072,4.0,11-07-2023,False,Travel Expenses,2023-07-11,Orange,0.0,7585.0,7149.97
0062x00000DVy0dAAD,0012x00000TGsykAAD,Marsden Park,NSW,Australia,Loan Paid,Existing Client-Granted Loan Before,0.0,31.4,2821.5574,2.0,0.0,0.0,2.0,2.0,6122.4369,0.0,8.0,675.135,1670.7266,1700.45,0.0,0.75,0.0,0.0,4392.72,899.0,700.0,3150,3928.48,12.0,24.571,Fortnightly,51.0,6122.44,5000.0,Full-Time Employment,0.0,0.0,0.2967,0.0,5978.6366,799.0,3065.2933,333.34,MoneySpot,0.0,4886581,0.0,18-03-2023,False,Vehicle Expenses,2023-03-18,Green,0.0,6707.0,6122.44
0062x00000DtxufAAB,0012x00000fmJZgAAM,Harden,NSW,Australia,Closed Lost,Existing Client-Granted Loan Before,0.0,56.9,2143.5132,1.0,0.0,0.0,7.0,1.0,5725.4782,0.0,25.0,680.1701,1317.6446,1618.5,0.0,1.05,0.0,0.0,5579.28,400.0,400.0,3500,4202.16,16.0,16.0,Weekly,30.0,5725.48,3500.0,Full-Time Employment,0.0,0.0,0.022,0.0,5709.7933,678.0,2122.0533,262.64,MoneySpot,,5362630,0.0,23-05-2023,False,Other Expenses,2023-05-22,Green,0.0,6209.0,5725.48
0062x00000DV7dhAAD,0010K00001y3iVgQAI,California Gully,VIC,Australia,Loan Paid,Existing Client-Granted Loan Before,0.0,70.49,2002.2725,1.0,0.0,0.0,3.0,1.0,6217.0722,0.0,47.0,534.7065,1286.4269,1259.0,0.0,0.0,0.0,0.0,3120.0,599.0,400.0,3500,4185.66,16.0,16.571,Weekly,36.0,6469.91,3500.0,Full-Time Employment,0.0,0.0,0.3516,0.0,5574.5166,2125.0,2178.86,263.98,MoneySpot,0.0,5422642,0.0,29-05-2023,False,Living Expenses,2023-05-28,Green,0.0,8612.0,6469.91
0062x00000EzAN2AAN,0010K00002ACsqCQAT,Calwell,ACT,Australia,Loan Paid,Existing Client-Granted Loan Before,0.0,72.7,2514.5761,2.0,0.0,0.0,4.0,2.0,7980.7827,4.0,61.0,500.0994,3673.3466,3872.13,0.0,0.0,0.0,0.0,0.0,599.0,530.0,3500,4504.03,15.0,30.429,Fortnightly,52.0,8748.97,3500.0,Full-Time Employment,5.0,1.0,0.0,1.0,7346.6933,1913.0,3859.8833,300.28,MoneySpot,0.0,6789438,0.0,10-10-2023,False,Home Maintenance & Repairs,2023-10-09,Orange,0.0,8586.0,8748.97
0062x00000E5DEGAA3,0010K00001zUr9fQAC,Wendouree,VIC,Australia,Closed Lost,Existing Client-No Loan Granted Ever,0.0,46.62,1517.4974,0.0,1.0,0.0,0.0,0.0,0.0066,6.0,91.0,1984.7816,0.0,0.0,1.0,2.27,0.0,0.0,4225.0,400.0,1200.0,3500,4095.34,9.0,9.571,Weekly,48.0,6013.59,3500.0,Full-Time Employment,6.0,0.0,0.011,4.0,0.0,1418.0,5426.8466,455.04,MoneySpot,,5630830,6.0,16-06-2023,False,Rental bond and moving expenses as Ill be homeless as of the 30/06/23,2023-06-16,Orange,0.0,7344.0,6013.59
0062x00000DsQPyAAN,0012x00000g8LqUAAU,Broken Hill,NSW,Australia,Loan Paid,Existing Client-Granted Loan Before,0.09,58.6,2284.2423,4.0,0.0,0.0,3.0,4.0,5313.2699,0.0,13.0,813.683,3735.6033,4261.67,0.0,1.28,0.0,1.0,9061.39,599.0,400.0,3500,4301.5,10.0,20.143,Fortnightly,49.0,13569.88,5000.0,Full-Time Employment,0.0,0.0,0.2967,0.0,6094.44,874.0,3954.3866,430.16,MoneySpot,0.0,5238759,0.0,10-05-2023,False,Other Expenses,2023-05-10,Orange,13.0,13053.0,13569.88
0062x00000F3xc7AAB,0012x00000g8MCZAA2,Baldivis,WA,Australia,Closed Lost,Existing Client-Granted Loan Before,0.0,74.72,1393.6914,2.0,0.0,0.0,4.0,2.0,5122.8631,8.0,62.0,325.8929,1739.0433,1739.05,0.0,1.75,0.0,0.0,6213.64,400.0,1600.0,3250,4325.11,18.0,36.429,Fortnightly,38.0,7183.46,3250.0,Full-Time Employment,8.0,0.0,0.0549,0.0,6736.8533,714.0,1892.2466,240.29,MoneySpot,,7095822,0.0,07-11-2023,False,Travel Expenses,2023-11-06,Orange,0.0,6587.0,7183.46
0062x00000DJEpyAAH,0012x000003fJkVAAU,MERRYLANDS,NSW,Australia,Loan Paid,Existing Client-Granted Loan Before,0.0,72.82,2003.8748,1.0,0.0,0.0,4.0,1.0,7399.9689,0.0,26.0,1950.6438,1322.0984,1407.5,0.0,0.0,0.0,0.0,5200.0,400.0,300.0,3500,4314.31,22.0,22.0,Weekly,48.0,6811.5,3500.0,Full-Time Employment,0.0,0.0,0.0,0.0,5729.0933,1865.0,1865.1433,196.11,MoneySpot,0.0,4878177,0.0,17-03-2023,False,Medical Expenses,2023-03-16,Orange,0.0,8051.0,6811.5
0062x00000FVbE6AAL,0010K000023ztsKQAQ,The Gemfields,QLD,Australia,Loan Paid,Existing Client-Granted Loan Before,0.0,49.25,1771.0116,1.0,0.0,0.0,4.0,1.0,8419.4215,4.0,48.0,0.0,1660.8178,1693.7,1.0,3.95,0.0,0.0,6933.33,899.0,400.0,3100,3771.24,16.0,16.0,Weekly,35.0,8419.42,3100.0,Full-Time Employment,5.0,0.0,0.033,0.0,7750.4833,4029.0,4757.9233,235.71,MoneySpot,0.0,7605107,3.0,22-12-2023,False,Travel Expenses,2023-12-22,Green,0.0,8607.0,8419.42
0062x00000EbkU6AAJ,0012x00000BHv3WAAT,South Bathurst,NSW,Australia,Loan Paid,Existing Client-Granted Loan Before,0.0,77.18,3483.7656,2.0,0.0,0.0,3.0,2.0,3351.5971,1.0,19.0,0.0,1446.7342,1413.0,1.0,0.0,0.0,0.0,2600.0,899.0,700.0,3500,4603.53,18.0,36.0,Fortnightly,52.0,3351.6,3500.0,Full-Time Employment,1.0,0.0,0.0989,0.0,3375.7133,1046.0,3552.5433,255.76,MoneySpot,0.0,6311587,1.0,24-08-2023,False,Vehicle Expenses,2023-08-23,Orange,0.0,4272.0,3351.6
0062x00000FKvYbAAL,0012x00000hZ14iAAC,Glengarry,TAS,Australia,Loan Paid,Existing Client-Granted Loan Before,0.15,29.1,2859.7677,2.0,0.0,0.0,2.0,2.0,7770.5528,3.0,38.0,0.0,3146.2266,3131.35,1.0,0.08,0.0,0.0,0.0,899.0,800.0,3050,3729.24,8.0,15.857,Fortnightly,57.0,7770.55,3050.0,Full-Time Employment,3.0,0.0,0.3956,2.0,6292.4533,777.0,4267.3166,466.16,QuickCash,0.0,7424771,0.0,07-12-2023,False,Travel Expenses,2023-12-07,Green,14.0,9068.0,7770.55
0062x00000FIiQxAAL,0012x00000hYky0AAC,Nundah,QLD,Australia,Closed Lost,Existing Client-Granted Loan Before,0.0,50.76,446.185,4.0,0.0,0.0,3.0,4.0,3358.52,0.0,27.0,0.0,1119.5066,1229.89,1.0,0.0,0.0,0.0,0.0,1499.0,260.0,3500,4382.23,25.0,25.286,Weekly,39.0,3358.52,3500.0,,0.0,0.0,0.0769,0.0,3358.52,594.0,1622.04,175.29,MoneySpot,,7271450,0.0,21-11-2023,False,Furniture or Appliances,2023-11-21,Green,0.0,3626.0,3358.52
0062x00000DUjLMAA1,0012x00000TtbZ1AAJ,Strathfield,NSW,Australia,Loan Paid,Existing Client-Granted Loan Before,0.0,73.32,4189.8132,2.0,0.0,0.0,3.0,2.0,8392.9475,2.0,34.0,1276.7196,1499.76,1499.76,1.0,0.08,0.0,0.0,7882.18,599.0,500.0,3150,3943.38,12.0,23.0,Fortnightly,28.0,8660.73,5000.0,Part-Time Employment,2.0,0.0,0.022,1.0,6359.29,3686.0,4510.4133,328.62,MoneySpot,0.0,5386507,2.0,25-05-2023,False,Home Maintenance & Repairs,2023-05-24,Green,0.0,10499.0,8660.73
0062x00000DsbshAAB,0012x00000cKxbMAAS,Castletown,WA,Australia,Loan Paid,Existing Client-Granted Loan Before,0.0,88.24,1557.1143,4.0,0.0,0.0,3.0,4.0,5168.5415,1.0,17.0,807.0577,702.5017,900.81,0.0,3.27,0.0,1.0,4268.33,599.0,800.0,3500,4196.74,16.0,15.857,Weekly,35.0,4729.18,3500.0,Part-Time Employment,1.0,0.0,0.2308,1.0,0.0,719.0,912.85,262.3,MoneySpot,0.0,5251919,1.0,12-05-2023,False,Other Expenses,2023-05-12,Orange,0.0,5048.0,4729.18
0062x00000EzfkxAAB,0012x00000SIBFmAAP,Nanango,QLD,Australia,Loan Paid,Existing Client-Granted Loan Before,0.0,64.28,670.4214,1.0,0.0,0.0,2.0,1.0,6880.0066,0.0,28.0,0.0,956.0,956.0,0.0,0.05,0.0,0.0,3684.97,400.0,0.0,3500,4303.11,22.0,21.714,Weekly,38.0,4154.05,3500.0,Full-Time Employment,0.0,0.0,0.0,0.0,4142.6666,501.0,3904.48,195.6,QuickCash,0.0,6824609,0.0,13-10-2023,False,Living Expenses,2023-10-13,Green,0.0,9559.0,4154.05
0062x00000D7wPOAAZ,0010K00001sH3csQAC,Kenilworth,QLD,Australia,Loan Paid,Existing Client-Granted Loan Before,0.0,81.23,3161.1738,0.0,2.0,0.0,0.0,0.0,2163.3366,7.0,108.0,1919.2032,0.0,0.0,7.0,26.31,0.0,0.0,3683.33,599.0,200.0,3300,3981.8,16.0,15.857,Weekly,43.0,6306.64,3300.0,Full-Time Employment,7.0,0.0,0.1978,1.0,0.0,2098.0,3986.13,248.87,MoneySpot,0.02,4507267,7.0,19-01-2023,False,Veterinary Expenses,2023-01-19,Orange,0.0,6951.0,6306.64
0062x00000EcEEcAAN,0012x00000TtHntAAF,Sydney,NSW,Australia,Loan Paid,Existing Client-Granted Loan Before,0.05,65.23,7514.7049,2.0,1.0,0.0,3.0,2.0,13897.2783,10.0,86.0,856.7394,5859.8,5859.8,1.0,0.55,0.0,0.0,11840.83,899.0,5974.0,3450,4150.91,8.0,15.571,Fortnightly,70.0,13897.28,3450.0,Full-Time Employment,10.0,0.0,0.7033,4.0,13672.8666,3358.0,8580.7833,518.87,MoneySpot,0.0,6343216,6.0,27-08-2023,False,Furniture or Appliances,2023-08-27,Green,13.0,22102.0,13897.28
0062x00000EO2upAAD,0012x00000BFrgnAAD,WINSTON,QLD,Australia,Loan Paid,Existing Client-Granted Loan Before,3.35,73.26,2769.2868,2.0,0.0,2.0,3.0,2.0,5977.1564,12.0,42.0,0.0,1741.68,1838.09,1.0,0.0,0.0,0.0,3975.31,1499.0,200.0,3250,3915.28,8.0,15.0,Fortnightly,30.0,5189.39,3250.0,Full-Time Employment,12.0,0.0,0.1978,2.0,5124.39,569.0,2843.2066,489.42,MoneySpot,0.0,6227409,8.0,16-08-2023,False,Living Expenses,2023-08-16,Green,214.0,6384.0,5189.39
0062x00000DtNBjAAN,0010K00001wFUMiQAO,Ardeer,VIC,Australia,Loan Paid,Existing Client-Granted Loan Before,3.99,87.15,8660.2437,2.0,0.0,0.0,3.0,2.0,10440.6087,1.0,83.0,4363.9622,3894.9657,3895.04,0.0,0.91,0.0,0.0,7098.0,899.0,200.0,3200,4035.4,12.0,24.0,Fortnightly,54.0,10821.83,3500.0,Full-Time Employment,1.0,0.0,0.3956,1.0,9088.2533,5682.0,9279.0533,336.29,MoneySpot,0.0,5310124,0.0,18-05-2023,False,Medical Expenses,2023-05-18,Green,601.0,15057.0,10821.83
0062x00000D1SjaAAF,0012x00000IN2ztAAD,Blacktown,NSW,Australia,Loan Paid,Existing Client-Granted Loan Before,0.0,77.02,4322.7152,2.0,1.0,0.0,3.0,2.0,15822.7487,8.0,42.0,57.8112,3340.415,3322.8,0.0,0.0,0.0,0.0,6500.0,899.0,1500.0,3200,3916.21,8.0,16.571,Fortnightly,44.0,10773.42,3200.0,Full-Time Employment,25.0,0.0,0.0549,9.0,9862.83,2146.0,4415.33,489.53,MoneySpot,-0.12,4390913,23.0,02-01-2023,False,Living Expenses,2023-01-01,Orange,0.0,15905.0,10773.42
0062x00000FXJHQAA5,0012x00000dwlhBAAQ,Deer Park,VIC,Australia,Loan Paid,Existing Client-Granted Loan Before,0.25,74.72,1339.5586,2.0,0.0,0.0,3.0,2.0,6631.535,0.0,39.0,0.0,1898.5685,1753.27,0.0,0.0,0.0,0.0,0.0,400.0,820.0,3500,4215.57,8.0,15.857,Fortnightly,49.0,7493.12,5000.0,Full-Time Employment,0.0,0.0,0.011,0.0,4429.9933,1130.0,1385.0566,526.95,MoneySpot,-0.03,7740981,0.0,2024-01-05,False,Vehicle Expenses,2024-01-05,Orange,21.0,8324.0,7493.12
0062x00000GBjmYAAT,0012x00000XKweuAAD,Paraburdoo,WA,Australia,Closed Lost,Existing Client-Granted Loan Before,0.0,71.91,5289.8266,3.0,0.0,0.0,2.0,3.0,9844.32,0.0,13.0,3619.762,9843.63,14831.82,0.0,0.17,0.0,0.0,11039.96,1499.0,260.0,3050,3730.99,4.0,15.429,Monthly,45.0,15228.63,3050.0,Full-Time Employment,0.0,0.0,0.0,0.0,9843.63,4296.0,6362.6533,932.75,MoneySpot,,8709128,0.0,2024-04-03,False,Medical Expenses,2024-04-03,Orange,0.0,9844.0,15228.63
0062x00000GDqg0AAD,0012x00000fm68SAAQ,Gillen,NT,Australia,Closed Lost,Existing Client-Granted Loan Before,0.0,60.53,3078.3406,1.0,0.0,0.0,4.0,1.0,5154.4539,0.0,57.0,519.5023,1186.2307,1065.0,0.0,0.22,0.0,0.0,1075.0,400.0,500.0,3450,4132.28,16.0,16.571,Weekly,30.0,5154.45,3450.0,Full-Time Employment,0.0,0.0,0.0,0.0,5140.3333,1605.0,3362.2066,258.27,MoneySpot,,8425065,0.0,2024-03-16,False,Other Expenses,2024-03-11,Orange,0.0,7238.0,5154.45
0062x00000GFXaaAAH,0012x00000hZ1Y6AAK,Railton,TAS,Australia,Closed Lost,Existing Client-Granted Loan Before,0.0,55.62,863.4749,1.0,0.0,0.0,3.0,1.0,6135.1638,0.0,37.0,309.3592,1182.1753,1108.34,0.0,10.68,0.0,0.0,4550.0,400.0,440.0,3300,4052.09,20.0,19.857,Weekly,25.0,6135.16,5000.0,Full-Time Employment,0.0,0.0,0.0989,0.0,5122.76,1653.0,2936.1866,202.61,MoneySpot,,8563927,0.0,2024-03-23,False,Living Expenses,2024-03-22,Green,0.0,6228.0,6135.16
0062x00000DrxEQAAZ,0012x00000XOPJ8AAP,Orange,NSW,Australia,Closed Lost,Existing Client-Granted Loan Before,0.0,55.01,1734.6666,2.0,0.0,0.0,4.0,2.0,3706.6624,8.0,35.0,1002.3124,1616.02,1274.14,1.0,0.0,0.0,0.0,3250.0,599.0,800.0,3450,4124.12,8.0,14.857,Fortnightly,29.0,3706.66,3500.0,Part-Time Employment,8.0,0.0,0.1648,6.0,3232.04,923.0,1665.8833,515.52,MoneySpot,,5208643,0.0,06-05-2023,False,Living Expenses,2023-05-05,Green,0.0,3583.0,3706.66
0062x00000GDvI8AAL,0012x00000Vf122AAB,Joondalup,WA,Australia,Closed Lost,Existing Client-Granted Loan Before,27.95,39.57,3126.0476,2.0,0.0,2.0,4.0,2.0,6726.1789,2.0,34.0,0.0,2002.1,2002.1,0.0,11.61,0.0,0.0,0.0,400.0,1600.0,3100,3938.5,12.0,24.429,Fortnightly,56.0,6726.18,5000.0,,2.0,0.0,0.0,2.0,6034.0566,1961.0,6401.08,328.21,MoneySpot,,8431372,1.0,2024-03-12,False,Vehicle Expenses,2024-03-11,Green,2030.0,7261.0,6726.18
0062x00000DtgsLAAR,0010K00001urUOiQAM,Corio,VIC,Australia,Loan Paid,Existing Client-Granted Loan Before,12.78,68.56,1560.4315,2.0,0.0,2.0,2.0,2.0,4597.6038,1.0,95.0,1225.5744,1830.4183,1733.45,1.0,38.66,0.0,0.0,2816.67,400.0,100.0,3400,3989.47,11.0,10.571,Weekly,33.0,4597.6,3500.0,Part-Time Employment,1.0,0.0,0.0,0.0,4327.5633,1178.0,3274.8766,362.68,QuickCash,0.0,5337043,1.0,20-05-2023,False,Vehicle Expenses,2023-05-20,Green,667.0,5217.0,4597.6
0062x00000DGL2hAAH,0012x00000cj5nHAAQ,Kojonup,WA,Australia,Loan Paid,Existing Client-Granted Loan Before,0.0,91.78,6582.4914,4.0,0.0,0.0,4.0,4.0,9502.705,8.0,52.0,267.0938,755.1428,1000.0,1.0,0.07,0.0,1.0,4225.0,599.0,380.0,3500,4205.22,8.0,15.571,Fortnightly,40.0,9502.71,5000.0,Full-Time Employment,8.0,0.0,0.1538,1.0,3881.68,2986.0,10196.52,525.66,MoneySpot,0.0,4718076,0.0,20-02-2023,False,Vehicle Expenses,2023-02-20,Orange,0.0,11043.0,9502.71
0062x00000EN63nAAD,0012x00000gAZmqAAG,Launceston,TAS,Australia,Loan Paid,Existing Client-Granted Loan Before,0.0,81.48,2971.0649,1.0,0.0,0.0,2.0,1.0,4631.9655,0.0,19.0,0.0,887.1753,884.6,1.0,0.68,0.0,0.0,4519.67,400.0,0.0,3500,4582.75,36.0,36.0,Weekly,33.0,4647.97,5000.0,Full-Time Employment,0.0,0.0,0.0,0.0,3844.4266,652.0,3275.9466,127.3,MoneySpot,0.0,6150779,0.0,09-08-2023,False,Vehicle Expenses,2023-08-09,Orange,0.0,8975.0,4647.97
0062x00000FUP0TAAX,0012x00000dxdIcAAI,Seabrook,VIC,Australia,Closed Lost,Existing Client-Granted Loan Before,0.0,37.01,604.6433,4.0,0.0,0.0,3.0,4.0,3083.6199,0.0,9.0,0.0,950.0955,1030.5,0.0,0.06,0.0,0.0,3114.11,400.0,600.0,3150,3892.84,20.0,20.0,Weekly,41.0,3732.29,5000.0,Full-Time Employment,0.0,0.0,0.0,0.0,2850.2866,856.0,1226.3266,194.65,MoneySpot,,7506669,0.0,14-12-2023,False,Travel Expenses,2023-12-14,Green,0.0,5234.0,3732.29
0062x00000D9hBUAAZ,0012x00000cvJUOAA2,Acacia Hills,NT,Australia,Loan Paid,Existing Client-Granted Loan Before,0.16,78.3,4762.1574,1.0,0.0,0.0,2.0,1.0,4737.4648,6.0,36.0,731.5643,856.37,901.15,0.0,0.54,0.0,0.0,0.0,899.0,1300.0,3500,4201.88,16.0,16.0,Weekly,40.0,13853.08,3500.0,Full-Time Employment,6.0,0.0,0.1099,4.0,3276.8766,850.0,6894.36,262.62,MoneySpot,0.0,4594351,6.0,01-02-2023,False,Vehicle Expenses,2023-02-01,Green,13.0,8113.0,13853.08
0062x00000DsLqaAAF,0010K00002ACsqCQAT,Calwell,ACT,Australia,Loan Paid,Existing Client-Granted Loan Before,0.0,36.37,826.0326,2.0,0.0,0.0,3.0,2.0,5137.3413,4.0,44.0,446.6627,1523.4016,2491.13,0.0,0.52,0.0,0.0,0.0,599.0,480.0,3500,4337.92,12.0,23.143,Fortnightly,52.0,10010.64,3500.0,Full-Time Employment,5.0,1.0,0.0,3.0,3046.8033,1338.0,2045.1666,361.5,MoneySpot,0.0,5235514,0.0,10-05-2023,False,Home Maintenance & Repairs,2023-05-10,Orange,0.0,10289.0,10010.64
0062x00000DHYMIAA5,0012x00000TrM7NAAV,Clovelly Park,SA,Australia,Loan Paid,Existing Client-Granted Loan Before,0.0,73.84,1664.1582,2.0,0.0,0.0,2.0,2.0,4922.5706,0.0,36.0,711.8771,1697.6766,1579.75,1.0,15.45,0.0,0.0,3574.06,599.0,300.0,3050,3861.66,12.0,23.857,Fortnightly,52.0,5090.07,5000.0,Part-Time Employment,0.0,0.0,0.044,0.0,3395.3533,2058.0,3048.0933,321.81,MoneySpot,0.0,4784365,0.0,02-03-2023,False,Other Expenses,2023-03-02,Green,0.0,7450.0,5090.07
0062x00000D9yNzAAJ,0012x00000TH9ouAAD,Banora Point,NSW,Australia,Loan Paid,Existing Client-Granted Loan Before,21.56,95.81,1689.2794,2.0,1.0,4.0,4.0,2.0,5023.2107,4.0,23.0,0.0,1676.48,1899.92,1.0,0.05,0.0,0.0,2753.25,599.0,1600.0,3400,4222.48,11.0,22.0,Fortnightly,44.0,5023.21,3800.0,Part-Time Employment,4.0,0.0,0.044,0.0,5093.0633,1461.0,2560.6666,383.87,QuickCash,0.0,4606801,4.0,04-02-2023,False,Vehicle Expenses,2023-02-04,Green,1181.0,5476.0,5023.21
0062x00000DZ4AQAA1,0012x00000dzD3NAAU,Mount Annan,NSW,Australia,Loan Paid,Existing Client-Granted Loan Before,11.17,81.22,4220.1803,2.0,0.0,2.0,3.0,2.0,10509.4806,0.0,16.0,0.0,2418.82,2304.57,1.0,0.0,0.0,0.0,0.0,599.0,1320.0,3500,4285.02,10.0,19.714,Fortnightly,35.0,10392.94,3500.0,Full-Time Employment,0.0,0.0,0.0,0.0,6994.22,1019.0,5008.0633,428.51,MoneySpot,0.0,5069795,0.0,16-04-2023,False,Other Expenses,2023-04-15,Orange,1350.0,12076.0,10392.94
0062x00000DFpQSAA1,0012x00000IN5xzAAD,Mudamuckla,SA,Australia,Loan Paid,Existing Client-Granted Loan Before,0.0,56.36,3967.6204,2.0,0.0,0.0,3.0,2.0,6341.0259,0.0,0.0,1204.9757,1530.8833,1649.07,0.0,18.48,0.0,0.0,2573.32,400.0,100.0,3450,4172.91,8.0,16.143,Fortnightly,51.0,7314.36,3500.0,Full-Time Employment,0.0,0.0,0.0,0.0,3061.7666,1297.0,4930.1,521.62,QuickCash,0.0,4688266,0.0,15-02-2023,False,Travel Expenses,2023-02-15,Green,0.0,12728.0,7314.36
0062x00000DsrRtAAJ,0012x00000SFPtdAAH,Holmview,QLD,Australia,Loan Paid,Existing Client-Granted Loan Before,0.09,36.98,3107.1097,2.0,0.0,0.0,3.0,2.0,4756.6087,5.0,50.0,1216.3441,2028.246,2297.28,1.0,0.0,0.0,0.0,3507.35,1499.0,0.0,3150,5971.48,10.0,20.429,Fortnightly,53.0,5314.94,5000.0,Full-Time Employment,5.0,0.0,0.2637,0.0,3380.41,1243.0,5063.4233,392.57,MoneySpot,-0.01,5271172,5.0,15-05-2023,False,Vehicle Expenses,2023-05-15,Green,6.0,6055.0,5314.94
0062x00000EyH85AAF,0010K00001zHuuCQAS,Malvern,VIC,Australia,Closed Lost,Existing Client-No Loan Granted Ever,0.0,58.35,0.0,3.0,0.0,0.0,3.0,3.0,5810.2732,0.0,0.0,0.0,3794.3266,3794.32,0.0,0.0,0.0,0.0,2383.33,599.0,830.0,3500,4094.31,5.0,9.571,Fortnightly,29.0,6379.61,3500.0,Full-Time Employment,0.0,0.0,0.0,0.0,3794.3266,0.0,0.0,818.87,MoneySpot,,6724599,0.0,03-10-2023,False,Vehicle Expenses,2023-10-03,Orange,0.0,10189.0,6379.61
0062x00000Du3OBAAZ,0012x00000ACUY9AAP,tarneit,VIC,Australia,Loan Paid,Existing Client-Granted Loan Before,0.0,95.35,2880.5368,1.0,0.0,0.0,2.0,1.0,5335.8575,0.0,44.0,1923.6566,959.8384,743.22,1.0,0.03,0.0,0.0,0.0,400.0,417.0,3450,4282.88,23.0,23.143,Weekly,28.0,5335.86,3500.0,,0.0,0.0,0.0,0.0,4159.3,1966.0,4135.3833,186.22,MoneySpot,0.0,5367041,0.0,23-05-2023,False,Furniture or Appliances,2023-05-23,Green,0.0,9012.0,5335.86
0062x00000F3QZEAA3,0012x00000iHYlEAAW,Kellyville,NSW,Australia,Loan Paid,Existing Client-Granted Loan Before,0.0,61.01,2789.816,2.0,0.0,0.0,3.0,2.0,9781.4869,1.0,13.0,0.0,3287.6633,3252.89,3.0,0.0,0.0,1.0,0.0,899.0,1400.0,3250,3978.99,10.0,18.857,Fortnightly,32.0,9781.49,3250.0,Full-Time Employment,1.0,0.0,0.0,0.0,0.0,1377.0,5407.9033,397.91,Financier-2,0.0,7047484,0.0,03-11-2023,False,Travel Expenses,2023-11-03,Orange,0.0,10493.0,9781.49
0062x00000DVSoqAAH,0012x00000FFksRAAT,Taigum,QLD,Australia,Loan Paid,Existing Client-Granted Loan Before,0.0,0.0,0.0,0.0,0.0,0.0,0.0,0.0,0.0,0.0,13.0,1815.0181,0.0,0.0,0.0,0.0,0.0,0.0,5757.28,899.0,500.0,3200,4026.93,24.0,24.286,Weekly,43.0,2916.0,3200.0,Full-Time Employment,0.0,0.0,0.0,0.0,0.0,2173.0,2571.41,167.79,MoneySpot,0.0,5450060,0.0,31-05-2023,False,Living Expenses,2023-05-31,Orange,0.0,0.0,2916.0
0062x00000FKwtWAAT,0012x00000hYHFOAA4,Milperra,NSW,Australia,Loan Paid,Existing Client-Granted Loan Before,0.0,46.27,12437.5924,2.0,0.0,0.0,3.0,2.0,14762.8586,0.0,127.0,0.0,4049.05,3744.18,0.0,0.0,0.0,0.0,0.0,1499.0,2100.0,3500,4295.87,10.0,20.0,Fortnightly,38.0,14616.38,3500.0,,0.0,0.0,0.0,0.0,9927.7666,809.0,14684.8766,429.59,MoneySpot,0.0,7426348,0.0,08-12-2023,False,Home Maintenance & Repairs,2023-12-08,Orange,0.0,22431.0,14616.38
0062x00000EC3JeAAL,0010K00001y3460QAA,Marsden,QLD,Australia,Closed Lost,Existing Client-Granted Loan Before,0.0,89.03,709.7212,1.0,2.0,0.0,1.0,1.0,402.77,14.0,66.0,0.0,134.2566,500.0,0.0,0.0,0.0,1.0,3900.0,599.0,400.0,3500,4185.74,16.0,16.571,Weekly,31.0,5534.57,3500.0,Full-Time Employment,14.0,0.0,0.1538,6.0,0.0,780.0,3626.05,261.61,MoneySpot,,5851047,12.0,07-07-2023,False,Relocation Expenses,2023-07-06,Green,0.0,5567.0,5534.57
0062x00000D8jIaAAJ,0012x000003jC6wAAE,Ganmain,NSW,Australia,Loan Paid,Existing Client-Granted Loan Before,35.04,82.79,1924.1146,1.0,0.0,1.0,1.0,1.0,9219.4141,1.0,46.0,1360.0368,854.8707,765.44,0.0,1.01,0.0,0.0,0.0,599.0,450.0,3500,4196.89,16.0,15.857,Weekly,25.0,10091.95,4000.0,,1.0,0.0,0.044,0.0,7540.84,1410.0,2726.4433,262.31,MoneySpot,0.0,4547253,1.0,25-01-2023,False,Travel Expenses,2023-01-25,Orange,3453.0,9853.0,10091.95
0062x00000DUjASAA1,0012x000008GbCtAAK,Durack,NT,Australia,Loan Paid,Existing Client-Granted Loan Before,0.0,74.41,4238.6164,1.0,1.0,0.0,2.0,1.0,6664.8891,23.0,61.0,1197.3698,1484.5115,1504.12,2.0,7.04,0.0,0.0,3749.2,599.0,800.0,3500,4191.24,16.0,15.714,Weekly,49.0,6681.22,3500.0,Full-Time Employment,23.0,0.0,0.1868,7.0,6432.8833,1102.0,4360.7233,261.96,MoneySpot,0.0,5386271,12.0,25-05-2023,False,Furniture or Appliances,2023-05-24,Orange,0.0,6863.0,6681.22
0062x00000FU3GHAA1,0012x00000Px3jyAAB,Warner,QLD,Australia,Loan Paid,Existing Client-Granted Loan Before,0.61,18.12,4617.0761,2.0,0.0,4.0,4.0,2.0,16903.7786,0.0,21.0,338.5095,5071.575,4876.23,0.0,0.0,0.0,0.0,14409.04,1499.0,1470.0,3500,4199.64,8.0,15.429,Fortnightly,49.0,19407.49,3500.0,Full-Time Employment,0.0,0.0,0.0,0.0,18028.33,364.0,5695.28,524.96,MoneySpot,0.0,7478162,0.0,12-12-2023,False,Vehicle Expenses,2023-12-12,Green,111.0,18060.0,19407.49
0062x00000DGPI6AAP,0010K00001gjvynQAA,Blacktown,NSW,Australia,Loan Paid,Existing Client-Granted Loan Before,0.0,43.51,3804.6758,1.0,0.0,0.0,3.0,1.0,8718.896,0.0,43.0,2088.1193,977.5214,949.81,1.0,0.89,1.0,0.0,2816.67,400.0,0.0,3500,4218.71,16.0,16.429,Weekly,31.0,7127.96,3500.0,Full-Time Employment,0.0,0.0,0.0,0.0,4561.7666,3045.0,9174.26,263.68,MoneySpot,0.0,4721209,0.0,20-02-2023,False,Travel Expenses,2023-02-20,Green,0.0,31798.0,7127.96
0062x00000DZ7niAAD,0012x00000XNpqFAAT,Beverly Hills,NSW,Australia,Loan Paid,Existing Client-Granted Loan Before,0.0,28.76,2290.8716,4.0,0.0,0.0,3.0,4.0,2043.8333,4.0,47.0,0.0,1743.8333,1720.0,0.0,1.98,0.0,0.0,5555.83,400.0,250.0,3200,4032.76,24.0,24.429,Weekly,26.0,2043.83,5000.0,Part-Time Employment,4.0,0.0,0.7363,0.0,1743.8333,1110.0,2520.5733,168.04,MoneySpot,0.0,5074749,3.0,17-04-2023,False,Vehicle Expenses,2023-04-16,Green,0.0,9260.0,2043.83
0062x00000F1UkEAAV,0012800001OCAbPAAX,Penshurst,NSW,Australia,Loan Paid,Existing Client-Granted Loan Before,0.27,88.99,5490.5466,2.0,0.0,0.0,3.0,2.0,6655.2781,0.0,81.0,1135.9122,2366.4242,2359.27,1.0,0.92,1.0,0.0,4001.83,599.0,200.0,3200,3960.54,10.0,19.857,Fortnightly,44.0,6655.28,3200.0,Full-Time Employment,0.0,0.0,0.022,0.0,5521.6566,1490.0,6717.23,396.06,MoneySpot,0.0,6897758,0.0,20-10-2023,False,Veterinary Expenses,2023-10-20,Green,21.0,7631.0,6655.28
0062x00000EyrJ6AAJ,0012x00000lfzTUAAY,Carrum Downs,VIC,Australia,Closed Lost,New Client-New Loan,78.49,44.65,0.0,4.0,0.0,1.0,3.0,1.0,6829.4692,0.0,5.0,0.0,725.0307,782.05,0.0,0.19,0.0,0.0,638.0,2000.0,1200.0,3500,4100.07,5.0,9.714,Fortnightly,43.0,6888.7,3500.0,Casual Employment,0.0,0.0,0.033,0.0,6737.14,0.0,82.8433,820.02,MoneySpot,,6767958,0.0,07-10-2023,True,Relocation Expenses,2023-10-06,Orange,5508.0,7017.0,6888.7
0062x00000D8si8AAB,0012x00000SFI3mAAH,Beveridge,VIC,Australia,Loan Paid,Existing Client-Granted Loan Before,0.0,43.6,2801.3465,4.0,0.0,0.0,5.0,4.0,6098.6466,1.0,15.0,2797.1921,4573.985,5552.66,1.0,6.75,2.0,0.0,5100.0,1499.0,1500.0,3500,4231.9,4.0,15.714,Monthly,44.0,6384.65,3500.0,Full-Time Employment,1.0,0.0,0.0,0.0,6098.6466,2217.0,4327.3166,1057.98,MoneySpot,0.0,4554487,1.0,26-01-2023,False,Living Expenses,2023-01-26,Green,0.0,6447.0,6384.65
0062x00000FUyWtAAL,0012x00000c7lO3AAI,Toormina,NSW,Australia,Closed Lost,Existing Client-Granted Loan Before,0.0,47.94,2764.5097,4.0,0.0,0.0,5.0,4.0,3030.0066,0.0,26.0,0.0,250.0,250.0,0.0,0.05,0.0,1.0,2916.4,599.0,1000.0,3500,4295.1,4.0,17.429,Monthly,48.0,4865.68,5000.0,Full-Time Employment,2.0,0.0,0.1648,0.0,1371.3633,747.0,3165.6233,1073.78,MoneySpot,,7553549,2.0,20-12-2023,False,Home Maintenance & Repairs,2023-12-18,Orange,0.0,9995.0,4865.68
0062x00000Ed9dKAAR,0012x00000XJyVLAA1,Upper Coomera,QLD,Australia,Loan Paid,Existing Client-Granted Loan Before,0.0,68.6,7332.4563,4.0,0.0,0.0,2.0,4.0,4359.3466,0.0,0.0,464.3756,2832.5,30.0,1.0,3.35,0.0,1.0,7348.9,899.0,600.0,3500,4454.34,30.0,29.714,Weekly,28.0,17545.92,3500.0,Full-Time Employment,6.0,0.0,0.3626,5.0,11691.7966,1267.0,8014.83,148.48,QuickCash,0.0,6402382,4.0,02-09-2023,False,Travel Expenses,2023-09-02,Orange,0.0,9278.0,17545.92
0062x00000DJLOkAAP,0010K00002437TgQAI,Oakford,WA,Australia,Loan Paid,Existing Client-Granted Loan Before,0.0,35.69,3571.3966,2.0,0.0,0.0,2.0,2.0,10662.03,16.0,48.0,2179.05,5697.618,8977.8,1.0,0.17,0.0,1.0,10000.0,599.0,2600.0,3200,3954.47,4.0,17.143,Monthly,45.0,10671.03,3200.0,Full-Time Employment,16.0,1.0,0.8571,0.0,0.0,1814.0,3840.25,988.62,MoneySpot,0.0,4883600,7.0,19-03-2023,False,Living Expenses,2023-03-19,Orange,0.0,13701.0,10671.03
0062x00000DXVpuAAH,0012x00000FGRGqAAP,Brighton-Le-Sands,NSW,Australia,Loan Paid,Existing Client-Granted Loan Before,0.0,73.28,3087.3271,4.0,0.0,0.0,1.0,4.0,8550.7092,0.0,50.0,930.2721,1193.607,1190.0,0.0,2.11,0.0,0.0,1459.0,400.0,1800.0,3500,4255.04,18.0,18.429,Weekly,65.0,6756.63,5000.0,Full-Time Employment,0.0,0.0,0.0,0.0,5168.69,928.0,3151.4466,236.4,MoneySpot,0.0,4977890,0.0,01-04-2023,False,Vehicle Expenses,2023-04-01,Orange,0.0,8527.0,6756.63
0062x00000E6q24AAB,0012x00000TJJjRAAX,Huntingdale,WA,Australia,Loan Paid,Existing Client-Granted Loan Before,0.0,25.32,2083.3899,2.0,0.0,0.0,3.0,2.0,7862.4397,4.0,14.0,0.0,3618.625,2681.11,0.0,8.15,0.0,0.0,4348.62,599.0,700.0,3500,4182.88,8.0,15.0,Fortnightly,26.0,7867.44,3500.0,Full-Time Employment,4.0,0.0,0.4176,0.0,7237.25,267.0,2461.52,522.87,MoneySpot,0.0,5772031,4.0,29-06-2023,False,Vehicle Expenses,2023-06-29,Green,0.0,7238.0,7867.44
0062x00000DGkOfAAL,0012x00000THZ1ZAAX,Panania,NSW,Australia,Loan Paid,Existing Client-Granted Loan Before,1.99,85.86,1464.9633,4.0,0.0,0.0,3.0,4.0,6816.5164,0.0,3.0,0.0,2299.4442,2088.07,1.0,0.0,0.0,0.0,4697.3,899.0,0.0,3500,4296.07,10.0,20.0,Fortnightly,39.0,10620.75,3500.0,Full-Time Employment,0.0,0.0,0.0,0.0,5365.37,93.0,1619.9866,429.61,MoneySpot,0.0,4739948,0.0,23-02-2023,False,Other Expenses,2023-02-23,Orange,210.0,10507.0,10620.75
0062x00000E4WzMAAV,0012x00000cizYYAAY,Northmead,NSW,Australia,Loan Paid,Existing Client-Granted Loan Before,0.0,31.93,2027.75,3.0,0.0,0.0,1.0,3.0,9570.4966,0.0,29.0,713.2184,9377.33,9377.33,1.0,1.03,0.0,0.0,8067.0,1499.0,2120.0,3250,4033.84,4.0,17.857,Monthly,40.0,9570.5,3250.0,Full-Time Employment,0.0,0.0,0.0,0.0,9377.33,1753.0,5350.4933,1008.46,QuickCash,0.0,5580523,0.0,12-06-2023,False,Furniture or Appliances,2023-06-12,Green,0.0,11533.0,9570.5
0062x00000DAXVZAA5,0012x00000c7i76AAA,Cootamundra,NSW,Australia,Loan Paid,Existing Client-Granted Loan Before,0.0,91.92,1904.3545,4.0,0.0,0.0,3.0,4.0,4718.4433,0.0,23.0,582.86,1560.0412,2291.33,0.0,11.64,0.0,0.0,3683.33,899.0,274.0,3400,4086.76,8.0,15.286,Fortnightly,24.0,4780.11,3400.0,Casual Employment,0.0,0.0,0.1758,0.0,4160.11,627.0,2402.8433,510.85,MoneySpot,0.0,4634496,0.0,07-02-2023,False,Vehicle Expenses,2023-02-07,Green,0.0,5122.0,4780.11
0062x00000DrtnqAAB,0012x00000g87MUAAY,Westmead,NSW,Australia,Loan Paid,Existing Client-Granted Loan Before,0.0,73.46,1845.8109,1.0,0.0,0.0,4.0,1.0,4887.054,0.0,19.0,0.0,666.4545,749.0,0.0,2.15,0.0,0.0,3856.67,400.0,200.0,3150,3978.99,12.0,24.0,Fortnightly,37.0,4887.05,3500.0,Full-Time Employment,0.0,0.0,0.0,0.0,2443.6666,876.0,2052.47,331.59,MoneySpot,0.0,5202348,0.0,05-05-2023,False,Home Maintenance & Repairs,2023-05-05,Green,0.0,5106.0,4887.05
0062x00000F2fiXAAR,0012x00000SFOqwAAH,Toongabbie,NSW,Australia,Loan Paid,Existing Client-Granted Loan Before,0.0,71.35,4428.0724,2.0,0.0,0.0,5.0,2.0,10515.2643,0.0,52.0,481.322,4428.5714,4000.0,2.0,0.0,0.0,1.0,13576.67,599.0,600.0,3500,4215.43,8.0,15.857,Fortnightly,28.0,10715.6,5000.0,Full-Time Employment,0.0,0.0,0.7253,0.0,0.0,2166.0,7227.4066,526.93,MoneySpot,-0.68,6987809,0.0,29-10-2023,False,Furniture or Appliances,2023-10-29,Orange,0.0,12076.0,10715.6
0062x00000FkJuKAAV,0012x00000INod6AAD,Austral,NSW,Australia,Loan Paid,Existing Client-Granted Loan Before,0.0,62.79,3330.2194,1.0,0.0,0.0,2.0,1.0,6529.6218,0.0,75.0,214.8286,1502.7081,1502.4,0.0,0.28,3.0,0.0,1530.0,599.0,0.0,3450,4203.37,19.0,19.0,Weekly,52.0,6586.96,3500.0,Full-Time Employment,0.0,0.0,0.0,0.0,5509.93,1952.0,5143.0366,221.23,MoneySpot,-0.2,8126176,0.0,2024-02-07,False,Living Expenses,2024-02-07,Green,0.0,7172.0,6586.96
0062x00000EO2xtAAD,0012x00000IOlQdAAL,Sydney,NSW,Australia,Loan Paid,Existing Client-Granted Loan Before,0.0,56.69,753.1399,1.0,0.0,0.0,2.0,1.0,6087.4289,0.0,44.0,0.0,863.4027,1082.84,0.0,0.96,0.0,0.0,2999.86,400.0,150.0,3500,4202.25,16.0,16.0,Weekly,46.0,9687.43,3500.0,Full-Time Employment,0.0,0.0,0.0,0.0,3165.81,878.0,3530.44,262.65,MoneySpot,0.0,6227486,0.0,16-08-2023,False,Furniture or Appliances,2023-08-15,Green,0.0,17583.0,9687.43
0062x00000F34MSAAZ,0012x00000hYkAHAA0,Karana Downs,QLD,Australia,Loan Paid,Existing Client-Granted Loan Before,0.88,9.45,5476.0196,2.0,0.0,0.0,4.0,2.0,6487.18,0.0,13.0,0.0,3231.09,392.0,1.0,0.0,0.0,0.0,0.0,2000.0,0.0,3500,4363.97,6.0,23.714,Monthly,42.0,9263.4,15000.0,Part-Time Employment,0.0,0.0,0.0,0.0,9200.37,0.0,5493.4933,727.33,MoneySpot,0.0,7018417,0.0,01-11-2023,False,Living Expenses,2023-11-01,Green,67.0,7554.0,9263.4
0062x00000DX6IRAA1,0012x00000SGBQIAA5,Hayborough,SA,Australia,Closed Lost,Existing Client-Granted Loan Before,0.21,91.43,3770.556,2.0,0.0,0.0,5.0,2.0,5577.6531,0.0,45.0,1278.3875,2245.9,1734.01,1.0,0.28,0.0,0.0,4983.33,599.0,1340.0,3500,4089.82,4.0,8.429,Fortnightly,58.0,6186.65,3500.0,Full-Time Employment,0.0,0.0,0.0,0.0,4491.8,2009.0,3714.7166,1022.46,MoneySpot,,4954423,0.0,29-03-2023,False,Vehicle Expenses,2023-03-29,Orange,13.0,6005.0,6186.65
0062x00000E6DEfAAN,0012x00000XDZzhAAH,Dinmore,QLD,Australia,Loan Paid,Existing Client-Granted Loan Before,0.27,89.16,2293.6205,1.0,0.0,0.0,3.0,1.0,4521.5683,7.0,139.0,96.0,1040.5646,1089.18,1.0,1.8,0.0,0.0,0.0,400.0,150.0,3050,3702.8,16.0,15.571,Weekly,26.0,5123.82,3050.0,Full-Time Employment,10.0,0.0,0.2747,1.0,5081.3633,1391.0,2941.1166,231.43,QuickCash,0.0,5719851,2.0,25-06-2023,False,Vehicle Expenses,2023-06-25,Green,13.0,4713.0,5123.82
0062x00000FXVHZAA5,0012x00000fllzXAAQ,Newcastle West,NSW,Australia,Loan Paid,Existing Client-Granted Loan Before,0.13,3.15,1080.4245,3.0,0.0,0.0,4.0,3.0,9924.67,0.0,29.0,0.0,9924.67,9924.67,0.0,0.59,0.0,0.0,9416.33,1500.0,2800.0,3500,4245.41,4.0,16.143,Monthly,45.0,9924.67,3500.0,Full-Time Employment,0.0,0.0,0.0,0.0,9924.67,483.0,1743.7233,1061.36,QuickCash,0.0,7759370,0.0,2024-01-09,False,Life Event Expenses,2024-01-09,Orange,14.0,10638.0,9924.67
0062x00000FK4CRAA1,0012x00000c9K0uAAE,Denman Prospect,ACT,Australia,Loan Paid,Existing Client-Granted Loan Before,0.0,14.38,3014.7703,3.0,1.0,0.0,4.0,3.0,6714.1157,2.0,11.0,1973.32,5788.63,5694.88,0.0,17.38,0.0,0.0,4500.0,1499.0,2200.0,3500,4057.99,4.0,7.571,Fortnightly,26.0,8142.81,3500.0,Full-Time Employment,31.0,0.0,0.0,15.0,5788.63,1045.0,4709.3133,1014.5,MoneySpot,0.0,7365613,17.0,01-12-2023,False,Living Expenses,2023-11-30,Green,0.0,12453.0,8142.81
0062x00000E5uI6AAJ,0010K00001suw9AQAQ,Caboolture,QLD,Australia,Loan Paid,Existing Client-Granted Loan Before,0.0,94.48,266.1534,2.0,0.0,0.0,5.0,2.0,366.6666,0.0,13.0,557.6896,133.3333,150.0,1.0,3.04,0.0,1.0,1419.17,599.0,1000.0,3500,4389.82,26.0,26.0,Weekly,49.0,4456.57,5000.0,Unemployed,0.0,0.0,0.1319,0.0,3451.2066,489.0,722.19,168.85,MoneySpot,0.0,5689811,0.0,22-06-2023,False,Other Expenses,2023-06-22,Green,0.0,560.0,4456.57
0062x00000DAN9iAAH,0012x00000TuT9XAAV,Middleton Grange,NSW,Australia,Closed Lost,Existing Client-Granted Loan Before,1.66,89.23,430.5,4.0,1.0,2.0,4.0,4.0,6015.3652,0.0,4.0,0.0,3125.0,3000.0,0.0,0.0,0.0,1.0,9599.73,1500.0,590.0,3500,4089.79,5.0,9.429,Fortnightly,50.0,15433.57,3500.0,Full-Time Employment,9.0,0.0,0.0549,3.0,8823.5633,0.0,1247.3666,817.96,MoneySpot,,4626789,4.0,07-02-2023,False,Child Expenses,2023-02-06,Orange,328.0,19680.0,15433.57
0062x00000DZ2bTAAT,0012x00000MiXeLAAV,GLENFIELD,NSW,Australia,Loan Paid,Existing Client-Granted Loan Before,0.0,67.22,4952.7006,1.0,0.0,0.0,2.0,1.0,7546.1415,7.0,83.0,2082.0546,1403.8684,1602.72,0.0,0.0,0.0,1.0,0.0,400.0,300.0,3150,3946.15,24.0,24.571,Weekly,48.0,7887.14,5000.0,,7.0,0.0,0.8352,1.0,0.0,2341.0,5588.1766,165.92,MoneySpot,0.0,5068033,6.0,15-04-2023,False,Travel Expenses,2023-04-15,Green,0.0,7865.0,7887.14
0062x00000DVLQxAAP,0012x00000g8LU2AAM,Semaphore,SA,Australia,Loan Paid,Existing Client-Granted Loan Before,0.0,39.35,2733.3774,1.0,1.0,0.0,3.0,1.0,5275.5131,4.0,0.0,562.4837,958.4578,929.05,1.0,0.7,1.0,0.0,0.0,400.0,150.0,3350,4194.8,24.0,24.286,Weekly,47.0,6835.51,5000.0,Full-Time Employment,4.0,0.0,0.033,2.0,4472.8033,1308.0,3270.8166,174.79,MoneySpot,-0.22,5439422,3.0,30-05-2023,False,Travel Expenses,2023-05-30,Green,0.0,9715.0,6835.51
0062x00000DUhTHAA1,0010K00001xNn6aQAC,AUBURN,NSW,Australia,Loan Paid,Existing Client-Granted Loan Before,0.0,75.62,6748.5579,2.0,0.0,0.0,3.0,2.0,10400.4144,0.0,33.0,2444.4778,4162.6985,5354.49,1.0,0.14,0.0,0.0,6066.67,1500.0,2800.0,3500,4221.18,8.0,16.0,Fortnightly,50.0,10727.08,3500.0,Full-Time Employment,0.0,0.0,0.0,0.0,11069.42,2569.0,8017.4433,527.65,MoneySpot,0.0,5385906,0.0,25-05-2023,False,Medical Expenses,2023-05-24,Green,0.0,12249.0,10727.08
0062x00000DHqP0AAL,0012x00000gnSv6AAE,Thursday Island,QLD,Australia,Closed Lost,Existing Client-No Loan Granted Ever,0.0,78.42,2198.6689,2.0,2.0,0.0,4.0,2.0,6935.3749,6.0,14.0,410.7472,2375.8,2375.8,0.0,0.0,0.0,0.0,0.0,599.0,500.0,3500,4099.85,5.0,9.714,Fortnightly,62.0,7205.37,3500.0,Full-Time Employment,6.0,0.0,0.0989,4.0,4751.6,459.0,2429.3066,819.97,MoneySpot,,4802571,6.0,05-03-2023,False,Travel Expenses,2023-03-05,Orange,0.0,8693.0,7205.37
0062x00000DILgeAAH,0010K000020JeoIQAS,Belgrave South,VIC,Australia,Loan Paid,Existing Client-Granted Loan Before,14.48,81.26,3125.0778,1.0,0.0,2.0,5.0,1.0,7382.8384,0.0,80.0,1660.0508,1127.373,1106.47,2.0,0.0,0.0,0.0,2968.33,400.0,200.0,3500,4287.56,20.0,20.286,Weekly,42.0,7382.84,3500.0,Unemployed,0.0,0.0,0.1538,0.0,6125.6966,2725.0,4968.7866,214.38,Financier-2,0.0,4828659,0.0,09-03-2023,False,Medical Expenses,2023-03-09,Orange,1240.0,8562.0,7382.84
0062x00000Ee24EAAR,0012x00000kge3nAAA,Port Elliot,SA,Australia,Closed Lost,Existing Client-No Loan Granted Ever,71.3,95.87,0.0,4.0,0.0,4.0,5.0,4.0,2675.5796,0.0,1.0,0.0,849.9142,586.6,0.0,0.0,0.0,0.0,1516.67,400.0,500.0,3500,4116.08,5.0,10.143,Fortnightly,19.0,3454.08,3500.0,Unemployed,0.0,0.0,0.0989,0.0,2358.21,0.0,20.0,823.22,QuickCash,,6458612,0.0,08-09-2023,True,Living Expenses,2023-09-08,Orange,2888.0,4050.0,3454.08
0062x00000E6VFcAAN,0010K00001mDFtxQAG,Safety Beach,VIC,Australia,Loan Paid,Existing Client-Granted Loan Before,1.69,66.48,2316.9815,1.0,1.0,0.0,1.0,1.0,5310.6011,1.0,47.0,0.0,744.4046,742.8,1.0,0.0,0.0,0.0,3466.67,400.0,400.0,3500,4201.9,16.0,16.0,Weekly,41.0,5361.42,3500.0,Full-Time Employment,1.0,0.0,0.0,1.0,5002.5966,2869.0,3377.31,262.62,MoneySpot,0.0,5743778,1.0,27-06-2023,False,Vehicle Expenses,2023-06-27,Green,102.0,6014.0,5361.42
0062x00000EC9KeAAL,0012800001GgrQfAAJ,Little Mountain,QLD,Australia,Loan Paid,Existing Client-Granted Loan Before,6.5,88.3,4015.7124,2.0,0.0,2.0,2.0,2.0,4491.789,9.0,53.0,0.0,1810.5014,1942.57,1.0,0.0,0.0,0.0,3683.33,400.0,820.0,3500,4322.27,11.0,21.714,Fortnightly,53.0,4521.19,3500.0,Full-Time Employment,9.0,0.0,0.0659,1.0,4514.1033,884.0,6269.22,392.94,MoneySpot,0.0,5856721,8.0,09-07-2023,False,Furniture or Appliances,2023-07-09,Green,322.0,4950.0,4521.19
0062x00000DVLCHAA5,0012x000005SGtYAAW,Nickol,WA,Australia,Loan Paid,Existing Client-Granted Loan Before,0.0,83.11,2531.8879,4.0,0.0,0.0,4.0,4.0,3939.8166,0.0,55.0,785.1911,999.325,944.7,1.0,0.0,0.0,0.0,3553.33,599.0,160.0,3150,3976.21,24.0,24.429,Weekly,24.0,3939.82,4950.0,Full-Time Employment,0.0,0.0,0.011,0.0,1998.65,1665.0,2797.4966,165.68,QuickCash,0.0,5439234,0.0,30-05-2023,False,Home Maintenance & Repairs,2023-05-30,Green,0.0,4720.0,3939.82
0062x00000FKu5OAAT,0012x00000goCxtAAE,Surfers Paradise,QLD,Australia,Loan Paid,Existing Client-Granted Loan Before,0.0,87.15,1567.4278,1.0,0.0,0.0,1.0,1.0,4873.0529,2.0,33.0,0.0,857.7384,884.8,1.0,0.36,0.0,0.0,4246.67,400.0,400.0,3050,3707.57,16.0,15.714,Weekly,28.0,4727.2,3050.0,Part-Time Employment,2.0,0.0,0.0659,0.0,4504.99,456.0,1528.1066,231.73,Financier-2,0.0,7423365,1.0,07-12-2023,False,Vehicle Expenses,2023-12-06,Green,0.0,4990.0,4727.2
0062x00000FVRLQAA5,0010K000029Jf2KQAS,Lethbridge Park,NSW,Australia,Closed Lost,Existing Client-Granted Loan Before,0.0,60.48,3764.4355,1.0,0.0,0.0,3.0,1.0,7367.7801,0.0,93.0,75.0208,1546.1438,1644.24,1.0,11.8,0.0,0.0,0.0,1500.0,100.0,3500,4202.25,16.0,16.0,Weekly,41.0,7372.78,5000.0,Full-Time Employment,0.0,0.0,0.2527,0.0,6699.9566,2857.0,3248.9433,262.65,MoneySpot,,7592128,0.0,25-12-2023,False,Living Expenses,2023-12-21,Orange,0.0,8162.0,7372.78
0062x00000DYcvYAAT,0012x00000GdN4oAAF,North Parramatta,NSW,Australia,Loan Paid,Existing Client-Granted Loan Before,0.0,14.72,2464.8194,1.0,0.0,0.0,4.0,1.0,5519.2471,0.0,6.0,2316.7455,1270.1833,1466.0,0.0,0.0,0.0,0.0,1020.0,599.0,800.0,3500,4213.04,16.0,16.286,Weekly,52.0,5519.25,3500.0,Full-Time Employment,0.0,0.0,0.0,0.0,5080.7333,1551.0,2614.3766,263.32,MoneySpot,0.0,5044296,0.0,12-04-2023,False,Medical Expenses,2023-04-12,Green,0.0,5764.0,5519.25
0062x00000E6ewHAAR,0012x00000e034CAAQ,Umina Beach,NSW,Australia,Loan Paid,Existing Client-Granted Loan Before,0.0,52.73,2036.0583,1.0,0.0,0.0,3.0,1.0,6465.4024,0.0,54.0,0.0,909.9766,921.79,0.0,7.59,0.0,0.0,4116.67,400.0,800.0,3500,4207.21,16.0,16.143,Weekly,60.0,6344.06,3500.0,Full-Time Employment,0.0,0.0,0.0,0.0,3639.9066,1697.0,2140.25,262.96,MoneySpot,0.0,5757336,0.0,28-06-2023,False,Other Expenses,2023-06-28,Green,0.0,7340.0,6344.06
0062x00000DGjDeAAL,0012x00000KLL7DAAX,Cranbrook,QLD,Australia,Loan Paid,Existing Client-Granted Loan Before,0.0,59.33,7822.1586,4.0,0.0,0.0,3.0,4.0,57249.8265,0.0,66.0,830.4002,5528.6925,4332.0,0.0,3.73,0.0,0.0,3208.95,1499.0,2080.0,3500,4239.26,18.0,18.0,Weekly,34.0,60671.86,5000.0,Unemployed,13.0,0.0,0.044,4.0,58354.3266,894.0,8505.7566,235.52,MoneySpot,-0.28,4738112,5.0,23-02-2023,False,Travel Expenses,2023-02-23,Orange,0.0,57732.0,60671.86
0062x00000DAo9pAAD,0012x00000BFLX1AAP,Springvale South,VIC,Australia,Closed Lost,Existing Client-Granted Loan Before,0.0,92.84,0.0,4.0,0.0,0.0,3.0,4.0,214.6666,0.0,0.0,0.0,161.0,50.0,0.0,0.0,0.0,1.0,0.0,899.0,450.0,3500,4203.3,14.0,15.0,Weekly,22.0,396.33,3500.0,Full-Time Employment,0.0,0.0,0.0,0.0,0.0,0.0,0.0,300.24,MoneySpot,,4646570,0.0,13-02-2023,False,Relocation Expenses,2023-02-08,Orange,0.0,783.0,396.33
0062x00000D9BbWAAV,0012x00000bmFjaAAE,Harris Park,NSW,Australia,Loan Paid,Existing Client-Granted Loan Before,0.0,74.63,1780.6974,2.0,1.0,0.0,4.0,2.0,6457.7295,9.0,18.0,1025.9265,2008.28,1288.1,0.0,0.0,0.0,0.0,5684.46,599.0,800.0,3500,4215.74,8.0,15.857,Fortnightly,29.0,9578.09,5000.0,Full-Time Employment,9.0,0.0,0.4505,2.0,6344.74,1159.0,2094.8566,526.97,MoneySpot,-0.07,4569538,8.0,29-01-2023,False,Home Maintenance & Repairs,2023-01-28,Orange,0.0,10768.0,9578.09
0062x00000DAVnMAAX,0012x00000d9aypAAA,Carindale,QLD,Australia,Closed Lost,Existing Client-Granted Loan Before,0.0,47.82,3903.5091,4.0,0.0,0.0,3.0,4.0,6396.38,1.0,59.0,775.0167,2398.6425,2912.69,1.0,0.0,0.0,0.0,0.0,899.0,800.0,3500,4381.55,12.0,25.286,Fortnightly,45.0,7129.71,3500.0,Full-Time Employment,1.0,0.0,0.0,0.0,6396.38,1655.0,4890.6466,337.05,MoneySpot,,4633452,1.0,08-02-2023,False,Medical Expenses,2023-02-06,Green,0.0,7630.0,7129.71
0062x00000Ds0TBAAZ,0012x00000XOX1fAAH,Deception Bay,QLD,Australia,Loan Paid,Existing Client-Granted Loan Before,0.0,36.38,887.5552,1.0,0.0,0.0,2.0,1.0,5181.0594,1.0,53.0,338.9286,1362.69,1306.55,0.0,16.47,0.0,0.0,3660.76,400.0,200.0,3300,4001.89,16.0,16.429,Weekly,27.0,5181.06,3300.0,Full-Time Employment,1.0,0.0,0.044,0.0,5450.76,714.0,1293.51,250.12,MoneySpot,0.0,5213622,1.0,07-05-2023,False,Medical Expenses,2023-05-06,Green,0.0,6145.0,5181.06
0062x00000E4VJVAA3,0012x000003CUB0AAO,Aveley,WA,Australia,Loan Paid,Existing Client-Granted Loan Before,0.34,99.61,4421.2348,2.0,0.0,0.0,4.0,2.0,5726.0352,6.0,42.0,1726.7396,2269.0157,2045.13,0.0,0.19,0.0,0.0,7981.59,599.0,500.0,3500,4354.85,12.0,23.571,Fortnightly,28.0,6115.84,3500.0,Full-Time Employment,6.0,0.0,0.011,2.0,5294.37,1187.0,7589.85,362.91,MoneySpot,0.0,5577827,6.0,12-06-2023,False,Relocation Expenses,2023-06-12,Orange,27.0,7838.0,6115.84
0062x00000DriS8AAJ,0010K00001qlMm8QAE,WENTWORTHVILLE,NSW,Australia,Loan Paid,Existing Client-Granted Loan Before,0.0,43.68,1232.0159,1.0,0.0,0.0,2.0,1.0,4787.9132,2.0,59.0,1650.9841,698.2493,1020.83,0.0,1.04,0.0,0.0,3033.33,599.0,600.0,3150,3960.82,24.0,24.0,Weekly,30.0,6050.09,5000.0,Full-Time Employment,2.0,0.0,0.011,2.0,3491.2466,1759.0,2663.77,165.04,MoneySpot,0.0,5186574,1.0,03-05-2023,False,Vehicle Expenses,2023-05-03,Green,0.0,8202.0,6050.09
0062x00000DFyA5AAL,0012800001Wah9wAAB,Blacktown,NSW,Australia,Loan Paid,Existing Client-Granted Loan Before,0.0,97.81,5125.04,0.0,0.0,0.0,0.0,0.0,0.0,0.0,6.0,3619.1342,0.0,0.0,3.0,1.1,1.0,0.0,3432.0,1499.0,0.0,3500,4082.4,8.0,16.143,Fortnightly,52.0,11687.69,3500.0,Full-Time Employment,0.0,0.0,0.022,0.0,10356.2366,4085.0,7304.3633,528.39,MoneySpot,0.0,4696058,0.0,16-02-2023,False,Other Expenses,2023-02-16,Orange,0.0,1550.0,11687.69
0062x00000Ec0jlAAB,0010K00001xOgrHQAS,Drouin,VIC,Australia,Loan Paid,Existing Client-Granted Loan Before,0.0,17.62,993.8335,1.0,0.0,0.0,4.0,1.0,7347.6112,0.0,14.0,0.0,1690.9576,1442.07,1.0,0.53,0.0,0.0,6881.33,599.0,0.0,3500,4202.12,16.0,16.0,Weekly,34.0,7347.61,3500.0,Full-Time Employment,0.0,0.0,0.0,0.0,7327.4833,386.0,1516.27,262.64,MoneySpot,0.0,6325670,0.0,25-08-2023,False,Other Expenses,2023-08-25,Green,0.0,7542.0,7347.61
0062x00000FVn9IAAT,0012x00000PxCSlAAN,Seaton,SA,Australia,Closed Lost,Existing Client-Granted Loan Before,0.0,76.03,2451.1465,2.0,0.0,0.0,3.0,2.0,6163.0007,6.0,69.0,702.9392,2319.6285,2099.86,0.0,0.0,0.0,0.0,4865.79,1499.0,400.0,3150,3969.07,12.0,23.714,Fortnightly,33.0,6396.33,5000.0,Full-Time Employment,6.0,0.0,0.0549,0.0,5412.4666,3175.0,4979.4,330.76,MoneySpot,,7622296,2.0,23-12-2023,False,Medical Expenses,2023-12-23,Green,0.0,14441.0,6396.33
0062x00000ENSPMAA5,0012x00000cvgDVAAY,Campsie,NSW,Australia,Loan Paid,Existing Client-Granted Loan Before,0.0,59.78,565.5501,1.0,0.0,0.0,5.0,1.0,13146.6732,0.0,2.0,0.0,4265.5555,1050.0,0.0,0.0,0.0,0.0,7823.33,599.0,640.0,3050,3878.29,26.0,25.857,Weekly,36.0,13149.62,3050.0,Full-Time Employment,0.0,0.0,0.0,0.0,12796.6666,61.0,739.3133,149.17,MoneySpot,0.0,6175513,0.0,11-08-2023,False,Vehicle Expenses,2023-08-11,Orange,0.0,20958.0,13149.62
0062x00000ELdPWAA1,0012x00000OJD4gAAH,Redbank Plains,QLD,Australia,Closed Lost,Existing Client-No Loan Granted Ever,0.0,61.11,50.881,1.0,0.0,0.0,2.0,1.0,5901.2661,7.0,19.0,0.0,968.4015,398.88,0.0,3.38,0.0,0.0,0.0,400.0,300.0,3500,4070.57,10.0,10.429,Weekly,30.0,6443.6,3500.0,,7.0,0.0,0.0,2.0,4196.4066,0.0,2364.72,407.06,MoneySpot,,6049742,3.0,29-07-2023,False,Vehicle Expenses,2023-07-29,Orange,0.0,8106.0,6443.6
0062x00000F4CMQAA3,0012x00000c8oPkAAI,Woy Woy,NSW,Australia,Loan Paid,Existing Client-Granted Loan Before,0.0,67.95,6670.0631,1.0,0.0,0.0,3.0,1.0,5589.8837,0.0,20.0,0.0,1286.439,1316.77,0.0,4.41,0.0,0.0,5564.0,1499.0,1000.0,3500,4207.47,16.0,16.143,Weekly,38.0,5589.88,3500.0,Full-Time Employment,0.0,0.0,0.011,0.0,4288.13,820.0,9908.7333,262.97,QuickCash,0.0,7113732,0.0,08-11-2023,False,Travel Expenses,2023-11-08,Green,0.0,21756.0,5589.88
0062x00000D1SBTAA3,0012x00000XCsHlAAL,Woodcroft,SA,Australia,Loan Paid,Existing Client-Granted Loan Before,0.0,88.4,1367.7193,1.0,0.0,0.0,6.0,1.0,7578.5397,0.0,14.0,843.628,759.5585,36.0,0.0,0.0,0.0,1.0,2250.38,400.0,300.0,3500,4204.36,8.0,15.571,Fortnightly,26.0,7027.39,5000.0,Part-Time Employment,2.0,0.0,0.0,0.0,3207.6466,1008.0,2519.6566,525.55,MoneySpot,0.0,4390445,1.0,01-01-2023,False,Vehicle Expenses,2023-01-01,Orange,0.0,11164.0,7027.39
0062x00000EcuDRAAZ,0010K00001hW0AtQAK,Frankston,VIC,Australia,Loan Paid,Existing Client-Granted Loan Before,0.32,77.91,5035.6456,2.0,0.0,0.0,3.0,2.0,6395.3779,0.0,37.0,277.5188,2943.6266,2952.64,0.0,0.0,1.0,1.0,4766.67,899.0,200.0,3500,4561.59,18.0,35.0,Fortnightly,53.0,6395.38,3500.0,Full-Time Employment,0.0,0.0,0.3297,0.0,0.0,1969.0,5309.76,253.43,QuickCash,0.0,6384602,0.0,31-08-2023,False,Home Maintenance & Repairs,2023-08-31,Orange,26.0,8106.0,6395.38
0062x00000DUeXvAAL,0012x00000cJyL3AAK,Carlton,NSW,Australia,Loan Paid,Existing Client-Granted Loan Before,0.0,67.4,2855.6619,1.0,0.0,0.0,3.0,1.0,6847.6101,2.0,34.0,0.0,631.4505,663.14,1.0,0.0,0.0,1.0,2896.78,400.0,400.0,3500,4295.98,10.0,20.0,Fortnightly,64.0,3269.39,3500.0,Full-Time Employment,2.0,0.0,0.011,2.0,3511.2366,1797.0,3424.9733,429.6,MoneySpot,0.0,5378413,2.0,24-05-2023,False,Home Maintenance & Repairs,2023-05-24,Green,0.0,7148.0,3269.39
0062x00000DAOcgAAH,0012x00000IMPUzAAP,Sunshine West,VIC,Australia,Closed Lost,Existing Client-Granted Loan Before,0.0,77.77,2764.5862,1.0,0.0,0.0,3.0,1.0,4824.7647,0.0,44.0,687.0069,1012.5492,847.39,1.0,0.13,0.0,0.0,2317.01,400.0,250.0,3100,3920.74,24.0,24.429,Weekly,29.0,4824.76,5000.0,Full-Time Employment,0.0,0.0,0.4176,0.0,4387.7133,2240.0,3482.9366,163.37,MoneySpot,,4627947,0.0,06-02-2023,False,Life Event Expenses,2023-02-06,Green,0.0,5197.0,4824.76
0062x00000E6bZ1AAJ,0012x00000fnxb9AAA,Frankston,VIC,Australia,Loan Paid,Existing Client-Granted Loan Before,0.0,65.82,1756.6899,4.0,1.0,0.0,4.0,4.0,4593.1827,1.0,24.0,836.48,3372.6475,4036.44,1.0,0.12,0.0,0.0,3980.0,899.0,700.0,3500,4308.98,5.0,20.143,Monthly,25.0,4961.2,3500.0,Full-Time Employment,1.0,0.0,0.7582,1.0,4496.8633,840.0,2147.41,861.8,MoneySpot,0.0,5754535,1.0,28-06-2023,False,Life Event Expenses,2023-06-28,Green,0.0,5061.0,4961.2
0062x00000F3jU4AAJ,0012x00000cKvi9AAC,Mount Pritchard,NSW,Australia,Closed Lost,Existing Client-Granted Loan Before,0.0,30.01,4545.709,2.0,0.0,0.0,2.0,2.0,8171.039,0.0,20.0,923.2979,3760.9166,3404.82,1.0,2.35,0.0,0.0,7147.2,899.0,0.0,3500,4312.42,10.0,20.429,Fortnightly,41.0,8208.36,5000.0,Full-Time Employment,0.0,0.0,0.0,0.0,7521.8333,1644.0,5066.2266,431.25,MoneySpot,,7074499,0.0,05-11-2023,False,Other Expenses,2023-11-05,Orange,0.0,10390.0,8208.36
0062x00000DUtyIAAT,0012x000003F4uqAAC,Kirwan,QLD,Australia,Loan Paid,Existing Client-Granted Loan Before,0.0,70.53,3729.8613,1.0,0.0,0.0,2.0,1.0,5143.0932,0.0,43.0,481.7139,892.7925,1006.6,0.0,3.56,0.0,0.0,2903.33,400.0,300.0,3100,3895.28,24.0,23.714,Weekly,25.0,8572.14,5000.0,Full-Time Employment,0.0,0.0,0.033,0.0,3046.8133,2848.0,3843.16,162.31,MoneySpot,0.0,5400079,0.0,26-05-2023,False,Home Maintenance & Repairs,2023-05-26,Green,0.0,6919.0,8572.14
0062x00000DVBmqAAH,0012x00000ddGpGAAU,Oakdowns,TAS,Australia,Loan Paid,Existing Client-Granted Loan Before,16.01,85.08,5787.8092,2.0,0.0,4.0,4.0,2.0,5567.8307,2.0,66.0,286.6119,1901.36,1853.23,1.0,0.0,0.0,0.0,2669.81,899.0,800.0,3100,3907.72,12.0,23.571,Fortnightly,36.0,8154.83,5000.0,Full-Time Employment,2.0,0.0,0.0,0.0,5852.7933,1728.0,6671.9533,325.65,MoneySpot,0.0,5428793,2.0,29-05-2023,False,Vehicle Expenses,2023-05-29,Green,1430.0,8929.0,8154.83
0062x00000D7wuRAAR,0012x00000BIWXSAA5,Kunparrka,NT,Australia,Loan Paid,Existing Client-Granted Loan Before,0.0,66.81,1000.7083,2.0,0.0,0.0,4.0,2.0,3570.7518,8.0,9.0,1175.4171,1301.7457,1195.65,0.0,0.0,0.0,0.0,1191.67,599.0,420.0,3500,4227.09,8.0,16.143,Fortnightly,37.0,3258.53,5000.0,Full-Time Employment,8.0,0.0,0.0769,1.0,3037.4066,1237.0,1395.8533,528.39,MoneySpot,0.0,4507607,5.0,19-01-2023,False,Living Expenses,2023-01-19,Orange,0.0,3875.0,3258.53
0062x00000EMLw6AAH,0012x00000cmYy4AAE,Latrobe,TAS,Australia,Loan Paid,Existing Client-Granted Loan Before,21.37,98.33,1667.1814,2.0,0.0,4.0,4.0,2.0,6266.7147,0.0,12.0,325.8929,2020.6016,1882.15,0.0,0.1,0.0,0.0,2000.0,400.0,400.0,3500,4226.2,8.0,16.143,Fortnightly,33.0,6271.71,3500.0,Casual Employment,0.0,0.0,0.0,0.0,5391.2566,762.0,1640.7666,528.28,MoneySpot,0.0,6097121,0.0,03-08-2023,False,Medical Expenses,2023-08-03,Green,1350.0,6315.0,6271.71
0062x00000EyUd7AAF,0012x00000Rr844AAB,Roseville Chase,NSW,Australia,Closed Lost,Existing Client-Granted Loan Before,0.0,45.92,6184.9884,4.0,0.0,0.0,4.0,4.0,14890.9998,14.0,33.0,496.08,8936.3825,9350.69,1.0,0.76,0.0,0.0,8000.0,599.0,1500.0,3500,4279.68,4.0,17.143,Monthly,38.0,14934.33,3500.0,Full-Time Employment,19.0,0.0,0.4066,6.0,11915.1766,1546.0,9725.0666,1069.92,MoneySpot,,6739918,9.0,06-10-2023,False,Travel Expenses,2023-10-04,Green,0.0,16559.0,14934.33
0062x00000E45kYAAR,0012x00000INsMxAAL,Coraki,NSW,Australia,Loan Paid,Existing Client-Granted Loan Before,0.0,99.68,3441.2624,2.0,1.0,0.0,3.0,2.0,5806.8975,8.0,46.0,2564.7018,2672.7642,2462.5,1.0,0.0,0.0,0.0,4333.33,599.0,400.0,3500,4221.17,8.0,16.0,Fortnightly,53.0,6612.23,3500.0,Unemployed,8.0,0.0,0.1209,2.0,6236.45,2754.0,3622.86,527.65,MoneySpot,0.0,5540708,6.0,08-06-2023,False,Home Maintenance & Repairs,2023-06-08,Green,0.0,7048.0,6612.23
0062x00000DIV1RAAX,0012x00000SHmmlAAD,Seaford,VIC,Australia,Loan Paid,Existing Client-Granted Loan Before,0.0,53.33,2625.3748,2.0,1.0,0.0,3.0,2.0,9218.3027,1.0,57.0,0.0,2039.8571,2013.0,1.0,0.07,0.0,1.0,3466.67,599.0,900.0,3500,4178.83,7.0,13.857,Fortnightly,39.0,9314.84,3500.0,Full-Time Employment,1.0,0.0,0.0,1.0,0.0,1414.0,2874.62,596.98,MoneySpot,0.0,4836476,1.0,10-03-2023,False,Living Expenses,2023-03-10,Green,0.0,9934.0,9314.84
0062x00000EbVEIAA3,0012x00000TuYvIAAV,Lethbridge Park,NSW,Australia,Loan Paid,Existing Client-Granted Loan Before,0.0,80.97,2200.5499,4.0,0.0,0.0,1.0,4.0,2266.3332,0.0,29.0,0.0,241.6111,200.0,0.0,17.04,0.0,1.0,6066.67,400.0,1500.0,3500,4483.77,30.0,30.429,Weekly,36.0,16572.99,3500.0,Full-Time Employment,0.0,0.0,0.0,0.0,0.0,1503.0,5033.87,149.47,MoneySpot,0.0,6293614,0.0,22-08-2023,False,Home Maintenance & Repairs,2023-08-22,Orange,0.0,19253.0,16572.99
0062x00000DHqmVAAT,0010K000022osvuQAA,Clontarf,QLD,Australia,Loan Paid,Existing Client-Granted Loan Before,17.95,49.29,5986.5796,1.0,4.0,0.0,2.0,1.0,8415.5374,34.0,133.0,3506.6837,998.0,998.0,0.0,0.05,1.0,0.0,2901.17,599.0,1400.0,3500,4218.08,16.0,16.429,Weekly,64.0,11323.81,58000.0,Part-Time Employment,34.0,0.0,0.2527,16.0,7931.99,3889.0,6769.1133,263.64,MoneySpot,0.0,4804063,21.0,06-03-2023,False,Living Expenses,2023-03-05,Green,2663.0,14831.0,11323.81
0062x00000DtZk2AAF,0012x00000flqi6AAA,Springvale South,VIC,Australia,Loan Paid,Existing Client-Granted Loan Before,0.0,74.01,3063.5383,1.0,0.0,0.0,3.0,1.0,3757.3679,0.0,22.0,1415.0229,832.9569,916.58,0.0,0.0,0.0,0.0,3861.0,599.0,450.0,3200,4011.98,24.0,23.857,Weekly,39.0,3762.37,5000.0,Contract Employment,0.0,0.0,0.0,0.0,3609.48,1473.0,3273.5333,167.17,MoneySpot,0.0,5324911,0.0,19-05-2023,False,Vehicle Expenses,2023-05-19,Green,0.0,4419.0,3762.37
0062x00000DrTSnAAN,0012x00000SIQxfAAH,Elderslie,NSW,Australia,Loan Paid,Existing Client-Granted Loan Before,0.0,35.31,6164.7685,2.0,0.0,0.0,3.0,2.0,8711.7651,0.0,35.0,565.4024,3380.92,3380.92,0.0,0.01,0.0,0.0,10273.08,599.0,1300.0,3500,4198.83,8.0,15.429,Fortnightly,41.0,8711.77,3500.0,Full-Time Employment,0.0,0.0,0.0,0.0,7888.8133,1337.0,11754.09,524.86,MoneySpot,0.0,5170476,0.0,01-05-2023,False,Other Expenses,2023-04-30,Green,0.0,27833.0,8711.77
0062x00000E7BhZAAV,0012x00000XCYkvAAH,Airds,NSW,Australia,Loan Paid,Existing Client-Granted Loan Before,0.0,72.17,1402.8421,1.0,0.0,0.0,4.0,1.0,4466.6357,5.0,52.0,194.0583,1027.9384,1084.93,1.0,0.0,0.0,0.0,3798.66,1499.0,150.0,3500,4190.72,16.0,15.714,Weekly,56.0,4466.64,3500.0,Full-Time Employment,5.0,0.0,0.5824,1.0,4454.4,586.0,1421.0333,261.93,MoneySpot,0.0,5804285,4.0,03-07-2023,False,Travel Expenses,2023-07-03,Green,0.0,4454.0,4466.64
0062x00000EdmYvAAJ,0012x00000c86eIAAQ,Wyndham Vale,VIC,Australia,Loan Paid,Existing Client-Granted Loan Before,0.0,58.64,1470.1947,1.0,1.0,0.0,2.0,1.0,5135.4923,11.0,37.0,0.0,1161.1546,1358.2,1.0,64.77,0.0,0.0,260000.0,400.0,1000.0,3500,4270.98,20.0,19.857,Weekly,41.0,5172.83,4500.0,Full-Time Employment,11.0,0.0,0.4176,1.0,5031.67,448.0,2024.7833,213.55,MoneySpot,-0.01,6442740,11.0,07-09-2023,False,Living Expenses,2023-09-06,Orange,0.0,12354.0,5172.83
0062x00000DtKqcAAF,0012x00000TrFlOAAV,Currie,TAS,Australia,Loan Paid,Existing Client-Granted Loan Before,0.0,97.1,4741.0029,1.0,0.0,0.0,3.0,1.0,4246.1894,0.0,70.0,775.625,823.8576,822.54,0.0,0.0,0.0,0.0,5020.88,599.0,100.0,3300,3986.74,16.0,16.0,Weekly,49.0,4691.19,5000.0,Full-Time Employment,0.0,0.0,0.4066,0.0,4236.3833,2725.0,4574.4166,249.18,MoneySpot,0.0,5307105,0.0,18-05-2023,False,Other Expenses,2023-05-17,Green,0.0,4856.0,4691.19
0062x00000DtlJnAAJ,0012x00000TtEo5AAF,Mount Crawford,SA,Australia,Loan Paid,Existing Client-Granted Loan Before,0.0,61.68,1377.8632,3.0,0.0,0.0,5.0,3.0,7019.4899,2.0,4.0,439.3216,7015.4866,6654.41,2.0,0.19,1.0,0.0,3476.0,1499.0,980.0,3500,4263.15,4.0,16.714,Monthly,50.0,9257.82,3500.0,Full-Time Employment,2.0,0.0,0.0,0.0,7015.4866,512.0,2465.54,1065.79,MoneySpot,0.0,5344981,0.0,22-05-2023,False,Vehicle Expenses,2023-05-22,Orange,0.0,9546.0,9257.82
0062x00000E5MUOAA3,0012x00000hXcO8AAK,Murrumba Downs,QLD,Australia,Closed Lost,Existing Client-No Loan Granted Ever,0.0,76.96,738.69,1.0,0.0,0.0,4.0,1.0,3505.0007,12.0,14.0,0.0,806.6307,900.0,0.0,17.65,0.0,0.0,0.0,2000.0,800.0,3500,4105.84,9.0,9.857,Weekly,56.0,3555.0,3500.0,Full-Time Employment,12.0,0.0,0.0,5.0,3495.4,0.0,183.3333,456.21,MoneySpot,,5647625,2.0,18-06-2023,False,Living Expenses,2023-06-18,Orange,0.0,3852.0,3555.0
0062x00000F2Nt3AAF,0012x00000dzmvtAAA,Broken Hill,NSW,Australia,Loan Paid,Existing Client-Granted Loan Before,0.0,47.24,3870.7025,4.0,0.0,0.0,1.0,4.0,3367.4666,0.0,12.0,0.0,3367.4666,2996.4,0.0,3.13,0.0,1.0,2800.0,599.0,1120.0,3500,4556.17,18.0,34.857,Fortnightly,54.0,8023.06,3500.0,Full-Time Employment,1.0,0.0,0.0,0.0,3571.4166,412.0,3969.81,253.13,QuickCash,0.0,6966438,0.0,27-10-2023,False,Other Expenses,2023-10-27,Orange,0.0,6136.0,8023.06
0062x00000FUWnEAAX,0012x00000Tr5E3AAJ,Australind,WA,Australia,Loan Paid,Existing Client-Granted Loan Before,0.0,13.11,1134.1429,3.0,0.0,0.0,4.0,3.0,7947.5233,1.0,21.0,650.9286,7947.5233,6984.43,0.0,0.0,0.0,0.0,8000.0,599.0,2400.0,3500,4300.64,4.0,17.571,Monthly,54.0,7947.52,3500.0,Full-Time Employment,1.0,0.0,0.2857,1.0,7947.5233,1073.0,1518.2566,1075.16,MoneySpot,0.0,7517145,1.0,15-12-2023,False,Vehicle Expenses,2023-12-15,Green,0.0,8790.0,7947.52
0062x00000EeyJnAAJ,0010K000023zTNJQA2,Cammeray,NSW,Australia,Loan Paid,Existing Client-Granted Loan Before,0.07,51.55,23604.7198,3.0,0.0,0.0,4.0,3.0,16491.9365,0.0,31.0,1016.37,9326.0866,9326.09,1.0,3.18,0.0,0.0,0.0,899.0,2200.0,3500,4375.61,5.0,21.857,Monthly,39.0,16572.27,3500.0,Full-Time Employment,0.0,0.0,0.5604,0.0,12046.2633,1542.0,26803.3866,875.13,Financier-2,0.04,6532886,0.0,15-09-2023,False,Travel Expenses,2023-09-15,Orange,27.0,35900.0,16572.27
0062x00000E4k4OAAR,0012x00000dxNThAAM,Glenroy,VIC,Australia,Loan Paid,Existing Client-Granted Loan Before,0.0,60.68,1660.3424,1.0,0.0,0.0,2.0,1.0,2664.225,4.0,35.0,793.4694,439.036,335.56,0.0,0.0,0.0,0.0,3811.34,400.0,200.0,3150,4035.91,28.0,28.143,Weekly,26.0,5080.54,5000.0,Part-Time Employment,4.0,0.0,0.011,0.0,731.7266,1476.0,2364.79,144.14,MoneySpot,0.0,5594789,4.0,14-06-2023,False,Travel Expenses,2023-06-13,Green,0.0,3900.0,5080.54
0062x00000EwpleAAB,0012x00000XCVG6AAP,Cranbourne North,VIC,Australia,Loan Paid,Existing Client-Granted Loan Before,0.0,51.34,1243.8033,1.0,0.0,0.0,2.0,1.0,7971.165,0.0,27.0,0.0,1834.46,1834.46,1.0,0.0,0.0,0.0,7068.32,1499.0,2618.0,3500,4412.51,26.0,26.571,Weekly,45.0,7971.17,5000.0,Full-Time Employment,0.0,0.0,0.033,0.0,7949.3266,655.0,1352.7266,169.72,MoneySpot,0.0,6620030,0.0,23-09-2023,False,Other Expenses,2023-09-22,Orange,0.0,8848.0,7971.17
0062x00000DthwzAAB,0012x00000TuxwZAAR,Pagewood,NSW,Australia,Loan Paid,Existing Client-Granted Loan Before,0.0,96.87,876.0233,4.0,0.0,0.0,1.0,4.0,19493.71,1.0,21.0,1315.789,8496.5025,8355.67,0.0,33.05,0.0,0.0,7339.0,599.0,1000.0,3050,3853.79,5.0,21.286,Monthly,32.0,25632.04,3050.0,Full-Time Employment,1.0,0.0,0.0,1.0,11328.67,1356.0,13692.3566,770.76,MoneySpot,0.0,5337913,0.0,20-05-2023,False,Life Event Expenses,2023-05-20,Green,0.0,28283.0,25632.04
0062x00000ENSZuAAP,0010K00001hC7HdQAK,Hampton Park,VIC,Australia,Loan Paid,Existing Client-Granted Loan Before,0.0,52.37,3173.6627,4.0,0.0,0.0,2.0,4.0,6928.2933,5.0,53.0,3750.1181,2598.11,2430.47,0.0,0.0,0.0,0.0,6500.0,1499.0,1000.0,3500,4210.4,8.0,15.714,Fortnightly,48.0,6928.29,3500.0,Full-Time Employment,5.0,0.0,0.022,4.0,6928.2933,4379.0,4378.8533,526.3,MoneySpot,0.0,6176012,5.0,11-08-2023,False,Travel Expenses,2023-08-11,Green,0.0,9289.0,6928.29
0062x00000E4zoQAAR,0010K0000260QTfQAM,Jurien Bay,WA,Australia,Loan Paid,Existing Client-Granted Loan Before,0.0,11.67,3293.4866,3.0,0.0,0.0,3.0,3.0,10714.12,6.0,27.0,9.6,10714.12,12236.77,1.0,20.24,0.0,0.0,7800.0,599.0,500.0,3450,4254.92,4.0,17.857,Monthly,50.0,10718.49,3450.0,Full-Time Employment,6.0,0.0,0.0,4.0,10714.12,3808.0,6230.6233,1063.73,MoneySpot,0.0,5615399,0.0,15-06-2023,False,Vehicle Expenses,2023-06-15,Green,0.0,15222.0,10718.49
0062x00000DXePWAA1,0012x000002bqfIAAQ,Moorooka,QLD,Australia,Loan Paid,Existing Client-Granted Loan Before,3.84,50.58,2845.0145,2.0,1.0,2.0,3.0,2.0,7200.9444,6.0,37.0,1948.2522,1543.98,1456.03,1.0,3.43,0.0,0.0,0.0,599.0,2000.0,3100,3938.1,12.0,24.429,Fortnightly,27.0,7539.94,5000.0,Full-Time Employment,6.0,0.0,0.1648,5.0,6207.6033,2095.0,3106.1866,328.18,MoneySpot,-0.15,4988245,5.0,04-04-2023,False,Life Event Expenses,2023-04-04,Green,281.0,7313.0,7539.94
0062x00000DZaXAAA1,0012x00000c8WAdAAM,Campsie,NSW,Australia,Closed Lost,Existing Client-Granted Loan Before,0.0,68.59,2261.2121,1.0,0.0,0.0,5.0,1.0,4332.2002,7.0,49.0,2611.5588,997.0,997.0,0.0,0.04,0.0,0.0,4320.33,400.0,400.0,3500,5781.04,16.0,16.286,Weekly,33.0,4462.2,5000.0,Full-Time Employment,7.0,0.0,0.022,0.0,4320.3333,2364.0,2363.51,361.32,MoneySpot,,5101412,7.0,20-04-2023,False,Travel Expenses,2023-04-20,Green,0.0,6991.0,4462.2
0062x00000FJn4cAAD,0012x00000TJ9xwAAD,Parafield Gardens,SA,Australia,Loan Paid,Existing Client-Granted Loan Before,0.0,38.46,1287.1216,1.0,0.0,0.0,3.0,1.0,9343.0266,0.0,58.0,0.0,2150.1766,1561.04,1.0,0.28,0.0,0.0,1500.0,599.0,1000.0,3500,4207.17,16.0,16.143,Weekly,28.0,9455.03,3500.0,Full-Time Employment,0.0,0.0,0.011,0.0,8600.7066,676.0,2196.06,262.95,MoneySpot,0.0,7347616,0.0,29-11-2023,False,Vehicle Expenses,2023-11-29,Green,0.0,9029.0,9455.03
0062x00000EO61RAAT,0012x00000TrZn8AAF,Mermaid Waters,QLD,Australia,Closed Lost,Existing Client-Granted Loan Before,0.0,45.82,1135.7557,1.0,0.0,0.0,3.0,1.0,3833.449,0.0,27.0,0.0,1008.25,1016.0,0.0,16.08,0.0,1.0,3813.33,400.0,100.0,3500,4588.91,36.0,36.143,Weekly,23.0,5627.55,4500.0,Full-Time Employment,0.0,0.0,0.022,0.0,0.0,1126.0,1173.27,127.47,MoneySpot,,6231645,0.0,21-08-2023,False,Vehicle Expenses,2023-08-16,Orange,0.0,5074.0,5627.55
0062x00000DUeXbAAL,0012x00000IOjp8AAD,Konnongorring,WA,Australia,Loan Paid,Existing Client-Granted Loan Before,0.0,51.47,3246.7369,4.0,0.0,0.0,2.0,4.0,206.6666,0.0,51.0,1150.3076,206.6666,300.0,1.0,4.16,0.0,0.0,10767.95,1500.0,0.0,3500,4207.56,16.0,16.143,Weekly,58.0,11929.0,3500.0,Casual Employment,0.0,0.0,0.0769,0.0,6965.7266,1512.0,4152.4033,262.98,MoneySpot,0.0,5378410,0.0,24-05-2023,False,Life Event Expenses,2023-05-24,Green,0.0,4514.0,11929.0
0062x00000ExhGmAAJ,0010K000022p8sqQAA,Cunnamulla,QLD,Australia,Loan Paid,Existing Client-Granted Loan Before,25.91,76.77,1643.2755,2.0,2.0,4.0,4.0,2.0,7990.8083,12.0,42.0,713.5326,2039.7833,1768.95,2.0,45.4,0.0,0.0,2604.33,599.0,400.0,3500,4220.81,8.0,16.0,Fortnightly,45.0,7990.81,3500.0,Full-Time Employment,12.0,0.0,0.2637,10.0,7255.3666,1669.0,2064.31,527.61,QuickCash,0.0,6681198,6.0,29-09-2023,False,Medical Expenses,2023-09-28,Green,3394.0,13096.0,7990.81
0062x00000DVevFAAT,0012x00000IN427AAD,Korumburra,VIC,Australia,Loan Paid,Existing Client-Granted Loan Before,0.0,93.3,1181.7412,2.0,0.0,0.0,3.0,2.0,3313.9749,2.0,20.0,0.0,1525.3366,1411.41,0.0,2.18,0.0,0.0,3250.0,599.0,300.0,3500,4295.36,10.0,20.0,Fortnightly,50.0,3363.64,3500.0,Part-Time Employment,2.0,0.0,0.044,0.0,3050.6733,506.0,1264.4166,429.54,MoneySpot,0.0,5465464,0.0,01-06-2023,False,Veterinary Expenses,2023-06-01,Green,0.0,3585.0,3363.64
0062x00000EByiZAAT,0012x000002cwXgAAI,North Saint Marys,NSW,Australia,Loan Paid,Existing Client-Granted Loan Before,0.0,87.0,3911.8622,1.0,0.0,0.0,3.0,1.0,8512.2727,2.0,79.0,2332.5971,1827.6418,2288.63,3.0,0.11,0.0,0.0,6500.0,599.0,310.0,3050,3717.04,16.0,16.0,Weekly,56.0,8512.27,3050.0,Full-Time Employment,3.0,0.0,0.1209,0.0,6701.3533,3112.0,4335.15,232.32,QuickCash,0.0,5846062,2.0,06-07-2023,False,Vehicle Expenses,2023-07-06,Green,0.0,9010.0,8512.27
0062x00000FX3lTAAT,0012x00000Vf1lsAAB,Morayfield,QLD,Australia,Loan Paid,Existing Client-Granted Loan Before,0.0,6.55,1345.4637,2.0,0.0,0.0,4.0,2.0,4899.1689,0.0,14.0,0.0,2254.96,2254.96,0.0,0.0,0.0,0.0,0.0,599.0,660.0,3500,4193.67,8.0,15.286,Fortnightly,51.0,4509.92,3500.0,,0.0,0.0,0.022,0.0,4509.92,0.0,1427.8833,524.22,MoneySpot,0.0,7720260,0.0,2024-01-04,False,Relocation Expenses,2024-01-04,Orange,0.0,4622.0,4509.92
0062x00000DWZnTAAX,0010K00001hDUmjQAG,Robina,QLD,Australia,Loan Paid,Existing Client-Granted Loan Before,0.0,61.92,4279.4004,1.0,0.0,0.0,3.0,1.0,19497.9858,9.0,15.0,2016.6671,2842.295,3198.79,0.0,31.58,0.0,0.0,7366.67,1499.0,450.0,3300,4016.69,18.0,17.857,Weekly,39.0,23371.29,3300.0,Full-Time Employment,9.0,0.0,0.044,0.0,11369.18,2548.0,4541.0666,223.15,MoneySpot,0.0,4924027,9.0,24-03-2023,False,Travel Expenses,2023-03-23,Orange,0.0,25564.0,23371.29
0062x00000DW26LAAT,0010K000022PZCZQA4,Hope Vale,QLD,Australia,Loan Paid,Existing Client-Granted Loan Before,3.38,83.96,1916.1888,2.0,0.0,0.0,3.0,2.0,4840.2758,0.0,69.0,672.0244,1477.3,1481.31,0.0,0.0,0.0,0.0,2719.0,599.0,450.0,3100,3908.18,12.0,23.571,Fortnightly,66.0,6290.61,5000.0,Full-Time Employment,0.0,0.0,0.3516,0.0,3447.0333,841.0,2866.4766,325.69,MoneySpot,0.0,4891872,0.0,19-03-2023,False,Home Maintenance & Repairs,2023-03-19,Green,250.0,7383.0,6290.61
0062x00000F1ibiAAB,0012x00000TtURZAA3,Essendon,VIC,Australia,Loan Paid,Existing Client-Granted Loan Before,0.0,76.07,5101.5323,4.0,0.0,0.0,3.0,4.0,7315.7699,0.0,33.0,325.8929,2656.8312,3290.0,0.0,3.86,0.0,0.0,6175.0,899.0,1550.0,3500,4204.99,8.0,15.571,Fortnightly,47.0,7371.47,3500.0,Full-Time Employment,0.0,0.0,0.4396,0.0,7084.8833,1654.0,6549.1766,525.63,MoneySpot,0.0,6916080,0.0,22-10-2023,False,Medical Expenses,2023-10-22,Green,0.0,7959.0,7371.47
0062x00000Dr0eZAAR,0012x00000ckz1SAAQ,Lockleys,SA,Australia,Loan Paid,Existing Client-Granted Loan Before,0.0,72.73,12215.0297,4.0,0.0,0.0,2.0,4.0,1048.3333,0.0,8.0,2038.0915,660.0,620.0,0.0,0.1,0.0,1.0,5031.75,1499.0,2532.0,3500,4273.71,10.0,19.429,Fortnightly,41.0,19154.13,3500.0,Full-Time Employment,0.0,0.0,0.989,0.0,8096.8166,1865.0,12363.8166,427.38,MoneySpot,0.0,5141373,0.0,26-04-2023,False,Living Expenses,2023-04-26,Orange,0.0,16385.0,19154.13
0062x00000ExQ27AAF,0012x000008Itl1AAC,Underdale,SA,Australia,Loan Paid,Existing Client-Granted Loan Before,0.0,34.42,2037.358,2.0,0.0,0.0,3.0,2.0,4344.3134,0.0,18.0,122.88,1907.52,1902.15,0.0,0.0,1.0,0.0,2741.6,599.0,460.0,3500,4263.59,9.0,18.143,Fortnightly,37.0,4344.31,3500.0,Full-Time Employment,0.0,0.0,0.0,0.0,3179.2,1043.0,1808.85,473.74,MoneySpot,0.0,6661434,0.0,27-09-2023,False,Medical Expenses,2023-09-27,Green,0.0,5948.0,4344.31
0062x00000D8p61AAB,0012x00000Wr9lcAAB,Baulkham Hills,NSW,Australia,Loan Paid,Existing Client-Granted Loan Before,0.0,78.16,6008.5689,4.0,2.0,0.0,4.0,4.0,10935.3566,3.0,106.0,1617.7228,2948.0,2948.0,1.0,0.91,0.0,0.0,9477.16,899.0,3000.0,3500,4213.17,16.0,16.286,Weekly,47.0,10935.36,3500.0,Full-Time Employment,3.0,0.0,0.7363,3.0,9826.6666,2283.0,7575.7366,263.33,MoneySpot,0.0,4551153,3.0,25-01-2023,False,Living Expenses,2023-01-25,Orange,0.0,14095.0,10935.36
0062x00000DrVrGAAV,0010K00001cRL2sQAG,Munno Para West,SA,Australia,Loan Paid,Existing Client-Granted Loan Before,0.0,36.67,1625.8246,1.0,0.0,0.0,3.0,1.0,7854.8434,1.0,60.0,1022.0434,1124.8315,1149.96,0.0,0.63,0.0,0.0,2383.33,899.0,560.0,3400,4182.37,20.0,20.429,Weekly,25.0,8475.26,3500.0,Part-Time Employment,1.0,0.0,0.011,0.0,5628.7666,1189.0,3701.8333,209.12,MoneySpot,-0.02,5172282,1.0,01-05-2023,False,Travel Expenses,2023-05-01,Green,0.0,8269.0,8475.26
0062x00000Fj70rAAB,0012x00000iKqS2AAK,Tenterfield,NSW,Australia,Closed Lost,Existing Client-Granted Loan Before,47.1,42.77,3234.3526,2.0,1.0,0.0,2.0,2.0,4815.5666,12.0,29.0,0.0,2216.48,2039.6,0.0,0.23,0.0,0.0,1000.0,1499.0,900.0,3250,3925.08,8.0,15.286,Fortnightly,34.0,5282.23,3250.0,Self Employed,22.0,0.0,0.0,6.0,5171.7866,768.0,4003.7233,490.64,MoneySpot,,8039740,10.0,2024-01-29,False,Living Expenses,2024-01-29,Green,8544.0,18137.0,5282.23
0062x00000E5B82AAF,0012x00000XCWS9AAP,Vale View,QLD,Australia,Loan Paid,Existing Client-Granted Loan Before,1.97,36.4,5214.0789,2.0,1.0,0.0,2.0,2.0,7333.3434,5.0,0.0,1125.1916,2746.0,2746.0,1.0,0.84,0.0,1.0,1679.17,899.0,2000.0,3500,4284.98,10.0,19.714,Fortnightly,56.0,7333.34,5000.0,Full-Time Employment,5.0,0.0,0.4615,2.0,0.0,1832.0,5760.0866,428.5,Financier-2,-0.06,5629075,2.0,16-06-2023,False,Furniture or Appliances,2023-06-16,Orange,204.0,10348.0,7333.34
0062x00000FUV10AAH,0012x00000OKnkgAAD,Moore Creek,NSW,Australia,Loan Paid,Existing Client-Granted Loan Before,0.0,76.95,3494.2904,4.0,0.0,0.0,1.0,4.0,5945.9665,0.0,49.0,480.8173,1280.4714,5000.0,1.0,2.38,0.0,1.0,4194.67,599.0,300.0,3200,3886.53,8.0,15.714,Fortnightly,31.0,7684.06,3200.0,Full-Time Employment,0.0,0.0,0.2088,0.0,3469.8666,2271.0,6160.2233,485.82,MoneySpot,0.0,7514993,0.0,15-12-2023,False,Life Event Expenses,2023-12-14,Green,0.0,9644.0,7684.06
0062x00000DGiHLAA1,0012x00000IOea7AAD,Wantirna South,VIC,Australia,Loan Paid,Existing Client-Granted Loan Before,0.0,71.01,7340.6757,2.0,0.0,0.0,3.0,2.0,16983.0912,1.0,89.0,4385.8858,3303.3942,3527.37,1.0,0.12,0.0,0.0,5416.67,899.0,1300.0,3500,4296.07,10.0,20.0,Fortnightly,49.0,18046.45,3500.0,Full-Time Employment,2.0,0.0,0.0769,0.0,11538.2,5130.0,8669.13,429.61,MoneySpot,0.0,4736964,1.0,23-02-2023,False,Medical Expenses,2023-02-22,Orange,0.0,19544.0,18046.45
0062x00000E3o6oAAB,0012x00000forxUAAQ,Docklands,VIC,Australia,Loan Paid,Existing Client-Granted Loan Before,0.0,79.07,3103.2613,2.0,0.0,0.0,3.0,2.0,5199.3444,2.0,29.0,859.3342,1750.0433,1689.37,1.0,0.0,0.0,0.0,3237.28,599.0,689.0,3150,3989.39,12.0,24.286,Fortnightly,30.0,7108.23,5000.0,Part-Time Employment,2.0,0.0,0.1868,0.0,3500.0866,760.0,4516.9866,332.46,MoneySpot,0.0,5518401,1.0,06-06-2023,False,Travel Expenses,2023-06-06,Green,0.0,8824.0,7108.23
0062x00000FUBTcAAP,0012x00000XLfT2AAL,Richmond,VIC,Australia,Loan Paid,Existing Client-Granted Loan Before,0.0,61.85,1804.0486,1.0,0.0,0.0,2.0,1.0,4901.4734,0.0,29.0,732.5236,1005.44,1033.35,0.0,45.14,0.0,0.0,6500.0,1499.0,300.0,3500,4202.16,16.0,16.0,Weekly,31.0,8716.08,3500.0,Full-Time Employment,0.0,0.0,0.0,0.0,4356.9066,1952.0,3313.94,262.64,MoneySpot,0.0,7489361,0.0,13-12-2023,False,Travel Expenses,2023-12-12,Orange,0.0,11389.0,8716.08
0062x00000EbgLKAAZ,0012x00000WtF7hAAF,Craigie,WA,Australia,Loan Paid,Existing Client-Granted Loan Before,0.0,68.76,1959.149,2.0,0.0,0.0,2.0,2.0,4624.7294,2.0,13.0,842.813,2128.6433,2190.47,0.0,0.05,0.0,0.0,5769.54,899.0,0.0,3400,4407.42,17.0,33.0,Fortnightly,30.0,4624.73,3500.0,Full-Time Employment,2.0,0.0,0.0,0.0,4257.2866,2180.0,5019.3533,259.27,MoneySpot,0.0,6305244,2.0,23-08-2023,False,Veterinary Expenses,2023-08-23,Green,0.0,5611.0,4624.73
0062x00000DsFO3AAN,0012x00000VfkfOAAR,Fletcher,NSW,Australia,Loan Paid,Existing Client-Granted Loan Before,0.39,21.56,425.25,2.0,0.0,0.0,2.0,2.0,3486.467,0.0,26.0,792.6584,1416.4783,853.79,0.0,0.0,0.0,0.0,2383.33,400.0,400.0,3500,4194.09,8.0,15.286,Fortnightly,27.0,3513.47,3500.0,Part-Time Employment,0.0,0.0,0.022,0.0,2868.9566,172.0,810.05,524.27,QuickCash,0.0,5229185,0.0,09-05-2023,False,Vehicle Expenses,2023-05-09,Green,13.0,3262.0,3513.47
0062x00000EDpBwAAL,0010K00001dS2XQQA0,Horsham,VIC,Australia,Closed Lost,Existing Client-Granted Loan Before,14.8,74.42,3365.1098,3.0,0.0,2.0,2.0,3.0,6618.234,0.0,112.0,193.4881,2866.6666,100.0,3.0,0.0,1.0,1.0,3033.33,899.0,0.0,3500,4133.27,14.0,14.143,Weekly,37.0,6621.48,3500.0,Full-Time Employment,0.0,0.0,0.011,0.0,2747.2466,1169.0,5876.1433,295.24,MoneySpot,,5967170,0.0,21-07-2023,False,Medical Expenses,2023-07-21,Orange,1681.0,11353.0,6621.48
0062x00000DWBjKAAX,0012x00000XMgVRAA1,Hillsdale,NSW,Australia,Loan Paid,Existing Client-Granted Loan Before,0.0,67.26,3166.9066,2.0,0.0,0.0,3.0,2.0,11619.9148,0.0,28.0,320.0,1949.7033,1925.14,0.0,7.4,2.0,0.0,0.0,400.0,100.0,3100,3933.44,12.0,24.286,Fortnightly,52.0,7013.11,5000.0,,0.0,0.0,0.011,0.0,3899.4066,2960.0,5183.7833,327.79,MoneySpot,0.0,4900381,0.0,21-03-2023,False,Travel Expenses,2023-03-21,Green,0.0,17170.0,7013.11
0062x00000Fji22AAB,0012x00000GbP0PAAV,Mawson Lakes,SA,Australia,Loan Paid,Existing Client-Granted Loan Before,0.0,32.25,4659.2055,2.0,2.0,0.0,3.0,2.0,36577.652,7.0,90.0,2719.7052,13670.4742,15880.96,0.0,0.0,1.0,0.0,8000.0,899.0,1000.0,3500,4215.47,8.0,15.857,Fortnightly,32.0,38780.24,3500.0,Full-Time Employment,7.0,0.0,0.0,1.0,31897.7733,4340.0,10781.4733,526.94,MoneySpot,0.0,8082568,6.0,2024-02-02,False,Home Maintenance & Repairs,2024-02-02,Green,0.0,39170.0,38780.24
0062x00000F3rgfAAB,0012x000002c87dAAA,Wee Waa,NSW,Australia,Loan Paid,Existing Client-Granted Loan Before,0.0,62.83,1230.1842,4.0,0.0,0.0,4.0,4.0,3863.1066,0.0,22.0,518.9518,1464.9028,1732.55,0.0,0.52,0.0,0.0,2600.0,599.0,0.0,3350,4409.27,18.0,35.571,Fortnightly,46.0,3884.77,5000.0,Full-Time Employment,0.0,0.0,0.0879,0.0,3418.1066,1417.0,3714.8733,244.97,MoneySpot,0.0,7085193,0.0,06-11-2023,False,Other Expenses,2023-11-06,Green,0.0,6355.0,3884.77
0062x00000DIJNlAAP,0010K0000272bK0QAI,Ashfield,NSW,Australia,Loan Paid,Existing Client-Granted Loan Before,0.0,77.85,2384.6077,1.0,0.0,0.0,2.0,1.0,8851.1753,6.0,43.0,1308.3946,703.3061,518.69,0.0,7.86,0.0,0.0,3033.0,599.0,320.0,3350,4179.05,24.0,23.857,Weekly,35.0,7868.27,5000.0,Full-Time Employment,6.0,0.0,0.0549,1.0,3047.66,2307.0,2560.5,174.13,MoneySpot,0.0,4826776,6.0,09-03-2023,False,Furniture or Appliances,2023-03-09,Green,0.0,10453.0,7868.27
0062x00000GG3B1AAL,0012x00000n0xYJAAY,Butler,WA,Australia,Closed Lost,Existing Client-Granted Loan Before,0.91,48.1,4509.2866,3.0,0.0,0.0,5.0,3.0,12054.635,0.0,40.0,0.0,7049.67,7049.67,0.0,0.0,0.0,1.0,0.0,1499.0,2600.0,3500,4239.73,4.0,16.0,Monthly,33.0,12054.64,5000.0,Full-Time Employment,0.0,0.0,0.022,0.0,3844.12,1485.0,4564.2866,1059.94,MoneySpot,,8605601,0.0,2024-03-26,False,Travel Expenses,2024-03-25,Orange,123.0,13415.0,12054.64
0062x00000DFkVSAA1,0010K00002BUPtZQAX,Potts Point,NSW,Australia,Loan Paid,Existing Client-Granted Loan Before,0.0,57.47,2380.1566,3.0,0.0,0.0,2.0,3.0,5010.4266,0.0,19.0,2316.7982,5010.4266,5010.43,1.0,1.51,0.0,0.0,0.0,599.0,820.0,3500,4286.9,4.0,17.286,Monthly,51.0,5010.43,4000.0,Full-Time Employment,0.0,0.0,0.033,0.0,5010.4266,2432.0,3868.0166,1071.73,MoneySpot,2.36,4684423,0.0,15-02-2023,False,Life Event Expenses,2023-02-14,Green,0.0,5090.0,5010.43
0062x00000E6MX8AAN,0012x00000INbxQAAT,New Lambton,NSW,Australia,Loan Paid,Existing Client-Granted Loan Before,0.0,36.4,3157.6264,2.0,0.0,0.0,3.0,2.0,5121.2283,0.0,55.0,908.1656,1630.1,1537.49,0.0,0.15,0.0,0.0,4340.74,599.0,400.0,3250,3930.16,8.0,15.429,Fortnightly,31.0,5121.23,3250.0,Part-Time Employment,0.0,0.0,0.0,0.0,5230.4933,948.0,3042.92,491.27,MoneySpot,-0.63,5731770,0.0,26-06-2023,False,Travel Expenses,2023-06-26,Green,0.0,6131.0,5121.23
0062x00000ENmpQAAT,0012x00000cmtyOAAQ,Neerim South,VIC,Australia,Closed Lost,Existing Client-Granted Loan Before,0.0,81.48,0.0,1.0,1.0,0.0,3.0,1.0,5044.227,3.0,25.0,1210.4819,1026.6153,1165.0,0.0,53.09,0.0,1.0,4280.67,1499.0,0.0,3250,3878.33,14.0,14.429,Weekly,31.0,6067.24,3250.0,Full-Time Employment,3.0,0.0,0.2308,3.0,0.0,1775.0,1905.0666,277.03,MoneySpot,,6204466,3.0,14-08-2023,False,Vehicle Expenses,2023-08-13,Orange,0.0,8536.0,6067.24
0062x00000FWUJEAA5,0010K00001hCekQQAS,South Arm,TAS,Australia,Closed Lost,Existing Client-Granted Loan Before,0.0,94.35,2707.9566,2.0,0.0,0.0,2.0,2.0,4394.9349,0.0,33.0,431.8,1697.3685,1702.46,0.0,1.74,0.0,0.0,972.83,599.0,400.0,3500,4172.91,7.0,13.714,Fortnightly,26.0,4394.93,3500.0,Full-Time Employment,0.0,0.0,0.0769,0.0,3960.5266,1208.0,4213.43,596.14,MoneySpot,,7674076,0.0,01-01-2024,False,Vehicle Expenses,2023-12-29,Orange,0.0,4783.0,4394.93
0062x00000DZIm4AAH,0010K00001wUbtPQAS,Doolandella,QLD,Australia,Loan Paid,Existing Client-Granted Loan Before,4.14,73.54,6240.9963,2.0,0.0,2.0,3.0,2.0,9208.679,1.0,57.0,0.0,2258.7366,2941.02,1.0,0.0,0.0,0.0,4565.17,599.0,1100.0,3500,4194.16,8.0,15.286,Fortnightly,36.0,10432.17,3500.0,Part-Time Employment,1.0,0.0,0.0549,1.0,8402.0866,2278.0,8471.54,524.28,MoneySpot,0.0,5085743,0.0,18-04-2023,False,Medical Expenses,2023-04-18,Orange,526.0,12689.0,10432.17
0062x00000DV7URAA1,0012x00000fo3csAAA,Yeronga,QLD,Australia,Loan Paid,Existing Client-Granted Loan Before,0.0,56.46,3585.1306,2.0,0.0,0.0,3.0,2.0,6369.4889,0.0,21.0,716.5298,1580.3985,1370.57,0.0,3.39,0.0,0.0,4116.67,599.0,870.0,3100,3907.79,12.0,23.571,Fortnightly,54.0,6530.53,4000.0,Full-Time Employment,0.0,0.0,0.0,0.0,3687.5966,770.0,4168.2733,325.66,MoneySpot,0.0,5421542,0.0,28-05-2023,False,Other Expenses,2023-05-28,Green,0.0,7414.0,6530.53
0062x00000FIXL1AAP,0010K00001iIXCRQA4,Deepwater,NSW,Australia,Loan Paid,Existing Client-Granted Loan Before,0.0,41.98,3654.3168,1.0,0.0,0.0,4.0,1.0,4802.482,0.0,74.0,1333.2001,1008.5714,960.0,0.0,0.0,0.0,1.0,3683.33,599.0,300.0,3500,4606.58,36.0,36.571,Weekly,49.0,5369.15,3500.0,Self Employed,0.0,0.0,0.0,0.0,420.0,2737.0,4745.89,127.97,MoneySpot,0.0,7257312,0.0,20-11-2023,False,Furniture or Appliances,2023-11-20,Orange,0.0,7410.0,5369.15
0062x00000E5JS5AAN,0012x00000ZwZMPAA3,Forest Lake,QLD,Australia,Loan Paid,Existing Client-Granted Loan Before,0.0,93.46,3482.1799,4.0,0.0,0.0,6.0,4.0,50900.9799,0.0,0.0,0.0,2133.8637,7585.0,0.0,52.29,0.0,1.0,3250.0,599.0,250.0,3500,4293.27,20.0,20.429,Weekly,23.0,50900.98,3500.0,Full-Time Employment,0.0,0.0,0.0,0.0,0.0,4438.0,6284.6466,214.67,MoneySpot,0.0,5641874,0.0,18-06-2023,False,Vehicle Expenses,2023-06-17,Orange,0.0,58741.0,50900.98
0062x00000F1JKMAA3,0010K00001rHLnPQAW,Sunset,QLD,Australia,Loan Paid,Existing Client-Granted Loan Before,0.0,90.51,3278.8329,2.0,0.0,0.0,3.0,2.0,7124.9088,7.0,30.0,2248.2432,2596.6942,2433.86,0.0,0.09,0.0,0.0,2166.67,899.0,600.0,3500,4486.87,15.0,30.0,Fortnightly,26.0,7313.75,5000.0,Full-Time Employment,7.0,0.0,0.1429,2.0,6058.9533,2019.0,3391.3666,299.13,MoneySpot,0.0,6884928,4.0,19-10-2023,False,Other Expenses,2023-10-19,Orange,0.0,7733.0,7313.75
0062x00000FTdQUAA1,0012x000004V1NDAA0,Collie,WA,Australia,Closed Lost,Existing Client-Granted Loan Before,0.0,7.36,2035.9567,3.0,0.0,0.0,2.0,3.0,7395.5066,0.0,25.0,1229.7255,7395.5066,7386.84,0.0,0.0,0.0,0.0,0.0,400.0,1000.0,3500,4166.65,4.0,14.0,Monthly,32.0,7395.51,3500.0,,0.0,0.0,0.0,0.0,7395.5066,1238.0,2233.77,1041.67,MoneySpot,,7446982,0.0,09-12-2023,False,Vehicle Expenses,2023-12-08,Green,0.0,8021.0,7395.51
0062x00000DJ837AAD,0012x00000TtgXrAAJ,Blacktown,NSW,Australia,Loan Paid,Existing Client-Granted Loan Before,0.0,61.59,3551.1146,2.0,0.0,0.0,3.0,2.0,5636.2144,23.0,3.0,1268.0803,2594.2028,2733.39,2.0,1.33,0.0,0.0,5273.32,599.0,1520.0,3500,4296.07,10.0,20.0,Fortnightly,41.0,5816.88,3500.0,Full-Time Employment,23.0,0.0,0.4066,5.0,6053.14,1392.0,3606.3566,429.61,MoneySpot,0.0,4872996,6.0,16-03-2023,False,Home Maintenance & Repairs,2023-03-16,Orange,0.0,6369.0,5816.88
0062x00000Ecp9jAAB,0012x000003CeIAAA0,FIGTREE,NSW,Australia,Closed Lost,Existing Client-Granted Loan Before,0.56,39.68,2901.4342,1.0,0.0,4.0,1.0,1.0,13864.5324,0.0,14.0,4.345,1220.4545,1700.0,0.0,13.33,0.0,1.0,4766.67,1500.0,200.0,3400,4063.12,14.0,14.143,Weekly,41.0,13864.53,3400.0,Full-Time Employment,0.0,0.0,0.1099,0.0,3807.9933,36.0,5138.6466,290.23,MoneySpot,,6381366,0.0,31-08-2023,False,Living Expenses,2023-08-31,Orange,98.0,17376.0,13864.53
0062x00000EeTzVAAV,0012x00000g7cfzAAA,Wollongbar,NSW,Australia,Loan Paid,Existing Client-Granted Loan Before,0.0,76.58,2370.6969,1.0,0.0,0.0,4.0,1.0,9177.7459,0.0,38.0,449.428,1728.6153,1811.0,1.0,1.3,0.0,0.0,0.0,1499.0,1200.0,3500,4600.71,36.0,36.429,Weekly,22.0,9766.24,3500.0,Full-Time Employment,2.0,0.0,0.0,2.0,7490.6666,1509.0,3158.34,127.8,MoneySpot,0.0,6493661,1.0,12-09-2023,False,Vehicle Expenses,2023-09-11,Orange,0.0,11056.0,9766.24
0062x00000EDL27AAH,0012x000003EMLVAA4,Woodridge,QLD,Australia,Closed Lost,Existing Client-No Loan Granted Ever,23.5,67.32,0.0,4.0,0.0,1.0,1.0,4.0,1307.5264,0.0,0.0,0.0,30.4477,35.0,0.0,2.4,0.0,1.0,3683.33,400.0,600.0,3500,4079.23,5.0,9.143,Fortnightly,27.0,4146.01,3500.0,Full-Time Employment,0.0,0.0,0.0,0.0,234.5933,0.0,42.9466,815.85,Financier-2,,5938607,0.0,18-07-2023,False,Vehicle Expenses,2023-07-17,Orange,991.0,4216.0,4146.01
0062x00000D9PhSAAV,0010K00001uJ0i0QAC,Longford,TAS,Australia,Closed Lost,Existing Client-Granted Loan Before,0.0,93.15,453.2333,1.0,1.0,0.0,3.0,1.0,4909.3024,27.0,30.0,459.5279,1079.6423,1085.22,0.0,0.0,0.0,0.0,2600.0,899.0,500.0,3500,4151.56,7.0,13.143,Fortnightly,29.0,8472.82,3500.0,Part-Time Employment,31.0,1.0,0.033,12.0,8459.97,453.0,467.9,593.09,MoneySpot,,4581211,27.0,30-01-2023,False,Medical Expenses,2023-01-30,Orange,0.0,5363.0,8472.82
0062x00000D7oU8AAJ,0012x00000GeaUyAAJ,Melton West,VIC,Australia,Loan Paid,Existing Client-Granted Loan Before,0.16,40.39,3572.2519,2.0,0.0,0.0,2.0,2.0,12481.3227,0.0,17.0,438.4908,4518.2757,5311.15,0.0,0.0,0.0,1.0,9533.33,400.0,0.0,3050,3734.5,8.0,16.0,Fortnightly,61.0,13466.32,3050.0,Full-Time Employment,0.0,0.0,0.3516,0.0,0.0,930.0,3659.5533,466.82,MoneySpot,0.0,4501167,0.0,18-01-2023,False,Medical Expenses,2023-01-18,Orange,27.0,16202.0,13466.32
0062x00000FiEUYAA3,0012x00000RqlsNAAR,Collinsville,QLD,Australia,Loan Paid,Existing Client-Granted Loan Before,0.0,39.82,2030.5643,0.0,0.0,0.0,0.0,0.0,0.0,0.0,63.0,596.8619,0.0,0.0,0.0,1.73,7.0,0.0,1810.0,1499.0,770.0,3500,4213.18,16.0,16.286,Weekly,39.0,11048.89,3500.0,Full-Time Employment,0.0,0.0,0.011,0.0,0.0,1545.0,3946.7966,263.33,MoneySpot,0.0,7968152,0.0,2024-01-23,False,Home Maintenance & Repairs,2024-01-23,Orange,0.0,10113.0,11048.89
0062x00000ELjjzAAD,0012x00000RqpUSAAZ,Kearneys Spring,QLD,Australia,Loan Paid,Existing Client-Granted Loan Before,0.4,77.49,1952.4798,1.0,1.0,0.0,4.0,1.0,6105.0742,10.0,59.0,0.0,961.3628,1154.13,1.0,0.0,0.0,0.0,4276.19,599.0,750.0,3500,4185.37,16.0,16.571,Weekly,40.0,6298.07,3500.0,Full-Time Employment,10.0,0.0,0.0879,0.0,5589.5433,839.0,4962.87,263.96,MoneySpot,0.0,6058915,8.0,31-07-2023,False,Vehicle Expenses,2023-07-30,Green,24.0,5947.0,6298.07
0062x00000E6GcCAAV,0010K000029H1lkQAC,Shortland,NSW,Australia,Loan Paid,Existing Client-Granted Loan Before,0.0,40.88,28898.7072,4.0,0.0,0.0,3.0,4.0,498868.1729,0.0,69.0,0.0,152665.1525,121732.14,0.0,0.0,0.0,1.0,0.0,899.0,840.0,3400,4188.26,20.0,20.571,Weekly,29.0,502689.87,3400.0,,1.0,0.0,0.0,0.0,3806.2466,536.0,30304.3766,209.42,MoneySpot,0.0,5726496,0.0,26-06-2023,False,Travel Expenses,2023-06-25,Orange,0.0,797682.0,502689.87
0062x00000FIBYyAAP,0010K00001rGMMlQAO,Rothwell,QLD,Australia,Closed Lost,Existing Client-No Loan Granted Ever,10.9,51.59,0.0,1.0,0.0,4.0,4.0,1.0,6012.1735,0.0,0.0,0.0,828.525,862.7,0.0,0.77,0.0,0.0,3900.0,599.0,0.0,3500,4092.33,10.0,10.0,Weekly,32.0,6012.17,3500.0,Full-Time Employment,0.0,0.0,0.1978,0.0,4483.2366,0.0,0.0,409.24,MoneySpot,,7231136,0.0,17-11-2023,False,Living Expenses,2023-11-16,Orange,1169.0,10722.0,6012.17
0062x00000DZpBiAAL,0012x00000OxWAoAAN,Dawesville,WA,Australia,Loan Paid,Existing Client-Granted Loan Before,0.0,53.77,2943.789,4.0,0.0,0.0,3.0,4.0,25416.7965,2.0,22.0,704.3276,10841.75,11037.85,0.0,43.43,0.0,0.0,8860.8,1499.0,2080.0,3500,4364.22,5.0,21.571,Monthly,36.0,25823.46,3500.0,Full-Time Employment,5.0,0.0,0.0,1.0,20598.0,672.0,3753.1233,872.85,MoneySpot,0.0,5116468,4.0,22-04-2023,False,Furniture or Appliances,2023-04-22,Green,0.0,50237.0,25823.46
0062x00000D9rQ1AAJ,0012x00000cmK7vAAE,Dubbo,NSW,Australia,Closed Lost,Existing Client-Granted Loan Before,0.0,96.57,74.5786,0.0,4.0,0.0,0.0,0.0,9.68,24.0,31.0,1164.4026,0.0,0.0,1.0,0.0,0.0,0.0,3310.67,400.0,50.0,3500,4196.54,16.0,15.857,Weekly,24.0,3811.47,3500.0,Full-Time Employment,24.0,0.0,0.3956,8.0,0.0,1518.0,1707.0433,262.29,Financier-2,,4602100,24.0,02-02-2023,False,Vehicle Expenses,2023-02-02,Green,0.0,3897.0,3811.47
0062x00000DY1JCAA1,0012x00000XLYXwAAP,Zilzie,QLD,Australia,Closed Lost,Existing Client-Granted Loan Before,0.0,51.52,1386.4737,1.0,0.0,0.0,2.0,1.0,4205.047,2.0,69.0,280.7893,815.463,823.16,0.0,2.33,0.0,0.0,4058.59,1499.0,0.0,3500,4201.96,16.0,16.0,Weekly,39.0,4205.05,3500.0,Full-Time Employment,2.0,0.0,0.011,0.0,3533.6733,994.0,1225.9033,262.63,MoneySpot,,5008328,0.0,06-04-2023,False,Other Expenses,2023-04-05,Orange,0.0,4512.0,4205.05
0062x00000ExaMbAAJ,0010K00002ARB1rQAH,PARKES,NSW,Australia,Loan Paid,Existing Client-Granted Loan Before,0.0,76.05,4990.159,2.0,0.0,0.0,3.0,2.0,5555.8123,12.0,71.0,803.5182,2311.7166,2320.41,1.0,0.0,0.0,0.0,0.0,899.0,1000.0,3500,4294.45,11.0,21.0,Fortnightly,29.0,5555.81,3500.0,,12.0,0.0,0.0989,6.0,4623.4333,1692.0,4676.4933,390.41,MoneySpot,0.0,6673150,2.0,28-09-2023,False,Vehicle Expenses,2023-09-28,Green,0.0,5458.0,5555.81
0062x00000DWVGzAAP,0010K000021F7RcQAK,Busby,NSW,Australia,Loan Paid,Existing Client-Granted Loan Before,0.0,55.14,5097.1065,1.0,1.0,0.0,4.0,1.0,3512.3753,2.0,56.0,1100.3777,749.259,799.3,1.0,0.0,0.0,0.0,2803.67,400.0,350.0,3500,4207.65,16.0,16.143,Weekly,32.0,3255.71,3500.0,Full-Time Employment,3.0,0.0,0.0769,3.0,2747.2833,1377.0,5317.2233,262.98,MoneySpot,0.0,4919563,3.0,23-03-2023,False,Medical Expenses,2023-03-23,Green,0.0,4487.0,3255.71
0062x00000FjmoeAAB,0012x00000hXHr2AAG,Fitzgibbon,QLD,Australia,Closed Lost,Existing Client-Granted Loan Before,0.0,88.62,1046.1183,1.0,0.0,0.0,4.0,1.0,3345.6556,0.0,13.0,0.0,757.3784,760.34,0.0,0.0,0.0,0.0,0.0,400.0,200.0,3350,4111.78,20.0,20.0,Weekly,25.0,3345.66,4500.0,Casual Employment,0.0,0.0,0.0,0.0,3281.9733,719.0,1076.6166,205.6,MoneySpot,,8086965,0.0,2024-02-02,False,Other Expenses,2024-02-02,Green,0.0,3483.0,3345.66
0062x00000GFMS3AAP,0012x00000mGjdTAAS,Halls Head,WA,Australia,Loan Paid,Existing Client-Granted Loan Before,3.84,73.28,4396.0999,4.0,0.0,2.0,2.0,4.0,28708.9274,0.0,11.0,0.0,2121.4285,3000.0,0.0,4.19,0.0,1.0,0.0,899.0,2500.0,3500,4226.86,8.0,16.143,Fortnightly,38.0,33000.42,3500.0,,0.0,0.0,0.0,0.0,9638.2233,1682.0,6327.7266,528.36,MoneySpot,0.0,8550001,0.0,2024-03-21,False,Home Maintenance & Repairs,2024-03-21,Green,1659.0,43101.0,33000.42
0062x00000FTHQfAAP,0010K000028h7w8QAA,Capalaba,QLD,Australia,Closed Lost,Existing Client-Granted Loan Before,0.0,54.5,1209.4633,1.0,0.0,0.0,3.0,1.0,3300.8165,2.0,17.0,0.0,728.6484,858.59,0.0,0.0,0.0,0.0,0.0,599.0,1000.0,3500,4148.75,14.0,14.571,Weekly,58.0,4341.48,3500.0,,2.0,0.0,0.0,1.0,3157.4766,29.0,1242.7066,296.34,MoneySpot,,9022775,0.0,2024-05-01,False,Home Maintenance & Repairs,2024-04-28,Orange,0.0,5377.0,4341.48
0062x00000FW0jfAAD,0012x00000kaBmiAAE,Campbelltown,NSW,Australia,Closed Lost,Existing Client-Granted Loan Before,0.0,24.02,1557.618,1.0,0.0,0.0,2.0,1.0,5124.0289,0.0,34.0,0.0,1060.0023,832.13,0.0,0.0,0.0,0.0,0.0,400.0,480.0,3500,4204.31,17.0,17.571,Weekly,30.0,5180.7,3500.0,,0.0,0.0,0.022,0.0,4593.3433,392.0,1933.1733,247.32,MoneySpot,,7637437,0.0,26-12-2023,False,Living Expenses,2023-12-25,Green,0.0,5366.0,5180.7
0062x00000GBkIuAAL,0012x00000cvJUOAA2,Acacia Hills,NT,Australia,Closed Lost,Existing Client-Granted Loan Before,0.0,79.05,5892.1984,1.0,0.0,0.0,2.0,1.0,5254.4491,2.0,76.0,8.9461,904.633,904.63,1.0,0.0,0.0,0.0,0.0,599.0,1200.0,3500,4164.8,14.0,14.0,Weekly,40.0,8615.99,3500.0,Full-Time Employment,6.0,0.0,0.0,2.0,6506.74,1738.0,6343.3466,297.49,MoneySpot,,8709138,1.0,2024-04-03,False,Vehicle Expenses,2024-04-03,Orange,0.0,5730.0,8615.99
0062x00000EOLJYAA5,0012x00000khAbLAAU,Murrumbeena,VIC,Australia,Closed Lost,New Client-New Loan,0.67,35.71,2160.2966,1.0,0.0,0.0,3.0,1.0,15358.2761,14.0,0.0,0.0,1610.53,3022.86,1.0,0.36,0.0,1.0,0.0,0.0,3360.0,3350,3937.8,9.0,9.571,Weekly,44.0,14802.26,3350.0,full_time,14.0,0.0,0.0879,2.0,0.0,0.0,2293.63,437.54,MoneySpot,,6251578,1.0,18-08-2023,False,rental_bond_cleaning,2023-08-17,Orange,108.0,15921.0,14802.26
0062x00000FTfpMAAT,0012x00000fmxCCAAY,Bowen Mountain,NSW,Australia,Loan Paid,Existing Client-Granted Loan Before,0.58,58.95,7685.4991,2.0,0.0,0.0,3.0,2.0,9760.5136,0.0,21.0,0.0,4492.5116,3555.01,1.0,0.91,0.0,0.0,0.0,899.0,4000.0,3250,3905.03,8.0,14.714,Fortnightly,29.0,9760.51,3250.0,,0.0,0.0,0.0879,0.0,8985.0233,764.0,7411.89,488.13,MoneySpot,0.0,7449514,0.0,09-12-2023,False,Home Maintenance & Repairs,2023-12-09,Green,62.0,10665.0,9760.51
0062x00000FHqFsAAL,0012x00000IOlQdAAL,Sydney,NSW,Australia,Loan Paid,Existing Client-Granted Loan Before,0.0,66.32,2001.7692,1.0,0.0,0.0,2.0,1.0,10365.7624,0.0,42.0,0.0,1053.05,1150.97,0.0,1.87,0.0,0.0,2999.86,400.0,750.0,3500,4563.46,35.0,35.0,Weekly,46.0,16069.15,3500.0,Full-Time Employment,0.0,0.0,0.011,0.0,3861.1833,1598.0,3549.4,130.39,MoneySpot,-106.14,7205341,0.0,15-11-2023,False,Other Expenses,2023-11-14,Green,0.0,16240.0,16069.15
0062x00000FUpV5AAL,0012x00000BJ3oIAAT,Kelvin Grove,QLD,Australia,Loan Paid,Existing Client-Granted Loan Before,0.77,77.47,775.9932,1.0,0.0,0.0,4.0,1.0,6879.4378,0.0,20.0,0.0,1583.2133,1141.93,2.0,0.0,0.0,0.0,752.54,899.0,960.0,3500,4191.43,16.0,15.714,Weekly,22.0,6879.44,3500.0,Part-Time Employment,0.0,0.0,0.0,0.0,6332.8533,457.0,756.7,261.97,MoneySpot,0.0,7542822,0.0,17-12-2023,False,Living Expenses,2023-12-17,Green,53.0,6836.0,6879.44
0062x00000Eci9NAAR,0012x00000g8a3EAAQ,Eastwood,SA,Australia,Loan Paid,Existing Client-Granted Loan Before,0.0,74.32,0.0,1.0,0.0,0.0,3.0,1.0,6152.0698,2.0,27.0,64.224,933.9125,626.0,1.0,0.0,0.0,0.0,3805.85,1499.0,0.0,3050,3754.48,18.0,18.143,Weekly,30.0,6812.74,3050.0,Full-Time Employment,2.0,0.0,0.0,0.0,3735.65,1118.0,2495.39,208.59,QuickCash,0.0,6373301,1.0,30-08-2023,False,Vehicle Expenses,2023-08-30,Green,0.0,14127.0,6812.74
0062x00000DUfchAAD,0012x00000VfKGvAAN,St Albans,VIC,Australia,Loan Paid,Existing Client-Granted Loan Before,0.0,65.59,1341.1568,2.0,0.0,0.0,3.0,2.0,3695.278,0.0,14.0,0.0,1433.8814,2233.24,1.0,0.0,0.0,0.0,3466.67,599.0,300.0,3100,3928.25,12.0,24.143,Fortnightly,28.0,3695.28,5000.0,Full-Time Employment,0.0,0.0,0.0,0.0,3345.7233,720.0,2021.8366,327.36,MoneySpot,0.0,5379223,0.0,24-05-2023,False,Vehicle Expenses,2023-05-24,Green,0.0,5316.0,3695.28
0062x00000DJ3MEAA1,0012x00000GbMC8AAN,Brightwaters,NSW,Australia,Loan Paid,Existing Client-Granted Loan Before,0.0,61.06,1958.8799,2.0,0.0,0.0,2.0,2.0,2592.5658,0.0,46.0,0.0,893.3316,549.38,1.0,0.0,0.0,0.0,5728.26,599.0,100.0,3050,3800.35,10.0,20.0,Fortnightly,49.0,4704.89,3050.0,Part-Time Employment,0.0,0.0,0.0,0.0,1786.6633,1969.0,4771.0233,380.04,MoneySpot,0.57,4868325,0.0,15-03-2023,False,Medical Expenses,2023-03-15,Green,0.0,5116.0,4704.89
0062x00000DWrOyAAL,0012x00000RqV0UAAV,Highland Park,QLD,Australia,Loan Paid,Existing Client-Granted Loan Before,0.0,74.71,3620.6551,0.0,0.0,0.0,0.0,0.0,1440.0,4.0,75.0,1246.0182,0.0,0.0,1.0,0.0,0.0,0.0,0.0,599.0,400.0,3300,4117.83,24.0,23.714,Weekly,30.0,6956.52,4400.0,,4.0,0.0,0.3736,4.0,0.0,2689.0,3766.5533,171.58,MoneySpot,0.0,4941880,4.0,27-03-2023,False,Life Event Expenses,2023-03-27,Orange,0.0,5249.0,6956.52
0062x00000DGnysAAD,0012800001SAnjkAAD,Black Rock,VIC,Australia,Loan Paid,Existing Client-Granted Loan Before,0.61,20.82,1356.07,3.0,0.0,2.0,2.0,3.0,12292.0199,1.0,22.0,669.5199,9819.52,7441.29,1.0,0.0,0.0,0.0,8050.0,899.0,1086.5,3200,3906.1,4.0,15.857,Monthly,35.0,10922.69,3200.0,Full-Time Employment,1.0,0.0,0.0,0.0,10922.6866,1794.0,2214.4633,976.53,MoneySpot,0.0,4745259,0.0,24-02-2023,False,Relocation Expenses,2023-02-24,Orange,103.0,16868.0,10922.69
0062x00000F2nDvAAJ,0012x00000LPCJyAAP,Coalfalls,QLD,Australia,Closed Lost,Existing Client-Granted Loan Before,2.4,83.84,2370.0025,2.0,0.0,0.0,3.0,2.0,7063.8844,10.0,29.0,558.7107,1880.2185,2442.27,2.0,0.0,0.0,0.0,8298.78,899.0,800.0,3500,4236.1,9.0,17.429,Fortnightly,34.0,7063.88,3500.0,Full-Time Employment,10.0,0.0,0.0,0.0,4387.1766,1516.0,2334.74,470.68,MoneySpot,,6995969,2.0,30-10-2023,False,Home Maintenance & Repairs,2023-10-30,Green,203.0,8451.0,7063.88
0062x00000FUincAAD,0012x00000flhDsAAI,South Morang,VIC,Australia,Loan Paid,Existing Client-Granted Loan Before,0.0,73.05,2234.6409,2.0,0.0,0.0,4.0,2.0,5799.7664,0.0,25.0,0.0,2480.77,2480.77,0.0,1.74,0.0,0.0,4337.67,599.0,1400.0,3150,3837.51,8.0,15.857,Fortnightly,42.0,5799.77,3150.0,Full-Time Employment,0.0,0.0,0.0,0.0,5788.4633,666.0,3550.8366,479.7,MoneySpot,0.0,7533681,0.0,16-12-2023,False,Child Expenses,2023-12-16,Orange,0.0,6367.0,5799.77
0062x00000D2C6SAAV,0010K00001b17DoQAI,Aspley,QLD,Australia,Loan Paid,Existing Client-Granted Loan Before,0.0,99.62,3101.4778,1.0,1.0,0.0,4.0,1.0,7255.9493,1.0,65.0,88.0,1148.2492,1091.97,1.0,0.0,0.0,0.0,3523.0,599.0,233.0,3500,4196.68,16.0,15.857,Weekly,33.0,7262.95,4000.0,Full-Time Employment,1.0,0.0,0.1868,0.0,4975.7466,1675.0,2812.3733,262.3,MoneySpot,0.0,4432589,1.0,07-01-2023,False,Travel Expenses,2023-01-07,Orange,0.0,7338.0,7262.95
0062x00000DsWQPAA3,0012x00000BJ8QlAAL,Pendle Hill,NSW,Australia,Loan Paid,Existing Client-Granted Loan Before,0.0,87.0,2782.3664,1.0,0.0,0.0,4.0,1.0,5916.5406,0.0,43.0,717.0691,1147.9483,1349.6,0.0,0.1,0.0,0.0,4116.67,400.0,100.0,3500,4357.49,24.0,24.143,Weekly,36.0,5905.9,5000.0,Full-Time Employment,0.0,0.0,0.0659,0.0,4591.7933,2225.0,3441.27,181.57,MoneySpot,0.0,5245721,0.0,11-05-2023,False,Medical Expenses,2023-05-11,Green,0.0,7997.0,5905.9
0062x00000ECU26AAH,0012x00000Mh9cyAAB,Marshall,VIC,Australia,Loan Paid,Existing Client-Granted Loan Before,0.0,85.71,7406.149,4.0,0.0,0.0,3.0,4.0,9422.4658,9.0,22.0,1144.42,2185.8087,2047.26,1.0,0.0,0.0,0.0,0.0,599.0,1500.0,3300,4085.0,11.0,21.286,Fortnightly,54.0,10122.47,3300.0,,9.0,0.0,0.5165,1.0,7255.75,2557.0,9423.3266,371.37,MoneySpot,0.0,5882013,3.0,11-07-2023,False,Home Maintenance & Repairs,2023-07-11,Orange,0.0,11123.0,10122.47
0062x00000GF5sZAAT,0012x00000hYqzTAAS,Willmot,NSW,Australia,Closed Lost,Existing Client-Granted Loan Before,0.0,59.68,1807.6367,2.0,0.0,0.0,3.0,2.0,7815.1009,2.0,39.0,0.0,1898.5233,2084.36,0.0,1.09,8.0,0.0,2200.0,599.0,0.0,3500,4189.78,7.0,14.143,Fortnightly,30.0,7815.1,3500.0,Full-Time Employment,2.0,0.0,0.022,0.0,3797.0466,1010.0,3986.84,598.55,MoneySpot,,8526699,1.0,2024-03-20,False,Other Expenses,2024-03-19,Orange,0.0,8274.0,7815.1
0062x00000Ec912AAB,0012x00000XCieWAAT,Byford,WA,Australia,Loan Paid,Existing Client-Granted Loan Before,0.0,84.81,1008.0465,2.0,0.0,0.0,2.0,2.0,4748.0301,0.0,32.0,313.1142,2177.2642,1949.3,1.0,2.71,0.0,0.0,1800.0,599.0,600.0,3500,4392.6,13.0,25.571,Fortnightly,24.0,4911.36,5000.0,Full-Time Employment,0.0,0.0,0.2747,0.0,5080.2833,272.0,1316.7633,337.9,MoneySpot,0.0,6337102,0.0,26-08-2023,False,Home Maintenance & Repairs,2023-08-26,Green,0.0,5639.0,4911.36
0062x00000D8hJCAAZ,0012x00000INRT5AAP,Taree,NSW,Australia,Loan Paid,Existing Client-Granted Loan Before,0.0,40.7,3618.0188,2.0,0.0,0.0,3.0,2.0,8668.4524,1.0,0.0,1263.9211,2320.7566,2643.96,0.0,0.0,0.0,1.0,4414.99,1499.0,2120.0,3500,4226.84,8.0,16.143,Fortnightly,63.0,8682.61,3500.0,Full-Time Employment,1.0,0.0,0.5165,1.0,0.0,1164.0,3517.6,528.36,MoneySpot,0.01,4545311,0.0,25-01-2023,False,Home Maintenance & Repairs,2023-01-25,Orange,0.0,8961.0,8682.61
0062x00000EelG0AAJ,0010K00001xM0q0QAC,Pemberton,WA,Australia,Loan Paid,Existing Client-Granted Loan Before,8.32,57.59,5399.6026,2.0,0.0,1.0,3.0,2.0,5281.1761,13.0,10.0,895.2132,2053.8371,2294.87,1.0,1.17,0.0,0.0,3900.0,599.0,1000.0,3200,4182.87,16.0,32.143,Fortnightly,45.0,9823.54,3200.0,Part-Time Employment,14.0,0.0,0.4066,9.0,9654.86,4453.0,7037.8766,261.43,QuickCash,0.0,6514186,2.0,13-09-2023,False,Furniture or Appliances,2023-09-13,Orange,631.0,7578.0,9823.54
0062x00000EC52QAAT,0012x00000kZTVeAAO,Bargo,NSW,Australia,Closed Lost,New Client-New Loan,22.33,75.61,0.0,4.0,0.0,2.0,4.0,4.0,4299.9397,0.0,0.0,0.0,1126.0733,1416.42,0.0,0.0,0.0,0.0,3033.33,400.0,0.0,3200,3799.3,5.0,10.143,Fortnightly,20.0,5738.72,3200.0,Full-Time Employment,0.0,0.0,0.0,0.0,3647.3,0.0,78.9666,759.86,MoneySpot,,5853568,0.0,07-07-2023,False,Living Expenses,2023-07-06,Orange,1156.0,5176.0,5738.72
0062x00000GZQ1iAAH,0012x00000gnXaUAAU,Wellard,WA,Australia,Closed Lost,Existing Client-Granted Loan Before,0.0,35.88,2582.3433,2.0,0.0,0.0,3.0,2.0,4480.1605,0.0,28.0,0.0,1999.1985,1999.2,0.0,0.54,0.0,0.0,4305.17,599.0,350.0,3300,4136.79,12.0,23.714,Fortnightly,61.0,4480.16,5000.0,Full-Time Employment,0.0,0.0,0.3297,0.0,4664.7966,1208.0,2747.8766,344.74,MoneySpot,,8921172,0.0,2024-04-24,False,Travel Expenses,2024-04-19,Green,0.0,5565.0,4480.16
0062x00000FUaa8AAD,0012x00000GbfThAAJ,Craigieburn,VIC,Australia,Closed Lost,Existing Client-Granted Loan Before,1.14,61.46,2459.7565,3.0,0.0,2.0,4.0,3.0,5620.6034,1.0,11.0,0.0,3404.26,3781.84,0.0,0.0,0.0,0.0,600.0,2000.0,826.0,3050,3876.95,5.0,21.857,Monthly,23.0,5748.86,6000.0,Part-Time Employment,1.0,1.0,0.0,0.0,4898.03,900.0,3465.2066,775.39,MoneySpot,,7520667,0.0,15-12-2023,False,Living Expenses,2023-12-15,Green,89.0,7784.0,5748.86
0062x00000E5qqKAAR,0012x00000LPliJAAT,Coombs,ACT,Australia,Loan Paid,Existing Client-Granted Loan Before,0.0,61.21,2122.9859,4.0,0.0,0.0,3.0,4.0,7567.4405,4.0,72.0,0.0,2101.6475,2166.0,0.0,0.0,0.0,0.0,3796.94,400.0,300.0,3400,4113.04,8.0,16.0,Fortnightly,27.0,8278.77,3400.0,Full-Time Employment,4.0,0.0,0.0,3.0,5604.3933,904.0,3216.6033,514.14,MoneySpot,0.0,5686916,0.0,22-06-2023,False,Medical Expenses,2023-06-22,Green,0.0,12951.0,8278.77
0062x00000EeX9EAAV,0012x00000MjOb0AAF,Gordonvale,QLD,Australia,Loan Paid,Existing Client-Granted Loan Before,0.0,89.81,651.7804,2.0,0.0,0.0,4.0,2.0,5103.3294,0.0,33.0,483.3216,2081.972,2094.04,0.0,1.36,0.0,0.0,3791.17,599.0,1940.0,3150,3891.51,9.0,18.429,Fortnightly,39.0,5169.0,3150.0,Full-Time Employment,0.0,0.0,0.0,0.0,3469.9533,1641.0,2851.28,432.39,QuickCash,0.0,6497678,0.0,12-09-2023,False,Vehicle Expenses,2023-09-12,Green,0.0,5227.0,5169.0
0062x00000F2DRmAAN,0010K00001ustfuQAA,PARKHURST,QLD,Australia,Closed Lost,Existing Client-Granted Loan Before,0.0,94.45,223.5366,0.0,6.0,0.0,0.0,0.0,0.0,8.0,61.0,0.0,0.0,0.0,0.0,0.0,0.0,0.0,433.33,599.0,640.0,3500,4151.9,7.0,13.143,Fortnightly,44.0,4965.99,3500.0,Unemployed,8.0,0.0,0.044,7.0,0.0,1188.0,3072.22,593.13,MoneySpot,,6953901,6.0,26-10-2023,False,Vehicle Expenses,2023-10-25,Orange,0.0,5110.0,4965.99
0062x00000FVs6lAAD,0012x00000hYtl2AAC,Woodford Island,NSW,Australia,Loan Paid,Existing Client-Granted Loan Before,0.0,77.74,2415.1068,1.0,0.0,0.0,3.0,1.0,7157.641,0.0,12.0,689.8439,971.3738,1020.33,1.0,0.0,0.0,0.0,0.0,899.0,200.0,3250,3917.59,16.0,16.571,Weekly,26.0,7157.64,3250.0,Part-Time Employment,0.0,0.0,0.0,0.0,4209.2866,709.0,2831.2266,247.08,MoneySpot,0.0,7628802,0.0,24-12-2023,False,Living Expenses,2023-12-24,Green,0.0,7330.0,7157.64
0062x00000DrjUKAAZ,0012x00000LRbBZAA1,Orchard Hills,NSW,Australia,Loan Paid,Existing Client-Granted Loan Before,0.0,53.6,8156.1805,1.0,0.0,0.0,3.0,1.0,14433.7669,0.0,128.0,1744.436,2090.2923,2423.99,0.0,0.09,0.0,0.0,8666.67,599.0,2400.0,3500,4207.08,16.0,16.143,Weekly,56.0,14571.77,3500.0,Full-Time Employment,0.0,0.0,0.0,0.0,13576.4733,3477.0,8685.66,262.95,MoneySpot,0.0,5187832,0.0,03-05-2023,False,Home Maintenance & Repairs,2023-05-03,Green,0.0,14535.0,14571.77
0062x00000ECZbeAAH,0012x00000dyYGMAA2,Adelong,NSW,Australia,Closed Lost,Existing Client-Granted Loan Before,37.95,80.39,1999.807,2.0,0.0,4.0,3.0,2.0,6811.9154,10.0,54.0,1343.4023,1733.5,1733.5,1.0,0.11,0.0,0.0,4912.67,599.0,540.0,3500,4194.15,8.0,15.286,Fortnightly,37.0,6822.92,3500.0,Full-Time Employment,10.0,0.0,0.3956,1.0,6771.6266,1761.0,2172.0333,524.27,MoneySpot,,5886167,7.0,11-07-2023,False,Vehicle Expenses,2023-07-11,Green,2727.0,7184.0,6822.92
0062x00000DIXjLAAX,0012x00000ACj6IAAT,Cooee Bay,QLD,Australia,Loan Paid,Existing Client-Granted Loan Before,0.0,40.33,2185.7366,1.0,0.0,0.0,2.0,1.0,13603.1489,0.0,18.0,712.064,2979.2346,2712.2,1.0,44.36,1.0,0.0,0.0,1499.0,1400.0,3500,4302.96,22.0,21.714,Weekly,32.0,19336.48,3500.0,Full-Time Employment,0.0,0.0,0.033,0.0,12910.0166,2639.0,3510.0533,195.59,MoneySpot,0.0,4838087,0.0,13-03-2023,False,Vehicle Expenses,2023-03-13,Orange,0.0,38856.0,19336.48
0062x00000DIwVsAAL,0012800001ZeeWFAAZ,West Mackay,QLD,Australia,Loan Paid,Existing Client-Granted Loan Before,0.0,21.43,2500.4693,3.0,0.0,0.0,2.0,3.0,8693.4699,0.0,38.0,1447.6254,8401.8033,8002.47,1.0,7.68,0.0,0.0,7150.0,1500.0,1400.0,3500,4295.05,4.0,17.429,Monthly,41.0,8401.8,3500.0,Casual Employment,2.0,0.0,0.4615,1.0,8401.8033,1480.0,2911.16,1073.77,MoneySpot,0.0,4863014,0.0,15-03-2023,False,Medical Expenses,2023-03-14,Green,0.0,11175.0,8401.8
0062x00000EMMmlAAH,0012x00000g8wIzAAI,Highland Park,QLD,Australia,Loan Paid,Existing Client-Granted Loan Before,0.0,76.58,3225.8335,2.0,0.0,0.0,3.0,2.0,7697.2089,0.0,26.0,0.0,2320.0771,2435.98,0.0,0.87,0.0,0.0,4628.96,1500.0,3000.0,3200,4140.98,15.0,30.0,Fortnightly,58.0,7695.95,3200.0,Full-Time Employment,0.0,0.0,0.0,0.0,5413.5133,819.0,3778.0433,276.07,QuickCash,0.0,6097630,0.0,03-08-2023,False,Furniture or Appliances,2023-08-03,Orange,0.0,9147.0,7695.95
0062x00000FJgIdAAL,0012x00000ACRw7AAH,Winston,QLD,Australia,Loan Paid,Existing Client-Granted Loan Before,0.13,40.25,2721.3946,1.0,0.0,0.0,2.0,1.0,11346.8401,0.0,69.0,924.0583,2611.3276,2633.32,1.0,0.0,0.0,0.0,8944.0,899.0,1400.0,3500,4319.26,22.0,22.143,Weekly,44.0,11635.56,3500.0,Full-Time Employment,0.0,0.0,0.0,0.0,11315.7533,1026.0,3099.83,196.34,MoneySpot,0.0,7339809,0.0,28-11-2023,False,Medical Expenses,2023-11-28,Orange,19.0,14094.0,11635.56
0062x00000Dsw4TAAR,0012x00000hZlGnAAK,Blacktown,NSW,Australia,Closed Lost,New Client-New Loan,0.0,25.34,1093.52,4.0,0.0,0.0,4.0,4.0,3923.6966,3.0,18.0,0.0,3923.6966,4486.42,0.0,0.25,0.0,0.0,4430.0,1499.0,880.0,3200,3820.03,2.0,8.857,Monthly,31.0,4032.35,3200.0,Full-Time Employment,3.0,0.0,0.1099,0.0,3923.6966,0.0,1093.52,1910.01,MoneySpot,,5274110,0.0,16-05-2023,False,Living Expenses,2023-05-15,Orange,0.0,6701.0,4032.35
0062x00000EyZy0AAF,0010K00001g6vz1QAA,Edgeworth,NSW,Australia,Closed Lost,Existing Client-Granted Loan Before,6.14,72.4,9791.6635,1.0,0.0,2.0,2.0,1.0,29648.9347,0.0,13.0,321.6715,1188.6363,800.0,1.0,0.02,0.0,1.0,4766.67,599.0,600.0,3500,4555.96,18.0,34.857,Fortnightly,35.0,36189.04,3500.0,Full-Time Employment,0.0,0.0,0.011,0.0,2596.7633,2222.0,10802.22,253.11,MoneySpot,,6747240,0.0,09-10-2023,False,Vehicle Expenses,2023-10-05,Orange,2597.0,42290.0,36189.04
0062x00000FTRklAAH,0012x00000fonbDAAQ,Grafton,NSW,Australia,Closed Lost,Existing Client-Granted Loan Before,0.0,96.66,2583.3619,1.0,0.0,0.0,3.0,1.0,10880.6266,6.0,83.0,0.0,893.2625,890.96,0.0,0.0,4.0,0.0,0.0,599.0,1030.0,3500,4174.66,16.0,16.286,Weekly,23.0,10983.96,3500.0,,6.0,0.0,0.033,2.0,6395.1033,1997.0,5377.88,260.92,MoneySpot,,9037858,1.0,2024-05-01,False,Car,2024-04-29,Orange,0.0,10896.0,10983.96
0062x00000DsRRYAA3,0012x00000cKu1nAAC,Clayton South,VIC,Australia,Loan Paid,Existing Client-Granted Loan Before,0.12,76.66,134.1033,2.0,0.0,0.0,3.0,2.0,8728.1585,0.0,50.0,0.0,3800.2957,3769.05,0.0,0.0,0.0,0.0,3765.14,899.0,1317.0,3500,4221.21,8.0,16.0,Fortnightly,42.0,8781.16,3500.0,Full-Time Employment,0.0,0.0,0.0,0.0,8867.3566,0.0,228.9833,527.66,MoneySpot,0.0,5242566,0.0,11-05-2023,False,Other Expenses,2023-05-10,Green,13.0,10041.0,8781.16
0062x00000FH7sJAAT,0012x000003fS7hAAE,Kin Kora,QLD,Australia,Loan Paid,Existing Client-Granted Loan Before,0.0,76.05,133.3184,4.0,0.0,0.0,3.0,4.0,3412.6166,0.0,1.0,0.0,1043.8722,949.0,1.0,1.56,0.0,0.0,1124.0,599.0,0.0,3250,3927.7,16.0,15.857,Weekly,22.0,3412.62,3250.0,Part-Time Employment,0.0,0.0,0.0,0.0,3131.6166,54.0,206.5966,245.49,MoneySpot,0.0,7142550,0.0,10-11-2023,False,Medical Expenses,2023-11-10,Green,0.0,6091.0,3412.62
0062x00000E3ZQtAAN,0012x00000SFHTOAA5,Galston,NSW,Australia,Loan Paid,Existing Client-Granted Loan Before,0.0,48.29,4400.5191,2.0,0.0,0.0,3.0,2.0,1373.5808,0.0,169.0,3783.6455,400.0,400.0,1.0,0.22,0.0,1.0,0.0,899.0,600.0,3300,4042.3,18.0,18.571,Weekly,31.0,14656.15,3300.0,Full-time,0.0,0.0,0.0,0.0,82.9966,9490.0,10829.2166,224.58,MoneySpot,0.0,5497910,0.0,04-06-2023,False,Relocation Expenses,2023-06-04,Green,0.0,18439.0,14656.15
0062x00000EepNxAAJ,0012x00000MjkamAAB,Thagoona,QLD,Australia,Loan Paid,Existing Client-Granted Loan Before,0.0,51.65,434.5233,1.0,0.0,0.0,3.0,1.0,4433.5515,6.0,36.0,520.5929,923.3323,1038.87,1.0,0.0,0.0,0.0,0.0,1499.0,1386.0,3250,3932.87,16.0,16.0,Weekly,41.0,4443.55,3250.0,Full-Time Employment,10.0,0.0,0.044,2.0,4001.1066,797.0,857.6133,245.81,MoneySpot,0.0,6521476,1.0,14-09-2023,False,Other Expenses,2023-09-13,Green,0.0,4824.0,4443.55
0062x00000FWokAAAT,0012x00000FGavNAAT,Burpengary East,QLD,Australia,Loan Paid,Existing Client-Granted Loan Before,0.0,88.26,4538.2256,2.0,0.0,0.0,3.0,2.0,9029.9272,0.0,30.0,385.244,3712.2228,2651.04,1.0,1.18,0.0,0.0,0.0,899.0,1200.0,3500,4198.9,8.0,15.429,Fortnightly,34.0,10149.95,3500.0,Full-Time Employment,0.0,0.0,0.8462,0.0,10021.2533,1205.0,5103.3233,524.87,MoneySpot,0.0,7699840,0.0,2024-01-01,False,Home Maintenance & Repairs,2024-01-01,Green,0.0,10711.0,10149.95
0062x00000FVoV6AAL,0012x00000IOlQdAAL,Sydney,NSW,Australia,Loan Paid,Existing Client-Granted Loan Before,0.0,68.51,1720.5966,4.0,0.0,0.0,1.0,4.0,8520.5832,0.0,43.0,67.9296,422.6521,400.0,0.0,1.96,0.0,1.0,2999.86,400.0,150.0,3500,4218.47,16.0,16.429,Weekly,46.0,14213.88,3500.0,Full-Time Employment,0.0,0.0,0.011,0.0,0.0,1135.0,2922.63,263.66,MoneySpot,0.0,7624337,0.0,24-12-2023,False,Vehicle Expenses,2023-12-23,Orange,0.0,15430.0,14213.88
0062x00000DHDaJAAX,0010K00002BT2VBQA1,Bondi,NSW,Australia,Loan Paid,Existing Client-Granted Loan Before,0.0,45.59,2700.3298,4.0,1.0,0.0,1.0,4.0,686.6666,6.0,47.0,1439.9144,686.6666,500.0,0.0,0.14,0.0,1.0,5000.0,1499.0,1240.0,3400,4188.83,4.0,17.571,Monthly,33.0,1613.81,3400.0,Full-Time Employment,6.0,0.0,0.0549,2.0,0.0,3813.0,8808.6666,1047.21,MoneySpot,0.0,4767710,2.0,28-02-2023,False,Life Event Expenses,2023-02-28,Green,0.0,12636.0,1613.81
0062x00000E4G03AAF,0010K0000240xFvQAI,HAY,NSW,Australia,Loan Paid,Existing Client-Granted Loan Before,0.0,52.17,0.0,4.0,0.0,0.0,2.0,4.0,65100.0,0.0,3.0,0.0,27900.0,26250.0,0.0,0.0,0.0,1.0,3200.0,1499.0,780.0,3500,4183.33,8.0,16.0,Fortnightly,48.0,65100.0,3500.0,Full-Time Employment,0.0,0.0,0.0,0.0,0.0,908.0,5908.1766,527.66,MoneySpot,0.0,5553456,0.0,09-06-2023,False,Home Maintenance & Repairs,2023-06-09,Orange,0.0,65100.0,65100.0
0062x00000FWRxeAAH,0012x00000mK3twAAC,Caboolture,QLD,Australia,Closed Lost,Existing Client-No Loan Granted Ever,0.0,72.79,1177.3866,4.0,0.0,0.0,3.0,4.0,4095.362,0.0,17.0,0.0,651.0,812.35,0.0,0.0,0.0,0.0,0.0,599.0,170.0,3500,4073.41,5.0,9.0,Fortnightly,31.0,6048.7,3500.0,Casual Employment,0.0,0.0,0.0,0.0,3085.6566,189.0,827.1466,814.69,MoneySpot,,7670917,0.0,29-12-2023,False,Travel Expenses,2023-12-28,Orange,0.0,5799.0,6048.7
0062x00000DWbspAAD,0012x00000c7lO3AAI,Toormina,NSW,Australia,Loan Paid,Existing Client-Granted Loan Before,0.0,53.04,30.51,0.0,0.0,0.0,0.0,0.0,192.1,0.0,0.0,0.0,0.0,0.0,0.0,80.73,0.0,0.0,2916.4,599.0,1000.0,3200,3994.41,5.0,20.571,Monthly,48.0,13198.87,5000.0,Full-Time Employment,0.0,0.0,1.0,0.0,0.0,0.0,125.02,798.89,MoneySpot,0.0,4925582,0.0,25-03-2023,False,Travel Expenses,2023-03-24,Green,0.0,192.0,13198.87
0062x00000DASHoAAP,0010K00002BQxTHQA1,Sinagra,WA,Australia,Loan Paid,Existing Client-Granted Loan Before,0.0,90.02,12747.4425,2.0,1.0,0.0,5.0,2.0,10737.0833,18.0,108.0,1680.3469,4942.0,4942.0,1.0,0.77,0.0,0.0,6933.0,899.0,2000.0,3500,4205.08,8.0,15.571,Fortnightly,49.0,10737.08,3500.0,Full-Time Employment,18.0,0.0,0.5495,7.0,11531.3333,4069.0,13624.49,525.64,MoneySpot,0.0,4630238,11.0,07-02-2023,False,Vehicle Expenses,2023-02-07,Orange,0.0,11618.0,10737.08
0062x00000DIrs3AAD,0012x00000BG363AAD,Surfers Paradise,QLD,Australia,Loan Paid,Existing Client-Granted Loan Before,0.0,65.71,3968.4998,2.0,0.0,0.0,5.0,2.0,4975.9186,0.0,21.0,546.1313,1713.2871,1604.28,0.0,0.0,0.0,0.0,0.0,599.0,520.0,3350,4079.08,9.0,17.571,Fortnightly,42.0,4975.92,3500.0,,0.0,0.0,0.0,0.0,3997.67,1885.0,4445.42,453.24,MoneySpot,0.0,4859856,0.0,14-03-2023,False,Vehicle Expenses,2023-03-14,Green,0.0,5348.0,4975.92
0062x00000FIpeNAAT,0010K000022oH0lQAE,Eagle Vale,NSW,Australia,Loan Paid,Existing Client-Granted Loan Before,29.79,75.93,263.9127,1.0,0.0,2.0,2.0,1.0,5048.1483,0.0,22.0,0.0,754.26,736.2,0.0,0.16,0.0,0.0,1993.33,599.0,800.0,3500,4466.45,30.0,30.0,Weekly,32.0,5664.08,3500.0,Casual Employment,0.0,0.0,0.0,0.0,4966.1866,848.0,1985.4366,148.89,MoneySpot,0.0,7280178,0.0,23-11-2023,False,Other Expenses,2023-11-22,Green,1698.0,5699.0,5664.08
0062x00000FVJqvAAH,0012x00000RrgfNAAR,Eastern Heights,QLD,Australia,Loan Paid,Existing Client-Granted Loan Before,0.0,34.48,2835.607,1.0,0.0,0.0,3.0,1.0,5837.6892,12.0,77.0,462.2664,1107.9615,1112.5,1.0,0.0,0.0,0.0,2403.48,1499.0,0.0,3500,4226.3,17.0,17.143,Weekly,36.0,5837.69,3500.0,Full-Time Employment,12.0,0.0,0.0659,0.0,4801.1666,461.0,2765.1233,248.61,QuickCash,0.02,7581469,3.0,20-12-2023,False,Vehicle Expenses,2023-12-20,Green,0.0,6459.0,5837.69
0062x00000DGrTfAAL,0010K00001y7rBjQAI,Westleigh,NSW,Australia,Loan Paid,Existing Client-Granted Loan Before,0.0,34.96,1473.4764,3.0,1.0,0.0,5.0,3.0,9789.3241,1.0,38.0,1088.0,9522.6575,9522.65,0.0,0.0,0.0,0.0,7800.0,1500.0,2200.0,3500,4286.71,4.0,17.286,Monthly,47.0,10252.07,4500.0,Full-Time Employment,1.0,0.0,0.0,1.0,12696.8766,2110.0,3619.3666,1071.68,MoneySpot,0.0,4746820,1.0,24-02-2023,False,Living Expenses,2023-02-24,Orange,0.0,14323.0,10252.07
0062x00000ELTApAAP,0012x00000kfbIKAAY,Hope Vale,QLD,Australia,Closed Lost,New Client-New Loan,0.0,52.54,623.0,1.0,0.0,0.0,2.0,1.0,5366.0623,0.0,18.0,0.0,1188.0583,538.95,1.0,5.07,0.0,0.0,3900.0,400.0,600.0,3200,3789.22,5.0,9.857,Fortnightly,31.0,5542.73,3200.0,Full-Time Employment,0.0,0.0,0.0,0.0,4752.2333,0.0,2126.26,757.85,QuickCash,,6036227,0.0,02-08-2023,False,Furniture or Appliances,2023-07-28,Orange,0.0,7886.0,5542.73
0062x00000DZkk2AAD,0010K00002COQxVQAX,Rural View,QLD,Australia,Loan Paid,Existing Client-Granted Loan Before,0.0,62.47,4634.3903,1.0,0.0,0.0,2.0,1.0,6192.2124,0.0,52.0,2344.9115,1410.0984,1366.61,1.0,0.0,0.0,0.0,5200.0,400.0,100.0,3450,4137.66,16.0,15.714,Weekly,49.0,6192.21,3500.0,Full-Time Employment,0.0,0.0,0.956,0.0,6110.4266,3021.0,4794.2866,258.61,MoneySpot,0.0,5110443,0.0,21-04-2023,False,Living Expenses,2023-04-21,Green,0.0,7887.0,6192.21
0062x00000FK7qFAAT,0012x00000iIQMNAA4,Ferntree Gully,VIC,Australia,Loan Paid,Existing Client-Granted Loan Before,0.0,80.87,664.4855,4.0,0.0,0.0,6.0,4.0,1704.0,4.0,24.0,0.0,284.0,54.0,0.0,1.04,0.0,1.0,7623.0,599.0,400.0,3500,4241.93,4.0,16.0,Monthly,33.0,2826.33,3500.0,Full-Time Employment,6.0,0.0,0.7912,0.0,0.0,1249.0,2186.6633,1060.49,QuickCash,0.0,7368906,4.0,01-12-2023,False,Home Maintenance & Repairs,2023-12-01,Green,0.0,12233.0,2826.33
0062x00000EMAiAAAX,0012x00000cLSawAAG,Bellbird Park,QLD,Australia,Loan Paid,Existing Client-Granted Loan Before,0.0,79.06,5377.2103,1.0,1.0,0.0,3.0,1.0,8751.1267,18.0,77.0,0.0,1784.5115,1966.55,1.0,0.0,0.0,0.0,6361.33,400.0,1200.0,3500,4356.86,24.0,24.143,Weekly,29.0,7754.13,5000.0,Full-Time Employment,18.0,0.0,0.0,13.0,7732.8833,1728.0,7320.59,181.54,MoneySpot,3.86,6084824,14.0,02-08-2023,False,Travel Expenses,2023-08-02,Orange,0.0,11874.0,7754.13
0062x00000DqxK5AAJ,0012x00000BGXL5AAP,Wiley Park,NSW,Australia,Loan Paid,Existing Client-Granted Loan Before,0.0,99.99,6327.7595,2.0,2.0,0.0,3.0,2.0,6200.1455,14.0,42.0,3066.301,2853.7666,3528.67,1.0,15.65,1.0,0.0,0.0,400.0,0.0,3100,3892.79,12.0,23.143,Fortnightly,27.0,6200.15,5000.0,Part-Time Employment,17.0,0.0,0.4286,5.0,5707.5333,2720.0,6683.9,324.4,QuickCash,0.0,5138720,17.0,26-04-2023,False,Vehicle Expenses,2023-04-25,Green,0.0,5941.0,6200.15
0062x00000ECFMRAA5,0012x00000cx3zTAAQ,Berkeley,NSW,Australia,Loan Paid,Existing Client-Granted Loan Before,0.0,81.88,3391.5134,2.0,0.0,0.0,4.0,2.0,6325.2796,10.0,44.0,249.9236,2911.3628,2623.01,0.0,0.0,0.0,0.0,0.0,599.0,2200.0,3500,4365.85,12.0,23.857,Fortnightly,36.0,6603.95,3500.0,Full-Time Employment,10.0,0.0,0.1319,5.0,6793.18,1139.0,3748.7733,363.83,MoneySpot,0.0,5864565,8.0,08-07-2023,False,Living Expenses,2023-07-08,Green,0.0,7105.0,6603.95
0062x00000F28EwAAJ,0010K00001cNk30QAC,Randwick,NSW,Australia,Loan Paid,Existing Client-Granted Loan Before,0.0,58.06,664.54,3.0,1.0,0.0,4.0,3.0,8794.8737,2.0,6.0,0.0,4838.0133,4859.86,0.0,0.0,1.0,0.0,3631.33,899.0,1.0,3500,4241.04,4.0,16.143,Monthly,41.0,9072.54,3500.0,Full-Time Employment,2.0,0.0,0.1099,2.0,7785.9233,886.0,1718.15,1060.27,MoneySpot,0.0,6946420,1.0,25-10-2023,False,Travel Expenses,2023-10-25,Green,0.0,9998.0,9072.54
0062x00000EwgBbAAJ,0012x00000cmQxcAAE,Gabbadah,WA,Australia,Loan Paid,Existing Client-Granted Loan Before,0.13,66.58,3805.5366,3.0,0.0,0.0,2.0,3.0,17712.9766,0.0,13.0,0.0,9274.31,12004.45,0.0,0.41,0.0,0.0,5361.55,599.0,300.0,3500,4281.06,4.0,17.143,Monthly,35.0,17712.98,3500.0,Full-Time Employment,0.0,0.0,0.022,0.0,9274.31,2803.0,4245.95,1070.27,QuickCash,0.0,6607544,0.0,22-09-2023,False,Living Expenses,2023-09-22,Green,27.0,20169.0,17712.98
0062x00000Dt8lDAAR,0010K00001jr3IkQAI,Epping,VIC,Australia,Loan Paid,Existing Client-Granted Loan Before,0.78,81.08,3613.969,2.0,0.0,0.0,3.0,2.0,5442.6975,1.0,28.0,448.0,2505.1333,2113.91,0.0,0.07,0.0,0.0,3466.67,899.0,0.0,3500,4156.63,8.0,16.143,Fortnightly,40.0,5442.7,3500.0,Full-Time Employment,1.0,0.0,0.0,0.0,5010.2666,1926.0,3250.7566,528.36,MoneySpot,0.0,5288543,1.0,17-05-2023,False,Travel Expenses,2023-05-16,Green,42.0,5352.0,5442.7
0062x00000DXxjfAAD,0010K00001hW0AtQAK,Frankston,VIC,Australia,Loan Paid,Existing Client-Granted Loan Before,0.0,64.91,5337.5813,2.0,2.0,0.0,3.0,2.0,6356.2134,4.0,40.0,2423.6184,2925.6,2925.6,0.0,0.0,0.0,1.0,4766.67,599.0,200.0,3100,3928.1,12.0,24.143,Fortnightly,53.0,6356.21,5000.0,Full-Time Employment,4.0,0.0,0.7473,4.0,0.0,2575.0,6738.3566,327.35,QuickCash,0.0,5004032,3.0,05-04-2023,False,Vehicle Expenses,2023-04-05,Green,0.0,7550.0,6356.21
0062x00000EzLnVAAV,0012x00000hZ6wcAAC,South Hedland,WA,Australia,Loan Paid,Existing Client-Granted Loan Before,0.0,47.3,1644.3692,4.0,0.0,0.0,4.0,4.0,5800.3599,0.0,19.0,0.0,2062.7028,2078.79,0.0,0.0,0.0,0.0,0.0,1499.0,1200.0,3500,4694.76,20.0,40.286,Fortnightly,25.0,5800.36,4000.0,Full-Time Employment,0.0,0.0,0.022,0.0,4812.9733,930.0,2064.93,234.75,MoneySpot,0.0,6802360,0.0,13-10-2023,False,Living Expenses,2023-10-13,Orange,0.0,13412.0,5800.36
0062x00000E6EosAAF,0010K00001jNt9kQAC,Beerwah,QLD,Australia,Loan Paid,Existing Client-Granted Loan Before,0.0,79.0,876.295,1.0,0.0,0.0,1.0,1.0,6316.5592,0.0,58.0,701.4624,1453.6741,1344.09,0.0,0.0,1.0,0.0,5850.0,400.0,600.0,3500,4212.89,16.0,16.286,Weekly,37.0,6316.56,3500.0,Full-Time Employment,0.0,0.0,0.4066,0.0,5814.6966,1455.0,1454.7533,263.31,MoneySpot,-0.33,5722371,0.0,26-06-2023,False,Life Event Expenses,2023-06-25,Green,0.0,9048.0,6316.56
0062x00000FUEBRAA5,0010K000022P1vvQAC,Koongal,QLD,Australia,Loan Paid,Existing Client-Granted Loan Before,0.0,55.14,594.1533,2.0,0.0,0.0,2.0,2.0,10427.833,0.0,13.0,576.0,3455.2,3455.2,0.0,0.76,1.0,0.0,9750.0,1499.0,880.0,3500,4183.46,8.0,15.0,Fortnightly,48.0,8907.1,4000.0,Unemployed,0.0,0.0,0.011,0.0,6910.4,548.0,594.1533,522.94,Financier-2,0.01,7492283,0.0,13-12-2023,False,Home Maintenance & Repairs,2023-12-13,Orange,0.0,11809.0,8907.1
0062x00000DtqAzAAJ,0010K00001mCve7QAC,Tennant Creek,NT,Australia,Loan Paid,Existing Client-Granted Loan Before,0.0,88.71,2573.4608,2.0,0.0,0.0,4.0,2.0,5881.1366,0.0,51.0,1985.3807,2510.705,2265.35,1.0,7.39,1.0,0.0,3553.33,599.0,400.0,3100,3873.03,12.0,24.571,Fortnightly,34.0,5919.46,5000.0,Full-Time Employment,0.0,0.0,0.7363,0.0,5021.41,1255.0,4868.56,328.64,MoneySpot,0.0,5351821,0.0,25-05-2023,False,Travel Expenses,2023-05-25,Green,0.0,6280.0,5919.46
0062x00000FkGHPAA3,0012x00000gmv6KAAQ,Ridleyton,SA,Australia,Closed Lost,Existing Client-Granted Loan Before,0.0,67.78,1482.2952,2.0,0.0,0.0,5.0,2.0,3921.7157,0.0,62.0,1283.8611,1419.5085,1307.08,0.0,0.67,2.0,0.0,0.0,599.0,0.0,3500,4204.95,8.0,15.571,Fortnightly,24.0,3820.05,5000.0,,0.0,0.0,0.0,0.0,3312.1866,1247.0,2922.6266,525.62,MoneySpot,,8121532,0.0,2024-02-06,False,Medical Expenses,2024-02-06,Orange,0.0,4772.0,3820.05
0062x00000D918dAAB,0010K00001ze65NQAQ,Botanic Ridge,VIC,Australia,Loan Paid,Existing Client-Granted Loan Before,19.28,74.34,2177.2483,2.0,0.0,4.0,5.0,2.0,5315.4893,3.0,58.0,0.0,1420.31,1420.31,1.0,0.51,0.0,0.0,6800.0,1499.0,100.0,3050,3739.0,8.0,16.143,Fortnightly,47.0,4697.16,3050.0,Full-Time Employment,3.0,0.0,0.9231,1.0,3945.3233,1696.0,2838.39,467.38,MoneySpot,0.0,4560824,0.0,27-01-2023,False,Medical Expenses,2023-01-26,Green,1105.0,5731.0,4697.16
0062x00000EyrfbAAB,0012x00000RqVLHAA3,Blue Haven,NSW,Australia,Closed Lost,Existing Client-No Loan Granted Ever,54.04,72.0,340.6366,1.0,0.0,4.0,5.0,1.0,7021.967,3.0,9.0,553.347,696.64,696.64,2.0,0.69,0.0,1.0,0.0,2000.0,2040.0,3400,4000.1,5.0,9.857,Fortnightly,40.0,8248.52,3400.0,,4.0,0.0,0.011,2.0,3891.53,624.0,1212.1466,800.03,MoneySpot,,6768319,4.0,07-10-2023,False,Furniture or Appliances,2023-10-06,Orange,4589.0,8491.0,8248.52
0062x00000E7d0FAAR,0012x00000g9yWcAAI,Campbelltown,NSW,Australia,Loan Paid,Existing Client-Granted Loan Before,0.0,74.39,1453.4666,2.0,0.0,0.0,3.0,2.0,6936.9345,0.0,12.0,0.0,3192.8914,3192.9,0.0,0.0,0.0,0.0,6592.31,400.0,770.0,3500,4226.36,8.0,16.143,Fortnightly,63.0,6936.93,3500.0,Full-Time Employment,0.0,0.0,0.1209,0.0,7450.08,1566.0,1566.4,528.3,MoneySpot,0.0,5834621,0.0,05-07-2023,False,Relocation Expenses,2023-07-05,Green,0.0,7450.0,6936.93
0062x00000FJsYQAA1,0012800001SDUBQAA5,Docklands,VIC,Australia,Loan Paid,Existing Client-Granted Loan Before,0.0,38.81,8067.5697,0.0,0.0,0.0,0.0,0.0,0.0,0.0,3.0,0.0,0.0,0.0,0.0,12.65,0.0,0.0,0.0,1500.0,1060.0,3250,4015.14,5.0,19.571,Monthly,36.0,182.2,3250.0,,0.0,0.0,0.0,0.0,0.0,0.0,10160.24,803.03,MoneySpot,0.0,7353904,0.0,30-11-2023,False,Life Event Expenses,2023-11-29,Green,0.0,18583.0,182.2
0062x00000EeXF7AAN,0012x00000NQsoTAAT,Melbourne,VIC,Australia,Loan Paid,Existing Client-Granted Loan Before,0.0,74.43,3412.4522,4.0,0.0,0.0,3.0,4.0,8086.9632,4.0,71.0,989.8549,2897.0385,3133.25,1.0,10.86,0.0,0.0,7817.06,899.0,1825.0,3500,4194.23,8.0,15.286,Fortnightly,37.0,8086.96,3500.0,Full-Time Employment,4.0,0.0,0.1099,1.0,8086.96,2645.0,7160.2666,524.28,MoneySpot,0.0,6497775,4.0,12-09-2023,False,Home Maintenance & Repairs,2023-09-12,Green,0.0,10868.0,8086.96
0062x00000DtRDzAAN,0012x00000Rrs3bAAB,Miranda,NSW,Australia,Loan Paid,Existing Client-Granted Loan Before,0.0,79.7,1105.0302,1.0,0.0,0.0,3.0,1.0,11908.7677,0.0,44.0,12004.2461,982.25,700.0,2.0,24.27,0.0,1.0,1935.47,400.0,0.0,3100,3895.54,24.0,23.714,Weekly,21.0,8033.81,3500.0,Full-Time Employment,0.0,0.0,0.0,0.0,3638.1066,3258.0,4221.2,162.32,MoneySpot,0.0,5313518,0.0,18-05-2023,False,Medical Expenses,2023-05-18,Green,0.0,16472.0,8033.81
0062x00000EcjUmAAJ,0012x00000e07iaAAA,Wollert,VIC,Australia,Loan Paid,Existing Client-Granted Loan Before,0.0,79.42,6679.4274,1.0,0.0,0.0,3.0,1.0,33005.1951,0.0,188.0,0.0,2186.1715,2270.88,1.0,1.17,0.0,0.0,2300.0,400.0,1500.0,3500,4207.17,16.0,16.143,Weekly,25.0,44107.41,3500.0,Full-Time Employment,0.0,0.0,0.033,0.0,9473.41,1651.0,8119.9233,262.95,MoneySpot,0.0,6374290,0.0,30-08-2023,False,Living Expenses,2023-08-30,Green,0.0,56471.0,44107.41
0062x00000ENQRgAAP,0012x00000XK1R4AAL,Truganina,VIC,Australia,Loan Paid,Existing Client-Granted Loan Before,0.0,70.46,1289.8394,1.0,0.0,0.0,3.0,1.0,4754.6262,1.0,28.0,0.0,717.073,608.98,1.0,0.0,0.0,0.0,2478.11,899.0,0.0,3500,4196.73,16.0,15.857,Weekly,24.0,4854.63,3500.0,Full-Time Employment,1.0,0.0,0.011,1.0,3107.3166,960.0,1839.8233,262.3,MoneySpot,0.0,6173832,1.0,12-08-2023,False,Vehicle Expenses,2023-08-11,Green,0.0,7696.0,4854.63
0062x00000F1iowAAB,0012x00000G1GJJAA3,South Murwillumbah,NSW,Australia,Closed Lost,Existing Client-Granted Loan Before,18.48,99.54,789.6743,0.0,0.0,4.0,7.0,4.0,1510.2033,2.0,24.0,0.0,1132.6525,857.0,0.0,4.99,0.0,0.0,1577.33,400.0,210.0,3500,4132.64,4.0,9.571,Fortnightly,61.0,1510.2,3500.0,Self Employed,2.0,0.0,0.0,0.0,1510.2033,238.0,806.04,1033.17,MoneySpot,,6916298,1.0,22-10-2023,True,Vehicle Expenses,2023-10-22,Orange,1577.0,8530.0,1510.2
0062x00000DYGoAAAX,0012x00000g8n3KAAQ,Johnston,NT,Australia,Loan Paid,Existing Client-Granted Loan Before,0.0,47.92,6091.7322,2.0,0.0,0.0,5.0,2.0,9634.5219,0.0,26.0,638.7585,3389.0957,3484.96,1.0,0.0,0.0,0.0,0.0,1499.0,2100.0,3300,4142.06,12.0,23.857,Fortnightly,33.0,9634.52,4000.0,,0.0,0.0,0.0,0.0,7907.89,873.0,5908.1066,345.18,MoneySpot,0.0,5022993,0.0,08-04-2023,False,Medical Expenses,2023-04-08,Green,0.0,10509.0,9634.52
0062x00000EM7FAAA1,0012x00000g9fktAAA,Murray Bridge,SA,Australia,Loan Paid,Existing Client-Granted Loan Before,0.0,83.41,4449.4544,1.0,0.0,0.0,2.0,1.0,5292.193,1.0,66.0,130.8243,909.8007,909.7,0.0,0.03,0.0,0.0,0.0,599.0,640.0,3500,4294.69,21.0,21.0,Weekly,29.0,5655.86,3500.0,Full-Time Employment,2.0,0.0,0.0,0.0,3942.47,1051.0,4744.11,204.52,MoneySpot,0.0,6082313,0.0,02-08-2023,False,Vehicle Expenses,2023-08-02,Green,0.0,8789.0,5655.86
0062x00000DXOJFAA5,0012x00000LQAreAAH,Sandy Hollow,NSW,Australia,Loan Paid,Existing Client-Granted Loan Before,0.0,52.75,1203.1707,1.0,0.0,0.0,3.0,1.0,5427.1332,0.0,24.0,0.0,1248.9846,1346.0,0.0,0.0,0.0,0.0,945.0,599.0,0.0,3500,4196.24,16.0,15.857,Weekly,43.0,5427.13,3500.0,Full-Time Employment,0.0,0.0,0.0659,0.0,5412.2666,1063.0,1063.1433,262.27,MoneySpot,0.0,4970119,0.0,31-03-2023,False,Home Maintenance & Repairs,2023-03-31,Green,0.0,5418.0,5427.13
0062x00000EDPSJAA5,0010K00001xik4AQAQ,Albion Park,NSW,Australia,Closed Lost,Existing Client-No Loan Granted Ever,0.86,13.11,343.77,1.0,0.0,0.0,3.0,1.0,3136.7187,8.0,19.0,282.1736,825.0,1398.0,0.0,0.67,0.0,0.0,1419.17,400.0,100.0,3500,4071.24,10.0,10.429,Weekly,53.0,3260.05,3500.0,Unemployed,8.0,0.0,0.5604,0.0,3300.0,294.0,343.77,407.13,MoneySpot,,5941955,8.0,18-07-2023,False,Vehicle Expenses,2023-07-18,Orange,30.0,3453.0,3260.05
0062x00000DWKZbAAP,0012800001Z6FA0AAN,Sunshine West,VIC,Australia,Loan Paid,Existing Client-Granted Loan Before,0.0,77.17,2912.7605,1.0,2.0,0.0,2.0,1.0,3938.525,1.0,58.0,2169.7374,714.2363,698.0,2.0,1.93,0.0,0.0,4766.67,400.0,300.0,3200,4017.11,24.0,24.0,Weekly,48.0,8554.58,5000.0,Full-Time Employment,5.0,0.0,0.2088,3.0,6357.1033,2180.0,2902.2333,167.39,MoneySpot,0.0,4910394,4.0,22-03-2023,False,Vehicle Expenses,2023-03-22,Green,0.0,4393.0,8554.58
0062x00000FtWTZAA3,0012x00000gok4pAAA,Panania,NSW,Australia,Loan Paid,Existing Client-Granted Loan Before,0.0,70.1,59.8466,2.0,0.0,0.0,2.0,2.0,1801.0784,0.0,15.0,0.0,438.9316,497.03,0.0,0.0,1.0,0.0,480.0,599.0,0.0,3450,4282.57,12.0,23.143,Fortnightly,19.0,1725.31,5000.0,Casual Employment,0.0,0.0,0.0,0.0,1429.4166,0.0,71.8466,356.89,MoneySpot,0.0,8184546,0.0,2024-02-13,False,Vehicle Expenses,2024-02-13,Green,0.0,5297.0,1725.31
0062x00000DZKzQAAX,0012x00000fmOaTAAU,Bayswater,VIC,Australia,Loan Paid,Existing Client-Granted Loan Before,0.0,54.04,3414.613,2.0,1.0,0.0,3.0,2.0,6650.3361,4.0,34.0,1948.9081,941.1466,1575.3,0.0,0.97,1.0,0.0,0.0,599.0,500.0,3500,4343.64,12.0,23.286,Fortnightly,28.0,9507.54,3500.0,Part-Time Employment,7.0,0.0,0.044,2.0,4692.9666,1806.0,5496.61,361.98,MoneySpot,0.0,5087336,5.0,18-04-2023,False,Vehicle Expenses,2023-04-18,Green,0.0,11683.0,9507.54
0062x00000FVTq7AAH,0012x00000RrDIgAAN,Zillmere,QLD,Australia,Loan Paid,Existing Client-Granted Loan Before,20.16,65.14,309.3587,2.0,0.0,2.0,3.0,2.0,7471.398,0.0,74.0,896.0,1658.424,1386.49,1.0,0.0,0.0,0.0,0.0,899.0,2200.0,3500,4183.3,8.0,15.0,Fortnightly,41.0,9173.1,3500.0,,0.0,0.0,0.011,0.0,6259.6033,744.0,1499.17,522.92,MoneySpot,0.0,7595186,0.0,23-12-2023,False,Life Event Expenses,2023-12-23,Green,2509.0,12444.0,9173.1
0062x00000F1ZtJAAV,0012x000002d4IdAAI,Berala,NSW,Australia,Loan Paid,Existing Client-Granted Loan Before,0.0,49.39,586.3664,2.0,0.0,0.0,4.0,2.0,4858.408,6.0,14.0,0.0,1777.21,1613.72,0.0,0.0,0.0,0.0,0.0,400.0,1600.0,3500,4519.7,16.0,31.857,Fortnightly,50.0,4858.41,3500.0,Full-Time Employment,6.0,0.0,0.7143,4.0,4146.8233,825.0,925.1866,282.49,MoneySpot,0.0,6904405,1.0,21-10-2023,False,Vehicle Expenses,2023-10-20,Green,0.0,5561.0,4858.41
0062x00000DsbgqAAB,0010K00001eKTIkQAO,Kooringal,NSW,Australia,Loan Paid,Existing Client-Granted Loan Before,0.0,46.65,4205.4075,1.0,0.0,0.0,2.0,1.0,5197.7746,0.0,67.0,1535.6271,1171.2692,1128.39,2.0,4.07,0.0,0.0,3900.0,1500.0,200.0,3150,3951.15,24.0,23.714,Weekly,43.0,5468.93,5000.0,Full-Time Employment,0.0,0.0,0.4396,0.0,5075.5,2318.0,4813.2066,164.64,MoneySpot,0.0,5251712,0.0,12-05-2023,False,Vehicle Expenses,2023-05-12,Green,0.0,6789.0,5468.93
0062x00000F368nAAB,0012x00000NR8rCAAT,Calliope,QLD,Australia,Loan Paid,Existing Client-Granted Loan Before,0.0,75.45,5722.5527,1.0,0.0,0.0,3.0,1.0,8674.7344,4.0,75.0,1242.6449,1920.1258,2180.2,0.0,0.0,0.0,0.0,9533.33,899.0,1200.0,3500,4206.99,16.0,16.143,Weekly,52.0,9800.65,3500.0,Full-Time Employment,4.0,0.0,0.0,0.0,7680.5033,2052.0,5718.0333,262.94,Financier-2,0.0,7020089,1.0,01-11-2023,False,Vehicle Expenses,2023-11-01,Green,0.0,9320.0,9800.65
0062x00000EBzAiAAL,0010K00001xjXUKQA2,Currans Hill,NSW,Australia,Loan Paid,Existing Client-Granted Loan Before,0.0,41.21,5972.8322,2.0,1.0,0.0,3.0,2.0,9135.0314,11.0,32.0,376.5801,4204.6185,5352.47,2.0,30.76,0.0,0.0,7800.0,599.0,808.0,3500,4220.99,8.0,16.0,Fortnightly,48.0,17988.95,3500.0,Full-Time Employment,11.0,0.0,0.044,4.0,17692.74,1316.0,6375.0433,527.63,MoneySpot,-0.03,5846365,7.0,06-07-2023,False,Furniture or Appliances,2023-07-06,Green,0.0,10409.0,17988.95
0062x00000ECkE3AAL,0012x00000IMrsHAAT,Paddington,QLD,Australia,Loan Paid,Existing Client-Granted Loan Before,0.0,28.09,29742.7978,4.0,1.0,0.0,4.0,4.0,49666.6666,3.0,76.0,0.0,49666.6666,50000.0,1.0,0.0,0.0,1.0,8569.35,1499.0,480.0,3500,4475.66,6.0,26.571,Monthly,42.0,52604.55,5000.0,Full-Time Employment,7.0,0.0,0.1099,0.0,2926.33,1163.0,24437.33,745.95,MoneySpot,0.0,5896805,4.0,13-07-2023,False,Vehicle Expenses,2023-07-12,Orange,0.0,113643.0,52604.55
0062x00000EMHafAAH,0012x00000kfzrAAAQ,Fairlight,NSW,Australia,Closed Lost,New Client-New Loan,0.0,70.07,0.0,4.0,0.0,0.0,6.0,4.0,3600.55,0.0,0.0,0.0,663.75,120.0,0.0,4.04,0.0,1.0,2500.0,2000.0,2320.0,3500,4084.32,4.0,8.286,Fortnightly,54.0,3600.55,3500.0,Self Employed,0.0,0.0,0.0,0.0,0.0,0.0,0.0,1021.09,MoneySpot,,6093786,0.0,03-08-2023,False,Living Expenses,2023-08-02,Orange,0.0,4056.0,3600.55
0062x00000F1bsSAAR,0012x00000hZ3bxAAC,Hillarys,WA,Australia,Loan Paid,Existing Client-Granted Loan Before,0.22,64.7,291.63,4.0,0.0,0.0,4.0,4.0,200.0,4.0,95.0,481.2012,100.0,100.0,2.0,0.17,0.0,1.0,7150.0,599.0,2400.0,3500,4372.33,5.0,21.571,Monthly,45.0,2426.33,5000.0,Full-Time Employment,4.0,0.0,0.0659,0.0,0.0,2075.0,4913.88,874.47,Financier-2,0.0,6907380,3.0,21-10-2023,False,Furniture or Appliances,2023-10-21,Orange,27.0,11924.0,2426.33
0062x00000DGPglAAH,0012x00000go7zvAAA,Parramatta,NSW,Australia,Closed Lost,New Client-New Loan,18.24,78.42,0.0,4.0,0.0,2.0,3.0,4.0,5016.5932,1.0,10.0,0.0,1664.445,1550.73,0.0,0.0,0.0,0.0,1200.0,2000.0,1800.0,3500,4084.58,5.0,9.286,Fortnightly,27.0,4730.59,3500.0,Full-Time Employment,1.0,0.0,0.011,0.0,3600.5933,0.0,40.0,816.92,MoneySpot,,4721426,0.0,21-02-2023,False,Relocation Expenses,2023-02-20,Orange,1381.0,7571.0,4730.59
0062x00000DrnDSAAZ,0012x00000MjebsAAB,Guanaba,QLD,Australia,Loan Paid,Existing Client-Granted Loan Before,0.0,69.2,1006.3323,1.0,0.0,0.0,4.0,1.0,12386.6689,0.0,25.0,810.0323,643.4636,670.25,2.0,2.6,0.0,0.0,0.0,599.0,600.0,3450,4207.17,16.0,16.143,Weekly,59.0,13456.7,3500.0,,0.0,0.0,0.0,0.0,2359.3666,808.0,2243.7666,259.58,MoneySpot,0.0,5193438,0.0,04-05-2023,False,Other Expenses,2023-05-04,Green,0.0,18095.0,13456.7
0062x00000GGzi1AAD,0012x00000hY2NwAAK,Lakemba,NSW,Australia,Closed Lost,Existing Client-Granted Loan Before,0.0,36.0,259.1278,1.0,0.0,0.0,7.0,1.0,13501.1766,0.0,8.0,0.0,1923.8944,1402.97,0.0,0.0,0.0,1.0,0.0,1499.0,1100.0,3350,4116.83,20.0,20.143,Weekly,29.0,13501.18,5000.0,Part-Time Employment,0.0,0.0,0.0,0.0,2500.5433,0.0,318.68,205.85,MoneySpot,,8678914,0.0,2024-04-01,False,Travel Expenses,2024-04-01,Green,0.0,13481.0,13501.18
0062x00000DYf0CAAT,0012x00000hXlNvAAK,Craigieburn,VIC,Australia,Closed Lost,Existing Client-No Loan Granted Ever,0.0,45.0,462.461,1.0,0.0,0.0,3.0,1.0,5383.8201,0.0,12.0,462.4637,854.6875,1002.25,0.0,0.1,0.0,0.0,0.0,0.0,200.0,3400,3990.25,9.0,9.571,Weekly,37.0,5890.15,3400.0,,0.0,0.0,0.033,0.0,3418.75,426.0,485.72,443.37,MoneySpot,,5045828,0.0,17-04-2023,False,Vehicle Other,2023-04-12,Orange,0.0,6877.0,5890.15
0062x00000DVhYRAA1,0012x00000GduzSAAR,Rockville,QLD,Australia,Closed Lost,Existing Client-Granted Loan Before,30.95,86.11,2428.0456,2.0,1.0,2.0,2.0,2.0,5473.9532,7.0,35.0,1550.5588,1464.2257,1364.57,2.0,0.0,0.0,0.0,2600.0,899.0,0.0,3100,3917.61,12.0,23.857,Fortnightly,33.0,5199.62,5000.0,Part-Time Employment,7.0,0.0,0.0879,1.0,5483.3,1475.0,2398.3833,326.47,MoneySpot,,5466999,6.0,01-06-2023,False,Vehicle Expenses,2023-06-01,Green,2317.0,7485.0,5199.62
0062x00000ENd1WAAT,0012x00000dwqwrAAA,Orange Grove,WA,Australia,Loan Paid,Existing Client-Granted Loan Before,2.44,51.83,6930.3114,2.0,2.0,2.0,7.0,2.0,11350.8705,3.0,55.0,378.9298,5443.3333,5500.0,1.0,0.35,0.0,1.0,0.0,1499.0,2500.0,3300,4111.47,6.0,23.0,Monthly,37.0,20384.35,5000.0,,5.0,0.0,0.0,0.0,427.3233,2242.0,10244.1266,685.25,MoneySpot,0.0,6190022,5.0,14-08-2023,False,Life Event Expenses,2023-08-14,Green,559.0,22839.0,20384.35
0062x00000ED7AnAAL,0012x00000Gc8t1AAB,Coleambally,NSW,Australia,Closed Lost,Existing Client-Granted Loan Before,0.0,52.82,3318.2684,1.0,0.0,0.0,3.0,1.0,5040.0801,0.0,72.0,903.1114,1067.0,1067.0,0.0,0.0,0.0,0.0,3076.67,599.0,0.0,3250,3922.65,16.0,15.714,Weekly,39.0,5095.14,3250.0,Full-Time Employment,0.0,0.0,0.011,0.0,4623.6666,2302.0,3581.2866,245.17,Financier-2,,5920739,0.0,15-07-2023,False,Vehicle Expenses,2023-07-15,Green,0.0,7263.0,5095.14
0062x00000DtubaAAB,0012x00000G1R5yAAF,Dunlop,ACT,Australia,Loan Paid,Existing Client-Granted Loan Before,0.0,87.13,1439.4346,1.0,1.0,0.0,3.0,1.0,3836.882,19.0,60.0,0.0,795.2115,794.1,0.0,0.21,0.0,0.0,1264.0,400.0,0.0,3150,3976.68,24.0,24.429,Weekly,22.0,3836.88,4000.0,Full-Time Employment,25.0,0.0,0.0549,2.0,3827.4166,1063.0,3420.09,165.7,MoneySpot,-0.01,5355279,25.0,22-05-2023,False,Travel Expenses,2023-05-22,Green,0.0,3852.0,3836.88
0062x00000DA8nnAAD,0012x00000VdNWnAAN,Ultimo,NSW,Australia,Closed Lost,Existing Client-Granted Loan Before,0.0,98.28,43.4524,3.0,0.0,0.0,5.0,3.0,6470.2432,0.0,10.0,0.0,5506.9666,5506.96,0.0,0.0,0.0,0.0,4314.0,400.0,840.0,3500,4257.7,5.0,18.714,Monthly,30.0,8698.24,3500.0,Full-Time Employment,0.0,0.0,0.0769,0.0,5543.5766,219.0,803.49,851.55,MoneySpot,,4614946,0.0,04-02-2023,False,Other Expenses,2023-02-03,Green,0.0,12702.0,8698.24
0062x00000DsRR3AAN,0012x00000Gb6uGAAR,Upper Coomera,QLD,Australia,Loan Paid,Existing Client-Granted Loan Before,0.0,82.59,4840.7554,2.0,0.0,0.0,2.0,2.0,4164.9563,9.0,75.0,715.5799,1515.4742,1391.69,1.0,2.93,0.0,0.0,2166.67,400.0,400.0,3100,3918.24,12.0,23.857,Fortnightly,33.0,4164.96,5000.0,Full-Time Employment,9.0,0.0,0.1099,5.0,3536.1066,1031.0,5252.4933,326.52,MoneySpot,0.0,5239966,4.0,12-05-2023,False,Medical Expenses,2023-05-11,Green,0.0,4703.0,4164.96
0062x00000Fhs39AAB,0012x00000kZuHOAA0,Labrador,QLD,Australia,Loan Paid,Existing Client-Granted Loan Before,0.0,66.67,488.7654,4.0,0.0,0.0,3.0,4.0,17305.4399,0.0,8.0,0.0,2028.3937,2509.6,0.0,0.0,0.0,0.0,0.0,599.0,650.0,3500,4210.6,8.0,15.714,Fortnightly,21.0,17566.09,3500.0,Part-Time Employment,0.0,0.0,0.0,0.0,7543.7733,375.0,374.9433,526.33,MoneySpot,0.0,7936521,0.0,2024-01-20,False,Medical Expenses,2024-01-19,Green,0.0,23117.0,17566.09
0062x00000EbAAGAA3,0012x00000govG7AAI,Ormeau,QLD,Australia,Loan Paid,Existing Client-Granted Loan Before,0.0,47.66,1398.8866,2.0,0.0,0.0,2.0,2.0,5070.9797,0.0,23.0,0.0,1516.9457,1498.93,1.0,0.6,0.0,0.0,0.0,899.0,1600.0,3500,4580.08,18.0,35.429,Fortnightly,52.0,5070.98,3500.0,Full-Time Employment,0.0,0.0,0.3407,0.0,3539.54,661.0,1587.6033,254.45,MoneySpot,-0.32,6273667,0.0,20-08-2023,False,Furniture or Appliances,2023-08-20,Green,0.0,5473.0,5070.98
0062x00000EbQqbAAF,0012x00000khRvbAAE,Chisholm,ACT,Australia,Closed Lost,New Client-New Loan,0.26,65.76,2989.4745,2.0,0.0,0.0,3.0,2.0,4225.8433,8.0,25.0,1079.8351,1838.4157,1931.26,0.0,0.17,0.0,0.0,3900.0,400.0,3400.0,3500,4089.76,5.0,9.429,Fortnightly,48.0,4431.84,3500.0,Part-Time Employment,8.0,0.0,0.033,6.0,4289.6366,1074.0,2983.29,817.96,MoneySpot,,6290638,2.0,22-08-2023,False,Living Expenses,2023-08-22,Orange,14.0,5336.0,4431.84
0062x00000DWQufAAH,0010K00001glMWAQA2,Scarborough,QLD,Australia,Loan Paid,Existing Client-Granted Loan Before,2.88,88.21,2677.9784,2.0,0.0,2.0,3.0,2.0,4540.3122,0.0,48.0,1489.1843,1895.4214,1765.13,1.0,0.0,0.0,0.0,1581.67,899.0,620.0,3100,3923.25,12.0,24.0,Fortnightly,33.0,4540.47,3500.0,Full-Time Employment,0.0,0.0,0.4835,0.0,4607.17,1532.0,3091.5666,326.94,MoneySpot,0.0,4916421,0.0,23-03-2023,False,Life Event Expenses,2023-03-23,Green,185.0,6405.0,4540.47
0062x00000DrFgrAAF,0012x00000MgitDAAR,Capel Sound,VIC,Australia,Closed Lost,Existing Client-Granted Loan Before,0.0,97.9,3736.8477,2.0,2.0,0.0,2.0,2.0,5545.3029,11.0,35.0,550.7897,2201.17,1923.23,0.0,25.28,0.0,0.0,0.0,400.0,0.0,3150,3832.22,8.0,15.714,Fortnightly,22.0,5798.64,3150.0,,11.0,0.0,0.0549,4.0,5136.0633,463.0,3679.5233,479.03,QuickCash,,5154593,11.0,28-04-2023,False,Vehicle Expenses,2023-04-28,Green,0.0,7248.0,5798.64
0062x00000DGIH5AAP,0012x00000go3gbAAA,Coombabah,QLD,Australia,Closed Lost,New Client-New Loan,0.0,61.31,290.7233,1.0,0.0,0.0,2.0,1.0,3761.3768,2.0,15.0,0.0,577.3,118.0,0.0,57.5,0.0,1.0,87000.0,2000.0,800.0,3500,4068.83,5.0,8.857,Fortnightly,22.0,9606.3,3500.0,Full-Time Employment,2.0,0.0,0.022,2.0,1559.6,0.0,549.66,813.77,MoneySpot,,4715089,0.0,19-02-2023,False,Medical Expenses,2023-02-19,Orange,0.0,23670.0,9606.3
0062x00000DYpjqAAD,0012x00000OJFW9AAP,Heathridge,WA,Australia,Loan Paid,Existing Client-Granted Loan Before,0.0,71.01,2060.4833,2.0,0.0,0.0,3.0,2.0,4423.9721,0.0,26.0,723.9475,1980.0871,1925.88,0.0,0.0,0.0,0.0,3445.78,599.0,800.0,3050,3734.2,8.0,16.0,Fortnightly,28.0,5150.64,3050.0,Part-Time Employment,5.0,0.0,0.0,1.0,4620.2033,778.0,2083.1566,466.78,QuickCash,0.0,5055281,0.0,13-04-2023,False,Living Expenses,2023-04-13,Green,0.0,5601.0,5150.64
0062x00000E6gwQAAR,0012x00000BIIQDAA5,Biloela,QLD,Australia,Loan Paid,Existing Client-Granted Loan Before,0.0,62.88,4722.6797,1.0,0.0,0.0,3.0,1.0,6790.2866,2.0,81.0,337.5561,1562.6961,1149.0,0.0,1.35,0.0,0.0,2806.92,899.0,760.0,3500,4357.06,24.0,24.143,Weekly,23.0,7162.3,3500.0,Full-Time Employment,2.0,0.0,0.0,0.0,6771.6833,1959.0,5384.66,181.55,MoneySpot,0.0,5759507,2.0,29-06-2023,False,Vehicle Expenses,2023-06-28,Orange,0.0,7470.0,7162.3
0062x00000EMER6AAP,0010K00001eJjGJQA0,Bald Hills,QLD,Australia,Loan Paid,Existing Client-Granted Loan Before,0.13,61.15,4356.8643,2.0,0.0,0.0,2.0,2.0,9461.2453,13.0,63.0,0.0,3713.5266,2543.05,1.0,0.61,0.0,0.0,5416.67,899.0,1000.0,3500,4177.46,8.0,14.857,Fortnightly,35.0,15266.61,3500.0,Full-Time Employment,13.0,0.0,0.1538,2.0,3713.5266,1100.0,6057.12,522.19,MoneySpot,0.0,6089553,4.0,03-08-2023,False,Relocation Expenses,2023-08-03,Green,14.0,10570.0,15266.61
0062x00000FkOiGAAV,0010K00001igdWwQAI,Gisborne,VIC,Australia,Loan Paid,Existing Client-Granted Loan Before,0.0,80.63,6929.8248,2.0,0.0,0.0,3.0,2.0,15230.8533,0.0,95.0,537.0008,3558.8,3558.8,1.0,2.84,0.0,0.0,4264.0,1500.0,2238.0,3300,4004.77,8.0,16.0,Fortnightly,43.0,16666.82,3300.0,Full-Time Employment,0.0,0.0,0.6154,0.0,16632.3466,1384.0,8185.0533,500.6,QuickCash,0.0,8130104,0.0,2024-02-08,False,Other Expenses,2024-02-07,Green,0.0,17826.0,16666.82
0062x00000ELd2RAAT,0012x00000GdNCDAA3,Lockleys,SA,Australia,Loan Paid,Existing Client-Granted Loan Before,0.2,72.72,1798.4889,0.0,0.0,0.0,0.0,0.0,0.0,0.0,49.0,0.0,0.0,0.0,1.0,0.05,0.0,0.0,4008.33,899.0,1000.0,3500,4468.89,15.0,29.571,Fortnightly,34.0,4532.27,3750.0,Part-Time Employment,0.0,0.0,0.0,0.0,4482.7433,997.0,2193.6933,297.93,MoneySpot,0.0,6048798,0.0,29-07-2023,False,Veterinary Expenses,2023-07-29,Orange,13.0,6262.0,4532.27
0062x00000DrDH9AAN,0012x00000WsBHyAAN,Burwood,NSW,Australia,Loan Paid,Existing Client-Granted Loan Before,0.0,87.03,723.3333,4.0,0.0,0.0,3.0,4.0,6910.1899,0.0,5.0,203.8848,3406.7,3261.5,0.0,0.0,0.0,1.0,1300.0,899.0,1040.0,3500,4365.59,12.0,23.857,Fortnightly,24.0,7614.63,5000.0,Self Employed,0.0,0.0,0.0,0.0,0.0,757.0,1480.6666,363.8,MoneySpot,0.0,5152585,0.0,28-04-2023,False,Other Expenses,2023-04-27,Orange,0.0,10194.0,7614.63
0062x00000E49bYAAR,0010K000020IjHyQAK,Lalor,VIC,Australia,Loan Paid,Existing Client-Granted Loan Before,0.0,60.58,706.2674,4.0,0.0,0.0,4.0,4.0,6053.2432,5.0,51.0,0.0,2083.105,1508.74,0.0,55.2,0.0,0.0,4766.67,899.0,753.0,3500,4226.59,8.0,16.143,Fortnightly,53.0,7212.95,3500.0,Contract Employment,5.0,0.0,0.022,0.0,5847.9866,2328.0,3878.7533,528.33,MoneySpot,0.0,5543758,1.0,08-06-2023,False,Home Maintenance & Repairs,2023-06-08,Green,0.0,13530.0,7212.95
0062x00000EO4BcAAL,0010K00001mhyZqQAI,HAWKESDALE,VIC,Australia,Loan Paid,Existing Client-Granted Loan Before,0.0,63.53,819.0094,2.0,0.0,0.0,3.0,2.0,7267.6899,0.0,7.0,0.0,2232.8,2254.6,1.0,0.36,0.0,0.0,3856.67,899.0,100.0,3500,4188.83,8.0,15.143,Fortnightly,40.0,7267.69,3500.0,Full-Time Employment,0.0,0.0,0.0,0.0,4465.6,625.0,1398.4433,523.61,MoneySpot,0.0,6228660,0.0,16-08-2023,False,Vehicle Expenses,2023-08-16,Green,0.0,10288.0,7267.69
0062x00000FIhGmAAL,0012x00000e07QmAAI,Bridgeman Downs,QLD,Australia,Closed Lost,Existing Client-Granted Loan Before,0.0,74.78,695.2367,2.0,0.0,0.0,2.0,2.0,7330.0921,4.0,40.0,0.0,2033.89,2033.89,0.0,0.0,0.0,0.0,6375.51,400.0,750.0,3500,4188.72,8.0,15.143,Fortnightly,61.0,7330.09,3500.0,Full-Time Employment,4.0,0.0,0.044,0.0,5391.1066,417.0,713.1633,523.59,MoneySpot,,7270353,0.0,21-11-2023,False,Other Expenses,2023-11-20,Green,0.0,9734.0,7330.09
0062x00000EByJZAA1,0012x00000IPObTAAX,Greenvale,VIC,Australia,Loan Paid,Existing Client-Granted Loan Before,0.84,67.68,2040.5002,1.0,0.0,0.0,3.0,1.0,5483.3645,0.0,16.0,0.0,1442.2,1442.2,1.0,63.29,0.0,0.0,2600.0,599.0,2172.0,3100,3922.22,25.0,25.0,Weekly,53.0,7353.36,3100.0,Full-Time Employment,0.0,0.0,0.0,0.0,2884.4,493.0,2098.25,156.9,MoneySpot,0.0,5845767,0.0,06-07-2023,False,Other Expenses,2023-07-06,Orange,63.0,7474.0,7353.36
0062x00000DAZSSAA5,0012x00000SIEQCAA5,Beeliar,WA,Australia,Loan Paid,Existing Client-Granted Loan Before,0.18,63.47,2510.2869,2.0,3.0,0.0,2.0,2.0,5717.153,4.0,17.0,573.5714,1519.3771,1426.61,7.0,20.54,0.0,0.0,4116.67,899.0,1010.0,3500,4226.72,8.0,16.143,Fortnightly,48.0,10001.5,3500.0,Full-Time Employment,13.0,0.0,0.0769,1.0,9901.4566,2039.0,3444.4833,528.35,MoneySpot,0.0,4635754,8.0,07-02-2023,False,Vehicle Expenses,2023-02-07,Green,13.0,7085.0,10001.5
0062x00000Ef7BpAAJ,0012x00000WXvimAAD,Medowie,NSW,Australia,Closed Lost,Existing Client-No Loan Granted Ever,6.78,73.57,0.0,1.0,0.0,1.0,3.0,1.0,6862.8172,0.0,0.0,0.0,704.83,792.25,0.0,0.18,0.0,1.0,11106.88,400.0,150.0,3500,4068.79,5.0,8.857,Fortnightly,24.0,12885.22,3500.0,Full-Time Employment,0.0,0.0,0.0,0.0,1083.4933,0.0,39.0033,813.77,MoneySpot,,6544705,0.0,16-09-2023,False,Living Expenses,2023-09-15,Orange,1083.0,15955.0,12885.22
0062x00000F1bYmAAJ,0012x00000goj0oAAA,Mount McKenzie,SA,Australia,Loan Paid,Existing Client-Granted Loan Before,0.0,87.16,6004.5017,1.0,0.0,0.0,3.0,1.0,9166.5852,12.0,42.0,0.0,1897.3076,1750.0,0.0,0.58,0.0,0.0,0.0,1499.0,650.0,3500,4191.38,16.0,15.714,Weekly,40.0,10147.92,3500.0,Full-Time Employment,20.0,0.0,0.0,10.0,8221.6666,802.0,6125.27,261.97,MoneySpot,0.0,6907012,5.0,21-10-2023,False,Furniture or Appliances,2023-10-21,Green,0.0,12270.0,10147.92
0062x00000EzlckAAB,0012x00000GeoGTAAZ,Moulden,NT,Australia,Loan Paid,Existing Client-Granted Loan Before,0.0,65.49,0.0,2.0,0.0,0.0,4.0,2.0,10224.0138,0.0,13.0,1063.3708,3846.67,3846.67,0.0,26.34,0.0,0.0,9530.79,1499.0,1000.0,3250,3875.94,7.0,12.857,Fortnightly,47.0,14779.79,3250.0,Full-Time Employment,0.0,0.0,0.044,0.0,7221.45,1189.0,1188.87,553.71,MoneySpot,0.0,6832727,0.0,14-10-2023,False,Living Expenses,2023-10-13,Orange,0.0,12179.0,14779.79
0062x00000DZd2KAAT,0012x00000g8QbbAAE,Telina,QLD,Australia,Closed Lost,Existing Client-Granted Loan Before,0.0,98.67,4486.9646,4.0,0.0,0.0,2.0,4.0,10913.0,0.0,0.0,554.5491,3273.9,1400.0,0.0,0.0,0.0,1.0,3033.33,400.0,800.0,3500,4265.64,20.0,19.714,Weekly,41.0,10909.33,5000.0,Part-Time Employment,2.0,0.0,0.0,2.0,3033.3333,1943.0,10003.1233,213.29,MoneySpot,,5103060,2.0,20-04-2023,False,Home Maintenance & Repairs,2023-04-20,Orange,0.0,159983.0,10909.33
0062x00000ECYiyAAH,0010K0000260NpiQAE,Harristown,QLD,Australia,Loan Paid,Existing Client-Granted Loan Before,2.85,39.74,5769.1111,1.0,0.0,3.0,2.0,1.0,4186.4333,0.0,0.0,1005.4676,900.0,900.0,2.0,3.69,0.0,1.0,3481.83,1499.0,100.0,3500,4357.46,24.0,24.143,Weekly,48.0,7981.73,3500.0,Full-Time Employment,0.0,0.0,0.0,0.0,3852.21,1943.0,7167.9666,181.57,MoneySpot,0.0,5885326,0.0,11-07-2023,False,Relocation Expenses,2023-07-11,Orange,113.0,3953.0,7981.73
0062x00000DZ1yeAAD,0012x00000Tu73hAAB,Mount Druitt,NSW,Australia,Closed Lost,Existing Client-Granted Loan Before,0.0,84.39,1476.637,2.0,1.0,0.0,3.0,2.0,3968.0263,1.0,16.0,711.9564,1643.4666,1598.71,2.0,0.14,0.0,0.0,3280.94,400.0,0.0,3050,5777.62,8.0,14.714,Fortnightly,28.0,4868.81,5000.0,Full-Time Employment,1.0,0.0,0.011,0.0,3286.9333,1095.0,3365.8466,722.21,MoneySpot,,5067550,1.0,15-04-2023,False,Vehicle Expenses,2023-04-14,Green,0.0,10801.0,4868.81
0062x00000DWOyVAAX,0010K00001miLcmQAE,Doolandella,QLD,Australia,Loan Paid,Existing Client-Granted Loan Before,0.0,74.25,2985.0655,1.0,0.0,0.0,3.0,1.0,5849.3853,0.0,111.0,1250.9306,1322.3792,1322.38,0.0,0.0,0.0,0.0,4030.0,599.0,249.0,3400,4094.45,16.0,16.0,Weekly,50.0,5849.39,3500.0,Full-Time Employment,0.0,0.0,0.1978,0.0,5730.31,1839.0,3901.77,255.91,MoneySpot,0.0,4915313,0.0,23-03-2023,False,Relocation Expenses,2023-03-23,Green,0.0,6231.0,5849.39
0062x00000DYnPQAA1,0012x00000OKtSbAAL,Kingsley,WA,Australia,Loan Paid,Existing Client-Granted Loan Before,0.0,63.27,744.7978,1.0,0.0,0.0,1.0,1.0,3626.5987,0.0,7.0,716.452,488.8888,500.0,0.0,0.0,0.0,1.0,2600.0,599.0,0.0,3100,3928.41,12.0,24.143,Fortnightly,46.0,4783.88,5000.0,Full-Time Employment,0.0,0.0,0.0,0.0,1087.63,798.0,797.7833,327.37,MoneySpot,-0.03,5053630,0.0,13-04-2023,False,Travel Expenses,2023-04-13,Green,0.0,6331.0,4783.88
0062x00000D7doRAAR,0010K000026PEiPQAW,Moonah,TAS,Australia,Loan Paid,Existing Client-Granted Loan Before,0.0,35.74,2729.5765,2.0,0.0,0.0,3.0,2.0,10158.8491,0.0,35.0,0.0,3458.58,3773.86,1.0,0.0,0.0,0.0,9858.33,899.0,1000.0,3500,4194.33,8.0,15.286,Fortnightly,34.0,10158.85,3500.0,Full-Time Employment,3.0,0.0,0.2418,1.0,5764.3,1567.0,3130.0133,524.3,MoneySpot,-0.02,4493281,0.0,17-01-2023,False,Travel Expenses,2023-01-17,Green,0.0,17231.0,10158.85
0062x00000FW8bXAAT,0012x00000TJL2kAAH,Greenslopes,QLD,Australia,Loan Paid,Existing Client-Granted Loan Before,0.0,94.15,3135.4722,4.0,0.0,0.0,3.0,4.0,982.4966,0.0,33.0,0.0,170.8366,129.73,0.0,0.0,0.0,1.0,193323.0,400.0,600.0,3500,4212.85,16.0,16.286,Weekly,31.0,5467.71,5000.0,Full-Time Employment,0.0,0.0,0.0549,0.0,0.0,0.0,4058.54,263.31,MoneySpot,0.0,7648005,0.0,27-12-2023,False,Other Expenses,2023-12-26,Orange,0.0,6016.0,5467.71
0062x00000EDnstAAD,0012x00000iHUf1AAG,Mooroolbark,VIC,Australia,Closed Lost,Existing Client-No Loan Granted Ever,1.12,18.46,319.3766,4.0,0.0,0.0,1.0,4.0,4669.0566,6.0,0.0,0.0,1056.8855,723.72,0.0,0.26,0.0,0.0,5633.33,599.0,2100.0,3500,4076.42,10.0,10.571,Weekly,41.0,5203.09,3500.0,Full-Time Employment,6.0,0.0,0.022,1.0,3170.6566,0.0,319.3766,407.65,MoneySpot,,5966178,6.0,21-07-2023,False,Furniture or Appliances,2023-07-21,Orange,123.0,10939.0,5203.09
0062x00000FVcj0AAD,0010K00001ewhcxQAA,Norman Gardens,QLD,Australia,Loan Paid,Existing Client-Granted Loan Before,0.0,86.31,7342.3959,1.0,0.0,0.0,3.0,1.0,9492.8003,0.0,149.0,1792.8394,1847.6978,1863.1,1.0,2.41,0.0,0.0,3900.0,899.0,1000.0,3500,4196.81,16.0,15.857,Weekly,41.0,9609.97,3500.0,Full-Time Employment,0.0,0.0,0.1319,0.0,8622.59,3123.0,9564.2266,262.31,MoneySpot,-0.01,7606632,0.0,22-12-2023,False,Vehicle Expenses,2023-12-22,Green,0.0,9533.0,9609.97
0062x00000FjNVqAAN,0012x00000G2Zr4AAF,Caboolture South,QLD,Australia,Closed Lost,Existing Client-Granted Loan Before,0.0,20.17,2566.9951,2.0,0.0,0.0,2.0,2.0,5920.5068,0.0,3.0,684.0274,2725.0557,2690.48,0.0,0.63,0.0,0.0,1703.0,899.0,654.0,3500,4183.67,7.0,14.0,Fortnightly,48.0,5920.51,3500.0,Unemployed,0.0,0.0,0.0,0.0,6358.4633,1340.0,2518.45,597.67,MoneySpot,,8058972,0.0,2024-01-31,False,Vehicle Expenses,2024-01-30,Orange,0.0,6393.0,5920.51
0062x00000D7TpdAAF,0012x00000VcG1HAAV,Clayton South,VIC,Australia,Loan Paid,Existing Client-Granted Loan Before,0.0,90.62,0.0,4.0,0.0,0.0,1.0,4.0,3263.3094,0.0,0.0,0.0,933.4,585.0,0.0,0.0,0.0,1.0,2889.02,599.0,400.0,3500,4213.31,16.0,16.286,Weekly,23.0,2510.33,3500.0,Full-Time Employment,0.0,0.0,0.0,0.0,0.0,0.0,0.0,263.34,MoneySpot,0.0,4486056,0.0,16-01-2023,False,Vehicle Expenses,2023-01-16,Orange,0.0,2733.0,2510.33
0062x00000D89PmAAJ,0012x00000RrGRYAA3,Kununurra,WA,Australia,Closed Lost,Existing Client-Granted Loan Before,14.4,93.78,3993.8057,1.0,0.0,2.0,2.0,1.0,7088.1661,3.0,33.0,0.0,976.8358,862.0,0.0,0.0,0.0,0.0,0.0,1499.0,180.0,3500,4154.84,14.0,13.714,Weekly,48.0,8190.07,3500.0,Full-Time Employment,3.0,0.0,0.022,3.0,4185.99,1011.0,7842.32,296.78,MoneySpot,,4517122,3.0,21-01-2023,False,Other Expenses,2023-01-20,Orange,1381.0,9586.0,8190.07
0062x00000ExFhzAAF,0012x00000Mh9v2AAB,Gracemere,QLD,Australia,Loan Paid,Existing Client-Granted Loan Before,9.36,98.74,1635.3019,2.0,0.0,2.0,2.0,2.0,5733.1431,10.0,31.0,0.0,2398.9683,2336.15,1.0,0.67,0.0,0.0,3756.39,1499.0,520.0,3500,4451.93,15.0,29.143,Fortnightly,35.0,5747.14,5000.0,Full-Time Employment,24.0,0.0,0.5055,2.0,5357.5866,570.0,4349.8833,296.8,MoneySpot,0.0,6648755,0.0,26-09-2023,False,Relocation Expenses,2023-09-26,Orange,560.0,5978.0,5747.14
0062x00000DrAy5AAF,0012x00000Tsnk8AAB,Golden Square,VIC,Australia,Loan Paid,Existing Client-Granted Loan Before,0.0,82.6,975.8604,1.0,0.0,0.0,2.0,1.0,5812.683,0.0,16.0,0.0,1030.4807,995.0,0.0,4.04,0.0,1.0,4314.22,899.0,100.0,3500,4196.52,16.0,15.857,Weekly,29.0,1335.0,3500.0,Full-Time Employment,0.0,0.0,0.0,0.0,0.0,1246.0,1723.6233,262.29,MoneySpot,0.0,5149718,0.0,27-04-2023,False,Relocation Expenses,2023-04-27,Green,0.0,7130.0,1335.0
0062x00000DW2tDAAT,0012x00000dzcVvAAI,Churchill,VIC,Australia,Closed Lost,Existing Client-Granted Loan Before,0.0,43.88,219.03,3.0,0.0,0.0,3.0,3.0,4812.55,0.0,6.0,0.0,4812.37,4597.89,0.0,2.08,0.0,0.0,60000.0,400.0,0.0,3500,4197.58,3.0,12.714,Monthly,48.0,5274.79,3500.0,Full-Time Employment,0.0,0.0,0.0,0.0,4812.37,453.0,745.3733,1399.2,MoneySpot,,4893056,0.0,19-03-2023,False,Home Maintenance & Repairs,2023-03-19,Orange,0.0,5301.0,5274.79
0062x00000E63yBAAR,0012x00000Vg8WZAAZ,South Yarra,VIC,Australia,Loan Paid,Existing Client-Granted Loan Before,0.3,32.21,253.24,4.0,2.0,4.0,4.0,4.0,15887.9433,5.0,30.0,506.9589,2244.4444,2000.0,1.0,4.5,0.0,1.0,4853.33,1499.0,1000.0,3500,4378.49,26.0,25.714,Weekly,36.0,18709.71,3500.0,Full-Time Employment,5.0,0.0,0.1978,0.0,4306.4366,5157.0,6316.7033,168.41,MoneySpot,0.0,5702148,5.0,23-06-2023,False,Living Expenses,2023-06-23,Orange,96.0,31119.0,18709.71
0062x00000DFNyoAAH,0010K000020JfhDQAS,Bankstown,NSW,Australia,Loan Paid,Existing Client-Granted Loan Before,0.0,99.62,1443.4833,1.0,1.0,0.0,5.0,1.0,1385.9999,2.0,22.0,953.6489,331.4,1500.0,0.0,0.0,0.0,1.0,2946.67,400.0,400.0,3450,4235.64,10.0,19.857,Fortnightly,48.0,5923.88,3500.0,Part-Time Employment,2.0,0.0,0.1099,1.0,1691.1666,1066.0,1845.7966,423.57,MoneySpot,0.0,4664714,1.0,11-02-2023,False,Relocation Expenses,2023-02-11,Green,0.0,1462.0,5923.88
0062x00000FV6IRAA1,0012x00000TspTxAAJ,Sanctuary Point,NSW,Australia,Loan Paid,Existing Client-Granted Loan Before,0.0,73.78,9745.2908,1.0,1.0,0.0,2.0,1.0,13402.8612,17.0,143.0,732.6505,1308.0846,1228.7,0.0,0.0,0.0,1.0,11029.47,899.0,215.0,3500,4269.74,9.0,18.286,Fortnightly,40.0,13468.04,3500.0,Full-Time Employment,17.0,0.0,0.011,3.0,4352.6266,1614.0,14290.5866,474.42,QuickCash,0.0,7565073,5.0,19-12-2023,False,Furniture or Appliances,2023-12-19,Orange,0.0,14098.0,13468.04
0062x00000FJWTLAA5,0010K00001ogEgvQAE,Dee Why,NSW,Australia,Loan Paid,Existing Client-Granted Loan Before,0.0,71.35,4957.2778,1.0,0.0,0.0,5.0,1.0,6599.4859,0.0,72.0,890.7819,1518.7861,1505.23,1.0,0.0,0.0,0.0,5715.67,899.0,350.0,3150,4160.47,36.0,35.714,Weekly,58.0,7532.82,5000.0,Full-Time Employment,0.0,0.0,0.033,0.0,6581.4066,2414.0,5324.2833,115.58,MoneySpot,0.0,7328927,0.0,27-11-2023,False,Furniture or Appliances,2023-11-27,Green,0.0,7791.0,7532.82
0062x00000Drx8SAAR,0010K00001rnR7XQAU,NANUM,QLD,Australia,Loan Paid,Existing Client-Granted Loan Before,0.3,93.72,7809.6062,1.0,1.0,0.0,3.0,1.0,8861.5531,7.0,98.0,2184.3278,1509.1923,1626.0,1.0,0.21,0.0,1.0,4723.33,599.0,1600.0,3250,3922.43,16.0,15.714,Weekly,45.0,11755.13,3300.0,Full-Time Employment,7.0,0.0,0.967,4.0,2874.58,3399.0,8037.13,245.16,MoneySpot,0.0,5208440,7.0,06-05-2023,False,Furniture or Appliances,2023-05-05,Green,27.0,8877.0,11755.13
0062x00000Fi59PAAR,0012x00000VfgPjAAJ,Horn,QLD,Australia,Closed Lost,Existing Client-Granted Loan Before,0.0,74.38,2833.5165,4.0,0.0,0.0,4.0,4.0,7005.1033,2.0,42.0,0.0,2560.7887,2589.83,0.0,0.0,0.0,0.0,5447.0,599.0,420.0,3500,4205.16,8.0,15.571,Fortnightly,31.0,6882.1,3500.0,Full-Time Employment,2.0,0.0,0.1868,2.0,6828.77,1516.0,3355.04,525.65,QuickCash,,7955858,0.0,2024-01-22,False,Living Expenses,2024-01-21,Orange,0.0,8077.0,6882.1
0062x00000ELycPAAT,0012x00000TtHqxAAF,Kallangur,QLD,Australia,Closed Lost,Existing Client-Granted Loan Before,29.4,96.15,2799.7079,1.0,0.0,4.0,2.0,1.0,5950.2234,4.0,61.0,110.8036,892.5,937.5,0.0,4.49,0.0,1.0,2932.55,899.0,1200.0,3500,4143.04,14.0,13.429,Weekly,38.0,9048.68,3500.0,Full-Time Employment,4.0,0.0,0.1758,1.0,2051.3566,617.0,2873.4566,295.94,Financier-2,,6072855,4.0,01-08-2023,False,Other Expenses,2023-08-01,Orange,2051.0,6976.0,9048.68
0062x00000DWKaUAAX,0010K00001zViEeQAK,Woy Woy,NSW,Australia,Loan Paid,Existing Client-Granted Loan Before,0.0,49.86,1342.8591,1.0,0.0,0.0,1.0,1.0,3776.1805,3.0,29.0,1494.6908,806.3269,890.69,0.0,0.0,0.0,0.0,3427.67,400.0,600.0,3500,4196.82,16.0,15.857,Weekly,27.0,5518.12,3500.0,Unemployed,7.0,0.0,0.0,1.0,5039.1933,1341.0,1341.1,262.31,MoneySpot,0.0,4910402,0.0,22-03-2023,False,Vehicle Expenses,2023-03-22,Green,0.0,4844.0,5518.12
0062x00000E5RMeAAN,0010K00002COk6FQAT,Elizabeth Park,SA,Australia,Closed Lost,Existing Client-Granted Loan Before,30.76,36.48,1457.1116,1.0,0.0,2.0,3.0,1.0,5039.9448,1.0,54.0,321.2869,653.173,709.07,0.0,7.32,0.0,0.0,1757.17,599.0,400.0,3350,4056.3,16.0,16.429,Weekly,35.0,5239.29,3350.0,Part-Time Employment,1.0,0.0,0.044,0.0,4863.2466,1568.0,2953.69,253.52,MoneySpot,,5653768,1.0,19-06-2023,False,Vehicle Expenses,2023-06-19,Green,2166.0,7040.0,5239.29
0062x00000FufEXAAZ,0012x00000g9htAAAQ,Morayfield,QLD,Australia,Closed Lost,Existing Client-Granted Loan Before,19.32,79.59,566.36,1.0,1.0,4.0,2.0,1.0,4146.5466,6.0,37.0,110.3025,760.8561,795.91,1.0,0.0,0.0,0.0,3656.7,899.0,1520.0,3350,4106.86,20.0,19.857,Weekly,26.0,4146.55,5000.0,Full-Time Employment,6.0,0.0,0.033,2.0,4110.49,541.0,1484.0366,205.35,MoneySpot,,8260891,4.0,2024-02-25,False,Vehicle Expenses,2024-02-21,Green,813.0,4208.0,4146.55
0062x00000FVTi3AAH,0012x00000cik2JAAQ,Blairgowrie,VIC,Australia,Loan Paid,Existing Client-Granted Loan Before,0.0,62.48,434.5238,2.0,0.0,0.0,1.0,2.0,17955.9867,3.0,60.0,1842.0921,5112.5,10000.0,0.0,0.5,1.0,1.0,0.0,599.0,100.0,3500,4202.25,16.0,16.0,Weekly,24.0,24254.33,3500.0,,3.0,0.0,0.0549,0.0,5565.7666,1012.0,4593.39,262.65,MoneySpot,0.0,7595065,3.0,21-12-2023,False,Travel Expenses,2023-12-21,Green,0.0,30814.0,24254.33
0062x00000DHTD7AAP,0012x00000MjJbrAAF,Rochedale South,NSW,Australia,Loan Paid,Existing Client-Granted Loan Before,0.22,75.16,4724.218,1.0,0.0,0.0,3.0,1.0,5211.0943,0.0,88.0,864.0,1127.31,1127.31,1.0,2.68,0.0,0.0,4308.18,899.0,890.0,3100,3837.42,20.0,20.0,Weekly,59.0,10032.98,3150.0,Full-Time Employment,0.0,0.0,0.2857,0.0,1503.08,1437.0,4911.59,191.88,MoneySpot,0.0,4779772,0.0,02-03-2023,False,Home Maintenance & Repairs,2023-03-01,Green,13.0,5678.0,10032.98
0062x00000DstlUAAR,0012x00000G0fFRAAZ,Wantirna South,VIC,Australia,Closed Lost,Existing Client-Granted Loan Before,0.0,61.59,0.0,2.0,0.0,0.0,4.0,2.0,4598.3098,2.0,34.0,1386.6871,2116.4816,2028.29,1.0,0.0,0.0,1.0,3900.0,1499.0,450.0,3200,4019.88,12.0,23.571,Fortnightly,29.0,5684.31,5000.0,Full-Time Employment,2.0,0.0,0.2088,0.0,0.0,2263.0,2473.3833,335.0,QuickCash,,5272472,1.0,19-05-2023,False,Life Event Expenses,2023-05-15,Green,0.0,7399.0,5684.31
0062x00000E60UrAAJ,0010K00001wUbtPQAS,Doolandella,QLD,Australia,Loan Paid,Existing Client-Granted Loan Before,5.83,75.96,5617.1735,2.0,0.0,4.0,3.0,2.0,10486.9763,1.0,57.0,0.0,2233.0533,2441.47,1.0,0.0,0.0,0.0,4565.17,599.0,1100.0,3500,4365.91,12.0,23.857,Fortnightly,36.0,10757.18,3500.0,Part-Time Employment,1.0,0.0,0.0549,0.0,9316.8566,2514.0,7606.77,363.83,MoneySpot,0.0,5699187,0.0,23-06-2023,False,Living Expenses,2023-06-23,Orange,699.0,11975.0,10757.18
0062x00000DFSsbAAH,0012x00000SHxFvAAL,Glebe,NSW,Australia,Loan Paid,Existing Client-Granted Loan Before,0.08,34.7,2052.5394,1.0,0.0,0.0,2.0,1.0,5551.2814,0.0,19.0,0.0,1089.61,1089.61,0.0,0.81,0.0,0.0,3508.31,599.0,1420.0,3500,4218.75,16.0,16.429,Weekly,45.0,5635.96,3500.0,Full-Time Employment,0.0,0.0,0.0,0.0,4770.6266,777.0,2201.7966,263.68,MoneySpot,0.0,4669957,0.0,13-02-2023,False,Living Expenses,2023-02-12,Green,13.0,14724.0,5635.96
0062x00000DZRKiAAP,0012x00000IPfIdAAL,Griffith,NSW,Australia,Loan Paid,Existing Client-Granted Loan Before,0.0,55.57,717.7816,0.0,0.0,0.0,0.0,0.0,0.0,1.0,11.0,745.1576,0.0,0.0,0.0,0.0,0.0,0.0,2840.79,400.0,350.0,3150,3961.38,24.0,24.0,Weekly,23.0,3482.29,5000.0,Full-Time Employment,1.0,0.0,0.4396,0.0,0.0,686.0,1143.6833,165.06,QuickCash,-0.11,5093221,1.0,19-04-2023,False,Medical Expenses,2023-04-19,Green,0.0,3390.0,3482.29
0062x00000DshNgAAJ,0012x00000ILmgfAAD,Prestons,NSW,Australia,Loan Paid,Existing Client-Granted Loan Before,0.0,35.71,2667.9663,2.0,0.0,0.0,2.0,2.0,5751.8371,0.0,33.0,1386.4423,2240.8466,2273.1,0.0,0.0,0.0,0.0,7841.91,599.0,0.0,3500,4473.27,15.0,30.714,Fortnightly,50.0,5756.84,5000.0,Full-Time Employment,0.0,0.0,0.0,0.0,4481.6933,2022.0,2639.3666,301.05,MoneySpot,0.0,5256018,0.0,13-05-2023,False,Travel Expenses,2023-05-12,Green,0.0,10210.0,5756.84
0062x00000D7nAvAAJ,0010K00001dRgFGQA0,Cranbourne,VIC,Australia,Loan Paid,Existing Client-Granted Loan Before,0.0,39.63,1880.078,2.0,0.0,0.0,3.0,2.0,6524.3173,0.0,27.0,2307.9866,1959.58,1627.08,1.0,0.0,0.0,0.0,11916.67,899.0,0.0,3500,4188.91,8.0,15.143,Fortnightly,49.0,6191.06,5000.0,Full-Time Employment,0.0,0.0,0.0,0.0,3919.16,2035.0,2796.68,523.62,MoneySpot,0.0,4500235,0.0,18-01-2023,False,Travel Expenses,2023-01-18,Orange,0.0,6969.0,6191.06
0062x00000ECulMAAT,0012x00000MkC1CAAV,South Gladstone,QLD,Australia,Loan Paid,Existing Client-Granted Loan Before,0.0,47.69,2457.2127,2.0,0.0,0.0,3.0,2.0,5645.4032,0.0,30.0,1141.7945,2412.83,1276.29,0.0,0.89,0.0,0.0,3144.62,599.0,300.0,3250,3910.23,8.0,14.857,Fortnightly,56.0,5645.4,3250.0,Full-Time Employment,0.0,0.0,0.0,0.0,5629.9366,1835.0,2562.36,488.78,MoneySpot,0.0,5907521,0.0,14-07-2023,False,Medical Expenses,2023-07-14,Green,0.0,7663.0,5645.4
0062x00000DY0kwAAD,0012x00000Ve2DNAAZ,Greystanes,NSW,Australia,Loan Paid,Existing Client-Granted Loan Before,0.0,80.82,1699.34,1.0,0.0,0.0,3.0,1.0,7260.9847,3.0,67.0,925.6782,1242.959,1335.4,3.0,0.0,0.0,0.0,5494.67,899.0,600.0,3400,4094.23,16.0,16.0,Weekly,40.0,6417.55,3400.0,Full-Time Employment,3.0,0.0,0.3077,0.0,4953.36,1650.0,3206.9533,255.89,MoneySpot,0.0,5007823,2.0,06-04-2023,False,Home Maintenance & Repairs,2023-04-06,Orange,0.0,7007.0,6417.55
0062x00000ECVwdAAH,0012x00000g7h6QAAQ,Marsden Park,NSW,Australia,Loan Paid,Existing Client-Granted Loan Before,0.0,72.05,2401.8901,1.0,0.0,0.0,4.0,1.0,9356.5441,0.0,34.0,0.0,1853.3423,1970.15,0.0,32.08,0.0,0.0,7448.0,599.0,1000.0,3300,3966.14,16.0,16.429,Weekly,33.0,9356.54,3300.0,Full-Time Employment,0.0,0.0,0.0,0.0,8031.15,1278.0,3251.9266,250.13,MoneySpot,0.0,5883417,0.0,11-07-2023,False,Veterinary Expenses,2023-07-11,Green,0.0,9931.0,9356.54
0062x00000E5uLUAAZ,0012x00000clueeAAA,Carlisle,WA,Australia,Loan Paid,Existing Client-Granted Loan Before,0.0,80.31,4077.1588,4.0,0.0,0.0,2.0,4.0,9181.9899,1.0,64.0,385.7193,3359.4962,4027.88,1.0,0.54,0.0,0.0,4463.95,599.0,1800.0,3500,4215.84,8.0,15.857,Fortnightly,39.0,9355.32,3500.0,Full-Time Employment,1.0,0.0,0.0,1.0,8958.6566,1044.0,4809.6233,526.99,MoneySpot,-0.35,5689855,1.0,22-06-2023,False,Travel Expenses,2023-06-22,Green,0.0,14251.0,9355.32
0062x00000DGbpJAAT,0012x00000NRj9hAAD,Kelvin Grove,QLD,Australia,Loan Paid,Existing Client-Granted Loan Before,0.0,33.74,3528.7293,3.0,0.0,0.0,5.0,3.0,6997.7966,3.0,13.0,0.0,6967.81,7236.53,0.0,8.09,0.0,0.0,1250.0,599.0,100.0,3500,4188.89,8.0,15.143,Fortnightly,47.0,12806.81,4500.0,Full-Time Employment,3.0,0.0,0.0659,3.0,12442.3766,332.0,3463.0,523.62,MoneySpot,0.0,4731495,1.0,22-02-2023,False,Home Maintenance & Repairs,2023-02-22,Orange,0.0,6998.0,12806.81
0062x00000DtF8rAAF,0012x00000MgfJbAAJ,Blayney,NSW,Australia,Loan Paid,Existing Client-Granted Loan Before,0.0,83.7,3107.5531,2.0,0.0,0.0,3.0,2.0,5449.4207,0.0,35.0,0.0,1645.8757,1650.47,2.0,0.0,0.0,0.0,4383.55,400.0,800.0,3500,4226.8,8.0,16.143,Fortnightly,41.0,6153.76,3500.0,Full-Time Employment,0.0,0.0,0.011,0.0,4741.0666,841.0,3241.58,528.36,MoneySpot,0.0,5298673,0.0,17-05-2023,False,Vehicle Expenses,2023-05-17,Green,0.0,6591.0,6153.76
0062x00000FunDMAAZ,0012x00000KKarAAAT,Wee Waa,NSW,Australia,Closed Lost,Existing Client-Granted Loan Before,0.0,36.67,1929.7161,2.0,0.0,0.0,4.0,2.0,6266.1679,0.0,9.0,0.0,2884.155,2884.15,0.0,16.04,0.0,0.0,8885.41,1499.0,460.0,3500,4146.68,7.0,13.0,Fortnightly,43.0,6266.17,3500.0,Full-Time Employment,1.0,0.0,0.0,0.0,5768.31,1575.0,2783.21,592.39,MoneySpot,,8269567,1.0,2024-02-27,False,Home Maintenance & Repairs,2024-02-22,Orange,0.0,5847.0,6266.17
0062x00000D7IO0AAN,0012x00000OJzodAAD,Werribee,VIC,Australia,Loan Paid,Existing Client-Granted Loan Before,0.0,46.81,1938.734,2.0,0.0,0.0,3.0,2.0,4596.959,1.0,21.0,820.9241,2115.8614,2201.34,0.0,0.72,0.0,0.0,4116.67,400.0,700.0,3200,3886.66,8.0,15.714,Fortnightly,53.0,5046.96,3200.0,Full-Time Employment,1.0,0.0,0.1978,0.0,4937.01,882.0,2386.8966,485.84,MoneySpot,0.0,4476798,0.0,14-01-2023,False,Home Maintenance & Repairs,2023-01-14,Orange,0.0,5535.0,5046.96
0062x00000DVxmhAAD,0012x00000Mh2ODAAZ,Brisbane City,QLD,Australia,Loan Paid,Existing Client-Granted Loan Before,0.0,51.46,5892.0518,2.0,0.0,0.0,3.0,2.0,8525.5391,0.0,42.0,674.3927,2589.5814,2235.01,0.0,2.09,0.0,0.0,5416.67,599.0,3080.0,3100,3913.24,12.0,23.714,Fortnightly,32.0,8525.54,5000.0,Full-Time Employment,0.0,0.0,0.7143,0.0,9156.1966,1304.0,6337.5133,326.11,MoneySpot,0.0,4886243,0.0,18-03-2023,False,Home Maintenance & Repairs,2023-03-18,Green,0.0,12848.0,8525.54
0062x00000FJ3ciAAD,0012x00000XO5NBAA1,Saint Marys,NSW,Australia,Loan Paid,Existing Client-Granted Loan Before,0.0,55.94,4638.8033,4.0,0.0,0.0,3.0,4.0,10657.4133,3.0,0.0,2961.9914,1208.5476,1352.52,0.0,0.05,0.0,1.0,9913.93,1500.0,160.0,3500,4276.59,20.0,20.0,Weekly,46.0,11474.08,3500.0,Full-Time Employment,3.0,0.0,0.0,1.0,0.0,3699.0,4895.4733,213.84,MoneySpot,-0.07,7295717,1.0,23-11-2023,False,Furniture or Appliances,2023-11-23,Orange,0.0,12264.0,11474.08
0062x00000FV7kDAAT,0012x00000hX8CJAA0,Robinvale,VIC,Australia,Loan Paid,Existing Client-Granted Loan Before,0.0,67.74,3448.1218,4.0,1.0,0.0,2.0,4.0,10241.9543,2.0,50.0,80.5952,334.9329,100.0,0.0,0.0,0.0,1.0,5200.0,400.0,400.0,3500,4213.15,16.0,16.286,Weekly,32.0,13525.29,5000.0,Casual Employment,2.0,0.0,0.0,0.0,4869.65,4159.0,8424.4866,263.33,MoneySpot,0.0,7566574,1.0,19-12-2023,False,Living Expenses,2023-12-19,Orange,0.0,14950.0,13525.29
0062x00000DFsCXAA1,0012x00000INiTSAA1,Bolwarra Heights,NSW,Australia,Loan Paid,Existing Client-Granted Loan Before,0.0,59.78,4786.9291,2.0,0.0,0.0,3.0,2.0,7545.2336,0.0,0.0,1370.3195,2666.2071,2629.76,0.0,17.62,0.0,1.0,3726.81,1499.0,2700.0,3200,3896.9,8.0,16.0,Fortnightly,51.0,7545.23,3200.0,Full-Time Employment,0.0,0.0,0.2088,0.0,0.0,1366.0,4853.4633,487.12,MoneySpot,-0.27,4690093,0.0,16-02-2023,False,Travel Expenses,2023-02-15,Orange,0.0,10679.0,7545.23
0062x00000E3qjiAAB,0012x00000dx2DkAAI,Pennington,SA,Australia,Loan Paid,Existing Client-Granted Loan Before,0.0,71.6,1154.9866,1.0,0.0,0.0,5.0,1.0,10000.9187,1.0,31.0,1053.9253,1076.923,1250.0,0.0,0.0,0.0,1.0,3825.0,400.0,0.0,3500,4185.76,16.0,16.571,Weekly,26.0,10705.92,3500.0,Full-Time Employment,1.0,0.0,0.022,1.0,0.0,1155.0,1409.3766,263.98,MoneySpot,-0.04,5520612,0.0,06-06-2023,False,Vehicle Expenses,2023-06-06,Green,0.0,13623.0,10705.92
0062x00000D7qjAAAR,0012x00000KMuLMAA1,Manly Vale,NSW,Australia,Loan Paid,Existing Client-Granted Loan Before,0.0,23.44,3418.6385,3.0,0.0,0.0,5.0,3.0,11514.3533,0.0,41.0,2870.2052,11416.13,11416.13,3.0,0.06,0.0,0.0,10900.0,1499.0,2400.0,3500,4190.72,3.0,12.429,Monthly,50.0,21031.02,3500.0,Full-Time Employment,0.0,0.0,0.0,0.0,11416.13,2659.0,9160.6666,1396.91,MoneySpot,0.0,4502563,0.0,21-01-2023,False,Child Expenses,2023-01-20,Green,0.0,35343.0,21031.02
0062x00000DtCglAAF,0010K00001oBkm0QAC,Beaconsfield,VIC,Australia,Loan Paid,Existing Client-Granted Loan Before,0.0,96.03,3480.9599,4.0,0.0,0.0,5.0,4.0,7291.3033,0.0,29.0,3203.0196,4788.6375,5363.87,0.0,27.16,0.0,0.0,3907.0,1499.0,0.0,3500,4312.96,4.0,18.0,Monthly,37.0,7296.3,3500.0,Full-Time Employment,0.0,0.0,0.1758,0.0,6384.85,3091.0,4511.6266,1078.25,MoneySpot,2.93,5296428,0.0,17-05-2023,False,Travel Expenses,2023-05-17,Green,0.0,7699.0,7296.3
0062x00000D6yotAAB,0012x00000OwQpYAAV,Brisbane City,QLD,Australia,Loan Paid,Existing Client-Granted Loan Before,0.0,67.46,2816.1888,1.0,0.0,0.0,1.0,1.0,4458.1313,0.0,13.0,1113.9576,963.0769,938.8,0.0,0.2,0.0,0.0,700.0,400.0,110.0,3500,4191.45,16.0,15.714,Weekly,27.0,4324.8,3500.0,Casual Employment,0.0,0.0,0.0659,0.0,4173.3333,1233.0,3166.34,261.97,MoneySpot,2.32,4462273,0.0,12-01-2023,False,Vehicle Expenses,2023-01-11,Green,0.0,8443.0,4324.8
0062x00000FWXsRAAX,0012x00000gAUHiAAO,Bucca,QLD,Australia,Loan Paid,Existing Client-Granted Loan Before,5.0,18.43,1064.6283,2.0,0.0,2.0,2.0,2.0,8425.9549,0.0,12.0,0.0,3683.2283,3435.55,0.0,0.2,0.0,0.0,0.0,400.0,200.0,3500,4166.75,8.0,16.571,Fortnightly,42.0,8942.62,3500.0,Full-Time Employment,0.0,0.0,0.1648,0.0,7756.4966,665.0,1007.27,530.34,MoneySpot,0.02,7681522,0.0,30-12-2023,False,Other Expenses,2023-12-29,Green,415.0,8298.0,8942.62
0062x00000DXgmrAAD,0010K000021WDCkQAO,Balaclava,VIC,Australia,Loan Paid,Existing Client-Granted Loan Before,0.05,44.28,4116.5249,2.0,1.0,0.0,2.0,2.0,20497.703,2.0,22.0,352.0,4449.0257,4449.02,1.0,0.0,0.0,0.0,5687.5,1500.0,700.0,3400,4086.17,8.0,15.286,Fortnightly,35.0,21689.37,3400.0,Full-Time Employment,2.0,0.0,0.1429,1.0,10381.06,1626.0,5283.0533,510.78,MoneySpot,0.0,4989681,2.0,03-04-2023,False,Life Event Expenses,2023-04-03,Green,26.0,44089.0,21689.37
0062x00000E7KYMAA3,0010K000021VzIzQAK,Mill Park,VIC,Australia,Loan Paid,Existing Client-Granted Loan Before,0.67,55.72,3245.137,1.0,0.0,4.0,4.0,1.0,7869.7455,23.0,97.0,956.9155,1784.6346,1357.0,1.0,0.51,0.0,1.0,0.0,599.0,500.0,3500,4373.8,24.0,24.571,Weekly,32.0,7880.75,3500.0,,23.0,0.0,0.7692,5.0,39.75,1814.0,3237.7433,182.25,Financier-2,0.0,5812371,18.0,03-07-2023,False,Other Expenses,2023-07-03,Orange,53.0,7862.0,7880.75
0062x00000DAiaVAAT,0012x00000IMRTVAA5,Wonnona,NSW,Australia,Loan Paid,Existing Client-Granted Loan Before,0.0,64.03,1352.1168,1.0,0.0,0.0,3.0,1.0,10156.7533,4.0,36.0,598.322,1084.6558,1033.2,1.0,55.64,0.0,0.0,3776.5,400.0,50.0,3500,4207.7,16.0,16.143,Weekly,41.0,10446.87,3500.0,Full-Time Employment,4.0,0.0,0.0,1.0,4338.6233,440.0,1245.5733,262.99,MoneySpot,0.0,4642226,4.0,08-02-2023,False,Life Event Expenses,2023-02-08,Green,0.0,10461.0,10446.87
0062x00000ELoMXAA1,0012x00000KM6rNAAT,Ambarvale,NSW,Australia,Loan Paid,Existing Client-Granted Loan Before,3.7,24.39,863.8946,2.0,0.0,2.0,3.0,2.0,5052.8561,3.0,7.0,0.0,2205.4671,2361.01,0.0,0.0,0.0,1.0,3756.88,400.0,400.0,3500,4462.94,15.0,29.429,Fortnightly,59.0,5052.86,3500.0,Full-Time Employment,3.0,0.0,0.022,1.0,240.4666,1049.0,1321.01,297.53,QuickCash,0.0,6061737,0.0,31-07-2023,False,Living Expenses,2023-07-31,Orange,240.0,6483.0,5052.86
0062x00000DtqSUAAZ,0012x00000dAq4wAAC,Lalor,VIC,Australia,Loan Paid,Existing Client-Granted Loan Before,0.0,88.11,1455.9106,1.0,0.0,0.0,4.0,1.0,5424.3714,6.0,41.0,1063.918,1002.1969,1450.75,0.0,0.0,0.0,0.0,0.0,599.0,200.0,3150,3946.01,24.0,24.571,Weekly,37.0,5470.54,4000.0,Part-Time Employment,6.0,0.0,0.0,3.0,4342.8533,1244.0,3037.69,165.91,MoneySpot,0.0,5352037,6.0,22-05-2023,False,Vehicle Expenses,2023-05-22,Green,0.0,8091.0,5470.54
0062x00000DYol3AAD,0012x000002aR8VAAU,Park Ridge,QLD,Australia,Loan Paid,Existing Client-Granted Loan Before,0.0,49.66,1208.6234,1.0,0.0,0.0,3.0,1.0,5762.0813,0.0,29.0,716.9339,1247.8209,1088.08,0.0,0.12,0.0,0.0,3972.7,1499.0,450.0,3250,4073.01,24.0,24.0,Weekly,33.0,7809.75,3500.0,Full-Time Employment,0.0,0.0,0.0549,0.0,4575.3433,1106.0,4202.8133,169.71,MoneySpot,0.0,5054724,0.0,13-04-2023,False,Vehicle Expenses,2023-04-13,Green,0.0,7760.0,7809.75
0062x00000F1jpEAAR,0012x00000gnlTkAAI,Redbank Plains,QLD,Australia,Loan Paid,Existing Client-Granted Loan Before,0.0,67.05,986.2732,4.0,0.0,0.0,3.0,4.0,4345.2699,2.0,8.0,0.0,1586.0987,1803.31,0.0,0.06,0.0,0.0,3737.24,400.0,0.0,3500,4354.78,12.0,23.571,Fortnightly,23.0,4953.41,3500.0,Full-Time Employment,2.0,0.0,0.011,0.0,4229.5966,809.0,4838.15,362.9,MoneySpot,0.0,6917325,0.0,22-10-2023,False,Living Expenses,2023-10-22,Green,0.0,6262.0,4953.41
0062x00000Ebd5xAAB,0012x00000SIPslAAH,Coolgardie,WA,Australia,Loan Paid,Existing Client-Granted Loan Before,0.0,54.22,5546.9504,2.0,0.0,0.0,3.0,2.0,7531.1607,28.0,83.0,945.4653,2403.7,2467.74,1.0,1.41,0.0,1.0,4881.36,1500.0,1990.0,3500,4452.13,15.0,29.143,Fortnightly,56.0,7538.16,5000.0,Full-Time Employment,28.0,0.0,0.3626,2.0,1177.2333,2459.0,7070.28,296.81,MoneySpot,0.0,6302792,9.0,23-08-2023,False,Home Maintenance & Repairs,2023-08-23,Orange,0.0,11364.0,7538.16
0062x00000ED9JBAA1,0010K00001wUBScQAO,ALLENBY DRIVE,QLD,Australia,Loan Paid,Existing Client-Granted Loan Before,0.0,76.96,5809.1948,1.0,0.0,0.0,2.0,1.0,6778.6325,4.0,97.0,213.4033,1423.85,1424.93,1.0,14.84,0.0,0.0,2946.67,400.0,500.0,3500,4293.22,20.0,20.429,Weekly,39.0,6186.97,5000.0,Full-Time Employment,4.0,0.0,0.0,3.0,6170.0166,1893.0,6308.1566,214.67,QuickCash,0.0,5924017,1.0,16-07-2023,False,Vehicle Expenses,2023-07-17,Orange,0.0,6838.0,6186.97
0062x00000DAS2vAAH,0012x00000Ownc6AAB,Yanchep,WA,Australia,Closed Lost,Existing Client-Granted Loan Before,0.0,56.8,850.7433,2.0,0.0,0.0,3.0,2.0,3005.9588,0.0,146.0,1281.0833,594.854,724.71,0.0,0.0,0.0,0.0,2166.67,599.0,0.0,3350,4251.26,12.0,26.286,Fortnightly,30.0,3005.96,3500.0,Part-Time Employment,0.0,0.0,0.011,0.0,991.4233,943.0,1450.4733,327.03,MoneySpot,,4630132,0.0,07-02-2023,False,Medical Expenses,2023-02-06,Green,0.0,2955.0,3005.96
0062x00000DYy0EAAT,0012x00000dc4coAAA,Arundel,QLD,Australia,Loan Paid,Existing Client-Granted Loan Before,0.0,86.62,875.495,4.0,1.0,0.0,2.0,4.0,4154.3199,10.0,89.0,936.0512,1352.5511,1350.02,0.0,0.0,0.0,0.0,6744.26,599.0,350.0,3150,3951.24,24.0,23.714,Weekly,64.0,4154.32,4250.0,Full-Time Employment,10.0,0.0,0.1099,3.0,4057.6533,933.0,3698.9433,164.64,MoneySpot,0.0,5062605,10.0,14-04-2023,False,Other Expenses,2023-04-14,Green,0.0,5923.0,4154.32
0062x00000DImHMAA1,0012x00000ZvKzeAAF,Mareeba,QLD,Australia,Loan Paid,Existing Client-Granted Loan Before,0.0,95.89,2544.6866,4.0,0.0,0.0,5.0,4.0,7613.6999,3.0,7.0,670.745,1647.0125,2262.0,1.0,0.39,0.0,0.0,3050.9,400.0,350.0,3500,4321.3,12.0,22.714,Fortnightly,33.0,7864.85,5000.0,Part-Time Employment,3.0,0.0,0.0,2.0,4392.0333,2324.0,3637.8066,360.11,MoneySpot,0.0,4854666,0.0,13-03-2023,False,Vehicle Expenses,2023-03-13,Orange,0.0,8471.0,7864.85
0062x00000Ex7zbAAB,0012x00000hXlCwAAK,Bonnet Bay,NSW,Australia,Loan Paid,Existing Client-Granted Loan Before,0.09,40.43,2718.8522,2.0,0.0,0.0,1.0,2.0,11893.1795,0.0,123.0,0.0,3181.8266,2373.21,0.0,0.06,0.0,0.0,0.0,899.0,0.0,3250,3955.66,8.0,16.143,Fortnightly,47.0,11893.18,3250.0,Full-Time Employment,0.0,0.0,0.0989,0.0,11343.9366,458.0,4649.4333,494.46,MoneySpot,0.0,6639166,0.0,26-09-2023,False,Other Expenses,2023-09-26,Green,14.0,15202.0,11893.18
0062x00000EESX4AAP,0012x000002cvsEAAQ,Inala,QLD,Australia,Loan Paid,Existing Client-Granted Loan Before,41.54,66.46,4144.4276,1.0,0.0,4.0,2.0,1.0,8852.1932,0.0,85.0,1797.8313,1171.2384,770.0,0.0,0.07,0.0,0.0,3900.0,599.0,1100.0,3500,4351.67,24.0,24.0,Weekly,38.0,8852.19,3500.0,Full-Time Employment,0.0,0.0,0.1538,0.0,8806.27,3658.0,4574.18,181.32,MoneySpot,0.0,6015088,0.0,26-07-2023,False,Other Expenses,2023-07-26,Green,3731.0,8981.0,8852.19
0062x00000DsrkHAAR,0012x00000fnVATAA2,Campsie,NSW,Australia,Closed Lost,Existing Client-Granted Loan Before,0.0,38.31,2344.1869,4.0,0.0,0.0,7.0,4.0,2769.9399,0.0,12.0,855.4688,433.3366,376.69,0.0,0.0,0.0,1.0,5633.33,599.0,800.0,3150,4747.07,16.0,32.429,Fortnightly,41.0,3621.96,4000.0,Full-Time Employment,0.0,0.0,0.6813,0.0,0.0,1560.0,3601.93,296.7,MoneySpot,,5271432,0.0,15-05-2023,False,Living Expenses,2023-05-14,Green,0.0,11005.0,3621.96
0062x00000EEc5nAAD,0012x00000hWla2AAC,Gulliver,QLD,Australia,Loan Paid,Existing Client-Granted Loan Before,0.0,76.7,2218.1067,2.0,0.0,0.0,2.0,2.0,3992.7079,0.0,7.0,0.0,1539.4828,1645.1,0.0,0.26,0.0,0.0,0.0,599.0,450.0,3500,4480.6,15.0,29.857,Fortnightly,32.0,4000.71,3500.0,,0.0,0.0,0.033,0.0,4240.1266,975.0,2255.28,298.71,MoneySpot,0.0,6025445,0.0,27-07-2023,False,Life Event Expenses,2023-07-27,Orange,0.0,4906.0,4000.71
0062x00000DW6soAAD,0010K000021WjyvQAC,Kelmscott,WA,Australia,Closed Lost,Existing Client-Granted Loan Before,0.0,58.94,3675.4731,2.0,0.0,0.0,4.0,2.0,4658.9229,0.0,58.0,1601.7556,1743.33,2161.84,0.0,1.68,0.0,1.0,3683.33,1499.0,400.0,3100,3908.15,12.0,23.571,Fortnightly,49.0,4663.92,5000.0,Part-Time Employment,0.0,0.0,0.0,0.0,0.0,1649.0,4820.8533,325.69,MoneySpot,,4896933,0.0,24-03-2023,False,Home Maintenance & Repairs,2023-03-20,Green,0.0,6023.0,4663.92
0062x00000EMrXxAAL,0012x00000SFaTTAA1,Hebersham,NSW,Australia,Loan Paid,Existing Client-Granted Loan Before,0.0,50.1,2984.2681,1.0,0.0,0.0,1.0,1.0,7637.479,1.0,58.0,711.9238,1757.6666,1663.0,2.0,0.0,0.0,0.0,2275.71,599.0,1520.0,3200,3883.72,16.0,16.143,Weekly,27.0,7827.31,3200.0,Full-Time Employment,1.0,0.0,0.0,1.0,7030.6666,1372.0,2905.5033,242.74,MoneySpot,-0.15,6133799,1.0,07-08-2023,False,Other Expenses,2023-08-07,Green,0.0,8061.0,7827.31
0062x00000FUoTEAA1,0012x00000hZ1Y6AAK,Railton,TAS,Australia,Loan Paid,Existing Client-Granted Loan Before,0.0,57.15,1087.6915,1.0,0.0,0.0,3.0,1.0,8735.0709,0.0,36.0,0.0,1177.0138,1127.55,1.0,0.02,0.0,0.0,4550.0,400.0,440.0,3500,4241.64,19.0,19.571,Weekly,25.0,8735.07,3500.0,Full-Time Employment,0.0,0.0,0.1648,0.0,5100.3933,4432.0,5576.3233,225.27,MoneySpot,0.0,7542232,0.0,17-12-2023,False,Living Expenses,2023-12-17,Green,0.0,10071.0,8735.07
0062x00000E5Hp4AAF,0012x00000dxbCGAAY,Gatton,QLD,Australia,Loan Paid,Existing Client-Granted Loan Before,0.0,36.93,1087.5202,1.0,0.0,0.0,4.0,1.0,2803.6592,1.0,38.0,198.0,737.4008,828.43,0.0,0.0,0.0,0.0,4073.33,400.0,150.0,3500,4196.81,16.0,15.857,Weekly,35.0,3138.66,3500.0,Full-Time Employment,1.0,0.0,0.6264,1.0,2949.6033,1086.0,1085.5666,262.31,MoneySpot,0.0,5639439,0.0,17-06-2023,False,Home Maintenance & Repairs,2023-06-17,Green,0.0,3557.0,3138.66
0062x00000DrqzjAAB,0012x00000BHv3WAAT,South Bathurst,NSW,Australia,Loan Paid,Existing Client-Granted Loan Before,0.0,89.84,3434.3408,2.0,0.0,0.0,3.0,2.0,3087.5836,2.0,14.0,1000.7518,1421.1357,1468.75,1.0,0.0,0.0,0.0,2600.0,599.0,700.0,3400,4143.58,9.0,17.857,Fortnightly,52.0,3087.58,3500.0,Full-Time Employment,2.0,0.0,0.0659,1.0,3315.9833,1075.0,3438.5666,460.4,MoneySpot,0.0,5198627,2.0,05-05-2023,False,Vehicle Expenses,2023-05-04,Green,0.0,3365.0,3087.58
0062x00000E4E7IAAV,0012x00000fnrxcAAA,Glen Waverley,VIC,Australia,Closed Lost,Existing Client-Granted Loan Before,0.0,54.71,3889.1445,2.0,0.0,0.0,4.0,2.0,9502.1255,3.0,37.0,1303.8319,1798.4285,1747.37,1.0,0.0,0.0,0.0,3394.0,1499.0,400.0,3500,4215.78,8.0,15.857,Fortnightly,59.0,9889.44,3500.0,Full-Time Employment,3.0,0.0,0.022,0.0,5623.26,2180.0,4303.2933,526.98,QuickCash,,5551449,3.0,09-06-2023,False,Veterinary Expenses,2023-06-08,Green,0.0,10200.0,9889.44
0062x00000EysHfAAJ,0012800001NF5u5AAD,Heckenberg,NSW,Australia,Closed Lost,Existing Client-No Loan Granted Ever,0.0,85.12,259.7619,4.0,0.0,0.0,1.0,4.0,5178.12,0.0,0.0,0.0,3433.59,1351.65,2.0,2.11,0.0,1.0,3900.0,599.0,1120.0,3200,3745.65,5.0,10.571,Fortnightly,40.0,7271.66,3200.0,Part-Time Employment,0.0,0.0,0.0,0.0,2088.5366,175.0,1598.5266,749.13,MoneySpot,,6768912,0.0,08-10-2023,False,Life Event Expenses,2023-10-07,Orange,0.0,9214.0,7271.66
0062x00000F2Xk6AAF,0012x00000haRGjAAM,Bundaberg South,QLD,Australia,Loan Paid,Existing Client-Granted Loan Before,0.0,72.76,718.2439,2.0,0.0,0.0,5.0,2.0,5443.963,0.0,12.0,108.9568,2505.714,2890.0,0.0,0.0,0.0,0.0,0.0,400.0,770.0,3250,3914.91,8.0,15.0,Fortnightly,43.0,5453.66,3250.0,Part-Time Employment,0.0,0.0,0.022,0.0,4176.19,761.0,761.4533,489.37,MoneySpot,0.0,6977451,0.0,28-10-2023,False,Other Expenses,2023-10-27,Green,0.0,5653.0,5453.66
0062x00000DVQNAAA5,0010K00001y278AQAQ,Belmore,NSW,Australia,Loan Paid,Existing Client-Granted Loan Before,0.0,89.24,1903.5488,1.0,0.0,0.0,2.0,1.0,5828.3149,1.0,77.0,960.3991,916.7084,854.05,0.0,0.33,0.0,0.0,3467.0,599.0,480.0,3500,4276.01,20.0,20.0,Weekly,30.0,5828.31,5000.0,Full-Time Employment,1.0,0.0,0.0,0.0,3972.4033,1988.0,3782.6433,213.81,MoneySpot,0.0,5444634,1.0,31-05-2023,False,Life Event Expenses,2023-05-31,Orange,0.0,7852.0,5828.31
0062x00000F4Bq6AAF,0012x00000TJGtWAAX,Eli Waters,QLD,Australia,Loan Paid,Existing Client-Granted Loan Before,0.0,88.2,231.1979,2.0,0.0,0.0,2.0,2.0,11353.7263,3.0,29.0,0.0,2373.7771,1832.03,1.0,3.58,0.0,0.0,1726.91,1499.0,1350.0,3500,4221.17,8.0,16.0,Fortnightly,29.0,11545.39,3500.0,Full-Time Employment,3.0,0.0,0.1758,0.0,5538.8133,1849.0,2908.4933,527.65,MoneySpot,0.0,7113153,0.0,09-11-2023,False,Relocation Expenses,2023-11-09,Green,0.0,12670.0,11545.39
0062x00000FwH49AAF,0012x00000gAK3FAAW,Biggera Waters,QLD,Australia,Loan Paid,Existing Client-Granted Loan Before,0.0,98.17,550.6433,1.0,0.0,0.0,2.0,1.0,5315.5883,0.0,35.0,0.0,1190.46,1190.46,0.0,0.0,0.0,0.0,0.0,1499.0,1500.0,3250,3908.01,14.0,14.286,Weekly,44.0,11362.07,3250.0,Full-Time Employment,1.0,0.0,0.1209,0.0,1401.3933,110.0,1448.9033,279.15,MoneySpot,0.0,8368101,1.0,2024-03-05,False,Life Event Expenses,2024-03-05,Orange,0.0,5365.0,11362.07
0062x00000FJXoGAAX,0012x00000TtBy0AAF,Blacktown,NSW,Australia,Loan Paid,Existing Client-Granted Loan Before,0.0,95.08,6926.0687,2.0,0.0,0.0,1.0,2.0,6317.0304,0.0,2.0,0.0,2636.4142,2378.0,0.0,0.23,0.0,0.0,0.0,1499.0,1080.0,3250,4240.51,16.0,32.143,Fortnightly,28.0,6317.03,3250.0,,2.0,0.0,0.0,0.0,6151.6333,1172.0,7878.3433,265.04,MoneySpot,0.0,7329972,2.0,27-11-2023,False,Other Expenses,2023-11-27,Orange,0.0,13763.0,6317.03
0062x00000DH4UXAA1,0012x00000NQsoTAAT,Melbourne,VIC,Australia,Loan Paid,Existing Client-Granted Loan Before,0.0,74.76,4702.8078,4.0,1.0,0.0,3.0,4.0,8147.4833,5.0,60.0,1782.5622,3457.4914,3064.72,1.0,21.37,1.0,0.0,7817.06,599.0,1238.0,3500,4273.64,10.0,19.429,Fortnightly,37.0,8147.48,3500.0,Full-Time Employment,5.0,0.0,0.2527,3.0,8067.48,3096.0,5855.4666,427.37,MoneySpot,0.0,4760071,5.0,27-02-2023,False,Furniture or Appliances,2023-02-27,Orange,0.0,11217.0,8147.48
0062x00000E3xC3AAJ,0012x00000gqR8SAAU,Horsham,VIC,Australia,Loan Paid,Existing Client-Granted Loan Before,0.0,43.38,960.9878,1.0,0.0,0.0,2.0,1.0,3338.8834,1.0,9.0,213.34,588.6638,736.94,0.0,0.0,0.0,0.0,2816.67,400.0,2000.0,3500,4351.73,24.0,24.0,Weekly,35.0,8745.3,5000.0,Part-Time Employment,1.0,0.0,0.011,0.0,2550.8766,638.0,774.22,181.33,MoneySpot,0.0,5529457,1.0,07-06-2023,False,Vehicle Expenses,2023-06-07,Green,0.0,9757.0,8745.3
0062x00000EdodOAAR,0010K00002BRDWKQA5,Garah,NSW,Australia,Loan Paid,Existing Client-Granted Loan Before,0.0,85.59,4024.7366,2.0,2.0,0.0,3.0,2.0,5117.6074,11.0,47.0,1587.855,2355.5,2314.0,0.0,0.0,0.0,0.0,0.0,899.0,100.0,3500,4486.48,15.0,30.0,Fortnightly,52.0,5117.61,3500.0,Full-Time Employment,11.0,0.0,0.0659,2.0,4711.0,3125.0,5074.3966,299.11,MoneySpot,-0.39,6445963,11.0,07-09-2023,False,Furniture or Appliances,2023-09-06,Orange,0.0,5649.0,5117.61
0062x00000E62TCAAZ,0012x00000iK1inAAC,Secret Harbour,WA,Australia,Closed Lost,New Client-New Loan,0.0,34.28,4631.2979,2.0,0.0,0.0,2.0,2.0,9130.5419,3.0,28.0,1066.517,4202.5516,3475.94,0.0,3.44,0.0,0.0,0.0,0.0,1300.0,3500,4095.03,9.0,9.571,Weekly,48.0,9133.88,3500.0,Full-Time Employment,3.0,0.0,0.0659,1.0,8405.1033,982.0,4938.5633,455.01,MoneySpot,,5700920,0.0,23-06-2023,False,Dental repairs,2023-06-23,Orange,0.0,8731.0,9133.88
0062x00000EDKsCAAX,0010K00002CQnNuQAL,Mighell,QLD,Australia,Loan Paid,Existing Client-Granted Loan Before,50.1,61.55,1147.4288,4.0,0.0,2.0,3.0,2.0,5851.0817,0.0,17.0,0.0,887.9,887.9,0.0,8.17,0.0,0.0,5340.28,599.0,1400.0,3500,4415.59,13.0,26.143,Fortnightly,35.0,8555.39,4000.0,Full-Time Employment,0.0,0.0,0.2198,0.0,5337.1833,1513.0,1885.6133,339.67,Financier-2,-0.44,5938500,0.0,18-07-2023,True,Travel Expenses,2023-07-18,Orange,4899.0,9777.0,8555.39
0062x00000EO6ogAAD,0010K00001g9eOJQAY,Pinnaroo,SA,Australia,Loan Paid,Existing Client-Granted Loan Before,0.0,52.95,3633.309,2.0,0.0,0.0,3.0,2.0,9478.5825,1.0,35.0,868.7,3838.34,3236.63,1.0,0.05,0.0,0.0,4446.0,400.0,100.0,3500,4377.35,12.0,24.143,Fortnightly,45.0,9483.58,3500.0,Full-Time Employment,1.0,0.0,0.0659,1.0,7676.68,2942.0,4239.5166,364.79,MoneySpot,0.0,6231213,0.0,17-08-2023,False,Furniture or Appliances,2023-08-16,Green,0.0,10289.0,9483.58
0062x00000FttXQAAZ,0012x00000G1zBxAAJ,Prahran,VIC,Australia,Loan Paid,Existing Client-Granted Loan Before,0.0,88.73,5335.4297,4.0,1.0,0.0,3.0,4.0,6954.11,8.0,28.0,472.6946,5215.5825,5574.67,0.0,0.35,3.0,0.0,3444.0,899.0,1249.0,3500,4281.27,4.0,17.143,Monthly,30.0,6954.11,3500.0,Full-Time Employment,11.0,0.0,0.011,3.0,6954.11,3048.0,8088.6933,1070.32,MoneySpot,0.0,8209078,7.0,2024-02-16,False,Furniture or Appliances,2024-02-15,Green,0.0,7163.0,6954.11
0062x00000DH3YRAA1,0012x00000RrdhwAAB,St Marys,SA,Australia,Loan Paid,Existing Client-Granted Loan Before,0.0,53.66,2723.113,1.0,0.0,0.0,3.0,1.0,5281.5822,0.0,34.0,469.9375,1159.6746,1252.81,0.0,0.0,0.0,0.0,2031.78,599.0,500.0,3500,4204.26,17.0,17.571,Weekly,27.0,5382.63,3500.0,Full-Time Employment,0.0,0.0,0.0,0.0,5267.7766,469.0,3008.1766,249.55,MoneySpot,-0.32,4759435,0.0,27-02-2023,False,Vehicle Expenses,2023-02-26,Green,0.0,6044.0,5382.63
0062x00000ENmxeAAD,0012x00000VcatYAAR,South Ripley,QLD,Australia,Loan Paid,Existing Client-Granted Loan Before,0.0,93.62,2820.4704,3.0,0.0,0.0,1.0,3.0,6232.8866,1.0,18.0,0.0,6081.22,6081.22,0.0,0.0,0.0,0.0,5200.0,899.0,2200.0,3250,4102.59,5.0,22.0,Monthly,52.0,6232.89,3250.0,Contract Employment,1.0,0.0,0.022,0.0,6081.22,404.0,3389.7533,820.52,MoneySpot,0.0,6204625,0.0,15-08-2023,False,Vehicle Expenses,2023-08-14,Green,0.0,6528.0,6232.89
0062x00000GElMeAAL,0012x00000hZ1Y6AAK,Railton,TAS,Australia,Closed Lost,Existing Client-Granted Loan Before,0.0,55.35,867.2,1.0,0.0,0.0,3.0,1.0,6108.5032,0.0,36.0,309.3592,1182.1761,1348.53,0.0,9.48,0.0,0.0,4550.0,400.0,880.0,3350,4096.33,20.0,20.571,Weekly,25.0,6108.5,5000.0,Full-Time Employment,0.0,0.0,0.3846,0.0,5122.7633,1605.0,2914.09,204.82,MoneySpot,,8500770,0.0,2024-03-17,False,Living Expenses,2024-03-17,Green,0.0,6184.0,6108.5
0062x00000FH6hVAAT,0010K00001iI7RIQA0,Maddington,WA,Australia,Closed Lost,Existing Client-Granted Loan Before,0.0,94.81,8606.6025,1.0,0.0,0.0,4.0,1.0,9829.9389,8.0,111.0,2260.5573,1911.8583,1999.64,1.0,0.0,1.0,0.0,4940.0,1499.0,595.0,3500,4389.85,26.0,26.0,Weekly,45.0,16357.28,3500.0,Full-Time Employment,8.0,1.0,0.0,2.0,3823.7166,3358.0,10525.2366,168.85,MoneySpot,,7141420,1.0,10-11-2023,False,Life Event Expenses,2023-11-10,Orange,0.0,12490.0,16357.28
0062x00000F35gYAAR,0012x00000hYGE6AAO,Gledswood Hills,NSW,Australia,Loan Paid,Existing Client-Granted Loan Before,0.0,39.89,1650.0484,4.0,0.0,0.0,3.0,4.0,3531.8999,7.0,61.0,445.0393,2630.0,2730.0,0.0,0.0,0.0,0.0,0.0,899.0,620.0,3500,4206.99,16.0,16.143,Weekly,60.0,18343.09,3500.0,Full-Time Employment,7.0,0.0,0.0659,0.0,3506.6666,2485.0,2484.6466,262.94,MoneySpot,0.0,7019768,5.0,01-11-2023,False,Life Event Expenses,2023-11-01,Green,0.0,16840.0,18343.09
0062x00000D1soPAAR,0012x00000bnnytAAA,Collarenebri,NSW,Australia,Closed Lost,Existing Client-No Loan Granted Ever,0.0,46.55,1330.7008,4.0,0.0,0.0,3.0,4.0,1264.083,0.0,43.0,793.9185,320.0,250.0,0.0,0.12,0.0,1.0,0.0,899.0,1000.0,3500,4084.26,9.0,9.286,Weekly,49.0,6211.75,3500.0,,0.0,0.0,0.011,0.0,574.5,731.0,1524.3633,453.81,MoneySpot,,4416331,0.0,09-01-2023,False,Vehicle Expenses,2023-01-05,Orange,0.0,9206.0,6211.75
0062x00000EdQ02AAF,0012x00000PwYWGAA3,Forster,NSW,Australia,Closed Lost,Existing Client-Granted Loan Before,0.74,61.83,2095.6887,2.0,0.0,0.0,3.0,2.0,4293.3984,4.0,30.0,535.2787,1840.36,1826.77,1.0,0.52,0.0,0.0,700.0,599.0,150.0,3500,4463.22,15.0,29.429,Fortnightly,25.0,4293.4,2050.0,Full-Time Employment,4.0,0.0,0.0,0.0,4294.1733,1325.0,3570.2433,297.55,QuickCash,,6420185,2.0,09-09-2023,False,Vehicle Expenses,2023-09-04,Orange,40.0,5339.0,4293.4
0062x00000FHAa3AAH,0012x00000XE2kcAAD,Kununurra,WA,Australia,Loan Paid,Existing Client-Granted Loan Before,0.18,63.12,1132.1883,2.0,0.0,0.0,4.0,2.0,6219.8258,1.0,23.0,0.0,2459.3166,3010.11,0.0,0.27,0.0,0.0,4287.83,599.0,2000.0,3450,4167.09,8.0,16.0,Fortnightly,48.0,6361.49,3450.0,Part-Time Employment,1.0,0.0,0.011,1.0,4918.6333,940.0,1163.1366,520.89,QuickCash,0.0,7145307,0.0,10-11-2023,False,Living Expenses,2023-11-10,Green,14.0,7680.0,6361.49
0062x00000DFcUFAA1,0012x00000TrMqtAAF,Dulwich Hill,NSW,Australia,Loan Paid,Existing Client-Granted Loan Before,0.0,45.51,1732.0599,2.0,0.0,0.0,3.0,2.0,10171.9937,1.0,2.0,0.0,2404.0016,2619.53,0.0,0.0,0.0,0.0,9859.65,599.0,1300.0,3500,4232.56,8.0,16.286,Fortnightly,36.0,10189.72,3500.0,Full-Time Employment,1.0,0.0,0.0,0.0,6043.6766,1040.0,3219.7266,529.08,MoneySpot,0.0,4678078,0.0,14-02-2023,False,Living Expenses,2023-02-13,Green,0.0,11986.0,10189.72
0062x00000Eetf0AAB,0012x00000VfGnmAAF,Red Hill,QLD,Australia,Loan Paid,Existing Client-Granted Loan Before,0.1,89.61,4287.081,1.0,1.0,0.0,3.0,1.0,18215.7166,1.0,47.0,0.0,2685.48,4162.33,0.0,14.02,0.0,0.0,10400.0,899.0,2160.0,3500,4582.98,36.0,36.0,Weekly,36.0,18523.38,3500.0,Full-Time Employment,1.0,0.0,0.0,1.0,11637.08,762.0,4204.23,127.31,MoneySpot,0.0,6525642,1.0,14-09-2023,False,Travel Expenses,2023-09-14,Orange,25.0,24808.0,18523.38
0062x00000EMeiDAAT,0012x00000Ge1jdAAB,Redland Bay,QLD,Australia,Loan Paid,Existing Client-Granted Loan Before,3.42,67.78,1439.9688,1.0,0.0,3.0,1.0,1.0,8666.7983,0.0,56.0,0.0,1371.1538,1025.0,3.0,0.0,0.0,0.0,2500.0,899.0,1000.0,3500,4406.44,26.0,26.429,Weekly,37.0,8749.59,3500.0,Full-Time Employment,0.0,0.0,0.0,0.0,8728.27,492.0,1525.5233,169.48,QuickCash,0.21,6119612,0.0,05-08-2023,False,Life Event Expenses,2023-08-05,Green,324.0,9472.0,8749.59
0062x00000DrR24AAF,0012x000005SMXSAA4,Ball Bay,QLD,Australia,Closed Lost,Existing Client-Granted Loan Before,0.13,99.53,1407.0916,1.0,0.0,0.0,4.0,1.0,8193.2705,4.0,23.0,0.0,970.5,983.0,1.0,0.11,0.0,1.0,1191.67,599.0,480.0,3050,3697.74,16.0,15.429,Weekly,22.0,4576.22,3050.0,Self Employed,4.0,0.0,0.3187,3.0,3722.66,1000.0,2501.9533,231.11,QuickCash,,5167265,1.0,30-04-2023,False,Medical Expenses,2023-04-30,Orange,13.0,9293.0,4576.22
0062x00000Ewl3NAAR,0012x00000hX40ZAAS,Kalgoorlie,WA,Australia,Loan Paid,Existing Client-Granted Loan Before,0.0,70.43,5821.4598,2.0,0.0,0.0,4.0,2.0,4753.3493,2.0,38.0,0.0,2187.8433,2067.14,0.0,0.17,0.0,0.0,0.0,899.0,200.0,3150,4152.85,18.0,35.0,Fortnightly,36.0,7582.35,3150.0,Full-Time Employment,2.0,0.0,0.022,0.0,4375.6866,1715.0,6492.6566,230.72,MoneySpot,0.0,6611723,0.0,22-09-2023,False,Life Event Expenses,2023-09-22,Orange,0.0,12380.0,7582.35
0062x00000D1vJoAAJ,0010K00001sDwLgQAK,Ingleburn,NSW,Australia,Loan Paid,Existing Client-Granted Loan Before,9.17,62.63,5983.0076,2.0,0.0,0.0,3.0,2.0,5018.75,13.0,72.0,2301.7316,2310.0,2310.0,1.0,8.91,0.0,0.0,4636.67,599.0,710.0,3500,4189.46,7.0,14.143,Fortnightly,44.0,5018.75,3500.0,Full-Time Employment,13.0,0.0,0.4505,8.0,5390.0,2835.0,6063.4733,598.5,MoneySpot,0.0,4418105,8.0,05-01-2023,False,Home Maintenance & Repairs,2023-01-05,Green,939.0,10234.0,5018.75
0062x00000ELhkUAAT,0012x00000Oy4hEAAR,DONCASTER EAST,VIC,Australia,Loan Paid,Existing Client-Granted Loan Before,0.0,59.3,2248.5539,2.0,0.0,0.0,4.0,2.0,5692.1047,6.0,68.0,825.8581,2224.65,2330.24,0.0,0.09,0.0,0.0,1900.0,599.0,2520.0,3500,4209.88,8.0,15.714,Fortnightly,40.0,5692.1,3500.0,Full-Time Employment,6.0,0.0,0.0,0.0,5190.85,1764.0,2863.5433,526.24,MoneySpot,0.0,6056335,1.0,30-07-2023,False,Home Maintenance & Repairs,2023-07-30,Green,0.0,8010.0,5692.1
0062x00000EchMyAAJ,0010K0000260mmqQAA,WILMINGTON,SA,Australia,Loan Paid,Existing Client-Granted Loan Before,0.13,55.28,4627.6134,4.0,0.0,0.0,1.0,4.0,9223.9065,0.0,19.0,0.0,609.5238,400.0,0.0,0.0,0.0,1.0,4333.33,400.0,100.0,3200,4133.0,30.0,30.286,Weekly,46.0,9223.91,5000.0,Full-Time Employment,0.0,0.0,0.0,0.0,3746.9466,2043.0,5746.54,137.77,MoneySpot,0.0,6372789,0.0,31-08-2023,False,Living Expenses,2023-08-31,Orange,14.0,10094.0,9223.91
0062x00000Ft35qAAB,0012x000002bNJGAA2,Tweed Heads,NSW,Australia,Loan Paid,Existing Client-Granted Loan Before,0.0,56.05,8110.9027,2.0,0.0,0.0,3.0,2.0,12550.3531,0.0,119.0,1297.8357,3311.4128,3348.66,0.0,6.0,0.0,0.0,0.0,899.0,980.0,3500,4178.95,7.0,13.857,Fortnightly,63.0,12550.35,3500.0,Full-Time Employment,0.0,0.0,0.0,0.0,11894.63,5771.0,10675.7233,597.0,MoneySpot,0.0,8149341,0.0,2024-02-09,False,Living Expenses,2024-02-09,Orange,0.0,13620.0,12550.35
0062x00000FWJp8AAH,0012x00000FEzn9AAD,Loganlea,QLD,Australia,Loan Paid,Existing Client-Granted Loan Before,22.77,30.88,2468.3951,2.0,0.0,2.0,4.0,2.0,5284.6858,4.0,41.0,285.8153,1757.3014,1810.63,1.0,0.0,0.0,0.0,4049.5,599.0,1500.0,3500,4226.42,8.0,16.143,Fortnightly,36.0,5284.69,5000.0,Full-Time Employment,4.0,0.0,0.1209,2.0,5669.25,949.0,2697.57,528.31,MoneySpot,0.0,7660782,1.0,28-12-2023,False,Home Maintenance & Repairs,2023-12-28,Orange,1483.0,6511.0,5284.69
0062x00000DGutgAAD,0012800001Oii2CAAR,Redcliffe,QLD,Australia,Loan Paid,Existing Client-Granted Loan Before,0.16,42.7,3205.2827,2.0,0.0,0.0,3.0,2.0,9023.6912,0.0,18.0,0.0,2557.755,1988.3,1.0,0.56,0.0,0.0,3250.0,899.0,500.0,3050,3761.3,10.0,18.857,Fortnightly,53.0,11253.88,5000.0,Full-Time Employment,0.0,0.0,0.0,0.0,7510.6766,2464.0,5801.3333,376.14,MoneySpot,0.0,4749087,0.0,24-02-2023,False,Medical Expenses,2023-02-24,Green,23.0,13576.0,11253.88
0062x00000EbbewAAB,0012x00000gADzVAAW,Drummond Cove,WA,Australia,Loan Paid,Existing Client-Granted Loan Before,0.0,56.48,2812.1279,1.0,0.0,0.0,5.0,1.0,5561.92,0.0,27.0,102.4,1237.7923,1179.9,1.0,0.0,0.0,0.0,4655.6,599.0,600.0,3050,3898.39,26.0,26.429,Weekly,23.0,5561.92,3050.0,Full-Time Employment,0.0,0.0,0.0,0.0,5363.7666,1598.0,4522.16,149.94,MoneySpot,0.0,6301755,0.0,24-08-2023,False,Medical Expenses,2023-08-24,Green,0.0,6541.0,5561.92
0062x00000DITJYAA5,0012x00000XMTO0AAP,Hillvue,NSW,Australia,Loan Paid,Existing Client-Granted Loan Before,0.0,25.0,1665.77,1.0,0.0,0.0,2.0,1.0,4457.8271,3.0,36.0,884.881,1025.9115,1178.79,0.0,0.96,0.0,0.0,4333.33,599.0,0.0,3500,4191.3,16.0,15.714,Weekly,39.0,4457.83,4000.0,Full-Time Employment,3.0,0.0,0.6374,0.0,4445.6166,1687.0,1686.89,261.96,MoneySpot,0.0,4835326,3.0,10-03-2023,False,Other Expenses,2023-03-10,Orange,0.0,4462.0,4457.83
0062x00000F3HFEAA3,0012x00000df1yNAAQ,Thornlands,QLD,Australia,Closed Lost,Existing Client-Granted Loan Before,0.0,79.07,2675.1418,1.0,0.0,0.0,3.0,1.0,6505.3636,0.0,32.0,0.0,596.9815,619.48,0.0,0.92,0.0,0.0,1820.0,599.0,120.0,3500,4170.09,14.0,14.143,Weekly,48.0,7065.96,3500.0,Contract Employment,0.0,0.0,0.0,0.0,2893.2633,642.0,5534.68,297.87,MoneySpot,,7034561,0.0,02-11-2023,False,Vehicle Expenses,2023-11-02,Orange,0.0,7515.0,7065.96
0062x00000DXrrtAAD,0012x00000XD6xmAAD,Bateau Bay,NSW,Australia,Loan Paid,Existing Client-Granted Loan Before,0.0,82.35,4595.4057,1.0,0.0,0.0,2.0,1.0,5062.9998,0.0,29.0,0.0,865.8475,834.71,0.0,1.28,0.0,0.0,50000.0,599.0,0.0,3150,3961.08,24.0,24.0,Weekly,27.0,5087.0,5000.0,Casual Employment,0.0,0.0,0.6374,0.0,3463.39,881.0,4106.2966,165.05,MoneySpot,0.0,4998730,0.0,05-04-2023,False,Vehicle Expenses,2023-04-04,Green,0.0,5485.0,5087.0
0062x00000EEdNKAA1,0012x00000cLPR1AAO,North Lakes,QLD,Australia,Loan Paid,Existing Client-Granted Loan Before,0.0,56.18,5689.8463,2.0,0.0,0.0,2.0,2.0,6478.0291,2.0,155.0,2031.6738,2833.46,2833.46,0.0,0.12,0.0,0.0,8654.57,1499.0,100.0,3500,4327.87,11.0,21.857,Fortnightly,53.0,7591.65,3500.0,Full-Time Employment,2.0,0.0,0.6044,2.0,6611.4066,2875.0,6020.18,393.45,MoneySpot,0.0,6026543,1.0,27-07-2023,False,Travel Expenses,2023-07-27,Green,0.0,9832.0,7591.65
0062x00000FVIi4AAH,0012x000002bVCbAAM,Singleton,WA,Australia,Loan Paid,Existing Client-Granted Loan Before,1.29,49.48,10544.942,1.0,0.0,2.0,2.0,1.0,12418.2929,2.0,41.0,2163.13,1785.93,1785.93,2.0,0.07,0.0,0.0,2900.0,1499.0,1150.0,3500,4202.26,16.0,16.0,Weekly,48.0,22634.96,3500.0,Full-Time Employment,2.0,0.0,0.0,0.0,12418.8833,4003.0,17395.8333,262.65,QuickCash,0.0,7580683,1.0,20-12-2023,False,Home Maintenance & Repairs,2023-12-20,Orange,346.0,26677.0,22634.96
0062x00000D1iHDAAZ,0012x00000Ge4uWAAR,Moonah,TAS,Australia,Loan Paid,Existing Client-Granted Loan Before,40.6,53.58,2062.9799,2.0,1.0,2.0,2.0,2.0,5456.4206,7.0,30.0,927.8496,1405.2433,1511.64,0.0,0.76,0.0,0.0,331.31,599.0,0.0,3500,4183.03,8.0,15.0,Fortnightly,42.0,5686.37,3500.0,Full-Time Employment,7.0,0.0,0.0,2.0,4648.0466,1060.0,3769.2833,522.89,MoneySpot,0.0,4406437,3.0,04-01-2023,False,Medical Expenses,2023-01-03,Green,2416.0,5950.0,5686.37
0062x00000DIS8ZAAX,0012x00000dBzHdAAK,West Wodonga,VIC,Australia,Loan Paid,Existing Client-Granted Loan Before,0.2,10.59,674.3375,2.0,0.0,0.0,4.0,2.0,4624.0055,0.0,6.0,0.0,2128.31,2128.31,0.0,0.0,0.0,0.0,2128.0,899.0,600.0,3500,4221.2,8.0,16.0,Fortnightly,65.0,4624.01,3500.0,Full-Time Employment,0.0,0.0,0.0,0.0,4966.0566,692.0,691.8733,527.66,MoneySpot,0.0,4834422,0.0,10-03-2023,False,Travel Expenses,2023-03-10,Green,13.0,6350.0,4624.01
0062x00000DYnnOAAT,0012x00000XNquGAAT,Taringa,QLD,Australia,Loan Paid,Existing Client-Granted Loan Before,0.0,63.84,2272.5377,3.0,1.0,0.0,4.0,3.0,4821.63,2.0,15.0,1964.736,4821.63,4643.35,0.0,0.18,0.0,1.0,3112.4,599.0,450.0,3450,4253.6,4.0,17.857,Monthly,22.0,5627.96,5000.0,Full-Time Employment,2.0,0.0,0.3297,1.0,0.0,1959.0,3057.4866,1063.4,MoneySpot,0.0,5054038,2.0,13-04-2023,False,Life Event Expenses,2023-04-13,Green,0.0,7235.0,5627.96
0062x00000F00wYAAR,0012x00000dbug5AAA,Silverwater,NSW,Australia,Loan Paid,Existing Client-Granted Loan Before,0.0,73.95,2222.958,1.0,0.0,0.0,4.0,1.0,7512.2797,0.0,29.0,0.0,811.6984,847.03,0.0,0.0,0.0,0.0,0.0,400.0,600.0,3500,4411.08,28.0,28.571,Weekly,24.0,7512.28,3500.0,Full-Time Employment,0.0,0.0,0.0,0.0,3517.36,822.0,2663.6333,158.97,MoneySpot,0.0,6850160,0.0,16-10-2023,False,Medical Expenses,2023-10-16,Green,0.0,11182.0,7512.28
0062x00000F1vJiAAJ,0012x00000Ve0UQAAZ,Kootingal,NSW,Australia,Loan Paid,Existing Client-Granted Loan Before,0.0,46.02,2796.1498,2.0,0.0,0.0,4.0,2.0,6528.7615,0.0,22.0,0.0,3004.8571,2946.5,0.0,0.0,0.0,0.0,5768.6,599.0,1000.0,3500,4463.61,15.0,29.429,Fortnightly,39.0,6528.76,3500.0,Full-Time Employment,0.0,0.0,0.0,0.0,7011.3333,1214.0,2827.4466,297.58,MoneySpot,0.0,6932687,0.0,24-10-2023,False,Vehicle Expenses,2023-10-23,Orange,0.0,7012.0,6528.76
0062x00000E3a1kAAB,0010K00001suauGQAQ,Forest Lake,QLD,Australia,Closed Lost,Existing Client-No Loan Granted Ever,0.0,90.12,0.0,1.0,0.0,0.0,2.0,1.0,4144.0275,14.0,18.0,0.0,953.6941,759.41,1.0,0.0,0.0,0.0,1950.0,400.0,600.0,3500,4094.7,9.0,9.571,Weekly,25.0,4210.69,3500.0,Part-Time Employment,14.0,0.0,0.5385,4.0,3814.7766,0.0,244.8333,454.97,QuickCash,,5499176,5.0,04-06-2023,False,Car Repairs,2023-06-04,Orange,0.0,3881.0,4210.69
0062x00000DGWnoAAH,0012x00000TtxUIAAZ,Klemzig,SA,Australia,Loan Paid,Existing Client-Granted Loan Before,0.37,70.76,4564.6965,1.0,0.0,0.0,3.0,1.0,7848.6081,0.0,39.0,0.0,814.5646,680.58,0.0,1.89,0.0,0.0,3728.8,599.0,200.0,3200,3957.99,20.0,20.286,Weekly,39.0,9134.56,5000.0,Full-Time Employment,0.0,0.0,0.0,0.0,3529.78,1733.0,5670.9966,197.9,MoneySpot,0.0,4726973,0.0,21-02-2023,False,Medical Expenses,2023-02-21,Orange,43.0,11532.0,9134.56
0062x00000D8UF3AAN,0012x00000XOXkOAAX,Bellmere,QLD,Australia,Loan Paid,Existing Client-Granted Loan Before,0.0,70.38,7140.7141,2.0,0.0,0.0,3.0,2.0,5014.0773,0.0,69.0,96.0,2130.95,2123.94,1.0,0.0,1.0,0.0,3900.0,1499.0,500.0,3500,4312.88,10.0,20.429,Fortnightly,50.0,9692.48,5000.0,Full-Time Employment,0.0,0.0,0.022,0.0,2130.95,1853.0,7391.79,431.29,MoneySpot,0.0,4535285,0.0,23-01-2023,False,Other Expenses,2023-01-23,Orange,0.0,6048.0,9692.48
0062x00000ENX0rAAH,0012x00000dd1sgAAA,Eagleby,QLD,Australia,Loan Paid,Existing Client-Granted Loan Before,0.0,71.79,2249.5252,1.0,0.0,0.0,3.0,1.0,9247.0729,2.0,70.0,325.8494,1865.7692,2208.0,0.0,0.0,0.0,0.0,1200.0,899.0,1480.0,3200,4046.9,26.0,25.857,Weekly,40.0,9256.07,3200.0,Full-Time Employment,2.0,0.0,0.0,2.0,8085.0,1558.0,3176.0,155.66,MoneySpot,0.0,6179477,2.0,11-08-2023,False,Life Event Expenses,2023-08-11,Green,0.0,9392.0,9256.07
0062x00000ECFVwAAP,0012x00000kZYaAAAW,Toolong,VIC,Australia,Closed Lost,Existing Client-No Loan Granted Ever,35.78,55.25,786.9612,1.0,0.0,2.0,3.0,1.0,5081.6255,0.0,6.0,395.8947,722.6825,882.32,0.0,0.0,0.0,0.0,3683.33,400.0,200.0,3200,3901.42,8.0,16.143,Fortnightly,37.0,5081.63,3200.0,Full-Time Employment,0.0,0.0,0.0,0.0,4979.53,151.0,511.4433,487.68,MoneySpot,,5864722,0.0,08-07-2023,False,Home Maintenance & Repairs,2023-07-08,Orange,2089.0,5837.0,5081.63
0062x00000DrELqAAN,0012x00000Mh0ElAAJ,Merrylands West,NSW,Australia,Loan Paid,Existing Client-Granted Loan Before,0.0,84.78,7097.6402,1.0,0.0,0.0,3.0,1.0,13290.4341,2.0,92.0,224.2577,1918.4615,2050.0,0.0,0.0,0.0,1.0,0.0,400.0,150.0,3500,4345.87,24.0,23.857,Weekly,34.0,14662.07,3500.0,,2.0,0.0,0.1099,2.0,0.0,2836.0,10191.9,181.08,MoneySpot,0.0,5153681,2.0,28-04-2023,False,Vehicle Expenses,2023-04-28,Orange,0.0,16310.0,14662.07
0062x00000D96iqAAB,0012x00000XOXueAAH,Lucas,VIC,Australia,Closed Lost,Existing Client-Granted Loan Before,0.17,71.13,3700.8849,2.0,0.0,0.0,3.0,2.0,6692.57,6.0,49.0,345.4464,3062.9128,3530.95,1.0,0.33,0.0,0.0,7592.1,599.0,1560.0,3500,4105.3,5.0,9.857,Fortnightly,50.0,6692.57,4000.0,Part-Time Employment,6.0,0.0,0.011,6.0,7146.7966,1426.0,4999.8666,821.06,MoneySpot,,4564639,6.0,01-02-2023,False,Travel Expenses,2023-01-27,Orange,13.0,7594.0,6692.57
0062x00000FHgBnAAL,0012x00000e0IviAAE,Nagambie,VIC,Australia,Loan Paid,Existing Client-Granted Loan Before,0.0,94.07,1348.3216,1.0,0.0,0.0,2.0,1.0,5638.0904,0.0,0.0,811.6366,1026.5908,970.06,0.0,0.29,0.0,0.0,950.0,400.0,150.0,3500,4357.6,24.0,24.143,Weekly,47.0,6131.76,3500.0,Full-Time Employment,0.0,0.0,0.0,0.0,4106.3633,809.0,1580.53,181.57,MoneySpot,0.0,7191837,0.0,14-11-2023,False,Other Expenses,2023-11-13,Orange,0.0,6182.0,6131.76
0062x00000GBcItAAL,0012x00000gARfVAAW,Two Rocks,WA,Australia,Closed Lost,Existing Client-Granted Loan Before,0.0,41.32,2205.7508,2.0,0.0,0.0,4.0,2.0,10514.6186,0.0,36.0,537.6,3228.6471,3034.93,0.0,0.28,0.0,0.0,0.0,899.0,1100.0,3500,4193.7,8.0,15.286,Fortnightly,53.0,11091.95,3500.0,Full-Time Employment,0.0,0.0,0.0,0.0,7533.51,3316.0,3749.2166,524.22,MoneySpot,,8696578,0.0,2024-04-03,False,Travel Expenses,2024-04-02,Green,0.0,11717.0,11091.95
0062x00000ECTDwAAP,0012x000002d6vSAAQ,BRAYBROOK,VIC,Australia,Closed Lost,Existing Client-No Loan Granted Ever,34.48,79.96,640.9226,4.0,0.0,1.0,3.0,1.0,6497.0846,0.0,14.0,747.7431,510.2307,289.6,0.0,0.51,0.0,0.0,5200.0,400.0,440.0,3300,3889.09,3.0,10.143,Monthly,48.0,6647.08,3300.0,Full-Time Employment,0.0,0.0,0.0,0.0,2211.0,688.0,688.3333,1296.36,MoneySpot,,5881133,0.0,11-07-2023,True,Living Expenses,2023-07-10,Orange,2571.0,7456.0,6647.08
0062x00000EChvVAAT,0012x00000TrJGtAAN,WEST FOOTSCRAY,VIC,Australia,Closed Lost,Existing Client-No Loan Granted Ever,0.0,95.93,687.0873,0.0,0.0,0.0,0.0,0.0,3.9,3.0,0.0,1642.3983,0.0,0.0,1.0,0.0,1.0,0.0,0.0,599.0,956.0,3500,4083.51,3.0,9.714,Monthly,41.0,4884.46,3500.0,Full-time,12.0,0.0,0.0,5.0,3030.7666,649.0,1429.9966,1361.17,MoneySpot,,5894115,0.0,12-07-2023,False,Medical Expenses,2023-07-12,Orange,0.0,208.0,4884.46
0062x00000ExMUiAAN,0012800001QCEysAAH,Rasmussen,QLD,Australia,Loan Paid,Existing Client-Granted Loan Before,0.0,70.86,4652.5635,4.0,0.0,0.0,2.0,4.0,8907.6166,0.0,40.0,0.0,3149.7312,2837.7,1.0,0.0,0.0,0.0,5154.5,599.0,640.0,3500,4371.34,12.0,24.0,Fortnightly,44.0,8907.62,3500.0,Casual Employment,0.0,0.0,0.022,0.0,8399.2833,1073.0,4856.7366,364.28,MoneySpot,0.0,6658383,0.0,27-09-2023,False,Vehicle Expenses,2023-09-27,Green,0.0,9374.0,8907.62
0062x00000D8NqCAAV,0012x00000XOXueAAH,Lucas,VIC,Australia,Closed Lost,Existing Client-Granted Loan Before,0.19,67.45,3285.5983,2.0,0.0,0.0,3.0,2.0,6523.0945,6.0,44.0,345.4464,2984.9066,3373.58,1.0,0.38,0.0,0.0,7592.1,599.0,1560.0,3500,4058.34,5.0,10.571,Fortnightly,50.0,6523.09,4600.0,Part-Time Employment,6.0,0.0,0.011,6.0,5969.8133,1323.0,4637.0066,811.67,MoneySpot,,4530455,6.0,27-01-2023,False,Other Expenses,2023-01-22,Orange,13.0,6501.0,6523.09
0062x00000ExhzMAAR,0012x00000MiPZbAAN,Thomastown,VIC,Australia,Loan Paid,Existing Client-Granted Loan Before,0.0,70.1,0.0,1.0,0.0,0.0,3.0,1.0,3702.1312,0.0,31.0,0.0,649.1807,560.08,0.0,0.14,0.0,0.0,500.0,400.0,510.0,3500,4402.69,27.0,26.857,Weekly,24.0,3708.76,3500.0,Part-Time Employment,0.0,0.0,0.0,0.0,2813.1166,551.0,1949.39,163.07,MoneySpot,-0.21,6681994,0.0,29-09-2023,False,Other Expenses,2023-09-29,Green,0.0,6551.0,3708.76
