Id,AccountId,City,State,Country,StageName,Applicant_Type__c,income_as_a_of_DP200_income__c,Deposit_spent_on_DOD__c,Monthly_ongoing_financial_commitments__c,DP_Primary_income_frequency__c,DP_enders_with_uncleared_dishonours_233__c,Primary_regular_benefit_frequency__c,Largest_income_source_day_of_week__c,Frequency_for_largest_income_source__c,Total_monthly_income_ongoin_Reg_231__c,DP_Dishonours_Across_Primary_Acct_244__c,DP_No_Direct_Debits_On_Primary_Acct_355__c,Amount_of_SACC_commitments_due__c,Largest_income_Src_Avg_freq__c,Largest_income_Src_last_payment_amt__c,agency_collection_providers__c,income_DP200_spend_on_high_risk_merch__c,most_recent_loan_has_no_repayments__c,Income_source_is_other_income_549__c,Summary_Income__c,Summary_Expenses__c,Rent_Mortgage__c,Loan_Amount__c,Total_Repayment_Amount__c,Total_Repayments__c,Term_in_Weeks__c,Payment_Frequency__c,Applicant_Age__c,Summary_Income_CV__c,Amount_Requested__c,Employment_Status__c,Dishonours_203__c,DP_Insolvency_Indicator__c,DP_Days_in_Overdrawn_For_Period__c,Dishonours_For_Last_30_Days_DP907__c,Salary_Gov_Allowances_all_types_2117__c,DP_Monthly_avg_of_SACC_repayments__c,DP_Avg_Monthly_Loan_Liability_269__c,Repayment_Amount__c,Opportunity_Origin__c,Current_Balance__c,Opp_Number__c,loan_dishonours__c,CloseDate,Bank_Report_Gov_Benefit__c,Purpose_of_Loan__c,Loan_apply_date,DE_Results,DP_Total_Monthly_Benefit_Income__c,Total_monthly_credits__c,Summary_Income_BS__c
0062x00000D7H2SAAV,0012x00000TunwWAAR,Yarrawonga,VIC,Australia,Loan Paid,Existing Client-Granted Loan Before,27.86,43.42,1804.4632,2.0,0.0,4.0,4.0,2.0,3607.8692,13.0,47.0,329.0466,989.48,1172.0,0.0,0.0,0.0,1.0,1400.0,1499.0,130.0,1300,1716.0,7.0,12.857,Fortnightly,26.0,6288.38,1300.0,Casual Employment,13.0,0.0,0.044,2.0,1212.21,1295.0,2925.9766,245.14,Financier-2,0.0,4475444,11.0,14-01-2023,False,Medical Expenses,2023-01-13,Green,1212.0,4350.0,6288.38
0062x00000DrqLEAAZ,0012x00000INkHTAA1,Yabulu,QLD,Australia,Loan Paid,Existing Client-Granted Loan Before,26.0,49.05,2662.9937,2.0,0.0,4.0,4.0,2.0,4955.3308,0.0,13.0,369.0555,1609.02,1904.58,0.0,0.0,0.0,0.0,1451.67,899.0,2000.0,1500,1980.0,5.0,10.0,Fortnightly,50.0,9367.24,2050.0,Part-Time Employment,0.0,0.0,0.956,0.0,3068.5633,1899.0,1899.0666,396.0,MoneySpot,0.0,5197265,0.0,05-05-2023,False,Medical Expenses,2023-05-04,Orange,1460.0,5614.0,9367.24
0062x00000DJ1pHAAT,0012x00000THjqzAAD,Theodore,ACT,Australia,Loan Paid,Existing Client-Granted Loan Before,0.0,24.25,947.6404,4.0,0.0,0.0,5.0,4.0,2783.4733,6.0,45.0,0.0,2087.605,2072.47,0.0,0.42,0.0,0.0,6295.35,400.0,200.0,1250,1650.0,11.0,11.143,Weekly,63.0,4811.37,2050.0,Full-Time Employment,6.0,0.0,0.1209,4.0,2783.4733,563.0,1676.82,150.0,MoneySpot,0.0,4867441,5.0,15-03-2023,False,Living Expenses,2023-03-15,Green,0.0,4986.0,4811.37
0062x00000D8ExqAAF,0012x00000dysl9AAA,Torquay,QLD,Australia,Loan Paid,Existing Client-Granted Loan Before,0.0,71.11,412.4433,2.0,0.0,0.0,3.0,2.0,5954.4087,1.0,13.0,1043.3239,2299.8857,2337.0,1.0,0.0,0.0,0.0,0.0,400.0,200.0,1200,1632.0,7.0,13.714,Fortnightly,27.0,6329.03,2500.0,Full-Time Employment,1.0,0.0,0.033,0.0,5366.4,1253.0,1439.3966,233.14,Financier-2,0.0,4522429,1.0,21-01-2023,False,Vehicle Expenses,2023-01-21,Orange,0.0,7377.0,6329.03
0062x00000EeHOhAAN,0012x00000WtFlTAAV,Callala Bay,NSW,Australia,Closed Lost,New Client-New Loan,0.0,65.84,938.5209,1.0,0.0,0.0,4.0,1.0,3069.4491,0.0,59.0,0.0,584.244,794.82,1.0,0.0,0.0,0.0,750.0,899.0,200.0,1200,1776.0,30.0,29.714,Weekly,20.0,3069.45,2050.0,Full-Time Employment,0.0,0.0,0.0,0.0,2921.22,455.0,1115.58,59.2,MoneySpot,,6477747,0.0,14-09-2023,False,Furniture or Appliances,2023-09-10,Green,0.0,3152.0,3069.45
0062x00000D1tnNAAR,0012x00000fmMTuAAM,VIOLET TOWN,VIC,Australia,Loan Paid,Existing Client-No Loan Granted Ever,0.0,36.38,1223.5329,2.0,0.0,0.0,4.0,2.0,5003.3944,3.0,21.0,461.7605,2300.9233,2516.68,0.0,0.37,0.0,0.0,0.0,899.0,600.0,1200,1584.0,5.0,9.143,Fortnightly,41.0,5008.89,2050.0,,3.0,0.0,0.0,0.0,2300.9233,129.0,1887.5166,316.8,MoneySpot,0.0,4417014,0.0,05-01-2023,False,Vehicle Expenses,2023-01-05,Green,0.0,4586.0,5008.89
0062x00000FTwTfAAL,0012x00000FGdVeAAL,Glenside,SA,Australia,Loan Paid,Existing Client-Granted Loan Before,0.0,75.27,2644.3887,1.0,0.0,0.0,2.0,1.0,9936.1236,0.0,78.0,176.8832,1386.4876,1419.49,1.0,0.0,1.0,0.0,5867.33,400.0,2000.0,1500,2040.0,16.0,16.286,Weekly,46.0,9936.12,2050.0,Full-Time Employment,0.0,0.0,0.0,0.0,6008.1133,3103.0,3534.2066,127.5,QuickCash,0.0,7467355,0.0,12-12-2023,False,Living Expenses,2023-12-12,Orange,0.0,10433.0,9936.12
0062x00000D6yNZAAZ,0012x00000fmQeEAAU,Pormpuraaw,QLD,Australia,Loan Paid,Existing Client-Granted Loan Before,0.0,98.66,1599.7932,2.0,0.0,0.0,3.0,2.0,7247.57,0.0,30.0,0.0,1731.5771,1532.54,0.0,0.0,0.0,0.0,2963.66,400.0,100.0,1300,1768.0,7.0,14.0,Fortnightly,44.0,7160.99,1300.0,Full-Time Employment,0.0,0.0,0.011,0.0,5604.7866,794.0,1582.4233,252.57,MoneySpot,0.0,4462065,0.0,12-01-2023,False,Travel Expenses,2023-01-11,Green,0.0,6368.0,7160.99
0062x00000Ds6RXAAZ,0010K000020GM9iQAG,Reservoir,VIC,Australia,Loan Paid,Existing Client-Granted Loan Before,0.0,30.76,0.0,1.0,0.0,0.0,3.0,1.0,2607.1402,0.0,0.0,0.0,600.0,600.0,0.0,0.0,0.0,1.0,4333.33,599.0,1600.0,1500,2040.0,14.0,14.429,Weekly,27.0,2607.14,2100.0,Full-Time Employment,0.0,0.0,0.8132,0.0,0.0,0.0,0.0,145.71,MoneySpot,0.0,5219975,0.0,08-05-2023,False,Living Expenses,2023-05-08,Orange,0.0,2600.0,2607.14
0062x00000DHbi8AAD,0012x00000OJCqzAAH,DEE WHY,NSW,Australia,Closed Lost,Existing Client-Granted Loan Before,0.0,65.23,1173.3242,1.0,0.0,0.0,3.0,1.0,4240.2099,0.0,30.0,213.33,902.5627,189.0,0.0,5.71,0.0,1.0,7800.0,400.0,800.0,1250,1550.0,1.0,0.857,Weekly,28.0,14274.79,1250.0,Casual Employment,0.0,0.0,0.022,0.0,235.48,142.0,2463.3366,1550.0,MoneySpot,,4786538,0.0,03-03-2023,False,Vehicle Expenses,2023-03-02,Green,0.0,23932.0,14274.79
0062x00000D2PuVAAV,0012x00000cwpZaAAI,Coogee,NSW,Australia,Loan Paid,Existing Client-Granted Loan Before,0.0,74.78,2452.5175,4.0,0.0,0.0,4.0,4.0,1139.5032,2.0,39.0,526.3684,219.0714,40.0,0.0,0.49,0.0,1.0,8762.0,899.0,1500.0,1500,2040.0,7.0,13.429,Fortnightly,30.0,14625.0,1500.0,Full-Time Employment,6.0,0.0,0.044,1.0,0.0,1824.0,4081.1833,291.43,QuickCash,0.0,4444589,4.0,10-01-2023,False,Living Expenses,2023-01-09,Orange,0.0,14788.0,14625.0
0062x00000D73DyAAJ,0012x00000g9n3iAAA,Docklands,VIC,Australia,Loan Paid,New Client-New Loan,0.0,61.19,353.2199,2.0,0.0,0.0,3.0,2.0,7021.4716,4.0,13.0,0.0,1637.8,1759.27,0.0,0.03,0.0,0.0,0.0,0.0,2326.0,1200,1584.0,5.0,10.0,Fortnightly,28.0,7043.12,3000.0,Employed full-time,6.0,0.0,0.3736,4.0,2729.6666,0.0,1394.78,316.8,MoneySpot,0.0,4465246,0.0,12-01-2023,False,Bills,2023-01-12,Green,0.0,7465.0,7043.12
0062x00000DWDXUAA5,0012x00000gq4ToAAI,Wynnum West,QLD,Australia,Loan Paid,New Client-New Loan,11.4,71.96,782.8207,2.0,0.0,2.0,3.0,2.0,8886.5426,0.0,7.0,0.0,2529.9883,1414.4,0.0,0.0,0.0,0.0,0.0,0.0,1370.0,1200,1536.0,3.0,5.286,Fortnightly,35.0,9510.62,2000.0,,0.0,0.0,0.3077,0.0,5642.5233,0.0,1304.5866,512.0,MoneySpot,0.0,4903444,0.0,21-03-2023,False,Home - Repairs/Maintenance,2023-03-21,Orange,1090.0,9560.0,9510.62
0062x00000DsDZEAA3,0012x00000gp7tkAAA,Blacktown,NSW,Australia,Loan Paid,Existing Client-No Loan Granted Ever,0.0,66.55,674.6152,1.0,0.0,0.0,2.0,1.0,5871.8918,0.0,8.0,0.0,1351.34,1628.61,1.0,0.5,0.0,0.0,0.0,599.0,1000.0,1200,1632.0,14.0,14.143,Weekly,32.0,6198.56,2000.0,,0.0,0.0,0.011,0.0,4054.02,0.0,810.32,116.57,MoneySpot,0.0,5227848,0.0,09-05-2023,False,Life Event Expenses,2023-05-09,Green,0.0,5549.0,6198.56
0062x00000DJG4BAAX,0012x00000XK4zlAAD,Ascot Park,SA,Australia,Loan Paid,Existing Client-Granted Loan Before,0.0,40.22,1190.8115,2.0,0.0,0.0,5.0,2.0,4361.5177,2.0,55.0,0.0,1963.0,1827.0,2.0,0.0,0.0,1.0,0.0,1499.0,1300.0,1100,1452.0,6.0,11.0,Fortnightly,43.0,4606.0,1100.0,,2.0,0.0,0.1099,2.0,0.0,0.0,1547.84,242.0,MoneySpot,0.0,4879745,0.0,17-03-2023,False,Child Expenses,2023-03-17,Orange,0.0,4794.0,4606.0
0062x00000D8xSoAAJ,0012x00000cz0xoAAA,Parkwood,WA,Australia,Loan Paid,Existing Client-Granted Loan Before,0.0,71.65,2090.5633,2.0,0.0,0.0,2.0,2.0,5190.814,0.0,16.0,320.0,2389.1971,2391.7,0.0,0.0,0.0,0.0,1546.07,599.0,700.0,1500,2040.0,7.0,13.857,Fortnightly,41.0,6086.62,1500.0,Full-Time Employment,0.0,0.0,0.011,0.0,5574.7933,251.0,3522.03,291.43,QuickCash,0.0,4557427,0.0,26-01-2023,False,Living Expenses,2023-01-26,Orange,0.0,9525.0,6086.62
0062x00000D9IEsAAN,0012x00000gmedPAAQ,MIDDLE STREET,NT,Australia,Closed Lost,New Client-New Loan,25.7,37.0,99.5263,2.0,0.0,2.0,4.0,2.0,5180.2167,0.0,6.0,0.0,1667.9085,1717.81,1.0,0.0,0.0,0.0,0.0,0.0,410.0,1150,1472.0,3.0,5.571,Fortnightly,32.0,5278.5,1150.0,,0.0,0.0,0.2747,0.0,5324.61,0.0,91.62,490.67,MoneySpot,,4575494,0.0,29-01-2023,False,Other,2023-01-29,Green,1478.0,5750.0,5278.5
0062x00000F1cQZAAZ,0012x00000lJ8xTAAS,Bordertown,SA,Australia,Closed Lost,Existing Client-No Loan Granted Ever,0.0,69.32,206.9133,1.0,0.0,0.0,2.0,1.0,4832.2865,0.0,9.0,0.0,969.0961,1354.76,0.0,0.0,0.0,0.0,0.0,400.0,110.0,1200,1728.0,22.0,22.571,Weekly,32.0,5010.62,5000.0,Full-Time Employment,0.0,0.0,0.0,0.0,4199.4166,207.0,500.77,78.55,MoneySpot,,6908064,0.0,21-10-2023,False,Vehicle Expenses,2023-10-21,Green,0.0,7661.0,5010.62
0062x00000DGv6VAAT,0012x00000fo3zzAAA,Ettalong Beach,NSW,Australia,Loan Paid,Existing Client-Granted Loan Before,0.2,42.03,2372.5837,2.0,1.0,0.0,3.0,2.0,5202.5394,5.0,7.0,0.0,1497.65,1456.24,0.0,4.02,0.0,1.0,3063.67,400.0,820.0,1150,1518.0,6.0,11.857,Fortnightly,63.0,5202.54,2050.0,Part-Time Employment,7.0,0.0,0.011,0.0,0.0,1538.0,3949.7833,253.0,MoneySpot,0.0,4749233,3.0,24-02-2023,False,Other Expenses,2023-02-24,Green,13.0,6418.0,5202.54
0062x00000DZQOAAA5,0012x00000Rq0KFAAZ,Yanchep,WA,Australia,Closed Lost,Existing Client-No Loan Granted Ever,0.0,54.77,572.5625,2.0,0.0,0.0,2.0,2.0,5349.4347,0.0,8.0,0.0,2286.842,2619.85,1.0,0.0,0.0,0.0,8587.68,899.0,1100.0,1200,1584.0,5.0,9.0,Fortnightly,27.0,6032.77,3000.0,Full-Time Employment,0.0,0.0,0.0,0.0,3811.4033,0.0,757.9433,316.8,MoneySpot,,5092547,0.0,19-04-2023,False,Vehicle - Repairs,2023-04-18,Green,0.0,5940.0,6032.77
0062x00000D751mAAB,0012x00000g9ntRAAQ,Griffith,NSW,Australia,Loan Paid,New Client-New Loan,0.0,33.6,2419.6506,1.0,0.0,0.0,2.0,1.0,6817.3483,0.0,29.0,984.918,1568.9246,1807.7,0.0,6.19,0.0,0.0,0.0,0.0,320.0,1200,1584.0,9.0,8.857,Weekly,36.0,6817.35,3000.0,,0.0,0.0,0.011,0.0,6798.6733,842.0,2262.6966,176.0,MoneySpot,0.0,4466175,0.0,12-01-2023,False,Holiday / Travel,2023-01-12,Green,0.0,7465.0,6817.35
0062x00000D7ebiAAB,0012x00000LPdplAAD,East Ipswich,QLD,Australia,Loan Paid,Existing Client-Granted Loan Before,0.0,66.44,763.92,0.0,0.0,0.0,0.0,0.0,0.0,1.0,58.0,1235.0353,0.0,0.0,1.0,0.0,0.0,0.0,3448.26,899.0,1200.0,1500,2040.0,14.0,14.286,Weekly,38.0,8256.06,1500.0,Full-Time Employment,1.0,0.0,0.1429,0.0,0.0,1209.0,1883.21,145.71,MoneySpot,0.0,4493772,1.0,17-01-2023,False,Vehicle Expenses,2023-01-17,Green,0.0,7736.0,8256.06
0062x00000D851aAAB,0012x00000dbWJFAA2,Gracemere,QLD,Australia,Closed Lost,Existing Client-No Loan Granted Ever,0.0,38.29,3344.6001,1.0,0.0,0.0,1.0,1.0,7226.13,0.0,92.0,163.0768,1663.0,1656.0,1.0,0.0,0.0,1.0,1750.0,599.0,1300.0,1200,1536.0,6.0,6.571,Weekly,48.0,7226.13,1500.0,Full-Time Employment,0.0,0.0,0.0,0.0,0.0,1330.0,3875.12,256.0,MoneySpot,,4513887,0.0,23-01-2023,False,Home Maintenance & Repairs,2023-01-19,Orange,0.0,7240.0,7226.13
0062x00000DG3A8AAL,0010K000029H0cQQAS,McKail,WA,Australia,Loan Paid,Existing Client-Granted Loan Before,34.06,96.27,4557.1172,2.0,1.0,4.0,4.0,2.0,7110.0911,29.0,71.0,1625.0385,2027.7628,1770.67,0.0,0.28,0.0,0.0,3185.0,599.0,2100.0,1450,2088.0,12.0,24.0,Fortnightly,47.0,7071.56,2050.0,Part-Time Employment,29.0,0.0,0.0,5.0,7308.33,1697.0,5425.3933,174.0,MoneySpot,0.0,4700618,13.0,17-02-2023,False,Furniture or Appliances,2023-02-16,Green,2577.0,7565.0,7071.56
0062x00000EevmhAAB,0012x00000lIM3sAAG,Horsley Park,NSW,Australia,Loan Paid,Existing Client-No Loan Granted Ever,0.0,72.79,1910.9453,1.0,0.0,0.0,4.0,1.0,5145.4648,0.0,29.0,0.0,914.5892,929.0,0.0,32.98,0.0,0.0,0.0,400.0,100.0,1200,1728.0,22.0,22.0,Weekly,26.0,5329.67,2500.0,Full-Time Employment,0.0,0.0,0.044,0.0,3963.22,0.0,1648.9633,78.55,MoneySpot,0.0,6528275,0.0,15-09-2023,False,Medical Expenses,2023-09-14,Green,0.0,6450.0,5329.67
0062x00000Ewg9ZAAR,0012x00000hXwuxAAC,Mildura,VIC,Australia,Loan Paid,Existing Client-Granted Loan Before,0.0,23.53,148.3333,1.0,0.0,0.0,4.0,1.0,5103.6398,0.0,37.0,0.0,1174.5363,893.0,1.0,4.93,0.0,0.0,7395.4,599.0,1600.0,1250,1750.0,21.0,21.0,Weekly,32.0,5103.64,1250.0,Full-Time Employment,0.0,0.0,0.0,0.0,4306.6333,0.0,248.3333,83.33,QuickCash,0.0,6606742,0.0,22-09-2023,False,Living Expenses,2023-09-21,Green,0.0,6025.0,5103.64
0062x00000DVzmJAAT,0012x00000cJsjnAAC,Golden Point,VIC,Australia,Loan Paid,Existing Client-Granted Loan Before,0.14,43.85,1163.7353,2.0,1.0,4.0,4.0,2.0,8160.6838,2.0,13.0,0.0,3747.6614,3248.49,0.0,45.14,0.0,0.0,3190.0,599.0,940.0,1400,1792.0,3.0,5.857,Fortnightly,31.0,9208.94,1400.0,Full-Time Employment,4.0,0.0,0.2967,2.0,8762.9866,786.0,2218.9733,597.33,Financier-2,0.0,4888834,4.0,18-03-2023,False,Vehicle Expenses,2023-03-18,Green,18.0,12598.0,9208.94
0062x00000D70QoAAJ,0012x00000g95DUAAY,Huntly,VIC,Australia,Closed Lost,Existing Client-No Loan Granted Ever,5.72,34.08,293.0933,1.0,0.0,0.0,3.0,1.0,5186.326,0.0,0.0,0.0,1068.5138,1174.03,0.0,3.87,0.0,0.0,0.0,599.0,390.0,1200,1536.0,6.0,6.0,Weekly,28.0,5186.33,1250.0,,0.0,0.0,0.0,0.0,4630.2266,15.0,316.4266,256.0,MoneySpot,,4463373,0.0,12-01-2023,False,Vehicle Expenses,2023-01-12,Green,333.0,5815.0,5186.33
0062x00000E4XLIAA3,0012x00000BGHfuAAH,Sunshine Beach,QLD,Australia,Loan Paid,Existing Client-No Loan Granted Ever,0.0,59.04,472.5,1.0,0.0,0.0,4.0,1.0,7021.5667,5.0,19.0,0.0,1338.6538,1568.0,0.0,1.18,0.0,0.0,3466.67,899.0,1760.0,1200,1632.0,15.0,15.571,Weekly,44.0,7021.57,2500.0,Full-Time Employment,5.0,0.0,0.3297,1.0,5800.8333,0.0,472.5,108.8,MoneySpot,0.0,5580752,0.0,13-06-2023,False,Living Expenses,2023-06-13,Green,0.0,8019.0,7021.57
0062x00000FHKjPAAX,0012x00000mHBPlAAO,Springfield Lakes,QLD,Australia,Closed Lost,Existing Client-No Loan Granted Ever,0.0,68.54,6371.5832,1.0,0.0,0.0,2.0,1.0,12939.7541,0.0,43.0,402.5066,2389.1285,2524.0,0.0,13.84,0.0,0.0,0.0,1499.0,1800.0,1200,1632.0,16.0,16.571,Weekly,34.0,13033.95,3100.0,full_time,0.0,0.0,0.0,0.0,11149.2666,371.0,6276.92,102.0,MoneySpot,,7160812,0.0,11-11-2023,False,Travel Expenses,2023-11-11,Green,0.0,13348.0,13033.95
0062x00000DVV2JAAX,0010K00001sGHp6QAG,PORTLAND,VIC,Australia,Loan Paid,Existing Client-Granted Loan Before,30.94,59.07,221.6337,1.0,0.0,2.0,2.0,1.0,2537.2353,0.0,63.0,287.6342,311.4,311.4,0.0,0.0,0.0,0.0,2166.67,400.0,200.0,1250,1800.0,23.0,22.857,Weekly,33.0,3189.24,2050.0,Part-Time Employment,0.0,0.0,0.6923,0.0,1426.49,248.0,525.69,78.26,MoneySpot,0.0,5451960,0.0,31-05-2023,False,Living Expenses,2023-05-31,Green,804.0,2598.0,3189.24
0062x00000EbbeNAAR,0012x00000fm2e9AAA,Panania,NSW,Australia,Loan Paid,Existing Client-Granted Loan Before,0.0,63.55,3593.0318,1.0,0.0,0.0,5.0,1.0,5202.2358,2.0,27.0,0.0,369.1538,374.0,0.0,21.3,0.0,0.0,800.0,2000.0,400.0,1050,1638.0,36.0,36.429,Weekly,30.0,5496.24,2000.0,Part-Time Employment,2.0,0.0,0.0,0.0,2556.7766,807.0,3587.1166,45.5,QuickCash,0.0,6301748,0.0,23-08-2023,False,Living Expenses,2023-08-23,Green,0.0,8131.0,5496.24
0062x00000DIc1xAAD,0012x00000Oy3bcAAB,Avenell Heights,QLD,Australia,Closed Lost,Existing Client-No Loan Granted Ever,10.25,50.12,1959.1995,1.0,0.0,2.0,1.0,1.0,4979.0266,0.0,56.0,434.5238,931.27,872.3,1.0,0.0,0.0,0.0,3407.27,899.0,600.0,1200,1632.0,16.0,16.429,Weekly,45.0,4979.03,5000.0,Full-Time Employment,0.0,0.0,0.0,0.0,4287.46,779.0,1865.0566,102.0,MoneySpot,,4843625,0.0,15-03-2023,False,Vehicle Expenses,2023-03-11,Green,562.0,5480.0,4979.03
0062x00000FIbqFAAT,0012x00000Mhb97AAB,Blue Mountain Heights,QLD,Australia,Closed Lost,Existing Client-Granted Loan Before,7.26,56.31,1310.9466,2.0,0.0,2.0,2.0,2.0,4892.1526,0.0,8.0,0.0,1788.6842,1780.97,1.0,0.0,0.0,1.0,0.0,0.0,1200.0,1500,2160.0,13.0,25.286,Fortnightly,29.0,4892.15,1500.0,,0.0,0.0,0.0,0.0,364.56,0.0,1330.0933,166.15,MoneySpot,,7261296,0.0,21-11-2023,False,school_education,2023-11-20,Orange,378.0,5202.0,4892.15
0062x00000E4McaAAF,0012x00000iIPSEAA4,Williams Landing,VIC,Australia,Loan Paid,New Client-New Loan,0.0,85.14,209.1784,1.0,0.0,0.0,3.0,1.0,7637.6366,6.0,26.0,0.0,1264.1446,1092.25,1.0,0.0,0.0,0.0,6066.67,599.0,1800.0,1200,1584.0,13.0,12.714,Weekly,43.0,7637.64,2100.0,Casual Employment,6.0,0.0,0.0,2.0,5477.96,0.0,434.6533,121.85,MoneySpot,0.0,5563832,1.0,10-06-2023,False,Living Expenses,2023-06-09,Green,0.0,7831.0,7637.64
0062x00000DWVviAAH,0010K000023zREDQA2,Gatton,QLD,Australia,Loan Paid,Existing Client-Granted Loan Before,0.0,77.83,7071.3224,2.0,0.0,0.0,3.0,2.0,7827.3337,0.0,69.0,1694.0694,3602.7185,3944.0,1.0,0.0,0.0,0.0,0.0,400.0,1200.0,1500,1980.0,5.0,10.0,Fortnightly,29.0,7827.33,1500.0,,0.0,0.0,0.4835,0.0,8406.3433,1941.0,7174.1633,396.0,Financier-2,0.0,4919983,0.0,23-03-2023,False,Vehicle Expenses,2023-03-23,Orange,0.0,8423.0,7827.33
0062x00000DWJ41AAH,0010K00001sYFVuQAO,Walloon,QLD,Australia,Loan Paid,Existing Client-Granted Loan Before,0.0,66.46,2371.356,2.0,0.0,0.0,3.0,2.0,4461.7928,1.0,51.0,617.9246,1035.6833,1026.15,2.0,0.51,0.0,0.0,2045.33,599.0,0.0,1100,1452.0,5.0,9.143,Fortnightly,42.0,4461.79,2050.0,Part-Time Employment,1.0,0.0,0.0,1.0,2071.3666,1406.0,3295.9966,290.4,MoneySpot,0.0,4909268,0.0,22-03-2023,False,Travel Expenses,2023-03-21,Green,0.0,4540.0,4461.79
0062x00000DGcVtAAL,0012x00000VfVj5AAF,Randwick,NSW,Australia,Closed Lost,Existing Client-No Loan Granted Ever,0.0,44.72,6683.4126,3.0,0.0,0.0,5.0,3.0,11983.4132,1.0,54.0,0.0,8324.2466,6601.67,0.0,3.76,0.0,0.0,8945.83,899.0,1153.0,1200,1536.0,2.0,7.857,Monthly,46.0,11988.41,5000.0,Full-Time Employment,1.0,0.0,0.0,0.0,8324.2466,0.0,6983.8933,768.0,MoneySpot,,4732017,1.0,26-02-2023,False,Other Expenses,2023-02-21,Orange,0.0,12889.0,11988.41
0062x00000DWzs1AAD,0012x00000XJgt9AAD,Southport,QLD,Australia,Loan Paid,Existing Client-Granted Loan Before,0.0,73.49,222.9699,4.0,0.0,0.0,5.0,4.0,2167.0833,8.0,49.0,341.2214,722.3611,903.0,1.0,0.0,0.0,1.0,4567.33,1499.0,600.0,1250,1600.0,9.0,8.571,Weekly,60.0,2167.08,1250.0,Contract Employment,8.0,0.0,0.8352,4.0,0.0,197.0,342.2133,177.78,QuickCash,0.0,4948830,6.0,28-03-2023,False,Other Expenses,2023-03-28,Green,0.0,3014.0,2167.08
0062x00000D7ICyAAN,0012x00000g9GivAAE,Croydon,VIC,Australia,Loan Paid,Existing Client-No Loan Granted Ever,3.84,50.49,2509.2366,1.0,0.0,4.0,3.0,1.0,6387.8138,0.0,10.0,0.0,730.9107,866.47,1.0,0.0,0.0,0.0,0.0,599.0,600.0,1200,1584.0,9.0,8.714,Weekly,34.0,7071.17,1500.0,,3.0,0.0,0.0,2.0,6155.78,0.0,3189.2733,176.0,MoneySpot,0.0,4476747,0.0,14-01-2023,False,Travel Expenses,2023-01-14,Green,389.0,10117.0,7071.17
0062x00000DVoCgAAL,0010K00001g85yeQAA,Carnegie,VIC,Australia,Loan Paid,Existing Client-Granted Loan Before,35.4,80.83,0.0,0.0,0.0,4.0,5.0,4.0,1787.3435,0.0,1.0,0.0,736.375,585.72,0.0,1.22,0.0,0.0,4116.67,599.0,200.0,1500,2040.0,16.0,15.714,Weekly,53.0,4385.04,2050.0,Full-Time Employment,0.0,0.0,0.0659,0.0,1714.0833,0.0,48.35,127.5,MoneySpot,0.0,5477225,0.0,02-06-2023,True,Living Expenses,2023-06-02,Orange,1939.0,5477.0,4385.04
0062x00000DFMRKAA5,0012x00000gnWdZAAU,Gorokan,NSW,Australia,Closed Lost,New Client-New Loan,0.0,51.7,1950.84,1.0,0.0,0.0,4.0,1.0,6604.047,1.0,7.0,0.0,1319.463,1297.88,0.0,0.0,0.0,0.0,0.0,0.0,200.0,1200,1632.0,14.0,13.857,Weekly,21.0,6604.05,8000.0,,1.0,0.0,0.011,0.0,5717.6733,0.0,5141.1933,116.57,MoneySpot,,4663370,2.0,11-02-2023,False,Home Purchase,2023-02-11,Orange,0.0,10066.0,6604.05
0062x00000D748jAAB,0012x00000g9nWKAAY,Ashfield,NSW,Australia,Loan Paid,New Client-New Loan,0.0,83.26,45.1233,1.0,0.0,0.0,1.0,1.0,7516.9539,0.0,12.0,0.0,1158.4223,1190.63,0.0,0.02,0.0,1.0,5156.67,400.0,1520.0,1200,1536.0,6.0,5.714,Weekly,31.0,8060.29,10200.0,Full-Time Employment,0.0,0.0,0.0,0.0,0.0,0.0,349.5433,256.0,MoneySpot,0.0,4465671,0.0,13-01-2023,False,Living Expenses,2023-01-12,Orange,0.0,12197.0,8060.29
0062x00000DHxs9AAD,0012x00000gn7LfAAI,Glenelg South,SA,Australia,Loan Paid,Existing Client-No Loan Granted Ever,0.1,93.91,2395.0899,3.0,0.0,0.0,3.0,3.0,3832.6233,3.0,25.0,0.0,3644.29,3582.21,0.0,75.12,0.0,0.0,3640.0,599.0,650.0,1200,1536.0,2.0,5.857,Monthly,30.0,4315.96,1200.0,Full-Time Employment,4.0,0.0,0.5824,1.0,4127.6233,0.0,3579.3933,768.0,MoneySpot,0.0,4809575,0.0,06-03-2023,False,Living Expenses,2023-03-06,Orange,13.0,12039.0,4315.96
0062x00000DVZQ4AAP,0012x00000iHW9uAAG,Mango Hill,QLD,Australia,Loan Paid,New Client-New Loan,0.0,66.22,993.0508,4.0,0.0,0.0,5.0,4.0,11863.0755,8.0,30.0,0.0,1995.2571,2156.18,1.0,0.0,0.0,0.0,0.0,0.0,780.0,1200,1632.0,14.0,13.857,Weekly,30.0,12843.51,5000.0,,8.0,0.0,0.0659,1.0,9236.42,0.0,1681.1166,116.57,MoneySpot,0.0,5456938,5.0,01-06-2023,False,Auto Finance,2023-05-31,Orange,0.0,9652.0,12843.51
0062x00000Ew8MZAAZ,0012x00000gpxHQAAY,Strathfield,NSW,Australia,Loan Paid,Existing Client-No Loan Granted Ever,0.0,73.1,690.3153,1.0,0.0,0.0,3.0,1.0,19646.428,0.0,36.0,0.0,1576.4607,1113.52,0.0,0.0,0.0,0.0,0.0,599.0,800.0,1200,1632.0,16.0,16.429,Weekly,28.0,19583.09,5000.0,Full-Time Employment,0.0,0.0,0.0549,0.0,6831.33,0.0,726.25,102.0,MoneySpot,0.0,6564068,0.0,18-09-2023,False,Relocation Expenses,2023-09-18,Green,0.0,43956.0,19583.09
0062x00000D9v2RAAR,0012x00000OwDkAAAV,Scarness,QLD,Australia,Loan Paid,Existing Client-Granted Loan Before,5.38,48.66,509.7224,1.0,0.0,0.0,1.0,1.0,4457.767,0.0,28.0,0.0,915.8153,775.7,0.0,0.23,0.0,0.0,1647.14,599.0,600.0,1300,1820.0,20.0,19.714,Weekly,46.0,4712.57,2050.0,Full-Time Employment,0.0,0.0,0.044,0.0,3968.5333,515.0,631.3933,91.0,MoneySpot,0.0,4604026,0.0,02-02-2023,False,Life Event Expenses,2023-02-02,Green,255.0,4735.0,4712.57
0062x00000D1lTeAAJ,0012x00000fmFnDAAU,Officer,VIC,Australia,Loan Paid,Existing Client-Granted Loan Before,0.0,92.73,1366.8333,4.0,0.0,0.0,2.0,4.0,17311.2647,0.0,19.0,0.0,234.4511,400.0,0.0,2.4,0.0,1.0,0.0,899.0,1350.0,1400,1904.0,7.0,14.0,Fortnightly,43.0,23343.21,1400.0,,0.0,0.0,0.8681,0.0,8129.0933,512.0,1325.7033,272.0,MoneySpot,0.0,4409675,0.0,04-01-2023,False,Home Maintenance & Repairs,2023-01-04,Orange,0.0,24366.0,23343.21
0062x00000EboB3AAJ,0012x00000NxFSLAA3,Kooringal,NSW,Australia,Loan Paid,Existing Client-Granted Loan Before,35.06,74.25,2896.9828,1.0,0.0,2.0,1.0,1.0,7715.6105,0.0,67.0,0.0,1128.4607,1245.52,2.0,2.24,0.0,0.0,4290.0,899.0,150.0,1400,1904.0,14.0,13.714,Weekly,35.0,7715.61,1400.0,Full-Time Employment,0.0,0.0,0.0,0.0,7536.25,225.0,3339.72,136.0,QuickCash,0.0,6314283,0.0,24-08-2023,False,Living Expenses,2023-08-24,Green,2646.0,7545.0,7715.61
0062x00000DXGt1AAH,0012x00000hWyqJAAS,Paradise,SA,Australia,Closed Lost,New Client-New Loan,0.0,72.43,0.0,4.0,0.0,0.0,4.0,4.0,4922.3683,0.0,1.0,0.0,1298.47,1298.47,0.0,0.0,0.0,0.0,4116.67,599.0,900.0,1200,1536.0,3.0,5.143,Fortnightly,23.0,4922.37,1200.0,Part-Time Employment,0.0,0.0,0.0,0.0,3257.3266,0.0,0.0,512.0,MoneySpot,,4963636,0.0,30-03-2023,False,Living Expenses,2023-03-30,Orange,0.0,6224.0,4922.37
0062x00000DXXv7AAH,0012x000005TRPiAAO,Aveley,WA,Australia,Loan Paid,Existing Client-Granted Loan Before,0.0,60.62,2621.369,1.0,1.0,0.0,3.0,1.0,9818.1096,16.0,13.0,817.5565,1886.7507,1783.14,1.0,0.0,0.0,0.0,1243.67,899.0,2500.0,1500,2040.0,14.0,14.571,Weekly,36.0,9564.78,2250.0,Full-Time Employment,16.0,0.0,0.3736,0.0,8175.92,1997.0,4955.6733,145.71,Financier-2,0.0,4982818,16.0,02-04-2023,False,Vehicle Expenses,2023-04-02,Orange,0.0,8463.0,9564.78
0062x00000DI4Q5AAL,0012x00000gp0BJAAY,Smithfield,QLD,Australia,Closed Lost,New Client-New Loan,0.31,69.01,149.9999,4.0,0.0,0.0,4.0,4.0,9815.3782,0.0,14.0,0.0,959.211,946.0,0.0,0.1,0.0,1.0,0.0,0.0,2080.0,1200,1536.0,6.0,6.143,Weekly,27.0,14293.05,1200.0,,0.0,0.0,0.0,0.0,2897.4733,0.0,150.0,256.0,MoneySpot,,4815216,0.0,07-03-2023,False,Event - Funeral - Air fares,2023-03-07,Orange,31.0,9876.0,14293.05
0062x00000EMV4TAAX,0012x00000kg6GOAAY,Victoria Park,WA,Australia,Loan Paid,New Client-New Loan,0.0,78.33,136.4133,2.0,0.0,0.0,3.0,2.0,4548.723,1.0,6.0,0.0,1945.6814,1856.0,0.0,27.57,0.0,0.0,4021.33,400.0,1501.01,1200,1680.0,10.0,19.857,Fortnightly,39.0,5765.89,2050.0,Full-Time Employment,1.0,0.0,0.044,0.0,4539.9233,0.0,1451.5733,168.0,MoneySpot,0.0,6107247,1.0,04-08-2023,False,Medical Expenses,2023-08-04,Green,0.0,6950.0,5765.89
0062x00000DGvmsAAD,0012x00000SHX6vAAH,Mildura,VIC,Australia,Loan Paid,Existing Client-No Loan Granted Ever,0.13,91.44,2394.1454,1.0,0.0,0.0,2.0,1.0,9482.2562,3.0,55.0,449.819,1240.879,1522.81,1.0,0.26,0.0,0.0,5120.94,599.0,400.0,1200,1584.0,10.0,10.571,Weekly,35.0,9482.26,2050.0,Full-Time Employment,3.0,0.0,0.0549,0.0,4549.89,744.0,2374.8266,158.4,MoneySpot,0.0,4749888,3.0,25-02-2023,False,Life Event Expenses,2023-02-24,Green,13.0,9717.0,9482.26
0062x00000D1RvBAAV,0012x00000Tsgw2AAB,Barham,NSW,Australia,Loan Paid,Existing Client-Granted Loan Before,4.69,57.84,2686.0224,4.0,1.0,0.0,1.0,4.0,4323.7598,9.0,24.0,734.4756,750.0866,337.51,0.0,1.67,0.0,0.0,2232.67,1499.0,0.0,1200,1632.0,14.0,14.286,Weekly,29.0,5316.26,1200.0,Full-Time Employment,14.0,0.0,0.1538,6.0,3467.06,789.0,2873.56,116.57,MoneySpot,0.0,4390209,12.0,01-01-2023,False,Vehicle Expenses,2023-01-01,Orange,250.0,5324.0,5316.26
0062x00000Ef66AAAR,0012x00000lIXsLAAW,Chatswood,NSW,Australia,Closed Lost,Existing Client-No Loan Granted Ever,0.0,64.18,3972.6125,2.0,0.0,0.0,2.0,2.0,8900.7258,0.0,38.0,0.0,2784.3083,2784.31,0.0,0.0,0.0,0.0,0.0,899.0,2640.0,1200,1632.0,8.0,16.571,Fortnightly,65.0,10200.73,2050.0,Full-Time Employment,0.0,0.0,0.4396,0.0,5568.6166,0.0,4276.8233,204.0,MoneySpot,,6545774,0.0,16-09-2023,False,Medical Expenses,2023-09-15,Green,0.0,11688.0,10200.73
0062x00000EMYBtAAP,0012x00000FEkZhAAL,Griffith,NSW,Australia,Loan Paid,Existing Client-Granted Loan Before,0.0,62.85,1303.2659,1.0,0.0,0.0,4.0,1.0,9662.0736,0.0,37.0,42.24,1309.9753,1096.58,0.0,41.37,0.0,0.0,4766.67,400.0,0.0,1500,2100.0,20.0,20.0,Weekly,33.0,9662.07,2050.0,Full-Time Employment,0.0,0.0,0.1099,0.0,5676.56,1713.0,1976.68,105.0,MoneySpot,0.0,6109263,0.0,04-08-2023,False,Living Expenses,2023-08-04,Orange,0.0,11022.0,9662.07
0062x00000Drjk3AAB,0012x00000hYHFdAAO,WISHART,QLD,Australia,Closed Lost,Existing Client-No Loan Granted Ever,0.83,55.44,3176.2665,2.0,0.0,4.0,2.0,2.0,10226.8179,2.0,145.0,0.0,3221.5185,6652.52,0.0,0.0,0.0,0.0,2600.0,0.0,1300.0,1200,1584.0,5.0,10.0,Fortnightly,31.0,10226.82,3000.0,Full-Time Employment,16.0,0.0,0.0659,5.0,10473.8666,1020.0,3487.14,316.8,MoneySpot,,5188156,0.0,08-05-2023,False,Vet - Procedure,2023-05-03,Green,101.0,12127.0,10226.82
0062x00000Dr9f1AAB,0012x00000hYi2OAAS,Maroubra,NSW,Australia,Loan Paid,Existing Client-No Loan Granted Ever,0.16,93.52,727.8925,2.0,0.0,0.0,3.0,2.0,7067.451,0.0,6.0,0.0,1878.5871,2020.94,0.0,0.07,0.0,0.0,4766.67,400.0,1000.0,1100,1408.0,3.0,6.0,Fortnightly,24.0,8217.45,1100.0,Full-Time Employment,0.0,0.0,0.0549,0.0,4383.37,0.0,1738.22,469.33,MoneySpot,0.0,5148949,0.0,27-04-2023,False,Medical Expenses,2023-04-27,Green,26.0,16209.0,8217.45
0062x00000FgeVKAAZ,0012x00000cme5ZAAQ,Rosehill,NSW,Australia,Loan Paid,Existing Client-Granted Loan Before,0.0,89.9,998.6446,1.0,0.0,0.0,3.0,1.0,18583.1895,0.0,33.0,0.0,2180.1,2513.05,0.0,0.38,0.0,0.0,4961.43,599.0,1000.0,1250,1700.0,14.0,14.0,Weekly,30.0,18617.42,1250.0,Full-Time Employment,0.0,0.0,0.033,0.0,11028.82,849.0,849.3366,121.43,MoneySpot,0.0,7825687,0.0,2024-01-12,False,Other Expenses,2024-01-12,Orange,0.0,19301.0,18617.42
0062x00000DIFPxAAP,0012x00000IN6aoAAD,Parkes,NSW,Australia,Loan Paid,Existing Client-Granted Loan Before,11.93,77.05,5846.9378,2.0,0.0,2.0,3.0,2.0,8931.3908,1.0,92.0,1125.1781,1364.535,840.96,2.0,0.62,0.0,0.0,6933.33,899.0,1200.0,1200,1584.0,7.0,13.143,Fortnightly,44.0,8238.72,1200.0,Part-Time Employment,1.0,0.0,0.022,1.0,7366.9633,2301.0,8944.2366,226.29,Financier-2,0.0,4822899,0.0,09-03-2023,False,Vehicle Expenses,2023-03-08,Orange,1039.0,8708.0,8238.72
0062x00000DHCxCAAX,0012x000005SyTHAA0,POINT COOK,VIC,Australia,Loan Paid,Existing Client-Granted Loan Before,0.0,96.25,6628.0696,1.0,0.0,0.0,3.0,1.0,7643.3909,7.0,79.0,636.6747,1623.63,1680.71,0.0,7.52,0.0,0.0,13276.25,899.0,100.0,1200,1632.0,14.0,14.286,Weekly,37.0,8249.43,2500.0,Full-Time Employment,7.0,0.0,0.0659,0.0,7035.73,1291.0,8333.1533,116.57,MoneySpot,0.0,4767054,6.0,28-02-2023,False,Other Expenses,2023-02-27,Orange,0.0,8401.0,8249.43
0062x00000D2LxzAAF,0010K00001odLr5QAE,Mitchelton,QLD,Australia,Loan Paid,Existing Client-Granted Loan Before,0.08,91.47,1752.5586,2.0,0.0,2.0,4.0,2.0,5259.3244,0.0,39.0,528.9241,2413.1316,1810.67,0.0,0.07,0.0,0.0,4225.0,599.0,0.0,1200,1632.0,7.0,13.571,Fortnightly,32.0,6802.66,1200.0,Full-Time Employment,0.0,0.0,0.0,0.0,4838.93,633.0,2613.4766,233.14,MoneySpot,0.0,4441107,0.0,09-01-2023,False,Furniture or Appliances,2023-01-08,Orange,15.0,18420.0,6802.66
0062x00000EyaClAAJ,0012x00000gqQERAA2,Clifton Springs,VIC,Australia,Loan Paid,Existing Client-No Loan Granted Ever,0.0,24.04,518.6866,2.0,0.0,0.0,5.0,2.0,3771.7622,6.0,10.0,0.0,1657.7985,1479.14,0.0,0.0,0.0,0.0,0.0,599.0,800.0,1200,1728.0,12.0,23.286,Fortnightly,45.0,3845.1,2050.0,Full-Time Employment,6.0,0.0,0.0,2.0,3868.1966,0.0,518.6866,144.0,MoneySpot,0.0,6747470,0.0,05-10-2023,False,Vehicle Expenses,2023-10-05,Green,0.0,4172.0,3845.1
0062x00000D8UlAAAV,0010K00002BRiESQA1,Nambucca Heads,NSW,Australia,Loan Paid,Existing Client-No Loan Granted Ever,0.0,56.77,1031.8471,1.0,0.0,0.0,3.0,1.0,5121.2328,0.0,13.0,689.4444,1178.5857,1409.27,1.0,0.11,0.0,0.0,0.0,400.0,300.0,1200,1632.0,16.0,16.429,Weekly,35.0,5121.23,5000.0,,0.0,0.0,0.0989,0.0,2750.0333,284.0,650.6933,102.0,MoneySpot,0.0,4535672,0.0,25-01-2023,False,Vehicle Expenses,2023-01-24,Green,0.0,2831.0,5121.23
0062x00000EONFxAAP,0012x00000khBX4AAM,Woodend,VIC,Australia,Closed Lost,New Client-New Loan,0.0,90.17,0.0,2.0,0.0,0.0,3.0,2.0,6793.5121,0.0,6.0,0.0,1781.19,2089.5,0.0,11.71,0.0,0.0,2000.0,2000.0,1000.0,1200,1728.0,13.0,24.857,Fortnightly,29.0,6813.51,2050.0,Full-Time Employment,0.0,0.0,0.033,0.0,3562.38,0.0,46.0,132.92,MoneySpot,,6253506,0.0,21-08-2023,False,Living Expenses,2023-08-18,Green,0.0,10253.0,6813.51
0062x00000ECOFTAA5,0012x00000kZdHfAAK,Glandore,SA,Australia,Closed Lost,New Client-New Loan,0.0,26.19,1062.4866,3.0,0.0,0.0,3.0,3.0,4203.13,0.0,14.0,0.0,4155.3333,4199.0,0.0,0.0,0.0,0.0,62400.0,2000.0,750.0,1200,1632.0,4.0,14.286,Monthly,40.0,4205.13,5000.0,Full-Time Employment,0.0,0.0,0.0,0.0,4155.3333,0.0,1449.2833,408.0,MoneySpot,,5875171,0.0,10-07-2023,False,Vehicle Expenses,2023-07-10,Orange,0.0,4551.0,4205.13
0062x00000F4JWiAAN,0012x000003EVC0AAO,Deer Park,VIC,Australia,Closed Lost,Existing Client-No Loan Granted Ever,0.0,76.14,86.9034,2.0,0.0,0.0,4.0,2.0,4939.2653,0.0,2.0,0.0,2204.3742,1638.75,0.0,0.0,0.0,0.0,4116.67,599.0,2150.0,1200,1680.0,9.0,18.143,Fortnightly,30.0,4939.27,2100.0,Full-Time Employment,0.0,0.0,0.0,0.0,5143.54,0.0,788.5266,186.67,MoneySpot,,7124900,0.0,09-11-2023,False,Medical Expenses,2023-11-08,Green,0.0,5971.0,4939.27
0062x00000F3RtWAAV,0012x00000BHrbNAAT,Fairfield West,NSW,Australia,Loan Paid,Existing Client-No Loan Granted Ever,0.0,83.89,148.3451,1.0,0.0,0.0,3.0,1.0,4214.5359,0.0,5.0,0.0,920.0576,838.0,1.0,0.0,0.0,0.0,2436.42,599.0,560.0,1200,1728.0,23.0,22.857,Weekly,28.0,4214.54,2050.0,Unemployed,0.0,0.0,0.0,0.0,3986.9166,0.0,56.9,75.13,MoneySpot,0.0,7048999,0.0,03-11-2023,False,Relocation Expenses,2023-11-03,Green,0.0,4307.0,4214.54
0062x00000DAC8AAAX,0010K000022N0sAQAS,LANSVALE,NSW,Australia,Loan Paid,Existing Client-No Loan Granted Ever,0.0,85.64,3445.4957,1.0,1.0,0.0,1.0,1.0,12239.9916,4.0,57.0,0.0,1489.5271,2248.29,0.0,6.55,0.0,0.0,7193.33,899.0,150.0,1150,1472.0,6.0,6.429,Weekly,38.0,10127.2,1150.0,Full-Time Employment,4.0,0.0,0.989,0.0,6951.1266,539.0,4220.4533,245.33,MoneySpot,0.0,4617949,4.0,04-02-2023,False,Other,2023-02-04,Green,0.0,14850.0,10127.2
0062x00000DIC0eAAH,0012x00000IMsxDAAT,Warwick,QLD,Australia,Loan Paid,Existing Client-Granted Loan Before,0.0,86.48,2794.3053,1.0,0.0,0.0,2.0,1.0,3489.2989,0.0,0.0,548.3427,754.2823,367.39,1.0,0.84,0.0,0.0,4333.33,400.0,0.0,1500,1980.0,13.0,13.0,Weekly,32.0,3489.3,1500.0,Full-Time Employment,0.0,0.0,0.1868,0.0,3268.5566,880.0,2871.7433,152.31,Financier-2,0.0,4821182,0.0,10-03-2023,False,Living Expenses,2023-03-10,Orange,0.0,3700.0,3489.3
0062x00000D7TJhAAN,0012x00000g98tEAAQ,Unley,SA,Australia,Loan Paid,Existing Client-No Loan Granted Ever,0.0,28.01,712.86,2.0,0.0,0.0,2.0,2.0,4379.2274,10.0,21.0,0.0,2015.645,1929.0,1.0,0.0,0.0,0.0,0.0,599.0,1000.0,1200,1584.0,5.0,9.286,Fortnightly,29.0,8086.8,2500.0,,10.0,0.0,0.2747,2.0,2687.5266,0.0,868.11,316.8,MoneySpot,0.0,4485740,4.0,16-01-2023,False,Relocation Expenses,2023-01-15,Green,0.0,3922.0,8086.8
0062x00000DXRJpAAP,0012x00000g9AkiAAE,Tarneit,VIC,Australia,Loan Paid,Existing Client-Granted Loan Before,5.35,74.62,0.0,2.0,0.0,2.0,2.0,2.0,5963.7646,1.0,40.0,0.0,2190.3128,2190.31,0.0,0.0,0.0,0.0,4745.0,599.0,900.0,1500,1920.0,3.0,5.714,Fortnightly,38.0,5963.76,1500.0,Full-Time Employment,1.0,0.0,0.4725,0.0,5464.8366,213.0,213.3333,640.0,QuickCash,0.0,4972075,0.0,31-03-2023,False,Living Expenses,2023-03-31,Green,354.0,6614.0,5963.76
0062x00000DWWy9AAH,0012x00000gqV2KAAU,Delahey,VIC,Australia,Closed Lost,Existing Client-No Loan Granted Ever,1.52,60.25,149.0,2.0,0.0,2.0,3.0,2.0,5639.4164,0.0,13.0,0.0,2506.0266,2343.28,0.0,0.0,0.0,0.0,5076.5,400.0,0.0,1200,1536.0,3.0,5.0,Fortnightly,31.0,5534.29,5000.0,Full-Time Employment,0.0,0.0,0.3736,0.0,5101.7033,0.0,638.65,512.0,MoneySpot,,4920659,0.0,28-03-2023,False,Life Event Expenses,2023-03-23,Green,90.0,5883.0,5534.29
0062x00000DWJZLAA5,0012x00000LReTtAAL,South Gundagai,NSW,Australia,Loan Paid,Existing Client-Granted Loan Before,0.0,70.72,1648.9932,1.0,0.0,0.0,2.0,1.0,9572.8926,0.0,41.0,1371.8301,1728.9061,1897.28,0.0,0.66,0.0,0.0,0.0,1499.0,100.0,1500,1980.0,11.0,11.0,Weekly,53.0,9572.89,2050.0,Full-Time Employment,0.0,0.0,0.0,0.0,7491.9266,1775.0,1809.7666,180.0,MoneySpot,0.0,4909672,0.0,22-03-2023,False,Furniture or Appliances,2023-03-21,Orange,0.0,10339.0,9572.89
0062x00000DFcbBAAT,0012x000002dMbAAAU,Kirkwood,QLD,Australia,Loan Paid,Existing Client-Granted Loan Before,62.8,98.84,667.43,2.0,2.0,2.0,1.0,2.0,7394.6825,16.0,37.0,564.881,1286.0,1188.0,0.0,0.0,0.0,1.0,3466.67,599.0,400.0,1200,1632.0,7.0,14.0,Fortnightly,31.0,8917.34,1200.0,Unemployed,16.0,0.0,0.1538,4.0,5606.6366,1317.0,2149.9533,233.14,Financier-2,0.0,4678200,8.0,14-02-2023,False,Living Expenses,2023-02-13,Green,5477.0,8720.0,8917.34
0062x00000D7QgYAAV,0010K0000272bcAQAQ,Heathridge,WA,Australia,Loan Paid,Existing Client-Granted Loan Before,1.62,96.29,2086.9401,1.0,0.0,0.0,2.0,1.0,5888.8874,3.0,76.0,0.0,655.8275,274.7,0.0,0.0,0.0,0.0,2990.0,400.0,1960.0,1500,2040.0,7.0,14.571,Fortnightly,44.0,6276.4,1500.0,Full-Time Employment,3.0,1.0,0.7912,0.0,4365.92,428.0,2717.14,291.43,MoneySpot,0.0,4483568,1.0,16-01-2023,False,Home Maintenance & Repairs,2023-01-16,Orange,152.0,9361.0,6276.4
0062x00000DYV6GAAX,0010K00001qIioBQAS,Yarralin,NT,Australia,Loan Paid,Existing Client-Granted Loan Before,0.0,88.11,1965.1151,2.0,1.0,0.0,4.0,2.0,2536.5715,7.0,32.0,0.0,1085.3114,1069.6,0.0,0.0,0.0,0.0,2166.67,599.0,190.0,1300,1664.0,4.0,7.429,Fortnightly,41.0,3473.91,2050.0,Full-Time Employment,7.0,0.0,0.1758,2.0,2532.3933,781.0,1867.9633,416.0,MoneySpot,0.0,5037569,7.0,11-04-2023,False,Life Event Expenses,2023-04-11,Orange,0.0,3541.0,3473.91
0062x00000D8v3wAAB,0012x00000gAi68AAC,Leonora,WA,Australia,Loan Paid,New Client-New Loan,0.0,55.93,858.2288,2.0,0.0,0.0,2.0,2.0,3960.2175,0.0,14.0,0.0,1687.7714,1435.32,0.0,16.53,0.0,0.0,0.0,0.0,150.0,1200,1920.0,20.0,39.857,Fortnightly,20.0,5878.72,10000.0,,0.0,0.0,0.0,0.0,3938.1333,0.0,901.4066,96.0,MoneySpot,0.0,4556084,0.0,26-01-2023,False,Holiday / Travel,2023-01-26,Green,0.0,7512.0,5878.72
0062x00000DXM6iAAH,0012x00000hX1gMAAS,Beeliar,WA,Australia,Loan Paid,New Client-New Loan,0.0,70.8,2669.7099,2.0,1.0,0.0,4.0,2.0,9833.2104,3.0,20.0,220.16,3326.9585,3324.37,0.0,0.0,0.0,0.0,0.0,0.0,2517.0,1200,1536.0,3.0,6.0,Fortnightly,51.0,11040.88,1400.0,,3.0,0.0,0.022,1.0,7762.9033,616.0,5432.33,512.0,MoneySpot,0.0,4968377,2.0,31-03-2023,False,Home and Improvement,2023-03-30,Green,0.0,12635.0,11040.88
0062x00000DrzESAAZ,0012x00000fmyWoAAI,Rokeby,TAS,Australia,Closed Lost,Existing Client-No Loan Granted Ever,0.0,29.81,2530.4125,4.0,0.0,0.0,3.0,4.0,7416.3333,0.0,48.0,304.1667,624.1379,700.0,0.0,0.0,0.0,1.0,0.0,599.0,200.0,1200,1632.0,14.0,13.714,Weekly,46.0,583.0,4250.0,Full-Time Employment,0.0,0.0,0.0,0.0,0.0,451.0,2772.2166,116.57,MoneySpot,,5211248,0.0,06-05-2023,False,Vehicle Expenses,2023-05-06,Orange,0.0,8742.0,583.0
0062x00000DHZI7AAP,0012x00000XB6dYAAT,Gregory Hills,NSW,Australia,Loan Paid,Existing Client-Granted Loan Before,0.0,59.06,1921.2134,1.0,0.0,0.0,2.0,1.0,6837.8216,4.0,60.0,1841.9169,1559.26,1587.53,2.0,0.61,0.0,0.0,3542.5,899.0,2320.0,1500,1980.0,12.0,12.857,Weekly,43.0,7971.79,1500.0,Full-Time Employment,4.0,0.0,0.033,0.0,6756.7933,1424.0,3210.2866,165.0,Financier-2,0.0,4784938,4.0,02-03-2023,False,Furniture or Appliances,2023-03-02,Orange,0.0,8295.0,7971.79
0062x00000DFw8SAAT,0012x00000g8nRPAAY,Point Cook,VIC,Australia,Loan Paid,Existing Client-Granted Loan Before,48.64,92.64,1253.0246,4.0,0.0,2.0,1.0,4.0,6430.646,0.0,37.0,300.2667,261.6038,500.0,1.0,0.0,0.0,1.0,0.0,1499.0,400.0,1200,1632.0,7.0,14.143,Fortnightly,32.0,6760.19,1200.0,Unemployed,0.0,0.0,0.9011,0.0,3190.44,342.0,1933.0166,233.14,Financier-2,0.0,4694506,0.0,16-02-2023,False,Travel Expenses,2023-02-16,Green,3722.0,7651.0,6760.19
0062x00000DZCENAA5,0012x00000hY2ulAAC,Harrisdale,WA,Australia,Loan Paid,New Client-New Loan,0.32,47.71,1921.19,1.0,0.0,0.0,4.0,1.0,7706.3552,2.0,7.0,1257.8954,1961.65,3038.78,0.0,0.07,0.0,0.0,0.0,0.0,2320.0,1200,1536.0,6.0,6.571,Weekly,45.0,7713.36,8500.0,,2.0,0.0,0.8352,0.0,7846.6,579.0,1337.03,256.0,MoneySpot,0.0,5078931,2.0,17-04-2023,False,Rental bond,2023-04-17,Orange,33.0,10046.0,7713.36
0062x00000D8MTWAA3,0012800001SDT9vAAH,Bardia,NSW,Australia,Loan Paid,Existing Client-Granted Loan Before,2.94,89.6,1953.7233,1.0,0.0,2.0,2.0,1.0,9586.9854,0.0,37.0,0.0,1811.1916,3040.25,0.0,0.25,0.0,0.0,0.0,899.0,1388.0,1100,1496.0,14.0,14.429,Weekly,32.0,15842.3,1100.0,Full-Time Employment,0.0,0.0,0.0,0.0,3944.44,512.0,2070.2933,106.86,MoneySpot,0.0,4529294,0.0,22-01-2023,False,Living Expenses,2023-01-22,Orange,362.0,12294.0,15842.3
0062x00000EbsYMAAZ,0012x00000khgpSAAQ,Southern River,WA,Australia,Closed Lost,Existing Client-No Loan Granted Ever,0.0,61.86,0.0,2.0,0.0,0.0,1.0,2.0,4993.9817,0.0,3.0,0.0,2298.6,2298.6,0.0,0.0,0.0,0.0,0.0,0.0,1200.0,1200,1680.0,9.0,17.714,Fortnightly,35.0,4996.68,3000.0,,0.0,0.0,0.0,0.0,5363.4,0.0,171.1533,186.67,MoneySpot,,6316946,0.0,29-08-2023,False,utilities_bill,2023-08-24,Green,0.0,5523.0,4996.68
0062x00000DrDzzAAF,0012x00000MhQnyAAF,Manly West,QLD,Australia,Loan Paid,Existing Client-Granted Loan Before,0.0,86.47,919.7393,2.0,0.0,0.0,3.0,2.0,3598.3634,18.0,49.0,0.0,1583.6642,1470.51,0.0,0.0,0.0,1.0,4550.0,899.0,710.0,1400,1792.0,3.0,5.857,Fortnightly,53.0,3603.36,1400.0,Full-Time Employment,18.0,0.0,0.8242,7.0,0.0,544.0,1068.09,597.33,Financier-2,0.0,5153386,3.0,28-04-2023,False,Life Event Expenses,2023-04-27,Green,0.0,4018.0,3603.36
0062x00000ELyNtAAL,0010K00001uIdltQAC,Blacktown,NSW,Australia,Loan Paid,Existing Client-Granted Loan Before,0.52,20.61,2384.8854,1.0,0.0,0.0,3.0,1.0,6932.0762,0.0,65.0,393.1571,1582.593,1635.81,2.0,0.04,0.0,0.0,3900.0,899.0,320.0,1250,1700.0,14.0,14.286,Weekly,34.0,6932.08,1250.0,Casual Employment,0.0,0.0,0.0,0.0,6857.9033,1422.0,3136.49,121.43,MoneySpot,0.0,6072689,0.0,02-08-2023,False,Vehicle Expenses,2023-08-01,Orange,37.0,7077.0,6932.08
0062x00000EDayFAAT,0012x00000kaDJCAA2,Coconut Grove,NT,Australia,Closed Lost,New Client-New Loan,0.0,51.7,399.5852,1.0,0.0,0.0,3.0,1.0,5609.8666,0.0,5.0,0.0,1001.0,1001.0,0.0,0.0,0.0,0.0,0.0,0.0,800.0,1200,1776.0,29.0,29.0,Weekly,26.0,4676.53,6000.0,Full-time,0.0,0.0,0.0,0.0,4004.0,0.0,1137.4733,61.24,MoneySpot,,5953352,0.0,24-07-2023,False,Vehicle,2023-07-19,Green,0.0,11269.0,4676.53
0062x00000FHJZeAAP,0012x00000goj0oAAA,Mount McKenzie,SA,Australia,Loan Paid,Existing Client-Granted Loan Before,0.0,86.33,6228.4789,1.0,0.0,0.0,3.0,1.0,9228.2058,12.0,42.0,0.0,1893.5384,1750.0,0.0,0.65,0.0,0.0,0.0,1500.0,650.0,1500,2040.0,16.0,15.714,Weekly,40.0,9228.21,1500.0,Full-Time Employment,18.0,0.0,0.044,6.0,8205.3333,740.0,6320.7633,127.5,MoneySpot,0.0,7159430,5.0,11-11-2023,False,Child Expenses,2023-11-11,Orange,0.0,10717.0,9228.21
0062x00000Ef3sPAAR,0012x00000lIWt5AAG,Shepparton East,VIC,Australia,Loan Paid,New Client-New Loan,0.0,89.29,1005.5738,4.0,0.0,0.0,5.0,4.0,1933.4832,3.0,3.0,0.0,286.6666,100.0,0.0,0.5,0.0,1.0,1783.0,2000.0,0.0,1300,1820.0,11.0,21.714,Fortnightly,23.0,5989.56,1300.0,Full-Time Employment,3.0,0.0,0.2198,0.0,4198.5966,0.0,1086.53,165.45,QuickCash,0.0,6538633,0.0,15-09-2023,False,Living Expenses,2023-09-15,Orange,0.0,2190.0,5989.56
0062x00000DsEl6AAF,0012x00000LPlTxAAL,Riverside,TAS,Australia,Loan Paid,Existing Client-Granted Loan Before,5.56,39.63,3943.8215,2.0,5.0,0.0,3.0,2.0,4364.5833,9.0,59.0,1368.3223,2002.0,2002.0,0.0,0.88,0.0,0.0,3716.18,400.0,1720.0,1300,1872.0,12.0,23.286,Fortnightly,24.0,8457.59,3000.0,Full-Time Employment,9.0,0.0,0.5714,8.0,2002.0,2364.0,4752.5666,156.0,MoneySpot,0.0,5228729,9.0,09-05-2023,False,Vehicle Expenses,2023-05-09,Green,318.0,5712.0,8457.59
0062x00000FTrQHAA1,0012x000002bCIWAA2,South Hurstville,NSW,Australia,Loan Paid,Existing Client-Granted Loan Before,0.0,90.93,1656.7436,4.0,0.0,0.0,3.0,4.0,5384.7416,0.0,50.0,0.0,839.6485,923.04,0.0,1.49,0.0,0.0,1516.67,899.0,800.0,1250,1750.0,9.0,18.429,Fortnightly,23.0,5384.74,1250.0,Part-Time Employment,0.0,0.0,0.0,0.0,4971.42,1004.0,3746.75,194.44,QuickCash,0.0,7463102,0.0,11-12-2023,False,Living Expenses,2023-12-11,Orange,0.0,5693.0,5384.74
0062x00000DAC3tAAH,0012x00000Nu8ZUAAZ,Forest Glen,QLD,Australia,Closed Lost,Existing Client-Granted Loan Before,0.21,38.33,1980.6432,3.0,0.0,0.0,5.0,3.0,11512.2588,0.0,0.0,0.0,7993.89,7993.89,0.0,0.0,0.0,1.0,2541.18,1500.0,4000.0,1500,2040.0,14.0,14.429,Weekly,39.0,11512.26,1500.0,Full-Time Employment,0.0,1.0,0.2747,0.0,3508.73,0.0,2279.2433,145.71,QuickCash,,4617893,0.0,07-02-2023,False,Living Expenses,2023-02-04,Orange,32.0,14731.0,11512.26
0062x00000DAKOaAAP,0012x00000gn94rAAA,Plympton,SA,Australia,Closed Lost,New Client-New Loan,0.0,63.71,515.8401,2.0,0.0,0.0,4.0,2.0,7686.6899,0.0,24.0,0.0,1491.41,1611.37,0.0,0.0,0.0,0.0,0.0,0.0,1680.0,1200,1536.0,3.0,5.571,Fortnightly,25.0,8385.29,2000.0,,0.0,0.0,0.0,0.0,6074.0366,0.0,484.8333,512.0,MoneySpot,,4624929,0.0,10-02-2023,False,Short Term Loan,2023-02-05,Green,0.0,11797.0,8385.29
0062x00000E52yvAAB,0012x00000iIsVbAAK,Laverton,VIC,Australia,Loan Paid,New Client-New Loan,0.0,86.13,419.9966,1.0,0.0,0.0,2.0,1.0,7960.7981,0.0,13.0,0.0,1291.2523,1136.13,0.0,47.06,0.0,0.0,0.0,0.0,1160.0,1200,1632.0,16.0,15.857,Weekly,36.0,10113.13,2500.0,,0.0,0.0,0.0659,0.0,5595.4266,0.0,463.7466,102.0,MoneySpot,0.0,5618083,0.0,15-06-2023,False,Travel & Entertainment,2023-06-15,Green,0.0,10358.0,10113.13
0062x00000DVq1fAAD,0012x00000hYZltAAG,Glenfield,NSW,Australia,Loan Paid,Existing Client-No Loan Granted Ever,0.0,58.18,465.551,2.0,0.0,0.0,4.0,2.0,3055.6218,0.0,19.0,128.7494,1406.4233,1251.28,1.0,0.0,0.0,0.0,0.0,2000.0,820.0,1200,1584.0,7.0,13.0,Fortnightly,39.0,3558.96,2100.0,Full-Time Employment,0.0,0.0,0.6484,0.0,2812.8466,99.0,1394.92,226.29,MoneySpot,0.0,5478905,0.0,02-06-2023,False,Living Expenses,2023-06-02,Orange,0.0,3471.0,3558.96
0062x00000DtQCaAAN,0012x00000ha6pgAAA,Blacktown,NSW,Australia,Closed Lost,New Client-New Loan,0.0,77.4,1716.3668,1.0,0.0,0.0,3.0,1.0,5459.4083,0.0,3.0,0.0,862.679,937.31,0.0,0.56,0.0,0.0,0.0,0.0,0.0,1200,1584.0,11.0,11.0,Weekly,23.0,5621.07,4000.0,Casual Employment,0.0,0.0,0.022,0.0,5147.59,0.0,1711.6666,144.0,MoneySpot,,5312660,0.0,18-05-2023,False,Lawyer fees,2023-05-18,Green,0.0,6653.0,5621.07
0062x00000EzoSYAAZ,0012x00000iK2eEAAS,Woy Woy,NSW,Australia,Loan Paid,Existing Client-No Loan Granted Ever,0.0,58.66,0.0,1.0,0.0,0.0,2.0,1.0,4723.5262,0.0,2.0,0.0,798.586,854.1,0.0,0.0,0.0,0.0,0.0,899.0,800.0,1200,1728.0,22.0,22.571,Weekly,39.0,5246.41,3000.0,Full-Time Employment,0.0,0.0,0.044,0.0,3992.93,0.0,94.5633,78.55,MoneySpot,0.0,6836167,0.0,14-10-2023,False,Relocation Expenses,2023-10-14,Green,0.0,6253.0,5246.41
0062x00000DrwKmAAJ,0010K00001uIXCIQA4,Wyndham Vale,VIC,Australia,Loan Paid,Existing Client-No Loan Granted Ever,0.0,45.07,945.3986,2.0,0.0,0.0,3.0,2.0,5219.6002,0.0,21.0,1080.4115,1790.9171,1787.26,0.0,0.0,0.0,0.0,4506.67,0.0,680.0,1200,1632.0,8.0,15.714,Fortnightly,44.0,5328.27,5000.0,Full-Time Employment,0.0,0.0,0.0,0.0,5605.71,1092.0,1457.3333,204.0,MoneySpot,0.0,5206690,0.0,07-05-2023,False,Car Repairs,2023-05-07,Green,0.0,6114.0,5328.27
0062x00000D8rIjAAJ,0012x00000g7tgAAAQ,Narre Warren North,VIC,Australia,Loan Paid,Existing Client-Granted Loan Before,10.2,81.75,213.3333,4.0,0.0,0.0,3.0,4.0,7838.7764,4.0,15.0,0.0,1716.02,1683.6,0.0,0.18,0.0,0.0,6114.9,599.0,300.0,1200,1632.0,7.0,14.0,Fortnightly,35.0,10921.1,3000.0,Full-Time Employment,4.0,0.0,0.011,0.0,5557.0766,213.0,3047.7533,233.14,MoneySpot,0.0,4553157,0.0,26-01-2023,False,Living Expenses,2023-01-26,Orange,1290.0,12647.0,10921.1
0062x00000DsFFQAA3,0010K00002431C1QAI,VICTORIA POINT,QLD,Australia,Loan Paid,Existing Client-Granted Loan Before,0.0,56.9,128.5,2.0,0.0,0.0,2.0,2.0,8188.9399,2.0,5.0,0.0,3709.8883,6243.37,0.0,26.15,0.0,0.0,5633.33,899.0,609.0,1250,1650.0,5.0,9.143,Fortnightly,46.0,8188.94,1250.0,Full-Time Employment,2.0,0.0,0.011,2.0,7481.61,0.0,216.0,330.0,QuickCash,0.0,5229088,0.0,09-05-2023,False,Moving - Removalist,2023-05-09,Green,0.0,9215.0,8188.94
0062x00000D9NCDAA3,0012x00000WsS5ZAAV,Mount Colah,NSW,Australia,Loan Paid,Existing Client-Granted Loan Before,0.0,35.0,589.8016,2.0,0.0,0.0,3.0,2.0,3976.4805,0.0,18.0,246.7009,1511.6142,1357.4,0.0,15.44,0.0,0.0,3543.81,400.0,500.0,1200,1632.0,7.0,13.429,Fortnightly,61.0,3989.79,2050.0,Full-Time Employment,0.0,0.0,0.0,0.0,4216.42,151.0,509.5266,233.14,MoneySpot,0.0,4579402,0.0,30-01-2023,False,Travel Expenses,2023-01-30,Green,0.0,4586.0,3989.79
0062x00000DGXnnAAH,0012x00000goCLhAAM,CALITA AVE,VIC,Australia,Closed Lost,New Client-New Loan,27.94,76.3,1509.0193,1.0,0.0,4.0,2.0,1.0,6458.7486,4.0,16.0,464.2887,839.2391,826.68,0.0,0.0,0.0,0.0,70000.0,2000.0,1400.0,1200,1536.0,6.0,6.143,Weekly,40.0,6469.75,2000.0,Full-Time Employment,4.0,0.0,0.011,3.0,5309.86,463.0,1763.2,256.0,QuickCash,,4727607,4.0,23-02-2023,False,Living Expenses,2023-02-21,Green,2042.0,7308.0,6469.75
0062x00000D1v4AAAR,0012x00000cwKS4AAM,Cloncurry,QLD,Australia,Loan Paid,Existing Client-Granted Loan Before,0.0,39.39,1411.6344,2.0,1.0,0.0,2.0,2.0,10945.1332,2.0,19.0,0.0,4110.0471,4613.0,0.0,0.0,0.0,0.0,6500.0,1499.0,1100.0,1500,2040.0,7.0,14.0,Fortnightly,60.0,10945.13,1500.0,Full-Time Employment,2.0,0.0,0.3846,2.0,11600.16,582.0,1353.7033,291.43,MoneySpot,0.0,4417951,2.0,05-01-2023,False,Furniture or Appliances,2023-01-05,Green,0.0,11600.0,10945.13
0062x00000D9JOyAAN,0012x00000flYARAA2,Mount Beauty,VIC,Australia,Loan Paid,Existing Client-Granted Loan Before,0.0,58.75,790.4167,1.0,0.0,0.0,2.0,1.0,3227.0258,0.0,9.0,0.0,678.0,649.0,0.0,3.43,0.0,0.0,0.0,599.0,600.0,1200,1632.0,14.0,14.429,Weekly,41.0,3227.03,2000.0,Full-Time Employment,0.0,0.0,0.8901,0.0,2712.0,371.0,984.0433,116.57,MoneySpot,0.0,4576443,0.0,29-01-2023,False,Medical Expenses,2023-01-29,Orange,0.0,5254.0,3227.03
0062x00000E4FEoAAN,0012x00000hYI4wAAG,Kearneys Spring,QLD,Australia,Closed Lost,Existing Client-No Loan Granted Ever,0.0,37.79,2025.0472,1.0,0.0,0.0,5.0,1.0,7519.072,0.0,53.0,485.3631,1730.4166,2500.0,1.0,0.01,0.0,1.0,0.0,599.0,450.0,1200,1632.0,14.0,13.857,Weekly,30.0,7821.67,4500.0,,0.0,0.0,0.0,0.0,0.0,484.0,2160.2566,116.57,MoneySpot,,5552812,0.0,09-06-2023,False,Other Expenses,2023-06-08,Orange,0.0,17107.0,7821.67
0062x00000DsWHqAAN,0012x00000hZWslAAG,Hillvue,NSW,Australia,Closed Lost,New Client-New Loan,36.25,73.89,2727.5023,1.0,0.0,4.0,4.0,1.0,6984.6002,0.0,31.0,478.6932,659.1983,522.94,0.0,0.24,0.0,0.0,0.0,0.0,0.0,1200,1536.0,6.0,6.143,Weekly,25.0,6984.6,1400.0,,0.0,0.0,0.011,0.0,5086.1133,441.0,2723.2066,256.0,MoneySpot,,5245447,0.0,15-05-2023,False,Vehicle - Repairs,2023-05-11,Green,2540.0,7006.0,6984.6
0062x00000DH7D4AAL,0012x00000d9DQuAAM,Blacktown,SA,Australia,Loan Paid,Existing Client-Granted Loan Before,0.0,97.54,1676.2956,2.0,0.0,0.0,3.0,2.0,18844.4175,7.0,36.0,480.3841,1431.9483,1320.8,1.0,0.0,0.0,0.0,3726.67,400.0,0.0,1100,1496.0,7.0,14.429,Fortnightly,22.0,19137.75,1100.0,Casual Employment,7.0,0.0,0.1868,0.0,2863.8966,572.0,1816.7866,213.71,QuickCash,0.0,4762391,6.0,27-02-2023,False,Living Expenses,2023-02-27,Green,0.0,20514.0,19137.75
0062x00000DXlUrAAL,0012800001Hl4ysAAB,Surfers Paradise,QLD,Australia,Loan Paid,Existing Client-Granted Loan Before,0.0,64.91,4836.9167,1.0,0.0,0.0,1.0,1.0,7298.63,1.0,113.0,2598.6513,1509.0,1551.0,0.0,4.8,0.0,0.0,6500.0,1499.0,1660.0,1500,2100.0,20.0,20.0,Weekly,39.0,7298.63,2050.0,Full-Time Employment,1.0,0.0,0.967,0.0,6539.0,2412.0,4625.2666,105.0,MoneySpot,0.0,4994397,1.0,04-04-2023,False,Vehicle Expenses,2023-04-03,Green,0.0,7747.0,7298.63
0062x00000E3bu0AAB,0012x00000gpVPDAA2,Rockdale,NSW,Australia,Closed Lost,Existing Client-No Loan Granted Ever,0.0,82.72,0.0,1.0,1.0,0.0,1.0,1.0,9120.6999,7.0,8.0,0.0,979.0,995.0,0.0,21.88,0.0,0.0,0.0,2000.0,350.0,1200,1584.0,10.0,10.143,Weekly,25.0,11494.79,2500.0,,7.0,0.0,0.0,3.0,4242.3333,292.0,332.8166,158.4,MoneySpot,,5503925,2.0,09-06-2023,False,Vehicle Expenses,2023-06-04,Green,0.0,20287.0,11494.79
0062x00000DIxzKAAT,0010K0000280RsGQAU,Mildura,VIC,Australia,Loan Paid,Existing Client-Granted Loan Before,0.0,98.81,2364.9041,1.0,0.0,0.0,4.0,1.0,5568.5388,6.0,47.0,0.0,913.7069,1056.29,0.0,10.37,0.0,0.0,3254.33,899.0,900.0,1500,1980.0,11.0,11.286,Weekly,47.0,6100.25,1500.0,Casual Employment,6.0,0.0,0.1209,4.0,4317.7633,959.0,2259.47,180.0,QuickCash,0.0,4864929,4.0,15-03-2023,False,Travel Expenses,2023-03-14,Green,0.0,6103.0,6100.25
0062x00000DIvWGAA1,0010K00001rImDqQAK,RIVERVIEW,QLD,Australia,Loan Paid,Existing Client-Granted Loan Before,0.0,54.64,526.24,2.0,3.0,0.0,1.0,2.0,5762.7,8.0,17.0,0.0,2881.35,2340.8,0.0,0.88,0.0,0.0,4550.0,599.0,800.0,1250,1600.0,2.0,6.857,Monthly,41.0,5762.7,1250.0,Full-Time Employment,8.0,0.0,0.2418,2.0,5762.7,266.0,912.9033,800.0,QuickCash,0.0,4862096,5.0,14-03-2023,False,Travel Expenses,2023-03-14,Green,0.0,7738.0,5762.7
0062x00000ELpCiAAL,0012x00000kfmTEAAY,Blacktown,NSW,Australia,Closed Lost,New Client-New Loan,0.0,35.76,127.6666,2.0,0.0,0.0,3.0,2.0,4531.9997,1.0,10.0,0.0,1867.3314,2113.47,0.0,0.0,0.0,0.0,0.0,0.0,150.0,1200,1680.0,10.0,20.429,Fortnightly,27.0,4832.11,2000.0,,1.0,0.0,0.0,1.0,4357.1066,0.0,1473.0833,168.0,MoneySpot,,6062292,0.0,01-08-2023,False,Holiday/travel,2023-07-31,Green,0.0,4878.0,4832.11
0062x00000D7BZGAA3,0012800001SDTvIAAX,Hoppers Crossing,VIC,Australia,Loan Paid,Existing Client-Granted Loan Before,0.0,80.27,5483.8589,2.0,0.0,0.0,3.0,2.0,7179.1795,0.0,52.0,1105.5527,3229.0585,3094.04,1.0,49.44,0.0,0.0,0.0,599.0,900.0,1200,1632.0,7.0,13.857,Fortnightly,52.0,7184.18,1200.0,,0.0,0.0,1.0,0.0,7534.47,2108.0,6001.2633,233.14,MoneySpot,0.0,4471292,0.0,13-01-2023,False,Home Maintenance & Repairs,2023-01-13,Green,0.0,8523.0,7184.18
0062x00000EwAQ4AAN,0012x00000fp52jAAA,Westmead,NSW,Australia,Loan Paid,Existing Client-No Loan Granted Ever,0.0,63.75,1505.4149,1.0,0.0,0.0,3.0,1.0,11013.7881,2.0,17.0,0.0,1516.6923,1416.0,0.0,0.15,0.0,0.0,0.0,599.0,860.0,1200,1632.0,16.0,16.429,Weekly,29.0,11835.45,2500.0,,2.0,0.0,0.011,0.0,6572.3333,791.0,1496.6733,102.0,MoneySpot,0.0,6566449,1.0,18-09-2023,False,Vehicle Expenses,2023-09-18,Green,0.0,20753.0,11835.45
0062x00000DZIRGAA5,0012x00000e0RRUAA2,Wentworth Point,NSW,Australia,Loan Paid,Existing Client-No Loan Granted Ever,0.0,56.89,1156.2966,2.0,0.0,0.0,3.0,2.0,3826.155,0.0,19.0,521.6966,1761.08,1358.78,0.0,23.59,0.0,0.0,4333.33,400.0,450.0,1200,1584.0,5.0,10.286,Fortnightly,35.0,3826.16,3000.0,Full-Time Employment,0.0,0.0,1.0,0.0,3522.16,561.0,1272.4766,316.8,MoneySpot,0.0,5085514,0.0,19-04-2023,False,Living Expenses,2023-04-19,Green,0.0,4091.0,3826.16
0062x00000D8omkAAB,0012x00000BGXOiAAP,Kalgoorlie,WA,Australia,Closed Lost,Existing Client-Granted Loan Before,0.0,34.13,1700.0926,1.0,0.0,0.0,3.0,1.0,9999.9691,0.0,37.0,1000.0274,1949.2543,2338.99,0.0,0.0,0.0,0.0,5850.0,1499.0,1000.0,1200,1632.0,14.0,14.143,Weekly,51.0,9999.97,3000.0,Full-Time Employment,0.0,0.0,0.7582,0.0,10396.0233,1070.0,1882.1366,116.57,MoneySpot,,4550883,0.0,25-01-2023,False,Other Expenses,2023-01-25,Orange,0.0,10581.0,9999.97
0062x00000DHOiqAAH,0012x00000gmikbAAA,Griffith,NSW,Australia,Loan Paid,Existing Client-No Loan Granted Ever,0.38,44.29,200.0,1.0,0.0,0.0,4.0,1.0,5370.8178,2.0,23.0,0.0,982.764,1871.45,0.0,0.0,0.0,0.0,3683.33,400.0,600.0,1200,1536.0,6.0,6.286,Weekly,27.0,5504.15,2000.0,Full-Time Employment,2.0,0.0,0.4505,0.0,1988.1866,0.0,215.8333,256.0,MoneySpot,0.0,4776200,0.0,01-03-2023,False,Child Expenses,2023-03-01,Green,13.0,3408.0,5504.15
0062x00000DXZ2uAAH,0010K00001vJzGjQAK,Werribee,VIC,Australia,Closed Lost,Existing Client-Granted Loan Before,43.76,95.71,760.6634,2.0,0.0,2.0,4.0,2.0,4580.3977,0.0,17.0,341.33,796.515,873.89,1.0,0.0,0.0,0.0,1512.33,400.0,350.0,1200,1584.0,5.0,9.714,Fortnightly,33.0,5713.33,5000.0,Unemployed,0.0,0.0,0.2308,0.0,2898.2,864.0,984.45,316.8,MoneySpot,,4982553,0.0,02-04-2023,True,Relocation Expenses,2023-04-01,Orange,2898.0,6621.0,5713.33
0062x00000DHb4HAAT,0010K00001usnomQAA,Chuwar,QLD,Australia,Loan Paid,Existing Client-Granted Loan Before,35.1,75.73,2135.8205,2.0,0.0,2.0,3.0,2.0,7611.0679,2.0,38.0,1345.6739,1635.275,1635.27,1.0,2.13,0.0,0.0,650.0,400.0,0.0,1300,1716.0,7.0,13.0,Fortnightly,38.0,7825.41,1300.0,Casual Employment,2.0,0.0,0.0879,1.0,7427.8133,1544.0,2958.31,245.14,QuickCash,0.0,4785938,1.0,02-03-2023,False,Living Expenses,2023-03-02,Green,2950.0,8403.0,7825.41
0062x00000DsHZfAAN,0012x00000g9ifvAAA,Crestmead,QLD,Australia,Closed Lost,Existing Client-No Loan Granted Ever,0.0,90.41,0.0,2.0,1.0,0.0,2.0,2.0,5124.6196,10.0,13.0,0.0,2242.4342,2020.04,0.0,1.25,0.0,0.0,0.0,0.0,0.0,1200,1536.0,3.0,6.143,Fortnightly,49.0,6560.21,1500.0,Employed full-time,10.0,0.0,0.0,1.0,5232.3466,1393.0,1505.9466,512.0,MoneySpot,,5230192,4.0,14-05-2023,False,Other,2023-05-09,Green,0.0,7067.0,6560.21
0062x00000DIRtuAAH,0012x00000MiNAbAAN,Ferntree Gully,VIC,Australia,Loan Paid,Existing Client-No Loan Granted Ever,31.23,68.68,2932.4678,1.0,0.0,4.0,1.0,1.0,6570.0841,0.0,98.0,2330.6913,852.2492,962.6,2.0,0.0,0.0,1.0,0.0,899.0,200.0,1200,1632.0,16.0,16.571,Weekly,41.0,6658.42,5000.0,,0.0,0.0,0.0,0.0,2152.8066,2073.0,2661.0266,102.0,MoneySpot,0.0,4834468,0.0,10-03-2023,False,Furniture or Appliances,2023-03-09,Green,2153.0,6893.0,6658.42
0062x00000EdQqIAAV,0012x00000lGjeGAAS,Homebush,NSW,Australia,Closed Lost,New Client-New Loan,0.0,29.72,397.3966,2.0,0.0,0.0,2.0,2.0,6459.0278,0.0,3.0,0.0,2972.9233,2943.16,0.0,57.45,0.0,0.0,0.0,0.0,1100.0,1200,1632.0,8.0,16.286,Fortnightly,45.0,13594.03,3000.0,,0.0,0.0,0.0,0.0,5945.8466,0.0,583.73,204.0,MoneySpot,,6420681,0.0,09-09-2023,False,Family expenses,2023-09-04,Green,0.0,16802.0,13594.03
0062x00000DskqTAAR,0012x00000TujiAAAR,WARWICK FARM,NSW,Australia,Loan Paid,Existing Client-Granted Loan Before,0.0,82.45,726.558,4.0,0.0,0.0,3.0,4.0,3805.6266,1.0,26.0,448.0,1169.61,1262.27,0.0,0.0,0.0,0.0,2729.89,599.0,440.0,1200,1632.0,7.0,13.714,Fortnightly,52.0,3805.63,2050.0,Full-Time Employment,1.0,0.0,0.011,0.0,3118.96,1811.0,1810.6966,233.14,MoneySpot,0.0,5262509,0.0,13-05-2023,False,Travel Expenses,2023-05-13,Orange,0.0,4169.0,3805.63
0062x00000E4oUkAAJ,0012x00000iIhawAAC,Holmview,QLD,Australia,Loan Paid,New Client-New Loan,0.0,58.5,1807.7975,1.0,0.0,0.0,2.0,1.0,5777.8517,0.0,82.0,0.0,1310.493,1420.2,1.0,0.0,0.0,0.0,4810.0,400.0,200.0,1200,1632.0,15.0,15.0,Weekly,54.0,5777.85,2050.0,Full-Time Employment,0.0,0.0,0.7802,0.0,5678.8033,773.0,2024.7566,108.8,QuickCash,0.0,5600899,0.0,14-06-2023,False,Home Maintenance & Repairs,2023-06-13,Green,0.0,5782.0,5777.85
0062x00000DH9fyAAD,0012x000003Dz9VAAS,HILLSDALE,NSW,Australia,Loan Paid,Existing Client-No Loan Granted Ever,0.0,80.37,2435.2014,2.0,0.0,0.0,6.0,2.0,4789.9999,0.0,28.0,0.0,528.5714,440.0,4.0,0.59,0.0,1.0,4433.0,400.0,800.0,1200,1536.0,6.0,6.571,Weekly,43.0,4790.0,2000.0,Full-Time Employment,5.0,0.0,0.011,1.0,0.0,579.0,4858.7266,256.0,MoneySpot,0.0,4764135,5.0,27-02-2023,False,Vehicle - Repairs,2023-02-27,Orange,0.0,5260.0,4790.0
0062x00000DWUkyAAH,0012x00000KMYNxAAP,Cowes,VIC,Australia,Loan Paid,Existing Client-No Loan Granted Ever,0.0,36.88,6010.8611,2.0,1.0,0.0,2.0,2.0,14185.9304,4.0,81.0,322.7426,5029.95,5114.28,1.0,0.23,0.0,0.0,4539.26,1499.0,1250.0,1200,1536.0,3.0,4.857,Fortnightly,33.0,14190.93,2050.0,Full-Time Employment,4.0,0.0,0.0989,3.0,10059.9,320.0,6938.4966,512.0,MoneySpot,0.0,4919219,3.0,23-03-2023,False,Medical Expenses,2023-03-23,Orange,0.0,13742.0,14190.93
0062x00000DUdfoAAD,0012x00000iGuwpAAC,Old Beach,TAS,Australia,Loan Paid,New Client-New Loan,0.0,8.8,258.0895,2.0,1.0,0.0,2.0,2.0,3879.2088,4.0,11.0,0.0,1642.4214,1830.26,1.0,0.0,0.0,0.0,4008.33,599.0,0.0,1200,1584.0,5.0,10.0,Fortnightly,28.0,4184.54,2100.0,Full-Time Employment,4.0,0.0,0.033,0.0,3832.3166,0.0,798.7133,316.8,MoneySpot,0.0,5377715,4.0,24-05-2023,False,Medical Expenses,2023-05-24,Green,0.0,4530.0,4184.54
0062x00000FL3MxAAL,0012x00000n0cVHAAY,Glenhaven,NSW,Australia,Loan Paid,New Client-New Loan,0.0,76.67,923.2362,2.0,0.0,0.0,4.0,2.0,8544.5586,0.0,9.0,0.0,2826.6466,2466.51,1.0,0.0,0.0,0.0,5416.67,400.0,0.0,1200,1632.0,8.0,15.0,Fortnightly,19.0,8544.56,2500.0,Full-Time Employment,0.0,0.0,0.044,0.0,5653.2933,0.0,906.5733,204.0,MoneySpot,0.0,7433573,0.0,08-12-2023,False,Furniture or Appliances,2023-12-07,Green,0.0,8210.0,8544.56
0062x00000D1sA5AAJ,0012x00000XPTRpAAP,Bucca,NSW,Australia,Loan Paid,Existing Client-Granted Loan Before,0.0,63.26,1748.5801,2.0,0.0,0.0,3.0,2.0,7791.4266,3.0,34.0,267.6667,3330.4328,3168.6,0.0,0.11,0.0,0.0,7386.21,899.0,1600.0,1500,2040.0,7.0,14.0,Fortnightly,58.0,7791.43,1500.0,Full-Time Employment,3.0,0.0,0.033,0.0,7771.01,935.0,1841.63,291.43,QuickCash,0.0,4415830,2.0,05-01-2023,False,Veterinary Expenses,2023-01-05,Orange,0.0,9400.0,7791.43
0062x00000DZLdFAAX,0012x00000hY7cqAAC,Berwick,VIC,Australia,Closed Lost,Existing Client-No Loan Granted Ever,0.0,91.92,778.4732,2.0,0.0,0.0,3.0,2.0,7911.8675,0.0,5.0,0.0,2113.7085,1948.69,0.0,0.0,0.0,0.0,0.0,1499.0,0.0,1200,1680.0,10.0,19.286,Fortnightly,32.0,7911.87,5000.0,Full-Time Employment,0.0,0.0,0.022,0.0,5886.5733,0.0,2558.8,168.0,MoneySpot,,5087727,0.0,23-04-2023,False,Other Expenses,2023-04-18,Green,0.0,17119.0,7911.87
0062x00000FgSHSAA3,0010K0000240mzzQAA,Trinity Park,QLD,Australia,Closed Lost,Existing Client-No Loan Granted Ever,0.0,37.52,477.9735,1.0,0.0,0.0,1.0,1.0,6041.3954,0.0,18.0,0.0,1518.8333,1676.0,2.0,1.21,0.0,0.0,4541.33,899.0,2200.0,1200,1632.0,15.0,14.714,Weekly,44.0,7847.4,3000.0,Full-Time Employment,0.0,0.0,0.1758,0.0,6075.3333,2.0,461.74,108.8,MoneySpot,,7809336,0.0,2024-01-11,False,Living Expenses,2024-01-10,Green,0.0,9194.0,7847.4
0062x00000DFytAAAT,0012x00000XPYMuAAP,Echuca,VIC,Australia,Loan Paid,Existing Client-Granted Loan Before,40.89,92.69,1697.8896,1.0,0.0,4.0,2.0,1.0,4833.8938,21.0,66.0,959.2274,747.7369,866.03,0.0,0.0,0.0,0.0,3751.62,599.0,1000.0,1500,2040.0,14.0,13.857,Weekly,34.0,5972.59,1500.0,Full-Time Employment,21.0,0.0,0.2088,2.0,4478.5866,1254.0,1960.1066,145.71,Financier-2,0.0,4696556,21.0,18-02-2023,False,Child Expenses,2023-02-18,Green,2637.0,6448.0,5972.59
0062x00000EdBlEAAV,0012x00000dzytRAAQ,Mount Waverley,VIC,Australia,Loan Paid,Existing Client-Granted Loan Before,0.0,79.28,3029.6399,3.0,1.0,0.0,1.0,3.0,27108.6916,2.0,25.0,91.25,10866.3066,8183.5,1.0,15.56,0.0,0.0,0.0,599.0,0.0,1250,1600.0,2.0,6.714,Monthly,33.0,29258.13,1250.0,Full-Time Employment,2.0,0.0,0.4505,0.0,18454.8933,597.0,3659.8,800.0,MoneySpot,0.0,6404228,1.0,02-09-2023,False,Living Expenses,2023-09-02,Green,0.0,28682.0,29258.13
0062x00000D9XC3AAN,0012x00000gAYNEAA4,Mordialloc,VIC,Australia,Loan Paid,Existing Client-No Loan Granted Ever,0.0,74.29,183.75,1.0,0.0,0.0,3.0,1.0,4486.8488,0.0,8.0,0.0,773.543,870.0,0.0,0.48,0.0,0.0,0.0,400.0,800.0,1200,1536.0,6.0,6.286,Weekly,34.0,4486.85,1500.0,,0.0,0.0,0.0,0.0,3352.02,0.0,398.4,256.0,MoneySpot,0.0,4587239,0.0,31-01-2023,False,Furniture or Appliances,2023-01-31,Green,0.0,3996.0,4486.85
0062x00000DIcThAAL,0012x00000cxOKgAAM,Charleville,QLD,Australia,Loan Paid,Existing Client-Granted Loan Before,8.68,68.63,1773.3621,2.0,3.0,2.0,2.0,2.0,6396.8597,14.0,36.0,0.0,1580.9083,1618.09,1.0,1.84,0.0,0.0,3386.5,400.0,100.0,1200,1584.0,5.0,10.571,Fortnightly,35.0,4184.57,2050.0,Full-Time Employment,14.0,0.0,0.3077,8.0,3872.58,1292.0,2199.7966,316.8,MoneySpot,0.0,4844221,12.0,12-03-2023,False,Living Expenses,2023-03-11,Orange,711.0,8185.0,4184.57
0062x00000EdIvrAAF,0012x00000lGeuVAAS,Hilbert,WA,Australia,Loan Paid,New Client-New Loan,0.0,28.88,325.6466,2.0,0.0,0.0,1.0,2.0,2876.9737,4.0,4.0,0.0,1160.83,1002.48,0.0,0.0,0.0,0.0,0.0,0.0,1000.0,1200,1632.0,17.0,17.143,Weekly,30.0,2876.97,3000.0,Full-Time Employment,4.0,0.0,0.033,4.0,2708.6033,0.0,325.6466,96.0,MoneySpot,0.0,6414649,0.0,04-09-2023,False,medical_dental_bill,2023-09-03,Green,0.0,7352.0,2876.97
0062x00000FJVK7AAP,0012x00000mJ7pgAAC,Herne Hill,VIC,Australia,Closed Lost,New Client-New Loan,0.0,48.67,0.0,1.0,1.0,0.0,3.0,1.0,5847.979,1.0,4.0,0.0,1345.8363,1906.56,0.0,1.39,0.0,0.0,1900.0,2000.0,280.0,1200,1680.0,18.0,18.429,Weekly,24.0,5518.07,5000.0,Casual Employment,1.0,0.0,0.0,0.0,4934.7333,0.0,116.19,93.33,MoneySpot,,7327813,1.0,27-11-2023,False,Home Maintenance & Repairs.,2023-11-27,Green,0.0,7178.0,5518.07
0062x00000D9Q9WAAV,0012x00000LSi8tAAD,Cranbourne West,VIC,Australia,Closed Lost,Existing Client-Granted Loan Before,0.0,52.71,2506.4668,1.0,0.0,0.0,1.0,1.0,5038.695,0.0,71.0,719.5105,1143.4038,1126.0,0.0,0.3,0.0,0.0,0.0,400.0,1200.0,1200,1632.0,16.0,16.143,Weekly,30.0,4968.36,2050.0,,0.0,0.0,0.0,0.0,4954.75,1244.0,2648.3866,102.0,MoneySpot,,4581536,0.0,30-01-2023,False,Living Expenses,2023-01-30,Green,0.0,5721.0,4968.36
0062x00000E3r5BAAR,0012x00000c70ZCAAY,Bli Bli,QLD,Australia,Closed Lost,Existing Client-No Loan Granted Ever,0.0,23.1,1562.5718,2.0,0.0,0.0,3.0,2.0,5941.7739,0.0,0.0,134.63,1435.324,1461.42,1.0,0.01,0.0,0.0,13330.49,899.0,800.0,1200,1920.0,20.0,39.286,Fortnightly,45.0,6499.97,10000.0,Part-Time Employment,4.0,0.0,0.011,0.0,3168.7666,324.0,1611.79,96.0,MoneySpot,,5520824,4.0,06-06-2023,False,Living Expenses,2023-06-06,Green,0.0,15984.0,6499.97
0062x00000DVNrfAAH,0012x00000iHOlBAAW,Blacktown,NSW,Australia,Closed Lost,New Client-New Loan,6.14,23.57,417.8666,2.0,0.0,0.0,3.0,2.0,4101.9609,0.0,14.0,0.0,1863.7714,1772.34,0.0,13.95,0.0,0.0,0.0,0.0,0.0,1200,1632.0,8.0,15.286,Fortnightly,33.0,4526.54,5000.0,,0.0,0.0,0.0,0.0,4348.8,0.0,554.22,204.0,MoneySpot,,5441298,0.0,02-06-2023,False,Car maintenance,2023-05-30,Green,392.0,6381.0,4526.54
0062x00000D9D8fAAF,0012x00000Rpx0iAAB,Flynn,ACT,Australia,Loan Paid,Existing Client-Granted Loan Before,0.0,43.41,711.3895,2.0,0.0,0.0,2.0,2.0,5309.6002,0.0,22.0,0.0,2443.8716,2179.21,1.0,0.0,0.0,0.0,4831.4,599.0,0.0,1200,1632.0,7.0,14.571,Fortnightly,30.0,5309.6,3000.0,Full-Time Employment,0.0,0.0,0.044,0.0,4887.7433,0.0,694.7266,233.14,MoneySpot,0.0,4570926,0.0,28-01-2023,False,Vehicle Expenses,2023-01-28,Orange,0.0,4921.0,5309.6
0062x00000D7A7QAAV,0012x00000g83CZAAY,Ryde,NSW,Australia,Loan Paid,Existing Client-No Loan Granted Ever,0.0,10.59,0.0,2.0,0.0,0.0,4.0,2.0,3884.7436,0.0,1.0,0.0,1788.0471,1558.04,0.0,4.02,0.0,0.0,1530.0,400.0,1140.0,1200,1584.0,6.0,12.0,Fortnightly,59.0,3884.74,2050.0,Full-Time Employment,0.0,0.0,0.0,0.0,4172.11,0.0,90.2533,264.0,MoneySpot,0.0,4470323,0.0,13-01-2023,False,Living Expenses,2023-01-13,Green,0.0,4578.0,3884.74
0062x00000ECMqSAAX,0010K00001y2QPDQA2,Canley Heights,NSW,Australia,Closed Lost,Existing Client-No Loan Granted Ever,0.0,96.0,473.3333,1.0,0.0,0.0,3.0,1.0,2766.009,6.0,8.0,0.0,508.8021,545.2,0.0,3.45,0.0,0.0,3466.67,599.0,1000.0,1200,1872.0,36.0,36.429,Weekly,26.0,2579.34,2050.0,Full-Time Employment,6.0,0.0,1.0,0.0,2374.41,0.0,753.3333,52.0,MoneySpot,,5874102,6.0,10-07-2023,False,Medical Expenses,2023-07-10,Green,0.0,3074.0,2579.34
0062x00000EdCNYAA3,0012x00000haIZOAA2,Bonython,ACT,Australia,Loan Paid,Existing Client-Granted Loan Before,0.55,36.22,577.2533,4.0,0.0,4.0,2.0,4.0,1989.6998,1.0,69.0,0.0,1135.61,1208.44,1.0,1.32,0.0,0.0,0.0,1500.0,0.0,1500,2040.0,16.0,16.571,Weekly,40.0,12954.05,1500.0,Full-Time Employment,1.0,0.0,0.011,0.0,1567.6966,421.0,1521.94,127.5,MoneySpot,0.0,6405396,0.0,02-09-2023,False,Living Expenses,2023-09-02,Orange,67.0,12081.0,12954.05
0062x00000DIJH3AAP,0012x00000gp7ryAAA,Saint George,QLD,Australia,Loan Paid,New Client-New Loan,0.59,54.74,3548.6435,4.0,0.0,0.0,2.0,4.0,6246.1901,5.0,72.0,1587.4953,1330.2222,1208.0,0.0,5.0,0.0,0.0,0.0,0.0,100.0,1200,1536.0,3.0,5.857,Fortnightly,57.0,11416.85,2000.0,,5.0,0.0,0.3736,5.0,8527.7566,2185.0,4627.3866,512.0,MoneySpot,0.0,4826657,1.0,09-03-2023,False,Vehicle - Registration,2023-03-09,Orange,67.0,11330.0,11416.85
0062x00000E3xWCAAZ,0012x00000iIAL7AAO,Noble Park,VIC,Australia,Loan Paid,New Client-New Loan,0.0,75.49,186.82,1.0,0.0,0.0,3.0,1.0,6692.4941,0.0,16.0,1128.4583,1064.5741,1023.62,0.0,0.0,0.0,0.0,0.0,0.0,0.0,1200,1776.0,29.0,29.143,Weekly,26.0,8919.16,6500.0,Full-Time Employment,0.0,0.0,0.0,0.0,4258.2966,594.0,780.42,61.24,MoneySpot,0.0,5529660,0.0,07-06-2023,False,"Holiday, Travel & Accommodation,Maintenance",2023-06-07,Green,0.0,9904.0,8919.16
0062x00000DtRmAAAV,0012x00000bmur9AAA,Rossi,NSW,Australia,Loan Paid,Existing Client-No Loan Granted Ever,2.1,50.88,784.4333,1.0,0.0,0.0,4.0,1.0,4094.2308,3.0,47.0,1902.6783,777.6861,690.54,1.0,0.73,0.0,0.0,1388.83,400.0,200.0,1200,1632.0,14.0,14.143,Weekly,39.0,4200.9,2100.0,Unemployed,3.0,0.0,0.0,3.0,3369.9733,643.0,762.61,116.57,MoneySpot,0.0,5313837,0.0,19-05-2023,False,Living Expenses,2023-05-18,Orange,101.0,4793.0,4200.9
0062x00000FJJ0gAAH,0012x00000cvsfnAAA,Noble Park,VIC,Australia,Closed Lost,Existing Client-No Loan Granted Ever,0.0,22.53,2554.4799,2.0,0.0,0.0,2.0,2.0,8773.3776,0.0,42.0,0.0,2990.2683,3483.75,1.0,0.06,0.0,0.0,5438.33,400.0,760.0,1200,1632.0,8.0,16.571,Fortnightly,53.0,8773.38,3500.0,Full-Time Employment,0.0,0.0,0.033,0.0,5980.5366,75.0,2538.4333,204.0,MoneySpot,,7314038,0.0,29-11-2023,False,Vehicle Expenses,2023-11-25,Green,0.0,8257.0,8773.38
0062x00000D1blGAAR,0010K00001g9q9HQAQ,Redcliffe,WA,Australia,Loan Paid,Existing Client-Granted Loan Before,0.53,52.66,599.3958,2.0,0.0,0.0,3.0,2.0,4568.7159,0.0,24.0,164.3332,2055.3,2469.93,0.0,2.85,0.0,0.0,5308.33,599.0,960.0,1050,1428.0,7.0,13.286,Fortnightly,34.0,4568.72,1050.0,Full-Time Employment,0.0,0.0,0.0989,0.0,4110.6,427.0,1530.62,204.0,QuickCash,0.0,4399833,0.0,03-01-2023,False,Life Event Expenses,2023-01-03,Green,27.0,5050.0,4568.72
0062x00000FISUdAAP,0012x00000Mh9NQAAZ,Brunswick East,VIC,Australia,Loan Paid,Existing Client-No Loan Granted Ever,0.0,24.57,1746.4235,2.0,0.0,0.0,2.0,2.0,5523.6279,0.0,13.0,0.0,1988.9071,1985.01,2.0,0.0,0.0,0.0,4746.51,599.0,800.0,1200,1680.0,10.0,19.429,Fortnightly,39.0,5534.46,2500.0,Full-Time Employment,0.0,0.0,0.0,0.0,4640.7833,50.0,2471.6433,168.0,Financier-2,0.0,7251273,0.0,19-11-2023,False,Living Expenses,2023-11-19,Green,0.0,5917.0,5534.46
0062x00000Dtjg0AAB,0012x00000haJn9AAE,West Mackay,QLD,Australia,Loan Paid,New Client-New Loan,0.15,20.52,1790.6528,1.0,0.0,0.0,2.0,1.0,7742.8025,0.0,15.0,0.0,999.8976,1001.97,2.0,0.23,0.0,0.0,4333.33,400.0,800.0,1200,1632.0,15.0,15.429,Weekly,54.0,7604.79,5000.0,Full-Time Employment,0.0,0.0,0.022,0.0,4332.89,0.0,1802.4033,108.8,MoneySpot,0.0,5340698,0.0,21-05-2023,False,Life Event Expenses,2023-05-21,Green,13.0,8574.0,7604.79
0062x00000EEcAJAA1,0012x00000c96RlAAI,Singleton,NSW,Australia,Loan Paid,Existing Client-Granted Loan Before,0.0,63.95,1509.0008,1.0,1.0,0.0,2.0,1.0,5954.2265,4.0,35.0,0.0,1103.3214,972.5,1.0,0.0,0.0,1.0,4856.87,899.0,1520.0,1500,2040.0,16.0,15.857,Weekly,23.0,5593.23,1500.0,Full-Time Employment,7.0,0.0,0.0,7.0,0.0,714.0,1507.4933,127.5,MoneySpot,0.0,6025505,6.0,28-07-2023,False,Living Expenses,2023-07-27,Orange,0.0,6573.0,5593.23
0062x00000DGxjtAAD,0012x00000goQRnAAM,MOOREBANK,NSW,Australia,Closed Lost,New Client-New Loan,0.0,66.37,592.3166,1.0,1.0,0.0,3.0,1.0,10001.6532,1.0,14.0,0.0,1598.0164,1387.5,0.0,53.44,0.0,0.0,0.0,0.0,200.0,1200,1536.0,6.0,5.714,Weekly,31.0,10305.99,2000.0,,1.0,0.0,0.011,1.0,7457.41,0.0,750.1333,256.0,MoneySpot,,4752146,1.0,25-02-2023,False,Other,2023-02-24,Green,0.0,18872.0,10305.99
0062x00000D73FLAAZ,0010K00001wUZPIQA4,Croydon,NSW,Australia,Loan Paid,Existing Client-Granted Loan Before,27.2,62.77,773.8287,0.0,0.0,2.0,2.0,2.0,1339.4405,14.0,32.0,163.7938,616.51,472.0,1.0,0.0,0.0,0.0,3542.5,400.0,1.0,1100,1452.0,5.0,9.143,Fortnightly,31.0,3769.49,1100.0,Full-Time Employment,14.0,0.0,0.0,8.0,1233.02,565.0,1172.7533,290.4,QuickCash,0.0,4465272,0.0,13-01-2023,True,Living Expenses,2023-01-12,Orange,1300.0,4779.0,3769.49
0062x00000DYWa1AAH,0012x00000XCVuFAAX,Macquarie Hills,NSW,Australia,Loan Paid,Existing Client-Granted Loan Before,0.0,32.12,1563.5262,1.0,0.0,0.0,4.0,1.0,1934.8187,1.0,55.0,0.0,144.0,200.0,0.0,0.03,0.0,1.0,14433.43,899.0,1100.0,1500,1920.0,8.0,8.143,Weekly,49.0,14647.69,2050.0,Full-Time Employment,1.0,0.0,0.0,1.0,0.0,794.0,1995.6933,240.0,MoneySpot,0.0,5038367,0.0,11-04-2023,False,Vehicle Expenses,2023-04-11,Orange,0.0,14924.0,14647.69
0062x00000DrQj2AAF,0012x00000IOIGBAA5,Highett,VIC,Australia,Loan Paid,Existing Client-Granted Loan Before,0.0,57.39,1028.9884,1.0,1.0,0.0,5.0,1.0,5077.7209,9.0,24.0,701.5206,1168.5714,1220.0,1.0,45.78,0.0,1.0,0.0,599.0,1200.0,1200,1728.0,24.0,23.857,Weekly,30.0,5453.33,2050.0,,9.0,0.0,0.0659,5.0,0.0,381.0,1112.4833,72.0,QuickCash,0.0,5166822,5.0,30-04-2023,False,Living Expenses,2023-04-30,Green,0.0,9316.0,5453.33
0062x00000FXTExAAP,0012x00000n42eEAAQ,Kambalda West,WA,Australia,Loan Paid,New Client-New Loan,0.0,17.4,3844.7887,3.0,0.0,0.0,4.0,3.0,6791.44,24.0,51.0,324.8848,6636.44,6868.46,1.0,0.0,0.0,0.0,8600.0,1500.0,650.0,1200,1632.0,4.0,14.429,Monthly,56.0,6791.44,1200.0,Full-Time Employment,24.0,0.0,0.4505,6.0,6636.44,333.0,4215.8366,408.0,QuickCash,0.0,7756502,9.0,2024-01-06,False,Living Expenses,2024-01-06,Orange,0.0,7000.0,6791.44
0062x00000Drm02AAB,0012x00000hZ3KtAAK,Hobartville,NSW,Australia,Loan Paid,New Client-New Loan,21.92,95.28,573.4597,1.0,0.0,2.0,3.0,1.0,3578.9922,7.0,40.0,183.5561,544.584,521.89,1.0,0.0,0.0,0.0,0.0,0.0,1100.0,1200,1584.0,9.0,9.0,Weekly,33.0,4531.53,3000.0,,11.0,0.0,0.6264,1.0,2209.99,253.0,573.6266,176.0,MoneySpot,0.0,5192038,6.0,04-05-2023,False,Other,2023-05-03,Green,1444.0,6587.0,4531.53
0062x00000DInV0AAL,0012x00000gpNDaAAM,Lake Heights,NSW,Australia,Loan Paid,New Client-New Loan,20.19,60.24,829.4327,1.0,0.0,2.0,2.0,1.0,6821.1383,0.0,12.0,92.4914,805.0761,806.58,0.0,0.0,0.0,0.0,5091.67,400.0,1060.0,1200,1536.0,8.0,8.286,Weekly,28.0,5205.14,2200.0,Full-Time Employment,0.0,0.0,0.0,0.0,5010.2333,798.0,1907.1933,192.0,MoneySpot,0.0,4855344,0.0,13-03-2023,False,Living Expenses,2023-03-13,Green,1522.0,7537.0,5205.14
0062x00000D20U3AAJ,0012x00000IPPNJAA5,Darley,VIC,Australia,Closed Lost,Existing Client-No Loan Granted Ever,0.0,93.28,4542.5336,1.0,0.0,0.0,4.0,1.0,19611.9504,0.0,0.0,0.0,2626.001,1740.42,0.0,0.09,0.0,1.0,5200.0,400.0,450.0,1400,1792.0,6.0,6.571,Weekly,61.0,25291.19,1400.0,Full-Time Employment,0.0,0.0,0.0,0.0,4107.7266,0.0,4659.4933,298.67,MoneySpot,,4422749,0.0,09-01-2023,False,Once off purchase,2023-01-05,Orange,0.0,19449.0,25291.19
0062x00000F4L8iAAF,0012x00000lhBQMAA2,Randwick,NSW,Australia,Closed Lost,Existing Client-No Loan Granted Ever,0.0,7.9,3727.6851,2.0,1.0,0.0,3.0,2.0,9284.557,0.0,44.0,0.0,4170.83,4170.83,1.0,0.0,0.0,0.0,4171.0,899.0,2500.0,1200,1584.0,6.0,11.0,Fortnightly,43.0,9284.56,3750.0,Full-Time Employment,6.0,0.0,0.0769,6.0,8341.66,0.0,4016.1933,264.0,MoneySpot,,7126750,1.0,09-11-2023,False,Child Expenses,2023-11-09,Green,0.0,8972.0,9284.56
0062x00000F1rdZAAR,0012x00000iK0ICAA0,Ripley,QLD,Australia,Loan Paid,Existing Client-Granted Loan Before,0.0,89.38,616.5458,2.0,0.0,0.0,3.0,2.0,3812.5218,4.0,18.0,0.0,1250.8866,703.28,0.0,0.0,0.0,0.0,0.0,400.0,600.0,1250,1900.0,17.0,34.429,Fortnightly,23.0,4300.69,1500.0,Part-Time Employment,4.0,0.0,1.0,2.0,3088.67,132.0,429.1133,111.76,MoneySpot,0.0,6925694,0.0,23-10-2023,False,Travel Expenses,2023-10-23,Green,0.0,4208.0,4300.69
0062x00000DZoZAAA1,0010K000028i06jQAA,DARLINGHURST,NSW,Australia,Loan Paid,Existing Client-No Loan Granted Ever,3.6,39.19,1863.565,1.0,0.0,0.0,3.0,1.0,7627.6073,6.0,43.0,184.8,1322.5375,1600.2,0.0,0.07,0.0,0.0,6066.67,1499.0,1250.0,1200,1584.0,10.0,9.714,Weekly,36.0,6300.15,3250.0,Full-Time Employment,9.0,0.0,0.8462,2.0,5290.15,587.0,2193.5566,158.4,MoneySpot,0.0,5115638,2.0,23-04-2023,False,Travel Expenses,2023-04-23,Green,250.0,6938.0,6300.15
0062x00000F3puBAAR,0012x00000NxySuAAJ,Kenwick,WA,Australia,Closed Lost,Existing Client-No Loan Granted Ever,0.0,29.04,1157.6457,1.0,0.0,0.0,3.0,1.0,6926.9642,0.0,22.0,0.0,1594.1507,2603.04,3.0,0.5,0.0,0.0,2946.67,599.0,800.0,1200,1632.0,13.0,13.429,Weekly,45.0,8573.43,2500.0,Full-Time Employment,0.0,0.0,0.0,0.0,6907.9866,0.0,2228.65,125.54,MoneySpot,,7083464,0.0,06-11-2023,False,Vehicle Expenses,2023-11-05,Green,0.0,8629.0,8573.43
0062x00000EdKkeAAF,0012x00000gpWIPAA2,Bethania,QLD,Australia,Closed Lost,Existing Client-No Loan Granted Ever,0.0,41.43,661.9778,1.0,0.0,0.0,2.0,1.0,4198.8687,4.0,13.0,0.0,828.27,894.84,0.0,1.83,0.0,0.0,3726.67,400.0,200.0,1200,1776.0,29.0,29.286,Weekly,52.0,4198.87,5200.0,Full-Time Employment,4.0,0.0,0.9451,0.0,3865.26,0.0,497.4733,61.24,MoneySpot,,6416577,0.0,08-09-2023,False,Living Expenses,2023-09-03,Green,0.0,3872.0,4198.87
0062x00000EcjPHAAZ,0012x00000lG3V0AAK,Narre Warren South,VIC,Australia,Loan Paid,New Client-New Loan,0.0,19.83,397.6522,2.0,0.0,0.0,3.0,2.0,2654.1826,0.0,6.0,0.0,1221.6516,970.91,1.0,0.0,0.0,0.0,0.0,0.0,120.0,1200,1872.0,18.0,35.143,Fortnightly,27.0,2654.18,3000.0,,0.0,0.0,0.0,0.0,2443.3033,0.0,366.06,104.0,MoneySpot,0.0,6374052,0.0,30-08-2023,False,Vehicle Expense,2023-08-30,Green,0.0,2802.0,2654.18
0062x00000DYDSUAA5,0012x00000hXU7RAAW,Yandina,QLD,Australia,Closed Lost,New Client-New Loan,0.0,95.88,352.9062,1.0,0.0,0.0,3.0,1.0,5768.7198,0.0,10.0,0.0,1422.3954,1512.0,0.0,0.0,0.0,0.0,0.0,0.0,1620.0,1200,1536.0,6.0,5.857,Weekly,27.0,5684.73,2000.0,,0.0,0.0,0.0,0.0,5215.45,0.0,296.7266,256.0,MoneySpot,,5018005,0.0,12-04-2023,False,Car and house maintenance,2023-04-07,Green,0.0,5972.0,5684.73
0062x00000E6wKcAAJ,0012x00000ZvAH8AAN,Noble Park,VIC,Australia,Closed Lost,Existing Client-Granted Loan Before,0.0,56.39,807.76,1.0,0.0,0.0,2.0,1.0,6074.6153,0.0,46.0,0.0,933.3976,853.26,0.0,0.0,0.0,0.0,0.0,599.0,600.0,1300,1872.0,23.0,22.714,Weekly,31.0,5192.52,1300.0,Full-Time Employment,0.0,0.0,0.033,0.0,4044.7233,364.0,1039.7666,81.39,MoneySpot,,5780606,0.0,30-06-2023,False,Vehicle Expenses,2023-06-30,Green,0.0,7933.0,5192.52
0062x00000F8ioKAAR,0012x00000hWm3kAAC,Madeley,WA,Australia,Closed Lost,Existing Client-No Loan Granted Ever,0.0,72.97,1740.9368,2.0,0.0,0.0,3.0,2.0,5428.5122,0.0,57.0,0.0,2203.6916,2203.69,1.0,0.49,0.0,0.0,0.0,1499.0,600.0,1200,1680.0,11.0,21.143,Fortnightly,38.0,5461.11,5000.0,Full-Time Employment,0.0,0.0,0.0,0.0,4407.3833,0.0,1907.11,152.73,MoneySpot,,6873246,0.0,18-10-2023,False,Other Expenses,2023-10-18,Green,0.0,5511.0,5461.11
0062x00000Ex7TLAAZ,0012x00000leeGkAAI,Banks,ACT,Australia,Closed Lost,New Client-New Loan,0.0,75.59,965.1917,3.0,0.0,0.0,4.0,3.0,4124.5899,0.0,16.0,0.0,3857.9233,3905.0,0.0,20.36,0.0,0.0,3905.0,2000.0,800.0,1500,2040.0,4.0,15.857,Monthly,31.0,5793.66,1500.0,Full-Time Employment,0.0,0.0,0.0,0.0,3857.9233,0.0,955.5433,510.0,QuickCash,,6638621,0.0,26-09-2023,False,Travel Expenses,2023-09-25,Orange,0.0,6980.0,5793.66
0062x00000D7bvBAAR,0012x00000MguoxAAB,Seven Hills,NSW,Australia,Loan Paid,Existing Client-Granted Loan Before,3.59,77.89,2768.8564,2.0,0.0,0.0,3.0,2.0,9423.5425,0.0,47.0,867.0019,1285.7783,1248.63,1.0,14.84,2.0,0.0,2808.41,899.0,150.0,1450,1972.0,7.0,14.286,Fortnightly,43.0,4693.51,1450.0,Unemployed,0.0,0.0,0.0,0.0,2571.5566,1660.0,3923.0633,281.71,QuickCash,0.0,4491969,0.0,17-01-2023,False,Medical Expenses,2023-01-16,Orange,417.0,11593.0,4693.51
0062x00000ECz0fAAD,0012x00000hYNf3AAG,Taringa,QLD,Australia,Loan Paid,Existing Client-No Loan Granted Ever,0.0,74.66,2620.1366,1.0,0.0,0.0,5.0,1.0,5773.1822,3.0,23.0,0.0,1270.6666,1287.0,0.0,16.93,0.0,0.0,0.0,400.0,1600.0,1200,1680.0,18.0,18.143,Weekly,52.0,5778.18,5000.0,Unemployed,3.0,0.0,0.0,1.0,5082.6666,0.0,2672.7233,93.33,MoneySpot,0.0,5911243,3.0,14-07-2023,False,Vehicle Expenses,2023-07-14,Green,0.0,5445.0,5778.18
0062x00000D8B6bAAF,0012x00000Tra8wAAB,Bushland Beach,QLD,Australia,Loan Paid,Existing Client-Granted Loan Before,0.0,67.84,7438.7836,4.0,0.0,0.0,1.0,4.0,8322.233,0.0,100.0,1476.6471,810.4,600.0,1.0,5.1,0.0,0.0,6275.34,1499.0,200.0,1200,1632.0,14.0,14.571,Weekly,33.0,8088.08,2050.0,Full-Time Employment,0.0,0.0,0.0,0.0,7469.7466,2599.0,7965.0266,116.57,MoneySpot,0.0,4518281,0.0,21-01-2023,False,Vehicle Expenses,2023-01-20,Orange,0.0,10986.0,8088.08
0062x00000DGmtoAAD,0010K00001y9BIbQAM,Kadina,SA,Australia,Loan Paid,Existing Client-Granted Loan Before,0.0,45.96,1769.8036,0.0,0.0,0.0,0.0,0.0,0.0,0.0,70.0,633.5357,0.0,0.0,0.0,0.0,0.0,0.0,3770.0,599.0,250.0,1250,1700.0,14.0,13.857,Weekly,38.0,5172.87,1250.0,Full-Time Employment,0.0,0.0,0.0,0.0,0.0,742.0,3465.53,121.43,QuickCash,0.0,4742415,0.0,23-02-2023,False,Living Expenses,2023-02-23,Orange,0.0,5193.0,5172.87
0062x00000DXYqzAAH,0012x00000WqGOiAAN,Hallidays Point,NSW,Australia,Loan Paid,Existing Client-Granted Loan Before,0.0,49.7,1857.3578,2.0,0.0,0.0,2.0,2.0,5606.1014,0.0,10.0,0.0,1702.535,1626.8,0.0,84.07,0.0,0.0,7236.67,899.0,100.0,1500,1980.0,7.0,12.429,Fortnightly,48.0,6198.96,1500.0,Full-Time Employment,0.0,0.0,0.0,0.0,3405.07,198.0,1983.4866,282.86,QuickCash,0.0,4982442,0.0,02-04-2023,False,Medical Expenses,2023-04-02,Orange,0.0,6597.0,6198.96
0062x00000D9gicAAB,0012x00000XNWmpAAH,Orange,NSW,Australia,Loan Paid,Existing Client-Granted Loan Before,35.71,49.83,1249.2968,2.0,1.0,4.0,3.0,2.0,9607.7578,1.0,28.0,702.2592,1437.6016,1635.39,0.0,0.0,0.0,0.0,1983.19,400.0,1000.0,1200,1632.0,7.0,13.143,Fortnightly,52.0,7965.72,2050.0,Full-Time Employment,1.0,0.0,0.044,0.0,6901.4166,1019.0,1667.8633,233.14,MoneySpot,0.0,4594128,1.0,01-02-2023,False,Travel Expenses,2023-02-01,Green,4026.0,11274.0,7965.72
0062x00000DrdZPAAZ,0012x00000hYye4AAC,Braybrook,VIC,Australia,Loan Paid,New Client-New Loan,0.0,63.36,1093.1751,1.0,0.0,0.0,4.0,1.0,5405.4327,0.0,1.0,0.0,995.6923,1048.0,0.0,0.13,0.0,0.0,0.0,0.0,0.0,1200,1584.0,9.0,9.429,Weekly,21.0,5572.1,3000.0,,1.0,0.0,0.2527,1.0,4314.6666,0.0,1157.7066,176.0,MoneySpot,0.0,5180720,0.0,02-05-2023,False,Short Term Loan,2023-05-02,Green,0.0,5320.0,5572.1
0062x00000DIayZAAT,0012x00000e0NtKAAU,Revesby,NSW,Australia,Loan Paid,Existing Client-Granted Loan Before,0.0,75.33,751.6966,1.0,0.0,0.0,3.0,1.0,8622.5267,0.0,0.0,0.0,1136.5676,1142.03,0.0,0.0,0.0,0.0,1140.0,899.0,1360.0,1500,1980.0,12.0,11.714,Weekly,39.0,8622.53,1500.0,Full-Time Employment,0.0,0.0,0.0,0.0,7150.33,0.0,851.6966,165.0,QuickCash,0.0,4842346,0.0,11-03-2023,False,Travel Expenses,2023-03-11,Orange,0.0,8610.0,8622.53
0062x00000D23AkAAJ,0012x00000cmPgLAAU,Bexley,NSW,Australia,Loan Paid,Existing Client-No Loan Granted Ever,0.0,84.01,308.0052,2.0,0.0,0.0,3.0,2.0,9851.8701,0.0,27.0,0.0,2559.5616,2566.48,0.0,1.59,0.0,0.0,7630.4,1499.0,200.0,1200,1632.0,8.0,14.857,Fortnightly,28.0,10185.2,5000.0,Full-Time Employment,0.0,0.0,0.022,0.0,9069.12,570.0,2659.6333,204.0,MoneySpot,0.0,4424980,0.0,06-01-2023,False,Living Expenses,2023-01-06,Green,0.0,10112.0,10185.2
0062x00000EyTYuAAN,0010K00001y3ZXWQA2,Glenroy,VIC,Australia,Loan Paid,Existing Client-Granted Loan Before,0.0,64.61,3108.271,1.0,0.0,0.0,2.0,1.0,5104.2513,0.0,32.0,0.0,1104.8692,1127.3,1.0,0.67,0.0,0.0,3683.33,899.0,0.0,1500,2160.0,23.0,23.0,Weekly,30.0,5104.25,1500.0,Full-Time Employment,0.0,0.0,0.0,0.0,4787.7666,713.0,2607.6966,93.91,MoneySpot,0.0,6738670,0.0,04-10-2023,False,Other Expenses,2023-10-04,Green,0.0,6879.0,5104.25
0062x00000DZkqRAAT,0012x00000OKtDUAA1,Electrona,TAS,Australia,Loan Paid,Existing Client-Granted Loan Before,2.73,85.81,1948.3215,2.0,0.0,2.0,3.0,2.0,6066.1843,2.0,64.0,0.0,2460.12,2460.12,1.0,0.56,0.0,0.0,0.0,599.0,750.0,1200,1584.0,7.0,12.857,Fortnightly,50.0,5609.0,2050.0,Full-Time Employment,2.0,0.0,0.0,1.0,5057.1066,1067.0,2499.8066,226.29,MoneySpot,0.0,5110577,2.0,24-04-2023,False,Travel Expenses,2023-04-24,Orange,143.0,5221.0,5609.0
0062x00000Dt4JmAAJ,0012x00000hZrLTAA0,Truganina,VIC,Australia,Closed Lost,New Client-New Loan,0.0,48.95,0.0,0.0,0.0,0.0,0.0,0.0,0.0,0.0,0.0,0.0,0.0,0.0,0.0,0.0,0.0,0.0,0.0,0.0,0.0,1500,1920.0,6.0,6.571,Weekly,30.0,5407.56,1500.0,,0.0,0.0,0.0,0.0,1896.8333,0.0,0.0,320.0,MoneySpot,,5284616,0.0,16-05-2023,False,Other,2023-05-16,Orange,0.0,3511.0,5407.56
0062x00000DqyrZAAR,0012x00000hYcKrAAK,North Melbourne,VIC,Australia,Closed Lost,New Client-New Loan,0.0,23.38,58.8,2.0,0.0,0.0,5.0,2.0,4279.0805,0.0,0.0,76.65,1969.55,1969.55,0.0,0.0,0.0,0.0,4266.17,400.0,1264.0,1200,1920.0,20.0,40.429,Fortnightly,52.0,4279.08,12500.0,Full-Time Employment,0.0,0.0,0.0,0.0,3939.1,59.0,58.8,96.0,MoneySpot,,5140062,0.0,30-04-2023,False,Living Expenses,2023-04-26,Green,0.0,4022.0,4279.08
0062x00000E3aStAAJ,0012x00000iHvdKAAS,Maryland,NSW,Australia,Closed Lost,New Client-New Loan,0.0,41.92,3151.4268,2.0,0.0,0.0,3.0,2.0,5595.368,0.0,6.0,172.3611,2309.05,3047.02,0.0,0.84,0.0,0.0,4764.5,899.0,700.0,1200,1536.0,3.0,5.571,Fortnightly,59.0,5595.37,2500.0,Full-Time Employment,14.0,0.0,0.0,4.0,5387.7833,1050.0,3250.2,512.0,MoneySpot,,5500732,5.0,09-06-2023,False,Vehicle Expenses,2023-06-04,Orange,0.0,5966.0,5595.37
0062x00000EePkXAAV,0012x00000THeBHAA1,Julia Creek,QLD,Australia,Loan Paid,Existing Client-Granted Loan Before,0.0,71.38,2305.2675,2.0,0.0,0.0,5.0,2.0,5313.3388,0.0,27.0,0.0,2128.31,2128.31,1.0,0.0,0.0,0.0,4671.33,1499.0,0.0,1450,2204.0,18.0,34.714,Fortnightly,33.0,5640.01,5000.0,Full-Time Employment,0.0,0.0,0.0,0.0,3547.1833,1204.0,3612.3566,122.44,MoneySpot,0.0,6486510,0.0,12-09-2023,False,Veterinary Expenses,2023-09-12,Green,0.0,6518.0,5640.01
0062x00000F1wT9AAJ,0012x00000gnr7xAAA,Kingswood,NSW,Australia,Loan Paid,Existing Client-Granted Loan Before,0.0,96.9,3166.3978,1.0,0.0,0.0,2.0,1.0,10756.356,6.0,34.0,0.0,2401.5615,2370.69,0.0,0.0,0.0,0.0,6761.81,1499.0,1840.0,1500,2100.0,20.0,20.143,Weekly,38.0,10756.36,1500.0,Full-Time Employment,6.0,0.0,0.0659,6.0,10406.7666,0.0,3165.1666,105.0,MoneySpot,0.0,6933296,3.0,24-10-2023,False,Vehicle Expenses,2023-10-24,Orange,0.0,10916.0,10756.36
0062x00000ED0yCAAT,0012x00000kZuuFAAS,Marsfield,NSW,Australia,Loan Paid,New Client-New Loan,0.0,69.68,85.3333,1.0,0.0,0.0,2.0,1.0,7260.1878,3.0,10.0,0.0,1093.3338,1112.84,0.0,0.0,0.0,0.0,0.0,0.0,624.0,1200,1680.0,19.0,18.714,Weekly,23.0,7860.19,5000.0,,3.0,0.0,0.0,1.0,4737.78,0.0,85.3333,88.42,MoneySpot,0.0,5912738,0.0,14-07-2023,False,School fee,2023-07-14,Green,0.0,12307.0,7860.19
0062x00000DGnB3AAL,0012x00000dxA9aAAE,Guyra,NSW,Australia,Loan Paid,Existing Client-No Loan Granted Ever,0.0,75.26,184.5835,1.0,0.0,0.0,4.0,1.0,6527.0336,4.0,21.0,184.5857,1267.142,1482.45,0.0,0.0,0.0,0.0,3102.79,899.0,800.0,1200,1584.0,9.0,9.143,Weekly,31.0,3967.64,3100.0,Part-Time Employment,4.0,0.0,0.2088,0.0,2111.9033,184.0,184.08,176.0,MoneySpot,0.0,4742561,4.0,23-02-2023,False,Motorbike birthday purchase,2023-02-23,Green,0.0,4738.0,3967.64
0062x00000D9BmEAAV,0010K00001mCtxqQAC,Sunset Beach,WA,Australia,Loan Paid,Existing Client-Granted Loan Before,0.0,48.84,2100.3749,1.0,0.0,0.0,4.0,1.0,5072.6641,0.0,0.0,0.0,1150.2241,1156.5,1.0,0.0,0.0,0.0,3250.0,400.0,550.0,1200,1632.0,14.0,14.0,Weekly,32.0,7572.66,1200.0,Full-Time Employment,0.0,0.0,0.022,0.0,4600.8966,0.0,1970.3566,116.57,QuickCash,0.0,4569661,0.0,28-01-2023,False,Medical Expenses,2023-01-28,Orange,0.0,8867.0,7572.66
0062x00000ExW66AAF,0012x00000lewb6AAA,Quakers Hill,NSW,Australia,Loan Paid,New Client-New Loan,0.0,33.85,933.5899,3.0,0.0,0.0,4.0,3.0,6234.6233,1.0,9.0,0.0,4173.29,4173.29,0.0,0.0,0.0,0.0,4100.0,2000.0,2200.0,1300,1924.0,7.0,28.714,Monthly,39.0,7282.09,1300.0,Full-Time Employment,1.0,0.0,0.0,0.0,4173.29,0.0,1124.57,274.86,QuickCash,0.0,6670249,0.0,28-09-2023,False,Vehicle Expenses,2023-09-28,Orange,0.0,12726.0,7282.09
0062x00000DWe6CAAT,0012x00000gqdlbAAA,Forest Lodge,NSW,Australia,Closed Lost,New Client-New Loan,0.0,43.91,0.0,2.0,0.0,0.0,3.0,2.0,4028.5232,1.0,9.0,960.0,1616.4166,1670.14,1.0,0.0,0.0,0.0,0.0,0.0,1580.0,1200,1536.0,3.0,4.857,Fortnightly,33.0,4028.52,10000.0,,1.0,0.0,0.0,0.0,3232.8333,78.0,1083.8433,512.0,MoneySpot,,4927365,0.0,29-03-2023,False,House furniture,2023-03-24,Orange,0.0,4043.0,4028.52
0062x00000EbVjGAAV,0010K00001y3ZnPQAU,Cranbourne,VIC,Australia,Loan Paid,Existing Client-Granted Loan Before,13.49,44.81,63.3333,0.0,0.0,1.0,2.0,1.0,2289.674,0.0,27.0,0.0,379.56,161.42,1.0,0.07,0.0,0.0,3458.0,599.0,1868.0,1250,1700.0,4.0,16.571,Monthly,43.0,3699.25,1250.0,Full-Time Employment,0.0,0.0,0.011,0.0,870.8233,1059.0,1515.68,425.0,QuickCash,0.0,6293926,0.0,22-08-2023,False,Travel Expenses,2023-08-22,Orange,1140.0,8449.0,3699.25
0062x00000FV0CkAAL,0012x00000lgNPWAA2,Meadow Heights,VIC,Australia,Closed Lost,Existing Client-No Loan Granted Ever,0.0,52.57,3462.81,1.0,0.0,0.0,4.0,1.0,9000.5076,2.0,12.0,0.0,2071.35,2924.62,0.0,0.0,0.0,0.0,0.0,599.0,100.0,1200,1632.0,13.0,13.571,Weekly,47.0,11351.84,3500.0,Full-Time Employment,14.0,0.0,0.011,4.0,8975.85,0.0,4647.78,125.54,MoneySpot,,7555203,4.0,23-12-2023,False,Vehicle Expenses,2023-12-18,Green,0.0,11494.0,11351.84
0062x00000Ecnc5AAB,0012x000005ThSIAA0,WILLAURA,VIC,Australia,Loan Paid,Existing Client-Granted Loan Before,0.0,66.05,1577.1232,1.0,1.0,0.0,3.0,1.0,10775.7357,0.0,7.0,0.0,1532.6666,1608.0,0.0,2.99,0.0,0.0,6500.0,1499.0,650.0,1500,2040.0,16.0,16.0,Weekly,23.0,11169.05,1500.0,Full-Time Employment,20.0,0.0,0.0,2.0,4598.0,1565.0,3352.4566,127.5,QuickCash,0.0,6380094,19.0,31-08-2023,False,Living Expenses,2023-08-31,Orange,0.0,12564.0,11169.05
0062x00000D7Z4KAAV,0012x00000gA2plAAC,St Albans,VIC,Australia,Loan Paid,New Client-New Loan,0.0,66.91,325.8902,2.0,0.0,0.0,1.0,2.0,5145.9768,0.0,12.0,960.0,2368.56,2418.0,1.0,0.07,0.0,0.0,5265.0,899.0,400.0,1200,1536.0,3.0,6.143,Fortnightly,49.0,6005.98,2000.0,Full-Time Employment,0.0,0.0,0.0,0.0,5526.64,110.0,1301.6666,512.0,QuickCash,0.0,4489235,0.0,17-01-2023,False,Home Maintenance & Repairs,2023-01-17,Green,0.0,7297.0,6005.98
0062x00000DVoJXAA1,0012x00000iHgOkAAK,Woodridge,QLD,Australia,Loan Paid,New Client-New Loan,15.76,60.64,434.4933,2.0,0.0,4.0,3.0,2.0,4550.4389,5.0,21.0,495.594,1649.6266,1626.07,0.0,0.08,0.0,0.0,3683.33,400.0,330.0,1200,1536.0,3.0,5.857,Fortnightly,41.0,7833.53,1300.0,Part-Time Employment,5.0,0.0,0.0,1.0,2433.7033,434.0,583.2433,512.0,QuickCash,0.0,5477340,5.0,02-06-2023,False,Vehicle Expenses,2023-06-02,Green,784.0,4974.0,7833.53
0062x00000D2ZYKAA3,0012x00000RqcBJAAZ,Bamaga,QLD,Australia,Loan Paid,Existing Client-Granted Loan Before,0.0,50.16,635.9847,2.0,0.0,0.0,3.0,2.0,4261.1579,0.0,18.0,640.0,1564.6983,1532.16,0.0,0.0,0.0,0.0,3178.51,400.0,150.0,1200,1632.0,7.0,14.286,Fortnightly,45.0,6275.82,5000.0,Part-Time Employment,0.0,0.0,0.0,0.0,3129.3966,537.0,896.94,233.14,MoneySpot,0.0,4451871,0.0,10-01-2023,False,Life Event Expenses,2023-01-10,Orange,0.0,8009.0,6275.82
0062x00000DIOkZAAX,0012x00000gp5N4AAI,Stirling,WA,Australia,Loan Paid,New Client-New Loan,0.0,64.3,2095.0252,2.0,0.0,0.0,4.0,2.0,6193.9134,0.0,12.0,0.0,2592.2233,2224.34,1.0,0.0,0.0,0.0,4983.33,400.0,880.0,1200,1632.0,8.0,15.143,Fortnightly,31.0,6267.25,5000.0,Full-Time Employment,0.0,0.0,0.044,0.0,5184.4466,0.0,2365.3433,204.0,MoneySpot,0.0,4830638,0.0,09-03-2023,False,Home Maintenance & Repairs,2023-03-09,Green,0.0,6137.0,6267.25
0062x00000DAPiGAAX,0012x00000NRXtFAAX,Swan Hill,VIC,Australia,Loan Paid,Existing Client-Granted Loan Before,4.56,76.61,0.0,4.0,0.0,0.0,4.0,4.0,4579.8083,0.0,0.0,0.0,720.0,250.0,0.0,0.0,0.0,1.0,852.27,400.0,150.0,1500,2100.0,18.0,17.857,Weekly,39.0,4114.51,1500.0,Unemployed,0.0,0.0,0.011,0.0,0.0,0.0,0.0,116.67,Financier-2,0.0,4628760,0.0,06-02-2023,False,Living Expenses,2023-02-06,Green,333.0,7288.0,4114.51
0062x00000Ewm5UAAR,0012x00000cjt5aAAA,Erskineville,NSW,Australia,Loan Paid,Existing Client-Granted Loan Before,0.0,54.81,1063.82,3.0,0.0,0.0,4.0,3.0,8185.1133,0.0,20.0,0.0,6515.1133,7234.0,0.0,0.05,0.0,0.0,6028.12,599.0,1500.0,1500,2040.0,4.0,16.714,Monthly,32.0,6515.11,1500.0,Full-Time Employment,0.0,0.0,0.011,0.0,6515.1133,352.0,1070.48,510.0,MoneySpot,0.0,6612779,0.0,22-09-2023,False,Living Expenses,2023-09-22,Green,0.0,9796.0,6515.11
0062x00000ECi2HAAT,0012x00000iHoqqAAC,Leumeah,NSW,Australia,Closed Lost,Existing Client-No Loan Granted Ever,0.0,68.31,582.984,1.0,1.0,0.0,3.0,1.0,3657.7069,0.0,9.0,0.0,826.4316,734.29,0.0,0.0,0.0,0.0,4155.67,400.0,240.0,1200,1728.0,26.0,26.143,Weekly,26.0,3982.93,2050.0,Casual Employment,2.0,0.0,0.0,0.0,3305.7266,0.0,437.5,66.46,Financier-2,,5894204,2.0,12-07-2023,False,Furniture or Appliances,2023-07-12,Green,0.0,3842.0,3982.93
0062x00000EeAeXAAV,0012x00000goa8bAAA,Tugun,QLD,Australia,Loan Paid,Existing Client-No Loan Granted Ever,0.0,45.75,968.9866,1.0,0.0,0.0,2.0,1.0,6201.0522,4.0,38.0,0.0,1371.8592,1531.09,0.0,0.0,0.0,0.0,0.0,1499.0,1120.0,1200,1632.0,15.0,15.571,Weekly,44.0,6442.72,4000.0,,4.0,0.0,0.3297,0.0,5944.7233,1416.0,1995.31,108.8,MoneySpot,0.0,6470846,4.0,09-09-2023,False,Life Event Expenses,2023-09-09,Green,0.0,7475.0,6442.72
0062x00000DA31ZAAT,0010K00002CNTQIQA5,Coorow,WA,Australia,Loan Paid,Existing Client-Granted Loan Before,0.0,32.75,1217.2688,2.0,0.0,0.0,3.0,2.0,5897.1215,0.0,7.0,659.6071,2460.6814,2340.41,0.0,0.0,0.0,0.0,2600.0,599.0,200.0,1500,2040.0,7.0,13.857,Fortnightly,44.0,5897.12,1500.0,Part-Time Employment,0.0,0.0,0.4176,0.0,5741.59,693.0,1373.9833,291.43,Financier-2,0.0,4610299,0.0,03-02-2023,False,Vehicle Expenses,2023-02-03,Orange,0.0,6293.0,5897.12
0062x00000D2CuDAAV,0012x00000LRdChAAL,Fannie Bay,NT,Australia,Loan Paid,Existing Client-Granted Loan Before,0.0,34.2,2568.0769,1.0,0.0,0.0,3.0,1.0,10572.1274,1.0,41.0,1522.5546,2780.176,3219.93,0.0,4.0,0.0,0.0,3196.99,899.0,300.0,1500,1980.0,10.0,9.714,Weekly,49.0,10572.13,1500.0,Full-Time Employment,1.0,0.0,0.011,0.0,9267.2533,2294.0,4485.5433,198.0,MoneySpot,0.0,4433305,1.0,07-01-2023,False,Travel Expenses,2023-01-07,Orange,0.0,10362.0,10572.13
0062x00000DIePxAAL,0012x00000gpI6CAAU,Mooroopna,VIC,Australia,Loan Paid,New Client-New Loan,0.0,66.26,4096.7957,1.0,0.0,0.0,4.0,1.0,6856.7951,2.0,55.0,0.0,1110.9166,1080.0,1.0,0.61,0.0,0.0,4333.33,400.0,1600.0,1200,1536.0,9.0,8.714,Weekly,30.0,7778.46,3000.0,Full-Time Employment,2.0,0.0,0.011,2.0,4443.6666,398.0,3655.4,170.67,QuickCash,0.0,4846951,2.0,12-03-2023,False,Living Expenses,2023-03-11,Green,0.0,10037.0,7778.46
0062x00000EEbiAAAT,0012x00000flykiAAA,Annerley,QLD,Australia,Closed Lost,Existing Client-No Loan Granted Ever,0.0,52.13,116.6466,2.0,0.0,0.0,3.0,2.0,12751.318,2.0,15.0,0.0,1194.3485,1217.15,0.0,1.1,0.0,0.0,0.0,599.0,793.32,1200,1824.0,16.0,32.0,Fortnightly,35.0,13017.93,2500.0,,2.0,0.0,0.7143,1.0,2786.8133,0.0,116.6466,114.0,MoneySpot,,6025167,0.0,27-07-2023,False,Living Expenses,2023-07-27,Green,0.0,14071.0,13017.93
0062x00000DrFOnAAN,0012x00000hYl68AAC,Liverpool,NSW,Australia,Closed Lost,New Client-New Loan,2.83,82.24,282.5466,3.0,0.0,0.0,5.0,3.0,7530.4922,0.0,36.0,0.0,4217.9766,4209.0,1.0,1.21,0.0,0.0,4200.0,400.0,1160.0,1200,1536.0,2.0,6.857,Monthly,28.0,7530.49,10200.0,Full-Time Employment,0.0,0.0,0.033,0.0,4781.8266,0.0,952.8766,768.0,MoneySpot,,5154357,0.0,28-04-2023,False,Living Expenses,2023-04-28,Orange,248.0,8761.0,7530.49
0062x00000DIsnoAAD,0012x00000gmpYVAAY,Redland Bay,QLD,Australia,Closed Lost,Existing Client-No Loan Granted Ever,0.0,75.86,2973.0395,4.0,0.0,0.0,2.0,4.0,5095.8436,0.0,30.0,1602.4325,2097.7671,1895.39,0.0,0.0,0.0,0.0,1895.0,400.0,120.0,1200,1536.0,3.0,5.143,Fortnightly,23.0,6245.99,5000.0,Full-Time Employment,0.0,0.0,0.011,0.0,4894.79,1203.0,3013.63,512.0,MoneySpot,,4860645,0.0,19-03-2023,False,Vehicle Expenses,2023-03-14,Orange,0.0,7085.0,6245.99
0062x00000DHDA8AAP,0012x00000SFJq1AAH,Blacktown,NSW,Australia,Loan Paid,Existing Client-Granted Loan Before,0.0,25.06,1360.4368,2.0,0.0,0.0,2.0,2.0,4912.601,1.0,0.0,0.0,2206.1433,2181.08,0.0,0.0,0.0,1.0,4337.67,400.0,200.0,1250,1700.0,7.0,14.143,Fortnightly,34.0,5015.06,1250.0,Full-Time Employment,1.0,0.0,0.011,0.0,0.0,427.0,1445.9,242.86,QuickCash,0.0,4767370,0.0,28-02-2023,False,Relocation Expenses,2023-02-27,Orange,0.0,4901.0,5015.06
0062x00000D8O4nAAF,0012x00000fn61YAAQ,Port Macquarie,NSW,Australia,Loan Paid,Existing Client-Granted Loan Before,0.0,55.38,213.3333,2.0,0.0,0.0,1.0,2.0,4479.9652,1.0,3.0,0.0,1053.9866,1064.67,0.0,0.0,0.0,0.0,2166.67,599.0,790.0,1200,1632.0,7.0,14.143,Fortnightly,24.0,4479.97,5000.0,Casual Employment,1.0,0.0,0.0659,1.0,2107.9733,213.0,213.3333,233.14,MoneySpot,0.0,4530620,0.0,23-01-2023,False,Living Expenses,2023-01-22,Orange,0.0,4258.0,4479.97
0062x00000D9iXlAAJ,0012x00000gmqsWAAQ,Rosebery,NT,Australia,Loan Paid,New Client-New Loan,0.0,73.14,432.7242,1.0,0.0,0.0,3.0,1.0,5660.8397,6.0,32.0,0.0,1302.7691,1407.46,1.0,0.0,0.0,0.0,0.0,0.0,200.0,1200,1536.0,6.0,6.143,Weekly,53.0,7744.84,2000.0,,6.0,0.0,0.0,6.0,5211.0766,648.0,913.7766,256.0,MoneySpot,0.0,4595172,4.0,01-02-2023,False,Event - Holiday - Accommodation,2023-02-01,Orange,0.0,10444.0,7744.84
0062x00000Dr4tDAAR,0012x000003fIOnAAM,Hay,NSW,Australia,Loan Paid,Existing Client-Granted Loan Before,0.0,81.08,6307.0868,2.0,0.0,0.0,3.0,2.0,19592.981,13.0,183.0,1576.4337,5128.8428,4742.7,1.0,0.0,0.0,0.0,10833.33,1500.0,280.0,1100,1496.0,8.0,16.0,Fortnightly,52.0,19779.01,2050.0,Full-Time Employment,22.0,0.0,0.4725,4.0,11967.3,3947.0,6247.31,187.0,MoneySpot,0.0,5145640,1.0,27-04-2023,False,Vehicle Expenses,2023-04-27,Orange,0.0,20953.0,19779.01
0062x00000Eyxj0AAB,0010K00001qHvriQAC,GATTON,QLD,Australia,Loan Paid,Existing Client-Granted Loan Before,0.0,88.95,7243.4568,2.0,0.0,0.0,3.0,2.0,9770.0082,0.0,64.0,0.0,4335.7857,4588.0,1.0,6.58,0.0,0.0,3427.67,599.0,600.0,1500,2040.0,7.0,13.571,Fortnightly,29.0,9770.01,1500.0,Full-Time Employment,0.0,0.0,0.0,0.0,10116.8333,2357.0,7652.6466,291.43,MoneySpot,0.0,6775459,0.0,08-10-2023,False,Relocation Expenses,2023-10-08,Orange,0.0,11029.0,9770.01
0062x00000EMog3AAD,0010K00001fecC4QAI,Waterford West,QLD,Australia,Loan Paid,Existing Client-Granted Loan Before,15.65,64.46,3881.1157,1.0,0.0,2.0,1.0,1.0,9395.1221,7.0,34.0,0.0,1491.0841,1551.87,0.0,0.0,1.0,0.0,5200.0,400.0,250.0,1250,1700.0,16.0,16.143,Weekly,60.0,9395.12,1250.0,Casual Employment,7.0,0.0,0.7033,0.0,7336.8766,643.0,3620.4666,106.25,MoneySpot,0.0,6131920,6.0,07-08-2023,False,Life Event Expenses,2023-08-07,Orange,1621.0,10352.0,9395.12
0062x00000DrcnoAAB,0012x00000hXhLyAAK,Holt,ACT,Australia,Loan Paid,Existing Client-No Loan Granted Ever,0.0,77.81,3624.963,1.0,0.0,0.0,3.0,1.0,5481.6825,0.0,17.0,0.0,1261.5384,1300.0,0.0,0.3,0.0,1.0,1300.0,899.0,0.0,1200,1632.0,14.0,14.286,Weekly,28.0,5481.68,2500.0,Full-Time Employment,0.0,0.0,0.0,0.0,0.0,51.0,4520.21,116.57,MoneySpot,0.0,5179890,0.0,02-05-2023,False,Home Maintenance & Repairs,2023-05-02,Orange,0.0,5667.0,5481.68
0062x00000DFEpxAAH,0012x00000NSHkkAAH,Parmelia,WA,Australia,Closed Lost,Existing Client-No Loan Granted Ever,0.0,18.97,1519.6433,2.0,0.0,0.0,2.0,2.0,8681.255,0.0,0.0,0.0,3397.4,3387.4,0.0,0.96,0.0,0.0,4883.67,1500.0,1913.0,1200,1584.0,7.0,12.714,Fortnightly,43.0,8681.26,2000.0,Full-Time Employment,0.0,0.0,0.0,0.0,6794.8,0.0,1617.37,226.29,MoneySpot,,4656750,0.0,15-02-2023,False,Other Expenses,2023-02-10,Orange,0.0,8133.0,8681.26
0062x00000DJK7yAAH,0012x00000gpcmJAAQ,Blacks Beach,QLD,Australia,Loan Paid,Existing Client-No Loan Granted Ever,0.0,76.84,1118.9721,1.0,0.0,0.0,4.0,1.0,10316.145,2.0,25.0,0.0,2168.8763,1995.41,2.0,0.0,0.0,0.0,0.0,899.0,356.0,1200,1536.0,6.0,6.0,Weekly,33.0,10316.15,4500.0,Full-Time Employment,2.0,0.0,0.0769,1.0,7952.5466,0.0,1502.2233,256.0,MoneySpot,0.0,4882661,0.0,17-03-2023,False,Vehicle Expenses,2023-03-17,Orange,0.0,11237.0,10316.15
0062x00000DtErDAAV,0012x00000hZz14AAC,Longford,TAS,Australia,Closed Lost,New Client-New Loan,9.18,35.72,464.8327,2.0,0.0,0.0,2.0,2.0,4586.8665,5.0,35.0,0.0,1493.3383,1414.95,1.0,0.0,0.0,0.0,0.0,0.0,420.0,1200,1536.0,3.0,4.857,Fortnightly,29.0,4306.98,1600.0,,5.0,0.0,0.8132,3.0,4008.25,0.0,464.04,512.0,MoneySpot,,5298471,5.0,17-05-2023,False,Other,2023-05-17,Green,445.0,4846.0,4306.98
0062x00000DHHSJAA5,0012x00000go3tVAAQ,Yulara,NT,Australia,Loan Paid,Existing Client-No Loan Granted Ever,0.0,58.27,132.7166,2.0,0.0,0.0,4.0,2.0,3707.6812,0.0,2.0,0.0,1537.3228,1415.4,0.0,0.0,0.0,0.0,3115.29,400.0,234.0,1200,1536.0,3.0,5.429,Fortnightly,36.0,4224.35,1500.0,Full-Time Employment,0.0,0.0,0.011,0.0,3587.0866,100.0,280.8166,512.0,MoneySpot,0.0,4770478,0.0,28-02-2023,False,Travel Expenses,2023-02-28,Green,0.0,5890.0,4224.35
0062x00000DFUhaAAH,0012x00000fmedqAAA,Gisborne,VIC,Australia,Loan Paid,Existing Client-Granted Loan Before,0.0,99.66,529.7151,0.0,0.0,0.0,0.0,0.0,0.0,0.0,21.0,174.4613,0.0,0.0,0.0,1.34,0.0,0.0,780.0,599.0,1455.0,1500,2040.0,14.0,14.286,Weekly,22.0,4127.88,1500.0,Full-Time Employment,3.0,0.0,0.044,0.0,3971.2233,387.0,674.96,145.71,QuickCash,0.0,4671688,0.0,13-02-2023,False,Living Expenses,2023-02-12,Orange,0.0,1570.0,4127.88
0062x00000E3YuiAAF,0012x00000iHuKoAAK,Acacia Hills,NT,Australia,Loan Paid,New Client-New Loan,0.0,31.97,2316.77,2.0,0.0,0.0,2.0,2.0,8369.5032,0.0,6.0,433.7681,2701.12,2701.12,0.0,40.32,0.0,0.0,2707.0,2000.0,1000.0,1200,1536.0,3.0,6.429,Fortnightly,57.0,8369.5,1500.0,Full-Time Employment,0.0,0.0,0.3297,0.0,5402.24,437.0,2303.3066,512.0,QuickCash,0.0,5496552,0.0,04-06-2023,False,Vehicle Expenses,2023-06-03,Green,0.0,8830.0,8369.5
0062x00000DHnCdAAL,0012x00000g8aWBAAY,Melton South,VIC,Australia,Loan Paid,Existing Client-Granted Loan Before,0.0,43.84,31.37,2.0,0.0,0.0,5.0,2.0,296.2948,0.0,0.0,0.0,136.3775,275.92,0.0,0.08,0.0,1.0,4141.81,599.0,500.0,1500,1980.0,5.0,9.714,Fortnightly,34.0,296.29,2050.0,Full-Time Employment,0.0,0.0,0.6044,0.0,0.0,250.0,870.5233,396.0,MoneySpot,0.0,4798258,0.0,04-03-2023,False,Vehicle Expenses,2023-03-04,Orange,0.0,2376.0,296.29
0062x00000FhNxXAAV,0012x00000lGTO9AAO,Surfers Paradise,QLD,Australia,Loan Paid,Existing Client-Granted Loan Before,0.0,61.6,940.0849,4.0,0.0,0.0,3.0,4.0,15731.9324,0.0,13.0,0.0,4952.324,919.17,0.0,0.0,0.0,1.0,0.0,899.0,3000.0,1500,2040.0,7.0,14.143,Fortnightly,35.0,15731.93,1500.0,Full-time,0.0,0.0,0.0,0.0,6792.1166,927.0,1486.8066,291.43,MoneySpot,0.0,7891592,0.0,2024-01-17,False,Life Event Expenses,2024-01-17,Orange,0.0,17627.0,15731.93
0062x00000DWSkIAAX,0012x00000cwpeQAAQ,Garbutt,QLD,Australia,Loan Paid,Existing Client-Granted Loan Before,0.0,81.47,1751.5178,1.0,0.0,0.0,3.0,1.0,4879.808,2.0,87.0,316.5806,1022.429,1016.01,1.0,1.2,0.0,0.0,0.0,899.0,620.0,1500,1980.0,10.0,10.0,Weekly,33.0,5046.47,1500.0,Full-Time Employment,2.0,0.0,0.0989,1.0,3748.9066,702.0,4110.9866,198.0,QuickCash,0.0,4917907,2.0,23-03-2023,False,Vehicle Expenses,2023-03-23,Green,0.0,5080.0,5046.47
0062x00000DIMuiAAH,0012x00000WtWftAAF,Mount Gravatt,QLD,Australia,Loan Paid,Existing Client-Granted Loan Before,9.91,61.44,4151.8936,2.0,0.0,4.0,4.0,2.0,8637.8397,0.0,51.0,107.0449,2051.585,1953.08,0.0,1.92,0.0,0.0,0.0,899.0,1060.0,1200,1584.0,6.0,11.143,Fortnightly,40.0,9212.13,1200.0,Full-Time Employment,0.0,0.0,0.0,0.0,5145.75,1622.0,5561.7733,264.0,Financier-2,0.0,4829689,0.0,09-03-2023,False,Other Expenses,2023-03-09,Orange,1224.0,12349.0,9212.13
0062x00000DsKDcAAN,0012x00000g9ZVXAA2,Ringwood,VIC,Australia,Loan Paid,Existing Client-Granted Loan Before,0.0,61.64,4004.2164,1.0,0.0,0.0,3.0,1.0,5544.596,0.0,95.0,1811.2656,910.365,910.8,1.0,3.05,1.0,0.0,0.0,599.0,956.0,1350,1944.0,24.0,24.143,Weekly,47.0,5877.12,2050.0,,0.0,0.0,0.7802,0.0,3641.46,854.0,4157.48,81.0,QuickCash,0.0,5233212,0.0,10-05-2023,False,Travel Expenses,2023-05-09,Green,0.0,6698.0,5877.12
0062x00000D1bHAAAZ,0010K000029IyTxQAK,Tumbi Umbi,NSW,Australia,Loan Paid,Existing Client-No Loan Granted Ever,0.0,3.6,921.8487,2.0,4.0,0.0,3.0,2.0,6322.1412,2.0,6.0,652.4592,2907.306,2860.35,1.0,3.58,0.0,0.0,0.0,0.0,3700.0,1200,1536.0,3.0,5.286,Fortnightly,48.0,6322.14,10000.0,Full-Time Employment,6.0,0.0,0.022,4.0,4845.51,601.0,7371.9733,512.0,MoneySpot,0.0,4399224,6.0,03-01-2023,False,Bills,2023-01-03,Orange,0.0,21375.0,6322.14
0062x00000D8FesAAF,0012x00000OwSqdAAF,Mount Barker,SA,Australia,Closed Lost,Existing Client-No Loan Granted Ever,44.37,36.44,307.5763,2.0,1.0,2.0,4.0,2.0,4937.0548,7.0,18.0,307.5777,1269.54,1840.56,0.0,0.0,0.0,0.0,1957.11,899.0,1100.0,1200,1584.0,5.0,8.857,Fortnightly,40.0,4854.11,2500.0,Part-Time Employment,7.0,0.0,0.3516,2.0,4718.91,283.0,290.0366,316.8,MoneySpot,,4522912,6.0,25-01-2023,False,Short Term Loan,2023-01-21,Green,2180.0,4913.0,4854.11
0062x00000D1bnfAAB,0012x00000Rrfx9AAB,Cranbourne West,VIC,Australia,Loan Paid,Existing Client-Granted Loan Before,0.0,22.99,2727.7083,2.0,0.0,0.0,4.0,2.0,4118.2889,0.0,24.0,672.1396,1895.5416,1889.75,1.0,0.42,0.0,0.0,3401.67,400.0,400.0,1400,1904.0,7.0,14.429,Fortnightly,52.0,4121.62,1400.0,Full-Time Employment,0.0,0.0,0.011,0.0,3791.0833,999.0,2717.8133,272.0,QuickCash,0.0,4399775,0.0,03-01-2023,False,Vehicle Expenses,2023-01-03,Green,0.0,6458.0,4121.62
0062x00000DFuXPAA1,0012x00000VfHyuAAF,Meridan Plains,QLD,Australia,Loan Paid,Existing Client-Granted Loan Before,0.0,71.29,752.2284,4.0,0.0,0.0,3.0,4.0,2833.8332,17.0,41.0,0.0,564.2857,1000.0,0.0,24.73,0.0,0.0,1100.0,400.0,1200.0,1250,1800.0,24.0,23.857,Weekly,26.0,4506.33,2050.0,Full-Time Employment,17.0,0.0,0.0769,5.0,2079.6666,161.0,1085.8533,75.0,MoneySpot,0.0,4693220,13.0,16-02-2023,False,Vehicle Expenses,2023-02-15,Green,0.0,9243.0,4506.33
0062x00000D7KbLAAV,0012x00000fomu6AAA,Logan Central,QLD,Australia,Loan Paid,Existing Client-Granted Loan Before,26.09,69.12,3786.3733,4.0,0.0,4.0,3.0,4.0,9644.8989,0.0,26.0,320.0,1791.6022,2975.7,1.0,7.48,0.0,0.0,4442.37,1500.0,600.0,1100,1496.0,7.0,13.714,Fortnightly,39.0,9681.72,1100.0,Part-Time Employment,0.0,0.0,0.011,0.0,8200.8333,768.0,3531.07,213.71,MoneySpot,0.0,4478704,0.0,14-01-2023,False,Other Expenses,2023-01-14,Green,2826.0,10830.0,9681.72
0062x00000EMHhgAAH,0012x00000g9xz9AAA,Gillieston,VIC,Australia,Loan Paid,Existing Client-Granted Loan Before,46.75,76.94,1185.488,1.0,0.0,4.0,3.0,1.0,5927.5911,1.0,22.0,0.0,819.3337,592.27,0.0,0.42,0.0,0.0,3623.75,599.0,800.0,1500,2160.0,24.0,24.0,Weekly,45.0,5927.59,1500.0,Full-Time Employment,2.0,0.0,0.0879,2.0,4997.3066,440.0,1858.5566,90.0,MoneySpot,0.0,6093870,2.0,03-08-2023,False,Other Expenses,2023-08-03,Orange,2645.0,5657.0,5927.59
0062x00000DXYoYAAX,0012x00000hX8CJAA0,Robinvale,VIC,Australia,Closed Lost,New Client-New Loan,0.0,55.46,0.0,1.0,0.0,0.0,3.0,1.0,6047.274,0.0,2.0,0.0,1232.003,1067.03,0.0,3.17,0.0,0.0,5200.0,599.0,400.0,1200,1536.0,6.0,6.571,Weekly,32.0,8749.68,5000.0,Casual Employment,0.0,0.0,0.033,0.0,5338.68,1653.0,1984.6233,256.0,MoneySpot,,4982109,0.0,06-04-2023,False,Living Expenses,2023-04-01,Orange,0.0,10520.0,8749.68
0062x00000D7vDCAAZ,0012x00000gADJoAAO,Potts Point,NSW,Australia,Loan Paid,New Client-New Loan,0.0,32.7,2917.8237,3.0,0.0,0.0,4.0,3.0,6213.8899,6.0,55.0,1893.5261,5864.7266,5864.73,1.0,0.39,0.0,0.0,0.0,0.0,1800.0,1200,1536.0,2.0,7.857,Monthly,30.0,6820.43,3800.0,,6.0,0.0,0.0549,3.0,5864.7266,1663.0,3806.4833,768.0,MoneySpot,0.0,4506460,1.0,19-01-2023,False,Holiday / Travel,2023-01-19,Orange,0.0,6941.0,6820.43
0062x00000FKScqAAH,0012x00000mK8pOAAS,Eaton,WA,Australia,Closed Lost,New Client-New Loan,51.7,75.39,123.6666,3.0,0.0,1.0,3.0,1.0,6140.9893,1.0,5.0,0.0,658.1553,289.6,2.0,0.0,0.0,0.0,0.0,0.0,1800.0,1250,1600.0,6.0,6.571,Weekly,39.0,6700.99,1250.0,,1.0,0.0,0.0,0.0,4007.7733,0.0,292.4066,266.67,MoneySpot,,7393307,1.0,04-12-2023,True,Vehicle Expenses,2023-12-04,Orange,4008.0,7751.0,6700.99
0062x00000DFxgoAAD,0012x000004TbD4AAK,Saint Lawrence,QLD,Australia,Loan Paid,Existing Client-Granted Loan Before,0.0,71.94,5597.2894,1.0,1.0,0.0,3.0,1.0,6813.3366,7.0,0.0,2479.3031,1568.0,1497.0,1.0,1.26,0.0,1.0,8911.09,899.0,400.0,1200,1632.0,14.0,14.0,Weekly,44.0,6813.34,2050.0,Full-Time Employment,7.0,0.0,0.0769,7.0,0.0,3146.0,5578.1166,116.57,MoneySpot,0.0,4695703,7.0,16-02-2023,False,Medical Expenses,2023-02-16,Orange,0.0,7602.0,6813.34
0062x00000DUdrpAAD,0012x00000iGv2zAAC,Dandenong,VIC,Australia,Loan Paid,Existing Client-No Loan Granted Ever,0.0,50.1,338.9481,1.0,0.0,0.0,2.0,1.0,3583.5061,0.0,9.0,0.0,824.6976,809.25,0.0,0.0,0.0,0.0,3505.67,400.0,300.0,1200,1680.0,20.0,20.0,Weekly,37.0,4338.51,4550.0,Full-Time Employment,0.0,0.0,0.3077,0.0,3573.69,201.0,200.5833,84.0,MoneySpot,0.0,5377863,0.0,24-05-2023,False,Vehicle Expenses,2023-05-24,Green,0.0,4324.0,4338.51
0062x00000FVAGQAA5,0012x00000dwXqGAAU,Roma,QLD,Australia,Loan Paid,Existing Client-Granted Loan Before,0.04,48.02,4910.7004,4.0,0.0,0.0,3.0,4.0,21663.9499,0.0,51.0,0.0,3814.2212,6365.15,0.0,4.18,0.0,0.0,7162.26,899.0,1200.0,1500,2040.0,7.0,13.286,Fortnightly,27.0,25782.46,1500.0,Full-Time Employment,2.0,0.0,0.0,0.0,14289.7666,442.0,5279.8333,291.43,MoneySpot,0.0,7569061,0.0,19-12-2023,False,Child Expenses,2023-12-19,Orange,11.0,22459.0,25782.46
0062x00000F1SCuAAN,0012x00000kfhTNAAY,South Mackay,QLD,Australia,Closed Lost,Existing Client-No Loan Granted Ever,0.0,92.92,3530.2343,2.0,0.0,0.0,3.0,2.0,10292.4616,4.0,14.0,0.0,4737.3533,4575.52,0.0,0.56,0.0,0.0,0.0,899.0,250.0,1200,1584.0,5.0,8.857,Fortnightly,43.0,10741.79,2050.0,Full-Time Employment,4.0,0.0,0.0989,2.0,9474.7066,0.0,3258.6966,316.8,MoneySpot,,6895675,0.0,20-10-2023,False,Other Expenses,2023-10-19,Green,0.0,10216.0,10741.79
0062x00000DAuSIAA1,0010K000026NTWAQA4,Mount Pritchard,NSW,Australia,Loan Paid,Existing Client-Granted Loan Before,0.0,63.15,217.8268,2.0,0.0,0.0,3.0,2.0,70.3322,1.0,28.0,487.4,23.1666,43.0,1.0,1.51,0.0,1.0,0.0,400.0,200.0,1500,2040.0,14.0,13.714,Weekly,33.0,8100.43,1500.0,,1.0,0.0,0.022,0.0,0.0,970.0,1148.2966,145.71,Financier-2,0.0,4650576,0.0,10-02-2023,False,Travel Expenses,2023-02-09,Orange,0.0,8302.0,8100.43
0062x00000DXSdcAAH,0012x00000hX4coAAC,Underwood,QLD,Australia,Loan Paid,New Client-New Loan,15.42,84.57,918.8668,1.0,0.0,2.0,2.0,1.0,5189.8138,1.0,5.0,0.0,875.6261,717.65,1.0,0.0,0.0,0.0,4333.33,400.0,800.0,1200,1536.0,6.0,6.571,Weekly,24.0,5731.98,1200.0,Full-Time Employment,1.0,0.0,0.011,1.0,4692.2266,340.0,916.8,256.0,MoneySpot,0.0,4973249,0.0,01-04-2023,False,Vehicle Expenses,2023-03-31,Green,898.0,5821.0,5731.98
0062x00000DZRB2AAP,0012x00000gAAwdAAG,Emmaville,NSW,Australia,Loan Paid,Existing Client-No Loan Granted Ever,0.0,10.94,1686.45,2.0,1.0,0.0,3.0,2.0,4179.9523,12.0,33.0,0.0,1840.0,1840.0,0.0,2.68,0.0,1.0,0.0,899.0,200.0,1200,1536.0,3.0,6.286,Fortnightly,26.0,3877.33,2000.0,Full-Time Employment,12.0,0.0,0.8901,2.0,0.0,636.0,1766.6566,512.0,MoneySpot,0.0,5093097,7.0,19-04-2023,False,Living Expenses,2023-04-19,Orange,0.0,5179.0,3877.33
0062x00000DV7FFAA1,0012x00000WXLoKAAX,Park Ridge,QLD,Australia,Closed Lost,Existing Client-No Loan Granted Ever,0.0,20.01,65.32,1.0,0.0,0.0,4.0,1.0,6860.5095,3.0,9.0,0.0,1493.553,1327.68,0.0,0.0,0.0,0.0,5881.77,899.0,350.0,1200,1536.0,9.0,8.714,Weekly,25.0,6860.51,3000.0,Full-Time Employment,3.0,0.0,0.0,0.0,6472.0633,0.0,65.32,170.67,MoneySpot,,5421416,0.0,01-06-2023,False,legal fees,2023-05-27,Green,0.0,7185.0,6860.51
0062x00000DAgS5AAL,0012x00000gnIUoAAM,Bassendean,WA,Australia,Loan Paid,New Client-New Loan,0.0,65.62,446.6666,3.0,0.0,0.0,1.0,3.0,6391.67,0.0,0.0,0.0,6391.67,6391.67,1.0,0.0,0.0,0.0,6391.0,599.0,720.0,1200,1632.0,4.0,16.286,Monthly,30.0,6391.67,3000.0,Full-Time Employment,2.0,0.0,0.0,0.0,6391.67,0.0,446.6666,408.0,MoneySpot,0.0,4640861,2.0,08-02-2023,False,Vehicle Expenses,2023-02-08,Orange,0.0,7433.0,6391.67
0062x00000DVoNUAA1,0010K00002BRrqdQAD,Daylesford,VIC,Australia,Loan Paid,Existing Client-No Loan Granted Ever,0.0,57.4,0.0,1.0,0.0,0.0,2.0,1.0,5238.5118,0.0,0.0,0.0,750.0,700.0,0.0,1.3,0.0,1.0,12566.67,400.0,2000.0,1200,1632.0,14.0,13.714,Weekly,42.0,7463.5,10000.0,Self Employed,0.0,0.0,0.0,0.0,0.0,0.0,0.0,116.57,MoneySpot,0.0,5477401,0.0,02-06-2023,False,Living Expenses,2023-06-02,Orange,0.0,20511.0,7463.5
0062x00000DJ7HFAA1,0012x00000gAVFPAA4,Salisbury North,SA,Australia,Loan Paid,Existing Client-Granted Loan Before,31.06,54.22,1299.1886,1.0,0.0,2.0,2.0,1.0,3809.9577,0.0,17.0,0.0,381.6761,353.65,2.0,0.0,0.0,0.0,0.0,400.0,0.0,1500,1980.0,12.0,11.857,Weekly,24.0,3710.79,1500.0,Full-Time Employment,0.0,0.0,0.2747,0.0,2849.31,427.0,1479.98,165.0,MoneySpot,0.0,4872689,0.0,16-03-2023,False,Medical Expenses,2023-03-16,Orange,1195.0,3847.0,3710.79
0062x00000DHhhFAAT,0012800001SDTyzAAH,Kingswood,NSW,Australia,Loan Paid,Existing Client-Granted Loan Before,0.0,39.71,2676.6033,2.0,0.0,0.0,4.0,2.0,8676.5005,0.0,49.0,1228.2033,3351.4857,4226.85,0.0,0.0,0.0,0.0,0.0,899.0,3986.0,1100,1452.0,6.0,12.0,Fortnightly,44.0,8676.5,1100.0,,0.0,0.0,0.0,0.0,7820.1333,1802.0,2768.27,242.0,MoneySpot,0.0,4792115,0.0,03-03-2023,False,Vehicle Expenses,2023-03-03,Orange,0.0,11328.0,8676.5
0062x00000F1jRAAAZ,0012x00000ldDI6AAM,Coomba Park,NSW,Australia,Closed Lost,New Client-New Loan,0.0,41.04,706.6825,1.0,0.0,0.0,3.0,1.0,4388.6657,0.0,26.0,18.4315,1009.9946,1148.8,1.0,2.14,0.0,0.0,0.0,0.0,400.0,1200,1728.0,22.0,22.571,Weekly,46.0,4388.67,5000.0,full_time,0.0,0.0,0.4286,0.0,4376.6433,13.0,686.7366,78.55,MoneySpot,,6916898,0.0,26-10-2023,False,holiday_travel,2023-10-22,Green,0.0,4631.0,4388.67
0062x00000DtxvKAAR,0012x00000haU2qAAE,Plumpton,NSW,Australia,Closed Lost,New Client-New Loan,0.0,70.8,1037.9426,2.0,0.0,0.0,3.0,2.0,5201.1175,0.0,15.0,0.0,2318.3642,2273.62,1.0,0.21,0.0,0.0,0.0,0.0,2000.0,1200,1536.0,3.0,5.286,Fortnightly,33.0,5201.12,2000.0,Full-Time Employment,0.0,0.0,0.0879,0.0,5409.5166,0.0,1296.8966,512.0,MoneySpot,,5362645,0.0,23-05-2023,False,Car Repairs,2023-05-22,Green,0.0,5769.0,5201.12
0062x00000D8dLEAAZ,0012x00000Miam3AAB,Barellan Point,QLD,Australia,Loan Paid,Existing Client-Granted Loan Before,25.93,77.62,1845.1458,4.0,1.0,2.0,2.0,4.0,3205.5229,16.0,46.0,943.024,568.84,601.0,0.0,0.0,0.0,0.0,1934.25,400.0,100.0,1100,1496.0,14.0,14.143,Weekly,44.0,4057.71,1500.0,Part-Time Employment,16.0,0.0,0.2198,7.0,3154.5333,919.0,2481.59,106.86,QuickCash,0.0,4542403,14.0,24-01-2023,False,Vehicle Expenses,2023-01-24,Orange,1258.0,4850.0,4057.71
0062x00000DAY4tAAH,0012x00000NSBOjAAP,Palmview,QLD,Australia,Loan Paid,Existing Client-Granted Loan Before,0.0,99.4,2934.7362,1.0,1.0,0.0,2.0,1.0,4511.8479,9.0,58.0,0.0,874.765,875.69,1.0,17.19,0.0,1.0,3460.3,899.0,600.0,1500,2040.0,14.0,14.143,Weekly,25.0,7820.19,1500.0,Part-Time Employment,9.0,0.0,0.0,0.0,566.17,616.0,3713.9,145.71,Financier-2,0.0,4634897,8.0,07-02-2023,False,Living Expenses,2023-02-07,Green,0.0,5097.0,7820.19
0062x00000DHjbdAAD,0010K00001rmpJAQAY,Stuart,NT,Australia,Loan Paid,Existing Client-No Loan Granted Ever,13.42,65.97,0.0,2.0,0.0,2.0,1.0,2.0,3676.8836,0.0,0.0,0.0,1313.0,1874.85,0.0,0.0,0.0,0.0,6066.67,400.0,650.0,1200,1536.0,3.0,6.571,Fortnightly,25.0,3847.31,1200.0,Casual Employment,0.0,0.0,0.0,0.0,1745.3266,13.0,13.0333,512.0,MoneySpot,0.0,4793316,0.0,03-03-2023,False,Holiday / Travel,2023-03-03,Green,432.0,3219.0,3847.31
0062x00000Ezw4mAAB,0012x00000lG3rBAAS,Laverton,VIC,Australia,Closed Lost,Existing Client-No Loan Granted Ever,0.0,19.65,527.6499,1.0,0.0,0.0,3.0,1.0,2695.9325,0.0,21.0,0.0,620.4338,630.72,0.0,0.0,0.0,0.0,0.0,899.0,350.0,1200,1824.0,33.0,33.571,Weekly,23.0,2695.93,4750.0,Full-Time Employment,0.0,0.0,0.0,0.0,2688.5466,0.0,527.65,55.27,MoneySpot,,6844923,0.0,15-10-2023,False,Vehicle Expenses,2023-10-15,Green,0.0,3528.0,2695.93
0062x00000DI4K7AAL,0012x00000FGfIFAA1,MOUNT JUKES,QLD,Australia,Loan Paid,Existing Client-Granted Loan Before,0.0,76.86,0.0,1.0,0.0,0.0,3.0,1.0,5010.715,0.0,0.0,0.0,924.9318,1004.0,0.0,2.69,0.0,0.0,2642.42,899.0,400.0,1500,2040.0,13.0,13.286,Weekly,43.0,6485.74,1500.0,Part-Time Employment,0.0,0.0,0.022,0.0,4800.3066,104.0,139.0,156.92,QuickCash,0.0,4815149,0.0,07-03-2023,False,Vehicle - Repairs,2023-03-07,Green,0.0,6353.0,6485.74
0062x00000DAs73AAD,0012x000002bCMdAAM,Coffs Harbour,NSW,Australia,Loan Paid,Existing Client-Granted Loan Before,0.0,81.76,3518.4344,2.0,0.0,0.0,3.0,2.0,7507.9271,13.0,62.0,1156.1251,2584.61,3334.04,1.0,0.0,0.0,0.0,4116.67,899.0,1260.0,1500,2040.0,7.0,14.0,Fortnightly,50.0,7808.26,1500.0,Full-Time Employment,13.0,0.0,0.2967,5.0,7253.7566,2842.0,6070.4666,291.43,Financier-2,0.0,4649192,13.0,09-02-2023,False,Vehicle Expenses,2023-02-09,Green,0.0,9584.0,7808.26
0062x00000DZ6hGAAT,0012x00000gq7JYAAY,Kennington,VIC,Australia,Closed Lost,Existing Client-No Loan Granted Ever,0.0,70.74,2779.5615,1.0,0.0,0.0,4.0,1.0,6877.8271,1.0,41.0,949.9174,1021.0,1021.0,1.0,5.33,0.0,0.0,0.0,599.0,1040.0,1200,1536.0,6.0,6.714,Weekly,25.0,7309.57,1200.0,,2.0,0.0,0.011,1.0,4424.3333,201.0,5046.33,256.0,MoneySpot,,5073473,0.0,20-04-2023,False,Veterinary Expenses,2023-04-16,Orange,0.0,8723.0,7309.57
0062x00000DY1CfAAL,0012x00000hXNfrAAG,Glengowrie,SA,Australia,Closed Lost,New Client-New Loan,0.84,69.99,0.0,1.0,0.0,0.0,2.0,1.0,4514.5833,10.0,20.0,0.0,1001.0,1001.0,0.0,0.0,0.0,0.0,0.0,0.0,800.0,1200,1536.0,6.0,5.857,Weekly,28.0,8035.28,1400.0,,10.0,0.0,1.0,2.0,1334.6666,0.0,0.0,256.0,MoneySpot,,5008228,0.0,07-04-2023,False,Event - Holiday - Accommodation,2023-04-05,Green,39.0,4635.0,8035.28
0062x00000EEGKwAAP,0012x00000ka3GkAAI,Parramatta,NSW,Australia,Closed Lost,Existing Client-No Loan Granted Ever,0.0,22.65,0.0,1.0,0.0,0.0,3.0,1.0,6737.5316,0.0,9.0,0.0,1019.3263,1102.38,0.0,0.33,0.0,0.0,0.0,2000.0,1560.0,1200,1728.0,23.0,23.286,Weekly,25.0,6586.49,4850.0,Full-time,0.0,0.0,0.0,0.0,4088.9266,0.0,0.0,75.13,MoneySpot,,6002527,0.0,29-07-2023,False,Other Expenses,2023-07-24,Green,0.0,6346.0,6586.49
0062x00000EcZFaAAN,0012x00000lFqzBAAS,Redbank Plains,QLD,Australia,Closed Lost,Existing Client-No Loan Granted Ever,0.0,32.49,0.0,2.0,0.0,0.0,2.0,2.0,3972.5758,0.0,22.0,0.0,1828.4733,1878.61,0.0,0.0,0.0,0.0,0.0,400.0,1200.0,1200,1728.0,13.0,26.286,Fortnightly,28.0,3696.95,2050.0,Full-Time Employment,0.0,0.0,0.0,0.0,3656.9466,0.0,980.0,132.92,MoneySpot,,6363934,0.0,29-08-2023,False,Relocation Expenses,2023-08-29,Green,0.0,3852.0,3696.95
0062x00000DZxdQAAT,0012x00000TGq34AAD,Cable Beach,WA,Australia,Loan Paid,Existing Client-Granted Loan Before,0.0,100.0,149.4699,3.0,0.0,0.0,3.0,3.0,7301.3133,3.0,5.0,313.35,7301.3133,6551.61,1.0,0.35,0.0,0.0,7354.05,599.0,500.0,1200,1536.0,2.0,8.143,Monthly,32.0,7301.31,2500.0,Full-Time Employment,3.0,0.0,0.0,3.0,7301.3133,1107.0,3268.83,768.0,MoneySpot,0.0,5126744,3.0,24-04-2023,False,Vehicle Expenses,2023-04-24,Orange,0.0,8913.0,7301.31
0062x00000E5WLWAA3,0012x00000iJUbGAAW,Kanahooka,NSW,Australia,Loan Paid,New Client-New Loan,0.0,32.89,197.1734,1.0,0.0,0.0,2.0,1.0,3676.5467,7.0,16.0,79.8438,830.0,830.0,0.0,4.19,0.0,0.0,830.0,2000.0,0.0,1200,1776.0,28.0,28.143,Weekly,27.0,4110.7,2050.0,Full-Time Employment,7.0,0.0,0.0,3.0,3320.0,63.0,1017.73,63.43,MoneySpot,0.0,5660664,0.0,20-06-2023,False,Vehicle Expenses,2023-06-19,Green,0.0,4037.0,4110.7
0062x00000F31RIAAZ,0010K00001dRi4hQAC,Eagleby,QLD,Australia,Loan Paid,Existing Client-No Loan Granted Ever,0.0,65.7,260.2997,1.0,0.0,0.0,2.0,1.0,4590.0462,0.0,32.0,0.0,722.9769,681.04,1.0,0.42,0.0,0.0,2166.67,400.0,133.0,1200,1776.0,27.0,27.0,Weekly,33.0,4759.09,2000.0,Casual Employment,0.0,0.0,0.0,0.0,3132.9,0.0,722.7333,65.78,MoneySpot,0.0,7013473,0.0,01-11-2023,False,rental_bond_cleaning,2023-10-31,Green,0.0,6620.0,4759.09
0062x00000D2DaTAAV,0012x00000RpxcIAAR,Baynton,WA,Australia,Loan Paid,Existing Client-Granted Loan Before,0.0,52.25,2511.6936,4.0,0.0,0.0,3.0,4.0,11698.9099,0.0,67.0,401.0033,3965.9237,3846.77,0.0,31.27,0.0,0.0,2800.0,400.0,250.0,1500,2040.0,7.0,13.714,Fortnightly,43.0,12598.91,1500.0,Full-Time Employment,0.0,0.0,0.5385,0.0,10575.7966,1298.0,2683.6633,291.43,Financier-2,0.0,4433898,0.0,07-01-2023,False,Medical Expenses,2023-01-07,Green,0.0,14781.0,12598.91
0062x00000DYGWeAAP,0012x00000hXVi6AAG,Morphettville,SA,Australia,Closed Lost,New Client-New Loan,0.0,40.65,800.9772,4.0,0.0,0.0,3.0,4.0,6210.2181,0.0,22.0,0.0,1025.4085,1016.99,0.0,0.0,0.0,0.0,0.0,0.0,600.0,1200,1584.0,5.0,8.857,Fortnightly,27.0,5539.85,10000.0,,0.0,0.0,0.011,0.0,4231.1666,0.0,918.4066,316.8,MoneySpot,,5022204,0.0,12-04-2023,False,University & Course Fees,2023-04-07,Orange,0.0,14575.0,5539.85
0062x00000D72lFAAR,0012x00000khdbVAAQ,Redbank Plains,QLD,Australia,Loan Paid,Existing Client-Granted Loan Before,0.0,82.98,1194.5476,1.0,0.0,0.0,3.0,1.0,5593.5817,0.0,27.0,0.0,1184.9,1184.9,0.0,0.43,0.0,1.0,2907.77,899.0,0.0,1200,1632.0,14.0,14.0,Weekly,35.0,11375.9,2500.0,Full-Time Employment,0.0,0.0,0.1868,0.0,0.0,440.0,1592.9733,116.57,MoneySpot,0.0,4464884,0.0,12-01-2023,False,Travel and accommodations,2023-01-12,Orange,0.0,12882.0,11375.9
0062x00000Dr0aGAAR,0010K00001y9A7eQAE,Moonee Beach,NSW,Australia,Loan Paid,Existing Client-Granted Loan Before,0.0,80.31,3867.8331,2.0,0.0,0.0,3.0,2.0,5465.5921,12.0,93.0,998.9021,2515.67,2283.15,1.0,0.0,0.0,0.0,4372.33,400.0,200.0,1500,2160.0,12.0,23.143,Fortnightly,42.0,5465.59,4000.0,Full-Time Employment,12.0,0.0,0.2527,6.0,5031.34,2623.0,5151.9433,180.0,MoneySpot,0.0,5141266,8.0,26-04-2023,False,Furniture or Appliances,2023-04-26,Green,0.0,6635.0,5465.59
0062x00000DASssAAH,0012x00000gnCJlAAM,Oakhurst,NSW,Australia,Loan Paid,New Client-New Loan,7.52,88.63,418.1563,2.0,0.0,2.0,4.0,2.0,11346.5993,0.0,23.0,401.5157,1145.1128,1432.51,0.0,0.13,0.0,0.0,0.0,0.0,200.0,1200,1632.0,8.0,15.429,Fortnightly,26.0,11583.1,5000.0,,0.0,0.0,0.0,0.0,4017.84,422.0,1271.4733,204.0,MoneySpot,0.0,4630691,0.0,07-02-2023,False,Holiday / Travel,2023-02-06,Green,1346.0,17881.0,11583.1
0062x00000DYN6NAAX,0012x00000IOpbHAAT,Bundaberg North,QLD,Australia,Loan Paid,Existing Client-Granted Loan Before,6.67,77.4,593.8458,2.0,0.0,0.0,4.0,2.0,3061.9089,4.0,19.0,0.0,1409.3183,1759.87,0.0,0.0,0.0,0.0,1235.0,400.0,150.0,1250,1600.0,3.0,5.571,Fortnightly,38.0,3066.91,1250.0,Unemployed,4.0,0.0,0.956,2.0,2818.6366,213.0,343.3333,533.33,QuickCash,0.0,5030702,4.0,12-04-2023,False,Vehicle Expenses,2023-04-11,Green,203.0,3039.0,3066.91
0062x00000E3gb0AAB,0012x00000MhFnQAAV,Yamba,NSW,Australia,Loan Paid,Existing Client-Granted Loan Before,0.0,54.38,598.0666,4.0,0.0,0.0,4.0,4.0,4335.6166,3.0,14.0,689.372,1858.1214,2301.37,0.0,0.69,0.0,0.0,0.0,1499.0,0.0,1250,1700.0,7.0,13.571,Fortnightly,49.0,4812.28,2050.0,Unemployed,3.0,0.0,0.0,0.0,4335.6166,1164.0,2892.29,242.86,MoneySpot,0.0,5507240,3.0,05-06-2023,False,Living Expenses,2023-06-05,Orange,0.0,8399.0,4812.28
0062x00000DsmEfAAJ,0012x00000hZg0IAAS,North Parramatta,NSW,Australia,Loan Paid,New Client-New Loan,0.0,10.49,162.9451,4.0,0.0,0.0,3.0,4.0,6889.9031,0.0,0.0,162.9464,200.0,350.0,0.0,0.0,0.0,1.0,80000.0,2000.0,1400.0,1500,2220.0,14.0,27.714,Fortnightly,28.0,6889.9,5000.0,Full-Time Employment,0.0,0.0,0.0549,0.0,0.0,175.0,175.0,158.57,MoneySpot,0.0,5263361,0.0,15-05-2023,False,Relocation Expenses,2023-05-15,Orange,0.0,7188.0,6889.9
0062x00000DG68DAAT,0012x00000g8voEAAQ,Banjup,WA,Australia,Loan Paid,Existing Client-Granted Loan Before,1.97,56.17,1636.2693,1.0,0.0,4.0,4.0,1.0,5612.3763,0.0,0.0,0.0,1253.617,1253.62,0.0,30.83,0.0,0.0,1253.0,599.0,1040.0,1250,1700.0,14.0,14.0,Weekly,38.0,7460.55,1250.0,Full-Time Employment,0.0,0.0,0.0,0.0,4343.8366,405.0,1251.8666,121.43,QuickCash,0.0,4702800,0.0,17-02-2023,False,Living Expenses,2023-02-17,Green,165.0,8350.0,7460.55
0062x00000DGPzTAAX,0012x00000WqeRUAAZ,Nerang,QLD,Australia,Loan Paid,Existing Client-No Loan Granted Ever,0.0,44.4,0.0,4.0,3.0,0.0,4.0,4.0,3654.7166,0.0,3.0,734.731,1233.2437,697.25,0.0,0.53,0.0,0.0,5081.95,599.0,480.0,1200,1632.0,14.0,14.571,Weekly,33.0,5697.66,5000.0,Part-Time Employment,23.0,0.0,0.011,1.0,4755.0266,1243.0,1242.7733,116.57,MoneySpot,0.0,4721586,20.0,20-02-2023,False,Furniture or Appliances,2023-02-20,Orange,0.0,5115.0,5697.66
0062x00000DVJwmAAH,0012x00000iHMNiAAO,Durack,QLD,Australia,Closed Lost,New Client-New Loan,0.0,25.37,0.0,1.0,0.0,0.0,4.0,1.0,5828.1831,0.0,2.0,0.0,1341.2807,1148.37,0.0,0.0,0.0,0.0,1200.0,2000.0,1320.0,1200,1584.0,10.0,10.429,Weekly,52.0,5828.18,3000.0,Full-Time Employment,0.0,0.0,0.022,0.0,5812.2166,0.0,0.0,158.4,MoneySpot,,5438248,0.0,30-05-2023,False,Vehicle Expenses,2023-05-29,Green,0.0,6462.0,5828.18
0062x00000EwA6TAAV,0012x00000fmMUAAA2,Brooklyn Park,SA,Australia,Loan Paid,Existing Client-No Loan Granted Ever,0.0,60.92,323.83,1.0,0.0,0.0,1.0,1.0,6534.8881,1.0,17.0,0.0,848.7963,818.32,1.0,0.0,0.0,0.0,0.0,400.0,100.0,1200,1776.0,29.0,29.143,Weekly,46.0,7268.39,2050.0,,1.0,0.0,0.0,0.0,3112.2533,395.0,1853.4366,61.24,MoneySpot,0.0,6566097,0.0,18-09-2023,False,Other Expenses,2023-09-18,Green,0.0,8200.0,7268.39
0062x00000DVcn2AAD,0012x00000haLl8AAE,Whyalla Norrie,SA,Australia,Closed Lost,Existing Client-No Loan Granted Ever,0.0,53.32,0.0,2.0,0.0,0.0,3.0,2.0,6580.4613,0.0,2.0,0.0,2754.185,2496.57,0.0,19.76,1.0,0.0,0.0,899.0,800.0,1200,1584.0,7.0,13.0,Fortnightly,59.0,6893.79,2000.0,Full-Time Employment,0.0,0.0,0.022,0.0,5508.37,0.0,0.0,226.29,MoneySpot,,5463192,0.0,01-06-2023,False,Travel Expenses,2023-05-31,Green,0.0,6805.0,6893.79
0062x00000DVMrkAAH,0012x00000iHO0GAAW,Wellesley Islands,QLD,Australia,Loan Paid,New Client-New Loan,0.0,39.56,0.0,1.0,0.0,0.0,2.0,1.0,4634.0053,0.0,3.0,0.0,857.8758,929.49,0.0,3.85,0.0,0.0,3900.0,400.0,50.0,1200,1632.0,16.0,16.143,Weekly,51.0,4634.01,5000.0,Full-Time Employment,0.0,0.0,0.0,0.0,3431.5033,0.0,0.0,102.0,MoneySpot,0.0,5440604,0.0,30-05-2023,False,Travel Expenses,2023-05-30,Green,0.0,5149.0,4634.01
0062x00000FXhMUAA1,0012x00000n4BrEAAU,Subiaco,WA,Australia,Loan Paid,New Client-New Loan,0.0,61.1,1574.9284,2.0,0.0,0.0,5.0,2.0,5626.4282,0.0,12.0,0.0,2435.2214,2435.23,1.0,0.0,0.0,0.0,5275.83,400.0,2200.0,1200,1632.0,8.0,15.714,Fortnightly,67.0,5667.63,2100.0,Full-Time Employment,0.0,0.0,0.0,0.0,5991.14,0.0,1633.6833,204.0,MoneySpot,0.0,7776540,0.0,2024-01-08,False,Living Expenses,2024-01-08,Green,0.0,6071.0,5667.63
0062x00000DrXf2AAF,0012x00000hYvHNAA0,Henty,VIC,Australia,Closed Lost,New Client-New Loan,0.0,37.94,625.22,2.0,0.0,0.0,5.0,2.0,5438.2632,0.0,9.0,0.0,1463.7142,1517.0,0.0,0.13,0.0,0.0,0.0,0.0,0.0,1200,1536.0,3.0,4.714,Fortnightly,31.0,8418.57,1500.0,Part-Time Employment,0.0,0.0,0.033,0.0,3692.0,0.0,628.1866,512.0,MoneySpot,,5173548,0.0,01-05-2023,False,Dental/medical/vet bills,2023-05-01,Green,0.0,14706.0,8418.57
0062x00000Edqe9AAB,0012x00000hYl8gAAC,Saint Helens Park,NSW,Australia,Loan Paid,Existing Client-No Loan Granted Ever,0.0,88.1,2088.8424,1.0,1.0,0.0,3.0,1.0,7517.9432,12.0,15.0,0.0,1489.3238,1307.01,0.0,2.77,0.0,0.0,0.0,599.0,600.0,1200,1632.0,14.0,14.0,Weekly,36.0,7434.8,2050.0,,12.0,0.0,0.0,3.0,6453.7366,506.0,2121.2633,116.57,MoneySpot,0.0,6447921,12.0,07-09-2023,False,Vehicle Expenses,2023-09-07,Green,0.0,8109.0,7434.8
0062x00000F3ZMEAA3,0012x00000hZm6bAAC,Penshurst,NSW,Australia,Loan Paid,Existing Client-No Loan Granted Ever,0.0,51.85,0.0,2.0,0.0,0.0,2.0,2.0,6350.3989,2.0,34.0,0.0,1945.98,1845.05,0.0,4.32,0.0,0.0,0.0,400.0,2280.0,1200,1680.0,10.0,19.571,Fortnightly,26.0,5654.54,2250.0,Full-time,2.0,0.0,0.0,2.0,4540.62,0.0,76.55,168.0,MoneySpot,0.0,7058934,0.0,04-11-2023,False,Other Expenses,2023-11-03,Green,0.0,8189.0,5654.54
0062x00000FHZwNAAX,0012x00000mHTNKAA4,Mickleham,VIC,Australia,Loan Paid,New Client-New Loan,0.0,53.85,366.8899,1.0,0.0,0.0,2.0,1.0,7649.3964,0.0,0.0,0.0,964.1666,890.0,0.0,0.0,0.0,0.0,3856.67,400.0,0.0,1200,1728.0,23.0,23.143,Weekly,35.0,7383.2,2050.0,Full-Time Employment,0.0,0.0,0.0,0.0,3856.6666,152.0,380.4733,75.13,MoneySpot,0.0,7181481,0.0,13-11-2023,False,Living Expenses,2023-11-13,Green,0.0,11166.0,7383.2
0062x00000Eeu3bAAB,0010K000028iVvDQAU,Seven Hills,NSW,Australia,Loan Paid,Existing Client-No Loan Granted Ever,0.0,27.07,778.7606,2.0,0.0,0.0,3.0,2.0,5784.9735,0.0,26.0,12.8,1944.8,1944.8,1.0,0.49,0.0,0.0,4701.67,400.0,350.0,1200,1728.0,11.0,22.0,Fortnightly,45.0,5940.15,4700.0,Full-Time Employment,0.0,0.0,0.0,0.0,4537.8666,368.0,931.11,157.09,MoneySpot,0.0,6525998,0.0,14-09-2023,False,Life Event Expenses,2023-09-14,Green,0.0,6938.0,5940.15
0062x00000DVaaVAAT,0012x00000Tu1WpAAJ,Injinoo,QLD,Australia,Loan Paid,Existing Client-Granted Loan Before,5.9,96.35,1587.1957,2.0,3.0,0.0,3.0,2.0,2571.7687,15.0,46.0,522.4838,1183.7183,425.2,0.0,0.0,0.0,0.0,4983.33,400.0,0.0,1500,2040.0,7.0,14.0,Fortnightly,29.0,2851.77,2050.0,Full-Time Employment,15.0,0.0,0.4396,4.0,2367.4366,2079.0,3046.4633,291.43,MoneySpot,0.0,5459070,14.0,01-06-2023,False,Travel Expenses,2023-05-31,Orange,232.0,3931.0,2851.77
0062x00000EDG4DAAX,0012x00000Rqt7UAAR,Westcourt,QLD,Australia,Closed Lost,Existing Client-No Loan Granted Ever,0.0,42.77,839.4976,2.0,0.0,0.0,2.0,2.0,3942.0788,0.0,28.0,158.4,1645.67,1552.38,1.0,0.29,0.0,0.0,0.0,400.0,0.0,1200,1776.0,14.0,27.286,Fortnightly,55.0,5428.66,2050.0,,0.0,0.0,0.7802,0.0,5208.3633,422.0,840.3533,126.86,MoneySpot,,5932094,0.0,17-07-2023,False,Furniture or Appliances,2023-07-17,Green,0.0,4453.0,5428.66
0062x00000FJGUsAAP,0012x00000fmHxkAAE,Inverell,NSW,Australia,Closed Lost,Existing Client-No Loan Granted Ever,0.0,17.42,215.3052,1.0,0.0,0.0,2.0,1.0,5533.1104,1.0,0.0,214.3506,1178.3669,1436.5,0.0,0.0,0.0,0.0,0.0,400.0,290.0,1200,1872.0,36.0,36.571,Weekly,32.0,5533.11,2050.0,Full-Time Employment,1.0,0.0,0.0,1.0,5106.2566,214.0,214.0566,52.0,MoneySpot,,7311068,1.0,29-11-2023,False,Living Expenses,2023-11-24,Green,0.0,5937.0,5533.11
0062x00000DrmRJAAZ,0012x00000GdteyAAB,Branxton,NSW,Australia,Loan Paid,Existing Client-Granted Loan Before,0.33,78.83,1662.1321,4.0,0.0,0.0,4.0,4.0,1958.6699,9.0,43.0,323.4126,993.202,1531.02,0.0,0.0,0.0,0.0,0.0,400.0,880.0,1200,1728.0,24.0,24.143,Weekly,46.0,7104.67,2050.0,Part-Time Employment,9.0,0.0,0.0989,1.0,1655.3366,717.0,1664.31,72.0,MoneySpot,0.0,5192542,5.0,04-05-2023,False,Home Maintenance & Repairs,2023-05-04,Green,26.0,7726.0,7104.67
0062x00000DVBOcAAP,0012x00000iHHNwAAO,Rokeby,TAS,Australia,Loan Paid,New Client-New Loan,0.69,13.64,145.5966,1.0,0.0,0.0,2.0,1.0,2726.8541,0.0,26.0,0.0,627.55,654.7,0.0,0.33,0.0,0.0,2600.0,400.0,0.0,1200,1872.0,39.0,39.286,Weekly,45.0,2726.85,20500.0,Full-Time Employment,0.0,0.0,0.0549,0.0,2719.3833,0.0,145.5966,48.0,MoneySpot,0.0,5428155,0.0,29-05-2023,False,Living Expenses,2023-05-29,Green,19.0,2752.0,2726.85
0062x00000DIDn8AAH,0012x00000gp4lyAAA,Clayton,VIC,Australia,Closed Lost,New Client-New Loan,0.0,51.95,1291.8686,1.0,0.0,0.0,3.0,1.0,8955.6665,2.0,42.0,916.7158,820.51,900.71,3.0,0.09,0.0,0.0,0.0,0.0,500.0,1200,1536.0,6.0,6.143,Weekly,28.0,8955.67,2000.0,,2.0,0.0,0.5495,1.0,5236.4833,723.0,2229.9333,256.0,MoneySpot,,4822087,2.0,13-03-2023,False,Other,2023-03-08,Green,0.0,10585.0,8955.67
0062x00000DW2oIAAT,0012x00000cwG7MAAU,Islington,NSW,Australia,Loan Paid,Existing Client-Granted Loan Before,0.0,51.02,877.5266,1.0,0.0,0.0,3.0,1.0,5884.7033,3.0,26.0,0.0,1195.632,1569.07,0.0,4.09,0.0,0.0,4050.62,400.0,800.0,1500,1980.0,10.0,10.571,Weekly,22.0,8795.45,1500.0,Full-Time Employment,3.0,0.0,0.1648,1.0,1992.72,0.0,877.5266,198.0,MoneySpot,0.0,4892950,3.0,19-03-2023,False,Vehicle Expenses,2023-03-19,Green,0.0,6356.0,8795.45
0062x00000DGO1NAAX,0010K0000260n9WQAQ,Bundoora,VIC,Australia,Loan Paid,Existing Client-Granted Loan Before,8.4,63.56,299.7855,2.0,0.0,4.0,1.0,4.0,1369.2541,0.0,63.0,1411.6674,266.34,218.54,1.0,1.54,0.0,0.0,0.0,400.0,700.0,1500,2040.0,14.0,14.429,Weekly,51.0,6313.97,1500.0,,0.0,0.0,0.1538,0.0,804.1133,1240.0,2145.7,145.71,Financier-2,0.0,4720322,0.0,20-02-2023,True,Vehicle Expenses,2023-02-20,Orange,802.0,9542.0,6313.97
0062x00000DIgYlAAL,0012x00000XDfBvAAL,Gowrie Junction,QLD,Australia,Loan Paid,Existing Client-Granted Loan Before,0.71,80.81,2296.1292,1.0,0.0,0.0,2.0,1.0,3561.3766,0.0,34.0,0.0,787.2323,907.96,1.0,0.0,0.0,0.0,2600.0,400.0,0.0,1200,1584.0,11.0,11.429,Weekly,21.0,3571.38,2050.0,Full-Time Employment,0.0,0.0,0.3736,0.0,3411.34,439.0,2052.36,144.0,MoneySpot,0.0,4849832,0.0,12-03-2023,False,Veterinary Expenses,2023-03-12,Orange,26.0,3634.0,3571.38
0062x00000DVC7DAAX,0012x00000gpohUAAQ,Swan Hill,VIC,Australia,Closed Lost,Existing Client-No Loan Granted Ever,0.0,19.16,2319.7655,2.0,0.0,0.0,1.0,2.0,3630.8665,1.0,20.0,0.0,1314.8333,1294.16,1.0,0.0,0.0,0.0,0.0,400.0,170.0,1050,1344.0,3.0,5.143,Fortnightly,31.0,3630.87,1050.0,Full-Time Employment,1.0,0.0,0.0,0.0,2629.6666,0.0,2352.5333,448.0,MoneySpot,,5428696,0.0,02-06-2023,False,Home Maintenance & Repairs,2023-05-29,Orange,0.0,4077.0,3630.87
0062x00000FWPsOAAX,0012800001GftVSAAZ,Ingleburn,NSW,Australia,Loan Paid,Existing Client-Granted Loan Before,0.0,62.06,3880.2175,1.0,0.0,0.0,2.0,1.0,5391.7617,0.0,9.0,1018.0893,1240.8438,1341.49,1.0,0.83,0.0,1.0,3856.67,899.0,1000.0,1250,1700.0,16.0,15.714,Weekly,47.0,5391.76,1250.0,Full-Time Employment,0.0,0.0,0.0,0.0,0.0,1958.0,3456.9433,106.25,MoneySpot,0.0,7668228,0.0,29-12-2023,False,Vehicle Expenses,2023-12-28,Orange,0.0,5401.0,5391.76
0062x00000FJ9SUAA1,0012x00000LSlijAAD,Glen Iris,VIC,Australia,Closed Lost,Existing Client-No Loan Granted Ever,0.0,14.84,1109.3585,0.0,0.0,0.0,0.0,0.0,0.0,5.0,0.0,0.0,0.0,0.0,1.0,0.0,0.0,0.0,1956.0,400.0,700.0,1250,1600.0,6.0,6.0,Weekly,39.0,5372.66,1250.0,Full-Time Employment,6.0,0.0,0.1868,2.0,0.0,0.0,1113.1866,266.67,QuickCash,,7302326,2.0,25-11-2023,False,Vehicle Expenses,2023-11-24,Orange,0.0,4751.0,5372.66
0062x00000EyccvAAB,0012x00000lI60fAAC,Jubilee,QLD,Australia,Loan Paid,Existing Client-No Loan Granted Ever,0.0,58.54,1360.8575,1.0,0.0,0.0,3.0,1.0,8166.778,0.0,34.0,221.303,1557.133,1441.15,1.0,26.11,0.0,0.0,0.0,1499.0,420.0,1200,1728.0,23.0,23.0,Weekly,34.0,8266.78,5000.0,Full-Time Employment,0.0,0.0,0.0,0.0,6747.5766,264.0,1351.4533,75.13,MoneySpot,0.0,6749589,0.0,05-10-2023,False,Living Expenses,2023-10-05,Green,0.0,8398.0,8266.78
0062x00000DZCMgAAP,0012x00000dbtCGAAY,Brunswick,VIC,Australia,Closed Lost,Existing Client-No Loan Granted Ever,5.27,78.09,43.4502,2.0,0.0,2.0,1.0,2.0,12231.8715,1.0,27.0,0.0,2181.6666,2145.0,1.0,0.0,0.0,0.0,0.0,0.0,1680.0,1200,1776.0,15.0,30.143,Fortnightly,39.0,17751.94,5500.0,,1.0,0.0,0.022,0.0,7968.4766,0.0,53.3333,118.4,MoneySpot,,5079038,0.0,21-04-2023,False,Specialist expenses,2023-04-17,Green,1152.0,21856.0,17751.94
0062x00000DX9J8AAL,0012x00000XDksSAAT,KILMORE,VIC,Australia,Loan Paid,Existing Client-Granted Loan Before,0.0,91.67,1704.0658,1.0,0.0,0.0,2.0,1.0,5301.483,4.0,42.0,0.0,926.1953,973.42,1.0,26.46,0.0,0.0,3787.28,1499.0,400.0,1500,1980.0,9.0,9.0,Weekly,53.0,7948.54,1500.0,Full-Time Employment,4.0,0.0,0.022,1.0,4013.5133,213.0,1590.6333,220.0,QuickCash,0.0,4956782,1.0,29-03-2023,False,Vehicle Expenses,2023-03-29,Green,0.0,8651.0,7948.54
0062x00000D8b9BAAR,0012x00000cyKdjAAE,Blacktown,QLD,Australia,Closed Lost,Existing Client-No Loan Granted Ever,0.0,18.14,1461.9853,1.0,0.0,0.0,5.0,1.0,8328.3725,4.0,53.0,357.0048,1816.6666,2000.0,1.0,0.87,0.0,0.0,6283.33,1500.0,1570.0,1200,1536.0,6.0,6.571,Weekly,30.0,11047.63,1500.0,Full-Time Employment,4.0,0.0,0.033,4.0,5450.0,329.0,1474.7666,256.0,MoneySpot,,4540947,3.0,24-01-2023,False,Vehicle Expenses,2023-01-24,Green,0.0,15353.0,11047.63
0062x00000DZmddAAD,0012x00000dbvYHAAY,Mount Gambier,SA,Australia,Closed Lost,Existing Client-No Loan Granted Ever,0.0,72.32,1973.3709,1.0,0.0,0.0,2.0,1.0,5476.4457,0.0,44.0,0.0,879.5546,889.08,0.0,0.25,0.0,0.0,17333.33,400.0,1098.0,1200,1920.0,39.0,39.571,Weekly,30.0,4955.21,10000.0,Part-Time Employment,0.0,0.0,0.0,0.0,3811.4033,161.0,1609.3233,49.23,MoneySpot,,5112243,0.0,26-04-2023,False,Home Maintenance,2023-04-21,Green,0.0,7460.0,4955.21
0062x00000DrREPAA3,0012x00000XOryjAAD,Cobar,NSW,Australia,Closed Lost,Existing Client-No Loan Granted Ever,0.0,88.17,0.0,2.0,0.0,0.0,2.0,2.0,3779.2617,2.0,3.0,0.0,1739.4971,1810.47,0.0,4.14,0.0,0.0,2366.0,0.0,680.0,1200,1584.0,6.0,11.571,Fortnightly,28.0,3779.26,4000.0,Full-Time Employment,2.0,0.0,0.0769,0.0,4058.8266,0.0,0.0,264.0,MoneySpot,,5167517,0.0,30-04-2023,False,Living Expenses,2023-04-30,Green,0.0,4353.0,3779.26
0062x00000DVLoBAAX,0012x00000iHNPmAAO,Upper Coomera,QLD,Australia,Closed Lost,New Client-New Loan,0.0,95.54,1157.5988,1.0,0.0,0.0,3.0,1.0,7367.09,0.0,25.0,0.0,1937.6458,1821.5,2.0,0.0,0.0,0.0,1516.67,400.0,120.0,1200,1632.0,16.0,16.286,Weekly,31.0,10412.62,5000.0,Part-Time Employment,0.0,0.0,0.0549,0.0,10245.7533,0.0,1167.13,102.0,MoneySpot,,5439740,0.0,30-05-2023,False,Living Expenses,2023-05-30,Green,0.0,12819.0,10412.62
0062x00000DUvbfAAD,0012x00000THdMBAA1,South Wentworthville,NSW,Australia,Loan Paid,Existing Client-Granted Loan Before,0.0,40.47,1343.7633,1.0,1.0,0.0,4.0,1.0,15811.957,15.0,41.0,1337.471,1844.6153,1780.0,1.0,0.49,0.0,0.0,3480.39,599.0,0.0,1200,1632.0,14.0,14.0,Weekly,32.0,14855.29,3500.0,Full-Time Employment,15.0,0.0,0.044,3.0,7993.3333,1143.0,1794.6033,116.57,MoneySpot,0.0,5401494,15.0,26-05-2023,False,Living Expenses,2023-05-26,Orange,0.0,27243.0,14855.29
0062x00000DA6OcAAL,0012x00000gn1XyAAI,Mount Louisa,QLD,Australia,Closed Lost,New Client-New Loan,0.0,44.02,1048.611,2.0,0.0,0.0,4.0,2.0,3781.1931,2.0,4.0,0.0,1740.385,3494.79,0.0,0.44,0.0,0.0,0.0,0.0,100.0,1200,1872.0,20.0,38.714,Fortnightly,21.0,3781.19,9000.0,,4.0,0.0,0.0549,0.0,3480.77,0.0,998.6666,93.6,MoneySpot,,4612415,4.0,08-02-2023,False,Motorbike,2023-02-03,Green,0.0,3664.0,3781.19
0062x00000DsxTAAAZ,0012x00000hZla5AAC,Monash,ACT,Australia,Loan Paid,New Client-New Loan,0.0,57.74,0.0,2.0,0.0,0.0,4.0,2.0,4118.0851,1.0,8.0,0.0,1895.4483,1853.84,0.0,0.0,0.0,0.0,0.0,0.0,0.0,1200,1632.0,7.0,13.571,Fortnightly,24.0,4216.42,2500.0,,1.0,0.0,0.0989,1.0,3790.8966,0.0,139.6866,233.14,MoneySpot,0.0,5274972,0.0,15-05-2023,False,Dental/medical/vet bills,2023-05-15,Orange,0.0,4530.0,4216.42
0062x00000DX02ZAAT,0012x00000XO9pIAAT,Junee,NSW,Australia,Closed Lost,Existing Client-Granted Loan Before,0.0,43.28,2525.6627,1.0,0.0,0.0,3.0,1.0,7302.0914,9.0,70.0,1257.8788,1612.1084,1895.04,0.0,1.58,1.0,0.0,8767.47,599.0,800.0,1250,1650.0,9.0,9.286,Weekly,35.0,10101.54,1250.0,Full-Time Employment,9.0,0.0,0.4615,1.0,9785.2566,1562.0,4776.5066,183.33,MoneySpot,,4948922,2.0,28-03-2023,False,Vehicle Expenses,2023-03-28,Green,0.0,7283.0,10101.54
0062x00000ExZweAAF,0012x00000fn7HCAAY,Marlo,VIC,Australia,Loan Paid,Existing Client-Granted Loan Before,0.0,51.1,2999.2738,2.0,0.0,0.0,3.0,2.0,4619.2133,0.0,33.0,1044.9063,2108.0,2108.0,0.0,0.0,0.0,0.0,3710.0,1499.0,200.0,1400,2016.0,13.0,26.0,Fortnightly,37.0,4619.21,2050.0,Part-Time Employment,0.0,0.0,0.1209,0.0,4918.6666,1741.0,3174.55,155.08,MoneySpot,0.0,6672749,0.0,28-09-2023,False,Vehicle Expenses,2023-09-28,Orange,0.0,5729.0,4619.21
0062x00000DFlXyAAL,0012x00000LQBH6AAP,Langwarrin,VIC,Australia,Loan Paid,Existing Client-Granted Loan Before,0.0,38.34,419.0786,4.0,0.0,0.0,1.0,4.0,3122.6666,1.0,26.0,813.6394,3122.6666,1998.0,0.0,0.0,0.0,1.0,3474.15,599.0,480.0,1200,1632.0,14.0,14.286,Weekly,27.0,16026.54,1200.0,Full-Time Employment,1.0,0.0,0.011,0.0,1735.3333,1678.0,2066.89,116.57,MoneySpot,0.0,4685746,0.0,15-02-2023,False,Vehicle Expenses,2023-02-14,Orange,0.0,15187.0,16026.54
0062x00000EcoWSAAZ,0012x00000G2naaAAB,Drewvale,QLD,Australia,Closed Lost,Existing Client-No Loan Granted Ever,3.25,46.45,0.0,2.0,0.0,1.0,5.0,2.0,5810.7609,0.0,6.0,0.0,2593.2283,2625.5,0.0,0.0,0.0,0.0,918.67,400.0,50.0,1200,1680.0,10.0,20.286,Fortnightly,46.0,6906.73,11500.0,Unemployed,0.0,0.0,0.0,0.0,6372.02,0.0,1987.7933,168.0,MoneySpot,,6380912,0.0,04-09-2023,False,Living Expenses,2023-08-30,Orange,177.0,5435.0,6906.73
0062x00000Ex1qTAAR,0010K00001oeGuMQAU,Stafford,QLD,Australia,Loan Paid,Existing Client-Granted Loan Before,0.0,85.72,2205.5186,1.0,0.0,0.0,1.0,1.0,5215.6097,1.0,56.0,0.0,1200.305,1100.82,1.0,0.0,0.0,0.0,3921.67,599.0,1600.0,1500,2160.0,23.0,23.143,Weekly,44.0,5215.61,1500.0,Full-Time Employment,1.0,0.0,0.5714,0.0,4801.22,441.0,2642.0866,93.91,QuickCash,0.0,6633191,1.0,25-09-2023,False,Living Expenses,2023-09-24,Green,0.0,6421.0,5215.61
0062x00000ECJcwAAH,0012x00000kZamDAAS,Madora Bay,WA,Australia,Loan Paid,New Client-New Loan,0.22,87.74,1879.8068,4.0,0.0,0.0,5.0,4.0,2005.0,9.0,35.0,761.6837,751.875,888.0,1.0,0.58,0.0,1.0,980.0,2000.0,550.0,1200,1632.0,14.0,13.857,Weekly,36.0,9681.68,2050.0,Full-Time Employment,13.0,0.0,0.1648,5.0,3740.8833,351.0,1792.81,116.57,MoneySpot,0.0,5870758,1.0,09-07-2023,False,Medical Expenses,2023-07-09,Orange,13.0,5728.0,9681.68
0062x00000DZldRAAT,0012x00000dwx7OAAQ,Raby,NSW,Australia,Closed Lost,Existing Client-No Loan Granted Ever,0.0,50.27,1561.4349,1.0,0.0,0.0,2.0,1.0,5078.8101,3.0,20.0,251.701,1093.2478,182.99,0.0,0.31,0.0,0.0,1100.0,899.0,1600.0,1200,1536.0,6.0,5.714,Weekly,24.0,5078.81,3000.0,Full-Time Employment,3.0,0.0,0.022,1.0,5101.8233,248.0,1601.1033,256.0,MoneySpot,,5111297,3.0,26-04-2023,False,Living Expenses,2023-04-21,Orange,0.0,5515.0,5078.81
0062x00000DHAOjAAP,0012x00000OyD8pAAF,Kingston,QLD,Australia,Loan Paid,Existing Client-Granted Loan Before,0.0,88.33,2511.8118,1.0,2.0,0.0,4.0,1.0,4135.3283,7.0,62.0,384.0,951.6923,834.0,0.0,0.0,0.0,0.0,3683.33,400.0,400.0,1400,1904.0,14.0,13.571,Weekly,30.0,4135.33,2050.0,Full-Time Employment,7.0,0.0,0.1099,4.0,4124.0,1712.0,3547.01,136.0,QuickCash,0.0,4764505,7.0,27-02-2023,False,Vehicle Expenses,2023-02-27,Green,0.0,4658.0,4135.33
0062x00000DsoF1AAJ,0012x00000IM7oSAAT,Woodberry,NSW,Australia,Loan Paid,Existing Client-Granted Loan Before,0.41,77.88,2443.6438,2.0,0.0,0.0,3.0,2.0,5147.361,0.0,41.0,328.96,2348.3314,2265.92,1.0,0.14,0.0,0.0,982.02,599.0,160.0,1200,1632.0,7.0,13.571,Fortnightly,24.0,5102.03,2050.0,Full-Time Employment,0.0,0.0,0.0,0.0,5479.44,1090.0,2873.4766,233.14,MoneySpot,0.0,5266715,0.0,14-05-2023,False,Living Expenses,2023-05-13,Orange,27.0,6530.0,5102.03
0062x00000EeBAKAA3,0012x00000lHUMjAAO,Kedron,QLD,Australia,Closed Lost,New Client-New Loan,0.0,13.83,2910.9851,2.0,0.0,0.0,3.0,2.0,13381.2628,0.0,15.0,0.0,5614.9142,5192.4,0.0,0.05,0.0,0.0,0.0,0.0,0.0,1200,1584.0,6.0,11.714,Fortnightly,46.0,13381.26,3800.0,Full-time,6.0,0.0,0.0,3.0,13101.4666,0.0,3714.17,264.0,MoneySpot,,6469120,0.0,13-09-2023,False,Other,2023-09-08,Green,0.0,14656.0,13381.26
0062x00000D7I7JAAV,0012x00000TsXQjAAN,Narangba,QLD,Australia,Loan Paid,Existing Client-Granted Loan Before,0.0,58.95,3543.7439,3.0,3.0,0.0,3.0,3.0,11019.3333,10.0,16.0,1468.8643,10316.0,10316.0,0.0,48.92,0.0,0.0,16759.12,599.0,1100.0,1200,1680.0,14.0,17.714,Weekly,43.0,11019.33,1200.0,Full-Time Employment,12.0,0.0,0.1099,6.0,10316.0,1809.0,4657.9566,120.0,MoneySpot,0.0,4476541,8.0,14-01-2023,False,Home Maintenance & Repairs,2023-01-14,Green,0.0,14719.0,11019.33
0062x00000EBzUEAA1,0012x00000hWxsmAAC,Pakenham,VIC,Australia,Loan Paid,Existing Client-Granted Loan Before,0.0,71.96,1510.571,1.0,1.0,0.0,3.0,1.0,7039.4903,8.0,25.0,0.0,1620.0476,1894.11,0.0,0.89,0.0,0.0,0.0,899.0,0.0,1500,2040.0,16.0,16.0,Weekly,29.0,7106.16,1500.0,Full-Time Employment,8.0,0.0,0.0,3.0,7020.2066,279.0,2205.4,127.5,MoneySpot,2.5,5846580,7.0,06-07-2023,False,Vehicle Expenses,2023-07-06,Green,0.0,8735.0,7106.16
0062x00000D7QgtAAF,0012x00000g9yhMAAQ,Kawana,QLD,Australia,Closed Lost,New Client-New Loan,31.14,41.89,432.6701,1.0,0.0,4.0,3.0,1.0,3109.9441,0.0,77.0,0.0,491.76,466.96,0.0,0.0,0.0,0.0,2023.67,400.0,250.0,1200,1584.0,9.0,9.571,Weekly,30.0,3109.94,2300.0,Contract Employment,0.0,0.0,0.1209,0.0,3117.2333,0.0,417.1366,176.0,MoneySpot,,4483596,0.0,20-01-2023,False,Living Expenses,2023-01-15,Green,986.0,3166.0,3109.94
0062x00000D8eWiAAJ,0012x00000BHNG1AAP,Golden Beach,QLD,Australia,Loan Paid,Existing Client-Granted Loan Before,0.0,67.46,1371.7699,2.0,1.0,0.0,4.0,2.0,3292.1848,2.0,36.0,708.0411,1041.226,1222.62,0.0,0.43,0.0,0.0,3250.92,899.0,0.0,1500,2040.0,7.0,14.429,Fortnightly,42.0,3966.18,1500.0,Part-Time Employment,2.0,0.0,0.3297,0.0,1735.3766,1231.0,2801.7033,291.43,MoneySpot,0.0,4543062,2.0,24-01-2023,False,Vehicle Expenses,2023-01-24,Green,0.0,4836.0,3966.18
0062x00000D6t71AAB,0012x00000g9iVpAAI,Redbank Plains,QLD,Australia,Closed Lost,New Client-New Loan,0.0,39.88,690.8551,2.0,0.0,0.0,3.0,2.0,10869.9857,0.0,0.0,0.0,1765.9285,1802.08,1.0,0.0,0.0,0.0,3900.0,400.0,720.0,1200,1536.0,3.0,6.143,Fortnightly,61.0,8600.41,5000.0,Full-Time Employment,0.0,0.0,0.0,0.0,7454.92,0.0,683.8266,512.0,MoneySpot,,4457827,0.0,11-01-2023,False,Vehicle Expenses,2023-01-11,Orange,0.0,12506.0,8600.41
0062x00000EDqzoAAD,0012x00000kZVKAAA4,Clarence Park,SA,Australia,Closed Lost,Existing Client-No Loan Granted Ever,0.0,37.52,0.0,2.0,0.0,0.0,5.0,2.0,9058.5925,0.0,6.0,0.0,1675.5714,1711.0,0.0,0.0,0.0,1.0,1500.0,400.0,300.0,1200,1728.0,11.0,22.143,Fortnightly,37.0,9107.49,4000.0,Full-Time Employment,0.0,0.0,0.0,0.0,3901.81,0.0,0.0,157.09,MoneySpot,,5968483,0.0,26-07-2023,False,Travel Expenses,2023-07-21,Green,0.0,10295.0,9107.49
0062x00000DHMJ0AAP,0012x00000Nwry2AAB,Ellenbrook,WA,Australia,Loan Paid,Existing Client-Granted Loan Before,1.14,60.8,709.3765,2.0,0.0,0.0,2.0,2.0,5337.2726,4.0,35.0,876.1024,2387.5666,3326.24,0.0,0.21,0.0,0.0,0.0,400.0,150.0,1200,1632.0,7.0,14.0,Fortnightly,32.0,5705.57,1200.0,Unemployed,4.0,0.0,0.3187,2.0,2387.5666,619.0,1523.4166,233.14,Financier-2,0.0,4774750,0.0,01-03-2023,False,Vehicle Expenses,2023-03-01,Green,72.0,6276.0,5705.57
0062x00000DA7BTAA1,0012x00000ILnhQAAT,DOONSIDE,NSW,Australia,Loan Paid,Existing Client-Granted Loan Before,0.0,58.79,1703.3302,1.0,0.0,0.0,4.0,1.0,5469.8039,2.0,31.0,1358.9524,1151.7907,1213.97,0.0,0.0,1.0,0.0,2427.61,400.0,220.0,1200,1632.0,14.0,13.857,Weekly,29.0,5469.8,1200.0,Full-Time Employment,2.0,0.0,0.1538,0.0,4991.0933,1102.0,1101.7166,116.57,MoneySpot,0.0,4613127,2.0,04-02-2023,False,Home Maintenance & Repairs,2023-02-03,Green,0.0,5864.0,5469.8
0062x00000Ezu52AAB,0012x00000lglSXAAY,Saint Helens Park,NSW,Australia,Closed Lost,New Client-New Loan,0.0,59.27,203.63,1.0,0.0,0.0,2.0,1.0,7094.5982,0.0,20.0,0.0,1301.3323,1063.09,3.0,0.72,0.0,0.0,0.0,0.0,1560.0,1200,1776.0,29.0,29.429,Weekly,26.0,7094.6,6000.0,Full-time,0.0,0.0,0.0,0.0,5639.1066,0.0,235.3333,61.24,MoneySpot,,6843827,0.0,15-10-2023,False,other_special_event,2023-10-15,Green,0.0,8583.0,7094.6
0062x00000F1Mp6AAF,0012x00000ld1LUAAY,Andergrove,QLD,Australia,Loan Paid,New Client-New Loan,0.0,87.56,123.6711,2.0,0.0,0.0,3.0,2.0,5251.4279,2.0,2.0,0.0,2037.37,2002.0,0.0,10.54,0.0,0.0,0.0,0.0,320.0,1200,1680.0,11.0,21.0,Fortnightly,24.0,5251.43,4000.0,full_time,3.0,0.0,0.0549,0.0,4074.74,81.0,1899.8566,152.73,MoneySpot,0.0,6887466,2.0,20-10-2023,False,vehicle_repairs,2023-10-20,Green,0.0,6196.0,5251.43
0062x00000DIBKYAA5,0012x00000RrIaMAAV,Blacktown,NSW,Australia,Closed Lost,Existing Client-No Loan Granted Ever,0.0,80.98,0.0,2.0,0.0,0.0,3.0,2.0,3920.67,0.0,1.0,0.0,1647.9366,1691.89,0.0,0.14,0.0,0.0,0.0,400.0,500.0,1200,1536.0,3.0,5.143,Fortnightly,46.0,4159.0,3000.0,,0.0,0.0,0.0,0.0,3295.8733,27.0,89.8466,512.0,MoneySpot,,4820731,0.0,13-03-2023,False,Living Expenses,2023-03-08,Green,0.0,4415.0,4159.0
0062x00000EDypbAAD,0012x00000kaNtnAAE,Blacktown,NSW,Australia,Loan Paid,New Client-New Loan,0.0,37.64,1923.7705,2.0,0.0,0.0,4.0,2.0,4868.446,0.0,10.0,0.0,2240.82,2240.82,0.0,0.0,0.0,0.0,0.0,0.0,120.0,1200,1728.0,13.0,25.857,Fortnightly,26.0,4868.45,2000.0,Full-Time Employment,0.0,0.0,0.4505,0.0,4481.64,17.0,2065.79,132.92,MoneySpot,0.0,5979838,0.0,23-07-2023,False,Short Term Loan,2023-07-23,Orange,0.0,5497.0,4868.45
0062x00000DZqN6AAL,0012x00000hYPh0AAG,Utakarra,WA,Australia,Closed Lost,New Client-New Loan,0.0,43.19,103.0433,1.0,0.0,0.0,2.0,1.0,3391.7204,17.0,18.0,0.0,703.6153,727.54,0.0,0.0,0.0,0.0,0.0,0.0,200.0,1200,1584.0,9.0,8.857,Weekly,22.0,4159.8,3000.0,Employed part-time,17.0,0.0,0.0,3.0,3049.0,0.0,125.67,176.0,MoneySpot,,5117889,0.0,22-04-2023,False,Dental/medical/vet bills,2023-04-22,Green,0.0,4150.0,4159.8
0062x00000Ezt10AAB,0012x00000g94gaAAA,Blacktown,NSW,Australia,Closed Lost,Existing Client-Granted Loan Before,0.0,45.36,2427.3455,4.0,0.0,0.0,4.0,4.0,5485.0371,0.0,55.0,0.0,1037.2222,500.0,0.0,0.23,0.0,0.0,0.0,599.0,160.0,1250,1700.0,14.0,13.714,Weekly,41.0,4625.12,1250.0,,0.0,0.0,0.0,0.0,4531.6666,1108.0,4651.5566,121.43,MoneySpot,,6842312,0.0,15-10-2023,False,Living Expenses,2023-10-14,Orange,0.0,5723.0,4625.12
0062x00000Ee05nAAB,0012x00000gAEaXAAW,Jimboomba,QLD,Australia,Loan Paid,Existing Client-No Loan Granted Ever,0.0,54.42,0.0,2.0,0.0,0.0,3.0,2.0,3584.8119,0.0,27.0,0.0,1088.8066,934.46,0.0,0.0,0.0,0.0,0.0,599.0,220.0,1200,1824.0,17.0,32.857,Fortnightly,22.0,3584.81,2050.0,,0.0,0.0,0.0,0.0,2678.1233,106.0,1077.7766,107.29,MoneySpot,0.0,6456825,0.0,08-09-2023,False,Vehicle Expenses,2023-09-07,Green,0.0,4790.0,3584.81
0062x00000DIFoEAAX,0012x00000gnSeUAAU,Rutherford,NSW,Australia,Loan Paid,Existing Client-No Loan Granted Ever,0.0,29.71,1003.5066,1.0,0.0,0.0,3.0,1.0,4140.3369,0.0,46.0,0.0,858.09,736.49,0.0,1.73,0.0,0.0,0.0,400.0,200.0,1200,1536.0,6.0,6.143,Weekly,24.0,10261.58,2000.0,Full-Time Employment,0.0,0.0,0.0,0.0,858.09,0.0,2143.09,256.0,MoneySpot,0.0,4823062,0.0,08-03-2023,False,Living Expenses,2023-03-08,Green,0.0,6466.0,10261.58
0062x00000D70XkAAJ,0012x00000BGzb6AAD,Beechboro,WA,Australia,Loan Paid,Existing Client-Granted Loan Before,0.35,78.72,979.0,2.0,0.0,0.0,3.0,2.0,3466.7395,2.0,16.0,0.0,1595.65,1677.6,0.0,0.78,0.0,0.0,3900.0,400.0,400.0,1200,1632.0,7.0,14.0,Fortnightly,45.0,3466.74,1200.0,Full-Time Employment,2.0,0.0,0.0659,0.0,3191.3,305.0,1451.8333,233.14,MoneySpot,0.0,4463440,0.0,12-01-2023,False,Medical Expenses,2023-01-12,Orange,13.0,3707.0,3466.74
0062x00000FX2XBAA1,0012x00000NwkEhAAJ,Kogarah,NSW,Australia,Closed Lost,Existing Client-No Loan Granted Ever,0.0,88.26,0.0,1.0,0.0,0.0,3.0,1.0,11509.9767,0.0,15.0,0.0,1095.9841,1287.3,0.0,8.8,0.0,0.0,0.0,400.0,1500.0,1200,1680.0,18.0,18.429,Weekly,31.0,19394.48,5000.0,,0.0,0.0,0.0,0.0,12268.44,0.0,701.1766,93.33,MoneySpot,,7718729,0.0,2024-01-03,False,Vehicle Expenses,2024-01-03,Green,0.0,11350.0,19394.48
0062x00000EdphMAAR,0012x00000lH7sHAAS,Brunswick West,VIC,Australia,Loan Paid,New Client-New Loan,0.0,80.81,1248.4773,1.0,0.0,0.0,3.0,1.0,6488.4302,4.0,41.0,0.0,1127.31,1127.31,0.0,11.91,0.0,0.0,1127.0,2000.0,1500.0,1200,1680.0,20.0,20.0,Weekly,34.0,7532.57,5000.0,Full-Time Employment,4.0,0.0,0.0,2.0,4509.24,0.0,1875.75,84.0,MoneySpot,0.0,6447202,0.0,07-09-2023,False,Car,2023-09-06,Green,0.0,12414.0,7532.57
0062x00000ENme3AAD,0012x00000iKj1tAAC,South Brisbane,QLD,Australia,Closed Lost,Existing Client-No Loan Granted Ever,0.0,14.4,889.8155,2.0,0.0,0.0,3.0,2.0,4018.6439,0.0,12.0,0.0,1849.6785,2149.69,0.0,0.0,0.0,0.0,0.0,599.0,430.0,1200,1680.0,11.0,21.429,Fortnightly,23.0,4018.64,4000.0,Part-Time Employment,0.0,0.0,0.011,0.0,4315.9166,479.0,744.33,152.73,MoneySpot,,6204259,0.0,18-08-2023,False,Vehicle Expenses,2023-08-13,Green,0.0,10548.0,4018.64
0062x00000F8kUcAAJ,0012x00000lekoFAAQ,Punchbowl,NSW,Australia,Loan Paid,Existing Client-No Loan Granted Ever,0.0,84.53,684.375,1.0,0.0,0.0,3.0,1.0,4542.06,0.0,5.0,0.0,1045.2966,1034.73,0.0,0.0,0.0,0.0,4498.0,599.0,1800.0,1150,1564.0,16.0,16.143,Weekly,29.0,9085.15,1150.0,Casual Employment,0.0,0.0,0.0549,0.0,1045.2966,0.0,192.5,97.75,MoneySpot,0.0,6874830,0.0,19-10-2023,False,Home & Improvement,2023-10-18,Orange,0.0,2937.0,9085.15
0062x00000FW4NhAAL,0012x00000n3D2yAAE,Deanside,VIC,Australia,Closed Lost,New Client-New Loan,0.0,60.19,492.4366,2.0,0.0,0.0,3.0,2.0,5991.7335,3.0,6.0,0.0,2757.84,2757.84,0.0,0.0,0.0,0.0,0.0,0.0,110.0,1200,1680.0,9.0,18.286,Fortnightly,27.0,6138.4,4300.0,full_time,3.0,0.0,0.0,2.0,5515.68,0.0,611.46,186.67,MoneySpot,,7641368,0.0,26-12-2023,False,Education expenses,2023-12-26,Green,0.0,10532.0,6138.4
0062x00000ED6QdAAL,0012x00000kZxRrAAK,Fitzgibbon,QLD,Australia,Loan Paid,New Client-New Loan,0.0,90.55,0.0,1.0,0.0,0.0,3.0,1.0,5544.347,0.0,2.0,0.0,1094.7841,1060.39,1.0,0.0,0.0,0.0,1146.0,2000.0,632.0,1200,1680.0,20.0,19.714,Weekly,40.0,5549.35,2050.0,Full-Time Employment,0.0,0.0,0.011,0.0,4379.1366,0.0,405.88,84.0,MoneySpot,0.0,5920653,0.0,15-07-2023,False,Furniture or Appliances,2023-07-15,Green,0.0,6378.0,5549.35
0062x00000DY2vMAAT,0012x00000hXOXfAAO,Ngunnawal,ACT,Australia,Closed Lost,New Client-New Loan,0.0,67.75,2885.2967,2.0,1.0,0.0,4.0,2.0,9358.7064,0.0,0.0,0.0,3445.83,3445.83,1.0,0.97,0.0,0.0,0.0,0.0,2800.0,1200,1536.0,6.0,6.143,Weekly,55.0,9358.71,4000.0,,4.0,0.0,0.0,0.0,6891.66,0.0,3187.1,256.0,MoneySpot,,5009480,3.0,08-04-2023,False,To allow my partner to have urgent major surgery,2023-04-06,Orange,0.0,8799.0,9358.71
0062x00000DIbB8AAL,0012x00000BIlRpAAL,Oakey,QLD,Australia,Loan Paid,Existing Client-Granted Loan Before,0.0,79.61,427.5305,1.0,0.0,0.0,4.0,1.0,235.0,3.0,13.0,0.0,70.5,150.0,0.0,42.36,0.0,1.0,2848.65,599.0,150.0,1100,1452.0,13.0,12.714,Weekly,23.0,6054.4,2050.0,Full-Time Employment,3.0,0.0,0.2857,0.0,0.0,394.0,554.19,111.69,MoneySpot,0.0,4842495,3.0,11-03-2023,False,Living Expenses,2023-03-11,Orange,0.0,6430.0,6054.4
0062x00000EwV7jAAF,0012x00000lJBI1AAO,Deception Bay,QLD,Australia,Loan Paid,New Client-New Loan,0.0,42.0,199.6093,1.0,1.0,0.0,2.0,1.0,6008.2091,4.0,6.0,0.0,1275.3244,1157.52,0.0,6.73,0.0,0.0,5013.67,899.0,550.0,1200,1728.0,23.0,22.857,Weekly,27.0,5976.09,2050.0,Full-Time Employment,4.0,0.0,0.0769,3.0,3825.9733,0.0,105.0,75.13,Financier-2,0.0,6593196,4.0,21-09-2023,False,Vehicle Expenses,2023-09-20,Green,0.0,4713.0,5976.09
0062x00000D7rFLAAZ,0012x000003FXVuAAO,Karabar,NSW,Australia,Loan Paid,Existing Client-Granted Loan Before,0.0,100.0,455.4287,1.0,0.0,0.0,2.0,1.0,3654.3739,2.0,10.0,0.0,841.0069,955.03,0.0,1.34,0.0,0.0,2123.33,400.0,200.0,1400,1904.0,14.0,14.0,Weekly,28.0,3654.37,2050.0,Full-Time Employment,2.0,0.0,0.022,2.0,3644.3633,396.0,554.65,136.0,MoneySpot,0.0,4502954,2.0,19-01-2023,False,Vehicle Expenses,2023-01-18,Orange,0.0,3794.0,3654.37
0062x00000DYdIIAA1,0012x00000g9CuxAAE,Yarrawonga,NT,Australia,Loan Paid,Existing Client-No Loan Granted Ever,0.0,37.42,0.0,1.0,0.0,0.0,4.0,1.0,3929.4318,0.0,0.0,0.0,904.3076,929.0,0.0,0.0,0.0,0.0,4025.67,400.0,0.0,1200,1536.0,6.0,6.286,Weekly,25.0,3929.43,2000.0,Full-Time Employment,0.0,0.0,0.0,0.0,3918.6666,87.0,86.6666,256.0,MoneySpot,0.0,5044523,0.0,12-04-2023,False,Relocation Expenses,2023-04-12,Green,0.0,3952.0,3929.43
0062x00000DITLbAAP,0012x00000gpCSwAAM,Banora Point,NSW,Australia,Closed Lost,New Client-New Loan,26.05,70.7,1727.9151,2.0,0.0,2.0,5.0,2.0,7141.4783,0.0,44.0,0.0,897.11,897.11,0.0,0.0,0.0,0.0,0.0,0.0,249.0,1200,1872.0,20.0,39.143,Fortnightly,40.0,10670.54,10000.0,,0.0,0.0,0.022,0.0,7974.3466,0.0,1908.8166,93.6,MoneySpot,,4835454,0.0,14-03-2023,False,Car Other,2023-03-10,Green,3194.0,12258.0,10670.54
0062x00000DVem6AAD,0012x00000BHnapAAD,Mitchell,QLD,Australia,Loan Paid,Existing Client-Granted Loan Before,0.0,97.16,789.0,1.0,1.0,0.0,5.0,1.0,4516.2058,11.0,34.0,0.0,1039.3461,1018.0,0.0,0.0,0.0,1.0,2426.67,899.0,1340.0,1400,1904.0,14.0,14.286,Weekly,25.0,4516.21,2050.0,Part-Time Employment,11.0,0.0,0.1758,2.0,0.0,720.0,1815.1133,136.0,MoneySpot,0.0,5464734,9.0,01-06-2023,False,Vehicle Expenses,2023-06-01,Orange,0.0,4527.0,4516.21
0062x00000D2PNvAAN,0012x00000cw4lRAAQ,Mount Martha,VIC,Australia,Closed Lost,Existing Client-No Loan Granted Ever,0.27,79.84,1079.386,1.0,0.0,0.0,5.0,1.0,3220.216,0.0,21.0,220.4339,699.1292,709.44,1.0,0.48,0.0,0.0,3071.58,899.0,400.0,1200,1536.0,6.0,6.571,Weekly,23.0,3368.56,5000.0,Full-Time Employment,0.0,0.0,0.4615,0.0,3029.56,220.0,947.6333,256.0,MoneySpot,,4444158,0.0,09-01-2023,False,House furniture,2023-01-09,Orange,13.0,4751.0,3368.56
0062x00000DAbKaAAL,0012x000002cQuhAAE,Brisbane City,QLD,Australia,Loan Paid,Existing Client-Granted Loan Before,3.61,90.18,2439.9471,1.0,0.0,0.0,2.0,1.0,3677.9335,0.0,13.0,883.5401,684.3358,761.77,1.0,0.0,0.0,0.0,866.67,599.0,150.0,1300,1872.0,24.0,24.143,Weekly,22.0,3966.01,2050.0,Part-Time Employment,1.0,0.0,0.3297,0.0,2737.3433,840.0,2513.4433,78.0,QuickCash,0.0,4636712,0.0,07-02-2023,False,Vehicle Expenses,2023-02-07,Green,146.0,4034.0,3966.01
0062x00000D7bfXAAR,0012x00000GcQ1CAAV,Mount Druitt,NSW,Australia,Loan Paid,Existing Client-Granted Loan Before,0.0,79.21,5230.4093,1.0,1.0,0.0,1.0,1.0,10415.4179,19.0,0.0,717.5857,957.0357,934.2,0.0,2.09,0.0,0.0,2905.98,899.0,0.0,1500,2040.0,14.0,14.0,Weekly,34.0,13847.51,1500.0,Part-Time Employment,19.0,0.0,0.0549,3.0,2233.0833,716.0,7750.5266,145.71,MoneySpot,0.0,4491737,18.0,17-01-2023,False,Living Expenses,2023-01-16,Green,0.0,13342.0,13847.51
0062x00000DHq5AAAT,0012x00000goseWAAQ,Wollstonecraft,NSW,Australia,Closed Lost,New Client-New Loan,0.0,38.35,1477.4499,3.0,0.0,0.0,2.0,3.0,11618.6066,0.0,16.0,0.0,11618.6066,11516.16,0.0,0.68,0.0,0.0,11518.0,2000.0,4300.0,1200,1536.0,2.0,5.857,Monthly,38.0,19922.79,5000.0,Full-Time Employment,0.0,0.0,0.0,0.0,12826.79,0.0,4034.0466,768.0,MoneySpot,,4802159,0.0,05-03-2023,False,Relocation Expenses,2023-03-04,Orange,0.0,20232.0,19922.79
0062x00000DHrKLAA1,0012x00000deacmAAA,Bellbird Park,QLD,Australia,Loan Paid,Existing Client-Granted Loan Before,0.0,64.85,2968.7032,2.0,0.0,0.0,2.0,2.0,9061.0072,0.0,78.0,1140.3932,2352.1571,2310.56,0.0,0.0,0.0,0.0,4357.15,400.0,150.0,1500,1980.0,6.0,11.429,Fortnightly,52.0,12320.39,2050.0,Full-Time Employment,0.0,0.0,0.011,0.0,5488.3666,2687.0,4217.2333,330.0,MoneySpot,0.0,4803821,0.0,05-03-2023,False,Furniture or Appliances,2023-03-05,Orange,0.0,13845.0,12320.39
0062x00000F2vSvAAJ,0012x00000ldwDEAAY,Clyde North,VIC,Australia,Closed Lost,New Client-New Loan,0.0,31.15,2117.1866,2.0,0.0,0.0,4.0,2.0,4508.2619,0.0,8.0,0.0,1706.38,1697.49,0.0,0.66,0.0,0.0,0.0,0.0,0.0,1200,1776.0,15.0,29.429,Fortnightly,30.0,4250.64,7000.0,full_time,0.0,0.0,0.1429,0.0,3981.5533,0.0,2195.52,118.4,MoneySpot,,7006906,0.0,04-11-2023,False,holiday_travel,2023-10-31,Green,0.0,6845.0,4250.64
0062x00000DZavRAAT,0012x00000IMGgEAAX,Rosemeadow,NSW,Australia,Loan Paid,Existing Client-No Loan Granted Ever,0.0,34.85,2127.038,4.0,0.0,0.0,3.0,4.0,8445.6139,0.0,61.0,388.125,2960.2887,3276.86,1.0,0.0,0.0,0.0,2340.0,400.0,1950.0,1200,1536.0,3.0,6.0,Fortnightly,45.0,8479.45,2050.0,Full-Time Employment,0.0,0.0,0.4176,0.0,7894.1033,502.0,3691.59,512.0,MoneySpot,0.0,5101739,0.0,20-04-2023,False,Living Expenses,2023-04-20,Orange,0.0,8474.0,8479.45
0062x00000D7iMDAAZ,0012x00000IOpCMAA1,Horsham,VIC,Australia,Loan Paid,Existing Client-Granted Loan Before,0.0,76.76,1519.1017,4.0,0.0,0.0,5.0,4.0,259.9999,3.0,33.0,0.0,143.3333,120.0,0.0,0.27,0.0,1.0,0.0,400.0,800.0,1500,2040.0,14.0,13.857,Weekly,50.0,5079.51,1500.0,,3.0,0.0,0.1758,2.0,0.0,621.0,3919.4933,145.71,MoneySpot,0.0,4496026,1.0,18-01-2023,False,Vehicle Expenses,2023-01-18,Orange,0.0,7543.0,5079.51
0062x00000D9dhcAAB,0012x00000RrcEzAAJ,Hannans,WA,Australia,Loan Paid,Existing Client-Granted Loan Before,0.0,85.65,7183.7602,2.0,0.0,0.0,3.0,2.0,5033.0887,0.0,48.0,886.306,2239.7342,2226.92,0.0,0.0,0.0,0.0,4821.35,1499.0,0.0,1500,2040.0,8.0,16.143,Fortnightly,33.0,5033.09,1500.0,Full-Time Employment,0.0,0.0,0.8681,0.0,5226.0466,3138.0,7489.3666,255.0,MoneySpot,0.0,4591849,0.0,01-02-2023,False,Other Expenses,2023-01-31,Green,0.0,6694.0,5033.09
0062x00000DGcMmAAL,0010K0000242LfsQAE,Prospect,SA,Australia,Loan Paid,Existing Client-Granted Loan Before,0.0,64.32,3127.1552,2.0,0.0,0.0,3.0,2.0,8968.4884,0.0,28.0,0.0,2477.88,2465.16,1.0,5.83,0.0,0.0,0.0,599.0,900.0,1250,1700.0,7.0,13.143,Fortnightly,61.0,11363.49,1250.0,,0.0,0.0,0.0,0.0,9735.76,1627.0,4617.7166,242.86,Financier-2,0.0,4731908,0.0,22-02-2023,False,Home Maintenance & Repairs,2023-02-22,Orange,0.0,11069.0,11363.49
0062x00000DsTkaAAF,0012x00000hZVhrAAG,Holland Park West,QLD,Australia,Closed Lost,New Client-New Loan,0.0,72.48,1609.9801,1.0,0.0,0.0,3.0,1.0,8272.7542,0.0,2.0,0.0,759.9318,882.0,0.0,0.1,0.0,0.0,0.0,0.0,800.0,1200,1632.0,15.0,15.0,Weekly,27.0,8772.75,5000.0,,0.0,0.0,0.0,0.0,2832.77,0.0,2689.94,108.8,MoneySpot,,5243536,0.0,11-05-2023,False,Family expenses,2023-05-10,Green,0.0,10012.0,8772.75
0062x00000Ds7yNAAR,0012x00000gAZGBAA4,Araluen,NT,Australia,Loan Paid,Existing Client-No Loan Granted Ever,0.0,45.04,651.7835,2.0,0.0,0.0,4.0,2.0,3915.845,0.0,6.0,0.0,1700.488,1971.28,1.0,0.0,0.0,0.0,0.0,0.0,200.0,1200,1536.0,3.0,6.571,Fortnightly,30.0,3915.85,2100.0,Full-Time Employment,0.0,0.0,0.7692,0.0,2834.1466,0.0,600.0,512.0,MoneySpot,0.0,5220975,0.0,08-05-2023,False,Travel Costs/Airfares/Tickets,2023-05-08,Orange,0.0,3655.0,3915.85
0062x00000FJBjoAAH,0012x00000mIYc9AAG,Merrylands,NSW,Australia,Loan Paid,New Client-New Loan,0.0,41.84,3447.2308,1.0,0.0,0.0,4.0,1.0,8601.1891,0.0,51.0,0.0,1778.8261,1802.94,0.0,2.82,0.0,0.0,6933.33,400.0,180.0,1200,1584.0,12.0,12.0,Weekly,36.0,8601.19,2050.0,Full-Time Employment,0.0,0.0,0.0769,0.0,7708.2466,0.0,3471.66,132.0,MoneySpot,0.0,7304440,0.0,24-11-2023,False,Home Maintenance & Repairs,2023-11-24,Green,0.0,9569.0,8601.19
0062x00000DH2fZAAT,0012x00000XCYkWAAX,Andrews Farm,SA,Australia,Loan Paid,Existing Client-Granted Loan Before,0.0,71.73,2482.5862,1.0,2.0,0.0,1.0,1.0,9242.2224,22.0,68.0,1690.855,1132.0769,13800.0,4.0,0.27,0.0,1.0,4169.44,400.0,1300.0,1100,1628.0,14.0,27.571,Fortnightly,26.0,4336.56,2050.0,Full-Time Employment,22.0,0.0,0.0659,0.0,4324.6766,829.0,3188.27,116.29,QuickCash,0.0,4757885,16.0,26-02-2023,False,Travel Expenses,2023-02-26,Green,0.0,9405.0,4336.56
0062x00000ELgH0AAL,0012x00000g7swpAAA,Leopold,VIC,Australia,Loan Paid,Existing Client-Granted Loan Before,0.0,74.13,6554.577,2.0,0.0,0.0,3.0,2.0,7086.6589,1.0,55.0,348.9661,3129.2371,3159.02,1.0,0.0,0.0,0.0,0.0,599.0,1800.0,1500,2220.0,14.0,27.571,Fortnightly,50.0,7153.33,1500.0,Full-Time Employment,1.0,0.0,0.7253,0.0,7377.5133,2025.0,7298.7033,158.57,QuickCash,0.0,6053556,0.0,30-07-2023,False,Home Maintenance & Repairs,2023-07-29,Green,0.0,8415.0,7153.33
0062x00000E5ty6AAB,0012x00000dzuSAAAY,South Toowoomba,QLD,Australia,Loan Paid,Existing Client-No Loan Granted Ever,0.0,55.16,3968.6854,1.0,0.0,0.0,2.0,1.0,9844.062,0.0,111.0,477.9762,1266.8515,1378.14,0.0,0.3,0.0,0.0,11594.56,1500.0,2000.0,1200,1584.0,11.0,10.857,Weekly,41.0,11133.86,2050.0,Full-Time Employment,0.0,0.0,0.0,0.0,11102.5366,477.0,4742.9266,144.0,MoneySpot,0.0,5689582,0.0,22-06-2023,False,Living Expenses,2023-06-22,Green,0.0,11923.0,11133.86
0062x00000FXE7rAAH,0012x00000kfhUxAAI,Goulburn,NSW,Australia,Loan Paid,Existing Client-Granted Loan Before,0.0,51.36,4264.0579,1.0,0.0,0.0,3.0,1.0,8428.8713,4.0,78.0,328.4453,1799.2692,1682.09,1.0,29.22,0.0,0.0,0.0,1499.0,1720.0,1200,1680.0,20.0,20.0,Weekly,29.0,8428.87,1500.0,,4.0,0.0,0.4725,3.0,7796.8333,956.0,4755.9,84.0,QuickCash,0.0,7733483,2.0,2024-01-04,False,Relocation Expenses,2024-01-04,Green,0.0,9601.0,8428.87
0062x00000FVoApAAL,0012x00000L2retAAB,Upper Coomera,QLD,Australia,Loan Paid,Existing Client-Granted Loan Before,0.0,10.56,1322.4162,2.0,0.0,0.0,2.0,2.0,6062.7142,0.0,21.0,489.2995,2582.62,2582.62,1.0,0.0,0.0,0.0,3627.73,599.0,2400.0,1500,2040.0,8.0,15.571,Fortnightly,52.0,8669.85,1500.0,Full-Time Employment,0.0,0.0,0.2857,0.0,6026.1133,1144.0,1432.1666,255.0,QuickCash,0.0,7623004,0.0,24-12-2023,False,Other Expenses,2023-12-23,Orange,0.0,7561.0,8669.85
0062x00000DWT35AAH,0012x00000gpbvmAAA,Kellyville,NSW,Australia,Closed Lost,Existing Client-No Loan Granted Ever,0.0,87.65,1445.2108,2.0,0.0,0.0,3.0,2.0,4134.7939,4.0,16.0,361.76,1843.3414,1752.67,0.0,0.0,0.0,0.0,0.0,0.0,1400.0,1200,1536.0,3.0,6.0,Fortnightly,31.0,4134.79,2000.0,,4.0,0.0,0.2637,0.0,4301.13,645.0,1478.3333,512.0,MoneySpot,,4918118,0.0,23-03-2023,False,Bond/moving costs,2023-03-23,Green,0.0,4590.0,4134.79
0062x00000DHxGtAAL,0012x00000TtWTLAA3,Springdale Heights,NSW,Australia,Loan Paid,Existing Client-No Loan Granted Ever,23.95,15.57,3453.8154,2.0,0.0,2.0,3.0,2.0,6888.0806,0.0,10.0,431.0042,2065.16,2260.76,0.0,1.11,0.0,0.0,2924.97,1499.0,560.0,1200,1536.0,3.0,5.429,Fortnightly,49.0,11430.57,1200.0,Full-Time Employment,1.0,0.0,0.0,1.0,11454.7366,331.0,5494.1866,512.0,MoneySpot,0.0,4809212,0.0,06-03-2023,False,Living Expenses,2023-03-06,Green,1772.0,7397.0,11430.57
0062x00000DVgrxAAD,0012x00000iHaimAAC,Marsden Park,NSW,Australia,Loan Paid,New Client-New Loan,0.0,72.99,1271.0156,2.0,0.0,0.0,3.0,2.0,4716.1449,0.0,10.0,264.0,1865.8642,1738.15,1.0,5.53,0.0,0.0,0.0,0.0,50.0,1100,1408.0,3.0,6.0,Fortnightly,36.0,4493.93,1100.0,,0.0,0.0,0.0,0.0,4353.6833,132.0,1127.2266,469.33,MoneySpot,0.0,5466567,0.0,01-06-2023,False,Home Improvements,2023-06-01,Green,0.0,5694.0,4493.93
0062x00000DG4lrAAD,0012x00000GbwzDAAR,NEWNHAM,TAS,Australia,Closed Lost,Existing Client-No Loan Granted Ever,0.0,93.73,0.0,1.0,0.0,0.0,3.0,1.0,3288.3938,0.0,4.0,0.0,670.3533,671.53,0.0,0.0,0.0,0.0,0.0,0.0,0.0,1200,1536.0,6.0,5.857,Weekly,33.0,4696.95,1800.0,Part-Time Employment,0.0,0.0,0.0,0.0,1914.03,0.0,44.0566,256.0,MoneySpot,,4701843,0.0,21-02-2023,False,Other,2023-02-17,Green,0.0,2810.0,4696.95
0062x00000DH1qhAAD,0012x00000cyoXJAAY,Shepparton,VIC,Australia,Loan Paid,Existing Client-Granted Loan Before,0.22,98.8,2369.2871,2.0,0.0,0.0,3.0,2.0,4980.76,0.0,11.0,3770.0889,2225.0085,2203.69,1.0,0.0,0.0,0.0,4766.67,599.0,1320.0,1500,1980.0,6.0,11.571,Fortnightly,31.0,4980.76,1500.0,Full-Time Employment,0.0,0.0,0.0,0.0,5191.6866,2019.0,2389.45,330.0,MoneySpot,0.0,4757634,0.0,26-02-2023,False,Medical Expenses,2023-02-26,Orange,13.0,5879.0,4980.76
0062x00000D8VVRAA3,0010K00001u1IucQAE,Ingleburn,NSW,Australia,Loan Paid,Existing Client-Granted Loan Before,31.71,59.29,377.0726,4.0,4.0,4.0,3.0,4.0,6598.0659,0.0,7.0,286.7857,435.2822,226.47,0.0,9.78,0.0,0.0,4550.0,1500.0,380.0,1200,1632.0,7.0,13.429,Fortnightly,39.0,6997.57,1200.0,Unemployed,4.0,0.0,0.0,0.0,2489.8133,467.0,1083.3033,233.14,QuickCash,0.0,4536029,4.0,23-01-2023,True,Travel Expenses,2023-01-23,Orange,2490.0,7852.0,6997.57
0062x00000FgNlXAAV,0012x00000n4SK6AAM,Coffs Harbour,NSW,Australia,Closed Lost,New Client-New Loan,0.0,31.75,0.0,1.0,0.0,0.0,4.0,1.0,4257.7133,0.0,7.0,0.0,939.2,1018.8,0.0,0.0,0.0,0.0,0.0,0.0,1660.0,1050,1470.0,20.0,20.286,Weekly,40.0,4257.71,5000.0,full_time,0.0,0.0,0.044,0.0,4069.8666,0.0,0.0,73.5,MoneySpot,,7801454,0.0,2024-01-15,False,vehicle_repairs,2024-01-10,Green,0.0,4451.0,4257.71
0062x00000DAR8pAAH,0012x00000GeXQvAAN,Kirwan,QLD,Australia,Loan Paid,Existing Client-Granted Loan Before,0.0,72.08,316.5705,0.0,0.0,0.0,0.0,0.0,0.0,1.0,21.0,316.5814,0.0,0.0,1.0,8.25,0.0,0.0,0.0,1499.0,1020.0,1300,1820.0,9.0,19.571,Fortnightly,27.0,1436.13,2000.0,,1.0,0.0,0.5165,0.0,0.0,555.0,715.4966,202.22,MoneySpot,0.0,4629528,1.0,06-02-2023,False,Medical Expenses,2023-02-06,Green,0.0,1879.0,1436.13
0062x00000DWiwZAAT,0012x000002aAAvAAM,Blacktown,NSW,Australia,Loan Paid,Existing Client-Granted Loan Before,0.0,72.54,1903.3739,2.0,0.0,0.0,4.0,2.0,5696.5265,0.0,26.0,0.0,2472.465,2472.47,0.0,2.44,0.0,0.0,0.0,899.0,1154.0,1250,1650.0,5.0,8.857,Fortnightly,34.0,5696.53,1250.0,Full-Time Employment,0.0,0.0,0.3956,0.0,4944.93,91.0,1564.3266,330.0,MoneySpot,0.0,4932877,0.0,25-03-2023,False,Home Maintenance & Repairs,2023-03-25,Green,0.0,6364.0,5696.53
0062x00000EMacqAAD,0012x00000kg8vHAAQ,Two Rocks,WA,Australia,Loan Paid,New Client-New Loan,0.0,61.56,791.5766,2.0,0.0,0.0,2.0,2.0,12860.5802,0.0,13.0,0.0,5086.0575,4287.7,0.0,8.48,0.0,0.0,20000.0,2000.0,1500.0,1200,1632.0,7.0,14.571,Fortnightly,40.0,11466.73,2050.0,Full-Time Employment,0.0,0.0,0.011,0.0,6781.41,0.0,5495.9966,233.14,MoneySpot,0.0,6112814,0.0,05-08-2023,False,Living Expenses,2023-08-04,Green,0.0,10570.0,11466.73
0062x00000FWDr3AAH,0012x00000gp3jrAAA,Heckenberg,NSW,Australia,Loan Paid,Existing Client-Granted Loan Before,0.0,52.27,2379.2933,1.0,0.0,0.0,3.0,1.0,30233.3941,8.0,2.0,838.4354,3359.2776,3760.99,0.0,0.15,0.0,1.0,0.0,599.0,3000.0,1250,1700.0,14.0,14.143,Weekly,33.0,33155.73,1250.0,,8.0,0.0,0.0,5.0,0.0,771.0,3150.5933,121.43,MoneySpot,0.0,7652927,0.0,27-12-2023,False,Travel Expenses,2023-12-27,Orange,0.0,41792.0,33155.73
0062x00000DsUUdAAN,0012x00000SFfLhAAL,Allenstown,QLD,Australia,Loan Paid,Existing Client-Granted Loan Before,32.3,51.4,889.4955,1.0,0.0,2.0,1.0,1.0,3840.9335,1.0,19.0,606.7821,546.0038,599.4,0.0,0.0,0.0,0.0,3466.67,400.0,1360.0,1500,1980.0,10.0,9.714,Weekly,42.0,3925.29,2050.0,Part-Time Employment,1.0,0.0,0.6703,1.0,3744.4066,506.0,788.67,198.0,MoneySpot,0.0,5244045,1.0,15-05-2023,False,Relocation Expenses,2023-05-15,Orange,1392.0,4309.0,3925.29
0062x00000FUu0IAAT,0012x00000mGRdYAAW,Benerembah,NSW,Australia,Closed Lost,Existing Client-No Loan Granted Ever,86.17,87.62,75.0,0.0,0.0,2.0,4.0,2.0,1971.0547,4.0,10.0,0.0,907.226,884.4,0.0,0.0,0.0,0.0,2023.67,400.0,600.0,1200,1536.0,3.0,5.429,Fortnightly,38.0,1971.05,1200.0,Unemployed,4.0,0.0,0.0,1.0,1512.0433,0.0,176.1333,512.0,QuickCash,,7548755,2.0,18-12-2023,True,Living Expenses,2023-12-17,Orange,1807.0,2097.0,1971.05
0062x00000D8ugsAAB,0010K000023zfJiQAI,Stonyfell,SA,Australia,Loan Paid,Existing Client-Granted Loan Before,0.0,88.06,3023.5048,1.0,7.0,0.0,3.0,1.0,3862.7425,21.0,85.0,1164.9221,862.0345,793.0,1.0,0.0,0.0,0.0,4116.67,599.0,100.0,1500,2040.0,14.0,14.0,Weekly,32.0,3903.28,2050.0,Full-Time Employment,21.0,0.0,0.1648,7.0,3186.7933,1368.0,2934.2433,145.71,MoneySpot,0.0,4555851,22.0,26-01-2023,False,Vehicle Expenses,2023-01-26,Orange,0.0,4350.0,3903.28
0062x00000ExuRzAAJ,0012x00000FFksWAAT,Edmonton,QLD,Australia,Loan Paid,Existing Client-No Loan Granted Ever,0.0,23.23,1701.0831,1.0,0.0,0.0,3.0,1.0,11673.7706,0.0,25.0,0.0,1559.2053,1480.65,0.0,6.19,0.0,0.0,8046.38,899.0,980.0,1200,1584.0,10.0,9.714,Weekly,57.0,12340.44,3500.0,Full-Time Employment,0.0,0.0,0.0,0.0,11266.0033,0.0,1642.9633,158.4,MoneySpot,0.0,6696777,0.0,30-09-2023,False,Living Expenses,2023-09-30,Green,0.0,11953.0,12340.44
0062x00000E4ytTAAR,0012x00000iIoACAA0,Wyndham Vale,VIC,Australia,Closed Lost,New Client-New Loan,0.0,34.29,500.6432,1.0,0.0,0.0,3.0,1.0,6076.8424,0.0,4.0,0.0,1598.2933,1399.46,0.0,0.42,0.0,0.0,1600.0,2000.0,150.0,1200,1632.0,14.0,14.0,Weekly,24.0,6078.93,4000.0,Full-Time Employment,0.0,0.0,0.0,0.0,6393.1733,0.0,916.4266,116.57,MoneySpot,,5614740,0.0,15-06-2023,False,Other Expenses,2023-06-14,Green,0.0,11619.0,6078.93
0062x00000F3fCyAAJ,0010K000028hYhJQAU,Greenacre,NSW,Australia,Closed Lost,Existing Client-No Loan Granted Ever,0.0,30.29,405.0232,2.0,0.0,0.0,2.0,2.0,5152.193,4.0,13.0,0.0,1888.93,1888.93,0.0,0.0,0.0,0.0,3791.67,400.0,600.0,1200,1728.0,12.0,24.571,Fortnightly,38.0,5159.19,5000.0,Full-Time Employment,4.0,0.0,0.011,2.0,3777.86,0.0,405.0233,144.0,MoneySpot,,7067219,0.0,04-11-2023,False,Life Event Expenses,2023-11-04,Green,0.0,4909.0,5159.19
0062x00000DYKlSAAX,0012x00000gnol4AAA,Rangeville,QLD,Australia,Loan Paid,Existing Client-Granted Loan Before,0.0,32.63,2234.2154,4.0,0.0,0.0,2.0,4.0,5920.3432,0.0,31.0,531.9006,3539.086,2866.54,1.0,0.0,0.0,0.0,0.0,1499.0,101.0,1200,1632.0,7.0,14.429,Fortnightly,47.0,11714.46,2050.0,Full-Time Employment,7.0,0.0,0.0,2.0,11412.7733,1021.0,4334.4133,233.14,MoneySpot,0.0,5027816,0.0,09-04-2023,False,Vehicle Expenses,2023-04-09,Orange,0.0,7216.0,11714.46
0062x00000DWN5ZAAX,0012x000002ayrVAAQ,Blacktown,NSW,Australia,Closed Lost,Existing Client-Granted Loan Before,0.0,79.67,3114.1004,1.0,0.0,0.0,3.0,1.0,4691.0651,0.0,65.0,0.0,1079.5876,1153.98,0.0,2.86,0.0,1.0,3596.67,899.0,700.0,1500,1980.0,10.0,10.143,Weekly,34.0,4691.07,1500.0,Full-Time Employment,0.0,0.0,0.0659,0.0,0.0,544.0,3043.9633,198.0,Financier-2,,4912213,0.0,23-03-2023,False,Travel Expenses,2023-03-22,Orange,0.0,4783.0,4691.07
0062x00000D1v5cAAB,0012x00000fleohAAA,Stawell,VIC,Australia,Loan Paid,Existing Client-Granted Loan Before,0.0,61.27,3280.1063,4.0,0.0,0.0,2.0,4.0,7026.7831,2.0,21.0,160.0,1200.792,991.0,1.0,0.11,0.0,0.0,0.0,599.0,100.0,1500,2040.0,14.0,13.857,Weekly,35.0,8305.95,1500.0,,2.0,0.0,0.0,1.0,5392.4666,1674.0,4150.5266,145.71,MoneySpot,0.0,4417962,2.0,06-01-2023,False,Travel Expenses,2023-01-06,Orange,0.0,11546.0,8305.95
0062x00000F8hEGAAZ,0012x00000lh8XLAAY,Blacktown,NSW,Australia,Closed Lost,New Client-New Loan,0.0,95.96,91.6287,2.0,0.0,0.0,5.0,2.0,3919.1875,2.0,5.0,0.0,1803.9,1803.9,1.0,0.0,0.0,0.0,0.0,0.0,800.0,1200,1776.0,13.0,26.429,Fortnightly,41.0,3919.19,5000.0,full_time,2.0,0.0,0.2308,2.0,3607.8,10.0,117.6666,136.62,MoneySpot,,6871719,2.0,18-10-2023,False,car_purchase,2023-10-18,Green,0.0,3618.0,3919.19
0062x00000D1llAAAR,0012x00000g9Do8AAE,Manunda,QLD,Australia,Closed Lost,New Client-New Loan,0.0,64.07,70.1895,2.0,0.0,0.0,5.0,2.0,6086.9468,1.0,11.0,70.1923,2801.6642,4301.93,1.0,1.51,0.0,0.0,0.0,0.0,0.0,1200,1536.0,3.0,5.429,Fortnightly,32.0,6086.95,2000.0,,1.0,0.0,0.5055,0.0,6537.2166,60.0,893.3333,512.0,MoneySpot,,4410132,1.0,09-01-2023,False,Event - Funeral - Accommodation,2023-01-04,Orange,0.0,6614.0,6086.95
0062x00000D8cV8AAJ,0012x00000gAYMKAA4,Leumeah,NSW,Australia,Closed Lost,New Client-New Loan,0.0,95.29,0.0,2.0,0.0,0.0,3.0,2.0,5305.2933,4.0,6.0,640.0,1580.2566,1116.75,0.0,0.0,1.0,0.0,2000.0,2000.0,0.0,1200,1584.0,5.0,10.286,Fortnightly,22.0,5438.39,3000.0,Full-Time Employment,4.0,0.0,0.011,0.0,3160.5133,0.0,222.0,316.8,MoneySpot,,4541891,8.0,24-01-2023,False,Living Expenses,2023-01-24,Green,0.0,5841.0,5438.39
0062x00000EMkYZAA1,0012x000008JK1zAAG,Glenmore Park,NSW,Australia,Closed Lost,Existing Client-No Loan Granted Ever,0.0,65.3,366.25,2.0,0.0,0.0,1.0,2.0,5909.3134,0.0,1.0,0.0,1667.43,1507.06,0.0,0.0,0.0,0.0,866.67,400.0,1000.0,1200,1680.0,10.0,19.143,Fortnightly,31.0,5909.31,2500.0,Part-Time Employment,0.0,0.0,0.0,0.0,4597.66,0.0,366.25,168.0,MoneySpot,,6130037,0.0,07-08-2023,False,Living Expenses,2023-08-06,Green,0.0,7396.0,5909.31
0062x00000DGRDbAAP,0012x00000BGAlbAAH,Tocumwal,NSW,Australia,Loan Paid,Existing Client-Granted Loan Before,33.13,44.75,220.2379,1.0,0.0,2.0,2.0,1.0,3211.816,0.0,6.0,256.0,367.2966,531.53,0.0,0.24,0.0,0.0,1401.33,400.0,800.0,1500,2100.0,18.0,18.286,Weekly,56.0,4183.12,1500.0,Unemployed,0.0,0.0,0.022,0.0,2041.79,362.0,362.4066,116.67,QuickCash,0.0,4722322,0.0,20-02-2023,False,Home Maintenance & Repairs,2023-02-20,Green,1674.0,5052.0,4183.12
0062x00000DH3Q9AAL,0010K00002ARB5yQAH,Booragul,NSW,Australia,Loan Paid,Existing Client-Granted Loan Before,0.0,81.64,164.2835,4.0,0.0,0.0,5.0,4.0,12455.6633,0.0,0.0,0.0,230.6604,800.0,9.0,0.03,0.0,1.0,0.0,899.0,1800.0,1500,2040.0,14.0,13.714,Weekly,46.0,20613.34,1500.0,Full-Time Employment,0.0,0.0,0.1319,0.0,7868.6666,1521.0,6365.51,145.71,MoneySpot,0.0,4758757,0.0,26-02-2023,False,Child Expenses,2023-02-26,Orange,0.0,12469.0,20613.34
0062x00000DGXeDAAX,0012x00000goCF4AAM,Anula,NT,Australia,Loan Paid,New Client-New Loan,3.38,92.89,983.6309,2.0,0.0,0.0,3.0,2.0,7597.9363,4.0,26.0,1305.44,3173.7142,3083.0,5.0,0.0,1.0,0.0,7308.17,400.0,2160.0,1100,1408.0,3.0,5.286,Fortnightly,32.0,7209.82,1100.0,Full-Time Employment,4.0,0.0,0.1648,0.0,7405.3333,978.0,1578.73,469.33,QuickCash,0.0,4727529,4.0,21-02-2023,False,Living Expenses,2023-02-21,Green,315.0,9313.0,7209.82
0062x00000D8kL1AAJ,0012x000003CIzYAAW,Olinda,VIC,Australia,Closed Lost,Existing Client-Granted Loan Before,0.0,52.63,1566.3819,1.0,0.0,0.0,2.0,1.0,5506.165,0.0,27.0,0.0,1190.46,1190.46,0.0,0.0,0.0,0.0,2210.0,599.0,1000.0,1500,2040.0,14.0,14.0,Weekly,46.0,5506.17,1500.0,Full-Time Employment,0.0,0.0,0.011,0.0,4365.02,0.0,1663.8866,145.71,Financier-2,,4547988,0.0,25-01-2023,False,Living Expenses,2023-01-25,Orange,0.0,7141.0,5506.17
0062x00000Dr2hyAAB,0012x00000gpUPwAAM,Durack,QLD,Australia,Loan Paid,Existing Client-No Loan Granted Ever,7.58,39.24,623.1071,1.0,0.0,2.0,1.0,1.0,3014.1063,0.0,14.0,0.0,615.9222,1107.18,0.0,0.26,0.0,0.0,0.0,400.0,300.0,1200,1536.0,6.0,5.857,Weekly,41.0,5566.65,1500.0,Part-Time Employment,0.0,0.0,0.0,0.0,2548.28,0.0,717.0,256.0,MoneySpot,0.0,5142568,0.0,26-04-2023,False,Vehicle Expenses,2023-04-26,Green,701.0,9238.0,5566.65
0062x00000EeejfAAB,0012x00000TuWvXAAV,Yarrabilba,QLD,Australia,Closed Lost,Existing Client-No Loan Granted Ever,0.0,42.46,1537.9708,1.0,0.0,0.0,3.0,1.0,6497.9469,0.0,12.0,0.0,1189.2061,1302.55,1.0,0.0,0.0,0.0,1100.0,2000.0,390.0,1200,1632.0,17.0,17.143,Weekly,29.0,6497.95,2600.0,Full-Time Employment,0.0,0.0,0.0,0.0,5153.2266,0.0,1537.3466,96.0,MoneySpot,,6509095,0.0,13-09-2023,False,Vehicle Expenses,2023-09-12,Green,0.0,6742.0,6497.95
0062x00000DITJOAA5,0012x00000gpBsmAAE,Glebe,NSW,Australia,Loan Paid,Existing Client-No Loan Granted Ever,0.23,17.64,895.4341,2.0,0.0,2.0,4.0,2.0,5422.9814,1.0,29.0,0.0,2489.525,2188.57,1.0,0.27,0.0,0.0,0.0,400.0,2720.0,1200,1632.0,8.0,15.0,Fortnightly,25.0,6387.08,5000.0,Full-Time Employment,1.0,0.0,0.0,1.0,4994.2933,0.0,894.7933,204.0,MoneySpot,0.0,4835324,0.0,10-03-2023,False,Living Expenses,2023-03-10,Green,15.0,6257.0,6387.08
0062x00000DV3fbAAD,0012x00000dwb2vAAA,Tarneit,VIC,Australia,Loan Paid,Existing Client-No Loan Granted Ever,34.38,94.83,2435.2834,2.0,0.0,2.0,4.0,2.0,6738.4535,0.0,5.0,195.5357,1722.07,1525.59,0.0,0.66,0.0,0.0,0.0,899.0,200.0,1200,1584.0,5.0,8.857,Fortnightly,47.0,7796.3,2500.0,,2.0,0.0,0.0769,0.0,6812.45,252.0,3713.0866,316.8,MoneySpot,0.0,5414400,0.0,27-05-2023,False,Furniture or Appliances,2023-05-27,Green,2647.0,7698.0,7796.3
0062x00000DW2tJAAT,0012x00000TuXpaAAF,DURACK,QLD,Australia,Loan Paid,Existing Client-Granted Loan Before,0.0,53.3,2315.4185,4.0,0.0,0.0,2.0,4.0,2794.5265,0.0,57.0,0.0,991.625,1028.5,1.0,0.0,0.0,1.0,2582.22,899.0,0.0,1200,1584.0,10.0,9.714,Weekly,40.0,5717.48,1200.0,Full-Time Employment,0.0,0.0,0.0,0.0,444.6933,224.0,4286.7266,158.4,QuickCash,0.0,4893623,0.0,19-03-2023,False,Other,2023-03-19,Green,0.0,7583.0,5717.48
0062x00000D7pEVAAZ,0012x00000dc2eAAAQ,Moama,NSW,Australia,Loan Paid,Existing Client-Granted Loan Before,56.78,53.18,535.3804,4.0,0.0,2.0,4.0,4.0,2539.1133,1.0,11.0,423.0682,777.2,1316.23,1.0,0.39,0.0,0.0,0.0,599.0,0.0,1100,1496.0,7.0,13.286,Fortnightly,67.0,2539.11,1100.0,Full-Time Employment,1.0,0.0,0.022,1.0,2631.12,408.0,749.6666,213.71,MoneySpot,0.0,4501690,1.0,18-01-2023,False,Vehicle Expenses,2023-01-18,Orange,1736.0,3057.0,2539.11
0062x00000Ds4KzAAJ,0012x00000SG7MeAAL,MINCHINBURY,NSW,Australia,Loan Paid,Existing Client-No Loan Granted Ever,0.0,85.3,0.0,2.0,1.0,0.0,3.0,2.0,5177.8488,1.0,1.0,0.0,1873.4114,2025.28,1.0,0.73,0.0,0.0,0.0,0.0,960.0,1200,1632.0,7.0,13.429,Fortnightly,23.0,5465.29,1250.0,Casual Employment,1.0,0.0,0.0,0.0,4371.2933,0.0,69.5866,233.14,MoneySpot,0.0,5218610,1.0,08-05-2023,False,Vehicle - Service,2023-05-07,Orange,0.0,6809.0,5465.29
0062x00000D2YYJAA3,0012x00000IO3vDAAT,Lakes Entrance,VIC,Australia,Loan Paid,Existing Client-Granted Loan Before,0.0,60.53,4660.8797,2.0,2.0,0.0,2.0,2.0,6253.4644,19.0,77.0,229.0375,1976.17,1976.17,2.0,0.0,0.0,0.0,3248.83,1499.0,0.0,1500,2040.0,7.0,13.143,Fortnightly,58.0,5820.13,1700.0,Full-Time Employment,19.0,0.0,0.1868,7.0,3952.34,2235.0,6756.02,291.43,MoneySpot,0.0,4451249,15.0,10-01-2023,False,Other Expenses,2023-01-10,Orange,0.0,5912.0,5820.13
0062x00000EOJu3AAH,0012x00000fpCN1AAM,Darra,QLD,Australia,Loan Paid,Existing Client-No Loan Granted Ever,0.0,79.05,1788.8672,1.0,0.0,0.0,2.0,1.0,5778.1629,0.0,56.0,329.0437,1329.7692,1349.0,0.0,0.61,0.0,0.0,0.0,2000.0,200.0,1200,1632.0,14.0,13.714,Weekly,39.0,5778.16,1200.0,Full-Time Employment,0.0,0.0,0.4396,0.0,5762.3333,723.0,1874.28,116.57,QuickCash,0.0,6249586,0.0,18-08-2023,False,Living Expenses,2023-08-17,Orange,0.0,6446.0,5778.16
0062x00000F8idgAAB,0012x000002cqcpAAA,Parramatta,NSW,Australia,Loan Paid,Existing Client-No Loan Granted Ever,0.0,46.39,403.5333,2.0,0.0,0.0,5.0,2.0,4660.4816,0.0,5.0,0.0,1573.5928,2213.44,0.0,0.0,0.0,0.0,1690.0,599.0,0.0,1200,1728.0,12.0,23.429,Fortnightly,45.0,4660.48,3000.0,Full-Time Employment,0.0,0.0,0.0,0.0,3671.7166,0.0,926.2966,144.0,MoneySpot,0.0,6873084,0.0,18-10-2023,False,Living Expenses,2023-10-18,Green,0.0,6179.0,4660.48
0062x00000D8nPQAAZ,0012x00000THe8LAAT,South Fremantle,WA,Australia,Loan Paid,Existing Client-Granted Loan Before,27.98,36.76,513.2476,4.0,0.0,2.0,1.0,2.0,3628.9089,0.0,18.0,160.0,869.11,999.4,0.0,0.0,0.0,0.0,2383.33,400.0,200.0,1500,2040.0,7.0,14.286,Fortnightly,68.0,3628.91,1500.0,Part-Time Employment,0.0,0.0,0.022,0.0,1738.22,430.0,546.6833,291.43,Financier-2,0.0,4550125,0.0,26-01-2023,True,Home Maintenance & Repairs,2023-01-25,Orange,1772.0,6332.0,3628.91
0062x00000D9oeTAAR,0010K000026MZ1jQAG,Sorrento,WA,Australia,Loan Paid,Existing Client-Granted Loan Before,17.92,21.38,911.6821,2.0,0.0,2.0,2.0,2.0,5543.7263,0.0,55.0,236.9964,2059.4685,2002.84,0.0,0.74,0.0,0.0,0.0,899.0,560.0,1450,1972.0,7.0,13.857,Fortnightly,64.0,5699.13,1450.0,,0.0,0.0,0.2747,0.0,6033.8166,870.0,1829.7566,281.71,Financier-2,0.0,4600025,0.0,02-02-2023,False,Furniture or Appliances,2023-02-02,Green,1217.0,6791.0,5699.13
0062x00000Ey3qLAAR,0012x00000kgDdpAAE,Harden,NSW,Australia,Closed Lost,Existing Client-No Loan Granted Ever,0.0,70.36,479.1263,2.0,0.0,0.0,4.0,2.0,4508.9058,0.0,4.0,0.0,2075.3333,2080.0,0.0,0.68,0.0,0.0,4333.33,599.0,1600.0,1200,1728.0,12.0,22.714,Fortnightly,27.0,4508.91,5000.0,Full-Time Employment,0.0,0.0,0.0,0.0,4150.6666,241.0,474.04,144.0,MoneySpot,,6707539,0.0,06-10-2023,False,Home Maintenance & Repairs,2023-10-01,Green,0.0,4879.0,4508.91
0062x00000DXaABAA1,0012x00000hX97XAAS,Albion Park Rail,NSW,Australia,Closed Lost,New Client-New Loan,28.54,49.5,35.846,2.0,0.0,4.0,3.0,2.0,6461.0351,0.0,21.0,384.0,1542.8816,1553.74,0.0,0.0,1.0,0.0,1556.0,2000.0,140.0,1200,1632.0,7.0,14.571,Fortnightly,27.0,6461.04,4000.0,Full-Time Employment,0.0,0.0,0.0,0.0,4915.4666,0.0,296.28,233.14,MoneySpot,,4984199,0.0,02-04-2023,False,Life Event Expenses,2023-04-02,Orange,1830.0,6410.0,6461.04
0062x00000DHh1iAAD,0012x000003CmLGAA0,Kitchener,NSW,Australia,Loan Paid,Existing Client-Granted Loan Before,38.2,85.33,1280.0433,2.0,1.0,1.0,3.0,2.0,5253.5433,11.0,28.0,719.0661,1169.4085,1179.12,0.0,0.0,0.0,0.0,866.67,599.0,0.0,1250,1700.0,7.0,13.857,Fortnightly,47.0,5626.42,1250.0,Part-Time Employment,14.0,0.0,0.033,4.0,5099.9466,1032.0,1625.5833,242.86,Financier-2,0.0,4791613,12.0,03-03-2023,False,Vehicle Expenses,2023-03-03,Green,2500.0,6543.0,5626.42
0062x00000EO2XFAA1,0012x00000kgymaAAA,West Albury,NSW,Australia,Closed Lost,New Client-New Loan,29.05,73.33,129.7933,1.0,0.0,4.0,3.0,1.0,2969.802,1.0,7.0,0.0,493.3233,601.8,0.0,0.03,0.0,0.0,0.0,0.0,0.0,1500,1920.0,6.0,6.571,Weekly,28.0,4532.29,1500.0,,1.0,0.0,0.2747,0.0,1266.1866,0.0,850.9966,320.0,MoneySpot,,6227233,1.0,16-08-2023,False,Dental expenses,2023-08-15,Orange,838.0,2884.0,4532.29
0062x00000Exb2AAAR,0012x00000lf1NOAAY,Maddington,WA,Australia,Loan Paid,New Client-New Loan,0.0,51.09,2048.1934,1.0,0.0,0.0,2.0,1.0,5135.115,0.0,31.0,0.0,1181.78,1246.5,1.0,0.08,0.0,0.0,1246.0,2000.0,400.0,1200,1776.0,28.0,27.857,Weekly,41.0,9286.49,3000.0,Full-Time Employment,0.0,0.0,0.044,0.0,3151.4133,0.0,2064.4,63.43,MoneySpot,0.0,6673731,0.0,28-09-2023,False,Travel Expenses,2023-09-28,Green,0.0,5273.0,9286.49
0062x00000DtSyRAAV,0012x00000ha8m0AAA,Woree,QLD,Australia,Closed Lost,New Client-New Loan,0.0,49.53,1650.351,1.0,0.0,0.0,2.0,1.0,5061.7128,1.0,39.0,0.0,1072.4492,1000.51,0.0,0.0,0.0,0.0,4333.33,400.0,215.0,1200,1584.0,9.0,8.857,Weekly,31.0,5066.71,2100.0,Full-Time Employment,2.0,0.0,0.011,0.0,4647.28,0.0,1784.4866,176.0,MoneySpot,,5315142,1.0,19-05-2023,False,Living Expenses,2023-05-18,Green,0.0,5066.0,5066.71
0062x00000F2UvzAAF,0012800001Wa4iRAAR,Blacktown,NSW,Australia,Loan Paid,Existing Client-Granted Loan Before,2.26,95.49,5383.76,3.0,0.0,0.0,5.0,3.0,8841.5533,0.0,18.0,0.0,8104.22,8104.22,1.0,0.0,0.0,0.0,3500.0,1499.0,2500.0,1500,2100.0,5.0,19.857,Monthly,45.0,8108.22,1500.0,Casual Employment,0.0,0.0,0.0,0.0,8104.22,0.0,5383.76,420.0,MoneySpot,0.0,6972427,0.0,28-10-2023,False,Travel Expenses,2023-10-27,Orange,217.0,9572.0,8108.22
0062x00000DIfhHAAT,0012x00000gpJQzAAM,Newington,NSW,Australia,Loan Paid,New Client-New Loan,0.0,30.43,1514.4022,2.0,0.0,0.0,3.0,2.0,4332.5826,0.0,37.0,0.0,1794.7233,1796.75,0.0,0.39,0.0,0.0,1800.0,2000.0,0.0,1200,1536.0,3.0,6.571,Fortnightly,33.0,4159.52,3000.0,Full-Time Employment,0.0,0.0,0.0,0.0,3589.4466,0.0,1730.4733,512.0,MoneySpot,0.0,4849667,0.0,12-03-2023,False,Living Expenses,2023-03-12,Orange,0.0,5105.0,4159.52
0062x00000Fgm1XAAR,0012x00000XB7doAAD,Saint Clair,NSW,Australia,Loan Paid,Existing Client-Granted Loan Before,0.0,58.64,3087.4014,2.0,0.0,0.0,3.0,2.0,5978.7479,1.0,32.0,0.0,2376.09,3601.99,1.0,0.99,0.0,0.0,0.0,1499.0,880.0,1200,1632.0,8.0,15.714,Fortnightly,50.0,5978.75,5000.0,,1.0,0.0,0.022,1.0,5544.21,917.0,3849.3966,204.0,MoneySpot,0.0,7839046,1.0,2024-01-14,False,Vehicle Expenses,2024-01-14,Orange,0.0,11249.0,5978.75
0062x00000DW0BfAAL,0010K000029H5vDQAS,Davidson,NSW,Australia,Loan Paid,Existing Client-Granted Loan Before,4.25,75.52,2556.1594,2.0,0.0,0.0,3.0,2.0,5601.7808,0.0,82.0,976.4184,2261.5333,2302.9,2.0,0.04,0.0,0.0,0.0,899.0,760.0,1500,1920.0,5.0,8.714,Fortnightly,43.0,5731.78,1500.0,,0.0,0.0,0.989,0.0,4523.0666,1190.0,2486.79,384.0,MoneySpot,0.0,4889379,0.0,18-03-2023,False,Relocation Expenses,2023-03-18,Green,759.0,17826.0,5731.78
0062x00000DtS6XAAV,0012x00000go5EHAAY,Caboolture,QLD,Australia,Loan Paid,Existing Client-Granted Loan Before,0.0,51.07,133.7304,1.0,0.0,0.0,3.0,1.0,3116.3489,0.0,16.0,0.0,461.7146,437.72,0.0,13.87,0.0,0.0,1950.0,400.0,0.0,1500,2040.0,14.0,14.0,Weekly,19.0,3120.35,1900.0,Part-Time Employment,0.0,0.0,0.0,0.0,2000.7633,110.0,270.2033,145.71,MoneySpot,0.0,5314647,0.0,18-05-2023,False,Vehicle Expenses,2023-05-18,Orange,0.0,4160.0,3120.35
0062x00000D6tPtAAJ,0012x00000SISwNAAX,Chinchilla,QLD,Australia,Loan Paid,Existing Client-Granted Loan Before,0.0,56.3,1345.4768,2.0,0.0,0.0,3.0,2.0,5014.503,3.0,32.0,0.0,1710.9933,2765.21,0.0,3.65,0.0,0.0,3423.33,599.0,550.0,1200,1632.0,7.0,13.143,Fortnightly,21.0,6421.97,2050.0,Part-Time Employment,3.0,0.0,0.1538,3.0,1710.9933,125.0,1206.51,233.14,MoneySpot,0.0,4458034,1.0,11-01-2023,False,Vehicle Expenses,2023-01-11,Green,0.0,4274.0,6421.97
0062x00000D8EaZAAV,0012x00000gAMELAA4,Tatura,VIC,Australia,Closed Lost,New Client-New Loan,20.12,34.74,2287.8395,1.0,0.0,4.0,3.0,1.0,6164.1246,0.0,13.0,194.0149,1115.0769,1143.0,2.0,0.0,0.0,0.0,0.0,0.0,800.0,1200,1584.0,9.0,8.714,Weekly,31.0,6204.96,3500.0,,0.0,0.0,0.0,0.0,6150.85,193.0,2109.6633,176.0,MoneySpot,,4521834,0.0,21-01-2023,False,Car Repairs,2023-01-20,Green,1332.0,6619.0,6204.96
0062x00000EMWTjAAP,0012x00000haIhcAAE,Bray Park,QLD,Australia,Loan Paid,Existing Client-No Loan Granted Ever,47.95,93.31,768.4815,1.0,0.0,4.0,4.0,1.0,8411.2515,3.0,9.0,0.0,789.684,863.67,3.0,1.38,0.0,1.0,3250.0,599.0,1040.0,1200,1680.0,18.0,18.0,Weekly,42.0,9083.75,2050.0,Full-Time Employment,3.0,0.0,0.0,1.0,4804.5533,0.0,2493.5466,93.33,MoneySpot,0.0,6108222,3.0,05-08-2023,False,Vehicle Expenses,2023-08-04,Green,5432.0,11327.0,9083.75
0062x00000DHej3AAD,0012x00000gmzyQAAQ,Sebastopol,VIC,Australia,Closed Lost,Existing Client-No Loan Granted Ever,0.0,8.56,1759.654,1.0,0.0,0.0,3.0,1.0,8149.678,2.0,35.0,0.0,1821.0769,1821.0,0.0,0.0,0.0,0.0,0.0,400.0,1000.0,1200,1536.0,6.0,5.857,Weekly,61.0,8149.68,3000.0,Full-Time Employment,2.0,0.0,0.6813,2.0,7891.3333,0.0,1757.9533,256.0,MoneySpot,,4789863,0.0,07-03-2023,False,Vehicle Expenses,2023-03-02,Green,0.0,8128.0,8149.68
0062x00000DXRboAAH,0012x00000g8ragAAA,Bayswater,WA,Australia,Closed Lost,Existing Client-No Loan Granted Ever,0.0,35.32,480.0601,4.0,0.0,0.0,3.0,4.0,5247.7133,0.0,9.0,0.0,1967.8925,2924.68,1.0,0.0,0.0,1.0,0.0,400.0,1500.0,1200,1536.0,3.0,5.857,Fortnightly,38.0,5247.71,3000.0,Full-Time Employment,3.0,0.0,0.0,1.0,0.0,0.0,475.0866,512.0,MoneySpot,,4972238,0.0,31-03-2023,False,Vehicle Expenses,2023-03-31,Orange,0.0,5788.0,5247.71
0062x00000DFiQBAA1,0012x00000gnknYAAQ,Lyons,ACT,Australia,Closed Lost,Existing Client-No Loan Granted Ever,0.0,59.34,0.0,1.0,0.0,0.0,2.0,1.0,5748.0961,1.0,1.0,1152.0,713.313,701.7,0.0,0.97,0.0,0.0,0.0,899.0,680.0,1200,1632.0,16.0,16.143,Weekly,24.0,8603.1,5000.0,,1.0,0.0,0.011,0.0,3091.0233,0.0,57.8,102.0,MoneySpot,,4682233,0.0,19-02-2023,False,Vehicle Expenses,2023-02-14,Green,0.0,10613.0,8603.1
0062x00000DVBf9AAH,0012x00000BFJZ1AAP,Bellerive,TAS,Australia,Closed Lost,Existing Client-No Loan Granted Ever,0.0,70.43,80.0,1.0,0.0,0.0,1.0,1.0,3519.7153,0.0,1.0,0.0,793.0,793.0,0.0,0.0,0.0,0.0,2444.0,599.0,100.0,1200,1680.0,18.0,18.143,Weekly,25.0,6008.48,4500.0,Part-Time Employment,0.0,0.0,0.0,0.0,2907.6666,0.0,284.6,93.33,MoneySpot,,5428351,0.0,29-05-2023,False,Vehicle Expenses,2023-05-28,Green,0.0,11361.0,6008.48
0062x00000DWj5vAAD,0012x00000GcPgHAAV,Granville,NSW,Australia,Loan Paid,Existing Client-Granted Loan Before,0.0,43.98,1583.4561,1.0,0.0,0.0,4.0,1.0,4566.2187,0.0,68.0,1193.7468,1001.0,1001.0,1.0,0.09,0.0,0.0,780.0,400.0,0.0,1050,1386.0,10.0,9.857,Weekly,36.0,4566.22,2050.0,Full-Time Employment,0.0,0.0,0.0,0.0,4031.6666,2053.0,2837.96,138.6,MoneySpot,0.0,4933049,0.0,25-03-2023,False,Vehicle Expenses,2023-03-25,Green,0.0,6735.0,4566.22
0062x00000DUyHiAAL,0012x00000iH8I3AAK,Blacktown,NSW,Australia,Closed Lost,New Client-New Loan,0.0,36.66,450.6568,2.0,0.0,0.0,3.0,2.0,5250.8717,2.0,36.0,0.0,1493.2233,1506.0,0.0,0.0,0.0,0.0,0.0,0.0,0.0,1200,1536.0,3.0,4.857,Fortnightly,50.0,12597.87,1650.0,,2.0,0.0,0.0,0.0,2986.4466,0.0,783.2333,512.0,MoneySpot,,5403780,0.0,29-05-2023,False,Other,2023-05-26,Green,0.0,12366.0,12597.87
0062x00000FXSKGAA5,0012x00000n4245AAA,Clayton,VIC,Australia,Closed Lost,New Client-New Loan,0.0,84.58,89.5333,2.0,0.0,0.0,1.0,2.0,6854.8368,0.0,6.0,0.0,3155.1033,3136.77,0.0,0.22,0.0,0.0,3100.0,2000.0,834.0,1200,1632.0,7.0,14.429,Fortnightly,31.0,7376.26,2700.0,Full-Time Employment,0.0,0.0,0.0,0.0,6310.2066,256.0,2162.0466,233.14,MoneySpot,,7755084,0.0,2024-01-10,False,Travel Expenses,2024-01-05,Green,0.0,8199.0,7376.26
0062x00000DZCasAAH,0012x00000SI9znAAD,Holsworthy,NSW,Australia,Loan Paid,Existing Client-Granted Loan Before,0.0,69.93,1518.8101,2.0,0.0,0.0,4.0,2.0,4064.1606,3.0,34.0,1604.5855,1824.6,1824.6,0.0,0.47,0.0,0.0,3834.07,599.0,1200.0,1250,1600.0,3.0,5.429,Fortnightly,41.0,4357.4,2050.0,Full-Time Employment,3.0,0.0,0.6484,1.0,4257.4,1791.0,1958.6633,533.33,MoneySpot,0.0,5079302,1.0,17-04-2023,False,Living Expenses,2023-04-17,Green,0.0,5478.0,4357.4
0062x00000Dri4vAAB,0012x00000g9cvxAAA,Clunes,NSW,Australia,Loan Paid,Existing Client-Granted Loan Before,0.0,80.36,420.721,1.0,0.0,0.0,2.0,1.0,4015.5514,2.0,44.0,0.0,760.3461,632.15,1.0,0.0,0.0,1.0,850.0,599.0,820.0,1200,1632.0,14.0,14.429,Weekly,21.0,4286.17,2050.0,Casual Employment,11.0,0.0,0.2747,1.0,0.0,239.0,883.1866,116.57,QuickCash,0.0,5186157,2.0,03-05-2023,False,Vehicle Expenses,2023-05-03,Orange,0.0,5220.0,4286.17
0062x00000EzOMSAA3,0012x00000MiqC1AAJ,Inverell,NSW,Australia,Closed Lost,Existing Client-No Loan Granted Ever,0.0,80.01,0.0,1.0,0.0,0.0,2.0,1.0,3273.7884,6.0,9.0,0.0,753.42,715.06,0.0,0.0,0.0,0.0,0.0,400.0,600.0,1200,1776.0,27.0,27.0,Weekly,62.0,3273.79,2050.0,Unemployed,6.0,0.0,0.9121,1.0,3264.82,0.0,0.0,65.78,MoneySpot,,6804859,0.0,11-10-2023,False,Life Event Expenses,2023-10-11,Green,0.0,3438.0,3273.79
0062x00000FI5flAAD,0012x00000goPW2AAM,Kambalda West,WA,Australia,Loan Paid,Existing Client-No Loan Granted Ever,0.0,81.28,706.2333,2.0,0.0,0.0,4.0,2.0,8672.2845,5.0,2.0,0.0,2779.6271,2468.54,1.0,0.0,0.0,0.0,3596.67,400.0,50.0,1200,1632.0,7.0,14.143,Fortnightly,22.0,8672.28,1300.0,Contract Employment,5.0,0.0,0.0,3.0,6485.7966,0.0,1119.98,233.14,MoneySpot,0.0,7223601,4.0,16-11-2023,False,Medical bills,2023-11-16,Green,0.0,9687.0,8672.28
0062x00000D9IKlAAN,0012x00000gmefVAAQ,Arundel,QLD,Australia,Closed Lost,New Client-New Loan,8.98,90.53,728.0353,2.0,1.0,2.0,4.0,2.0,4706.6778,7.0,22.0,0.0,1789.97,1864.97,0.0,0.0,0.0,0.0,0.0,0.0,1560.0,1200,1536.0,3.0,4.714,Fortnightly,49.0,4712.01,1600.0,,7.0,0.0,0.956,1.0,3993.8733,0.0,1176.8766,512.0,MoneySpot,,4575575,7.0,03-02-2023,False,Other,2023-01-29,Green,414.0,4607.0,4712.01
0062x00000DGlqfAAD,0012x00000goKLBAA2,Kiama,NSW,Australia,Loan Paid,New Client-New Loan,0.0,39.4,0.0,1.0,1.0,0.0,3.0,1.0,12374.2198,6.0,14.0,0.0,1467.4353,1429.28,0.0,0.0,0.0,0.0,0.0,0.0,1080.0,1200,1536.0,6.0,6.0,Weekly,31.0,13084.02,2000.0,,6.0,0.0,0.033,0.0,10284.6766,0.0,1764.3,256.0,MoneySpot,0.0,4741237,8.0,23-02-2023,False,Moving - Cleaning,2023-02-23,Green,0.0,10774.0,13084.02
0062x00000D2BrrAAF,0012x00000MhiYBAAZ,Cooks Gap,NSW,Australia,Loan Paid,Existing Client-Granted Loan Before,0.0,60.13,1742.7152,4.0,2.0,0.0,6.0,4.0,9830.8657,7.0,49.0,320.0,639.3641,180.0,1.0,0.51,0.0,1.0,3907.77,899.0,0.0,1200,1632.0,14.0,14.571,Weekly,39.0,4715.95,1200.0,Full-Time Employment,7.0,0.0,0.0549,0.0,4463.69,1908.0,6335.5233,116.57,MoneySpot,0.0,4432377,5.0,07-01-2023,False,Travel Expenses,2023-01-07,Green,0.0,10020.0,4715.95
0062x00000F1dXiAAJ,0012x000003fHjWAAU,Colac,VIC,Australia,Loan Paid,Existing Client-No Loan Granted Ever,0.0,30.27,281.7435,1.0,0.0,0.0,3.0,1.0,4670.813,0.0,9.0,0.0,1059.8569,889.29,1.0,0.0,0.0,0.0,2166.67,599.0,100.0,1200,1680.0,19.0,18.714,Weekly,26.0,4707.48,4000.0,Contract Employment,0.0,0.0,0.0,0.0,4592.7133,0.0,194.52,88.42,MoneySpot,0.0,6909816,0.0,21-10-2023,False,Vehicle Expenses,2023-10-21,Green,0.0,5277.0,4707.48
0062x00000DANgYAAX,0012x00000d9FECAA2,Belmont,WA,Australia,Loan Paid,Existing Client-Granted Loan Before,0.0,89.55,1786.59,2.0,1.0,0.0,3.0,2.0,6322.7082,1.0,28.0,1297.5,1614.7285,1522.73,0.0,0.05,0.0,0.0,1900.0,599.0,880.0,1350,1836.0,7.0,13.429,Fortnightly,27.0,6322.71,1350.0,Casual Employment,1.0,0.0,0.6044,0.0,3767.7,1107.0,2095.57,262.29,QuickCash,0.0,4627188,1.0,06-02-2023,False,Relocation Expenses,2023-02-06,Green,0.0,7547.0,6322.71
0062x00000FTtGFAA1,0012x00000lgJ7vAAE,Port Macquarie,NSW,Australia,Loan Paid,Existing Client-Granted Loan Before,0.0,62.93,471.6232,1.0,0.0,0.0,4.0,1.0,4865.8442,1.0,28.0,0.0,1011.75,1011.75,0.0,17.35,0.0,0.0,0.0,1499.0,1100.0,1500,2160.0,25.0,25.571,Weekly,55.0,5049.51,1500.0,Full-Time Employment,1.0,0.0,0.044,0.0,4384.25,213.0,2031.44,86.4,MoneySpot,0.0,7464538,1.0,11-12-2023,False,Vehicle Expenses,2023-12-11,Green,0.0,6024.0,5049.51
0062x00000D234wAAB,0012x00000cvLW8AAM,Glenhaven,NSW,Australia,Loan Paid,Existing Client-Granted Loan Before,1.39,73.48,3962.1741,2.0,10.0,0.0,4.0,2.0,6054.0224,0.0,5.0,1188.4511,2176.6133,1320.0,1.0,0.0,0.0,0.0,7847.67,899.0,0.0,1200,1632.0,7.0,13.0,Fortnightly,34.0,18317.39,3000.0,Full-Time Employment,56.0,0.0,0.1429,26.0,2176.6133,2513.0,5868.97,233.14,MoneySpot,0.0,4424912,27.0,06-01-2023,False,Medical Expenses,2023-01-06,Orange,180.0,12939.0,18317.39
0062x00000FJwBeAAL,0012x00000hYHrbAAG,Lidcombe,NSW,Australia,Closed Lost,Existing Client-No Loan Granted Ever,0.0,66.94,0.0,1.0,0.0,0.0,3.0,1.0,6384.8753,4.0,12.0,0.0,997.1861,1084.14,0.0,0.0,0.0,0.0,0.0,400.0,300.0,1200,1680.0,19.0,19.0,Weekly,25.0,7681.49,3000.0,Part-Time Employment,4.0,0.0,0.0,2.0,4525.2866,0.0,35.0,88.42,MoneySpot,,7357641,0.0,04-12-2023,False,Other Expenses,2023-11-30,Green,0.0,11859.0,7681.49
0062x00000D7WsfAAF,0010K000020IhStQAK,Ceduna,SA,Australia,Loan Paid,Existing Client-Granted Loan Before,0.0,86.91,3394.2122,2.0,1.0,0.0,4.0,2.0,4290.8076,11.0,69.0,1048.3165,1659.66,1626.21,1.0,1.02,0.0,0.0,3250.0,599.0,200.0,1500,2040.0,7.0,13.571,Fortnightly,53.0,4290.81,1500.0,Full-Time Employment,11.0,0.0,0.7582,5.0,4472.54,2660.0,4192.4,291.43,QuickCash,0.0,4488097,9.0,16-01-2023,False,Vehicle Expenses,2023-01-16,Green,0.0,4697.0,4290.81
0062x00000DAjzgAAD,0012x00000gAgCOAA0,Mount Louisa,QLD,Australia,Loan Paid,Existing Client-No Loan Granted Ever,0.0,10.13,1766.9609,4.0,0.0,0.0,3.0,4.0,4383.9633,1.0,17.0,0.0,1643.9862,1687.12,0.0,0.0,0.0,0.0,0.0,899.0,0.0,1200,1632.0,7.0,14.143,Fortnightly,46.0,4383.96,3000.0,Full-Time Employment,1.0,0.0,0.0,0.0,4383.9633,0.0,1741.6633,233.14,MoneySpot,0.0,4643044,0.0,09-02-2023,False,Other Expenses,2023-02-08,Orange,0.0,4445.0,4383.96
0062x00000DYUouAAH,0012800001SBxvhAAD,Coomera,QLD,Australia,Loan Paid,Existing Client-Granted Loan Before,0.83,48.12,671.9142,1.0,0.0,4.0,1.0,1.0,8508.3906,0.0,22.0,0.0,1005.3938,1004.15,1.0,0.69,0.0,0.0,3600.0,599.0,630.0,1500,1920.0,7.0,7.429,Weekly,54.0,5134.36,1500.0,Full-Time Employment,0.0,0.0,0.011,0.0,4413.7233,172.0,690.46,274.29,MoneySpot,0.0,5037288,0.0,11-04-2023,False,Living Expenses,2023-04-11,Green,57.0,6851.0,5134.36
0062x00000FhuE6AAJ,0012x00000nQbbEAAS,Freshwater,NSW,Australia,Loan Paid,New Client-New Loan,0.0,72.91,819.7109,1.0,0.0,0.0,5.0,1.0,8728.6347,1.0,18.0,0.0,1361.0,1361.0,0.0,30.5,2.0,0.0,1361.0,2000.0,2440.0,1300,1768.0,14.0,14.0,Weekly,30.0,8123.87,2100.0,Full-Time Employment,2.0,0.0,0.0,1.0,4990.3333,0.0,819.0966,126.29,MoneySpot,0.0,7939713,0.0,2024-01-20,False,Vehicle Expenses,2024-01-20,Orange,0.0,8704.0,8123.87
0062x00000DFvsJAAT,0010K000022Ok4JQAS,Thursday Island,QLD,Australia,Loan Paid,Existing Client-Granted Loan Before,17.06,25.23,0.0,2.0,0.0,4.0,3.0,2.0,3455.4483,0.0,0.0,0.0,1407.048,1187.25,0.0,0.0,0.0,0.0,1300.0,1499.0,400.0,1500,2040.0,7.0,13.0,Fortnightly,50.0,3622.11,1500.0,Unemployed,0.0,0.0,0.0,0.0,2743.3366,35.0,35.2,291.43,Financier-2,0.0,4694280,0.0,16-02-2023,False,Other Expenses,2023-02-16,Green,594.0,3481.0,3622.11
0062x00000EODkRAAX,0012x00000gqSMhAAM,Livingstone,NT,Australia,Loan Paid,Existing Client-No Loan Granted Ever,20.55,94.4,459.4075,1.0,0.0,2.0,2.0,1.0,5857.3504,0.0,17.0,0.0,981.5361,949.69,1.0,0.0,0.0,0.0,0.0,899.0,400.0,1200,1680.0,18.0,17.857,Weekly,40.0,5857.35,2250.0,Full-Time Employment,0.0,0.0,0.0,0.0,4892.65,0.0,497.4766,93.33,MoneySpot,0.0,6241231,0.0,17-08-2023,False,Vehicle Expenses,2023-08-17,Green,1242.0,6042.0,5857.35
0062x00000E3ZMpAAN,0012x00000gmyqjAAA,Hoppers Crossing,VIC,Australia,Loan Paid,Existing Client-Granted Loan Before,0.0,68.61,2565.8745,1.0,0.0,0.0,4.0,1.0,14581.4325,0.0,111.0,1326.7071,1828.25,2017.0,0.0,0.31,0.0,1.0,3466.67,400.0,800.0,1150,1656.0,24.0,23.714,Weekly,39.0,14581.43,25200.0,Contract Employment,0.0,0.0,0.0,0.0,3498.23,1433.0,2976.8566,69.0,MoneySpot,0.0,5498759,0.0,04-06-2023,False,Living Expenses,2023-06-04,Green,0.0,14059.0,14581.43
0062x00000FjzlaAAB,0012x00000VeCbAAAV,Parkwood,QLD,Australia,Loan Paid,Existing Client-Granted Loan Before,2.0,49.25,3146.1186,2.0,0.0,2.0,4.0,2.0,19405.3845,2.0,41.0,0.0,4347.2257,4589.98,0.0,3.2,1.0,0.0,5221.31,599.0,450.0,1500,2040.0,7.0,13.714,Fortnightly,45.0,19405.38,1500.0,Full-Time Employment,2.0,0.0,0.0,0.0,17586.58,437.0,3459.5366,291.43,MoneySpot,0.0,8104103,0.0,2024-02-04,False,Medical Expenses,2024-02-04,Orange,600.0,29911.0,19405.38
0062x00000D8jniAAB,0012x000002cNXiAAM,Rydalmere,NSW,Australia,Closed Lost,Existing Client-Granted Loan Before,0.0,98.36,337.6888,4.0,1.0,0.0,2.0,4.0,71.6666,9.0,15.0,337.6902,53.75,20.0,0.0,0.0,0.0,1.0,2771.17,599.0,800.0,1500,2040.0,7.0,13.143,Fortnightly,30.0,2216.46,1500.0,Full-Time Employment,9.0,0.0,0.2747,4.0,0.0,259.0,259.05,291.43,Financier-2,,4547623,4.0,25-01-2023,False,Relocation Expenses,2023-01-24,Orange,0.0,3898.0,2216.46
0062x00000EMy8vAAD,0012x00000g8F0YAAU,Cabramatta,NSW,Australia,Loan Paid,Existing Client-Granted Loan Before,13.35,25.92,2239.0042,1.0,0.0,0.0,3.0,1.0,7375.92,0.0,37.0,0.0,1697.472,1618.37,1.0,0.0,0.0,0.0,0.0,899.0,280.0,1500,2160.0,26.0,26.286,Weekly,48.0,15831.62,2000.0,Full-Time Employment,0.0,0.0,0.3077,0.0,2829.12,766.0,2370.3966,83.08,MoneySpot,0.0,6142147,0.0,10-08-2023,False,Vehicle Expenses,2023-08-10,Orange,716.0,5360.0,15831.62
0062x00000ELnf9AAD,0012x00000THL3AAAX,Winston,QLD,Australia,Loan Paid,Existing Client-No Loan Granted Ever,0.0,24.8,0.0,2.0,0.0,0.0,3.0,2.0,7783.2734,0.0,6.0,0.0,3384.2571,3224.4,0.0,26.57,0.0,0.0,6169.0,1499.0,400.0,1200,1584.0,6.0,11.429,Fortnightly,44.0,7716.03,2050.0,Full-Time Employment,0.0,0.0,0.2418,0.0,7896.6,0.0,237.1833,264.0,MoneySpot,0.0,6061246,0.0,31-07-2023,False,Living Expenses,2023-07-31,Green,0.0,9993.0,7716.03
0062x00000DWc8sAAD,0012x00000Oy7k5AAB,BUCASIA,QLD,Australia,Closed Lost,Existing Client-Granted Loan Before,0.0,67.74,941.5417,2.0,1.0,0.0,3.0,2.0,4101.2768,1.0,27.0,0.0,1887.7116,1780.81,1.0,0.0,0.0,0.0,0.0,599.0,1720.0,1100,1452.0,5.0,8.857,Fortnightly,61.0,4101.28,1100.0,,1.0,0.0,0.022,1.0,3775.4233,366.0,737.8333,290.4,MoneySpot,,4925782,1.0,24-03-2023,False,Living Expenses,2023-03-24,Green,0.0,4474.0,4101.28
0062x00000DGBuSAAX,0012x00000gnzhWAAQ,Leederville,WA,Australia,Loan Paid,New Client-New Loan,0.0,76.08,107.3133,2.0,0.0,0.0,1.0,2.0,6557.9974,0.0,13.0,0.0,2116.8757,1967.58,0.0,0.0,0.0,0.0,4550.0,0.0,0.0,1200,1632.0,8.0,15.429,Fortnightly,29.0,7176.33,5000.0,Full-Time Employment,0.0,0.0,0.0,0.0,4939.3766,0.0,121.77,204.0,MoneySpot,0.0,4708038,0.0,18-02-2023,False,Medical Expenses,2023-02-17,Green,0.0,8255.0,7176.33
0062x00000DZoY7AAL,0012x000003E5jMAAS,Kallaroo,WA,Australia,Loan Paid,Existing Client-Granted Loan Before,0.0,59.28,3227.7852,1.0,0.0,0.0,2.0,1.0,4245.7255,0.0,39.0,1362.6213,722.1069,824.91,0.0,0.0,0.0,0.0,5936.67,400.0,0.0,1200,1632.0,14.0,13.857,Weekly,58.0,7703.82,2050.0,Part-Time Employment,14.0,0.0,0.0,0.0,7695.2233,1561.0,3398.7,116.57,MoneySpot,0.0,5115620,0.0,22-04-2023,False,Home Maintenance & Repairs,2023-04-22,Orange,0.0,4687.0,7703.82
0062x00000DFDg6AAH,0012x00000gAVd9AAG,Craigieburn,VIC,Australia,Loan Paid,Existing Client-No Loan Granted Ever,28.73,67.8,91.1666,1.0,0.0,2.0,4.0,1.0,6307.8082,0.0,6.0,0.0,954.05,1262.5,0.0,0.12,0.0,0.0,0.0,599.0,420.0,1200,1584.0,10.0,10.0,Weekly,37.0,11355.89,2050.0,Full-Time Employment,1.0,0.0,0.0,0.0,5170.6133,147.0,264.0833,158.4,MoneySpot,0.0,4656063,0.0,11-02-2023,False,Travel Expenses,2023-02-10,Green,1990.0,6926.0,11355.89
0062x00000F3zxuAAB,0012x00000goTgkAAE,Mooroolbark,VIC,Australia,Closed Lost,Existing Client-No Loan Granted Ever,0.0,68.42,349.1466,1.0,0.0,0.0,5.0,1.0,6187.167,0.0,0.0,0.0,947.063,1014.0,0.0,29.5,0.0,0.0,0.0,400.0,400.0,1200,1680.0,21.0,21.429,Weekly,32.0,7184.67,2050.0,Full-Time Employment,0.0,0.0,0.0,0.0,4103.94,243.0,592.48,80.0,MoneySpot,,7097493,0.0,07-11-2023,False,Living Expenses,2023-11-06,Green,0.0,9013.0,7184.67
0062x00000DVuOMAA1,0012x00000iHnaCAAS,Parilla,SA,Australia,Closed Lost,New Client-New Loan,0.0,59.75,0.0,2.0,0.0,0.0,3.0,2.0,3996.2188,0.0,15.0,0.0,1766.3257,1555.81,0.0,12.25,0.0,0.0,0.0,0.0,360.0,1200,1632.0,8.0,15.714,Fortnightly,52.0,4067.89,5000.0,Full-time,0.0,0.0,0.0549,0.0,4121.4266,0.0,0.0,204.0,MoneySpot,,5485519,0.0,03-06-2023,False,Other,2023-06-02,Green,0.0,4573.0,4067.89
0062x00000D9uarAAB,0010K00001zVtBLQA0,Hamilton,VIC,Australia,Loan Paid,Existing Client-Granted Loan Before,47.83,44.51,126.6666,1.0,0.0,2.0,3.0,1.0,4293.0466,0.0,40.0,570.3125,532.753,553.64,1.0,0.71,0.0,0.0,2383.33,599.0,210.0,1500,2040.0,14.0,14.0,Weekly,35.0,4822.13,1500.0,Unemployed,0.0,0.0,0.0,0.0,3355.1866,695.0,1902.11,145.71,Financier-2,0.0,4603849,0.0,02-02-2023,False,Living Expenses,2023-02-02,Green,2480.0,5185.0,4822.13
0062x00000DrrkLAAR,0012x00000SFgDcAAL,Christies Beach,SA,Australia,Loan Paid,Existing Client-Granted Loan Before,0.0,56.37,5249.0889,2.0,0.0,0.0,3.0,2.0,8239.1906,0.0,61.0,1463.5486,3792.2857,3506.0,1.0,0.17,0.0,0.0,7019.94,1499.0,600.0,1200,1632.0,7.0,13.857,Fortnightly,43.0,8239.19,2050.0,Full-Time Employment,0.0,0.0,0.0,0.0,8848.6666,1894.0,5979.2466,233.14,MoneySpot,0.0,5199841,0.0,05-05-2023,False,Life Event Expenses,2023-05-05,Orange,0.0,9743.0,8239.19
0062x00000E7ULEAA3,0012x00000iKopjAAC,Kilmore,VIC,Australia,Closed Lost,New Client-New Loan,0.0,52.77,1475.8777,2.0,0.0,0.0,3.0,2.0,6349.1113,0.0,12.0,0.0,1744.5114,1829.02,0.0,0.02,0.0,0.0,0.0,0.0,1000.0,1200,1632.0,8.0,15.286,Fortnightly,41.0,6663.7,10000.0,,0.0,0.0,0.0,0.0,5787.03,0.0,1474.0533,204.0,MoneySpot,,5824697,0.0,07-07-2023,False,Other,2023-07-04,Green,0.0,10519.0,6663.7
0062x00000FIXXRAA5,0012x00000mI5dVAAS,Midway Point,TAS,Australia,Closed Lost,New Client-New Loan,0.0,80.32,1464.9053,2.0,1.0,0.0,3.0,2.0,3920.103,18.0,29.0,0.0,1804.3214,1821.15,0.0,59.89,0.0,0.0,1800.0,2000.0,400.0,1200,1680.0,11.0,21.429,Fortnightly,46.0,5831.27,2000.0,Full-Time Employment,18.0,0.0,0.0,0.0,4210.0833,0.0,2635.8766,152.73,QuickCash,,7257533,12.0,20-11-2023,False,Living Expenses,2023-11-19,Green,0.0,8983.0,5831.27
0062x00000D9wBwAAJ,0012x00000g803wAAA,Banksia Grove,WA,Australia,Loan Paid,Existing Client-No Loan Granted Ever,29.24,80.87,3594.2971,2.0,0.0,2.0,4.0,2.0,6666.6721,2.0,50.0,541.7052,1947.8171,1653.54,1.0,0.0,0.0,0.0,3184.63,599.0,1600.0,1200,1632.0,7.0,14.0,Fortnightly,27.0,6536.66,3000.0,Full-Time Employment,2.0,0.0,0.0659,0.0,6786.2666,582.0,3629.66,233.14,MoneySpot,0.0,4604764,1.0,03-02-2023,False,Travel Expenses,2023-02-02,Orange,2347.0,8024.0,6536.66
0062x00000F1d4uAAB,0012x00000XEBmgAAH,Blacktown,VIC,Australia,Closed Lost,Existing Client-No Loan Granted Ever,0.0,71.0,0.0,1.0,0.0,0.0,4.0,1.0,4471.25,1.0,1.0,0.0,1029.0,1329.0,0.0,3.92,0.0,0.0,2708.33,599.0,200.0,1200,1680.0,20.0,19.857,Weekly,46.0,4567.92,2050.0,Contract Employment,1.0,0.0,0.0,0.0,4459.0,0.0,33.3333,84.0,MoneySpot,,6908945,0.0,21-10-2023,False,Home Maintenance & Repairs,2023-10-21,Green,0.0,5022.0,4567.92
0062x00000DFxb5AAD,0012x00000dc5IkAAI,Marcoola,QLD,Australia,Loan Paid,Existing Client-Granted Loan Before,0.0,76.23,784.98,2.0,0.0,0.0,3.0,2.0,6592.422,0.0,5.0,0.0,2110.7433,2233.91,0.0,0.0,0.0,0.0,0.0,899.0,1240.0,1050,1428.0,7.0,13.0,Fortnightly,33.0,6653.09,1050.0,,0.0,0.0,0.0549,0.0,4221.4866,340.0,1069.9766,204.0,MoneySpot,0.0,4695626,0.0,16-02-2023,False,Travel Expenses,2023-02-16,Green,0.0,6514.0,6653.09
0062x00000E3c6XAAR,0012x00000iHwXzAAK,Sandy Bay,TAS,Australia,Closed Lost,New Client-New Loan,0.63,65.86,3004.4909,2.0,0.0,4.0,3.0,2.0,11332.3643,0.0,36.0,0.0,5185.5,5185.5,1.0,0.0,0.0,0.0,0.0,0.0,2600.0,1200,1584.0,5.0,10.429,Fortnightly,42.0,11332.36,3000.0,,0.0,0.0,0.9011,0.0,10437.25,0.0,2881.88,316.8,MoneySpot,,5502956,0.0,05-06-2023,False,Presents,2023-06-04,Green,66.0,10459.0,11332.36
0062x00000DIud7AAD,0012x00000bnHXVAA2,WELLARD,WA,Australia,Closed Lost,Existing Client-No Loan Granted Ever,0.0,61.26,2434.6032,3.0,0.0,0.0,2.0,3.0,13493.3999,0.0,18.0,1376.0,7576.2033,7258.33,3.0,0.04,1.0,0.0,8100.0,0.0,1200.0,1200,1536.0,6.0,6.571,Weekly,33.0,13494.4,1200.0,Full-Time Employment,0.0,0.0,0.2418,0.0,7576.2033,1673.0,6169.0833,256.0,QuickCash,,4861700,0.0,14-03-2023,False,Other,2023-03-14,Orange,0.0,18393.0,13494.4
0062x00000D9RznAAF,0012x00000SIRPSAA5,Blacktown,SA,Australia,Loan Paid,Existing Client-Granted Loan Before,0.27,58.87,370.7031,2.0,0.0,2.0,4.0,2.0,2525.4197,3.0,16.0,0.0,1155.9383,1165.95,0.0,14.61,0.0,0.0,1473333.33,599.0,300.0,1200,1632.0,7.0,14.571,Fortnightly,28.0,4476.51,2050.0,Full-Time Employment,3.0,0.0,0.967,0.0,2326.92,0.0,354.5833,233.14,MoneySpot,0.0,4582624,1.0,30-01-2023,False,Life Event Expenses,2023-01-30,Green,15.0,5470.0,4476.51
0062x00000DFE8AAAX,0012x00000XDQVVAA5,Gretna,TAS,Australia,Loan Paid,Existing Client-Granted Loan Before,2.57,39.98,606.465,1.0,0.0,2.0,3.0,1.0,5975.9733,5.0,51.0,390.1497,978.75,1058.5,1.0,0.26,0.0,0.0,5209.15,400.0,0.0,1500,2340.0,18.0,34.857,Fortnightly,39.0,6290.57,1500.0,Full-Time Employment,5.0,0.0,0.0659,0.0,4734.43,628.0,838.07,130.0,Financier-2,0.0,4656368,4.0,10-02-2023,False,Vehicle Expenses,2023-02-10,Green,167.0,6473.0,6290.57
0062x00000DrxB8AAJ,0012x00000hYYa2AAG,Pegs Creek,WA,Australia,Loan Paid,Existing Client-No Loan Granted Ever,0.0,62.34,2727.0043,2.0,0.0,0.0,4.0,2.0,6769.8241,3.0,13.0,0.0,1781.18,1826.77,0.0,0.71,0.0,0.0,0.0,599.0,100.0,1200,1632.0,8.0,15.857,Fortnightly,42.0,6769.82,5000.0,,3.0,0.0,0.044,3.0,4156.0866,0.0,2642.5633,204.0,MoneySpot,0.0,5208555,0.0,07-05-2023,False,Home Maintenance & Repairs,2023-05-07,Green,0.0,8441.0,6769.82
0062x00000D79O6AAJ,0012x00000g9pzkAAA,DARTBROOK,NSW,Australia,Closed Lost,New Client-New Loan,0.0,25.18,2891.7996,2.0,0.0,0.0,2.0,2.0,6532.2984,0.0,35.0,952.3944,2224.0666,2314.49,0.0,0.56,0.0,0.0,0.0,0.0,0.0,1200,1536.0,3.0,6.143,Fortnightly,44.0,6532.3,2000.0,,0.0,0.0,0.0,0.0,4448.1333,1919.0,2709.3133,512.0,MoneySpot,,4469871,0.0,13-01-2023,False,Event - Funeral - Accommodation,2023-01-12,Green,0.0,6549.0,6532.3
0062x00000E3ew1AAB,0012x00000iHyTKAA0,Mildura,VIC,Australia,Closed Lost,New Client-New Loan,0.0,75.89,158.7967,1.0,0.0,0.0,2.0,1.0,4491.69,0.0,19.0,0.0,886.0321,1036.91,0.0,0.0,0.0,0.0,0.0,0.0,540.0,1200,1920.0,39.0,39.286,Weekly,32.0,4491.69,10000.0,Full-time,0.0,0.0,0.011,0.0,4134.8166,0.0,170.5433,49.23,MoneySpot,,5506209,0.0,11-06-2023,False,"Living, utilities, bills",2023-06-05,Green,0.0,4902.0,4491.69
0062x00000FJJahAAH,0012x00000khHqfAAE,Dandenong,VIC,Australia,Closed Lost,Existing Client-No Loan Granted Ever,0.0,23.4,1123.2691,1.0,0.0,0.0,3.0,1.0,7909.5773,0.0,16.0,0.0,1820.2869,1998.25,1.0,0.1,0.0,0.0,0.0,1499.0,3000.0,1200,1632.0,16.0,15.714,Weekly,62.0,7968.91,5000.0,Full-Time Employment,0.0,0.0,0.1758,0.0,7887.91,0.0,942.3933,102.0,MoneySpot,,7314891,0.0,30-11-2023,False,Travel Expenses,2023-11-25,Green,0.0,9272.0,7968.91
0062x00000D9MThAAN,0012x00000OwSQ7AAN,Blacktown,QLD,Australia,Loan Paid,Existing Client-Granted Loan Before,0.0,36.29,0.0,1.0,0.0,0.0,1.0,1.0,2273.8339,0.0,11.0,0.0,520.2791,508.86,0.0,3.96,0.0,0.0,4331.51,599.0,880.0,1200,1632.0,14.0,14.143,Weekly,43.0,2704.63,2050.0,Casual Employment,0.0,0.0,0.2198,0.0,2081.1166,0.0,63.7333,116.57,MoneySpot,0.0,4578901,0.0,30-01-2023,False,Living Expenses,2023-01-30,Green,0.0,3084.0,2704.63
0062x00000DtCZkAAN,0012x00000hZxR4AAK,Redbank Plains,QLD,Australia,Closed Lost,New Client-New Loan,0.0,19.49,3961.4631,1.0,0.0,0.0,2.0,1.0,4927.2948,4.0,34.0,0.0,1133.9528,971.91,0.0,0.0,0.0,0.0,5200.0,400.0,1390.0,1200,1872.0,39.0,39.0,Weekly,37.0,10730.37,10000.0,Contract Employment,4.0,0.0,0.0,1.0,10728.1633,0.0,5106.9266,48.0,MoneySpot,,5296326,0.0,17-05-2023,False,Living Expenses,2023-05-16,Green,0.0,5326.0,10730.37
0062x00000ED5GoAAL,0012x00000kZwpkAAC,Woonona,NSW,Australia,Closed Lost,New Client-New Loan,0.0,16.1,2118.3884,2.0,0.0,0.0,2.0,2.0,2820.9025,3.0,61.0,0.0,1298.388,1402.47,0.0,0.03,0.0,0.0,0.0,0.0,2600.0,1200,1632.0,14.0,13.714,Weekly,41.0,17248.21,2000.0,,3.0,0.0,0.1648,1.0,2163.98,0.0,2803.17,116.57,MoneySpot,,5918580,0.0,15-07-2023,False,Bill due,2023-07-14,Orange,0.0,16143.0,17248.21
0062x00000DH49sAAD,0012x00000OK8QrAAL,Ringwood,VIC,Australia,Closed Lost,Existing Client-No Loan Granted Ever,8.12,60.41,0.0,1.0,0.0,2.0,5.0,1.0,8764.4628,1.0,5.0,0.0,1068.0357,1118.98,0.0,55.83,0.0,0.0,4000.0,1499.0,500.0,1200,1536.0,6.0,5.857,Weekly,37.0,7300.43,1300.0,Part-Time Employment,1.0,0.0,0.0,0.0,6193.7,67.0,150.0566,256.0,MoneySpot,,4759593,0.0,01-03-2023,False,Other Expenses,2023-02-26,Green,1210.0,14885.0,7300.43
0062x00000E4O3BAAV,0012x00000iIQ2DAAW,Binalong,NSW,Australia,Loan Paid,New Client-New Loan,0.0,73.08,0.0,1.0,0.0,0.0,3.0,1.0,11359.5199,1.0,2.0,0.0,1269.125,1524.0,0.0,0.28,0.0,0.0,8116.33,400.0,400.0,1200,1776.0,30.0,29.714,Weekly,29.0,20132.53,5300.0,Full-Time Employment,1.0,0.0,0.011,0.0,6352.3333,0.0,35.0,59.2,MoneySpot,0.0,5566070,1.0,10-06-2023,False,Living Expenses,2023-06-10,Green,0.0,21328.0,20132.53
0062x00000DI7HkAAL,0012x00000gp1POAAY,Jordan Springs,NSW,Australia,Loan Paid,New Client-New Loan,0.0,57.94,731.9999,2.0,0.0,0.0,2.0,2.0,7638.9116,1.0,10.0,0.0,3515.9928,2696.2,0.0,0.0,0.0,0.0,0.0,0.0,2600.0,1200,1536.0,3.0,6.143,Fortnightly,52.0,7638.91,1500.0,,1.0,0.0,0.5165,1.0,8203.9833,732.0,1107.2,512.0,MoneySpot,0.0,4816885,0.0,07-03-2023,False,Holiday / Travel,2023-03-07,Green,0.0,8348.0,7638.91
0062x00000D7HUYAA3,0012x00000TuEOyAAN,Rural View,QLD,Australia,Loan Paid,Existing Client-Granted Loan Before,0.0,55.73,2718.3987,2.0,0.0,0.0,3.0,2.0,7565.5162,0.0,6.0,96.0,3482.2114,3725.53,1.0,0.0,0.0,0.0,1343.33,400.0,400.0,1200,1632.0,7.0,13.714,Fortnightly,34.0,7997.69,3000.0,Contract Employment,7.0,0.0,0.0,3.0,8125.16,26.0,3129.86,233.14,MoneySpot,0.0,4476007,0.0,14-01-2023,False,Life Event Expenses,2023-01-14,Green,0.0,8568.0,7997.69
0062x00000D9GWfAAN,0010K00002COOhvQAH,Blacktown,NSW,Australia,Loan Paid,Existing Client-Granted Loan Before,0.0,64.03,4814.273,1.0,0.0,0.0,3.0,1.0,26668.9432,9.0,0.0,2432.3529,3004.6536,3198.79,0.0,27.85,0.0,0.0,10833.33,1499.0,600.0,1050,1428.0,14.0,13.571,Weekly,39.0,29283.79,1050.0,Full-Time Employment,9.0,0.0,0.044,9.0,11017.0633,2717.0,5514.0066,102.0,Financier-2,0.0,4573858,9.0,29-01-2023,False,Travel Expenses,2023-01-28,Green,0.0,30659.0,29283.79
0062x00000EwAg2AAF,0012x00000kgVxqAAE,Hoppers Crossing,VIC,Australia,Closed Lost,Existing Client-No Loan Granted Ever,0.0,3.78,0.0,1.0,0.0,0.0,2.0,1.0,3660.1105,0.0,4.0,0.0,842.3269,748.5,0.0,0.0,0.0,0.0,0.0,400.0,250.0,1200,1728.0,25.0,25.286,Weekly,60.0,3660.11,3000.0,Part-Time Employment,0.0,0.0,0.0549,0.0,3650.0833,0.0,0.0,69.12,MoneySpot,,6566708,0.0,18-09-2023,False,Veterinary Expenses,2023-09-18,Green,0.0,3650.0,3660.11
0062x00000F4MAJAA3,0012x00000kaYoDAAU,Bligh Park,NSW,Australia,Loan Paid,Existing Client-No Loan Granted Ever,0.0,94.04,1363.8482,1.0,0.0,0.0,4.0,1.0,5340.7402,2.0,49.0,0.0,1132.0,1132.0,0.0,1.53,0.0,0.0,1130.0,2000.0,1360.0,1200,1680.0,19.0,19.143,Weekly,22.0,5340.74,2050.0,Full-Time Employment,2.0,0.0,0.011,0.0,4528.0,0.0,1426.2366,88.42,MoneySpot,0.0,7128905,1.0,09-11-2023,False,Vehicle Expenses,2023-11-09,Green,0.0,5411.0,5340.74
0062x00000E6eyOAAR,0012x00000iKN4VAAW,Bellmere,QLD,Australia,Closed Lost,Existing Client-No Loan Granted Ever,0.0,12.63,236.9762,1.0,0.0,0.0,3.0,1.0,4599.4388,0.0,22.0,0.0,907.175,722.02,0.0,0.0,0.0,0.0,0.0,0.0,0.0,1200,1680.0,20.0,20.143,Weekly,26.0,4599.44,2000.0,,0.0,0.0,0.0,0.0,4233.4833,0.0,231.4833,84.0,MoneySpot,,5757386,0.0,28-06-2023,False,Short Term Loan,2023-06-28,Green,0.0,4378.0,4599.44
0062x00000DACezAAH,0012x00000gn4nOAAQ,South Mackay,QLD,Australia,Closed Lost,Existing Client-No Loan Granted Ever,5.16,63.85,506.9424,1.0,0.0,0.0,3.0,1.0,3764.1544,6.0,26.0,0.0,747.2618,1229.89,0.0,0.0,0.0,0.0,850.0,0.0,600.0,1200,1584.0,11.0,10.714,Weekly,25.0,3901.67,4000.0,Casual Employment,6.0,0.0,0.0,3.0,2739.96,13.0,346.6666,144.0,MoneySpot,,4618363,1.0,04-02-2023,False,White goods,2023-02-04,Green,250.0,4843.0,3901.67
0062x00000DIIh6AAH,0012x00000fm4TRAAY,Kirwan,QLD,Australia,Loan Paid,Existing Client-Granted Loan Before,0.0,58.95,990.2498,2.0,0.0,0.0,3.0,2.0,4044.1041,0.0,16.0,0.0,1537.3016,1495.66,0.0,1.75,0.0,0.0,3671.78,1499.0,450.0,1500,1980.0,5.0,9.0,Fortnightly,31.0,4401.18,2050.0,Full-Time Employment,0.0,0.0,0.1429,0.0,3716.27,506.0,1986.0466,396.0,MoneySpot,0.0,4826169,0.0,09-03-2023,False,Vehicle Expenses,2023-03-08,Orange,0.0,4390.0,4401.18
0062x00000DYBUIAA5,0012x00000LRTDaAAP,Katherine,NT,Australia,Loan Paid,Existing Client-Granted Loan Before,0.0,57.49,0.0,2.0,0.0,0.0,3.0,2.0,3218.3454,0.0,6.0,0.0,1063.8616,828.42,0.0,0.0,0.0,0.0,2951.66,1499.0,900.0,1400,1792.0,4.0,6.857,Fortnightly,33.0,4264.65,1400.0,Full-Time Employment,0.0,0.0,0.0,0.0,2287.8033,132.0,132.0,448.0,MoneySpot,0.0,5017023,0.0,07-04-2023,False,Vehicle Expenses,2023-04-07,Green,0.0,4496.0,4264.65
0062x00000DA1eeAAD,0012x00000SFx5BAAT,Beenleigh,QLD,Australia,Loan Paid,Existing Client-Granted Loan Before,0.0,56.77,717.8333,4.0,0.0,0.0,3.0,4.0,1976.9999,0.0,34.0,0.0,582.1,774.0,1.0,0.25,0.0,1.0,3173.0,400.0,660.0,1500,2040.0,14.0,13.857,Weekly,23.0,2628.0,1500.0,Part-Time Employment,0.0,0.0,0.4066,0.0,0.0,485.0,534.5333,145.71,MoneySpot,0.0,4609395,0.0,03-02-2023,False,Life Event Expenses,2023-02-03,Green,0.0,2780.0,2628.0
0062x00000DXDXcAAP,0010K00001ypiCHQAY,Mooloolaba,QLD,Australia,Closed Lost,Existing Client-No Loan Granted Ever,0.0,40.69,568.311,1.0,1.0,0.0,1.0,1.0,4527.9879,3.0,12.0,0.0,833.4,833.4,0.0,0.73,0.0,0.0,2734.33,1499.0,100.0,1200,1536.0,6.0,5.714,Weekly,45.0,5361.39,2000.0,Full-Time Employment,3.0,0.0,0.2527,1.0,833.4,0.0,652.7,256.0,MoneySpot,,4961159,2.0,30-03-2023,False,Travel Expenses,2023-03-29,Green,0.0,6813.0,5361.39
0062x00000EwjiyAAB,0012x00000MjlTnAAJ,Queens Park,WA,Australia,Closed Lost,Existing Client-Granted Loan Before,0.0,65.19,1125.8625,1.0,0.0,0.0,2.0,1.0,5156.9298,0.0,31.0,480.3661,1186.8007,1188.35,0.0,22.23,0.0,0.0,0.0,400.0,1000.0,1500,2100.0,18.0,17.714,Weekly,33.0,5156.93,1500.0,,0.0,0.0,0.0,0.0,5142.8033,1018.0,2414.0233,116.67,MoneySpot,,6610636,0.0,22-09-2023,False,Home Maintenance & Repairs,2023-09-22,Orange,0.0,5556.0,5156.93
0062x00000D8zJpAAJ,0012x00000TrQgJAAV,Ormiston,QLD,Australia,Loan Paid,Existing Client-No Loan Granted Ever,0.76,32.46,983.7154,1.0,0.0,0.0,3.0,1.0,5138.4449,0.0,16.0,0.0,929.8186,902.65,0.0,1.17,0.0,0.0,3617.13,599.0,250.0,1200,1536.0,6.0,5.857,Weekly,27.0,5124.85,2000.0,Full-Time Employment,0.0,0.0,0.0,0.0,4649.0933,0.0,1097.4133,256.0,MoneySpot,0.0,4559076,0.0,27-01-2023,False,Vehicle Expenses,2023-01-26,Green,44.0,5749.0,5124.85
0062x00000Dr71xAAB,0012x00000fn7M7AAI,WAUCHOPE,NSW,Australia,Loan Paid,Existing Client-Granted Loan Before,19.7,78.37,829.639,2.0,1.0,4.0,3.0,2.0,6272.9176,8.0,49.0,0.0,1428.225,1971.5,0.0,0.0,0.0,0.0,2383.33,599.0,220.0,1200,1584.0,7.0,13.0,Fortnightly,29.0,7348.72,2050.0,Part-Time Employment,8.0,0.0,0.1758,8.0,4314.5566,213.0,1866.9833,226.29,QuickCash,0.0,5147241,2.0,27-04-2023,False,Living Expenses,2023-04-27,Orange,1458.0,7399.0,7348.72
0062x00000FUhpqAAD,0012x00000n1WXWAA2,Gosnells,WA,Australia,Loan Paid,New Client-New Loan,0.0,20.65,1492.6735,1.0,0.0,0.0,4.0,1.0,5901.4994,0.0,22.0,0.0,1358.1538,1385.0,0.0,0.19,0.0,0.0,6001.67,400.0,1.0,1200,1632.0,15.0,14.857,Weekly,31.0,5901.5,1600.0,Full-Time Employment,0.0,0.0,0.2308,0.0,5885.3333,0.0,1811.26,108.8,QuickCash,0.0,7531825,0.0,16-12-2023,False,Living Expenses,2023-12-16,Green,0.0,6177.0,5901.5
0062x00000EyZsHAAV,0012x00000RqAzkAAF,Brigadoon,WA,Australia,Loan Paid,Existing Client-No Loan Granted Ever,0.0,80.76,3079.9367,1.0,0.0,0.0,2.0,1.0,10178.8294,6.0,53.0,177.5338,1785.5,2150.0,0.0,9.02,0.0,0.0,1339.0,899.0,250.0,1200,1680.0,18.0,17.857,Weekly,61.0,10552.83,2050.0,Unemployed,6.0,0.0,0.0879,0.0,7142.0,191.0,3419.1233,93.33,Financier-2,0.0,6747160,6.0,05-10-2023,False,Vehicle Expenses,2023-10-05,Green,0.0,14241.0,10552.83
0062x00000E5c0VAAR,0012x00000iJdZDAA0,Manunda,QLD,Australia,Loan Paid,New Client-New Loan,0.0,59.5,0.0,2.0,0.0,0.0,3.0,2.0,5321.9376,0.0,19.0,0.0,2311.4685,1912.27,0.0,8.58,0.0,0.0,0.0,0.0,600.0,1200,1632.0,8.0,15.286,Fortnightly,29.0,5513.6,2000.0,,0.0,0.0,0.6154,0.0,5393.4266,0.0,0.0,204.0,MoneySpot,0.0,5665623,0.0,20-06-2023,False,Presents,2023-06-20,Green,0.0,6012.0,5513.6
0062x00000EM6hCAAT,0012x00000ZwfUNAAZ,Blacktown,NSW,Australia,Closed Lost,Existing Client-No Loan Granted Ever,0.0,73.43,149.9085,2.0,0.0,0.0,5.0,2.0,3088.1859,4.0,6.0,0.0,1421.4128,1202.69,0.0,0.0,0.0,0.0,0.0,400.0,1400.0,1200,1776.0,14.0,27.429,Fortnightly,52.0,3088.19,2050.0,,5.0,0.0,0.2637,3.0,3316.63,0.0,84.5,126.86,MoneySpot,,6081938,1.0,02-08-2023,False,Vehicle Expenses,2023-08-01,Green,0.0,3333.0,3088.19
0062x00000E4ZCIAA3,0012x00000iIXoZAAW,Orange,NSW,Australia,Closed Lost,New Client-New Loan,0.15,27.64,1397.1032,2.0,0.0,0.0,3.0,2.0,6835.5445,7.0,5.0,11.646,2812.5871,2590.18,0.0,0.0,0.0,1.0,7366.67,1500.0,1320.0,1200,1920.0,20.0,39.429,Fortnightly,33.0,10887.36,10000.0,Full-Time Employment,7.0,0.0,0.044,0.0,4051.8166,11.0,3435.51,96.0,MoneySpot,,5582191,3.0,12-06-2023,False,Living Expenses,2023-06-12,Green,13.0,8201.0,10887.36
0062x00000DWFz6AAH,0012x00000gAEyhAAG,Nanango,QLD,Australia,Loan Paid,Existing Client-Granted Loan Before,0.0,87.54,8110.0046,1.0,0.0,0.0,2.0,1.0,9315.142,17.0,105.0,729.8262,2016.4833,2299.62,1.0,0.0,0.0,1.0,0.0,899.0,1320.0,1150,1518.0,10.0,10.143,Weekly,58.0,17566.06,5000.0,,17.0,0.0,0.7253,7.0,0.0,1159.0,7725.22,151.8,MoneySpot,0.0,4905883,13.0,21-03-2023,False,Medical Expenses,2023-03-21,Green,0.0,9662.0,17566.06
0062x00000EyySoAAJ,0012x00000lg3ubAAA,Kirwan,QLD,Australia,Closed Lost,New Client-New Loan,0.0,32.94,282.44,4.0,0.0,0.0,4.0,4.0,5218.3032,0.0,13.0,0.0,2197.1285,2435.65,0.0,1.42,0.0,0.0,2200.0,2000.0,460.0,1200,1632.0,8.0,15.714,Fortnightly,27.0,6291.64,1200.0,Full-Time Employment,0.0,0.0,0.1429,0.0,5126.6333,0.0,316.6666,204.0,QuickCash,,6776172,0.0,12-10-2023,False,Living Expenses,2023-10-08,Orange,0.0,7183.0,6291.64
0062x00000ECAKPAA5,0012x00000gAErzAAG,Blacktown,NSW,Australia,Loan Paid,Existing Client-Granted Loan Before,0.0,53.71,621.6284,2.0,0.0,0.0,3.0,2.0,10701.2994,0.0,9.0,0.0,4819.6666,4690.0,1.0,41.04,0.0,0.0,10200.0,1500.0,1300.0,1500,2040.0,7.0,14.857,Fortnightly,67.0,10701.3,1500.0,Full-Time Employment,0.0,0.0,0.1538,0.0,9639.3333,32.0,911.8866,291.43,QuickCash,0.0,5857535,0.0,10-07-2023,False,Furniture or Appliances,2023-07-09,Orange,0.0,10003.0,10701.3
0062x00000D7QLxAAN,0012x00000TreaXAAR,Kensington,NSW,Australia,Loan Paid,Existing Client-Granted Loan Before,0.0,39.56,146.5627,1.0,0.0,0.0,3.0,1.0,6296.2712,0.0,7.0,0.0,1449.0053,1406.25,1.0,0.0,0.0,0.0,5456.66,899.0,2200.0,1200,1632.0,14.0,13.571,Weekly,45.0,6296.27,1500.0,Full-Time Employment,0.0,0.0,0.0,0.0,6279.0233,0.0,184.9266,116.57,QuickCash,0.0,4483329,0.0,15-01-2023,False,Living Expenses,2023-01-15,Green,0.0,6579.0,6296.27
0062x00000DAw7QAAT,0012x00000dxwSfAAI,Geelong West,VIC,Australia,Loan Paid,Existing Client-Granted Loan Before,22.37,46.52,326.3737,1.0,2.0,0.0,3.0,1.0,2885.915,9.0,24.0,0.0,664.156,378.86,4.0,0.0,0.0,0.0,1467.92,599.0,700.0,1200,1632.0,14.0,13.857,Weekly,29.0,4254.46,1200.0,Casual Employment,9.0,0.0,0.1868,1.0,2213.8533,315.0,347.39,116.57,Financier-2,0.0,4652008,5.0,10-02-2023,False,Furniture or Appliances,2023-02-09,Green,718.0,3209.0,4254.46
0062x00000DrzwIAAR,0012x00000XCgO5AAL,Box Hill North,VIC,Australia,Closed Lost,Existing Client-No Loan Granted Ever,0.0,24.15,2442.615,1.0,0.0,0.0,3.0,1.0,4826.1151,0.0,17.0,0.0,1110.6676,1130.68,0.0,0.35,0.0,0.0,4116.67,400.0,337.0,1200,1632.0,15.0,15.571,Weekly,27.0,5019.78,4600.0,Contract Employment,0.0,0.0,0.0,0.0,4812.8933,64.0,1571.4833,108.8,MoneySpot,,5212192,0.0,08-05-2023,False,Car,2023-05-06,Green,0.0,6496.0,5019.78
0062x00000D2OsYAAV,0010K0000240EiMQAU,Riverwood,NSW,Australia,Loan Paid,Existing Client-Granted Loan Before,0.0,99.85,0.0,4.0,1.0,0.0,4.0,4.0,1780.0,0.0,9.0,215.552,1068.0,3010.0,0.0,8.99,0.0,1.0,2600.0,599.0,500.0,1500,1980.0,10.0,10.571,Weekly,26.0,5535.71,2000.0,Full-Time Employment,1.0,0.0,0.2418,0.0,3755.7133,767.0,767.2,198.0,QuickCash,0.0,4443726,1.0,09-01-2023,False,Vehicle Expenses,2023-01-09,Orange,0.0,4817.0,5535.71
0062x00000DVg8NAAT,0012x00000g8C0mAAE,Labrador,QLD,Australia,Loan Paid,Existing Client-No Loan Granted Ever,9.18,93.56,1205.4417,1.0,1.0,0.0,4.0,1.0,5985.2717,2.0,31.0,0.0,863.46,863.46,0.0,0.0,0.0,0.0,3744.0,400.0,170.0,1200,1632.0,16.0,16.143,Weekly,31.0,7751.94,2050.0,Full-Time Employment,2.0,0.0,0.0989,1.0,4029.48,1183.0,1183.1333,102.0,MoneySpot,0.0,5465982,2.0,01-06-2023,False,Vehicle Expenses,2023-06-01,Green,1667.0,18153.0,7751.94
0062x00000D2HarAAF,0012x00000d9JVGAA2,Newman,WA,Australia,Loan Paid,Existing Client-Granted Loan Before,0.0,70.04,1510.8899,2.0,0.0,0.0,3.0,2.0,5196.342,1.0,32.0,1381.0476,1986.8542,1939.0,0.0,0.0,0.0,0.0,6901.42,599.0,200.0,1400,1848.0,5.0,9.571,Fortnightly,36.0,5196.34,2000.0,Full-Time Employment,1.0,0.0,0.1209,0.0,4635.9933,1198.0,1661.1066,369.6,MoneySpot,0.0,4437510,0.0,08-01-2023,False,Travel Expenses,2023-01-08,Orange,0.0,6691.0,5196.34
0062x00000D8a5cAAB,0012x00000INvieAAD,Bonner,ACT,Australia,Loan Paid,Existing Client-No Loan Granted Ever,0.27,74.89,1202.1508,2.0,1.0,0.0,4.0,2.0,4796.7058,7.0,0.0,1193.1078,1785.0614,1693.25,0.0,0.0,0.0,0.0,1578.0,599.0,2200.0,1200,1728.0,12.0,23.429,Fortnightly,33.0,4823.37,5000.0,Full-Time Employment,7.0,0.0,0.022,4.0,4165.1433,375.0,2983.3333,144.0,MoneySpot,0.0,4540188,4.0,24-01-2023,False,Medical Expenses,2023-01-24,Orange,27.0,9924.0,4823.37
0062x00000DIajCAAT,0012x00000g8Y7DAAU,Glenelg North,SA,Australia,Loan Paid,Existing Client-Granted Loan Before,0.0,6.66,1651.9075,0.0,0.0,0.0,0.0,0.0,0.0,0.0,0.0,0.0,0.0,0.0,0.0,0.0,0.0,0.0,4550.0,1499.0,0.0,1500,1980.0,5.0,9.714,Fortnightly,67.0,4871.82,1500.0,Full-Time Employment,3.0,0.0,0.0,0.0,5232.2033,303.0,1692.4433,396.0,QuickCash,0.0,4842396,2.0,11-03-2023,False,Medical Expenses,2023-03-11,Orange,0.0,17018.0,4871.82
0062x00000DWX5jAAH,0012x00000RrafeAAB,Wentworthville,NSW,Australia,Closed Lost,Existing Client-No Loan Granted Ever,0.0,6.0,1809.8332,4.0,0.0,0.0,2.0,4.0,10017.14,0.0,40.0,0.0,7512.855,9377.33,1.0,0.12,0.0,0.0,4892.67,899.0,1800.0,1200,1536.0,2.0,7.571,Monthly,36.0,10022.14,1500.0,Full-Time Employment,0.0,0.0,0.0769,0.0,10017.14,0.0,3993.7233,768.0,QuickCash,,4920811,0.0,26-03-2023,False,Furniture or Appliances,2023-03-23,Orange,0.0,10185.0,10022.14
0062x00000DZQ5DAAX,0012x00000gqeSvAAI,Cartwright,NSW,Australia,Loan Paid,Existing Client-No Loan Granted Ever,0.0,23.66,880.4104,2.0,0.0,0.0,3.0,2.0,8208.9871,0.0,3.0,0.0,2623.71,2730.1,1.0,0.06,0.0,0.0,0.0,400.0,0.0,1200,1536.0,3.0,6.143,Fortnightly,29.0,8370.82,2000.0,Full-Time Employment,0.0,0.0,0.0,0.0,5247.42,82.0,1175.95,512.0,MoneySpot,0.0,5092329,0.0,19-04-2023,False,Travel Expenses,2023-04-19,Green,0.0,12222.0,8370.82
0062x00000FHqzvAAD,0012x00000TH8NxAAL,Northam,WA,Australia,Closed Lost,Existing Client-No Loan Granted Ever,0.0,51.76,2154.2424,1.0,0.0,0.0,5.0,1.0,4818.5512,0.0,21.0,0.0,1075.5576,1154.5,1.0,0.0,0.0,0.0,4238.0,400.0,100.0,1200,1680.0,19.0,19.429,Weekly,39.0,5051.88,2050.0,Full-Time Employment,0.0,0.0,0.2967,0.0,4660.75,0.0,2087.8033,88.42,MoneySpot,,7206139,0.0,19-11-2023,False,Vehicle Expenses,2023-11-14,Green,0.0,5392.0,5051.88
0062x00000DZfMGAA1,0010K00001u0lteQAA,Nundah,QLD,Australia,Loan Paid,Existing Client-Granted Loan Before,46.17,86.97,1235.8605,1.0,0.0,4.0,1.0,1.0,3445.4126,17.0,45.0,280.7893,364.8923,627.4,0.0,0.0,0.0,1.0,1999.83,400.0,480.0,1100,1408.0,6.0,5.571,Weekly,35.0,3445.41,2050.0,Unemployed,17.0,0.0,0.1758,6.0,1643.7233,486.0,1668.1866,234.67,QuickCash,0.0,5106416,10.0,21-04-2023,False,Living Expenses,2023-04-20,Green,1644.0,3560.0,3445.41
0062x00000FJoOcAAL,0012x00000mJgnHAAS,Gateshead,NSW,Australia,Loan Paid,Existing Client-No Loan Granted Ever,0.0,57.12,0.0,1.0,1.0,0.0,2.0,1.0,6004.9341,11.0,11.0,0.0,1146.9242,1084.84,0.0,0.0,0.0,0.0,5200.0,400.0,150.0,1200,1632.0,16.0,16.0,Weekly,37.0,6004.93,4000.0,Full-Time Employment,11.0,0.0,0.0,0.0,5352.3133,0.0,826.4633,102.0,Financier-2,0.0,7348732,9.0,29-11-2023,False,Vehicle Expenses,2023-11-29,Green,0.0,5598.0,6004.93
0062x00000E6mX6AAJ,0012x00000iKRA5AAO,Kilsyth,VIC,Australia,Closed Lost,New Client-New Loan,0.0,54.26,0.0,2.0,0.0,0.0,3.0,2.0,9834.1514,0.0,18.0,0.0,1663.1,1706.76,0.0,2.31,0.0,0.0,4333.33,400.0,600.0,1200,1584.0,6.0,12.0,Fortnightly,34.0,9834.15,2050.0,Full-Time Employment,0.0,0.0,0.0,0.0,8295.09,0.0,130.0,264.0,QuickCash,,5768847,0.0,29-06-2023,False,Life Event Expenses,2023-06-29,Green,0.0,17330.0,9834.15
0062x00000F00XZAAZ,0012x00000iJMYaAAO,Somerville,WA,Australia,Loan Paid,Existing Client-Granted Loan Before,0.0,36.52,4649.7499,3.0,0.0,0.0,4.0,3.0,9153.2033,0.0,20.0,0.0,8599.87,8599.87,0.0,2.35,0.0,0.0,0.0,599.0,1768.0,1500,1980.0,3.0,13.0,Monthly,53.0,9189.85,1500.0,Full-Time Employment,0.0,0.0,0.0,0.0,8599.87,496.0,6532.8933,660.0,QuickCash,0.0,6849936,0.0,16-10-2023,False,Veterinary Expenses,2023-10-16,Green,0.0,9538.0,9189.85
0062x00000DGKOUAA5,0012x00000go5DtAAI,Evatt,ACT,Australia,Closed Lost,New Client-New Loan,0.0,18.9,2320.754,2.0,0.0,0.0,4.0,2.0,6912.3397,0.0,0.0,16.1029,2048.0014,1779.37,0.0,3.8,0.0,0.0,4983.33,1500.0,100.0,1200,1920.0,20.0,39.571,Fortnightly,50.0,7595.67,10200.0,Full-Time Employment,0.0,0.0,0.0,0.0,4778.67,12.0,2278.01,96.0,MoneySpot,,4717613,0.0,24-02-2023,False,Living Expenses,2023-02-19,Green,0.0,8107.0,7595.67
0062x00000D80tDAAR,0012x00000VdvHvAAJ,Southport,QLD,Australia,Loan Paid,Existing Client-Granted Loan Before,0.0,87.83,7841.6433,1.0,0.0,0.0,2.0,1.0,13299.1375,1.0,114.0,1599.2363,1127.31,1127.31,0.0,0.0,0.0,0.0,4883.67,899.0,880.0,1200,1632.0,14.0,13.857,Weekly,40.0,13299.14,1500.0,Full-Time Employment,1.0,0.0,0.1538,0.0,4885.01,2155.0,7949.7666,116.57,Financier-2,0.0,4510146,1.0,19-01-2023,False,Living Expenses,2023-01-19,Green,0.0,13286.0,13299.14
0062x00000Du04cAAB,0012x00000RppwmAAB,Latrobe,TAS,Australia,Loan Paid,Existing Client-Granted Loan Before,26.64,98.79,59.23,0.0,0.0,2.0,1.0,2.0,1266.9988,0.0,17.0,979.8693,583.1666,627.59,0.0,0.09,0.0,0.0,15.19,899.0,600.0,1500,2040.0,7.0,13.429,Fortnightly,35.0,4128.29,2100.0,Full-Time Employment,0.0,0.0,0.011,0.0,1166.3333,1225.0,1317.53,291.43,MoneySpot,0.0,5364472,0.0,23-05-2023,True,Living Expenses,2023-05-23,Orange,1403.0,5266.0,4128.29
0062x00000DA10yAAD,0012x00000THKnlAAH,Leppington,NSW,Australia,Loan Paid,Existing Client-Granted Loan Before,0.0,59.47,322.8666,1.0,0.0,0.0,2.0,1.0,2629.2599,0.0,25.0,669.1667,516.1041,968.53,0.0,1.09,0.0,0.0,2134.37,599.0,0.0,1300,1768.0,14.0,13.714,Weekly,24.0,2629.26,1300.0,Part-Time Employment,0.0,0.0,0.0989,0.0,2064.4166,264.0,357.5333,126.29,MoneySpot,0.0,4608946,0.0,03-02-2023,False,Home Maintenance & Repairs,2023-02-03,Green,0.0,4323.0,2629.26
0062x00000DIalmAAD,0012x00000Rs0NkAAJ,Auburn,NSW,Australia,Loan Paid,Existing Client-Granted Loan Before,0.0,96.69,2282.3308,1.0,0.0,0.0,3.0,1.0,7330.8088,0.0,58.0,342.3506,1220.3957,2099.52,1.0,0.0,0.0,0.0,600.0,400.0,550.0,1500,1980.0,12.0,11.714,Weekly,22.0,8608.73,1500.0,Casual Employment,0.0,0.0,0.989,0.0,5695.18,805.0,2722.3066,165.0,Financier-2,0.0,4842218,0.0,11-03-2023,False,Medical Expenses,2023-03-10,Orange,0.0,8267.0,8608.73
0062x00000DIoGpAAL,0012x000003fzXaAAI,Mirani,QLD,Australia,Loan Paid,Existing Client-No Loan Granted Ever,0.0,67.32,0.0,3.0,0.0,0.0,2.0,3.0,24638.6866,0.0,4.0,0.0,24638.6866,25036.9,0.0,0.0,0.0,0.0,79124.54,1499.0,2400.0,1200,1536.0,2.0,6.857,Monthly,41.0,24638.69,2500.0,Full-Time Employment,0.0,0.0,0.0,0.0,24638.6866,220.0,717.8633,768.0,MoneySpot,0.0,4856001,0.0,14-03-2023,False,Furniture or Appliances,2023-03-14,Orange,0.0,25845.0,24638.69
0062x00000Ed4HTAAZ,0012x00000hZ1n7AAC,Mermaid Waters,QLD,Australia,Closed Lost,Existing Client-Granted Loan Before,0.0,37.71,96.5566,2.0,1.0,0.0,2.0,2.0,2704.8791,3.0,10.0,0.0,856.0,920.0,0.0,0.0,0.0,0.0,6933.33,1499.0,2800.0,1050,1596.0,18.0,34.714,Fortnightly,35.0,3921.4,1750.0,Self Employed,9.0,0.0,0.022,1.0,2473.3333,152.0,1127.7633,88.67,MoneySpot,,6394150,1.0,01-09-2023,False,Other Expenses,2023-09-01,Green,0.0,6745.0,3921.4
0062x00000DrvnxAAB,0012x00000hZ7xZAAS,Wiley Park,NSW,Australia,Loan Paid,New Client-New Loan,0.0,50.07,1083.3808,1.0,0.0,0.0,2.0,1.0,4681.108,7.0,34.0,169.5946,1052.3646,1363.32,1.0,1.61,0.0,0.0,5200.0,400.0,1100.0,1200,1584.0,9.0,9.571,Weekly,29.0,4694.11,2100.0,Full-Time Employment,7.0,0.0,0.0549,0.0,4560.2466,169.0,1089.5833,176.0,MoneySpot,0.0,5205452,3.0,06-05-2023,False,Living Expenses,2023-05-06,Green,0.0,4772.0,4694.11
0062x00000D7BezAAF,0012x000002dMOgAAM,Hope Vale,QLD,Australia,Loan Paid,Existing Client-Granted Loan Before,0.0,48.38,4945.8454,4.0,1.0,0.0,3.0,4.0,10390.6699,23.0,85.0,2153.7025,2560.001,2917.24,1.0,5.74,0.0,0.0,4983.33,599.0,600.0,1400,1904.0,7.0,13.857,Fortnightly,53.0,10400.67,1400.0,Full-Time Employment,23.0,0.0,0.2527,7.0,8533.3366,2458.0,6473.0866,272.0,QuickCash,0.0,4471352,19.0,13-01-2023,False,Medical Expenses,2023-01-13,Green,0.0,12016.0,10400.67
0062x00000FJUzAAAX,0012x00000mJ7aUAAS,Woodridge,QLD,Australia,Closed Lost,New Client-New Loan,0.0,54.96,0.0,1.0,0.0,0.0,3.0,1.0,3178.5241,0.0,3.0,0.0,631.31,684.2,1.0,0.0,0.0,0.0,3466.67,400.0,1.0,1100,1672.0,34.0,34.429,Weekly,46.0,3178.52,40200.0,Full-Time Employment,0.0,0.0,0.0,0.0,2735.6766,0.0,129.44,49.18,MoneySpot,,7327594,0.0,01-12-2023,False,Living Expenses,2023-11-27,Green,0.0,3228.0,3178.52
0062x00000DHUXqAAP,0012x00000dblP1AAI,Schofields,NSW,Australia,Closed Lost,Existing Client-Granted Loan Before,0.0,29.18,3139.5198,4.0,0.0,0.0,1.0,4.0,1347.74,2.0,10.0,778.4017,1347.74,1496.78,0.0,0.0,0.0,1.0,9100.0,599.0,2247.0,1500,2040.0,4.0,16.714,Monthly,39.0,1347.74,1500.0,Full-Time Employment,2.0,0.0,0.1978,0.0,0.0,529.0,5084.6066,510.0,MoneySpot,,4781464,3.0,02-03-2023,False,Living Expenses,2023-03-01,Orange,0.0,10883.0,1347.74
0062x00000DG0H3AAL,0012x00000ZukZOAAZ,Edmondson Park,NSW,Australia,Loan Paid,Existing Client-Granted Loan Before,6.16,80.88,0.0,2.0,0.0,2.0,1.0,2.0,5170.6781,3.0,23.0,0.0,2040.09,2905.78,0.0,0.0,0.0,0.0,0.0,400.0,1000.0,1500,2040.0,7.0,13.714,Fortnightly,27.0,5170.68,1500.0,,3.0,0.0,0.2747,2.0,5326.61,0.0,64.2333,291.43,MoneySpot,0.0,4697364,0.0,16-02-2023,False,Child Expenses,2023-02-16,Green,566.0,9174.0,5170.68
0062x00000D8EQ0AAN,0012x00000IPYW4AAP,Granville,NSW,Australia,Loan Paid,Existing Client-Granted Loan Before,0.0,42.17,0.0,1.0,0.0,0.0,2.0,1.0,1956.8988,0.0,2.0,0.0,450.3553,113.53,0.0,0.0,0.0,0.0,3900.0,400.0,400.0,1500,2040.0,14.0,14.571,Weekly,31.0,2713.57,1500.0,Full-Time Employment,0.0,0.0,0.3736,0.0,1951.54,106.0,105.6,145.71,MoneySpot,0.0,4521669,0.0,21-01-2023,False,Relocation Expenses,2023-01-21,Green,0.0,2966.0,2713.57
0062x00000DGJZPAA5,0012x00000go4bKAAQ,Mount Austin,NSW,Australia,Closed Lost,New Client-New Loan,0.0,90.07,70.1955,2.0,0.0,0.0,3.0,2.0,4220.8569,8.0,20.0,70.1973,1710.9271,1701.53,0.0,0.3,0.0,0.0,0.0,0.0,400.0,1200,1920.0,20.0,39.571,Fortnightly,23.0,4220.86,9000.0,,8.0,0.0,0.3187,0.0,3992.1633,75.0,92.89,96.0,MoneySpot,,4716481,3.0,19-02-2023,False,New Car,2023-02-19,Green,0.0,4924.0,4220.86
0062x00000EeD6tAAF,0012x00000hZbwwAAC,Hobart,TAS,Australia,Loan Paid,Existing Client-No Loan Granted Ever,0.0,59.28,2090.182,1.0,0.0,0.0,4.0,1.0,12229.1063,4.0,28.0,0.0,756.3609,742.11,0.0,34.0,0.0,1.0,0.0,599.0,700.0,1200,1680.0,18.0,17.857,Weekly,36.0,13313.49,2050.0,,4.0,0.0,0.0,0.0,4889.2066,132.0,1980.4633,93.33,MoneySpot,0.0,6471854,2.0,09-09-2023,False,Vehicle Expenses,2023-09-09,Green,0.0,14944.0,13313.49
0062x00000ELxooAAD,0012x00000iJUVoAAO,Carnegie,VIC,Australia,Loan Paid,Existing Client-No Loan Granted Ever,0.0,86.13,0.0,2.0,0.0,0.0,3.0,2.0,9593.54,0.0,2.0,0.0,3748.72,3748.72,0.0,0.0,0.0,0.0,0.0,599.0,1800.0,1200,1632.0,7.0,13.286,Fortnightly,44.0,9598.54,4500.0,Full-Time Employment,0.0,0.0,0.0,0.0,8747.0133,0.0,87.5,233.14,MoneySpot,0.0,6072289,0.0,01-08-2023,False,Life Event Expenses,2023-08-01,Green,0.0,10263.0,9598.54
0062x00000F29T4AAJ,0012x00000ha1WuAAI,West Bathurst,NSW,Australia,Loan Paid,Existing Client-Granted Loan Before,10.59,75.1,3604.2615,1.0,0.0,4.0,3.0,1.0,7910.0123,0.0,81.0,0.0,1366.899,1867.59,0.0,0.0,0.0,0.0,0.0,599.0,1760.0,1250,1700.0,14.0,14.143,Weekly,35.0,7910.01,1250.0,Full-Time Employment,0.0,0.0,0.1978,0.0,5803.2433,712.0,3941.7266,121.43,QuickCash,0.0,6947445,0.0,26-10-2023,False,Furniture or Appliances,2023-10-26,Orange,924.0,8717.0,7910.01
0062x00000DG2DDAA1,0012x00000L3NfoAAF,Armadale,VIC,Australia,Loan Paid,Existing Client-Granted Loan Before,0.0,95.54,3551.9065,2.0,1.0,0.0,3.0,2.0,13070.0629,17.0,44.0,1622.1697,6015.81,6015.81,1.0,0.0,0.0,0.0,7384.0,599.0,1803.0,1500,2040.0,7.0,13.857,Fortnightly,45.0,13581.61,1500.0,Full-Time Employment,17.0,0.0,0.5604,1.0,8021.08,2787.0,4472.3533,291.43,Financier-2,0.0,4700014,15.0,17-02-2023,False,Travel Expenses,2023-02-16,Orange,0.0,8535.0,13581.61
0062x00000D2IjfAAF,0012x00000g9WT1AAM,Lakelands,WA,Australia,Closed Lost,New Client-New Loan,0.0,68.08,1500.08,1.0,0.0,0.0,3.0,1.0,4984.8803,1.0,42.0,0.0,1084.0715,950.8,0.0,0.74,0.0,0.0,0.0,0.0,0.0,1200,1632.0,15.0,15.571,Weekly,20.0,4984.88,5000.0,Full-time,1.0,0.0,0.011,0.0,4697.6433,0.0,1580.0766,108.8,MoneySpot,,4438560,1.0,11-01-2023,False,Vehicle,2023-01-08,Green,0.0,5120.0,4984.88
0062x00000D9zEKAAZ,0012x00000NvdyxAAB,Mentone,VIC,Australia,Loan Paid,Existing Client-Granted Loan Before,0.26,84.59,280.2652,2.0,1.0,0.0,2.0,2.0,13575.3446,0.0,3.0,0.0,1487.3128,1638.77,0.0,0.04,0.0,1.0,1500.0,599.0,0.0,1500,2040.0,7.0,13.714,Fortnightly,26.0,14697.68,1500.0,Part-Time Employment,6.0,0.0,0.0,3.0,0.0,427.0,1463.3,291.43,MoneySpot,0.0,4607641,2.0,03-02-2023,False,Vehicle Expenses,2023-02-02,Green,52.0,19746.0,14697.68
0062x00000D77m2AAB,0012x00000OJrtvAAD,Wilsonton,QLD,Australia,Loan Paid,Existing Client-Granted Loan Before,15.78,92.1,2173.8333,1.0,2.0,2.0,3.0,1.0,3548.3839,9.0,120.0,179.6756,677.9153,484.82,0.0,0.0,0.0,0.0,2383.33,400.0,1240.0,1500,2040.0,14.0,13.857,Weekly,31.0,3548.38,1500.0,Part-Time Employment,9.0,0.0,0.4505,0.0,3492.4333,1311.0,4304.8533,145.71,MoneySpot,0.0,4468666,9.0,13-01-2023,False,Vehicle Expenses,2023-01-12,Orange,555.0,3517.0,3548.38
0062x00000D2HaIAAV,0012x00000ADj1cAAD,Bushland Beach,QLD,Australia,Loan Paid,Existing Client-Granted Loan Before,13.47,75.44,1202.103,2.0,0.0,2.0,3.0,2.0,3626.1301,6.0,29.0,422.1088,937.59,779.13,3.0,0.0,0.0,0.0,3754.83,400.0,1320.0,1200,1632.0,8.0,15.571,Fortnightly,54.0,4027.8,3100.0,Full-Time Employment,6.0,0.0,0.4396,5.0,2764.9066,453.0,1545.08,204.0,MoneySpot,0.0,4437501,3.0,08-01-2023,False,Living Expenses,2023-01-08,Orange,577.0,4283.0,4027.8
0062x00000DH8SKAA1,0010K000029HZBlQAO,Mayfield,NSW,Australia,Loan Paid,Existing Client-Granted Loan Before,0.0,41.22,1691.5304,2.0,0.0,0.0,3.0,2.0,6882.5156,0.0,0.0,0.0,2228.1171,2483.72,1.0,31.17,0.0,1.0,3596.67,400.0,510.0,1500,2040.0,7.0,13.429,Fortnightly,38.0,6882.52,1500.0,Part-Time Employment,0.0,0.0,0.3516,0.0,0.0,233.0,2141.05,291.43,Financier-2,0.0,4763288,0.0,27-02-2023,False,Vehicle Expenses,2023-02-27,Orange,0.0,8029.0,6882.52
0062x00000DHE4KAAX,0012x00000TJKJTAA5,Werribee,VIC,Australia,Closed Lost,Existing Client-No Loan Granted Ever,0.0,26.44,2674.2655,1.0,0.0,0.0,3.0,1.0,6162.5474,0.0,37.0,0.0,1418.2307,1342.0,0.0,0.0,0.0,0.0,5814.17,599.0,1300.0,1200,1632.0,16.0,16.286,Weekly,45.0,6162.55,5000.0,Full-Time Employment,0.0,0.0,0.0,0.0,6145.6666,0.0,2791.8866,102.0,MoneySpot,,4768221,0.0,28-02-2023,False,Other Expenses,2023-02-27,Green,0.0,7551.0,6162.55
0062x00000FTnBEAA1,0012x00000MiOCSAA3,North Richmond,NSW,Australia,Loan Paid,Existing Client-Granted Loan Before,0.0,85.6,6280.8806,1.0,0.0,0.0,3.0,1.0,11296.3743,0.0,0.0,0.0,1285.7777,1296.0,1.0,0.0,0.0,0.0,2631.0,899.0,1638.0,1500,2040.0,8.0,16.571,Fortnightly,43.0,22359.44,2100.0,Full-Time Employment,0.0,0.0,0.0,0.0,12351.42,1162.0,9390.52,255.0,MoneySpot,0.0,7458182,0.0,10-12-2023,False,Life Event Expenses,2023-12-10,Orange,0.0,13584.0,22359.44
0062x00000DtojxAAB,0012x00000XChvkAAD,Fairfield,NSW,Australia,Loan Paid,Existing Client-Granted Loan Before,0.0,17.54,385.7259,1.0,0.0,0.0,4.0,1.0,8935.3319,0.0,9.0,0.0,1884.1318,1594.37,0.0,1.07,0.0,1.0,5973.75,599.0,170.0,1500,2160.0,23.0,23.571,Weekly,37.0,8940.33,2300.0,Full-Time Employment,0.0,0.0,0.3626,0.0,0.0,79.0,583.3133,93.91,MoneySpot,0.0,5350777,0.0,22-05-2023,False,Home Maintenance & Repairs,2023-05-21,Green,0.0,8873.0,8940.33
0062x00000DFCQrAAP,0012x00000IN47iAAD,Lowood,QLD,Australia,Loan Paid,Existing Client-Granted Loan Before,15.45,85.54,2202.4819,1.0,0.0,2.0,3.0,1.0,4222.5758,1.0,132.0,2811.9399,636.4876,550.14,0.0,0.0,1.0,0.0,380.0,400.0,100.0,1500,2040.0,14.0,13.857,Weekly,43.0,4222.58,1500.0,Casual Employment,1.0,0.0,0.011,1.0,3412.4266,1706.0,3768.61,145.71,Financier-2,0.0,4655225,1.0,10-02-2023,False,Vehicle Expenses,2023-02-10,Orange,654.0,4232.0,4222.58
0062x00000DZcvSAAT,0012x00000hYI3AAAW,Blue Haven,NSW,Australia,Closed Lost,New Client-New Loan,0.0,95.97,0.0,1.0,0.0,0.0,3.0,1.0,4801.4259,0.0,4.0,172.062,1104.9861,1367.11,0.0,0.0,0.0,0.0,0.0,0.0,300.0,1200,1536.0,6.0,6.0,Weekly,32.0,4880.76,1300.0,,16.0,0.0,0.011,4.0,4788.2733,13.0,61.5333,256.0,MoneySpot,,5102928,0.0,20-04-2023,False,Car Repairs,2023-04-20,Green,0.0,5149.0,4880.76
0062x00000DroLwAAJ,0012x00000ILmTRAA1,Windsor Gardens,SA,Australia,Loan Paid,Existing Client-No Loan Granted Ever,0.0,89.48,2026.8159,1.0,0.0,0.0,3.0,1.0,6017.5327,1.0,14.0,272.2292,1307.03,1990.96,0.0,0.0,0.0,0.0,0.0,400.0,150.0,1200,1536.0,6.0,6.0,Weekly,40.0,5992.35,1200.0,Unemployed,1.0,0.0,0.0,1.0,5663.7966,209.0,2205.5,256.0,MoneySpot,0.0,5194857,1.0,04-05-2023,False,Medical Expenses,2023-05-04,Green,0.0,6120.0,5992.35
0062x00000DrICfAAN,0012x00000g8Gs1AAE,Craigieburn,VIC,Australia,Closed Lost,Existing Client-No Loan Granted Ever,0.15,45.55,2268.5329,2.0,0.0,0.0,3.0,2.0,6845.6205,0.0,35.0,478.3238,1482.0616,1482.07,1.0,0.0,0.0,0.0,8302.47,599.0,1500.0,1200,1584.0,5.0,8.857,Fortnightly,40.0,6845.62,3000.0,Full-Time Employment,0.0,0.0,0.1209,0.0,2964.1233,440.0,2213.9866,316.8,MoneySpot,,5156262,0.0,28-04-2023,False,Medical Expenses,2023-04-28,Green,13.0,8319.0,6845.62
0062x00000DIyuSAAT,0012x00000XCnVQAA1,Dee Why,NSW,Australia,Loan Paid,Existing Client-Granted Loan Before,40.43,95.82,1870.0948,1.0,2.0,2.0,2.0,1.0,4399.2749,16.0,67.0,0.0,602.6269,645.28,1.0,0.0,0.0,0.0,3420.52,400.0,1090.0,1300,1716.0,11.0,11.0,Weekly,35.0,4544.82,1300.0,Unemployed,16.0,0.0,0.3956,5.0,4523.83,573.0,1773.8466,156.0,Financier-2,0.0,4865928,16.0,15-03-2023,False,Home Maintenance & Repairs,2023-03-15,Green,1912.0,4729.0,4544.82
0062x00000DA2c5AAD,0012x00000gmzcsAAA,Seven Hills,NSW,Australia,Loan Paid,New Client-New Loan,0.0,11.77,887.3533,1.0,0.0,0.0,4.0,1.0,3464.145,0.0,23.0,516.5092,797.2284,767.35,0.0,0.0,0.0,0.0,0.0,0.0,250.0,1150,1472.0,6.0,6.0,Weekly,61.0,3464.15,1150.0,,0.0,0.0,0.2967,0.0,3454.6566,453.0,819.4966,245.33,MoneySpot,0.0,4610015,0.0,03-02-2023,False,Other,2023-02-03,Green,0.0,3488.0,3464.15
0062x00000DVUbOAAX,0012x00000dbbCjAAI,Coodanup,WA,Australia,Loan Paid,Existing Client-Granted Loan Before,0.0,64.94,1239.5134,2.0,0.0,0.0,2.0,2.0,2632.3502,0.0,26.0,477.9532,1124.5557,1083.02,1.0,0.59,0.0,0.0,0.0,400.0,350.0,1500,2040.0,8.0,16.0,Fortnightly,55.0,2632.35,2050.0,Part-Time Employment,0.0,0.0,0.5495,0.0,2623.9633,534.0,1292.8333,255.0,MoneySpot,0.0,5451628,0.0,31-05-2023,False,Life Event Expenses,2023-05-31,Orange,0.0,2894.0,2632.35
0062x00000E5u4TAAR,0012x00000hYYcDAAW,ROOTY HILL,NSW,Australia,Closed Lost,Existing Client-No Loan Granted Ever,0.0,50.14,0.0,1.0,0.0,0.0,4.0,1.0,8261.2092,0.0,0.0,0.0,878.4816,855.24,0.0,0.0,0.0,0.0,0.0,599.0,800.0,1200,1728.0,25.0,25.143,Weekly,43.0,8831.29,2050.0,,0.0,0.0,0.0769,0.0,3513.9266,0.0,0.3333,69.12,MoneySpot,,5689653,0.0,22-06-2023,False,Other Expenses,2023-06-22,Green,0.0,9576.0,8831.29
0062x00000DIJBEAA5,0010K0000241tICQAY,Buderim,QLD,Australia,Closed Lost,Existing Client-No Loan Granted Ever,0.31,39.89,1918.0417,2.0,0.0,0.0,3.0,2.0,9474.3924,0.0,42.0,0.0,1777.91,1915.38,1.0,0.0,0.0,0.0,3707.17,899.0,0.0,1200,1536.0,3.0,6.0,Fortnightly,40.0,25274.93,1500.0,Full-Time Employment,0.0,0.0,0.0,0.0,2963.1833,83.0,2426.0966,512.0,MoneySpot,,4826798,0.0,09-03-2023,False,Medical Expenses,2023-03-08,Green,67.0,21187.0,25274.93
0062x00000DA1BrAAL,0012x00000OvrgNAAR,Springvale,VIC,Australia,Closed Lost,Existing Client-No Loan Granted Ever,0.0,36.39,1759.552,2.0,0.0,0.0,3.0,2.0,4669.2837,2.0,21.0,0.0,2149.15,2385.38,0.0,0.0,0.0,0.0,65000.0,400.0,0.0,1200,1584.0,5.0,8.857,Fortnightly,25.0,4719.28,3500.0,Full-Time Employment,2.0,0.0,0.1319,0.0,4298.3,430.0,1722.47,316.8,MoneySpot,,4609055,2.0,07-02-2023,False,Living Expenses,2023-02-03,Green,0.0,6092.0,4719.28
0062x00000D83XGAAZ,0012x00000WtWftAAF,Mount Gravatt,QLD,Australia,Loan Paid,Existing Client-Granted Loan Before,10.76,75.62,3533.5151,2.0,0.0,2.0,4.0,2.0,8064.456,0.0,56.0,1195.0449,2070.9385,2336.09,0.0,1.71,0.0,0.0,0.0,899.0,1000.0,1400,1904.0,7.0,14.0,Fortnightly,40.0,9229.98,1500.0,Full-Time Employment,0.0,0.0,0.011,0.0,6787.1833,706.0,4093.6166,272.0,Financier-2,0.0,4512589,0.0,20-01-2023,False,Living Expenses,2023-01-19,Green,1454.0,13507.0,9229.98
0062x00000DFCkcAAH,0012x00000gnRrFAAU,Caversham,WA,Australia,Loan Paid,New Client-New Loan,0.0,45.85,416.4163,2.0,0.0,0.0,3.0,2.0,10142.7163,0.0,4.0,0.0,4327.8416,4327.84,0.0,6.79,0.0,0.0,346666.67,1500.0,2000.0,1200,1536.0,3.0,4.857,Fortnightly,50.0,10652.05,1700.0,Full-Time Employment,0.0,0.0,0.1758,0.0,9331.6833,85.0,468.6666,512.0,QuickCash,0.0,4655470,0.0,10-02-2023,False,Living Expenses,2023-02-10,Green,0.0,11380.0,10652.05
0062x00000DVKNQAA5,0012x00000hZTfQAAW,Blacktown,NSW,Australia,Closed Lost,Existing Client-No Loan Granted Ever,0.0,46.49,1041.9867,1.0,0.0,0.0,2.0,1.0,4613.8494,0.0,10.0,1041.9881,1061.8175,953.88,0.0,0.0,0.0,0.0,0.0,599.0,920.0,1200,1632.0,17.0,17.143,Weekly,50.0,10331.84,5000.0,,0.0,0.0,0.0,0.0,2831.5133,1003.0,1003.3866,96.0,MoneySpot,,5438691,0.0,30-05-2023,False,Travel Expenses,2023-05-29,Green,0.0,4611.0,10331.84
0062x00000Dtt46AAB,0012x00000haR1bAAE,Latrobe,TAS,Australia,Closed Lost,New Client-New Loan,0.0,44.06,0.0,2.0,0.0,0.0,2.0,2.0,6861.9117,0.0,5.0,0.0,3158.36,2886.94,0.0,0.0,0.0,0.0,2700.0,2000.0,1800.0,1200,1632.0,8.0,16.286,Fortnightly,29.0,6861.91,5000.0,Part-Time Employment,0.0,0.0,0.0,0.0,6316.72,0.0,30.4433,204.0,MoneySpot,,5354052,0.0,22-05-2023,False,Medical Expenses,2023-05-22,Green,0.0,7868.0,6861.91
0062x00000DIavKAAT,0012x00000SFf84AAD,South Morang,VIC,Australia,Closed Lost,Existing Client-Granted Loan Before,0.0,92.68,0.0,0.0,0.0,0.0,0.0,0.0,0.0,0.0,0.0,272.5768,0.0,0.0,0.0,10.29,0.0,0.0,7800.0,1499.0,2000.0,1200,1584.0,12.0,11.714,Weekly,52.0,5289.76,5000.0,Full-Time Employment,4.0,0.0,0.0,0.0,5128.7566,377.0,376.83,132.0,MoneySpot,,4842144,4.0,11-03-2023,False,Travel Costs/Airfares/Tickets,2023-03-10,Orange,0.0,1001.0,5289.76
0062x00000Ec9izAAB,0012x00000lFPQTAA4,Parramatta,NSW,Australia,Closed Lost,New Client-New Loan,0.0,96.69,136.875,2.0,1.0,0.0,3.0,2.0,5954.5775,8.0,18.0,0.0,1871.74,1853.89,1.0,13.84,0.0,0.0,3732.0,400.0,240.0,1500,1920.0,2.0,5.429,Monthly,25.0,10347.02,1500.0,Part-Time Employment,8.0,0.0,0.022,4.0,3743.48,0.0,262.5,960.0,QuickCash,,6337384,1.0,26-08-2023,False,Living Expenses,2023-08-26,Orange,0.0,9550.0,10347.02
0062x00000DHuPOAA1,0012x000002cV6UAAU,MILL PARK,VIC,Australia,Closed Lost,Existing Client-No Loan Granted Ever,0.0,36.94,43.4502,0.0,0.0,0.0,0.0,0.0,10912.09,0.0,0.0,0.0,0.0,0.0,1.0,0.0,0.0,0.0,0.0,0.0,1900.0,1200,1536.0,6.0,6.429,Weekly,43.0,21262.63,2000.0,,0.0,0.0,0.0,0.0,10322.1833,0.0,40.0,256.0,MoneySpot,,4807201,0.0,06-03-2023,False,Vehicle - Service,2023-03-05,Orange,0.0,11238.0,21262.63
0062x00000FWKDPAA5,0012x00000n1jNqAAI,Warrawong,NSW,Australia,Closed Lost,Existing Client-No Loan Granted Ever,0.0,57.85,0.0,1.0,0.0,0.0,4.0,1.0,4943.4566,0.0,41.0,0.0,957.36,857.79,0.0,0.15,0.0,0.0,5416.67,400.0,700.0,1100,1540.0,20.0,20.0,Weekly,24.0,5344.79,7000.0,Full-Time Employment,0.0,0.0,0.978,0.0,4148.56,0.0,332.5,77.0,MoneySpot,,7661201,0.0,28-12-2023,False,Living Expenses,2023-12-28,Green,0.0,5502.0,5344.79
0062x00000DrTWlAAN,0010K00001yp2TPQAY,Baulkham Hills,NSW,Australia,Closed Lost,Existing Client-No Loan Granted Ever,0.0,37.68,0.0,2.0,0.0,0.0,4.0,2.0,5936.0486,0.0,0.0,0.0,2614.7142,2733.74,0.0,0.0,0.0,0.0,110432.83,599.0,990.0,1200,1776.0,15.0,29.571,Fortnightly,28.0,5936.05,6000.0,Full-Time Employment,17.0,0.0,0.0,2.0,6101.0,460.0,459.8666,118.4,MoneySpot,,5170544,4.0,01-05-2023,False,Vehicle Repairs & Maintenance,2023-04-30,Green,0.0,6368.0,5936.05
0062x00000D7KYMAA3,0012x00000g9vgIAAQ,Goondiwindi,QLD,Australia,Closed Lost,New Client-New Loan,11.44,62.18,1365.4606,2.0,0.0,2.0,5.0,2.0,10255.2257,2.0,0.0,682.6357,2182.17,2244.24,0.0,0.0,0.0,1.0,0.0,0.0,460.0,1200,1536.0,3.0,5.714,Fortnightly,43.0,10255.23,8500.0,,2.0,0.0,0.022,0.0,5457.7133,1451.0,1510.44,512.0,MoneySpot,,4478664,2.0,14-01-2023,False,Vehicle Service,2023-01-14,Green,1147.0,10024.0,10255.23
0062x00000E7StNAAV,0012x00000TrSigAAF,Morayfield,QLD,Australia,Loan Paid,Existing Client-No Loan Granted Ever,0.0,36.44,306.0599,1.0,0.0,0.0,5.0,1.0,4662.7824,3.0,13.0,0.0,913.4423,938.85,0.0,0.0,0.0,0.0,1800.0,400.0,1000.0,1200,1728.0,22.0,22.571,Weekly,23.0,4763.28,2050.0,Casual Employment,5.0,0.0,0.0,3.0,3958.25,0.0,306.06,78.55,MoneySpot,0.0,5823489,0.0,07-07-2023,False,Vehicle Expenses,2023-07-07,Green,0.0,5077.0,4763.28
0062x00000D1WEYAA3,0012x00000TubEvAAJ,Roxburgh Park,VIC,Australia,Closed Lost,Existing Client-No Loan Granted Ever,0.0,87.88,456.6284,2.0,0.0,0.0,3.0,2.0,8540.3549,0.0,13.0,0.0,2530.1366,3060.5,1.0,0.0,0.0,0.0,1500.0,400.0,1.0,1200,1584.0,6.0,12.429,Fortnightly,27.0,8597.69,4000.0,Contract Employment,0.0,0.0,0.7473,0.0,5060.2733,176.0,812.24,264.0,MoneySpot,,4394165,0.0,06-01-2023,False,Home Maintenance & Repairs,2023-01-02,Green,0.0,8780.0,8597.69
0062x00000FJPTdAAP,0012x00000Nxj2CAAR,Waterford,QLD,Australia,Loan Paid,Existing Client-Granted Loan Before,0.0,65.47,752.8218,1.0,0.0,0.0,5.0,1.0,6119.4212,0.0,32.0,0.0,1173.0769,1250.0,2.0,0.0,0.0,0.0,4333.33,599.0,800.0,1200,1632.0,16.0,15.857,Weekly,23.0,5836.09,2050.0,Contract Employment,0.0,0.0,0.0,0.0,5083.3333,649.0,799.5366,102.0,MoneySpot,0.0,7321578,0.0,26-11-2023,False,Travel Expenses,2023-11-26,Orange,0.0,6742.0,5836.09
0062x00000DGeINAA1,0012x00000ZvC56AAF,Bowen,QLD,Australia,Loan Paid,Existing Client-Granted Loan Before,16.76,66.95,571.7072,4.0,0.0,2.0,3.0,4.0,2063.9356,5.0,26.0,805.4286,669.8857,833.47,0.0,0.0,0.0,0.0,1518.83,400.0,250.0,1500,2040.0,7.0,13.143,Fortnightly,55.0,2063.94,2050.0,Full-Time Employment,5.0,0.0,0.0659,0.0,1936.9966,1273.0,1273.0933,291.43,Financier-2,0.0,4733379,4.0,22-02-2023,False,Living Expenses,2023-02-22,Orange,374.0,2231.0,2063.94
0062x00000FTOUkAAP,0012x00000qAZXDAA4,Berala,NSW,Australia,Closed Lost,New Client-New Loan,0.0,61.49,1775.2333,1.0,0.0,0.0,3.0,1.0,9456.3466,2.0,23.0,0.0,2291.6666,2300.0,2.0,7.69,0.0,0.0,0.0,0.0,1400.0,1100,1496.0,16.0,16.571,Weekly,24.0,9456.35,1100.0,full_time,2.0,0.0,0.011,2.0,9166.6666,0.0,2388.1266,93.5,MoneySpot,,9031925,1.0,2024-05-02,False,Funeral,2024-04-29,Orange,0.0,12922.0,9456.35
0062x00000E3dRlAAJ,0012x000003DRrzAAG,South Hedland,WA,Australia,Loan Paid,Existing Client-No Loan Granted Ever,0.0,82.63,0.0,2.0,0.0,0.0,2.0,2.0,5800.461,0.0,0.0,0.0,1803.26,1487.06,0.0,0.27,1.0,0.0,7401.23,899.0,1000.0,1200,1872.0,19.0,38.286,Fortnightly,42.0,6472.79,11000.0,Full-Time Employment,0.0,0.0,0.0,0.0,3606.52,0.0,0.3333,98.53,MoneySpot,0.0,5505068,0.0,05-06-2023,False,Living Expenses,2023-06-05,Green,0.0,6182.0,6472.79
0062x00000DtVpaAAF,0012x00000haAaYAAU,Manoora,QLD,Australia,Loan Paid,New Client-New Loan,41.05,59.32,314.1133,1.0,0.0,2.0,2.0,1.0,5426.9693,6.0,12.0,314.9759,976.7275,1114.37,0.0,0.0,0.0,0.0,0.0,0.0,200.0,1200,1632.0,9.0,16.714,Fortnightly,55.0,5339.61,2500.0,Casual Employment,6.0,0.0,0.7033,2.0,2314.4666,314.0,415.1933,181.33,MoneySpot,0.0,5322087,5.0,19-05-2023,False,Vehicle - Repairs,2023-05-18,Green,1145.0,2789.0,5339.61
0062x00000DtdRdAAJ,0012x00000haFmJAAU,Campbelltown,NSW,Australia,Closed Lost,New Client-New Loan,0.0,22.52,1291.5203,2.0,0.0,0.0,4.0,2.0,7338.9648,0.0,46.0,0.0,3003.802,3334.44,0.0,0.0,0.0,0.0,3000.0,2000.0,860.0,1200,1584.0,7.0,13.0,Fortnightly,31.0,7338.96,2000.0,Full-Time Employment,0.0,0.0,0.0,0.0,5006.3366,0.0,1332.57,226.29,QuickCash,,5328213,0.0,24-05-2023,False,Relocation Expenses,2023-05-19,Orange,0.0,6383.0,7338.96
0062x00000Ew7ugAAB,0012x00000GbYPBAA3,Rosemeadow,NSW,Australia,Loan Paid,Existing Client-Granted Loan Before,0.0,76.92,437.9485,4.0,0.0,0.0,2.0,4.0,5472.5665,1.0,33.0,0.0,2607.74,2818.35,3.0,2.54,0.0,0.0,4333.33,599.0,1000.0,1500,2520.0,25.0,48.571,Fortnightly,25.0,7818.64,1500.0,Full-Time Employment,1.0,0.0,0.1538,1.0,4346.2333,0.0,582.2266,100.8,QuickCash,0.0,6563657,1.0,18-09-2023,False,Emergency,2023-09-18,Green,0.0,10149.0,7818.64
0062x00000EyACRAA3,0012x00000lHvjiAAC,Rockdale,NSW,Australia,Closed Lost,Existing Client-No Loan Granted Ever,0.0,78.29,0.0,1.0,0.0,0.0,5.0,1.0,7206.8995,0.0,1.0,0.0,551.5769,561.0,0.0,1.16,0.0,0.0,0.0,1500.0,0.0,1200,1872.0,36.0,36.571,Weekly,21.0,7200.33,2100.0,Part-Time Employment,0.0,0.0,0.0,0.0,2390.1666,0.0,0.0,52.0,MoneySpot,,6714656,0.0,07-10-2023,False,Living Expenses,2023-10-02,Green,0.0,16526.0,7200.33
0062x00000E3f87AAB,0012x00000iHyaQAAS,Deer Park,VIC,Australia,Loan Paid,New Client-New Loan,0.0,48.68,250.2433,3.0,0.0,0.0,5.0,3.0,5566.4166,1.0,2.0,384.0,4146.4166,5180.48,1.0,0.0,0.0,0.0,0.0,0.0,800.0,1200,1584.0,3.0,10.143,Monthly,38.0,5759.75,2500.0,,1.0,0.0,0.011,0.0,4146.4166,135.0,2035.6366,528.0,MoneySpot,0.0,5506371,0.0,06-06-2023,False,Vehicle Expense,2023-06-06,Orange,0.0,7410.0,5759.75
0062x00000ExDr4AAF,0012x00000NxySuAAJ,Kenwick,WA,Australia,Closed Lost,Existing Client-No Loan Granted Ever,0.0,27.06,302.4067,1.0,0.0,0.0,2.0,1.0,7614.9943,0.0,10.0,0.0,1484.4375,1453.46,1.0,0.74,0.0,0.0,2946.67,599.0,400.0,1200,1632.0,16.0,16.286,Weekly,45.0,7614.99,5000.0,Full-Time Employment,4.0,0.0,0.0,0.0,7102.51,0.0,1896.2566,102.0,MoneySpot,,6647139,0.0,26-09-2023,False,Vehicle Expenses,2023-09-26,Green,0.0,7385.0,7614.99
0062x00000EONb0AAH,0012x00000khBiAAAU,Toongabbie,NSW,Australia,Closed Lost,New Client-New Loan,0.0,56.89,1019.0899,2.0,0.0,0.0,3.0,2.0,3888.8012,0.0,30.0,0.0,1789.915,1284.15,0.0,0.0,0.0,0.0,1400.0,2000.0,680.0,1200,1728.0,13.0,24.857,Fortnightly,22.0,3888.8,2750.0,Part-Time Employment,0.0,0.0,0.011,0.0,3579.83,0.0,1390.6833,132.92,MoneySpot,,6253863,0.0,22-08-2023,False,Vehicle Expenses,2023-08-18,Green,0.0,3658.0,3888.8
0062x00000D1ejZAAR,0012x00000WsjbNAAR,Calamvale,QLD,Australia,Loan Paid,Existing Client-Granted Loan Before,0.0,14.19,1034.3395,2.0,1.0,0.0,2.0,2.0,11059.4954,2.0,49.0,448.3851,4666.4866,3821.67,0.0,0.98,0.0,0.0,8233.33,899.0,2800.0,1200,1632.0,7.0,14.143,Fortnightly,47.0,11072.83,2050.0,Full-Time Employment,2.0,0.0,0.0,1.0,9332.9733,537.0,1551.2933,233.14,MoneySpot,0.0,4402766,1.0,03-01-2023,False,Vehicle Expenses,2023-01-03,Orange,0.0,10611.0,11072.83
0062x00000DWZjNAAX,0012x00000GbXYGAA3,Warrnambool,VIC,Australia,Loan Paid,Existing Client-Granted Loan Before,0.63,97.94,1981.3,2.0,3.0,0.0,3.0,2.0,4096.5379,6.0,42.0,643.1647,1885.53,1895.78,1.0,0.56,0.0,0.0,4428.67,1499.0,400.0,1100,1452.0,5.0,8.857,Fortnightly,31.0,4104.91,2050.0,Full-Time Employment,6.0,0.0,0.3297,3.0,3142.55,1172.0,3021.5366,290.4,MoneySpot,0.0,4924060,6.0,24-03-2023,False,Relocation Expenses,2023-03-24,Green,26.0,4072.0,4104.91
0062x00000EDrruAAD,0012x00000gqE0UAAU,Mount Louisa,QLD,Australia,Loan Paid,Existing Client-Granted Loan Before,0.92,58.05,2177.6504,2.0,0.0,0.0,3.0,2.0,4878.9336,13.0,56.0,0.0,1668.4628,1638.22,1.0,0.0,0.0,0.0,0.0,899.0,600.0,1450,2088.0,13.0,25.857,Fortnightly,35.0,4878.93,2050.0,,13.0,0.0,0.0,0.0,3893.08,767.0,2253.4566,160.62,QuickCash,0.0,5969050,0.0,21-07-2023,False,Travel Expenses,2023-07-21,Orange,49.0,5311.0,4878.93
0062x00000D9Aa8AAF,0012x00000GbBYZAA3,Point cook,VIC,Australia,Loan Paid,Existing Client-Granted Loan Before,0.0,92.0,2327.5357,2.0,2.0,0.0,2.0,2.0,6790.2105,6.0,39.0,3727.658,3125.3585,3811.5,2.0,1.68,1.0,0.0,2400.0,0.0,0.0,1400,1904.0,7.0,13.571,Fortnightly,30.0,6795.21,1400.0,Full-Time Employment,6.0,0.0,0.1429,0.0,7292.5033,2250.0,2559.95,272.0,QuickCash,0.0,4568563,2.0,28-01-2023,False,Needing a loan to pay off bills and purchase furniture.,2023-01-27,Orange,0.0,7758.0,6795.21
0062x00000D8G3xAAF,0010K000025x4UIQAY,Pakenham South,VIC,Australia,Loan Paid,Existing Client-Granted Loan Before,0.19,58.02,2184.7734,1.0,0.0,0.0,2.0,1.0,5079.1741,0.0,32.0,0.0,1127.5584,1266.54,0.0,6.91,0.0,0.0,3900.0,1499.0,101.0,1200,1632.0,14.0,14.571,Weekly,26.0,5399.17,1800.0,Full-Time Employment,0.0,0.0,0.0,0.0,4886.0866,173.0,1779.2433,116.57,MoneySpot,0.0,4523404,0.0,21-01-2023,False,Living Expenses,2023-01-21,Orange,13.0,6775.0,5399.17
0062x00000DGrzqAAD,0012x00000LQ3SsAAL,Mount Saint Thomas,NSW,Australia,Loan Paid,Existing Client-Granted Loan Before,0.0,81.18,2768.2181,2.0,0.0,0.0,4.0,2.0,3889.5531,3.0,53.0,977.593,1066.785,1170.78,0.0,0.0,1.0,0.0,2164.88,899.0,1400.0,1100,1496.0,7.0,13.0,Fortnightly,46.0,3939.42,1100.0,Part-Time Employment,3.0,0.0,0.3187,0.0,2133.57,775.0,2812.1133,213.71,MoneySpot,0.0,4747232,0.0,24-02-2023,False,Home Maintenance & Repairs,2023-02-24,Green,0.0,4146.0,3939.42
0062x00000D7954AAB,0012x00000ACgaXAAT,Mount Duneed,VIC,Australia,Closed Lost,Existing Client-Granted Loan Before,0.0,54.17,691.1801,1.0,0.0,0.0,4.0,1.0,8019.728,0.0,24.0,273.5762,802.3,802.3,0.0,5.34,0.0,0.0,0.0,0.0,3212.0,1200,1632.0,16.0,16.0,Weekly,25.0,8839.46,7000.0,Employed full-time,0.0,0.0,0.0,0.0,2941.7666,273.0,716.7633,102.0,MoneySpot,,4469683,0.0,17-01-2023,False,Repairs/renovation,2023-01-12,Orange,0.0,9666.0,8839.46
0062x00000D7D1LAAV,0012x00000KLk99AAD,North Albury,NSW,Australia,Loan Paid,Existing Client-Granted Loan Before,0.0,65.56,2208.5061,4.0,2.0,0.0,2.0,4.0,5997.8998,11.0,36.0,168.856,897.2222,1000.0,0.0,16.3,0.0,0.0,5200.0,899.0,1300.0,1300,1768.0,14.0,13.714,Weekly,32.0,5997.9,1300.0,Full-Time Employment,11.0,0.0,0.1429,5.0,4571.2333,1846.0,2233.55,126.29,QuickCash,0.0,4472180,6.0,13-01-2023,False,Vehicle Expenses,2023-01-13,Green,0.0,6239.0,5997.9
0062x00000Dt7IfAAJ,0012x00000hZtLFAA0,Ingleburn,NSW,Australia,Loan Paid,New Client-New Loan,0.37,47.53,927.9599,1.0,0.0,0.0,4.0,1.0,7172.3612,3.0,40.0,0.0,1126.64,1190.0,0.0,0.96,0.0,0.0,0.0,0.0,470.0,1200,1584.0,9.0,9.429,Weekly,44.0,6760.53,2250.0,,3.0,0.0,0.044,0.0,6313.7833,0.0,1017.96,176.0,MoneySpot,0.0,5286933,1.0,16-05-2023,False,Other,2023-05-16,Green,26.0,7010.0,6760.53
0062x00000D7wXhAAJ,0012x00000THjGwAAL,Norlane,VIC,Australia,Loan Paid,Existing Client-No Loan Granted Ever,22.28,49.13,2392.8967,2.0,0.0,2.0,2.0,2.0,12603.8753,0.0,20.0,0.0,4333.04,4333.04,1.0,2.79,0.0,0.0,4140.29,899.0,1560.0,1200,1584.0,5.0,8.857,Fortnightly,36.0,11855.91,3000.0,Full-Time Employment,0.0,0.0,0.033,0.0,11521.5933,102.0,2806.5566,316.8,MoneySpot,0.0,4507356,0.0,19-01-2023,False,Travel Expenses,2023-01-19,Green,2856.0,12813.0,11855.91
0062x00000ExjRvAAJ,0012x00000fmNBPAA2,Mount Burges,WA,Australia,Loan Paid,Existing Client-Granted Loan Before,0.0,11.17,2118.6402,4.0,0.0,0.0,3.0,4.0,8599.3932,0.0,6.0,140.3946,3494.74,4185.65,1.0,0.04,0.0,0.0,8513.07,599.0,600.0,1500,2040.0,8.0,14.857,Fortnightly,30.0,8599.39,1500.0,Full-Time Employment,0.0,0.0,0.0,0.0,8154.3933,515.0,2464.6966,255.0,QuickCash,0.0,6683367,0.0,29-09-2023,False,Travel Expenses,2023-09-29,Green,0.0,21618.0,8599.39
0062x00000DHnbeAAD,0012x00000fnHmlAAE,South Hedland,WA,Australia,Closed Lost,Existing Client-Granted Loan Before,0.0,62.3,2710.9492,2.0,0.0,0.0,3.0,2.0,4481.7338,0.0,0.0,484.494,1880.5571,1760.37,1.0,3.78,0.0,0.0,3832.83,599.0,624.0,1200,1584.0,6.0,11.714,Fortnightly,49.0,4635.07,5000.0,Full-Time Employment,0.0,0.0,0.7253,0.0,4387.9666,1880.0,3028.1233,264.0,Financier-2,,4799308,0.0,04-03-2023,False,Other Expenses,2023-03-04,Orange,0.0,6165.0,4635.07
0062x00000ELUczAAH,0012x00000dzjIWAAY,Hay,NSW,Australia,Closed Lost,Existing Client-No Loan Granted Ever,4.04,55.85,1713.0144,1.0,1.0,0.0,4.0,1.0,4644.3141,9.0,36.0,342.6326,1039.6784,765.32,1.0,0.0,0.0,0.0,0.0,0.0,0.0,1200,1680.0,20.0,20.0,Weekly,27.0,4644.31,2500.0,Full-Time Employment,9.0,0.0,0.0,4.0,4505.2733,315.0,1742.73,84.0,MoneySpot,,6037274,9.0,02-08-2023,False,Car Repairs,2023-07-28,Orange,236.0,5831.0,4644.31
0062x00000DWFgSAAX,0012x00000THcBcAAL,Reservoir,VIC,Australia,Loan Paid,Existing Client-No Loan Granted Ever,15.84,66.03,1886.3984,4.0,0.0,2.0,1.0,4.0,6466.5849,0.0,14.0,0.0,573.1578,1520.0,0.0,0.0,0.0,1.0,6500.0,599.0,680.0,1200,1536.0,6.0,6.286,Weekly,68.0,6466.58,5000.0,Full-Time Employment,0.0,0.0,0.044,0.0,1703.95,0.0,2129.6933,256.0,MoneySpot,0.0,4905405,0.0,22-03-2023,False,Other Expenses,2023-03-21,Orange,1704.0,10751.0,6466.58
0062x00000DG6aMAAT,0012x00000gnwrWAAQ,Banks,ACT,Australia,Loan Paid,New Client-New Loan,0.0,82.25,68.33,1.0,0.0,0.0,3.0,1.0,4605.9015,1.0,5.0,0.0,956.6092,964.86,0.0,0.0,0.0,0.0,1000.0,2000.0,0.0,1200,1584.0,10.0,9.857,Weekly,22.0,4605.9,2500.0,Full-Time Employment,1.0,0.0,0.1099,1.0,4420.9866,0.0,68.33,158.4,MoneySpot,0.0,4703171,0.0,17-02-2023,False,Vehicle Expenses,2023-02-17,Green,0.0,4483.0,4605.9
0062x00000EdHNMAA3,0012x00000goPhhAAE,Bellmere,QLD,Australia,Loan Paid,Existing Client-No Loan Granted Ever,0.0,84.83,0.0,1.0,0.0,0.0,3.0,1.0,8929.1726,3.0,3.0,0.0,1893.5653,1722.67,0.0,4.14,0.0,0.0,1500.0,400.0,450.0,1200,1584.0,11.0,10.571,Weekly,26.0,9261.09,2050.0,Casual Employment,3.0,0.0,0.011,1.0,8205.45,0.0,17.6666,144.0,Financier-2,0.0,6411918,0.0,03-09-2023,False,Vehicle Expenses,2023-09-04,Green,0.0,10706.0,9261.09
0062x00000DVOOjAAP,0010K00001xO3fzQAC,Gosnells,WA,Australia,Loan Paid,Existing Client-Granted Loan Before,14.77,71.15,4156.1929,1.0,0.0,4.0,3.0,1.0,5641.8219,13.0,41.0,0.0,757.9609,821.0,1.0,0.8,0.0,0.0,2600.0,899.0,1600.0,1500,2160.0,23.0,23.286,Weekly,38.0,5482.98,2050.0,Contract Employment,13.0,0.0,0.4396,0.0,3539.92,368.0,4371.2166,93.91,MoneySpot,0.0,5441614,4.0,30-05-2023,False,Vehicle Expenses,2023-05-30,Green,921.0,6234.0,5482.98
0062x00000DGzftAAD,0012x00000SHuPGAA1,Lethbridge Park,NSW,Australia,Loan Paid,Existing Client-Granted Loan Before,49.38,41.39,901.352,1.0,0.0,4.0,3.0,1.0,4482.6927,2.0,43.0,467.3534,501.613,514.78,0.0,0.0,0.0,0.0,3540.33,899.0,1280.0,1250,1650.0,12.0,11.714,Weekly,33.0,4693.71,2100.0,Casual Employment,2.0,0.0,0.0769,0.0,4498.13,462.0,1430.7833,137.5,QuickCash,0.0,4754209,2.0,25-02-2023,False,Veterinary Expenses,2023-02-25,Green,2324.0,4706.0,4693.71
0062x00000ENAGOAA5,0012x00000Fz73oAAB,Rokeby,TAS,Australia,Loan Paid,Existing Client-No Loan Granted Ever,0.12,35.85,1334.6695,2.0,0.0,0.0,3.0,2.0,3877.1544,12.0,38.0,236.3862,1755.4028,1839.86,0.0,0.27,0.0,0.0,1798.33,899.0,0.0,1200,1680.0,10.0,20.143,Fortnightly,33.0,3877.15,2100.0,Unemployed,15.0,0.0,0.0,2.0,4095.94,229.0,3539.14,168.0,MoneySpot,0.0,6153875,11.0,09-08-2023,False,Medical Bill,2023-08-09,Orange,6.0,4737.0,3877.15
0062x00000DAnLpAAL,0012x00000TFJJJAA5,Gungahlin,ACT,Australia,Loan Paid,Existing Client-Granted Loan Before,0.0,89.29,579.2245,2.0,0.0,0.0,3.0,2.0,3602.9264,2.0,13.0,579.2268,1658.3333,1925.0,0.0,1.05,0.0,1.0,0.0,599.0,200.0,1150,1610.0,9.0,18.0,Fortnightly,37.0,6116.67,1150.0,,2.0,0.0,0.022,0.0,0.0,578.0,577.64,178.89,MoneySpot,0.0,4645969,2.0,09-02-2023,False,Furniture or Appliances,2023-02-08,Green,0.0,6983.0,6116.67
0062x00000DZ6LsAAL,0012x00000dzls5AAA,Regentville,NSW,Australia,Loan Paid,Existing Client-No Loan Granted Ever,11.19,34.65,1223.3333,2.0,0.0,2.0,2.0,2.0,5089.173,4.0,10.0,0.0,1596.0,1624.0,0.0,0.93,0.0,1.0,0.0,599.0,1600.0,1200,1536.0,3.0,5.286,Fortnightly,44.0,7254.81,2000.0,,4.0,0.0,0.0,0.0,616.9,0.0,2054.72,512.0,MoneySpot,0.0,5072913,0.0,17-04-2023,False,Other Expenses,2023-04-17,Orange,617.0,5511.0,7254.81
0062x00000D9IPMAA3,0012x00000NQvouAAD,Bruce Rock,WA,Australia,Loan Paid,Existing Client-Granted Loan Before,0.0,38.24,2370.6717,2.0,1.0,0.0,4.0,2.0,6845.8095,19.0,0.0,2129.5579,3026.7542,3440.89,0.0,4.27,0.0,0.0,0.0,599.0,900.0,1500,2040.0,7.0,13.714,Fortnightly,39.0,6845.81,1500.0,,19.0,1.0,0.0,1.0,7062.4266,2348.0,2544.12,291.43,MoneySpot,0.0,4575644,1.0,29-01-2023,False,Living Expenses,2023-01-29,Orange,0.0,7534.0,6845.81
0062x00000EdHAJAA3,0012x00000g7cfzAAA,Wollongbar,NSW,Australia,Closed Lost,Existing Client-Granted Loan Before,0.0,80.73,2747.1643,1.0,0.0,0.0,4.0,1.0,8805.3293,0.0,36.0,0.0,1708.5384,1811.0,1.0,1.39,0.0,0.0,0.0,1499.0,1200.0,1500,2040.0,16.0,15.714,Weekly,22.0,9610.67,3500.0,Full-Time Employment,2.0,0.0,0.0,2.0,7403.6666,1037.0,2759.2233,127.5,MoneySpot,,6411661,1.0,07-09-2023,False,Other Expenses,2023-09-03,Orange,0.0,10330.0,9610.67
0062x00000Ef0VlAAJ,0012x00000gAUSQAA4,Findon,SA,Australia,Loan Paid,Existing Client-Granted Loan Before,0.0,38.56,1922.4864,1.0,0.0,0.0,2.0,1.0,6050.6871,0.0,55.0,0.0,1392.4869,1447.29,0.0,0.0,0.0,0.0,5200.0,1499.0,190.0,1250,1700.0,14.0,13.714,Weekly,69.0,6050.69,1250.0,Full-Time Employment,0.0,0.0,0.0,0.0,6034.11,1338.0,2339.4966,121.43,Financier-2,0.0,6535397,0.0,15-09-2023,False,Relocation Expenses,2023-09-15,Orange,0.0,7251.0,6050.69
0062x00000E45LHAAZ,0012x00000gnZs9AAE,Strathfield,NSW,Australia,Loan Paid,Existing Client-Granted Loan Before,0.0,78.61,5734.7195,1.0,0.0,0.0,2.0,1.0,5424.3099,15.0,126.0,1961.14,1162.6241,1395.39,0.0,0.0,0.0,1.0,5200.0,599.0,0.0,1200,1632.0,14.0,13.857,Weekly,41.0,5666.64,2050.0,Full-Time Employment,15.0,0.0,0.1648,2.0,0.0,2481.0,6029.0166,116.57,QuickCash,0.0,5540049,12.0,08-06-2023,False,Travel Expenses,2023-06-08,Orange,0.0,11257.0,5666.64
0062x00000DHI1YAAX,0010K000023QwPvQAK,Red Cliffs,VIC,Australia,Loan Paid,Existing Client-Granted Loan Before,22.07,98.32,2298.4009,1.0,1.0,4.0,2.0,1.0,7467.113,21.0,94.0,463.0286,909.6753,956.52,1.0,0.0,0.0,0.0,3250.0,899.0,1000.0,1350,1836.0,13.0,13.143,Weekly,43.0,7508.25,2050.0,Full-Time Employment,21.0,0.0,0.2527,2.0,5451.5233,1149.0,3867.9566,141.23,QuickCash,0.0,4770769,16.0,28-02-2023,False,Living Expenses,2023-02-28,Green,1510.0,6839.0,7508.25
0062x00000DYAc2AAH,0012x00000VfoTIAAZ,Newstead,QLD,Australia,Loan Paid,Existing Client-Granted Loan Before,0.0,58.94,1896.9633,3.0,1.0,0.0,2.0,3.0,11363.3961,3.0,19.0,769.8407,10886.5866,10753.92,1.0,0.77,1.0,0.0,10000.0,1499.0,3000.0,1200,1584.0,3.0,9.857,Monthly,39.0,11362.09,2050.0,Full-Time Employment,3.0,0.0,0.978,1.0,10886.5866,3628.0,6979.2266,528.0,MoneySpot,0.0,5016483,3.0,07-04-2023,False,Relocation Expenses,2023-04-07,Orange,0.0,12661.0,11362.09
0062x00000EELO4AAP,0012x00000kaYJIAA2,Forest Lake,QLD,Australia,Loan Paid,New Client-New Loan,0.0,48.75,889.6875,1.0,0.0,0.0,2.0,1.0,4311.6995,0.0,24.0,0.0,782.8571,684.0,0.0,0.0,0.0,0.0,750.0,2000.0,500.0,1200,1728.0,25.0,25.143,Weekly,39.0,5195.03,5000.0,Casual Employment,0.0,0.0,0.044,0.0,3653.3333,0.0,750.75,69.12,MoneySpot,0.0,6006627,0.0,25-07-2023,False,Relocation Expenses,2023-07-25,Green,0.0,9111.0,5195.03
0062x00000DZkzrAAD,0012x00000hXQbLAAW,Blacktown,NSW,Australia,Loan Paid,Existing Client-No Loan Granted Ever,0.0,43.91,1308.75,2.0,0.0,0.0,4.0,2.0,5334.2358,2.0,12.0,0.0,2338.7716,2057.68,0.0,0.0,0.0,0.0,0.0,899.0,920.0,1200,1536.0,4.0,7.0,Fortnightly,28.0,5334.24,1800.0,,2.0,0.0,0.022,1.0,4677.5433,0.0,1032.5,384.0,MoneySpot,0.0,5110834,0.0,22-04-2023,False,Home Maintenance & Repairs,2023-04-22,Orange,0.0,5233.0,5334.24
0062x00000DGDWAAA5,0012x00000cATd5AAG,CASTLE HILL,NSW,Australia,Loan Paid,Existing Client-No Loan Granted Ever,0.0,48.47,2089.5274,2.0,0.0,0.0,3.0,2.0,9747.3128,0.0,33.0,452.3547,2313.3871,2220.61,0.0,0.15,0.0,0.0,6922.73,899.0,500.0,1100,1452.0,6.0,11.714,Fortnightly,67.0,9747.31,1100.0,Full-Time Employment,0.0,0.0,0.8571,0.0,5397.9033,832.0,2447.3833,242.0,MoneySpot,0.0,4709692,0.0,18-02-2023,False,Other,2023-02-18,Green,0.0,11460.0,9747.31
0062x00000FWbDFAA1,0012x00000hWjNOAA0,Abbotsford,NSW,Australia,Closed Lost,Existing Client-Granted Loan Before,0.4,67.4,6373.3983,1.0,0.0,4.0,2.0,1.0,15905.5899,0.0,0.0,536.1385,1493.38,1257.6,1.0,40.26,0.0,0.0,0.0,599.0,600.0,1500,2040.0,14.0,14.714,Weekly,34.0,24950.24,1500.0,Full-Time Employment,0.0,0.0,0.2857,0.0,7521.9666,1580.0,6882.3666,145.71,QuickCash,,7686632,0.0,03-01-2024,False,Living Expenses,2023-12-30,Orange,116.0,28293.0,24950.24
0062x00000Ebe4RAAR,0012x00000c8AbWAAU,Homebush,NSW,Australia,Loan Paid,Existing Client-No Loan Granted Ever,0.0,82.81,2438.0,2.0,0.0,0.0,4.0,2.0,6066.0938,0.0,13.0,0.0,1661.3266,1569.62,0.0,52.36,0.0,0.0,0.0,899.0,600.0,1200,1776.0,14.0,28.286,Fortnightly,35.0,6066.09,4000.0,,0.0,0.0,0.978,0.0,3322.6533,0.0,2438.0,126.86,MoneySpot,0.0,6303510,0.0,23-08-2023,False,Vehicle Expenses,2023-08-23,Green,0.0,11795.0,6066.09
0062x00000DrPfSAAV,0012x00000hYqiVAAS,Logan Reserve,QLD,Australia,Closed Lost,New Client-New Loan,0.0,91.07,890.9733,2.0,0.0,0.0,2.0,2.0,4780.0455,2.0,4.0,0.0,1940.23,1843.62,0.0,13.31,0.0,0.0,0.0,0.0,300.0,1200,1536.0,3.0,5.286,Fortnightly,29.0,9350.05,2000.0,,2.0,0.0,0.3956,0.0,4527.2033,0.0,1985.1033,512.0,MoneySpot,,5166193,1.0,30-04-2023,False,One-off purchase,2023-04-30,Green,0.0,10080.0,9350.05
0062x00000D6unnAAB,0012x00000e0FB2AAM,Lorne,VIC,Australia,Closed Lost,Existing Client-No Loan Granted Ever,0.0,59.17,512.9526,1.0,0.0,0.0,4.0,1.0,3831.1342,0.0,22.0,210.6137,881.6858,936.18,0.0,0.0,0.0,0.0,4030.0,400.0,500.0,1200,1632.0,16.0,16.286,Weekly,34.0,3831.13,5000.0,Contract Employment,0.0,0.0,0.1099,0.0,3526.7433,433.0,432.85,102.0,MoneySpot,,4458808,0.0,11-01-2023,False,Medical Expenses,2023-01-11,Green,0.0,3527.0,3831.13
0062x00000FVOr5AAH,0012x00000BHQL0AAP,Gillen,NT,Australia,Loan Paid,Existing Client-Granted Loan Before,0.0,80.81,2248.45,1.0,0.0,0.0,2.0,1.0,9002.9029,2.0,35.0,0.0,734.9369,1302.42,1.0,18.22,0.0,0.0,4050.95,599.0,100.0,1250,1700.0,15.0,14.857,Weekly,36.0,9910.67,1250.0,Full-Time Employment,2.0,0.0,0.6264,2.0,6159.9233,2622.0,4504.3733,113.33,MoneySpot,0.0,7588815,2.0,21-12-2023,False,Travel Expenses,2023-12-20,Green,0.0,13480.0,9910.67
0062x00000ELYETAA5,0012x00000gnAanAAE,Sunshine West,VIC,Australia,Loan Paid,Existing Client-Granted Loan Before,0.0,74.27,2651.1399,1.0,0.0,0.0,2.0,1.0,8602.6007,0.0,29.0,0.0,690.4223,510.36,0.0,11.36,0.0,0.0,0.0,899.0,540.0,1250,1950.0,36.0,36.571,Weekly,29.0,8804.69,2050.0,Full-Time Employment,0.0,0.0,0.0,0.0,2991.83,117.0,4392.6366,54.17,MoneySpot,0.0,6040493,0.0,29-07-2023,False,Other Expenses,2023-07-28,Green,0.0,10437.0,8804.69
0062x00000D2IncAAF,0012x00000g9WUnAAM,Melbourne,VIC,Australia,Closed Lost,New Client-New Loan,0.06,67.12,5138.4432,2.0,0.0,0.0,4.0,2.0,12940.5924,0.0,10.0,0.0,3903.3971,4597.71,1.0,0.05,0.0,0.0,3000.0,2000.0,1912.0,1200,1536.0,3.0,5.714,Fortnightly,32.0,12940.59,2000.0,Full-Time Employment,0.0,0.0,0.022,0.0,9107.9266,0.0,5335.6933,512.0,QuickCash,,4438612,0.0,08-01-2023,False,Living Expenses,2023-01-08,Green,13.0,18711.0,12940.59
0062x00000FjsaYAAR,0012x00000hYa3GAAS,Bairnsdale,VIC,Australia,Closed Lost,Existing Client-Granted Loan Before,0.0,76.25,93.8567,1.0,0.0,0.0,2.0,1.0,4842.9275,0.0,15.0,93.8571,832.8542,713.02,0.0,0.0,1.0,0.0,0.0,400.0,165.0,1500,2040.0,14.0,14.571,Weekly,24.0,7147.2,1500.0,Full-Time Employment,0.0,0.0,0.0879,0.0,1943.3266,94.0,163.7733,145.71,MoneySpot,,8095818,0.0,2024-02-07,False,Vehicle Expenses,2024-02-03,Orange,0.0,5938.0,7147.2
0062x00000DIPQWAA5,0012x00000Mij5SAAR,Blacktown,NSW,Australia,Loan Paid,Existing Client-Granted Loan Before,0.0,66.07,6001.9222,4.0,0.0,0.0,3.0,4.0,9393.3766,0.0,50.0,2169.9962,3451.2662,4578.38,1.0,0.08,0.0,0.0,6500.0,1499.0,250.0,1500,1980.0,5.0,10.0,Fortnightly,25.0,9879.71,2100.0,Full-Time Employment,0.0,0.0,0.9121,0.0,9203.3766,3201.0,6702.1833,396.0,MoneySpot,0.0,4831184,0.0,09-03-2023,False,Home Maintenance & Repairs,2023-03-09,Orange,0.0,10247.0,9879.71
0062x00000D7MlhAAF,0012x00000g9wpMAAQ,Villawood,NSW,Australia,Closed Lost,New Client-New Loan,0.0,70.24,0.0,1.0,0.0,0.0,2.0,1.0,3944.2338,0.0,16.0,0.0,581.4545,439.09,0.0,0.0,0.0,0.0,350.0,2000.0,470.0,1200,1632.0,16.0,16.429,Weekly,21.0,4022.41,5000.0,Casual Employment,0.0,0.0,0.0,0.0,2132.0,0.0,0.0,102.0,MoneySpot,,4480445,0.0,15-01-2023,False,Other Expenses,2023-01-14,Green,0.0,7648.0,4022.41
0062x00000DsRJNAA3,0012x00000cvYI8AAM,Rockdale,NSW,Australia,Closed Lost,Existing Client-Granted Loan Before,22.91,32.6,623.1566,1.0,0.0,2.0,1.0,1.0,6926.2436,0.0,4.0,0.0,998.7421,1010.2,0.0,0.0,0.0,1.0,740.0,400.0,0.0,1500,2040.0,14.0,13.714,Weekly,31.0,6926.24,2050.0,Unemployed,0.0,0.0,0.0,0.0,1863.1766,0.0,923.4766,145.71,QuickCash,,5239757,0.0,15-05-2023,False,Medical Expenses,2023-05-10,Orange,1863.0,8131.0,6926.24
0062x00000FgvVuAAJ,0012x00000nPx5oAAC,Higgins,ACT,Australia,Loan Paid,Existing Client-No Loan Granted Ever,0.0,31.87,3448.863,2.0,0.0,0.0,3.0,2.0,8424.7144,0.0,21.0,0.0,1980.48,1960.19,0.0,0.0,0.0,0.0,6056.69,899.0,2520.0,1200,1632.0,7.0,13.571,Fortnightly,47.0,7024.71,2000.0,Full-Time Employment,0.0,0.0,0.033,0.0,5183.96,0.0,3421.38,233.14,QuickCash,0.0,7853990,0.0,2024-01-14,False,utilities_bill,2024-01-14,Orange,0.0,12323.0,7024.71
0062x00000DVOJUAA5,0012x00000fnCGGAA2,North Willoughby,NSW,Australia,Loan Paid,Existing Client-No Loan Granted Ever,0.0,59.72,875.1917,1.0,0.0,0.0,2.0,1.0,4937.7274,0.0,45.0,272.9244,894.71,892.09,1.0,0.0,0.0,0.0,3633.62,899.0,0.0,1200,1584.0,9.0,9.143,Weekly,52.0,7832.84,2100.0,Full-Time Employment,0.0,0.0,0.0549,0.0,894.71,251.0,2367.2866,176.0,MoneySpot,3.5,5441565,0.0,30-05-2023,False,Living Expenses,2023-05-30,Green,0.0,4986.0,7832.84
0062x00000DIBesAAH,0012x00000Tsw6xAAB,Mudgee,NSW,Australia,Loan Paid,Existing Client-Granted Loan Before,0.0,33.73,1609.1253,1.0,0.0,0.0,4.0,1.0,4786.2803,16.0,0.0,0.0,1070.8153,1029.0,1.0,0.0,0.0,0.0,4766.67,599.0,800.0,1500,2040.0,13.0,13.286,Weekly,45.0,4786.28,2050.0,Full-Time Employment,16.0,0.0,0.033,9.0,4640.2,833.0,1787.18,156.92,MoneySpot,0.0,4820941,15.0,08-03-2023,False,Living Expenses,2023-03-08,Green,0.0,5040.0,4786.28
0062x00000D8wzYAAR,0012x00000gmUPkAAM,Wentworth Point,NSW,Australia,Closed Lost,New Client-New Loan,0.0,92.46,0.0,2.0,0.0,0.0,4.0,2.0,4923.3314,0.0,2.0,0.0,1951.5616,1981.42,0.0,0.0,0.0,0.0,0.0,0.0,200.0,1200,1536.0,3.0,6.0,Fortnightly,38.0,5917.33,1500.0,,0.0,0.0,0.7692,0.0,3903.1233,0.0,35.0,512.0,MoneySpot,,4557144,0.0,31-01-2023,False,Wedding,2023-01-26,Green,0.0,5575.0,5917.33
0062x00000DGuGPAA1,0012x00000MhjnQAAR,Rooty Hill,NSW,Australia,Loan Paid,Existing Client-Granted Loan Before,0.0,62.02,3830.3807,1.0,1.0,0.0,3.0,1.0,8625.7441,4.0,0.0,943.2,1823.23,1823.23,1.0,21.06,0.0,1.0,8172.76,1499.0,2200.0,1500,2040.0,14.0,13.857,Weekly,42.0,8625.74,1500.0,Full-Time Employment,5.0,0.0,0.0,3.0,0.0,1525.0,5679.0933,145.71,Financier-2,0.0,4748742,5.0,24-02-2023,False,Veterinary Expenses,2023-02-24,Green,0.0,14897.0,8625.74
0062x00000DtPFeAAN,0012x000003fWTCAA2,Crestmead,QLD,Australia,Loan Paid,Existing Client-Granted Loan Before,0.0,75.24,1255.2494,4.0,0.0,0.0,2.0,4.0,16820.8332,0.0,28.0,681.8174,3502.5,3750.0,1.0,0.34,0.0,1.0,4333.33,599.0,400.0,1500,2040.0,14.0,13.857,Weekly,35.0,16453.5,2050.0,Full-Time Employment,0.0,0.0,0.0,0.0,1300.0,339.0,3357.04,145.71,MoneySpot,0.0,5311929,0.0,20-05-2023,False,Vehicle Expenses,2023-05-20,Orange,0.0,19738.0,16453.5
0062x00000FK1DHAA1,0012x00000XDc7AAAT,Tom Price,WA,Australia,Loan Paid,Existing Client-Granted Loan Before,0.0,38.93,1847.2799,3.0,0.0,0.0,5.0,3.0,10541.1633,0.0,16.0,0.0,10207.83,6753.07,1.0,0.0,0.0,0.0,9592.57,899.0,230.0,1500,1980.0,3.0,11.857,Monthly,41.0,11143.64,1500.0,Full-Time Employment,0.0,0.0,0.2308,0.0,10207.83,1287.0,2927.1133,660.0,MoneySpot,0.0,7361107,0.0,01-12-2023,False,Life Event Expenses,2023-11-30,Green,0.0,11323.0,11143.64
0062x00000EyNhXAAV,0012x00000lfcSoAAI,Mount Waverley,VIC,Australia,Loan Paid,New Client-New Loan,0.0,43.79,1560.0029,2.0,0.0,0.0,1.0,2.0,5470.3971,6.0,40.0,0.0,1769.9985,1815.54,0.0,0.0,0.0,0.0,1815.0,2000.0,1197.0,1200,1728.0,13.0,25.857,Fortnightly,37.0,4192.4,1200.0,Full-Time Employment,6.0,0.0,0.0549,4.0,4129.9966,0.0,1637.3866,132.92,QuickCash,0.0,6733588,0.0,04-10-2023,False,Veterinary Expenses,2023-10-04,Orange,0.0,6237.0,4192.4
0062x00000DZhLEAA1,0012x00000hYKZnAAO,Dulwich Hill,NSW,Australia,Loan Paid,New Client-New Loan,1.0,31.09,542.4554,2.0,0.0,0.0,4.0,2.0,4031.7011,0.0,8.0,267.2321,1855.6871,1844.31,0.0,3.07,0.0,0.0,0.0,0.0,1000.0,1200,1584.0,5.0,10.0,Fortnightly,63.0,4403.27,3000.0,,0.0,0.0,0.9231,0.0,4329.9366,82.0,845.75,316.8,MoneySpot,0.0,5108050,0.0,21-04-2023,False,Vehicle - Service,2023-04-21,Green,46.0,4566.0,4403.27
0062x00000EbAYFAA3,0012x00000IOichAAD,st andrews,NSW,Australia,Loan Paid,Existing Client-Granted Loan Before,36.3,59.3,1122.1445,1.0,0.0,4.0,2.0,4.0,5824.0478,1.0,3.0,0.0,1137.8,1084.9,1.0,20.58,0.0,0.0,0.0,599.0,0.0,1250,1850.0,15.0,29.429,Fortnightly,40.0,8747.08,1250.0,,1.0,0.0,0.8681,0.0,3034.1333,396.0,993.06,123.33,MoneySpot,0.0,6274109,1.0,21-08-2023,True,Vehicle Expenses,2023-08-21,Green,3034.0,8356.0,8747.08
0062x00000D8l89AAB,0012x00000dzhmrAAA,Henley Brook,WA,Australia,Loan Paid,Existing Client-No Loan Granted Ever,27.91,96.01,1721.1452,1.0,0.0,0.0,3.0,1.0,4098.6345,6.0,20.0,112.3244,876.6616,1050.43,0.0,22.04,0.0,0.0,216.67,400.0,100.0,1200,1584.0,9.0,9.143,Weekly,24.0,5109.81,2100.0,Contract Employment,6.0,0.0,1.0,2.0,1753.3233,287.0,696.8,176.0,MoneySpot,0.0,4548688,6.0,25-01-2023,False,Medical accommodation,2023-01-25,Green,1078.0,3862.0,5109.81
0062x00000DXNXrAAP,0012x000003fSd3AAE,Berwick,VIC,Australia,Loan Paid,Existing Client-Granted Loan Before,21.22,72.79,2653.1977,1.0,0.0,2.0,2.0,1.0,5674.9467,3.0,74.0,2143.3241,497.8169,510.62,0.0,0.03,1.0,0.0,0.0,599.0,0.0,1100,1408.0,9.0,8.714,Weekly,35.0,5674.95,2500.0,Part-Time Employment,3.0,0.0,0.0,3.0,4369.9533,1714.0,3308.19,156.44,MoneySpot,0.0,4969636,2.0,31-03-2023,False,Travel Expenses,2023-03-31,Green,1244.0,5860.0,5674.95
0062x00000DFJ6QAAX,0012x00000INSScAAP,Port Macquarie,NSW,Australia,Loan Paid,Existing Client-Granted Loan Before,0.0,86.97,1867.8961,1.0,2.0,0.0,3.0,1.0,3368.3541,16.0,58.0,0.0,822.8,871.0,0.0,0.0,0.0,0.0,860.0,899.0,400.0,1300,1768.0,16.0,15.714,Weekly,27.0,3368.35,1300.0,Casual Employment,16.0,0.0,0.3516,3.0,2742.6666,563.0,3599.5433,110.5,MoneySpot,0.0,4660301,15.0,11-02-2023,False,Vehicle Expenses,2023-02-10,Green,0.0,3591.0,3368.35
0062x00000EODRlAAP,0012x00000kZmqbAAC,Doveton,VIC,Australia,Closed Lost,Existing Client-No Loan Granted Ever,0.0,63.6,1511.9485,1.0,0.0,0.0,3.0,1.0,4206.472,9.0,43.0,0.0,901.7476,1004.14,0.0,0.11,0.0,0.0,0.0,400.0,400.0,1200,1728.0,23.0,23.0,Weekly,35.0,4206.47,5000.0,Full-Time Employment,9.0,0.0,0.2088,1.0,3907.5733,0.0,1198.4033,75.13,MoneySpot,,6241046,0.0,17-08-2023,False,Vehicle Expenses,2023-08-17,Green,0.0,6087.0,4206.47
0062x00000E4JWlAAN,0012x00000iINXZAA4,Lara,VIC,Australia,Loan Paid,New Client-New Loan,0.0,40.42,2094.3609,1.0,0.0,0.0,2.0,1.0,6826.9873,1.0,42.0,0.0,1346.6935,1446.98,1.0,0.0,0.0,0.0,0.0,0.0,100.0,1200,1584.0,11.0,10.714,Weekly,24.0,6826.99,2500.0,,1.0,0.0,0.022,0.0,6284.57,0.0,2360.48,144.0,MoneySpot,0.0,5556389,1.0,09-06-2023,False,Vehicle Expense,2023-06-09,Green,0.0,6288.0,6826.99
0062x00000EMkAwAAL,0012x00000kfxShAAI,Wheelers Hill,VIC,Australia,Closed Lost,Existing Client-No Loan Granted Ever,0.0,92.29,783.6299,2.0,0.0,0.0,3.0,2.0,4103.7536,1.0,14.0,0.0,1714.2471,1661.98,0.0,0.0,0.0,0.0,0.0,0.0,0.0,1200,1728.0,12.0,23.571,Fortnightly,22.0,4103.75,5000.0,Full-time,1.0,0.0,0.0,0.0,3999.91,0.0,830.53,144.0,MoneySpot,,6127395,0.0,11-08-2023,False,Investments,2023-08-06,Green,0.0,5422.0,4103.75
0062x00000ENxfqAAD,0012x00000kaRdNAAU,Bligh Park,NSW,Australia,Closed Lost,Existing Client-No Loan Granted Ever,0.0,27.56,0.0,1.0,0.0,0.0,3.0,1.0,3985.6608,1.0,3.0,0.0,843.6944,948.68,0.0,33.36,0.0,0.0,0.0,400.0,600.0,1200,1824.0,34.0,34.286,Weekly,32.0,3985.66,2050.0,,1.0,0.0,0.0,0.0,2531.0833,0.0,0.0,53.65,MoneySpot,,6219308,0.0,20-08-2023,False,Other Expenses,2023-08-15,Green,0.0,7380.0,3985.66
0062x00000DXUd5AAH,0012x00000gmiWaAAI,Melton West,VIC,Australia,Loan Paid,Existing Client-No Loan Granted Ever,0.0,91.99,215.8036,1.0,0.0,0.0,2.0,1.0,4944.5503,0.0,7.0,150.0845,999.4954,1094.47,0.0,0.0,0.0,0.0,1762.37,400.0,0.0,1200,1536.0,6.0,6.571,Weekly,20.0,4944.55,2000.0,Full-Time Employment,0.0,0.0,0.0,0.0,3664.8166,81.0,110.8433,256.0,MoneySpot,0.0,4976426,0.0,01-04-2023,False,Living Expenses,2023-03-31,Green,0.0,4563.0,4944.55
0062x00000DsZLNAA3,0012x000003DhqgAAC,Wollert,VIC,Australia,Loan Paid,Existing Client-Granted Loan Before,0.0,69.04,205.89,2.0,0.0,0.0,3.0,2.0,8161.2996,0.0,12.0,0.0,3756.435,3633.08,0.0,100.0,0.0,0.0,5581.33,899.0,1040.0,1200,1584.0,7.0,13.0,Fortnightly,54.0,25829.63,5000.0,Full-Time Employment,0.0,0.0,0.0,0.0,7512.87,439.0,645.0433,226.29,MoneySpot,0.0,5248016,0.0,12-05-2023,False,Travel Expenses,2023-05-12,Orange,0.0,33741.0,25829.63
0062x00000DGz0lAAD,0012x00000Tuuz4AAB,BALLARAT NORTH,VIC,Australia,Loan Paid,Existing Client-Granted Loan Before,0.0,45.08,1071.1777,1.0,0.0,0.0,5.0,1.0,4931.189,15.0,36.0,38.1568,752.6584,699.2,1.0,0.0,0.0,0.0,2265.47,899.0,200.0,1500,2040.0,14.0,14.0,Weekly,22.0,5087.3,1500.0,Full-Time Employment,15.0,0.0,0.0,9.0,3261.52,592.0,2882.3866,145.71,MoneySpot,0.06,4753537,0.0,25-02-2023,False,Medical - Dental,2023-02-25,Green,0.0,7114.0,5087.3
0062x00000FJtjsAAD,0012x00000lI37pAAC,Erskineville,NSW,Australia,Loan Paid,Existing Client-No Loan Granted Ever,0.0,34.61,3914.5046,1.0,0.0,0.0,1.0,1.0,9357.6266,4.0,9.0,0.0,1442.08,1442.08,0.0,0.32,0.0,0.0,0.0,899.0,2000.0,1200,1584.0,12.0,11.714,Weekly,45.0,9357.63,4000.0,Full-Time Employment,5.0,0.0,0.9231,3.0,7526.49,0.0,4902.9433,132.0,MoneySpot,0.0,7355433,2.0,30-11-2023,False,Vehicle Expenses,2023-11-29,Green,0.0,11872.0,9357.63
0062x00000EdALYAA3,0012x00000cKw3gAAC,Blacktown,NSW,Australia,Loan Paid,Existing Client-No Loan Granted Ever,0.0,70.04,684.7733,2.0,0.0,0.0,4.0,2.0,4038.217,0.0,9.0,0.0,1858.6866,2037.72,0.0,0.02,0.0,0.0,0.0,400.0,290.0,1200,1728.0,13.0,24.857,Fortnightly,27.0,4038.22,2050.0,,0.0,0.0,0.0,0.0,3717.3733,0.0,723.4333,132.92,MoneySpot,0.0,6402384,0.0,02-09-2023,False,Furniture or Appliances,2023-09-02,Green,0.0,8301.0,4038.22
0062x00000E3lUuAAJ,0012x000003DEvNAAW,Dubbo,NSW,Australia,Loan Paid,Existing Client-Granted Loan Before,0.0,53.17,4524.6913,1.0,1.0,0.0,3.0,1.0,10887.9396,2.0,25.0,2389.3985,1202.0007,1215.42,2.0,0.45,0.0,1.0,5451.98,899.0,450.0,1200,1632.0,16.0,16.286,Weekly,46.0,13910.42,2500.0,Full-Time Employment,2.0,0.0,0.011,1.0,3014.1966,2434.0,5771.8233,102.0,MoneySpot,0.0,5515847,2.0,06-06-2023,False,Furniture or Appliances,2023-06-05,Orange,0.0,13430.0,13910.42
0062x00000F4M4wAAF,0012x00000lg0y9AAA,Westcourt,QLD,Australia,Closed Lost,Existing Client-No Loan Granted Ever,0.0,77.94,250.3017,1.0,0.0,0.0,3.0,1.0,3413.7531,2.0,6.0,0.0,770.289,768.1,2.0,0.0,0.0,0.0,3250.0,400.0,0.0,1200,1824.0,33.0,33.0,Weekly,58.0,3850.42,2050.0,Full-Time Employment,2.0,0.0,0.1648,0.0,2634.2966,0.0,148.3333,55.27,MoneySpot,,7127695,1.0,09-11-2023,False,Vehicle Expenses,2023-11-09,Green,0.0,3071.0,3850.42
0062x00000D9CIoAAN,0012x00000gmbNWAAY,Blacktown,NSW,Australia,Closed Lost,New Client-New Loan,0.0,70.52,0.0,1.0,0.0,0.0,4.0,1.0,6137.805,0.0,3.0,0.0,992.9,1161.39,0.0,22.58,0.0,0.0,0.0,0.0,0.0,1200,1632.0,15.0,14.714,Weekly,30.0,8171.53,5000.0,,0.0,0.0,0.022,0.0,2316.7666,0.0,0.0,108.8,MoneySpot,,4570157,0.0,31-01-2023,False,Investments,2023-01-28,Green,0.0,12400.0,8171.53
0062x00000EedY1AAJ,0012x00000hXqdnAAC,Hurstville,NSW,Australia,Closed Lost,Existing Client-No Loan Granted Ever,0.0,71.55,623.8635,2.0,0.0,0.0,3.0,2.0,5906.8785,0.0,6.0,0.0,1256.35,1459.15,0.0,0.15,0.0,0.0,0.0,400.0,400.0,1200,1680.0,10.0,20.143,Fortnightly,31.0,7506.88,5000.0,Full-time,0.0,0.0,0.0,0.0,4639.76,0.0,2045.6166,168.0,MoneySpot,,6507390,0.0,17-09-2023,False,Travel Expenses,2023-09-12,Green,0.0,11347.0,7506.88
0062x00000DUvB8AAL,0012x00000hXzJDAA0,Monash,ACT,Australia,Loan Paid,Existing Client-No Loan Granted Ever,25.12,42.88,1364.9389,2.0,0.0,2.0,3.0,2.0,5990.2468,0.0,8.0,559.1235,1899.9928,1893.36,1.0,1.57,0.0,0.0,0.0,400.0,150.0,1200,1584.0,5.0,9.857,Fortnightly,33.0,5990.25,3500.0,Full-Time Employment,0.0,0.0,0.0,0.0,5986.5466,389.0,1007.15,316.8,MoneySpot,0.0,5401129,0.0,26-05-2023,False,Vehicle Expenses,2023-05-26,Green,1553.0,6182.0,5990.25
0062x00000EDDgYAAX,0012x00000hYTkEAAW,Lutwyche,QLD,Australia,Closed Lost,Existing Client-No Loan Granted Ever,0.0,53.65,928.828,1.0,0.0,0.0,5.0,1.0,6094.192,0.0,8.0,0.0,1075.4533,854.52,0.0,0.78,0.0,0.0,0.0,899.0,250.0,1200,1632.0,17.0,16.714,Weekly,38.0,6094.19,2050.0,,0.0,0.0,0.0,0.0,5219.5533,0.0,1921.6666,96.0,MoneySpot,,5929384,0.0,21-07-2023,False,Other Expenses,2023-07-17,Green,0.0,5376.0,6094.19
0062x00000DJ0ndAAD,0012x00000RrucVAAR,Ovingham,SA,Australia,Loan Paid,Existing Client-Granted Loan Before,0.0,74.5,4051.9008,2.0,0.0,0.0,2.0,2.0,10541.9787,8.0,58.0,1939.4811,3018.4016,3045.76,0.0,0.19,0.0,0.0,7348.61,599.0,980.0,1300,1716.0,5.0,9.0,Fortnightly,37.0,7560.65,1300.0,Full-Time Employment,8.0,0.0,0.0,2.0,6036.8033,2627.0,5212.3833,343.2,MoneySpot,0.0,4867038,7.0,15-03-2023,False,Living Expenses,2023-03-15,Green,0.0,11768.0,7560.65
0062x00000D1WQzAAN,0012x00000fnEkcAAE,Hurstville,NSW,Australia,Closed Lost,Existing Client-No Loan Granted Ever,0.0,81.26,860.8989,1.0,0.0,0.0,4.0,1.0,4905.2766,0.0,20.0,0.0,976.52,976.52,0.0,0.0,0.0,0.0,0.0,2000.0,200.0,1200,1584.0,11.0,11.571,Weekly,51.0,5367.94,4000.0,Full-Time Employment,0.0,0.0,0.8132,0.0,4231.5866,511.0,619.3033,144.0,MoneySpot,,4394700,0.0,02-01-2023,False,Living Expenses,2023-01-02,Green,0.0,5969.0,5367.94
0062x00000DIvAAAA1,0012x00000gpREzAAM,Trevallyn,TAS,Australia,Loan Paid,New Client-New Loan,0.41,17.66,1080.0,1.0,0.0,0.0,3.0,1.0,6497.6508,2.0,6.0,0.0,1209.3585,1293.77,0.0,29.86,0.0,0.0,0.0,0.0,1280.0,1200,1536.0,6.0,6.286,Weekly,34.0,6502.65,1500.0,,2.0,0.0,0.1429,1.0,5643.6733,0.0,1136.8766,256.0,MoneySpot,0.0,4861885,0.0,15-03-2023,False,Medical - Dental,2023-03-14,Green,26.0,6317.0,6502.65
0062x00000Ex3RpAAJ,0012x00000lJaUqAAK,Craigieburn,VIC,Australia,Closed Lost,New Client-New Loan,0.0,96.77,0.0,0.0,0.0,0.0,0.0,0.0,0.0,0.0,0.0,0.0,0.0,0.0,0.0,0.0,0.0,0.0,0.0,0.0,1080.0,1500,1920.0,6.0,6.571,Weekly,27.0,763.55,1500.0,part_time,0.0,0.0,0.0,0.0,697.1966,0.0,101.4433,320.0,MoneySpot,,6635028,0.0,25-09-2023,False,rental_bond_cleaning,2023-09-24,Orange,0.0,103.0,763.55
0062x00000DZ5cNAAT,0012x00000hXz40AAC,Box Hill,VIC,Australia,Loan Paid,New Client-New Loan,0.0,69.73,658.2179,2.0,0.0,0.0,2.0,2.0,4879.8045,7.0,27.0,0.0,1729.44,1488.4,0.0,1.0,0.0,0.0,0.0,0.0,1041.0,1200,1536.0,3.0,6.429,Fortnightly,38.0,4879.8,8500.0,,7.0,0.0,0.033,3.0,4227.2866,0.0,818.4833,512.0,MoneySpot,0.0,5073021,0.0,16-04-2023,False,Emergency medical expenses,2023-04-16,Orange,0.0,10569.0,4879.8
0062x00000DWEgbAAH,0012x00000gq5oQAAQ,Hamilton Hill,WA,Australia,Loan Paid,New Client-New Loan,0.0,36.87,0.0,2.0,0.0,0.0,3.0,2.0,4721.2696,0.0,2.0,0.0,2159.4228,2221.65,1.0,0.0,0.0,0.0,0.0,0.0,1840.0,1200,1536.0,3.0,5.286,Fortnightly,26.0,5068.32,2000.0,,0.0,0.0,0.0,0.0,5038.6533,0.0,31.5133,512.0,MoneySpot,0.0,4904284,0.0,21-03-2023,False,Vehicle - Repairs,2023-03-21,Green,0.0,6183.0,5068.32
0062x00000Ebm6pAAB,0012x00000iIdGKAA0,Jan Juc,VIC,Australia,Loan Paid,Existing Client-Granted Loan Before,0.26,40.41,1200.5052,1.0,0.0,0.0,3.0,1.0,10070.2397,26.0,62.0,0.0,1364.8569,1307.98,0.0,51.54,0.0,0.0,1000.0,899.0,400.0,1250,1700.0,14.0,14.0,Weekly,27.0,10880.86,1250.0,Full-Time Employment,26.0,0.0,0.0,2.0,9314.38,679.0,1861.9533,121.43,QuickCash,0.0,6312942,4.0,24-08-2023,False,Travel Expenses,2023-08-24,Orange,40.0,14899.0,10880.86
0062x00000DVvhoAAD,0012x00000dblRWAAY,Kawana,QLD,Australia,Loan Paid,Existing Client-Granted Loan Before,0.0,38.21,1309.0392,2.0,0.0,0.0,2.0,2.0,3513.9857,9.0,35.0,507.8082,1617.3966,1759.82,1.0,0.0,0.0,0.0,0.0,599.0,600.0,1250,1800.0,12.0,24.571,Fortnightly,44.0,3513.99,2050.0,,9.0,0.0,0.5495,4.0,3234.7933,525.0,2425.7333,150.0,MoneySpot,0.0,5488602,6.0,03-06-2023,False,Furniture or Appliances,2023-06-02,Green,0.0,3235.0,3513.99
0062x00000DHbRuAAL,0012x00000IO38OAAT,CLARKSON,WA,Australia,Loan Paid,Existing Client-No Loan Granted Ever,0.0,78.69,448.24,1.0,1.0,0.0,3.0,1.0,13734.2108,0.0,0.0,653.1459,3160.75,3743.0,0.0,10.93,0.0,0.0,9250.0,400.0,800.0,1150,1472.0,6.0,5.857,Weekly,46.0,13985.08,1150.0,Full-Time Employment,7.0,0.0,0.8132,3.0,12643.0,630.0,629.8833,245.33,MoneySpot,0.0,4786311,5.0,03-03-2023,False,Other,2023-03-02,Green,0.0,13119.0,13985.08
0062x00000Eyj0pAAB,0012x00000Tso3KAAR,Barney Point,QLD,Australia,Loan Paid,Existing Client-No Loan Granted Ever,0.0,76.95,107.3566,1.0,0.0,0.0,3.0,1.0,3908.5702,10.0,19.0,0.0,860.3838,945.8,1.0,0.0,0.0,0.0,216.67,400.0,370.0,1200,1776.0,29.0,28.857,Weekly,22.0,3908.57,6000.0,Self Employed,10.0,0.0,0.1209,2.0,3728.33,0.0,1164.95,61.24,MoneySpot,0.0,6757282,0.0,06-10-2023,False,Specialist expenses,2023-10-06,Green,0.0,5386.0,3908.57
0062x00000DrXw8AAF,0012x00000SGCVoAAP,Hoppers Crossing,VIC,Australia,Loan Paid,Existing Client-No Loan Granted Ever,2.12,48.03,334.1433,4.0,0.0,0.0,3.0,4.0,1375.2871,0.0,14.0,0.0,1058.9533,1380.92,0.0,0.3,0.0,0.0,2166.67,599.0,0.0,1200,1632.0,7.0,13.429,Fortnightly,25.0,3466.03,3000.0,Casual Employment,0.0,0.0,0.011,0.0,1058.9533,0.0,406.1433,233.14,MoneySpot,0.0,5173797,0.0,02-05-2023,False,Living Expenses,2023-05-02,Orange,93.0,4375.0,3466.03
0062x00000DIRg6AAH,0012x00000dwlNBAAY,Mount Druitt,NSW,Australia,Loan Paid,Existing Client-No Loan Granted Ever,0.0,39.54,620.0465,2.0,0.0,0.0,3.0,2.0,6079.3925,0.0,35.0,0.0,1823.94,1878.24,1.0,3.37,0.0,0.0,0.0,599.0,600.0,1200,1584.0,5.0,8.857,Fortnightly,26.0,6079.39,2050.0,Full-Time Employment,0.0,0.0,0.0769,0.0,3647.88,0.0,1176.0333,316.8,MoneySpot,0.0,4833922,0.0,10-03-2023,False,Living Expenses,2023-03-09,Green,0.0,6489.0,6079.39
0062x00000D7c5GAAR,0012x00000gA4I9AAK,Caversham,WA,Australia,Closed Lost,New Client-New Loan,0.6,9.4,1165.3804,2.0,0.0,0.0,4.0,2.0,4734.5445,2.0,25.0,1098.7152,2165.2266,2350.8,3.0,0.0,0.0,0.0,0.0,0.0,100.0,1200,1584.0,5.0,10.429,Fortnightly,25.0,4704.21,2350.0,,2.0,0.0,0.0879,1.0,4330.4533,902.0,1074.4433,316.8,MoneySpot,,4492107,2.0,17-01-2023,False,Holiday / Travel,2023-01-16,Green,27.0,4461.0,4704.21
0062x00000F09l5AAB,0012x00000hXqdnAAC,Hurstville,NSW,Australia,Closed Lost,Existing Client-No Loan Granted Ever,0.0,67.1,652.7335,2.0,0.0,0.0,3.0,2.0,7919.0326,0.0,7.0,0.0,1523.0328,2016.21,0.0,0.02,0.0,0.0,0.0,599.0,600.0,1200,1632.0,7.0,13.286,Fortnightly,31.0,7919.03,2050.0,Full-time,0.0,0.0,0.0,0.0,6858.07,0.0,2333.95,233.14,MoneySpot,,6859748,0.0,21-10-2023,False,Travel Expenses,2023-10-17,Green,0.0,9857.0,7919.03
0062x00000DVWGXAA5,0010K0000281p9uQAA,Dunbogan,NSW,Australia,Loan Paid,Existing Client-Granted Loan Before,0.0,45.85,1113.6022,1.0,0.0,0.0,2.0,1.0,3525.906,4.0,71.0,327.7876,811.4418,811.22,2.0,0.0,0.0,0.0,3033.33,400.0,0.0,1200,1632.0,14.0,14.0,Weekly,61.0,3525.91,1200.0,Full-Time Employment,4.0,0.0,0.7473,0.0,2975.2866,977.0,1997.3533,116.57,Financier-2,0.0,5453230,4.0,31-05-2023,False,Medical Expenses,2023-05-31,Orange,0.0,3551.0,3525.91
0062x00000DrjSEAAZ,0012x00000hZ1dlAAC,Railton,TAS,Australia,Closed Lost,New Client-New Loan,1.1,36.97,774.9319,1.0,0.0,3.0,3.0,1.0,5931.4444,0.0,18.0,0.0,931.0375,1091.25,1.0,1.32,0.0,0.0,4727.67,400.0,0.0,1200,1536.0,6.0,6.143,Weekly,25.0,5931.44,2000.0,Full-Time Employment,0.0,0.0,0.022,0.0,3077.25,0.0,841.23,256.0,Financier-2,,5187795,0.0,08-05-2023,False,Living Expenses,2023-05-03,Green,53.0,4783.0,5931.44
0062x00000DXDI3AAP,0012x00000XKOTkAAP,ORMISTON,QLD,Australia,Closed Lost,Existing Client-No Loan Granted Ever,0.54,24.95,944.8499,1.0,0.0,0.0,2.0,1.0,4956.7486,2.0,25.0,0.0,977.77,759.96,1.0,0.84,0.0,0.0,0.0,0.0,2000.0,1200,1536.0,6.0,5.857,Weekly,31.0,4956.75,1200.0,Full-Time Employment,8.0,0.0,0.0,5.0,4562.9266,0.0,823.9966,256.0,MoneySpot,,4960920,1.0,30-03-2023,False,Purchase - Furniture,2023-03-29,Green,26.0,4765.0,4956.75
0062x00000DIsddAAD,0012x00000RqgSzAAJ,Kingsthorpe,QLD,Australia,Closed Lost,Existing Client-Granted Loan Before,0.0,71.58,6058.8875,4.0,0.0,0.0,3.0,4.0,5951.8133,0.0,68.0,1809.8558,2194.43,2586.15,1.0,0.0,0.0,0.0,4303.48,599.0,600.0,1400,1848.0,6.0,11.286,Fortnightly,52.0,5951.81,1400.0,Full-Time Employment,0.0,0.0,0.0,0.0,5851.8133,3332.0,7151.62,308.0,Financier-2,,4860430,0.0,14-03-2023,False,Medical Expenses,2023-03-14,Orange,0.0,6188.0,5951.81
0062x00000D1k0tAAB,0012800001VofatAAB,Glendale,NSW,Australia,Loan Paid,Existing Client-Granted Loan Before,2.84,75.9,4242.8119,2.0,4.0,0.0,3.0,2.0,7548.3171,15.0,55.0,645.0623,2295.3742,2713.6,1.0,0.0,0.0,0.0,3683.33,599.0,900.0,1500,2040.0,7.0,14.143,Fortnightly,35.0,4986.97,1500.0,Part-Time Employment,15.0,0.0,0.6923,7.0,5355.8733,2055.0,7112.65,291.43,QuickCash,0.0,4408411,11.0,04-01-2023,False,Vehicle Expenses,2023-01-04,Green,276.0,9710.0,4986.97
0062x00000D9vrEAAR,0012x00000VdIjSAAV,Mawson Lakes,SA,Australia,Loan Paid,Existing Client-Granted Loan Before,0.0,58.55,3952.7286,1.0,0.0,0.0,3.0,1.0,4601.9707,0.0,56.0,0.0,939.1823,907.46,1.0,8.14,0.0,0.0,5719.84,899.0,100.0,1450,2030.0,18.0,18.0,Weekly,38.0,4601.97,5000.0,Full-Time Employment,3.0,0.0,0.1429,0.0,4069.79,1524.0,4980.05,112.78,MoneySpot,0.0,4604488,3.0,02-02-2023,False,Living Expenses,2023-02-02,Green,0.0,37124.0,4601.97
0062x00000F1oOuAAJ,0012x00000ldFv4AAE,Park Ridge,QLD,Australia,Loan Paid,New Client-New Loan,0.0,42.69,0.0,1.0,0.0,0.0,2.0,1.0,6391.9256,0.0,30.0,0.0,1260.8735,1427.18,0.0,14.39,0.0,0.0,0.0,0.0,2080.0,1200,1632.0,15.0,15.286,Weekly,33.0,7002.22,3000.0,full_time,0.0,0.0,0.0,0.0,5884.0766,0.0,9.4433,108.8,MoneySpot,0.0,6922646,0.0,23-10-2023,False,rental_bond_cleaning,2023-10-23,Green,0.0,12053.0,7002.22
0062x00000DFKB5AAP,0012x00000Ws9T6AAJ,Greenbank,QLD,Australia,Closed Lost,Existing Client-No Loan Granted Ever,0.57,85.28,0.0,2.0,0.0,0.0,4.0,2.0,4376.2033,3.0,5.0,0.0,1619.1842,1622.99,0.0,0.0,0.0,0.0,0.0,899.0,560.0,1200,1584.0,5.0,9.857,Fortnightly,40.0,4376.2,3000.0,Full-time,3.0,0.0,0.1429,0.0,3778.0966,0.0,142.95,316.8,MoneySpot,,4661280,2.0,11-02-2023,False,Living Expenses,2023-02-10,Green,27.0,4663.0,4376.2
0062x00000D1vFrAAJ,0012x00000g9HtYAAU,Devonport,TAS,Australia,Loan Paid,New Client-New Loan,0.0,58.63,545.6506,1.0,0.0,0.0,1.0,1.0,9956.1308,0.0,21.0,0.0,844.71,997.07,0.0,0.0,0.0,0.0,0.0,0.0,2000.0,1200,1536.0,6.0,5.857,Weekly,42.0,12289.46,2000.0,,0.0,0.0,0.033,0.0,3660.41,754.0,1256.5833,256.0,MoneySpot,0.0,4418066,0.0,08-01-2023,False,Event - Holiday - Accommodation,2023-01-08,Green,0.0,13885.0,12289.46
0062x00000DFX1DAAX,0012x00000g8BHsAAM,Dharruk,NSW,Australia,Loan Paid,Existing Client-Granted Loan Before,13.08,19.54,404.8,2.0,0.0,4.0,4.0,2.0,3192.1379,0.0,0.0,303.6,1075.8985,848.34,0.0,0.08,0.0,0.0,5200.0,400.0,100.0,1250,1700.0,14.0,14.571,Weekly,20.0,3347.48,1250.0,Part-Time Employment,0.0,0.0,0.0,0.0,3012.98,611.0,1181.2,121.43,MoneySpot,0.0,4673359,0.0,13-02-2023,False,Living Expenses,2023-02-13,Green,503.0,3843.0,3347.48
0062x00000Dr9soAAB,0012x00000hYiDqAAK,Granville,NSW,Australia,Closed Lost,New Client-New Loan,0.0,82.85,0.0,2.0,0.0,0.0,3.0,2.0,7201.8251,1.0,9.0,0.0,1049.48,1050.21,0.0,0.0,0.0,0.0,0.0,0.0,400.0,1200,1776.0,15.0,30.0,Fortnightly,37.0,7201.83,5500.0,,1.0,0.0,0.022,1.0,3809.8533,0.0,0.0,118.4,MoneySpot,,5149064,0.0,02-05-2023,False,University & Course Fees,2023-04-27,Green,0.0,15107.0,7201.83
0062x00000DILGMAA5,0012x00000gmXiAAAU,Kurunjang,VIC,Australia,Loan Paid,Existing Client-Granted Loan Before,0.0,18.41,1330.1557,1.0,0.0,0.0,2.0,1.0,6838.9716,0.0,6.0,0.0,1286.9864,1126.2,0.0,28.17,0.0,0.0,0.0,599.0,1600.0,1200,1584.0,12.0,11.857,Weekly,52.0,6838.97,1500.0,,0.0,0.0,0.989,0.0,6005.9366,213.0,1080.0,132.0,QuickCash,0.0,4828314,0.0,09-03-2023,False,Home Maintenance & Repairs,2023-03-09,Orange,0.0,6521.0,6838.97
0062x00000DXVs4AAH,0012x00000hX666AAC,MIDLAND,NT,Australia,Closed Lost,New Client-New Loan,19.03,22.8,0.0,2.0,0.0,0.0,4.0,2.0,2186.8214,0.0,0.0,0.0,1006.5375,1066.77,0.0,0.0,0.0,0.0,0.0,0.0,0.0,1500,1920.0,6.0,6.571,Weekly,53.0,2186.82,1500.0,,0.0,0.0,0.8462,0.0,1342.05,0.0,0.0,320.0,MoneySpot,,4978335,0.0,01-04-2023,False,Other,2023-04-01,Orange,347.0,1823.0,2186.82
0062x00000DGOQmAAP,0012x00000AAOQpAAP,WOODCROFT,SA,Australia,Loan Paid,Existing Client-Granted Loan Before,0.0,72.85,278.41,1.0,0.0,0.0,3.0,1.0,6213.155,2.0,4.0,0.0,821.1,731.0,0.0,12.16,0.0,0.0,0.0,0.0,150.0,1500,2040.0,14.0,14.429,Weekly,25.0,5559.14,1500.0,,2.0,0.0,0.011,2.0,2737.0,0.0,451.9666,145.71,MoneySpot,0.0,4720641,0.0,20-02-2023,False,Business - Equipment Purchase,2023-02-20,Green,0.0,8415.0,5559.14
0062x00000DsHAzAAN,0012x00000hZMVqAAO,Mount Lawley,WA,Australia,Loan Paid,New Client-New Loan,0.0,51.93,610.9066,1.0,0.0,0.0,2.0,1.0,2845.2267,0.0,18.0,0.0,654.7925,426.1,1.0,0.0,0.0,0.0,550.0,2000.0,220.0,1100,1496.0,14.0,14.143,Weekly,21.0,3003.91,1100.0,Casual Employment,0.0,0.0,0.0,0.0,2619.17,0.0,571.36,106.86,QuickCash,0.0,5230011,0.0,09-05-2023,False,Vehicle Expenses,2023-05-09,Orange,0.0,2846.0,3003.91
0062x00000D2PLgAAN,0010K00001zHde6QAC,Moonah,TAS,Australia,Closed Lost,Existing Client-No Loan Granted Ever,21.96,69.44,1227.574,2.0,0.0,4.0,4.0,2.0,3143.5351,0.0,30.0,497.2615,917.0633,1098.97,0.0,0.0,0.0,0.0,2985.67,400.0,400.0,1200,1584.0,5.0,10.571,Fortnightly,47.0,6676.09,3000.0,Part-Time Employment,0.0,0.0,0.044,0.0,2024.8366,626.0,1356.54,316.8,MoneySpot,,4444222,0.0,14-01-2023,False,Consonadate 2 pay day loans into 1,2023-01-09,Green,1265.0,5758.0,6676.09
0062x00000DAs15AAD,0012x00000fmNarAAE,South Kalgoorlie,WA,Australia,Loan Paid,Existing Client-No Loan Granted Ever,0.19,39.64,2489.8265,2.0,1.0,0.0,3.0,2.0,5629.3007,1.0,28.0,1003.75,2591.0214,1535.39,1.0,0.0,0.0,0.0,2742.96,899.0,2200.0,1200,1632.0,7.0,14.0,Fortnightly,46.0,5830.13,1500.0,Full-Time Employment,4.0,0.0,0.1648,2.0,6045.7166,220.0,4837.99,233.14,MoneySpot,0.0,4649127,3.0,09-02-2023,False,Living Expenses,2023-02-09,Orange,13.0,6766.0,5830.13
0062x00000DrFNaAAN,0012x00000dbXVeAAM,ROSEMEADOW,NSW,Australia,Closed Lost,Existing Client-No Loan Granted Ever,0.0,92.39,0.0,0.0,0.0,0.0,0.0,0.0,0.0,0.0,0.0,0.0,0.0,0.0,0.0,0.12,0.0,0.0,0.0,0.0,600.0,1200,1536.0,6.0,6.571,Weekly,37.0,6526.89,1200.0,,0.0,0.0,0.0769,0.0,0.0,0.0,0.0,256.0,MoneySpot,,5154341,0.0,01-05-2023,False,Other,2023-04-28,Orange,0.0,18509.0,6526.89
0062x00000D1bAnAAJ,0012x00000g98KsAAI,Lara,VIC,Australia,Closed Lost,New Client-New Loan,0.0,34.74,149.6533,1.0,0.0,0.0,4.0,1.0,8514.1877,0.0,23.0,0.0,1952.9857,1702.23,0.0,0.0,0.0,0.0,0.0,0.0,2000.0,1200,1536.0,6.0,6.286,Weekly,32.0,9325.27,2000.0,,0.0,0.0,0.2967,0.0,9113.9333,0.0,605.7166,256.0,MoneySpot,,4399104,0.0,05-01-2023,False,Event - Holiday - Accommodation,2023-01-02,Green,0.0,10602.0,9325.27
0062x00000D1w6OAAR,0012x00000SHWrlAAH,Maddington,WA,Australia,Loan Paid,Existing Client-Granted Loan Before,0.0,80.98,927.1134,2.0,0.0,0.0,2.0,2.0,6854.2387,2.0,44.0,992.0,2296.935,2337.29,0.0,0.0,2.0,0.0,4703.67,899.0,1320.0,1200,1584.0,7.0,12.857,Fortnightly,46.0,6854.24,2000.0,Full-Time Employment,2.0,0.0,0.033,1.0,4593.87,410.0,1939.7333,226.29,QuickCash,0.0,4418622,0.0,05-01-2023,False,Living Expenses,2023-01-05,Orange,0.0,6253.0,6854.24
0062x00000DFBM5AAP,0010K00001b0WW7QAM,Langford,WA,Australia,Loan Paid,Existing Client-Granted Loan Before,26.09,78.6,533.6533,4.0,1.0,2.0,4.0,4.0,8053.776,22.0,50.0,1224.0,397.6588,1000.0,2.0,0.31,0.0,1.0,2437.5,599.0,200.0,1500,2040.0,7.0,13.0,Fortnightly,55.0,8207.23,1500.0,Unemployed,22.0,0.0,0.8022,11.0,3287.3566,818.0,1310.5266,291.43,MoneySpot,0.0,4654773,7.0,10-02-2023,False,Life Event Expenses,2023-02-10,Green,2551.0,9775.0,8207.23
0062x00000DALiMAAX,0012x00000fm9zZAAQ,CHATSWOOD,NSW,Australia,Loan Paid,Existing Client-No Loan Granted Ever,0.0,66.43,255.9,1.0,0.0,0.0,6.0,1.0,5610.6281,0.0,1.0,0.0,619.9807,694.75,0.0,0.0,0.0,0.0,3033.33,400.0,1200.0,1200,1632.0,14.0,14.143,Weekly,42.0,5610.63,2000.0,Full-Time Employment,0.0,0.0,0.0,0.0,2686.5833,0.0,286.5266,116.57,MoneySpot,0.0,4625837,0.0,06-02-2023,False,Education - Course Fees,2023-02-06,Orange,0.0,8866.0,5610.63
0062x00000DA7b3AAD,0012x00000XOmaUAAT,Broken Hill,NSW,Australia,Loan Paid,Existing Client-Granted Loan Before,0.0,88.51,6907.9007,4.0,0.0,0.0,3.0,4.0,11107.7666,0.0,204.0,809.6682,1933.13,4806.29,1.0,0.14,0.0,0.0,6211.54,1499.0,100.0,1500,2040.0,7.0,13.714,Fortnightly,35.0,12218.18,1500.0,Part-Time Employment,0.0,0.0,0.8901,0.0,6443.7666,931.0,10726.3666,291.43,MoneySpot,0.0,4613685,0.0,04-02-2023,False,Living Expenses,2023-02-03,Green,0.0,12487.0,12218.18
0062x00000DXYuSAAX,0012x00000Rpx8hAAB,Yarrawonga,VIC,Australia,Loan Paid,Existing Client-Granted Loan Before,0.0,52.58,921.1869,1.0,1.0,0.0,3.0,1.0,7919.2665,3.0,14.0,0.0,1713.9684,933.36,0.0,0.0,0.0,0.0,2000.0,2000.0,450.0,1500,1920.0,9.0,8.571,Weekly,37.0,7919.27,1500.0,Full-Time Employment,3.0,0.0,0.011,0.0,7427.1966,345.0,2204.6266,213.33,QuickCash,0.0,4982579,1.0,02-04-2023,False,Living Expenses,2023-04-02,Green,0.0,7899.0,7919.27
0062x00000DAxYXAA1,0010K0000274zuTQAQ,Caringbah,NSW,Australia,Loan Paid,Existing Client-Granted Loan Before,0.0,61.02,952.6738,1.0,0.0,0.0,1.0,1.0,6689.0368,0.0,52.0,68.0,1467.8333,1709.0,1.0,5.84,0.0,1.0,281666.67,899.0,1200.0,1200,1632.0,16.0,15.571,Weekly,55.0,6710.49,2050.0,Full-Time Employment,0.0,0.0,0.0,0.0,0.0,147.0,1908.1066,102.0,QuickCash,0.0,4653296,0.0,10-02-2023,False,Travel Expenses,2023-02-09,Green,0.0,7511.0,6710.49
0062x00000DIXg2AAH,0012x00000gpEQ2AAM,Blacktown,NSW,Australia,Closed Lost,New Client-New Loan,0.0,65.69,0.0,1.0,0.0,0.0,2.0,1.0,6113.2459,0.0,5.0,0.0,1304.09,1030.26,0.0,0.11,0.0,0.0,0.0,0.0,0.0,1200,1632.0,15.0,14.714,Weekly,37.0,6113.25,5000.0,,0.0,0.0,0.0659,0.0,5651.0566,0.0,0.0,108.8,MoneySpot,,4838059,0.0,14-03-2023,False,Car Repairs,2023-03-10,Green,0.0,6098.0,6113.25
0062x00000DsOE5AAN,0012x00000WVcniAAD,TORONTO,NSW,Australia,Closed Lost,Existing Client-No Loan Granted Ever,0.0,71.66,7938.1925,2.0,0.0,0.0,3.0,2.0,9632.3067,0.0,17.0,0.0,3962.64,3962.64,2.0,0.09,0.0,0.0,0.0,0.0,900.0,1200,1584.0,7.0,13.143,Fortnightly,40.0,9632.31,1750.0,,0.0,0.0,0.9121,0.0,7925.28,0.0,9367.7133,226.29,MoneySpot,,5237298,0.0,14-05-2023,False,Holiday / Travel,2023-05-10,Orange,0.0,11397.0,9632.31
0062x00000FJHeAAAX,0012x00000flpliAAA,Riverview,QLD,Australia,Closed Lost,Existing Client-No Loan Granted Ever,46.3,81.25,185.1162,1.0,1.0,2.0,3.0,1.0,6265.917,20.0,24.0,71.3705,620.8,408.0,1.0,0.0,0.0,0.0,0.0,2000.0,440.0,1500,1920.0,2.0,5.571,Monthly,29.0,9275.24,1500.0,,20.0,0.0,0.0,7.0,4157.77,66.0,213.8733,960.0,QuickCash,,7312436,4.0,25-11-2023,False,Living Expenses,2023-11-24,Orange,3123.0,6745.0,9275.24
0062x00000FWVROAA5,0012x00000goRdCAAU,Bracken Ridge,QLD,Australia,Closed Lost,Existing Client-Granted Loan Before,35.8,54.71,1753.6399,4.0,0.0,4.0,4.0,4.0,7742.7858,0.0,35.0,0.0,2004.4357,415.53,0.0,0.0,0.0,0.0,0.0,899.0,1733.0,1500,2040.0,7.0,14.714,Fortnightly,44.0,7742.79,1500.0,Part-Time Employment,0.0,0.0,0.0659,0.0,7720.6766,0.0,2250.0366,291.43,QuickCash,,7675113,0.0,01-01-2024,False,Living Expenses,2023-12-29,Orange,3044.0,8502.0,7742.79
0062x00000FWDM5AAP,0012x00000kZcnKAAS,Saint Andrews,NSW,Australia,Loan Paid,Existing Client-Granted Loan Before,0.0,71.5,5122.4658,2.0,0.0,0.0,3.0,2.0,8233.9532,4.0,74.0,251.5676,3178.9766,2943.91,2.0,19.21,0.0,0.0,0.0,599.0,1000.0,1300,1768.0,8.0,15.143,Fortnightly,55.0,8238.95,2050.0,Full-Time Employment,4.0,0.0,0.8462,0.0,6357.9533,717.0,5876.33,221.0,MoneySpot,0.0,7652410,0.0,27-12-2023,False,Furniture or Appliances,2023-12-27,Orange,0.0,8028.0,8238.95
0062x00000DW20XAAT,0012x00000BJ4ouAAD,Bourkelands,NSW,Australia,Closed Lost,Existing Client-Granted Loan Before,0.0,99.01,921.2593,1.0,0.0,0.0,1.0,1.0,812.7455,0.0,53.0,133.8333,187.0428,406.0,0.0,0.15,0.0,1.0,948.0,599.0,450.0,1500,2040.0,14.0,13.857,Weekly,33.0,872.87,5000.0,Full-Time Employment,0.0,0.0,0.011,0.0,0.0,347.0,1960.05,145.71,MoneySpot,,4891729,0.0,23-03-2023,False,Living Expenses,2023-03-18,Orange,0.0,1942.0,872.87
0062x00000DXOtIAAX,0012x00000g7tduAAA,Armidale,NSW,Australia,Loan Paid,Existing Client-Granted Loan Before,20.52,47.34,740.1688,2.0,0.0,2.0,4.0,2.0,4967.2676,11.0,2.0,0.0,1184.8214,1228.13,1.0,0.0,0.0,1.0,0.0,899.0,440.0,1500,1920.0,4.0,8.0,Fortnightly,34.0,4941.5,2050.0,,11.0,0.0,0.2198,2.0,1124.39,228.0,1200.7733,480.0,MoneySpot,0.0,4970532,2.0,01-04-2023,False,Travel Expenses,2023-03-31,Orange,1124.0,5476.0,4941.5
0062x00000D7QulAAF,0012x00000dc3LFAAY,Ashgrove,QLD,Australia,Loan Paid,Existing Client-Granted Loan Before,0.0,65.93,1457.3417,0.0,0.0,0.0,0.0,0.0,0.0,0.0,62.0,738.6855,0.0,0.0,1.0,0.0,0.0,0.0,900.0,899.0,0.0,1500,2040.0,14.0,14.143,Weekly,47.0,5131.87,3000.0,Part-Time Employment,5.0,0.0,0.0,1.0,4724.1333,990.0,3709.4633,145.71,MoneySpot,0.0,4483683,0.0,16-01-2023,False,Child Expenses,2023-01-15,Orange,0.0,792.0,5131.87
0062x00000DFSgRAAX,0012x00000gnagEAAQ,Charlemont,VIC,Australia,Loan Paid,New Client-New Loan,0.0,29.48,1876.9177,2.0,0.0,0.0,3.0,2.0,7914.367,0.0,15.0,475.5429,1835.55,2157.89,0.0,0.08,0.0,0.0,4983.33,1499.0,800.0,1200,1584.0,6.0,12.571,Fortnightly,30.0,9624.73,4000.0,Part-Time Employment,2.0,0.0,0.0,0.0,5233.3,470.0,1885.4,264.0,MoneySpot,0.0,4669919,0.0,12-02-2023,False,Other Expenses,2023-02-12,Green,0.0,8269.0,9624.73
0062x00000D72uXAAR,0010K00002COwU4QAL,Middle Ridge,QLD,Australia,Loan Paid,Existing Client-Granted Loan Before,47.18,48.25,174.9502,2.0,0.0,2.0,3.0,2.0,7577.6083,6.0,80.0,512.0,1533.5914,1976.67,2.0,0.0,0.0,0.0,0.0,1499.0,1060.0,1500,2040.0,7.0,14.0,Fortnightly,36.0,7582.61,1500.0,,6.0,0.0,0.9011,1.0,7380.6333,473.0,569.5,291.43,MoneySpot,0.0,4465056,0.0,12-01-2023,False,Medical Expenses,2023-01-12,Green,3882.0,8227.0,7582.61
0062x00000DsLQ3AAN,0012x00000ILmWLAA1,Willbriggie,NSW,Australia,Loan Paid,Existing Client-Granted Loan Before,0.0,94.69,612.0934,1.0,0.0,0.0,2.0,1.0,4480.1372,3.0,26.0,480.1461,678.325,670.9,0.0,27.16,0.0,0.0,2.17,400.0,100.0,1300,1664.0,6.0,6.0,Weekly,44.0,6195.73,1300.0,Unemployed,3.0,0.0,0.7033,1.0,3165.5166,505.0,651.8066,277.33,MoneySpot,0.0,5235204,0.0,10-05-2023,False,Vehicle Expenses,2023-05-09,Green,0.0,6591.0,6195.73
0062x00000DUo7OAAT,0012x00000XAnSyAAL,Brewarrina,NSW,Australia,Loan Paid,Existing Client-No Loan Granted Ever,19.71,78.52,1951.3842,2.0,0.0,4.0,3.0,2.0,4174.2241,4.0,25.0,0.0,1501.18,1221.68,2.0,0.0,0.0,0.0,2721.8,899.0,220.0,1200,1536.0,3.0,5.0,Fortnightly,33.0,5984.1,2000.0,Full-Time Employment,8.0,0.0,0.1209,4.0,3718.4266,0.0,1779.3966,512.0,MoneySpot,0.0,5390633,0.0,26-05-2023,False,Car maintanace,2023-05-25,Green,947.0,4803.0,5984.1
0062x00000E3yovAAB,0012x00000hYdhtAAC,Kingswood,NSW,Australia,Closed Lost,Existing Client-No Loan Granted Ever,0.0,67.79,2570.0748,2.0,0.0,0.0,3.0,2.0,3460.7139,1.0,11.0,12.8,1246.348,1299.82,1.0,0.0,0.0,0.0,0.0,2000.0,0.0,1200,1584.0,7.0,13.143,Fortnightly,37.0,7595.4,3000.0,Full-Time Employment,5.0,0.0,0.033,3.0,5652.03,60.0,4644.8366,226.29,MoneySpot,,5530850,1.0,11-06-2023,False,Medical Expenses,2023-06-07,Orange,0.0,3643.0,7595.4
0062x00000E7ei2AAB,0012x00000SHqEqAAL,Birkdale,QLD,Australia,Loan Paid,Existing Client-Granted Loan Before,0.0,21.19,229.4268,2.0,0.0,0.0,4.0,2.0,6103.7337,0.0,5.0,0.0,2809.39,2740.93,0.0,0.77,0.0,0.0,3064.98,599.0,940.0,1250,1700.0,9.0,17.286,Fortnightly,55.0,6108.73,1250.0,Full-Time Employment,0.0,0.0,0.2418,0.0,5618.78,176.0,199.3333,188.89,QuickCash,0.0,5835761,0.0,05-07-2023,False,Medical Expenses,2023-07-05,Green,0.0,5619.0,6108.73
0062x00000DZD4tAAH,0012x00000hY3OqAAK,Denham Court,NSW,Australia,Loan Paid,New Client-New Loan,0.0,54.31,2986.4439,2.0,0.0,0.0,4.0,2.0,4701.9269,0.0,19.0,157.6442,2164.175,2180.56,0.0,0.0,1.0,0.0,0.0,0.0,1160.0,1200,1536.0,3.0,6.571,Fortnightly,40.0,4755.26,2000.0,,0.0,0.0,0.044,0.0,4328.35,97.0,3057.1,512.0,MoneySpot,0.0,5079760,0.0,17-04-2023,False,Vehicle - Service,2023-04-17,Orange,0.0,8458.0,4755.26
0062x00000ExP3iAAF,0012x00000MixoaAAB,Amaroo,ACT,Australia,Loan Paid,Existing Client-No Loan Granted Ever,0.0,57.0,1635.4816,1.0,0.0,0.0,1.0,1.0,3809.6966,4.0,30.0,0.0,876.7523,835.69,1.0,9.56,0.0,0.0,2924.26,599.0,1200.0,1200,1728.0,23.0,22.857,Weekly,48.0,4004.03,2050.0,Full-Time Employment,4.0,0.0,0.044,2.0,3799.26,0.0,1875.33,75.13,MoneySpot,2.78,6660631,3.0,27-09-2023,False,Other Expenses,2023-09-27,Green,0.0,4810.0,4004.03
0062x00000EydWDAAZ,0012x00000lfnazAAA,Portland,VIC,Australia,Closed Lost,New Client-New Loan,0.0,43.11,0.0,2.0,0.0,0.0,3.0,2.0,2686.1752,0.0,2.0,0.0,1080.44,1909.4,0.0,2.46,0.0,0.0,3250.0,400.0,1320.0,1150,1794.0,18.0,35.0,Fortnightly,22.0,6321.81,15000.0,Contract Employment,0.0,0.0,0.0,0.0,2876.82,0.0,98.3233,99.67,MoneySpot,,6750607,0.0,05-10-2023,False,Living Expenses,2023-10-05,Green,0.0,2726.0,6321.81
0062x00000DtFgUAAV,0012x00000LRcJZAA1,Granville,NSW,Australia,Closed Lost,Existing Client-No Loan Granted Ever,0.0,29.3,119.8033,4.0,0.0,0.0,2.0,4.0,3895.4032,0.0,19.0,0.0,1353.535,1672.97,0.0,0.22,0.0,0.0,1744.65,899.0,1000.0,1200,1632.0,7.0,14.0,Fortnightly,30.0,3895.4,6500.0,Part-Time Employment,0.0,0.0,0.0,0.0,2707.07,0.0,845.2,233.14,MoneySpot,,5299026,0.0,22-05-2023,False,"Dental,Purchase",2023-05-17,Orange,0.0,9489.0,3895.4
0062x00000E41JWAAZ,0012x00000iICbaAAG,Blacktown,NSW,Australia,Closed Lost,New Client-New Loan,0.0,53.31,1216.2599,2.0,0.0,0.0,3.0,2.0,5609.7707,0.0,38.0,1126.1231,2355.1166,2025.08,0.0,0.14,0.0,0.0,0.0,0.0,0.0,1200,1584.0,5.0,9.143,Fortnightly,66.0,5609.77,2000.0,,0.0,0.0,0.1868,0.0,4710.2333,839.0,1216.26,316.8,MoneySpot,,5532932,0.0,11-06-2023,False,Other,2023-06-07,Green,0.0,6548.0,5609.77
0062x00000DXTLxAAP,0012x00000IMasBAAT,Bass Hill,NSW,Australia,Closed Lost,Existing Client-Granted Loan Before,0.0,33.25,1261.2006,1.0,0.0,0.0,2.0,1.0,3989.7693,0.0,11.0,0.0,918.1938,910.72,0.0,24.75,0.0,0.0,3474.58,599.0,100.0,1200,1536.0,8.0,8.571,Weekly,27.0,4583.1,1200.0,Part-Time Employment,3.0,0.0,0.0,0.0,4572.1733,466.0,1310.6466,192.0,MoneySpot,,4974027,3.0,01-04-2023,False,Vehicle Expenses,2023-03-31,Green,0.0,3979.0,4583.1
0062x00000D9fB8AAJ,0012x00000g8TDZAA2,Albion,VIC,Australia,Loan Paid,Existing Client-Granted Loan Before,0.44,45.37,926.9813,1.0,0.0,0.0,2.0,1.0,4236.3742,0.0,19.0,0.0,827.1207,948.77,0.0,13.95,0.0,1.0,0.0,400.0,0.0,1500,2040.0,14.0,14.0,Weekly,48.0,4236.37,1500.0,,0.0,0.0,0.0,0.0,0.0,652.0,799.6666,145.71,QuickCash,0.0,4593142,0.0,01-02-2023,False,Child Expenses,2023-01-31,Green,27.0,6093.0,4236.37
0062x00000D73wiAAB,0012x00000g9nSQAAY,Blue Haven,NSW,Australia,Closed Lost,New Client-New Loan,18.27,56.3,2169.6105,1.0,0.0,2.0,1.0,1.0,5578.4912,0.0,61.0,0.0,758.9707,804.51,0.0,0.0,0.0,1.0,0.0,0.0,2360.0,1200,1584.0,9.0,8.714,Weekly,37.0,7021.82,3000.0,,0.0,0.0,0.0,0.0,2093.87,0.0,2080.78,176.0,MoneySpot,,4465581,0.0,12-01-2023,False,Travel/holiday,2023-01-12,Green,1496.0,8188.0,7021.82
0062x00000D2OeRAAV,0012x00000LOqGWAA1,Ayr,QLD,Australia,Loan Paid,Existing Client-Granted Loan Before,0.0,31.89,712.8347,1.0,0.0,0.0,3.0,1.0,6920.207,3.0,46.0,253.2635,815.423,947.5,2.0,1.21,0.0,0.0,2153.98,1499.0,1000.0,1050,1386.0,10.0,10.429,Weekly,41.0,6920.21,1500.0,Full-Time Employment,3.0,0.0,0.0,2.0,3533.5,430.0,998.24,138.6,MoneySpot,0.0,4443525,0.0,09-01-2023,False,Vehicle Expenses,2023-01-09,Orange,0.0,7349.0,6920.21
0062x00000DVopYAAT,0012x00000MiPJ9AAN,Ararat,VIC,Australia,Loan Paid,Existing Client-Granted Loan Before,0.0,49.02,1952.6899,1.0,0.0,0.0,3.0,1.0,7699.8607,8.0,48.0,0.0,1737.5023,1459.59,0.0,0.0,0.0,0.0,0.0,400.0,1000.0,1500,2040.0,14.0,13.857,Weekly,60.0,7699.86,2050.0,,13.0,0.0,0.1758,7.0,7529.1766,1420.0,2098.3333,145.71,MoneySpot,0.0,5477809,11.0,02-06-2023,False,Medical Expenses,2023-06-02,Orange,0.0,7746.0,7699.86
0062x00000D20bZAAR,0012800001SDUKqAAP,Blacktown,NSW,Australia,Loan Paid,Existing Client-Granted Loan Before,0.0,66.36,634.6666,4.0,2.0,0.0,5.0,4.0,1415.0,4.0,17.0,849.1807,849.0,1100.0,0.0,0.0,0.0,0.0,0.0,400.0,0.0,1500,1980.0,10.0,9.857,Weekly,39.0,3863.56,1500.0,,4.0,0.0,0.2088,4.0,1415.0,1242.0,1242.3666,198.0,QuickCash,0.0,4422956,4.0,06-01-2023,False,Vehicle Expenses,2023-01-05,Orange,0.0,3864.0,3863.56
0062x00000Dsv1OAAR,0012x00000hZkeMAAS,Carramar,NSW,Australia,Loan Paid,New Client-New Loan,0.0,52.71,496.8,1.0,0.0,0.0,4.0,1.0,6684.9141,0.0,13.0,0.0,1538.4461,1209.89,1.0,0.0,0.0,0.0,0.0,0.0,1650.0,1200,1584.0,9.0,9.571,Weekly,33.0,6684.91,3000.0,,0.0,0.0,0.4066,0.0,6666.6,0.0,890.6666,176.0,MoneySpot,0.0,5273448,0.0,15-05-2023,False,Home - Repairs/Maintenance,2023-05-15,Green,0.0,8158.0,6684.91
0062x00000EcsNoAAJ,0012x00000lGDllAAG,Lake MacDonald,QLD,Australia,Closed Lost,New Client-New Loan,0.0,88.97,1820.6283,1.0,0.0,0.0,5.0,1.0,5399.1745,0.0,18.0,56.1839,1227.0769,1489.0,0.0,0.07,0.0,0.0,1489.0,2000.0,200.0,1200,1680.0,19.0,19.286,Weekly,22.0,5930.75,2200.0,Full-Time Employment,0.0,0.0,0.0,0.0,5317.3333,67.0,1926.11,88.42,MoneySpot,,6383614,0.0,31-08-2023,False,Vehicle Expenses,2023-08-31,Green,0.0,9645.0,5930.75
0062x00000FVqndAAD,0012x00000TH6KiAAL,Jordan Springs,NSW,Australia,Loan Paid,Existing Client-Granted Loan Before,0.0,48.27,1937.15,1.0,0.0,0.0,2.0,1.0,7637.117,0.0,26.0,0.0,1757.5835,1358.88,0.0,0.11,0.0,0.0,1200.0,599.0,1000.0,1500,2040.0,14.0,14.429,Weekly,20.0,7715.45,2050.0,Full-Time Employment,0.0,0.0,0.3846,0.0,8202.0566,887.0,2332.89,145.71,QuickCash,0.0,7627114,0.0,24-12-2023,False,Medical Expenses,2023-12-23,Orange,0.0,9144.0,7715.45
0062x00000ExndkAAB,0012x00000hZ1cIAAS,Sandhurst,VIC,Australia,Loan Paid,Existing Client-No Loan Granted Ever,0.0,85.45,2118.6096,1.0,0.0,0.0,4.0,1.0,4383.7899,8.0,26.0,0.0,1008.8723,1050.01,0.0,0.0,0.0,0.0,1445.17,400.0,50.0,1200,1680.0,20.0,20.0,Weekly,33.0,4440.46,2050.0,Full-Time Employment,8.0,0.0,0.0879,2.0,4371.78,0.0,2126.0366,84.0,MoneySpot,0.0,6687167,4.0,30-09-2023,False,Medical Expenses,2023-09-29,Green,0.0,4712.0,4440.46
0062x00000DHdlwAAD,0010K000023zRqTQAU,Belmont,VIC,Australia,Loan Paid,Existing Client-No Loan Granted Ever,0.19,91.39,358.75,1.0,0.0,0.0,2.0,1.0,5295.9478,0.0,5.0,0.0,771.5808,897.52,0.0,19.69,0.0,0.0,2816.67,599.0,600.0,1200,1536.0,6.0,5.714,Weekly,39.0,5789.28,1200.0,Full-Time Employment,0.0,0.0,0.0,0.0,3086.3233,0.0,358.75,256.0,MoneySpot,0.0,4789056,0.0,03-03-2023,False,Medical - Dental,2023-03-02,Green,13.0,6765.0,5789.28
0062x00000ELXjMAAX,0012x00000SFhzHAAT,RINGWOOD,VIC,Australia,Loan Paid,Existing Client-Granted Loan Before,1.07,65.02,2657.3979,2.0,0.0,4.0,3.0,2.0,4951.6491,0.0,31.0,0.0,2254.2766,1920.03,1.0,0.22,0.0,0.0,3809.0,400.0,1200.0,1500,2100.0,10.0,18.714,Fortnightly,49.0,4951.65,1500.0,Self Employed,0.0,0.0,0.011,0.0,4562.52,657.0,3459.25,210.0,QuickCash,0.0,6040100,0.0,29-07-2023,False,Medical Expenses,2023-07-28,Orange,54.0,5012.0,4951.65
0062x00000DrhTGAAZ,0012x00000hZ0h5AAC,Kilmore,VIC,Australia,Closed Lost,New Client-New Loan,0.0,55.0,870.8666,1.0,0.0,0.0,3.0,1.0,4831.4553,1.0,3.0,0.0,1102.4516,1282.78,1.0,0.0,0.0,0.0,1100.0,2000.0,912.5,1200,1584.0,10.0,10.143,Weekly,27.0,5594.46,3000.0,Full-Time Employment,1.0,0.0,0.0,1.0,5172.8066,0.0,916.3633,158.4,MoneySpot,,5185576,1.0,03-05-2023,False,Living Expenses,2023-05-03,Green,0.0,4964.0,5594.46
0062x00000D2OuuAAF,0012x000003D1h7AAC,Kellyville Ridge,NSW,Australia,Closed Lost,Existing Client-No Loan Granted Ever,0.0,36.22,119.0533,1.0,0.0,0.0,5.0,1.0,6476.417,0.0,19.0,689.8956,1685.8511,1349.82,1.0,0.0,1.0,0.0,3709.33,400.0,400.0,1200,1536.0,6.0,6.571,Weekly,27.0,7044.75,1200.0,Full-Time Employment,0.0,0.0,0.2088,0.0,5057.5533,151.0,337.21,256.0,MoneySpot,,4443941,0.0,09-01-2023,False,Holiday,2023-01-09,Orange,0.0,6709.0,7044.75
0062x00000D8ElIAAV,0012x000005UK8lAAG,TAREE,NSW,Australia,Loan Paid,Existing Client-Granted Loan Before,0.0,59.71,2952.3965,1.0,1.0,0.0,4.0,1.0,4618.0761,5.0,0.0,1047.5317,1046.2976,986.51,2.0,2.19,0.0,0.0,182000.0,400.0,200.0,1500,2040.0,14.0,13.857,Weekly,50.0,4618.08,2050.0,Full-Time Employment,5.0,0.0,0.011,3.0,4533.9566,1121.0,3186.3733,145.71,QuickCash,0.0,4522003,5.0,21-01-2023,False,Other Expenses,2023-01-21,Orange,0.0,5118.0,4618.08
0062x00000ENoozAAD,0012x00000goJalAAE,Griffin,QLD,Australia,Loan Paid,Existing Client-No Loan Granted Ever,0.0,19.75,160.3332,1.0,0.0,0.0,2.0,1.0,2704.6917,5.0,41.0,0.0,536.5323,635.7,0.0,3.13,0.0,0.0,1863.33,400.0,720.0,1200,1872.0,36.0,36.286,Weekly,27.0,2704.69,2000.0,Part-Time Employment,5.0,0.0,0.011,3.0,2324.9733,0.0,481.38,52.0,MoneySpot,0.0,6207173,0.0,14-08-2023,False,appliance_purchase,2023-08-14,Green,0.0,2971.0,2704.69
0062x00000E3akpAAB,0012x00000iHvnOAAS,Toormina,NSW,Australia,Closed Lost,New Client-New Loan,5.28,46.75,1770.5967,2.0,2.0,4.0,3.0,2.0,6278.4407,3.0,9.0,0.0,2043.8333,1972.0,0.0,0.35,0.0,0.0,0.0,0.0,100.0,1200,1632.0,8.0,16.571,Fortnightly,32.0,6508.44,5000.0,,5.0,0.0,0.2857,5.0,5185.2466,0.0,2066.3,204.0,MoneySpot,,5500553,5.0,09-06-2023,False,Car,2023-06-04,Green,514.0,9726.0,6508.44
0062x00000Eyh9RAAR,0012x00000lGgmOAAS,Seaton,SA,Australia,Closed Lost,Existing Client-No Loan Granted Ever,0.0,67.26,1162.6567,1.0,0.0,0.0,3.0,1.0,6446.5074,0.0,10.0,0.0,910.4623,913.58,2.0,0.16,0.0,0.0,0.0,599.0,1800.0,1200,1728.0,23.0,22.857,Weekly,26.0,3956.17,5000.0,Full-Time Employment,0.0,0.0,0.0,0.0,3945.3366,0.0,1091.1866,75.13,MoneySpot,,6756426,0.0,06-10-2023,False,Vehicle Expenses,2023-10-05,Green,0.0,12123.0,3956.17
0062x00000DHMsUAAX,0012x00000foSPSAA2,Preston,VIC,Australia,Loan Paid,Existing Client-Granted Loan Before,0.0,91.75,0.0,4.0,0.0,0.0,1.0,4.0,1540.0,0.0,13.0,512.0,231.0,500.0,0.0,3.04,0.0,1.0,6746.91,1499.0,1000.0,1500,1980.0,3.0,12.571,Monthly,55.0,1022.33,1500.0,Full-Time Employment,0.0,0.0,0.0,0.0,0.0,512.0,512.0,660.0,QuickCash,0.0,4775117,0.0,01-03-2023,False,Living Expenses,2023-03-01,Orange,0.0,2562.0,1022.33
0062x00000D24lXAAR,0012x00000WWa3vAAD,Erskine,WA,Australia,Loan Paid,Existing Client-No Loan Granted Ever,0.23,42.37,2631.139,0.0,0.0,0.0,0.0,0.0,0.0,1.0,27.0,0.0,0.0,0.0,0.0,12.11,0.0,0.0,4753.67,599.0,0.0,1200,1536.0,6.0,5.714,Weekly,34.0,5869.69,1550.0,Full-Time Employment,1.0,0.0,0.1209,1.0,0.0,0.0,2685.9,256.0,MoneySpot,0.0,4426148,1.0,06-01-2023,False,Living Expenses,2023-01-06,Orange,13.0,5433.0,5869.69
0062x00000ECN5wAAH,0012x00000goE9aAAE,Carlton,NSW,Australia,Loan Paid,Existing Client-No Loan Granted Ever,0.0,81.34,2870.7447,2.0,0.0,0.0,4.0,2.0,6210.6118,14.0,64.0,0.0,2858.5833,2722.0,1.0,0.0,0.0,0.0,0.0,599.0,2200.0,1200,1632.0,8.0,16.571,Fortnightly,48.0,6238.61,2500.0,Full-Time Employment,14.0,0.0,0.3187,1.0,5717.1666,609.0,2796.6766,204.0,MoneySpot,0.0,5874329,6.0,10-07-2023,False,Furniture or Appliances,2023-07-10,Green,0.0,5722.0,6238.61
0062x00000E3a1gAAB,0012x00000fmZnsAAE,Wantirna,VIC,Australia,Closed Lost,Existing Client-No Loan Granted Ever,0.0,51.8,281.8433,1.0,0.0,0.0,2.0,1.0,5564.4961,0.0,9.0,0.0,1107.3215,1176.6,0.0,0.27,0.0,0.0,6497.48,899.0,700.0,1200,1920.0,39.0,39.429,Weekly,26.0,5937.24,25700.0,Self Employed,0.0,0.0,0.0,0.0,4798.3933,0.0,744.0766,49.23,MoneySpot,,5499257,0.0,04-06-2023,False,Living Expenses,2023-06-04,Green,0.0,8214.0,5937.24
0062x00000EyPsEAAV,0012x000002aAW8AAM,Salisbury East,SA,Australia,Loan Paid,Existing Client-Granted Loan Before,24.41,33.6,1978.7099,2.0,0.0,0.0,3.0,2.0,4100.0353,4.0,15.0,0.0,1786.6466,1693.64,0.0,0.0,0.0,0.0,4116.67,899.0,1000.0,1500,2160.0,13.0,25.143,Fortnightly,36.0,4100.04,1500.0,Part-Time Employment,4.0,0.0,0.1868,2.0,3573.2933,0.0,1962.4066,166.15,QuickCash,0.0,6735709,1.0,04-10-2023,False,Other Expenses,2023-10-04,Orange,1411.0,5779.0,4100.04
0062x00000Dr5avAAB,0012x00000MiK4yAAF,Brassall,QLD,Australia,Loan Paid,Existing Client-Granted Loan Before,0.31,74.57,260.9601,4.0,0.0,0.0,3.0,4.0,3875.7266,0.0,0.0,0.0,107.082,50.0,1.0,2.55,0.0,1.0,3637.54,1499.0,1740.0,1200,1584.0,5.0,8.857,Fortnightly,37.0,10468.79,2050.0,Part-Time Employment,12.0,0.0,0.011,2.0,6062.49,165.0,654.1633,316.8,MoneySpot,0.0,5146334,0.0,27-04-2023,False,Life Event Expenses,2023-04-27,Orange,13.0,4080.0,10468.79
0062x00000DG35LAAT,0012x00000g7swpAAA,Leopold,VIC,Australia,Loan Paid,Existing Client-Granted Loan Before,0.0,78.62,5628.9265,2.0,0.0,0.0,3.0,2.0,8279.7402,0.0,27.0,0.0,3490.0316,3180.35,0.0,0.0,0.0,0.0,0.0,1499.0,1800.0,1500,2160.0,12.0,22.857,Fortnightly,50.0,8599.07,2050.0,Full-Time Employment,0.0,0.0,0.8791,0.0,7138.9633,1085.0,5738.9833,180.0,QuickCash,0.0,4700509,0.0,17-02-2023,False,Vehicle Expenses,2023-02-16,Green,0.0,9053.0,8599.07
0062x00000F27NHAAZ,0012x00000hZAjMAAW,Newstead,QLD,Australia,Closed Lost,Existing Client-No Loan Granted Ever,0.0,71.34,2321.7533,2.0,0.0,0.0,3.0,2.0,5363.3161,0.0,7.0,0.0,1342.2416,1391.67,0.0,0.35,0.0,0.0,0.0,400.0,800.0,1200,1824.0,17.0,34.143,Fortnightly,35.0,8813.64,5000.0,Full-Time Employment,0.0,0.0,0.0,0.0,2684.4833,0.0,2587.7533,107.29,MoneySpot,,6945657,0.0,30-10-2023,False,Vehicle Expenses,2023-10-25,Green,0.0,10743.0,8813.64
0062x00000DZAj9AAH,0012x00000PwvFGAAZ,Blacktown,NSW,Australia,Loan Paid,Existing Client-Granted Loan Before,13.54,98.28,3997.5639,1.0,0.0,2.0,1.0,1.0,8608.8669,0.0,41.0,767.1548,837.6775,1231.13,1.0,0.0,0.0,1.0,3683.33,1499.0,320.0,1350,1728.0,6.0,6.286,Weekly,35.0,9079.91,2050.0,Part-Time Employment,0.0,0.0,0.0,0.0,1202.2566,1596.0,5701.37,288.0,MoneySpot,0.0,5077713,0.0,17-04-2023,False,Life Event Expenses,2023-04-17,Green,1202.0,8874.0,9079.91
0062x00000DHnssAAD,0012x00000bcUIhAAM,Pacific Pines,QLD,Australia,Loan Paid,Existing Client-Granted Loan Before,0.0,86.86,428.1145,4.0,0.0,0.0,3.0,4.0,75.0,4.0,24.0,284.1117,22.5,55.0,0.0,1.73,0.0,1.0,2514.0,599.0,600.0,1300,1716.0,13.0,12.714,Weekly,36.0,2689.52,2050.0,Full-Time Employment,4.0,0.0,0.033,0.0,0.0,689.0,688.6666,132.0,QuickCash,0.0,4799072,4.0,04-03-2023,False,Other Expenses,2023-03-04,Green,0.0,3122.0,2689.52
0062x00000Fv1dYAAR,0012800001b2dPSAAY,Cabramatta,NSW,Australia,Closed Lost,Existing Client-Granted Loan Before,0.0,35.28,2288.8331,1.0,0.0,0.0,3.0,1.0,11604.7546,0.0,30.0,0.0,2670.6833,2150.0,0.0,0.0,0.0,1.0,5416.67,400.0,250.0,1500,2040.0,14.0,14.571,Weekly,44.0,10682.73,2500.0,Full-Time Employment,0.0,0.0,0.0,0.0,0.0,1791.0,1791.06,145.71,MoneySpot,,8286576,0.0,2024-02-29,False,Living Expenses,2024-02-24,Orange,0.0,11468.0,10682.73
0062x00000EdYqtAAF,0012x00000kgBxrAAE,Homebush,NSW,Australia,Closed Lost,Existing Client-No Loan Granted Ever,0.0,79.9,907.1966,1.0,1.0,0.0,2.0,1.0,3091.5172,1.0,1.0,0.0,664.295,727.45,0.0,0.0,0.0,0.0,0.0,400.0,300.0,1200,1824.0,34.0,34.143,Weekly,22.0,3917.52,5000.0,part-time,1.0,0.0,0.0,0.0,2657.18,0.0,1334.42,53.65,MoneySpot,,6428782,1.0,10-09-2023,False,Vehicle Expenses,2023-09-05,Green,0.0,6458.0,3917.52
0062x00000FJ0RXAA1,0012x00000mGRmrAAG,Grange,QLD,Australia,Closed Lost,Existing Client-No Loan Granted Ever,0.0,46.97,164.23,2.0,0.0,0.0,3.0,2.0,5012.9275,0.0,24.0,0.0,1250.0,1250.0,0.0,0.02,0.0,0.0,0.0,899.0,880.0,1200,1872.0,18.0,35.0,Fortnightly,43.0,4955.66,3000.0,Full-Time Employment,2.0,0.0,0.0,0.0,2543.3333,0.0,218.7233,104.0,MoneySpot,,7292445,0.0,27-11-2023,False,Vehicle Expenses,2023-11-22,Green,0.0,5225.0,4955.66
0062x00000DAq7gAAD,0010K00001cux8vQAA,Parramatta,NSW,Australia,Closed Lost,Existing Client-No Loan Granted Ever,0.0,60.61,3684.7325,1.0,0.0,0.0,2.0,1.0,6026.118,4.0,35.0,0.0,1210.845,1492.63,0.0,12.86,0.0,0.0,3033.33,899.0,1500.0,1200,1632.0,14.0,13.857,Weekly,44.0,7552.21,2200.0,Full-Time Employment,4.0,0.0,0.044,1.0,4843.38,1029.0,4898.5866,116.57,MoneySpot,,4647977,3.0,09-02-2023,False,Living Expenses,2023-02-09,Orange,0.0,8626.0,7552.21
0062x00000FVYONAA5,0012x00000LSPuxAAH,Brisbane City,QLD,Australia,Loan Paid,Existing Client-No Loan Granted Ever,0.0,95.97,515.24,2.0,0.0,0.0,4.0,2.0,9504.1711,0.0,9.0,0.0,4374.5233,3952.43,0.0,0.0,0.0,0.0,8666.67,400.0,1200.0,1200,1584.0,5.0,9.0,Fortnightly,40.0,9504.17,2050.0,Full-Time Employment,0.0,0.0,0.1319,0.0,8749.0466,0.0,474.3033,316.8,MoneySpot,0.0,7601582,0.0,22-12-2023,False,Furniture or Appliances,2023-12-21,Green,0.0,8905.0,9504.17
0062x00000DFlSeAAL,0010K000026PAz1QAG,Pimpama,QLD,Australia,Loan Paid,Existing Client-Granted Loan Before,36.53,58.54,1714.5375,1.0,1.0,4.0,3.0,1.0,6751.8855,5.0,0.0,337.5186,851.5007,719.96,0.0,0.0,0.0,1.0,2383.33,400.0,660.0,1200,1632.0,9.0,17.143,Fortnightly,44.0,7898.55,1200.0,Part-Time Employment,5.0,0.0,0.011,1.0,2992.9666,720.0,1293.6633,181.33,QuickCash,0.0,4685653,4.0,15-02-2023,False,Event - Holiday - Air fares,2023-02-14,Green,3006.0,8228.0,7898.55
0062x00000D8nHHAAZ,0010K00001feGXqQAM,Brighton,QLD,Australia,Loan Paid,Existing Client-Granted Loan Before,1.3,63.86,3623.4557,4.0,4.0,0.0,1.0,4.0,962.8666,8.0,78.0,3545.8417,361.075,582.0,2.0,11.18,0.0,1.0,3358.33,899.0,0.0,1500,2040.0,7.0,14.0,Fortnightly,42.0,0.0,1500.0,Full-Time Employment,9.0,0.0,0.4066,9.0,5032.0066,3159.0,4692.5633,291.43,MoneySpot,0.0,4550045,5.0,25-01-2023,False,Home Maintenance & Repairs,2023-01-25,Orange,13.0,993.0,0.0
0062x00000D1znzAAB,0012x00000GbW84AAF,Hillvue,NSW,Australia,Loan Paid,Existing Client-Granted Loan Before,0.0,99.8,2497.065,2.0,0.0,0.0,3.0,2.0,4174.1765,2.0,55.0,1271.5547,1921.2657,1727.7,1.0,0.0,0.0,0.0,0.0,899.0,520.0,1500,2040.0,7.0,13.857,Fortnightly,63.0,4174.18,1500.0,,2.0,0.0,0.3626,0.0,4482.9533,1460.0,2820.6566,291.43,MoneySpot,0.0,4422154,2.0,06-01-2023,False,Life Event Expenses,2023-01-05,Orange,0.0,5233.0,4174.18
0062x00000DWqlZAAT,0012x00000gn3K2AAI,Frenchville,QLD,Australia,Loan Paid,Existing Client-No Loan Granted Ever,0.0,69.47,242.8801,2.0,0.0,0.0,2.0,2.0,4303.277,2.0,6.0,658.8814,1980.6866,2725.2,0.0,0.0,0.0,0.0,0.0,599.0,1640.0,1200,1536.0,3.0,5.286,Fortnightly,50.0,4304.75,2000.0,,2.0,0.0,0.0,0.0,3961.3733,186.0,380.74,512.0,MoneySpot,0.0,4941338,0.0,27-03-2023,False,Vehicle Expenses,2023-03-27,Green,0.0,4070.0,4304.75
0062x00000D1V19AAF,0012x000003Ci5sAAC,Forest Lake,QLD,Australia,Closed Lost,Existing Client-No Loan Granted Ever,0.0,20.62,2657.7025,1.0,0.0,0.0,3.0,1.0,8895.9283,1.0,120.0,1808.6444,1382.0742,1248.49,1.0,0.0,0.0,0.0,5633.33,400.0,8000.0,1200,1536.0,6.0,6.429,Weekly,35.0,10246.51,4000.0,Full-Time Employment,1.0,0.0,0.0,0.0,6449.68,3217.0,3740.9566,256.0,MoneySpot,,4392849,0.0,06-01-2023,False,Medical Expenses,2023-01-01,Orange,0.0,10459.0,10246.51
0062x00000D96qBAAR,0012x00000dBAxAAAW,Forreston,SA,Australia,Loan Paid,Existing Client-Granted Loan Before,0.0,65.8,2733.0172,2.0,1.0,0.0,3.0,2.0,5748.188,1.0,57.0,627.9065,1893.9614,1893.96,1.0,22.85,0.0,0.0,0.0,599.0,360.0,1500,2040.0,7.0,13.857,Fortnightly,29.0,5848.19,1500.0,Full-Time Employment,1.0,0.0,0.0769,1.0,4419.2433,1045.0,2628.62,291.43,MoneySpot,0.0,4564735,1.0,27-01-2023,False,Vehicle Expenses,2023-01-27,Orange,0.0,6397.0,5848.19
0062x00000EwXloAAF,0012x00000lJCuAAAW,Mollymook,NSW,Australia,Closed Lost,New Client-New Loan,0.0,48.97,0.0,2.0,0.0,0.0,3.0,2.0,7515.5428,1.0,5.0,0.0,1226.4683,1226.47,0.0,0.0,0.0,0.0,1000.0,2000.0,2100.0,1200,1728.0,12.0,23.0,Fortnightly,40.0,7680.2,5000.0,Self Employed,1.0,0.0,0.0,1.0,3756.27,0.0,0.0,144.0,MoneySpot,,6597285,0.0,25-09-2023,False,Other Expenses,2023-09-20,Green,0.0,9371.0,7680.2
0062x00000EbpvHAAR,0012x00000khffvAAA,Mickleham,VIC,Australia,Closed Lost,New Client-New Loan,0.0,39.89,987.4616,1.0,0.0,0.0,4.0,1.0,3910.7725,2.0,6.0,0.0,881.97,901.3,1.0,0.0,0.0,0.0,900.0,2000.0,1970.0,1200,1728.0,25.0,25.143,Weekly,25.0,4010.77,4000.0,Part-Time Employment,2.0,0.0,0.0769,0.0,3527.88,0.0,1185.4066,69.12,MoneySpot,,6315334,1.0,29-08-2023,False,Travel Expenses,2023-08-24,Green,0.0,4836.0,4010.77
0062x00000DA5YQAA1,0012x00000FFpQvAAL,Erskine Park,NSW,Australia,Loan Paid,Existing Client-Granted Loan Before,0.0,74.24,7066.2805,1.0,0.0,0.0,2.0,1.0,9380.1899,10.0,68.0,2562.0491,1380.2678,1162.0,0.0,1.53,0.0,0.0,4545.27,599.0,400.0,1500,2040.0,14.0,13.714,Weekly,28.0,7015.19,1500.0,Full-Time Employment,17.0,0.0,0.022,11.0,6441.25,3166.0,6021.9766,145.71,MoneySpot,0.0,4611793,17.0,03-02-2023,False,Furniture or Appliances,2023-02-03,Orange,0.0,9306.0,7015.19
0062x00000DFuctAAD,0012x00000OyjAUAAZ,Aldinga Beach,SA,Australia,Loan Paid,Existing Client-Granted Loan Before,20.04,88.49,1746.497,1.0,0.0,2.0,2.0,1.0,5417.4729,3.0,38.0,73.9825,814.1569,792.24,0.0,0.0,0.0,0.0,0.0,400.0,100.0,1500,2040.0,14.0,13.857,Weekly,40.0,5417.47,1500.0,Full-Time Employment,3.0,0.0,0.0,2.0,4617.12,1508.0,1986.3966,145.71,Financier-2,0.0,4693310,0.0,16-02-2023,False,Vehicle Expenses,2023-02-16,Orange,1102.0,5497.0,5417.47
0062x00000D9AfRAAV,0012x00000gmaezAAA,St Leonards,NSW,Australia,Closed Lost,New Client-New Loan,0.43,28.76,1322.2953,2.0,0.0,0.0,3.0,2.0,5871.4842,2.0,13.0,709.8642,2702.4914,2793.69,0.0,0.0,0.0,0.0,0.0,0.0,2400.0,1200,1536.0,3.0,5.714,Fortnightly,55.0,5876.48,2000.0,,2.0,0.0,0.1429,1.0,6305.8133,350.0,3494.7266,512.0,MoneySpot,,4568493,0.0,28-01-2023,False,Medical - Specialist,2023-01-27,Orange,39.0,9004.0,5876.48
0062x00000EDZI4AAP,0012x00000kaCZ4AAM,Gordon Park,QLD,Australia,Closed Lost,New Client-New Loan,0.0,73.35,308.6409,1.0,0.0,0.0,3.0,1.0,3787.9647,12.0,29.0,0.0,871.7508,971.91,1.0,3.1,0.0,0.0,3900.0,400.0,260.0,1200,1728.0,22.0,22.286,Weekly,23.0,4885.96,4800.0,Contract Employment,13.0,0.0,0.0,0.0,4127.2266,0.0,1105.1266,78.55,MoneySpot,,5951420,13.0,24-07-2023,False,Living Expenses,2023-07-19,Green,0.0,3770.0,4885.96
0062x00000DFyiCAAT,0010K000021E4EgQAK,Gympie,QLD,Australia,Loan Paid,Existing Client-Granted Loan Before,17.52,51.54,2852.757,1.0,0.0,2.0,1.0,1.0,7761.3581,6.0,67.0,440.5107,803.055,836.7,0.0,0.0,0.0,0.0,3206.67,400.0,380.0,1200,1632.0,14.0,13.714,Weekly,36.0,6948.74,1200.0,Full-Time Employment,22.0,1.0,0.1538,2.0,6157.9333,565.0,3472.3833,116.57,MoneySpot,0.0,4696446,3.0,16-02-2023,False,Vehicle Expenses,2023-02-16,Green,1592.0,9083.0,6948.74
0062x00000Ee63YAAR,0012x00000iHMyHAAW,Wentworthville,NSW,Australia,Loan Paid,Existing Client-No Loan Granted Ever,0.0,61.53,25.69,1.0,0.0,0.0,4.0,1.0,9154.714,0.0,3.0,0.0,1728.5714,1800.0,0.0,0.0,0.0,0.0,3466.67,599.0,7200.0,1200,1728.0,22.0,22.143,Weekly,28.0,7831.42,2050.0,Full-Time Employment,0.0,0.0,0.0,0.0,4033.3333,0.0,65.0933,78.55,MoneySpot,0.0,6461302,0.0,08-09-2023,False,Vehicle Expenses,2023-09-08,Green,0.0,9512.0,7831.42
0062x00000DFDIJAA5,0012x00000GeXbKAAV,Mount Lawley,WA,Australia,Loan Paid,Existing Client-Granted Loan Before,12.81,83.25,1924.356,2.0,2.0,0.0,3.0,2.0,4048.9586,8.0,40.0,838.4699,1325.11,1565.65,1.0,2.07,0.0,0.0,0.0,599.0,600.0,1400,1904.0,7.0,13.857,Fortnightly,32.0,4988.47,2050.0,Full-Time Employment,8.0,0.0,0.022,8.0,3091.9233,1268.0,1926.4633,272.0,MoneySpot,0.0,4655804,7.0,10-02-2023,False,Medical Expenses,2023-02-10,Orange,676.0,5275.0,4988.47
0062x00000DIPJZAA5,0012x00000g8MDIAA2,Blacktown,SA,Australia,Loan Paid,Existing Client-Granted Loan Before,0.0,54.38,1677.9752,2.0,0.0,0.0,3.0,2.0,4879.9678,0.0,0.0,741.5872,2246.1228,2047.28,1.0,0.7,0.0,1.0,4333.33,899.0,0.0,1500,1980.0,5.0,10.0,Fortnightly,39.0,8550.03,1500.0,Part-Time Employment,0.0,0.0,0.1209,0.0,0.0,955.0,2762.3566,396.0,MoneySpot,0.0,4831028,0.0,09-03-2023,False,Vehicle Expenses,2023-03-09,Orange,0.0,9755.0,8550.03
0062x00000DGiheAAD,0012x00000goIsKAAU,Red Cliffs,VIC,Australia,Closed Lost,New Client-New Loan,24.55,93.25,56.7835,1.0,1.0,2.0,3.0,1.0,5333.3655,2.0,5.0,0.0,912.4481,1027.12,3.0,0.0,0.0,0.0,0.0,0.0,160.0,1200,1536.0,6.0,6.0,Weekly,47.0,6204.42,2000.0,,11.0,0.0,0.1319,7.0,4194.7,0.0,60.0,256.0,MoneySpot,,4737847,2.0,23-02-2023,False,Vehicle - Repairs,2023-02-22,Green,1416.0,5766.0,6204.42
0062x00000DXA6PAAX,0012x000002d8UxAAI,Five Dock,NSW,Australia,Loan Paid,Existing Client-Granted Loan Before,21.08,91.27,5423.2749,2.0,1.0,2.0,3.0,2.0,6507.1737,5.0,43.0,989.8142,1879.084,2655.78,1.0,0.0,0.0,0.0,4940.0,899.0,480.0,1400,1792.0,4.0,8.143,Fortnightly,36.0,6854.92,2050.0,Full-Time Employment,7.0,0.0,0.1978,3.0,3784.96,1685.0,5727.4933,448.0,MoneySpot,0.0,4957237,5.0,29-03-2023,False,Vehicle Expenses,2023-03-29,Green,1517.0,7196.0,6854.92
0062x00000DtNBkAAN,0012x00000hYgVRAA0,Jimboomba,QLD,Australia,Loan Paid,Existing Client-No Loan Granted Ever,41.08,30.26,590.899,2.0,0.0,4.0,3.0,2.0,6357.8801,0.0,11.0,0.0,1028.3685,1181.94,0.0,1.03,0.0,0.0,1989.0,2000.0,100.0,1200,1776.0,15.0,30.0,Fortnightly,46.0,6357.88,6500.0,Casual Employment,0.0,0.0,0.1209,0.0,5136.87,220.0,758.3833,118.4,MoneySpot,0.0,5310252,0.0,21-05-2023,False,Living Expenses,2023-05-20,Green,2764.0,6728.0,6357.88
0062x00000D8TtbAAF,0012x00000gA0rRAAS,ARUNDEL,QLD,Australia,Closed Lost,Existing Client-No Loan Granted Ever,0.0,93.26,1477.1088,1.0,4.0,0.0,5.0,1.0,3876.097,16.0,101.0,0.0,828.5333,812.0,1.0,4.09,0.0,0.0,3540.33,400.0,100.0,1050,1344.0,6.0,6.571,Weekly,24.0,5054.51,1050.0,Full-Time Employment,16.0,0.0,0.7912,0.0,3314.1333,1100.0,2268.6366,224.0,MoneySpot,,4535063,10.0,26-01-2023,False,Medical - Optical,2023-01-23,Orange,0.0,9451.0,5054.51
0062x00000DVRpWAAX,0010K00001zdlntQAA,Woorim,QLD,Australia,Closed Lost,Existing Client-No Loan Granted Ever,0.0,55.64,2176.3125,1.0,0.0,0.0,2.0,1.0,8648.1613,0.0,1.0,0.0,1256.8769,1268.6,0.0,24.83,0.0,0.0,5633.33,899.0,1640.0,1200,1632.0,15.0,14.857,Weekly,44.0,8651.1,5000.0,Full-Time Employment,0.0,0.0,0.0,0.0,5446.4666,0.0,1533.0,108.8,MoneySpot,,5449925,0.0,31-05-2023,False,Holiday / Travel,2023-05-30,Green,0.0,11908.0,8651.1
0062x00000Exf7rAAB,0012x00000lewVXAAY,Saint Marys,NSW,Australia,Loan Paid,Existing Client-No Loan Granted Ever,0.0,36.62,0.0,1.0,0.0,0.0,3.0,1.0,3611.6081,0.0,8.0,0.0,808.0508,894.62,0.0,1.43,0.0,0.0,3900.0,599.0,0.0,1200,1776.0,28.0,27.857,Weekly,20.0,3611.61,2050.0,Part-Time Employment,0.0,0.0,0.011,0.0,3232.2033,0.0,0.0,63.43,MoneySpot,0.0,6677484,0.0,29-09-2023,False,Living Expenses,2023-09-28,Green,0.0,5390.0,3611.61
0062x00000FWajWAAT,0012x00000n3a2TAAQ,Saint Clair,NSW,Australia,Closed Lost,New Client-New Loan,0.0,76.53,0.0,2.0,1.0,0.0,3.0,2.0,7915.512,6.0,6.0,0.0,2028.7571,1968.31,0.0,0.09,0.0,0.0,0.0,0.0,100.0,1200,1680.0,10.0,19.714,Fortnightly,29.0,7915.51,2500.0,,6.0,0.0,0.0,2.0,4733.7666,0.0,35.0,168.0,MoneySpot,,7683830,1.0,30-12-2023,False,Vehicle Expenses,2023-12-29,Green,0.0,11692.0,7915.51
0062x00000DFyQXAA1,0012x00000gnt6zAAA,Bentleigh East,VIC,Australia,Closed Lost,New Client-New Loan,0.0,41.98,248.7191,2.0,0.0,0.0,4.0,2.0,5279.5673,0.0,9.0,208.7198,1662.925,1705.57,0.0,0.65,0.0,0.0,41860.0,2000.0,0.0,1200,1536.0,3.0,5.143,Fortnightly,31.0,5436.23,1500.0,Full-Time Employment,0.0,0.0,0.0549,0.0,3325.85,192.0,285.47,512.0,QuickCash,,4696238,0.0,21-02-2023,False,Travel Expenses,2023-02-16,Green,0.0,6953.0,5436.23
0062x00000DXwGIAA1,0012x00000bmCb9AAE,Bassendean,WA,Australia,Loan Paid,Existing Client-Granted Loan Before,0.0,67.09,3339.1006,2.0,0.0,0.0,4.0,2.0,8978.7502,0.0,45.0,340.48,3559.35,3176.82,1.0,9.36,0.0,0.0,7475.0,899.0,2200.0,1100,1496.0,7.0,13.286,Fortnightly,54.0,8702.08,1100.0,Full-Time Employment,0.0,0.0,0.0879,0.0,9345.8033,1263.0,3960.4466,213.71,Financier-2,0.0,5003067,0.0,05-04-2023,False,Travel Expenses,2023-04-05,Green,0.0,12064.0,8702.08
0062x00000FVmqaAAD,0012x00000gpYlkAAE,Gorokan,NSW,Australia,Closed Lost,Existing Client-Granted Loan Before,0.0,55.61,1247.93,1.0,0.0,0.0,3.0,1.0,4665.8872,0.0,33.0,0.0,965.7823,965.86,0.0,4.56,0.0,0.0,0.0,400.0,300.0,1100,1496.0,16.0,15.714,Weekly,30.0,4665.89,5000.0,,0.0,0.0,0.1429,0.0,4185.0566,1305.0,1575.8866,93.5,QuickCash,,7621890,0.0,23-12-2023,False,Other Expenses,2023-12-23,Orange,0.0,5245.0,4665.89
0062x00000DtgpeAAB,0012x00000haI9QAAU,Murarrie,QLD,Australia,Loan Paid,New Client-New Loan,0.0,41.14,1943.3649,2.0,0.0,0.0,3.0,2.0,4668.8054,0.0,18.0,0.0,1652.126,1713.54,1.0,0.0,0.0,0.0,3711.5,599.0,200.0,1200,1536.0,3.0,5.714,Fortnightly,27.0,5440.69,1200.0,Casual Employment,0.0,0.0,0.0,0.0,2753.5433,0.0,1937.3966,512.0,QuickCash,0.0,5336221,0.0,20-05-2023,False,Vehicle Expenses,2023-05-20,Green,0.0,6741.0,5440.69
0062x00000FJbTsAAL,0012x00000mJFbPAAW,Mount Eliza,VIC,Australia,Closed Lost,New Client-New Loan,0.0,49.45,0.0,1.0,0.0,0.0,2.0,1.0,7340.4237,1.0,21.0,0.0,1689.3033,1894.74,0.0,0.0,0.0,0.0,1900.0,2000.0,880.0,1200,1584.0,13.0,13.143,Weekly,23.0,8941.09,4000.0,Full-Time Employment,1.0,0.0,0.011,0.0,6757.2133,0.0,0.0,121.85,MoneySpot,,7335511,0.0,02-12-2023,False,Vehicle Expenses,2023-11-27,Green,0.0,12955.0,8941.09
0062x00000D7zAWAAZ,0012x00000fpDFtAAM,Blacktown,NSW,Australia,Loan Paid,Existing Client-Granted Loan Before,0.0,95.84,1920.0843,2.0,0.0,0.0,3.0,2.0,5438.5441,0.0,16.0,0.0,1107.1428,1250.0,1.0,0.5,0.0,1.0,5416.67,400.0,400.0,1200,1632.0,14.0,14.0,Weekly,28.0,5436.67,1200.0,Full-Time Employment,0.0,0.0,0.022,0.0,0.0,512.0,1070.2,116.57,QuickCash,0.0,4509138,0.0,20-01-2023,False,Living Expenses,2023-01-20,Orange,0.0,7810.0,5436.67
0062x00000D1V3FAAV,0012x000003E9KkAAK,HINCHINBROOK,NSW,Australia,Loan Paid,Existing Client-Granted Loan Before,19.51,89.32,1673.8458,1.0,0.0,2.0,4.0,1.0,10017.063,3.0,24.0,0.0,983.766,2726.64,0.0,16.77,0.0,1.0,0.0,599.0,400.0,1200,1632.0,7.0,13.714,Fortnightly,34.0,12860.9,1200.0,Full-Time Employment,8.0,0.0,0.0879,3.0,5804.7066,341.0,2073.85,233.14,MoneySpot,0.0,4392885,2.0,02-01-2023,False,Medical Expenses,2023-01-02,Orange,2794.0,14320.0,12860.9
0062x00000DGE7IAAX,0012x00000THEAyAAP,Parafield Gardens,SA,Australia,Loan Paid,Existing Client-Granted Loan Before,25.12,81.01,1684.7127,1.0,0.0,2.0,4.0,1.0,4260.7559,4.0,62.0,800.0,645.8061,1063.05,1.0,0.0,1.0,0.0,2426.67,599.0,1700.0,1250,1700.0,14.0,13.857,Weekly,25.0,4207.54,1250.0,Contract Employment,4.0,0.0,0.978,1.0,3886.19,528.0,1881.96,121.43,QuickCash,0.0,4710454,4.0,18-02-2023,False,Vehicle Expenses,2023-02-18,Green,1088.0,4330.0,4207.54
0062x00000FJ9hjAAD,0012x00000kfm3AAAQ,Medina,WA,Australia,Closed Lost,Existing Client-No Loan Granted Ever,0.0,54.83,0.0,1.0,0.0,0.0,2.0,1.0,3557.4726,0.0,7.0,0.0,763.09,763.09,0.0,24.04,0.0,0.0,0.0,400.0,1000.0,1200,1776.0,29.0,28.714,Weekly,58.0,3704.14,2050.0,,0.0,0.0,1.0,0.0,3306.7233,0.0,0.0,61.24,MoneySpot,,7302558,0.0,25-11-2023,False,Medical Expenses,2023-11-24,Green,0.0,4360.0,3704.14
0062x00000EDx1lAAD,0010K00001sGlzvQAC,Charleville,QLD,Australia,Loan Paid,Existing Client-No Loan Granted Ever,0.0,31.49,398.5235,1.0,0.0,0.0,2.0,1.0,7201.2609,0.0,16.0,0.0,1329.1175,1242.05,1.0,0.0,0.0,0.0,4693.0,599.0,840.0,1200,1632.0,16.0,16.571,Weekly,51.0,7201.26,3000.0,Full-Time Employment,0.0,0.0,0.0,0.0,5528.1366,0.0,493.9666,102.0,MoneySpot,0.0,5978068,0.0,22-07-2023,False,Vehicle Expenses,2023-07-22,Green,0.0,7326.0,7201.26
0062x00000DJIlqAAH,0012x00000gpcTUAAY,Granville,NSW,Australia,Loan Paid,New Client-New Loan,0.54,38.87,0.0,2.0,0.0,0.0,2.0,2.0,7675.1,5.0,29.0,0.0,1724.5128,1630.78,1.0,22.44,0.0,0.0,0.0,0.0,800.0,1200,1536.0,3.0,5.714,Fortnightly,36.0,11946.0,2000.0,,5.0,0.0,0.0769,0.0,4023.8633,893.0,4516.19,512.0,MoneySpot,0.0,4881769,3.0,17-03-2023,False,Other,2023-03-17,Green,80.0,14597.0,11946.0
0062x00000D2OjnAAF,0012x00000WXFK0AAP,Ropes Crossing,NSW,Australia,Closed Lost,Existing Client-Granted Loan Before,0.0,66.67,1187.6889,1.0,0.0,0.0,2.0,1.0,5597.2752,7.0,76.0,461.511,1253.62,1253.62,0.0,0.0,0.0,0.0,5395.0,400.0,1824.0,1500,2040.0,14.0,14.286,Weekly,34.0,5597.28,4500.0,Full-Time Employment,7.0,0.0,0.7033,1.0,5014.48,566.0,1245.3666,145.71,Financier-2,,4443820,7.0,10-01-2023,False,Vehicle Expenses,2023-01-09,Orange,0.0,5799.0,5597.28
0062x00000Dtm9UAAR,0012x00000haMMNAA2,North Perth,WA,Australia,Loan Paid,New Client-New Loan,8.22,61.65,0.0,1.0,0.0,4.0,2.0,1.0,3235.0227,2.0,14.0,0.0,715.0,820.0,0.0,0.0,0.0,0.0,0.0,0.0,560.0,1100,1408.0,6.0,6.429,Weekly,39.0,3235.02,1100.0,,2.0,0.0,0.044,0.0,3211.8666,0.0,123.3333,234.67,MoneySpot,0.0,5346823,0.0,22-05-2023,False,Car Other,2023-05-21,Green,352.0,4279.0,3235.02
0062x00000D9LTgAAN,0012x00000c9LxVAAU,Rockdale,NSW,Australia,Closed Lost,Existing Client-No Loan Granted Ever,0.0,72.67,1028.3239,2.0,0.0,0.0,4.0,2.0,8399.3069,0.0,18.0,0.0,1423.3333,1056.43,0.0,0.07,0.0,0.0,0.0,400.0,150.0,1200,1632.0,8.0,16.571,Fortnightly,32.0,8153.61,5000.0,Part-Time Employment,0.0,0.0,0.0,0.0,6819.8966,0.0,1243.2166,204.0,MoneySpot,,4578055,0.0,30-01-2023,False,Other Expenses,2023-01-29,Green,0.0,18373.0,8153.61
0062x00000DtbFfAAJ,0012x00000haENDAA2,Wadalba,NSW,Australia,Loan Paid,New Client-New Loan,0.0,37.95,160.6064,1.0,0.0,0.0,3.0,1.0,4494.7487,0.0,6.0,0.0,991.2192,761.0,0.0,0.0,0.0,0.0,0.0,0.0,200.0,1200,1776.0,29.0,28.857,Weekly,27.0,4515.23,6000.0,,0.0,0.0,0.0,0.0,4295.2833,0.0,152.0833,61.24,MoneySpot,0.0,5326177,0.0,19-05-2023,False,Car Repairs,2023-05-19,Green,0.0,4540.0,4515.23
0062x00000E49l9AAB,0012x00000fojdCAAQ,Winston Hills,NSW,Australia,Loan Paid,Existing Client-No Loan Granted Ever,1.22,15.07,1040.6453,2.0,2.0,0.0,3.0,2.0,4129.3221,3.0,26.0,0.0,1877.6066,1977.52,0.0,0.0,0.0,0.0,0.0,599.0,400.0,1200,1680.0,10.0,19.0,Fortnightly,33.0,4575.71,2500.0,Full-Time Employment,4.0,0.0,0.033,4.0,3755.2133,0.0,1010.4666,168.0,MoneySpot,0.0,5543864,3.0,08-06-2023,False,Life Event Expenses,2023-06-08,Green,60.0,4891.0,4575.71
0062x00000FIN4QAAX,0012x00000cvopfAAA,Mount Gambier,SA,Australia,Loan Paid,Existing Client-Granted Loan Before,6.23,68.24,8719.9223,1.0,0.0,0.0,3.0,1.0,8899.694,2.0,71.0,0.0,1226.0469,1188.44,0.0,0.23,0.0,0.0,4983.33,899.0,600.0,1500,2100.0,20.0,20.571,Weekly,29.0,8722.11,1500.0,Full-Time Employment,2.0,0.0,0.033,0.0,5312.87,1558.0,10917.0166,105.0,MoneySpot,0.0,7244222,0.0,18-11-2023,False,Other Expenses,2023-11-18,Orange,1006.0,16140.0,8722.11
0062x00000E4Ez0AAF,0012x00000g8f10AAA,Baxter,VIC,Australia,Closed Lost,Existing Client-Granted Loan Before,0.0,39.67,284.2693,1.0,0.0,0.0,3.0,1.0,2171.0208,6.0,16.0,0.0,489.0461,526.88,0.0,0.43,0.0,0.0,1479.83,899.0,0.0,1050,1554.0,28.0,27.857,Weekly,40.0,2581.4,1250.0,Unemployed,12.0,0.0,0.7692,2.0,2529.5766,128.0,773.6866,55.5,QuickCash,,5552576,0.0,09-06-2023,False,Vehicle Expenses,2023-06-08,Green,0.0,2311.0,2581.4
0062x00000D8dncAAB,0012x00000dAkhjAAC,Margate,QLD,Australia,Loan Paid,Existing Client-Granted Loan Before,0.0,98.8,647.8218,1.0,0.0,0.0,1.0,1.0,3246.4925,4.0,48.0,405.5809,747.1384,724.11,0.0,0.0,0.0,0.0,3250.0,599.0,75.0,1050,1386.0,10.0,10.0,Weekly,21.0,3343.41,1150.0,Full-Time Employment,5.0,0.0,0.1429,3.0,3237.6,547.0,1567.98,138.6,QuickCash,0.0,4542690,4.0,24-01-2023,False,Living Expenses,2023-01-24,Orange,0.0,3463.0,3343.41
0062x00000D2CTCAA3,0010K00001uEunCQAS,Noble Park,VIC,Australia,Closed Lost,Existing Client-No Loan Granted Ever,0.0,16.41,886.2667,2.0,0.0,0.0,3.0,2.0,3735.0943,0.0,31.0,0.0,1507.45,1858.27,0.0,0.83,0.0,0.0,272133.33,0.0,1.0,1200,1536.0,3.0,4.714,Fortnightly,63.0,3735.09,5000.0,Part-Time Employment,0.0,0.0,0.7912,0.0,3014.9,168.0,833.26,512.0,MoneySpot,,4432910,0.0,11-01-2023,False,Renovations,2023-01-07,Orange,0.0,3509.0,3735.09
0062x00000EyD5rAAF,0012x00000g9ey1AAA,Toronto,NSW,Australia,Loan Paid,Existing Client-Granted Loan Before,0.0,84.4,702.932,1.0,0.0,0.0,2.0,1.0,5998.2128,0.0,36.0,0.0,1078.9246,1006.39,1.0,1.89,0.0,1.0,0.0,599.0,150.0,1500,2100.0,20.0,20.143,Weekly,25.0,6181.88,1500.0,,0.0,0.0,0.011,0.0,0.0,484.0,2303.1366,105.0,MoneySpot,0.0,6718886,0.0,03-10-2023,False,Other Expenses,2023-10-02,Orange,0.0,8163.0,6181.88
0062x00000DGmw8AAD,0012x000002byY8AAI,Hamilton Hill,WA,Australia,Closed Lost,Existing Client-No Loan Granted Ever,0.0,73.77,6939.4259,2.0,0.0,0.0,3.0,2.0,7834.7565,0.0,0.0,1922.1021,3367.7128,3367.72,0.0,0.15,0.0,0.0,0.0,0.0,0.0,1200,1536.0,3.0,6.0,Fortnightly,46.0,7834.76,2000.0,,0.0,0.0,0.1868,0.0,7857.9966,1511.0,6753.8966,512.0,MoneySpot,,4742304,0.0,28-02-2023,False,Flights for overseas trip,2023-02-23,Orange,0.0,8876.0,7834.76
0062x00000Ee44yAAB,0012x00000hYQqwAAG,South Fremantle,WA,Australia,Loan Paid,Existing Client-Granted Loan Before,0.44,33.83,693.4597,2.0,0.0,0.0,4.0,2.0,6266.4872,5.0,9.0,0.0,2884.3016,2691.74,0.0,0.17,0.0,0.0,2550.0,899.0,1000.0,1500,2280.0,16.0,31.0,Fortnightly,31.0,6266.49,1500.0,Full-Time Employment,5.0,0.0,0.022,1.0,5768.6033,971.0,1164.2733,142.5,MoneySpot,0.0,6460058,0.0,08-09-2023,False,Vehicle Expenses,2023-09-08,Orange,27.0,6049.0,6266.49
0062x00000EeOJFAA3,0012x00000lHlVsAAK,Carlton,NSW,Australia,Closed Lost,Existing Client-No Loan Granted Ever,0.0,57.06,1674.9665,1.0,0.0,0.0,4.0,1.0,10689.8579,0.0,43.0,0.0,2628.0833,3361.0,0.0,0.0,0.0,0.0,0.0,899.0,1600.0,1200,1632.0,16.0,16.571,Weekly,32.0,10694.86,5000.0,Full-Time Employment,0.0,0.0,0.3077,0.0,10512.3333,0.0,1807.4333,102.0,MoneySpot,,6485143,0.0,11-09-2023,False,Medical Expenses,2023-09-11,Green,0.0,13000.0,10694.86
0062x00000E6RLqAAN,0012x00000iKFbJAAW,Blacktown,NSW,Australia,Closed Lost,New Client-New Loan,0.0,61.09,1636.25,2.0,0.0,0.0,3.0,2.0,8140.8755,0.0,26.0,0.0,1198.2085,1114.3,0.0,0.02,0.0,0.0,0.0,0.0,0.0,1200,1776.0,15.0,29.286,Fortnightly,21.0,8140.88,6000.0,,0.0,0.0,0.0,0.0,5577.0533,0.0,4430.0066,118.4,MoneySpot,,5740334,0.0,30-06-2023,False,Student Loan Repayment,2023-06-26,Green,0.0,12238.0,8140.88
0062x00000D1SZpAAN,0012x00000WqsjUAAR,Darley,VIC,Australia,Loan Paid,Existing Client-Granted Loan Before,0.0,94.38,1759.0633,1.0,0.0,0.0,3.0,1.0,6985.6862,4.0,75.0,231.432,1038.14,867.55,1.0,8.71,0.0,0.0,4629.88,899.0,960.0,1200,1632.0,14.0,13.571,Weekly,24.0,8308.02,1300.0,Full-Time Employment,4.0,0.0,0.6154,0.0,6017.34,1352.0,3010.65,116.57,QuickCash,0.0,4390770,2.0,01-01-2023,False,Living Expenses,2023-01-01,Green,0.0,7371.0,8308.02
0062x00000DVO6uAAH,0012x00000hZl0CAAS,Tahmoor,NSW,Australia,Closed Lost,Existing Client-No Loan Granted Ever,0.0,70.61,2585.8687,1.0,0.0,0.0,3.0,1.0,6278.6005,11.0,67.0,0.0,1324.46,1541.77,0.0,0.0,0.0,0.0,0.0,599.0,1500.0,1200,1536.0,6.0,6.286,Weekly,29.0,6799.71,2000.0,,11.0,0.0,0.0549,1.0,4856.3533,0.0,2649.8966,256.0,MoneySpot,,5441449,0.0,30-05-2023,False,Living Expenses,2023-05-30,Green,0.0,7308.0,6799.71
0062x00000F3JrOAAV,0012x00000leK1OAAU,Brookfield,VIC,Australia,Loan Paid,New Client-New Loan,0.0,23.84,1408.8034,1.0,0.0,0.0,2.0,1.0,16615.8007,0.0,63.0,543.1548,2811.1423,3556.37,2.0,0.0,0.0,0.0,11700.0,1500.0,1800.0,1200,1632.0,16.0,15.857,Weekly,55.0,16837.47,3000.0,Full-Time Employment,0.0,0.0,0.0,0.0,12181.6166,542.0,1756.2,102.0,MoneySpot,0.0,7037106,0.0,02-11-2023,False,Travel Expenses,2023-11-02,Green,0.0,19902.0,16837.47
0062x00000DXOtDAAX,0012x00000dc3HNAAY,Sunshine West,VIC,Australia,Loan Paid,Existing Client-Granted Loan Before,0.0,17.31,922.97,0.0,1.0,0.0,0.0,0.0,1084.9666,9.0,11.0,160.3029,0.0,0.0,1.0,0.35,0.0,0.0,4398.33,400.0,300.0,1250,1650.0,5.0,9.714,Fortnightly,45.0,4054.79,1250.0,Full-Time Employment,12.0,0.0,0.3626,6.0,3189.5066,361.0,1598.6066,330.0,MoneySpot,0.0,4970531,8.0,31-03-2023,False,Vehicle Expenses,2023-03-31,Orange,0.0,5797.0,4054.79
0062x00000DAjnfAAD,0012x00000dzsSvAAI,Dubbo,NSW,Australia,Closed Lost,Existing Client-No Loan Granted Ever,0.0,65.07,1703.2901,2.0,0.0,0.0,3.0,2.0,3308.5594,0.0,11.0,0.0,1426.9783,1358.77,0.0,0.0,0.0,0.0,3141.67,400.0,1200.0,1200,1632.0,7.0,13.143,Fortnightly,27.0,4093.04,2300.0,Full-Time Employment,0.0,0.0,0.0,0.0,2947.6033,0.0,1770.8966,233.14,MoneySpot,,4642902,0.0,08-02-2023,False,Living Expenses,2023-02-08,Orange,0.0,4416.0,4093.04
0062x00000DFLowAAH,0012x00000WrQOyAAN,Blacktown,WA,Australia,Loan Paid,Existing Client-No Loan Granted Ever,32.2,53.9,362.9733,2.0,0.0,2.0,4.0,2.0,6313.572,0.0,3.0,393.3054,1641.475,1546.92,0.0,0.0,0.0,0.0,1569.53,400.0,1480.0,1200,1632.0,7.0,13.857,Fortnightly,38.0,6237.57,1200.0,Home Duties,0.0,0.0,0.0,0.0,5312.2166,1043.0,1224.2566,233.14,MoneySpot,0.0,4662841,0.0,11-02-2023,False,Living Expenses,2023-02-11,Orange,2406.0,7471.0,6237.57
0062x00000DAg1YAAT,0012x00000gnIIrAAM,Prospect,NSW,Australia,Loan Paid,New Client-New Loan,0.0,3.13,0.0,4.0,0.0,0.0,5.0,4.0,6373.6033,0.0,7.0,0.0,4780.2025,7641.49,0.0,0.0,0.0,0.0,5673.0,2000.0,1800.0,1200,1632.0,4.0,13.714,Monthly,43.0,6373.6,2000.0,Full-Time Employment,0.0,0.0,0.2527,0.0,6373.6033,242.0,241.8266,408.0,QuickCash,0.0,4640605,0.0,08-02-2023,False,Living Expenses,2023-02-08,Orange,0.0,6562.0,6373.6
0062x00000DGmZzAAL,0012x00000goLAxAAM,Annandale,NSW,Australia,Closed Lost,Existing Client-No Loan Granted Ever,0.0,79.25,885.8182,2.0,0.0,0.0,4.0,2.0,9945.1302,0.0,6.0,0.0,2502.415,2438.54,0.0,0.0,0.0,0.0,7863.51,899.0,850.0,1200,1536.0,4.0,8.143,Fortnightly,30.0,9954.78,3000.0,Full-Time Employment,3.0,0.0,0.0989,3.0,5004.83,0.0,1199.6233,384.0,MoneySpot,,4742884,0.0,24-02-2023,False,Relocation Expenses,2023-02-23,Green,0.0,10404.0,9954.78
0062x00000D83pZAAR,0012x00000ckXHfAAM,Crestwood,NSW,Australia,Loan Paid,Existing Client-No Loan Granted Ever,0.0,93.56,1584.8122,1.0,0.0,0.0,3.0,1.0,3973.2323,2.0,16.0,0.0,682.0261,736.14,0.0,0.49,0.0,0.0,750.0,400.0,0.0,1200,1536.0,6.0,5.857,Weekly,21.0,4001.57,1500.0,Full-Time Employment,3.0,0.0,0.011,2.0,3718.4466,0.0,4357.6166,256.0,MoneySpot,0.0,4513046,3.0,20-01-2023,False,Living Expenses,2023-01-20,Orange,0.0,4303.0,4001.57
0062x00000Dtko5AAB,0012x00000Mhl8eAAB,Pakenham,VIC,Australia,Loan Paid,Existing Client-No Loan Granted Ever,10.35,54.85,4141.6349,1.0,1.0,2.0,2.0,1.0,12453.4304,15.0,49.0,0.0,1332.8023,1464.32,1.0,0.26,0.0,0.0,2457.0,599.0,1000.0,1200,1584.0,10.0,10.429,Weekly,36.0,10850.49,3000.0,Full-Time Employment,21.0,0.0,0.0,4.0,8395.77,0.0,4521.7166,158.4,MoneySpot,0.0,5343699,10.0,21-05-2023,False,Birthday expenses,2023-05-21,Orange,1253.0,12099.0,10850.49
0062x00000ELdrtAAD,0012x00000LP4sYAAT,Kirwan,QLD,Australia,Loan Paid,Existing Client-Granted Loan Before,0.0,56.01,1216.7996,1.0,0.0,0.0,3.0,1.0,8544.2452,6.0,37.0,0.0,2030.25,983.0,0.0,28.2,0.0,0.0,0.0,400.0,250.0,1500,2100.0,20.0,19.714,Weekly,30.0,11118.33,1500.0,,6.0,0.0,0.2088,0.0,5414.0,989.0,3189.24,105.0,QuickCash,0.0,6049700,5.0,29-07-2023,False,Vehicle Expenses,2023-07-29,Green,0.0,14426.0,11118.33
0062x00000DWHdYAAX,0012x00000RrgzvAAB,Yass,NSW,Australia,Loan Paid,Existing Client-Granted Loan Before,0.0,98.04,2348.8386,1.0,1.0,0.0,2.0,1.0,2223.5563,12.0,47.0,1264.3037,402.9446,447.03,0.0,29.82,0.0,0.0,2166.67,400.0,0.0,1500,1980.0,10.0,10.0,Weekly,22.0,2256.89,2050.0,Part-Time Employment,12.0,0.0,0.978,3.0,1746.0933,1014.0,2298.2466,198.0,MoneySpot,0.0,4907190,12.0,22-03-2023,False,Living Expenses,2023-03-21,Orange,0.0,2532.0,2256.89
0062x00000DXaCQAA1,0012800001UxMWyAAN,Mooroobool,QLD,Australia,Loan Paid,Existing Client-Granted Loan Before,0.0,54.12,1196.4151,2.0,1.0,0.0,3.0,2.0,3589.1558,0.0,0.0,618.3057,1546.1333,1421.03,0.0,0.0,0.0,0.0,2912.0,599.0,1340.0,1500,2040.0,7.0,13.571,Fortnightly,45.0,4908.05,1500.0,Unemployed,4.0,0.0,0.0,1.0,4290.5466,1126.0,1203.3833,291.43,MoneySpot,0.0,4984737,4.0,03-04-2023,False,Other Expenses,2023-04-03,Orange,0.0,4242.0,4908.05
0062x00000EcctgAAB,0012x00000lFvwkAAC,Kedron,QLD,Australia,Closed Lost,New Client-New Loan,0.0,37.44,0.0,1.0,0.0,0.0,4.0,1.0,4153.5114,0.0,9.0,0.0,955.8769,875.7,0.0,0.0,0.0,0.0,45733.0,2000.0,980.0,1200,1680.0,21.0,21.286,Weekly,23.0,4153.51,2050.0,Full-Time Employment,0.0,0.0,0.0,0.0,4142.1333,0.0,0.0,80.0,MoneySpot,,6369544,0.0,30-08-2023,False,Travel Expenses,2023-08-29,Green,0.0,7960.0,4153.51
0062x00000ED5TzAAL,0012x00000bmXQqAAM,Horn Island,QLD,Australia,Loan Paid,Existing Client-Granted Loan Before,0.0,98.04,0.0,0.0,0.0,0.0,0.0,0.0,0.0,0.0,6.0,0.0,0.0,0.0,0.0,0.0,0.0,0.0,4795.44,599.0,500.0,1250,1750.0,10.0,19.571,Fortnightly,51.0,0.0,1250.0,Full-Time Employment,0.0,0.0,0.0,0.0,0.0,250.0,902.71,175.0,QuickCash,0.0,5919400,0.0,17-07-2023,False,Other Expenses,2023-07-16,Orange,0.0,1492.0,0.0
0062x00000DJ4NKAA1,0012x00000g9evMAAQ,Buninyong,VIC,Australia,Closed Lost,Existing Client-No Loan Granted Ever,0.0,71.56,1373.2475,2.0,0.0,0.0,3.0,2.0,4696.242,0.0,3.0,0.0,1799.785,1242.26,0.0,0.0,0.0,0.0,3900.0,400.0,900.0,1200,1536.0,3.0,5.0,Fortnightly,20.0,6297.22,2000.0,Contract Employment,0.0,0.0,0.0,0.0,3599.57,0.0,2281.84,512.0,MoneySpot,,4869733,0.0,20-03-2023,False,Living Expenses,2023-03-15,Orange,0.0,12222.0,6297.22
0062x00000DW89WAAT,0012x00000gpvNjAAI,Lewiston,SA,Australia,Loan Paid,New Client-New Loan,0.0,54.48,2091.427,1.0,0.0,0.0,4.0,1.0,5465.3675,21.0,51.0,346.9866,949.862,769.26,0.0,3.72,0.0,0.0,0.0,0.0,60.0,1200,1536.0,6.0,6.571,Weekly,25.0,5608.03,1200.0,,21.0,0.0,0.3077,1.0,2514.43,342.0,2330.6133,256.0,MoneySpot,0.0,4897839,15.0,20-03-2023,False,Other,2023-03-20,Green,0.0,4115.0,5608.03
0062x00000DrofmAAB,0012x00000hZ4YvAAK,Killarney Vale,NSW,Australia,Closed Lost,New Client-New Loan,0.0,28.93,986.8999,2.0,0.0,0.0,3.0,2.0,4920.5655,3.0,29.0,0.0,1606.7742,1609.82,1.0,0.0,0.0,0.0,1600.0,2000.0,880.0,1200,1632.0,8.0,16.0,Fortnightly,60.0,4923.01,5000.0,Full-Time Employment,3.0,0.0,0.0,0.0,3749.14,0.0,1040.8933,204.0,MoneySpot,,5195216,0.0,04-05-2023,False,Other Expenses,2023-05-04,Green,0.0,5350.0,4923.01
0062x00000EzyRZAAZ,0012x00000XLqLiAAL,Raby,NSW,Australia,Loan Paid,Existing Client-Granted Loan Before,0.0,46.66,1806.83,1.0,0.0,0.0,4.0,1.0,3710.8333,0.0,33.0,0.0,854.0,854.0,0.0,20.67,0.0,0.0,3600.0,400.0,100.0,1250,1800.0,25.0,25.571,Weekly,22.0,3710.83,1250.0,Full-Time Employment,0.0,0.0,0.0,0.0,3700.6666,427.0,1988.94,72.0,MoneySpot,0.0,6847925,0.0,16-10-2023,False,Life Event Expenses,2023-10-15,Green,0.0,4781.0,3710.83
0062x00000F2xTdAAJ,0012x00000le2CVAAY,Chester Hill,NSW,Australia,Closed Lost,New Client-New Loan,0.0,12.52,0.0,1.0,0.0,0.0,3.0,1.0,4192.1781,0.0,4.0,0.0,957.5646,959.06,0.0,3.18,0.0,0.0,0.0,0.0,600.0,1200,1680.0,21.0,21.286,Weekly,45.0,4192.18,3800.0,full_time,0.0,0.0,0.022,0.0,4149.4466,0.0,0.0,80.0,MoneySpot,,7009099,0.0,31-10-2023,False,household_furnishings,2023-10-31,Green,0.0,4247.0,4192.18
0062x00000ECEdzAAH,0012x00000kZXvwAAG,Beenleigh,QLD,Australia,Closed Lost,New Client-New Loan,0.0,55.81,1392.3733,2.0,0.0,0.0,4.0,2.0,4919.6329,0.0,16.0,0.0,2188.4342,2131.53,0.0,0.0,0.0,0.0,4675.67,400.0,650.0,1200,1680.0,9.0,17.857,Fortnightly,49.0,4919.63,3500.0,Full-Time Employment,0.0,0.0,0.1538,0.0,5106.3466,0.0,1409.1233,186.67,MoneySpot,,5863778,0.0,08-07-2023,False,Living Expenses,2023-07-08,Green,0.0,5474.0,4919.63
0062x00000DYGc7AAH,0010K000021XEnVQAW,Arncliffe,NSW,Australia,Loan Paid,Existing Client-Granted Loan Before,0.0,91.0,483.3962,2.0,3.0,0.0,1.0,2.0,4790.6371,9.0,17.0,0.0,2047.5057,1787.17,1.0,4.11,0.0,0.0,4116.67,599.0,420.0,1250,1700.0,14.0,15.429,Weekly,42.0,8788.84,1250.0,Full-Time Employment,10.0,0.0,0.1319,2.0,7138.3233,1161.0,1629.72,121.43,MoneySpot,0.0,5022285,9.0,08-04-2023,False,Life Event Expenses,2023-04-08,Orange,0.0,9448.0,8788.84
0062x00000DYK1kAAH,0012x00000XE23PAAT,SUNBURY,VIC,Australia,Loan Paid,Existing Client-Granted Loan Before,0.35,37.53,665.6443,2.0,0.0,2.0,4.0,2.0,3974.5787,0.0,12.0,326.7185,1709.9283,1811.49,0.0,0.69,0.0,0.0,3099.52,899.0,250.0,1200,1536.0,3.0,4.714,Fortnightly,20.0,4031.31,1200.0,Full-Time Employment,0.0,0.0,0.1209,0.0,3435.2333,301.0,612.76,512.0,MoneySpot,0.0,5026906,0.0,09-04-2023,False,Other,2023-04-08,Orange,15.0,4206.0,4031.31
0062x00000EOOPKAA5,0012x00000TttiBAAR,Goulburn,NSW,Australia,Closed Lost,Existing Client-No Loan Granted Ever,0.0,42.84,620.254,1.0,1.0,0.0,2.0,1.0,3998.9704,0.0,13.0,0.0,920.3115,978.41,1.0,0.0,0.0,0.0,856.0,400.0,0.0,1200,1680.0,22.0,21.714,Weekly,28.0,3998.97,2050.0,Full-Time Employment,4.0,0.0,0.0,3.0,3988.0166,0.0,1021.4066,76.36,MoneySpot,,6254682,4.0,18-08-2023,False,Furniture or Appliances,2023-08-18,Green,0.0,3988.0,3998.97
0062x00000DrRt4AAF,0012x000002afWsAAI,Forster,NSW,Australia,Loan Paid,Existing Client-Granted Loan Before,55.57,74.67,2767.948,4.0,1.0,2.0,4.0,2.0,3572.9213,0.0,21.0,1093.9585,754.1414,775.9,2.0,4.97,0.0,0.0,2946.67,599.0,2009.0,1250,1700.0,14.0,14.429,Weekly,51.0,8573.32,1250.0,Casual Employment,18.0,0.0,0.0,7.0,7171.8933,1207.0,2856.6633,121.43,Financier-2,0.0,5168343,18.0,01-05-2023,True,Medical Expenses,2023-04-30,Orange,2797.0,5033.0,8573.32
0062x00000EDguYAAT,0010K00001sYi8UQAS,Umbakumba,NT,Australia,Loan Paid,Existing Client-No Loan Granted Ever,0.0,90.2,0.0,4.0,0.0,0.0,1.0,4.0,7494.8925,0.0,5.0,0.0,2562.5,50.0,0.0,8.34,0.0,1.0,1733.33,2000.0,120.0,1100,1584.0,13.0,25.0,Fortnightly,24.0,9918.81,1100.0,Part-Time Employment,0.0,0.0,0.1099,0.0,2216.5833,62.0,61.5333,121.85,QuickCash,0.0,5958751,0.0,20-07-2023,False,Living Expenses,2023-07-20,Orange,0.0,10928.0,9918.81
0062x00000F3cUuAAJ,0012x00000ldolYAAQ,Modbury Heights,SA,Australia,Loan Paid,Existing Client-No Loan Granted Ever,0.0,11.47,435.4634,2.0,0.0,0.0,2.0,2.0,5018.3776,6.0,20.0,0.0,2027.9983,2120.95,0.0,0.0,0.0,0.0,2200.0,400.0,1840.0,1200,1728.0,12.0,24.571,Fortnightly,30.0,4673.31,5000.0,Full-Time Employment,6.0,0.0,0.0879,0.0,4055.9966,0.0,641.87,144.0,MoneySpot,0.0,7063898,0.0,04-11-2023,False,Furniture or Appliances,2023-11-04,Green,0.0,4920.0,4673.31
0062x00000D1hqCAAR,0012x00000g9BwJAAU,Mosman,NSW,Australia,Loan Paid,New Client-New Loan,0.0,25.25,615.8266,2.0,0.0,0.0,2.0,2.0,5463.4081,0.0,3.0,320.0,2332.8571,2777.1,1.0,0.52,0.0,0.0,2400.0,2000.0,960.0,1200,1584.0,5.0,10.0,Fortnightly,26.0,5704.45,3500.0,Full-Time Employment,0.0,0.0,0.7253,0.0,5443.3333,527.0,622.4933,316.8,MoneySpot,0.0,4405956,0.0,04-01-2023,False,Medical Expenses,2023-01-03,Green,0.0,6192.0,5704.45
0062x00000Ebs5nAAB,0012x00000khghEAAQ,Shepparton,VIC,Australia,Loan Paid,New Client-New Loan,0.0,78.94,1327.3071,1.0,0.0,0.0,2.0,1.0,4901.4268,0.0,21.0,0.0,1128.0,1128.0,0.0,0.06,0.0,0.0,4888.0,599.0,1200.0,1200,1680.0,18.0,17.857,Weekly,24.0,4901.43,2050.0,Full-Time Employment,0.0,0.0,0.0,0.0,4888.0,332.0,1550.52,93.33,MoneySpot,0.0,6316736,0.0,25-08-2023,False,Furniture or Appliances,2023-08-25,Green,0.0,5340.0,4901.43
0062x00000D1eY7AAJ,0012800001GhoWnAAJ,Joyner,QLD,Australia,Loan Paid,Existing Client-No Loan Granted Ever,28.48,64.8,1599.2818,1.0,0.0,4.0,2.0,1.0,8012.5495,0.0,75.0,657.2419,768.0433,881.5,0.0,0.0,0.0,0.0,2340.0,400.0,360.0,1200,1536.0,6.0,6.286,Weekly,41.0,8279.22,2000.0,Full-Time Employment,0.0,0.0,0.0,0.0,7635.9966,875.0,1470.0333,256.0,MoneySpot,0.0,4402607,0.0,03-01-2023,False,Education - Course Fees,2023-01-03,Green,4697.0,16489.0,8279.22
0062x00000D8fHsAAJ,0012x00000GdG4HAAV,Hadfield,VIC,Australia,Closed Lost,Existing Client-No Loan Granted Ever,0.0,36.64,299.3391,2.0,0.0,0.0,3.0,2.0,5170.5288,0.0,16.0,262.4958,1381.715,1495.34,0.0,0.0,0.0,0.0,4236.55,400.0,600.0,1200,1536.0,3.0,5.286,Fortnightly,28.0,5170.53,1200.0,Full-Time Employment,0.0,0.0,0.0,0.0,4374.54,262.0,314.3533,512.0,MoneySpot,,4543553,0.0,29-01-2023,False,Travel Expenses,2023-01-24,Green,0.0,4907.0,5170.53
0062x00000FJIYmAAP,0012x00000cLvVpAAK,Bowen,QLD,Australia,Closed Lost,Existing Client-No Loan Granted Ever,0.0,95.27,153.6666,1.0,1.0,0.0,4.0,1.0,3640.8689,5.0,5.0,0.0,837.8992,832.45,0.0,1.32,0.0,0.0,4749.33,899.0,1400.0,1200,1728.0,24.0,23.857,Weekly,33.0,3640.87,2050.0,Full-Time Employment,5.0,0.0,0.022,1.0,3630.8966,154.0,153.6666,72.0,MoneySpot,,7313521,5.0,25-11-2023,False,Vehicle Expenses,2023-11-25,Green,0.0,3648.0,3640.87
0062x00000D8lspAAB,0010K000021E60dQAC,Yagoona,NSW,Australia,Loan Paid,Existing Client-Granted Loan Before,0.39,94.39,3160.9261,2.0,0.0,0.0,5.0,2.0,3939.7341,0.0,54.0,1700.8811,1813.3571,1990.13,2.0,9.21,0.0,0.0,3033.33,599.0,678.0,1500,2040.0,7.0,13.429,Fortnightly,42.0,6745.09,1500.0,Casual Employment,0.0,0.0,0.0,0.0,6609.4033,1029.0,3572.0566,291.43,MoneySpot,0.0,4549081,0.0,25-01-2023,False,Child Expenses,2023-01-25,Orange,39.0,9981.0,6745.09
0062x00000ELWreAAH,0012x00000g8AokAAE,Blacktown,NSW,Australia,Loan Paid,Existing Client-Granted Loan Before,29.09,84.24,93.95,4.0,0.0,2.0,1.0,4.0,5620.5982,0.0,8.0,0.0,425.6668,1000.0,1.0,0.67,0.0,1.0,3033.33,400.0,400.0,1250,1900.0,17.0,32.857,Fortnightly,38.0,9069.06,2050.0,Unemployed,0.0,0.0,0.6593,0.0,3106.9733,176.0,772.0566,111.76,MoneySpot,0.0,6038976,0.0,28-07-2023,False,Furniture or Appliances,2023-07-28,Green,3107.0,10677.0,9069.06
0062x00000DGcLtAAL,0012x000004UzqRAAS,Keilor East,VIC,Australia,Loan Paid,Existing Client-Granted Loan Before,0.0,43.79,2684.5238,2.0,0.0,0.0,3.0,2.0,4914.1227,0.0,39.0,0.0,2261.8428,1746.0,0.0,0.0,0.0,0.0,3434.17,599.0,1173.0,1500,2040.0,7.0,14.143,Fortnightly,33.0,4914.12,1500.0,Full-Time Employment,0.0,0.0,0.0,0.0,5277.6333,556.0,2236.6933,291.43,Financier-2,0.0,4731896,0.0,22-02-2023,False,Vehicle Expenses,2023-02-22,Orange,0.0,5496.0,4914.12
0062x00000ExCWVAA3,0012x00000lHuYGAA0,Ashtonfield,NSW,Australia,Closed Lost,Existing Client-No Loan Granted Ever,0.0,25.72,150.0,2.0,0.0,0.0,3.0,2.0,7329.3573,0.0,15.0,0.0,2324.1533,2660.91,0.0,0.0,0.0,0.0,0.0,599.0,300.0,1200,1632.0,8.0,16.286,Fortnightly,25.0,7329.36,4000.0,Full-Time Employment,0.0,0.0,0.0,0.0,5871.3866,0.0,210.0,204.0,MoneySpot,,6645983,0.0,26-09-2023,False,Medical Expenses,2023-09-25,Green,0.0,8855.0,7329.36
0062x00000DFcteAAD,0012x00000g79GmAAI,Hampton Park,VIC,Australia,Loan Paid,Existing Client-Granted Loan Before,0.0,96.0,2467.5567,2.0,0.0,0.0,2.0,2.0,3940.5036,0.0,20.0,427.0,1607.1666,1695.0,0.0,7.61,1.0,0.0,3653.0,400.0,400.0,1400,2016.0,12.0,23.143,Fortnightly,36.0,4047.5,2050.0,Full-Time Employment,1.0,0.0,0.3187,1.0,3214.3333,349.0,2666.85,168.0,QuickCash,0.0,4678508,0.0,14-02-2023,False,Medical Expenses,2023-02-13,Green,0.0,4071.0,4047.5
0062x00000D1r1IAAR,0012x00000g9GQdAAM,Girraween,NSW,Australia,Closed Lost,New Client-New Loan,0.0,49.83,508.6233,2.0,0.0,0.0,3.0,2.0,5118.3333,6.0,22.0,0.0,2559.1666,2585.0,0.0,0.05,0.0,0.0,0.0,0.0,2500.0,1200,1536.0,3.0,5.0,Fortnightly,33.0,10763.08,2000.0,,9.0,0.0,0.0,3.0,8690.71,0.0,569.4666,512.0,MoneySpot,,4414906,0.0,05-01-2023,False,Education - Course Fees,2023-01-04,Green,0.0,5628.0,10763.08
0062x00000DFf3dAAD,0012x00000TrW7LAAV,Hampton Park,VIC,Australia,Closed Lost,Existing Client-No Loan Granted Ever,0.0,91.44,383.1328,2.0,0.0,0.0,3.0,2.0,2462.2565,0.0,0.0,0.0,1133.3128,982.01,0.0,0.0,0.0,0.0,0.0,899.0,500.0,1500,1920.0,6.0,6.143,Weekly,28.0,2540.59,1500.0,,0.0,0.0,0.0,0.0,2644.3966,0.0,1513.5233,320.0,MoneySpot,,4680120,0.0,14-02-2023,False,Relocation Expenses,2023-02-14,Orange,0.0,3828.0,2540.59
0062x00000E4GTVAA3,0012x00000iILmoAAG,West Mackay,QLD,Australia,Closed Lost,New Client-New Loan,0.0,92.35,1002.574,1.0,0.0,0.0,2.0,1.0,8235.0083,0.0,31.0,0.0,1895.18,1698.26,0.0,0.0,0.0,0.0,1500.0,2000.0,508.0,1200,1680.0,20.0,19.714,Weekly,33.0,12530.9,5000.0,Full-Time Employment,0.0,0.0,0.3736,0.0,3790.36,0.0,1134.1233,84.0,MoneySpot,,5554138,0.0,13-06-2023,False,Travel Expenses,2023-06-09,Green,0.0,6330.0,12530.9
0062x00000DWhuSAAT,0010K00001oDRHIQA4,Australind,WA,Australia,Loan Paid,Existing Client-Granted Loan Before,27.29,62.22,4358.7585,1.0,0.0,2.0,4.0,1.0,13678.5592,0.0,75.0,1458.8702,1664.4038,2244.0,0.0,1.81,0.0,0.0,1694.33,599.0,500.0,1050,1386.0,10.0,9.857,Weekly,41.0,20245.23,2050.0,Full-Time Employment,9.0,0.0,0.0769,7.0,12820.4466,2436.0,6236.52,138.6,QuickCash,0.0,4931707,6.0,25-03-2023,False,Relocation Expenses,2023-03-25,Green,6423.0,23528.0,20245.23
0062x00000D2AzfAAF,0012x00000BFjJnAAL,Horningsea Park,NSW,Australia,Loan Paid,Existing Client-Granted Loan Before,6.15,73.15,3267.3487,1.0,1.0,2.0,2.0,1.0,5205.1645,9.0,79.0,1669.4804,1066.2215,1149.13,0.0,28.17,0.0,0.0,3986.67,899.0,1000.0,1500,2040.0,14.0,14.571,Weekly,34.0,7555.16,1500.0,Full-Time Employment,9.0,0.0,0.1099,7.0,5147.0133,1696.0,3277.92,145.71,QuickCash,0.0,4431561,7.0,07-01-2023,False,Living Expenses,2023-01-06,Orange,527.0,8563.0,7555.16
0062x00000D1T0EAAV,0012x00000g93ulAAA,Glenfield,NSW,Australia,Loan Paid,New Client-New Loan,11.8,49.98,1070.6666,2.0,0.0,0.0,4.0,2.0,3270.8167,2.0,27.0,0.0,1505.4728,1350.08,0.0,0.0,0.0,0.0,0.0,0.0,1724.0,1200,1776.0,15.0,29.714,Fortnightly,58.0,3749.16,7000.0,Full-Time Employment,2.0,0.0,0.6593,2.0,3512.77,0.0,583.1,118.4,MoneySpot,0.0,4391135,0.0,02-01-2023,False,vehicle repairs,2023-01-01,Green,478.0,4048.0,3749.16
0062x00000ECP2AAAX,0012x00000XAsFPAA1,The Gap,QLD,Australia,Loan Paid,Existing Client-No Loan Granted Ever,0.0,20.0,1129.4345,2.0,0.0,0.0,4.0,2.0,3077.7043,6.0,45.0,0.0,1416.5885,1397.02,1.0,0.88,0.0,0.0,0.0,599.0,1100.0,1200,1776.0,14.0,27.571,Fortnightly,42.0,3077.7,2050.0,Full-Time Employment,6.0,0.0,0.011,2.0,3305.3733,0.0,1179.1733,126.86,MoneySpot,0.0,5875661,3.0,10-07-2023,False,Veterinary Expenses,2023-07-10,Green,0.0,3313.0,3077.7
0062x00000EOPgwAAH,0012x00000khCmyAAE,Seven Hills,NSW,Australia,Closed Lost,New Client-New Loan,0.0,60.06,151.2432,1.0,0.0,0.0,2.0,1.0,9884.9061,0.0,31.0,0.0,1843.0,1520.0,0.0,0.0,0.0,0.0,0.0,0.0,800.0,1200,1584.0,12.0,11.714,Weekly,27.0,11251.95,2100.0,Full-time,0.0,0.0,0.0,0.0,7372.0,0.0,187.0733,132.0,MoneySpot,,6255999,0.0,19-08-2023,False,Other,2023-08-18,Green,0.0,18235.0,11251.95
0062x00000DX6YfAAL,0012x00000flgvOAAQ,Mayfield,NSW,Australia,Loan Paid,Existing Client-No Loan Granted Ever,0.0,65.71,1684.3863,2.0,0.0,0.0,2.0,2.0,5506.9435,1.0,8.0,0.0,2534.7028,2504.23,0.0,0.0,0.0,0.0,0.0,1499.0,380.0,1200,1536.0,3.0,6.0,Fortnightly,57.0,5506.94,1250.0,,1.0,0.0,0.2198,1.0,5914.3066,714.0,1980.0433,512.0,MoneySpot,0.0,4954670,2.0,29-03-2023,False,Furniture or Appliances,2023-03-29,Green,0.0,6362.0,5506.94
0062x00000DAHVPAA5,0012x00000gn7QGAAY,Salisbury Park,SA,Australia,Closed Lost,New Client-New Loan,0.0,31.55,791.1917,1.0,0.0,0.0,4.0,1.0,6668.6795,0.0,87.0,0.0,1121.9838,1149.81,2.0,0.11,0.0,0.0,0.0,0.0,720.0,1200,1584.0,11.0,10.714,Weekly,40.0,8166.92,4000.0,,0.0,0.0,0.1319,0.0,6367.3033,0.0,880.2866,144.0,MoneySpot,,4622689,0.0,05-02-2023,False,House hold goods,2023-02-05,Green,0.0,6535.0,8166.92
0062x00000EzpTEAAZ,0012x00000LPb6BAAT,Point Cook,VIC,Australia,Closed Lost,Existing Client-No Loan Granted Ever,0.0,42.75,1413.5761,2.0,0.0,0.0,4.0,2.0,4391.8808,2.0,71.0,0.0,1492.0,1492.0,0.0,0.0,0.0,0.0,1669.34,899.0,10.0,1200,1728.0,13.0,25.857,Fortnightly,28.0,4631.67,4000.0,Part-Time Employment,2.0,0.0,0.0,0.0,3481.3333,0.0,2429.6666,132.92,MoneySpot,,6837489,0.0,19-10-2023,False,school_education,2023-10-14,Green,0.0,8886.0,4631.67
0062x00000D1rVWAAZ,0012x00000LOiFaAAL,Raymond Terrace,NSW,Australia,Loan Paid,Existing Client-Granted Loan Before,0.0,80.48,1987.58,1.0,6.0,0.0,3.0,1.0,9042.738,15.0,13.0,1061.194,1693.6909,1693.69,2.0,20.93,0.0,0.0,0.0,599.0,960.0,1450,1972.0,14.0,14.0,Weekly,29.0,10119.4,5000.0,,18.0,0.0,0.0,5.0,6210.2,1158.0,3026.9933,140.86,MoneySpot,0.0,4415326,15.0,05-01-2023,False,Vehicle Expenses,2023-01-05,Orange,0.0,15545.0,10119.4
0062x00000DAhF7AAL,0012x00000gnIoiAAE,Sydney,NSW,Australia,Closed Lost,New Client-New Loan,0.0,95.24,0.0,1.0,0.0,0.0,3.0,1.0,4499.0748,0.0,3.0,0.0,521.4661,545.2,0.0,12.45,0.0,0.0,0.0,0.0,440.0,1200,1536.0,6.0,6.143,Weekly,24.0,3464.07,1650.0,,0.0,0.0,0.011,0.0,2384.5866,0.0,0.0,256.0,MoneySpot,,4641373,0.0,12-02-2023,False,Event - Holiday - Accommodation,2023-02-08,Green,0.0,4836.0,3464.07
0062x00000ExskaAAB,0012x000003DI3yAAG,Leumeah,NSW,Australia,Loan Paid,Existing Client-No Loan Granted Ever,0.0,83.21,834.6547,1.0,0.0,0.0,3.0,1.0,9857.5043,0.0,42.0,165.4532,2120.0615,2292.0,1.0,0.0,0.0,0.0,3900.0,899.0,3000.0,1200,1584.0,12.0,11.714,Weekly,51.0,13354.39,2050.0,Full-Time Employment,0.0,0.0,0.6484,0.0,9186.9333,397.0,836.7466,132.0,Financier-2,0.0,6695238,0.0,30-09-2023,False,Other Expenses,2023-09-30,Green,0.0,15374.0,13354.39
0062x00000D9EUrAAN,0012x00000fowwOAAQ,Whyalla Stuart,SA,Australia,Loan Paid,Existing Client-Granted Loan Before,0.0,56.32,3075.3347,1.0,0.0,0.0,3.0,1.0,5150.9438,5.0,58.0,637.9762,1185.4233,595.32,0.0,23.53,0.0,0.0,0.0,599.0,1000.0,1500,2040.0,14.0,14.571,Weekly,41.0,13603.83,1500.0,Full-Time Employment,5.0,0.0,0.033,0.0,1185.4233,894.0,3046.77,145.71,QuickCash,0.0,4571958,3.0,29-01-2023,False,Vehicle Expenses,2023-01-29,Orange,0.0,7103.0,13603.83
0062x00000D9uIsAAJ,0012x00000gmvtWAAQ,Manly West,QLD,Australia,Loan Paid,New Client-New Loan,0.0,46.67,2784.9505,2.0,0.0,0.0,2.0,2.0,7373.3072,1.0,45.0,449.8914,2694.125,3773.53,0.0,4.11,0.0,0.0,0.0,0.0,960.0,1200,1536.0,3.0,4.857,Fortnightly,57.0,7373.31,2000.0,,1.0,0.0,0.2747,1.0,5388.25,921.0,2460.9133,512.0,MoneySpot,0.0,4603725,0.0,02-02-2023,False,Medical - Dental,2023-02-02,Green,0.0,8207.0,7373.31
0062x00000FJgngAAD,0012x00000haIp7AAE,Dee Why,NSW,Australia,Closed Lost,Existing Client-No Loan Granted Ever,0.0,5.08,88.6666,1.0,0.0,0.0,3.0,1.0,5408.756,0.0,8.0,0.0,863.3376,1008.63,0.0,0.0,0.0,0.0,0.0,400.0,200.0,1200,1728.0,24.0,24.286,Weekly,37.0,5408.76,4000.0,Full-time,0.0,0.0,0.0,0.0,3741.13,0.0,88.6666,72.0,MoneySpot,,7340224,0.0,28-11-2023,False,Vehicle Expenses,2023-11-28,Green,0.0,15124.0,5408.76
0062x00000Dre8dAAB,0012x00000hYykkAAC,Beerburrum,QLD,Australia,Closed Lost,New Client-New Loan,0.13,46.78,1216.9309,2.0,1.0,0.0,3.0,2.0,8736.5152,0.0,12.0,403.0209,2476.5228,2292.28,2.0,0.0,0.0,0.0,0.0,0.0,517.0,1200,1632.0,7.0,13.286,Fortnightly,42.0,8756.52,10000.0,part-time,4.0,0.0,0.0,0.0,8887.8933,354.0,1714.7633,233.14,MoneySpot,,5180873,2.0,06-05-2023,False,"Maintenance,Renovations",2023-05-02,Green,13.0,9919.0,8756.52
0062x00000DIY02AAH,0012x00000gn1PVAAY,Perth,WA,Australia,Loan Paid,Existing Client-Granted Loan Before,0.0,86.04,16.6666,2.0,0.0,0.0,2.0,2.0,3022.8391,0.0,21.0,0.0,1391.3342,723.0,0.0,0.0,0.0,0.0,0.0,400.0,200.0,1500,1980.0,6.0,11.714,Fortnightly,24.0,3311.85,1500.0,part-time,0.0,0.0,0.0879,0.0,3246.4466,427.0,1343.38,330.0,MoneySpot,0.0,4838277,0.0,11-03-2023,False,Living Expenses,2023-03-10,Orange,0.0,4116.0,3311.85
0062x00000FVw69AAD,0012x00000WVlRwAAL,New Lambton,NSW,Australia,Loan Paid,Existing Client-Granted Loan Before,0.0,53.03,1558.8265,3.0,0.0,0.0,4.0,3.0,6294.96,2.0,13.0,0.0,5684.96,5684.96,1.0,2.16,0.0,0.0,7537.64,899.0,1085.0,1250,1650.0,3.0,11.429,Monthly,46.0,6294.96,1250.0,Full-Time Employment,2.0,0.0,0.011,0.0,5684.96,2809.0,6717.2333,550.0,MoneySpot,0.0,7633479,1.0,25-12-2023,False,Life Event Expenses,2023-12-25,Orange,0.0,10033.0,6294.96
0062x00000DI4caAAD,0010K000021DORbQAO,Shalvey,NSW,Australia,Loan Paid,Existing Client-Granted Loan Before,0.0,82.03,3098.4958,2.0,0.0,0.0,1.0,2.0,4460.7525,2.0,49.0,2075.6214,1770.1,1783.4,0.0,2.03,1.0,0.0,4333.33,400.0,100.0,1200,1584.0,6.0,11.0,Fortnightly,24.0,4853.82,2050.0,Full-Time Employment,2.0,0.0,0.2088,2.0,3540.2,1914.0,4403.74,264.0,MoneySpot,0.0,4815341,0.0,07-03-2023,False,Vehicle Expenses,2023-03-07,Orange,0.0,6539.0,4853.82
0062x00000D7J88AAF,0012x000003Eo6CAAS,Pemulwuy,NSW,Australia,Loan Paid,Existing Client-Granted Loan Before,0.0,87.45,2470.7103,2.0,1.0,0.0,5.0,2.0,4615.1428,5.0,56.0,1266.6708,1763.6833,1594.6,1.0,0.0,0.0,1.0,0.0,400.0,400.0,1200,1632.0,7.0,13.0,Fortnightly,31.0,4615.14,1200.0,,5.0,0.0,0.978,4.0,0.0,1419.0,4280.8566,233.14,MoneySpot,0.0,4477449,5.0,14-01-2023,False,Medical Expenses,2023-01-14,Orange,0.0,6011.0,4615.14
0062x00000D97u4AAB,0012x00000gAMyMAAW,Granville,NSW,Australia,Loan Paid,Existing Client-No Loan Granted Ever,0.0,90.44,157.5,1.0,0.0,0.0,4.0,1.0,6477.1287,0.0,3.0,0.0,1490.6269,1666.0,0.0,0.0,0.0,0.0,0.0,1499.0,410.0,1200,1584.0,10.0,10.0,Weekly,30.0,6701.8,3000.0,Full-Time Employment,0.0,0.0,0.3846,0.0,6459.3833,0.0,157.5,158.4,MoneySpot,0.0,4565540,0.0,28-01-2023,False,Other Expenses,2023-01-28,Green,0.0,6685.0,6701.8
0062x00000D2PPmAAN,0012x000003jD6GAAU,Timber Creek,NT,Australia,Loan Paid,Existing Client-Granted Loan Before,10.81,94.91,559.4476,2.0,2.0,2.0,3.0,2.0,4533.865,4.0,20.0,134.0814,1354.8833,1506.32,0.0,0.65,0.0,0.0,1781.0,400.0,150.0,1200,1584.0,5.0,9.429,Fortnightly,22.0,4520.75,1600.0,Part-Time Employment,4.0,0.0,0.9011,0.0,3209.3533,447.0,845.7766,316.8,QuickCash,0.0,4444187,4.0,09-01-2023,False,Living Expenses,2023-01-09,Orange,503.0,4649.0,4520.75
0062x00000E5ad6AAB,0012x00000iJbKuAAK,Edmonton,QLD,Australia,Closed Lost,New Client-New Loan,0.0,24.71,0.0,2.0,0.0,0.0,3.0,2.0,7994.2293,0.0,12.0,0.0,3648.8514,5589.51,0.0,4.3,0.0,0.0,0.0,0.0,400.0,1200,1632.0,8.0,15.286,Fortnightly,28.0,7994.23,5000.0,Full-Time Employment,0.0,0.0,0.0,0.0,8513.9866,0.0,564.7566,204.0,MoneySpot,,5664677,0.0,25-06-2023,False,Hospital surgery overseas,2023-06-20,Green,0.0,10407.0,7994.23
0062x00000D1sYlAAJ,0012800001IZEwgAAH,Eagleby,QLD,Australia,Loan Paid,Existing Client-Granted Loan Before,23.51,72.29,1425.8267,2.0,0.0,2.0,3.0,2.0,5715.988,0.0,37.0,613.0374,1906.9814,1833.27,2.0,0.0,0.0,0.0,2600.0,599.0,100.0,1500,2040.0,7.0,14.0,Fortnightly,38.0,5715.99,1500.0,Full-Time Employment,0.0,0.0,0.4945,0.0,5897.5033,540.0,1371.1133,291.43,MoneySpot,0.0,4416139,0.0,05-01-2023,False,Vehicle Expenses,2023-01-05,Green,1448.0,6158.0,5715.99
0062x00000D8bQhAAJ,0012x00000XKOkaAAH,Queanbeyan East,NSW,Australia,Closed Lost,Existing Client-No Loan Granted Ever,0.0,21.94,1283.9875,2.0,0.0,0.0,1.0,2.0,3899.7269,0.0,18.0,882.7945,1794.9433,1762.0,0.0,0.85,0.0,0.0,3252.32,400.0,420.0,1200,1584.0,5.0,9.0,Fortnightly,32.0,3899.73,2500.0,Full-Time Employment,0.0,0.0,0.011,0.0,3589.8866,795.0,1365.9666,316.8,MoneySpot,,4541170,0.0,24-01-2023,False,Relocation Expenses,2023-01-24,Green,0.0,4100.0,3899.73
0062x00000DrGTPAA3,0012x00000hYlVsAAK,Aurukun,QLD,Australia,Closed Lost,Existing Client-No Loan Granted Ever,64.58,37.06,214.0664,2.0,0.0,2.0,1.0,2.0,4281.4559,4.0,12.0,214.0682,741.525,732.83,0.0,0.0,0.0,0.0,0.0,400.0,150.0,1200,1632.0,8.0,16.571,Fortnightly,38.0,4321.46,2050.0,,4.0,0.0,0.0,1.0,4350.9966,370.0,369.9033,204.0,MoneySpot,,5155219,3.0,28-04-2023,False,Home Maintenance & Repairs,2023-04-28,Green,2868.0,4441.0,4321.46
0062x00000ENiTMAA1,0012x00000kglZ0AAI,Blacktown,NSW,Australia,Loan Paid,New Client-New Loan,0.0,18.17,782.5383,1.0,0.0,0.0,3.0,1.0,5558.3245,0.0,13.0,0.0,1260.7653,1176.08,0.0,1.77,0.0,0.0,0.0,0.0,300.0,1200,1632.0,16.0,16.571,Weekly,40.0,5558.32,2000.0,,0.0,0.0,0.3407,0.0,5463.3166,0.0,1062.7866,102.0,MoneySpot,0.0,6198387,0.0,15-08-2023,False,Short Term Loan,2023-08-15,Green,0.0,5657.0,5558.32
0062x00000D1cFUAAZ,0012x00000g98tJAAQ,Gregory Hills,NSW,Australia,Loan Paid,New Client-New Loan,2.24,6.49,0.0,1.0,0.0,0.0,3.0,1.0,4258.1204,0.0,0.0,0.0,979.9515,1008.63,0.0,0.0,0.0,1.0,1170.0,2000.0,800.0,1200,1536.0,6.0,7.286,Weekly,48.0,4258.12,1200.0,Full-Time Employment,0.0,0.0,0.0,0.0,0.0,35.0,34.7133,256.0,QuickCash,0.0,4400279,0.0,03-01-2023,False,Furniture or Appliances,2023-01-03,Orange,109.0,4859.0,4258.12
0062x00000DWuTAAA1,0012x00000hWmzfAAC,Yarrabah,QLD,Australia,Loan Paid,New Client-New Loan,0.0,83.36,1760.8829,2.0,0.0,0.0,3.0,2.0,10296.9724,0.0,13.0,506.9372,4739.4285,6144.5,0.0,0.17,0.0,0.0,0.0,0.0,250.0,1200,1536.0,3.0,5.429,Fortnightly,31.0,60370.4,2000.0,,0.0,0.0,0.044,0.0,11058.6666,467.0,1755.67,512.0,MoneySpot,0.0,4943775,0.0,27-03-2023,False,Event - Holiday - Accommodation,2023-03-27,Green,0.0,64178.0,60370.4
0062x00000EzgewAAB,0010K00002BSHxAQAX,Clarkson,WA,Australia,Loan Paid,Existing Client-Granted Loan Before,0.0,57.31,1817.5092,2.0,0.0,0.0,3.0,2.0,5562.2228,0.0,47.0,0.0,2560.1466,2737.02,0.0,2.69,0.0,0.0,1300.0,899.0,200.0,1500,2100.0,11.0,20.857,Fortnightly,23.0,5562.22,1500.0,Casual Employment,0.0,0.0,0.3187,0.0,5120.2933,882.0,2724.56,190.91,MoneySpot,0.0,6825457,0.0,13-10-2023,False,Living Expenses,2023-10-13,Green,0.0,5912.0,5562.22
0062x00000D1hxXAAR,0012x00000TtUFDAA3,GASCOYNE JUNCTION,WA,Australia,Closed Lost,Existing Client-No Loan Granted Ever,32.66,79.36,2610.0628,4.0,0.0,2.0,5.0,4.0,11871.9268,0.0,35.0,207.9317,756.9781,2000.0,1.0,0.0,0.0,1.0,6283.33,899.0,0.0,1200,1536.0,3.0,6.143,Fortnightly,51.0,11871.93,5000.0,Full-Time Employment,0.0,0.0,0.0,0.0,5184.8333,205.0,3246.1366,512.0,MoneySpot,,4406098,0.0,08-01-2023,False,Vehicle Expenses,2023-01-03,Orange,6515.0,19947.0,11871.93
0062x00000EcccvAAB,0012x00000MgPRnAAN,Randwick,NSW,Australia,Loan Paid,Existing Client-Granted Loan Before,0.0,62.8,3262.4378,1.0,1.0,0.0,2.0,1.0,10111.5592,18.0,38.0,505.3729,1695.1538,1589.0,0.0,3.81,0.0,0.0,0.0,899.0,1400.0,1250,1750.0,20.0,20.0,Weekly,33.0,28732.13,1250.0,,20.0,0.0,0.0,12.0,7345.6666,598.0,3019.0866,87.5,QuickCash,0.0,6369142,9.0,30-08-2023,False,Medical Expenses,2023-08-29,Orange,0.0,30598.0,28732.13
0062x00000DZMEVAA5,0012x00000hY8LHAA0,Balmain,NSW,Australia,Loan Paid,New Client-New Loan,0.0,56.79,294.78,1.0,1.0,0.0,3.0,1.0,9424.8386,18.0,26.0,0.0,1097.9876,1437.2,1.0,0.18,0.0,0.0,0.0,0.0,1780.0,1200,1632.0,15.0,15.286,Weekly,23.0,9424.84,5000.0,,18.0,0.0,0.0,2.0,4757.9466,314.0,607.7066,108.8,MoneySpot,0.0,5088059,17.0,18-04-2023,False,Rental bond,2023-04-18,Green,0.0,9661.0,9424.84
0062x00000DHdGyAAL,0012x00000g9YMiAAM,Brighton,TAS,Australia,Loan Paid,Existing Client-Granted Loan Before,0.0,69.35,1234.3957,1.0,0.0,0.0,4.0,1.0,7606.4198,0.0,9.0,0.0,1082.8476,1082.85,0.0,9.94,0.0,0.0,6284.83,1499.0,725.0,1500,2040.0,14.0,14.0,Weekly,56.0,8313.79,1500.0,Full-Time Employment,0.0,0.0,0.0,0.0,6852.55,213.0,1803.7866,145.71,MoneySpot,0.0,4788507,0.0,03-03-2023,False,Travel Expenses,2023-03-02,Green,0.0,7886.0,8313.79
0062x00000F1mETAAZ,0012x00000g8huCAAQ,Wentworthville,NSW,Australia,Closed Lost,Existing Client-No Loan Granted Ever,0.0,81.59,0.0,1.0,0.0,0.0,4.0,1.0,7868.3595,0.0,2.0,0.0,1035.603,1050.44,0.0,0.0,0.0,0.0,6226.62,599.0,1500.0,1200,1632.0,16.0,16.571,Weekly,29.0,6960.69,2050.0,Full-Time Employment,0.0,0.0,0.0,0.0,6389.1433,0.0,780.87,102.0,MoneySpot,,6920320,0.0,23-10-2023,False,Home Maintenance & Repairs,2023-10-22,Green,0.0,12086.0,6960.69
0062x00000DZtKLAA1,0010K00001jrKQBQA2,Yarrabilba,QLD,Australia,Loan Paid,Existing Client-Granted Loan Before,0.0,18.73,2706.52,1.0,0.0,0.0,1.0,1.0,10760.4633,0.0,3.0,512.0,1656.784,1656.98,1.0,0.0,1.0,1.0,4250.0,1499.0,980.0,1200,1632.0,16.0,16.286,Weekly,57.0,10760.46,2200.0,Full-Time Employment,0.0,0.0,0.1538,0.0,0.0,8.0,1086.42,102.0,QuickCash,0.0,5122334,0.0,23-04-2023,False,Medical Expenses,2023-04-23,Orange,0.0,6589.0,10760.46
0062x00000D8vk2AAB,0012x00000bcSviAAE,Greystanes,NSW,Australia,Loan Paid,Existing Client-Granted Loan Before,0.0,88.63,1025.9181,2.0,0.0,0.0,3.0,2.0,2267.8918,3.0,27.0,405.3064,921.88,862.14,0.0,0.0,0.0,0.0,1300.0,400.0,0.0,1400,1904.0,7.0,13.0,Fortnightly,20.0,2391.23,1800.0,Casual Employment,3.0,0.0,0.2088,1.0,1843.76,656.0,1367.5233,272.0,MoneySpot,0.0,4556476,2.0,26-01-2023,False,Living Expenses,2023-01-26,Green,0.0,3859.0,2391.23
0062x00000Ebbg3AAB,0012x00000fmF2UAAU,Warners Bay,NSW,Australia,Loan Paid,Existing Client-Granted Loan Before,0.0,98.46,831.8504,2.0,0.0,0.0,2.0,2.0,5590.6472,3.0,8.0,561.1009,2573.23,2573.23,0.0,34.35,1.0,1.0,4431.62,899.0,1000.0,1500,2100.0,10.0,18.857,Fortnightly,45.0,7615.57,1500.0,Full-Time Employment,4.0,0.0,0.022,0.0,0.0,281.0,865.9433,210.0,MoneySpot,0.0,6301750,3.0,23-08-2023,False,Vehicle Expenses,2023-08-23,Orange,0.0,5167.0,7615.57
0062x00000Ds5l7AAB,0012x00000hZDnUAAW,Fairfield Heights,NSW,Australia,Closed Lost,New Client-New Loan,0.0,43.42,43.5133,1.0,0.0,0.0,3.0,1.0,6233.1824,0.0,3.0,716.925,850.5516,922.27,0.0,0.0,0.0,0.0,0.0,0.0,400.0,1200,1536.0,6.0,6.429,Weekly,34.0,4475.1,2000.0,,0.0,0.0,0.8352,0.0,1701.1033,55.0,175.1766,256.0,MoneySpot,,5219503,0.0,08-05-2023,False,Vehicle - Repairs,2023-05-08,Green,0.0,5366.0,4475.1
0062x00000D2792AAB,0012x00000g9PzkAAE,Liverpool,NSW,Australia,Closed Lost,New Client-New Loan,16.41,47.29,39.4033,1.0,0.0,2.0,5.0,1.0,3630.0366,0.0,7.0,0.0,397.7392,863.5,0.0,0.0,0.0,0.0,0.0,0.0,200.0,1200,1536.0,6.0,6.143,Weekly,31.0,3625.3,2000.0,,0.0,0.0,0.0,0.0,2325.07,0.0,48.5633,256.0,MoneySpot,,4427612,0.0,06-01-2023,False,Car Repairs,2023-01-06,Green,602.0,3667.0,3625.3
0062x00000EM1uRAAT,0012x00000kfrxpAAA,Canley Heights,NSW,Australia,Loan Paid,New Client-New Loan,0.0,82.21,697.6166,1.0,0.0,0.0,2.0,1.0,9911.369,0.0,13.0,0.0,1025.0675,1083.77,0.0,0.0,0.0,0.0,4766.67,400.0,200.0,1200,1680.0,21.0,21.143,Weekly,48.0,10079.55,2100.0,Full-Time Employment,0.0,0.0,0.0,0.0,4100.27,237.0,791.7666,80.0,QuickCash,0.0,6074894,0.0,01-08-2023,False,Living Expenses,2023-08-01,Green,0.0,13482.0,10079.55
0062x00000E4AorAAF,0012x00000dbvYHAAY,Mount Gambier,SA,Australia,Closed Lost,Existing Client-No Loan Granted Ever,0.0,50.83,1922.3109,1.0,0.0,0.0,2.0,1.0,7553.6619,0.0,56.0,0.0,901.58,887.22,0.0,0.0,0.0,0.0,17333.33,400.0,1098.0,1200,1872.0,39.0,38.857,Weekly,30.0,6070.55,10000.0,Part-Time Employment,0.0,0.0,0.0,0.0,3906.8466,443.0,1840.2933,48.0,MoneySpot,,5544776,0.0,08-06-2023,False,Home Improvements,2023-06-08,Green,0.0,7631.0,6070.55
0062x00000DtsrHAAR,0012x00000gpDkOAAU,Gungahlin,ACT,Australia,Loan Paid,Existing Client-No Loan Granted Ever,0.3,49.14,786.265,1.0,0.0,0.0,3.0,1.0,4182.2555,0.0,40.0,636.6284,823.2592,785.84,0.0,4.25,0.0,0.0,0.0,599.0,400.0,1200,1536.0,6.0,6.429,Weekly,26.0,4248.92,2000.0,Full-Time Employment,0.0,0.0,0.011,0.0,3567.4566,558.0,768.14,256.0,MoneySpot,0.0,5353913,0.0,22-05-2023,False,Travel Expenses,2023-05-22,Green,17.0,5484.0,4248.92
0062x00000E5ro2AAB,0012x00000fp7vNAAQ,Lurnea,NSW,Australia,Closed Lost,Existing Client-No Loan Granted Ever,0.0,23.79,782.7485,2.0,0.0,0.0,3.0,2.0,8844.7391,1.0,31.0,0.0,1827.8542,1866.39,0.0,1.33,0.0,0.0,8284.79,599.0,1000.0,1200,1584.0,6.0,12.0,Fortnightly,59.0,8849.74,2050.0,Full-Time Employment,1.0,0.0,0.7802,0.0,7875.66,0.0,871.06,264.0,MoneySpot,,5687755,0.0,26-06-2023,False,Other Expenses,2023-06-22,Green,0.0,9396.0,8849.74
0062x00000DA62pAAD,0012x000002aEelAAE,High Wycombe,WA,Australia,Loan Paid,Existing Client-Granted Loan Before,0.0,92.85,2071.806,2.0,9.0,0.0,3.0,2.0,2298.573,27.0,51.0,411.6985,885.73,839.09,1.0,0.0,0.0,0.0,2166.67,400.0,200.0,1400,1904.0,7.0,13.857,Fortnightly,33.0,2885.95,1400.0,Full-Time Employment,30.0,0.0,0.3956,10.0,1771.46,1188.0,2405.2133,272.0,MoneySpot,0.0,4612189,25.0,04-02-2023,False,Relocation Expenses,2023-02-03,Orange,0.0,3483.0,2885.95
0062x00000DX4mFAAT,0012x00000Tuc6SAAR,FLINDERS VIEW,QLD,Australia,Loan Paid,Existing Client-Granted Loan Before,48.63,73.75,1715.3765,1.0,0.0,2.0,2.0,1.0,3990.8517,2.0,25.0,207.2679,408.633,244.47,1.0,2.59,0.0,0.0,1993.0,599.0,400.0,1300,1716.0,10.0,10.0,Weekly,22.0,4010.43,2050.0,Part-Time Employment,2.0,0.0,0.5604,0.0,3219.19,586.0,1198.04,171.6,MoneySpot,0.0,4953207,2.0,29-03-2023,False,Living Expenses,2023-03-28,Orange,1857.0,3818.0,4010.43
0062x00000D7CIzAAN,0012x00000Wr0tOAAR,Lane Cove North,NSW,Australia,Loan Paid,Existing Client-Granted Loan Before,2.15,69.72,5370.6465,2.0,0.0,0.0,2.0,2.0,6954.6613,0.0,95.0,981.585,3201.05,3254.96,1.0,0.0,0.0,0.0,2751.0,899.0,1800.0,1500,2040.0,7.0,13.714,Fortnightly,35.0,7146.49,1500.0,Full-Time Employment,0.0,0.0,0.7912,0.0,7469.1166,1850.0,6352.7666,291.43,QuickCash,0.0,4471764,0.0,13-01-2023,False,Vehicle Expenses,2023-01-13,Green,192.0,8895.0,7146.49
0062x00000EzF9tAAF,0012x00000XRAMkAAP,Waterford West,QLD,Australia,Loan Paid,Existing Client-Granted Loan Before,0.2,77.5,1475.9999,1.0,0.0,0.0,2.0,1.0,7464.0528,0.0,34.0,0.0,1587.4533,1863.69,0.0,1.58,0.0,0.0,1500.0,1500.0,2160.0,1500,1980.0,7.0,13.143,Fortnightly,59.0,8787.51,1750.0,Casual Employment,0.0,0.0,0.0,0.0,8450.8466,731.0,1553.6466,282.86,MoneySpot,0.0,6793930,0.0,11-10-2023,False,Veterinary Expenses,2023-10-10,Orange,14.0,6781.0,8787.51
0062x00000ENyxWAAT,0012x00000kgwTzAAI,Auburn,NSW,Australia,Closed Lost,New Client-New Loan,0.0,76.81,417.1852,1.0,0.0,0.0,4.0,1.0,14484.7764,0.0,2.0,0.0,1099.0,1099.0,0.0,0.25,0.0,0.0,0.0,0.0,2000.0,1200,1776.0,29.0,29.429,Weekly,24.0,16631.64,7000.0,Full-time,0.0,0.0,0.0,0.0,4762.3333,0.0,406.7166,61.24,MoneySpot,,6220727,0.0,16-08-2023,False,Tuition Fees,2023-08-15,Green,0.0,21414.0,16631.64
0062x00000FhHtPAAV,0012x00000nQGKGAA4,Gorokan,NSW,Australia,Loan Paid,New Client-New Loan,0.0,91.39,122.5,1.0,0.0,0.0,2.0,1.0,5173.3761,0.0,20.0,0.0,1020.5021,1073.0,0.0,0.48,0.0,1.0,4636.67,400.0,200.0,1100,1496.0,14.0,14.0,Weekly,34.0,5183.38,1100.0,Part-Time Employment,0.0,0.0,0.4505,0.0,0.0,0.0,240.79,106.86,QuickCash,3.5,7884654,0.0,2024-01-17,False,Living Expenses,2024-01-17,Orange,0.0,4762.0,5183.38
0062x00000EDXqrAAH,0012x00000iKGaQAAW,Hoppers Crossing,VIC,Australia,Closed Lost,Existing Client-No Loan Granted Ever,0.0,55.74,926.0599,2.0,0.0,0.0,1.0,2.0,7374.7899,0.0,5.0,0.0,1500.5714,1820.0,0.0,0.0,0.0,1.0,0.0,400.0,0.0,1200,1776.0,14.0,27.857,Fortnightly,38.0,7382.12,2050.0,Part-Time Employment,0.0,0.0,0.2967,0.0,3344.1333,0.0,1181.7566,126.86,MoneySpot,,5950231,0.0,24-07-2023,False,Living Expenses,2023-07-19,Green,0.0,8079.0,7382.12
0062x00000DrPSGAA3,0012x00000gmXgDAAU,Kellyville,NSW,Australia,Loan Paid,Existing Client-No Loan Granted Ever,0.0,79.58,3369.3462,2.0,0.0,0.0,4.0,2.0,9626.5709,2.0,19.0,984.9424,2908.8442,2762.06,0.0,2.31,0.0,0.0,5812.11,899.0,300.0,1200,1632.0,8.0,15.714,Fortnightly,32.0,9626.57,5000.0,Full-Time Employment,2.0,0.0,0.033,1.0,6787.3033,1274.0,3209.16,204.0,MoneySpot,0.0,5167047,1.0,30-04-2023,False,"Insurance payments,Holiday, Travel & Accommodation,Gifts",2023-04-30,Green,0.0,12891.0,9626.57
0062x00000EeYl9AAF,0012x00000TttiBAAR,Goulburn,NSW,Australia,Closed Lost,Existing Client-No Loan Granted Ever,0.0,33.67,788.0145,1.0,1.0,0.0,2.0,1.0,3890.4711,0.0,12.0,0.0,895.3416,832.47,1.0,0.0,0.0,0.0,856.0,400.0,0.0,1200,1728.0,24.0,24.143,Weekly,28.0,3890.47,2050.0,Full-Time Employment,6.0,0.0,0.011,3.0,3581.3666,0.0,1057.8166,72.0,MoneySpot,,6499315,6.0,17-09-2023,False,Furniture or Appliances,2023-09-12,Green,0.0,3582.0,3890.47
0062x00000E6fboAAB,0010K000022PZgQQAW,Redbank Plains,QLD,Australia,Closed Lost,Existing Client-No Loan Granted Ever,0.0,52.91,523.2134,1.0,0.0,0.0,1.0,1.0,3495.9557,0.0,8.0,0.0,739.5463,802.0,0.0,0.0,0.0,0.0,2632.5,400.0,0.0,1200,1824.0,32.0,31.857,Weekly,27.0,3495.96,2050.0,Full-Time Employment,19.0,0.0,0.0659,0.0,2711.67,0.0,328.6866,57.0,MoneySpot,,5757817,0.0,28-06-2023,False,Living Expenses,2023-06-28,Green,0.0,4227.0,3495.96
0062x00000Ey817AAB,0010K000021EEDAQA4,Glendenning,NSW,Australia,Loan Paid,Existing Client-Granted Loan Before,0.0,1.95,0.0,2.0,0.0,0.0,2.0,2.0,7786.4781,0.0,0.0,0.0,3263.08,3263.08,0.0,0.0,0.0,0.0,5633.33,599.0,700.0,1250,1750.0,10.0,19.286,Fortnightly,44.0,8255.52,1250.0,Full-Time Employment,0.0,0.0,0.9011,0.0,7613.8533,0.0,0.0,175.0,QuickCash,0.0,6712817,0.0,03-10-2023,False,Furniture or Appliances,2023-10-02,Orange,0.0,8806.0,8255.52
0062x00000DIQi9AAH,0012x00000g9V1FAAU,Deer Park,VIC,Australia,Closed Lost,Existing Client-No Loan Granted Ever,0.0,66.07,0.0,1.0,0.0,0.0,2.0,1.0,7402.7289,2.0,4.0,0.0,772.4323,923.12,0.0,13.01,0.0,0.0,3900.0,400.0,250.0,1200,1632.0,16.0,15.714,Weekly,26.0,9604.4,5000.0,Full-Time Employment,2.0,0.0,0.4286,0.0,3347.2066,0.0,0.0,102.0,MoneySpot,,4833110,0.0,10-03-2023,False,Vehicle Expenses,2023-03-09,Green,0.0,11581.0,9604.4
0062x00000D74nSAAR,0012x00000NRn6cAAD,Saint Marys,NSW,Australia,Loan Paid,Existing Client-Granted Loan Before,0.0,32.13,1266.1454,2.0,0.0,0.0,3.0,2.0,9459.5902,0.0,36.0,0.0,3988.9742,4910.34,0.0,0.19,0.0,0.0,9750.0,400.0,600.0,1200,1632.0,8.0,16.0,Fortnightly,55.0,10194.73,5000.0,Full-Time Employment,0.0,0.0,0.0769,0.0,10116.1766,198.0,1186.8,204.0,MoneySpot,0.0,4466022,0.0,12-01-2023,False,Travel Expenses,2023-01-12,Orange,0.0,10975.0,10194.73
0062x00000DJ5K5AAL,0012x00000gpWF6AAM,Hannans,WA,Australia,Closed Lost,New Client-New Loan,0.0,11.01,0.0,1.0,0.0,0.0,3.0,1.0,8755.9172,0.0,0.0,0.0,943.0975,823.23,0.0,0.0,0.0,0.0,700.0,2000.0,400.0,1200,1536.0,6.0,6.0,Weekly,32.0,8755.92,4000.0,Casual Employment,0.0,0.0,0.0,0.0,3550.7966,0.0,810.7566,256.0,MoneySpot,,4870057,0.0,20-03-2023,False,Vehicle Expenses,2023-03-15,Orange,0.0,6140.0,8755.92
0062x00000EMG8bAAH,0012x00000RrltXAAR,Augustine Heights,QLD,Australia,Loan Paid,Existing Client-No Loan Granted Ever,0.0,6.18,465.7133,2.0,0.0,0.0,2.0,2.0,4689.307,3.0,13.0,0.0,2158.3666,2458.0,2.0,0.0,0.0,0.0,3834.13,1499.0,0.0,1200,1680.0,11.0,20.857,Fortnightly,38.0,4689.31,2250.0,Full-Time Employment,3.0,0.0,0.8681,2.0,4316.7333,0.0,2391.2933,152.73,MoneySpot,0.0,6092148,3.0,03-08-2023,False,Furniture or Appliances,2023-08-02,Green,0.0,4342.0,4689.31
0062x00000DZBq6AAH,0012x000003CWl8AAG,Ferndale,WA,Australia,Loan Paid,Existing Client-Granted Loan Before,0.0,83.35,2533.2268,2.0,0.0,0.0,4.0,2.0,6124.779,0.0,9.0,0.0,2819.0771,2823.36,0.0,0.0,0.0,0.0,4116.67,400.0,660.0,1100,1496.0,7.0,13.571,Fortnightly,27.0,6124.78,1100.0,Full-Time Employment,0.0,0.0,0.0,0.0,6577.8466,1434.0,4199.0333,213.71,Financier-2,0.0,5078632,0.0,17-04-2023,False,Living Expenses,2023-04-17,Orange,0.0,6733.0,6124.78
0062x00000DXOQzAAP,0012x00000cM6YYAA0,BRABHAM,WA,Australia,Loan Paid,Existing Client-Granted Loan Before,0.0,46.08,4629.9624,4.0,0.0,0.0,7.0,4.0,11829.4073,4.0,72.0,1311.2698,502.6666,165.0,0.0,0.67,0.0,1.0,4983.33,400.0,2800.0,1200,1536.0,3.0,6.0,Fortnightly,35.0,12701.1,1200.0,Full-Time Employment,4.0,0.0,0.0,4.0,6613.93,1078.0,4347.6766,512.0,QuickCash,0.0,4970213,0.0,31-03-2023,False,Living Expenses,2023-03-31,Green,0.0,14839.0,12701.1
0062x00000EE3ElAAL,0012x00000Mio34AAB,Woodvale,WA,Australia,Loan Paid,Existing Client-Granted Loan Before,0.0,53.09,3237.627,4.0,0.0,0.0,4.0,4.0,4475.0,0.0,28.0,0.0,2237.5,1823.0,0.0,0.0,0.0,0.0,5065.0,899.0,2300.0,1500,2160.0,24.0,24.286,Weekly,31.0,7189.67,1500.0,Full-Time Employment,0.0,0.0,0.4725,0.0,4475.0,363.0,4852.44,90.0,MoneySpot,0.0,5987282,0.0,23-07-2023,False,Living Expenses,2023-07-23,Green,0.0,11932.0,7189.67
0062x00000DApNiAAL,0012x00000g8YYEAA2,Morton,NSW,Australia,Loan Paid,Existing Client-No Loan Granted Ever,0.0,75.84,4467.4444,1.0,0.0,0.0,5.0,1.0,6421.2959,0.0,6.0,0.0,1266.6666,1400.0,0.0,1.7,0.0,1.0,1400.0,400.0,300.0,1200,1632.0,14.0,14.286,Weekly,53.0,6421.3,5000.0,Full-Time Employment,0.0,0.0,0.0,0.0,0.0,0.0,4797.9133,116.57,MoneySpot,0.0,4647353,0.0,10-02-2023,False,Home Maintenance & Repairs,2023-02-10,Orange,0.0,7233.0,6421.3
0062x00000DA8ZHAA1,0010K000020KPiyQAG,Taree,NSW,Australia,Closed Lost,Existing Client-No Loan Granted Ever,0.0,29.13,1874.9395,1.0,0.0,0.0,3.0,1.0,3359.7367,0.0,0.0,1018.3842,773.2,773.2,1.0,0.0,0.0,0.0,3510.0,899.0,0.0,1200,1536.0,6.0,5.714,Weekly,60.0,7046.93,1200.0,Part-Time Employment,0.0,0.0,0.0,0.0,2061.8666,1419.0,1909.17,256.0,MoneySpot,,4614699,0.0,04-02-2023,False,Car Repairs,2023-02-03,Green,0.0,3835.0,7046.93
0062x00000DGOOvAAP,0012x00000go7PAAAY,Blacktown,NSW,Australia,Loan Paid,New Client-New Loan,0.0,92.63,0.0,1.0,0.0,0.0,3.0,1.0,6989.7495,1.0,15.0,0.0,1172.4764,1293.94,0.0,0.03,0.0,0.0,5850.0,599.0,380.0,1200,1536.0,6.0,6.286,Weekly,31.0,6989.75,1500.0,Full-Time Employment,1.0,0.0,0.3407,1.0,5471.5566,0.0,83.0,256.0,MoneySpot,0.0,4720616,0.0,20-02-2023,False,Vehicle Expenses,2023-02-20,Green,0.0,6945.0,6989.75
0062x00000DrjwGAAR,0012x00000hZ1z4AAC,Ashfield,NSW,Australia,Closed Lost,New Client-New Loan,0.0,53.2,0.0,1.0,0.0,0.0,3.0,1.0,6335.8721,0.0,3.0,0.0,905.0,905.0,0.0,0.0,0.0,1.0,0.0,0.0,450.0,1200,1632.0,14.0,14.143,Weekly,28.0,4976.24,6000.0,Full-time,0.0,0.0,0.0,0.0,303.17,0.0,0.0,116.57,MoneySpot,,5188554,0.0,05-05-2023,False,Purchase,2023-05-03,Orange,0.0,9900.0,4976.24
0062x00000DGW0XAAX,0012x00000XCc2bAAD,Mambourin,VIC,Australia,Loan Paid,Existing Client-Granted Loan Before,1.22,39.24,326.98,1.0,1.0,0.0,2.0,1.0,6136.0375,5.0,18.0,0.0,872.11,1021.1,1.0,0.3,0.0,0.0,3636.95,400.0,1600.0,1200,1632.0,7.0,13.143,Fortnightly,30.0,5532.84,2000.0,Full-Time Employment,5.0,0.0,0.0989,2.0,2615.43,0.0,499.9066,233.14,Financier-2,0.0,4726377,5.0,21-02-2023,False,Living Expenses,2023-02-21,Orange,53.0,4310.0,5532.84
0062x00000D9N4nAAF,0012x00000GdeZCAAZ,Mount Warren Park,QLD,Australia,Loan Paid,Existing Client-Granted Loan Before,26.87,88.05,176.3966,2.0,0.0,4.0,2.0,2.0,5039.083,1.0,17.0,0.0,1497.01,1428.91,0.0,0.0,0.0,0.0,3119.5,599.0,1232.0,1200,1632.0,7.0,14.286,Fortnightly,30.0,7320.96,2500.0,Part-Time Employment,3.0,0.0,0.0,1.0,2811.56,0.0,782.78,233.14,MoneySpot,0.0,4579316,1.0,30-01-2023,False,Medical Expenses,2023-01-30,Green,1565.0,5823.0,7320.96
0062x00000F1JmNAAV,0012x00000bcoGiAAI,Marrickville,NSW,Australia,Closed Lost,Existing Client-No Loan Granted Ever,0.0,70.14,2749.5665,2.0,0.0,0.0,3.0,2.0,5900.6955,0.0,6.0,0.0,1108.1657,1102.72,0.0,0.25,0.0,0.0,4361.58,899.0,650.0,1200,1824.0,17.0,34.0,Fortnightly,31.0,6841.76,2600.0,Part-Time Employment,0.0,0.0,0.1648,0.0,2585.72,0.0,2749.5666,107.29,MoneySpot,,6884969,0.0,23-10-2023,False,rental_bond_cleaning,2023-10-19,Green,0.0,8295.0,6841.76
0062x00000DUeorAAD,0012x00000iGvhGAAS,Narre Warren South,VIC,Australia,Closed Lost,New Client-New Loan,0.0,81.85,3531.74,1.0,0.0,0.0,3.0,1.0,6816.422,1.0,24.0,637.2812,1429.7791,1485.55,0.0,5.52,0.0,0.0,0.0,0.0,20.0,1200,1536.0,6.0,6.143,Weekly,23.0,7074.42,1500.0,,1.0,0.0,0.0,1.0,5719.1166,49.0,3021.9533,256.0,MoneySpot,,5378583,0.0,24-05-2023,False,Medical Bill,2023-05-24,Green,0.0,6872.0,7074.42
0062x00000DIcZfAAL,0012x00000gpGoeAAE,Double Bay,NSW,Australia,Closed Lost,New Client-New Loan,0.0,21.93,0.0,1.0,0.0,0.0,4.0,1.0,4506.3402,1.0,6.0,0.0,1068.0133,1000.0,0.0,0.6,0.0,0.0,0.0,0.0,300.0,1200,1632.0,15.0,14.857,Weekly,27.0,5432.21,5000.0,,1.0,0.0,0.011,0.0,5195.3866,0.0,0.0,108.8,MoneySpot,,4844325,0.0,16-03-2023,False,To pay for materials,2023-03-11,Green,0.0,5493.0,5432.21
0062x00000DXS9HAAX,0012x00000LQKS9AAP,Noranda,WA,Australia,Closed Lost,Existing Client-No Loan Granted Ever,29.57,60.76,1539.882,1.0,0.0,2.0,2.0,1.0,7443.7749,0.0,8.0,0.0,656.2833,756.71,0.0,0.13,0.0,0.0,0.0,599.0,1000.0,1200,1536.0,6.0,5.714,Weekly,38.0,7443.77,2000.0,,0.0,0.0,0.011,0.0,3078.7666,0.0,1651.4466,256.0,MoneySpot,,4972677,0.0,31-03-2023,False,Living Expenses,2023-03-31,Green,1766.0,5971.0,7443.77
0062x00000FI1SwAAL,0012x00000g7xzEAAQ,Hoppers Crossing,VIC,Australia,Loan Paid,Existing Client-Granted Loan Before,0.0,85.11,969.6584,2.0,0.0,0.0,3.0,2.0,6187.8087,3.0,17.0,0.0,2727.99,2634.56,1.0,0.0,0.0,0.0,5639.8,400.0,1000.0,1500,2100.0,9.0,18.0,Fortnightly,45.0,6187.81,1500.0,Full-Time Employment,3.0,0.0,0.0549,1.0,6365.31,944.0,1092.6033,233.33,MoneySpot,0.0,7220014,1.0,16-11-2023,False,Home Maintenance & Repairs,2023-11-16,Green,0.0,11889.0,6187.81
0062x00000DWDbGAAX,0012x00000TFJOqAAP,Bowden,SA,Australia,Loan Paid,Existing Client-Granted Loan Before,0.0,57.62,929.777,4.0,0.0,0.0,1.0,4.0,6932.8132,0.0,29.0,795.1741,1578.2711,2021.05,1.0,0.18,0.0,0.0,0.0,599.0,870.0,1200,1536.0,4.0,8.0,Fortnightly,60.0,4734.81,1200.0,,0.0,0.0,0.9121,0.0,4734.8133,621.0,2157.91,384.0,MoneySpot,0.0,4903003,0.0,21-03-2023,False,Vehicle Expenses,2023-03-20,Green,0.0,12032.0,4734.81
0062x00000EwmAKAAZ,0012x00000gmUY3AAM,Woolgoolga,NSW,Australia,Loan Paid,Existing Client-Granted Loan Before,0.0,12.75,718.8,4.0,0.0,0.0,3.0,4.0,4253.3833,0.0,13.0,0.0,2126.6916,2224.6,1.0,0.0,0.0,0.0,4183.88,1499.0,600.0,1500,2040.0,16.0,15.857,Weekly,24.0,4253.38,1500.0,Full-Time Employment,0.0,0.0,0.1538,0.0,4253.3833,283.0,785.4666,127.5,MoneySpot,0.0,6612879,0.0,22-09-2023,False,Living Expenses,2023-09-22,Orange,0.0,5024.0,4253.38
0062x00000DsLq6AAF,0012x00000Rr8V1AAJ,Officer,VIC,Australia,Closed Lost,Existing Client-Granted Loan Before,0.0,47.48,1314.7534,1.0,1.0,0.0,4.0,1.0,4115.4735,9.0,49.0,0.0,880.0,880.0,2.0,0.0,0.0,0.0,3510.0,1499.0,500.0,1400,1792.0,6.0,6.286,Weekly,29.0,3877.99,1400.0,Full-Time Employment,12.0,0.0,0.044,6.0,3813.3333,51.0,1443.83,298.67,MoneySpot,,5235510,9.0,10-05-2023,False,Vehicle Expenses,2023-05-09,Green,0.0,4978.0,3877.99
0062x00000EDGdrAAH,0012x00000hZ1dGAAS,Dubbo,NSW,Australia,Closed Lost,Existing Client-No Loan Granted Ever,0.0,41.06,1461.4294,1.0,0.0,0.0,2.0,1.0,7956.0083,0.0,48.0,0.0,1439.4807,1329.65,2.0,0.0,0.0,0.0,0.0,899.0,530.0,1200,1584.0,11.0,11.286,Weekly,33.0,7956.01,2500.0,Full-Time Employment,0.0,0.0,0.011,0.0,8064.71,240.0,1532.43,144.0,MoneySpot,,5932712,0.0,17-07-2023,False,Living Expenses,2023-07-17,Green,0.0,8706.0,7956.01
0062x00000DFpnPAAT,0012x00000g96NrAAI,Mirrabooka,WA,Australia,Closed Lost,Existing Client-No Loan Granted Ever,0.0,52.14,0.0,2.0,0.0,0.0,4.0,2.0,3962.2454,4.0,10.0,326.7185,1731.0133,1361.96,0.0,0.0,0.0,0.0,0.0,400.0,0.0,1200,1536.0,4.0,8.286,Fortnightly,20.0,3962.25,1500.0,Full-time,4.0,0.0,0.1429,0.0,3462.0266,100.0,185.43,384.0,MoneySpot,,4688450,4.0,15-02-2023,False,Living Expenses,2023-02-15,Green,0.0,4673.0,3962.25
0062x00000Drx0sAAB,0012x00000hZ8qAAAS,Narrabri,NSW,Australia,Closed Lost,New Client-New Loan,0.0,26.78,1149.545,1.0,0.0,0.0,2.0,1.0,5708.1924,0.0,22.0,0.0,1126.0,1230.0,1.0,0.14,0.0,1.0,4333.33,1500.0,1040.0,1200,1584.0,10.0,10.571,Weekly,60.0,9791.77,2100.0,Part-Time Employment,0.0,0.0,0.0,0.0,3389.4333,0.0,1146.0133,158.4,MoneySpot,,5208226,0.0,06-05-2023,False,Living Expenses,2023-05-05,Green,0.0,5901.0,9791.77
0062x00000F49JHAAZ,0012x00000mGo1wAAC,Rosemeadow,NSW,Australia,Closed Lost,New Client-New Loan,0.0,59.37,183.452,2.0,0.0,0.0,4.0,2.0,7169.33,4.0,16.0,0.0,3299.8566,3270.4,1.0,0.0,0.0,0.0,3150.0,2000.0,200.0,1200,1632.0,7.0,14.286,Fortnightly,47.0,8752.66,3200.0,Full-Time Employment,4.0,0.0,0.1978,4.0,6599.7133,0.0,182.95,233.14,MoneySpot,,7110825,1.0,12-11-2023,False,Furniture or Appliances,2023-11-07,Green,0.0,8366.0,8752.66
0062x00000ECcrLAAT,0012x00000TGppeAAD,Mornington,VIC,Australia,Loan Paid,Existing Client-No Loan Granted Ever,0.0,22.21,553.8069,2.0,0.0,0.0,2.0,2.0,6143.9031,3.0,30.0,0.0,1629.8214,1656.75,1.0,2.67,0.0,0.0,4257.98,1500.0,1440.0,1200,1632.0,8.0,16.0,Fortnightly,56.0,6154.9,4000.0,Self Employed,3.0,0.0,0.8791,0.0,6016.4266,0.0,1186.2733,204.0,MoneySpot,0.0,5890143,0.0,12-07-2023,False,Living Expenses,2023-07-12,Green,0.0,6848.0,6154.9
0062x00000DIS1JAAX,0012x00000gomqWAAQ,Parap,NT,Australia,Loan Paid,Existing Client-No Loan Granted Ever,0.0,17.01,522.7821,2.0,0.0,0.0,4.0,2.0,3538.894,0.0,16.0,271.331,1628.8614,1954.73,0.0,0.0,0.0,0.0,3364.83,400.0,600.0,1200,1536.0,3.0,6.0,Fortnightly,42.0,3885.23,2000.0,Full-Time Employment,0.0,0.0,0.011,0.0,3800.6766,125.0,376.34,512.0,MoneySpot,0.0,4834316,0.0,10-03-2023,False,Travel Expenses,2023-03-10,Green,0.0,4682.0,3885.23
0062x00000D9u8dAAB,0012x00000GcYqCAAV,Cooks Hill,NSW,Australia,Loan Paid,Existing Client-Granted Loan Before,0.0,0.0,0.0,0.0,0.0,0.0,0.0,0.0,0.0,0.0,0.0,0.0,0.0,0.0,0.0,0.0,0.0,0.0,501.0,599.0,570.0,1200,1632.0,14.0,14.0,Weekly,30.0,0.0,2050.0,Casual Employment,0.0,0.0,0.0,0.0,0.0,0.0,0.0,116.57,MoneySpot,0.0,4603652,0.0,03-02-2023,False,Child Expenses,2023-02-03,Orange,0.0,0.0,0.0
0062x00000E3aerAAB,0012x00000LQaeSAAT,Midvale,WA,Australia,Loan Paid,Existing Client-Granted Loan Before,0.0,91.45,217.6069,1.0,0.0,0.0,2.0,1.0,3323.9711,5.0,13.0,217.6095,740.0376,836.95,0.0,0.0,0.0,0.0,750.0,400.0,400.0,1500,2040.0,16.0,16.429,Weekly,27.0,3455.64,1500.0,Casual Employment,5.0,0.0,0.1209,1.0,3206.83,217.0,217.0133,127.5,Financier-2,0.0,5500394,5.0,04-06-2023,False,Vehicle Expenses,2023-06-04,Green,0.0,3514.0,3455.64
0062x00000E3ZYaAAN,0012x00000iHujLAAS,Kallangur,QLD,Australia,Closed Lost,New Client-New Loan,0.0,89.23,104.9566,1.0,0.0,0.0,3.0,1.0,341.6666,0.0,14.0,0.0,128.125,50.0,0.0,2.27,0.0,1.0,8666.67,400.0,500.0,1200,1536.0,6.0,5.714,Weekly,42.0,8858.44,75000.0,Full-Time Employment,0.0,0.0,0.1648,0.0,0.0,73.0,178.29,256.0,MoneySpot,,5498926,0.0,04-06-2023,False,Living Expenses,2023-06-04,Orange,0.0,10068.0,8858.44
0062x00000DFMkrAAH,0012x00000gnWvTAAU,Ellenbrook,WA,Australia,Closed Lost,New Client-New Loan,0.0,34.18,1481.83,2.0,0.0,0.0,2.0,2.0,4624.4999,7.0,0.0,672.0,2270.5833,2102.0,0.0,0.14,0.0,0.0,0.0,0.0,0.0,1200,1536.0,3.0,6.571,Fortnightly,22.0,4963.3,2000.0,,7.0,0.0,0.3187,3.0,4541.1666,273.0,1548.4966,512.0,MoneySpot,,4663927,2.0,11-02-2023,False,Vehicle Other,2023-02-11,Green,0.0,6359.0,4963.3
0062x00000DHVVwAAP,0012x00000c7OT7AAM,CRANBOURNE EAST,VIC,Australia,Loan Paid,Existing Client-Granted Loan Before,0.0,96.36,3082.3099,2.0,0.0,0.0,3.0,2.0,11401.4659,0.0,3.0,0.0,2400.0,2400.0,0.0,10.56,0.0,1.0,0.0,400.0,380.0,1500,1980.0,7.0,13.0,Fortnightly,54.0,3767.97,1500.0,,0.0,0.0,0.0,0.0,0.0,540.0,7066.6333,282.86,MoneySpot,0.0,4782379,0.0,02-03-2023,False,Other Expenses,2023-03-02,Orange,0.0,16935.0,3767.97
0062x00000Ez7CVAAZ,0012x00000Fz3OxAAJ,Wentworthville,NSW,Australia,Loan Paid,Existing Client-No Loan Granted Ever,0.0,63.71,2342.1899,2.0,0.0,0.0,2.0,2.0,10620.0208,0.0,25.0,0.0,2296.2283,1979.66,2.0,0.0,0.0,0.0,0.0,400.0,200.0,1200,1632.0,8.0,16.286,Fortnightly,29.0,10313.0,5000.0,,0.0,0.0,0.0,0.0,7583.5433,0.0,2168.09,204.0,MoneySpot,0.0,6784589,0.0,09-10-2023,False,Vehicle Expenses,2023-10-09,Green,0.0,12459.0,10313.0
0062x00000D93huAAB,0012x00000gmXQJAA2,Riverside,TAS,Australia,Loan Paid,New Client-New Loan,0.0,87.42,1928.0381,1.0,0.0,0.0,3.0,1.0,7094.9808,1.0,47.0,0.0,882.8215,884.87,0.0,0.48,0.0,0.0,900.0,2000.0,0.0,1200,1632.0,16.0,15.857,Weekly,25.0,9033.98,5000.0,Full-Time Employment,1.0,0.0,0.4066,1.0,4280.4933,78.0,2815.2566,102.0,MoneySpot,0.0,4562685,0.0,27-01-2023,False,Medical Expenses,2023-01-27,Green,0.0,10396.0,9033.98
0062x00000FU7VAAA1,0012x00000n19gdAAA,Coniston,NSW,Australia,Closed Lost,New Client-New Loan,0.0,65.64,425.0049,1.0,0.0,0.0,2.0,1.0,9775.0088,10.0,23.0,0.0,1585.723,1568.0,1.0,0.0,0.0,0.0,0.0,0.0,2000.0,1200,1584.0,13.0,13.0,Weekly,45.0,9775.01,2100.0,full_time,10.0,0.0,0.7473,0.0,6871.4666,0.0,1236.01,121.85,MoneySpot,,7482250,8.0,17-12-2023,False,Household bills,2023-12-12,Green,0.0,9774.0,9775.01
0062x00000EfAY4AAN,0012x00000gnZoLAAU,Dubbo,NSW,Australia,Loan Paid,Existing Client-Granted Loan Before,0.0,85.49,1940.1976,4.0,0.0,0.0,2.0,4.0,5865.7059,4.0,92.0,0.0,1574.125,1833.65,2.0,0.0,0.0,1.0,3791.67,599.0,560.0,1250,1750.0,10.0,19.571,Fortnightly,32.0,5865.71,1250.0,Full-Time Employment,4.0,0.0,0.022,0.0,152.3333,546.0,2514.6633,175.0,QuickCash,0.0,6550580,2.0,16-09-2023,False,Living Expenses,2023-09-16,Orange,0.0,7113.0,5865.71
0062x00000FVSwzAAH,0012x00000hYHYsAAO,Blacktown,QLD,Australia,Loan Paid,Existing Client-Granted Loan Before,0.0,74.54,861.7466,1.0,0.0,0.0,3.0,1.0,5056.4439,0.0,46.0,0.0,1019.8384,983.42,1.0,0.85,0.0,0.0,4225.0,400.0,500.0,1150,1610.0,20.0,20.0,Weekly,28.0,5056.44,1500.0,Full-Time Employment,0.0,0.0,0.0,0.0,4419.3,0.0,936.7966,80.5,QuickCash,0.0,7594812,0.0,21-12-2023,False,Life Event Expenses,2023-12-21,Green,0.0,7195.0,5056.44
0062x00000DV409AAD,0012x00000g8n7RAAQ,Hillside,VIC,Australia,Loan Paid,Existing Client-Granted Loan Before,16.77,66.69,4583.4855,4.0,0.0,4.0,2.0,4.0,18405.3595,3.0,0.0,1549.8921,3216.6666,200.0,3.0,0.0,0.0,1.0,0.0,1500.0,0.0,1500,2040.0,7.0,13.714,Fortnightly,33.0,18405.36,3000.0,,3.0,0.0,0.011,1.0,3613.9233,1443.0,7087.75,291.43,MoneySpot,0.0,5414773,1.0,27-05-2023,False,Travel Expenses,2023-05-27,Orange,3627.0,21625.0,18405.36
0062x00000DGrVlAAL,0012x00000SI3dnAAD,MASCOT,NSW,Australia,Closed Lost,Existing Client-No Loan Granted Ever,17.45,85.8,2034.6353,2.0,1.0,2.0,4.0,2.0,7688.7275,2.0,38.0,224.475,1838.9983,1810.0,1.0,0.0,0.0,0.0,1842.97,899.0,740.0,1200,1536.0,3.0,5.0,Fortnightly,28.0,7688.73,2000.0,Full-Time Employment,2.0,0.0,0.0549,2.0,4988.3733,589.0,3692.7466,512.0,MoneySpot,,4746850,1.0,28-02-2023,False,Vehicle - Repairs,2023-02-24,Green,1310.0,7507.0,7688.73
0062x00000DHr2lAAD,0012x00000LQHPBAA5,Balga,WA,Australia,Closed Lost,Existing Client-No Loan Granted Ever,0.0,6.49,1149.2206,2.0,0.0,0.0,4.0,2.0,3323.3067,0.0,15.0,0.0,1529.6316,1578.02,0.0,0.16,0.0,0.0,0.0,2000.0,1200.0,1200,1536.0,3.0,4.714,Fortnightly,52.0,3323.31,15000.0,,0.0,0.0,0.2088,0.0,3059.2633,0.0,1084.1466,512.0,MoneySpot,,4803462,0.0,05-03-2023,False,Living Expenses,2023-03-05,Orange,0.0,3180.0,3323.31
0062x00000Dtp2LAAR,0012x00000TszFGAAZ,Clyde North,VIC,Australia,Loan Paid,Existing Client-Granted Loan Before,0.0,92.15,1809.5725,1.0,0.0,0.0,3.0,1.0,6333.6533,2.0,38.0,0.0,1665.8381,2171.19,1.0,0.0,0.0,0.0,6989.67,1499.0,1315.0,1200,1632.0,14.0,14.429,Weekly,36.0,6333.65,2050.0,Full-Time Employment,2.0,0.0,0.0,1.0,6108.0733,359.0,1589.8166,116.57,MoneySpot,0.0,5351027,2.0,22-05-2023,False,Vehicle Expenses,2023-05-22,Orange,0.0,7007.0,6333.65
0062x00000DZLZNAA5,0012x00000c9YlRAAU,Wyndham Vale,VIC,Australia,Loan Paid,Existing Client-Granted Loan Before,49.41,51.95,2744.8982,1.0,0.0,4.0,2.0,1.0,5567.5317,0.0,94.0,861.3131,670.3558,634.19,1.0,0.0,0.0,0.0,2617.84,899.0,1000.0,1300,1820.0,20.0,20.143,Weekly,59.0,5572.53,2050.0,Part-Time Employment,0.0,1.0,0.1429,0.0,5336.1,822.0,2832.2133,91.0,MoneySpot,0.0,5087690,0.0,18-04-2023,False,Furniture or Appliances,2023-04-18,Orange,2655.0,5373.0,5572.53
0062x00000DWCYMAA5,0012x00000g9V1FAAU,Deer Park,VIC,Australia,Closed Lost,Existing Client-No Loan Granted Ever,0.0,72.34,0.0,4.0,0.0,0.0,1.0,4.0,10410.9988,0.0,2.0,0.0,570.4583,330.0,0.0,9.1,0.0,1.0,3900.0,400.0,200.0,1200,1536.0,6.0,6.143,Weekly,26.0,11866.0,5000.0,Full-Time Employment,0.0,0.0,0.4835,0.0,3100.7133,0.0,0.0,256.0,MoneySpot,,4901798,0.0,21-03-2023,False,Vehicle Expenses,2023-03-20,Orange,0.0,13786.0,11866.0
0062x00000ENEtIAAX,0012x00000ILt9cAAD,Sheldon,QLD,Australia,Loan Paid,Existing Client-No Loan Granted Ever,0.0,44.42,1053.8765,1.0,0.0,0.0,3.0,1.0,9815.1543,5.0,83.0,0.0,2034.6153,1320.0,1.0,0.0,0.0,0.0,1473.33,400.0,690.0,1200,1632.0,14.0,14.0,Weekly,25.0,9877.27,2500.0,Unemployed,5.0,0.0,0.011,0.0,8816.6666,0.0,986.8133,116.57,MoneySpot,0.0,6160815,0.0,10-08-2023,False,Living Expenses,2023-08-09,Orange,0.0,10389.0,9877.27
0062x00000E4xpHAAR,0012x00000iInQZAA0,Werribee,VIC,Australia,Closed Lost,New Client-New Loan,0.0,48.78,1628.6326,2.0,0.0,0.0,3.0,2.0,12399.0117,2.0,28.0,0.0,2946.7142,2694.19,2.0,0.0,0.0,0.0,0.0,0.0,1000.0,1200,1632.0,8.0,16.0,Fortnightly,50.0,12671.95,5000.0,Full-Time Employment,2.0,0.0,0.0,0.0,10634.4933,14.0,1810.2,204.0,MoneySpot,,5613457,2.0,19-06-2023,False,To finish off building my mums home,2023-06-14,Green,0.0,18019.0,12671.95
0062x00000E4XBDAA3,0012x00000IMDg3AAH,Bunnaloo,NSW,Australia,Loan Paid,Existing Client-Granted Loan Before,0.56,59.59,1332.6285,1.0,0.0,0.0,1.0,1.0,8854.7211,1.0,38.0,0.0,1927.3333,1994.0,2.0,0.0,0.0,0.0,9838.18,899.0,0.0,1500,2040.0,14.0,14.143,Weekly,33.0,8854.72,5000.0,Full-Time Employment,1.0,0.0,0.011,0.0,7709.3333,2149.0,4076.21,145.71,MoneySpot,0.0,5580650,1.0,12-06-2023,False,Medical Expenses,2023-06-12,Orange,49.0,8705.0,8854.72
0062x00000D9pRBAAZ,0012x00000L3CmbAAF,Capel,WA,Australia,Loan Paid,Existing Client-Granted Loan Before,0.25,54.7,5801.3217,4.0,1.0,0.0,4.0,4.0,2953.3333,2.0,20.0,2691.2495,344.0,250.0,1.0,0.36,0.0,1.0,13739.38,899.0,0.0,1350,1836.0,7.0,14.0,Fortnightly,43.0,27183.18,1350.0,Part-Time Employment,7.0,0.0,0.011,0.0,7088.57,2638.0,7415.4333,262.29,Financier-2,0.0,4600708,5.0,02-02-2023,False,Furniture or Appliances,2023-02-02,Orange,39.0,15060.0,27183.18
0062x00000D6xnkAAB,0012x00000g9kiiAAA,Ultimo,NSW,Australia,Closed Lost,New Client-New Loan,0.0,70.12,411.1832,2.0,0.0,0.0,4.0,2.0,5189.84,3.0,7.0,0.0,1958.0,1958.0,1.0,0.39,0.0,0.0,1958.0,2000.0,0.0,1200,1584.0,6.0,11.0,Fortnightly,72.0,5189.84,4000.0,Full-Time Employment,3.0,0.0,0.0,0.0,3916.0,0.0,583.9033,264.0,MoneySpot,,4461324,2.0,16-01-2023,False,Medical Expenses,2023-01-11,Green,0.0,5666.0,5189.84
0062x00000GZdrrAAD,0012x00000IM1iNAAT,Hamilton South,NSW,Australia,Closed Lost,Existing Client-Granted Loan Before,0.0,85.36,4653.1663,1.0,0.0,0.0,3.0,1.0,7534.4593,0.0,106.0,586.2595,1379.6338,1426.4,0.0,6.79,0.0,0.0,1209.57,599.0,300.0,1500,2040.0,14.0,14.429,Weekly,28.0,7534.46,1500.0,Full-Time Employment,0.0,0.0,0.5934,0.0,5978.4133,2044.0,5557.05,145.71,MoneySpot,,8940532,0.0,2024-04-22,False,Travel Expenses,2024-04-22,Orange,0.0,8514.0,7534.46
0062x00000FSqI9AAL,0012x00000SIJteAAH,Cowaramup,WA,Australia,Closed Lost,Existing Client-Granted Loan Before,0.0,80.78,2835.85,1.0,0.0,0.0,2.0,1.0,9138.7163,0.0,59.0,0.0,1553.8169,1631.54,1.0,0.0,0.0,1.0,0.0,599.0,100.0,1500,2040.0,14.0,13.857,Weekly,36.0,9143.72,5000.0,,0.0,0.0,0.0,0.0,0.0,4090.0,4889.7466,145.71,MoneySpot,,8982648,0.0,2024-04-25,False,Vehicle Expenses,2024-04-25,Orange,0.0,9878.0,9143.72
0062x00000D8pD7AAJ,0010K000027209EQAQ,Seaford Rise,SA,Australia,Loan Paid,Existing Client-Granted Loan Before,0.0,62.8,1038.1641,1.0,0.0,0.0,3.0,1.0,4949.2418,1.0,82.0,0.0,976.2892,953.78,2.0,0.0,0.0,0.0,4610.67,599.0,400.0,1200,1632.0,16.0,16.143,Weekly,54.0,4949.24,5000.0,Full-Time Employment,1.0,0.0,0.5385,0.0,4230.5866,626.0,1054.4,102.0,MoneySpot,0.0,4551245,0.0,25-01-2023,False,Living Expenses,2023-01-25,Green,0.0,5215.0,4949.24
0062x00000DIXBEAA5,0012x00000XOpOJAA1,Silverwater,NSW,Australia,Loan Paid,Existing Client-Granted Loan Before,0.0,57.04,530.1666,4.0,0.0,0.0,4.0,4.0,3590.9433,1.0,15.0,0.0,1145.8537,1807.85,1.0,8.22,0.0,0.0,0.0,2000.0,400.0,1350,1782.0,6.0,11.0,Fortnightly,51.0,3590.94,15300.0,,1.0,0.0,0.0,0.0,3055.61,212.0,1394.73,297.0,MoneySpot,0.0,4837813,0.0,10-03-2023,False,Living Expenses,2023-03-10,Green,0.0,5253.0,3590.94
0062x00000FJolfAAD,0012x00000mJhbVAAS,Bibra Lake,WA,Australia,Closed Lost,New Client-New Loan,0.0,47.69,913.7151,2.0,0.0,0.0,3.0,2.0,6356.9406,0.0,24.0,0.0,2862.8771,3288.56,0.0,0.0,0.0,0.0,2791.93,2000.0,960.0,1200,1632.0,8.0,16.143,Fortnightly,35.0,6356.94,5000.0,Full-Time Employment,0.0,0.0,0.022,0.0,6680.0466,0.0,851.65,204.0,MoneySpot,,7349036,0.0,01-12-2023,False,Vehicle Expenses,2023-11-29,Green,0.0,7522.0,6356.94
0062x00000DY6pvAAD,0012x00000BJ1suAAD,Cooroy,QLD,Australia,Loan Paid,Existing Client-Granted Loan Before,0.0,74.15,2840.5066,1.0,0.0,0.0,4.0,1.0,14671.6239,0.0,9.0,320.0,1623.2783,1623.61,0.0,52.87,0.0,1.0,5837.0,599.0,500.0,1150,1472.0,6.0,6.143,Weekly,36.0,14671.62,1150.0,Full-Time Employment,0.0,0.0,0.0,0.0,0.0,555.0,2601.4233,245.33,QuickCash,0.0,5012214,0.0,06-04-2023,False,Living Expenses,2023-04-06,Green,0.0,16001.0,14671.62
0062x00000D1jP8AAJ,0012x00000SFY15AAH,Caboolture South,QLD,Australia,Loan Paid,Existing Client-Granted Loan Before,0.0,94.28,1628.6448,2.0,0.0,0.0,2.0,2.0,4993.7038,3.0,41.0,960.0,2274.4616,1123.83,0.0,0.0,0.0,0.0,4781.12,899.0,200.0,1500,2040.0,7.0,14.0,Fortnightly,23.0,4977.04,1500.0,Full-Time Employment,3.0,0.0,0.989,0.0,4548.9233,597.0,2730.41,291.43,QuickCash,0.0,4407610,0.0,04-01-2023,False,Medical Expenses,2023-01-04,Green,0.0,6230.0,4977.04
0062x00000EbR2cAAF,0012x00000iH2DxAAK,Thomastown,VIC,Australia,Closed Lost,Existing Client-No Loan Granted Ever,0.0,57.72,1298.6533,1.0,0.0,0.0,3.0,1.0,16954.3959,2.0,10.0,0.0,948.5992,964.47,0.0,10.95,0.0,0.0,7686.39,400.0,900.0,1200,1632.0,16.0,16.286,Weekly,34.0,19245.4,5000.0,Full-Time Employment,2.0,0.0,0.0,0.0,6474.7033,0.0,1310.9866,102.0,MoneySpot,,6290786,0.0,22-08-2023,False,Other Expenses,2023-08-22,Green,0.0,28934.0,19245.4
0062x00000DZHZTAA5,0012x00000hY69mAAC,Collingwood,VIC,Australia,Loan Paid,New Client-New Loan,0.29,94.49,427.7884,2.0,0.0,0.0,3.0,2.0,4241.912,0.0,14.0,1240.7893,1765.8783,1612.5,1.0,0.0,0.0,0.0,3683.33,400.0,350.0,1200,1632.0,8.0,16.286,Fortnightly,33.0,5246.25,4900.0,Full-Time Employment,0.0,0.0,0.0,0.0,3531.7566,356.0,1150.3233,204.0,MoneySpot,0.0,5084899,0.0,18-04-2023,False,Living Expenses,2023-04-17,Green,18.0,6102.0,5246.25
0062x00000DG9aZAAT,0012x00000dxKGYAA2,Sefton,NSW,Australia,Loan Paid,Existing Client-Granted Loan Before,0.0,90.11,4453.5853,2.0,0.0,0.0,3.0,2.0,5338.1741,10.0,89.0,417.5048,2317.8366,2521.62,1.0,0.0,0.0,0.0,2000.0,599.0,820.0,1500,2040.0,7.0,12.857,Fortnightly,25.0,5338.17,1500.0,Part-Time Employment,10.0,0.0,0.7582,5.0,4635.6733,809.0,4765.02,291.43,MoneySpot,0.0,4705068,4.0,17-02-2023,False,Life Event Expenses,2023-02-17,Orange,0.0,5100.0,5338.17
0062x00000DsQ80AAF,0012x00000hZTZVAA4,Minchinbury,NSW,Australia,Loan Paid,New Client-New Loan,0.0,88.47,708.0925,1.0,0.0,0.0,3.0,1.0,3552.7226,0.0,9.0,0.0,778.7777,861.0,0.0,0.0,0.0,0.0,4116.67,400.0,1.0,1200,1584.0,12.0,12.143,Weekly,19.0,4585.61,3600.0,Contract Employment,0.0,0.0,0.0769,0.0,2336.3333,0.0,743.3333,132.0,MoneySpot,0.0,5238641,0.0,10-05-2023,False,Living Expenses,2023-05-10,Green,0.0,4176.0,4585.61
0062x00000DWolxAAD,0012x00000Oya8vAAB,Blacktown,VIC,Australia,Closed Lost,Existing Client-Granted Loan Before,0.0,50.18,0.0,2.0,0.0,0.0,2.0,2.0,226.6666,0.0,11.0,0.0,80.0,100.0,0.0,5.53,0.0,1.0,4099.33,599.0,720.0,1500,1980.0,9.0,9.286,Weekly,47.0,5090.87,1500.0,Full-Time Employment,0.0,0.0,0.3736,0.0,0.0,106.0,105.6,220.0,Financier-2,,4939984,0.0,27-03-2023,False,Living Expenses,2023-03-26,Green,0.0,5136.0,5090.87
0062x00000Fw0aHAAR,0012x00000LP3xYAAT,Rutherford,NSW,Australia,Loan Paid,Existing Client-Granted Loan Before,0.0,50.56,1355.77,2.0,0.0,0.0,3.0,2.0,7417.3686,0.0,23.0,0.0,3329.6383,3830.78,0.0,27.35,2.0,0.0,0.0,1499.0,800.0,1500,2040.0,7.0,14.571,Fortnightly,28.0,8680.66,1500.0,,0.0,0.0,0.0,0.0,6659.2766,1273.0,3179.7433,291.43,MoneySpot,0.0,8350541,0.0,2024-03-03,False,Veterinary Expenses,2024-03-03,Orange,0.0,10438.0,8680.66
0062x00000D7cYNAAZ,0012x00000g9VZaAAM,Altona Meadows,VIC,Australia,Loan Paid,Existing Client-No Loan Granted Ever,0.12,37.76,2558.1437,4.0,0.0,0.0,3.0,4.0,8831.9,1.0,47.0,365.9125,2943.9666,3139.15,1.0,0.45,0.0,1.0,0.0,1500.0,1560.0,1200,1536.0,6.0,6.286,Weekly,57.0,8836.9,2000.0,Full-Time Employment,1.0,0.0,0.033,1.0,0.0,554.0,1827.6533,256.0,MoneySpot,0.0,4492473,0.0,17-01-2023,False,Vehicle Expenses,2023-01-16,Orange,13.0,10415.0,8836.9
0062x00000FHRqgAAH,0012x00000LQSOzAAP,Mortlake,NSW,Australia,Loan Paid,Existing Client-Granted Loan Before,1.01,44.19,6250.8195,2.0,0.0,0.0,2.0,2.0,15324.582,0.0,31.0,0.0,6426.9783,5930.86,0.0,11.39,0.0,0.0,10728.85,899.0,3400.0,1500,2100.0,10.0,20.429,Fortnightly,34.0,14976.96,1500.0,Full-Time Employment,0.0,0.0,0.0,0.0,12853.9566,730.0,6104.86,210.0,MoneySpot,0.0,7171256,0.0,12-11-2023,False,Vehicle Expenses,2023-11-12,Orange,152.0,14923.0,14976.96
0062x00000D93oMAAR,0010K000028f09NQAQ,Minto,NSW,Australia,Loan Paid,Existing Client-Granted Loan Before,0.0,66.08,1261.2528,4.0,0.0,0.0,3.0,4.0,3758.2066,0.0,0.0,986.7068,1315.9312,1368.62,0.0,0.0,0.0,0.0,3531.67,899.0,0.0,1200,1632.0,7.0,13.857,Fortnightly,34.0,3758.21,1200.0,Full-Time Employment,0.0,0.0,0.0,0.0,3509.15,1589.0,3244.8133,233.14,Financier-2,0.0,4562766,0.0,27-01-2023,False,Travel Expenses,2023-01-27,Green,0.0,4531.0,3758.21
0062x00000DAfkrAAD,0012x00000gnICxAAM,Deception Bay,QLD,Australia,Closed Lost,New Client-New Loan,37.17,30.92,1001.5477,1.0,0.0,2.0,3.0,1.0,4095.5768,4.0,57.0,325.4583,620.6572,524.89,1.0,0.0,0.0,0.0,0.0,0.0,640.0,1200,1536.0,6.0,6.429,Weekly,39.0,4100.58,2000.0,,4.0,0.0,0.956,0.0,3718.52,687.0,1040.26,256.0,MoneySpot,,4640428,4.0,08-02-2023,False,Vehicle - Repairs,2023-02-08,Green,1443.0,3882.0,4100.58
0062x00000DGkZKAA1,0012x00000foa7rAAA,New Port,SA,Australia,Loan Paid,Existing Client-Granted Loan Before,0.0,51.29,1897.9168,4.0,2.0,0.0,2.0,4.0,69039.6022,0.0,2.0,3287.6923,4575.7635,8344.31,1.0,0.0,0.0,1.0,0.0,599.0,1400.0,1500,2040.0,14.0,13.857,Weekly,34.0,107691.37,1500.0,,13.0,0.0,0.0,9.0,2972.3433,3235.0,4091.3366,145.71,QuickCash,0.0,4740413,9.0,23-02-2023,False,Living Expenses,2023-02-23,Orange,0.0,105742.0,107691.37
0062x00000D2LskAAF,0012x00000ZvZguAAF,Upper Manilla,NSW,Australia,Loan Paid,Existing Client-No Loan Granted Ever,0.0,34.26,0.0,2.0,0.0,0.0,5.0,2.0,3339.8558,0.0,21.0,0.0,1426.8566,1484.0,0.0,1.34,0.0,0.0,0.0,400.0,120.0,1200,1536.0,3.0,4.714,Fortnightly,20.0,5409.88,1500.0,Full-Time Employment,0.0,0.0,0.011,0.0,1426.8566,0.0,673.75,512.0,MoneySpot,0.0,4441037,0.0,09-01-2023,False,Home Maintenance & Repairs,2023-01-08,Green,0.0,3737.0,5409.88
0062x00000DZPoDAAX,0012x00000hYAXfAAO,Grafton,NSW,Australia,Closed Lost,New Client-New Loan,0.0,12.79,936.6333,0.0,0.0,0.0,0.0,0.0,0.0,2.0,8.0,0.0,0.0,0.0,0.0,0.0,0.0,0.0,3900.0,400.0,1800.0,1200,1536.0,3.0,5.143,Fortnightly,34.0,2271.25,1400.0,Full-Time Employment,2.0,0.0,0.022,0.0,0.0,16.0,1083.19,512.0,QuickCash,,5092270,2.0,19-04-2023,False,Living Expenses,2023-04-18,Orange,0.0,2863.0,2271.25
0062x00000FKSctAAH,0012x00000kg0FbAAI,Caddens,NSW,Australia,Loan Paid,Existing Client-No Loan Granted Ever,0.0,43.01,3731.0135,1.0,0.0,0.0,3.0,1.0,9532.9938,0.0,9.0,0.0,1215.386,1261.86,2.0,0.1,0.0,0.0,7800.0,899.0,7150.0,1200,1632.0,16.0,16.429,Weekly,41.0,24294.65,2050.0,Full-Time Employment,2.0,0.0,0.0,0.0,5322.9033,0.0,4892.83,102.0,MoneySpot,0.0,7393739,0.0,04-12-2023,False,Travel Expenses,2023-12-04,Green,0.0,17202.0,24294.65
0062x00000E4XpYAAV,0012x00000goQrmAAE,Clinton,QLD,Australia,Loan Paid,Existing Client-No Loan Granted Ever,2.48,73.78,308.3333,1.0,0.0,1.0,2.0,1.0,5761.3858,2.0,9.0,0.0,1022.5707,875.99,0.0,0.0,0.0,0.0,0.0,899.0,930.0,1200,1632.0,15.0,15.286,Weekly,56.0,5287.89,2050.0,,2.0,0.0,0.022,0.0,4569.0433,0.0,371.6666,108.8,MoneySpot,0.0,5581152,0.0,12-06-2023,False,Living Expenses,2023-06-12,Green,138.0,5554.0,5287.89
0062x00000DsvXyAAJ,0012x00000XNngdAAD,Strathfield,NSW,Australia,Closed Lost,Existing Client-No Loan Granted Ever,0.0,44.08,0.0,1.0,0.0,0.0,4.0,1.0,3892.6411,0.0,3.0,0.0,995.325,1057.88,0.0,0.24,0.0,0.0,3683.33,400.0,460.0,1200,1776.0,29.0,29.571,Weekly,27.0,3892.64,6000.0,Part-Time Employment,0.0,0.0,0.022,0.0,3981.3,0.0,0.0,61.24,MoneySpot,,5273742,0.0,20-05-2023,False,Purchase,2023-05-15,Green,0.0,4952.0,3892.64
0062x00000DJHtKAAX,0012x00000bczNrAAI,GLENFIELD PARK,NSW,Australia,Loan Paid,Existing Client-No Loan Granted Ever,0.0,84.04,1835.6393,2.0,1.0,0.0,3.0,2.0,3697.304,4.0,18.0,155.4626,1701.7728,1625.35,0.0,2.81,0.0,0.0,4766.67,400.0,0.0,1200,1536.0,3.0,5.857,Fortnightly,36.0,3702.3,1200.0,Full-Time Employment,10.0,0.0,0.0,1.0,3970.8033,847.0,1987.6666,512.0,MoneySpot,0.0,4881091,10.0,17-03-2023,False,Other,2023-03-17,Orange,0.0,4017.0,3702.3
0062x00000D8c8JAAR,0012x00000gAEnaAAG,Pallarenda,QLD,Australia,Closed Lost,Existing Client-No Loan Granted Ever,5.05,77.82,3086.1873,1.0,0.0,2.0,4.0,1.0,5272.3824,1.0,37.0,984.9424,1029.5,1029.5,1.0,0.0,0.0,0.0,4461.17,599.0,800.0,1200,1536.0,6.0,6.429,Weekly,36.0,5747.3,5000.0,Full-Time Employment,1.0,0.0,0.033,1.0,4860.0466,259.0,3260.09,256.0,MoneySpot,,4541632,1.0,24-01-2023,False,Travel Expenses,2023-01-24,Orange,399.0,7899.0,5747.3
0062x00000EcNA0AAN,0010K00001xkh1TQAQ,Ferny Grove,QLD,Australia,Loan Paid,Existing Client-Granted Loan Before,2.46,82.02,2248.3756,2.0,0.0,4.0,3.0,2.0,6300.4247,0.0,26.0,0.0,2429.5416,2512.1,2.0,0.0,0.0,0.0,4623.67,899.0,800.0,1200,1632.0,8.0,15.429,Fortnightly,38.0,6300.42,1200.0,Full-Time Employment,0.0,0.0,0.7473,0.0,5033.4333,91.0,3202.5166,204.0,MoneySpot,0.0,6352175,0.0,28-08-2023,False,Veterinary Expenses,2023-08-28,Orange,174.0,7048.0,6300.42
0062x00000D7er2AAB,0012x00000WpyBMAAZ,Whyalla Norrie,SA,Australia,Loan Paid,Existing Client-Granted Loan Before,0.0,56.17,4134.4985,1.0,0.0,0.0,3.0,1.0,7205.7157,0.0,50.0,0.0,1248.0508,1466.66,1.0,68.35,0.0,0.0,0.0,899.0,800.0,1500,2040.0,14.0,14.286,Weekly,44.0,8850.97,1500.0,,0.0,0.0,0.0,0.0,4992.2033,816.0,3698.1933,145.71,QuickCash,0.0,4493940,0.0,17-01-2023,False,Child Expenses,2023-01-17,Green,0.0,13254.0,8850.97
0062x00000DFLGkAAP,0012x00000cx8ZaAAI,Casino,NSW,Australia,Loan Paid,Existing Client-Granted Loan Before,0.0,62.27,2172.1536,1.0,0.0,0.0,5.0,1.0,3683.5764,0.0,44.0,689.6884,847.7272,1165.0,1.0,2.68,0.0,0.0,1200.0,400.0,100.0,1250,1700.0,14.0,14.0,Weekly,27.0,3108.33,1250.0,Full-Time Employment,0.0,0.0,0.6923,0.0,3108.3333,923.0,1980.06,121.43,QuickCash,0.0,4662331,0.0,11-02-2023,False,Medical Expenses,2023-02-11,Orange,0.0,3587.0,3108.33
0062x00000DXRNcAAP,0010K00001ymEUJQA2,Marangaroo,WA,Australia,Loan Paid,Existing Client-No Loan Granted Ever,0.43,3.26,2556.3903,2.0,0.0,0.0,4.0,2.0,6022.065,0.0,6.0,0.0,2771.8,2346.0,1.0,3.79,0.0,0.0,3635.67,899.0,2281.0,1200,1536.0,3.0,5.0,Fortnightly,40.0,6022.07,1300.0,Full-Time Employment,0.0,0.0,0.0,0.0,5543.6,0.0,2341.7833,512.0,MoneySpot,0.0,4972111,0.0,31-03-2023,False,Home Maintenance & Repairs,2023-03-31,Green,24.0,5573.0,6022.07
0062x00000Ewk7cAAB,0012x00000lJO3eAAG,Holland Park,QLD,Australia,Loan Paid,New Client-New Loan,0.0,16.0,0.0,1.0,0.0,0.0,1.0,1.0,6322.3213,0.0,2.0,0.0,1455.0,1230.0,0.0,0.89,0.0,0.0,5200.0,400.0,1600.0,1200,1632.0,16.0,15.714,Weekly,45.0,6305.0,5000.0,Full-Time Employment,0.0,0.0,0.1868,0.0,6305.0,0.0,6.0,102.0,QuickCash,0.0,6610946,0.0,22-09-2023,False,Vehicle Expenses,2023-09-22,Green,0.0,7887.0,6305.0
0062x00000DrcqnAAB,0012x00000gnK3RAAU,Rosebud,VIC,Australia,Loan Paid,Existing Client-No Loan Granted Ever,0.0,22.16,217.68,2.0,0.0,0.0,3.0,2.0,3194.4587,2.0,8.0,0.0,1470.3275,1782.15,0.0,0.0,0.0,0.0,2646.14,899.0,0.0,1200,1536.0,3.0,5.286,Fortnightly,30.0,7574.81,1200.0,Full-Time Employment,2.0,0.0,0.0989,1.0,1960.4366,0.0,217.68,512.0,MoneySpot,0.0,5179925,0.0,02-05-2023,False,Relocation Expenses,2023-05-02,Green,0.0,4229.0,7574.81
0062x00000EMjq2AAD,0012x00000kgE9nAAE,Bellbird Park,QLD,Australia,Loan Paid,New Client-New Loan,0.0,25.44,1003.2224,2.0,0.0,0.0,2.0,2.0,4146.1505,0.0,25.0,0.0,1908.3657,1933.37,0.0,0.0,0.0,0.0,1933.0,2000.0,800.0,1200,1680.0,10.0,19.429,Fortnightly,52.0,6733.82,2050.0,Full-Time Employment,0.0,0.0,0.011,0.0,4452.8533,341.0,899.6033,168.0,MoneySpot,0.0,6126975,0.0,06-08-2023,False,Vehicle Expenses,2023-08-06,Green,0.0,11852.0,6733.82
0062x00000ENniLAAT,0012x00000hZWB2AAO,Yungaburra,QLD,Australia,Loan Paid,Existing Client-No Loan Granted Ever,0.0,7.65,696.28,2.0,0.0,0.0,2.0,2.0,4988.3972,0.0,7.0,0.0,2296.03,2296.03,0.0,0.0,0.0,0.0,0.0,599.0,128.0,1200,1632.0,9.0,17.286,Fortnightly,52.0,4988.4,5000.0,Full-Time Employment,0.0,0.0,0.0,0.0,5357.4033,0.0,747.7866,181.33,MoneySpot,0.0,6205468,0.0,14-08-2023,False,Vehicle Expenses,2023-08-14,Green,0.0,6641.0,4988.4
0062x00000ED4VdAAL,0012x00000hZh8lAAC,Croydon,VIC,Australia,Loan Paid,Existing Client-Granted Loan Before,0.0,50.09,546.87,1.0,0.0,0.0,1.0,1.0,8370.8619,4.0,22.0,0.0,1284.2842,1236.0,0.0,54.5,0.0,0.0,0.0,599.0,1000.0,1250,1700.0,15.0,15.429,Weekly,48.0,12450.46,1250.0,,4.0,0.0,0.0,2.0,5993.3266,299.0,845.5366,113.33,QuickCash,0.0,5917341,1.0,15-07-2023,False,Living Expenses,2023-07-14,Green,0.0,13404.0,12450.46
0062x00000E3XLoAAN,0012x00000g7UQFAA2,OAKLEIGH SOUTH,VIC,Australia,Loan Paid,Existing Client-No Loan Granted Ever,0.0,30.43,1028.5835,1.0,1.0,0.0,5.0,1.0,5411.6907,1.0,10.0,147.2,1219.75,1781.25,1.0,5.75,0.0,1.0,8233.33,400.0,1000.0,1200,1632.0,14.0,14.0,Weekly,31.0,5657.0,2050.0,Full-Time Employment,1.0,0.0,0.011,0.0,1068.0,1007.0,1521.3566,116.57,MoneySpot,0.0,5493201,1.0,03-06-2023,False,Travel Expenses,2023-06-03,Orange,0.0,5500.0,5657.0
0062x00000EDMTTAA5,0012x00000ka6EmAAI,Rosebud,VIC,Australia,Closed Lost,New Client-New Loan,0.0,30.64,936.3333,1.0,0.0,0.0,1.0,1.0,3663.0335,0.0,4.0,0.0,843.0,843.0,0.0,0.06,0.0,0.0,0.0,0.0,880.0,1200,1728.0,25.0,25.0,Weekly,27.0,3698.77,5000.0,,0.0,0.0,0.0,0.0,3653.0,0.0,1083.3333,69.12,MoneySpot,,5939704,0.0,22-07-2023,False,Once off purchase,2023-07-18,Green,0.0,11558.0,3698.77
0062x00000D9MefAAF,0012x00000gmgzcAAA,Werribee,VIC,Australia,Closed Lost,New Client-New Loan,28.74,24.3,202.7857,2.0,0.0,4.0,3.0,2.0,6348.328,0.0,3.0,0.0,1363.095,1634.6,0.0,0.38,0.0,0.0,0.0,0.0,1386.0,1200,1536.0,3.0,6.429,Fortnightly,42.0,10121.81,1500.0,,0.0,0.0,0.0,0.0,4074.3266,0.0,2019.21,512.0,MoneySpot,,4579020,0.0,30-01-2023,False,Car Repairs,2023-01-29,Green,2280.0,7931.0,10121.81
0062x00000DWTglAAH,0010K00001y9Q0SQAU,Colyton,NSW,Australia,Loan Paid,Existing Client-Granted Loan Before,0.66,69.58,2850.1073,1.0,1.0,0.0,3.0,1.0,5191.04,19.0,31.0,1444.423,1040.1523,982.19,0.0,0.0,0.0,1.0,2253.33,599.0,300.0,1100,1452.0,10.0,10.0,Weekly,31.0,5191.04,1100.0,Full-Time Employment,19.0,0.0,0.0549,7.0,0.0,2116.0,4314.8166,145.2,MoneySpot,0.0,4918604,10.0,23-03-2023,False,Medical Expenses,2023-03-23,Orange,39.0,5884.0,5191.04
0062x00000DGdjsAAD,0012x00000goFgvAAE,Palmwoods,QLD,Australia,Closed Lost,New Client-New Loan,4.1,68.2,714.6515,1.0,1.0,0.0,1.0,1.0,6071.6542,5.0,12.0,190.1042,790.409,959.25,1.0,0.02,0.0,0.0,0.0,0.0,1000.0,1200,1536.0,6.0,5.857,Weekly,51.0,6209.72,2000.0,,5.0,0.0,0.022,2.0,2898.1666,175.0,838.7533,256.0,MoneySpot,,4732990,4.0,22-02-2023,False,Vehicle - Repairs,2023-02-22,Green,339.0,8264.0,6209.72
0062x00000EbpceAAB,0012x00000khfXoAAI,Caloundra,QLD,Australia,Loan Paid,New Client-New Loan,0.0,53.22,315.2833,1.0,0.0,0.0,3.0,1.0,5807.0768,0.0,4.0,0.0,580.9788,637.69,0.0,31.1,0.0,0.0,0.0,0.0,1.0,1200,1728.0,26.0,26.0,Weekly,22.0,5982.88,1200.0,,0.0,0.0,0.0,0.0,3247.6733,0.0,1224.78,66.46,MoneySpot,0.0,6315158,0.0,25-08-2023,False,Travel & Entertainment,2023-08-25,Green,0.0,4926.0,5982.88
0062x00000DW9o3AAD,0010K00001j6c0UQAQ,Tweed Heads,NSW,Australia,Loan Paid,Existing Client-Granted Loan Before,13.27,87.53,1164.7896,2.0,0.0,4.0,3.0,2.0,5637.252,1.0,29.0,267.9561,1236.8383,1487.33,0.0,0.2,0.0,0.0,31416.67,599.0,360.0,1500,1920.0,4.0,8.429,Fortnightly,62.0,5637.25,1500.0,Full-Time Employment,1.0,0.0,0.022,1.0,3261.7533,599.0,1153.6666,480.0,MoneySpot,0.0,4899005,1.0,20-03-2023,False,Vehicle Expenses,2023-03-20,Green,788.0,5938.0,5637.25
0062x00000F1L2WAAV,0012x00000cmLCFAA2,Melton West,VIC,Australia,Loan Paid,Existing Client-No Loan Granted Ever,0.0,77.51,704.1108,2.0,0.0,0.0,3.0,2.0,5614.4832,8.0,28.0,0.0,2205.0885,1795.3,1.0,0.0,0.0,0.0,10833.33,400.0,450.0,1200,1680.0,9.0,18.0,Fortnightly,37.0,6190.48,2500.0,Casual Employment,8.0,0.0,0.0879,2.0,5145.2066,0.0,703.7366,186.67,MoneySpot,0.0,6886068,0.0,19-10-2023,False,Vehicle Expenses,2023-10-19,Green,0.0,9986.0,6190.48
0062x00000EyNUBAA3,0012x00000lfc4hAAA,Temora,NSW,Australia,Closed Lost,Existing Client-No Loan Granted Ever,0.18,91.42,775.166,2.0,0.0,0.0,2.0,2.0,6559.9331,4.0,12.0,0.0,2120.4016,2841.54,1.0,0.0,0.0,0.0,4340.8,899.0,720.0,1200,1728.0,13.0,25.0,Fortnightly,37.0,6897.45,1200.0,Full-Time Employment,4.0,0.0,0.011,4.0,4340.8033,0.0,1383.4766,132.92,QuickCash,,6732641,0.0,08-10-2023,False,home_improvements_repair,2023-10-03,Orange,14.0,7682.0,6897.45
0062x00000EOKIKAA5,0012x00000khA2LAAU,Mudgee,NSW,Australia,Loan Paid,New Client-New Loan,0.0,74.84,298.7766,2.0,0.0,0.0,3.0,2.0,4609.1091,4.0,7.0,0.0,2110.805,1977.39,0.0,0.0,0.0,0.0,2100.0,2000.0,2280.0,1200,1680.0,11.0,20.857,Fortnightly,38.0,4609.11,2050.0,Part-Time Employment,7.0,0.0,0.0,2.0,4221.61,0.0,1851.78,152.73,MoneySpot,0.0,6250295,0.0,18-08-2023,False,Life Event Expenses,2023-08-17,Green,0.0,4950.0,4609.11
0062x00000F03UWAAZ,0012x00000lgwwnAAA,Noble Park,VIC,Australia,Closed Lost,New Client-New Loan,0.0,17.9,1620.3915,2.0,0.0,0.0,3.0,2.0,5076.061,0.0,41.0,0.0,2336.38,2552.93,0.0,0.42,0.0,0.0,0.0,0.0,1300.0,1200,1632.0,8.0,15.429,Fortnightly,36.0,5076.06,4000.0,part_time,0.0,0.0,0.0,0.0,5451.5533,0.0,2108.8233,204.0,MoneySpot,,6852350,0.0,21-10-2023,False,lifestyle_other,2023-10-16,Green,0.0,7768.0,5076.06
0062x00000D8a1GAAR,0012x00000gAXGfAAO,STANTHORPE,QLD,Australia,Closed Lost,New Client-New Loan,1.33,50.85,1256.371,2.0,0.0,4.0,2.0,2.0,6920.4536,0.0,32.0,0.0,1890.4633,1858.05,1.0,3.54,0.0,0.0,0.0,0.0,700.0,1200,1632.0,8.0,16.143,Fortnightly,36.0,6920.45,5000.0,,0.0,0.0,0.0,0.0,4344.1266,0.0,1749.8333,204.0,MoneySpot,,4540124,0.0,27-01-2023,False,"Car rego, payback family members",2023-01-23,Green,96.0,7179.0,6920.45
0062x00000ENwCOAA1,0010K0000274cP4QAI,Ashfield,NSW,Australia,Loan Paid,Existing Client-Granted Loan Before,0.0,30.61,1334.6763,2.0,0.0,0.0,3.0,2.0,8667.9392,0.0,25.0,0.0,3444.964,3660.82,1.0,1.09,0.0,0.0,5416.67,1499.0,1640.0,1500,2100.0,10.0,20.286,Fortnightly,51.0,12342.82,1500.0,Full-Time Employment,0.0,0.0,0.0,0.0,5741.6066,2355.0,2555.4866,210.0,QuickCash,0.0,6217782,0.0,15-08-2023,False,Other Expenses,2023-08-15,Orange,0.0,12194.0,12342.82
0062x00000E3X3FAAV,0012x00000iHsjbAAC,Loxton,SA,Australia,Closed Lost,New Client-New Loan,35.27,55.15,120.0,2.0,0.0,4.0,3.0,2.0,3888.1177,4.0,18.0,0.0,1174.1185,1233.81,1.0,0.0,0.0,0.0,0.0,0.0,1120.0,1200,1632.0,8.0,15.714,Fortnightly,38.0,4175.66,5000.0,,4.0,0.0,0.3516,0.0,4056.54,0.0,120.0,204.0,MoneySpot,,5492720,1.0,03-06-2023,False,Auto Finance,2023-06-03,Green,1493.0,4233.0,4175.66
0062x00000FKibSAAT,0012x00000c9988AAA,Peregian Springs,QLD,Australia,Loan Paid,Existing Client-Granted Loan Before,0.0,40.6,665.3333,1.0,0.0,0.0,3.0,1.0,7528.055,0.0,0.0,0.0,1732.484,2382.04,0.0,10.5,0.0,0.0,6487.0,599.0,1000.0,1500,2100.0,20.0,20.143,Weekly,25.0,14522.57,2050.0,Full-Time Employment,33.0,0.0,0.0,19.0,2887.4733,0.0,773.0133,105.0,MoneySpot,0.0,7410222,24.0,08-12-2023,False,Living Expenses,2023-12-08,Orange,0.0,7639.0,14522.57
0062x00000Da0EdAAJ,0012x00000hYVNoAAO,Dudley Park,WA,Australia,Closed Lost,New Client-New Loan,0.0,59.82,1684.5022,2.0,0.0,0.0,4.0,2.0,4352.1405,0.0,7.0,590.3223,2003.1185,2163.15,0.0,0.0,0.0,0.0,0.0,0.0,2000.0,1200,1584.0,5.0,9.571,Fortnightly,28.0,5625.43,3000.0,,0.0,0.0,0.0,0.0,6007.6366,634.0,1778.2466,316.8,MoneySpot,,5128454,0.0,29-04-2023,False,Car Repairs,2023-04-24,Green,0.0,4707.0,5625.43
0062x00000DrUxNAAV,0010K00001rIP7KQAW,Yokine,WA,Australia,Closed Lost,Existing Client-No Loan Granted Ever,0.0,50.49,1105.8492,1.0,0.0,0.0,3.0,1.0,11338.4243,0.0,12.0,372.5173,2119.3333,3012.0,0.0,9.81,0.0,0.0,6283.33,599.0,2080.0,1200,1632.0,14.0,14.429,Weekly,58.0,11338.42,20000.0,Contract Employment,0.0,0.0,0.044,0.0,8477.3333,371.0,1263.83,116.57,MoneySpot,,5171525,0.0,05-05-2023,False,Living Expenses,2023-05-01,Orange,0.0,13573.0,11338.42
0062x00000D1UwTAAV,0012x00000XCjPIAA1,Abbotsford,NSW,Australia,Loan Paid,Existing Client-Granted Loan Before,0.0,77.63,2664.3666,1.0,0.0,0.0,3.0,1.0,9564.7876,5.0,19.0,498.4953,1568.3333,1637.0,0.0,9.18,0.0,0.0,4083.0,400.0,2000.0,1500,2040.0,14.0,14.429,Weekly,31.0,8195.75,5000.0,Full-Time Employment,5.0,0.0,0.033,3.0,3136.6666,492.0,2664.3666,145.71,MoneySpot,0.0,4392770,2.0,02-01-2023,False,Other Expenses,2023-01-02,Orange,0.0,14759.0,8195.75
0062x00000DYtcKAAT,0012x00000hXsfrAAC,Bellmere,QLD,Australia,Closed Lost,New Client-New Loan,0.0,46.61,2734.9484,1.0,0.0,0.0,4.0,1.0,7275.2134,6.0,16.0,124.0,1674.2961,936.0,0.0,2.31,0.0,0.0,1800.0,2000.0,100.0,1200,1536.0,6.0,7.0,Weekly,21.0,7275.21,1400.0,Casual Employment,12.0,0.0,0.022,4.0,7255.2833,83.0,3654.5666,256.0,QuickCash,,5059899,12.0,18-04-2023,False,Living Expenses,2023-04-13,Orange,0.0,7671.0,7275.21
0062x00000DrQWVAA3,0012x00000hYrBaAAK,Cranbourne West,VIC,Australia,Loan Paid,New Client-New Loan,0.0,73.21,2972.4659,2.0,1.0,0.0,3.0,2.0,6419.4996,7.0,31.0,860.3571,2658.4666,2198.14,0.0,0.07,0.0,0.0,0.0,0.0,2086.0,1200,1632.0,8.0,16.571,Fortnightly,25.0,8647.07,5000.0,,8.0,0.0,0.044,3.0,5316.9333,396.0,3136.35,204.0,MoneySpot,0.0,5167476,4.0,30-04-2023,False,Home & Improvement,2023-04-30,Green,0.0,8478.0,8647.07
0062x00000DIvoFAAT,0012x00000SISb1AAH,Blacks Beach,QLD,Australia,Loan Paid,Existing Client-Granted Loan Before,0.0,64.79,7601.469,2.0,1.0,0.0,3.0,2.0,9643.1022,2.0,19.0,0.0,4438.47,4438.47,1.0,0.0,1.0,0.0,3278.38,599.0,0.0,1500,1980.0,5.0,10.286,Fortnightly,58.0,12638.29,2050.0,Part-Time Employment,2.0,0.0,0.1429,1.0,12093.69,2041.0,10326.4233,396.0,MoneySpot,0.0,4862373,2.0,14-03-2023,False,Travel Expenses,2023-03-14,Orange,0.0,8944.0,12638.29
0062x00000DIXKuAAP,0012x00000gpEJjAAM,Petersham,NSW,Australia,Closed Lost,New Client-New Loan,0.0,74.4,0.0,1.0,0.0,0.0,3.0,1.0,4360.4776,0.0,0.0,0.0,1056.7836,1063.74,0.0,0.0,0.0,0.0,0.0,0.0,0.0,1150,1472.0,6.0,6.571,Weekly,21.0,4487.14,1150.0,,0.0,0.0,0.011,0.0,3874.8733,0.0,46.6666,245.33,MoneySpot,,4837889,0.0,10-03-2023,False,Other,2023-03-10,Orange,0.0,6083.0,4487.14
0062x00000DWr9lAAD,0012x00000MgleVAAR,Saint Clair,NSW,Australia,Loan Paid,Existing Client-Granted Loan Before,29.9,84.17,800.9445,2.0,0.0,2.0,2.0,2.0,3412.2068,0.0,5.0,264.0,1269.4616,2002.03,1.0,0.0,0.0,1.0,0.0,899.0,900.0,1500,1920.0,3.0,6.286,Fortnightly,33.0,4764.29,2000.0,,0.0,0.0,0.9011,0.0,259.68,217.0,563.47,640.0,MoneySpot,0.0,4941596,0.0,27-03-2023,False,Vehicle Expenses,2023-03-27,Orange,1826.0,6105.0,4764.29
0062x00000DFrFUAA1,0012x000008JiDfAAK,Alexandra Hills,QLD,Australia,Closed Lost,Existing Client-No Loan Granted Ever,1.32,86.64,842.566,2.0,0.0,4.0,2.0,2.0,4033.0173,0.0,12.0,0.0,1807.39,1935.86,0.0,0.0,0.0,0.0,3710.56,1499.0,1020.0,1200,1632.0,7.0,14.0,Fortnightly,30.0,3993.02,3000.0,Full-Time Employment,0.0,0.0,0.0,0.0,4283.4933,784.0,1634.9166,233.14,MoneySpot,,4689305,0.0,15-02-2023,False,Living Expenses,2023-02-15,Orange,66.0,4982.0,3993.02
0062x00000DAFe4AAH,0012x000002ayuoAAA,South Nowra,NSW,Australia,Loan Paid,Existing Client-Granted Loan Before,0.0,47.8,2268.1967,2.0,0.0,0.0,4.0,2.0,5216.1693,13.0,22.0,0.0,2400.8671,1937.82,2.0,0.15,0.0,0.0,0.0,899.0,1040.0,1500,2040.0,7.0,13.714,Fortnightly,35.0,5430.04,1500.0,Full-Time Employment,13.0,0.0,0.0,4.0,5602.0233,883.0,3040.3866,291.43,MoneySpot,0.0,4620984,0.0,05-02-2023,False,Vehicle Expenses,2023-02-04,Green,0.0,13702.0,5430.04
0062x00000F2wjJAAR,0012x00000lfDc8AAE,Glenmore Park,NSW,Australia,Closed Lost,Existing Client-No Loan Granted Ever,0.0,33.65,998.3408,1.0,0.0,0.0,3.0,1.0,5899.0448,0.0,21.0,0.0,791.8027,631.88,1.0,0.22,0.0,0.0,800.0,599.0,150.0,1200,1632.0,16.0,16.286,Weekly,29.0,5899.04,4000.0,Full-Time Employment,0.0,0.0,0.0,0.0,5783.91,446.0,1177.4433,102.0,MoneySpot,,7008083,0.0,04-11-2023,False,Relocation Expenses,2023-10-31,Green,0.0,5829.0,5899.04
0062x00000EDToJAAX,0012x00000TrfDyAAJ,Brighton-Le-Sands,NSW,Australia,Loan Paid,Existing Client-No Loan Granted Ever,0.0,93.31,89.08,1.0,0.0,0.0,4.0,1.0,8842.2596,7.0,11.0,0.0,1687.0407,1579.45,0.0,4.97,0.0,0.0,6500.0,899.0,509.0,1200,1584.0,12.0,12.286,Weekly,33.0,8842.26,2500.0,Full-Time Employment,7.0,0.0,0.0659,3.0,7310.51,0.0,182.4133,132.0,MoneySpot,0.0,5947256,0.0,19-07-2023,False,Home Maintenance & Repairs,2023-07-18,Green,0.0,9521.0,8842.26
0062x00000D7OvtAAF,0010K00001zFfpeQAC,Bondi Junction,NSW,Australia,Loan Paid,Existing Client-Granted Loan Before,0.0,57.82,413.8533,4.0,4.0,0.0,5.0,4.0,2230.5532,13.0,42.0,824.664,190.3125,243.0,0.0,15.6,0.0,1.0,16288.05,1499.0,1200.0,1500,2040.0,4.0,17.143,Monthly,48.0,2230.55,1500.0,Full-Time Employment,13.0,0.0,0.1429,4.0,1186.8833,1279.0,3999.7866,510.0,MoneySpot,0.0,4482150,6.0,15-01-2023,False,Medical Expenses,2023-01-15,Orange,0.0,12573.0,2230.55
0062x00000D1d4IAAR,0012x00000OxMeRAAV,Oxenford,QLD,Australia,Loan Paid,Existing Client-Granted Loan Before,0.0,85.2,1965.8501,1.0,2.0,0.0,2.0,1.0,4884.6381,7.0,79.0,1319.4762,935.9166,929.94,0.0,1.8,1.0,0.0,3760.43,1499.0,400.0,1500,2040.0,14.0,14.286,Weekly,31.0,4891.64,1500.0,Full-Time Employment,7.0,0.0,0.8791,0.0,3743.6666,1853.0,5786.2666,145.71,MoneySpot,0.0,4401138,6.0,03-01-2023,False,Relocation Expenses,2023-01-03,Green,0.0,4732.0,4891.64
0062x00000DramRAAR,0012x00000SHxoJAAT,Coomera,QLD,Australia,Loan Paid,Existing Client-Granted Loan Before,0.0,59.13,345.0166,1.0,1.0,0.0,1.0,1.0,4017.8165,7.0,23.0,880.6277,250.8333,500.0,0.0,23.21,0.0,1.0,5051.67,599.0,250.0,1300,1872.0,24.0,24.0,Weekly,29.0,7001.15,2200.0,Self Employed,18.0,0.0,0.1429,6.0,0.0,620.0,813.5866,78.0,MoneySpot,0.0,5178451,4.0,02-05-2023,False,Vehicle Expenses,2023-05-02,Green,0.0,9820.0,7001.15
0062x00000EcygTAAR,0012x00000gA2dxAAC,Ilparpa,NT,Australia,Closed Lost,Existing Client-Granted Loan Before,0.0,63.78,1740.3079,1.0,1.0,0.0,4.0,1.0,6978.362,0.0,7.0,0.0,1835.4055,1784.85,0.0,0.0,0.0,0.0,9577.27,599.0,720.0,1500,2040.0,14.0,14.0,Weekly,31.0,6978.36,3500.0,Full-Time Employment,4.0,0.0,0.0,2.0,5506.2166,396.0,1351.3766,145.71,MoneySpot,,6390829,2.0,05-09-2023,False,Travel Expenses,2023-08-31,Orange,0.0,10770.0,6978.36
0062x00000E5MmcAAF,0012x00000iJI5NAAW,Port Lincoln,SA,Australia,Loan Paid,New Client-New Loan,6.68,47.83,348.1613,2.0,0.0,4.0,3.0,2.0,10019.9018,0.0,57.0,0.0,2301.5971,2285.8,0.0,14.04,0.0,0.0,3200.0,2000.0,470.0,1200,1632.0,7.0,13.571,Fortnightly,44.0,10019.9,2100.0,Full-Time Employment,0.0,0.0,0.0,0.0,10021.6533,0.0,160.25,233.14,MoneySpot,0.0,5648152,0.0,18-06-2023,False,Living Expenses,2023-06-18,Orange,824.0,12333.0,10019.9
0062x00000D1dDbAAJ,0012x00000Ttf7kAAB,Burwood,NSW,Australia,Closed Lost,Existing Client-No Loan Granted Ever,0.0,95.37,345.3066,2.0,0.0,0.0,3.0,2.0,6932.8741,0.0,5.0,0.0,1318.9333,1421.39,0.0,0.0,0.0,0.0,4749.98,899.0,0.0,1200,1776.0,15.0,29.286,Fortnightly,28.0,7614.21,7000.0,Full-Time Employment,0.0,0.0,0.0,0.0,4981.0,0.0,354.47,118.4,MoneySpot,,4401707,0.0,05-01-2023,False,Purchase,2023-01-03,Green,0.0,12849.0,7614.21
0062x00000DXFyfAAH,0012x00000INz1OAAT,Kellyville,NSW,Australia,Loan Paid,Existing Client-Granted Loan Before,1.69,84.44,3080.0247,4.0,0.0,4.0,4.0,4.0,8680.1965,4.0,32.0,0.0,157.8571,100.0,1.0,0.0,0.0,1.0,6681.19,899.0,2773.0,1500,1980.0,10.0,9.857,Weekly,46.0,9930.2,2050.0,Self Employed,4.0,0.0,0.044,0.0,139.9166,382.0,4300.7133,198.0,MoneySpot,0.0,4962964,4.0,30-03-2023,False,Travel Expenses,2023-03-30,Orange,339.0,20058.0,9930.2
0062x00000DWj4aAAD,0012x00000GapgYAAR,Shearwater,TAS,Australia,Closed Lost,Existing Client-Granted Loan Before,39.59,96.73,1230.3128,2.0,0.0,2.0,3.0,2.0,5292.0021,0.0,10.0,0.0,1459.4416,1545.17,0.0,0.0,0.0,0.0,847.09,599.0,1440.0,1300,1664.0,5.0,8.714,Fortnightly,28.0,5183.08,2050.0,Full-Time Employment,0.0,0.0,0.9231,0.0,4995.1,842.0,934.01,332.8,QuickCash,,4933337,0.0,29-03-2023,False,Vehicle Expenses,2023-03-25,Orange,2259.0,5705.0,5183.08
0062x00000D9pttAAB,0012x00000LQTb5AAH,Faulconbridge,NSW,Australia,Loan Paid,Existing Client-Granted Loan Before,14.36,73.44,1406.1706,1.0,0.0,4.0,4.0,1.0,4240.7276,2.0,30.0,561.7181,444.7154,427.5,0.0,0.0,0.0,0.0,1537.68,400.0,280.0,1200,1632.0,14.0,14.143,Weekly,31.0,4344.06,1200.0,Full-Time Employment,2.0,0.0,0.0,1.0,2283.1366,931.0,1536.5366,116.57,MoneySpot,0.0,4600992,0.0,02-02-2023,False,Vehicle Expenses,2023-02-02,Orange,653.0,4547.0,4344.06
0062x00000DAi6BAAT,0012x00000NRUi2AAH,MACLEOD,VIC,Australia,Loan Paid,Existing Client-Granted Loan Before,0.0,65.15,1801.4566,2.0,0.0,0.0,3.0,2.0,5623.3454,0.0,0.0,736.0326,1636.8933,2102.94,0.0,13.5,0.0,0.0,0.0,400.0,880.0,1150,1564.0,7.0,14.143,Fortnightly,27.0,10270.02,2050.0,,0.0,0.0,0.0,0.0,1636.8933,339.0,2292.65,223.43,MoneySpot,0.0,4641930,0.0,08-02-2023,False,Relocation Expenses,2023-02-08,Orange,0.0,15550.0,10270.02
0062x00000D8or1AAB,0012x00000g7bqqAAA,Melbourne,VIC,Australia,Loan Paid,Existing Client-Granted Loan Before,0.0,74.35,4653.6984,2.0,2.0,0.0,1.0,2.0,2969.8747,6.0,25.0,0.0,1229.6416,1223.51,0.0,0.0,0.0,1.0,0.0,599.0,800.0,1500,1980.0,7.0,12.857,Fortnightly,34.0,3519.87,1500.0,,6.0,0.0,0.1099,4.0,0.0,427.0,4555.79,282.86,MoneySpot,0.0,4550945,3.0,26-01-2023,False,Home Maintenance & Repairs,2023-01-25,Orange,0.0,7254.0,3519.87
0062x00000D21hwAAB,0010K00001uGDVeQAO,Acacia Ridge,QLD,Australia,Loan Paid,Existing Client-Granted Loan Before,0.0,44.2,2372.0575,1.0,0.0,0.0,2.0,1.0,3437.2384,0.0,56.0,835.2215,791.0361,818.47,7.0,0.0,0.0,0.0,3085.33,599.0,710.0,1400,1904.0,14.0,13.714,Weekly,51.0,7015.95,1400.0,Full-Time Employment,1.0,0.0,0.3956,0.0,3427.8233,2528.0,2882.01,136.0,MoneySpot,0.0,4423886,0.0,06-01-2023,False,Vehicle Expenses,2023-01-06,Green,0.0,3947.0,7015.95
0062x00000DXVC9AAP,0012800001IYBE1AAP,Wodonga,VIC,Australia,Closed Lost,Existing Client-Granted Loan Before,0.0,80.68,1311.1764,1.0,0.0,0.0,3.0,1.0,5626.3411,3.0,36.0,651.5924,1294.8292,1254.81,3.0,0.64,0.0,0.0,21992.19,899.0,1200.0,1500,1920.0,9.0,8.714,Weekly,38.0,5686.34,1500.0,Full-Time Employment,3.0,0.0,0.044,0.0,5610.9266,937.0,1943.7466,213.33,MoneySpot,,4977185,3.0,01-04-2023,False,Travel Expenses,2023-03-31,Green,0.0,6117.0,5686.34
0062x00000DI3gWAAT,0012x00000GekQ2AAJ,Eleebana,NSW,Australia,Loan Paid,Existing Client-No Loan Granted Ever,0.24,90.08,1546.5156,2.0,1.0,0.0,4.0,2.0,4978.7475,4.0,4.0,0.0,1677.2766,1751.38,2.0,1.19,0.0,0.0,3248.05,899.0,500.0,1200,1632.0,7.0,14.429,Fortnightly,21.0,4978.75,4500.0,Part-Time Employment,4.0,0.0,0.0,1.0,3354.5533,0.0,1565.1266,233.14,MoneySpot,0.0,4814701,3.0,07-03-2023,False,Rental bond,2023-03-07,Green,13.0,5380.0,4978.75
0062x00000FIFbwAAH,0012x00000lfzCEAAY,Narre Warren South,VIC,Australia,Closed Lost,Existing Client-No Loan Granted Ever,0.0,36.06,140.3333,1.0,0.0,0.0,3.0,1.0,6732.5883,0.0,12.0,0.0,1206.4285,1230.0,0.0,0.84,0.0,0.0,1200.0,400.0,0.0,1200,1632.0,16.0,15.857,Weekly,23.0,6824.25,2500.0,Full-Time Employment,0.0,0.0,0.0,0.0,5630.0,0.0,148.3966,102.0,MoneySpot,,7234352,0.0,22-11-2023,False,Veterinary Expenses,2023-11-17,Green,0.0,17556.0,6824.25
0062x00000DIjNCAA1,0012x00000LSYGuAAP,COLLINGWOOD,VIC,Australia,Loan Paid,Existing Client-No Loan Granted Ever,0.0,64.57,2861.5301,2.0,0.0,0.0,4.0,2.0,5686.9795,2.0,36.0,96.0,2095.6185,2155.02,0.0,1.63,0.0,0.0,49000.0,0.0,999.0,1200,1536.0,3.0,5.571,Fortnightly,26.0,5686.98,1250.0,Full-Time Employment,2.0,0.0,0.1648,0.0,4889.7766,861.0,4011.75,512.0,MoneySpot,0.0,4852557,2.0,13-03-2023,False,Vet - Procedure,2023-03-13,Orange,0.0,6084.0,5686.98
0062x00000DYqX0AAL,0012x00000hXqqnAAC,Albion Park Rail,NSW,Australia,Closed Lost,New Client-New Loan,0.68,65.8,775.3641,4.0,0.0,0.0,4.0,4.0,3396.5,4.0,14.0,0.0,1913.1,1952.5,1.0,0.0,0.0,0.0,108333.33,1500.0,90.0,1200,1536.0,3.0,6.0,Fortnightly,47.0,3396.5,42700.0,Full-Time Employment,4.0,0.0,0.2088,1.0,3188.5,364.0,753.3233,512.0,MoneySpot,,5055739,2.0,14-04-2023,False,Living Expenses,2023-04-13,Orange,40.0,5835.0,3396.5
0062x00000D6y42AAB,0012x00000OxUEGAA3,Mitchell Park,SA,Australia,Loan Paid,Existing Client-Granted Loan Before,0.0,69.78,3550.4246,2.0,1.0,0.0,3.0,2.0,6703.2975,1.0,50.0,667.0954,2145.0042,2452.92,2.0,0.0,0.0,0.0,4618.15,400.0,250.0,1500,2040.0,7.0,14.0,Fortnightly,34.0,7023.3,1500.0,Part-Time Employment,1.0,0.0,0.2088,0.0,5005.01,1671.0,5916.83,291.43,MoneySpot,0.0,4461580,1.0,12-01-2023,False,Vehicle Expenses,2023-01-11,Orange,0.0,7508.0,7023.3
0062x00000DrxBmAAJ,0012x00000gpV74AAE,Wyndham Vale,VIC,Australia,Closed Lost,Existing Client-No Loan Granted Ever,0.0,30.03,560.9133,4.0,0.0,0.0,2.0,4.0,9772.5024,0.0,7.0,0.0,359.3111,50.0,0.0,0.0,0.0,1.0,0.0,400.0,1300.0,1200,1632.0,7.0,13.857,Fortnightly,50.0,9882.47,4250.0,Full-Time Employment,0.0,0.0,0.0,0.0,0.0,0.0,1009.4666,233.14,MoneySpot,,5208561,0.0,06-05-2023,False,Vehicle Expenses,2023-05-05,Orange,0.0,21787.0,9882.47
