Id,AccountId,City,State,Country,StageName,Applicant_Type__c,income_as_a_of_DP200_income__c,Deposit_spent_on_DOD__c,Monthly_ongoing_financial_commitments__c,DP_Primary_income_frequency__c,DP_enders_with_uncleared_dishonours_233__c,Primary_regular_benefit_frequency__c,Largest_income_source_day_of_week__c,Frequency_for_largest_income_source__c,Total_monthly_income_ongoin_Reg_231__c,DP_Dishonours_Across_Primary_Acct_244__c,DP_No_Direct_Debits_On_Primary_Acct_355__c,Amount_of_SACC_commitments_due__c,Largest_income_Src_Avg_freq__c,Largest_income_Src_last_payment_amt__c,agency_collection_providers__c,income_DP200_spend_on_high_risk_merch__c,most_recent_loan_has_no_repayments__c,Income_source_is_other_income_549__c,Summary_Income__c,Summary_Expenses__c,Rent_Mortgage__c,Loan_Amount__c,Total_Repayment_Amount__c,Total_Repayments__c,Term_in_Weeks__c,Payment_Frequency__c,Applicant_Age__c,Summary_Income_CV__c,Amount_Requested__c,Employment_Status__c,Dishonours_203__c,DP_Insolvency_Indicator__c,DP_Days_in_Overdrawn_For_Period__c,Dishonours_For_Last_30_Days_DP907__c,Salary_Gov_Allowances_all_types_2117__c,DP_Monthly_avg_of_SACC_repayments__c,DP_Avg_Monthly_Loan_Liability_269__c,Repayment_Amount__c,Opportunity_Origin__c,Current_Balance__c,Opp_Number__c,loan_dishonours__c,CloseDate,Bank_Report_Gov_Benefit__c,Purpose_of_Loan__c,Loan_apply_date,DE_Results,DP_Total_Monthly_Benefit_Income__c,Total_monthly_credits__c,Summary_Income_BS__c
0062x00000DGt5GAAT,0012x00000FGe6bAAD,Bogangar,NSW,Australia,Closed Lost,Existing Client-No Loan Granted Ever,52.71,40.54,3506.6124,4.0,0.0,2.0,5.0,2.0,4358.6681,2.0,17.0,291.2064,620.0966,567.77,0.0,0.0,1.0,0.0,2535.0,1500.0,0.0,700,896.0,3.0,5.857,Fortnightly,64.0,4405.73,5000.0,Part-Time Employment,2.0,0.0,0.2857,0.0,3528.2433,559.0,3474.6066,298.67,MoneySpot,,4748100,2.0,24-02-2023,True,Vehicle Expenses,2023-02-24,Orange,2250.0,4268.0,4405.73
0062x00000DHKHpAAP,0012x00000GbgVJAAZ,Jimboomba,QLD,Australia,Loan Paid,Existing Client-Granted Loan Before,38.18,94.45,2980.7915,4.0,0.0,1.0,2.0,4.0,10534.4594,2.0,46.0,384.4522,516.3428,7.0,2.0,0.16,0.0,1.0,3033.33,599.0,240.0,800,1056.0,5.0,10.143,Fortnightly,34.0,4293.2,1000.0,Part-Time Employment,2.0,0.0,0.011,0.0,4291.8266,1734.0,5368.8866,211.2,MoneySpot,0.0,4772656,2.0,01-03-2023,False,Relocation Expenses,2023-02-28,Orange,4292.0,11241.0,4293.2
0062x00000DG0IuAAL,0012x00000TrTQ8AAN,Avenell Heights,QLD,Australia,Loan Paid,Existing Client-Granted Loan Before,0.0,74.62,2539.4344,1.0,0.0,0.0,4.0,1.0,5971.484,0.0,72.0,1437.1314,964.4625,982.53,1.0,0.0,0.0,0.0,4151.33,599.0,220.0,950,1292.0,14.0,14.143,Weekly,56.0,5971.48,950.0,Full-Time Employment,0.0,0.0,0.011,0.0,3857.85,1936.0,3177.3733,92.29,Financier-2,0.0,4697386,0.0,16-02-2023,False,Medical Expenses,2023-02-16,Green,0.0,6979.0,5971.48
0062x00000FVUjMAAX,0012x00000clQAHAA2,Dean Park,NSW,Australia,Loan Paid,Existing Client-Granted Loan Before,0.0,47.42,750.8868,2.0,0.0,0.0,3.0,2.0,4250.1907,0.0,7.0,0.0,1956.2528,2266.17,0.0,0.0,0.0,0.0,1500.0,899.0,300.0,750,990.0,6.0,12.0,Fortnightly,30.0,4250.19,750.0,Full-Time Employment,0.0,0.0,0.0,0.0,4564.59,397.0,778.21,165.0,QuickCash,0.0,7596005,0.0,22-12-2023,False,Travel Expenses,2023-12-21,Green,0.0,4835.0,4250.19
0062x00000D9Go5AAF,0012x00000G2s2SAAR,Saint Clair,NSW,Australia,Loan Paid,Existing Client-Granted Loan Before,0.35,57.36,311.8825,4.0,0.0,0.0,5.0,4.0,11165.2823,0.0,13.0,1757.145,540.569,634.0,0.0,56.74,0.0,1.0,1765.83,400.0,0.0,950,1254.0,10.0,10.571,Weekly,33.0,11173.37,950.0,Casual Employment,0.0,0.0,0.2637,0.0,3491.9166,2472.0,2951.3133,125.4,MoneySpot,0.0,4574133,0.0,29-01-2023,False,Living Expenses,2023-01-28,Orange,46.0,13054.0,11173.37
0062x00000FSU4oAAH,0010K00001iKLWqQAO,Southbank,VIC,Australia,Closed Lost,Existing Client-Granted Loan Before,0.0,50.36,3742.1351,4.0,1.0,0.0,7.0,4.0,3246.46,4.0,50.0,481.2786,512.3076,600.0,0.0,31.95,0.0,1.0,3250.0,899.0,850.0,800,1120.0,18.0,18.429,Weekly,28.0,4272.92,2250.0,Full-Time Employment,4.0,0.0,0.0,0.0,1026.46,2031.0,4182.98,62.22,MoneySpot,,8953483,2.0,2024-04-23,False,Child Expenses,2024-04-23,Orange,0.0,8275.0,4272.92
0062x00000DWqr8AAD,0012x00000RpuD1AAJ,Roxburgh Park,VIC,Australia,Loan Paid,Existing Client-Granted Loan Before,33.31,58.42,788.6416,2.0,0.0,2.0,4.0,2.0,5129.2262,0.0,19.0,0.0,1452.3771,1511.28,0.0,0.0,0.0,0.0,1400.0,599.0,600.0,1000,1280.0,3.0,5.571,Fortnightly,33.0,5129.23,1000.0,Part-Time Employment,0.0,0.0,0.0,0.0,5205.8266,350.0,758.46,426.67,QuickCash,0.0,4941394,0.0,27-03-2023,False,Living Expenses,2023-03-27,Green,1817.0,5454.0,5129.23
0062x00000DrxwhAAB,0012x00000Mirj7AAB,Cessnock,NSW,Australia,Loan Paid,Existing Client-Granted Loan Before,0.0,80.42,817.1791,1.0,0.0,0.0,5.0,1.0,2779.322,1.0,35.0,487.6806,624.5892,969.0,0.0,0.02,0.0,1.0,1600.64,899.0,720.0,1000,1320.0,10.0,10.0,Weekly,41.0,5760.45,2050.0,Part-Time Employment,1.0,0.0,0.0549,1.0,1329.0433,631.0,771.0,132.0,MoneySpot,0.0,5209692,1.0,06-05-2023,False,Vehicle Expenses,2023-05-06,Orange,0.0,5480.0,5760.45
0062x00000Fiz6rAAB,0012x00000nRLHMAA4,Albion,QLD,Australia,Closed Lost,New Client-New Loan,0.0,79.97,90.0,4.0,0.0,0.0,4.0,4.0,10992.7322,0.0,0.0,0.0,2860.0,4713.0,0.0,5.39,0.0,1.0,8000.0,2000.0,600.0,1000,1360.0,14.0,13.714,Weekly,43.0,11484.07,4000.0,Full-Time Employment,0.0,0.0,0.0,0.0,1066.6666,0.0,90.0,97.14,MoneySpot,,8030911,0.0,2024-01-28,False,Furniture or Appliances,2024-01-28,Orange,0.0,12032.0,11484.07
0062x00000D8viQAAR,0010K00001y2C3fQAE,Montmorency,VIC,Australia,Loan Paid,Existing Client-Granted Loan Before,0.0,75.63,906.3406,2.0,0.0,0.0,3.0,2.0,6343.5033,0.0,10.0,128.0,2813.12,2915.55,1.0,0.11,0.0,0.0,3900.0,899.0,101.0,600,816.0,7.0,14.0,Fortnightly,44.0,6343.5,600.0,Full-Time Employment,1.0,0.0,0.967,0.0,6563.9466,128.0,793.8333,116.57,QuickCash,0.0,4556459,1.0,26-01-2023,False,Medical Expenses,2023-01-26,Orange,0.0,7831.0,6343.5
0062x00000DGE2kAAH,0010K00001zGJqDQAW,Wellington Point,QLD,Australia,Loan Paid,Existing Client-Granted Loan Before,49.39,64.02,960.1261,2.0,0.0,4.0,3.0,2.0,5634.5191,1.0,35.0,363.6346,909.58,1012.75,0.0,3.12,0.0,0.0,3614.0,400.0,0.0,1000,1360.0,7.0,13.714,Fortnightly,43.0,5641.52,1000.0,Full-Time Employment,1.0,0.0,0.033,0.0,5104.86,845.0,1623.2966,194.29,QuickCash,0.0,4710198,0.0,18-02-2023,False,Veterinary Expenses,2023-02-18,Green,3005.0,6084.0,5641.52
0062x00000DAFyYAAX,0012x00000TJMfHAAX,Warmun,WA,Australia,Loan Paid,Existing Client-Granted Loan Before,0.0,68.64,444.9524,4.0,0.0,0.0,5.0,4.0,5020.6732,0.0,8.0,0.0,1207.1385,991.8,0.0,0.0,0.0,0.0,1862.86,599.0,320.0,850,1156.0,7.0,12.857,Fortnightly,33.0,5020.67,850.0,Full-Time Employment,0.0,0.0,0.1099,0.0,4754.0066,273.0,279.7333,165.14,Financier-2,0.0,4621288,0.0,05-02-2023,False,Other Expenses,2023-02-05,Green,0.0,6322.0,5020.67
0062x00000DYnTrAAL,0012x00000hXpX9AAK,Blacktown,SA,Australia,Closed Lost,New Client-New Loan,0.0,74.72,0.0,2.0,0.0,0.0,3.0,2.0,2404.5013,3.0,15.0,0.0,1106.73,941.59,0.0,0.0,0.0,0.0,2600.0,400.0,0.0,700,896.0,3.0,5.0,Fortnightly,34.0,2404.5,10200.0,Contract Employment,3.0,0.0,0.0879,0.0,1844.55,0.0,493.5,298.67,MoneySpot,,5053684,0.0,17-04-2023,False,Living Expenses,2023-04-13,Orange,0.0,2383.0,2404.5
0062x00000DFFoMAAX,0012x00000cyyF0AAI,Parramatta,NSW,Australia,Loan Paid,Existing Client-Granted Loan Before,0.0,74.56,526.1258,2.0,0.0,0.0,5.0,2.0,4212.3604,1.0,7.0,262.8869,1686.5714,1624.0,1.0,0.0,0.0,0.0,2924.83,599.0,540.0,1000,1360.0,7.0,14.0,Fortnightly,28.0,5787.75,1000.0,Part-Time Employment,1.0,0.0,0.2088,0.0,3935.3333,282.0,515.7533,194.29,MoneySpot,0.0,4657213,1.0,10-02-2023,False,Life Event Expenses,2023-02-10,Green,0.0,6398.0,5787.75
0062x00000DUcz0AAD,0010K00001rnmOZQAY,Atherton,QLD,Australia,Loan Paid,Existing Client-Granted Loan Before,15.24,88.68,2017.2534,1.0,0.0,2.0,1.0,1.0,7941.782,0.0,11.0,0.0,449.935,467.42,0.0,19.48,0.0,1.0,3705.0,599.0,840.0,1000,1360.0,14.0,13.857,Weekly,52.0,12534.3,1000.0,Casual Employment,0.0,0.0,0.0,0.0,1867.9166,220.0,1994.04,97.14,QuickCash,0.0,5377243,0.0,24-05-2023,False,Furniture or Appliances,2023-05-24,Orange,1868.0,12257.0,12534.3
0062x00000D8ZylAAF,0012x00000cjfJLAAY,Nambour,QLD,Australia,Loan Paid,Existing Client-Granted Loan Before,0.0,58.4,463.5043,1.0,0.0,0.0,5.0,1.0,4506.8121,1.0,27.0,0.0,674.5454,640.0,0.0,0.0,0.0,0.0,2301.2,899.0,1000.0,750,1020.0,14.0,14.571,Weekly,46.0,4506.81,1000.0,Self Employed,1.0,0.0,0.0,0.0,2473.3333,261.0,295.5566,72.86,QuickCash,0.0,4540087,1.0,24-01-2023,False,Home Maintenance & Repairs,2023-01-24,Orange,0.0,7001.0,4506.81
0062x00000DG6KiAAL,0012x00000XO0YhAAL,South Penrith,NSW,Australia,Loan Paid,Existing Client-Granted Loan Before,0.0,87.07,1722.0316,1.0,0.0,0.0,4.0,1.0,7105.0315,0.0,43.0,1010.3363,1343.8923,1316.2,1.0,0.0,0.0,0.0,1300.0,1499.0,1000.0,1000,1360.0,14.0,14.0,Weekly,55.0,7110.03,2050.0,Full-Time Employment,1.0,0.0,0.0,0.0,5823.5333,1842.0,2290.9466,97.14,MoneySpot,0.0,4702958,1.0,17-02-2023,False,Living Expenses,2023-02-17,Orange,0.0,8436.0,7110.03
0062x00000DXWg7AAH,0012x00000dyFMiAAM,Hayborough,SA,Australia,Loan Paid,Existing Client-Granted Loan Before,27.52,59.17,2377.7644,1.0,0.0,4.0,2.0,1.0,6036.4603,0.0,0.0,204.457,849.9607,778.83,1.0,0.0,0.0,0.0,800.0,599.0,1680.0,1000,1280.0,9.0,8.571,Weekly,42.0,6008.5,1000.0,Part-Time Employment,0.0,0.0,0.0,0.0,5469.4166,498.0,2422.2666,142.22,QuickCash,0.0,4979273,0.0,01-04-2023,False,Vehicle Expenses,2023-04-01,Green,1786.0,6489.0,6008.5
0062x00000D1vzmAAB,0012x00000BGUUOAA5,Capalaba,QLD,Australia,Loan Paid,Existing Client-Granted Loan Before,12.78,52.69,339.7926,1.0,0.0,0.0,4.0,1.0,1525.8734,0.0,15.0,66.7009,385.5454,539.0,0.0,2.92,0.0,0.0,2600.0,400.0,300.0,700,952.0,14.0,14.143,Weekly,25.0,2065.9,700.0,Contract Employment,0.0,0.0,0.033,0.0,1413.6666,270.0,356.9733,68.0,QuickCash,0.0,4418549,0.0,05-01-2023,False,Living Expenses,2023-01-05,Green,342.0,2674.0,2065.9
0062x00000Drz7rAAB,0012x00000RqhiAAAR,GLENORCHY,TAS,Australia,Loan Paid,Existing Client-Granted Loan Before,32.97,71.6,3570.0487,4.0,0.0,4.0,4.0,4.0,2376.1332,8.0,33.0,384.0,494.7675,339.78,1.0,2.57,0.0,0.0,0.0,599.0,120.0,1000,1360.0,7.0,13.571,Fortnightly,31.0,2376.13,2050.0,,8.0,0.0,0.0659,0.0,2175.3366,0.0,3851.46,194.29,QuickCash,0.0,5211501,6.0,06-05-2023,True,Vehicle Expenses,2023-05-06,Orange,1333.0,4043.0,2376.13
0062x00000D7Bo1AAF,0010K00001qkWNeQAM,Bomaderry,NSW,Australia,Loan Paid,Existing Client-Granted Loan Before,0.74,27.43,5520.7273,4.0,0.0,3.0,3.0,4.0,1929.7632,0.0,88.0,579.2358,1324.8725,1405.91,0.0,0.0,1.0,0.0,3466.67,400.0,400.0,1000,1360.0,14.0,13.857,Weekly,63.0,15012.51,1000.0,Full-Time Employment,0.0,0.0,0.0,0.0,1883.0966,2289.0,5875.2033,97.14,MoneySpot,0.0,4471453,0.0,13-01-2023,False,Medical Expenses,2023-01-13,Orange,117.0,15779.0,15012.51
0062x00000D1t7wAAB,0012x00000Ge3mxAAB,Isabella Plains,ACT,Australia,Loan Paid,Existing Client-Granted Loan Before,0.0,56.12,1711.876,4.0,0.0,0.0,1.0,4.0,1274.8332,0.0,67.0,1077.8639,96.5681,55.0,1.0,0.35,0.0,1.0,1000.0,400.0,740.0,1000,1360.0,14.0,14.143,Weekly,28.0,4896.6,1000.0,Full-Time Employment,0.0,1.0,0.0769,0.0,0.0,760.0,1915.72,97.14,Financier-2,0.02,4416570,0.0,05-01-2023,False,Living Expenses,2023-01-05,Orange,0.0,6492.0,4896.6
0062x00000D1UnRAAV,0012x00000KLJboAAH,MINTO,NSW,Australia,Closed Lost,Existing Client-No Loan Granted Ever,0.0,95.14,469.0166,1.0,0.0,0.0,1.0,1.0,7970.0925,0.0,34.0,123.0,950.0,800.0,6.0,3.0,0.0,1.0,3683.33,0.0,800.0,700,896.0,6.0,6.143,Weekly,29.0,7982.0,1000.0,Full-Time Employment,0.0,0.0,0.2198,0.0,0.0,82.0,768.51,149.33,QuickCash,,4392625,0.0,04-01-2023,False,Other,2023-01-01,Orange,0.0,8495.0,7982.0
0062x00000FkFEEAA3,0010K00001gkccoQAA,Albanvale,VIC,Australia,Loan Paid,Existing Client-Granted Loan Before,0.0,62.6,333.91,3.0,0.0,0.0,5.0,3.0,422.61,2.0,47.0,2325.6223,422.61,93.6,0.0,0.0,0.0,1.0,9316.67,899.0,0.0,1000,1320.0,10.0,10.429,Weekly,37.0,9311.32,4500.0,Full-Time Employment,2.0,0.0,0.011,2.0,0.0,2737.0,2736.8466,132.0,MoneySpot,0.0,8120647,0.0,2024-02-08,False,Vehicle Expenses,2024-02-07,Orange,0.0,11712.0,9311.32
0062x00000F8fGeAAJ,0012x00000XETTTAA5,Worrigee,NSW,Australia,Loan Paid,Existing Client-Granted Loan Before,0.0,31.19,231.0,4.0,0.0,0.0,4.0,4.0,400.0033,0.0,52.0,1204.1958,171.4285,150.0,0.0,0.0,0.0,1.0,3476.02,400.0,200.0,1000,1360.0,16.0,16.286,Weekly,24.0,4411.94,1500.0,Full-Time Employment,0.0,0.0,0.0549,0.0,0.0,1517.0,2227.11,85.0,QuickCash,0.0,6869463,0.0,18-10-2023,False,Living Expenses,2023-10-17,Orange,0.0,4769.0,4411.94
0062x00000DWl9mAAD,0012x00000MkEkAAAV,UNANDERRA,NSW,Australia,Closed Lost,Existing Client-No Loan Granted Ever,0.0,81.55,806.0766,0.0,1.0,0.0,0.0,0.0,0.0,4.0,14.0,295.2102,0.0,0.0,1.0,0.0,0.0,0.0,0.0,0.0,400.0,1000,1280.0,6.0,6.571,Weekly,25.0,4859.73,2500.0,,5.0,0.0,0.011,1.0,4426.2333,291.0,1031.8633,213.33,MoneySpot,,4935863,5.0,30-03-2023,False,Purchase - Electrical Purchase - Computer/TV,2023-03-25,Orange,0.0,641.0,4859.73
0062x00000DsPtiAAF,0012x00000hZTNKAA4,Corlette,NSW,Australia,Loan Paid,New Client-New Loan,0.0,20.05,885.324,2.0,0.0,0.0,3.0,2.0,3556.3587,0.0,53.0,640.0,1418.9,1418.9,0.0,0.0,1.0,0.0,2000.0,2000.0,560.0,1000,1360.0,7.0,14.143,Fortnightly,37.0,3489.01,1500.0,Full-Time Employment,0.0,0.0,0.0,0.0,2837.8,302.0,859.59,194.29,QuickCash,0.0,5238334,0.0,10-05-2023,False,Living Expenses,2023-05-10,Orange,0.0,3310.0,3489.01
0062x00000DZb7rAAD,0012x00000IM7GLAA1,Kelso,QLD,Australia,Loan Paid,Existing Client-Granted Loan Before,0.0,61.0,405.5515,1.0,0.0,0.0,3.0,1.0,7853.7567,1.0,18.0,0.0,2065.6458,1588.08,0.0,0.0,0.0,0.0,2080.0,400.0,100.0,1000,1320.0,10.0,10.0,Weekly,32.0,7860.76,2050.0,Part-Time Employment,1.0,0.0,0.4505,0.0,8262.5833,249.0,281.14,132.0,QuickCash,0.0,5101882,1.0,20-04-2023,False,Home Maintenance & Repairs,2023-04-20,Green,0.0,8350.0,7860.76
0062x00000ELTIoAAP,0012x00000Mguq8AAB,Reservoir,VIC,Australia,Closed Lost,Existing Client-No Loan Granted Ever,0.0,42.74,217.2601,1.0,0.0,0.0,5.0,1.0,4363.3332,4.0,50.0,0.0,816.0,1050.0,1.0,0.0,0.0,1.0,750.0,2000.0,1137.0,800,1088.0,14.0,14.143,Weekly,32.0,4366.0,2500.0,Full-Time Employment,4.0,0.0,0.0659,4.0,0.0,0.0,271.74,77.71,MoneySpot,,6036318,0.0,28-07-2023,False,Vehicle Expenses,2023-07-28,Orange,0.0,4376.0,4366.0
0062x00000DHMPDAA5,0012x00000SHqq4AAD,Joyner,QLD,Australia,Closed Lost,Existing Client-No Loan Granted Ever,2.24,55.62,2246.5599,1.0,0.0,0.0,1.0,1.0,9234.6152,16.0,83.0,1201.2845,1127.31,1127.31,1.0,0.0,0.0,0.0,3558.14,899.0,0.0,1000,1280.0,3.0,6.857,Fortnightly,24.0,10997.25,3000.0,Unemployed,16.0,0.0,0.022,6.0,9700.6466,1165.0,2577.02,426.67,MoneySpot,,4774826,7.0,05-03-2023,False,Living Expenses,2023-02-28,Orange,220.0,9780.0,10997.25
0062x00000DX1ivAAD,0012x00000TH60uAAD,Woronora,NSW,Australia,Loan Paid,Existing Client-Granted Loan Before,8.63,65.32,2823.1816,2.0,0.0,0.0,4.0,2.0,7563.5831,4.0,32.0,1127.4269,2916.7166,2969.2,1.0,0.24,0.0,0.0,6942.74,599.0,800.0,1000,1280.0,4.0,8.429,Fortnightly,47.0,10580.25,2050.0,Full-Time Employment,4.0,0.0,0.022,0.0,6500.8333,3490.0,7023.0966,320.0,MoneySpot,0.0,4949974,5.0,28-03-2023,False,Travel Expenses,2023-03-28,Orange,1326.0,15351.0,10580.25
0062x00000DHeP3AAL,0012x00000fmhDqAAI,Elwood,VIC,Australia,Loan Paid,Existing Client-No Loan Granted Ever,0.0,61.49,0.0,1.0,0.0,0.0,2.0,1.0,6400.8748,0.0,3.0,0.0,717.4166,802.0,0.0,0.0,0.0,1.0,3670.33,599.0,800.0,800,1024.0,6.0,5.714,Weekly,44.0,6949.68,3000.0,Full-Time Employment,0.0,0.0,0.022,0.0,0.0,0.0,762.0,170.67,MoneySpot,0.0,4789629,0.0,03-03-2023,False,Vehicle Expenses,2023-03-03,Orange,0.0,7725.0,6949.68
0062x00000DUnH3AAL,0012x00000hWgO9AAK,Cranbourne,VIC,Australia,Closed Lost,Existing Client-No Loan Granted Ever,0.24,71.72,331.1599,1.0,0.0,0.0,1.0,1.0,5384.1016,0.0,47.0,421.1535,872.3961,913.75,1.0,0.3,0.0,1.0,0.0,899.0,0.0,1000,1280.0,6.0,5.714,Weekly,43.0,5384.1,1500.0,Full-Time Employment,0.0,0.0,0.0,0.0,0.0,420.0,1682.11,213.33,MoneySpot,,5390035,0.0,25-05-2023,False,Living Expenses,2023-05-25,Orange,13.0,5410.0,5384.1
0062x00000D9ArxAAF,0012x00000Gee0gAAB,Pemulwuy,NSW,Australia,Loan Paid,Existing Client-Granted Loan Before,0.13,37.13,711.0996,2.0,0.0,0.0,3.0,2.0,7999.4711,3.0,0.0,346.8389,2572.4585,2591.82,1.0,1.3,0.0,1.0,1500.0,899.0,1200.0,750,1020.0,7.0,13.714,Fortnightly,34.0,7999.47,750.0,Full-Time Employment,3.0,0.0,0.022,1.0,0.0,158.0,770.9833,145.71,MoneySpot,0.0,4568813,0.0,28-01-2023,False,Living Expenses,2023-01-28,Orange,13.0,9554.0,7999.47
0062x00000D76VJAAZ,0012x00000Ttan2AAB,Caulfield North,VIC,Australia,Loan Paid,Existing Client-Granted Loan Before,0.0,56.55,1489.8175,2.0,0.0,0.0,3.0,2.0,8205.5893,0.0,68.0,243.9851,2131.7633,479.36,0.0,14.91,0.0,0.0,13229.66,1499.0,1509.0,700,952.0,14.0,13.857,Weekly,47.0,20020.01,900.0,Full-Time Employment,0.0,0.0,0.0989,0.0,2131.7633,402.0,3431.65,68.0,QuickCash,0.0,4467333,0.0,14-01-2023,False,Child Expenses,2023-01-14,Orange,0.0,17091.0,20020.01
0062x00000DXLzIAAX,0012x00000XPc7eAAD,Wee Waa,NSW,Australia,Loan Paid,Existing Client-Granted Loan Before,0.0,71.83,3209.4259,2.0,0.0,0.0,3.0,2.0,4232.3483,9.0,38.0,1519.1354,1948.04,1876.15,0.0,0.16,0.0,0.0,5027.25,899.0,1080.0,900,1152.0,4.0,7.857,Fortnightly,55.0,4239.68,2300.0,Full-Time Employment,9.0,0.0,0.1978,5.0,4545.4266,1338.0,3070.2433,288.0,MoneySpot,0.0,4968257,4.0,31-03-2023,False,Other Expenses,2023-03-30,Green,0.0,5072.0,4239.68
0062x00000FKfk1AAD,0012x00000RrCiDAAV,Riverstone,NSW,Australia,Loan Paid,Existing Client-Granted Loan Before,0.0,41.74,2103.7682,1.0,0.0,0.0,3.0,1.0,5284.8091,0.0,0.0,0.0,1184.7784,986.06,0.0,10.66,0.0,1.0,0.0,400.0,100.0,750,1020.0,14.0,14.286,Weekly,29.0,5539.94,750.0,,0.0,0.0,1.0,0.0,0.0,300.0,2083.6666,72.86,MoneySpot,0.0,7406730,0.0,05-12-2023,False,Veterinary Expenses,2023-12-05,Orange,0.0,6217.0,5539.94
0062x00000Ee3tMAAR,0012x00000hYYomAAG,Geographe,WA,Australia,Closed Lost,Existing Client-No Loan Granted Ever,0.0,58.85,0.0,2.0,0.0,0.0,3.0,2.0,4199.533,0.0,0.0,0.0,900.0,900.0,0.0,0.0,0.0,0.0,1950.0,400.0,1000.0,800,1024.0,3.0,5.571,Fortnightly,41.0,4617.87,800.0,Full-Time Employment,0.0,0.0,0.0,0.0,3293.47,0.0,0.0,341.33,QuickCash,,6459928,0.0,12-09-2023,False,Once off purchase,2023-09-08,Orange,0.0,4739.0,4617.87
0062x00000DICvRAAX,0012x00000AE6eEAAT,Marble road,NSW,Australia,Loan Paid,Existing Client-Granted Loan Before,0.0,84.85,2504.1633,4.0,0.0,0.0,2.0,4.0,9556.2966,9.0,16.0,361.6157,7167.2225,8869.66,1.0,3.42,0.0,0.0,4535.44,400.0,5000.0,1000,1280.0,2.0,7.714,Monthly,38.0,10624.96,2050.0,Full-Time Employment,9.0,0.0,0.2857,1.0,9556.2966,499.0,3380.7333,640.0,QuickCash,0.0,4821699,9.0,08-03-2023,False,Child Expenses,2023-03-08,Orange,0.0,10645.0,10624.96
0062x00000DYhOWAA1,0012x00000g8zdrAAA,Newstead,QLD,Australia,Loan Paid,Existing Client-Granted Loan Before,0.3,91.75,2881.5053,2.0,2.0,4.0,2.0,2.0,10493.5092,31.0,57.0,501.2667,2069.1233,2173.7,1.0,10.11,0.0,0.0,4448.17,1499.0,1720.0,650,832.0,4.0,7.0,Fortnightly,28.0,10551.18,2050.0,Full-Time Employment,31.0,0.0,0.1099,6.0,6460.9966,500.0,3790.29,208.0,QuickCash,0.0,5047142,17.0,13-04-2023,False,Living Expenses,2023-04-13,Orange,40.0,13007.0,10551.18
0062x00000DIDnmAAH,0012x00000VeQdpAAF,Ferryden Park,SA,Australia,Loan Paid,Existing Client-Granted Loan Before,0.0,90.05,1409.9436,2.0,0.0,0.0,2.0,2.0,4153.1325,4.0,30.0,1462.9799,1780.7085,1755.82,0.0,3.76,0.0,0.0,1820.61,899.0,600.0,1000,1320.0,5.0,10.0,Fortnightly,49.0,3868.8,1000.0,Full-Time Employment,4.0,0.0,0.967,1.0,4154.9866,881.0,1476.9066,264.0,QuickCash,0.0,4822094,4.0,08-03-2023,False,Home Maintenance & Repairs,2023-03-08,Green,0.0,5029.0,3868.8
0062x00000EzUAEAA3,0012x00000kgXrpAAE,Deception Bay,QLD,Australia,Loan Paid,Existing Client-No Loan Granted Ever,0.0,63.16,1565.101,2.0,0.0,0.0,2.0,2.0,4518.4151,0.0,26.0,846.2637,1655.8485,1712.77,0.0,0.0,0.0,0.0,3582.58,599.0,400.0,900,1224.0,7.0,13.857,Fortnightly,19.0,4694.08,2050.0,Part-Time Employment,0.0,0.0,0.0,0.0,3863.6466,1081.0,2276.5466,174.86,Financier-2,0.0,6812181,0.0,12-10-2023,False,Life Event Expenses,2023-10-12,Orange,0.0,6556.0,4694.08
0062x00000Ds7bJAAR,0010K000026Q8RrQAK,Moranbah,QLD,Australia,Loan Paid,Existing Client-Granted Loan Before,0.0,55.07,439.6607,1.0,0.0,0.0,3.0,1.0,3526.8615,0.0,0.0,0.0,510.4509,1022.26,0.0,100.0,0.0,0.0,6933.33,899.0,240.0,1000,1360.0,14.0,14.429,Weekly,34.0,10913.76,2050.0,Full-Time Employment,12.0,0.0,0.022,3.0,9238.32,295.0,754.3766,97.14,MoneySpot,0.0,5220764,0.0,08-05-2023,False,Living Expenses,2023-05-08,Orange,0.0,3633.0,10913.76
0062x00000D2MDOAA3,0012x00000dx56pAAA,Glossodia,NSW,Australia,Loan Paid,Existing Client-No Loan Granted Ever,0.0,86.96,2115.9666,0.0,1.0,0.0,0.0,0.0,2705.88,4.0,13.0,336.9471,0.0,0.0,1.0,0.08,1.0,0.0,3356.24,599.0,600.0,1000,1280.0,3.0,5.571,Fortnightly,23.0,4996.4,1000.0,Casual Employment,5.0,0.0,0.0549,1.0,2290.5233,318.0,2140.56,426.67,MoneySpot,0.0,4441336,5.0,09-01-2023,False,Living Expenses,2023-01-09,Orange,0.0,3989.0,4996.4
0062x00000D7pyOAAR,0012x00000LR1MgAAL,Coomera,QLD,Australia,Loan Paid,Existing Client-Granted Loan Before,0.37,50.22,814.9341,4.0,0.0,0.0,3.0,4.0,2857.5365,0.0,11.0,0.0,853.8455,1044.09,0.0,0.06,0.0,1.0,3466.67,899.0,1000.0,1000,1360.0,14.0,14.143,Weekly,40.0,2857.54,1000.0,Casual Employment,0.0,0.0,0.0,0.0,0.0,396.0,831.3633,97.14,QuickCash,0.0,4502133,0.0,18-01-2023,False,Child Expenses,2023-01-18,Green,13.0,3480.0,2857.54
0062x00000DHL4qAAH,0012x00000XKAlUAAX,Springfield,NSW,Australia,Loan Paid,Existing Client-Granted Loan Before,27.34,69.75,2981.6162,2.0,0.0,2.0,2.0,2.0,5674.7008,0.0,24.0,1028.551,1795.5657,1630.41,0.0,1.22,0.0,0.0,3373.51,400.0,740.0,1000,1320.0,6.0,12.0,Fortnightly,33.0,5790.76,1000.0,Part-Time Employment,0.0,0.0,0.033,0.0,5874.67,1325.0,2360.4866,220.0,MoneySpot,0.0,4774083,0.0,01-03-2023,False,Medical Expenses,2023-02-28,Orange,1685.0,6163.0,5790.76
0062x00000D7AMkAAN,0012x00000L35IlAAJ,Alyangula,NT,Australia,Loan Paid,Existing Client-Granted Loan Before,0.0,97.19,0.0,1.0,0.0,0.0,2.0,1.0,671.2899,2.0,10.0,0.0,129.2857,20.0,0.0,5.41,0.0,1.0,0.0,400.0,100.0,600,816.0,14.0,14.143,Weekly,37.0,671.29,5000.0,,2.0,0.0,0.0769,1.0,0.0,227.0,253.3333,58.29,MoneySpot,0.0,4470486,2.0,13-01-2023,False,Travel Expenses,2023-01-13,Orange,0.0,1591.0,671.29
0062x00000DVBpOAAX,0012x00000iHHa1AAG,Kepnock,QLD,Australia,Closed Lost,New Client-New Loan,0.0,51.72,1146.815,2.0,1.0,0.0,2.0,2.0,3731.836,4.0,8.0,0.0,1717.6671,1919.44,0.0,0.0,0.0,0.0,0.0,0.0,150.0,700,924.0,5.0,9.286,Fortnightly,25.0,3809.5,1050.0,,8.0,0.0,0.0,4.0,4007.89,0.0,1997.33,184.8,MoneySpot,,5428479,8.0,02-06-2023,False,Other,2023-05-28,Orange,0.0,4462.0,3809.5
0062x00000DGyMqAAL,0010K00002APkP5QAL,DUBBO,NSW,Australia,Loan Paid,Existing Client-Granted Loan Before,0.0,61.82,4966.8873,1.0,1.0,0.0,2.0,1.0,5163.5242,7.0,88.0,682.3456,1188.3184,1188.32,1.0,0.32,0.0,0.0,4246.67,599.0,0.0,1000,1360.0,14.0,13.571,Weekly,50.0,5573.49,1000.0,Full-Time Employment,16.0,0.0,0.1648,10.0,5149.38,1475.0,5487.6533,97.14,QuickCash,0.0,4752883,15.0,25-02-2023,False,Home Maintenance & Repairs,2023-02-25,Green,0.0,5372.0,5573.49
0062x00000DrORzAAN,0012x00000g95qOAAQ,Fremantle,WA,Australia,Closed Lost,Existing Client-No Loan Granted Ever,0.0,22.58,0.0,1.0,0.0,0.0,2.0,1.0,2955.2483,11.0,18.0,0.0,560.4277,750.95,0.0,0.0,0.0,1.0,1400.0,899.0,0.0,700,896.0,6.0,6.571,Weekly,40.0,2955.25,700.0,Self Employed,11.0,0.0,0.2527,0.0,0.0,0.0,52.6733,149.33,MoneySpot,,5163469,0.0,29-04-2023,False,Medical Expenses,2023-04-29,Orange,0.0,3826.0,2955.25
0062x00000DrseUAAR,0012x00000hXNd6AAG,Punchbowl,NSW,Australia,Closed Lost,Existing Client-Granted Loan Before,0.0,87.64,1548.5043,2.0,0.0,0.0,2.0,2.0,3457.4509,0.0,22.0,909.2733,841.3214,911.08,0.0,0.0,0.0,1.0,2100.0,400.0,300.0,850,1224.0,12.0,23.714,Fortnightly,50.0,6763.39,5000.0,Self Employed,0.0,0.0,0.8132,0.0,0.0,371.0,2015.0533,102.0,QuickCash,,5200979,0.0,05-05-2023,False,Travel Expenses,2023-05-05,Green,0.0,11359.0,6763.39
0062x00000DFNJvAAP,0012x00000XKFtdAAH,Greenslopes,QLD,Australia,Loan Paid,Existing Client-Granted Loan Before,0.0,72.36,2480.1866,1.0,0.0,0.0,2.0,1.0,5188.9647,0.0,40.0,788.4762,1194.173,1110.96,0.0,0.0,0.0,0.0,4483.49,599.0,1680.0,1000,1440.0,24.0,24.571,Weekly,40.0,5710.63,2050.0,Full-Time Employment,0.0,0.0,0.011,0.0,5174.75,2420.0,4236.0866,60.0,MoneySpot,0.0,4664180,0.0,11-02-2023,False,Medical Expenses,2023-02-11,Green,0.0,5829.0,5710.63
0062x00000D1ecdAAB,0012x00000PwyUWAAZ,Wendouree,VIC,Australia,Loan Paid,Existing Client-Granted Loan Before,37.2,50.94,996.0937,2.0,0.0,2.0,4.0,2.0,4358.3124,0.0,15.0,1151.7027,1097.0271,1395.16,1.0,0.0,0.0,0.0,1083.33,599.0,500.0,800,1088.0,7.0,13.429,Fortnightly,33.0,4167.65,800.0,Contract Employment,0.0,0.0,0.7912,0.0,4435.4633,902.0,1172.1666,155.43,MoneySpot,0.0,4402675,0.0,03-01-2023,False,Relocation Expenses,2023-01-03,Green,1876.0,5042.0,4167.65
0062x00000DrsViAAJ,0012x00000TtqqAAAR,Kariong,NSW,Australia,Loan Paid,Existing Client-Granted Loan Before,0.0,99.67,2952.6433,1.0,2.0,0.0,5.0,1.0,3208.0516,18.0,56.0,575.82,676.9166,569.0,1.0,0.0,0.0,1.0,1946.46,400.0,80.0,1000,1360.0,14.0,14.143,Weekly,26.0,3208.05,2050.0,Full-Time Employment,18.0,0.0,0.0879,11.0,0.0,1094.0,2648.27,97.14,MoneySpot,0.0,5200872,18.0,05-05-2023,False,Vehicle Expenses,2023-05-05,Orange,0.0,3021.0,3208.05
0062x00000D25FnAAJ,0012x00000g9PBGAA2,Kurunjang,VIC,Australia,Loan Paid,New Client-New Loan,0.0,55.88,3510.999,2.0,1.0,0.0,3.0,2.0,5846.5681,5.0,27.0,0.0,2542.9685,3145.52,1.0,0.75,0.0,0.0,0.0,0.0,770.0,600,768.0,3.0,5.857,Fortnightly,43.0,5846.57,600.0,,5.0,0.0,0.1209,3.0,5933.5933,164.0,4155.6833,256.0,QuickCash,0.0,4426556,5.0,06-01-2023,False,Short Term Loan,2023-01-06,Orange,0.0,6364.0,5846.57
0062x00000DYe7BAAT,0012x00000bmVRcAAM,Gorokan,NSW,Australia,Loan Paid,Existing Client-Granted Loan Before,0.0,77.08,1672.4915,1.0,0.0,0.0,2.0,1.0,4360.6124,5.0,44.0,960.0,1003.5384,601.0,2.0,33.75,0.0,0.0,3900.0,400.0,0.0,1000,1320.0,9.0,9.0,Weekly,30.0,5715.95,1000.0,Full-Time Employment,5.0,0.0,0.0549,0.0,4348.6666,1192.0,2997.6466,146.67,Financier-2,0.0,5045017,5.0,12-04-2023,False,Living Expenses,2023-04-12,Orange,0.0,10597.0,5715.95
0062x00000FUWuFAAX,0012x00000gpM6cAAE,Noble Park,VIC,Australia,Loan Paid,Existing Client-Granted Loan Before,0.0,56.75,1481.24,1.0,0.0,0.0,4.0,1.0,4961.5137,0.0,29.0,0.0,970.4907,1007.62,0.0,0.0,0.0,0.0,0.0,599.0,1020.0,1000,1360.0,14.0,14.0,Weekly,58.0,4961.51,2050.0,,0.0,0.0,0.033,0.0,4528.9566,1024.0,1481.24,97.14,QuickCash,0.0,7518040,0.0,15-12-2023,False,Living Expenses,2023-12-15,Orange,0.0,4671.0,4961.51
0062x00000DYIVSAA5,0012800001OiGGMAA3,Blacktown,NSW,Australia,Loan Paid,Existing Client-Granted Loan Before,0.0,59.94,5727.0979,2.0,0.0,0.0,3.0,2.0,9706.8434,0.0,6.0,2350.9847,4467.8083,4282.62,0.0,0.0,0.0,0.0,6500.0,599.0,2240.0,1000,1280.0,4.0,7.714,Fortnightly,59.0,10550.18,2500.0,Full-Time Employment,2.0,0.0,0.8242,0.0,8935.6166,3226.0,5679.99,320.0,MoneySpot,0.0,5024456,0.0,08-04-2023,False,Other Expenses,2023-04-08,Orange,0.0,9797.0,10550.18
0062x00000FVykRAAT,0012x00000n3ABeAAM,Berserker,QLD,Australia,Closed Lost,New Client-New Loan,0.0,90.7,0.0,1.0,0.0,0.0,3.0,1.0,2993.7933,0.0,1.0,0.0,653.3115,668.74,0.0,0.0,0.0,0.0,686.0,2000.0,520.0,700,980.0,19.0,19.286,Weekly,36.0,3180.96,3000.0,Full-Time Employment,0.0,0.0,0.8681,0.0,2831.0166,30.0,29.8833,51.58,MoneySpot,,7634939,0.0,26-12-2023,False,Vehicle Expenses,2023-12-25,Green,0.0,3274.0,3180.96
0062x00000D23zxAAB,0010K00001ofUsOQAU,South Albury,NSW,Australia,Loan Paid,Existing Client-Granted Loan Before,0.0,33.16,440.9366,4.0,0.0,0.0,2.0,4.0,4280.5233,0.0,6.0,0.0,1151.832,497.38,2.0,0.32,0.0,1.0,3250.0,400.0,320.0,1000,1360.0,14.0,14.571,Weekly,32.0,4285.52,1000.0,Self Employed,0.0,0.0,0.0,0.0,0.0,213.0,757.5566,97.14,QuickCash,0.0,4425575,0.0,06-01-2023,False,Other Expenses,2023-01-06,Orange,0.0,5279.0,4285.52
0062x00000D8EdFAAV,0012x00000SI6HrAAL,Cranbourne North,VIC,Australia,Loan Paid,Existing Client-No Loan Granted Ever,0.0,73.29,3340.3678,1.0,0.0,0.0,4.0,1.0,9630.6116,1.0,29.0,0.0,1638.7441,1531.0,2.0,0.09,0.0,0.0,3683.33,599.0,100.0,1000,1280.0,6.0,5.857,Weekly,26.0,9630.61,1000.0,Full-Time Employment,1.0,0.0,0.044,0.0,8617.5066,0.0,3321.36,213.33,MoneySpot,0.0,4522023,1.0,21-01-2023,False,Living Expenses,2023-01-20,Green,0.0,13741.0,9630.61
0062x00000D28wPAAR,0012x00000Ve2wiAAB,Rockbank,VIC,Australia,Closed Lost,Existing Client-No Loan Granted Ever,0.0,42.47,1273.2852,4.0,0.0,0.0,5.0,4.0,14153.0232,0.0,3.0,290.0446,411.6742,1368.49,0.0,0.0,0.0,1.0,2717.63,1499.0,0.0,700,896.0,6.0,5.857,Weekly,38.0,15038.97,2000.0,Full-Time Employment,0.0,0.0,0.0,0.0,5078.4466,257.0,1436.9766,149.33,MoneySpot,,4429191,0.0,07-01-2023,False,Life Event Expenses,2023-01-06,Orange,0.0,14515.0,15038.97
0062x00000D9e7CAAR,0012x00000TtHTIAA3,Jimboomba,QLD,Australia,Loan Paid,Existing Client-Granted Loan Before,14.33,64.9,2655.8938,1.0,0.0,4.0,1.0,1.0,5796.2329,7.0,66.0,1465.1369,1050.9107,1183.0,0.0,0.0,0.0,0.0,3416.67,599.0,300.0,1000,1360.0,14.0,13.857,Weekly,34.0,6455.83,1000.0,Full-Time Employment,7.0,0.0,0.3077,3.0,5711.9333,1451.0,2747.4333,97.14,Financier-2,0.0,4592375,7.0,01-02-2023,False,Vehicle Expenses,2023-01-31,Green,1158.0,8078.0,6455.83
0062x00000DreVDAAZ,0010K0000274LMVQA2,Banyo,QLD,Australia,Loan Paid,Existing Client-Granted Loan Before,0.0,94.12,3852.9544,2.0,0.0,0.0,1.0,2.0,5557.5052,2.0,41.0,573.767,2557.975,2447.21,1.0,0.0,0.0,0.0,3900.0,599.0,800.0,1000,1360.0,7.0,14.0,Fortnightly,41.0,5773.81,3000.0,Full-Time Employment,11.0,0.0,0.044,2.0,5315.07,1790.0,4680.9966,194.29,MoneySpot,0.0,5181196,2.0,02-05-2023,False,Vehicle Expenses,2023-05-02,Orange,0.0,8138.0,5773.81
0062x00000DrFWDAA3,0012x00000hYlAXAA0,Blacktown,QLD,Australia,Loan Paid,New Client-New Loan,5.48,62.72,1957.4585,1.0,0.0,2.0,2.0,1.0,40846.1497,3.0,117.0,650.5787,8716.7857,7117.5,0.0,0.04,0.0,1.0,37037.0,1500.0,1.0,1000,1280.0,6.0,6.0,Weekly,34.0,25475.05,1000.0,Home Duties,3.0,0.0,0.6374,1.0,2195.7833,321.0,2181.7333,213.33,Financier-2,0.0,5154444,1.0,28-04-2023,False,Living Expenses,2023-04-28,Orange,2196.0,40059.0,25475.05
0062x00000D6snfAAB,0012x00000Tu4YPAAZ,Woree,QLD,Australia,Loan Paid,Existing Client-Granted Loan Before,0.22,86.98,1267.2523,2.0,0.0,0.0,2.0,2.0,3274.188,2.0,60.0,1247.2589,1365.3242,1009.18,0.0,15.67,0.0,0.0,3504.26,400.0,200.0,1000,1360.0,7.0,14.0,Fortnightly,35.0,5732.23,1000.0,Full-Time Employment,2.0,0.0,0.1209,1.0,3185.7566,888.0,1559.6333,194.29,QuickCash,0.0,4457570,1.0,11-01-2023,False,Living Expenses,2023-01-11,Green,13.0,5756.0,5732.23
0062x00000DYxYVAA1,0012x00000dwqnJAAQ,Pegs Creek,WA,Australia,Loan Paid,Existing Client-Granted Loan Before,0.0,61.5,4077.0283,1.0,1.0,0.0,4.0,1.0,11127.7319,6.0,9.0,1448.1646,2277.0676,2385.0,1.0,0.27,1.0,0.0,2090.0,599.0,0.0,1000,1280.0,8.0,8.0,Weekly,53.0,11127.73,1000.0,Full-Time Employment,6.0,0.0,0.0,0.0,9867.2933,3744.0,5014.33,160.0,MoneySpot,0.0,5062404,5.0,14-04-2023,False,Living Expenses,2023-04-14,Orange,0.0,12178.0,11127.73
0062x00000DIF8MAAX,0012x00000gA9ecAAC,Lyneham,ACT,Australia,Loan Paid,Existing Client-Granted Loan Before,0.0,89.43,278.0935,2.0,0.0,0.0,3.0,2.0,2355.8927,0.0,4.0,0.0,934.0,934.0,0.0,1.06,0.0,0.0,1868.0,400.0,100.0,600,792.0,7.0,13.143,Fortnightly,45.0,3356.82,600.0,Full-Time Employment,0.0,0.0,0.011,0.0,2179.3333,128.0,145.5,113.14,Financier-2,0.0,4822764,0.0,08-03-2023,False,Travel Expenses,2023-03-08,Orange,0.0,4334.0,3356.82
0062x00000DXqb2AAD,0012x00000gp8cBAAQ,Noble Park,VIC,Australia,Loan Paid,Existing Client-No Loan Granted Ever,0.0,65.21,931.15,2.0,0.0,0.0,2.0,2.0,7767.9594,0.0,11.0,0.0,1871.6366,1822.52,0.0,0.0,0.0,0.0,0.0,599.0,1695.0,1000,1280.0,3.0,6.143,Fortnightly,42.0,6979.69,1000.0,,0.0,0.0,0.011,0.0,3743.2733,0.0,5543.86,426.67,MoneySpot,0.0,4997553,0.0,04-04-2023,False,Vehicle Expenses,2023-04-04,Orange,0.0,10391.0,6979.69
0062x00000DY9k4AAD,0012x00000MgVjEAAV,Riverstone,NSW,Australia,Loan Paid,Existing Client-Granted Loan Before,0.0,78.91,422.1072,4.0,0.0,0.0,3.0,4.0,6309.3158,3.0,27.0,385.0841,2134.5742,2523.99,0.0,0.0,0.0,0.0,6032.0,1499.0,870.0,1000,1280.0,4.0,7.857,Fortnightly,55.0,6309.32,2050.0,Part-Time Employment,3.0,0.0,0.7143,0.0,6203.7533,414.0,868.7066,320.0,MoneySpot,0.0,5015913,0.0,07-04-2023,False,Relocation Expenses,2023-04-07,Green,0.0,7824.0,6309.32
0062x00000DZomPAAT,0012x00000hYOUcAAO,Two Rocks,WA,Australia,Closed Lost,New Client-New Loan,0.04,71.75,7139.3997,2.0,0.0,0.0,4.0,2.0,11758.6812,0.0,25.0,0.0,4044.1285,2172.4,0.0,1.6,0.0,0.0,0.0,0.0,0.0,800,1024.0,3.0,4.714,Fortnightly,29.0,13334.12,1000.0,,0.0,0.0,0.0,0.0,12595.17,879.0,9311.0966,341.33,QuickCash,,5115901,0.0,26-04-2023,False,Moving - Cleaning,2023-04-22,Orange,6.0,13291.0,13334.12
0062x00000DGEKvAAP,0012x00000go133AAA,Coburg,VIC,Australia,Loan Paid,New Client-New Loan,0.0,43.93,625.93,1.0,0.0,0.0,4.0,1.0,9628.341,4.0,26.0,971.5185,2215.8375,2091.85,0.0,0.0,0.0,0.0,8666.67,400.0,0.0,1000,1360.0,14.0,13.857,Weekly,49.0,10725.01,400.0,Full-Time Employment,6.0,0.0,0.6044,6.0,8863.35,958.0,958.21,97.14,QuickCash,0.0,4710592,2.0,19-02-2023,False,Living Expenses,2023-02-19,Green,0.0,10021.0,10725.01
0062x00000E5Ai0AAF,0012x00000gp89qAAA,Maddington,WA,Australia,Loan Paid,Existing Client-Granted Loan Before,0.24,87.84,1947.3699,2.0,1.0,0.0,4.0,2.0,4057.6267,12.0,24.0,0.0,1815.4566,1814.27,0.0,3.02,0.0,0.0,0.0,599.0,300.0,800,1056.0,7.0,13.0,Fortnightly,32.0,4068.63,5000.0,,12.0,0.0,0.3187,4.0,3630.9133,671.0,2497.5633,150.86,MoneySpot,0.0,5628726,7.0,16-06-2023,False,Living Expenses,2023-06-16,Orange,13.0,5206.0,4068.63
0062x00000EC2VEAA1,0012x00000dzIS5AAM,Blacktown,TAS,Australia,Loan Paid,Existing Client-Granted Loan Before,1.9,63.93,2926.2573,4.0,1.0,2.0,2.0,4.0,5464.6526,26.0,57.0,0.0,2012.5987,2304.17,0.0,0.0,0.0,0.0,5200.0,899.0,900.0,750,1020.0,7.0,13.714,Fortnightly,46.0,5464.65,750.0,Full-Time Employment,26.0,0.0,0.0,6.0,5471.8833,828.0,3180.6433,145.71,QuickCash,0.0,5851133,16.0,07-07-2023,False,Child Expenses,2023-07-06,Orange,105.0,5514.0,5464.65
0062x00000DZJfsAAH,0012x00000gpA7fAAE,Nailsworth,SA,Australia,Loan Paid,Existing Client-Granted Loan Before,0.0,92.06,3545.7486,1.0,0.0,0.0,2.0,1.0,6294.2284,0.0,29.0,0.0,1244.4033,1657.45,0.0,7.02,0.0,0.0,260000.0,1499.0,550.0,700,896.0,6.0,6.143,Weekly,29.0,6294.23,700.0,Part-Time Employment,0.0,0.0,0.0,0.0,4977.6133,178.0,5323.38,149.33,Financier-2,0.0,5086401,0.0,18-04-2023,False,Living Expenses,2023-04-18,Green,0.0,6243.0,6294.23
0062x00000D79D8AAJ,0010K00001c8QUBQA2,Leanyer,NT,Australia,Loan Paid,Existing Client-Granted Loan Before,0.0,80.05,460.9699,1.0,0.0,0.0,2.0,1.0,4045.9854,0.0,78.0,0.0,1064.15,1064.15,1.0,0.0,0.0,0.0,3683.33,400.0,1000.0,800,1088.0,14.0,13.714,Weekly,41.0,4045.99,800.0,Full-Time Employment,0.0,0.0,0.1868,0.0,4256.6,827.0,2310.8166,77.71,MoneySpot,0.0,4469763,0.0,13-01-2023,False,Vehicle Expenses,2023-01-13,Green,0.0,6029.0,4045.99
0062x00000DHUCQAA5,0012x00000deShSAAU,Burleigh Waters,QLD,Australia,Loan Paid,Existing Client-No Loan Granted Ever,0.0,61.99,925.2166,1.0,0.0,0.0,4.0,1.0,4032.75,0.0,26.0,0.0,1008.1875,1001.0,0.0,0.0,0.0,0.0,940.0,400.0,1200.0,700,896.0,6.0,6.0,Weekly,25.0,4983.27,1000.0,Contract Employment,0.0,0.0,0.011,0.0,4032.75,0.0,1470.93,149.33,MoneySpot,0.0,4781783,0.0,02-03-2023,False,Living Expenses,2023-03-02,Orange,0.0,8105.0,4983.27
0062x00000DVIpLAAX,0012x00000Zv8KnAAJ,Sylvania,NSW,Australia,Loan Paid,Existing Client-Granted Loan Before,0.0,90.49,598.3809,1.0,0.0,0.0,3.0,1.0,10850.4785,8.0,24.0,0.0,1646.404,2235.22,1.0,0.0,0.0,1.0,6500.0,599.0,500.0,800,1088.0,14.0,14.0,Weekly,55.0,10850.48,800.0,Part-Time Employment,8.0,0.0,0.0769,2.0,3696.4633,311.0,560.84,77.71,Financier-2,0.0,5436620,7.0,30-05-2023,False,Other Expenses,2023-05-29,Orange,0.0,6453.0,10850.48
0062x00000DZaXjAAL,0012x00000ZwJwOAAV,Blacktown,NSW,Australia,Loan Paid,Existing Client-Granted Loan Before,12.38,63.45,1263.6433,4.0,0.0,4.0,4.0,4.0,4659.8163,1.0,11.0,0.0,998.8975,930.11,0.0,2.09,0.0,0.0,1967.33,400.0,0.0,1000,1320.0,6.0,11.857,Fortnightly,41.0,8115.85,1000.0,Unemployed,1.0,0.0,0.0,0.0,2663.7266,427.0,1955.45,220.0,Financier-2,0.0,5101423,0.0,20-04-2023,True,Vehicle Expenses,2023-04-20,Orange,2664.0,21511.0,8115.85
0062x00000DsVECAA3,0012x00000hZWODAA4,Aitkenvale,QLD,Australia,Loan Paid,New Client-New Loan,0.0,91.84,1458.1843,2.0,0.0,0.0,3.0,2.0,7080.1751,4.0,14.0,0.0,3199.38,3199.38,0.0,0.51,0.0,0.0,0.0,0.0,600.0,1000,1280.0,3.0,5.0,Fortnightly,50.0,7451.56,1000.0,,6.0,0.0,0.2418,3.0,6398.76,0.0,1362.0566,426.67,QuickCash,0.0,5244588,4.0,11-05-2023,False,Vehicle - Repairs,2023-05-11,Green,0.0,6929.0,7451.56
0062x00000EbaqgAAB,0012x00000ha7goAAA,Mackay,QLD,Australia,Loan Paid,Existing Client-No Loan Granted Ever,0.66,70.15,401.66,1.0,0.0,0.0,3.0,1.0,1553.4977,1.0,10.0,0.0,298.4962,66.6,2.0,0.0,0.0,0.0,0.0,1499.0,0.0,1000,1400.0,5.0,20.714,Monthly,40.0,5526.2,2500.0,,1.0,0.0,0.0769,0.0,4116.83,0.0,555.6933,280.0,MoneySpot,0.0,6301072,0.0,23-08-2023,False,Vehicle Expenses,2023-08-23,Orange,14.0,2112.0,5526.2
0062x00000E4tC2AAJ,0012x00000Gb78MAAR,Kingsbury,VIC,Australia,Loan Paid,Existing Client-Granted Loan Before,0.0,83.11,0.0,2.0,0.0,0.0,2.0,2.0,7955.4933,0.0,0.0,0.0,1050.0,1050.0,0.0,0.25,0.0,1.0,3751.06,899.0,360.0,600,816.0,8.0,15.0,Fortnightly,30.0,7955.49,2050.0,Part-Time Employment,0.0,0.0,0.0,0.0,0.0,257.0,416.3966,102.0,MoneySpot,0.0,5605646,0.0,15-06-2023,False,Vehicle Expenses,2023-06-14,Orange,0.0,8057.0,7955.49
0062x00000FVF6AAAX,0012x00000gpVeOAAU,Braitling,NT,Australia,Loan Paid,Existing Client-Granted Loan Before,0.0,54.13,5455.4977,2.0,0.0,0.0,4.0,2.0,10701.0192,0.0,63.0,351.8483,1949.8783,2140.78,1.0,0.0,0.0,0.0,5239.16,599.0,0.0,1000,1360.0,7.0,14.286,Fortnightly,46.0,11422.69,2050.0,Full-Time Employment,0.0,0.0,0.967,0.0,5188.2866,1038.0,5901.27,194.29,MoneySpot,0.0,7576782,0.0,20-12-2023,False,Vehicle Expenses,2023-12-20,Orange,0.0,12097.0,11422.69
0062x00000D9kc4AAB,0012x00000GeJptAAF,Claymore,NSW,Australia,Loan Paid,Existing Client-Granted Loan Before,0.0,61.22,2196.47,4.0,0.0,0.0,3.0,4.0,4767.7499,2.0,64.0,712.6625,1410.3611,1036.5,0.0,1.11,0.0,1.0,0.0,599.0,1240.0,1000,1360.0,14.0,14.143,Weekly,65.0,4767.75,1000.0,,2.0,0.0,0.0659,2.0,0.0,1837.0,2337.9266,97.14,MoneySpot,0.0,4596330,2.0,01-02-2023,False,Living Expenses,2023-02-01,Orange,0.0,6312.0,4767.75
0062x00000DXFdNAAX,0012x000002aKIRAA2,Acacia Creek,NSW,Australia,Loan Paid,Existing Client-Granted Loan Before,32.85,82.29,2488.1548,2.0,0.0,2.0,3.0,2.0,6139.029,7.0,60.0,335.4741,1312.3466,983.01,0.0,0.0,0.0,0.0,0.0,599.0,1800.0,600,768.0,3.0,5.0,Fortnightly,36.0,6146.03,750.0,,7.0,0.0,0.989,0.0,4451.2766,751.0,3093.6466,256.0,MoneySpot,0.0,4962716,6.0,30-03-2023,False,Other Expenses,2023-03-30,Orange,1872.0,5697.0,6146.03
0062x00000DWePHAA1,0012x00000g8GmmAAE,Caboolture,QLD,Australia,Loan Paid,Existing Client-Granted Loan Before,0.0,82.54,853.9701,1.0,0.0,0.0,3.0,1.0,4483.7634,4.0,6.0,0.0,884.4687,838.0,0.0,0.0,0.0,0.0,900.0,400.0,600.0,1000,1320.0,10.0,9.857,Weekly,19.0,5054.12,1000.0,Full-Time Employment,8.0,0.0,0.0879,2.0,4717.1666,213.0,1079.02,132.0,QuickCash,0.0,4927312,8.0,24-03-2023,False,Relocation Expenses,2023-03-24,Orange,0.0,5465.0,5054.12
0062x00000ECIWtAAP,0012x00000goPoeAAE,Valentine,NSW,Australia,Loan Paid,Existing Client-Granted Loan Before,0.0,69.4,3287.706,1.0,0.0,0.0,2.0,1.0,7310.0398,0.0,49.0,0.0,1258.3523,1210.47,0.0,0.11,0.0,0.0,5200.0,400.0,800.0,750,990.0,10.0,10.429,Weekly,37.0,8148.37,750.0,Part-Time Employment,0.0,0.0,0.8571,0.0,5452.86,907.0,3870.7333,99.0,MoneySpot,0.0,5869443,0.0,09-07-2023,False,Vehicle Expenses,2023-07-09,Green,0.0,15417.0,8148.37
0062x00000DY4WsAAL,0012x00000WWU3oAAH,Mildura,VIC,Australia,Loan Paid,Existing Client-Granted Loan Before,0.0,85.96,369.3866,2.0,2.0,0.0,3.0,2.0,2918.9893,3.0,13.0,128.5,1082.1,1082.1,0.0,14.87,0.0,0.0,1456.97,599.0,260.0,800,1056.0,5.0,9.0,Fortnightly,26.0,6350.33,800.0,Part-Time Employment,4.0,0.0,0.1429,3.0,1082.1,280.0,2231.0166,211.2,Financier-2,0.0,5010630,2.0,06-04-2023,False,Medical Expenses,2023-04-06,Orange,0.0,6502.0,6350.33
0062x00000D870AAAR,0012x00000bm2TDAAY,Mirrabooka,WA,Australia,Loan Paid,Existing Client-Granted Loan Before,0.0,85.09,1042.22,3.0,0.0,0.0,4.0,3.0,6885.0581,4.0,36.0,1338.8608,5409.3333,4428.0,2.0,2.7,0.0,0.0,7150.0,899.0,2200.0,1000,1320.0,3.0,12.143,Monthly,42.0,6885.06,1500.0,Full-Time Employment,5.0,0.0,0.0,0.0,6651.2066,957.0,1955.72,440.0,QuickCash,0.0,4515340,2.0,20-01-2023,False,Travel Expenses,2023-01-20,Orange,0.0,8971.0,6885.06
0062x00000Ec3wjAAB,0012x00000g9f52AAA,Dandenong,VIC,Australia,Loan Paid,Existing Client-Granted Loan Before,0.0,98.54,2332.4596,1.0,1.0,0.0,5.0,1.0,6735.5991,18.0,45.0,0.0,1023.8661,961.21,0.0,1.07,0.0,0.0,0.0,400.0,600.0,800,1088.0,14.0,14.143,Weekly,47.0,6852.27,5000.0,Full-Time Employment,18.0,0.0,0.044,2.0,4436.7533,943.0,3258.0233,77.71,MoneySpot,0.0,6327838,9.0,25-08-2023,False,Vehicle Expenses,2023-08-25,Orange,0.0,7766.0,6852.27
0062x00000DWrcAAAT,0012x00000g9esSAAQ,Killarney Vale,NSW,Australia,Loan Paid,Existing Client-Granted Loan Before,0.0,53.48,139.0467,1.0,0.0,0.0,3.0,1.0,3820.2907,6.0,32.0,0.0,879.1907,929.3,0.0,0.3,0.0,0.0,1080.0,899.0,720.0,1000,1320.0,9.0,9.429,Weekly,28.0,4906.6,1000.0,Full-Time Employment,20.0,0.0,0.044,2.0,4893.16,128.0,1436.69,146.67,QuickCash,0.0,4941919,14.0,27-03-2023,False,Vehicle Expenses,2023-03-27,Green,0.0,6981.0,4906.6
0062x00000DAGBDAA5,0012x00000WYiuXAAT,Douglas,QLD,Australia,Closed Lost,Existing Client-Granted Loan Before,0.0,46.41,2007.8382,2.0,0.0,0.0,2.0,2.0,4994.715,0.0,17.0,0.0,2298.9366,2240.92,0.0,0.0,0.0,0.0,1809.77,400.0,720.0,1000,1360.0,7.0,13.429,Fortnightly,21.0,9288.81,1000.0,Full-Time Employment,3.0,0.0,0.044,1.0,2298.9366,0.0,2227.1733,194.29,MoneySpot,,4621462,0.0,06-02-2023,False,Living Expenses,2023-02-05,Green,0.0,5024.0,9288.81
0062x00000F8hnkAAB,0012x00000LQgSvAAL,Coorparoo,QLD,Australia,Loan Paid,Existing Client-Granted Loan Before,17.32,62.8,2191.5938,2.0,1.0,0.0,3.0,2.0,3161.8155,18.0,97.0,0.0,1455.3016,1820.41,0.0,17.23,0.0,0.0,50000.0,599.0,110.0,750,1020.0,8.0,15.143,Fortnightly,28.0,3978.56,750.0,Casual Employment,18.0,0.0,0.1758,4.0,2910.6033,375.0,2752.56,127.5,QuickCash,0.0,6872269,3.0,18-10-2023,False,Vehicle Expenses,2023-10-18,Orange,978.0,5646.0,3978.56
0062x00000E7HRXAA3,0012x00000SFyptAAD,Hampton,VIC,Australia,Loan Paid,Existing Client-Granted Loan Before,1.34,58.57,2284.9181,4.0,0.0,0.0,3.0,4.0,7167.6133,12.0,90.0,0.0,1534.938,1500.0,0.0,0.27,0.0,0.0,1427.0,400.0,2100.0,1000,1360.0,14.0,14.429,Weekly,37.0,7298.69,2050.0,Full-Time Employment,12.0,0.0,0.989,1.0,5116.46,1201.0,5362.1766,97.14,QuickCash,0.0,5809921,5.0,03-07-2023,False,Life Event Expenses,2023-07-03,Orange,126.0,9382.0,7298.69
0062x00000D6suRAAR,0012x00000g9iUcAAI,Chipping Norton,NSW,Australia,Loan Paid,New Client-New Loan,0.0,78.47,844.7933,1.0,0.0,0.0,2.0,1.0,5131.1304,23.0,43.0,896.364,1180.8633,1330.47,0.0,0.0,0.0,0.0,0.0,0.0,150.0,1000,1280.0,6.0,6.0,Weekly,35.0,11531.62,2000.0,,23.0,0.0,0.3626,15.0,2361.7266,845.0,844.7933,213.33,MoneySpot,0.0,4457659,23.0,11-01-2023,False,Travel costs,2023-01-11,Orange,0.0,7446.0,11531.62
0062x00000DWiTXAA1,0012x00000g9DKZAA2,Balga,WA,Australia,Loan Paid,Existing Client-Granted Loan Before,0.0,89.57,3125.278,2.0,1.0,0.0,5.0,2.0,5790.0451,6.0,38.0,1401.3113,2665.0071,2676.5,1.0,0.3,0.0,0.0,4333.33,599.0,280.0,1000,1280.0,4.0,7.857,Fortnightly,25.0,6218.35,1000.0,Part-Time Employment,6.0,0.0,0.0659,4.0,6218.35,1480.0,4202.13,320.0,MoneySpot,0.0,4932348,6.0,25-03-2023,False,Vehicle Expenses,2023-03-25,Green,0.0,6353.0,6218.35
0062x00000F3EJLAA3,0012x00000gq522AAA,Clarkson,WA,Australia,Loan Paid,Existing Client-Granted Loan Before,0.0,47.02,1457.9555,1.0,0.0,0.0,3.0,1.0,4135.5899,6.0,45.0,0.0,951.7523,926.3,0.0,6.71,0.0,0.0,0.0,599.0,1000.0,1000,1360.0,16.0,16.0,Weekly,39.0,4141.59,2050.0,,6.0,0.0,0.7912,2.0,4124.26,704.0,1500.4633,85.0,MoneySpot,0.0,7031765,3.0,02-11-2023,False,Life Event Expenses,2023-11-01,Orange,0.0,4231.0,4141.59
0062x00000D9fiRAAR,0010K000025x7mkQAA,Dundas,NSW,Australia,Loan Paid,Existing Client-No Loan Granted Ever,0.0,96.48,1847.9918,4.0,0.0,0.0,3.0,4.0,6580.5395,1.0,59.0,256.0,994.2181,1130.0,1.0,12.74,0.0,1.0,996.67,1500.0,500.0,700,896.0,6.0,6.143,Weekly,29.0,6580.54,2500.0,Full-Time Employment,1.0,0.0,0.022,1.0,1108.3333,206.0,1331.5033,149.33,MoneySpot,0.0,4593539,0.0,01-02-2023,False,Motorbike,2023-02-01,Orange,0.0,7459.0,6580.54
0062x00000ENvgeAAD,0010K00001iKFYzQAO,Thursday Island,QLD,Australia,Loan Paid,Existing Client-Granted Loan Before,22.63,89.92,599.7838,4.0,0.0,0.0,1.0,4.0,116.6666,0.0,22.0,367.85,87.5,100.0,1.0,1.91,0.0,1.0,2795.0,400.0,610.0,800,1152.0,12.0,23.286,Fortnightly,51.0,7163.6,1000.0,Unemployed,0.0,0.0,0.044,0.0,0.0,596.0,1308.88,96.0,MoneySpot,0.0,6217510,0.0,15-08-2023,False,Travel Expenses,2023-08-15,Orange,1996.0,8817.0,7163.6
0062x00000D2N8LAAV,0012x00000XP7FCAA1,Hoppers Crossing,VIC,Australia,Loan Paid,Existing Client-Granted Loan Before,0.0,79.47,884.9758,4.0,0.0,0.0,7.0,4.0,18717.0015,3.0,11.0,0.0,525.6075,100.0,0.0,90.53,0.0,1.0,3844.37,1499.0,1200.0,1000,1360.0,14.0,14.429,Weekly,32.0,18870.33,2000.0,Full-Time Employment,3.0,0.0,0.022,3.0,4862.6433,310.0,516.3133,97.14,MoneySpot,0.0,4442225,3.0,09-01-2023,False,Furniture or Appliances,2023-01-09,Orange,0.0,19272.0,18870.33
0062x00000DrbhLAAR,0012x00000hYxOtAAK,Dandenong North,VIC,Australia,Closed Lost,New Client-New Loan,0.0,35.43,401.1593,2.0,0.0,0.0,5.0,2.0,10927.0665,0.0,12.0,0.0,4075.5566,4500.0,0.0,0.0,0.0,1.0,0.0,0.0,2000.0,1000,1320.0,7.0,13.0,Fortnightly,34.0,13106.56,5000.0,,0.0,0.0,0.0,0.0,2218.3733,0.0,369.2866,188.57,MoneySpot,,5178996,0.0,06-05-2023,False,Car Other,2023-05-02,Orange,0.0,14798.0,13106.56
0062x00000DrigAAAR,0012x00000SIBEUAA5,North Gosford,NSW,Australia,Loan Paid,Existing Client-Granted Loan Before,0.0,50.28,2571.746,1.0,0.0,0.0,2.0,1.0,5431.8083,0.0,61.0,736.0833,1250.06,1250.06,1.0,0.4,0.0,0.0,5221.06,899.0,800.0,1000,1360.0,14.0,14.0,Weekly,25.0,6445.14,2050.0,Full-Time Employment,0.0,0.0,0.0,0.0,5416.9266,919.0,2926.43,97.14,MoneySpot,0.0,5186869,0.0,03-05-2023,False,Furniture or Appliances,2023-05-03,Orange,0.0,14651.0,6445.14
0062x00000EdhcqAAB,0012x00000lGz3WAAS,Blacktown,NSW,Australia,Closed Lost,New Client-New Loan,0.31,0.52,154.63,1.0,0.0,2.0,4.0,1.0,4443.9206,0.0,7.0,0.0,1019.4108,1133.51,1.0,2.67,0.0,0.0,1100.0,2000.0,800.0,1000,1360.0,14.0,14.286,Weekly,38.0,4443.92,1600.0,Full-Time Employment,0.0,0.0,0.0,0.0,4090.8433,0.0,162.6666,97.14,QuickCash,,6438676,0.0,10-09-2023,False,Medical Expenses,2023-09-06,Orange,13.0,4191.0,4443.92
0062x00000DFfGDAA1,0012x00000OwY2LAAV,Indooroopilly,QLD,Australia,Loan Paid,Existing Client-No Loan Granted Ever,0.0,84.83,50.0,3.0,0.0,0.0,5.0,3.0,2378.5666,0.0,14.0,142.5984,2270.0,2270.0,0.0,0.0,0.0,1.0,4333.33,599.0,0.0,800,1088.0,4.0,16.857,Monthly,51.0,2895.67,800.0,Contract Employment,0.0,0.0,0.044,0.0,0.0,50.0,533.0,272.0,MoneySpot,0.0,4680275,0.0,14-02-2023,False,Medical Expenses,2023-02-14,Orange,0.0,6223.0,2895.67
0062x00000E6DWdAAN,0012x00000iK7nmAAC,Bulimba,QLD,Australia,Loan Paid,New Client-New Loan,9.84,65.35,0.0,2.0,0.0,2.0,3.0,2.0,6000.1954,1.0,22.0,0.0,2432.49,2289.77,0.0,0.0,0.0,1.0,0.0,0.0,1920.0,800,1088.0,7.0,13.571,Fortnightly,34.0,6000.2,3150.0,,1.0,0.0,0.011,0.0,689.2333,0.0,0.0,155.43,MoneySpot,0.0,5719909,0.0,26-06-2023,False,Once off purchase,2023-06-26,Orange,730.0,7418.0,6000.2
0062x00000ECr0hAAD,0012x00000dAt3GAAS,Rocherlea,TAS,Australia,Closed Lost,Existing Client-Granted Loan Before,0.74,97.43,4330.5041,2.0,1.0,0.0,4.0,2.0,4195.6216,10.0,50.0,0.0,1848.44,1848.44,1.0,20.42,0.0,0.0,3690.5,899.0,250.0,800,1120.0,10.0,20.286,Fortnightly,25.0,10994.97,4000.0,Full-Time Employment,10.0,0.0,0.0989,10.0,1848.44,1124.0,4626.5533,112.0,MoneySpot,,5903038,7.0,14-07-2023,False,Travel Expenses,2023-07-13,Orange,68.0,9136.0,10994.97
0062x00000DFBxeAAH,0012x00000PwFHyAAN,Preston,VIC,Australia,Loan Paid,Existing Client-Granted Loan Before,0.0,85.51,3672.884,2.0,0.0,0.0,3.0,2.0,4457.039,0.0,53.0,384.0,1977.5085,2123.72,0.0,0.0,0.0,0.0,3607.5,400.0,1521.0,800,1088.0,7.0,13.857,Fortnightly,42.0,4457.04,800.0,Full-Time Employment,0.0,0.0,0.044,0.0,4614.1866,1232.0,4057.74,155.43,Financier-2,0.0,4654929,0.0,10-02-2023,False,Living Expenses,2023-02-10,Orange,0.0,5055.0,4457.04
0062x00000DY4UrAAL,0010K0000242pxOQAQ,Banyo,QLD,Australia,Loan Paid,Existing Client-Granted Loan Before,0.46,66.93,1189.8247,1.0,0.0,0.0,3.0,1.0,2804.228,0.0,60.0,344.8522,645.3572,274.08,1.0,0.29,1.0,0.0,4116.67,400.0,944.0,950,1216.0,8.0,8.0,Weekly,58.0,3238.75,3000.0,Full-Time Employment,0.0,0.0,0.0,0.0,2732.9766,217.0,1682.7433,152.0,MoneySpot,0.0,5010614,0.0,06-04-2023,False,Living Expenses,2023-04-06,Green,13.0,2791.0,3238.75
0062x00000DZ34LAAT,0012x00000g93hNAAQ,Mirani,QLD,Australia,Loan Paid,Existing Client-Granted Loan Before,0.0,68.68,5164.2694,1.0,0.0,0.0,2.0,1.0,19679.2861,2.0,31.0,0.0,1559.0369,1667.73,0.0,4.78,0.0,0.0,0.0,400.0,100.0,750,960.0,6.0,5.714,Weekly,37.0,21632.1,2200.0,Full-Time Employment,2.0,0.0,0.7802,2.0,8922.4933,3849.0,7492.3666,160.0,MoneySpot,0.0,5068516,2.0,15-04-2023,False,Vehicle Expenses,2023-04-15,Green,0.0,24608.0,21632.1
0062x00000DY9lhAAD,0012x00000SHwXkAAL,Bowen,QLD,Australia,Loan Paid,Existing Client-Granted Loan Before,0.0,76.31,1523.8707,1.0,1.0,0.0,3.0,1.0,5039.1171,7.0,43.0,1476.1005,1136.29,2141.48,2.0,0.2,0.0,0.0,6500.0,899.0,1680.0,1000,1360.0,14.0,13.857,Weekly,33.0,7945.06,2050.0,Full-Time Employment,8.0,0.0,0.1429,4.0,1136.29,2133.0,2517.8733,97.14,QuickCash,0.0,5016003,6.0,08-04-2023,False,Vehicle Expenses,2023-04-08,Green,0.0,6888.0,7945.06
0062x00000EBvvhAAD,0012x00000INKHQAA5,Little Mountain,QLD,Australia,Loan Paid,Existing Client-Granted Loan Before,0.96,99.66,371.8194,1.0,0.0,0.0,2.0,1.0,3956.3718,0.0,20.0,0.0,910.5076,880.36,0.0,0.0,0.0,0.0,9001.99,899.0,1100.0,750,1020.0,14.0,13.857,Weekly,54.0,5044.79,750.0,Full-Time Employment,0.0,0.0,0.0,0.0,5114.4666,227.0,614.1433,72.86,MoneySpot,0.0,5844763,0.0,07-07-2023,False,Furniture or Appliances,2023-07-07,Orange,39.0,4038.0,5044.79
0062x00000FWJ5eAAH,0012x00000n3MD3AAM,Werribee,VIC,Australia,Closed Lost,New Client-New Loan,0.0,85.89,0.0,4.0,0.0,0.0,3.0,4.0,4326.6666,4.0,11.0,0.0,1180.0,1400.0,0.0,0.0,0.0,0.0,0.0,0.0,1000.0,600,792.0,10.0,9.714,Weekly,27.0,4326.67,5000.0,full_time,4.0,0.0,0.1319,0.0,3933.3333,0.0,0.0,79.2,MoneySpot,,7659926,0.0,28-12-2023,False,car_purchase,2023-12-27,Orange,0.0,4447.0,4326.67
0062x00000D9lPLAAZ,0012x00000INKF5AAP,Hallam,VIC,Australia,Loan Paid,Existing Client-Granted Loan Before,4.29,45.7,3221.0516,2.0,0.0,0.0,3.0,2.0,4776.1497,0.0,32.0,339.378,2198.3385,1488.03,1.0,0.45,0.0,0.0,2319.75,599.0,600.0,1000,1360.0,7.0,14.143,Fortnightly,35.0,4776.15,1000.0,Part-Time Employment,1.0,0.0,0.0,1.0,5129.4566,1257.0,3985.3933,194.29,MoneySpot,0.0,4596931,1.0,01-02-2023,False,Living Expenses,2023-02-01,Green,250.0,5819.0,4776.15
0062x00000FL8BVAA1,0012x00000ADg6hAAD,Cabramatta,NSW,Australia,Loan Paid,Existing Client-Granted Loan Before,0.74,89.85,286.7835,1.0,0.0,0.0,3.0,1.0,5699.6554,0.0,10.0,0.0,997.4353,993.0,0.0,3.11,0.0,1.0,2600.0,599.0,800.0,1000,1360.0,14.0,13.857,Weekly,46.0,5699.66,1000.0,Unemployed,0.0,0.0,0.0,0.0,0.0,220.0,220.0,97.14,QuickCash,0.0,7438238,0.0,08-12-2023,False,Furniture or Appliances,2023-12-08,Orange,45.0,6015.0,5699.66
0062x00000DH5nAAAT,0012x00000flqpgAAA,Greenwith,SA,Australia,Closed Lost,Existing Client-No Loan Granted Ever,38.79,58.73,285.5966,2.0,0.0,2.0,5.0,2.0,6782.9344,0.0,12.0,0.0,1212.084,1250.4,2.0,0.0,0.0,0.0,6933.33,599.0,2000.0,800,1024.0,3.0,4.714,Fortnightly,33.0,8107.6,3000.0,Part-Time Employment,9.0,0.0,0.0,2.0,4682.96,0.0,603.9566,341.33,MoneySpot,,4761448,0.0,03-03-2023,False,Other Expenses,2023-02-26,Orange,3122.0,8048.0,8107.6
0062x00000DH5xUAAT,0012x00000fmhEtAAI,Arncliffe,NSW,Australia,Closed Lost,Existing Client-No Loan Granted Ever,0.0,74.07,1163.9089,1.0,3.0,0.0,1.0,1.0,4590.7786,17.0,33.0,78.72,1001.0,1001.0,0.0,29.55,0.0,0.0,4333.33,400.0,0.0,650,832.0,6.0,6.429,Weekly,28.0,12503.43,650.0,Full-Time Employment,17.0,0.0,0.2308,12.0,1001.0,193.0,1330.8766,138.67,MoneySpot,,4761603,11.0,27-02-2023,False,Medical Expenses,2023-02-26,Orange,0.0,15340.0,12503.43
0062x00000D7dt7AAB,0012x00000gA56SAAS,Saint Marys,NSW,Australia,Loan Paid,New Client-New Loan,0.0,78.35,579.2185,1.0,0.0,0.0,4.0,1.0,4940.5122,1.0,13.0,579.2202,1136.9946,804.8,0.0,0.0,0.0,0.0,4333.33,0.0,0.0,1000,1280.0,6.0,6.429,Weekly,22.0,5267.18,1000.0,Casual Employment,1.0,0.0,0.011,1.0,4926.9766,578.0,1707.32,213.33,MoneySpot,0.0,4493333,1.0,17-01-2023,False,Other Expenses,2023-01-17,Green,0.0,5499.0,5267.18
0062x00000DGExlAAH,0010K000029KU8UQAW,Wellard,WA,Australia,Closed Lost,Existing Client-No Loan Granted Ever,12.16,53.99,0.0,1.0,0.0,2.0,3.0,1.0,5312.9366,0.0,0.0,0.0,1001.0,1001.0,0.0,0.0,0.0,0.0,0.0,2000.0,0.0,1000,1280.0,6.0,6.714,Weekly,52.0,5312.94,1000.0,,0.0,0.0,0.0,0.0,5301.02,0.0,26.6666,213.33,QuickCash,,4711172,0.0,18-02-2023,False,Living Expenses,2023-02-18,Orange,963.0,7913.0,5312.94
0062x00000DFR4kAAH,0012x00000gnZaEAAU,Narwee,NSW,Australia,Loan Paid,New Client-New Loan,0.0,78.06,0.0,2.0,0.0,0.0,1.0,2.0,10912.0833,0.0,1.0,0.0,5306.0416,4299.54,0.0,0.0,0.0,1.0,8666.67,400.0,1260.0,800,1088.0,7.0,13.286,Fortnightly,54.0,10912.08,800.0,Full-Time Employment,0.0,0.0,0.0,0.0,0.0,0.0,0.0,155.43,MoneySpot,0.0,4667938,0.0,12-02-2023,False,Living Expenses,2023-02-12,Orange,0.0,33565.0,10912.08
0062x00000DVVhWAAX,0012x00000iHTdDAAW,Blacktown,VIC,Australia,Closed Lost,New Client-New Loan,0.28,93.75,622.6765,0.0,0.0,0.0,0.0,0.0,3228.6466,0.0,3.0,0.0,0.0,0.0,1.0,0.07,0.0,0.0,6303.0,1500.0,1000.0,700,924.0,3.0,10.857,Monthly,29.0,9453.28,3100.0,Full-Time Employment,0.0,0.0,0.0,0.0,6224.63,0.0,1656.8333,308.0,MoneySpot,,5452643,0.0,31-05-2023,False,Living Expenses,2023-05-31,Orange,13.0,4600.0,9453.28
0062x00000D8s35AAB,0012x00000dbHRFAA2,Wheelers Hill,VIC,Australia,Loan Paid,Existing Client-Granted Loan Before,0.0,80.78,2403.7232,4.0,1.0,0.0,1.0,4.0,7622.5433,6.0,51.0,1236.2285,5716.9075,57.57,1.0,1.5,0.0,0.0,0.0,899.0,1890.0,1000,1360.0,4.0,15.714,Monthly,21.0,7955.88,1000.0,Full-Time Employment,6.0,0.0,0.2637,0.0,7622.5433,1866.0,4961.6166,340.0,MoneySpot,0.0,4553847,5.0,26-01-2023,False,Living Expenses,2023-01-25,Orange,0.0,10633.0,7955.88
0062x00000E6md9AAB,0012x00000iKRDYAA4,Shepparton,VIC,Australia,Loan Paid,New Client-New Loan,11.09,43.41,282.4369,2.0,0.0,4.0,3.0,2.0,5118.6106,7.0,11.0,72.5378,2001.1716,1895.63,3.0,0.22,0.0,0.0,4116.67,400.0,1400.0,800,1056.0,7.0,13.0,Fortnightly,33.0,5194.69,800.0,Full-Time Employment,7.0,0.0,0.0,0.0,4759.3333,81.0,798.1166,150.86,QuickCash,0.0,5768948,0.0,29-06-2023,False,Living Expenses,2023-06-29,Orange,562.0,5065.0,5194.69
0062x00000D9uvBAAR,0012x00000g8GZwAAM,Erina,NSW,Australia,Loan Paid,Existing Client-No Loan Granted Ever,0.0,63.61,927.5744,1.0,0.0,0.0,4.0,1.0,4216.6585,3.0,61.0,613.14,1090.6283,1010.26,1.0,0.44,0.0,0.0,5021.29,1499.0,200.0,700,896.0,6.0,6.143,Weekly,22.0,7339.66,700.0,Full-Time Employment,3.0,0.0,0.1758,3.0,4362.5133,323.0,573.28,149.33,MoneySpot,0.0,4603972,0.0,02-02-2023,False,Living Expenses,2023-02-02,Green,0.0,9450.0,7339.66
0062x00000D7JUKAA3,0012x00000g9utKAAQ,South Perth,WA,Australia,Loan Paid,New Client-New Loan,0.0,31.98,1028.9873,2.0,0.0,0.0,2.0,2.0,10368.8644,0.0,27.0,256.0,3526.8433,3468.18,2.0,7.03,1.0,0.0,7514.0,899.0,1200.0,750,960.0,3.0,4.571,Fortnightly,44.0,10303.7,750.0,Full-Time Employment,0.0,0.0,0.0,0.0,7053.6866,171.0,1066.8466,320.0,Financier-2,0.0,4478015,0.0,14-01-2023,False,Vehicle Expenses,2023-01-14,Green,0.0,11247.0,10303.7
0062x00000DG02hAAD,0012x00000WYIReAAP,Alice River,QLD,Australia,Loan Paid,Existing Client-Granted Loan Before,0.0,67.33,580.7812,0.0,0.0,0.0,0.0,0.0,0.0,9.0,73.0,231.5143,0.0,0.0,0.0,0.07,0.0,0.0,3706.51,899.0,400.0,700,952.0,14.0,13.857,Weekly,22.0,3798.9,700.0,Full-Time Employment,9.0,0.0,0.2418,1.0,0.0,827.0,1912.0933,68.0,Financier-2,0.0,4697190,4.0,16-02-2023,False,Home Maintenance & Repairs,2023-02-16,Orange,0.0,4055.0,3798.9
0062x00000DGi5jAAD,0012x00000goIYAAA2,Goodna,QLD,Australia,Loan Paid,New Client-New Loan,0.0,94.6,876.5648,4.0,0.0,0.0,1.0,4.0,349.9998,2.0,2.0,0.0,155.0,50.0,0.0,0.0,0.0,1.0,0.0,0.0,450.0,1000,1280.0,6.0,6.0,Weekly,32.0,8685.17,1000.0,,6.0,0.0,0.044,6.0,5462.4066,0.0,779.2866,213.33,QuickCash,0.0,4736538,0.0,23-02-2023,False,Car,2023-02-22,Orange,0.0,3974.0,8685.17
0062x00000DHcihAAD,0012x00000gAeszAAC,Morayfield,QLD,Australia,Loan Paid,Existing Client-Granted Loan Before,0.0,94.63,11013.641,2.0,0.0,0.0,4.0,2.0,6165.0998,0.0,58.0,1419.1305,2302.3371,2305.77,0.0,0.0,0.0,0.0,2305.0,400.0,1478.0,550,748.0,7.0,14.0,Fortnightly,59.0,6165.1,550.0,Full-Time Employment,0.0,0.0,1.0,0.0,5417.12,1274.0,12193.0266,106.86,Financier-2,0.0,4787663,0.0,03-03-2023,False,Medical Expenses,2023-03-02,Green,0.0,6962.0,6165.1
0062x00000EzysyAAB,0010K00001zHEJnQAO,Fairfield West,NSW,Australia,Loan Paid,Existing Client-Granted Loan Before,0.0,68.85,1884.8322,2.0,3.0,0.0,3.0,2.0,6461.23,20.0,46.0,544.4583,2973.9371,3416.94,1.0,0.85,0.0,0.0,3900.0,599.0,550.0,1000,1360.0,8.0,15.429,Fortnightly,55.0,10249.82,1000.0,Casual Employment,27.0,0.0,0.0769,12.0,10426.7733,1252.0,3357.2766,170.0,MoneySpot,0.0,6848235,9.0,16-10-2023,False,Home Maintenance & Repairs,2023-10-15,Green,0.0,7743.0,10249.82
0062x00000D7bxvAAB,0012x00000INTl8AAH,Noble Park,VIC,Australia,Loan Paid,Existing Client-Granted Loan Before,0.0,55.17,1294.03,1.0,0.0,0.0,1.0,1.0,5005.7772,22.0,88.0,393.3692,1152.0146,1157.25,1.0,0.0,0.0,0.0,4042.0,599.0,0.0,1000,1360.0,14.0,14.0,Weekly,34.0,5005.78,1000.0,Full-Time Employment,22.0,0.0,0.7802,8.0,4992.0633,952.0,1365.33,97.14,MoneySpot,0.0,4492009,9.0,17-01-2023,False,Child Expenses,2023-01-16,Orange,0.0,5020.0,5005.78
0062x00000DVyYBAA1,0012x000008Iy4rAAC,Griffith,ACT,Australia,Loan Paid,Existing Client-Granted Loan Before,0.0,38.23,758.4273,1.0,0.0,0.0,3.0,1.0,6308.9217,3.0,47.0,1266.471,1368.3,974.6,0.0,7.36,0.0,1.0,4225.0,400.0,0.0,1000,1320.0,11.0,10.714,Weekly,29.0,7589.83,1000.0,Contract Employment,3.0,0.0,0.7143,0.0,0.0,1212.0,1386.5533,120.0,QuickCash,0.0,4887359,2.0,18-03-2023,False,Medical Expenses,2023-03-18,Green,0.0,6765.0,7589.83
0062x00000DriMFAAZ,0010K00001ypmgwQAA,Halls Creek,WA,Australia,Loan Paid,Existing Client-Granted Loan Before,0.0,99.31,342.179,4.0,1.0,0.0,3.0,4.0,4230.0763,0.0,0.0,0.0,102.079,41.0,2.0,0.02,0.0,1.0,4173.0,400.0,120.0,600,816.0,7.0,14.143,Fortnightly,47.0,7050.56,600.0,Unemployed,2.0,0.0,0.0,0.0,4660.5733,264.0,447.3333,116.57,MoneySpot,0.0,5186448,2.0,03-05-2023,False,Vehicle Expenses,2023-05-03,Orange,0.0,9907.0,7050.56
0062x00000Du7xiAAB,0012x00000cKr7yAAC,Portland,VIC,Australia,Loan Paid,Existing Client-Granted Loan Before,0.0,51.42,897.5151,4.0,0.0,0.0,5.0,4.0,374.0632,2.0,10.0,910.1,106.0,60.0,0.0,3.88,0.0,1.0,3063.49,599.0,100.0,1000,1360.0,7.0,13.857,Fortnightly,29.0,3150.06,2050.0,Full-Time Employment,2.0,0.0,0.011,0.0,0.0,734.0,1303.5266,194.29,MoneySpot,0.0,5375227,2.0,24-05-2023,False,Living Expenses,2023-05-24,Green,0.0,4567.0,3150.06
0062x00000DYOKpAAP,0012x00000hXc7zAAC,Yelta,VIC,Australia,Loan Paid,New Client-New Loan,37.77,89.31,1160.9129,2.0,0.0,2.0,2.0,2.0,5820.0031,7.0,30.0,985.0872,1210.4583,1361.03,0.0,1.02,1.0,0.0,0.0,0.0,1840.0,700,896.0,3.0,6.286,Fortnightly,40.0,6083.01,700.0,,7.0,0.0,0.1648,0.0,5274.3733,1008.0,1370.3266,298.67,QuickCash,0.0,5031499,4.0,10-04-2023,False,Vet - Procedure,2023-04-10,Green,2853.0,7553.0,6083.01
0062x00000DYYCGAA5,0012x00000XKNW3AAP,POINT COOK,VIC,Australia,Loan Paid,Existing Client-Granted Loan Before,0.0,98.62,643.1233,4.0,1.0,0.0,4.0,4.0,15213.2916,0.0,5.0,164.76,1475.0,2000.0,0.0,4.84,0.0,1.0,1232.83,899.0,400.0,850,1088.0,8.0,8.286,Weekly,30.0,21642.4,850.0,Unemployed,4.0,0.0,0.022,0.0,1558.72,165.0,1244.5566,136.0,QuickCash,0.0,5039446,4.0,11-04-2023,False,Child Expenses,2023-04-11,Orange,0.0,18598.0,21642.4
0062x00000Exi3TAAR,0012x00000gobovAAA,New Town,SA,Australia,Loan Paid,Existing Client-Granted Loan Before,26.53,41.54,3167.9192,2.0,0.0,4.0,5.0,2.0,8505.396,0.0,40.0,0.0,1535.9066,1521.38,0.0,1.45,0.0,0.0,0.0,899.0,500.0,1000,1400.0,10.0,20.143,Fortnightly,33.0,14159.91,1000.0,Part-Time Employment,0.0,0.0,0.0,0.0,7641.47,220.0,5047.87,140.0,MoneySpot,0.0,6682070,0.0,29-09-2023,False,Travel Expenses,2023-09-29,Orange,3710.0,13979.0,14159.91
0062x00000DWFnTAAX,0012x00000fmX0WAAU,Nicholls Rivulet,TAS,Australia,Closed Lost,Existing Client-Granted Loan Before,43.18,67.51,665.3061,2.0,0.0,2.0,3.0,2.0,4243.3864,0.0,9.0,0.0,746.6771,717.1,0.0,0.0,0.0,0.0,0.0,400.0,200.0,800,1056.0,5.0,9.286,Fortnightly,23.0,4243.39,2050.0,,0.0,0.0,0.0,0.0,3766.1166,295.0,1329.1466,211.2,MoneySpot,,4905526,0.0,21-03-2023,True,Vehicle Expenses,2023-03-21,Orange,2591.0,6000.0,4243.39
0062x00000EeP9zAAF,0012x00000lHnqlAAC,Bracken Ridge,QLD,Australia,Closed Lost,New Client-New Loan,28.71,88.58,1032.8866,2.0,0.0,4.0,3.0,2.0,3812.4718,4.0,88.0,0.0,1134.1671,888.97,3.0,0.0,0.0,0.0,0.0,0.0,0.0,1000,1360.0,9.0,17.429,Fortnightly,25.0,4307.64,1000.0,,17.0,0.0,0.4505,6.0,3935.95,0.0,1397.9566,151.11,QuickCash,,6485921,0.0,16-09-2023,False,Car Repairs,2023-09-11,Green,1671.0,5820.0,4307.64
0062x00000ECrNOAA1,0012x00000TuW2DAAV,Williamstown,VIC,Australia,Loan Paid,Existing Client-Granted Loan Before,0.0,64.31,2450.1175,1.0,1.0,0.0,4.0,1.0,5355.6138,3.0,51.0,0.0,1043.0454,1345.0,0.0,63.5,0.0,1.0,2221.13,1499.0,1050.0,1000,1360.0,14.0,14.143,Weekly,54.0,4711.83,1500.0,Self Employed,3.0,0.0,0.0549,0.0,0.0,403.0,3776.7933,97.14,MoneySpot,0.0,5903598,3.0,13-07-2023,False,Vehicle Expenses,2023-07-13,Orange,0.0,6630.0,4711.83
0062x00000FUzx2AAD,0012x00000khAjUAAU,Prospect,SA,Australia,Loan Paid,Existing Client-Granted Loan Before,0.0,90.43,0.0,2.0,0.0,0.0,1.0,2.0,4854.187,0.0,1.0,0.0,1787.7914,2016.26,0.0,44.24,0.0,0.0,0.0,400.0,200.0,700,952.0,7.0,14.143,Fortnightly,23.0,9162.64,1000.0,full_time,0.0,0.0,0.1429,0.0,4171.5133,149.0,148.5733,136.0,QuickCash,0.0,7555125,0.0,19-12-2023,False,Living Expenses,2023-12-18,Orange,0.0,12042.0,9162.64
0062x00000D1fSIAAZ,0012x00000flxYWAAY,Griffith,NSW,Australia,Loan Paid,Existing Client-Granted Loan Before,0.52,83.41,772.001,4.0,0.0,0.0,2.0,4.0,4199.8299,2.0,6.0,0.0,1224.949,1196.78,0.0,0.0,0.0,0.0,0.0,599.0,640.0,1000,1360.0,14.0,14.0,Weekly,23.0,4322.91,2050.0,,4.0,0.0,0.0879,4.0,4083.1633,213.0,355.3333,97.14,MoneySpot,0.0,4403389,4.0,04-01-2023,False,Living Expenses,2023-01-03,Orange,40.0,7682.0,4322.91
0062x00000EerQKAAZ,0012x00000g8387AAA,Balmoral,NSW,Australia,Loan Paid,Existing Client-Granted Loan Before,0.15,84.91,4773.3664,4.0,0.0,0.0,4.0,4.0,16439.6743,0.0,45.0,0.0,2231.9314,3782.54,1.0,0.0,0.0,0.0,0.0,1499.0,100.0,1000,1400.0,10.0,19.143,Fortnightly,24.0,19363.66,1000.0,,0.0,0.0,0.022,0.0,6805.4633,846.0,6937.55,140.0,MoneySpot,0.0,6523527,0.0,14-09-2023,False,Life Event Expenses,2023-09-14,Orange,34.0,21343.0,19363.66
0062x00000D2SCKAA3,0012x00000GdteyAAB,Branxton,NSW,Australia,Loan Paid,Existing Client-Granted Loan Before,11.95,71.05,929.86,4.0,0.0,0.0,1.0,4.0,1474.0151,1.0,42.0,500.2021,389.7142,186.0,0.0,2.04,0.0,1.0,0.0,400.0,800.0,800,1088.0,14.0,14.429,Weekly,46.0,9670.93,800.0,Part-Time Employment,1.0,0.0,0.0549,0.0,0.0,722.0,1671.9766,77.71,QuickCash,0.0,4446928,0.0,10-01-2023,False,Travel Expenses,2023-01-09,Green,978.0,8182.0,9670.93
0062x00000Ecn5tAAB,0012x00000MiGTUAA3,Charlemont,VIC,Australia,Loan Paid,Existing Client-Granted Loan Before,0.57,96.21,409.3846,2.0,0.0,2.0,4.0,2.0,4321.678,12.0,34.0,0.0,1817.4433,1781.29,1.0,3.13,0.0,0.0,4260.92,599.0,560.0,1000,1400.0,10.0,20.143,Fortnightly,29.0,4329.01,1000.0,Full-Time Employment,12.0,0.0,0.0989,0.0,3663.2866,0.0,2375.6666,140.0,MoneySpot,0.0,6379711,0.0,31-08-2023,False,Living Expenses,2023-08-30,Orange,28.0,4860.0,4329.01
0062x00000D8LG2AAN,0012x00000TrJlfAAF,Yanchep,WA,Australia,Loan Paid,Existing Client-Granted Loan Before,0.0,47.26,6639.9804,3.0,2.0,0.0,4.0,3.0,8288.97,8.0,0.0,1810.5419,8288.97,8288.97,2.0,0.47,1.0,0.0,12365.46,599.0,2200.0,1000,1320.0,3.0,12.571,Monthly,39.0,12329.75,2050.0,Full-Time Employment,13.0,0.0,0.0,7.0,12318.68,1765.0,7887.2366,440.0,QuickCash,0.0,4528106,8.0,22-01-2023,False,Travel Expenses,2023-01-22,Green,0.0,8530.0,12329.75
0062x00000ECDQBAA5,0012x00000hYV36AAG,Busby,NSW,Australia,Loan Paid,Existing Client-No Loan Granted Ever,0.0,53.56,2275.0117,2.0,0.0,0.0,3.0,2.0,5449.9336,1.0,34.0,264.0,2508.4633,2586.0,0.0,0.0,0.0,0.0,0.0,899.0,1880.0,700,1064.0,18.0,34.714,Fortnightly,40.0,6690.77,2050.0,,1.0,0.0,0.033,1.0,5016.9266,132.0,2741.95,59.11,MoneySpot,0.0,5862230,0.0,08-07-2023,False,Vehicle Expenses,2023-07-07,Green,0.0,6336.0,6690.77
0062x00000ED5gwAAD,0012x00000iJGJgAAO,Redbank Plains,QLD,Australia,Loan Paid,Existing Client-No Loan Granted Ever,0.0,57.49,588.754,1.0,0.0,0.0,5.0,1.0,3552.91,0.0,23.0,160.5565,817.6561,843.09,1.0,0.0,0.0,0.0,0.0,899.0,1000.0,600,912.0,33.0,33.0,Weekly,62.0,3552.91,2050.0,Full-Time Employment,0.0,0.0,0.044,0.0,3543.1766,49.0,552.07,27.64,MoneySpot,0.0,5918919,0.0,15-07-2023,False,Home Maintenance & Repairs,2023-07-15,Green,0.0,3543.0,3552.91
0062x00000D9WR2AAN,0012x00000MhWMxAAN,Bibra Lake,WA,Australia,Loan Paid,Existing Client-Granted Loan Before,0.0,32.72,2086.7503,3.0,0.0,0.0,3.0,3.0,5214.8666,0.0,27.0,132.0,3962.3333,4001.0,0.0,0.0,0.0,0.0,1890.0,899.0,500.0,650,884.0,4.0,16.857,Monthly,33.0,5224.87,650.0,Full-Time Employment,0.0,0.0,0.1099,0.0,3962.3333,440.0,2038.5166,221.0,Financier-2,0.0,4586732,0.0,31-01-2023,False,Living Expenses,2023-01-31,Green,0.0,5747.0,5224.87
0062x00000DZd66AAD,0012x00000gAXKDAA4,Cooloongup,WA,Australia,Loan Paid,Existing Client-Granted Loan Before,0.0,46.2,2507.9622,2.0,0.0,0.0,3.0,2.0,9329.0155,0.0,43.0,0.0,4246.3416,3524.18,1.0,0.13,0.0,0.0,9100.0,599.0,400.0,1000,1320.0,7.0,13.0,Fortnightly,44.0,9467.35,1000.0,Full-Time Employment,0.0,0.0,0.0,0.0,8492.6833,295.0,4258.1333,188.57,Financier-2,0.0,5103067,0.0,21-04-2023,False,Medical Expenses,2023-04-20,Green,0.0,8729.0,9467.35
0062x00000DtgMvAAJ,0012x00000RqTuaAAF,Charlemont,VIC,Australia,Loan Paid,Existing Client-Granted Loan Before,0.06,94.52,2238.0735,2.0,0.0,0.0,5.0,2.0,12391.1961,7.0,106.0,0.0,5454.9016,3513.93,1.0,0.0,0.0,0.0,7039.09,899.0,740.0,1000,1360.0,7.0,14.429,Fortnightly,29.0,11478.25,2050.0,Full-Time Employment,7.0,0.0,0.033,2.0,10916.4033,1365.0,4685.8466,194.29,QuickCash,0.0,5335182,2.0,20-05-2023,False,Medical Expenses,2023-05-19,Orange,9.0,14757.0,11478.25
0062x00000DIRV9AAP,0012x00000Mj7zWAAR,Winston,QLD,Australia,Loan Paid,Existing Client-Granted Loan Before,0.0,87.36,2804.2904,2.0,0.0,0.0,2.0,2.0,6077.3526,2.0,37.0,0.0,2141.7,2141.7,1.0,0.0,0.0,0.0,0.0,1499.0,580.0,1000,1320.0,7.0,12.714,Fortnightly,42.0,6077.35,1000.0,,2.0,0.0,0.022,0.0,4283.4,430.0,2935.5933,188.57,QuickCash,0.0,4833695,2.0,10-03-2023,False,Living Expenses,2023-03-09,Orange,0.0,5764.0,6077.35
0062x00000D7unnAAB,0012x00000XOt0qAAD,Traralgon,VIC,Australia,Loan Paid,Existing Client-No Loan Granted Ever,20.67,50.05,1350.4369,1.0,0.0,4.0,3.0,1.0,6209.1629,1.0,81.0,439.8868,944.7626,917.0,2.0,0.63,0.0,0.0,4160.0,899.0,1500.0,800,1024.0,6.0,6.0,Weekly,39.0,6189.76,800.0,Full-Time Employment,1.0,0.0,0.1209,0.0,6124.1533,835.0,1513.9733,170.67,MoneySpot,0.0,4506110,0.0,19-01-2023,False,Medical Expenses,2023-01-18,Green,1439.0,6960.0,6189.76
0062x00000DINsrAAH,0012x000003fJrwAAE,LATROBE,TAS,Australia,Closed Lost,Existing Client-Granted Loan Before,0.31,60.32,2597.4763,1.0,0.0,0.0,3.0,1.0,4116.3787,1.0,126.0,1048.6231,947.3315,842.32,1.0,1.16,0.0,0.0,15782.48,899.0,200.0,1000,1480.0,30.0,30.0,Weekly,33.0,4129.71,1000.0,Full-Time Employment,1.0,0.0,0.7802,0.0,4105.1033,1481.0,2829.1966,49.33,MoneySpot,,4830186,1.0,09-03-2023,False,Vehicle Expenses,2023-03-09,Orange,13.0,4125.0,4129.71
0062x00000FXoAyAAL,0012x00000lGMRyAAO,Mayfield East,NSW,Australia,Loan Paid,Existing Client-Granted Loan Before,0.0,21.84,2961.1633,0.0,0.0,0.0,0.0,0.0,0.0,1.0,66.0,2707.8833,0.0,0.0,1.0,0.0,0.0,0.0,0.0,400.0,500.0,1000,1320.0,12.0,12.429,Weekly,64.0,64495.13,1000.0,full_time,1.0,0.0,0.022,0.0,0.0,2723.0,5356.09,110.0,MoneySpot,0.0,7787101,0.0,2024-01-10,False,Living Expenses,2024-01-09,Orange,0.0,113117.0,64495.13
0062x00000D94ZrAAJ,0012x00000KMFLxAAP,Wilton,NSW,Australia,Loan Paid,Existing Client-Granted Loan Before,0.0,82.53,5479.7976,4.0,0.0,0.0,3.0,4.0,14009.9999,1.0,44.0,0.0,1382.3529,977.0,0.0,8.7,0.0,0.0,10499.89,899.0,2500.0,1000,1360.0,14.0,14.0,Weekly,50.0,14010.0,1000.0,Full-Time Employment,1.0,0.0,0.1538,0.0,7833.3333,812.0,6990.6566,97.14,QuickCash,0.0,4563301,1.0,27-01-2023,False,Home Maintenance & Repairs,2023-01-27,Green,0.0,17469.0,14010.0
0062x00000DFzj6AAD,0012x00000BIWPsAAP,Cranbourne East,VIC,Australia,Loan Paid,Existing Client-Granted Loan Before,22.92,77.23,1672.4809,4.0,0.0,2.0,2.0,2.0,3296.0151,0.0,38.0,0.0,490.958,497.28,1.0,0.0,0.0,0.0,3167.61,899.0,200.0,600,816.0,7.0,12.857,Fortnightly,39.0,8427.97,600.0,Full-Time Employment,0.0,0.0,0.0,0.0,1966.64,579.0,2054.46,116.57,MoneySpot,0.0,4697020,0.0,16-02-2023,True,Vehicle Expenses,2023-02-16,Orange,2240.0,9771.0,8427.97
0062x00000DFECcAAP,0012x000004TptuAAC,Bell Park,VIC,Australia,Loan Paid,Existing Client-Granted Loan Before,0.0,62.87,2336.6784,1.0,0.0,0.0,3.0,1.0,4834.9105,6.0,88.0,1114.2335,942.3907,987.96,1.0,0.0,0.0,0.0,3120.0,400.0,300.0,1000,1360.0,14.0,13.857,Weekly,24.0,5400.34,1000.0,Full-Time Employment,6.0,0.0,0.6813,0.0,4083.6933,1128.0,2460.3833,97.14,QuickCash,0.0,4656427,5.0,10-02-2023,False,Vehicle Expenses,2023-02-10,Green,0.0,5722.0,5400.34
0062x00000FHfpXAAT,0010K00001ig7H1QAI,Helensvale,QLD,Australia,Loan Paid,Existing Client-Granted Loan Before,0.0,74.54,1680.2321,1.0,0.0,0.0,2.0,1.0,5952.3149,0.0,41.0,0.0,651.7342,730.0,0.0,2.81,0.0,1.0,2383.33,599.0,1000.0,1000,1400.0,19.0,19.143,Weekly,53.0,8124.95,1000.0,Unemployed,7.0,0.0,0.0,2.0,3900.8266,489.0,1709.4866,73.68,MoneySpot,0.0,7191399,0.0,14-11-2023,False,Other Expenses,2023-11-13,Green,0.0,5909.0,8124.95
0062x00000E4goOAAR,0012x00000IMvIPAA1,GREGORY HILLS,NSW,Australia,Closed Lost,Existing Client-Granted Loan Before,0.0,45.4,75.1768,1.0,1.0,0.0,4.0,1.0,2756.2874,19.0,28.0,590.9958,625.1188,645.97,0.0,0.0,0.0,0.0,1711.0,2000.0,350.0,1000,1360.0,14.0,13.429,Weekly,28.0,3418.19,1000.0,Full-Time Employment,27.0,0.0,0.044,9.0,2577.2566,544.0,614.04,97.14,QuickCash,,5592188,23.0,13-06-2023,False,Travel Expenses,2023-06-12,Orange,0.0,2047.0,3418.19
0062x00000D1qmlAAB,0012x00000Mh8iAAAR,Echunga,SA,Australia,Loan Paid,Existing Client-Granted Loan Before,37.02,59.4,1397.3766,1.0,1.0,4.0,2.0,1.0,5418.4237,4.0,0.0,1351.9732,423.07,403.7,1.0,0.07,0.0,0.0,1723.62,899.0,620.0,900,1224.0,14.0,13.857,Weekly,39.0,4003.15,900.0,Part-Time Employment,4.0,0.0,0.0989,0.0,2901.2433,849.0,1772.08,87.43,QuickCash,0.0,4414666,1.0,05-01-2023,False,Furniture or Appliances,2023-01-04,Green,2478.0,6693.0,4003.15
0062x00000DWTlvAAH,0012x00000gpI23AAE,Homebush West,NSW,Australia,Closed Lost,Existing Client-No Loan Granted Ever,0.0,84.46,93.3333,1.0,0.0,0.0,2.0,1.0,8495.4826,0.0,3.0,0.0,848.5353,915.78,0.0,6.82,0.0,0.0,0.0,400.0,500.0,700,896.0,6.0,5.857,Weekly,26.0,8695.77,3000.0,,0.0,0.0,0.011,0.0,5011.82,0.0,226.6666,149.33,MoneySpot,,4918672,0.0,27-03-2023,False,Other Expenses,2023-03-23,Orange,0.0,11882.0,8695.77
0062x00000DWfJbAAL,0012x00000IMMzHAAX,Mount Lawley,WA,Australia,Loan Paid,Existing Client-Granted Loan Before,0.0,94.92,4457.2444,2.0,2.0,0.0,4.0,2.0,5050.8426,8.0,46.0,1293.9615,2324.7716,2360.27,0.0,1.3,1.0,0.0,4909.67,599.0,1820.0,1000,1320.0,5.0,8.857,Fortnightly,39.0,6609.13,2050.0,Full-Time Employment,8.0,0.0,0.1978,6.0,5864.5,1231.0,4343.3766,264.0,QuickCash,0.0,4928303,4.0,25-03-2023,False,Furniture or Appliances,2023-03-24,Orange,0.0,5302.0,6609.13
0062x00000DHfiuAAD,0012x00000XOjLlAAL,Heritage Park,QLD,Australia,Loan Paid,Existing Client-Granted Loan Before,16.04,29.58,2004.253,2.0,0.0,2.0,2.0,2.0,6310.7296,4.0,44.0,1045.9591,1891.3628,1868.92,2.0,0.0,0.0,0.0,3568.3,899.0,300.0,1000,1360.0,7.0,13.714,Fortnightly,49.0,6550.73,1000.0,Full-Time Employment,4.0,0.0,0.0549,1.0,5628.9866,995.0,2077.8233,194.29,QuickCash,0.0,4790611,3.0,03-03-2023,False,Home Maintenance & Repairs,2023-03-03,Green,1216.0,7579.0,6550.73
0062x00000E5PARAA3,0012x00000XOMJiAAP,Cross Roads,VIC,Australia,Closed Lost,Existing Client-No Loan Granted Ever,0.0,95.28,199.3571,4.0,2.0,0.0,5.0,4.0,285.6666,4.0,14.0,131.3227,38.0588,50.0,1.0,8.32,0.0,1.0,1303.87,899.0,70.0,1000,1280.0,6.0,6.286,Weekly,26.0,5439.44,1000.0,Full-Time Employment,11.0,0.0,0.011,3.0,1378.1433,91.0,1111.86,213.33,QuickCash,,5652064,11.0,19-06-2023,False,Living Expenses,2023-06-18,Orange,0.0,4207.0,5439.44
0062x00000DUwZaAAL,0012x00000LPntIAAT,New Farm,QLD,Australia,Loan Paid,Existing Client-No Loan Granted Ever,0.0,54.45,192.3161,0.0,0.0,0.0,0.0,0.0,0.0,0.0,1.0,0.0,0.0,0.0,2.0,0.0,0.0,0.0,3755.4,400.0,200.0,600,768.0,6.0,5.714,Weekly,30.0,4898.43,600.0,Full-Time Employment,0.0,0.0,0.9121,0.0,0.0,0.0,168.7166,128.0,MoneySpot,0.0,5402413,0.0,26-05-2023,False,Life Event Expenses,2023-05-26,Orange,0.0,5046.0,4898.43
0062x00000DFTliAAH,0012x00000cmVKdAAM,Leichhardt,QLD,Australia,Loan Paid,Existing Client-No Loan Granted Ever,0.0,49.94,2402.4075,4.0,0.0,0.0,3.0,4.0,5208.2666,2.0,29.0,0.0,1953.1,2141.98,0.0,1.09,0.0,0.0,1700.0,1499.0,1700.0,1000,1360.0,7.0,13.286,Fortnightly,36.0,5715.38,1000.0,Full-Time Employment,2.0,0.0,0.044,1.0,5208.2666,104.0,2344.6833,194.29,MoneySpot,0.0,4671152,2.0,13-02-2023,False,Child Expenses,2023-02-12,Orange,0.0,7182.0,5715.38
0062x00000DALRVAA5,0012x00000WtjKYAAZ,Ashfield,NSW,Australia,Loan Paid,Existing Client-Granted Loan Before,0.0,52.9,1925.5108,1.0,0.0,0.0,5.0,1.0,5410.6999,0.0,67.0,483.3208,1362.009,1111.35,1.0,0.0,0.0,0.0,5416.67,599.0,1240.0,650,884.0,14.0,13.714,Weekly,51.0,5410.7,650.0,Full-Time Employment,0.0,0.0,0.0,0.0,4994.0333,897.0,2838.9466,63.14,Financier-2,0.0,4625692,0.0,06-02-2023,False,Living Expenses,2023-02-06,Green,0.0,5717.0,5410.7
0062x00000DGHVaAAP,0012x000003E0ToAAK,Condobolin,NSW,Australia,Loan Paid,Existing Client-Granted Loan Before,76.78,83.51,169.0466,1.0,1.0,0.0,5.0,1.0,885.5655,8.0,25.0,103.415,201.5,101.0,0.0,0.0,0.0,1.0,0.0,400.0,0.0,900,1224.0,14.0,13.857,Weekly,51.0,2579.5,900.0,Unemployed,8.0,0.0,0.4176,5.0,0.0,484.0,666.81,87.43,MoneySpot,0.0,4714220,3.0,19-02-2023,False,Furniture or Appliances,2023-02-19,Green,1978.0,2576.0,2579.5
0062x00000FW47iAAD,0012x00000n3CtgAAE,Deer Park,VIC,Australia,Closed Lost,New Client-New Loan,0.0,79.43,0.0,1.0,0.0,0.0,2.0,1.0,3583.9593,1.0,5.0,0.0,824.8016,892.0,1.0,0.0,0.0,0.0,3865.33,400.0,500.0,850,1190.0,20.0,20.571,Weekly,59.0,11741.08,3000.0,Full-Time Employment,1.0,0.0,0.2198,0.0,3299.2066,0.0,1668.1333,59.5,MoneySpot,,7641140,1.0,26-12-2023,False,Travel Expenses,2023-12-26,Green,0.0,12373.0,11741.08
0062x00000DHiXuAAL,0012x00000gooN4AAI,Narellan,NSW,Australia,Loan Paid,New Client-New Loan,0.0,57.68,1298.457,2.0,0.0,0.0,2.0,2.0,6474.0063,1.0,6.0,0.0,2633.5385,2633.54,1.0,0.0,0.0,0.0,0.0,0.0,1280.0,700,896.0,3.0,5.714,Fortnightly,33.0,10943.67,700.0,,1.0,0.0,0.0989,1.0,6144.9233,0.0,1348.1233,298.67,QuickCash,0.0,4792658,2.0,03-03-2023,False,Purchase - White Good/s,2023-03-03,Green,0.0,14336.0,10943.67
0062x00000D9b2WAAR,0010K000020HefEQAS,Carlingford,NSW,Australia,Loan Paid,Existing Client-Granted Loan Before,0.0,69.19,4211.6115,2.0,0.0,0.0,3.0,2.0,6379.8997,0.0,72.0,609.1035,725.6416,760.93,0.0,0.24,0.0,0.0,2816.67,599.0,0.0,600,816.0,7.0,14.286,Fortnightly,38.0,6379.9,5000.0,Part-Time Employment,0.0,0.0,0.011,0.0,3642.2133,1281.0,4633.66,116.57,QuickCash,0.0,4589483,0.0,31-01-2023,False,Home Improvements,2023-01-31,Orange,0.0,8816.0,6379.9
0062x00000DryMLAAZ,0012x00000hYmTXAA0,MacGregor,ACT,Australia,Loan Paid,Existing Client-No Loan Granted Ever,7.62,38.79,708.6243,2.0,0.0,2.0,4.0,2.0,5998.0966,0.0,29.0,0.0,2529.57,2529.57,0.0,0.0,0.0,0.0,0.0,599.0,800.0,1000,1280.0,3.0,4.857,Fortnightly,48.0,5998.1,3000.0,Full-time,0.0,0.0,0.0,0.0,4578.27,129.0,899.63,426.67,MoneySpot,0.0,5210251,0.0,06-05-2023,False,Veterinary Expenses,2023-05-06,Orange,425.0,5576.0,5998.1
0062x00000E4qxeAAB,0012x00000TsZ8UAAV,Denham Court,NSW,Australia,Loan Paid,Existing Client-Granted Loan Before,0.93,57.18,669.2399,4.0,0.0,0.0,2.0,4.0,3177.9999,0.0,9.0,0.0,176.909,196.0,0.0,0.0,0.0,1.0,2600.0,599.0,250.0,1000,1440.0,12.0,23.857,Fortnightly,33.0,3178.0,2050.0,Full-Time Employment,0.0,0.0,0.2088,0.0,0.0,25.0,753.74,120.0,MoneySpot,0.0,5603727,0.0,14-06-2023,False,Medical Expenses,2023-06-14,Orange,30.0,3225.0,3178.0
0062x00000D1RmnAAF,0012x00000d9DtGAAU,Salisbury East,SA,Australia,Loan Paid,Existing Client-Granted Loan Before,0.0,86.49,3530.8286,1.0,1.0,0.0,4.0,1.0,3813.7432,18.0,57.0,773.0335,841.7846,890.97,0.0,0.0,0.0,0.0,3019.92,400.0,600.0,800,1056.0,10.0,9.714,Weekly,20.0,4294.65,1000.0,Full-Time Employment,24.0,0.0,0.011,3.0,3647.7333,1286.0,3747.3033,105.6,QuickCash,0.0,4390077,20.0,01-01-2023,False,Vehicle Expenses,2023-01-01,Orange,0.0,5161.0,4294.65
0062x00000DrMDlAAN,0012x00000hYoRjAAK,Lawnton,QLD,Australia,Loan Paid,New Client-New Loan,19.62,39.64,89.9226,1.0,0.0,4.0,7.0,1.0,4048.9259,0.0,0.0,0.0,653.5375,757.9,0.0,2.1,0.0,1.0,0.0,0.0,400.0,1000,1280.0,6.0,6.429,Weekly,41.0,4557.26,2000.0,,0.0,0.0,0.0,0.0,1140.8166,0.0,97.3333,213.33,MoneySpot,0.0,5160896,0.0,29-04-2023,False,Event - Holiday - Accommodation,2023-04-29,Orange,1141.0,5814.0,4557.26
0062x00000DVyo4AAD,0012x00000IN2MwAAL,CRAIGIEBURN,VIC,Australia,Loan Paid,Existing Client-No Loan Granted Ever,0.0,70.72,423.5,0.0,1.0,0.0,0.0,0.0,0.0,1.0,8.0,0.0,0.0,0.0,0.0,7.52,0.0,0.0,1711.67,0.0,600.0,700,896.0,6.0,6.429,Weekly,55.0,3676.09,2500.0,Unemployed,1.0,0.0,0.011,1.0,0.0,0.0,637.44,149.33,MoneySpot,0.0,4887688,1.0,18-03-2023,False,Purchase - Electrical Purchase - Computer/TV,2023-03-18,Orange,0.0,3682.0,3676.09
0062x00000FVUBeAAP,0012x00000n2TfqAAE,Long Jetty,NSW,Australia,Loan Paid,New Client-New Loan,2.12,58.98,103.8485,1.0,0.0,0.0,3.0,1.0,3967.9819,2.0,34.0,0.0,913.18,792.28,1.0,0.18,0.0,0.0,0.0,0.0,1600.0,600,792.0,10.0,10.0,Weekly,48.0,7735.24,600.0,,2.0,0.0,0.5934,0.0,913.18,0.0,55.7666,79.2,QuickCash,0.0,7595499,0.0,21-12-2023,False,Medical bills,2023-12-21,Orange,83.0,3898.0,7735.24
0062x00000FHOeyAAH,0012x00000mHDouAAG,The Entrance,NSW,Australia,Closed Lost,New Client-New Loan,0.0,86.4,0.0,1.0,0.0,0.0,4.0,1.0,4319.6119,0.0,12.0,0.0,900.7153,990.5,0.0,0.0,0.0,0.0,900.0,2000.0,800.0,1000,1400.0,18.0,17.714,Weekly,25.0,4319.61,1000.0,Full-Time Employment,0.0,0.0,0.9341,0.0,3903.1,0.0,3.3333,77.78,QuickCash,,7167640,0.0,12-11-2023,False,Living Expenses,2023-11-11,Green,0.0,4339.0,4319.61
0062x00000Fj0x8AAB,0012x00000VdIOGAA3,Gillieston Heights,NSW,Australia,Loan Paid,Existing Client-Granted Loan Before,0.0,80.98,6903.7559,1.0,0.0,0.0,3.0,1.0,14126.4034,8.0,76.0,0.0,2334.2961,3579.1,1.0,25.19,4.0,0.0,9533.33,1500.0,1080.0,700,896.0,6.0,6.571,Weekly,33.0,15326.4,700.0,Full-Time Employment,8.0,0.0,0.011,8.0,13715.2833,1009.0,7462.6233,149.33,MoneySpot,0.0,8032919,3.0,2024-01-29,False,Medical Expenses,2024-01-28,Orange,0.0,18377.0,15326.4
0062x00000DGFAzAAP,0012x00000go1cNAAQ,Bairnsdale,VIC,Australia,Loan Paid,New Client-New Loan,0.0,39.48,760.77,1.0,0.0,0.0,3.0,1.0,3403.3968,0.0,9.0,0.0,783.2476,729.87,0.0,1.3,0.0,1.0,3401.67,400.0,700.0,800,1088.0,14.0,13.714,Weekly,53.0,3403.4,800.0,Full-Time Employment,0.0,0.0,0.6374,0.0,0.0,0.0,759.9966,77.71,MoneySpot,0.0,4711377,0.0,18-02-2023,False,Vehicle Expenses,2023-02-18,Orange,0.0,3394.0,3403.4
0062x00000DJDMmAAP,0012x00000GbgirAAB,Wollongong,NSW,Australia,Loan Paid,Existing Client-Granted Loan Before,22.25,81.53,3118.463,1.0,0.0,4.0,2.0,1.0,8720.4577,0.0,131.0,899.34,1020.375,1019.73,0.0,0.43,0.0,0.0,2941.77,599.0,1040.0,1000,1280.0,6.0,5.857,Weekly,46.0,11525.21,1000.0,Part-Time Employment,0.0,0.0,0.0769,0.0,6906.3433,1126.0,4074.19,213.33,QuickCash,0.0,4876697,0.0,16-03-2023,False,Travel Expenses,2023-03-16,Green,2102.0,9446.0,11525.21
0062x00000DVxbGAAT,0012x00000cm4eZAAQ,Kirwan,QLD,Australia,Loan Paid,Existing Client-Granted Loan Before,0.0,36.78,4153.3365,3.0,0.0,0.0,3.0,3.0,6462.9066,3.0,20.0,322.996,6255.6533,6301.46,0.0,0.04,0.0,0.0,0.0,599.0,1640.0,1000,1360.0,4.0,17.143,Monthly,34.0,6281.51,1000.0,Employed full-time,3.0,0.0,0.1319,3.0,6255.6533,1467.0,4250.0033,340.0,MoneySpot,0.0,4886953,3.0,18-03-2023,False,Living Expenses,2023-03-17,Orange,0.0,7506.0,6281.51
0062x00000D8brmAAB,0012x00000g7yQ8AAI,Gordonvale,QLD,Australia,Loan Paid,Existing Client-Granted Loan Before,17.2,73.92,3673.488,4.0,1.0,1.0,1.0,1.0,5252.0159,2.0,40.0,0.0,959.8666,620.0,1.0,0.33,0.0,0.0,0.0,899.0,400.0,600,816.0,7.0,13.286,Fortnightly,29.0,3780.53,2000.0,,2.0,0.0,0.2308,2.0,1585.38,466.0,4039.8233,116.57,QuickCash,0.0,4541442,2.0,25-01-2023,True,Life Event Expenses,2023-01-25,Orange,1418.0,8244.0,3780.53
0062x00000Dt3awAAB,0012x00000fmFiVAAU,Berserker,QLD,Australia,Loan Paid,Existing Client-Granted Loan Before,9.37,40.71,200.0,2.0,0.0,2.0,2.0,2.0,4777.0569,1.0,2.0,0.0,1860.7266,1861.06,0.0,0.0,0.0,0.0,0.0,599.0,500.0,650,884.0,7.0,14.143,Fortnightly,41.0,7438.39,650.0,,1.0,0.0,0.0,1.0,4053.5333,114.0,313.78,126.29,QuickCash,0.0,5283852,0.0,16-05-2023,False,Living Expenses,2023-05-16,Orange,805.0,8590.0,7438.39
0062x00000DZ9fGAAT,0012x00000bmlLPAAY,Blacktown,NSW,Australia,Loan Paid,Existing Client-Granted Loan Before,0.0,95.21,1271.6334,2.0,4.0,0.0,2.0,2.0,2450.5278,22.0,22.0,0.0,859.6616,1049.22,1.0,0.0,0.0,0.0,2348.67,1499.0,0.0,700,896.0,3.0,6.429,Fortnightly,30.0,2450.53,2000.0,Part-Time Employment,22.0,0.0,0.7473,5.0,1987.5766,155.0,1325.9733,298.67,MoneySpot,0.0,5077020,22.0,17-04-2023,False,Travel Expenses,2023-04-17,Orange,0.0,2016.0,2450.53
0062x00000DsWGdAAN,0012x00000TrCAiAAN,Wallsend,NSW,Australia,Loan Paid,Existing Client-Granted Loan Before,50.44,41.52,2039.7443,1.0,0.0,4.0,1.0,1.0,5105.8653,0.0,27.0,0.0,428.5961,1062.66,0.0,0.0,0.0,0.0,1733.33,599.0,1000.0,600,816.0,14.0,13.714,Weekly,42.0,5784.18,600.0,Part-Time Employment,0.0,0.0,0.0,0.0,4733.4666,178.0,1985.3666,58.29,MoneySpot,0.0,5245436,0.0,11-05-2023,False,Vehicle Expenses,2023-05-11,Orange,3020.0,5987.0,5784.18
0062x00000DY0wwAAD,0012x00000g8AnBAAU,ROBINVALE,VIC,Australia,Loan Paid,Existing Client-Granted Loan Before,0.0,68.11,919.1293,4.0,0.0,0.0,1.0,4.0,6876.3574,2.0,24.0,976.9833,1137.5,1200.0,0.0,0.0,0.0,1.0,1200.0,400.0,180.0,550,704.0,7.0,7.0,Weekly,32.0,12800.23,2050.0,Full-Time Employment,2.0,0.0,0.0989,2.0,0.0,481.0,827.06,100.57,QuickCash,0.0,5007975,1.0,06-04-2023,False,Living Expenses,2023-04-05,Green,0.0,13533.0,12800.23
0062x00000DIihLAAT,0012x00000NQvdDAAT,Glenmore Park,NSW,Australia,Loan Paid,Existing Client-Granted Loan Before,10.81,83.9,2039.8841,1.0,0.0,2.0,3.0,1.0,4426.7988,5.0,66.0,546.4448,737.5166,264.28,0.0,0.27,0.0,0.0,700.0,400.0,440.0,1000,1320.0,11.0,11.429,Weekly,49.0,4426.8,1000.0,Full-Time Employment,5.0,0.0,0.1538,0.0,3430.02,1297.0,2164.58,120.0,QuickCash,0.0,4852009,5.0,13-03-2023,False,Travel Expenses,2023-03-13,Green,552.0,5105.0,4426.8
0062x00000D1efDAAR,0012x00000LQUGMAA5,Narre Warren,VIC,Australia,Loan Paid,Existing Client-Granted Loan Before,0.0,74.86,1323.065,1.0,0.0,0.0,1.0,1.0,4506.9105,1.0,43.0,272.5074,1037.207,855.0,1.0,0.0,0.0,0.0,0.0,599.0,1200.0,1000,1320.0,10.0,10.143,Weekly,27.0,4506.91,1000.0,,1.0,0.0,0.0,0.0,3457.3566,1142.0,1255.9866,132.0,MoneySpot,0.0,4402709,1.0,03-01-2023,False,Life Event Expenses,2023-01-03,Orange,0.0,6628.0,4506.91
0062x00000DImZzAAL,0012x00000g9iIQAAY,Kelmscott,WA,Australia,Loan Paid,Existing Client-Granted Loan Before,0.0,59.38,195.5335,1.0,0.0,0.0,3.0,1.0,4699.5879,0.0,27.0,195.5357,1081.5492,1094.75,0.0,0.68,0.0,1.0,4779.52,599.0,1800.0,1000,1320.0,10.0,10.429,Weekly,51.0,6332.8,1000.0,Full-Time Employment,0.0,0.0,0.1319,0.0,0.0,717.0,717.3333,132.0,MoneySpot,0.0,4854833,0.0,13-03-2023,False,Vehicle Expenses,2023-03-13,Orange,0.0,6769.0,6332.8
0062x00000DY4TQAA1,0012x00000RriFWAAZ,Orange,NSW,Australia,Closed Lost,Existing Client-Granted Loan Before,0.0,81.58,1357.5273,0.0,0.0,0.0,0.0,0.0,0.0,1.0,61.0,900.3725,0.0,0.0,1.0,3.95,0.0,0.0,4011.54,899.0,1000.0,1000,1280.0,6.0,5.857,Weekly,41.0,5887.31,2000.0,Full-Time Employment,1.0,0.0,0.3516,0.0,0.0,894.0,2408.92,213.33,MoneySpot,,5010768,1.0,06-04-2023,False,Furniture or Appliances,2023-04-06,Green,0.0,6024.0,5887.31
0062x00000DXJS7AAP,0012x00000czNqkAAE,Windale,NSW,Australia,Loan Paid,Existing Client-Granted Loan Before,0.0,89.19,1055.3762,2.0,0.0,0.0,4.0,2.0,3166.8142,3.0,26.0,274.3707,1452.46,1734.87,0.0,0.0,0.0,0.0,0.0,400.0,355.0,1000,1280.0,3.0,6.143,Fortnightly,33.0,4875.66,1000.0,,7.0,0.0,0.033,3.0,5077.3066,295.0,1048.8633,426.67,QuickCash,0.0,4965202,3.0,31-03-2023,False,Vehicle Expenses,2023-03-31,Green,0.0,3400.0,4875.66
0062x00000D73CkAAJ,0010K00001b1GKhQAM,South Townsville,QLD,Australia,Loan Paid,Existing Client-Granted Loan Before,0.0,75.31,2858.7251,4.0,1.0,0.0,3.0,4.0,1714.9999,1.0,5.0,1048.6708,443.0,1000.0,0.0,5.37,0.0,1.0,3761.33,400.0,1249.0,1000,1360.0,14.0,13.857,Weekly,37.0,4648.09,1000.0,Full-Time Employment,2.0,0.0,0.1978,1.0,2933.0866,864.0,3731.8533,97.14,QuickCash,0.0,4465196,2.0,12-01-2023,False,Veterinary Expenses,2023-01-12,Orange,0.0,2885.0,4648.09
0062x00000D7tvxAAB,0012x00000gACpAAAW,North Booval,QLD,Australia,Closed Lost,New Client-New Loan,0.0,41.98,1079.1366,1.0,0.0,0.0,3.0,1.0,1005.0,0.0,8.0,0.0,274.0909,35.0,0.0,2.81,0.0,1.0,1200.0,2000.0,1120.0,1000,1280.0,6.0,5.714,Weekly,38.0,4540.41,1000.0,Full-Time Employment,0.0,0.0,0.0659,0.0,0.0,0.0,1085.8033,213.33,QuickCash,,4505322,0.0,23-01-2023,False,Vehicle Expenses,2023-01-18,Orange,0.0,6589.0,4540.41
0062x00000DFfWzAAL,0010K000025xcaWQAQ,Yaroomba,QLD,Australia,Loan Paid,Existing Client-Granted Loan Before,0.0,30.42,463.4891,1.0,0.0,0.0,3.0,1.0,4125.4593,0.0,0.0,0.0,753.8553,698.65,0.0,0.0,0.0,1.0,3891.33,599.0,1105.0,1000,1360.0,14.0,14.286,Weekly,49.0,4125.46,1000.0,Full-Time Employment,0.0,0.0,0.0,0.0,0.0,213.0,213.3333,97.14,QuickCash,0.0,4680480,0.0,14-02-2023,False,Furniture or Appliances,2023-02-14,Green,0.0,4300.0,4125.46
0062x00000F2YYGAA3,0012x00000Vdvp3AAB,Urraween,QLD,Australia,Loan Paid,Existing Client-Granted Loan Before,65.41,40.24,1754.3653,2.0,0.0,4.0,2.0,4.0,9582.6441,8.0,42.0,0.0,2172.1133,485.94,1.0,0.0,0.0,0.0,9598.47,899.0,900.0,800,1088.0,8.0,15.0,Fortnightly,45.0,22643.78,3500.0,Part-Time Employment,8.0,0.0,0.011,0.0,20413.12,700.0,2344.15,136.0,MoneySpot,0.0,6978516,1.0,28-10-2023,False,Vehicle Expenses,2023-10-27,Orange,8408.0,12853.0,22643.78
0062x00000EegzoAAB,0012x00000Ws1I3AAJ,Thornlie,WA,Australia,Loan Paid,Existing Client-Granted Loan Before,0.72,37.36,5731.4993,2.0,0.0,0.0,3.0,2.0,13712.7994,2.0,21.0,0.0,3675.82,3981.22,0.0,0.09,0.0,0.0,13376.38,1499.0,800.0,750,1020.0,7.0,13.143,Fortnightly,44.0,13712.8,750.0,Full-Time Employment,2.0,0.0,0.1209,1.0,11096.2,634.0,8260.57,145.71,QuickCash,0.0,6511125,0.0,13-09-2023,False,Home Maintenance & Repairs,2023-09-13,Orange,108.0,14856.0,13712.8
0062x00000D9VLmAAN,0012x00000LRphRAAT,Redbank Plains,QLD,Australia,Loan Paid,Existing Client-Granted Loan Before,0.76,60.86,660.3572,2.0,0.0,0.0,3.0,2.0,3800.6263,0.0,15.0,0.0,1749.33,1774.82,1.0,0.0,0.0,0.0,4007.05,599.0,300.0,800,1088.0,7.0,13.286,Fortnightly,30.0,3800.63,800.0,Full-Time Employment,0.0,0.0,0.0,0.0,2915.55,513.0,721.3466,155.43,QuickCash,0.0,4585781,0.0,31-01-2023,False,Vehicle Expenses,2023-01-30,Green,27.0,3509.0,3800.63
0062x00000DI5y3AAD,0010K00001dqIiuQAE,Warner,QLD,Australia,Loan Paid,Existing Client-Granted Loan Before,0.0,80.6,1322.0737,1.0,0.0,0.0,2.0,1.0,9655.7682,0.0,98.0,1280.848,1279.7241,1235.9,10.0,0.77,0.0,0.0,32500.0,400.0,350.0,1000,1320.0,10.0,10.143,Weekly,46.0,9995.26,2000.0,Part-Time Employment,0.0,0.0,0.0879,0.0,9201.5933,880.0,1890.5566,132.0,MoneySpot,0.0,4816245,0.0,07-03-2023,False,Vehicle Repairs & Maintenance,2023-03-07,Green,0.0,10252.0,9995.26
0062x00000DZqC8AAL,0012x00000hYPZtAAO,Richmond,VIC,Australia,Closed Lost,New Client-New Loan,0.0,75.31,393.0933,4.0,0.0,0.0,4.0,4.0,3285.2799,0.0,2.0,0.0,878.4854,900.34,0.0,0.0,0.0,0.0,0.0,0.0,1050.0,700,896.0,6.0,5.857,Weekly,24.0,3285.28,3000.0,,0.0,0.0,0.022,0.0,3221.1133,0.0,416.7533,149.33,MoneySpot,,5117707,0.0,27-04-2023,False,Short Term Loan,2023-04-22,Orange,0.0,4415.0,3285.28
0062x00000D89hLAAR,0012x00000FF2hYAAT,Willaston,SA,Australia,Loan Paid,Existing Client-Granted Loan Before,24.95,63.9,3008.004,1.0,0.0,4.0,3.0,1.0,4929.3714,1.0,39.0,1021.6877,503.7692,301.14,0.0,0.01,1.0,0.0,0.0,599.0,1200.0,800,1088.0,14.0,13.857,Weekly,36.0,4929.37,800.0,Unemployed,1.0,0.0,0.0,0.0,3924.9766,992.0,3220.4533,77.71,Financier-2,0.0,4517244,0.0,20-01-2023,False,Medical Expenses,2023-01-20,Green,1742.0,6980.0,4929.37
0062x00000DGD65AAH,0012x00000fn6KiAAI,GRANGE,QLD,Australia,Loan Paid,Existing Client-No Loan Granted Ever,0.0,79.57,4571.208,2.0,0.0,0.0,3.0,2.0,4914.9242,4.0,87.0,766.7115,2101.1166,2198.76,0.0,0.0,0.0,0.0,0.0,599.0,740.0,900,1188.0,7.0,12.714,Fortnightly,26.0,4914.92,900.0,,5.0,0.0,0.9341,5.0,4202.2333,848.0,4315.6866,169.71,MoneySpot,0.0,4709691,2.0,18-02-2023,False,Vehicle Expenses,2023-02-18,Orange,0.0,7848.0,4914.92
0062x00000FJjrkAAD,0012x00000Rqu9RAAR,Penrith,NSW,Australia,Loan Paid,Existing Client-No Loan Granted Ever,0.0,30.29,309.7116,1.0,0.0,0.0,4.0,1.0,3078.4495,0.0,13.0,197.1,809.675,997.68,0.0,0.3,0.0,0.0,600.0,400.0,300.0,800,1088.0,14.0,14.286,Weekly,26.0,3078.45,2050.0,Part-Time Employment,0.0,0.0,0.0,0.0,2698.9166,104.0,227.9033,77.71,Financier-2,0.0,7344434,0.0,29-11-2023,False,Living Expenses,2023-11-28,Orange,0.0,3611.0,3078.45
0062x00000DXYVwAAP,0012x00000goS2VAAU,RUTHERFORD,NSW,Australia,Loan Paid,Existing Client-Granted Loan Before,0.0,73.9,614.9101,1.0,1.0,0.0,2.0,1.0,5230.9253,1.0,19.0,716.925,910.6353,875.67,1.0,0.67,0.0,0.0,3947.67,599.0,400.0,1000,1280.0,6.0,6.429,Weekly,35.0,5339.9,1000.0,Full-Time Employment,1.0,0.0,0.1758,0.0,3946.0866,690.0,886.9566,213.33,MoneySpot,0.0,4982082,1.0,02-04-2023,False,Vehicle Expenses,2023-04-01,Orange,0.0,5346.0,5339.9
0062x00000DA4KDAA1,0012x00000g8KuwAAE,Kellyville,NSW,Australia,Loan Paid,Existing Client-Granted Loan Before,3.17,54.98,1599.7673,1.0,0.0,2.0,5.0,1.0,14574.4771,0.0,0.0,432.5925,1300.0,2500.0,1.0,6.89,0.0,1.0,3900.0,400.0,1500.0,1000,1360.0,7.0,13.143,Fortnightly,56.0,14630.79,1000.0,Full-Time Employment,0.0,0.0,0.0,0.0,1696.77,213.0,2612.57,194.29,QuickCash,0.0,4611138,0.0,03-02-2023,False,Living Expenses,2023-02-03,Green,474.0,14926.0,14630.79
0062x00000D6sq0AAB,0012x00000IMs5pAAD,Macquarie Hills,NSW,Australia,Loan Paid,Existing Client-Granted Loan Before,0.0,92.42,833.7004,2.0,0.0,0.0,3.0,2.0,3333.7162,0.0,21.0,0.0,1195.9566,1185.71,0.0,0.0,0.0,0.0,3033.33,899.0,690.0,950,1292.0,7.0,13.143,Fortnightly,40.0,4032.05,950.0,Full-Time Employment,0.0,0.0,0.1868,0.0,2854.0533,660.0,1020.8133,184.57,MoneySpot,0.0,4457603,0.0,11-01-2023,False,Travel Expenses,2023-01-11,Green,0.0,10814.0,4032.05
0062x00000DYeoGAAT,0012x00000Fz1snAAB,Chermside,QLD,Australia,Loan Paid,Existing Client-Granted Loan Before,0.0,69.04,0.0,4.0,1.0,0.0,3.0,4.0,2787.1223,17.0,23.0,0.0,822.9912,791.2,0.0,0.0,0.0,0.0,4290.0,400.0,0.0,650,832.0,7.0,7.143,Weekly,24.0,2813.12,1900.0,Full-Time Employment,17.0,0.0,0.0989,3.0,2194.6433,67.0,189.57,118.86,QuickCash,0.0,5045785,5.0,15-04-2023,False,Living Expenses,2023-04-15,Orange,0.0,3979.0,2813.12
0062x00000D8E41AAF,0012x00000dzceUAAQ,Heathwood,QLD,Australia,Loan Paid,Existing Client-Granted Loan Before,0.0,53.56,41.4333,1.0,0.0,0.0,3.0,1.0,4214.619,0.0,8.0,492.4458,964.1869,925.6,0.0,0.07,0.0,0.0,926.0,599.0,680.0,600,816.0,14.0,13.714,Weekly,21.0,4313.62,600.0,Full-Time Employment,0.0,0.0,0.5165,0.0,4178.1433,289.0,404.4833,58.29,MoneySpot,0.0,4521405,0.0,21-01-2023,False,Vehicle Expenses,2023-01-20,Green,0.0,4577.0,4313.62
0062x00000D6pPGAAZ,0012x000002cV0HAAU,Melton West,VIC,Australia,Loan Paid,Existing Client-Granted Loan Before,0.0,47.89,1253.2182,1.0,0.0,0.0,2.0,1.0,5113.7318,0.0,56.0,211.0547,802.8758,852.55,1.0,0.68,0.0,0.0,3596.67,400.0,400.0,700,952.0,14.0,14.143,Weekly,32.0,5113.73,700.0,Full-Time Employment,0.0,0.0,0.0549,0.0,3211.5033,210.0,1514.1733,68.0,MoneySpot,0.0,4455282,0.0,11-01-2023,False,Vehicle Expenses,2023-01-11,Green,0.0,6910.0,5113.73
0062x00000DWifnAAD,0012x00000g9h2HAAQ,Lurnea,NSW,Australia,Loan Paid,Existing Client-Granted Loan Before,0.0,56.25,84.0,4.0,0.0,0.0,4.0,4.0,18.3333,0.0,18.0,0.0,13.75,10.0,3.0,0.0,0.0,1.0,0.0,400.0,1455.0,750,990.0,9.0,9.429,Weekly,33.0,3526.25,2500.0,Full-Time Employment,0.0,0.0,0.0,0.0,0.0,213.0,427.7833,110.0,MoneySpot,0.0,4932575,0.0,25-03-2023,False,Vehicle Expenses,2023-03-25,Green,0.0,4897.0,3526.25
0062x00000DGm8mAAD,0012x00000g9rDQAAY,Gerangamete,VIC,Australia,Loan Paid,Existing Client-Granted Loan Before,0.0,51.49,1999.9963,2.0,0.0,0.0,3.0,2.0,4645.5987,0.0,23.0,0.0,1649.215,1911.63,0.0,0.0,0.0,0.0,0.0,899.0,800.0,1000,1360.0,7.0,14.0,Fortnightly,54.0,4645.6,1000.0,,0.0,0.0,0.0,0.0,3298.43,341.0,4091.02,194.29,MoneySpot,0.0,4741388,0.0,23-02-2023,False,Living Expenses,2023-02-23,Green,0.0,5373.0,4645.6
0062x00000DZSfbAAH,0012x00000gnzhWAAQ,Leederville,WA,Australia,Closed Lost,Existing Client-Granted Loan Before,0.0,82.05,1958.735,4.0,0.0,0.0,1.0,4.0,16425.151,0.0,27.0,0.0,1300.8333,140.0,0.0,0.0,0.0,1.0,4550.0,400.0,0.0,1000,1480.0,15.0,28.857,Fortnightly,29.0,21035.15,5000.0,Full-Time Employment,0.0,0.0,0.0,0.0,3751.3833,1185.0,1941.4466,98.67,MoneySpot,,5094174,0.0,19-04-2023,False,Vehicle Expenses,2023-04-19,Orange,0.0,30533.0,21035.15
0062x00000D9fH1AAJ,0012x00000RqZaaAAF,Boondall,QLD,Australia,Loan Paid,Existing Client-Granted Loan Before,0.0,90.65,3854.1923,4.0,1.0,0.0,2.0,4.0,14004.1994,4.0,41.0,1870.0777,254.9176,54.0,0.0,0.06,0.0,1.0,4333.33,899.0,600.0,800,1088.0,14.0,14.286,Weekly,26.0,4054.73,800.0,Full-Time Employment,4.0,0.0,0.033,2.0,0.0,677.0,3586.0166,77.71,MoneySpot,0.0,4593216,4.0,01-02-2023,False,Vehicle Expenses,2023-02-01,Orange,0.0,17551.0,4054.73
0062x00000D2D8oAAF,0012x00000KMFWLAA5,Kelso,QLD,Australia,Loan Paid,Existing Client-Granted Loan Before,6.78,90.76,3774.5401,1.0,0.0,0.0,4.0,1.0,4442.8968,1.0,84.0,556.625,920.0,920.0,2.0,17.37,0.0,0.0,900.0,899.0,100.0,1000,1360.0,14.0,13.857,Weekly,24.0,4051.62,1200.0,Full-Time Employment,1.0,0.0,0.0659,0.0,3986.6666,2322.0,4024.31,97.14,MoneySpot,0.0,4433530,1.0,07-01-2023,False,Living Expenses,2023-01-07,Green,333.0,4911.0,4051.62
0062x00000DHKGGAA5,0012x00000goRyPAAU,Higgins,ACT,Australia,Closed Lost,Existing Client-Granted Loan Before,0.0,51.7,0.0,1.0,0.0,0.0,2.0,1.0,3946.9727,1.0,5.0,512.0,536.1338,133.19,0.0,0.0,1.0,1.0,7313.47,899.0,500.0,1000,1280.0,6.0,6.0,Weekly,24.0,9181.77,5000.0,Full-Time Employment,1.0,0.0,0.0,1.0,0.0,267.0,266.6666,213.33,MoneySpot,,4772321,0.0,01-03-2023,False,Vehicle Expenses,2023-02-28,Orange,0.0,12097.0,9181.77
0062x00000DGQ0OAAX,0012x00000go88mAAA,Oatlands,NSW,Australia,Loan Paid,New Client-New Loan,0.08,96.54,125.3633,4.0,0.0,0.0,1.0,4.0,14648.8182,0.0,2.0,0.0,803.2903,837.6,0.0,3.55,0.0,1.0,0.0,0.0,200.0,1000,1360.0,7.0,13.286,Fortnightly,25.0,10501.96,2600.0,,0.0,0.0,0.011,0.0,2653.4466,0.0,125.3633,194.29,MoneySpot,0.0,4721737,0.0,20-02-2023,False,Student Loan Repayment,2023-02-20,Orange,13.0,15896.0,10501.96
0062x00000E3hoUAAR,0010K000020IXXoQAO,Blacktown,NSW,Australia,Loan Paid,Existing Client-Granted Loan Before,0.0,66.45,1775.8403,2.0,0.0,0.0,2.0,2.0,4954.3305,0.0,20.0,0.0,2280.35,2349.39,1.0,1.21,0.0,0.0,3466.67,599.0,450.0,1000,1360.0,7.0,14.286,Fortnightly,38.0,4954.33,2050.0,Full-Time Employment,0.0,0.0,0.3846,0.0,4560.7,534.0,1903.4233,194.29,MoneySpot,0.0,5508067,0.0,09-06-2023,False,Vehicle Expenses,2023-06-09,Orange,0.0,6196.0,4954.33
0062x00000EDxvOAAT,0010K00001mhdjwQAA,Mount Louisa,QLD,Australia,Loan Paid,Existing Client-Granted Loan Before,0.0,49.38,463.4891,4.0,0.0,0.0,3.0,4.0,2178.1348,0.0,6.0,0.0,1026.6666,1400.0,0.0,11.49,0.0,0.0,5633.33,899.0,300.0,1000,1360.0,14.0,14.0,Weekly,38.0,7326.57,1000.0,Full-Time Employment,0.0,0.0,0.7802,0.0,1460.0,213.0,249.65,97.14,MoneySpot,0.0,5978710,0.0,22-07-2023,False,Vehicle Expenses,2023-07-22,Orange,0.0,4168.0,7326.57
0062x00000D9AY1AAN,0012x00000dBIdsAAG,Sippy Downs,QLD,Australia,Loan Paid,Existing Client-Granted Loan Before,13.26,86.1,2517.0969,2.0,0.0,4.0,2.0,2.0,10225.161,0.0,30.0,872.71,2094.83,2058.19,1.0,0.14,0.0,0.0,0.0,599.0,540.0,1000,1360.0,7.0,13.571,Fortnightly,46.0,10473.49,1000.0,Full-Time Employment,0.0,0.0,0.0,0.0,6458.7233,1786.0,2899.5166,194.29,MoneySpot,0.0,4568348,0.0,28-01-2023,False,Vehicle Expenses,2023-01-27,Orange,1610.0,12133.0,10473.49
0062x00000FuNIdAAN,0010K00002BTA5mQAH,Cobar,NSW,Australia,Closed Lost,Existing Client-Granted Loan Before,0.0,11.68,0.0,0.0,0.0,0.0,0.0,0.0,0.0,1.0,12.0,0.0,0.0,0.0,0.0,0.48,2.0,0.0,0.0,899.0,1000.0,800,1056.0,3.0,12.143,Monthly,37.0,0.0,1500.0,Full-Time Employment,1.0,1.0,0.011,1.0,0.0,0.0,322.0533,352.0,MoneySpot,,8243637,0.0,2024-02-22,False,Vehicle Expenses,2024-02-19,Orange,0.0,6890.0,0.0
0062x00000DrxZJAAZ,0010K000029GXsRQAW,Westbury,TAS,Australia,Loan Paid,Existing Client-Granted Loan Before,2.87,71.83,5775.3129,2.0,0.0,2.0,4.0,2.0,11327.5837,5.0,63.0,1221.2783,2780.73,2780.73,0.0,0.01,0.0,0.0,0.0,899.0,300.0,1000,1360.0,7.0,13.857,Fortnightly,39.0,9397.03,2050.0,Full-Time Employment,9.0,0.0,0.0989,6.0,8439.5566,2006.0,6974.0533,194.29,QuickCash,0.0,5209168,2.0,06-05-2023,False,Home Maintenance & Repairs,2023-05-06,Orange,323.0,11235.0,9397.03
0062x00000DZ2DRAA1,0012x00000hXwtfAAC,Kangaroo Point,QLD,Australia,Closed Lost,New Client-New Loan,0.0,17.08,344.1402,2.0,0.0,0.0,3.0,2.0,4118.9943,6.0,37.0,2.4013,1876.9233,1937.23,0.0,0.0,0.0,0.0,0.0,0.0,1350.0,800,1024.0,3.0,4.714,Fortnightly,28.0,4371.59,800.0,,14.0,0.0,0.1648,9.0,3970.5133,266.0,317.4433,341.33,QuickCash,,5067695,0.0,15-04-2023,False,Family expenses,2023-04-14,Orange,0.0,4533.0,4371.59
0062x00000E76n3AAB,0012x00000iId9vAAC,West Perth,WA,Australia,Loan Paid,Existing Client-No Loan Granted Ever,0.0,89.57,0.0,2.0,0.0,0.0,2.0,2.0,2315.1065,0.0,1.0,0.0,1065.5833,1069.28,0.0,0.0,0.0,0.0,1050.0,599.0,500.0,850,1326.0,18.0,36.571,Fortnightly,18.0,2226.67,4000.0,Full-Time Employment,0.0,0.0,0.0,0.0,2131.1666,0.0,17.5,73.67,MoneySpot,0.0,5793815,0.0,03-07-2023,False,Vehicle Expenses,2023-07-02,Green,0.0,2873.0,2226.67
0062x00000DGDhZAAX,0012x00000GalizAAB,Dalby,QLD,Australia,Loan Paid,Existing Client-Granted Loan Before,23.67,72.69,216.8701,2.0,0.0,2.0,5.0,2.0,4267.2345,0.0,6.0,0.0,869.314,853.75,0.0,0.0,0.0,0.0,2166.67,400.0,0.0,700,952.0,7.0,14.0,Fortnightly,56.0,3643.61,700.0,Unemployed,0.0,0.0,0.0769,0.0,2740.9433,203.0,203.2,136.0,MoneySpot,0.0,4710320,0.0,18-02-2023,False,Other Expenses,2023-02-18,Green,1292.0,5458.0,3643.61
0062x00000EOOCQAA5,0012x00000iJKtcAAG,Springwood,QLD,Australia,Loan Paid,Existing Client-No Loan Granted Ever,0.0,91.68,821.4062,0.0,0.0,0.0,0.0,0.0,0.0,1.0,28.0,0.0,0.0,0.0,0.0,0.0,0.0,0.0,0.0,400.0,0.0,800,1088.0,14.0,14.0,Weekly,44.0,6157.65,5000.0,,10.0,0.0,0.011,5.0,0.0,0.0,622.1266,77.71,MoneySpot,0.0,6254471,0.0,18-08-2023,False,Vehicle Expenses,2023-08-18,Orange,0.0,6106.0,6157.65
0062x00000D6q4TAAR,0010K00001eH7pJQAS,Mooroobool,QLD,Australia,Loan Paid,Existing Client-Granted Loan Before,0.0,67.87,2180.5067,1.0,0.0,0.0,2.0,1.0,8901.0481,0.0,34.0,0.0,1922.6523,1891.36,1.0,0.35,0.0,0.0,6066.67,599.0,1200.0,800,1088.0,14.0,14.0,Weekly,43.0,8901.05,1500.0,Full-Time Employment,0.0,0.0,0.4615,0.0,8331.4933,1372.0,3608.79,77.71,MoneySpot,0.0,4455769,0.0,11-01-2023,False,White goods,2023-01-11,Orange,0.0,8925.0,8901.05
0062x00000D7Z0TAAV,0012x000002dWfGAAU,Macquarie,ACT,Australia,Closed Lost,Existing Client-No Loan Granted Ever,0.0,57.88,716.9643,4.0,0.0,0.0,4.0,4.0,5488.8266,0.0,12.0,836.4583,1901.2766,1524.31,1.0,0.0,0.0,1.0,3900.0,400.0,1800.0,1000,1280.0,3.0,6.429,Fortnightly,31.0,5488.83,2000.0,Full-Time Employment,0.0,0.0,0.0,0.0,1686.2733,330.0,837.2533,426.67,MoneySpot,,4489291,0.0,21-01-2023,False,Vehicle Repairs & Maintenance,2023-01-16,Orange,0.0,7030.0,5488.83
0062x00000DXHTTAA5,0012x00000SIOURAA5,Mango Hill,QLD,Australia,Loan Paid,Existing Client-Granted Loan Before,0.0,40.82,872.9862,1.0,0.0,0.0,4.0,1.0,6079.3366,7.0,30.0,1734.6094,1549.5454,2489.0,0.0,0.0,0.0,0.0,3783.8,1500.0,550.0,1000,1360.0,14.0,14.286,Weekly,42.0,6139.34,3000.0,Full-Time Employment,7.0,0.0,0.1319,3.0,5681.6666,1071.0,1589.75,97.14,MoneySpot,0.0,4963998,5.0,30-03-2023,False,Vehicle Expenses,2023-03-30,Orange,0.0,7589.0,6139.34
0062x00000DHIl1AAH,0012x00000INhawAAD,Nightcliff,NT,Australia,Loan Paid,Existing Client-Granted Loan Before,0.0,73.22,1111.604,1.0,2.0,0.0,2.0,1.0,4883.2954,13.0,68.0,361.6461,1123.8269,993.47,0.0,0.0,0.0,0.0,4477.58,899.0,600.0,1000,1480.0,14.0,27.143,Fortnightly,46.0,5609.3,2050.0,Full-Time Employment,13.0,0.0,0.044,9.0,4869.9166,500.0,1552.8133,105.71,QuickCash,0.0,4771149,12.0,01-03-2023,False,Vehicle Expenses,2023-02-28,Green,0.0,5737.0,5609.3
0062x00000Ee1sNAAR,0010K00001y9ACFQA2,Deception Bay,QLD,Australia,Loan Paid,Existing Client-Granted Loan Before,0.0,68.03,3383.7468,1.0,0.0,0.0,1.0,1.0,7703.6031,2.0,80.0,0.0,964.3161,978.47,0.0,0.75,0.0,0.0,260000.0,899.0,1000.0,750,1020.0,14.0,14.571,Weekly,64.0,9436.94,750.0,Full-Time Employment,2.0,0.0,0.011,0.0,7085.6866,497.0,3123.2233,72.86,MoneySpot,0.0,6458440,1.0,08-09-2023,False,Medical Expenses,2023-09-08,Orange,0.0,11282.0,9436.94
0062x00000Ds1auAAB,0012x00000hXNrcAAG,Clayton,VIC,Australia,Closed Lost,Existing Client-No Loan Granted Ever,0.73,32.69,1113.2826,1.0,0.0,0.0,4.0,1.0,5903.0206,0.0,9.0,0.0,740.8469,742.0,1.0,0.23,0.0,0.0,0.0,2000.0,480.0,800,1088.0,14.0,13.714,Weekly,46.0,3941.01,3000.0,,0.0,0.0,0.0,0.0,3210.3366,0.0,897.78,77.71,MoneySpot,,5215102,0.0,07-05-2023,False,Living Expenses,2023-05-07,Orange,44.0,5971.0,3941.01
0062x00000EDLsrAAH,0012x00000gmUbMAAU,Lutwyche,QLD,Australia,Loan Paid,Existing Client-Granted Loan Before,0.0,93.26,669.1033,0.0,1.0,0.0,0.0,0.0,0.0,3.0,27.0,494.7153,0.0,0.0,0.0,0.0,0.0,0.0,0.0,0.0,940.0,700,952.0,14.0,14.286,Weekly,22.0,4304.06,1000.0,,3.0,0.0,0.044,1.0,0.0,477.0,1255.1366,68.0,MoneySpot,0.0,5939268,3.0,18-07-2023,False,Bond Loan,2023-07-18,Orange,0.0,4559.0,4304.06
0062x00000DAJuuAAH,0012x00000c8gw0AAA,Caboolture,QLD,Australia,Loan Paid,Existing Client-Granted Loan Before,5.41,97.71,2551.156,2.0,0.0,0.0,3.0,2.0,2930.6209,3.0,37.0,409.6908,696.0316,795.58,1.0,0.32,0.0,0.0,2509.28,400.0,0.0,1000,1360.0,7.0,14.429,Fortnightly,23.0,2226.94,1000.0,Part-Time Employment,3.0,0.0,0.033,0.0,1883.3233,1354.0,3478.5766,194.29,MoneySpot,0.0,4624519,3.0,06-02-2023,False,Furniture or Appliances,2023-02-05,Orange,250.0,4618.0,2226.94
0062x00000DJHzmAAH,0012x00000ckYWZAA2,FLYNN,ACT,Australia,Loan Paid,Existing Client-Granted Loan Before,0.0,19.72,2545.6378,0.0,0.0,0.0,0.0,0.0,0.0,0.0,58.0,306.1438,0.0,0.0,0.0,7.82,0.0,0.0,0.0,1499.0,900.0,550,748.0,7.0,14.0,Fortnightly,47.0,4912.17,550.0,Full-Time Employment,0.0,0.0,0.0,0.0,4906.7666,775.0,3150.6966,106.86,MoneySpot,0.0,4881169,0.0,17-03-2023,False,Vehicle Expenses,2023-03-17,Orange,0.0,4730.0,4912.17
0062x00000DtCGxAAN,0012x00000OJeNhAAL,Lavington,NSW,Australia,Closed Lost,Existing Client-No Loan Granted Ever,0.0,85.7,409.6093,1.0,1.0,0.0,3.0,1.0,5186.4634,9.0,12.0,0.0,939.88,963.35,0.0,0.0,0.0,0.0,1462.5,400.0,1160.0,800,1024.0,6.0,6.571,Weekly,33.0,5279.8,800.0,Casual Employment,9.0,0.0,0.0,5.0,4072.8133,0.0,424.93,170.67,QuickCash,,5296017,8.0,17-05-2023,False,Business - Equipment Purchase,2023-05-16,Orange,0.0,6164.0,5279.8
0062x00000Ewxl5AAB,0012x00000dzeptAAA,Docklands,VIC,Australia,Loan Paid,Existing Client-Granted Loan Before,0.0,96.9,1045.0098,2.0,1.0,0.0,3.0,2.0,5267.7521,0.0,9.0,0.0,2238.9666,2152.77,0.0,0.0,0.0,0.0,4638.36,599.0,500.0,1000,1360.0,7.0,13.571,Fortnightly,40.0,5267.75,1500.0,Full-Time Employment,9.0,0.0,0.0769,1.0,4477.9333,860.0,1498.6,194.29,MoneySpot,0.0,6628809,9.0,24-09-2023,False,Other Expenses,2023-09-24,Orange,0.0,9043.0,5267.75
0062x00000DIPBpAAP,0012x000002dvcaAAA,Byford,WA,Australia,Loan Paid,Existing Client-Granted Loan Before,0.0,92.7,1312.0618,1.0,0.0,0.0,2.0,1.0,5891.6768,4.0,21.0,439.106,924.6153,1047.0,0.0,0.43,0.0,1.0,3726.67,400.0,0.0,600,792.0,5.0,8.857,Fortnightly,43.0,7064.12,600.0,Full-Time Employment,5.0,1.0,0.0,1.0,815.8666,591.0,1279.0166,158.4,Financier-2,0.0,4830916,2.0,10-03-2023,False,Medical Expenses,2023-03-09,Orange,0.0,6900.0,7064.12
0062x00000DWSxvAAH,0012x000002aN6YAAU,Maroochydore,QLD,Australia,Closed Lost,Existing Client-Granted Loan Before,0.0,48.29,143.3929,4.0,0.0,0.0,1.0,4.0,330.9466,1.0,71.0,1189.7061,66.1893,170.0,1.0,0.0,0.0,1.0,0.0,899.0,1160.0,800,1056.0,10.0,9.857,Weekly,45.0,4929.16,800.0,,1.0,0.0,0.5934,0.0,0.0,1121.0,1715.58,105.6,QuickCash,,4918061,1.0,23-03-2023,False,Medical Expenses,2023-03-23,Green,0.0,4917.0,4929.16
0062x00000DWZYsAAP,0010K00001rGP94QAG,Fig Tree Pocket,QLD,Australia,Loan Paid,Existing Client-Granted Loan Before,19.83,93.86,991.6441,2.0,0.0,2.0,4.0,2.0,7115.1889,0.0,20.0,633.1819,1751.38,1751.38,0.0,0.0,0.0,0.0,3523.0,899.0,1080.0,800,1056.0,7.0,13.0,Fortnightly,34.0,6360.65,800.0,Full-Time Employment,0.0,0.0,0.011,0.0,5221.92,842.0,1188.5766,150.86,MoneySpot,0.0,4923791,0.0,24-03-2023,False,Child Expenses,2023-03-23,Green,1732.0,8732.0,6360.65
0062x00000F1WbJAAV,0012x00000Tr7VAAAZ,Fletcher,NSW,Australia,Loan Paid,Existing Client-Granted Loan Before,0.41,43.24,1422.1,2.0,0.0,0.0,3.0,2.0,5581.8195,0.0,10.0,0.0,2331.2666,2569.46,0.0,0.0,0.0,0.0,4550.0,899.0,400.0,1000,1440.0,13.0,24.857,Fortnightly,40.0,5581.82,1000.0,Full-Time Employment,0.0,0.0,0.0,0.0,4662.5333,655.0,1915.32,110.77,MoneySpot,0.0,6899488,0.0,20-10-2023,False,Living Expenses,2023-10-20,Orange,24.0,5790.0,5581.82
0062x00000D7to8AAB,0012x00000floN7AAI,Seaford,VIC,Australia,Loan Paid,Existing Client-Granted Loan Before,0.0,25.83,1998.7477,3.0,0.0,0.0,4.0,3.0,8871.92,0.0,14.0,0.0,8871.92,8373.25,0.0,0.05,0.0,0.0,7791.0,1500.0,2055.0,800,1056.0,3.0,9.857,Monthly,36.0,8871.92,800.0,Full-Time Employment,0.0,0.0,0.1648,0.0,8871.92,341.0,2252.64,352.0,QuickCash,0.0,4505206,0.0,19-01-2023,False,Living Expenses,2023-01-18,Green,0.0,9124.0,8871.92
0062x00000DZpzyAAD,0012x00000hYObRAAW,Kayena,TAS,Australia,Loan Paid,New Client-New Loan,0.0,36.7,280.7671,2.0,0.0,0.0,4.0,2.0,4565.6817,0.0,3.0,0.0,1879.0,1732.0,0.0,0.0,0.0,0.0,20000.0,2000.0,150.0,700,896.0,3.0,4.857,Fortnightly,35.0,4650.35,700.0,Full-Time Employment,0.0,0.0,0.0659,0.0,3758.0,129.0,445.8966,298.67,QuickCash,0.0,5117533,0.0,22-04-2023,False,Living Expenses,2023-04-22,Green,0.0,5521.0,4650.35
0062x00000DVIdAAAX,0010K00001qm3L0QAI,Walkerston,QLD,Australia,Loan Paid,Existing Client-Granted Loan Before,22.25,95.3,940.8433,2.0,0.0,2.0,2.0,2.0,6577.2134,5.0,7.0,314.4371,1483.7571,1608.9,1.0,4.74,0.0,1.0,3900.0,599.0,1100.0,1000,1360.0,7.0,14.143,Fortnightly,28.0,7382.2,2050.0,Full-Time Employment,5.0,0.0,0.0,0.0,1993.6466,265.0,1142.3533,194.29,MoneySpot,0.0,5435969,0.0,30-05-2023,False,Child Expenses,2023-05-29,Orange,1994.0,8958.0,7382.2
0062x00000DGEW7AAP,0012x00000Ttf4BAAR,Double Bay,NSW,Australia,Loan Paid,Existing Client-Granted Loan Before,0.0,53.87,1591.8434,1.0,0.0,0.0,4.0,1.0,4082.5918,0.0,17.0,899.2,834.46,834.46,0.0,0.0,0.0,0.0,3686.76,400.0,0.0,1000,1360.0,14.0,13.857,Weekly,42.0,4082.59,1000.0,Full-Time Employment,0.0,0.0,0.0,0.0,3615.9933,939.0,2768.35,97.14,QuickCash,0.0,4710757,0.0,18-02-2023,False,Relocation Expenses,2023-02-18,Green,0.0,5709.0,4082.59
0062x00000D9OtdAAF,0012800001SDTCuAAP,Telina,QLD,Australia,Loan Paid,Existing Client-Granted Loan Before,1.86,27.87,3144.3228,1.0,0.0,0.0,2.0,1.0,4394.1055,4.0,64.0,1049.2973,886.2671,1064.15,1.0,0.0,0.0,0.0,0.0,1499.0,100.0,800,1088.0,14.0,14.286,Weekly,32.0,13622.48,800.0,Full-Time Employment,4.0,0.0,0.2967,1.0,2611.0233,1430.0,3453.57,77.71,MoneySpot,0.0,4580636,4.0,30-01-2023,False,Relocation Expenses,2023-01-30,Green,132.0,7059.0,13622.48
0062x00000Ech71AAB,0012x00000MjMMzAAN,Lakes Entrance,VIC,Australia,Loan Paid,Existing Client-Granted Loan Before,39.34,81.67,1114.293,1.0,1.0,4.0,3.0,4.0,9973.0349,41.0,61.0,412.0155,1233.0512,788.06,1.0,0.0,0.0,0.0,0.0,899.0,1520.0,1000,1360.0,14.0,14.0,Weekly,46.0,9051.03,2050.0,Full-Time Employment,45.0,0.0,0.0549,0.0,6579.2266,576.0,3773.03,97.14,MoneySpot,0.0,6372692,24.0,30-08-2023,False,Vehicle Expenses,2023-08-30,Orange,4515.0,11476.0,9051.03
0062x00000DHPhtAAH,0012x00000ADiUtAAL,Millner,NT,Australia,Loan Paid,Existing Client-Granted Loan Before,0.0,75.67,1490.359,4.0,0.0,0.0,4.0,4.0,6188.2066,1.0,29.0,211.0543,2874.77,2874.77,1.0,0.0,0.0,0.0,890.0,599.0,330.0,1000,1320.0,5.0,9.286,Fortnightly,39.0,8199.54,1000.0,Full-Time Employment,1.0,0.0,0.1758,0.0,5749.54,1135.0,2546.11,264.0,MoneySpot,0.0,4776990,0.0,01-03-2023,False,Living Expenses,2023-03-01,Green,0.0,13451.0,8199.54
0062x00000DIPFDAA5,0012x00000g8b3AAAQ,Warrnambool,VIC,Australia,Loan Paid,Existing Client-No Loan Granted Ever,0.42,39.09,1522.1979,2.0,0.0,0.0,2.0,2.0,4708.9174,1.0,11.0,0.0,1627.3928,1604.01,0.0,0.13,0.0,0.0,1800.0,2000.0,0.0,1000,1280.0,3.0,5.857,Fortnightly,62.0,3535.7,1000.0,Casual Employment,2.0,0.0,0.011,2.0,3797.25,488.0,2003.01,426.67,QuickCash,0.0,4830957,2.0,10-03-2023,False,Living Expenses,2023-03-09,Orange,23.0,5356.0,3535.7
0062x00000FJHbOAAX,0012x00000LQwpyAAD,Petersham,NSW,Australia,Loan Paid,Existing Client-Granted Loan Before,0.0,92.73,1431.77,2.0,0.0,0.0,1.0,2.0,6143.4639,0.0,28.0,0.0,1866.6785,1947.0,1.0,0.0,0.0,1.0,1800.0,599.0,1000.0,750,1020.0,8.0,15.429,Fortnightly,32.0,6866.8,750.0,Full-Time Employment,0.0,0.0,1.0,0.0,0.0,626.0,1506.4633,127.5,MoneySpot,0.0,7313205,0.0,25-11-2023,False,Living Expenses,2023-11-25,Orange,0.0,7409.0,6866.8
0062x00000D1m5sAAB,0010K00001rIhPiQAK,Kedron,QLD,Australia,Loan Paid,Existing Client-Granted Loan Before,0.57,94.15,1996.6803,1.0,2.0,0.0,2.0,1.0,2128.8115,24.0,0.0,801.1826,487.5407,673.93,2.0,0.0,0.0,0.0,1061.67,400.0,100.0,800,1088.0,14.0,15.0,Weekly,31.0,2128.81,1300.0,Part-Time Employment,24.0,0.0,0.9121,14.0,2112.6766,1177.0,2262.0766,77.71,MoneySpot,0.0,4410242,26.0,04-01-2023,False,Vehicle Expenses,2023-01-04,Orange,13.0,2257.0,2128.81
0062x00000DFTmFAAX,0012x00000TFKTBAA5,EUMEMMERRING,VIC,Australia,Loan Paid,Existing Client-Granted Loan Before,0.0,48.07,114.7134,1.0,0.0,0.0,4.0,1.0,3175.4284,0.0,17.0,0.0,708.9808,843.0,2.0,19.47,0.0,0.0,3900.0,400.0,640.0,1000,1360.0,14.0,13.571,Weekly,22.0,3305.62,1000.0,Full-Time Employment,0.0,0.0,0.0,0.0,3173.2,98.0,150.6966,97.14,QuickCash,0.0,4670617,0.0,13-02-2023,False,Other Expenses,2023-02-12,Green,0.0,3035.0,3305.62
0062x00000DHSB4AAP,0012x00000dzuTSAAY,Carlisle,WA,Australia,Loan Paid,Existing Client-Granted Loan Before,0.0,45.68,546.4871,4.0,1.0,0.0,3.0,4.0,7331.8989,7.0,29.0,0.0,2650.798,2874.2,0.0,0.0,0.0,0.0,0.0,599.0,600.0,700,924.0,7.0,13.143,Fortnightly,29.0,7816.91,700.0,,7.0,0.0,0.1099,0.0,6561.3566,1729.0,1922.33,132.0,QuickCash,0.0,4778473,7.0,01-03-2023,False,Living Expenses,2023-03-01,Green,0.0,12134.0,7816.91
0062x00000E3mqVAAR,0012x00000hYOxgAAG,Ipswich,QLD,Australia,Loan Paid,Existing Client-No Loan Granted Ever,1.3,45.95,1608.1835,1.0,0.0,4.0,3.0,1.0,2756.5808,0.0,5.0,948.3917,619.0223,717.21,0.0,2.52,0.0,1.0,3250.0,599.0,1000.0,700,952.0,14.0,14.286,Weekly,30.0,2756.58,5000.0,Full-Time Employment,0.0,0.0,0.0,0.0,66.7833,972.0,1819.7966,68.0,MoneySpot,0.0,5517309,0.0,07-06-2023,False,Living Expenses,2023-06-07,Orange,92.0,7071.0,2756.58
0062x00000DGXKHAA5,0012x00000LPZMPAA5,Waratah,NSW,Australia,Loan Paid,Existing Client-Granted Loan Before,38.21,79.16,309.1628,2.0,0.0,4.0,1.0,2.0,4568.9719,1.0,13.0,205.8305,1327.8633,1322.21,0.0,0.0,0.0,0.0,0.0,400.0,100.0,600,816.0,7.0,14.0,Fortnightly,27.0,4327.51,600.0,Full-Time Employment,1.0,0.0,0.3846,0.0,2770.43,205.0,322.5566,116.57,QuickCash,0.0,4727282,1.0,21-02-2023,False,Vehicle Expenses,2023-02-21,Orange,1443.0,3776.0,4327.51
0062x00000DW1xEAAT,0012x00000gpnJVAAY,West End,QLD,Australia,Closed Lost,New Client-New Loan,0.85,88.08,292.53,1.0,0.0,0.0,3.0,1.0,3324.426,0.0,8.0,0.0,765.0738,789.26,1.0,0.0,0.0,0.0,3254.33,1500.0,1020.0,1000,1280.0,6.0,6.571,Weekly,22.0,3324.43,1000.0,Full-Time Employment,0.0,0.0,0.0,0.0,3315.32,0.0,330.71,213.33,QuickCash,,4891647,0.0,23-03-2023,False,Living Expenses,2023-03-18,Orange,29.0,3374.0,3324.43
0062x00000DXVi5AAH,0012x000003EG7rAAG,Williamstown,SA,Australia,Loan Paid,Existing Client-Granted Loan Before,2.87,98.25,624.8031,2.0,1.0,2.0,5.0,2.0,5171.5723,13.0,64.0,365.0,1025.5533,1403.2,1.0,0.5,0.0,0.0,3250.0,599.0,350.0,700,896.0,3.0,6.0,Fortnightly,44.0,5171.57,700.0,Full-Time Employment,13.0,0.0,0.3516,0.0,3393.7733,794.0,2153.3466,298.67,Financier-2,0.0,4977723,8.0,01-04-2023,False,Vehicle Expenses,2023-04-01,Green,189.0,6565.0,5171.57
0062x00000DWjmiAAD,0012x00000gmaC4AAI,Victoria Park,WA,Australia,Loan Paid,Existing Client-Granted Loan Before,0.0,47.17,0.0,2.0,0.0,0.0,3.0,2.0,3359.5786,0.0,9.0,0.0,1546.3271,1956.74,0.0,0.0,0.0,0.0,0.0,599.0,500.0,1000,1280.0,3.0,5.571,Fortnightly,24.0,4135.73,1000.0,,0.0,0.0,0.2967,0.0,3608.0966,299.0,298.6666,426.67,QuickCash,0.0,4934496,0.0,26-03-2023,False,Other Expenses,2023-03-25,Green,0.0,4230.0,4135.73
0062x00000DGY2JAAX,0012x00000RrIuaAAF,O'Sullivan Beach,SA,Australia,Loan Paid,Existing Client-Granted Loan Before,0.0,67.61,1729.8763,1.0,0.0,0.0,2.0,1.0,4689.2167,0.0,59.0,927.5922,854.4246,905.41,1.0,0.0,0.0,0.0,870.0,1499.0,1320.0,1000,1360.0,14.0,14.143,Weekly,46.0,4856.16,1000.0,Contract Employment,0.0,0.0,0.0,0.0,3702.5066,659.0,2795.2266,97.14,MoneySpot,0.0,4727755,0.0,21-02-2023,False,Other Expenses,2023-02-21,Orange,0.0,4863.0,4856.16
0062x00000D8vC5AAJ,0012x00000XNzFJAA1,Saint Clair,NSW,Australia,Loan Paid,Existing Client-Granted Loan Before,0.0,65.26,100.3066,1.0,0.0,0.0,2.0,1.0,1004.9332,0.0,27.0,0.0,120.0,80.0,0.0,0.0,1.0,1.0,2991.12,599.0,800.0,1000,1360.0,14.0,14.143,Weekly,29.0,7212.52,1000.0,Full-Time Employment,0.0,0.0,0.3407,0.0,0.0,563.0,713.7566,97.14,QuickCash,0.0,4556168,0.0,26-01-2023,False,Living Expenses,2023-01-26,Orange,0.0,8015.0,7212.52
0062x00000E3gzMAAR,0012x00000OJ1ZXAA1,Stuart,QLD,Australia,Closed Lost,Existing Client-No Loan Granted Ever,0.0,12.65,3164.8127,1.0,0.0,0.0,4.0,1.0,3185.212,0.0,38.0,0.0,837.755,1008.84,0.0,0.0,0.0,0.0,3060.0,899.0,1000.0,700,952.0,14.0,14.571,Weekly,41.0,3185.21,7000.0,Full-Time Employment,0.0,0.0,0.0,0.0,3351.02,701.0,3065.6166,68.0,MoneySpot,,5507549,0.0,05-06-2023,False,Vehicle Other,2023-06-05,Orange,0.0,3734.0,3185.21
0062x00000ENKkWAAX,0012x000002dvcaAAA,Byford,WA,Australia,Loan Paid,Existing Client-Granted Loan Before,0.25,84.96,2323.1917,1.0,0.0,0.0,1.0,1.0,6822.5794,5.0,6.0,0.0,917.1538,929.0,0.0,1.56,0.0,1.0,3726.67,400.0,200.0,600,816.0,12.0,16.143,Weekly,43.0,8306.89,2050.0,Full-Time Employment,5.0,1.0,0.0,0.0,1274.0366,468.0,2479.7966,68.0,Financier-2,0.0,6165816,0.0,10-08-2023,False,Medical Expenses,2023-08-10,Orange,19.0,7576.0,8306.89
0062x00000F2bHcAAJ,0012x00000ldl26AAA,Malvern East,VIC,Australia,Closed Lost,New Client-New Loan,0.0,44.97,3193.7065,4.0,0.0,0.0,2.0,4.0,366.6666,8.0,24.0,0.0,366.6666,300.0,0.0,0.0,0.0,1.0,7339.0,400.0,1782.0,1000,1320.0,3.0,11.429,Monthly,30.0,366.67,28900.0,Full-Time Employment,8.0,0.0,0.033,6.0,0.0,0.0,4754.4133,440.0,MoneySpot,,6981554,0.0,02-11-2023,False,Living Expenses,2023-10-28,Orange,0.0,7618.0,366.67
0062x00000D7h98AAB,0010K00001y8HseQAE,KIRWAN,QLD,Australia,Loan Paid,Existing Client-Granted Loan Before,0.0,31.43,1719.0654,2.0,0.0,0.0,1.0,2.0,4003.7367,13.0,61.0,812.8434,1842.8171,1887.4,2.0,0.32,1.0,0.0,2946.67,1499.0,850.0,800,1088.0,7.0,14.0,Fortnightly,46.0,4003.74,800.0,Full-Time Employment,13.0,0.0,0.4835,9.0,4299.9066,445.0,1867.3433,155.43,QuickCash,0.0,4495209,7.0,17-01-2023,False,Medical Expenses,2023-01-17,Green,0.0,4343.0,4003.74
0062x00000FgTfpAAF,0010K00001uGGpMQAW,Loganholme,QLD,Australia,Loan Paid,Existing Client-Granted Loan Before,0.0,86.46,520.405,1.0,0.0,0.0,3.0,1.0,5129.4233,3.0,42.0,0.0,984.4818,881.19,0.0,0.0,0.0,0.0,1731.17,599.0,1200.0,1000,1320.0,10.0,10.0,Weekly,49.0,5129.42,1000.0,Full-Time Employment,3.0,0.0,0.1758,0.0,3609.7666,461.0,1699.51,132.0,MoneySpot,0.0,7810897,0.0,2024-01-11,False,Vehicle Expenses,2024-01-11,Orange,0.0,5520.0,5129.42
0062x00000DZ3whAAD,0012x000003DR2mAAG,Wattleup,WA,Australia,Loan Paid,Existing Client-Granted Loan Before,0.0,99.92,1370.7166,1.0,0.0,0.0,3.0,1.0,3763.4085,0.0,24.0,0.0,866.1,866.1,0.0,0.0,0.0,0.0,3973.67,599.0,260.0,800,1024.0,8.0,7.714,Weekly,60.0,7531.83,2050.0,Full-Time Employment,0.0,0.0,0.0,0.0,2598.3,1371.0,1370.7166,128.0,MoneySpot,0.0,5069510,0.0,15-04-2023,False,Vehicle Expenses,2023-04-15,Orange,0.0,3753.0,7531.83
0062x00000D85liAAB,0012x00000RrHOIAA3,Saint Marys,NSW,Australia,Loan Paid,Existing Client-Granted Loan Before,17.12,50.78,1027.1424,1.0,1.0,2.0,3.0,1.0,6173.342,8.0,0.0,533.4636,782.24,874.63,1.0,0.0,0.0,0.0,3341.0,899.0,320.0,1000,1360.0,14.0,13.857,Weekly,28.0,10543.98,1500.0,Full-Time Employment,8.0,0.0,0.0,3.0,2189.01,430.0,1977.25,97.14,QuickCash,0.0,4514394,2.0,20-01-2023,False,Living Expenses,2023-01-20,Green,1146.0,6692.0,10543.98
0062x00000D9H5zAAF,0012x00000BGyFMAA1,Redland Bay,QLD,Australia,Loan Paid,Existing Client-Granted Loan Before,0.0,27.45,261.4742,2.0,2.0,0.0,1.0,2.0,4579.8809,4.0,25.0,182.7172,2108.0,2108.0,0.0,0.0,0.0,0.0,0.0,599.0,635.0,950,1254.0,5.0,9.286,Fortnightly,36.0,4216.0,950.0,,4.0,0.0,0.2747,2.0,4216.0,249.0,447.5833,250.8,MoneySpot,0.0,4574428,3.0,29-01-2023,False,Vehicle Expenses,2023-01-29,Orange,0.0,5033.0,4216.0
0062x00000DHfkgAAD,0012x00000XQCmgAAH,Karama,NT,Australia,Loan Paid,Existing Client-Granted Loan Before,16.58,52.13,720.656,1.0,0.0,4.0,1.0,1.0,6642.1908,0.0,15.0,0.0,1292.0833,1335.0,0.0,0.0,0.0,1.0,5200.0,400.0,150.0,1000,1320.0,12.0,11.714,Weekly,46.0,6975.52,2050.0,Full-Time Employment,0.0,0.0,0.011,0.0,1204.3066,498.0,497.55,110.0,MoneySpot,0.0,4790629,0.0,03-03-2023,False,Home Maintenance & Repairs,2023-03-03,Orange,1204.0,7260.0,6975.52
0062x00000E3Wj9AAF,0012x00000SFxoKAAT,Hallett Cove,SA,Australia,Loan Paid,Existing Client-Granted Loan Before,0.0,77.07,5279.4272,2.0,0.0,0.0,4.0,2.0,8166.4947,0.0,0.0,1579.7285,3758.8257,2140.83,1.0,0.77,0.0,0.0,7679.09,599.0,1800.0,1000,1360.0,7.0,13.857,Fortnightly,55.0,8166.49,2050.0,Full-Time Employment,0.0,0.0,0.011,0.0,8770.5933,1665.0,7039.7966,194.29,QuickCash,0.0,5492028,0.0,03-06-2023,False,Other Expenses,2023-06-03,Orange,0.0,9501.0,8166.49
0062x00000DG0wHAAT,0012x00000flvJdAAI,Liverpool,NSW,Australia,Loan Paid,Existing Client-Granted Loan Before,0.0,67.03,7254.8112,2.0,0.0,0.0,2.0,2.0,11827.1053,3.0,80.0,0.0,2993.0716,3249.04,0.0,0.03,0.0,0.0,0.0,1499.0,350.0,1000,1360.0,14.0,13.857,Weekly,45.0,11827.11,2050.0,Full-Time Employment,3.0,0.0,0.022,1.0,10157.98,545.0,11130.8433,97.14,MoneySpot,0.0,4697883,2.0,17-02-2023,False,Medical Expenses,2023-02-16,Orange,0.0,14531.0,11827.11
0062x00000D9fQIAAZ,0012x00000BGVpjAAH,Cooktown,QLD,Australia,Loan Paid,Existing Client-Granted Loan Before,23.81,88.57,1560.588,1.0,0.0,2.0,2.0,1.0,7337.8633,9.0,35.0,603.7383,833.4936,921.79,0.0,0.1,0.0,1.0,3622.67,899.0,516.0,700,952.0,14.0,14.0,Weekly,39.0,7396.2,700.0,Full-Time Employment,9.0,0.0,0.1868,1.0,1646.0233,620.0,1155.1033,68.0,QuickCash,0.0,4593339,8.0,02-02-2023,False,Vehicle Expenses,2023-02-02,Orange,1646.0,6913.0,7396.2
0062x00000FX9LNAA1,0012x00000IMnC6AAL,Ropes Crossing,NSW,Australia,Loan Paid,Existing Client-Granted Loan Before,0.0,76.34,3787.3174,2.0,0.0,0.0,3.0,2.0,4477.5584,2.0,47.0,560.7438,2060.9042,2137.94,0.0,0.0,0.0,0.0,2200.0,1499.0,400.0,1000,1360.0,8.0,16.0,Fortnightly,31.0,4773.81,2050.0,Full-Time Employment,2.0,0.0,0.044,0.0,4808.7766,942.0,4681.66,170.0,MoneySpot,0.0,7728203,0.0,2024-01-04,False,Life Event Expenses,2024-01-04,Orange,0.0,6170.0,4773.81
0062x00000DZLwqAAH,0012x00000hY8DDAA0,Thornton,NSW,Australia,Closed Lost,New Client-New Loan,2.47,95.91,0.0,2.0,0.0,2.0,5.0,2.0,18039.1197,0.0,13.0,0.0,4139.5833,3818.0,0.0,0.0,0.0,0.0,0.0,0.0,1300.0,1000,1280.0,3.0,6.429,Fortnightly,33.0,18018.24,1000.0,,0.0,0.0,0.022,0.0,8851.7,0.0,610.5233,426.67,QuickCash,,5087904,0.0,18-04-2023,False,Other,2023-04-18,Green,545.0,22060.0,18018.24
0062x00000DIcgbAAD,0012x00000gpGsqAAE,Saint Clair,NSW,Australia,Closed Lost,New Client-New Loan,0.0,22.81,0.0,1.0,0.0,0.0,2.0,1.0,4669.5259,0.0,0.0,0.0,938.85,1040.54,0.0,0.0,0.0,0.0,0.0,0.0,0.0,1000,1280.0,6.0,6.571,Weekly,19.0,4669.53,2000.0,,0.0,0.0,0.0,0.0,2190.65,0.0,0.0,213.33,MoneySpot,,4844482,0.0,12-03-2023,False,Medical Bill,2023-03-11,Orange,0.0,2791.0,4669.53
0062x00000DGnV3AAL,0012x00000goLKsAAM,Spearwood,WA,Australia,Closed Lost,New Client-New Loan,0.0,74.24,725.4929,1.0,0.0,0.0,1.0,1.0,5439.7088,0.0,7.0,0.0,985.1,891.7,1.0,0.34,0.0,0.0,0.0,0.0,0.0,1000,1280.0,6.0,5.571,Weekly,28.0,5663.04,1000.0,,0.0,0.0,0.0,0.0,3940.4,928.0,1114.19,213.33,QuickCash,,4742980,0.0,28-02-2023,False,Other,2023-02-23,Green,0.0,6452.0,5663.04
0062x00000DZgIxAAL,0012x00000hYK7BAAW,Gledswood Hills,NSW,Australia,Loan Paid,New Client-New Loan,7.57,95.49,1863.052,2.0,0.0,0.0,3.0,2.0,2278.9231,7.0,20.0,0.0,1048.93,819.16,1.0,0.0,0.0,0.0,0.0,0.0,0.0,700,896.0,3.0,5.857,Fortnightly,34.0,3144.61,2500.0,,7.0,0.0,0.1978,3.0,3111.5933,0.0,2760.4766,298.67,MoneySpot,0.0,5107279,4.0,21-04-2023,False,Education Bills,2023-04-21,Orange,271.0,3579.0,3144.61
0062x00000DWOpEAAX,0012800001IbAMqAAN,Eastern Heights,QLD,Australia,Loan Paid,Existing Client-Granted Loan Before,34.14,40.17,540.1835,4.0,0.0,2.0,1.0,2.0,2321.3242,0.0,26.0,836.5816,614.4616,796.9,0.0,0.0,0.0,0.0,3813.33,599.0,200.0,600,792.0,10.0,9.857,Weekly,56.0,2215.26,2050.0,Full-Time Employment,0.0,0.0,0.6154,0.0,2215.2566,460.0,460.0433,79.2,MoneySpot,0.0,4913506,0.0,23-03-2023,True,Travel Expenses,2023-03-22,Orange,1229.0,3599.0,2215.26
0062x00000DZ6ctAAD,0012x00000goOAvAAM,Ambarvale,NSW,Australia,Closed Lost,Existing Client-No Loan Granted Ever,0.0,19.65,0.0,1.0,0.0,0.0,4.0,1.0,4026.1423,0.0,5.0,0.0,918.3946,956.25,0.0,0.0,0.0,0.0,0.0,400.0,580.0,700,896.0,6.0,5.714,Weekly,62.0,4092.81,5000.0,Full-time,0.0,0.0,0.1978,0.0,3979.71,0.0,0.0,149.33,MoneySpot,,5073303,0.0,20-04-2023,False,Vehicle Expenses,2023-04-16,Orange,0.0,4154.0,4092.81
0062x00000DGHXMAA5,0012x00000g9SA8AAM,Campbells Creek,VIC,Australia,Loan Paid,Existing Client-Granted Loan Before,0.0,30.82,463.4891,1.0,0.0,0.0,4.0,1.0,4122.2582,0.0,10.0,0.0,948.6846,898.0,0.0,0.0,0.0,0.0,3970.83,599.0,200.0,1000,1360.0,14.0,13.714,Weekly,57.0,4127.26,1000.0,Full-Time Employment,0.0,0.0,0.3297,0.0,4110.9666,213.0,213.3333,97.14,QuickCash,0.0,4714247,0.0,19-02-2023,False,Home Maintenance & Repairs,2023-02-19,Green,0.0,4187.0,4127.26
0062x00000DXef0AAD,0012x00000hXBbrAAG,Mount Torrens,SA,Australia,Closed Lost,New Client-New Loan,0.25,59.04,3184.2644,2.0,0.0,0.0,4.0,2.0,10789.6215,8.0,71.0,0.0,2459.38,2448.7,1.0,0.0,0.0,0.0,2448.0,2000.0,1878.0,800,1024.0,3.0,6.571,Fortnightly,62.0,10789.62,2200.0,Full-Time Employment,8.0,0.0,0.1209,0.0,7164.5933,0.0,3981.2833,341.33,MoneySpot,,4988421,1.0,03-04-2023,False,Travel Expenses,2023-04-03,Orange,27.0,10680.0,10789.62
0062x00000DY5ptAAD,0012x00000OxJlOAAV,Greenfields,WA,Australia,Loan Paid,Existing Client-Granted Loan Before,23.06,52.7,2102.4093,2.0,1.0,4.0,3.0,2.0,6566.8204,5.0,40.0,1108.103,1547.47,1058.15,1.0,0.0,0.0,0.0,0.0,400.0,1440.0,600,768.0,3.0,6.0,Fortnightly,58.0,6566.82,2050.0,Employed full-time,5.0,0.0,0.0,0.0,5068.89,1629.0,2919.1933,256.0,QuickCash,0.0,5011461,5.0,06-04-2023,False,Other Expenses,2023-04-06,Green,1664.0,7213.0,6566.82
0062x00000EO5KQAA1,0012x00000LSg4OAAT,Southbank,VIC,Australia,Loan Paid,Existing Client-Granted Loan Before,0.0,57.57,1860.6091,4.0,0.0,0.0,3.0,4.0,3252.2466,0.0,38.0,384.8577,1951.348,2961.1,0.0,0.0,0.0,0.0,1414.0,599.0,2303.0,600,792.0,7.0,13.143,Fortnightly,32.0,6410.45,3000.0,Full-Time Employment,0.0,0.0,0.0,0.0,3252.2466,1573.0,3791.5066,113.14,MoneySpot,0.0,6229673,0.0,16-08-2023,False,Medical Expenses,2023-08-16,Orange,0.0,7333.0,6410.45
0062x00000D21KJAAZ,0012x00000e0EynAAE,Varsity Lakes,QLD,Australia,Loan Paid,Existing Client-No Loan Granted Ever,0.0,86.52,2795.6966,0.0,0.0,0.0,0.0,0.0,3512.1666,2.0,7.0,0.0,0.0,0.0,0.0,0.0,0.0,0.0,0.0,599.0,1.2,600,768.0,6.0,6.0,Weekly,38.0,13232.71,600.0,Full-Time Employment,2.0,0.0,0.022,0.0,1213.8833,0.0,3804.3566,128.0,MoneySpot,0.0,4423583,0.0,06-01-2023,False,Living Expenses,2023-01-05,Orange,0.0,7205.0,13232.71
0062x00000DG5ySAAT,0012x00000gnwcfAAA,Coomera,QLD,Australia,Loan Paid,New Client-New Loan,0.0,77.63,3474.2571,2.0,0.0,0.0,4.0,2.0,3043.8504,2.0,27.0,0.0,1316.6228,1214.51,0.0,0.22,0.0,0.0,0.0,0.0,100.0,1000,1360.0,7.0,14.0,Fortnightly,33.0,3043.85,2000.0,,2.0,0.0,0.0,1.0,3072.12,1323.0,5609.3866,194.29,MoneySpot,0.0,4702668,2.0,17-02-2023,False,Medical - Hospital Stay,2023-02-17,Orange,0.0,3645.0,3043.85
0062x00000D1WR3AAN,0012x00000WpjOLAAZ,Armadale,WA,Australia,Closed Lost,Existing Client-No Loan Granted Ever,0.0,7.31,253.24,2.0,0.0,0.0,3.0,2.0,2954.681,0.0,0.0,0.0,1359.9633,1293.88,1.0,0.37,0.0,0.0,3423.24,899.0,215.0,800,1024.0,3.0,6.429,Fortnightly,28.0,2954.68,3000.0,Full-Time Employment,0.0,0.0,0.0,0.0,2719.9266,0.0,233.12,341.33,MoneySpot,,4394360,0.0,06-01-2023,False,Bills,2023-01-02,Orange,0.0,2720.0,2954.68
0062x00000D1WwQAAV,0012x00000GczCRAAZ,Highbury,SA,Australia,Loan Paid,Existing Client-Granted Loan Before,0.0,41.29,858.9737,1.0,0.0,0.0,4.0,1.0,5108.0996,0.0,46.0,272.0,1100.3846,900.15,3.0,15.79,0.0,0.0,0.0,899.0,400.0,600,792.0,10.0,9.571,Weekly,26.0,5127.21,600.0,Unemployed,0.0,0.0,0.978,0.0,4768.3333,1001.0,1040.86,79.2,QuickCash,0.0,4394872,0.0,02-01-2023,False,Living Expenses,2023-01-02,Green,0.0,5555.0,5127.21
0062x00000DHrGYAA1,0012x00000g9xbDAAQ,Katherine South,NT,Australia,Loan Paid,Existing Client-Granted Loan Before,0.0,24.13,1231.7578,1.0,0.0,0.0,3.0,1.0,6364.6875,0.0,32.0,984.9424,1255.5,2142.0,0.0,0.57,0.0,0.0,0.0,899.0,700.0,1000,1360.0,14.0,14.571,Weekly,27.0,6364.69,1000.0,Full-time,0.0,0.0,0.0,0.0,5022.0,882.0,881.5366,97.14,MoneySpot,0.0,4803747,0.0,05-03-2023,False,Living Expenses,2023-03-05,Green,0.0,8967.0,6364.69
0062x00000D7NorAAF,0012x00000XEQlMAAX,West Kempsey,NSW,Australia,Loan Paid,Existing Client-Granted Loan Before,65.52,45.71,873.94,4.0,0.0,2.0,3.0,2.0,2188.2955,0.0,0.0,0.0,689.0133,717.08,0.0,0.0,0.0,0.0,2764.08,599.0,200.0,700,952.0,14.0,13.714,Weekly,26.0,2188.3,700.0,Full-Time Employment,9.0,0.0,0.0,2.0,1378.0266,262.0,1814.7833,68.0,MoneySpot,0.0,4481494,3.0,15-01-2023,True,Medical Expenses,2023-01-15,Orange,1378.0,2103.0,2188.3
0062x00000D7GRlAAN,0012x00000KLhHTAA1,Murray Bridge,SA,Australia,Loan Paid,Existing Client-Granted Loan Before,0.0,50.16,1646.2397,1.0,0.0,0.0,4.0,1.0,4341.2176,0.0,0.0,876.7761,891.6776,882.31,0.0,0.73,0.0,1.0,3047.1,400.0,780.0,1000,1360.0,14.0,13.857,Weekly,31.0,4341.22,1000.0,Part-Time Employment,0.0,0.0,0.0,0.0,0.0,1015.0,1605.8133,97.14,QuickCash,0.0,4474815,0.0,14-01-2023,False,Home Maintenance & Repairs,2023-01-13,Green,0.0,4371.0,4341.22
0062x00000FhtMlAAJ,0012x000002a80CAAQ,Bowenfels,NSW,Australia,Loan Paid,Existing Client-No Loan Granted Ever,0.0,51.06,525.0,1.0,0.0,0.0,3.0,1.0,9548.111,4.0,13.0,0.0,2511.2845,2135.5,0.0,0.0,2.0,0.0,0.0,899.0,800.0,1000,1320.0,10.0,9.714,Weekly,30.0,9548.11,2050.0,Full-Time Employment,4.0,0.0,0.044,0.0,9208.0433,0.0,1029.13,132.0,QuickCash,0.0,7938409,0.0,2024-01-20,False,Life Event Expenses,2024-01-22,Orange,0.0,11171.0,9548.11
0062x00000DY4DMAA1,0012x00000hXP7GAAW,Auburn,NSW,Australia,Loan Paid,New Client-New Loan,0.0,54.74,209.1784,1.0,0.0,0.0,2.0,1.0,3849.003,0.0,13.0,0.0,789.9846,865.6,1.0,0.87,0.0,0.0,3466.67,400.0,200.0,750,960.0,6.0,5.857,Weekly,35.0,3849.0,750.0,Full-Time Employment,0.0,0.0,0.0,0.0,3423.2666,0.0,208.6066,160.0,QuickCash,0.0,5010407,0.0,06-04-2023,False,Vehicle Expenses,2023-04-06,Green,0.0,4263.0,3849.0
0062x00000DZqEwAAL,0012x00000GdIHAAA3,Crestwood,NSW,Australia,Loan Paid,Existing Client-Granted Loan Before,0.0,69.53,5691.8103,2.0,0.0,0.0,4.0,2.0,6934.2213,0.0,55.0,0.0,3191.6428,3396.0,2.0,0.0,0.0,0.0,0.0,599.0,572.0,1000,1360.0,7.0,13.714,Fortnightly,24.0,6934.22,2050.0,,0.0,0.0,0.1099,0.0,7447.1666,722.0,5983.8233,194.29,MoneySpot,0.0,5118618,0.0,23-04-2023,False,Living Expenses,2023-04-22,Orange,0.0,7854.0,6934.22
0062x00000DXWCFAA5,0012800001NEmrrAAD,Saint Helens Park,NSW,Australia,Loan Paid,Existing Client-Granted Loan Before,0.0,70.08,2449.4931,4.0,0.0,0.0,3.0,4.0,5666.6666,0.0,13.0,78.5748,1700.0,2200.0,2.0,0.74,0.0,1.0,3290.0,599.0,300.0,1000,1320.0,5.0,9.714,Fortnightly,39.0,8817.77,2050.0,Full-Time Employment,9.0,0.0,0.7802,1.0,3151.1033,1387.0,2876.02,264.0,MoneySpot,0.0,4978440,6.0,01-04-2023,False,Home Maintenance & Repairs,2023-04-01,Orange,0.0,5667.0,8817.77
0062x00000FkLueAAF,0012x00000gqGVsAAM,Hollywell,QLD,Australia,Closed Lost,Existing Client-Granted Loan Before,0.0,69.71,1802.692,4.0,0.0,0.0,1.0,4.0,13256.8379,1.0,127.0,0.0,726.5,800.0,0.0,0.18,0.0,1.0,0.0,1499.0,400.0,600,816.0,7.0,13.143,Fortnightly,52.0,13840.17,1750.0,Part-Time Employment,1.0,0.0,0.0,1.0,3018.94,238.0,2259.1466,116.57,MoneySpot,,8127786,0.0,2024-02-07,False,Relocation Expenses,2024-02-07,Orange,0.0,16971.0,13840.17
0062x00000EwX2MAAV,0012x000002dC6PAAU,Toormina,NSW,Australia,Loan Paid,Existing Client-Granted Loan Before,0.0,29.2,650.3022,1.0,0.0,0.0,2.0,1.0,3690.2716,4.0,59.0,0.0,849.2684,910.7,1.0,0.0,0.0,0.0,2600.0,599.0,300.0,1000,1400.0,19.0,18.857,Weekly,52.0,4082.16,1000.0,Part-Time Employment,4.0,0.0,0.1758,2.0,3680.1633,368.0,688.4133,73.68,QuickCash,0.0,6597190,0.0,22-09-2023,False,Vehicle Expenses,2023-09-21,Green,0.0,4273.0,4082.16
0062x00000Eem3DAAR,0012x00000hWiXMAA0,Marsfield,NSW,Australia,Loan Paid,Existing Client-Granted Loan Before,0.2,33.66,3047.0084,1.0,0.0,0.0,3.0,1.0,11468.6336,1.0,62.0,672.947,2665.709,2859.67,0.0,0.46,0.0,0.0,12289.3,1500.0,100.0,750,1020.0,14.0,14.143,Weekly,46.0,11468.63,750.0,Full-Time Employment,1.0,0.0,0.3736,1.0,8885.6966,1274.0,3078.9966,72.86,QuickCash,0.0,6515146,0.0,14-09-2023,False,Living Expenses,2023-09-13,Orange,38.0,18304.0,11468.63
0062x00000DZcRJAA1,0010K00001xOHLrQAO,Armadale,WA,Australia,Loan Paid,Existing Client-Granted Loan Before,32.08,58.68,1786.9026,2.0,0.0,4.0,4.0,2.0,6880.1719,0.0,58.0,682.7857,1606.3283,1646.07,3.0,0.29,0.0,0.0,2816.67,599.0,400.0,1000,1360.0,7.0,13.143,Fortnightly,25.0,6305.46,2050.0,Part-Time Employment,0.0,0.0,0.0549,0.0,5607.27,1639.0,4375.9933,194.29,QuickCash,0.0,5102623,0.0,20-04-2023,False,Other Expenses,2023-04-20,Orange,2395.0,7465.0,6305.46
0062x00000EChIZAA1,0012x00000hZ4AOAA0,Buderim,QLD,Australia,Loan Paid,Existing Client-Granted Loan Before,30.61,81.22,957.2246,1.0,1.0,4.0,2.0,1.0,7368.8851,1.0,22.0,0.0,479.083,483.33,0.0,0.0,0.0,0.0,0.0,599.0,1100.0,750,1080.0,22.0,22.0,Weekly,44.0,7368.89,750.0,Part-Time Employment,1.0,0.0,0.022,1.0,4672.1033,297.0,664.2233,49.09,QuickCash,0.0,5893739,1.0,13-07-2023,False,Other Expenses,2023-07-13,Orange,2729.0,8913.0,7368.89
0062x00000D9rL0AAJ,0012x00000dzvLHAAY,Vincent,QLD,Australia,Loan Paid,Existing Client-Granted Loan Before,0.0,62.0,1535.8165,1.0,0.0,0.0,5.0,1.0,7626.4148,0.0,46.0,968.7273,1424.8736,1222.43,1.0,0.07,0.0,0.0,1200.0,599.0,480.0,800,1088.0,14.0,14.286,Weekly,31.0,6659.54,800.0,Full-Time Employment,0.0,0.0,0.011,0.0,5224.5366,713.0,1879.6466,77.71,QuickCash,0.0,4602001,0.0,02-02-2023,False,Vehicle Expenses,2023-02-02,Green,0.0,8172.0,6659.54
0062x00000E3aRKAAZ,0012x00000XPqm0AAD,Highland Park,QLD,Australia,Loan Paid,Existing Client-Granted Loan Before,0.0,67.11,282.9817,4.0,0.0,0.0,2.0,4.0,6892.6666,1.0,26.0,0.0,780.3,999.0,0.0,0.89,0.0,1.0,4199.0,899.0,300.0,800,1056.0,10.0,10.429,Weekly,23.0,8140.0,800.0,Full-Time Employment,1.0,0.0,0.0659,0.0,0.0,84.0,282.7533,105.6,Financier-2,0.0,5500037,0.0,04-06-2023,False,Medical Expenses,2023-06-04,Orange,0.0,8804.0,8140.0
0062x00000DtSJQAA3,0012x00000ha8GbAAI,Bohle Plains,QLD,Australia,Loan Paid,New Client-New Loan,0.0,18.1,2006.3146,1.0,1.0,0.0,3.0,1.0,12520.5341,14.0,96.0,0.0,1770.6576,1578.5,2.0,0.14,0.0,0.0,2100.0,2000.0,1200.0,1000,1360.0,7.0,14.0,Fortnightly,42.0,13954.26,3000.0,Full-Time Employment,15.0,0.0,0.3297,2.0,14195.77,547.0,2568.66,194.29,MoneySpot,0.0,5314361,5.0,19-05-2023,False,Vehicle Expenses,2023-05-18,Orange,0.0,13287.0,13954.26
0062x00000DYPe7AAH,0012x00000RrG1GAAV,Blacktown,NSW,Australia,Loan Paid,Existing Client-Granted Loan Before,0.0,61.52,220.7549,2.0,1.0,0.0,3.0,2.0,3720.3921,3.0,21.0,126.6311,868.87,863.4,1.0,0.0,0.0,0.0,1798.33,400.0,300.0,950,1216.0,4.0,8.429,Fortnightly,42.0,4818.63,2050.0,Part-Time Employment,3.0,0.0,0.2857,2.0,1448.1166,117.0,758.6266,304.0,QuickCash,0.0,5032298,3.0,10-04-2023,False,Living Expenses,2023-04-10,Green,0.0,4709.0,4818.63
0062x00000D9LqkAAF,0012x00000IOt7eAAD,Croydon,VIC,Australia,Loan Paid,Existing Client-Granted Loan Before,0.0,56.51,88.3333,4.0,0.0,0.0,5.0,4.0,786.3332,0.0,11.0,0.0,89.2,500.0,0.0,14.57,0.0,1.0,3281.42,599.0,400.0,1000,1320.0,10.0,10.286,Weekly,40.0,4935.87,3000.0,Full-Time Employment,0.0,0.0,0.0989,0.0,0.0,213.0,420.2133,132.0,MoneySpot,0.0,4578384,0.0,30-01-2023,False,Medical Expenses,2023-01-30,Orange,0.0,5140.0,4935.87
0062x00000D1lbUAAR,0012x000003CAfEAAW,Darwin River,NT,Australia,Loan Paid,Existing Client-Granted Loan Before,0.0,62.42,2001.127,4.0,0.0,0.0,3.0,4.0,6917.95,1.0,8.0,413.3419,3835.596,4357.61,0.0,5.09,0.0,1.0,0.0,400.0,175.0,650,858.0,7.0,12.857,Fortnightly,44.0,6917.95,650.0,Full-Time Employment,1.0,0.0,0.3626,1.0,525.29,577.0,1935.56,122.57,MoneySpot,0.0,4409925,0.0,04-01-2023,False,Other Expenses,2023-01-04,Green,0.0,7974.0,6917.95
0062x00000FhJ9iAAF,0012x00000nQGshAAG,Thirlmere,NSW,Australia,Closed Lost,New Client-New Loan,0.0,25.37,0.0,2.0,0.0,0.0,3.0,2.0,4000.9322,2.0,24.0,0.0,1561.006,1464.62,0.0,0.16,0.0,0.0,3466.67,400.0,1200.0,1000,1360.0,8.0,15.143,Fortnightly,27.0,4000.93,1000.0,Full-Time Employment,2.0,0.0,0.0879,0.0,3162.7166,0.0,1730.4166,170.0,QuickCash,,7886392,0.0,2024-01-17,False,Living Expenses,2024-01-16,Orange,0.0,3779.0,4000.93
0062x00000EyT6qAAF,0012x00000g8ZYMAA2,Clayton South,VIC,Australia,Loan Paid,Existing Client-Granted Loan Before,0.0,77.8,2535.3293,1.0,0.0,0.0,2.0,1.0,9801.1697,1.0,19.0,0.0,1705.2,200.0,0.0,0.0,0.0,1.0,5725.98,899.0,500.0,800,1088.0,8.0,15.0,Fortnightly,32.0,11329.17,2050.0,Full-Time Employment,1.0,0.0,0.0549,1.0,3091.3,698.0,3348.5833,136.0,MoneySpot,0.0,6738286,1.0,05-10-2023,False,Travel Expenses,2023-10-04,Orange,0.0,11588.0,11329.17
0062x00000Ebb4YAAR,0010K00001ffFloQAE,Hazelbrook,NSW,Australia,Loan Paid,Existing Client-Granted Loan Before,0.38,81.17,908.8529,1.0,4.0,0.0,3.0,1.0,4297.6908,8.0,28.0,0.0,791.8383,456.53,0.0,11.2,0.0,0.0,2166.67,599.0,1000.0,700,952.0,14.0,14.143,Weekly,27.0,4746.02,1000.0,Full-Time Employment,8.0,0.0,0.011,4.0,3167.3533,264.0,1376.7466,68.0,MoneySpot,0.0,6301243,6.0,23-08-2023,False,Living Expenses,2023-08-23,Orange,27.0,7051.0,4746.02
0062x00000Eyb4xAAB,0010K00001zIQg6QAG,Oakey,QLD,Australia,Loan Paid,Existing Client-No Loan Granted Ever,0.0,95.28,631.883,4.0,0.0,0.0,3.0,4.0,97.5166,0.0,12.0,0.0,43.91,166.55,2.0,0.0,0.0,1.0,2886.0,599.0,600.0,650,884.0,14.0,13.714,Weekly,32.0,4733.32,650.0,Full-Time Employment,0.0,0.0,0.0,0.0,4418.5066,0.0,628.9366,63.14,QuickCash,0.0,6748232,0.0,05-10-2023,False,Vehicle Expense,2023-10-05,Orange,0.0,507.0,4733.32
0062x00000EzRJhAAN,0012x00000gAhEtAAK,Bellbird Park,QLD,Australia,Loan Paid,Existing Client-Granted Loan Before,0.0,26.67,484.069,1.0,0.0,0.0,3.0,1.0,5118.4648,17.0,11.0,0.0,1173.6523,1068.22,1.0,0.0,0.0,1.0,3033.33,599.0,250.0,750,990.0,10.0,10.0,Weekly,22.0,5118.46,750.0,Casual Employment,17.0,0.0,0.011,7.0,0.0,199.0,514.3666,99.0,MoneySpot,0.0,6808228,0.0,12-10-2023,False,Living Expenses,2023-10-11,Orange,0.0,6154.0,5118.46
0062x00000D8ktcAAB,0012x00000SHqmRAAT,OAK FLATS,NSW,Australia,Loan Paid,Existing Client-No Loan Granted Ever,2.37,48.9,2589.4174,2.0,2.0,0.0,3.0,2.0,7459.4695,7.0,34.0,0.0,2030.5616,2364.0,0.0,50.65,0.0,0.0,0.0,899.0,420.0,700,896.0,3.0,6.143,Fortnightly,41.0,6572.61,1500.0,Full-time,7.0,0.0,0.0549,2.0,4061.1233,359.0,4248.43,298.67,MoneySpot,0.0,4548355,7.0,25-01-2023,False,Life Event Expenses,2023-01-25,Orange,250.0,10536.0,6572.61
0062x00000EDwZzAAL,0012x00000kaMsgAAE,Urangan,QLD,Australia,Closed Lost,Existing Client-No Loan Granted Ever,15.5,73.81,80.0,1.0,0.0,2.0,3.0,1.0,4898.2619,0.0,16.0,0.0,575.2727,420.36,0.0,0.0,0.0,0.0,0.0,400.0,1100.0,700,952.0,14.0,13.714,Weekly,32.0,5042.73,2400.0,,0.0,0.0,0.0,0.0,2658.47,0.0,80.0,68.0,QuickCash,,5979046,0.0,23-07-2023,False,Vehicle Expenses,2023-07-22,Orange,1211.0,7812.0,5042.73
0062x00000FWUNFAA5,0012x00000hWuhCAAS,Moil,NT,Australia,Closed Lost,Existing Client-Granted Loan Before,1.92,77.21,621.6633,1.0,0.0,0.0,3.0,1.0,4720.6016,0.0,0.0,0.0,769.8483,872.79,0.0,0.0,0.0,0.0,3415.85,1500.0,1500.0,750,1020.0,14.0,15.0,Weekly,20.0,4720.6,750.0,Full-Time Employment,0.0,0.0,0.0,0.0,3079.3933,17.0,643.07,72.86,MoneySpot,,7673925,0.0,01-01-2024,False,Living Expenses,2023-12-29,Orange,79.0,4112.0,4720.6
0062x00000DHVvFAAX,0012x00000LQbTEAA1,Sunnybank Hills,QLD,Australia,Closed Lost,Existing Client-Granted Loan Before,0.1,78.03,901.6152,4.0,1.0,0.0,2.0,4.0,12005.5866,1.0,15.0,641.6179,5127.0,8.0,0.0,2.02,0.0,1.0,0.0,599.0,1400.0,1000,1240.0,1.0,1.0,Weekly,38.0,12010.59,1000.0,Full-Time Employment,1.0,0.0,0.0989,1.0,5169.5866,640.0,1145.89,1240.0,MoneySpot,,4782606,1.0,02-03-2023,False,Living Expenses,2023-03-02,Green,13.0,12142.0,12010.59
0062x00000DrCeDAAV,0012x00000Ttyu8AAB,Blacktown,SA,Australia,Loan Paid,Existing Client-Granted Loan Before,0.49,61.96,2359.0553,1.0,0.0,0.0,3.0,1.0,6133.6675,0.0,26.0,114.7143,1057.71,1006.32,0.0,49.78,0.0,0.0,3856.67,599.0,1200.0,1000,1280.0,6.0,5.857,Weekly,54.0,8313.84,1000.0,Full-Time Employment,0.0,0.0,0.0,0.0,4583.41,886.0,2917.2033,213.33,MoneySpot,0.0,5152271,0.0,28-04-2023,False,Furniture or Appliances,2023-04-27,Green,49.0,9856.0,8313.84
0062x00000DJ5SWAA1,0012x00000SI28lAAD,Redbank Plains,QLD,Australia,Closed Lost,Existing Client-Granted Loan Before,0.0,60.58,2173.4245,2.0,7.0,0.0,3.0,2.0,673.5119,12.0,25.0,154.169,310.0,500.0,2.0,0.0,0.0,1.0,270.46,899.0,600.0,1000,1320.0,5.0,9.0,Fortnightly,57.0,2748.83,1400.0,Unemployed,16.0,0.0,0.1868,9.0,1910.6033,844.0,3389.1066,264.0,Financier-2,,4870723,14.0,16-03-2023,False,Vehicle Expenses,2023-03-15,Orange,0.0,3322.0,2748.83
0062x00000DFkzhAAD,0010K000029JKQLQA4,Balmain,NSW,Australia,Loan Paid,Existing Client-Granted Loan Before,0.0,47.91,1557.4672,2.0,1.0,0.0,4.0,2.0,6894.6492,1.0,36.0,820.4145,3173.4285,3260.0,1.0,1.86,0.0,0.0,0.0,899.0,2200.0,1000,1360.0,7.0,13.286,Fortnightly,51.0,6894.65,1000.0,Employed full-time,1.0,0.0,0.5165,1.0,7404.6666,1407.0,1860.4566,194.29,QuickCash,0.0,4685142,1.0,15-02-2023,False,Living Expenses,2023-02-14,Green,0.0,7405.0,6894.65
0062x00000DIKYpAAP,0012x00000TtX7jAAF,Street,VIC,Australia,Loan Paid,Existing Client-Granted Loan Before,0.0,60.44,2632.9805,2.0,0.0,0.0,2.0,2.0,4650.4345,0.0,36.0,1476.425,2140.475,2128.31,1.0,0.14,0.0,0.0,4175.17,400.0,1391.0,1000,1320.0,6.0,10.857,Fortnightly,56.0,4900.43,2050.0,Full-Time Employment,0.0,0.0,0.1429,0.0,4280.95,1982.0,2709.0633,220.0,MoneySpot,0.0,4827727,0.0,09-03-2023,False,Vehicle Expenses,2023-03-09,Orange,0.0,5543.0,4900.43
0062x00000D8F0hAAF,0012x00000g7sFMAAY,Vincent,QLD,Australia,Loan Paid,Existing Client-No Loan Granted Ever,0.0,91.09,1516.9732,1.0,0.0,0.0,5.0,1.0,6422.2797,0.0,16.0,0.0,1293.3609,1252.44,0.0,0.0,0.0,1.0,6959.02,899.0,200.0,1000,1280.0,6.0,6.0,Weekly,51.0,6422.28,1000.0,Full-Time Employment,0.0,0.0,0.022,0.0,802.32,0.0,1704.8033,213.33,MoneySpot,0.0,4522236,0.0,21-01-2023,False,Vehicle Expenses,2023-01-21,Orange,0.0,5787.0,6422.28
0062x00000Dttl0AAB,0012x00000haRMHAA2,Kangaroo Point,QLD,Australia,Loan Paid,New Client-New Loan,0.0,83.21,360.0366,2.0,0.0,0.0,2.0,2.0,7824.707,2.0,12.0,448.0,2307.15,2307.15,0.0,3.45,0.0,0.0,4992.0,899.0,800.0,800,1088.0,7.0,14.286,Fortnightly,31.0,7824.71,1000.0,Full-Time Employment,2.0,0.0,0.044,1.0,3845.25,326.0,1984.15,155.43,QuickCash,0.0,5354480,2.0,22-05-2023,False,Veterinary Expenses,2023-05-22,Orange,0.0,8657.0,7824.71
0062x00000DXIiAAAX,0012x00000bnw1dAAA,Ashcroft,NSW,Australia,Loan Paid,Existing Client-Granted Loan Before,21.69,50.19,2257.7384,2.0,2.0,2.0,4.0,2.0,5742.0826,10.0,50.0,287.338,2061.24,2150.47,1.0,0.75,1.0,0.0,3603.95,599.0,500.0,1000,1320.0,5.0,10.143,Fortnightly,45.0,7082.44,1000.0,Full-Time Employment,10.0,0.0,0.2857,2.0,3911.7066,784.0,2608.3833,264.0,QuickCash,0.0,4964628,10.0,30-03-2023,False,Life Event Expenses,2023-03-30,Orange,1163.0,5360.0,7082.44
0062x00000EE1DpAAL,0012x00000g9pS1AAI,Prospect,SA,Australia,Closed Lost,Existing Client-No Loan Granted Ever,0.0,81.91,729.1827,2.0,0.0,0.0,4.0,2.0,5720.7642,0.0,3.0,0.0,1671.49,1585.15,0.0,1.01,0.0,1.0,0.0,0.0,900.0,1000,1440.0,13.0,24.714,Fortnightly,28.0,5720.76,10000.0,,0.0,0.0,0.0,0.0,0.0,0.0,763.8766,110.77,MoneySpot,,5984202,0.0,27-07-2023,False,Vehicle,2023-07-22,Orange,0.0,7250.0,5720.76
0062x00000DHRkXAAX,0012x00000gn7JyAAI,Zillmere,QLD,Australia,Loan Paid,Existing Client-Granted Loan Before,0.0,57.1,924.7033,2.0,0.0,0.0,3.0,2.0,4564.7797,0.0,3.0,1537.33,2100.8983,2100.9,0.0,0.24,0.0,0.0,4902.1,400.0,290.0,1000,1360.0,7.0,14.0,Fortnightly,35.0,4564.78,1000.0,Full-Time Employment,1.0,0.0,0.6813,0.0,4201.7966,1283.0,1365.09,194.29,QuickCash,0.0,4778791,1.0,02-03-2023,False,Travel Expenses,2023-03-01,Green,0.0,4902.0,4564.78
0062x00000DHJZcAAP,0012x00000MhbF6AAJ,West Perth,WA,Australia,Loan Paid,Existing Client-Granted Loan Before,0.0,79.34,18854.1745,2.0,0.0,0.0,2.0,2.0,8928.925,1.0,40.0,1250.7667,4109.7528,4476.0,0.0,80.6,0.0,0.0,0.0,1499.0,800.0,1000,1320.0,5.0,10.0,Fortnightly,53.0,13582.08,2000.0,,1.0,0.0,0.3407,0.0,13544.5466,1921.0,22909.6433,264.0,MoneySpot,0.0,4771824,1.0,01-03-2023,False,Furniture or Appliances,2023-02-28,Orange,0.0,24501.0,13582.08
0062x00000EDyRtAAL,0012x00000god2mAAA,Clarkson,WA,Australia,Loan Paid,Existing Client-Granted Loan Before,0.0,68.3,2061.2866,4.0,0.0,0.0,2.0,4.0,4678.7698,0.0,10.0,0.0,1499.762,1491.52,0.0,0.0,0.0,0.0,0.0,400.0,100.0,750,1080.0,11.0,22.571,Fortnightly,21.0,4678.77,750.0,Full-Time Employment,0.0,0.0,0.011,0.0,2499.6033,1834.0,3792.8066,98.18,MoneySpot,0.0,5979344,0.0,22-07-2023,False,Travel Expenses,2023-07-22,Green,0.0,5324.0,4678.77
0062x00000DGxpmAAD,0010K000026PYtcQAG,Nowra,NSW,Australia,Loan Paid,Existing Client-No Loan Granted Ever,0.0,57.54,1150.2609,2.0,0.0,0.0,3.0,2.0,4018.2728,0.0,25.0,496.1667,1849.5066,1856.34,0.0,0.0,0.0,0.0,3466.67,899.0,1600.0,600,768.0,3.0,5.714,Fortnightly,31.0,4018.27,1000.0,Full-Time Employment,2.0,0.0,0.1758,1.0,3699.0133,895.0,1492.5333,256.0,MoneySpot,0.0,4752259,0.0,25-02-2023,False,Relocation Expenses,2023-02-24,Orange,0.0,4318.0,4018.27
0062x00000E52FlAAJ,0012x00000e06PxAAI,Redbank Plains,QLD,Australia,Loan Paid,Existing Client-No Loan Granted Ever,0.29,55.99,1974.9784,1.0,0.0,0.0,3.0,1.0,4281.161,3.0,48.0,0.0,985.2538,926.11,0.0,0.0,0.0,0.0,3994.62,899.0,1200.0,700,924.0,10.0,10.0,Weekly,36.0,4281.16,700.0,Full-Time Employment,4.0,0.0,0.0989,3.0,4269.4333,0.0,2239.2933,92.4,MoneySpot,0.0,5617536,1.0,15-06-2023,False,Car rego,2023-06-15,Orange,13.0,4337.0,4281.16
0062x00000DIavUAAT,0012x00000fmR3KAAU,Rothwell,QLD,Australia,Loan Paid,Existing Client-Granted Loan Before,0.0,47.37,629.5233,1.0,0.0,0.0,1.0,1.0,4022.814,0.0,0.0,779.2461,925.7984,1033.08,0.0,0.0,0.0,0.0,3904.33,400.0,800.0,1000,1320.0,12.0,12.429,Weekly,58.0,4022.81,1000.0,Full-Time Employment,0.0,0.0,0.044,0.0,4011.7933,592.0,592.4433,110.0,QuickCash,0.0,4842147,0.0,11-03-2023,False,Living Expenses,2023-03-10,Orange,0.0,4445.0,4022.81
0062x00000DWmg6AAD,0012x00000Rr5YiAAJ,Semaphore Park,SA,Australia,Loan Paid,Existing Client-Granted Loan Before,0.0,68.8,661.8066,1.0,0.0,0.0,4.0,1.0,6379.7779,3.0,25.0,0.0,1177.95,1177.95,0.0,34.91,0.0,0.0,5048.33,899.0,1600.0,1000,1280.0,6.0,5.714,Weekly,46.0,8245.04,1000.0,Full-Time Employment,3.0,0.0,0.9121,1.0,5104.45,393.0,1114.9066,213.33,QuickCash,0.0,4937682,2.0,26-03-2023,False,Living Expenses,2023-03-26,Green,0.0,8994.0,8245.04
0062x00000DHtvEAAT,0012x00000TudTwAAJ,Alkimos,WA,Australia,Loan Paid,Existing Client-Granted Loan Before,0.0,48.25,2462.1392,1.0,0.0,0.0,3.0,1.0,6632.7039,0.0,62.0,0.0,1526.4307,1701.0,0.0,18.5,0.0,0.0,4258.42,899.0,1500.0,600,792.0,10.0,10.429,Weekly,38.0,6948.34,600.0,Full-Time Employment,0.0,0.0,0.011,0.0,6614.5333,596.0,2298.2733,79.2,Financier-2,0.0,4806770,0.0,06-03-2023,False,Living Expenses,2023-03-06,Orange,0.0,7053.0,6948.34
0062x00000DIsMmAAL,0012x00000g83o5AAA,Hastings,VIC,Australia,Loan Paid,Existing Client-Granted Loan Before,0.45,91.33,7381.8455,2.0,0.0,0.0,2.0,2.0,6859.7701,0.0,44.0,1414.5041,2862.0316,3419.31,1.0,0.0,0.0,0.0,0.0,1499.0,400.0,1000,1320.0,5.0,10.143,Fortnightly,22.0,6859.77,3000.0,Full-Time Employment,0.0,0.0,0.044,0.0,5724.0633,2107.0,7860.6766,264.0,MoneySpot,0.0,4860221,0.0,14-03-2023,False,Medical Expenses,2023-03-14,Orange,30.0,6584.0,6859.77
0062x00000DIRpiAAH,0012x00000MiJpgAAF,Catalina,NSW,Australia,Loan Paid,Existing Client-Granted Loan Before,0.0,99.87,2688.9183,2.0,1.0,0.0,3.0,2.0,3903.4772,10.0,28.0,1375.9757,1796.67,1859.25,0.0,0.0,0.0,0.0,5633.33,400.0,200.0,1000,1320.0,5.0,9.857,Fortnightly,36.0,3903.48,1000.0,Full-Time Employment,10.0,0.0,0.8022,2.0,3593.34,2218.0,2854.9766,264.0,Financier-2,0.0,4834230,9.0,10-03-2023,False,Vehicle Expenses,2023-03-09,Orange,0.0,4257.0,3903.48
0062x00000DYHanAAH,0012x00000e0G4UAAU,Townview,QLD,Australia,Loan Paid,Existing Client-No Loan Granted Ever,0.0,68.73,6166.6037,2.0,0.0,0.0,2.0,2.0,7501.2735,1.0,27.0,0.0,1375.812,1510.35,1.0,0.0,0.0,0.0,3425.43,599.0,350.0,750,960.0,3.0,6.571,Fortnightly,37.0,5874.61,3000.0,Full-Time Employment,1.0,0.0,0.022,0.0,4007.92,0.0,6390.5866,320.0,MoneySpot,0.0,5023657,1.0,10-04-2023,False,Living Expenses,2023-04-09,Orange,0.0,8443.0,5874.61
0062x00000DG4GPAA1,0010K00001hEGk4QAG,Anna Bay,NSW,Australia,Loan Paid,Existing Client-Granted Loan Before,0.0,71.47,3810.6622,2.0,0.0,0.0,4.0,2.0,12403.4765,0.0,42.0,2170.4321,4512.5928,5037.17,1.0,0.3,0.0,0.0,6188.0,400.0,1000.0,1000,1360.0,7.0,14.0,Fortnightly,56.0,12820.14,1000.0,Full-Time Employment,0.0,0.0,0.0,0.0,10529.3833,1763.0,3698.3166,194.29,QuickCash,0.0,4701479,0.0,17-02-2023,False,Living Expenses,2023-02-17,Orange,0.0,14467.0,12820.14
0062x00000DYKwzAAH,0012x00000hXYa0AAG,Rockbank,VIC,Australia,Loan Paid,New Client-New Loan,9.49,21.7,0.0,0.0,0.0,0.0,0.0,0.0,0.0,1.0,7.0,0.0,0.0,0.0,0.0,0.0,0.0,0.0,0.0,0.0,1695.0,800,1024.0,6.0,6.571,Weekly,43.0,7060.25,1000.0,,1.0,0.0,0.0549,1.0,0.0,60.0,60.07,170.67,QuickCash,0.0,5028064,0.0,09-04-2023,False,Other,2023-04-09,Orange,481.0,5067.0,7060.25
0062x00000DY0e9AAD,0012x00000cx1cOAAQ,Whalan,NSW,Australia,Closed Lost,Existing Client-Granted Loan Before,4.56,88.98,666.6666,0.0,0.0,2.0,1.0,2.0,2702.1341,0.0,5.0,0.0,582.2328,600.6,0.0,0.04,0.0,0.0,0.0,400.0,400.0,1000,1280.0,5.0,8.714,Fortnightly,32.0,45032.8,1000.0,Unemployed,0.0,0.0,0.0549,0.0,2698.4033,1829.0,1888.4566,256.0,QuickCash,,5007583,0.0,06-04-2023,True,Vehicle Expenses,2023-04-05,Orange,2836.0,62057.0,45032.8
0062x00000DrsqeAAB,0012x00000dzyhvAAA,Modbury,SA,Australia,Closed Lost,Existing Client-No Loan Granted Ever,0.22,41.9,1669.5952,2.0,0.0,0.0,3.0,2.0,4371.2487,5.0,38.0,0.0,1851.03,1957.32,2.0,0.0,0.0,0.0,3683.33,400.0,300.0,600,792.0,5.0,8.857,Fortnightly,50.0,5392.92,2000.0,Full-Time Employment,5.0,0.0,0.022,5.0,3702.06,0.0,1893.2933,158.4,MoneySpot,,5201196,3.0,05-05-2023,False,Living Expenses,2023-05-05,Orange,13.0,5887.0,5392.92
0062x00000D1WAIAA3,0012x00000MgJT8AAN,Windsor,VIC,Australia,Loan Paid,Existing Client-Granted Loan Before,1.42,99.46,203.1377,1.0,0.0,0.0,3.0,1.0,14483.1639,1.0,27.0,203.1388,2723.1625,2656.79,0.0,0.7,0.0,0.0,10004.81,400.0,150.0,800,1088.0,14.0,14.429,Weekly,31.0,16895.46,800.0,Full-Time Employment,1.0,0.0,0.5385,0.0,3630.8833,214.0,307.7933,77.71,QuickCash,0.0,4394389,0.0,02-01-2023,False,Life Event Expenses,2023-01-02,Orange,250.0,17539.0,16895.46
0062x00000Ec3etAAB,0012x00000BJ5oqAAD,Mount Gambier,SA,Australia,Loan Paid,Existing Client-Granted Loan Before,0.0,88.44,7373.0913,2.0,0.0,0.0,3.0,2.0,14537.6381,9.0,34.0,435.4798,2653.4142,2765.35,0.0,0.05,0.0,1.0,4175.56,599.0,540.0,1000,1360.0,7.0,13.857,Fortnightly,34.0,17394.86,1000.0,Full-Time Employment,9.0,0.0,0.1648,2.0,0.0,1236.0,7524.88,194.29,MoneySpot,0.0,6327553,3.0,25-08-2023,False,Living Expenses,2023-08-25,Orange,0.0,21063.0,17394.86
0062x00000DZZl6AAH,0010K000022oLgjQAE,MORANBAH,QLD,Australia,Loan Paid,Existing Client-Granted Loan Before,0.0,53.72,373.07,4.0,0.0,0.0,2.0,4.0,1907.7466,0.0,30.0,211.0547,50.2038,115.0,0.0,0.49,0.0,1.0,1300.0,599.0,150.0,800,1024.0,6.0,5.857,Weekly,30.0,6182.13,2050.0,Part-Time Employment,0.0,0.0,0.0,0.0,0.0,714.0,1212.1733,170.67,MoneySpot,0.0,5100812,0.0,20-04-2023,False,Living Expenses,2023-04-20,Green,0.0,6705.0,6182.13
0062x00000DZ4qYAAT,0012x00000XDaJNAA1,CEDAR POINT,NSW,Australia,Loan Paid,Existing Client-No Loan Granted Ever,0.0,94.38,1558.7448,1.0,0.0,0.0,4.0,1.0,7590.1857,14.0,22.0,925.3637,927.7775,955.08,0.0,0.3,0.0,0.0,6500.0,1500.0,900.0,750,960.0,6.0,5.714,Weekly,24.0,7590.19,750.0,Full-Time Employment,16.0,0.0,0.044,3.0,6186.26,1078.0,1809.43,160.0,MoneySpot,0.0,5072203,16.0,16-04-2023,False,Vet - Procedure,2023-04-15,Green,0.0,7113.0,7590.19
0062x00000D8RgBAAV,0010K00001y7nfGQAQ,AVELEY,WA,Australia,Loan Paid,Existing Client-Granted Loan Before,0.0,37.23,1792.0591,4.0,0.0,0.0,3.0,4.0,9091.43,0.0,66.0,924.6042,3409.2862,3044.94,1.0,0.11,0.0,0.0,2600.0,400.0,800.0,1000,1320.0,5.0,9.429,Fortnightly,33.0,9091.43,1000.0,Part-Time Employment,0.0,0.0,0.044,0.0,9091.43,1588.0,3049.1966,264.0,MoneySpot,0.0,4533546,0.0,23-01-2023,False,Life Event Expenses,2023-01-23,Orange,0.0,9731.0,9091.43
0062x00000F39eJAAR,0012x00000c7lO3AAI,Toormina,NSW,Australia,Loan Paid,Existing Client-Granted Loan Before,0.0,45.14,2137.3615,3.0,0.0,0.0,5.0,3.0,7668.8798,0.0,42.0,0.0,4989.6466,4633.58,0.0,0.0,0.0,0.0,2916.4,599.0,1059.0,1000,1360.0,4.0,15.571,Monthly,48.0,10009.35,5000.0,Full-Time Employment,6.0,0.0,0.1648,2.0,6336.31,806.0,2621.9566,340.0,MoneySpot,0.0,7023417,6.0,01-11-2023,False,Vehicle Expenses,2023-11-01,Orange,0.0,9812.0,10009.35
0062x00000F2tobAAB,0012x00000g95cMAAQ,South Gladstone,QLD,Australia,Loan Paid,Existing Client-Granted Loan Before,0.0,55.46,3314.7758,1.0,0.0,0.0,3.0,1.0,6372.6165,2.0,33.0,0.0,1437.4246,1059.84,0.0,0.0,0.0,0.0,1050.0,1499.0,640.0,1000,1320.0,12.0,12.286,Weekly,28.0,6372.62,1000.0,Full-Time Employment,2.0,0.0,0.011,2.0,6228.84,288.0,3539.14,110.0,QuickCash,0.0,7005532,0.0,31-10-2023,False,Living Expenses,2023-10-30,Green,0.0,6719.0,6372.62
0062x00000FXE9KAAX,0012x00000OyLqDAAV,PIMPAMA,QLD,Australia,Closed Lost,Existing Client-Granted Loan Before,0.0,49.61,2810.5003,2.0,0.0,0.0,2.0,2.0,7244.2188,0.0,45.0,1541.747,3334.3257,3308.0,1.0,0.4,0.0,0.0,0.0,899.0,1100.0,800,1088.0,8.0,15.857,Fortnightly,38.0,7678.74,2050.0,Full-Time Employment,0.0,0.0,0.0,0.0,8246.76,2585.0,3586.6066,136.0,MoneySpot,,7733145,0.0,2024-01-05,False,Vehicle Expenses,2024-01-04,Orange,0.0,7794.0,7678.74
0062x00000DIju1AAD,0012x00000gpL06AAE,Condell Park,NSW,Australia,Loan Paid,New Client-New Loan,0.0,38.59,1093.8866,1.0,0.0,0.0,4.0,1.0,4131.0182,0.0,21.0,1554.1536,950.7007,780.0,2.0,5.88,0.0,0.0,780.0,2000.0,400.0,800,1024.0,6.0,6.571,Weekly,73.0,4131.02,2000.0,Full-Time Employment,0.0,0.0,0.4725,0.0,4119.7033,756.0,3261.9866,170.67,QuickCash,0.0,4852982,0.0,13-03-2023,False,Travel Expenses,2023-03-13,Orange,0.0,4153.0,4131.02
0062x00000DVyVXAA1,0012x00000OymCCAAZ,Randwick,NSW,Australia,Loan Paid,Existing Client-Granted Loan Before,0.0,37.05,1565.6724,2.0,0.0,0.0,4.0,2.0,4675.2424,0.0,7.0,171.9203,2151.8928,1843.0,0.0,0.0,0.0,0.0,3460.17,899.0,1240.0,800,1056.0,6.0,11.857,Fortnightly,43.0,4675.24,800.0,Full-Time Employment,0.0,0.0,0.0,0.0,5021.0833,983.0,2035.8,176.0,Financier-2,0.0,4887530,0.0,18-03-2023,False,Medical Expenses,2023-03-18,Orange,0.0,5421.0,4675.24
0062x00000EEBhGAAX,0012x00000LPr0AAAT,Newport,NSW,Australia,Loan Paid,Existing Client-No Loan Granted Ever,0.0,81.51,373.3798,2.0,0.0,0.0,3.0,2.0,8269.5331,0.0,16.0,0.0,1939.4566,2431.48,0.0,0.14,0.0,0.0,2472.0,899.0,1200.0,750,1140.0,17.0,34.429,Fortnightly,24.0,13242.55,2500.0,Full-Time Employment,0.0,0.0,0.0,0.0,1939.4566,0.0,500.03,67.06,MoneySpot,0.0,5995154,0.0,24-07-2023,False,Vehicle Expense,2023-07-24,Green,0.0,15973.0,13242.55
0062x00000DGikwAAD,0010K00002COcOdQAL,Paddington,QLD,Australia,Loan Paid,Existing Client-Granted Loan Before,3.13,81.87,241.0,1.0,1.0,0.0,1.0,1.0,1253.6983,17.0,131.0,458.5733,241.3887,102.28,0.0,0.0,0.0,1.0,942.5,599.0,1200.0,1000,1360.0,14.0,13.857,Weekly,47.0,3706.42,1250.0,Part-Time Employment,17.0,0.0,0.1758,7.0,111.0,832.0,3393.92,97.14,Financier-2,0.0,4737606,6.0,23-02-2023,False,Vehicle Expenses,2023-02-22,Orange,123.0,3927.0,3706.42
0062x00000D7lJlAAJ,0012x00000g8SseAAE,Tarneit,VIC,Australia,Loan Paid,Existing Client-No Loan Granted Ever,0.0,23.43,10.8617,4.0,0.0,0.0,3.0,4.0,2598.2799,0.0,8.0,0.0,1377.718,1118.57,1.0,1.19,0.0,0.0,0.0,2000.0,1400.0,800,1024.0,3.0,6.143,Fortnightly,43.0,4403.9,5000.0,Full-Time Employment,0.0,0.0,0.0,0.0,2296.1966,0.0,11.6666,341.33,MoneySpot,0.0,4498859,0.0,18-01-2023,False,Living Expenses,2023-01-17,Orange,0.0,10365.0,4403.9
0062x00000DHTjSAAX,0010K00001hVs7tQAC,Burwood Heights,NSW,Australia,Loan Paid,Existing Client-Granted Loan Before,0.0,46.39,3038.0437,2.0,3.0,0.0,3.0,2.0,4943.7942,36.0,62.0,624.026,2275.5,2981.45,3.0,0.0,0.0,0.0,6500.0,1499.0,1470.0,850,1122.0,6.0,12.0,Fortnightly,51.0,4943.79,1000.0,Full-Time Employment,36.0,0.0,0.4835,14.0,3034.0,1111.0,4851.1133,187.0,MoneySpot,0.0,4780659,23.0,02-03-2023,False,Travel Expenses,2023-03-01,Green,0.0,8315.0,4943.79
0062x00000DZEnDAAX,0012x00000hY4N2AAK,South Penrith,NSW,Australia,Closed Lost,New Client-New Loan,0.0,14.09,493.3887,1.0,0.0,0.0,3.0,1.0,5419.5117,0.0,0.0,0.0,1171.1538,1072.0,1.0,0.15,0.0,1.0,0.0,0.0,150.0,800,1024.0,6.0,6.429,Weekly,58.0,5418.61,6000.0,,0.0,0.0,0.0,0.0,0.0,0.0,443.71,170.67,MoneySpot,,5080848,0.0,22-04-2023,False,Vehicle Repairs & Maintenance,2023-04-17,Orange,0.0,5408.0,5418.61
0062x00000DYDW6AAP,0010K00001y85VbQAI,Canteen Creek,NT,Australia,Loan Paid,Existing Client-Granted Loan Before,19.1,73.19,403.1151,2.0,0.0,2.0,4.0,2.0,7953.0472,1.0,8.0,0.0,2158.4033,1994.53,0.0,0.0,0.0,0.0,758.33,400.0,140.0,1000,1320.0,5.0,9.0,Fortnightly,46.0,7943.37,2100.0,Part-Time Employment,1.0,0.0,0.7033,1.0,5786.92,110.0,512.3666,264.0,MoneySpot,0.0,5018017,1.0,07-04-2023,False,Living Expenses,2023-04-07,Orange,1470.0,7694.0,7943.37
0062x00000DVTELAA5,0010K000023RDGSQA4,East Side,NT,Australia,Loan Paid,Existing Client-Granted Loan Before,28.56,71.91,1846.3314,1.0,0.0,2.0,4.0,1.0,5762.9133,11.0,91.0,431.42,511.7072,616.56,0.0,0.0,0.0,0.0,0.0,1499.0,150.0,700,952.0,14.0,14.286,Weekly,30.0,5809.58,2050.0,Full-Time Employment,11.0,0.0,0.0769,3.0,5552.4266,541.0,1905.73,68.0,Financier-2,0.0,5450484,4.0,31-05-2023,False,Home Maintenance & Repairs,2023-05-31,Orange,2662.0,9318.0,5809.58
0062x00000D8mE2AAJ,0012x000003frL7AAI,Bertram,WA,Australia,Loan Paid,Existing Client-Granted Loan Before,0.07,60.64,1218.0331,1.0,0.0,0.0,2.0,1.0,6454.9238,0.0,26.0,211.0547,1386.1746,1385.88,0.0,21.83,0.0,0.0,4333.33,599.0,400.0,600,816.0,14.0,14.0,Weekly,38.0,6454.92,600.0,Full-Time Employment,0.0,0.0,0.0,0.0,6006.7566,210.0,1392.1133,58.29,MoneySpot,0.0,4549321,0.0,25-01-2023,False,Living Expenses,2023-01-25,Orange,6.0,8114.0,6454.92
0062x00000DA2i8AAD,0012x00000gmzevAAA,Hamilton,QLD,Australia,Closed Lost,New Client-New Loan,0.0,74.54,505.85,4.0,0.0,0.0,5.0,4.0,8035.5149,1.0,15.0,0.0,2741.25,2576.0,0.0,17.11,0.0,0.0,0.0,0.0,800.0,800,1088.0,7.0,13.571,Fortnightly,29.0,7637.6,6000.0,,1.0,0.0,0.0659,0.0,3655.0,0.0,1701.66,155.43,MoneySpot,,4610090,0.0,07-02-2023,False,Car Maintenance / Rego,2023-02-03,Orange,0.0,14729.0,7637.6
0062x00000EMgQ8AAL,0010K00001su7xsQAA,Driver,NT,Australia,Closed Lost,Existing Client-Granted Loan Before,6.14,35.84,422.1164,2.0,0.0,2.0,3.0,2.0,5355.2745,0.0,11.0,0.0,1392.1557,1503.74,0.0,0.0,0.0,0.0,2166.67,599.0,1200.0,750,990.0,5.0,9.571,Fortnightly,32.0,5061.9,750.0,Full-Time Employment,0.0,0.0,0.1099,0.0,5282.4533,556.0,555.84,198.0,QuickCash,,6121712,0.0,06-08-2023,False,Child Expenses,2023-08-05,Orange,489.0,7952.0,5061.9
0062x00000DIUHKAA5,0012x00000Rpq0uAAB,Collingwood Park,QLD,Australia,Loan Paid,Existing Client-Granted Loan Before,7.15,85.6,3530.7764,2.0,0.0,0.0,4.0,2.0,4889.9286,3.0,51.0,1781.25,1717.1433,1525.59,1.0,0.0,0.0,0.0,3033.33,599.0,800.0,600,792.0,7.0,13.0,Fortnightly,41.0,5402.05,600.0,Part-Time Employment,3.0,0.0,0.8571,0.0,3434.2866,1408.0,4200.29,113.14,Financier-2,0.0,4836063,3.0,10-03-2023,False,Vehicle Expenses,2023-03-10,Orange,465.0,6496.0,5402.05
0062x00000DHF6cAAH,0012x00000KMBEBAA5,Algester,QLD,Australia,Loan Paid,Existing Client-Granted Loan Before,0.0,46.71,2809.1926,1.0,0.0,0.0,4.0,1.0,9509.7248,4.0,52.0,0.0,1795.9857,2641.3,0.0,0.7,0.0,0.0,3562.49,400.0,1000.0,1000,1360.0,14.0,14.429,Weekly,29.0,9343.06,1000.0,Full-Time Employment,4.0,1.0,0.0659,2.0,8619.6766,9.0,2886.6166,97.14,QuickCash,0.0,4768801,0.0,28-02-2023,False,Living Expenses,2023-02-28,Green,0.0,9115.0,9343.06
0062x00000DYVuUAAX,0012x000005U1OLAA0,Mittagong,NSW,Australia,Closed Lost,Existing Client-No Loan Granted Ever,0.0,35.35,533.9742,4.0,0.0,0.0,4.0,4.0,3601.6666,0.0,17.0,0.0,1200.5555,1100.0,2.0,0.0,0.0,1.0,4333.33,1500.0,2000.0,1000,1280.0,6.0,6.429,Weekly,38.0,7083.33,5000.0,Full-Time Employment,0.0,0.0,0.0,0.0,0.0,613.0,1424.9233,213.33,MoneySpot,,5037986,0.0,11-04-2023,False,Furniture or Appliances,2023-04-11,Orange,0.0,7775.0,7083.33
0062x00000D81q0AAB,0012x00000gAGZYAA4,Carrum Downs,VIC,Australia,Closed Lost,New Client-New Loan,0.0,29.34,254.6633,1.0,0.0,0.0,1.0,1.0,4032.2066,0.0,1.0,0.0,599.1066,604.72,0.0,0.0,0.0,1.0,900.0,2000.0,400.0,800,1024.0,6.0,5.857,Weekly,37.0,4032.21,2500.0,Part-Time Employment,0.0,0.0,0.0,0.0,1211.2266,0.0,254.6633,170.67,MoneySpot,,4510764,0.0,24-01-2023,False,Other Expenses,2023-01-19,Orange,0.0,3760.0,4032.21
0062x00000Dsd5SAAR,0010K00001y9NQFQA2,Crestmead,QLD,Australia,Loan Paid,Existing Client-Granted Loan Before,0.0,81.87,3399.3899,2.0,2.0,0.0,4.0,2.0,4985.8699,9.0,37.0,0.0,1882.0966,1904.08,0.0,41.74,0.0,0.0,3830.67,899.0,400.0,1000,1360.0,7.0,14.0,Fortnightly,56.0,4985.87,2050.0,Full-Time Employment,9.0,0.0,0.2527,3.0,3764.1933,854.0,3356.4633,194.29,MoneySpot,0.0,5252889,3.0,12-05-2023,False,Vehicle Expenses,2023-05-12,Orange,0.0,6382.0,4985.87
0062x00000DWaMOAA1,0012x00000VewUnAAJ,Manoora,QLD,Australia,Closed Lost,Existing Client-No Loan Granted Ever,19.73,70.04,847.7377,2.0,0.0,2.0,4.0,2.0,5107.2824,10.0,20.0,0.0,1626.0414,1587.55,0.0,0.0,0.0,0.0,1400.0,400.0,0.0,600,792.0,5.0,10.0,Fortnightly,33.0,5256.18,600.0,Full-Time Employment,10.0,0.0,0.1429,3.0,5076.4166,893.0,1134.15,158.4,MoneySpot,,4924487,2.0,24-03-2023,False,Travel Expenses,2023-03-23,Orange,1282.0,6495.0,5256.18
0062x00000DFSb2AAH,0012x00000OxOpZAAV,Preston,VIC,Australia,Loan Paid,Existing Client-No Loan Granted Ever,5.21,53.84,0.0,1.0,0.0,2.0,2.0,1.0,4978.745,1.0,12.0,0.0,560.9191,577.9,0.0,63.98,0.0,0.0,0.0,0.0,1000.0,1000,1280.0,6.0,6.429,Weekly,39.0,5894.91,1000.0,,1.0,0.0,0.0,0.0,2609.8166,177.0,177.2833,213.33,MoneySpot,0.0,4669993,1.0,12-02-2023,False,Bond for rental,2023-02-12,Green,393.0,7532.0,5894.91
0062x00000D21qeAAB,0010K0000240wcSQAQ,Ulladulla,NSW,Australia,Closed Lost,Existing Client-Granted Loan Before,0.0,30.02,1320.7374,1.0,0.0,0.0,3.0,1.0,3518.0038,0.0,56.0,293.6946,809.623,813.54,1.0,2.34,0.0,0.0,3159.0,599.0,1000.0,1000,1360.0,14.0,13.857,Weekly,46.0,3518.0,5000.0,Full-Time Employment,0.0,0.0,0.0,0.0,3508.3666,374.0,1072.6733,97.14,MoneySpot,,4423984,0.0,10-01-2023,False,Living Expenses,2023-01-05,Orange,0.0,3842.0,3518.0
0062x00000DtJiMAAV,0010K00002ARR2nQAH,Springdale Heights,NSW,Australia,Loan Paid,Existing Client-Granted Loan Before,0.0,85.66,363.6033,4.0,0.0,0.0,5.0,4.0,13180.0158,8.0,28.0,0.0,1012.4375,500.0,0.0,0.0,0.0,1.0,3466.67,899.0,2160.0,650,884.0,16.0,16.0,Weekly,37.0,13230.02,650.0,Full-Time Employment,8.0,0.0,0.022,4.0,5384.6066,221.0,2862.63,55.25,MoneySpot,0.0,5304710,2.0,18-05-2023,False,Vehicle Expenses,2023-05-17,Green,0.0,13966.0,13230.02
0062x00000EwlUxAAJ,0012x00000G1rBIAAZ,Kogarah,NSW,Australia,Loan Paid,Existing Client-No Loan Granted Ever,0.0,73.68,355.84,2.0,0.0,0.0,2.0,2.0,5155.7892,0.0,9.0,275.3143,1299.43,923.82,0.0,0.06,0.0,0.0,2166.67,400.0,280.0,600,912.0,18.0,34.714,Fortnightly,25.0,5197.12,5000.0,Part-Time Employment,0.0,0.0,0.0,0.0,4925.0933,253.0,761.7,50.67,MoneySpot,0.0,6612118,0.0,22-09-2023,False,Tuition Fees,2023-09-22,Green,0.0,7143.0,5197.12
0062x00000ExFXpAAN,0012x00000leknCAAQ,Mornington,TAS,Australia,Loan Paid,New Client-New Loan,0.0,76.34,1237.7093,4.0,0.0,0.0,3.0,4.0,17101.2032,11.0,27.0,0.0,1808.2015,1205.26,1.0,12.65,0.0,0.0,0.0,0.0,1400.0,1000,1360.0,14.0,14.429,Weekly,31.0,20176.2,2000.0,full_time,15.0,0.0,0.011,1.0,11451.9433,0.0,2594.45,97.14,MoneySpot,0.0,6648591,9.0,26-09-2023,False,car_purchase,2023-09-26,Orange,0.0,25109.0,20176.2
0062x00000DHp2jAAD,0012x00000KM68mAAD,Pinjarra,WA,Australia,Loan Paid,Existing Client-Granted Loan Before,32.58,83.99,1320.7466,3.0,0.0,2.0,5.0,2.0,2123.5747,0.0,29.0,288.0,694.7666,728.1,1.0,0.37,1.0,0.0,2725.67,899.0,1600.0,800,1056.0,12.0,12.571,Weekly,41.0,5936.03,800.0,Full-Time Employment,0.0,0.0,0.011,0.0,1727.2333,775.0,4119.0033,88.0,MoneySpot,0.0,4800275,0.0,05-03-2023,True,Vehicle Expenses,2023-03-05,Orange,2116.0,6494.0,5936.03
0062x00000Fw5gTAAR,0012x00000gn31cAAA,Somerset,TAS,Australia,Closed Lost,Existing Client-Granted Loan Before,27.7,60.75,778.8978,2.0,0.0,4.0,2.0,2.0,5829.0505,2.0,21.0,0.0,1793.6542,1905.92,1.0,0.26,0.0,0.0,1800.0,1500.0,730.0,1000,1360.0,8.0,15.286,Fortnightly,55.0,5806.87,1500.0,Full-Time Employment,2.0,0.0,0.1099,2.0,6095.1333,767.0,994.65,170.0,QuickCash,,8355519,0.0,2024-03-08,False,Child Expenses,2024-03-04,Orange,1910.0,6894.0,5806.87
0062x00000D7lM1AAJ,0012x00000BJE5DAAX,Eagleby,QLD,Australia,Loan Paid,Existing Client-Granted Loan Before,31.09,77.01,2103.1347,2.0,0.0,1.0,2.0,2.0,5105.3674,0.0,0.0,1077.2932,1519.48,1621.48,0.0,0.0,0.0,1.0,1126.67,400.0,100.0,750,1020.0,7.0,14.0,Fortnightly,54.0,5105.37,750.0,Unemployed,0.0,0.0,0.0,0.0,1660.78,1378.0,2272.4233,145.71,Financier-2,0.0,4498887,0.0,18-01-2023,False,Vehicle Expenses,2023-01-18,Orange,1661.0,5342.0,5105.37
0062x00000DGYxyAAH,0012x00000dzq2wAAA,Saint Marys,NSW,Australia,Closed Lost,Existing Client-No Loan Granted Ever,59.56,93.39,749.0685,4.0,1.0,2.0,4.0,2.0,3669.2964,3.0,29.0,1359.7933,1515.04,1471.04,1.0,0.0,1.0,0.0,666.67,899.0,0.0,700,896.0,6.0,6.286,Weekly,36.0,6037.74,5000.0,Unemployed,3.0,0.0,0.1868,1.0,2810.2,819.0,1080.89,149.33,MoneySpot,,4728309,3.0,21-02-2023,True,Furniture or Appliances,2023-02-21,Orange,3358.0,5638.0,6037.74
0062x00000FKMymAAH,0012x00000g90W4AAI,Cranbourne,VIC,Australia,Loan Paid,Existing Client-Granted Loan Before,0.0,91.3,922.28,4.0,0.0,0.0,5.0,4.0,13882.2031,4.0,21.0,0.0,176.0709,200.0,0.0,0.0,0.0,1.0,3603.99,400.0,600.0,750,1020.0,4.0,16.714,Monthly,48.0,14220.54,750.0,Full-Time Employment,4.0,0.0,0.8791,0.0,4831.6566,922.0,4197.87,255.0,MoneySpot,0.0,7387399,2.0,03-12-2023,False,Vehicle Expenses,2023-12-03,Orange,0.0,14916.0,14220.54
0062x00000DYu71AAD,0012x00000hXso3AAC,Colac,VIC,Australia,Loan Paid,New Client-New Loan,24.82,84.29,3474.8716,2.0,0.0,4.0,3.0,2.0,4181.9543,0.0,28.0,1778.8301,952.875,783.93,0.0,0.31,0.0,0.0,0.0,0.0,200.0,700,896.0,3.0,4.857,Fortnightly,26.0,4881.26,3000.0,,0.0,0.0,0.0,0.0,3972.47,3214.0,5112.2566,298.67,MoneySpot,0.0,5059963,0.0,17-04-2023,False,Vehicle - Deposit,2023-04-17,Orange,2226.0,8965.0,4881.26
0062x00000DHqX0AAL,0010K00002BSPpqQAH,Kawungan,QLD,Australia,Closed Lost,Existing Client-Granted Loan Before,37.55,93.76,555.4241,1.0,1.0,2.0,1.0,2.0,1443.4881,3.0,5.0,578.5964,369.4,379.0,3.0,15.14,0.0,0.0,0.0,599.0,400.0,1000,1320.0,10.0,9.714,Weekly,24.0,1515.99,1000.0,Part-Time Employment,11.0,0.0,0.5385,2.0,738.8,858.0,2288.1533,132.0,MoneySpot,,4803403,4.0,05-03-2023,True,Vehicle Expenses,2023-03-05,Orange,739.0,1968.0,1515.99
0062x00000FkF4dAAF,0010K00002AR8NHQA1,Cranbrook,QLD,Australia,Loan Paid,Existing Client-Granted Loan Before,0.0,76.64,1646.8605,2.0,1.0,0.0,3.0,2.0,4656.4114,4.0,47.0,0.0,2143.226,2143.21,2.0,0.0,4.0,0.0,0.0,599.0,1000.0,600,816.0,7.0,14.286,Fortnightly,27.0,9188.04,600.0,,7.0,0.0,0.033,3.0,3988.0766,895.0,3312.06,116.57,MoneySpot,-23.99,8120513,4.0,2024-02-06,False,Veterinary Expenses,2024-02-06,Orange,0.0,8335.0,9188.04
0062x00000DH3BdAAL,0012x00000dygpUAAQ,Busby,NSW,Australia,Loan Paid,Existing Client-Granted Loan Before,0.0,59.69,1912.3871,1.0,0.0,0.0,4.0,1.0,3468.8785,0.0,65.0,578.0565,738.4438,766.48,0.0,0.0,0.0,0.0,1200.0,599.0,800.0,600,816.0,14.0,13.714,Weekly,31.0,3473.88,600.0,Casual Employment,0.0,0.0,0.0,0.0,3199.9233,996.0,1561.94,58.29,MoneySpot,0.0,4758450,0.0,26-02-2023,False,Travel Expenses,2023-02-26,Green,0.0,3627.0,3473.88
0062x00000DHjPXAA1,0012x00000XOVToAAP,Woodville Park,SA,Australia,Loan Paid,Existing Client-Granted Loan Before,0.0,56.4,4032.5856,1.0,0.0,0.0,3.0,1.0,7319.7638,29.0,96.0,2045.9467,846.415,799.17,1.0,0.0,0.0,1.0,3247.8,400.0,0.0,600,792.0,12.0,11.857,Weekly,29.0,7319.76,2050.0,Full-Time Employment,29.0,0.0,0.5934,9.0,3557.36,2578.0,4002.79,66.0,QuickCash,0.0,4793152,28.0,03-03-2023,False,Living Expenses,2023-03-03,Green,0.0,5255.0,7319.76
0062x00000ExizNAAR,0012x00000FFppCAAT,Burwood,NSW,Australia,Closed Lost,Existing Client-No Loan Granted Ever,0.0,52.72,371.3933,2.0,0.0,0.0,3.0,2.0,7067.3152,4.0,19.0,0.0,1947.0657,2251.93,0.0,0.04,0.0,0.0,3900.0,400.0,1920.0,1000,1360.0,8.0,14.857,Fortnightly,30.0,7067.32,1000.0,Full-Time Employment,4.0,0.0,0.033,0.0,4543.1533,0.0,1022.4433,170.0,MoneySpot,,6682961,0.0,03-10-2023,False,vehicle_repairs,2023-09-29,Green,0.0,10967.0,7067.32
0062x00000DZCybAAH,0012x00000hY3JIAA0,Ballajura,WA,Australia,Closed Lost,New Client-New Loan,4.39,74.87,1337.5606,2.0,0.0,2.0,2.0,2.0,4668.4864,1.0,70.0,701.9228,1956.87,2380.92,0.0,0.0,0.0,0.0,0.0,0.0,1500.0,600,768.0,3.0,5.286,Fortnightly,38.0,9993.42,600.0,,1.0,0.0,0.8571,0.0,2218.91,700.0,1318.49,256.0,QuickCash,,5079649,0.0,22-04-2023,False,Once off purchase,2023-04-17,Green,262.0,5959.0,9993.42
0062x00000Da28ZAAR,0012x00000hYWbqAAG,Auburn,NSW,Australia,Loan Paid,New Client-New Loan,0.0,37.7,768.489,2.0,0.0,0.0,3.0,2.0,4673.3693,0.0,20.0,0.0,2123.1071,2147.58,1.0,0.0,0.0,0.0,2300.0,2000.0,280.0,700,896.0,3.0,5.286,Fortnightly,25.0,4673.37,700.0,Part-Time Employment,0.0,0.0,0.1868,0.0,4953.9166,0.0,770.5133,298.67,QuickCash,0.0,5130541,0.0,25-04-2023,False,Other Expenses,2023-04-24,Green,0.0,5193.0,4673.37
0062x00000DISgRAAX,0012800001FMjJlAAL,Mundingburra,QLD,Australia,Loan Paid,Existing Client-Granted Loan Before,0.0,88.71,2699.8691,4.0,0.0,0.0,4.0,4.0,3769.0,3.0,80.0,65.1786,1145.4,1263.0,1.0,55.73,0.0,0.0,1863.33,599.0,400.0,1000,1320.0,12.0,12.0,Weekly,27.0,4603.93,3000.0,Full-Time Employment,3.0,0.0,0.6044,2.0,3769.0,1414.0,3167.3,110.0,MoneySpot,0.0,4834858,3.0,10-03-2023,False,Relocation Expenses,2023-03-10,Orange,0.0,5737.0,4603.93
0062x00000DtgxSAAR,0012x00000SG1H1AAL,Narre Warren,VIC,Australia,Loan Paid,Existing Client-Granted Loan Before,0.0,30.81,643.3763,4.0,0.0,0.0,3.0,4.0,11717.0889,8.0,40.0,88.9101,473.837,233.0,0.0,71.21,0.0,1.0,5817.51,400.0,600.0,1000,1360.0,14.0,14.571,Weekly,36.0,14276.56,2050.0,Full-Time Employment,8.0,0.0,0.5275,6.0,3615.0166,89.0,800.0066,97.14,MoneySpot,0.0,5336164,0.0,20-05-2023,False,Medical Expenses,2023-05-20,Orange,0.0,20692.0,14276.56
0062x00000DJAaNAAX,0012x00000gpYZPAA2,Louth Bay,SA,Australia,Loan Paid,New Client-New Loan,42.58,17.66,542.1032,1.0,0.0,2.0,2.0,2.0,3449.4764,0.0,11.0,160.5324,779.6171,757.43,0.0,0.0,0.0,0.0,450.0,2000.0,500.0,600,768.0,6.0,5.857,Weekly,63.0,3996.14,600.0,Casual Employment,0.0,0.0,0.8022,0.0,3504.7733,158.0,542.1033,128.0,QuickCash,0.0,4874994,0.0,16-03-2023,True,Vehicle Expenses,2023-03-16,Green,1819.0,4271.0,3996.14
0062x00000FXMuLAAX,0012x00000n3zUlAAI,Subiaco,WA,Australia,Loan Paid,New Client-New Loan,0.57,86.55,762.5654,2.0,0.0,0.0,3.0,2.0,4394.633,0.0,14.0,0.0,1400.2914,1372.96,2.0,0.25,0.0,0.0,3033.33,400.0,1716.0,800,1088.0,8.0,15.857,Fortnightly,28.0,4624.68,800.0,Part-Time Employment,0.0,0.0,0.0,0.0,3267.3466,0.0,735.6433,136.0,QuickCash,0.0,7745073,0.0,2024-01-06,False,Living Expenses,2024-01-06,Orange,28.0,4840.0,4624.68
0062x00000GCwGLAA1,0012x00000hXGBZAA4,Rooty Hill,NSW,Australia,Closed Lost,Existing Client-No Loan Granted Ever,0.0,50.88,4146.6563,2.0,0.0,0.0,3.0,2.0,5757.2849,2.0,9.0,0.0,2649.9285,2838.04,0.0,0.21,0.0,0.0,0.0,0.0,680.0,800,1056.0,5.0,9.714,Fortnightly,42.0,5886.62,800.0,,2.0,0.0,0.0,0.0,6183.1666,1177.0,4456.8366,211.2,MoneySpot,,8807081,0.0,2024-04-16,False,vehicle_expenses,2024-04-11,Orange,0.0,6623.0,5886.62
0062x00000ED9NwAAL,0012x00000kZzPQAA0,Benandarah,NSW,Australia,Loan Paid,New Client-New Loan,30.37,46.59,957.1994,1.0,0.0,2.0,1.0,1.0,5191.5266,0.0,8.0,0.0,810.5692,826.8,0.0,0.0,0.0,0.0,792.4,2000.0,100.0,1000,1400.0,18.0,18.286,Weekly,31.0,5120.92,3000.0,Part-Time Employment,0.0,0.0,0.0,0.0,5130.61,137.0,1551.21,77.78,MoneySpot,0.0,5924132,0.0,16-07-2023,False,Vehicle Expenses,2023-07-16,Orange,1618.0,5326.0,5120.92
0062x00000DW5PXAA1,0012x00000WtifqAAB,Monash,ACT,Australia,Closed Lost,Existing Client-No Loan Granted Ever,0.0,69.64,1579.8746,2.0,3.0,0.0,4.0,2.0,4134.3689,10.0,69.0,280.4171,1576.0142,1567.71,0.0,0.0,0.0,0.0,3319.33,400.0,960.0,600,768.0,3.0,5.571,Fortnightly,39.0,4134.37,600.0,Part-Time Employment,10.0,0.0,0.2088,0.0,3677.3666,526.0,2020.9433,256.0,MoneySpot,,4896580,6.0,20-03-2023,False,Medical Expenses,2023-03-19,Green,0.0,4627.0,4134.37
0062x00000DZ2LLAA1,0012x00000WtQlTAAV,Orange,NSW,Australia,Loan Paid,Existing Client-Granted Loan Before,2.99,40.95,3363.0513,2.0,0.0,0.0,3.0,2.0,7346.0655,0.0,34.0,1118.1294,2109.9483,2066.14,1.0,1.75,1.0,0.0,4968.7,899.0,2080.0,800,1024.0,3.0,4.714,Fortnightly,33.0,7571.6,2050.0,Full-Time Employment,0.0,0.0,0.011,0.0,5442.9566,415.0,2977.8833,341.33,QuickCash,0.0,5067844,0.0,15-04-2023,False,Living Expenses,2023-04-15,Green,226.0,7555.0,7571.6
0062x00000EN9xAAAT,0012x00000hZzsaAAC,Collingwood Park,QLD,Australia,Loan Paid,Existing Client-Granted Loan Before,0.23,94.07,1278.6199,2.0,0.0,2.0,4.0,2.0,3926.1068,0.0,77.0,0.0,1628.52,1643.58,0.0,0.0,0.0,0.0,3250.0,599.0,200.0,1000,1400.0,10.0,19.286,Fortnightly,21.0,3642.77,2050.0,Full-Time Employment,0.0,0.0,0.044,0.0,3813.08,785.0,2783.0,140.0,MoneySpot,0.0,6153534,0.0,10-08-2023,False,Relocation Expenses,2023-08-09,Orange,13.0,5635.0,3642.77
0062x00000D7rFBAAZ,0010K00001iK2QgQAK,Epsom,VIC,Australia,Loan Paid,Existing Client-Granted Loan Before,0.0,66.54,1130.3333,0.0,0.0,0.0,0.0,0.0,135.0033,0.0,33.0,1819.2537,0.0,0.0,0.0,43.78,4.0,0.0,4875.0,599.0,370.0,750,990.0,5.0,10.143,Fortnightly,53.0,4648.9,750.0,Full-Time Employment,0.0,0.0,0.0769,0.0,0.0,641.0,2822.3966,198.0,MoneySpot,0.0,4502952,0.0,19-01-2023,False,Medical Expenses,2023-01-18,Orange,0.0,7755.0,4648.9
0062x00000FgwcSAAR,0012x00000LQEKCAA5,Werribee,VIC,Australia,Loan Paid,Existing Client-Granted Loan Before,0.0,56.32,2451.1014,2.0,0.0,0.0,2.0,2.0,4175.4147,3.0,30.0,487.6672,1921.62,2031.62,1.0,0.0,1.0,0.0,5295.05,899.0,3000.0,1000,1360.0,7.0,13.429,Fortnightly,42.0,5017.58,2050.0,Full-Time Employment,3.0,0.0,0.6264,2.0,4483.78,905.0,2890.31,194.29,MoneySpot,0.0,7855204,1.0,2024-01-14,False,Travel Expenses,2024-01-14,Orange,0.0,5018.0,5017.58
0062x00000DIPGfAAP,0012x00000RrBxEAAV,Baulkham Hills,NSW,Australia,Loan Paid,Existing Client-Granted Loan Before,0.3,50.37,114.0625,4.0,1.0,0.0,3.0,4.0,2242.7499,8.0,0.0,0.0,1013.65,1858.0,0.0,0.0,0.0,0.0,4001.36,400.0,400.0,1000,1320.0,7.0,13.0,Fortnightly,27.0,2683.08,1000.0,Full-Time Employment,8.0,0.0,0.0659,2.0,1689.4166,0.0,170.1333,188.57,MoneySpot,0.0,4830975,1.0,09-03-2023,False,Vehicle Expenses,2023-03-09,Orange,26.0,8526.0,2683.08
0062x00000DtvNIAAZ,0012x00000g9kHwAAI,Yarraville,VIC,Australia,Loan Paid,Existing Client-Granted Loan Before,0.0,80.28,1498.9647,2.0,0.0,0.0,3.0,2.0,8103.5035,9.0,131.0,0.0,2040.3183,1806.84,0.0,7.95,0.0,0.0,0.0,400.0,400.0,1000,1360.0,7.0,13.286,Fortnightly,34.0,9854.5,2050.0,,9.0,0.0,0.0659,8.0,4080.6366,494.0,5031.14,194.29,QuickCash,0.0,5356771,0.0,23-05-2023,False,Veterinary Expenses,2023-05-22,Orange,0.0,11540.0,9854.5
0062x00000EMX3IAAX,0012x00000WXnXeAAL,Ayr,QLD,Australia,Closed Lost,Existing Client-No Loan Granted Ever,0.0,51.33,1312.2444,2.0,0.0,0.0,3.0,2.0,4009.452,1.0,35.0,0.0,1845.4471,2095.26,1.0,0.0,0.0,0.0,1300.0,0.0,2000.0,700,924.0,6.0,11.857,Fortnightly,55.0,4009.45,700.0,Full-Time Employment,1.0,0.0,0.0,1.0,4306.0433,0.0,1897.3233,154.0,MoneySpot,,6108552,1.0,04-08-2023,False,Travel & Entertainment,2023-08-04,Green,0.0,4306.0,4009.45
0062x00000DXlWnAAL,0012x00000hXFJiAAO,Marsden,QLD,Australia,Closed Lost,New Client-New Loan,0.0,67.13,177.6066,2.0,0.0,0.0,1.0,2.0,152.6666,8.0,42.0,834.7839,91.6,150.0,1.0,0.0,0.0,1.0,0.0,0.0,800.0,700,896.0,6.0,6.143,Weekly,30.0,3008.8,10000.0,,8.0,0.0,0.1978,1.0,0.0,791.0,1113.6466,149.33,MoneySpot,,4994429,5.0,04-04-2023,False,Funeral Expenses,2023-04-03,Orange,0.0,3470.0,3008.8
0062x00000D1wfdAAB,0012x00000SHlTDAA1,Wanneroo,WA,Australia,Loan Paid,Existing Client-Granted Loan Before,0.4,83.92,1271.2676,2.0,9.0,0.0,4.0,2.0,3357.6377,25.0,37.0,931.7566,1485.595,1486.42,1.0,0.0,0.0,0.0,1763.07,599.0,300.0,800,1088.0,7.0,13.143,Fortnightly,34.0,3357.64,800.0,Full-Time Employment,25.0,0.0,0.6154,7.0,2971.19,897.0,1360.0833,155.43,QuickCash,0.0,4418922,25.0,05-01-2023,False,Other Expenses,2023-01-05,Green,13.0,3173.0,3357.64
0062x00000DFDnqAAH,0012x00000gnSLhAAM,Lochinvar,NSW,Australia,Loan Paid,New Client-New Loan,0.0,48.11,1377.4844,1.0,0.0,0.0,3.0,1.0,5797.3162,3.0,40.0,0.0,1334.1769,1398.0,0.0,0.65,0.0,0.0,6066.67,400.0,0.0,1000,1360.0,14.0,13.857,Weekly,26.0,5797.32,3000.0,Full-Time Employment,3.0,0.0,0.0879,1.0,5781.4333,0.0,1065.1866,97.14,MoneySpot,0.0,4656148,0.0,10-02-2023,False,Travel Expenses,2023-02-10,Orange,0.0,8203.0,5797.32
0062x00000D7NgxAAF,0012x00000SHsoQAAT,Mango Hill,QLD,Australia,Loan Paid,Existing Client-Granted Loan Before,0.0,12.95,1803.8214,1.0,0.0,0.0,3.0,1.0,5906.6398,1.0,54.0,28.7296,1359.3369,1211.97,0.0,2.6,0.0,0.0,0.0,0.0,1200.0,900,1224.0,14.0,14.571,Weekly,66.0,5906.64,900.0,,1.0,0.0,0.8462,1.0,5890.46,425.0,2470.62,87.43,QuickCash,0.0,4481359,0.0,18-01-2023,False,Car Repairs,2023-01-18,Orange,0.0,5924.0,5906.64
0062x00000DGMoIAAX,0012x00000g90dUAAQ,Doreen,VIC,Australia,Loan Paid,Existing Client-No Loan Granted Ever,0.0,85.21,966.9332,1.0,0.0,0.0,1.0,1.0,5374.0756,0.0,57.0,0.0,755.9783,748.5,1.0,0.03,0.0,0.0,3362.67,400.0,0.0,1000,1360.0,14.0,14.143,Weekly,21.0,5377.41,3000.0,Full-Time Employment,0.0,0.0,0.0,0.0,3023.9133,390.0,2009.0433,97.14,MoneySpot,0.0,4719471,0.0,21-02-2023,False,Vehicle Expenses,2023-02-21,Orange,0.0,6758.0,5377.41
0062x00000DFRkvAAH,0010K00001yn11YQAQ,ELI WATERS,QLD,Australia,Loan Paid,Existing Client-Granted Loan Before,42.42,61.15,987.7482,1.0,0.0,2.0,3.0,1.0,5326.3356,9.0,100.0,1537.088,582.5484,235.2,1.0,0.0,0.0,0.0,4246.67,1499.0,1120.0,600,816.0,14.0,14.571,Weekly,38.0,5175.14,600.0,Part-Time Employment,9.0,0.0,0.2527,4.0,4717.5833,723.0,2995.5733,58.29,MoneySpot,0.0,4668711,3.0,12-02-2023,False,Other,2023-02-12,Green,2677.0,6310.0,5175.14
0062x00000DJ3zKAAT,0012x00000d9BwsAAE,Cronulla,NSW,Australia,Loan Paid,Existing Client-Granted Loan Before,0.0,20.59,225.9502,2.0,0.0,0.0,4.0,2.0,5292.796,0.0,77.0,208.0,2056.6366,2050.47,0.0,0.0,0.0,1.0,4944.33,899.0,2040.0,1000,1280.0,3.0,6.286,Fortnightly,45.0,5944.88,1000.0,Full-Time Employment,0.0,0.0,0.1648,0.0,636.26,139.0,1556.3433,426.67,QuickCash,0.0,4868711,0.0,16-03-2023,False,Living Expenses,2023-03-15,Green,0.0,6375.0,5944.88
0062x00000EyyoaAAB,0010K00001dOkRkQAK,c,VIC,Australia,Loan Paid,Existing Client-Granted Loan Before,0.0,88.81,1643.0655,1.0,0.0,0.0,4.0,1.0,7019.3182,12.0,45.0,166.1619,1305.8469,1239.33,2.0,4.7,0.0,1.0,3163.33,599.0,250.0,750,1020.0,14.0,13.714,Weekly,55.0,7014.39,750.0,Full-Time Employment,12.0,0.0,0.044,2.0,0.0,329.0,1527.6633,72.86,QuickCash,0.0,6776515,6.0,08-10-2023,False,Furniture or Appliances,2023-10-08,Orange,0.0,8780.0,7014.39
0062x00000FtN5JAAV,0012x00000gpFwuAAE,Rouse Hill,NSW,Australia,Loan Paid,Existing Client-Granted Loan Before,0.0,7.08,4059.0,0.0,0.0,0.0,0.0,0.0,239.3566,0.0,0.0,0.0,0.0,0.0,0.0,1.05,1.0,0.0,0.0,1499.0,2040.0,1000,1360.0,7.0,13.429,Fortnightly,41.0,7583.22,1000.0,Part-Time Employment,0.0,0.0,0.0,0.0,4691.01,867.0,6133.2233,194.29,MoneySpot,0.0,8172327,0.0,2024-02-12,False,Living Expenses,2024-02-12,Orange,0.0,26906.0,7583.22
0062x00000D1rydAAB,0012x00000WW71WAAT,Murdoch,WA,Australia,Loan Paid,Existing Client-Granted Loan Before,35.61,91.79,1920.2285,1.0,2.0,2.0,2.0,1.0,6451.6137,19.0,63.0,280.7893,441.7876,325.7,1.0,0.0,0.0,0.0,3033.33,400.0,250.0,1000,1320.0,7.0,12.857,Fortnightly,24.0,6299.88,2050.0,Part-Time Employment,22.0,0.0,0.0549,9.0,5705.2033,1124.0,2691.1333,188.57,MoneySpot,0.0,4415690,22.0,05-01-2023,False,Child Expenses,2023-01-05,Orange,2383.0,6691.0,6299.88
0062x00000D7r9cAAB,0012x00000fmeKUAAY,Ingham,QLD,Australia,Loan Paid,Existing Client-Granted Loan Before,0.0,64.73,899.4922,1.0,0.0,0.0,2.0,1.0,5321.8277,16.0,39.0,0.0,1049.7857,1029.0,0.0,0.26,0.0,0.0,4766.67,899.0,250.0,1000,1360.0,14.0,14.0,Weekly,34.0,5321.83,1500.0,Full-Time Employment,22.0,0.0,0.3077,4.0,4899.0,603.0,1065.4466,97.14,MoneySpot,0.0,4502876,15.0,19-01-2023,False,Vehicle Expenses,2023-01-18,Orange,0.0,4962.0,5321.83
0062x00000DsrGDAAZ,0010K00001eI5JtQAK,St Albans,VIC,Australia,Loan Paid,Existing Client-Granted Loan Before,0.0,41.52,2131.3258,3.0,4.0,0.0,4.0,3.0,6160.275,15.0,34.0,0.0,5225.275,5511.85,1.0,30.81,0.0,0.0,6283.33,1500.0,1000.0,900,1296.0,6.0,26.286,Monthly,40.0,6175.28,900.0,Full-Time Employment,15.0,0.0,0.6593,5.0,6967.0333,132.0,2300.3866,216.0,MoneySpot,0.0,5271157,15.0,15-05-2023,False,Vehicle Expenses,2023-05-14,Green,0.0,8807.0,6175.28
0062x00000DWQltAAH,0012x000008JsaVAAS,Rockingham,WA,Australia,Loan Paid,Existing Client-Granted Loan Before,0.0,70.62,5877.3116,1.0,0.0,0.0,3.0,1.0,7541.0236,0.0,52.0,453.8494,887.0312,1066.65,0.0,1.77,0.0,0.0,3553.33,400.0,350.0,1000,1320.0,11.0,11.0,Weekly,38.0,9099.36,2050.0,Full-Time Employment,0.0,0.0,0.0,0.0,4730.8333,5254.0,8920.3333,120.0,MoneySpot,0.0,4916636,0.0,23-03-2023,False,Home Maintenance & Repairs,2023-03-22,Orange,0.0,13988.0,9099.36
0062x00000DX06MAAT,0012x00000Tu3kGAAR,Jamestown,SA,Australia,Closed Lost,Existing Client-Granted Loan Before,0.0,66.02,2635.7652,2.0,0.0,0.0,3.0,2.0,5239.8192,1.0,30.0,1304.9323,1478.8683,1458.56,0.0,0.73,1.0,0.0,0.0,400.0,480.0,900,1152.0,4.0,7.286,Fortnightly,26.0,6298.48,900.0,,1.0,0.0,0.4835,0.0,2957.7366,673.0,2995.0133,288.0,MoneySpot,,4948966,1.0,28-03-2023,False,Veterinary Expenses,2023-03-28,Green,0.0,6437.0,6298.48
0062x00000DthLtAAJ,0012x00000czLhfAAE,Narre Warren,VIC,Australia,Closed Lost,Existing Client-Granted Loan Before,0.0,83.37,95.052,4.0,0.0,0.0,4.0,4.0,220.3366,2.0,28.0,0.0,62.75,26.0,0.0,0.0,0.0,1.0,3449.66,599.0,1080.0,800,1088.0,14.0,13.714,Weekly,23.0,5850.78,5000.0,Full-Time Employment,2.0,0.0,0.1099,2.0,2810.8633,0.0,451.2133,77.71,MoneySpot,,5336882,0.0,20-05-2023,False,Vehicle Expenses,2023-05-20,Orange,0.0,2809.0,5850.78
0062x00000F1mXdAAJ,0012x00000TrVyXAAV,Harrisdale,WA,Australia,Loan Paid,Existing Client-Granted Loan Before,0.0,99.18,1097.2087,1.0,2.0,0.0,2.0,1.0,4905.8482,12.0,22.0,0.0,797.4276,535.88,1.0,0.0,0.0,0.0,3466.9,1499.0,500.0,700,980.0,18.0,17.714,Weekly,24.0,4905.85,1000.0,Full-Time Employment,12.0,0.0,0.011,2.0,4138.8533,839.0,1402.21,54.44,MoneySpot,0.0,6921299,12.0,24-10-2023,False,Other Expenses,2023-10-24,Orange,0.0,4521.0,4905.85
0062x00000DrY2yAAF,0012x00000hXkbyAAC,Kelmscott,WA,Australia,Loan Paid,Existing Client-Granted Loan Before,0.33,68.85,3585.1917,4.0,0.0,0.0,4.0,4.0,4755.6766,0.0,19.0,2611.2,1658.4912,1904.38,1.0,0.93,0.0,0.0,0.0,899.0,400.0,1000,1360.0,7.0,13.429,Fortnightly,23.0,4809.01,4200.0,,0.0,0.0,0.0,0.0,4422.6433,3318.0,5470.73,194.29,QuickCash,0.0,5173933,0.0,01-05-2023,False,Travel Expenses,2023-05-01,Orange,27.0,7953.0,4809.01
0062x00000GG1Q9AAL,0012x00000MjeTFAAZ,Ingleburn,NSW,Australia,Closed Lost,Existing Client-Granted Loan Before,0.0,67.51,5699.0643,1.0,0.0,0.0,3.0,1.0,9456.8808,18.0,100.0,2080.6393,1205.91,1287.95,0.0,0.0,2.0,0.0,0.0,400.0,200.0,1000,1360.0,14.0,14.0,Weekly,43.0,10068.34,3000.0,,18.0,0.0,0.0549,0.0,4667.4,3142.0,8616.3833,97.14,MoneySpot,,8603374,9.0,2024-03-30,False,Child Expenses,2024-03-25,Orange,0.0,10334.0,10068.34
0062x00000DZ6WnAAL,0012x00000ZvYuBAAV,Owen,SA,Australia,Loan Paid,Existing Client-Granted Loan Before,0.0,81.87,3377.0827,2.0,0.0,0.0,3.0,2.0,6570.6665,0.0,7.0,633.1631,1930.1285,1941.75,0.0,0.58,0.0,0.0,4983.33,599.0,300.0,650,832.0,3.0,5.571,Fortnightly,40.0,4561.33,2050.0,Full-Time Employment,0.0,0.0,0.0,0.0,4503.6333,680.0,3578.63,277.33,MoneySpot,0.0,5073458,0.0,16-04-2023,False,Travel Expenses,2023-04-16,Green,0.0,11117.0,4561.33
0062x00000D1jzaAAB,0012x00000GeZMvAAN,Dulwich Hill,NSW,Australia,Loan Paid,Existing Client-Granted Loan Before,0.0,91.97,1678.0612,1.0,4.0,0.0,4.0,1.0,6105.6803,9.0,68.0,192.0,926.3433,919.81,1.0,1.74,0.0,0.0,2000.0,599.0,1020.0,1000,1360.0,14.0,14.286,Weekly,28.0,6105.68,1000.0,Full-Time Employment,9.0,0.0,0.1538,0.0,3705.3733,755.0,2201.1633,97.14,QuickCash,0.0,4408207,9.0,04-01-2023,False,Vehicle Expenses,2023-01-04,Green,0.0,7307.0,6105.68
0062x00000DsuEMAAZ,0012x00000hXCIKAA4,Darwin City,NT,Australia,Loan Paid,Existing Client-No Loan Granted Ever,0.0,27.47,2282.0599,2.0,0.0,0.0,5.0,2.0,11172.6666,7.0,12.0,0.0,4095.09,3136.33,0.0,0.0,0.0,0.0,0.0,400.0,1060.0,1000,1320.0,3.0,10.429,Monthly,38.0,11172.67,1000.0,Full-Time Employment,7.0,0.0,0.022,1.0,9555.21,183.0,3756.0166,440.0,MoneySpot,0.0,5272825,4.0,15-05-2023,False,Vehicle Expenses,2023-05-15,Green,0.0,11256.0,11172.67
0062x00000FVTf9AAH,0012x00000n2SzmAAE,Nulsen,WA,Australia,Closed Lost,New Client-New Loan,0.0,38.39,890.7718,2.0,0.0,0.0,3.0,2.0,5460.9007,0.0,12.0,192.0,2466.7171,2193.91,0.0,2.61,0.0,0.0,5525.0,400.0,200.0,850,1190.0,10.0,20.0,Fortnightly,22.0,5657.57,1200.0,Full-Time Employment,0.0,0.0,0.0,0.0,5755.6733,64.0,1216.8566,119.0,QuickCash,,7595022,0.0,26-12-2023,False,Living Expenses,2023-12-21,Green,0.0,6429.0,5657.57
0062x00000DXejgAAD,0010K00001vipggQAA,Lavington,NSW,Australia,Loan Paid,Existing Client-Granted Loan Before,0.0,71.21,3312.9563,4.0,0.0,0.0,1.0,4.0,13712.3324,3.0,81.0,341.0752,1108.1429,1006.23,0.0,2.31,0.0,0.0,3683.33,899.0,1000.0,700,924.0,9.0,9.286,Weekly,57.0,14208.61,700.0,Full-Time Employment,3.0,0.0,0.5495,1.0,11836.28,3602.0,6630.5866,102.67,MoneySpot,0.0,4988474,3.0,03-04-2023,False,Living Expenses,2023-04-03,Orange,0.0,17282.0,14208.61
0062x00000DrWQaAAN,0012x00000hYuYHAA0,Ashmore,QLD,Australia,Loan Paid,New Client-New Loan,0.0,66.43,998.9575,1.0,0.0,0.0,5.0,1.0,4618.126,0.0,15.0,164.9018,822.1538,793.0,0.0,0.0,0.0,1.0,3466.67,1500.0,1200.0,700,896.0,6.0,5.714,Weekly,42.0,5842.99,31000.0,Full-Time Employment,2.0,0.0,0.3187,2.0,0.0,152.0,1011.1133,149.33,MoneySpot,0.0,5172721,2.0,01-05-2023,False,Living Expenses,2023-05-01,Orange,0.0,7003.0,5842.99
0062x00000DIuZxAAL,0012x00000goc9hAAA,Avoca,QLD,Australia,Loan Paid,Existing Client-No Loan Granted Ever,0.0,23.39,964.1809,1.0,0.0,0.0,3.0,1.0,4171.9158,0.0,2.0,0.0,859.0823,856.97,0.0,0.92,0.0,0.0,850.0,0.0,350.0,800,1024.0,6.0,6.286,Weekly,26.0,4171.92,2000.0,Full-Time Employment,3.0,0.0,0.0,1.0,3722.69,35.0,2587.4266,170.67,QuickCash,0.0,4861624,3.0,14-03-2023,False,Car Other,2023-03-14,Orange,0.0,4673.0,4171.92
0062x00000D76KVAAZ,0012x00000Tu1tHAAR,Melton West,VIC,Australia,Loan Paid,Existing Client-Granted Loan Before,0.0,83.66,4047.7804,1.0,3.0,0.0,2.0,1.0,8124.8453,18.0,92.0,879.6501,1045.5792,1389.67,0.0,4.26,0.0,0.0,5849.58,400.0,100.0,600,816.0,14.0,13.714,Weekly,24.0,6513.9,600.0,Part-Time Employment,18.0,0.0,0.0,0.0,4530.8433,716.0,3999.0333,58.29,QuickCash,0.0,4467144,4.0,13-01-2023,False,Travel Expenses,2023-01-12,Green,0.0,8407.0,6513.9
0062x00000DthAGAAZ,0012x000002chCVAAY,Boondall,QLD,Australia,Loan Paid,Existing Client-Granted Loan Before,5.01,45.71,0.0,2.0,0.0,0.0,2.0,2.0,4349.5832,0.0,4.0,0.0,2002.0,2002.0,0.0,0.0,0.0,1.0,4333.33,899.0,150.0,1000,1320.0,7.0,12.714,Fortnightly,38.0,3336.67,1000.0,Full-Time Employment,0.0,0.0,0.0,0.0,0.0,107.0,141.6666,188.57,Financier-2,0.0,5337160,0.0,20-05-2023,False,Vehicle Expenses,2023-05-20,Orange,213.0,4244.0,3336.67
0062x00000DGpqJAAT,0012x00000OvHCmAAN,Bundamba,QLD,Australia,Loan Paid,Existing Client-Granted Loan Before,0.0,55.7,3587.0852,2.0,0.0,0.0,4.0,2.0,4354.5077,1.0,35.0,0.0,2004.2666,1963.72,1.0,0.0,0.0,0.0,4327.06,599.0,400.0,1000,1360.0,7.0,13.0,Fortnightly,32.0,4354.51,1000.0,Full-Time Employment,2.0,0.0,0.0659,0.0,4008.5333,39.0,3735.58,194.29,MoneySpot,0.0,4745591,2.0,24-02-2023,False,Travel Expenses,2023-02-23,Orange,0.0,4033.0,4354.51
0062x00000D2MQmAAN,0012x00000bmvJMAAY,Karangi,NSW,Australia,Closed Lost,Existing Client-No Loan Granted Ever,0.0,40.38,470.7666,3.0,0.0,0.0,4.0,3.0,170.0,6.0,63.0,349.531,170.0,170.0,1.0,1.04,0.0,0.0,0.0,2000.0,400.0,800,1024.0,6.0,6.429,Weekly,28.0,4765.96,10400.0,Full-Time Employment,6.0,0.0,0.2747,4.0,190.0,684.0,1676.5833,170.67,MoneySpot,,4441525,1.0,09-01-2023,False,Living Expenses,2023-01-08,Orange,0.0,7395.0,4765.96
0062x00000DXeRJAA1,0012x00000Ttnp9AAB,Muirhead,NT,Australia,Closed Lost,Existing Client-Granted Loan Before,0.0,66.76,2265.4821,2.0,0.0,0.0,4.0,2.0,22323.0682,1.0,34.0,0.0,5121.9614,4871.07,0.0,23.52,0.0,0.0,13696.6,599.0,1500.0,1000,1320.0,5.0,9.571,Fortnightly,38.0,22323.07,2050.0,Full-Time Employment,1.0,0.0,0.0,0.0,11951.2433,1163.0,2768.5766,264.0,MoneySpot,,4988457,0.0,03-04-2023,False,Other Expenses,2023-04-03,Orange,0.0,25795.0,22323.07
0062x00000FWymUAAT,0012x00000n3lgXAAQ,Salisbury Park,SA,Australia,Loan Paid,New Client-New Loan,0.0,19.48,748.5085,2.0,0.0,0.0,1.0,2.0,5317.4875,3.0,34.0,0.0,2208.57,2233.42,0.0,0.0,0.0,0.0,0.0,0.0,1200.0,700,924.0,7.0,12.857,Fortnightly,61.0,5317.49,1000.0,full_time,7.0,0.0,0.011,7.0,4417.14,0.0,2689.8366,132.0,QuickCash,0.0,7715117,0.0,2024-01-03,False,vehicle_expenses,2024-01-03,Orange,0.0,4784.0,5317.49
0062x00000FhdZZAAZ,0010K0000280NX4QAM,Blacktown,NSW,Australia,Loan Paid,Existing Client-Granted Loan Before,0.0,56.82,2118.1892,1.0,0.0,0.0,4.0,1.0,4976.3441,3.0,40.0,502.3095,1005.2915,979.0,0.0,44.96,0.0,0.0,4196.83,1499.0,920.0,1000,1360.0,14.0,14.0,Weekly,54.0,6867.4,2050.0,Full-Time Employment,3.0,0.0,0.0,0.0,4591.93,907.0,2458.24,97.14,MoneySpot,0.04,7917139,3.0,2024-01-19,False,Travel Expenses,2024-01-19,Orange,0.0,6922.0,6867.4
0062x00000EdNhcAAF,0012x00000TudfjAAB,Murray Bridge,SA,Australia,Loan Paid,Existing Client-Granted Loan Before,0.0,57.66,0.0,4.0,0.0,0.0,4.0,4.0,170.0166,6.0,35.0,0.0,20.0166,54.5,0.0,10.14,0.0,1.0,10833.33,1500.0,600.0,700,952.0,16.0,16.429,Weekly,24.0,3493.26,1000.0,Student,6.0,0.0,0.1538,2.0,0.0,422.0,614.9533,59.5,QuickCash,0.0,6418596,4.0,04-09-2023,False,Vehicle Expenses,2023-09-04,Orange,0.0,2812.0,3493.26
0062x00000D2AJKAA3,0012x00000INQkeAAH,Aveley,WA,Australia,Loan Paid,Existing Client-No Loan Granted Ever,0.0,16.28,0.0,1.0,0.0,0.0,3.0,1.0,4860.8722,0.0,12.0,0.0,1118.6666,1126.0,0.0,0.0,0.0,1.0,2587.0,1499.0,2000.0,1000,1280.0,6.0,5.714,Weekly,33.0,10132.27,2000.0,Full-Time Employment,0.0,0.0,0.0989,0.0,0.0,0.0,0.0,213.33,MoneySpot,0.0,4430793,0.0,07-01-2023,False,Living Expenses,2023-01-06,Orange,0.0,5664.0,10132.27
0062x00000DWj7SAAT,0012x000003COQ1AAO,Clayton,VIC,Australia,Loan Paid,Existing Client-No Loan Granted Ever,0.0,56.46,2077.1831,2.0,0.0,0.0,4.0,2.0,7525.1976,0.0,20.0,861.8056,1830.6385,949.58,0.0,0.11,0.0,0.0,0.0,899.0,500.0,800,1024.0,3.0,5.857,Fortnightly,45.0,7525.2,1500.0,Full-Time Employment,0.0,0.0,0.0549,0.0,4271.49,793.0,2329.66,341.33,MoneySpot,0.0,4933077,0.0,25-03-2023,False,Life Event Expenses,2023-03-25,Orange,0.0,12144.0,7525.2
0062x00000DZwnFAAT,0012x000003EZ9IAAW,CROYDON,VIC,Australia,Closed Lost,Existing Client-No Loan Granted Ever,0.0,94.62,0.0,1.0,0.0,0.0,5.0,1.0,3927.052,0.0,3.0,0.0,778.1715,858.25,3.0,20.49,0.0,1.0,3679.0,400.0,350.0,1000,1280.0,6.0,5.714,Weekly,25.0,3927.05,3000.0,Full-Time Employment,0.0,0.0,0.1099,0.0,0.0,0.0,50.0,213.33,MoneySpot,,5126150,0.0,25-04-2023,False,Vehicle - Deposit,2023-04-23,Orange,0.0,4295.0,3927.05
0062x00000E4ZNpAAN,0012x00000hYHw7AAG,Millaa Millaa,QLD,Australia,Loan Paid,Existing Client-Granted Loan Before,0.0,42.18,787.2076,2.0,0.0,0.0,3.0,2.0,3950.5145,0.0,3.0,0.0,1780.73,1652.95,0.0,0.0,0.0,0.0,4333.33,599.0,200.0,1000,1400.0,9.0,18.429,Fortnightly,23.0,4297.18,1000.0,Casual Employment,0.0,0.0,0.1319,0.0,3561.46,213.0,600.25,155.56,MoneySpot,0.0,5582338,0.0,12-06-2023,False,Living Expenses,2023-06-12,Green,0.0,4361.0,4297.18
0062x00000ENJ7iAAH,0012x00000iIQ5MAAW,Airport West,VIC,Australia,Loan Paid,Existing Client-Granted Loan Before,0.0,56.32,1529.6432,3.0,0.0,0.0,1.0,3.0,6460.1532,2.0,15.0,0.0,3511.3366,3525.67,0.0,63.95,0.0,0.0,0.0,400.0,0.0,1000,1400.0,5.0,21.571,Monthly,23.0,6460.15,1000.0,,2.0,0.0,0.033,2.0,3511.3366,213.0,1742.9766,280.0,QuickCash,0.0,6164620,2.0,10-08-2023,False,Living Expenses,2023-08-10,Green,0.0,7054.0,6460.15
0062x00000E3tnOAAR,0010K000020JoIqQAK,Dalby,QLD,Australia,Loan Paid,Existing Client-Granted Loan Before,71.71,94.1,325.9662,4.0,0.0,2.0,2.0,2.0,2721.3341,0.0,0.0,0.0,620.044,587.55,0.0,0.0,0.0,0.0,1334.67,400.0,620.0,600,792.0,7.0,13.0,Fortnightly,30.0,2721.33,600.0,Part-Time Employment,1.0,0.0,0.3956,0.0,1660.3133,369.0,377.1766,113.14,Financier-2,0.0,5524200,1.0,07-06-2023,True,Vehicle Expenses,2023-06-06,Orange,1978.0,2758.0,2721.33
0062x00000EeyXvAAJ,0012x00000lIRg2AAG,Miles,QLD,Australia,Loan Paid,New Client-New Loan,0.0,40.15,547.01,1.0,0.0,0.0,2.0,1.0,8582.3168,0.0,0.0,0.0,1811.0,1811.0,0.0,0.0,0.0,0.0,0.0,0.0,800.0,900,1188.0,10.0,9.714,Weekly,32.0,8582.32,900.0,,0.0,0.0,0.0,0.0,7847.6666,0.0,988.6633,118.8,QuickCash,0.0,6533267,0.0,15-09-2023,False,Medical bills,2023-09-14,Orange,0.0,9112.0,8582.32
0062x00000DISFuAAP,0012x00000NRapwAAD,Pacific Pines,QLD,Australia,Closed Lost,Existing Client-No Loan Granted Ever,18.32,49.28,1389.9399,4.0,0.0,4.0,3.0,4.0,2824.5465,1.0,14.0,0.0,1310.188,1360.77,0.0,0.0,0.0,0.0,30000.0,400.0,200.0,1000,1280.0,3.0,4.857,Fortnightly,23.0,2824.55,2000.0,Casual Employment,1.0,0.0,0.011,1.0,2824.5466,0.0,1947.0066,426.67,MoneySpot,,4834523,1.0,10-03-2023,False,Life Event Expenses,2023-03-09,Orange,644.0,3515.0,2824.55
0062x00000Ex21CAAR,0012x00000bmN6oAAE,Eimeo,QLD,Australia,Loan Paid,Existing Client-Granted Loan Before,0.14,16.75,466.3025,2.0,0.0,0.0,4.0,2.0,8807.4195,0.0,11.0,0.0,3410.05,3559.77,0.0,0.0,0.0,0.0,7150.0,1499.0,2400.0,1000,1360.0,7.0,14.571,Fortnightly,46.0,8807.42,1000.0,Full-Time Employment,0.0,0.0,0.033,0.0,5683.4166,69.0,445.7566,194.29,MoneySpot,0.0,6633348,0.0,25-09-2023,False,Vehicle Expenses,2023-09-24,Orange,14.0,9737.0,8807.42
0062x00000DWyhaAAD,0010K00001hT4xWQAS,Reservoir,VIC,Australia,Closed Lost,Existing Client-No Loan Granted Ever,0.0,92.23,0.0,4.0,0.0,0.0,2.0,4.0,6948.2332,0.0,0.0,0.0,3621.585,5027.67,0.0,0.02,0.0,0.0,2166.67,899.0,0.0,1000,1280.0,2.0,6.857,Monthly,34.0,7584.9,1000.0,Part-Time Employment,0.0,0.0,0.0,0.0,4828.78,0.0,0.0,640.0,MoneySpot,,4948011,0.0,28-03-2023,False,Furniture or Appliances,2023-03-28,Orange,0.0,13896.0,7584.9
0062x00000DGWvOAAX,0012x00000SFPxtAAH,South Hedland,WA,Australia,Loan Paid,Existing Client-Granted Loan Before,0.0,92.06,2004.5535,2.0,0.0,0.0,3.0,2.0,7829.2446,3.0,34.0,0.0,2437.1528,2081.7,3.0,13.65,0.0,0.0,0.0,899.0,1000.0,1000,1360.0,7.0,13.286,Fortnightly,28.0,7743.17,1300.0,Full-time,3.0,0.0,0.4725,0.0,5686.69,213.0,1839.7,194.29,QuickCash,0.0,4727046,0.0,21-02-2023,False,Living Expenses,2023-02-21,Orange,0.0,10168.0,7743.17
0062x00000DAinAAAT,0012x00000d9KEWAA2,Doncaster,VIC,Australia,Loan Paid,Existing Client-No Loan Granted Ever,0.0,29.68,220.9253,1.0,0.0,0.0,4.0,1.0,8840.0949,0.0,0.0,0.0,1340.245,1762.08,0.0,0.97,0.0,1.0,1200.0,400.0,150.0,1000,1360.0,14.0,14.286,Weekly,31.0,8779.22,1000.0,Casual Employment,0.0,0.0,0.0,0.0,2250.2033,0.0,135.5833,97.14,MoneySpot,0.0,4642340,0.0,08-02-2023,False,Living Expenses,2023-02-08,Orange,0.0,7452.0,8779.22
0062x00000D9a6mAAB,0012x00000flsPzAAI,Hurstville,NSW,Australia,Closed Lost,Existing Client-No Loan Granted Ever,0.0,94.62,232.876,1.0,0.0,0.0,4.0,1.0,4674.9842,5.0,18.0,160.0,1064.15,1064.15,0.0,0.0,0.0,0.0,0.0,400.0,400.0,1000,1280.0,6.0,6.571,Weekly,28.0,9160.42,1000.0,Full-Time Employment,5.0,0.0,0.1429,1.0,2128.3,316.0,977.81,213.33,MoneySpot,,4589040,5.0,31-01-2023,False,Other Expenses,2023-01-31,Green,0.0,5758.0,9160.42
0062x00000EdCq4AAF,0012x00000hZI0cAAG,Cranbourne East,VIC,Australia,Loan Paid,Existing Client-Granted Loan Before,0.0,76.33,3233.0476,1.0,0.0,0.0,4.0,1.0,6149.8864,70.0,157.0,174.8524,1390.7684,1547.81,1.0,0.07,0.0,0.0,0.0,1500.0,1520.0,1000,1360.0,16.0,15.857,Weekly,43.0,6172.97,1000.0,Full-Time Employment,70.0,0.0,0.1099,30.0,6026.6633,588.0,3340.19,85.0,QuickCash,0.0,6405385,6.0,02-09-2023,False,Living Expenses,2023-09-02,Green,0.0,7147.0,6172.97
0062x00000DZI9MAAX,0012x00000AEEBbAAP,Churchill,QLD,Australia,Loan Paid,Existing Client-Granted Loan Before,16.01,74.97,2457.4534,1.0,0.0,2.0,1.0,1.0,6729.8451,4.0,79.0,1206.1463,1159.2338,983.25,0.0,0.22,0.0,0.0,2114.68,899.0,1600.0,700,896.0,6.0,6.0,Weekly,37.0,7009.85,2050.0,Full-Time Employment,4.0,0.0,0.7253,0.0,6616.2833,1593.0,2411.5866,149.33,MoneySpot,0.0,5085337,2.0,18-04-2023,False,Relocation Expenses,2023-04-18,Orange,1156.0,7220.0,7009.85
0062x00000DrGAcAAN,0012x00000LOgEAAA1,Kenwick,WA,Australia,Loan Paid,Existing Client-Granted Loan Before,0.0,91.23,10263.8674,2.0,0.0,0.0,3.0,2.0,6720.1149,0.0,65.0,512.0,2993.3685,3146.35,0.0,46.54,1.0,0.0,724.0,899.0,800.0,700,952.0,7.0,13.857,Fortnightly,57.0,7407.39,2050.0,Full-Time Employment,0.0,0.0,0.022,0.0,6984.5266,1773.0,10242.13,136.0,QuickCash,0.0,5154972,0.0,28-04-2023,False,Home Maintenance & Repairs,2023-04-28,Orange,0.0,8718.0,7407.39
0062x00000FuiwIAAR,0012x00000haCHEAA2,Claremont Meadows,NSW,Australia,Loan Paid,Existing Client-Granted Loan Before,0.0,60.27,3509.1983,2.0,1.0,0.0,4.0,2.0,10112.5431,24.0,44.0,1791.297,3969.345,3584.73,1.0,55.38,0.0,0.0,0.0,899.0,0.0,1000,1360.0,7.0,13.143,Fortnightly,39.0,10112.54,2050.0,Full-Time Employment,24.0,0.0,0.044,2.0,8106.9033,1985.0,4046.5133,194.29,QuickCash,0.0,8263682,9.0,2024-02-23,False,Medical Expenses,2024-02-23,Orange,0.0,9427.0,10112.54
0062x00000DFQnPAAX,0012x00000GbJdpAAF,Kambah,ACT,Australia,Loan Paid,Existing Client-Granted Loan Before,0.0,89.69,4229.1925,2.0,1.0,0.0,4.0,2.0,6733.5627,7.0,43.0,802.2771,2494.0366,2397.51,1.0,0.0,0.0,0.0,164883.33,400.0,500.0,1000,1320.0,7.0,12.714,Fortnightly,26.0,7328.4,2050.0,Full-Time Employment,7.0,0.0,0.3736,1.0,4988.0733,1633.0,3865.3233,188.57,MoneySpot,0.0,4667596,6.0,12-02-2023,False,Living Expenses,2023-02-12,Orange,0.0,7215.0,7328.4
0062x00000F1LnEAAV,0010K000023QqxWQAS,Oran Park,NSW,Australia,Loan Paid,Existing Client-Granted Loan Before,0.0,35.05,2615.8366,3.0,0.0,0.0,3.0,3.0,12764.6399,6.0,48.0,280.5525,9083.14,9083.14,0.0,0.0,0.0,0.0,6375.0,899.0,4223.0,750,1020.0,4.0,15.857,Monthly,37.0,12827.97,750.0,Full-Time Employment,6.0,0.0,0.0879,0.0,9083.14,1333.0,4948.2666,255.0,MoneySpot,0.0,6886465,0.0,19-10-2023,False,Living Expenses,2023-10-19,Orange,0.0,13258.0,12827.97
0062x00000DISAfAAP,0012x00000WW8EoAAL,Blacktown,NSW,Australia,Loan Paid,Existing Client-Granted Loan Before,0.0,79.18,1047.3389,1.0,0.0,0.0,2.0,1.0,6407.4584,0.0,32.0,1250.0642,883.9966,773.48,0.0,0.0,0.0,0.0,2383.33,599.0,500.0,600,768.0,8.0,7.714,Weekly,26.0,9744.48,600.0,Casual Employment,0.0,0.0,0.0,0.0,2703.4933,799.0,849.24,96.0,QuickCash,0.0,4834457,0.0,10-03-2023,False,Travel Expenses,2023-03-09,Green,0.0,5946.0,9744.48
0062x00000DY9wFAAT,0012x00000FFuSwAAL,ORANGE,NSW,Australia,Loan Paid,Existing Client-Granted Loan Before,0.0,57.01,1128.9193,1.0,2.0,0.0,4.0,1.0,7753.516,7.0,22.0,289.2963,1773.5375,1907.0,1.0,0.25,0.0,0.0,2151.32,599.0,1320.0,550,726.0,10.0,10.0,Weekly,60.0,10824.79,550.0,Full-Time Employment,14.0,0.0,0.1209,4.0,2364.7166,575.0,1342.5,72.6,MoneySpot,0.0,5016040,20.0,07-04-2023,False,Living Expenses,2023-04-07,Orange,0.0,4773.0,10824.79
0062x00000FW2tBAAT,0012x00000n3C88AAE,Werrington,NSW,Australia,Closed Lost,New Client-New Loan,0.0,72.16,542.75,1.0,0.0,0.0,2.0,1.0,5211.8519,8.0,13.0,0.0,716.0261,696.71,1.0,0.0,0.0,0.0,0.0,0.0,300.0,800,1120.0,20.0,20.143,Weekly,36.0,5495.19,5000.0,part_time,8.0,0.0,0.0549,0.0,3102.78,0.0,799.1166,56.0,MoneySpot,,7639968,2.0,26-12-2023,False,seasonal_religious_holiday,2023-12-26,Green,0.0,5465.0,5495.19
0062x00000DIWUyAAP,0012x00000g8ZA7AAM,REDCLIFFE,QLD,Australia,Closed Lost,Existing Client-Granted Loan Before,0.0,73.71,688.1841,1.0,0.0,0.0,1.0,1.0,2692.1688,1.0,26.0,346.9595,588.8833,480.5,0.0,19.29,0.0,1.0,3683.33,400.0,100.0,1000,1360.0,14.0,13.571,Weekly,35.0,4426.5,1000.0,Full-Time Employment,1.0,0.0,0.5714,1.0,0.0,561.0,939.4766,97.14,QuickCash,,4837525,1.0,12-03-2023,False,Furniture or Appliances,2023-03-10,Orange,0.0,3540.0,4426.5
0062x00000Ds13EAAR,0012x00000g8U4xAAE,Cable Beach,WA,Australia,Loan Paid,Existing Client-Granted Loan Before,48.57,88.2,1097.0189,1.0,0.0,4.0,5.0,4.0,9902.681,2.0,30.0,332.8935,4990.1433,1217.9,0.0,0.0,0.0,0.0,0.0,400.0,100.0,800,1088.0,14.0,14.571,Weekly,31.0,10130.16,2050.0,,2.0,0.0,0.2198,0.0,7584.9866,925.0,992.05,77.71,MoneySpot,0.0,5215979,2.0,07-05-2023,True,Vehicle Expenses,2023-05-07,Orange,4990.0,10273.0,10130.16
0062x00000DVYIKAA5,0012x00000OxUn8AAF,Mount Barker,SA,Australia,Loan Paid,Existing Client-Granted Loan Before,0.0,64.54,4323.9731,2.0,1.0,0.0,3.0,2.0,5060.811,3.0,33.0,0.3907,2191.355,2200.16,0.0,23.17,0.0,1.0,0.0,400.0,300.0,1000,1320.0,7.0,13.143,Fortnightly,27.0,7789.37,2050.0,,3.0,0.0,0.011,1.0,0.0,550.0,4864.5933,188.57,MoneySpot,0.0,5454486,3.0,01-06-2023,False,Medical Expenses,2023-05-31,Orange,0.0,9975.0,7789.37
0062x00000DAg2CAAT,0012x00000Ve9jOAAR,Wolli Creek,NSW,Australia,Loan Paid,Existing Client-No Loan Granted Ever,0.0,76.4,927.2799,2.0,0.0,0.0,4.0,2.0,5876.1355,1.0,21.0,96.0,1216.8866,701.33,1.0,0.1,0.0,0.0,4333.33,599.0,1800.0,700,896.0,3.0,6.286,Fortnightly,31.0,5804.29,1000.0,Contract Employment,1.0,0.0,0.011,0.0,4619.5666,169.0,990.7,298.67,QuickCash,0.0,4640611,1.0,08-02-2023,False,Travel Expenses,2023-02-08,Orange,0.0,8235.0,5804.29
0062x00000DWEofAAH,0010K00001jsnDUQAY,Northcote,VIC,Australia,Loan Paid,Existing Client-Granted Loan Before,0.0,95.42,2568.1958,4.0,0.0,0.0,1.0,4.0,3119.9899,24.0,42.0,2206.2403,291.2761,80.0,0.0,41.61,0.0,1.0,3971.5,599.0,880.0,1000,1320.0,5.0,9.429,Fortnightly,31.0,885.0,1000.0,Full-Time Employment,24.0,0.0,0.3187,8.0,885.0,1879.0,2771.0966,264.0,QuickCash,0.0,4904446,23.0,21-03-2023,False,Living Expenses,2023-03-21,Orange,0.0,3432.0,885.0
0062x00000ENdWZAA1,0012800001SDU7tAAH,Ballarat,VIC,Australia,Loan Paid,Existing Client-Granted Loan Before,0.0,67.97,4689.6646,2.0,0.0,0.0,3.0,2.0,11437.8186,1.0,11.0,0.0,3335.0,3335.0,0.0,9.61,0.0,0.0,0.0,899.0,400.0,750,990.0,5.0,9.714,Fortnightly,43.0,11456.15,750.0,,1.0,0.0,0.1868,1.0,6670.0,0.0,5292.51,198.0,MoneySpot,0.0,6190737,1.0,12-08-2023,False,Medical Expenses,2023-08-12,Green,0.0,18264.0,11456.15
0062x00000D8meoAAB,0012x00000TJISSAA5,Warragul,VIC,Australia,Loan Paid,Existing Client-Granted Loan Before,20.04,91.18,1798.8085,2.0,2.0,4.0,3.0,2.0,5565.4054,5.0,26.0,610.0,1531.7183,1738.89,0.0,0.0,0.0,0.0,4821.98,599.0,1200.0,850,1122.0,5.0,10.143,Fortnightly,38.0,5565.41,850.0,Full-Time Employment,5.0,0.0,0.033,2.0,4446.7366,598.0,2404.5466,224.4,QuickCash,0.0,4549610,4.0,25-01-2023,False,Medical Expenses,2023-01-25,Green,1383.0,6899.0,5565.41
0062x00000GGpgsAAD,0012x00000d9YBZAA2,Auburn,NSW,Australia,Loan Paid,Existing Client-Granted Loan Before,0.0,89.37,2812.2633,1.0,0.0,0.0,3.0,1.0,14454.3465,0.0,38.0,0.0,2778.94,3349.71,0.0,45.93,4.0,0.0,0.0,1499.0,100.0,1000,1320.0,10.0,10.571,Weekly,30.0,26835.53,1000.0,Full-Time Employment,0.0,0.0,0.0,0.0,12968.3866,1522.0,3103.4133,132.0,MoneySpot,0.0,8666302,0.0,2024-03-31,False,Living Expenses,2024-03-31,Orange,0.0,28631.0,26835.53
0062x00000D9NiJAAV,0012x00000SG4csAAD,Chirnside Park,VIC,Australia,Loan Paid,Existing Client-No Loan Granted Ever,0.46,49.67,2861.9861,2.0,0.0,0.0,1.0,2.0,4309.3451,1.0,24.0,451.9616,1983.48,1983.48,1.0,0.0,0.0,0.0,4097.17,599.0,980.0,1000,1440.0,12.0,25.143,Fortnightly,31.0,4998.36,1250.0,Full-Time Employment,1.0,0.0,0.011,1.0,3966.96,173.0,5329.9133,120.0,MoneySpot,0.0,4579770,0.0,30-01-2023,False,Medical Expenses,2023-01-30,Orange,27.0,5757.0,4998.36
0062x00000Eb9gqAAB,0012x00000GefNVAAZ,Merrylands,NSW,Australia,Loan Paid,Existing Client-Granted Loan Before,0.0,98.98,437.5,2.0,0.0,0.0,2.0,2.0,9995.868,2.0,20.0,0.0,2653.1128,2385.44,0.0,15.05,0.0,0.0,4333.33,400.0,200.0,1000,1320.0,6.0,11.429,Fortnightly,36.0,10571.87,1000.0,Full-Time Employment,2.0,0.0,0.8901,0.0,6190.5966,862.0,1299.8133,220.0,QuickCash,0.0,6272347,1.0,20-08-2023,False,Vehicle Expenses,2023-08-20,Green,0.0,11368.0,10571.87
0062x00000EzhimAAB,0012x00000IMxVOAA1,Smithfield,NSW,Australia,Loan Paid,Existing Client-Granted Loan Before,0.0,84.43,5006.6815,2.0,0.0,0.0,4.0,2.0,12918.4566,1.0,82.0,375.081,2445.46,3006.72,0.0,0.2,0.0,0.0,4539.17,899.0,2200.0,750,1050.0,10.0,20.0,Fortnightly,52.0,13642.08,750.0,Full-Time Employment,1.0,0.0,0.0549,0.0,9964.0733,1884.0,5486.1366,105.0,MoneySpot,0.0,6826776,0.0,14-10-2023,False,Medical Expenses,2023-10-13,Orange,0.0,26723.0,13642.08
0062x00000D6rm2AAB,0012x00000VdrW2AAJ,Camillo,WA,Australia,Loan Paid,Existing Client-Granted Loan Before,0.0,84.54,1944.4747,4.0,0.0,0.0,5.0,4.0,5146.5898,6.0,20.0,278.8194,1115.51,260.62,0.0,0.0,0.0,0.0,1400.0,400.0,150.0,600,816.0,7.0,13.286,Fortnightly,30.0,6473.59,2500.0,Full-Time Employment,6.0,0.0,0.0879,4.0,2602.8566,391.0,2447.84,116.57,QuickCash,0.0,4456868,2.0,11-01-2023,False,Home Maintenance & Repairs,2023-01-11,Orange,0.0,8906.0,6473.59
0062x00000DrEReAAN,0012x00000LQ1CkAAL,BUDERIM,QLD,Australia,Loan Paid,Existing Client-Granted Loan Before,0.34,53.6,2682.6255,1.0,0.0,0.0,2.0,1.0,3209.1786,15.0,78.0,0.0,738.5507,745.15,1.0,0.45,0.0,0.0,2917.52,899.0,600.0,700,952.0,14.0,13.714,Weekly,24.0,3446.57,700.0,Part-Time Employment,15.0,0.0,0.044,6.0,3446.57,0.0,3269.4366,68.0,QuickCash,0.0,5153744,12.0,28-04-2023,False,Vehicle - Registration,2023-04-28,Orange,13.0,3794.0,3446.57
0062x00000DGk2wAAD,0010K00001eXVo6QAG,Thomastown,VIC,Australia,Closed Lost,Existing Client-Granted Loan Before,0.0,64.47,2054.8373,2.0,0.0,0.0,3.0,2.0,10200.1284,0.0,27.0,737.5173,3443.1766,3185.71,1.0,0.0,0.0,0.0,4714.67,1499.0,100.0,1000,1320.0,6.0,12.0,Fortnightly,48.0,10080.73,5000.0,Full-Time Employment,0.0,0.0,0.0,0.0,6886.3533,1760.0,2144.7533,220.0,MoneySpot,,4739064,0.0,27-02-2023,False,Medical Expenses,2023-02-23,Orange,0.0,11942.0,10080.73
0062x00000DtEdZAAV,0012x00000dbqn5AAA,Williams Landing,VIC,Australia,Loan Paid,Existing Client-Granted Loan Before,0.0,58.33,211.046,2.0,0.0,0.0,3.0,2.0,4137.8181,0.0,6.0,97.14,1904.53,1949.33,0.0,0.0,0.0,0.0,4000.0,400.0,850.0,750,1020.0,8.0,15.143,Fortnightly,29.0,3809.06,750.0,Full-Time Employment,0.0,0.0,0.0879,0.0,3809.06,194.0,194.28,127.5,MoneySpot,0.0,5298285,0.0,17-05-2023,False,Vehicle Expenses,2023-05-17,Green,0.0,4272.0,3809.06
0062x00000DIJKvAAP,0010K00001stFYbQAM,Woree,QLD,Australia,Loan Paid,Existing Client-Granted Loan Before,0.0,97.84,4737.4213,2.0,0.0,0.0,3.0,2.0,6116.3139,7.0,58.0,1297.4941,2800.6057,5098.8,1.0,0.34,0.0,1.0,2166.67,400.0,660.0,700,924.0,5.0,10.0,Fortnightly,38.0,6116.31,700.0,Unemployed,7.0,0.0,0.8132,2.0,0.0,2049.0,5674.6233,184.8,QuickCash,0.0,4826730,7.0,09-03-2023,False,Furniture or Appliances,2023-03-09,Orange,0.0,7329.0,6116.31
0062x00000DJ2gYAAT,0012x00000cKqAXAA0,Wellesley Islands,QLD,Australia,Closed Lost,Existing Client-Granted Loan Before,0.0,72.13,2207.9609,1.0,1.0,0.0,2.0,1.0,3382.056,7.0,43.0,1931.9498,713.6078,555.27,0.0,3.73,0.0,0.0,3180.67,1499.0,120.0,1000,1320.0,11.0,11.0,Weekly,28.0,4475.84,1000.0,Full-Time Employment,7.0,0.0,0.1209,4.0,3330.17,1235.0,1852.1866,120.0,Financier-2,,4868088,7.0,20-03-2023,False,Living Expenses,2023-03-15,Orange,0.0,5304.0,4475.84
0062x00000DYofFAAT,0012x00000goh0WAAQ,Harrington,NSW,Australia,Loan Paid,Existing Client-Granted Loan Before,7.64,29.47,884.7133,2.0,0.0,4.0,3.0,2.0,5278.0568,0.0,12.0,0.0,977.22,929.41,0.0,2.42,0.0,0.0,780.0,599.0,0.0,550,704.0,3.0,5.0,Fortnightly,65.0,5278.05,2050.0,Part-Time Employment,0.0,0.0,0.1099,0.0,4505.78,213.0,1275.5466,234.67,MoneySpot,0.0,5054596,0.0,13-04-2023,False,Vehicle Expenses,2023-04-13,Green,402.0,5258.0,5278.05
0062x00000Ez70LAAR,0010K00001vgN0fQAE,Willow Vale,QLD,Australia,Loan Paid,Existing Client-Granted Loan Before,36.78,91.71,484.4526,1.0,0.0,4.0,4.0,1.0,12073.1348,2.0,53.0,0.0,862.6153,588.0,0.0,0.07,0.0,0.0,2600.0,899.0,1980.0,800,1088.0,13.0,13.571,Weekly,33.0,12103.13,2050.0,Full-Time Employment,2.0,0.0,0.0,0.0,8163.01,269.0,507.0466,83.69,MoneySpot,0.0,6784469,0.0,11-10-2023,False,Furniture or Appliances,2023-10-11,Orange,4425.0,12028.0,12103.13
0062x00000ECyrxAAD,0010K00001y54AYQAY,Alexandra Hills,QLD,Australia,Loan Paid,Existing Client-No Loan Granted Ever,0.0,66.16,3212.3745,1.0,0.0,0.0,4.0,1.0,12769.3526,0.0,25.0,539.032,1978.8181,1713.69,0.0,2.65,0.0,0.0,3033.33,899.0,440.0,800,1248.0,35.0,35.0,Weekly,32.0,14342.02,3500.0,Full-Time Employment,0.0,0.0,0.0,0.0,8687.0566,148.0,3439.2666,35.66,MoneySpot,0.0,5911128,0.0,14-07-2023,False,Medical / Dental,2023-07-14,Green,0.0,15595.0,14342.02
0062x00000DsUSSAA3,0012x00000NwdONAAZ,Blacktown,NSW,Australia,Loan Paid,Existing Client-Granted Loan Before,0.0,48.03,3910.7306,2.0,1.0,0.0,2.0,2.0,4368.4507,23.0,53.0,293.0831,2010.6842,2002.0,1.0,0.0,0.0,0.0,0.0,400.0,680.0,1000,1320.0,5.0,9.857,Fortnightly,37.0,4691.6,2050.0,Full-Time Employment,23.0,0.0,0.3077,7.0,4691.5966,315.0,3962.43,264.0,QuickCash,0.0,5244016,16.0,11-05-2023,False,Vehicle Expenses,2023-05-11,Green,0.0,4737.0,4691.6
0062x00000DWcyoAAD,0012x00000czQ6KAAU,Ocean Grove,VIC,Australia,Loan Paid,Existing Client-Granted Loan Before,6.49,49.93,2969.2197,2.0,0.0,4.0,2.0,2.0,7053.1444,2.0,86.0,1016.5276,2919.098,2884.36,0.0,21.44,0.0,0.0,6859.75,599.0,1880.0,900,1152.0,3.0,4.714,Fortnightly,52.0,7351.48,900.0,Full-Time Employment,2.0,0.0,0.0769,1.0,5354.33,961.0,4495.9333,384.0,MoneySpot,0.0,4926425,2.0,24-03-2023,False,Medical Expenses,2023-03-24,Green,597.0,9187.0,7351.48
0062x00000DYze6AAD,0012x00000THAsTAAX,Avondale Heights,VIC,Australia,Loan Paid,Existing Client-Granted Loan Before,0.0,66.6,5498.386,1.0,0.0,0.0,3.0,1.0,8171.9079,0.0,113.0,540.8893,1337.8692,2421.25,1.0,11.35,1.0,0.0,1064.15,1500.0,100.0,950,1406.0,30.0,29.857,Weekly,26.0,9156.46,2050.0,Full-Time Employment,0.0,0.0,0.2967,0.0,5797.4333,1981.0,5921.2766,46.87,QuickCash,0.0,5063935,0.0,14-04-2023,False,Relocation Expenses,2023-04-14,Green,0.0,11985.0,9156.46
0062x00000EC4bpAAD,0012x00000bn53RAAQ,Wandina,WA,Australia,Loan Paid,Existing Client-Granted Loan Before,0.0,35.65,1865.8364,2.0,0.0,0.0,1.0,2.0,6736.2575,3.0,28.0,114.7143,2879.0583,2690.99,0.0,0.0,0.0,0.0,2300.0,1499.0,1600.0,800,1088.0,8.0,15.571,Fortnightly,46.0,6846.26,2050.0,Full-Time Employment,4.0,0.0,0.0879,1.0,5758.1166,563.0,2007.4933,136.0,MoneySpot,0.0,5853279,0.0,07-07-2023,False,Travel Expenses,2023-07-06,Green,0.0,6060.0,6846.26
0062x00000Eyzk0AAB,0012x00000kZXnXAAW,Lamington,WA,Australia,Loan Paid,Existing Client-Granted Loan Before,0.58,66.2,1590.7966,2.0,1.0,4.0,2.0,2.0,10949.8778,1.0,49.0,0.0,2433.6733,2933.67,0.0,12.75,0.0,0.0,0.0,899.0,0.0,1000,1400.0,10.0,20.429,Fortnightly,40.0,11045.11,1000.0,,1.0,0.0,0.4286,0.0,4921.38,1093.0,12813.46,140.0,MoneySpot,0.0,6777341,1.0,08-10-2023,False,Living Expenses,2023-10-08,Orange,177.0,30243.0,11045.11
0062x00000D1iajAAB,0012x00000bnZ8XAAU,Pimpama,QLD,Australia,Loan Paid,Existing Client-No Loan Granted Ever,0.0,21.36,1412.0,2.0,0.0,0.0,1.0,2.0,10232.0896,2.0,48.0,0.0,2135.9633,2373.67,0.0,4.31,0.0,0.0,2816.67,899.0,560.0,800,1024.0,6.0,6.286,Weekly,30.0,9558.42,1500.0,Full-Time Employment,2.0,0.0,0.022,2.0,8685.78,0.0,2740.8566,170.67,MoneySpot,0.0,4406770,1.0,04-01-2023,False,Life Event Expenses,2023-01-03,Orange,0.0,9582.0,9558.42
0062x00000ENKo8AAH,0012x00000RquvIAAR,MAWSON LAKES,SA,Australia,Loan Paid,Existing Client-Granted Loan Before,0.0,82.87,1429.8124,1.0,0.0,0.0,3.0,1.0,5316.0338,0.0,39.0,0.0,857.3863,859.41,0.0,37.34,0.0,0.0,1733.33,400.0,0.0,1000,1400.0,18.0,18.0,Weekly,20.0,6648.32,2050.0,Full-Time Employment,0.0,0.0,0.0,0.0,3143.75,758.0,1779.2,77.78,MoneySpot,0.0,6165798,0.0,10-08-2023,False,Living Expenses,2023-08-10,Orange,0.0,8913.0,6648.32
0062x00000ECDqzAAH,0012x00000iHW5uAAG,Kambah,ACT,Australia,Loan Paid,Existing Client-Granted Loan Before,29.66,21.97,278.0935,2.0,0.0,2.0,2.0,2.0,3059.7691,0.0,15.0,0.0,859.284,802.0,0.0,2.65,0.0,0.0,0.0,599.0,10.0,550,836.0,17.0,33.571,Fortnightly,49.0,3059.77,2050.0,,0.0,0.0,0.0,0.0,1432.14,128.0,168.0,49.18,MoneySpot,0.0,5863147,0.0,08-07-2023,True,Medical Expenses,2023-07-08,Green,1432.0,4827.0,3059.77
0062x00000DGcB5AAL,0012x00000g9yNFAAY,DOREEN,VIC,Australia,Closed Lost,Existing Client-No Loan Granted Ever,0.0,85.34,1053.3333,1.0,0.0,0.0,4.0,1.0,2320.6811,0.0,3.0,0.0,220.75,64.0,0.0,0.0,0.0,1.0,1400.0,0.0,560.0,700,896.0,3.0,5.857,Fortnightly,24.0,2537.18,700.0,Full-Time Employment,1.0,0.0,0.0,0.0,213.8,0.0,1650.8066,298.67,QuickCash,,4731775,2.0,26-02-2023,False,Other,2023-02-21,Orange,0.0,6999.0,2537.18
0062x00000Ew8XhAAJ,0012x00000TFJ8KAAX,Wendouree,VIC,Australia,Loan Paid,Existing Client-Granted Loan Before,0.0,98.05,2323.6542,2.0,4.0,0.0,3.0,2.0,3820.6222,8.0,52.0,0.0,1758.534,1746.06,0.0,0.0,0.0,0.0,2275.0,899.0,0.0,750,1020.0,8.0,16.429,Fortnightly,28.0,3820.62,750.0,Full-Time Employment,8.0,0.0,0.0769,4.0,2930.89,348.0,3683.0333,127.5,QuickCash,0.0,6564300,8.0,19-09-2023,False,Medical Expenses,2023-09-19,Orange,0.0,4062.0,3820.62
0062x00000DtOowAAF,0012x00000OyNNnAAN,PERTH,WA,Australia,Closed Lost,Existing Client-No Loan Granted Ever,0.0,39.15,0.0,1.0,0.0,0.0,2.0,1.0,3733.9156,0.0,0.0,0.0,970.6428,871.0,0.0,0.0,0.0,0.0,3354.47,899.0,800.0,1000,1280.0,6.0,6.571,Weekly,30.0,4751.88,1000.0,Full-Time Employment,0.0,0.0,0.0,0.0,2264.8333,0.0,0.0,213.33,QuickCash,,5311547,0.0,18-05-2023,False,Event - Funeral - Air fares,2023-05-18,Orange,0.0,3415.0,4751.88
0062x00000E606fAAB,0012x00000govvKAAQ,Marong,VIC,Australia,Loan Paid,Existing Client-Granted Loan Before,1.3,54.47,2772.9613,2.0,0.0,4.0,3.0,2.0,8208.2836,3.0,46.0,306.7738,3592.4471,3342.1,3.0,0.0,0.0,0.0,0.0,599.0,500.0,1000,1360.0,7.0,13.857,Fortnightly,39.0,8221.62,2050.0,,3.0,0.0,0.0549,1.0,8472.31,1202.0,3792.7933,194.29,MoneySpot,0.0,5698808,0.0,23-06-2023,False,Child Expenses,2023-06-23,Orange,116.0,8912.0,8221.62
0062x00000DWWxzAAH,0010K000026MIBrQAO,PINJARRA,WA,Australia,Loan Paid,Existing Client-Granted Loan Before,0.0,93.44,5194.8134,2.0,0.0,0.0,2.0,2.0,6269.8171,2.0,37.0,863.016,3043.4728,3466.36,0.0,17.92,0.0,0.0,6200.0,599.0,1600.0,1000,1320.0,5.0,9.857,Fortnightly,48.0,6469.82,1000.0,Full-Time Employment,3.0,0.0,0.022,0.0,7101.4366,1313.0,4873.7566,264.0,QuickCash,0.0,4920657,3.0,23-03-2023,False,Vehicle Expenses,2023-03-23,Orange,0.0,11049.0,6469.82
0062x00000Ds10mAAB,0012x00000TtJhCAAV,Thangool,QLD,Australia,Closed Lost,Existing Client-Granted Loan Before,0.0,87.06,325.8902,1.0,0.0,0.0,3.0,1.0,524.91,0.0,6.0,0.0,131.2275,150.0,0.0,0.0,0.0,1.0,2383.33,400.0,150.0,600,792.0,7.0,12.571,Fortnightly,31.0,3157.98,600.0,Unemployed,0.0,0.0,0.033,0.0,2019.89,485.0,792.1566,113.14,Financier-2,,5214241,0.0,07-05-2023,False,Vehicle Expenses,2023-05-06,Orange,0.0,677.0,3157.98
0062x00000DGCKaAAP,0012x00000g8wohAAA,Moree,NSW,Australia,Loan Paid,Existing Client-No Loan Granted Ever,9.76,68.41,660.2099,0.0,2.0,0.0,0.0,0.0,1833.3333,8.0,27.0,640.3705,0.0,0.0,0.0,2.28,1.0,0.0,0.0,1499.0,600.0,800,1088.0,14.0,14.571,Weekly,40.0,7484.36,1200.0,,8.0,0.0,0.0989,2.0,0.0,69.0,1461.09,77.71,MoneySpot,0.0,4708550,8.0,18-02-2023,False,Living Expenses,2023-02-18,Orange,843.0,8629.0,7484.36
0062x00000D6rR1AAJ,0010K00001hTQTIQA4,Keilor Downs,VIC,Australia,Closed Lost,Existing Client-Granted Loan Before,0.0,64.9,2387.9096,2.0,0.0,0.0,3.0,2.0,5721.5848,0.0,18.0,910.8504,2633.4966,2803.83,2.0,2.15,0.0,0.0,3986.67,599.0,600.0,1000,1320.0,5.0,9.143,Fortnightly,47.0,5721.58,2050.0,Full-Time Employment,0.0,0.0,0.0,0.0,5266.9933,1876.0,2695.4266,264.0,MoneySpot,,4456759,0.0,12-01-2023,False,Other Expenses,2023-01-11,Green,0.0,7760.0,5721.58
0062x00000FVwK6AAL,0012x00000IPOfBAAX,South Guildford,WA,Australia,Loan Paid,Existing Client-Granted Loan Before,0.93,41.04,3492.1562,1.0,0.0,0.0,1.0,1.0,12197.1224,3.0,25.0,350.5304,2791.6666,5000.0,0.0,5.43,0.0,1.0,10400.0,1500.0,900.0,1000,1360.0,14.0,14.143,Weekly,53.0,14566.67,1000.0,Full-Time Employment,3.0,0.0,0.0,0.0,0.0,1457.0,4549.2433,97.14,QuickCash,3.5,7633679,2.0,25-12-2023,False,Other Expenses,2023-12-25,Orange,140.0,14910.0,14566.67
0062x00000D94UXAAZ,0012x00000KLlo0AAD,North Warrandyte,VIC,Australia,Loan Paid,Existing Client-Granted Loan Before,0.58,61.61,3729.9106,1.0,0.0,3.0,3.0,1.0,8874.876,5.0,34.0,0.0,2024.7938,2107.28,0.0,0.28,0.0,0.0,6736.17,1499.0,2400.0,1000,1320.0,10.0,9.857,Weekly,64.0,8874.88,2050.0,Full-Time Employment,5.0,0.0,0.0879,3.0,8850.7733,501.0,3169.3066,132.0,MoneySpot,0.0,4563248,4.0,27-01-2023,False,Medical Expenses,2023-01-27,Green,77.0,13145.0,8874.88
0062x00000GFlOCAA1,0012x00000Nx9eOAAR,Cowandilla,SA,Australia,Loan Paid,Existing Client-Granted Loan Before,0.0,28.44,0.0,3.0,0.0,0.0,4.0,3.0,5507.7833,0.0,6.0,0.0,5399.1533,5992.67,0.0,0.47,1.0,0.0,112666.67,599.0,110.0,1000,1360.0,4.0,16.286,Monthly,22.0,5732.17,1000.0,Contract Employment,0.0,0.0,0.0,0.0,5499.1533,320.0,710.25,340.0,QuickCash,0.0,8582193,0.0,2024-03-24,False,Travel Expenses,2024-03-23,Green,0.0,5755.0,5732.17
0062x00000DrstiAAB,0010K00002720UwQAI,Rangeway,WA,Australia,Loan Paid,Existing Client-Granted Loan Before,0.0,61.72,0.0,4.0,0.0,0.0,4.0,4.0,3025.7366,0.0,7.0,168.9863,216.4502,307.01,0.0,0.0,0.0,1.0,1789.67,1499.0,0.0,650,884.0,14.0,14.0,Weekly,25.0,3312.4,650.0,Part-Time Employment,0.0,0.0,0.7143,0.0,0.0,91.0,90.7433,63.14,MoneySpot,0.0,5201251,0.0,05-05-2023,False,Vehicle Expenses,2023-05-05,Orange,0.0,3496.0,3312.4
0062x00000DHLrLAAX,0012800001VpBCgAAN,Dandenong,VIC,Australia,Loan Paid,Existing Client-Granted Loan Before,0.0,81.07,128.3333,0.0,0.0,0.0,0.0,0.0,0.0,0.0,95.0,2010.3052,0.0,0.0,0.0,0.0,1.0,0.0,2990.0,400.0,250.0,1000,1360.0,13.0,13.286,Weekly,67.0,4516.26,3000.0,Full-Time Employment,0.0,0.0,0.0,0.0,0.0,2494.0,3772.1966,104.62,MoneySpot,0.0,4774398,0.0,01-03-2023,False,Vehicle Expenses,2023-02-28,Orange,0.0,5230.0,4516.26
0062x00000D1aCLAAZ,0012x00000GbD6mAAF,North Lakes,QLD,Australia,Loan Paid,Existing Client-Granted Loan Before,40.47,81.09,540.7566,2.0,0.0,4.0,3.0,2.0,6076.6182,0.0,21.0,106.67,890.605,1315.79,0.0,0.0,0.0,0.0,0.0,599.0,650.0,850,1156.0,7.0,14.286,Fortnightly,40.0,9747.48,850.0,,0.0,0.0,0.2527,0.0,4466.1333,178.0,177.7833,165.14,MoneySpot,0.0,4398449,0.0,03-01-2023,False,Travel Expenses,2023-01-02,Green,3279.0,8101.0,9747.48
0062x00000DG5RTAA1,0012x00000cwnSSAAY,Hampton Park,VIC,Australia,Loan Paid,Existing Client-Granted Loan Before,0.85,73.57,1852.7015,1.0,0.0,0.0,3.0,1.0,3605.2071,0.0,12.0,326.3335,815.6153,474.14,0.0,0.64,0.0,0.0,4311.67,899.0,100.0,1000,1360.0,14.0,13.857,Weekly,30.0,4510.8,1000.0,Casual Employment,0.0,0.0,0.0879,0.0,3534.3333,350.0,2024.6833,97.14,MoneySpot,0.0,4702292,0.0,17-02-2023,False,Relocation Expenses,2023-02-17,Green,49.0,5762.0,4510.8
0062x00000DV2TiAAL,0012x00000gnov6AAA,Craigieburn,VIC,Australia,Loan Paid,Existing Client-Granted Loan Before,0.0,56.91,1745.8804,2.0,0.0,0.0,3.0,2.0,4572.2427,0.0,37.0,931.3852,1589.6733,1594.93,1.0,0.0,0.0,0.0,0.0,400.0,400.0,1000,1280.0,3.0,4.714,Fortnightly,25.0,4572.24,2050.0,,0.0,0.0,0.7363,0.0,3969.6066,1425.0,3524.6466,426.67,MoneySpot,0.0,5411936,0.0,27-05-2023,False,Living Expenses,2023-05-26,Orange,0.0,4413.0,4572.24
0062x00000D1vfVAAR,0012x00000WtQw5AAF,Burwood,NSW,Australia,Loan Paid,Existing Client-Granted Loan Before,0.0,85.91,768.0086,2.0,0.0,0.0,4.0,2.0,10474.1578,0.0,17.0,160.0,3865.914,3383.96,1.0,0.0,0.0,0.0,6807.88,400.0,630.0,850,1156.0,7.0,14.143,Fortnightly,27.0,10474.16,850.0,Full-Time Employment,0.0,0.0,0.0989,0.0,6443.19,551.0,1176.05,165.14,QuickCash,0.0,4418326,0.0,05-01-2023,False,Medical Expenses,2023-01-05,Orange,0.0,16094.0,10474.16
0062x00000DYDzIAAX,0010K000021Dp61QAC,Cannon Valley,QLD,Australia,Loan Paid,Existing Client-Granted Loan Before,0.0,65.93,7110.7623,1.0,1.0,0.0,3.0,1.0,12319.0205,3.0,63.0,741.3048,2351.775,2362.18,5.0,19.89,0.0,0.0,7583.33,599.0,1000.0,1000,1280.0,7.0,6.857,Weekly,45.0,12319.02,2050.0,Full-Time Employment,3.0,0.0,0.0,2.0,9407.1,1389.0,6803.4833,182.86,MoneySpot,0.0,5018423,3.0,07-04-2023,False,Home Maintenance & Repairs,2023-04-07,Orange,0.0,13668.0,12319.02
0062x00000DtQFyAAN,0012x00000ha6rrAAA,Wynnum West,QLD,Australia,Loan Paid,New Client-New Loan,45.25,33.76,2037.5495,4.0,1.0,4.0,3.0,4.0,7542.8647,1.0,25.0,267.5798,1078.0537,1342.35,0.0,9.2,0.0,0.0,0.0,0.0,380.0,600,792.0,5.0,10.0,Fortnightly,35.0,7861.37,600.0,,1.0,0.0,0.0,1.0,7064.2766,246.0,2203.6833,158.4,QuickCash,0.0,5312697,1.0,18-05-2023,False,Event - Funeral - Air fares,2023-05-18,Orange,4189.0,9257.0,7861.37
0062x00000DHkxoAAD,0012x00000RpugIAAR,CRANEBROOK,NSW,Australia,Loan Paid,Existing Client-Granted Loan Before,0.0,61.16,1847.6913,1.0,0.0,0.0,2.0,1.0,6604.6216,0.0,20.0,0.0,1230.5416,1371.0,0.0,24.96,0.0,0.0,3794.5,400.0,100.0,1000,1360.0,14.0,13.571,Weekly,24.0,6604.62,1000.0,Full-Time Employment,0.0,0.0,0.0659,0.0,4922.1666,243.0,1303.3833,97.14,QuickCash,3.5,4796477,0.0,04-03-2023,False,Living Expenses,2023-03-03,Green,0.0,7232.0,6604.62
0062x00000DXhXTAA1,0012x00000hXD71AAG,Brooklyn Park,SA,Australia,Loan Paid,New Client-New Loan,0.0,40.83,152.4033,1.0,0.0,0.0,2.0,1.0,3626.7254,0.0,16.0,0.0,768.0272,829.51,0.0,0.0,0.0,0.0,975.0,599.0,355.0,800,1024.0,6.0,6.286,Weekly,54.0,3626.73,4000.0,Unemployed,0.0,0.0,0.0,0.0,2816.1,0.0,152.4033,170.67,MoneySpot,0.0,4989942,0.0,06-04-2023,False,Relocation Expenses,2023-04-06,Orange,0.0,3714.0,3626.73
0062x00000DIEKWAA5,0012x00000IMMmXAAX,TEMPLESTOWE,VIC,Australia,Loan Paid,Existing Client-Granted Loan Before,0.0,66.41,2876.4178,4.0,1.0,0.0,3.0,4.0,5507.9133,1.0,20.0,65.1786,2360.5342,2760.5,0.0,39.0,1.0,0.0,0.0,599.0,0.0,1000,1320.0,7.0,13.143,Fortnightly,52.0,7010.91,1000.0,Full-Time Employment,3.0,0.0,0.0,1.0,5507.9133,470.0,1800.4,188.57,MoneySpot,0.0,4822396,3.0,08-03-2023,False,Relocation Expenses,2023-03-08,Orange,0.0,8279.0,7010.91
0062x00000ENGwiAAH,0012x00000hXxXoAAK,Howlong,NSW,Australia,Loan Paid,Existing Client-Granted Loan Before,0.0,82.84,3708.8585,1.0,0.0,0.0,3.0,1.0,5924.6189,0.0,53.0,914.3494,1101.4584,911.27,1.0,10.32,0.0,0.0,4333.33,599.0,600.0,1000,1360.0,14.0,14.0,Weekly,28.0,8052.21,2050.0,Full-Time Employment,3.0,0.0,0.0,1.0,4772.9866,1491.0,4108.54,97.14,MoneySpot,0.0,6162879,2.0,10-08-2023,False,Home Maintenance & Repairs,2023-08-10,Orange,0.0,9359.0,8052.21
0062x00000DGqSRAA1,0012x00000goMkQAAU,Bellbird Park,QLD,Australia,Closed Lost,New Client-New Loan,0.0,73.07,1692.5868,1.0,0.0,0.0,2.0,1.0,4623.9842,5.0,74.0,1112.8216,1064.15,1064.15,1.0,0.0,0.0,0.0,0.0,0.0,920.0,1000,1280.0,6.0,5.714,Weekly,34.0,4797.32,4000.0,,5.0,0.0,0.6264,4.0,4611.3166,1093.0,1756.2166,213.33,MoneySpot,,4746057,1.0,24-02-2023,False,Bond and house moving,2023-02-23,Orange,0.0,5479.0,4797.32
0062x00000D7xvGAAR,0010K00001eJOouQAG,TINGALPA,QLD,Australia,Loan Paid,Existing Client-Granted Loan Before,0.0,93.99,424.3511,1.0,2.0,0.0,3.0,1.0,4445.0067,20.0,75.0,0.0,945.4,1057.54,5.0,0.0,0.0,0.0,2816.67,1499.0,1020.0,700,952.0,14.0,14.0,Weekly,26.0,5726.37,700.0,Full-Time Employment,20.0,0.0,0.3516,4.0,3466.4666,254.0,913.1533,68.0,MoneySpot,0.0,4508290,14.0,19-01-2023,False,Living Expenses,2023-01-19,Orange,0.0,4827.0,5726.37
0062x00000DAoedAAD,0012x00000LRMLHAA5,Kingsley,WA,Australia,Loan Paid,Existing Client-Granted Loan Before,0.0,92.42,1386.7866,2.0,1.0,0.0,3.0,2.0,1670.715,18.0,0.0,0.0,644.8083,494.48,0.0,0.0,0.0,0.0,2386.78,599.0,100.0,1000,1360.0,7.0,13.0,Fortnightly,38.0,1926.99,2050.0,Part-Time Employment,18.0,0.0,0.7363,8.0,1289.6166,0.0,1503.8333,194.29,MoneySpot,0.0,4646871,3.0,09-02-2023,False,Vehicle Expenses,2023-02-09,Orange,0.0,2156.0,1926.99
0062x00000EOUkZAAX,0012x00000deYK1AAM,Walkervale,QLD,Australia,Loan Paid,Existing Client-Granted Loan Before,0.0,82.17,1274.9419,0.0,0.0,0.0,0.0,0.0,0.0,0.0,49.0,832.9604,0.0,0.0,1.0,0.0,0.0,0.0,0.0,400.0,400.0,1000,1400.0,20.0,19.857,Weekly,29.0,3863.25,2200.0,,0.0,0.0,0.011,0.0,3852.6666,1092.0,1540.0033,70.0,MoneySpot,0.0,6265517,0.0,19-08-2023,False,Vehicle Expenses,2023-08-19,Orange,0.0,1003.0,3863.25
0062x00000E5IJbAAN,0012x00000iJB2HAAW,Hallam,VIC,Australia,Closed Lost,New Client-New Loan,0.0,70.78,81.6666,3.0,0.0,0.0,3.0,3.0,6701.9901,2.0,31.0,0.0,4143.01,4143.01,0.0,0.1,0.0,0.0,4142.0,400.0,1.0,800,1056.0,3.0,12.857,Monthly,24.0,6621.99,3400.0,Full-Time Employment,2.0,0.0,0.022,1.0,4143.01,0.0,81.6666,352.0,MoneySpot,,5640176,0.0,21-06-2023,False,Living Expenses,2023-06-17,Orange,0.0,6862.0,6621.99
0062x00000F8j0VAAR,0012x00000iHFNTAA4,Saint Helens Park,NSW,Australia,Loan Paid,Existing Client-Granted Loan Before,0.0,37.88,801.9866,2.0,0.0,0.0,4.0,2.0,3959.8272,5.0,18.0,0.0,1822.6057,1716.71,0.0,0.07,0.0,0.0,0.0,599.0,600.0,1000,1440.0,12.0,23.429,Fortnightly,40.0,3959.83,5000.0,Full-Time Employment,5.0,0.0,0.0,1.0,4252.7466,802.0,801.9866,120.0,MoneySpot,0.0,6873434,0.0,18-10-2023,False,Travel Expenses,2023-10-18,Orange,0.0,4429.0,3959.83
0062x00000DAtjDAAT,0010K00002BTXCIQA5,Redan,VIC,Australia,Loan Paid,Existing Client-Granted Loan Before,41.67,59.27,3656.4357,1.0,1.0,4.0,1.0,4.0,800.2094,9.0,82.0,728.8685,114.04,65.58,2.0,0.0,0.0,0.0,4766.67,1499.0,460.0,1000,1360.0,14.0,14.0,Weekly,45.0,6663.77,2050.0,Full-Time Employment,9.0,0.0,0.8681,0.0,582.7533,665.0,3266.91,97.14,MoneySpot,0.0,4650043,9.0,10-02-2023,True,Furniture or Appliances,2023-02-09,Orange,2930.0,7030.0,6663.77
0062x00000DHVBCAA5,0012x00000TtUPmAAN,Melbourne,VIC,Australia,Loan Paid,Existing Client-No Loan Granted Ever,9.14,28.03,798.581,2.0,0.0,4.0,3.0,2.0,5155.0832,1.0,13.0,0.0,1269.895,864.07,0.0,0.84,0.0,0.0,2865.87,599.0,1304.0,800,1024.0,3.0,6.0,Fortnightly,25.0,5156.42,1000.0,Full-Time Employment,1.0,0.0,0.011,0.0,3027.8166,0.0,859.2633,341.33,MoneySpot,0.0,4782084,1.0,04-03-2023,False,Relocation Expenses,2023-03-04,Orange,520.0,5686.0,5156.42
0062x00000DZ33NAAT,0012x00000hXxEvAAK,Sydney,NSW,Australia,Loan Paid,New Client-New Loan,0.0,64.46,0.0,1.0,0.0,0.0,3.0,1.0,5433.0491,1.0,3.0,0.0,1036.6261,1030.33,0.0,38.09,0.0,0.0,0.0,0.0,0.0,1000,1280.0,6.0,5.714,Weekly,35.0,11089.71,1000.0,,1.0,0.0,0.0989,1.0,4492.0466,0.0,155.2633,213.33,QuickCash,0.0,5068500,0.0,15-04-2023,False,Vehicle Expense,2023-04-15,Green,0.0,13179.0,11089.71
0062x00000DIzFiAAL,0012x00000cKtHfAAK,Rosebery,NT,Australia,Closed Lost,Existing Client-Granted Loan Before,0.0,98.51,998.4298,2.0,0.0,0.0,4.0,2.0,5781.6064,0.0,21.0,1120.0,1962.6583,1942.63,1.0,0.0,1.0,0.0,3113.07,400.0,800.0,1000,1280.0,3.0,6.286,Fortnightly,31.0,5883.27,1000.0,Full-Time Employment,0.0,0.0,0.0,0.0,3925.3166,1300.0,2374.4333,426.67,Financier-2,,4865939,0.0,15-03-2023,False,Vehicle Expenses,2023-03-14,Green,0.0,5714.0,5883.27
0062x00000DtZdGAAV,0012x00000hYJpXAAW,Inala,QLD,Australia,Closed Lost,Existing Client-No Loan Granted Ever,0.0,40.42,2160.1313,4.0,0.0,0.0,2.0,4.0,5024.7194,0.0,42.0,323.0467,1510.076,1748.89,0.0,0.0,0.0,0.0,5200.0,400.0,600.0,1000,1280.0,3.0,4.714,Fortnightly,50.0,5489.36,2050.0,Full-Time Employment,0.0,0.0,0.0,0.0,2811.26,990.0,2445.0433,426.67,MoneySpot,,5324795,0.0,23-05-2023,False,Travel Expenses,2023-05-19,Orange,0.0,9077.0,5489.36
0062x00000DFRR0AAP,0010K00001xkGlSQAU,Parkes,NSW,Australia,Loan Paid,Existing Client-Granted Loan Before,0.0,77.08,173.3333,1.0,0.0,0.0,3.0,1.0,6081.079,13.0,34.0,0.0,1261.297,1645.14,0.0,11.29,0.0,0.0,1029.17,599.0,150.0,1000,1360.0,14.0,14.571,Weekly,29.0,7302.25,1000.0,Full-Time Employment,13.0,0.0,0.2308,0.0,4204.3233,705.0,1119.5633,97.14,MoneySpot,0.0,4668350,6.0,12-02-2023,False,Travel Expenses,2023-02-12,Green,0.0,9705.0,7302.25
0062x00000D96UFAAZ,0012x000003fXC9AAM,Lake Heights,NSW,Australia,Loan Paid,Existing Client-Granted Loan Before,2.69,97.53,660.8385,1.0,0.0,0.0,4.0,1.0,8738.3328,0.0,39.0,0.0,1873.5453,2101.6,0.0,4.62,0.0,0.0,1447.33,400.0,100.0,1000,1360.0,14.0,13.857,Weekly,29.0,8743.33,1000.0,Unemployed,7.0,0.0,0.1538,0.0,8118.6966,311.0,602.5066,97.14,Financier-2,0.0,4564458,0.0,27-01-2023,False,Travel Expenses,2023-01-27,Green,245.0,9099.0,8743.33
0062x00000DVs6hAAD,0012x00000goXxMAAU,Rochedale south,QLD,Australia,Loan Paid,Existing Client-Granted Loan Before,0.0,70.75,4558.4812,2.0,0.0,0.0,3.0,2.0,9189.3897,0.0,65.0,192.0,2586.64,2586.64,0.0,0.0,1.0,0.0,5590.0,1499.0,350.0,1000,1320.0,7.0,12.857,Fortnightly,33.0,16065.84,2050.0,Part-Time Employment,0.0,0.0,0.033,0.0,2586.64,1279.0,5954.16,188.57,QuickCash,0.0,5480640,0.0,02-06-2023,False,Vehicle Expenses,2023-06-02,Orange,0.0,11661.0,16065.84
0062x00000DAFUiAAP,0012x00000RqXLuAAN,Inverell,NSW,Australia,Loan Paid,Existing Client-Granted Loan Before,0.0,14.81,1416.1912,2.0,0.0,0.0,4.0,2.0,5767.8355,0.0,0.0,1346.6913,2534.1014,2609.44,1.0,0.0,0.0,1.0,5633.33,599.0,1440.0,950,1292.0,7.0,13.714,Fortnightly,48.0,5767.84,950.0,Full-Time Employment,0.0,0.0,0.0,0.0,0.0,1446.0,1712.8466,184.57,QuickCash,0.0,4620827,0.0,05-02-2023,False,Vehicle Expenses,2023-02-04,Green,0.0,7799.0,5767.84
0062x00000DGIU4AAP,0012x00000MgRLAAA3,Belmore,NSW,Australia,Loan Paid,Existing Client-Granted Loan Before,0.0,31.67,261.711,2.0,1.0,0.0,3.0,2.0,5486.5666,12.0,23.0,261.7137,2273.6,1600.6,0.0,0.0,0.0,0.0,9306.51,899.0,260.0,800,1120.0,9.0,17.571,Fortnightly,25.0,5486.57,800.0,Full-Time Employment,12.0,0.0,0.3846,1.0,5305.0666,310.0,1123.7,124.44,QuickCash,0.0,4715354,12.0,19-02-2023,False,Living Expenses,2023-02-19,Green,0.0,7497.0,5486.57
0062x00000DFUVkAAP,0012x00000gncVYAAY,Leichhardt,NSW,Australia,Closed Lost,New Client-New Loan,0.0,73.5,6582.5997,2.0,0.0,0.0,3.0,2.0,7438.7158,4.0,58.0,595.662,2559.3,2559.3,1.0,0.0,0.0,0.0,0.0,0.0,0.0,700,952.0,7.0,13.429,Fortnightly,60.0,7545.63,1150.0,,4.0,0.0,0.2308,1.0,5971.7,1783.0,6838.24,136.0,MoneySpot,,4671834,4.0,17-02-2023,False,Other,2023-02-12,Orange,0.0,8110.0,7545.63
0062x00000ELeWnAAL,0012x00000Nx5LtAAJ,Greenwich,NSW,Australia,Loan Paid,Existing Client-Granted Loan Before,0.0,30.61,1989.7099,3.0,0.0,0.0,4.0,3.0,8400.34,0.0,14.0,366.9624,8335.34,8335.34,0.0,0.48,0.0,0.0,7098.0,599.0,1600.0,750,990.0,3.0,13.0,Monthly,52.0,8400.34,750.0,Full-Time Employment,0.0,0.0,0.8462,0.0,8335.34,471.0,2490.1933,330.0,QuickCash,0.0,6053336,0.0,30-07-2023,False,Vehicle Expenses,2023-07-30,Green,0.0,8400.0,8400.34
0062x00000DXNoqAAH,0012800001SDT7cAAH,Bentley Park,QLD,Australia,Loan Paid,Existing Client-Granted Loan Before,0.0,72.84,754.2378,2.0,0.0,0.0,3.0,2.0,4417.427,9.0,38.0,654.3836,1798.7028,2271.58,0.0,18.25,0.0,0.0,0.0,400.0,200.0,1000,1280.0,3.0,5.857,Fortnightly,34.0,4417.43,1000.0,Full-Time Employment,9.0,0.0,0.7033,2.0,4196.9733,637.0,1090.1233,426.67,QuickCash,0.0,4969781,1.0,31-03-2023,False,Vehicle Expenses,2023-03-31,Green,0.0,5568.0,4417.43
0062x00000DtX52AAF,0012x000003EBW3AAO,Woodpark,NSW,Australia,Loan Paid,Existing Client-Granted Loan Before,46.15,86.5,2183.4515,2.0,0.0,4.0,4.0,2.0,7547.1233,8.0,49.0,0.0,1358.9585,1358.96,2.0,0.36,0.0,0.0,0.0,599.0,500.0,1000,1360.0,7.0,14.0,Fortnightly,39.0,7547.12,2050.0,Part-Time Employment,8.0,0.0,0.011,4.0,7393.24,1440.0,2765.0333,194.29,MoneySpot,0.0,5322589,5.0,19-05-2023,False,Vehicle Expenses,2023-05-19,Orange,4222.0,9148.0,7547.12
0062x00000DH2OcAAL,0010K00001iJmPyQAK,Chipping Norton,NSW,Australia,Loan Paid,Existing Client-Granted Loan Before,0.0,96.49,1569.928,4.0,0.0,0.0,3.0,4.0,3230.0,18.0,35.0,2489.1581,969.0,969.0,0.0,0.0,1.0,0.0,2816.67,599.0,190.0,1000,1280.0,6.0,6.571,Weekly,24.0,4199.0,1000.0,Full-Time Employment,31.0,0.0,0.2198,6.0,3230.0,1017.0,1716.2733,213.33,MoneySpot,0.0,4757650,27.0,26-02-2023,False,Furniture or Appliances,2023-02-26,Green,0.0,4774.0,4199.0
0062x00000DZpPaAAL,0012x00000RrsuDAAR,Deloraine,TAS,Australia,Loan Paid,Existing Client-Granted Loan Before,0.0,49.91,5798.648,2.0,0.0,0.0,4.0,2.0,6836.1366,0.0,29.0,711.341,1572.9442,611.53,1.0,0.51,0.0,0.0,3337.54,899.0,1270.0,1000,1360.0,7.0,13.857,Fortnightly,35.0,6836.14,2050.0,Part-Time Employment,0.0,0.0,0.011,0.0,6288.4933,1401.0,6917.8633,194.29,MoneySpot,0.0,5116759,0.0,22-04-2023,False,Home Maintenance & Repairs,2023-04-22,Orange,0.0,7872.0,6836.14
0062x00000DHEskAAH,0012x00000cljqUAAQ,Sellicks Beach,SA,Australia,Closed Lost,Existing Client-No Loan Granted Ever,8.85,47.99,1495.3036,2.0,0.0,4.0,3.0,2.0,5339.4464,0.0,58.0,0.0,1113.3928,1341.82,1.0,0.22,0.0,0.0,0.0,400.0,613.0,1000,1280.0,3.0,5.429,Fortnightly,29.0,5050.53,1000.0,,0.0,0.0,0.3846,0.0,3153.8033,0.0,2663.84,426.67,MoneySpot,,4768661,0.0,04-03-2023,False,Living Expenses,2023-02-28,Orange,569.0,6429.0,5050.53
0062x00000DFzpoAAD,0010K00001oe04bQAA,West Busselton,WA,Australia,Loan Paid,Existing Client-Granted Loan Before,50.61,84.84,1673.6137,2.0,0.0,4.0,3.0,2.0,6586.4168,1.0,29.0,0.0,983.6042,918.04,0.0,0.0,0.0,1.0,3250.0,400.0,2080.0,1000,1440.0,12.0,24.0,Fortnightly,37.0,6577.08,2050.0,Casual Employment,1.0,0.0,0.0659,1.0,3408.9666,484.0,1777.64,120.0,MoneySpot,0.0,4697103,1.0,16-02-2023,False,Travel Expenses,2023-02-16,Orange,3555.0,7024.0,6577.08
0062x00000DW7sBAAT,0012x00000XJwijAAD,Werrington,NSW,Australia,Loan Paid,Existing Client-No Loan Granted Ever,14.5,72.0,2258.4066,1.0,0.0,4.0,4.0,1.0,6588.5151,0.0,12.0,352.0,575.4,575.4,0.0,0.0,0.0,0.0,1763.61,899.0,600.0,800,1024.0,6.0,6.571,Weekly,62.0,9126.88,30100.0,Part-Time Employment,0.0,0.0,0.0,0.0,3314.75,381.0,2257.36,170.67,MoneySpot,0.0,4897610,0.0,20-03-2023,False,Living Expenses,2023-03-20,Orange,1397.0,9628.0,9126.88
0062x00000DGjZLAA1,0012x00000GcduWAAR,Clyde North,VIC,Australia,Loan Paid,Existing Client-Granted Loan Before,0.0,64.27,3721.7762,1.0,0.0,0.0,2.0,1.0,4654.0024,1.0,91.0,1982.2859,1071.0584,1188.54,0.0,0.0,0.0,0.0,3173.71,599.0,600.0,1000,1360.0,14.0,13.857,Weekly,43.0,4654.0,1000.0,Full-Time Employment,1.0,0.0,0.3407,1.0,4641.2533,869.0,4344.2666,97.14,MoneySpot,0.0,4738517,1.0,23-02-2023,False,Travel Expenses,2023-02-23,Orange,0.0,4971.0,4654.0
0062x00000EDLhUAAX,0012x00000cmUY7AAM,Murrumba Downs,QLD,Australia,Loan Paid,Existing Client-Granted Loan Before,0.0,85.52,2306.5518,1.0,0.0,0.0,1.0,1.0,4415.262,3.0,59.0,115.9744,1016.1153,887.55,0.0,10.04,0.0,1.0,0.0,400.0,480.0,600,816.0,14.0,14.0,Weekly,43.0,4415.26,1500.0,Full-Time Employment,3.0,0.0,0.5055,0.0,0.0,422.0,2224.4733,58.29,QuickCash,0.0,5939132,3.0,18-07-2023,False,Vehicle Expenses,2023-07-18,Orange,0.0,4432.0,4415.26
0062x00000FJuGTAA1,0010K00001doS59QAE,North Curl Curl,NSW,Australia,Loan Paid,Existing Client-Granted Loan Before,0.0,46.81,0.0,1.0,0.0,0.0,3.0,1.0,5570.4101,1.0,21.0,0.0,1146.5176,1062.49,1.0,2.53,0.0,0.0,3622.67,599.0,1000.0,1000,1360.0,14.0,14.0,Weekly,40.0,5438.36,2050.0,Full-Time Employment,16.0,0.0,0.0,6.0,4968.2433,53.0,437.96,97.14,MoneySpot,0.0,7356183,0.0,30-11-2023,False,Home Maintenance & Repairs,2023-11-30,Orange,0.0,7072.0,5438.36
0062x00000GF7bpAAD,0012x00000iIPs2AAG,Colac,VIC,Australia,Closed Lost,Existing Client-Granted Loan Before,0.0,73.73,1025.13,1.0,0.0,0.0,2.0,1.0,6567.8888,0.0,23.0,0.0,968.95,929.3,0.0,3.71,0.0,0.0,3683.33,400.0,400.0,1000,1360.0,14.0,14.0,Weekly,21.0,12592.88,1500.0,Full-Time Employment,0.0,0.0,0.0,0.0,968.95,591.0,995.54,97.14,QuickCash,,8529748,0.0,2024-03-20,False,Travel Expenses,2024-03-19,Orange,0.0,9226.0,12592.88
0062x00000DAeS3AAL,0012x00000gnHg1AAE,Lilydale,VIC,Australia,Loan Paid,New Client-New Loan,0.0,48.12,1068.0112,1.0,0.0,0.0,2.0,1.0,4430.3182,5.0,46.0,0.0,1019.5807,1002.0,0.0,0.23,0.0,0.0,0.0,0.0,750.0,1000,1360.0,14.0,14.0,Weekly,33.0,6057.38,1000.0,,5.0,0.0,0.2527,1.0,4418.1833,777.0,3254.3433,97.14,QuickCash,0.0,4639529,4.0,08-02-2023,False,Vehicle - Repairs,2023-02-07,Orange,0.0,15030.0,6057.38
0062x00000DGw8NAAT,0010K00001ymX7SQAU,Chinchilla,QLD,Australia,Loan Paid,Existing Client-Granted Loan Before,4.82,81.49,1046.758,2.0,2.0,0.0,3.0,2.0,4311.5472,11.0,30.0,627.5557,1597.2442,878.1,0.0,0.17,0.0,0.0,3770.0,1499.0,800.0,1000,1360.0,7.0,13.714,Fortnightly,59.0,4311.55,1000.0,Full-Time Employment,11.0,0.0,0.5495,8.0,4630.4866,715.0,1224.9333,194.29,QuickCash,0.0,4750160,8.0,25-02-2023,False,Living Expenses,2023-02-24,Green,250.0,5185.0,4311.55
0062x00000EMVVtAAP,0012x00000g9i21AAA,Brendale,QLD,Australia,Loan Paid,Existing Client-Granted Loan Before,69.29,81.92,305.1166,4.0,0.0,4.0,4.0,4.0,6395.1206,0.0,17.0,0.0,850.1487,756.76,1.0,3.06,0.0,0.0,44200.0,599.0,305.0,1000,1360.0,14.0,13.857,Weekly,32.0,6395.12,1000.0,Casual Employment,0.0,0.0,0.033,0.0,5761.7166,98.0,468.9866,97.14,QuickCash,0.0,6107559,0.0,05-08-2023,True,Vehicle Expenses,2023-08-04,Green,5420.0,7822.0,6395.12
0062x00000D7WRPAA3,0012x00000gA1WPAA0,Rouse Hill,NSW,Australia,Loan Paid,New Client-New Loan,0.0,66.23,363.7999,4.0,0.0,0.0,6.0,4.0,27669.6632,0.0,10.0,640.0,389.0563,50.0,0.0,0.0,1.0,1.0,0.0,0.0,1000.0,750,960.0,2.0,8.286,Monthly,46.0,27669.66,750.0,,0.0,0.0,0.0,0.0,5260.65,256.0,1781.1466,480.0,QuickCash,0.0,4487806,0.0,18-01-2023,False,Event - Funeral - Air fares,2023-01-17,Orange,0.0,28053.0,27669.66
0062x00000EwrcRAAR,0010K00002AR8UhQAL,Port Lincoln,SA,Australia,Loan Paid,Existing Client-Granted Loan Before,21.55,42.78,270.4135,1.0,0.0,2.0,5.0,1.0,5524.576,1.0,12.0,0.0,931.8,931.8,1.0,8.13,0.0,0.0,0.0,400.0,0.0,600,792.0,10.0,10.0,Weekly,40.0,7494.58,600.0,Full-Time Employment,1.0,0.0,0.3407,1.0,2685.0333,96.0,253.5,79.2,QuickCash,0.0,6621144,1.0,23-09-2023,False,Living Expenses,2023-09-23,Orange,1132.0,5252.0,7494.58
0062x00000DYNWBAA5,0012x00000e0OgIAAU,Macgregor,QLD,Australia,Loan Paid,Existing Client-Granted Loan Before,0.0,91.95,1031.1493,4.0,0.0,0.0,3.0,4.0,5389.3333,1.0,38.0,0.0,586.1052,1329.0,0.0,0.0,0.0,0.0,4388.33,400.0,100.0,700,896.0,6.0,5.714,Weekly,28.0,5441.0,2050.0,Full-Time Employment,1.0,0.0,0.011,0.0,4921.0,695.0,2461.9733,149.33,MoneySpot,0.0,5031068,0.0,10-04-2023,False,Living Expenses,2023-04-10,Green,0.0,6977.0,5441.0
0062x00000DJ7hVAAT,0012x00000XOK8xAAH,Charlemont,VIC,Australia,Loan Paid,Existing Client-Granted Loan Before,0.0,66.24,4061.0858,2.0,0.0,0.0,3.0,2.0,10011.5329,0.0,67.0,1922.2796,1456.0,1456.0,0.0,0.04,0.0,0.0,0.0,1499.0,500.0,1000,1320.0,5.0,9.0,Fortnightly,27.0,8832.86,1000.0,,0.0,0.0,0.0,0.0,3397.3333,2400.0,8216.84,264.0,QuickCash,0.0,4872745,0.0,16-03-2023,False,Medical Expenses,2023-03-16,Orange,0.0,19060.0,8832.86
0062x00000E4pkKAAR,0012x00000g9TzYAAU,Warwick,QLD,Australia,Loan Paid,Existing Client-Granted Loan Before,0.0,68.07,2681.8671,1.0,0.0,0.0,1.0,1.0,10163.9147,4.0,26.0,0.0,912.5892,1054.09,0.0,37.92,0.0,0.0,4964.76,899.0,0.0,550,726.0,10.0,9.857,Weekly,20.0,10163.91,550.0,Full-Time Employment,4.0,0.0,0.011,0.0,3954.5533,410.0,2442.3766,72.6,QuickCash,0.0,5602810,4.0,14-06-2023,False,Vehicle Expenses,2023-06-14,Green,0.0,11370.0,10163.91
0062x00000DHkqeAAD,0012x00000gopdhAAA,Footscray,VIC,Australia,Loan Paid,New Client-New Loan,0.0,47.57,73.6666,1.0,0.0,0.0,2.0,1.0,6392.9024,2.0,4.0,0.0,549.7687,8.17,0.0,0.0,0.0,1.0,0.0,0.0,500.0,700,896.0,6.0,6.429,Weekly,28.0,5208.74,8500.0,,2.0,0.0,0.0,1.0,0.0,0.0,225.21,149.33,MoneySpot,0.0,4794653,0.0,04-03-2023,False,Second hand car,2023-03-03,Orange,0.0,8661.0,5208.74
0062x00000DHh2lAAD,0012x00000BGSZkAAP,Tatura,VIC,Australia,Loan Paid,Existing Client-Granted Loan Before,8.1,40.56,0.0,1.0,0.0,0.0,2.0,1.0,5075.2675,1.0,12.0,0.0,952.752,890.33,0.0,6.47,0.0,0.0,0.0,1499.0,600.0,1000,1360.0,14.0,13.714,Weekly,31.0,4111.17,1000.0,Full-Time Employment,1.0,0.0,0.1538,0.0,4111.1733,102.0,102.3333,97.14,QuickCash,0.0,4791626,1.0,03-03-2023,False,Travel Expenses,2023-03-03,Green,451.0,5564.0,4111.17
0062x00000DH0NHAA1,0012x00000goS2VAAU,RUTHERFORD,NSW,Australia,Loan Paid,New Client-New Loan,0.0,62.28,634.8028,1.0,1.0,0.0,2.0,1.0,5191.4861,1.0,14.0,211.2,896.6492,856.33,1.0,0.61,0.0,0.0,3947.67,599.0,400.0,600,768.0,6.0,6.571,Weekly,35.0,5331.19,600.0,Full-Time Employment,1.0,0.0,0.0769,0.0,3885.48,282.0,558.83,128.0,MoneySpot,0.0,4754981,1.0,26-02-2023,False,Living Expenses,2023-02-25,Green,0.0,5584.0,5331.19
0062x00000DYK5FAAX,0012x00000KLJqKAAX,Lammermoor,QLD,Australia,Loan Paid,Existing Client-Granted Loan Before,0.0,77.96,7844.2775,1.0,0.0,0.0,3.0,1.0,11830.091,8.0,55.0,760.4167,2722.5415,2967.0,1.0,14.59,0.0,0.0,10088.58,899.0,300.0,1000,1320.0,9.0,9.571,Weekly,37.0,11830.09,2050.0,Full-Time Employment,8.0,0.0,0.1099,0.0,11797.68,758.0,8426.4066,146.67,MoneySpot,0.0,5027139,8.0,09-04-2023,False,Life Event Expenses,2023-04-08,Orange,0.0,12375.0,11830.09
0062x00000DXTJIAA5,0012x00000ZuvOrAAJ,Doncaster East,VIC,Australia,Loan Paid,Existing Client-Granted Loan Before,0.0,60.73,2966.1299,1.0,0.0,0.0,3.0,1.0,12551.7745,0.0,44.0,0.0192,1795.4775,2138.36,2.0,0.44,0.0,0.0,1400.0,1499.0,600.0,1000,1280.0,6.0,5.714,Weekly,39.0,12593.06,1000.0,Full-Time Employment,0.0,0.0,0.6593,0.0,7181.91,741.0,3137.6733,213.33,QuickCash,0.0,4973964,0.0,01-04-2023,False,Vehicle Expenses,2023-03-31,Green,0.0,14773.0,12593.06
0062x00000DVgvtAAD,0010K00001rkifWQAQ,Spalding,WA,Australia,Loan Paid,Existing Client-Granted Loan Before,14.74,53.61,295.0568,2.0,1.0,2.0,3.0,2.0,9748.3665,1.0,16.0,223.0556,3136.4114,3762.58,1.0,36.73,0.0,0.0,2500.0,400.0,109.0,550,748.0,8.0,15.857,Fortnightly,45.0,10435.77,550.0,Part-Time Employment,1.0,0.0,0.0659,0.0,8915.0833,220.0,468.88,93.5,MoneySpot,0.0,5466580,1.0,01-06-2023,False,Medical Expenses,2023-06-01,Green,1597.0,10829.0,10435.77
0062x00000D933aAAB,0012x00000LP267AAD,Port Lincoln,SA,Australia,Loan Paid,Existing Client-Granted Loan Before,0.0,29.09,891.8781,2.0,0.0,0.0,3.0,2.0,6852.5532,14.0,0.0,487.5357,2497.6657,2411.63,1.0,0.0,0.0,1.0,5434.17,1500.0,960.0,650,884.0,7.0,13.857,Fortnightly,28.0,6852.55,650.0,Full-Time Employment,14.0,0.0,0.4835,6.0,0.0,717.0,1938.2266,126.29,QuickCash,0.0,4562205,2.0,27-01-2023,False,Living Expenses,2023-01-27,Green,0.0,7387.0,6852.55
0062x00000DGHvsAAH,0012x00000cilJMAAY,Goonellabah,NSW,Australia,Loan Paid,Existing Client-No Loan Granted Ever,0.0,52.4,528.9533,0.0,0.0,0.0,0.0,0.0,0.0,0.0,26.0,34.56,0.0,0.0,0.0,0.0,1.0,0.0,3778.67,400.0,0.0,600,816.0,14.0,14.286,Weekly,34.0,3141.32,600.0,Full-Time Employment,0.0,0.0,0.1209,0.0,0.0,301.0,873.9366,58.29,QuickCash,0.0,4714688,0.0,19-02-2023,False,Living Expenses,2023-02-19,Orange,0.0,3127.0,3141.32
0062x00000DWdVTAA1,0012x000008JJ2QAAW,HILL TOP,NSW,Australia,Loan Paid,Existing Client-No Loan Granted Ever,0.0,89.1,613.8441,0.0,0.0,0.0,0.0,0.0,3766.6666,0.0,19.0,0.0,0.0,0.0,0.0,0.0,0.0,0.0,0.0,0.0,840.0,700,896.0,6.0,5.857,Weekly,27.0,8226.12,2500.0,,0.0,0.0,0.1099,0.0,3570.6466,105.0,954.71,149.33,MoneySpot,0.0,4926789,0.0,25-03-2023,False,Medical - Procedure,2023-03-24,Orange,0.0,4127.0,8226.12
0062x00000EyZR2AAN,0012x00000Rr356AAB,South Tamworth,NSW,Australia,Loan Paid,Existing Client-Granted Loan Before,0.0,42.41,1532.202,1.0,0.0,0.0,2.0,1.0,4496.8305,8.0,49.0,58.2,958.6469,978.97,1.0,0.0,0.0,0.0,4264.68,899.0,1480.0,1000,1360.0,16.0,15.857,Weekly,37.0,4505.83,1500.0,Full-Time Employment,8.0,0.0,0.956,0.0,4154.1366,490.0,1883.9033,85.0,MoneySpot,0.0,6746767,1.0,05-10-2023,False,Other Expenses,2023-10-05,Orange,0.0,6077.0,4505.83
0062x00000DGtVJAA1,0012x00000goOAWAA2,Ringwood,VIC,Australia,Closed Lost,New Client-New Loan,0.69,6.0,0.0,4.0,0.0,0.0,5.0,4.0,3110.7799,0.0,6.0,0.0,2305.0,2412.0,0.0,0.0,0.0,1.0,0.0,0.0,1640.0,800,992.0,3.0,3.143,Weekly,30.0,4740.55,2000.0,,0.0,0.0,0.0,0.0,0.0,0.0,241.28,330.67,MoneySpot,,4748397,0.0,01-03-2023,False,Car Repairs,2023-02-24,Orange,40.0,5759.0,4740.55
0062x00000DXezjAAD,0012x00000OvljEAAR,Long Gully,VIC,Australia,Closed Lost,Existing Client-No Loan Granted Ever,36.78,96.16,0.0,4.0,0.0,4.0,3.0,4.0,2199.2433,2.0,2.0,0.0,690.39,635.3,0.0,0.8,0.0,0.0,1347.67,899.0,1000.0,1000,1280.0,3.0,5.429,Fortnightly,36.0,2731.59,1000.0,Unemployed,3.0,0.0,0.1099,0.0,1610.91,0.0,0.0,426.67,MoneySpot,,4988677,0.0,03-04-2023,True,Living Expenses,2023-04-03,Orange,1839.0,5000.0,2731.59
0062x00000E7V0zAAF,0012x00000SFwEYAA1,Palm Beach,QLD,Australia,Closed Lost,Existing Client-No Loan Granted Ever,0.0,55.61,0.0,4.0,0.0,0.0,7.0,4.0,14415.9383,2.0,11.0,0.0,731.0357,10.0,0.0,0.0,0.0,1.0,2200.0,400.0,400.0,700,952.0,7.0,14.286,Fortnightly,27.0,11737.8,2500.0,Casual Employment,2.0,0.0,0.022,2.0,4914.7966,0.0,0.0,136.0,MoneySpot,,5825237,0.0,09-07-2023,False,Travel Expenses,2023-07-04,Orange,0.0,12153.0,11737.8
0062x00000DJ3F7AAL,0012x00000gpVADAA2,Mandurah,WA,Australia,Loan Paid,New Client-New Loan,0.0,64.54,0.0,1.0,0.0,0.0,2.0,1.0,3248.8376,0.0,1.0,544.9425,747.6781,701.33,0.0,0.0,1.0,0.0,3466.67,400.0,200.0,900,1152.0,6.0,6.0,Weekly,30.0,3248.84,900.0,Contract Employment,0.0,0.0,0.0879,0.0,2741.4866,27.0,27.1666,192.0,QuickCash,0.0,4868262,0.0,15-03-2023,False,Living Expenses,2023-03-15,Orange,0.0,3887.0,3248.84
0062x00000EdYMeAAN,0012x00000FGYugAAH,Hornsby Heights,NSW,Australia,Closed Lost,Existing Client-Granted Loan Before,0.0,58.51,504.3666,1.0,0.0,0.0,2.0,1.0,7001.4817,0.0,7.0,0.0,1611.3,1611.3,0.0,0.19,0.0,1.0,0.0,2000.0,2600.0,800,1088.0,14.0,14.143,Weekly,42.0,9362.44,5000.0,Full-Time Employment,0.0,0.0,0.0,0.0,0.0,0.0,559.2,77.71,MoneySpot,,6428450,0.0,05-09-2023,False,Home Maintenance & Repairs.,2023-09-05,Orange,0.0,12200.0,9362.44
0062x00000DIvPFAA1,0012x000003CmnZAAS,The Range,QLD,Australia,Loan Paid,Existing Client-Granted Loan Before,0.0,95.88,843.7526,1.0,1.0,0.0,2.0,1.0,3564.1414,9.0,35.0,1312.0661,778.1566,705.83,0.0,0.0,1.0,0.0,3163.33,599.0,200.0,650,858.0,11.0,11.143,Weekly,39.0,3569.14,650.0,Full-Time Employment,9.0,0.0,0.3736,3.0,3112.6266,595.0,1062.4033,78.0,Financier-2,0.0,4862024,9.0,14-03-2023,False,Living Expenses,2023-03-14,Orange,0.0,3295.0,3569.14
0062x00000DG2x2AAD,0012x00000ILswnAAD,Maudsland,QLD,Australia,Loan Paid,Existing Client-Granted Loan Before,9.23,93.81,1123.792,1.0,0.0,0.0,2.0,1.0,2416.6731,1.0,31.0,203.8222,443.6484,351.01,0.0,0.0,0.0,0.0,940.36,899.0,0.0,1000,1360.0,14.0,13.714,Weekly,23.0,2578.02,1000.0,Part-Time Employment,1.0,0.0,0.044,1.0,1946.2433,1131.0,1631.3766,97.14,QuickCash,0.0,4700356,0.0,17-02-2023,False,Living Expenses,2023-02-16,Green,280.0,3032.0,2578.02
0062x00000EE2MJAA1,0012x00000OKt5VAAT,Albanvale,VIC,Australia,Loan Paid,Existing Client-Granted Loan Before,22.95,49.75,755.7599,4.0,0.0,2.0,2.0,4.0,4704.3831,0.0,14.0,0.0,1255.21,1696.77,0.0,1.24,0.0,0.0,0.0,599.0,460.0,1000,1440.0,12.0,23.429,Fortnightly,41.0,4704.38,1000.0,Unemployed,0.0,0.0,0.0,0.0,4103.5966,264.0,1119.62,120.0,QuickCash,0.0,5986026,0.0,24-07-2023,False,Medical Expenses,2023-07-23,Orange,1352.0,5891.0,4704.38
0062x00000DXV4KAAX,0012x00000GdAnJAAV,Rasmussen,QLD,Australia,Loan Paid,Existing Client-Granted Loan Before,40.7,51.59,551.1073,2.0,0.0,2.0,2.0,2.0,2473.5775,6.0,36.0,211.0543,634.206,467.93,0.0,0.0,0.0,0.0,0.0,599.0,640.0,700,924.0,9.0,8.857,Weekly,42.0,2486.91,1250.0,Full-Time Employment,6.0,0.0,0.3736,0.0,2065.6466,227.0,569.96,102.67,QuickCash,0.0,4977027,4.0,02-04-2023,True,Vehicle Expenses,2023-04-01,Orange,1057.0,2597.0,2486.91
0062x00000DZUOlAAP,0012x00000INaN4AAL,Darlinghurst,NSW,Australia,Loan Paid,Existing Client-Granted Loan Before,0.0,97.21,1276.4207,2.0,0.0,0.0,3.0,2.0,3439.8882,0.0,41.0,440.4028,1444.0014,1831.78,0.0,0.31,0.0,0.0,3252.97,400.0,300.0,1000,1360.0,7.0,14.143,Fortnightly,31.0,3465.86,2050.0,Full-Time Employment,0.0,0.0,0.011,0.0,3369.3366,815.0,4032.01,194.29,MoneySpot,0.0,5095204,0.0,19-04-2023,False,Living Expenses,2023-04-19,Orange,0.0,4801.0,3465.86
0062x00000DI7eVAAT,0012x00000GcFXuAAN,Thomastown,VIC,Australia,Loan Paid,Existing Client-Granted Loan Before,0.0,80.71,3290.8757,4.0,2.0,0.0,4.0,4.0,14127.1567,9.0,28.0,235.8813,2581.8837,432.3,0.0,5.55,0.0,0.0,0.0,599.0,400.0,1000,1320.0,5.0,10.143,Fortnightly,47.0,11804.11,2050.0,,9.0,0.0,0.0879,5.0,11755.94,2592.0,4068.94,264.0,QuickCash,0.0,4817188,7.0,08-03-2023,False,Vehicle Expenses,2023-03-07,Green,0.0,15653.0,11804.11
0062x00000D9YW4AAN,0012x00000gmmMZAAY,Ascot Vale,VIC,Australia,Loan Paid,New Client-New Loan,0.33,54.05,4230.1434,2.0,0.0,0.0,2.0,2.0,5078.4777,1.0,117.0,0.0,1474.3485,1321.06,1.0,0.0,0.0,0.0,0.0,0.0,500.0,1000,1280.0,3.0,6.143,Fortnightly,50.0,7986.84,1500.0,,1.0,0.0,0.4615,0.0,5543.79,0.0,4405.5366,426.67,MoneySpot,0.0,4588100,1.0,31-01-2023,False,Event - Funeral - Vehicle Hire,2023-01-31,Orange,26.0,7804.0,7986.84
0062x00000FXTXpAAP,0012x00000TGulOAAT,Green Valley,NSW,Australia,Loan Paid,Existing Client-Granted Loan Before,0.0,92.6,2028.0946,2.0,1.0,0.0,5.0,2.0,7857.1782,0.0,25.0,0.0,3251.3042,2825.89,1.0,0.24,0.0,0.0,6276.13,599.0,400.0,1000,1360.0,7.0,14.0,Fortnightly,33.0,7857.18,1000.0,Full-Time Employment,6.0,0.0,0.0,0.0,7586.3766,769.0,2318.2933,194.29,MoneySpot,0.0,7756972,3.0,2024-01-06,False,Vehicle Expenses,2024-01-06,Orange,0.0,8380.0,7857.18
0062x00000DHxyMAAT,0012x00000gowrtAAA,Deanside,VIC,Australia,Closed Lost,New Client-New Loan,0.0,50.58,2317.9733,0.0,0.0,0.0,0.0,0.0,3228.0,0.0,3.0,0.0,0.0,0.0,0.0,0.0,0.0,0.0,0.0,0.0,1700.0,800,1024.0,3.0,5.429,Fortnightly,35.0,4823.02,10000.0,,0.0,0.0,0.044,0.0,1595.02,0.0,2317.9733,341.33,MoneySpot,,4809630,0.0,11-03-2023,False,Car Lease,2023-03-06,Orange,0.0,3495.0,4823.02
0062x00000DHDErAAP,0010K00001us3vJQAQ,Boronia,VIC,Australia,Loan Paid,Existing Client-Granted Loan Before,0.0,85.64,1698.2346,1.0,1.0,0.0,1.0,1.0,5376.0312,13.0,56.0,375.1902,1140.1892,1314.98,1.0,0.12,0.0,0.0,3380.0,599.0,800.0,1000,1360.0,14.0,14.0,Weekly,30.0,5467.7,1000.0,Full-Time Employment,13.0,0.0,0.2198,3.0,4940.82,1003.0,1669.0666,97.14,MoneySpot,0.0,4767400,13.0,28-02-2023,False,Home Maintenance & Repairs,2023-02-27,Green,0.0,5664.0,5467.7
0062x00000DGmzbAAD,0012x00000TJKwrAAH,Balga,WA,Australia,Closed Lost,Existing Client-Granted Loan Before,0.0,45.2,2509.5688,2.0,0.0,0.0,3.0,2.0,3724.6499,0.0,62.0,0.0,1256.08,1322.15,0.0,2.07,0.0,0.0,2600.0,599.0,0.0,700,952.0,9.0,17.0,Fortnightly,45.0,3926.52,2000.0,Part-Time Employment,0.0,0.0,0.1319,0.0,2930.8533,0.0,2615.5,105.78,MoneySpot,,4742374,0.0,23-02-2023,False,Vehicle Expenses,2023-02-23,Green,0.0,4343.0,3926.52
0062x00000DsBVtAAN,0012x00000gn5ExAAI,Glen Waverley,VIC,Australia,Loan Paid,Existing Client-No Loan Granted Ever,0.41,68.16,1827.4133,3.0,0.0,0.0,5.0,3.0,6702.2733,0.0,15.0,816.7955,6702.2733,7163.42,1.0,0.0,0.0,0.0,6471.7,599.0,1000.0,1000,1320.0,2.0,9.571,Monthly,44.0,10030.77,3000.0,Full-Time Employment,5.0,0.0,0.0,3.0,10030.7733,917.0,3704.1,660.0,MoneySpot,0.0,5225754,0.0,09-05-2023,False,Travel Expenses,2023-05-09,Orange,49.0,11775.0,10030.77
0062x00000DFNBrAAP,0012x00000LPHaJAAX,Glenroy,VIC,Australia,Loan Paid,Existing Client-Granted Loan Before,0.91,47.98,2853.4918,1.0,0.0,0.0,3.0,1.0,7198.6607,0.0,26.0,0.0,1420.01,1665.6,1.0,1.13,0.0,0.0,2045.33,899.0,1716.0,1000,1360.0,14.0,13.714,Weekly,58.0,10979.25,2050.0,Full-Time Employment,0.0,0.0,0.0,0.0,10235.5333,581.0,4984.7566,97.14,MoneySpot,0.0,4664058,0.0,11-02-2023,False,Other Expenses,2023-02-11,Orange,70.0,7610.0,10979.25
0062x00000DHZEeAAP,0012x00000XLYyNAAX,New Mapoon,QLD,Australia,Loan Paid,Existing Client-Granted Loan Before,0.0,66.94,836.8218,2.0,0.0,0.0,3.0,2.0,3568.5818,5.0,44.0,1363.5738,1434.412,1818.22,0.0,0.0,0.0,0.0,0.0,400.0,150.0,800,1056.0,7.0,13.0,Fortnightly,43.0,3878.77,800.0,,5.0,0.0,0.6593,0.0,2390.6866,1475.0,2125.38,150.86,MoneySpot,0.0,4784908,5.0,02-03-2023,False,Travel Expenses,2023-03-02,Green,0.0,5157.0,3878.77
0062x00000DGdjNAAT,0010K000022POhDQAW,Coolbellup,WA,Australia,Loan Paid,Existing Client-Granted Loan Before,0.0,89.68,2609.904,3.0,0.0,0.0,2.0,3.0,8506.1266,2.0,30.0,488.4944,7871.46,7597.67,2.0,0.0,0.0,0.0,250000.0,1499.0,1280.0,1000,1320.0,3.0,11.714,Monthly,44.0,8618.13,1000.0,Full-Time Employment,2.0,0.0,0.0989,0.0,7871.46,806.0,3512.6833,440.0,QuickCash,0.0,4732949,2.0,22-02-2023,False,Living Expenses,2023-02-22,Orange,0.0,8686.0,8618.13
0062x00000D6v3BAAR,0010K00001mfpxCQAQ,Blacksmiths,NSW,Australia,Loan Paid,Existing Client-Granted Loan Before,0.0,81.92,1448.9895,1.0,1.0,0.0,4.0,1.0,10302.9012,10.0,74.0,101.3889,1636.405,1418.95,2.0,46.14,0.0,0.0,4320.0,899.0,840.0,800,1088.0,14.0,14.286,Weekly,34.0,11198.72,800.0,Full-Time Employment,10.0,0.0,0.1319,4.0,7152.2866,688.0,4200.8466,77.71,MoneySpot,0.0,4458946,10.0,11-01-2023,False,Vehicle Expenses,2023-01-11,Orange,0.0,13296.0,11198.72
0062x00000ELaVHAA1,0010K00001swKNIQA2,Marsden,QLD,Australia,Loan Paid,Existing Client-Granted Loan Before,0.0,99.73,1726.4072,1.0,2.0,0.0,2.0,1.0,3538.5685,31.0,79.0,0.0,814.3561,1025.39,1.0,0.0,0.0,0.0,2860.0,599.0,200.0,750,1020.0,16.0,15.571,Weekly,38.0,3756.24,750.0,Full-Time Employment,31.0,0.0,0.5714,13.0,3528.8766,198.0,1905.3666,63.75,QuickCash,0.0,6045174,24.0,29-07-2023,False,Home Maintenance & Repairs,2023-07-28,Green,0.0,3747.0,3756.24
0062x00000ExOGRAA3,0012x00000lerMSAAY,Claymore,NSW,Australia,Closed Lost,New Client-New Loan,0.0,88.3,228.125,1.0,0.0,0.0,2.0,1.0,3678.3209,3.0,6.0,0.0,846.5181,1587.81,0.0,9.12,0.0,0.0,0.0,0.0,350.0,1000,1360.0,14.0,14.0,Weekly,30.0,5804.15,1000.0,full_time,3.0,0.0,0.0879,2.0,3103.9,0.0,307.8266,97.14,QuickCash,,6659910,3.0,27-09-2023,False,appliance_purchase,2023-09-27,Orange,0.0,6349.0,5804.15
0062x00000DtSZ2AAN,0012x00000ha8OFAAY,Rivervale,WA,Australia,Closed Lost,Existing Client-No Loan Granted Ever,0.0,45.07,1420.96,3.0,0.0,0.0,4.0,3.0,3648.5132,0.0,15.0,576.0,3252.0,3252.0,0.0,12.89,0.0,0.0,3252.0,1500.0,200.0,1000,1400.0,5.0,21.143,Monthly,21.0,3752.98,2000.0,Full-Time Employment,0.0,0.0,0.3736,0.0,3252.0,102.0,2227.3733,280.0,MoneySpot,,5314543,0.0,19-05-2023,False,Living Expenses,2023-05-18,Orange,0.0,4622.0,3752.98
0062x00000DYQ8gAAH,0012x00000TsZ6qAAF,The Gap,NT,Australia,Closed Lost,Existing Client-No Loan Granted Ever,0.89,52.5,844.8957,1.0,0.0,3.0,1.0,1.0,4676.5626,0.0,24.0,0.0,871.023,671.5,1.0,5.99,0.0,0.0,2713.44,899.0,1100.0,800,1024.0,6.0,6.143,Weekly,62.0,4676.56,2600.0,Full-Time Employment,0.0,0.0,0.0,0.0,3812.2166,258.0,881.2966,170.67,MoneySpot,,5032605,0.0,10-04-2023,False,Living Expenses,2023-04-10,Orange,38.0,4240.0,4676.56
0062x00000DVbARAA1,0012x00000G15b5AAB,Upper Kedron,QLD,Australia,Loan Paid,Existing Client-Granted Loan Before,4.11,69.96,2208.8065,2.0,1.0,2.0,2.0,2.0,5379.0561,6.0,43.0,544.0,2244.8571,1698.32,1.0,0.55,0.0,1.0,3466.67,899.0,740.0,1000,1360.0,7.0,13.857,Fortnightly,33.0,5379.06,2050.0,Full-Time Employment,6.0,0.0,0.0879,3.0,292.98,799.0,2470.9766,194.29,MoneySpot,0.0,5463176,5.0,01-06-2023,False,Living Expenses,2023-06-01,Orange,293.0,7119.0,5379.06
0062x00000D1qaaAAB,0012x00000g8TnNAAU,Wollert,VIC,Australia,Loan Paid,Existing Client-No Loan Granted Ever,23.21,51.1,930.8106,2.0,0.0,4.0,3.0,2.0,6173.0599,11.0,79.0,0.0,2096.6528,1785.05,0.0,0.62,0.0,0.0,0.0,1499.0,1776.0,950,1216.0,3.0,6.0,Fortnightly,34.0,6186.39,950.0,,11.0,0.0,0.2308,8.0,6528.06,643.0,2295.8033,405.33,MoneySpot,0.0,4414479,1.0,05-01-2023,False,Child Expenses,2023-01-04,Orange,2085.0,8981.0,6186.39
0062x00000DHImTAAX,0012x00000g9PHfAAM,Whittington,VIC,Australia,Loan Paid,Existing Client-Granted Loan Before,16.27,55.65,1369.2177,1.0,0.0,2.0,2.0,1.0,4362.0718,4.0,61.0,129.3577,789.1933,771.35,1.0,0.0,0.0,0.0,0.0,599.0,1500.0,1000,1360.0,14.0,14.143,Weekly,42.0,4362.07,1000.0,,4.0,0.0,0.011,0.0,3826.48,359.0,1567.8966,97.14,QuickCash,0.0,4771163,4.0,28-02-2023,False,Vehicle Expenses,2023-02-28,Green,670.0,4118.0,4362.07
0062x00000D8GpbAAF,0012x000002bjmfAAA,Traralgon,VIC,Australia,Loan Paid,Existing Client-Granted Loan Before,0.0,51.2,12069.7567,0.0,0.0,0.0,0.0,0.0,0.0,0.0,26.0,1700.375,0.0,0.0,0.0,0.0,2.0,0.0,22631.48,599.0,1680.0,1000,1360.0,14.0,13.714,Weekly,46.0,65671.02,2050.0,Full-Time Employment,3.0,0.0,0.0,2.0,6434.0,100.0,12123.76,97.14,MoneySpot,0.0,4523864,1.0,21-01-2023,False,Home Maintenance & Repairs,2023-01-21,Orange,0.0,65451.0,65671.02
0062x00000D1VSpAAN,0012x00000g95IqAAI,Queanbeyan,NSW,Australia,Loan Paid,New Client-New Loan,0.0,14.29,414.2293,1.0,0.0,0.0,1.0,1.0,3816.5363,0.0,0.0,362.4526,870.425,924.0,0.0,1.81,0.0,0.0,830.0,2000.0,1320.0,800,1024.0,6.0,6.143,Weekly,21.0,3816.54,1500.0,Full-Time Employment,0.0,0.0,0.0,0.0,3481.7,127.0,127.1066,170.67,QuickCash,0.0,4393413,0.0,02-01-2023,False,Living Expenses,2023-01-02,Orange,0.0,3532.0,3816.54
0062x00000DscMSAAZ,0012x00000g990KAAQ,CARSELDINE,QLD,Australia,Closed Lost,Existing Client-No Loan Granted Ever,0.0,14.99,3911.757,1.0,1.0,0.0,4.0,1.0,8528.0241,7.0,38.0,0.0,1962.6138,1766.62,1.0,0.0,0.0,0.0,7800.0,899.0,2500.0,1000,1360.0,14.0,13.857,Weekly,39.0,8504.66,1000.0,Full-Time Employment,7.0,0.0,0.1758,2.0,8504.66,199.0,3622.8166,97.14,MoneySpot,,5252325,4.0,12-05-2023,False,Vehicle Expenses,2023-05-11,Green,0.0,9211.0,8504.66
0062x00000FXUf2AAH,0012x00000SG3RVAA1,Blacktown,NSW,Australia,Closed Lost,Existing Client-Granted Loan Before,0.0,87.38,561.8138,2.0,1.0,0.0,3.0,2.0,3259.3901,4.0,20.0,0.0,1101.616,1210.21,1.0,0.0,0.0,0.0,2816.67,1499.0,600.0,550,792.0,12.0,22.714,Fortnightly,23.0,3259.39,750.0,Casual Employment,4.0,0.0,0.011,1.0,1836.0266,144.0,665.2433,66.0,MoneySpot,,7758649,1.0,2024-01-11,False,Medical Expenses,2024-01-06,Green,0.0,3332.0,3259.39
0062x00000EMol3AAD,0012x00000THMYeAAP,Ngunnawal,ACT,Australia,Loan Paid,Existing Client-Granted Loan Before,0.0,43.89,3498.5408,1.0,0.0,0.0,4.0,1.0,6764.0035,8.0,26.0,0.0,1556.6476,1527.66,0.0,0.07,0.0,0.0,5806.67,1500.0,0.0,1000,1360.0,16.0,16.571,Weekly,49.0,6764.0,4000.0,Full-Time Employment,15.0,0.0,0.0,5.0,6745.4733,597.0,5630.8633,85.0,MoneySpot,0.0,6131969,12.0,07-08-2023,False,Veterinary Expenses,2023-08-07,Orange,0.0,11923.0,6764.0
0062x00000DWicUAAT,0012x00000fmhhwAAA,Batchelor,NT,Australia,Loan Paid,Existing Client-Granted Loan Before,0.0,63.55,1173.9372,2.0,0.0,0.0,4.0,2.0,5312.0518,0.0,28.0,0.0,2445.0,2445.0,0.0,0.0,0.0,0.0,5297.5,599.0,1400.0,1000,1280.0,3.0,4.857,Fortnightly,48.0,5312.05,1000.0,Full-Time Employment,0.0,0.0,0.033,0.0,4890.0,1081.0,1080.6666,426.67,QuickCash,0.0,4932514,0.0,25-03-2023,False,Medical Expenses,2023-03-25,Green,0.0,5107.0,5312.05
0062x00000DWEfEAAX,0012x00000LQx7LAAT,Port Macquarie,NSW,Australia,Loan Paid,Existing Client-Granted Loan Before,0.09,94.24,6385.4242,2.0,1.0,2.0,3.0,2.0,11482.7136,3.0,62.0,0.0,3944.8266,3539.76,1.0,0.04,0.0,0.0,8513.85,899.0,2800.0,1000,1320.0,6.0,11.286,Fortnightly,53.0,11482.71,5000.0,Full-Time Employment,3.0,0.0,0.033,1.0,7891.32,1485.0,7145.7633,220.0,QuickCash,0.0,4904259,3.0,21-03-2023,False,Other Expenses,2023-03-21,Orange,13.0,13437.0,11482.71
0062x00000EdobnAAB,0012x00000gqQnaAAE,North Ryde,NSW,Australia,Loan Paid,Existing Client-Granted Loan Before,0.0,55.03,413.3433,1.0,0.0,0.0,2.0,1.0,3679.7368,0.0,4.0,0.0,350.5,360.0,0.0,0.04,0.0,0.0,0.0,599.0,785.0,800,1056.0,10.0,10.286,Weekly,46.0,10252.93,2050.0,Full-Time Employment,0.0,0.0,0.0,0.0,1177.8333,104.0,550.7966,105.6,MoneySpot,0.0,6446377,0.0,10-09-2023,False,Medical Expenses,2023-09-10,Orange,0.0,11941.0,10252.93
0062x00000DXeXlAAL,0012x00000gndmOAAQ,Boronia,VIC,Australia,Loan Paid,Existing Client-Granted Loan Before,0.0,82.49,944.5699,3.0,0.0,0.0,4.0,3.0,4156.4766,5.0,42.0,928.16,3379.81,3173.65,0.0,0.0,0.0,0.0,3600.0,599.0,920.0,1000,1280.0,2.0,5.571,Monthly,33.0,4156.48,1000.0,Full-Time Employment,5.0,0.0,0.7912,2.0,3379.81,1018.0,2629.7266,640.0,MoneySpot,0.0,4988352,4.0,03-04-2023,False,Medical Expenses,2023-04-03,Green,0.0,5447.0,4156.48
0062x00000DGZuHAAX,0012x00000g9lFNAAY,Manunda,QLD,Australia,Closed Lost,Existing Client-No Loan Granted Ever,0.0,39.63,2750.7083,2.0,0.0,0.0,4.0,2.0,5528.4875,4.0,45.0,1201.5899,2360.5083,2515.14,1.0,24.2,1.0,0.0,0.0,0.0,700.0,750,990.0,6.0,11.286,Fortnightly,26.0,5528.49,750.0,,4.0,0.0,0.9121,1.0,4721.0166,1499.0,1975.9766,165.0,MoneySpot,,4729198,0.0,22-02-2023,False,travelling,2023-02-21,Orange,0.0,7108.0,5528.49
0062x00000ECELWAA5,0012x00000INPRiAAP,Officer,VIC,Australia,Loan Paid,Existing Client-Granted Loan Before,0.0,84.91,2282.735,1.0,1.0,0.0,3.0,1.0,7269.1301,16.0,56.0,0.0,1672.8961,1542.99,3.0,2.43,0.0,0.0,3770.0,599.0,1803.0,1000,1360.0,14.0,13.714,Weekly,32.0,7269.13,1750.0,Full-Time Employment,44.0,0.0,0.2967,19.0,7249.2166,437.0,2890.1333,97.14,QuickCash,0.0,5863426,12.0,08-07-2023,False,Medical Expenses,2023-07-08,Orange,0.0,7249.0,7269.13
0062x00000DsQ8nAAF,0012x00000g7y1wAAA,Werrington County,NSW,Australia,Loan Paid,Existing Client-Granted Loan Before,24.33,45.32,2799.3743,2.0,0.0,2.0,3.0,2.0,3250.4618,3.0,8.0,1075.7707,903.2866,880.54,0.0,0.0,0.0,1.0,1899.46,1499.0,1120.0,1000,1320.0,7.0,13.143,Fortnightly,40.0,3250.46,2050.0,Part-Time Employment,4.0,0.0,0.0,1.0,1185.6366,1167.0,4599.4166,188.57,QuickCash,0.0,5238521,3.0,10-05-2023,False,Furniture or Appliances,2023-05-10,Orange,1226.0,5039.0,3250.46
0062x00000DWapaAAD,0012x00000TrhkTAAR,Maningrida,NT,Australia,Loan Paid,Existing Client-Granted Loan Before,35.1,54.29,176.7056,4.0,0.0,2.0,3.0,4.0,3580.1178,3.0,9.0,176.7063,81.8,30.0,0.0,5.6,0.0,1.0,60666.67,599.0,0.0,1000,1320.0,10.0,10.857,Weekly,29.0,3845.74,2000.0,Full-Time Employment,3.0,0.0,0.0989,0.0,1785.6,245.0,245.3333,132.0,MoneySpot,0.0,4924809,3.0,24-03-2023,False,Living Expenses,2023-03-24,Orange,1849.0,5267.0,3845.74
0062x00000DtcXHAAZ,0010K00001mE8nAQAS,Hamlyn Heights,VIC,Australia,Loan Paid,Existing Client-Granted Loan Before,0.0,85.15,1767.0075,2.0,0.0,0.0,4.0,2.0,10481.1582,0.0,11.0,675.3804,4014.1514,4018.42,0.0,0.97,0.0,0.0,4333.33,599.0,1500.0,1000,1360.0,7.0,14.0,Fortnightly,45.0,16859.16,2050.0,Full-Time Employment,0.0,0.0,0.1868,0.0,9366.3533,1509.0,1508.8433,194.29,MoneySpot,0.0,5327103,0.0,19-05-2023,False,Travel Expenses,2023-05-19,Orange,0.0,18075.0,16859.16
0062x00000FUM7mAAH,0012x00000cmqZhAAI,Newstead,QLD,Australia,Loan Paid,Existing Client-Granted Loan Before,0.0,65.1,710.9115,2.0,0.0,0.0,4.0,2.0,5760.6755,1.0,6.0,0.0,1665.6216,1765.9,0.0,0.0,0.0,1.0,2883.19,899.0,1400.0,700,924.0,5.0,9.143,Fortnightly,26.0,5760.68,5000.0,Full-Time Employment,1.0,0.0,0.0769,0.0,0.0,0.0,705.6766,184.8,MoneySpot,0.0,7503675,1.0,14-12-2023,False,rental_bond_cleaning,2023-12-14,Orange,0.0,6018.0,5760.68
0062x00000EOCsPAAX,0012x00000kh5x5AAA,Saint Kilda East,VIC,Australia,Closed Lost,New Client-New Loan,0.0,23.97,258.06,2.0,0.0,0.0,3.0,2.0,3275.7751,0.0,15.0,0.0,926.84,1099.67,0.0,0.0,0.0,0.0,0.0,0.0,0.0,850,1292.0,17.0,34.0,Fortnightly,24.0,3710.11,5000.0,part-time,0.0,0.0,0.0,0.0,2162.6266,0.0,338.06,76.0,MoneySpot,,6240386,0.0,21-08-2023,False,Other,2023-08-17,Green,0.0,6373.0,3710.11
0062x00000DX58GAAT,0010K00001mgdQdQAI,Armidale,NSW,Australia,Loan Paid,Existing Client-Granted Loan Before,0.0,67.46,505.2165,1.0,0.0,0.0,4.0,1.0,3715.2802,4.0,56.0,418.0731,855.0238,823.06,1.0,0.64,0.0,1.0,2903.33,400.0,910.0,550,726.0,9.0,9.286,Weekly,33.0,3715.28,550.0,Full-Time Employment,4.0,0.0,0.1429,0.0,0.0,585.0,1133.62,80.67,MoneySpot,0.0,4953549,4.0,29-03-2023,False,Living Expenses,2023-03-28,Green,0.0,4342.0,3715.28
0062x00000DYMGCAA5,0012x00000GdPz2AAF,Elizabeth Park,SA,Australia,Loan Paid,Existing Client-Granted Loan Before,0.0,59.1,1255.0812,2.0,0.0,0.0,4.0,2.0,3995.676,0.0,68.0,649.1784,1839.1057,1841.96,1.0,0.59,0.0,0.0,0.0,599.0,700.0,1000,1280.0,4.0,7.714,Fortnightly,37.0,4554.32,2050.0,,0.0,0.0,0.4835,0.0,4291.2466,925.0,1742.4366,320.0,MoneySpot,0.0,5029620,0.0,10-04-2023,False,Vehicle Expenses,2023-04-09,Orange,0.0,8974.0,4554.32
0062x00000D1e1KAAR,0012x00000THB9GAAX,Forestville,SA,Australia,Loan Paid,Existing Client-Granted Loan Before,0.0,80.02,3512.5076,2.0,0.0,0.0,5.0,2.0,6770.5303,7.0,42.0,633.9086,2379.6471,2352.68,1.0,0.28,0.0,0.0,2029.0,599.0,960.0,950,1292.0,7.0,13.571,Fortnightly,26.0,6774.81,950.0,Full-Time Employment,8.0,0.0,0.0,4.0,5552.51,667.0,5518.3966,184.57,QuickCash,0.0,4402084,0.0,03-01-2023,False,Living Expenses,2023-01-03,Orange,0.0,9048.0,6774.81
0062x00000DX9HlAAL,0012x00000LQdc6AAD,Kootingal,NSW,Australia,Loan Paid,Existing Client-Granted Loan Before,0.0,95.48,338.7473,2.0,1.0,0.0,3.0,2.0,3644.4793,8.0,15.0,0.0,1677.46,1743.94,0.0,0.0,0.0,0.0,3231.04,599.0,1240.0,1000,1320.0,5.0,10.143,Fortnightly,28.0,3644.48,2000.0,Part-Time Employment,8.0,0.0,0.7912,1.0,3354.92,574.0,644.48,264.0,Financier-2,0.0,4956765,4.0,29-03-2023,False,Vehicle Expenses,2023-03-29,Orange,0.0,4013.0,3644.48
0062x00000EDAO0AAP,0012x00000ka0JAAAY,Northam,WA,Australia,Loan Paid,New Client-New Loan,47.2,68.96,0.0,1.0,0.0,2.0,2.0,1.0,8273.333,3.0,20.0,0.0,732.047,847.08,0.0,0.0,0.0,0.0,0.0,0.0,1320.0,700,952.0,14.0,14.429,Weekly,38.0,8329.09,700.0,,3.0,0.0,0.0,3.0,6363.0666,0.0,0.0,68.0,QuickCash,0.0,5926026,0.0,16-07-2023,False,Medical bills,2023-07-16,Orange,3923.0,8311.0,8329.09
0062x00000F3aksAAB,0012x00000XO5cLAAT,JACKA,ACT,Australia,Closed Lost,Existing Client-Granted Loan Before,0.0,95.12,0.0,0.0,0.0,0.0,0.0,0.0,86.3333,0.0,0.0,0.0,0.0,0.0,0.0,0.0,0.0,0.0,0.0,1499.0,600.0,750,1020.0,7.0,13.714,Fortnightly,32.0,4493.77,750.0,,2.0,0.0,0.0,2.0,4110.4333,0.0,70.0866,145.71,MoneySpot,,7061747,0.0,04-11-2023,False,Vehicle Expenses,2023-11-03,Orange,0.0,2291.0,4493.77
0062x00000DFSPoAAP,0010K000020HG7NQAW,Bogangar,NSW,Australia,Loan Paid,Existing Client-Granted Loan Before,1.79,64.98,4990.1542,2.0,1.0,0.0,2.0,2.0,7442.7941,9.0,64.0,1213.1261,2664.5085,2738.08,1.0,0.44,0.0,0.0,4333.33,400.0,50.0,1000,1360.0,7.0,13.429,Fortnightly,25.0,8413.78,1000.0,Part-Time Employment,11.0,0.0,0.0769,3.0,6217.1866,3588.0,8302.9433,194.29,MoneySpot,0.0,4669522,11.0,12-02-2023,False,Medical Expenses,2023-02-12,Green,276.0,15372.0,8413.78
0062x00000DH5TPAA1,0012x00000goVZWAA2,Mornington,QLD,Australia,Loan Paid,New Client-New Loan,0.0,23.64,715.2533,3.0,0.0,0.0,2.0,3.0,7078.4366,0.0,7.0,0.0,6321.77,6543.11,1.0,0.3,0.0,0.0,6500.0,400.0,1020.0,1000,1280.0,2.0,6.714,Monthly,39.0,7078.44,10000.0,Full-Time Employment,0.0,0.0,0.0549,0.0,6321.77,91.0,806.5133,640.0,MoneySpot,0.0,4761108,0.0,01-03-2023,False,Living Expenses,2023-03-01,Orange,0.0,8857.0,7078.44
0062x00000DHfE6AAL,0012x00000gonEAAAY,Griffith,NSW,Australia,Loan Paid,New Client-New Loan,0.0,14.82,328.2875,0.0,0.0,0.0,0.0,0.0,0.0,0.0,0.0,0.0,0.0,0.0,0.0,0.0,0.0,0.0,5026.67,400.0,600.0,700,896.0,6.0,5.857,Weekly,45.0,4448.64,15100.0,Self Employed,0.0,0.0,0.4286,0.0,2433.6866,0.0,319.66,149.33,MoneySpot,0.0,4790237,0.0,03-03-2023,False,Living Expenses,2023-03-03,Orange,0.0,18667.0,4448.64
0062x00000D6osRAAR,0010K00001zeDG3QAM,COOLAMON,NSW,Australia,Loan Paid,Existing Client-Granted Loan Before,44.85,49.58,1795.1097,1.0,0.0,2.0,3.0,1.0,7342.1059,0.0,49.0,1032.6726,742.9066,866.29,1.0,0.0,0.0,0.0,3900.0,599.0,560.0,1000,1360.0,14.0,14.143,Weekly,47.0,7342.11,1000.0,Unemployed,0.0,0.0,0.011,0.0,5907.6866,1624.0,1864.0866,97.14,MoneySpot,0.0,4454825,0.0,11-01-2023,False,Medical Expenses,2023-01-10,Orange,3242.0,7228.0,7342.11
0062x00000D9s16AAB,0010K00001zVTOBQA4,Frankston North,VIC,Australia,Loan Paid,Existing Client-Granted Loan Before,0.0,98.4,725.5546,0.0,3.0,0.0,0.0,0.0,0.0,19.0,66.0,514.9976,0.0,0.0,0.0,0.0,0.0,0.0,2600.0,400.0,0.0,1000,1360.0,14.0,13.857,Weekly,38.0,4014.88,2050.0,Full-Time Employment,19.0,0.0,0.3516,11.0,0.0,1360.0,2216.8433,97.14,MoneySpot,0.0,4602446,19.0,02-02-2023,False,Living Expenses,2023-02-02,Green,0.0,3724.0,4014.88
0062x00000DFwgxAAD,0012x00000RqQnGAAV,Sandhurst,VIC,Australia,Loan Paid,Existing Client-Granted Loan Before,0.69,63.67,7045.1398,3.0,0.0,0.0,1.0,3.0,184.5833,0.0,36.0,461.0206,184.5833,345.0,1.0,0.0,0.0,0.0,3500.0,1499.0,1200.0,1000,1320.0,3.0,12.571,Monthly,53.0,354.58,1000.0,Full-Time Employment,10.0,0.0,0.0,2.0,184.5833,683.0,15024.5433,440.0,QuickCash,0.0,4694922,4.0,16-02-2023,False,Home Maintenance & Repairs,2023-02-16,Orange,110.0,15829.0,354.58
0062x00000DHi4UAAT,0012x00000SHYtVAAX,Maffra,VIC,Australia,Loan Paid,Existing Client-Granted Loan Before,19.69,33.41,1347.3369,4.0,0.0,4.0,2.0,4.0,2789.9121,2.0,58.0,627.3438,1011.875,943.0,1.0,13.31,0.0,0.0,4578.28,899.0,1000.0,1000,1320.0,13.0,12.714,Weekly,35.0,4260.68,1000.0,Full-Time Employment,2.0,0.0,0.011,1.0,2570.9166,605.0,1459.36,101.54,QuickCash,0.0,4792385,2.0,03-03-2023,False,Car maintenance,2023-03-03,Orange,1222.0,6205.0,4260.68
0062x00000D8oD1AAJ,0012x00000IME4zAAH,SOUTH MORANG,VIC,Australia,Loan Paid,Existing Client-Granted Loan Before,0.91,68.42,7283.0399,2.0,1.0,0.0,1.0,2.0,9001.2062,3.0,20.0,0.0,3012.9885,3722.58,0.0,65.01,0.0,0.0,5305.97,899.0,935.0,1000,1360.0,7.0,13.857,Fortnightly,59.0,8116.49,1000.0,Full-Time Employment,3.0,0.0,0.0549,1.0,7030.3066,701.0,8326.19,194.29,MoneySpot,0.0,4550474,3.0,25-01-2023,False,Medical Expenses,2023-01-25,Orange,91.0,9939.0,8116.49
0062x00000DWQwMAAX,0012x00000Mii4XAAR,Inala,QLD,Australia,Loan Paid,Existing Client-Granted Loan Before,55.96,72.08,588.1573,2.0,0.0,2.0,3.0,2.0,6786.4658,2.0,47.0,416.0,893.62,893.62,1.0,0.53,0.0,0.0,0.0,899.0,315.0,1000,1320.0,5.0,9.0,Fortnightly,31.0,6247.78,2000.0,,2.0,0.0,0.3077,0.0,4140.9433,1666.0,3567.3666,264.0,MoneySpot,0.0,4916444,2.0,23-03-2023,True,Home Maintenance & Repairs,2023-03-23,Orange,3779.0,6752.0,6247.78
0062x00000DZEziAAH,0012x00000hY4VBAA0,Fairy Meadow,NSW,Australia,Closed Lost,New Client-New Loan,0.0,75.69,2110.8985,1.0,0.0,0.0,2.0,1.0,5847.2847,7.0,23.0,0.0,1345.6769,1650.51,1.0,0.0,0.0,0.0,0.0,0.0,1000.0,800,1024.0,6.0,6.286,Weekly,33.0,6077.35,3000.0,,12.0,0.0,0.0549,6.0,5831.2666,0.0,2306.1866,170.67,MoneySpot,,5081012,12.0,17-04-2023,False,Bills and rego,2023-04-17,Orange,0.0,8584.0,6077.35
0062x00000DGzmpAAD,0012x00000g8RinAAE,Merrylands,NSW,Australia,Loan Paid,Existing Client-Granted Loan Before,0.0,69.25,4182.5583,1.0,0.0,0.0,3.0,1.0,11172.0984,6.0,54.0,0.0,2065.9557,2275.8,1.0,0.46,0.0,0.0,0.0,899.0,1820.0,1000,1360.0,14.0,13.857,Weekly,38.0,13872.1,1000.0,,6.0,0.0,0.033,3.0,9641.1266,1163.0,4100.43,97.14,QuickCash,0.0,4754323,6.0,25-02-2023,False,Vehicle Expenses,2023-02-25,Green,0.0,15561.0,13872.1
0062x00000DrlmBAAR,0012x000002d7b4AAA,Wellesley Islands,QLD,Australia,Loan Paid,Existing Client-Granted Loan Before,0.0,79.18,836.5435,1.0,0.0,0.0,3.0,1.0,6612.8977,16.0,29.0,371.6847,697.5961,836.0,0.0,4.73,0.0,0.0,4246.67,1499.0,600.0,600,816.0,14.0,14.0,Weekly,55.0,6679.89,2050.0,Full-Time Employment,16.0,0.0,0.0,11.0,5211.5833,371.0,901.5766,58.29,MoneySpot,0.0,5191711,0.0,04-05-2023,False,Travel Expenses,2023-05-03,Orange,0.0,8303.0,6679.89
0062x00000DJ5XhAAL,0012x00000WXkRlAAL,Riverwood,NSW,Australia,Loan Paid,Existing Client-Granted Loan Before,0.39,40.65,1585.0367,4.0,0.0,0.0,1.0,4.0,10604.4665,12.0,0.0,627.9063,4542.0525,6167.63,0.0,16.27,0.0,1.0,2571.83,599.0,370.0,1000,1320.0,5.0,10.0,Fortnightly,59.0,10775.81,1000.0,Part-Time Employment,12.0,0.0,0.033,3.0,4827.5766,708.0,2065.9966,264.0,MoneySpot,0.0,4870725,0.0,16-03-2023,False,Vehicle Expenses,2023-03-15,Orange,46.0,11644.0,10775.81
0062x00000Da2WdAAJ,0012x00000THBMHAA5,COLLINGWOOD PARK,QLD,Australia,Closed Lost,Existing Client-Granted Loan Before,0.0,55.41,3170.307,4.0,1.0,0.0,1.0,4.0,4882.13,1.0,25.0,0.0,1808.2987,1826.77,0.0,0.06,0.0,0.0,3001.68,899.0,0.0,600,816.0,8.0,15.286,Fortnightly,28.0,4882.13,600.0,Part-Time Employment,1.0,0.0,0.022,1.0,4822.13,0.0,6051.3833,102.0,QuickCash,,5130510,1.0,29-04-2023,False,Other,2023-04-24,Green,0.0,5082.0,4882.13
0062x00000DGoDuAAL,0012x00000THUDZAA5,Geebung,QLD,Australia,Loan Paid,Existing Client-Granted Loan Before,0.0,71.53,1369.512,2.0,3.0,0.0,4.0,2.0,4415.3867,38.0,76.0,434.9873,2032.2885,1981.08,1.0,0.06,0.0,0.0,2500.0,400.0,1120.0,1000,1360.0,7.0,14.0,Fortnightly,37.0,4415.39,1000.0,Full-Time Employment,38.0,0.0,0.3516,30.0,4742.0066,725.0,1568.7566,194.29,Financier-2,0.0,4743585,30.0,24-02-2023,False,Medical Expenses,2023-02-23,Green,0.0,4907.0,4415.39
0062x00000DZ2fgAAD,0012x00000XO8tMAAT,COOPERS PLAINS,QLD,Australia,Loan Paid,Existing Client-Granted Loan Before,0.0,31.79,610.1709,1.0,0.0,0.0,2.0,1.0,5006.469,5.0,25.0,0.0,559.9653,492.21,1.0,0.0,0.0,0.0,700.0,400.0,660.0,600,816.0,8.0,15.571,Fortnightly,33.0,5064.8,600.0,Casual Employment,5.0,0.0,0.0,0.0,3464.4133,213.0,360.0066,102.0,QuickCash,0.0,5068212,0.0,15-04-2023,False,Life Event Expenses,2023-04-15,Orange,0.0,5473.0,5064.8
0062x00000DGioZAAT,0012x00000fm9gYAAQ,Strathfield,NSW,Australia,Closed Lost,Existing Client-No Loan Granted Ever,0.0,96.03,0.0,2.0,0.0,0.0,2.0,2.0,6541.7684,1.0,2.0,1070.9028,1810.866,1666.0,0.0,0.39,0.0,1.0,0.0,400.0,432.0,1000,1280.0,3.0,6.286,Fortnightly,25.0,5925.56,3000.0,part-time,1.0,0.0,0.033,1.0,2420.78,113.0,667.9366,426.67,MoneySpot,,4737674,1.0,23-02-2023,False,Living Expenses,2023-02-22,Orange,0.0,7468.0,5925.56
0062x00000DWuJeAAL,0012x00000gA5pbAAC,Mascot,NSW,Australia,Loan Paid,Existing Client-No Loan Granted Ever,0.0,76.38,1538.0108,1.0,0.0,0.0,1.0,1.0,4739.3694,3.0,88.0,1050.6048,853.1453,913.38,0.0,0.0,0.0,0.0,0.0,899.0,760.0,700,896.0,6.0,6.286,Weekly,28.0,4729.21,2250.0,,3.0,0.0,0.0549,3.0,3696.9633,722.0,2573.4433,149.33,MoneySpot,0.0,4943598,3.0,28-03-2023,False,Other Expenses,2023-03-27,Orange,0.0,11584.0,4729.21
0062x00000DZWgiAAH,0012x00000hYEW4AAO,Hindmarsh Valley,SA,Australia,Loan Paid,New Client-New Loan,0.0,67.36,1524.9166,4.0,0.0,0.0,3.0,4.0,19392.8323,1.0,16.0,0.0,9473.892,20610.87,0.0,0.89,0.0,1.0,6029.83,599.0,1100.0,800,1024.0,3.0,5.143,Fortnightly,57.0,21021.4,2000.0,Full-Time Employment,1.0,0.0,0.0,1.0,1217.7066,0.0,1865.2433,341.33,QuickCash,0.0,5098274,1.0,20-04-2023,False,Medical Expenses,2023-04-19,Orange,0.0,21217.0,21021.4
0062x00000DsYLMAA3,0012x00000VekhVAAR,North Strathfield,NSW,Australia,Loan Paid,Existing Client-Granted Loan Before,0.0,96.32,2753.0716,2.0,0.0,0.0,4.0,2.0,6726.2534,1.0,26.0,682.88,3095.92,2908.31,0.0,0.0,2.0,0.0,5333.92,599.0,824.0,1000,1360.0,7.0,14.143,Fortnightly,25.0,6726.25,2050.0,Full-Time Employment,1.0,0.0,0.011,0.0,5159.8666,1378.0,2707.8866,194.29,MoneySpot,0.0,5246855,1.0,11-05-2023,False,Living Expenses,2023-05-11,Orange,0.0,6901.0,6726.25
0062x00000D2YzUAAV,0012x00000SIEPJAA5,Melton West,VIC,Australia,Loan Paid,Existing Client-No Loan Granted Ever,0.0,89.88,0.0,2.0,0.0,0.0,3.0,2.0,3253.9008,1.0,18.0,0.0,1095.7133,1178.34,0.0,0.0,0.0,0.0,3109.56,400.0,0.0,1000,1280.0,3.0,5.429,Fortnightly,28.0,3064.76,1000.0,Part-Time Employment,1.0,0.0,0.8022,0.0,2191.4266,0.0,634.9833,426.67,MoneySpot,0.0,4451438,1.0,10-01-2023,False,Living Expenses,2023-01-10,Orange,0.0,3865.0,3064.76
0062x00000DXN79AAH,0012x00000WW39NAAT,Frankston North,VIC,Australia,Loan Paid,Existing Client-Granted Loan Before,0.0,52.67,717.4409,2.0,0.0,0.0,7.0,2.0,7462.5165,3.0,22.0,0.0,2842.3728,4210.82,0.0,0.18,0.0,0.0,4366.23,599.0,0.0,800,1056.0,5.0,9.571,Fortnightly,34.0,6632.2,2050.0,Full-Time Employment,3.0,0.0,0.1868,2.0,6632.2033,1081.0,1080.6966,211.2,QuickCash,0.0,4969440,0.0,03-04-2023,False,Life Event Expenses,2023-04-03,Orange,0.0,9195.0,6632.2
0062x00000Ec4OwAAJ,0012x00000gmairAAA,Blacktown,NSW,Australia,Loan Paid,Existing Client-Granted Loan Before,0.0,44.52,1723.3197,1.0,0.0,0.0,3.0,1.0,8201.9287,0.0,0.0,428.7446,1850.8592,2084.7,0.0,4.14,0.0,0.0,0.0,599.0,360.0,750,1020.0,14.0,13.857,Weekly,27.0,8201.93,750.0,,0.0,0.0,0.033,0.0,8020.39,1174.0,2143.6633,72.86,MoneySpot,0.0,6328011,0.0,26-08-2023,False,Vehicle Expenses,2023-08-26,Orange,0.0,9908.0,8201.93
0062x00000FKVTGAA5,0012x00000mKAU5AAO,Elizabeth Downs,SA,Australia,Closed Lost,New Client-New Loan,0.0,94.3,0.0,1.0,0.0,0.0,3.0,1.0,4278.7803,2.0,5.0,0.0,844.24,830.58,0.0,0.04,0.0,0.0,4333.33,599.0,400.0,900,1224.0,16.0,16.429,Weekly,32.0,9940.68,2050.0,Full-Time Employment,2.0,0.0,0.0,2.0,2251.3066,18.0,63.08,76.5,Financier-2,,7395985,0.0,04-12-2023,False,Vehicle Expenses,2023-12-04,Green,0.0,7765.0,9940.68
0062x00000DInW8AAL,0012x00000gmhcvAAA,Byford,WA,Australia,Loan Paid,Existing Client-Granted Loan Before,0.34,10.99,6101.4575,3.0,0.0,0.0,3.0,3.0,7600.03,0.0,0.0,0.0,7600.0,7600.0,1.0,0.56,0.0,1.0,0.0,599.0,1000.0,1000,1320.0,5.0,9.571,Fortnightly,36.0,12143.0,2050.0,,0.0,0.0,0.0,0.0,4833.7233,213.0,6129.9766,264.0,QuickCash,0.0,4855359,0.0,14-03-2023,False,Travel Expenses,2023-03-13,Orange,26.0,7626.0,12143.0
0062x00000D9q8AAAR,0010K00002AQSoXQAX,Erskine Park,NSW,Australia,Loan Paid,Existing Client-Granted Loan Before,0.0,42.98,3471.6378,1.0,0.0,0.0,3.0,1.0,7027.1082,0.0,75.0,767.3675,1555.4446,1383.09,0.0,2.3,0.0,0.0,950.0,400.0,200.0,800,1088.0,14.0,14.0,Weekly,34.0,7027.11,800.0,Full-Time Employment,0.0,0.0,0.011,0.0,6740.26,1741.0,3266.3,77.71,QuickCash,0.0,4601134,0.0,02-02-2023,False,Vehicle Expenses,2023-02-02,Green,0.0,7116.0,7027.11
0062x00000DIADCAA5,0012x00000cLpreAAC,LAKE CONJOLA,NSW,Australia,Loan Paid,Existing Client-No Loan Granted Ever,0.0,92.32,886.4286,1.0,0.0,0.0,3.0,1.0,4453.7762,6.0,0.0,0.0,591.2925,895.0,0.0,0.14,0.0,1.0,4151.33,400.0,500.0,1000,1280.0,6.0,6.143,Weekly,28.0,4822.11,1800.0,Full-Time Employment,12.0,0.0,0.3297,0.0,0.0,0.0,919.5533,213.33,MoneySpot,0.0,4819951,12.0,09-03-2023,False,Other,2023-03-09,Orange,0.0,9551.0,4822.11
0062x00000F3uSCAAZ,0012x00000mGTQqAAO,Rooty Hill,NSW,Australia,Loan Paid,New Client-New Loan,0.0,51.9,1646.1132,2.0,0.0,0.0,3.0,2.0,6167.781,2.0,21.0,0.0,1800.8757,2408.43,0.0,16.89,0.0,0.0,0.0,0.0,500.0,1000,1400.0,9.0,17.429,Fortnightly,33.0,6167.78,1000.0,full_time,2.0,0.0,0.0,0.0,4202.0433,0.0,2234.31,155.56,QuickCash,0.0,7088048,0.0,06-11-2023,False,vehicle_expenses,2023-11-06,Green,0.0,8751.0,6167.78
0062x00000EDAWBAA5,0012x00000fp7UOAAY,Howrah,TAS,Australia,Loan Paid,Existing Client-Granted Loan Before,59.45,20.1,0.0,1.0,0.0,2.0,3.0,2.0,2648.8989,0.0,5.0,0.0,805.9714,822.0,0.0,0.44,0.0,0.0,2223.0,899.0,468.0,800,1216.0,34.0,34.571,Weekly,68.0,2564.97,1500.0,Unemployed,0.0,0.0,0.0,0.0,2017.52,301.0,300.9466,35.76,MoneySpot,0.0,5925705,0.0,16-07-2023,True,Travel Expenses,2023-07-16,Green,1881.0,3164.0,2564.97
0062x00000DtcKqAAJ,0012x00000IN2ygAAD,Barcaldine,QLD,Australia,Loan Paid,Existing Client-Granted Loan Before,0.0,63.07,1854.5152,2.0,0.0,0.0,4.0,2.0,5144.5472,0.0,34.0,0.0,2367.9014,2935.41,0.0,0.0,0.0,0.0,3856.67,899.0,500.0,700,952.0,8.0,16.0,Fortnightly,33.0,5144.55,700.0,Full-Time Employment,0.0,0.0,0.956,0.0,5525.1033,233.0,1802.7066,119.0,Financier-2,0.0,5326924,0.0,19-05-2023,False,Medical Expenses,2023-05-19,Green,0.0,5692.0,5144.55
0062x00000D2N0QAAV,0012x00000dyiwMAAQ,Scoresby,VIC,Australia,Loan Paid,Existing Client-Granted Loan Before,0.0,62.08,849.7488,3.0,0.0,0.0,4.0,3.0,4226.1098,1.0,13.0,0.0,1632.7766,1516.36,0.0,38.41,0.0,0.0,0.0,599.0,300.0,850,1088.0,2.0,14.857,Monthly,33.0,6981.12,850.0,Full-Time Employment,1.0,0.0,0.0879,0.0,1632.7766,500.0,815.9166,544.0,Financier-2,0.0,4442036,1.0,09-01-2023,False,Vehicle Expenses,2023-01-09,Orange,0.0,11424.0,6981.12
0062x00000EcpEPAAZ,0010K00001sDtx1QAC,Ormiston,QLD,Australia,Loan Paid,Existing Client-Granted Loan Before,0.0,30.33,487.3267,1.0,0.0,0.0,3.0,1.0,6122.4585,22.0,32.0,0.0,1120.2118,1002.96,0.0,34.49,0.0,0.0,6500.0,599.0,800.0,750,1020.0,14.0,14.0,Weekly,32.0,6147.44,750.0,Full-Time Employment,22.0,0.0,0.0,8.0,4107.4433,486.0,485.9933,72.86,QuickCash,0.0,6381425,2.0,31-08-2023,False,Living Expenses,2023-08-31,Orange,0.0,5872.0,6147.44
0062x00000D7rd8AAB,0012x00000SFgWuAAL,Morley,WA,Australia,Loan Paid,Existing Client-Granted Loan Before,0.0,48.62,1766.1946,4.0,0.0,0.0,5.0,4.0,2902.8198,2.0,47.0,615.5751,1188.5642,8.45,1.0,1.3,0.0,0.0,2313.84,400.0,200.0,1000,1320.0,7.0,12.857,Fortnightly,21.0,2992.82,1000.0,Full-Time Employment,2.0,0.0,0.1758,0.0,2773.3166,928.0,2061.9566,188.57,MoneySpot,0.0,4503271,1.0,19-01-2023,False,Living Expenses,2023-01-18,Orange,0.0,3764.0,2992.82
0062x00000D9q8UAAR,0012x00000d8EyuAAE,Leppington,NSW,Australia,Loan Paid,Existing Client-Granted Loan Before,0.0,74.31,2166.8901,1.0,0.0,0.0,3.0,1.0,7739.7379,0.0,28.0,984.917,1781.2,1378.0,1.0,0.0,0.0,1.0,0.0,400.0,2000.0,1000,1360.0,14.0,14.0,Weekly,46.0,1435.31,1800.0,Full-Time Employment,0.0,0.0,0.0,0.0,1415.0,1253.0,2093.87,97.14,MoneySpot,0.0,4601137,0.0,02-02-2023,False,Home Maintenance & Repairs,2023-02-02,Orange,0.0,11513.0,1435.31
0062x00000DXe6KAAT,0012x00000hXBLIAA4,Collingwood Park,QLD,Australia,Loan Paid,New Client-New Loan,0.0,86.41,2364.3469,1.0,0.0,0.0,2.0,1.0,3873.2309,1.0,64.0,0.0,891.3738,1004.06,2.0,0.13,0.0,0.0,0.0,0.0,1120.0,1000,1280.0,6.0,6.286,Weekly,29.0,5647.47,2500.0,,10.0,0.0,0.011,1.0,5614.8633,299.0,2419.62,213.33,MoneySpot,0.0,4988044,7.0,03-04-2023,False,Medical - Dental,2023-04-03,Orange,0.0,3886.0,5647.47
0062x00000ECygvAAD,0012x00000gpZ5lAAE,Maylands,WA,Australia,Loan Paid,Existing Client-Granted Loan Before,0.0,78.75,2506.8687,2.0,0.0,0.0,2.0,2.0,3523.7212,1.0,35.0,262.5176,1598.25,1502.0,0.0,0.0,0.0,0.0,1900.0,599.0,600.0,800,1088.0,7.0,13.714,Fortnightly,35.0,3523.72,1500.0,Full-Time Employment,1.0,0.0,0.1648,1.0,3196.5,1015.0,3029.81,155.43,QuickCash,0.0,5911768,1.0,15-07-2023,False,Living Expenses,2023-07-15,Orange,0.0,4515.0,3523.72
0062x00000DWtvxAAD,0012800001HmqpcAAB,Bahrs Scrub,QLD,Australia,Loan Paid,Existing Client-Granted Loan Before,1.93,19.03,2477.2957,1.0,0.0,2.0,2.0,1.0,4356.534,5.0,68.0,1613.7676,981.255,1080.2,1.0,0.96,0.0,0.0,3423.33,400.0,0.0,1000,1320.0,10.0,10.286,Weekly,52.0,4356.53,1000.0,Full-Time Employment,5.0,0.0,0.0,1.0,4017.77,1395.0,2471.5033,132.0,MoneySpot,0.0,4943285,0.0,28-03-2023,False,Other Expenses,2023-03-27,Orange,93.0,4804.0,4356.53
0062x00000EdmuNAAR,0012x00000G2nmWAAR,LISMORE,NSW,Australia,Loan Paid,Existing Client-Granted Loan Before,0.0,91.92,2197.772,1.0,1.0,0.0,2.0,1.0,2985.6939,14.0,67.0,0.0,687.1192,610.05,0.0,0.54,0.0,0.0,738.0,400.0,200.0,750,1020.0,15.0,14.857,Weekly,40.0,3087.03,750.0,Part-Time Employment,15.0,0.0,0.0,2.0,2977.5166,422.0,2525.4066,68.0,QuickCash,0.0,6443206,3.0,07-09-2023,False,Medical Expenses,2023-09-06,Orange,0.0,3335.0,3087.03
0062x00000FIcwsAAD,0012x00000goWmCAAU,Andergrove,QLD,Australia,Loan Paid,Existing Client-Granted Loan Before,0.0,32.12,0.0,1.0,0.0,0.0,4.0,1.0,7678.5828,0.0,0.0,0.0,728.4414,847.55,0.0,40.91,0.0,1.0,2050.0,2000.0,200.0,1000,1400.0,20.0,20.571,Weekly,36.0,4765.25,1000.0,Casual Employment,0.0,0.0,0.0,0.0,0.0,0.0,5.1,70.0,QuickCash,0.0,7262810,0.0,21-11-2023,False,Living Expenses,2023-11-21,Orange,0.0,8624.0,4765.25
0062x00000DVIrbAAH,0012x00000WtGLLAA3,Orange,NSW,Australia,Loan Paid,Existing Client-Granted Loan Before,34.5,86.42,2504.8331,4.0,0.0,2.0,4.0,4.0,10107.6007,0.0,26.0,0.0,2522.5542,2819.1,2.0,0.1,0.0,0.0,4347.61,899.0,2000.0,1000,1320.0,5.0,10.429,Fortnightly,40.0,11755.92,2500.0,Part-Time Employment,4.0,0.0,0.0,1.0,10439.16,2361.0,3377.71,264.0,QuickCash,0.0,5436703,0.0,30-05-2023,False,Travel Expenses,2023-05-30,Orange,3542.0,10264.0,11755.92
0062x00000DVyU9AAL,0012x000002aLj9AAE,Coodanup,WA,Australia,Closed Lost,Existing Client-No Loan Granted Ever,0.0,86.88,3767.0332,4.0,0.0,0.0,5.0,4.0,7501.6833,0.0,0.0,970.1396,140.2928,150.0,2.0,1.24,0.0,1.0,0.0,0.0,50.0,1000,1280.0,3.0,5.857,Fortnightly,50.0,13604.01,2500.0,,0.0,0.0,0.0,0.0,4311.2766,794.0,3868.74,426.67,QuickCash,,4887274,0.0,18-03-2023,False,Event - Funeral - Air fares,2023-03-17,Orange,0.0,13486.0,13604.01
0062x00000F1V1GAAV,0012x00000cx79WAAQ,Penshurst,NSW,Australia,Loan Paid,Existing Client-Granted Loan Before,0.13,34.42,780.6984,1.0,0.0,0.0,5.0,1.0,3117.8799,0.0,40.0,0.0,695.1116,685.0,0.0,49.73,0.0,0.0,0.0,599.0,0.0,1000,1440.0,24.0,24.571,Weekly,25.0,6709.26,1000.0,Full-Time Employment,0.0,0.0,0.0,0.0,2984.5466,584.0,877.2466,60.0,MoneySpot,0.0,6898045,0.0,21-10-2023,False,Living Expenses,2023-10-21,Orange,14.0,10464.0,6709.26
0062x00000DWP53AAH,0010K000023OgFWQA0,Usher,WA,Australia,Loan Paid,Existing Client-Granted Loan Before,0.0,81.31,2046.2095,1.0,1.0,0.0,2.0,1.0,6136.249,13.0,61.0,526.0,1050.1484,1058.23,0.0,0.0,0.0,0.0,0.0,400.0,1700.0,1000,1320.0,10.0,10.0,Weekly,34.0,6123.75,1000.0,Full-Time Employment,13.0,0.0,0.5604,6.0,5998.7633,1389.0,3160.2266,132.0,Financier-2,0.0,4913731,12.0,23-03-2023,False,Travel Expenses,2023-03-22,Green,0.0,6388.0,6123.75
0062x00000D6mdGAAR,0012x00000ACVpTAAX,Blacktown,NSW,Australia,Loan Paid,Existing Client-Granted Loan Before,0.0,59.47,660.1666,4.0,0.0,0.0,4.0,4.0,4558.2999,0.0,31.0,0.0,856.05,820.4,0.0,1.51,0.0,0.0,3250.0,599.0,840.0,1000,1320.0,12.0,12.286,Weekly,30.0,4558.3,1500.0,Casual Employment,0.0,0.0,0.0659,0.0,3451.0666,469.0,1400.6266,110.0,MoneySpot,0.0,4452512,0.0,14-01-2023,False,Medical Expenses,2023-01-14,Orange,0.0,4894.0,4558.3
0062x00000DGDDtAAP,0012x00000XBksSAAT,Denham Court,NSW,Australia,Loan Paid,Existing Client-Granted Loan Before,0.0,72.92,784.408,4.0,0.0,0.0,5.0,4.0,2391.5133,0.0,0.0,0.0,108.7051,100.0,1.0,0.0,0.0,1.0,2200.0,599.0,1300.0,1000,1360.0,7.0,13.714,Fortnightly,28.0,4735.91,1000.0,Full-Time Employment,0.0,0.0,0.6374,0.0,4350.0433,352.0,754.6133,194.29,QuickCash,0.0,4709431,0.0,18-02-2023,False,Vehicle Expenses,2023-02-18,Orange,0.0,3034.0,4735.91
0062x00000D8KX2AAN,0010K00001ffo8tQAA,Hornsby Heights,NSW,Australia,Loan Paid,Existing Client-Granted Loan Before,0.0,70.85,1374.47,2.0,0.0,0.0,3.0,2.0,8980.091,3.0,64.0,672.3044,3386.1233,2521.27,2.0,0.31,0.0,0.0,4983.33,599.0,200.0,1000,1360.0,7.0,13.571,Fortnightly,31.0,8990.3,1000.0,Full-Time Employment,3.0,0.0,0.4176,0.0,6772.2466,1208.0,2978.4833,194.29,MoneySpot,0.0,4527281,3.0,22-01-2023,False,Vehicle Expenses,2023-01-21,Green,0.0,9666.0,8990.3
0062x00000D9tpqAAB,0012x00000e0HMaAAM,Mullion Creek,NSW,Australia,Loan Paid,Existing Client-Granted Loan Before,0.0,80.45,0.0,2.0,0.0,0.0,3.0,2.0,4113.5178,0.0,13.0,0.0,1531.434,2170.39,0.0,0.0,0.0,0.0,2100.0,400.0,0.0,1000,1360.0,7.0,13.0,Fortnightly,21.0,4580.81,1200.0,Casual Employment,0.0,0.0,0.0,0.0,2552.39,725.0,1383.8766,194.29,QuickCash,0.0,4603505,0.0,02-02-2023,False,Other Expenses,2023-02-02,Green,0.0,4799.0,4580.81
0062x00000DAGhTAAX,0012x00000WtGjcAAF,Mildura,VIC,Australia,Loan Paid,Existing Client-Granted Loan Before,0.0,36.56,0.0,0.0,0.0,0.0,0.0,0.0,0.0,0.0,5.0,32.0,0.0,0.0,0.0,21.51,0.0,0.0,1849.0,400.0,100.0,1000,1360.0,7.0,13.571,Fortnightly,42.0,0.0,1000.0,Full-Time Employment,0.0,0.0,0.8901,0.0,0.0,48.0,333.3333,194.29,QuickCash,0.0,4621912,0.0,06-02-2023,False,Vehicle Expenses,2023-02-05,Orange,0.0,767.0,0.0
0062x00000Eek1IAAR,0010K00001iKFqAQAW,Boronia Heights,QLD,Australia,Loan Paid,Existing Client-Granted Loan Before,0.0,24.92,2034.6844,1.0,0.0,0.0,1.0,1.0,3535.685,0.0,31.0,0.0,813.6923,902.0,4.0,0.0,0.0,0.0,3466.67,400.0,1000.0,1000,1400.0,19.0,18.857,Weekly,41.0,3930.52,1000.0,Full-Time Employment,5.0,0.0,0.0,2.0,3920.8333,713.0,1897.17,73.68,QuickCash,0.0,6513242,1.0,13-09-2023,False,Living Expenses,2023-09-13,Green,0.0,3694.0,3930.52
0062x00000EMhqPAAT,0012x00000PwFQnAAN,Alligator Creek,QLD,Australia,Loan Paid,Existing Client-Granted Loan Before,0.0,43.56,2736.0103,2.0,0.0,0.0,2.0,2.0,5965.3783,0.0,22.0,0.0,2510.2,2309.0,0.0,0.12,0.0,0.0,1415.55,599.0,600.0,1000,1480.0,14.0,28.429,Fortnightly,21.0,5965.38,1000.0,Part-Time Employment,0.0,0.0,0.0659,0.0,4183.6666,583.0,2278.1466,105.71,MoneySpot,0.0,6124174,0.0,06-08-2023,False,Living Expenses,2023-08-05,Orange,0.0,6920.0,5965.38
0062x00000DGbfnAAD,0012x00000WYolCAAT,Marsden,QLD,Australia,Loan Paid,Existing Client-Granted Loan Before,0.0,79.91,2084.8925,1.0,0.0,0.0,3.0,1.0,7415.2389,1.0,64.0,1068.631,1290.5866,1232.03,0.0,0.42,1.0,0.0,0.0,400.0,150.0,1000,1320.0,10.0,10.143,Weekly,58.0,9737.57,2050.0,,1.0,0.0,0.011,0.0,5162.3466,1382.0,2554.39,132.0,MoneySpot,0.0,4731353,0.0,22-02-2023,False,Vehicle Expenses,2023-02-22,Orange,0.0,9292.0,9737.57
0062x00000EchveAAB,0012x00000kgon5AAA,Kilcoy,QLD,Australia,Closed Lost,Existing Client-No Loan Granted Ever,0.0,63.61,2037.8608,1.0,0.0,0.0,4.0,1.0,6846.876,0.0,63.0,0.0,1391.9938,1402.19,0.0,0.42,0.0,0.0,0.0,899.0,1760.0,800,1056.0,10.0,10.286,Weekly,35.0,9003.71,4000.0,Full-Time Employment,0.0,0.0,0.1099,0.0,6031.9733,0.0,1941.8966,105.6,MoneySpot,,6373176,0.0,04-09-2023,False,Furniture or Appliances,2023-08-30,Orange,0.0,11966.0,9003.71
0062x00000DWOueAAH,0012x00000cxP2EAAU,Yalgoo,WA,Australia,Loan Paid,Existing Client-Granted Loan Before,0.0,91.53,3174.3846,2.0,4.0,0.0,2.0,2.0,2193.796,3.0,6.0,0.0,577.55,577.55,0.0,45.18,0.0,0.0,3683.33,599.0,0.0,1000,1320.0,5.0,10.0,Fortnightly,39.0,7026.13,1000.0,Full-Time Employment,31.0,0.0,0.022,5.0,6693.1333,725.0,4048.4266,264.0,Financier-2,0.0,4913576,30.0,23-03-2023,False,Living Expenses,2023-03-22,Orange,0.0,4363.0,7026.13
0062x00000DI6ljAAD,0012x000002b4RkAAI,Ascot Vale,VIC,Australia,Closed Lost,Existing Client-Granted Loan Before,0.0,79.1,1279.7133,2.0,0.0,0.0,3.0,2.0,4082.0991,0.0,26.0,0.0,1878.8842,1878.88,0.0,0.0,0.0,0.0,4100.0,599.0,1629.0,1000,1360.0,8.0,15.286,Fortnightly,28.0,4087.1,1000.0,Full-Time Employment,0.0,0.0,0.0,0.0,4384.0633,216.0,2222.44,170.0,QuickCash,,4816645,0.0,07-03-2023,False,Life Event Expenses,2023-03-07,Green,0.0,5774.0,4087.1
0062x00000DFxk7AAD,0012x00000fmWvlAAE,Whalan,NSW,Australia,Loan Paid,Existing Client-Granted Loan Before,0.0,88.03,1464.6378,1.0,0.0,0.0,2.0,1.0,4143.407,1.0,48.0,952.2735,953.5515,792.6,0.0,0.0,0.0,0.0,0.0,400.0,100.0,1000,1360.0,14.0,13.857,Weekly,43.0,4143.41,1000.0,Full-Time Employment,1.0,0.0,0.7363,0.0,4132.0566,1542.0,1542.1633,97.14,QuickCash,0.0,4695739,1.0,16-02-2023,False,Travel Expenses,2023-02-16,Green,0.0,4326.0,4143.41
0062x00000DHdrQAAT,0012x00000cLBDsAAO,Woorabinda,QLD,Australia,Loan Paid,Existing Client-Granted Loan Before,0.0,97.65,3158.4651,4.0,0.0,0.0,3.0,4.0,4104.11,39.0,89.0,1087.1385,473.5511,891.3,0.0,5.85,0.0,0.0,3887.91,1499.0,880.0,700,924.0,10.0,9.857,Weekly,36.0,4104.11,1000.0,Full-Time Employment,39.0,0.0,0.4066,5.0,4104.11,1786.0,4410.8,92.4,Financier-2,0.0,4789142,35.0,03-03-2023,False,Travel Expenses,2023-03-02,Orange,0.0,4171.0,4104.11
0062x00000D92drAAB,0010K00001vINT1QAO,Mowbray,TAS,Australia,Loan Paid,Existing Client-Granted Loan Before,0.0,57.6,710.6941,1.0,0.0,0.0,4.0,1.0,3445.8208,0.0,15.0,664.4391,691.6088,768.33,0.0,0.0,0.0,0.0,1690.0,400.0,390.0,1000,1360.0,14.0,14.0,Weekly,54.0,6300.15,1200.0,Part-Time Employment,0.0,0.0,0.022,0.0,2074.8266,1341.0,1562.0433,97.14,QuickCash,0.0,4561928,0.0,27-01-2023,False,Vehicle Expenses,2023-01-27,Orange,0.0,6982.0,6300.15
0062x00000DG2DbAAL,0012x00000g98OVAAY,Gayndah,QLD,Australia,Loan Paid,Existing Client-Granted Loan Before,15.57,52.79,472.698,2.0,0.0,2.0,4.0,2.0,2491.3804,0.0,20.0,227.0386,932.2428,760.61,0.0,1.09,0.0,0.0,0.0,400.0,100.0,1000,1360.0,7.0,14.0,Fortnightly,44.0,2491.38,1000.0,,0.0,0.0,0.0989,0.0,2604.1866,337.0,337.0,194.29,QuickCash,0.0,4699458,0.0,17-02-2023,False,Living Expenses,2023-02-16,Green,429.0,2754.0,2491.38
0062x00000DJIg7AAH,0010K000021EWM3QAO,Blacktown,NSW,Australia,Loan Paid,Existing Client-Granted Loan Before,0.34,45.44,4519.0506,1.0,1.0,0.0,4.0,1.0,12892.1558,0.0,54.0,0.0,1662.3253,2017.88,2.0,0.0,0.0,0.0,4586.83,899.0,2000.0,1000,1320.0,10.0,10.0,Weekly,44.0,13495.31,5000.0,Full-Time Employment,16.0,0.0,0.3736,8.0,12921.96,2495.0,4311.1133,132.0,MoneySpot,0.0,4881693,5.0,17-03-2023,False,Medical Expenses,2023-03-17,Orange,44.0,12623.0,13495.31
0062x00000DI5CTAA1,0012x00000cjmeYAAQ,Balgowlah,NSW,Australia,Loan Paid,Existing Client-Granted Loan Before,0.0,71.88,1631.3003,1.0,0.0,0.0,3.0,1.0,8663.5044,3.0,107.0,930.9267,1253.423,1253.0,0.0,2.64,0.0,0.0,5429.67,1499.0,1600.0,1000,1320.0,10.0,10.286,Weekly,28.0,8988.91,1000.0,Full-Time Employment,3.0,0.0,0.011,0.0,6489.8333,1004.0,2042.6533,132.0,QuickCash,0.0,4815761,2.0,07-03-2023,False,Relocation Expenses,2023-03-07,Green,0.0,14906.0,8988.91
0062x00000DA0NrAAL,0012800001NE6PBAA1,Melton,VIC,Australia,Loan Paid,Existing Client-Granted Loan Before,40.07,99.61,2070.7627,1.0,0.0,1.0,2.0,1.0,7640.0763,12.0,68.0,734.7307,774.1093,891.07,7.0,0.0,0.0,0.0,4160.0,400.0,0.0,950,1292.0,14.0,13.714,Weekly,35.0,8304.1,950.0,Full-Time Employment,12.0,0.0,0.2198,4.0,7510.17,804.0,2136.7966,92.29,QuickCash,0.0,4608513,4.0,03-02-2023,False,Medical Expenses,2023-02-03,Green,3535.0,8821.0,8304.1
0062x00000DFVM9AAP,0012x00000gndoeAAA,SCOTTVILLE,QLD,Australia,Closed Lost,New Client-New Loan,0.0,30.72,1670.5763,4.0,0.0,0.0,3.0,4.0,6586.3433,3.0,33.0,640.0,2326.8162,3919.5,1.0,0.0,0.0,0.0,0.0,0.0,0.0,1000,1280.0,7.0,8.429,Weekly,30.0,6586.34,1000.0,Full-Time Employment,8.0,0.0,0.2418,3.0,6586.3433,1231.0,3175.1333,182.86,QuickCash,,4672254,0.0,16-02-2023,False,Vehicle - Tyres,2023-02-12,Orange,0.0,7139.0,6586.34
0062x00000DIaalAAD,0012x000003F0pdAAC,Langwarrin,VIC,Australia,Loan Paid,Existing Client-Granted Loan Before,0.0,79.95,1904.3662,1.0,0.0,0.0,1.0,1.0,11876.5148,0.0,31.0,0.0,1641.5322,1472.39,1.0,4.83,0.0,0.0,3466.67,599.0,500.0,1000,1320.0,10.0,10.429,Weekly,29.0,13960.66,1000.0,Full-Time Employment,0.0,0.0,0.0,0.0,4924.5966,0.0,1667.6166,132.0,Financier-2,0.0,4841605,0.0,11-03-2023,False,Living Expenses,2023-03-10,Orange,0.0,15476.0,13960.66
0062x00000DX8quAAD,0012x00000Pvir1AAB,South Innisfail,QLD,Australia,Loan Paid,Existing Client-Granted Loan Before,0.0,59.12,2507.4099,2.0,0.0,0.0,2.0,2.0,4011.5763,1.0,43.0,501.875,1792.425,1718.84,0.0,0.04,0.0,0.0,800.0,899.0,400.0,1000,1320.0,5.0,9.0,Fortnightly,31.0,3984.25,1000.0,Casual Employment,1.0,0.0,0.1429,1.0,3584.85,537.0,2632.4166,264.0,QuickCash,0.0,4956473,1.0,29-03-2023,False,Travel Expenses,2023-03-29,Orange,0.0,4735.0,3984.25
0062x00000DYsIjAAL,0012x00000gozRbAAI,Bass Hill,NSW,Australia,Loan Paid,Existing Client-Granted Loan Before,0.0,59.84,1101.7138,1.0,0.0,0.0,2.0,1.0,4067.5283,0.0,29.0,757.7516,455.22,571.33,0.0,0.0,0.0,0.0,0.0,400.0,100.0,550,704.0,7.0,6.714,Weekly,34.0,4067.53,2050.0,Part-Time Employment,0.0,0.0,0.0,0.0,1972.62,1140.0,2720.78,100.57,QuickCash,0.0,5058548,0.0,14-04-2023,False,Medical Expenses,2023-04-13,Green,0.0,4278.0,4067.53
0062x00000DsT5IAAV,0012x00000FFhfSAAT,GLEBE,NSW,Australia,Loan Paid,Existing Client-Granted Loan Before,0.0,79.57,463.4891,1.0,0.0,0.0,3.0,1.0,6916.2218,4.0,29.0,0.0,1104.9392,1037.37,0.0,50.25,0.0,0.0,0.0,599.0,200.0,1000,1320.0,10.0,10.0,Weekly,25.0,6924.91,2050.0,,4.0,0.0,0.2527,2.0,4788.07,537.0,537.13,132.0,MoneySpot,0.0,5242887,0.0,11-05-2023,False,Living Expenses,2023-05-10,Orange,0.0,8251.0,6924.91
0062x00000DXYYRAA5,0012x00000d9jcIAAQ,Dandenong,VIC,Australia,Closed Lost,Existing Client-Granted Loan Before,0.0,69.66,4828.4719,1.0,0.0,0.0,3.0,1.0,5127.0853,2.0,96.0,429.047,1179.9153,1080.42,0.0,23.75,0.0,0.0,0.0,599.0,800.0,1000,1320.0,9.0,9.571,Weekly,37.0,5559.81,1000.0,Full-Time Employment,2.0,0.0,0.033,0.0,5540.69,906.0,4843.88,146.67,MoneySpot,,4981881,2.0,06-04-2023,False,Vehicle Expenses,2023-04-01,Orange,0.0,5380.0,5559.81
0062x00000DZ6E8AAL,0012800001VoUYuAAN,Clifton Hill,VIC,Australia,Loan Paid,Existing Client-Granted Loan Before,0.0,52.65,0.0,0.0,0.0,0.0,0.0,0.0,0.0,7.0,9.0,544.0,0.0,0.0,0.0,0.0,2.0,0.0,3900.0,899.0,750.0,1000,1320.0,3.0,13.0,Monthly,33.0,0.0,2050.0,Full-Time Employment,7.0,0.0,0.0,2.0,0.0,383.0,562.08,440.0,QuickCash,0.0,5072763,0.0,16-04-2023,False,Living Expenses,2023-04-16,Orange,0.0,6058.0,0.0
0062x00000DqzmGAAR,0012x00000INS4pAAH,Chipping Norton,NSW,Australia,Loan Paid,Existing Client-Granted Loan Before,3.53,58.82,296.7966,2.0,0.0,2.0,3.0,2.0,3244.1402,0.0,8.0,0.0,1295.7233,1871.22,0.0,0.0,0.0,0.0,4766.67,599.0,0.0,800,1152.0,12.0,24.143,Fortnightly,28.0,11125.57,2050.0,Full-Time Employment,0.0,0.0,0.0,0.0,1704.4766,0.0,1452.4433,96.0,MoneySpot,0.0,5140694,0.0,26-04-2023,False,Home Maintenance & Repairs,2023-04-26,Green,409.0,11557.0,11125.57
0062x00000D7kQlAAJ,0012x00000d8ZmGAAU,Maidstone,VIC,Australia,Loan Paid,Existing Client-Granted Loan Before,0.0,70.97,2814.1704,1.0,0.0,0.0,2.0,1.0,3717.357,0.0,59.0,106.4583,479.7525,282.01,0.0,28.43,0.0,0.0,0.0,599.0,0.0,1000,1320.0,10.0,10.0,Weekly,24.0,5550.38,1000.0,Part-Time Employment,0.0,0.0,0.1978,0.0,3697.36,935.0,2501.75,132.0,MoneySpot,0.0,4498046,0.0,18-01-2023,False,Medical Expenses,2023-01-17,Orange,0.0,6960.0,5550.38
0062x00000DrO6XAAV,0012x000003BzihAAC,Belair,SA,Australia,Loan Paid,Existing Client-Granted Loan Before,0.0,38.71,3662.7927,2.0,0.0,0.0,5.0,2.0,9883.9018,5.0,32.0,865.0646,4202.755,4191.9,1.0,0.0,1.0,0.0,260000.0,1499.0,400.0,1000,1320.0,7.0,13.0,Fortnightly,48.0,10077.85,3000.0,Full-Time Employment,6.0,0.0,0.0989,1.0,8599.4566,2102.0,4203.9466,188.57,MoneySpot,0.0,5163155,3.0,29-04-2023,False,Home Maintenance & Repairs,2023-04-29,Orange,0.0,9809.0,10077.85
0062x00000DXerBAAT,0012x00000g8lkHAAQ,Forest Range,SA,Australia,Closed Lost,Existing Client-Granted Loan Before,1.19,11.88,1040.7821,2.0,0.0,0.0,1.0,2.0,1960.7891,0.0,0.0,625.8929,902.5014,441.35,1.0,0.0,1.0,0.0,1733.33,1499.0,0.0,750,960.0,4.0,7.143,Fortnightly,20.0,1960.79,2500.0,Contract Employment,0.0,0.0,0.0,0.0,2105.8366,796.0,989.9733,240.0,MoneySpot,,4988570,0.0,03-04-2023,False,Life Event Expenses,2023-04-03,Green,31.0,2604.0,1960.79
0062x00000Ds52DAAR,0012x00000TFKu9AAH,ROCKINGHAM,WA,Australia,Loan Paid,Existing Client-Granted Loan Before,16.96,67.05,2792.7468,1.0,1.0,2.0,2.0,1.0,7594.5315,1.0,81.0,288.0,874.1357,1057.17,0.0,1.74,0.0,0.0,4116.67,400.0,1850.0,600,768.0,6.0,6.286,Weekly,35.0,7221.58,600.0,Full-Time Employment,1.0,0.0,0.5385,1.0,5462.7533,373.0,2919.07,128.0,QuickCash,0.0,5219033,1.0,08-05-2023,False,Home - Repairs/Maintenance,2023-05-08,Green,1383.0,8151.0,7221.58
0062x00000D7ULoAAN,0012x00000INhcTAAT,Fortitude Valley,QLD,Australia,Loan Paid,Existing Client-No Loan Granted Ever,0.0,25.49,449.3333,3.0,0.0,0.0,5.0,3.0,4742.18,0.0,4.0,2311.9375,4742.18,4742.18,0.0,0.0,0.0,0.0,800.0,599.0,1000.0,1000,1280.0,2.0,8.286,Monthly,35.0,4742.18,3000.0,Casual Employment,0.0,0.0,0.0659,0.0,4742.18,500.0,663.1633,640.0,MoneySpot,0.0,4486377,0.0,16-01-2023,False,Vehicle Expenses,2023-01-16,Orange,0.0,5383.0,4742.18
0062x00000DJ8yrAAD,0012x00000THen1AAD,Earlwood,NSW,Australia,Loan Paid,Existing Client-Granted Loan Before,0.0,35.2,1691.0807,1.0,0.0,0.0,3.0,1.0,9740.4236,17.0,18.0,0.0,1980.7738,1878.51,0.0,9.02,0.0,0.0,7719.68,899.0,0.0,650,832.0,6.0,5.857,Weekly,32.0,9850.18,650.0,Full-Time Employment,17.0,0.0,0.0,4.0,8583.3533,3840.0,4767.4066,138.67,Financier-2,0.0,4873689,0.0,16-03-2023,False,Living Expenses,2023-03-16,Green,0.0,10631.0,9850.18
0062x00000DW762AAD,0012x00000g8sVqAAI,Prestons,NSW,Australia,Closed Lost,Existing Client-Granted Loan Before,0.0,54.56,1724.5933,2.0,0.0,0.0,3.0,2.0,5695.7145,3.0,0.0,1003.5979,2068.0628,2137.06,1.0,0.0,0.0,0.0,0.0,599.0,1060.0,900,1152.0,3.0,5.429,Fortnightly,27.0,6097.38,900.0,,3.0,0.0,0.011,0.0,4825.48,976.0,2663.1633,384.0,MoneySpot,,4897080,0.0,20-03-2023,False,Veterinary Expenses,2023-03-20,Green,0.0,9932.0,6097.38
0062x00000F2ZNEAA3,0012x00000lgW92AAE,Springfield Lakes,QLD,Australia,Closed Lost,Existing Client-No Loan Granted Ever,5.17,42.58,2298.9799,4.0,0.0,2.0,3.0,4.0,3744.9467,13.0,70.0,0.0,1511.175,1826.01,1.0,0.0,0.0,0.0,0.0,400.0,500.0,800,1088.0,8.0,14.714,Fortnightly,34.0,3744.95,5000.0,full_time,15.0,0.0,0.1758,2.0,3311.95,0.0,2691.4566,136.0,MoneySpot,,6979440,1.0,28-10-2023,False,Medical Expenses,2023-10-27,Orange,338.0,6529.0,3744.95
0062x00000D1bMAAAZ,0012x00000NxchmAAB,Tuart Hill,WA,Australia,Loan Paid,Existing Client-Granted Loan Before,0.0,83.0,280.0,1.0,0.0,0.0,1.0,1.0,3614.9022,0.0,41.0,787.9438,950.769,979.0,0.0,0.0,0.0,1.0,4169.37,899.0,600.0,600,816.0,14.0,14.0,Weekly,40.0,3998.16,600.0,Full-Time Employment,0.0,0.0,0.033,0.0,0.0,326.0,1797.1166,58.29,QuickCash,0.0,4399310,0.0,03-01-2023,False,Home Maintenance & Repairs,2023-01-02,Orange,0.0,5074.0,3998.16
0062x00000ECefaAAD,0012x00000hYn7EAAS,Berwick,VIC,Australia,Loan Paid,Existing Client-Granted Loan Before,0.0,61.18,1732.8133,1.0,0.0,0.0,3.0,1.0,4787.714,0.0,9.0,0.0,901.8308,938.85,0.0,0.0,0.0,1.0,913.0,599.0,530.0,1000,1360.0,16.0,16.143,Weekly,30.0,4787.71,1250.0,Full-Time Employment,0.0,0.0,0.033,0.0,0.0,512.0,1502.2233,85.0,QuickCash,0.0,5891533,0.0,12-07-2023,False,Other Expenses,2023-07-12,Orange,0.0,3847.0,4787.71
0062x00000FV4uVAAT,0012x00000dA8pUAAS,Nunawading,VIC,Australia,Closed Lost,Existing Client-Granted Loan Before,0.27,81.95,640.5589,1.0,0.0,0.0,4.0,1.0,4133.1231,0.0,15.0,0.0,951.1846,932.24,2.0,0.23,0.0,0.0,0.0,400.0,0.0,1000,1520.0,16.0,31.429,Fortnightly,35.0,5945.07,5000.0,,5.0,0.0,0.011,2.0,5784.6033,687.0,4375.49,95.0,MoneySpot,,7563446,5.0,23-12-2023,False,Medical Expenses,2023-12-18,Orange,24.0,8716.0,5945.07
0062x00000DFovaAAD,0012x000003EgwFAAS,Aveley,WA,Australia,Loan Paid,Existing Client-Granted Loan Before,0.0,86.12,470.2981,2.0,0.0,0.0,2.0,2.0,4103.5246,10.0,0.0,470.2982,1888.7457,1830.25,0.0,0.0,0.0,0.0,2816.67,599.0,700.0,1000,1360.0,7.0,14.0,Fortnightly,25.0,4103.52,1000.0,Full-Time Employment,10.0,0.0,0.8462,2.0,4407.0733,469.0,469.01,194.29,QuickCash,0.0,4687947,7.0,15-02-2023,False,Living Expenses,2023-02-15,Orange,0.0,4460.0,4103.52
0062x00000D8x7vAAB,0012x000008K2tCAAS,Padbury,WA,Australia,Loan Paid,Existing Client-Granted Loan Before,0.0,73.13,3891.4614,2.0,0.0,0.0,3.0,2.0,7322.2008,4.0,54.0,422.1088,3336.8928,3997.61,1.0,8.63,0.0,0.0,2600.0,400.0,400.0,1000,1320.0,5.0,10.0,Fortnightly,46.0,7322.2,3000.0,Full-Time Employment,4.0,0.0,0.3626,0.0,7786.0833,2010.0,4012.0966,264.0,QuickCash,0.0,4557171,4.0,26-01-2023,False,Vehicle Expenses,2023-01-26,Green,0.0,7903.0,7322.2
0062x00000DGjGdAAL,0012x00000TtVIXAA3,Hunters Hill,NSW,Australia,Loan Paid,Existing Client-Granted Loan Before,0.0,78.06,2959.1204,2.0,0.0,0.0,4.0,2.0,3807.8726,0.0,38.0,633.1627,1656.4683,1755.53,0.0,0.16,0.0,0.0,4099.46,599.0,500.0,700,1008.0,12.0,23.143,Fortnightly,30.0,4488.86,2250.0,Part-Time Employment,0.0,0.0,0.1538,0.0,3312.9366,583.0,2575.0966,84.0,MoneySpot,0.0,4738168,0.0,23-02-2023,False,Travel Expenses,2023-02-22,Green,0.0,4281.0,4488.86
0062x00000ECz69AAD,0012x00000dbiMFAAY,Bentleigh East,VIC,Australia,Loan Paid,Existing Client-No Loan Granted Ever,0.0,47.08,53.6666,1.0,0.0,0.0,3.0,1.0,4411.3275,3.0,8.0,0.0,871.374,931.87,0.0,50.95,0.0,0.0,0.0,0.0,200.0,600,936.0,36.0,35.857,Weekly,26.0,19605.26,2500.0,Full-time,3.0,0.0,0.0,0.0,1452.29,0.0,416.9366,26.0,MoneySpot,0.0,5911313,0.0,14-07-2023,False,Due to medical emergency need to go back to home for 1 month,2023-07-14,Green,0.0,24520.0,19605.26
0062x00000DHueYAAT,0012x00000dAvLcAAK,Mentone,VIC,Australia,Loan Paid,Existing Client-Granted Loan Before,14.44,58.91,78.8666,2.0,0.0,0.0,3.0,2.0,5229.7883,5.0,10.0,0.0,2344.2325,2401.04,2.0,0.0,0.0,0.0,1295.6,400.0,0.0,1000,1320.0,6.0,12.429,Fortnightly,39.0,7114.05,1000.0,Full-Time Employment,5.0,0.0,1.0,3.0,4534.9433,79.0,175.5333,220.0,MoneySpot,0.0,4807358,1.0,06-03-2023,False,Life Event Expenses,2023-03-06,Orange,594.0,4111.0,7114.05
0062x00000DGpRmAAL,0012x00000Rq4SSAAZ,Melville,WA,Australia,Loan Paid,Existing Client-Granted Loan Before,0.0,23.31,161.3327,1.0,0.0,0.0,3.0,1.0,4172.4437,0.0,11.0,0.0,920.7272,1280.0,1.0,0.0,0.0,0.0,3683.33,400.0,100.0,700,952.0,14.0,13.857,Weekly,39.0,4599.12,700.0,Full-Time Employment,0.0,0.0,0.4835,0.0,3376.0,175.0,344.0533,68.0,Financier-2,0.0,4745173,0.0,24-02-2023,False,Home Maintenance & Repairs,2023-02-23,Green,0.0,9494.0,4599.12
0062x00000D8TpPAAV,0012x00000cLrzcAAC,Eastern Creek,NSW,Australia,Loan Paid,Existing Client-Granted Loan Before,0.0,18.85,627.9934,1.0,0.0,0.0,3.0,1.0,5647.5932,0.0,0.0,644.0354,1299.7207,1517.59,0.0,0.29,0.0,0.0,5200.0,400.0,0.0,1000,1320.0,10.0,10.429,Weekly,67.0,5647.59,2050.0,Full-Time Employment,0.0,0.0,0.0,0.0,5632.1233,627.0,626.9666,132.0,QuickCash,0.0,4535022,0.0,23-01-2023,False,Vehicle Expenses,2023-01-23,Green,0.0,6969.0,5647.59
0062x00000Dti2pAAB,0012x00000fmvdsAAA,Weetangera,ACT,Australia,Loan Paid,Existing Client-No Loan Granted Ever,0.0,56.14,2339.7725,2.0,0.0,0.0,4.0,2.0,4086.5508,1.0,27.0,0.0,1724.9333,1724.93,1.0,0.0,0.0,0.0,0.0,0.0,990.0,600,792.0,5.0,8.857,Fortnightly,26.0,4139.37,600.0,,1.0,0.0,0.2198,1.0,3581.6166,0.0,5142.6233,158.4,MoneySpot,0.0,5338344,0.0,20-05-2023,False,Short Term Loan,2023-05-20,Orange,0.0,6113.0,4139.37
0062x00000DIeg5AAD,0012x00000dyDrHAAU,SLADE POINT,QLD,Australia,Loan Paid,Existing Client-Granted Loan Before,0.0,90.48,1617.6033,0.0,1.0,0.0,0.0,0.0,576.6733,4.0,43.0,37.5808,0.0,0.0,0.0,56.6,1.0,0.0,9533.33,400.0,200.0,800,1056.0,12.0,12.571,Weekly,31.0,12375.88,1000.0,Full-Time Employment,8.0,0.0,0.1209,5.0,0.0,409.0,2717.96,88.0,QuickCash,0.0,4847551,4.0,12-03-2023,False,Life Event Expenses,2023-03-12,Orange,0.0,16346.0,12375.88
0062x00000DGw5sAAD,0012x00000fmkMVAAY,Nickol,WA,Australia,Loan Paid,Existing Client-Granted Loan Before,15.85,50.97,589.7791,1.0,0.0,2.0,4.0,1.0,7600.1487,1.0,12.0,0.0,1403.0833,1584.0,0.0,0.0,0.0,1.0,0.0,599.0,300.0,1000,1320.0,10.0,9.857,Weekly,48.0,7959.29,5000.0,Casual Employment,1.0,0.0,0.4286,0.0,1315.3,590.0,664.1366,132.0,MoneySpot,0.0,4750117,1.0,25-02-2023,False,Vehicle Expenses,2023-02-24,Orange,1315.0,8292.0,7959.29
0062x00000FUaDxAAL,0012x00000n1SW3AAM,North Toowoomba,QLD,Australia,Closed Lost,New Client-New Loan,12.02,62.62,1615.2069,2.0,0.0,4.0,2.0,2.0,6262.1711,0.0,26.0,0.0,2209.9233,1698.32,0.0,0.0,0.0,1.0,0.0,0.0,740.0,1000,1320.0,7.0,12.714,Fortnightly,27.0,6378.84,2000.0,,0.0,0.0,0.0,0.0,828.3333,0.0,1413.6133,188.57,MoneySpot,,7520338,0.0,20-12-2023,False,Family expenses,2023-12-15,Orange,828.0,6883.0,6378.84
0062x00000D8nPfAAJ,0012x00000IOYOHAA5,City Beach,WA,Australia,Loan Paid,Existing Client-Granted Loan Before,0.0,0.0,169.3566,0.0,2.0,0.0,0.0,0.0,0.0,10.0,22.0,89.3986,0.0,0.0,0.0,0.0,0.0,0.0,2166.67,400.0,100.0,1000,1360.0,14.0,14.143,Weekly,30.0,5833.83,2000.0,Full-Time Employment,10.0,0.0,0.1429,4.0,5370.3233,169.0,169.3566,97.14,Financier-2,0.0,4550128,7.0,25-01-2023,False,Relocation Expenses,2023-01-25,Orange,0.0,0.0,5833.83
0062x00000D221mAAB,0010K00002COxygQAD,Newman,WA,Australia,Loan Paid,Existing Client-Granted Loan Before,0.0,95.67,4431.9321,2.0,2.0,0.0,3.0,2.0,6074.9596,7.0,0.0,2066.2728,2796.1471,2799.19,1.0,26.47,0.0,0.0,5416.67,899.0,240.0,800,1088.0,7.0,13.857,Fortnightly,44.0,6988.33,800.0,Full-Time Employment,7.0,0.0,0.4286,3.0,6524.3433,2475.0,4766.03,155.43,QuickCash,0.0,4424112,7.0,06-01-2023,False,Travel Expenses,2023-01-06,Green,0.0,7843.0,6988.33
0062x00000D7HvmAAF,0012x00000fmYK3AAM,Redbank Plains,QLD,Australia,Loan Paid,Existing Client-Granted Loan Before,0.0,79.07,3077.9207,2.0,1.0,0.0,4.0,2.0,9378.5261,4.0,27.0,1518.9594,4190.882,5501.35,0.0,1.17,0.0,0.0,0.0,599.0,1200.0,800,1056.0,5.0,8.857,Fortnightly,47.0,14373.1,800.0,,9.0,0.0,0.0549,4.0,11227.38,1725.0,4718.72,211.2,MoneySpot,0.0,4476361,6.0,14-01-2023,False,Living Expenses,2023-01-14,Green,0.0,10705.0,14373.1
0062x00000EMCsMAAX,0012x00000TtlwGAAR,Norlane,VIC,Australia,Loan Paid,Existing Client-Granted Loan Before,77.92,86.71,1454.6739,4.0,0.0,2.0,3.0,2.0,3699.2211,0.0,30.0,476.06,967.2428,967.9,0.0,1.07,0.0,0.0,2302.36,400.0,820.0,600,816.0,8.0,15.143,Fortnightly,29.0,10547.24,600.0,Unemployed,0.0,0.0,0.0,0.0,9486.73,1404.0,5477.17,102.0,QuickCash,0.0,6086335,0.0,03-08-2023,True,Travel Expenses,2023-08-02,Orange,3845.0,4934.0,10547.24
0062x00000D83jlAAB,0012x00000gAHXPAA4,Andergrove,QLD,Australia,Loan Paid,New Client-New Loan,0.0,6.73,1144.2866,0.0,0.0,0.0,0.0,0.0,0.0,0.0,5.0,0.0,0.0,0.0,1.0,0.2,0.0,0.0,0.0,0.0,700.0,600,768.0,6.0,6.571,Weekly,30.0,7996.88,600.0,,7.0,0.0,0.0,5.0,0.0,631.0,1944.0233,128.0,QuickCash,0.0,4513083,3.0,20-01-2023,False,Education - Uniforms,2023-01-19,Orange,0.0,4945.0,7996.88
0062x00000DIHDFAA5,0012x00000g97ySAAQ,Keysborough,VIC,Australia,Loan Paid,Existing Client-Granted Loan Before,0.0,84.51,2760.5683,1.0,2.0,0.0,3.0,1.0,6521.969,5.0,58.0,702.6363,1500.9463,1527.97,0.0,6.57,1.0,0.0,0.0,599.0,650.0,1000,1320.0,10.0,10.0,Weekly,35.0,6570.3,1000.0,Full-Time Employment,5.0,0.0,0.6593,1.0,5503.47,1795.0,3335.56,132.0,MoneySpot,0.0,4823863,5.0,09-03-2023,False,Travel Expenses,2023-03-08,Orange,0.0,6742.0,6570.3
0062x00000Ey3lzAAB,0012x00000lfKXUAA2,Northam,WA,Australia,Closed Lost,New Client-New Loan,0.0,0.09,0.0,0.0,0.0,0.0,0.0,0.0,36.18,0.0,0.0,0.0,0.0,0.0,0.0,0.12,0.0,0.0,0.0,0.0,1440.0,800,1088.0,7.0,13.714,Fortnightly,45.0,5639.46,4000.0,full_time,6.0,0.0,0.0,1.0,5158.0866,0.0,54.1633,155.43,MoneySpot,,6707469,0.0,06-10-2023,False,Funeral,2023-10-01,Orange,0.0,16703.0,5639.46
0062x00000DAfWkAAL,0012x00000IOsRkAAL,Baldivis,WA,Australia,Loan Paid,Existing Client-Granted Loan Before,8.24,48.26,2758.8686,2.0,0.0,2.0,3.0,2.0,9299.9555,1.0,40.0,818.3938,2425.0816,2425.08,1.0,0.14,0.0,0.0,9574.12,1499.0,480.0,900,1224.0,7.0,13.143,Fortnightly,37.0,9299.96,900.0,Part-Time Employment,1.0,0.0,0.033,1.0,8222.9333,285.0,2787.8633,174.86,MoneySpot,0.0,4640307,1.0,08-02-2023,False,Medical Expenses,2023-02-08,Green,783.0,9496.0,9299.96
0062x00000E7A7IAAV,0012x00000clV2JAAU,Charlestown,NSW,Australia,Closed Lost,Existing Client-No Loan Granted Ever,0.0,51.46,1778.3488,2.0,1.0,0.0,2.0,2.0,5110.5498,11.0,22.0,0.0,2251.76,2410.24,0.0,3.25,0.0,0.0,0.0,599.0,200.0,1000,1360.0,7.0,14.429,Fortnightly,27.0,5610.65,2050.0,Full-Time Employment,11.0,0.0,0.8901,3.0,4503.52,0.0,2225.62,194.29,MoneySpot,,5798715,11.0,02-07-2023,False,Vehicle Expenses,2023-07-01,Green,0.0,5315.0,5610.65
0062x00000EOETSAA5,0012x00000dzVsOAAU,Hinchinbrook,NSW,Australia,Loan Paid,Existing Client-No Loan Granted Ever,32.26,65.82,855.201,2.0,0.0,4.0,2.0,2.0,4387.7871,15.0,42.0,181.2949,975.1028,1320.98,1.0,0.24,0.0,0.0,283.49,899.0,0.0,700,1064.0,17.0,33.857,Fortnightly,25.0,4396.81,2050.0,Unemployed,15.0,0.0,0.8791,3.0,4068.0233,576.0,824.8466,62.59,Financier-2,0.0,6242070,10.0,18-08-2023,False,Child Expenses,2023-08-18,Green,1915.0,5936.0,4396.81
0062x00000DGskhAAD,0012x000003Dp7HAAS,Kuranda,QLD,Australia,Loan Paid,Existing Client-Granted Loan Before,0.0,57.84,626.7367,1.0,0.0,0.0,2.0,1.0,1026.6963,0.0,0.0,682.0,202.5266,150.0,0.0,5.73,0.0,1.0,2513.33,599.0,200.0,1000,1360.0,7.0,13.0,Fortnightly,40.0,6610.99,1000.0,Full-Time Employment,4.0,0.0,0.011,0.0,4370.9233,696.0,696.3333,194.29,QuickCash,0.0,4747837,0.0,24-02-2023,False,Living Expenses,2023-02-24,Orange,0.0,1029.0,6610.99
0062x00000DGQIfAAP,0012x00000d9INAAA2,DEE WHY,NSW,Australia,Closed Lost,Existing Client-No Loan Granted Ever,0.0,91.07,0.0,2.0,0.0,0.0,2.0,2.0,3188.7643,0.0,0.0,0.0,1136.155,1587.82,0.0,2.71,0.0,0.0,0.0,0.0,0.0,800,1088.0,7.0,13.286,Fortnightly,21.0,2535.1,800.0,,0.0,0.0,0.022,0.0,1514.8733,0.0,50.0,155.43,MoneySpot,,4721741,0.0,25-02-2023,False,Other,2023-02-20,Orange,0.0,3025.0,2535.1
0062x00000DV7nzAAD,0012x00000hYIVWAA4,Port Huon,TAS,Australia,Loan Paid,Existing Client-Granted Loan Before,38.01,58.64,3461.9371,4.0,0.0,4.0,5.0,4.0,4675.2793,5.0,25.0,464.1764,633.935,527.27,0.0,16.74,0.0,0.0,507.0,1499.0,1340.0,800,1056.0,10.0,9.857,Weekly,30.0,5743.83,800.0,Part-Time Employment,6.0,0.0,0.0,4.0,3076.86,249.0,3695.7266,105.6,MoneySpot,0.0,5422415,2.0,28-05-2023,True,Home Maintenance & Repairs,2023-05-28,Orange,3077.0,8095.0,5743.83
0062x00000DZxXwAAL,0012x00000g6sJeAAI,Bennett Springs,WA,Australia,Loan Paid,Existing Client-Granted Loan Before,0.0,76.84,7335.5222,2.0,0.0,0.0,1.0,2.0,12435.3056,0.0,34.0,1388.116,3115.4285,3148.0,1.0,1.83,0.0,0.0,6329.67,599.0,0.0,1000,1360.0,7.0,14.143,Fortnightly,29.0,6868.64,2050.0,Full-Time Employment,0.0,0.0,0.0,0.0,7269.3333,2016.0,8727.8533,194.29,MoneySpot,0.0,5126662,0.0,24-04-2023,False,Home Maintenance & Repairs,2023-04-24,Orange,0.0,14193.0,6868.64
0062x00000DGVd9AAH,0012x00000cLZ9TAAW,Croydon South,VIC,Australia,Loan Paid,Existing Client-Granted Loan Before,0.0,76.0,3372.6257,2.0,0.0,0.0,3.0,2.0,5853.2104,0.0,30.0,0.0,2546.43,3208.39,0.0,0.34,0.0,0.0,4766.67,599.0,1070.0,1000,1360.0,7.0,13.286,Fortnightly,40.0,5727.7,1000.0,Full-Time Employment,0.0,0.0,0.0,0.0,5092.86,1041.0,4679.5766,194.29,MoneySpot,0.0,4726088,0.0,21-02-2023,False,Living Expenses,2023-02-21,Green,0.0,7107.0,5727.7
0062x00000FKUKxAAP,0012x00000SHp1AAAT,Leichardt,VIC,Australia,Loan Paid,Existing Client-Granted Loan Before,0.0,45.29,3654.5302,2.0,1.0,0.0,3.0,2.0,6659.3348,28.0,14.0,0.0,2749.0642,2692.92,1.0,0.47,0.0,0.0,3493.4,599.0,1800.0,1000,1360.0,7.0,13.429,Fortnightly,25.0,6659.33,2050.0,Full-Time Employment,41.0,0.0,0.0,12.0,6414.4833,0.0,3679.4433,194.29,MoneySpot,0.0,7394882,27.0,04-12-2023,False,Travel Expenses,2023-12-04,Orange,0.0,7507.0,6659.33
0062x00000DFQh9AAH,0012x00000XOCijAAH,Hillvue,NSW,Australia,Closed Lost,Existing Client-No Loan Granted Ever,0.0,48.16,113.1121,4.0,0.0,0.0,3.0,4.0,2158.6333,1.0,5.0,0.0,719.5444,726.7,1.0,0.0,0.0,0.0,900.0,2000.0,1920.0,1000,1360.0,14.0,14.571,Weekly,27.0,2158.63,5000.0,Full-Time Employment,1.0,0.0,0.044,0.0,2158.6333,0.0,267.9333,97.14,MoneySpot,,4668118,1.0,16-02-2023,False,Living Expenses,2023-02-12,Orange,0.0,2639.0,2158.63
0062x00000DGqulAAD,0012x00000goN0LAAU,Cambooya,QLD,Australia,Loan Paid,New Client-New Loan,0.0,59.83,190.29,2.0,1.0,0.0,1.0,2.0,2954.1999,5.0,17.0,276.7011,1351.4566,1312.02,0.0,0.0,0.0,0.0,0.0,0.0,380.0,1000,1280.0,3.0,5.571,Fortnightly,25.0,2954.2,1800.0,,5.0,0.0,0.3407,2.0,2702.9133,255.0,977.2,426.67,MoneySpot,0.0,4746469,2.0,24-02-2023,False,Moving - Truck hire,2023-02-24,Orange,0.0,3329.0,2954.2
0062x00000FHMVYAA5,0012x00000mHCZtAAO,Homebush West,NSW,Australia,Closed Lost,New Client-New Loan,0.0,90.9,307.9809,1.0,0.0,0.0,2.0,1.0,6340.2248,4.0,7.0,0.0,940.996,1262.26,0.0,0.37,0.0,0.0,950.0,2000.0,250.0,1000,1360.0,15.0,15.429,Weekly,29.0,6606.89,1000.0,Full-Time Employment,4.0,0.0,0.044,4.0,4704.98,0.0,1151.8866,90.67,QuickCash,,7163285,1.0,16-11-2023,False,Vehicle Expenses,2023-11-11,Green,0.0,7620.0,6606.89
0062x00000DZLbxAAH,0012x00000goHA9AAM,Park Avenue,QLD,Australia,Loan Paid,Existing Client-Granted Loan Before,19.21,63.46,261.7641,0.0,0.0,2.0,5.0,2.0,827.9416,1.0,35.0,357.6671,296.94,296.94,1.0,0.0,1.0,0.0,0.0,599.0,1680.0,550,726.0,10.0,10.143,Weekly,38.0,4545.71,550.0,Part-Time Employment,1.0,0.0,0.3736,0.0,762.16,401.0,1006.32,72.6,Financier-2,0.0,5087713,1.0,18-04-2023,True,Living Expenses,2023-04-18,Orange,889.0,4627.0,4545.71
0062x00000DYKMrAAP,0012x00000XBuk7AAD,Lakelands,WA,Australia,Closed Lost,Existing Client-Granted Loan Before,0.0,60.47,3509.9157,2.0,0.0,0.0,3.0,2.0,5961.329,0.0,53.0,661.1843,2743.8457,2559.04,1.0,0.0,0.0,0.0,4838.54,899.0,900.0,800,1024.0,3.0,5.571,Fortnightly,46.0,5966.33,800.0,Full-Time Employment,0.0,0.0,0.7253,0.0,6402.3066,1388.0,4255.09,341.33,MoneySpot,,5027290,0.0,09-04-2023,False,Other Expenses,2023-04-08,Orange,0.0,6902.0,5966.33
0062x00000DGfXLAA1,0012x00000g7y2zAAA,Tarneit,VIC,Australia,Loan Paid,Existing Client-No Loan Granted Ever,0.0,56.63,2982.7445,1.0,0.0,0.0,2.0,1.0,4379.3411,0.0,64.0,325.4583,1079.7041,1452.3,1.0,0.0,0.0,0.0,6500.0,599.0,1000.0,800,1024.0,6.0,6.0,Weekly,30.0,6007.84,2050.0,Full-Time Employment,5.0,0.0,0.011,0.0,4318.8166,250.0,2803.77,170.67,MoneySpot,0.0,4734243,0.0,23-02-2023,False,Relocation Expenses,2023-02-23,Orange,0.0,7108.0,6007.84
0062x00000DXmmsAAD,0012x00000MjicwAAB,Morphett Vale,SA,Australia,Loan Paid,Existing Client-Granted Loan Before,0.0,75.31,4784.0699,4.0,1.0,0.0,3.0,4.0,10128.8265,1.0,29.0,888.96,3940.6,4624.0,0.0,3.97,0.0,0.0,0.0,1499.0,1700.0,1000,1280.0,4.0,7.286,Fortnightly,37.0,10128.83,2050.0,Full-Time Employment,1.0,0.0,0.022,0.0,6567.6666,3167.0,8640.8466,320.0,MoneySpot,0.0,4995351,1.0,04-04-2023,False,Other Expenses,2023-04-04,Orange,0.0,14092.0,10128.83
0062x00000DYGW2AAP,0012x00000hXWLQAA4,Prahran,VIC,Australia,Loan Paid,New Client-New Loan,0.0,45.24,4652.5295,3.0,0.0,0.0,5.0,3.0,6600.6632,0.0,15.0,544.0,6123.9966,6124.0,1.0,0.0,1.0,0.0,6124.0,1499.0,782.0,1000,1320.0,2.0,9.429,Monthly,44.0,6600.66,1000.0,Full-Time Employment,0.0,0.0,0.6593,0.0,6123.9966,0.0,5121.1833,660.0,MoneySpot,0.0,5023936,0.0,08-04-2023,False,Medical Expenses,2023-04-08,Orange,0.0,6751.0,6600.66
0062x00000DI1jxAAD,0012x00000goz0aAAA,Gosford,NSW,Australia,Loan Paid,New Client-New Loan,0.0,64.73,963.1066,4.0,0.0,0.0,5.0,4.0,8071.9113,0.0,14.0,0.0,554.2307,250.0,0.0,0.0,0.0,1.0,5416.67,599.0,960.0,800,1024.0,3.0,5.429,Fortnightly,30.0,8071.91,2000.0,Full-Time Employment,0.0,0.0,0.2198,0.0,3510.3633,0.0,1033.1066,341.33,MoneySpot,0.0,4813131,0.0,07-03-2023,False,Living Expenses,2023-03-06,Orange,0.0,8380.0,8071.91
0062x00000DWDwYAAX,0012x00000L2mYlAAJ,Busby,NSW,Australia,Loan Paid,Existing Client-Granted Loan Before,32.6,68.84,409.6881,2.0,0.0,2.0,3.0,2.0,4629.6608,0.0,6.0,0.0,1287.5,1551.29,0.0,0.85,0.0,0.0,0.0,400.0,450.0,1000,1320.0,5.0,10.286,Fortnightly,41.0,4826.33,2000.0,Casual Employment,0.0,0.0,0.0,0.0,4188.6666,454.0,494.5766,264.0,QuickCash,0.0,4903410,0.0,21-03-2023,False,Home Maintenance & Repairs,2023-03-21,Green,1614.0,4950.0,4826.33
0062x00000DJ68pAAD,0012x00000ADGxYAAX,Byron Bay,NSW,Australia,Loan Paid,Existing Client-Granted Loan Before,0.0,47.63,412.8533,1.0,0.0,0.0,3.0,1.0,6593.4513,0.0,19.0,465.0969,984.93,834.62,0.0,0.0,0.0,0.0,1458.83,400.0,400.0,1000,1280.0,6.0,6.0,Weekly,46.0,11391.99,1000.0,Part-Time Employment,0.0,0.0,0.0659,0.0,984.93,413.0,412.8533,213.33,QuickCash,0.0,4871533,0.0,16-03-2023,False,Medical Expenses,2023-03-15,Green,0.0,5990.0,11391.99
0062x00000EO5xIAAT,0010K00001zGJTsQAO,Larapinta,NT,Australia,Closed Lost,Existing Client-No Loan Granted Ever,19.46,90.94,30.0,4.0,0.0,4.0,2.0,4.0,8668.3927,3.0,3.0,0.0,247.5,500.0,0.0,8.65,0.0,1.0,348.83,400.0,640.0,650,832.0,6.0,6.571,Weekly,24.0,9871.76,650.0,Unemployed,3.0,0.0,0.044,1.0,2952.9133,0.0,65.99,138.67,QuickCash,,6230345,0.0,16-08-2023,False,Home & Improvement,2023-08-16,Orange,2954.0,15178.0,9871.76
0062x00000E3imGAAR,0012x00000iI0hpAAC,Auburn,NSW,Australia,Loan Paid,New Client-New Loan,0.0,79.93,487.351,1.0,0.0,0.0,3.0,1.0,3262.9208,2.0,14.0,0.0,500.07,500.07,0.0,0.0,0.0,0.0,2168.83,400.0,65.0,1000,1280.0,6.0,6.429,Weekly,22.0,3852.25,1000.0,Full-Time Employment,2.0,0.0,0.0549,1.0,2166.97,0.0,411.2466,213.33,QuickCash,0.0,5509221,2.0,05-06-2023,False,Vehicle Expenses,2023-06-05,Green,0.0,6147.0,3852.25
0062x00000E3zd0AAB,0010K00001sw1mrQAA,Ormiston,QLD,Australia,Loan Paid,Existing Client-Granted Loan Before,0.0,48.94,2067.8051,1.0,1.0,0.0,2.0,1.0,3375.9397,5.0,48.0,357.0,776.9292,787.55,1.0,0.0,0.0,0.0,3076.67,400.0,150.0,1000,1360.0,14.0,14.0,Weekly,28.0,3375.94,3200.0,Full-Time Employment,11.0,0.0,0.1758,5.0,3366.6933,1224.0,2015.3466,97.14,MoneySpot,0.0,5531540,6.0,07-06-2023,False,Vehicle Expenses,2023-06-07,Orange,0.0,3367.0,3375.94
0062x00000D7BMvAAN,0012x00000INMmsAAH,Ellenbrook,WA,Australia,Loan Paid,Existing Client-Granted Loan Before,0.0,68.88,33.3333,2.0,0.0,0.0,2.0,2.0,2076.4637,0.0,3.0,0.0,955.7428,1446.97,0.0,0.64,0.0,0.0,2933.67,599.0,150.0,600,792.0,5.0,9.714,Fortnightly,45.0,5775.46,600.0,Casual Employment,0.0,0.0,0.1429,0.0,2230.0666,213.0,302.9766,158.4,QuickCash,0.0,4471133,0.0,13-01-2023,False,Other Expenses,2023-01-13,Green,0.0,5962.0,5775.46
0062x00000DtSV5AAN,0012x00000XBOjbAAH,Raceview,QLD,Australia,Loan Paid,Existing Client-Granted Loan Before,0.0,91.49,301.6905,1.0,0.0,0.0,3.0,1.0,5174.1271,2.0,12.0,0.0,1116.1025,1235.95,0.0,0.0,0.0,0.0,1300.0,1499.0,1000.0,600,816.0,16.0,16.0,Weekly,21.0,5211.73,600.0,Part-Time Employment,2.0,0.0,0.011,0.0,4464.41,0.0,420.6333,51.0,MoneySpot,0.0,5314460,1.0,18-05-2023,False,Living Expenses,2023-05-18,Green,0.0,8044.0,5211.73
0062x00000DtxySAAR,0012x00000OyHHQAA3,Lockridge,WA,Australia,Loan Paid,Existing Client-Granted Loan Before,0.0,70.92,2915.1399,2.0,0.0,0.0,1.0,2.0,3012.8605,5.0,32.0,1820.672,1310.03,1400.42,0.0,0.18,0.0,0.0,1797.38,599.0,0.0,1000,1320.0,7.0,13.0,Fortnightly,56.0,3017.86,2050.0,Full-Time Employment,5.0,0.0,0.011,0.0,2183.3833,1130.0,3323.2333,188.57,MoneySpot,0.0,5362696,4.0,23-05-2023,False,Medical Expenses,2023-05-23,Orange,0.0,2800.0,3017.86
0062x00000FUK4sAAH,0012x00000NxGg7AAF,Shoal Bay,NSW,Australia,Loan Paid,Existing Client-Granted Loan Before,39.69,84.78,351.2333,2.0,0.0,4.0,3.0,2.0,8713.2407,3.0,0.0,0.0,1395.2983,1348.89,0.0,0.0,0.0,0.0,3746.72,1499.0,420.0,750,990.0,7.0,13.0,Fortnightly,36.0,8873.24,750.0,Part-Time Employment,3.0,0.0,0.022,0.0,7880.93,167.0,3199.7533,141.43,Financier-2,0.0,7501323,0.0,14-12-2023,False,Life Event Expenses,2023-12-13,Orange,3521.0,8870.0,8873.24
0062x00000DHwUMAA1,0012x000008ImdaAAC,Bogangar,NSW,Australia,Loan Paid,Existing Client-Granted Loan Before,0.0,17.18,322.8299,2.0,0.0,0.0,4.0,2.0,10998.0408,5.0,12.0,0.0,4721.0516,4549.32,0.0,16.18,0.0,0.0,8125.0,899.0,2800.0,1000,1320.0,6.0,12.571,Fortnightly,39.0,11214.37,1500.0,Full-Time Employment,5.0,0.0,0.0,2.0,9442.1033,189.0,535.8233,220.0,MoneySpot,0.0,4808682,0.0,06-03-2023,False,Living Expenses,2023-03-06,Orange,0.0,11208.0,11214.37
0062x00000DGVcQAAX,0012x00000goB98AAE,St Kilda,VIC,Australia,Loan Paid,New Client-New Loan,0.0,42.32,1568.2202,4.0,0.0,0.0,1.0,4.0,3547.1766,1.0,8.0,0.0,2660.3825,4256.61,0.0,0.0,0.0,0.0,77000.0,2000.0,1477.0,700,896.0,2.0,5.143,Monthly,39.0,3554.18,1200.0,Full-Time Employment,1.0,0.0,0.1429,0.0,3547.1766,0.0,1580.34,448.0,QuickCash,0.0,4726081,1.0,21-02-2023,False,Vehicle Expenses,2023-02-21,Orange,0.0,4720.0,3554.18
0062x00000DXUMDAA5,0012x00000VdTqTAAV,Surrey Hills,VIC,Australia,Loan Paid,Existing Client-Granted Loan Before,0.0,61.56,1963.425,4.0,0.0,0.0,5.0,4.0,7399.2603,0.0,33.0,379.9042,529.0,520.0,0.0,45.47,0.0,1.0,0.0,599.0,0.0,600,768.0,6.0,6.0,Weekly,21.0,11187.08,600.0,,0.0,0.0,0.0,0.0,2463.1866,365.0,1894.25,128.0,MoneySpot,0.0,4975904,0.0,01-04-2023,False,Living Expenses,2023-03-31,Green,0.0,12022.0,11187.08
0062x00000Dtd5QAAR,0012x00000fmRwHAAU,Saint Clair,NSW,Australia,Loan Paid,Existing Client-Granted Loan Before,0.0,71.71,1208.4633,1.0,0.0,0.0,4.0,1.0,7935.4934,1.0,31.0,994.7922,1359.2046,983.7,1.0,10.6,0.0,1.0,0.0,400.0,300.0,1000,1360.0,14.0,14.0,Weekly,34.0,7664.06,2050.0,Full-Time Employment,1.0,0.0,0.022,0.0,0.0,1015.0,1327.3866,97.14,QuickCash,0.0,5328449,0.0,19-05-2023,False,Life Event Expenses,2023-05-19,Orange,0.0,8093.0,7664.06
0062x00000ECd1zAAD,0012x00000KMbJJAA1,South Townsville,QLD,Australia,Loan Paid,Existing Client-Granted Loan Before,0.0,12.74,324.9368,0.0,0.0,0.0,0.0,0.0,0.0,0.0,14.0,0.0,0.0,0.0,1.0,0.0,0.0,0.0,1759.33,400.0,700.0,1000,1400.0,20.0,20.143,Weekly,48.0,6841.37,1000.0,Unemployed,0.0,0.0,0.0,0.0,0.0,335.0,438.3133,70.0,MoneySpot,0.0,5890267,0.0,12-07-2023,False,Vehicle Expenses,2023-07-12,Orange,0.0,6603.0,6841.37
0062x00000GZIkvAAH,0012x00000qSvuQAAS,Fairfield,NSW,Australia,Closed Lost,New Client-New Loan,0.0,31.15,0.0,1.0,0.0,0.0,4.0,1.0,5331.494,0.0,0.0,0.0,1079.6869,1065.66,0.0,0.0,0.0,0.0,0.0,0.0,0.0,800,1088.0,14.0,14.0,Weekly,34.0,5435.33,2000.0,full_time,2.0,0.0,0.0,1.0,4678.6433,0.0,2588.3166,77.71,MoneySpot,,8909738,0.0,2024-04-23,False,birthday,2024-04-19,Orange,0.0,5556.0,5435.33
0062x00000Ex52OAAR,0012x00000SHwWWAA1,Gladstone Park,VIC,Australia,Loan Paid,Existing Client-Granted Loan Before,18.32,56.17,0.0,2.0,0.0,2.0,1.0,2.0,6388.7676,0.0,12.0,0.0,1122.3483,966.0,0.0,0.79,0.0,0.0,184.22,400.0,1565.0,750,1050.0,10.0,20.143,Fortnightly,39.0,12507.08,750.0,Unemployed,0.0,0.0,0.0,0.0,6094.8066,181.0,180.9533,105.0,MoneySpot,0.0,6636454,0.0,25-09-2023,True,Child Expenses,2023-09-25,Orange,4050.0,22098.0,12507.08
0062x00000EypUsAAJ,0012x00000g7vWIAAY,Bayswater,VIC,Australia,Loan Paid,Existing Client-Granted Loan Before,0.0,42.96,1559.1847,4.0,0.0,0.0,3.0,4.0,7794.8866,4.0,40.0,0.0,1062.939,1133.47,0.0,32.52,0.0,0.0,1100.0,1499.0,2000.0,750,960.0,7.0,6.714,Weekly,46.0,9121.55,750.0,Full-Time Employment,4.0,0.0,0.4835,0.0,7794.8866,661.0,1582.9533,137.14,QuickCash,0.0,6765127,2.0,07-10-2023,False,Living Expenses,2023-10-06,Green,0.0,11602.0,9121.55
0062x00000FXhjxAAD,0012x000008KF5eAAG,Long Jetty,NSW,Australia,Loan Paid,Existing Client-Granted Loan Before,18.33,96.96,974.36,1.0,2.0,4.0,1.0,1.0,6524.5853,4.0,4.0,0.0,786.5857,823.0,2.0,42.61,0.0,0.0,0.0,400.0,300.0,1000,1360.0,16.0,16.143,Weekly,39.0,7061.99,1000.0,Full-Time Employment,10.0,0.0,0.022,4.0,5333.5333,862.0,2327.1366,85.0,MoneySpot,0.0,7776903,2.0,2024-01-08,False,Life Event Expenses,2024-01-08,Orange,1663.0,9068.0,7061.99
0062x00000DWksQAAT,0012x00000PwR68AAF,Randwick,NSW,Australia,Loan Paid,Existing Client-Granted Loan Before,0.0,85.69,1586.2047,2.0,0.0,0.0,3.0,2.0,4226.2333,0.0,17.0,0.0,2113.1166,2026.11,0.0,0.0,0.0,1.0,140833.33,400.0,1340.0,900,1188.0,5.0,9.714,Fortnightly,45.0,4276.5,900.0,Full-Time Employment,0.0,0.0,0.7912,0.0,0.0,352.0,1961.98,237.6,Financier-2,0.0,4935409,0.0,26-03-2023,False,Medical Expenses,2023-03-25,Orange,0.0,4263.0,4276.5
0062x00000Ds85dAAB,0012800001WaKEtAAN,Burnside Heights,VIC,Australia,Loan Paid,Existing Client-Granted Loan Before,0.0,30.18,3493.8133,4.0,0.0,0.0,4.0,4.0,11308.0799,0.0,8.0,0.0,8481.0475,5985.2,1.0,0.0,0.0,0.0,4391.8,899.0,1500.0,1000,1320.0,3.0,10.571,Monthly,45.0,11308.08,2050.0,Full-Time Employment,0.0,0.0,0.0,0.0,11308.0633,656.0,4205.72,440.0,QuickCash,0.0,5221045,0.0,08-05-2023,False,Child Expenses,2023-05-08,Orange,0.0,11644.0,11308.08
0062x00000DXIlnAAH,0012x00000RqhUYAAZ,Baldivis,WA,Australia,Loan Paid,Existing Client-Granted Loan Before,13.95,59.04,1241.6086,2.0,0.0,4.0,4.0,2.0,5940.1623,0.0,29.0,1482.3286,2011.7657,1992.62,0.0,36.57,0.0,0.0,3683.33,599.0,100.0,1000,1280.0,3.0,6.0,Fortnightly,33.0,6981.69,1000.0,Full-Time Employment,0.0,0.0,0.9011,0.0,6050.1233,751.0,2846.0333,426.67,QuickCash,0.0,4964660,0.0,30-03-2023,False,Medical Expenses,2023-03-30,Green,1356.0,9716.0,6981.69
0062x00000D8WKeAAN,0012x00000IMkANAA1,Mudgeeraba,QLD,Australia,Closed Lost,Existing Client-No Loan Granted Ever,0.0,31.49,420.7659,4.0,1.0,0.0,4.0,4.0,1906.77,3.0,15.0,0.0,1430.0775,2139.7,0.0,0.0,0.0,0.0,2169.87,899.0,833.0,700,896.0,3.0,5.571,Fortnightly,24.0,2345.1,5000.0,Full-Time Employment,3.0,0.0,0.4286,0.0,1906.77,0.0,668.5033,298.67,MoneySpot,,4536602,3.0,28-01-2023,False,Purchase,2023-01-23,Orange,0.0,2802.0,2345.1
0062x00000ED21RAAT,0012x00000fmdsnAAA,Hampton Park,VIC,Australia,Loan Paid,Existing Client-Granted Loan Before,0.0,67.03,838.1708,1.0,0.0,0.0,4.0,1.0,10874.2956,0.0,20.0,0.0,1462.5545,1532.82,0.0,57.53,0.0,0.0,0.0,599.0,120.0,1000,1360.0,14.0,14.0,Weekly,30.0,12100.13,1000.0,,0.0,0.0,0.5495,0.0,5362.7,525.0,646.4766,97.14,QuickCash,0.0,5913896,0.0,15-07-2023,False,Vehicle Expenses,2023-07-14,Orange,0.0,12680.0,12100.13
0062x00000DG9BtAAL,0012x00000Tra3cAAB,Marangaroo,WA,Australia,Loan Paid,Existing Client-Granted Loan Before,0.0,16.45,1974.1394,1.0,0.0,0.0,3.0,1.0,6489.3643,0.0,42.0,0.0,851.5433,963.0,1.0,0.03,0.0,0.0,10934.76,599.0,500.0,650,936.0,24.0,23.857,Weekly,64.0,3237.64,5000.0,Part-Time Employment,0.0,0.0,0.0,0.0,3406.1733,2019.0,2979.7166,39.0,MoneySpot,0.0,4704776,0.0,20-02-2023,False,Travel Expenses,2023-02-20,Green,0.0,21997.0,3237.64
0062x00000DI5tXAAT,0012x00000goFv1AAE,Karabar,NSW,Australia,Loan Paid,Existing Client-No Loan Granted Ever,0.0,74.03,1984.0941,2.0,0.0,0.0,4.0,2.0,4569.3037,0.0,27.0,900.7143,2024.0471,2036.69,0.0,0.0,0.0,0.0,0.0,899.0,400.0,800,1024.0,3.0,5.429,Fortnightly,43.0,4651.23,1500.0,,0.0,0.0,0.0,0.0,4722.7766,124.0,3128.2666,341.33,QuickCash,0.0,4816199,0.0,07-03-2023,False,Living Expenses,2023-03-07,Orange,0.0,5280.0,4651.23
0062x00000DAR22AAH,0012x00000LQhKqAAL,Manly,QLD,Australia,Loan Paid,Existing Client-Granted Loan Before,0.0,87.13,5481.1782,1.0,0.0,0.0,4.0,1.0,6857.8,6.0,127.0,1438.1227,1623.15,1623.15,1.0,0.0,0.0,0.0,0.0,899.0,1880.0,1000,1360.0,14.0,14.571,Weekly,33.0,6171.35,1000.0,,6.0,0.0,0.3297,3.0,6492.6,1241.0,5600.96,97.14,QuickCash,0.0,4629459,4.0,06-02-2023,False,Travel Expenses,2023-02-06,Orange,0.0,8275.0,6171.35
0062x00000EcuBfAAJ,0010K00001mD2OYQA0,Regents Park,QLD,Australia,Loan Paid,Existing Client-Granted Loan Before,0.0,93.78,2963.8503,2.0,0.0,0.0,3.0,2.0,4347.2051,28.0,53.0,0.0,1876.9828,1807.72,0.0,0.0,0.0,0.0,3250.0,400.0,495.0,750,1020.0,7.0,14.0,Fortnightly,35.0,4077.97,750.0,Full-Time Employment,28.0,0.0,0.033,0.0,4379.6266,890.0,3654.4733,145.71,MoneySpot,0.0,6384578,8.0,31-08-2023,False,Home Maintenance & Repairs,2023-08-31,Orange,0.0,5427.0,4077.97
0062x00000EyJoeAAF,0012x00000VfUkxAAF,Coffs Harbour,NSW,Australia,Loan Paid,Existing Client-Granted Loan Before,0.0,45.05,1052.3268,1.0,0.0,0.0,2.0,1.0,7227.3796,3.0,34.0,0.0,857.2781,61.52,0.0,0.0,0.0,0.0,2120.51,400.0,200.0,1000,1360.0,16.0,16.143,Weekly,34.0,5416.73,1000.0,Part-Time Employment,3.0,0.0,0.0,3.0,4701.6733,857.0,1095.9,85.0,MoneySpot,0.0,6726985,2.0,03-10-2023,False,Life Event Expenses,2023-10-03,Green,0.0,5694.0,5416.73
0062x00000FJrftAAD,0012x00000dyHcpAAE,Beecroft,NSW,Australia,Loan Paid,Existing Client-Granted Loan Before,0.0,49.4,3162.3938,2.0,0.0,0.0,5.0,2.0,8803.2132,0.0,10.0,0.0,4051.89,4601.21,0.0,0.0,0.0,0.0,4000.0,899.0,900.0,1000,1360.0,8.0,15.143,Fortnightly,33.0,8109.11,2050.0,Contract Employment,0.0,0.0,0.033,0.0,8103.78,672.0,3058.4233,170.0,QuickCash,0.0,7353532,0.0,30-11-2023,False,Other Expenses,2023-11-29,Orange,0.0,11054.0,8109.11
0062x00000D1dpiAAB,0012x00000TsnwbAAB,Woombye,QLD,Australia,Loan Paid,Existing Client-Granted Loan Before,0.0,83.56,2123.7554,2.0,1.0,0.0,2.0,2.0,3442.607,3.0,6.0,158.4,1584.5433,1539.29,0.0,0.0,0.0,1.0,1685.0,400.0,1500.0,1000,1360.0,7.0,14.143,Fortnightly,51.0,3457.77,1000.0,Casual Employment,3.0,0.0,1.0,0.0,0.0,1021.0,2593.5166,194.29,Financier-2,0.0,4401910,3.0,03-01-2023,False,Vehicle Expenses,2023-01-03,Orange,0.0,3184.0,3457.77
0062x00000D9UjJAAV,0012800001SDTxNAAX,Carlton,VIC,Australia,Loan Paid,Existing Client-Granted Loan Before,0.0,49.37,1376.1533,3.0,0.0,0.0,5.0,3.0,4555.6925,0.0,17.0,952.8375,4299.2925,5512.79,1.0,0.98,0.0,0.0,0.0,1500.0,1390.0,800,1088.0,4.0,16.571,Monthly,47.0,6058.79,800.0,Full-Time Employment,0.0,0.0,0.8791,0.0,5816.39,846.0,3025.78,272.0,MoneySpot,0.0,4585167,0.0,31-01-2023,False,Living Expenses,2023-01-30,Green,0.0,6559.0,6058.79
0062x00000DXClOAAX,0012x00000RrGdKAAV,Wilsonton Heights,QLD,Australia,Loan Paid,Existing Client-Granted Loan Before,0.0,92.0,3155.7317,2.0,0.0,0.0,3.0,2.0,6610.0078,8.0,66.0,510.4105,1901.2428,1820.66,1.0,0.0,0.0,0.0,0.0,599.0,600.0,550,704.0,4.0,8.0,Fortnightly,35.0,4130.67,1600.0,,8.0,0.0,0.011,2.0,4436.2333,1831.0,3958.5833,176.0,MoneySpot,0.0,4960284,5.0,30-03-2023,False,Veterinary Expenses,2023-03-29,Green,0.0,6923.0,4130.67
0062x00000DJBeRAAX,0012x00000gpZ5lAAE,Maylands,WA,Australia,Loan Paid,New Client-New Loan,0.0,46.2,1544.5312,2.0,0.0,0.0,2.0,2.0,4224.0703,0.0,13.0,0.0,2043.65,2447.0,0.0,0.0,0.0,0.0,1900.0,2000.0,1400.0,550,704.0,3.0,4.857,Fortnightly,35.0,4224.07,550.0,Full-Time Employment,0.0,0.0,0.1209,0.0,3406.0833,0.0,1666.6866,234.67,QuickCash,0.0,4875580,0.0,16-03-2023,False,Living Expenses,2023-03-16,Orange,0.0,4130.0,4224.07
0062x00000DZg13AAD,0012x00000hYJw8AAG,Bushland Beach,QLD,Australia,Closed Lost,New Client-New Loan,0.69,45.65,554.76,1.0,0.0,0.0,4.0,1.0,5890.3366,1.0,30.0,0.0,1359.3084,100.0,4.0,0.0,0.0,1.0,0.0,0.0,200.0,600,768.0,3.0,6.143,Fortnightly,39.0,5890.34,2000.0,,1.0,0.0,0.044,0.0,0.0,0.0,565.6366,256.0,MoneySpot,,5107002,0.0,21-04-2023,False,Purchase - White Good/s,2023-04-20,Orange,46.0,6575.0,5890.34
0062x00000DYKdlAAH,0012x00000dB9EIAA0,QUEANBEYAN,NSW,Australia,Loan Paid,Existing Client-Granted Loan Before,0.0,11.1,517.0163,2.0,0.0,0.0,4.0,2.0,7204.5186,6.0,18.0,0.0,3059.8333,3175.0,1.0,0.0,0.0,0.0,8666.67,400.0,1400.0,1000,1280.0,5.0,8.714,Fortnightly,55.0,6676.33,2000.0,Full-Time Employment,10.0,0.0,0.7473,2.0,6119.6666,0.0,501.2733,256.0,QuickCash,0.0,5028633,9.0,09-04-2023,False,Other,2023-04-09,Orange,0.0,6762.0,6676.33
0062x00000DG4tCAAT,0012x00000gnw4yAAA,Burpengary,QLD,Australia,Loan Paid,New Client-New Loan,0.0,78.33,1024.3025,4.0,0.0,0.0,3.0,4.0,4578.2498,0.0,17.0,0.0,1019.5555,806.0,0.0,0.0,0.0,0.0,0.0,0.0,732.0,1000,1360.0,14.0,13.857,Weekly,23.0,4663.25,7000.0,Full-Time Employment,0.0,0.0,0.033,0.0,3058.6666,0.0,1181.7366,97.14,MoneySpot,0.0,4701928,0.0,17-02-2023,False,Wedding,2023-02-17,Orange,0.0,5038.0,4663.25
0062x00000D9Z67AAF,0012x00000XL4cMAAT,Home Hill,QLD,Australia,Loan Paid,Existing Client-Granted Loan Before,0.0,64.08,689.5738,0.0,0.0,0.0,0.0,0.0,76.77,0.0,0.0,422.1088,0.0,0.0,0.0,0.0,0.0,0.0,3033.33,899.0,0.0,1000,1360.0,7.0,14.143,Fortnightly,23.0,8282.62,1000.0,Part-Time Employment,1.0,0.0,0.011,1.0,1653.69,453.0,1046.88,194.29,MoneySpot,0.0,4588443,0.0,31-01-2023,False,Veterinary Expenses,2023-01-31,Orange,0.0,892.0,8282.62
0062x00000EyuhBAAR,0012x00000lg1VOAAY,Warnbro,WA,Australia,Closed Lost,Existing Client-No Loan Granted Ever,0.0,63.19,196.3366,1.0,0.0,0.0,5.0,1.0,3193.2659,0.0,7.0,0.0,676.6466,699.5,0.0,2.33,0.0,0.0,3033.33,899.0,400.0,1000,1320.0,10.0,10.0,Weekly,19.0,3193.27,1000.0,Full-Time Employment,0.0,0.0,0.3077,0.0,2706.5866,0.0,196.3366,132.0,MoneySpot,,6771231,0.0,08-10-2023,False,Medical Expenses,2023-10-07,Green,0.0,3561.0,3193.27
0062x00000ELVwMAAX,0012x00000kfcSuAAI,Glen Iris,WA,Australia,Closed Lost,New Client-New Loan,0.0,69.2,1041.7899,1.0,0.0,0.0,3.0,1.0,3042.0709,1.0,19.0,0.0,519.5591,612.29,0.0,0.0,0.0,0.0,800.0,2000.0,0.0,850,1292.0,35.0,34.857,Weekly,22.0,3186.67,2050.0,Part-Time Employment,1.0,0.0,0.0,1.0,2078.2366,0.0,1040.2066,36.91,MoneySpot,,6038052,1.0,28-07-2023,False,Vehicle Expenses,2023-07-28,Green,0.0,3979.0,3186.67
0062x00000EbzPQAAZ,0012x00000hZhBzAAK,Woongarrah,NSW,Australia,Loan Paid,Existing Client-Granted Loan Before,0.0,68.65,785.0332,1.0,0.0,0.0,1.0,1.0,10292.8946,4.0,30.0,0.0,1688.3333,1780.0,0.0,0.59,0.0,1.0,6933.33,899.0,1200.0,1000,1360.0,16.0,16.571,Weekly,30.0,11551.89,2050.0,Part-Time Employment,4.0,0.0,0.6593,0.0,0.0,421.0,856.34,85.0,MoneySpot,0.0,6324746,2.0,25-08-2023,False,Medical Expenses,2023-08-25,Orange,0.0,6994.0,11551.89
0062x00000DVCboAAH,0012x00000iHI3oAAG,Auburn,NSW,Australia,Closed Lost,New Client-New Loan,0.0,72.24,0.0,2.0,0.0,0.0,3.0,2.0,3814.821,1.0,5.0,0.0,1212.2033,825.85,0.0,0.0,0.0,0.0,0.0,0.0,420.0,1000,1320.0,6.0,12.429,Fortnightly,20.0,3864.82,8000.0,part-time,1.0,0.0,0.0769,0.0,2424.4066,0.0,105.0,220.0,MoneySpot,,5429160,0.0,02-06-2023,False,Tuition Fees,2023-05-29,Orange,0.0,5502.0,3864.82
0062x00000ExiMpAAJ,0012x00000ckx3vAAA,SEAFORD,VIC,Australia,Loan Paid,Existing Client-Granted Loan Before,0.28,39.11,1326.2108,1.0,0.0,0.0,4.0,1.0,4783.2077,0.0,57.0,289.1321,996.793,1242.26,1.0,0.74,0.0,0.0,4649.67,1499.0,600.0,1000,1320.0,13.0,13.0,Weekly,28.0,4504.64,1000.0,Full-Time Employment,0.0,0.0,0.0,0.0,4319.4366,1071.0,1462.3,101.54,QuickCash,0.0,6682361,0.0,29-09-2023,False,Living Expenses,2023-09-29,Orange,14.0,4871.0,4504.64
0062x00000FV9vDAAT,0012x00000goRA0AAM,Berri,SA,Australia,Loan Paid,Existing Client-Granted Loan Before,0.31,67.78,2441.819,2.0,0.0,0.0,4.0,2.0,9609.1688,0.0,40.0,0.0,2172.1871,2524.07,1.0,1.59,0.0,0.0,1840.0,400.0,0.0,1000,1360.0,16.0,16.0,Weekly,53.0,9164.35,2050.0,Full-Time Employment,0.0,0.0,0.0,0.0,8743.1433,693.0,3785.8533,85.0,MoneySpot,0.0,7568730,0.0,19-12-2023,False,Life Event Expenses,2023-12-19,Orange,32.0,10160.0,9164.35
0062x00000D9O4UAAV,0010K00001vIw5iQAC,Augustine Heights,QLD,Australia,Loan Paid,Existing Client-No Loan Granted Ever,0.0,85.94,0.0,4.0,0.0,0.0,2.0,4.0,2384.4866,0.0,9.0,0.0,715.346,957.58,0.0,0.08,0.0,0.0,3466.67,0.0,350.0,700,896.0,6.0,6.286,Weekly,31.0,2449.49,2000.0,Full-Time Employment,0.0,0.0,0.4176,0.0,2384.4866,0.0,0.0,149.33,MoneySpot,0.0,4580047,0.0,30-01-2023,False,Car maintenance,2023-01-30,Orange,0.0,3730.0,2449.49
0062x00000D8Q6RAAV,0010K00001fdjSSQAY,Wagaman,NT,Australia,Loan Paid,Existing Client-Granted Loan Before,0.0,78.45,2059.8901,2.0,0.0,0.0,4.0,2.0,5446.7033,0.0,41.0,1314.8024,2506.9771,2398.09,0.0,0.0,0.0,0.0,4225.0,599.0,100.0,700,952.0,7.0,13.571,Fortnightly,32.0,6155.31,1000.0,Full-Time Employment,0.0,0.0,0.0,0.0,5849.6133,715.0,3090.23,136.0,QuickCash,0.0,4532366,0.0,23-01-2023,False,Medical Expenses,2023-01-22,Orange,0.0,10034.0,6155.31
0062x00000FVU4dAAH,0012x00000WVS9qAAH,Riverton,WA,Australia,Loan Paid,Existing Client-Granted Loan Before,0.0,37.74,1576.809,2.0,0.0,0.0,3.0,2.0,9226.2855,0.0,15.0,0.0,2211.43,2433.7,0.0,0.94,0.0,0.0,4008.33,899.0,100.0,1000,1360.0,7.0,14.0,Fortnightly,41.0,9226.29,2050.0,Full-Time Employment,0.0,0.0,0.6593,0.0,2211.43,874.0,1538.01,194.29,MoneySpot,0.0,7595395,0.0,21-12-2023,False,Vehicle Expenses,2023-12-21,Orange,0.0,8230.0,9226.29
0062x00000DG3UWAA1,0012x00000gnvYVAAY,Molendinar,QLD,Australia,Loan Paid,New Client-New Loan,28.57,31.17,555.4137,1.0,0.0,2.0,2.0,1.0,6013.0802,0.0,7.0,0.0,918.5261,696.33,0.0,0.0,0.0,0.0,0.0,0.0,600.0,1000,1280.0,6.0,5.714,Weekly,41.0,6018.08,1000.0,,0.0,0.0,0.0,0.0,5656.58,0.0,548.45,213.33,QuickCash,0.0,4700995,0.0,17-02-2023,False,Medical - Dental,2023-02-16,Green,1676.0,5865.0,6018.08
0062x00000EwJv1AAF,0012800001b2W4OAAU,Coorparoo,QLD,Australia,Loan Paid,Existing Client-Granted Loan Before,0.0,63.27,2508.3698,3.0,0.0,0.0,4.0,3.0,5846.4732,3.0,18.0,0.0,4721.9966,4722.0,1.0,3.61,0.0,0.0,4353.0,1499.0,1451.66,1000,1360.0,4.0,16.857,Monthly,43.0,6099.81,1000.0,Full-Time Employment,3.0,0.0,0.011,0.0,5846.4733,0.0,2675.0366,340.0,MoneySpot,0.0,6579047,0.0,21-09-2023,False,Life Event Expenses,2023-09-21,Orange,0.0,7315.0,6099.81
0062x00000DAOdtAAH,0012x00000IOtU9AAL,Manjimup,WA,Australia,Loan Paid,Existing Client-Granted Loan Before,0.63,35.33,1843.9627,2.0,0.0,2.0,1.0,2.0,3036.7695,2.0,45.0,337.7554,1330.4883,1434.31,0.0,0.01,0.0,0.0,4420.0,1500.0,1200.0,1000,1360.0,7.0,13.143,Fortnightly,45.0,10240.44,1800.0,Part-Time Employment,2.0,0.0,0.0659,1.0,2795.4966,337.0,2804.9333,194.29,MoneySpot,0.0,4627968,1.0,06-02-2023,False,Education - School Fees,2023-02-06,Orange,183.0,28669.0,10240.44
0062x00000FXnwxAAD,0012x00000GbOPsAAN,Purga,QLD,Australia,Closed Lost,Existing Client-Granted Loan Before,2.12,48.99,1115.0293,1.0,0.0,0.0,3.0,1.0,9980.7607,0.0,33.0,587.4327,2296.9423,376.0,0.0,0.45,0.0,0.0,3856.67,899.0,1200.0,1000,1320.0,10.0,10.286,Weekly,34.0,10902.43,1750.0,Full-Time Employment,0.0,0.0,0.0,0.0,9953.4166,1152.0,1152.47,132.0,MoneySpot,,7786913,0.0,2024-01-13,False,Veterinary Expenses,2024-01-09,Orange,311.0,14642.0,10902.43
0062x00000D7csSAAR,0012x00000fmFexAAE,Park Holme,SA,Australia,Closed Lost,Existing Client-No Loan Granted Ever,19.39,77.56,705.2367,1.0,0.0,4.0,1.0,1.0,4721.4837,7.0,13.0,0.0,832.4569,909.01,1.0,0.0,0.0,0.0,0.0,899.0,290.0,600,768.0,6.0,6.0,Weekly,52.0,5684.68,600.0,,8.0,0.0,0.022,4.0,4655.78,0.0,894.9433,128.0,MoneySpot,,4492700,2.0,20-01-2023,False,Medical Expenses,2023-01-16,Orange,1048.0,5404.0,5684.68
0062x00000DZzhtAAD,0012x00000hYV03AAG,Unley,SA,Australia,Closed Lost,Existing Client-No Loan Granted Ever,0.0,58.91,608.7668,1.0,0.0,0.0,2.0,1.0,3898.6272,3.0,28.0,257.2018,771.8707,252.18,1.0,0.0,0.0,0.0,0.0,400.0,800.0,700,896.0,6.0,6.429,Weekly,28.0,3898.63,700.0,Full-time,3.0,0.0,0.022,1.0,3344.7733,237.0,692.0133,149.33,MoneySpot,,5128191,2.0,24-04-2023,False,Medical Expenses,2023-04-24,Orange,0.0,4112.0,3898.63
0062x00000D7NqdAAF,0012x00000SG4ftAAD,Tallygaroopna,VIC,Australia,Loan Paid,Existing Client-Granted Loan Before,0.0,77.22,5128.4414,2.0,2.0,0.0,4.0,2.0,4433.3901,8.0,27.0,881.4041,1746.0,1746.0,1.0,8.03,0.0,0.0,1700.0,899.0,0.0,1000,1360.0,7.0,13.714,Fortnightly,30.0,4433.39,1000.0,Full-Time Employment,10.0,0.0,0.1538,5.0,4340.6666,156.0,6025.8333,194.29,MoneySpot,0.0,4481521,8.0,15-01-2023,False,Vehicle Expenses,2023-01-15,Orange,0.0,6913.0,4433.39
0062x00000DFLIbAAP,0012x00000g8n6TAAQ,Broome,WA,Australia,Loan Paid,Existing Client-Granted Loan Before,0.0,69.29,847.8234,2.0,1.0,0.0,1.0,2.0,5135.1429,2.0,17.0,0.0,1848.8333,1272.75,1.0,0.0,0.0,1.0,0.0,400.0,2600.0,1000,1360.0,7.0,13.429,Fortnightly,34.0,5135.14,1000.0,Full-Time Employment,3.0,0.0,0.2747,2.0,0.0,341.0,1802.1466,194.29,MoneySpot,0.0,4662359,3.0,11-02-2023,False,Living Expenses,2023-02-11,Green,0.0,6596.0,5135.14
0062x00000DsTMTAA3,0012x00000fmbqGAAQ,Stuart,QLD,Australia,Loan Paid,Existing Client-Granted Loan Before,0.0,17.75,867.5658,1.0,0.0,0.0,2.0,1.0,4396.1847,0.0,30.0,139.9601,1011.7253,778.52,0.0,0.0,0.0,0.0,0.0,400.0,1424.0,800,1088.0,14.0,13.857,Weekly,46.0,4396.18,4000.0,Full-Time Employment,0.0,0.0,0.0769,0.0,4384.1433,562.0,1633.85,77.71,MoneySpot,0.0,5243207,0.0,11-05-2023,False,Vehicle Expenses,2023-05-11,Orange,0.0,4384.0,4396.18
0062x00000D6yJHAAZ,0012800001SCUwwAAH,North Toowoomba,QLD,Australia,Loan Paid,Existing Client-Granted Loan Before,0.18,53.73,2849.2222,1.0,0.0,0.0,2.0,1.0,6440.0374,0.0,66.0,554.546,1093.2138,1232.0,0.0,33.54,0.0,0.0,3206.67,1499.0,200.0,550,748.0,14.0,13.857,Weekly,43.0,6623.37,550.0,Full-Time Employment,0.0,0.0,0.0,0.0,4737.26,1043.0,3471.1833,53.43,MoneySpot,0.0,4461809,0.0,12-01-2023,False,Life Event Expenses,2023-01-11,Green,13.0,6959.0,6623.37
0062x00000DZMydAAH,0012x00000XMfMqAAL,Neutral Bay,NSW,Australia,Loan Paid,Existing Client-Granted Loan Before,0.0,70.27,1985.7083,1.0,0.0,0.0,3.0,1.0,6656.1563,0.0,54.0,846.6021,1078.4992,972.36,1.0,0.0,0.0,0.0,4587.91,599.0,1240.0,1000,1360.0,14.0,14.286,Weekly,39.0,6606.49,2050.0,Full-Time Employment,0.0,0.0,0.0549,0.0,5032.9966,1204.0,1657.6233,97.14,MoneySpot,0.0,5088543,0.0,18-04-2023,False,Home Maintenance & Repairs,2023-04-18,Orange,0.0,7420.0,6606.49
0062x00000D9rCIAAZ,0012x00000KM6GuAAL,Wagaman,NT,Australia,Closed Lost,Existing Client-No Loan Granted Ever,0.0,21.44,2117.8954,2.0,0.0,0.0,2.0,2.0,3848.6395,0.0,10.0,0.0,1605.73,1570.33,0.0,0.0,0.0,0.0,3683.33,400.0,150.0,700,896.0,3.0,5.857,Fortnightly,55.0,3848.64,5000.0,Full-Time Employment,0.0,0.0,0.5275,0.0,3746.7033,0.0,2155.5633,298.67,MoneySpot,,4601915,0.0,06-02-2023,False,Medical Expenses,2023-02-02,Orange,0.0,4239.0,3848.64
0062x00000EdIRuAAN,0012x00000TGyr2AAD,Nambucca Heads,NSW,Australia,Loan Paid,Existing Client-Granted Loan Before,0.0,93.01,782.75,2.0,0.0,0.0,2.0,2.0,3160.611,2.0,22.0,0.0,1454.7475,1798.45,0.0,0.0,0.0,0.0,2686.16,599.0,1000.0,750,1020.0,7.0,13.429,Fortnightly,22.0,4315.6,1000.0,Full-Time Employment,2.0,0.0,0.1099,0.0,1939.6633,295.0,999.77,145.71,QuickCash,0.0,6413238,0.0,03-09-2023,False,Life Event Expenses,2023-09-03,Orange,0.0,3340.0,4315.6
0062x00000D7LaJAAV,0012x00000g9wK4AAI,Chinchilla,QLD,Australia,Loan Paid,New Client-New Loan,0.0,72.29,858.006,2.0,0.0,0.0,3.0,2.0,5483.355,0.0,25.0,0.0,2247.528,2575.0,1.0,3.42,0.0,0.0,3900.0,400.0,0.0,600,768.0,3.0,6.571,Fortnightly,37.0,5931.69,600.0,Full-Time Employment,0.0,0.0,0.022,0.0,3745.88,418.0,1221.26,256.0,MoneySpot,0.0,4479344,0.0,15-01-2023,False,Vehicle Expenses,2023-01-14,Orange,0.0,5939.0,5931.69
0062x00000D7TD0AAN,0012x00000WXL5IAAX,North Fremantle,WA,Australia,Loan Paid,Existing Client-Granted Loan Before,0.0,46.16,965.2636,3.0,0.0,0.0,2.0,3.0,1032.11,0.0,21.0,422.1108,999.31,1102.83,2.0,0.03,0.0,1.0,29146.65,400.0,840.0,1000,1280.0,3.0,5.857,Weekly,36.0,19810.2,2000.0,Full-Time Employment,1.0,0.0,0.6264,1.0,0.0,389.0,888.5733,426.67,MoneySpot,0.0,4485646,0.0,16-01-2023,False,Vehicle Expenses,2023-01-15,Green,0.0,21260.0,19810.2
0062x00000DIbJDAA1,0012x000003CefdAAC,Buff Point,NSW,Australia,Loan Paid,Existing Client-Granted Loan Before,3.87,82.13,5782.9632,2.0,0.0,0.0,2.0,2.0,5060.4241,5.0,25.0,0.0,2246.4857,4200.3,0.0,2.24,0.0,0.0,3466.67,899.0,0.0,850,1122.0,5.0,9.857,Fortnightly,43.0,5495.55,850.0,Full-Time Employment,7.0,0.0,0.0,0.0,5241.8,1051.0,6114.2766,224.4,Financier-2,0.0,4842727,5.0,11-03-2023,False,Medical Expenses,2023-03-11,Orange,254.0,6554.0,5495.55
0062x00000DWOOIAA5,0012x00000civK4AAI,Leda,WA,Australia,Loan Paid,Existing Client-Granted Loan Before,6.33,48.95,2027.3362,1.0,0.0,4.0,2.0,1.0,13664.709,4.0,54.0,132.0,845.723,1033.12,2.0,0.05,0.0,0.0,346666.67,400.0,200.0,1000,1320.0,10.0,10.0,Weekly,28.0,16298.28,2050.0,Full-Time Employment,4.0,0.0,0.2088,1.0,7327.39,1433.0,1895.5233,132.0,MoneySpot,0.0,4913081,0.0,22-03-2023,False,Home Maintenance & Repairs,2023-03-22,Orange,1068.0,16860.0,16298.28
0062x00000E5J3GAAV,0012x00000NQrRxAAL,West End,QLD,Australia,Loan Paid,Existing Client-Granted Loan Before,0.33,19.96,746.1207,1.0,0.0,2.0,4.0,1.0,6661.1956,1.0,28.0,0.0,860.65,866.48,0.0,33.86,0.0,0.0,4333.33,599.0,100.0,1000,1400.0,18.0,17.857,Weekly,23.0,8619.53,2050.0,Casual Employment,1.0,0.0,0.0,1.0,5264.9333,1440.0,1942.9266,77.78,MoneySpot,0.0,5641395,0.0,17-06-2023,False,Medical Expenses,2023-06-17,Orange,33.0,9915.0,8619.53
0062x00000D8t8gAAB,0010K00001vipggQAA,Lavington,NSW,Australia,Loan Paid,Existing Client-Granted Loan Before,0.0,58.5,2125.4122,4.0,0.0,0.0,1.0,4.0,9452.7578,0.0,59.0,1829.0327,694.7716,674.15,0.0,2.65,0.0,0.0,3683.33,899.0,1000.0,700,952.0,14.0,14.143,Weekly,57.0,10419.28,700.0,Full-Time Employment,0.0,0.0,0.0549,0.0,7633.02,1357.0,2818.2233,68.0,MoneySpot,0.0,4554932,0.0,26-01-2023,False,Travel Expenses,2023-01-26,Orange,0.0,10888.0,10419.28
0062x00000EbEKJAA3,0012x000002dFNAAA2,Sussex Inlet,NSW,Australia,Closed Lost,Existing Client-Granted Loan Before,0.0,48.19,2151.4652,1.0,0.0,0.0,4.0,1.0,5725.1497,0.0,51.0,263.4952,1317.5692,1065.95,0.0,0.97,0.0,0.0,0.0,400.0,165.0,1000,1360.0,14.0,14.571,Weekly,39.0,5725.15,2050.0,,0.0,0.0,0.3187,0.0,5709.4666,1375.0,2756.76,97.14,MoneySpot,,6278120,0.0,25-08-2023,False,Vehicle Expenses,2023-08-20,Orange,0.0,6289.0,5725.15
0062x00000D9h3zAAB,0012x00000g7tSxAAI,Narre Warren,VIC,Australia,Closed Lost,Existing Client-No Loan Granted Ever,0.0,28.91,1949.25,1.0,0.0,0.0,3.0,1.0,4566.7127,0.0,28.0,0.0,1050.97,1316.77,0.0,0.0,0.0,1.0,0.0,899.0,2001.0,1000,1280.0,6.0,6.143,Weekly,39.0,16550.23,3500.0,,0.0,0.0,0.0,0.0,0.0,0.0,1949.25,213.33,MoneySpot,,4594318,0.0,05-02-2023,False,Vehicle Expenses,2023-02-01,Green,0.0,5559.0,16550.23
0062x00000DHQJEAA5,0012x00000IOLYZAA5,Saint Andrews,NSW,Australia,Loan Paid,Existing Client-Granted Loan Before,14.14,54.38,1329.1134,2.0,0.0,2.0,3.0,2.0,6182.1291,0.0,46.0,814.2321,2089.605,2326.83,0.0,11.09,1.0,0.0,0.0,400.0,1000.0,1000,1360.0,7.0,14.143,Fortnightly,49.0,6272.45,1000.0,Full-Time Employment,0.0,0.0,0.0,0.0,5138.7733,857.0,1335.77,194.29,QuickCash,0.0,4777331,0.0,01-03-2023,False,Vehicle Expenses,2023-03-01,Green,960.0,6788.0,6272.45
0062x00000FhYyhAAF,0012x00000gnZpyAAE,Kangaroo Flat,VIC,Australia,Loan Paid,Existing Client-Granted Loan Before,0.0,60.61,369.9214,1.0,0.0,0.0,4.0,1.0,8818.7002,2.0,27.0,0.0,1370.05,1212.6,0.0,50.19,0.0,0.0,0.0,400.0,0.0,1000,1360.0,14.0,14.143,Weekly,24.0,14605.83,1000.0,Full-Time Employment,2.0,0.0,0.0,2.0,6393.5666,389.0,420.8466,97.14,MoneySpot,0.0,7906739,0.0,2024-01-18,False,Living Expenses,2024-01-18,Orange,0.0,16709.0,14605.83
0062x00000DInnxAAD,0012x00000RrqOhAAJ,Muswellbrook,NSW,Australia,Loan Paid,Existing Client-No Loan Granted Ever,20.04,61.98,48.0461,1.0,0.0,2.0,4.0,1.0,5727.9258,0.0,1.0,0.0,341.1123,355.76,0.0,0.0,0.0,0.0,0.0,899.0,800.0,1000,1280.0,6.0,6.571,Weekly,38.0,5628.84,1000.0,Full-Time Employment,0.0,0.0,0.0,0.0,3056.6966,0.0,67.99,213.33,MoneySpot,0.0,4855622,0.0,13-03-2023,False,Life Event Expenses,2023-03-13,Green,1592.0,7941.0,5628.84
0062x00000DtffpAAB,0012x00000G2nQQAAZ,Kingston,QLD,Australia,Loan Paid,Existing Client-Granted Loan Before,0.0,98.35,3949.7018,2.0,1.0,0.0,3.0,2.0,5216.7985,3.0,45.0,862.9827,1896.23,2132.31,0.0,2.81,0.0,0.0,1258.0,599.0,100.0,800,1056.0,7.0,12.714,Fortnightly,27.0,6073.69,2050.0,Full-Time Employment,4.0,0.0,0.0549,2.0,4532.06,1413.0,3886.45,150.86,MoneySpot,0.0,5335017,4.0,20-05-2023,False,Vehicle Expenses,2023-05-19,Orange,0.0,5866.0,6073.69
0062x00000D7kjYAAR,0012x000002boMrAAI,Collingwood Park,QLD,Australia,Loan Paid,Existing Client-Granted Loan Before,0.0,44.91,1866.5844,1.0,6.0,0.0,2.0,1.0,6683.1209,26.0,0.0,337.6919,967.2941,537.88,9.0,0.83,0.0,1.0,2600.0,599.0,205.0,800,1088.0,14.0,14.0,Weekly,25.0,6584.79,800.0,Part-Time Employment,29.0,0.0,0.1209,10.0,0.0,571.0,2256.0566,77.71,MoneySpot,0.0,4498349,13.0,18-01-2023,False,Life Event Expenses,2023-01-17,Green,0.0,6349.0,6584.79
0062x00000D6oHQAAZ,0010K00001rIh83QAC,Kawungan,QLD,Australia,Loan Paid,Existing Client-Granted Loan Before,0.0,70.5,1647.6045,1.0,0.0,0.0,2.0,1.0,4380.5176,5.0,56.0,728.4982,1097.78,1380.55,1.0,0.0,0.0,0.0,2925.0,400.0,200.0,1000,1360.0,14.0,14.0,Weekly,47.0,4380.52,1500.0,Full-Time Employment,5.0,0.0,0.011,0.0,4391.12,1274.0,1795.6366,97.14,MoneySpot,0.0,4454219,5.0,11-01-2023,False,Vehicle Expenses,2023-01-10,Orange,0.0,4631.0,4380.52
0062x00000DHB6qAAH,0012x000002cQFUAA2,Deloraine,TAS,Australia,Loan Paid,Existing Client-No Loan Granted Ever,0.0,51.55,4987.6554,4.0,0.0,0.0,2.0,4.0,6113.8666,0.0,89.0,748.8867,2292.7,2261.6,1.0,0.0,0.0,1.0,0.0,400.0,0.0,1000,1280.0,3.0,5.286,Fortnightly,25.0,7547.2,5000.0,,0.0,0.0,0.2637,0.0,0.0,720.0,5230.77,426.67,MoneySpot,0.0,4764846,0.0,03-03-2023,False,"Maintenance,Computers, laptops and phones",2023-03-03,Orange,0.0,11356.0,7547.2
0062x00000DHjaLAAT,0012x00000WphIeAAJ,Moorooka,QLD,Australia,Loan Paid,Existing Client-Granted Loan Before,0.59,33.99,4430.111,4.0,0.0,4.0,3.0,4.0,8706.5499,0.0,30.0,0.0,2214.1087,2352.92,0.0,0.0,0.0,0.0,0.0,1499.0,2000.0,800,1088.0,7.0,13.857,Fortnightly,48.0,8706.55,800.0,Full-Time Employment,0.0,0.0,0.0,0.0,8504.8033,709.0,4634.64,155.43,MoneySpot,0.0,4793295,0.0,03-03-2023,False,Medical Expenses,2023-03-03,Green,53.0,8943.0,8706.55
0062x00000D9AnCAAV,0012x00000GdpQzAAJ,SEVEN HILLS,NSW,Australia,Closed Lost,Existing Client-No Loan Granted Ever,15.8,95.82,2458.4799,4.0,0.0,2.0,5.0,4.0,5588.2366,0.0,16.0,286.0613,3785.34,5409.28,0.0,2.39,0.0,0.0,2458.39,899.0,0.0,600,768.0,2.0,6.571,Monthly,46.0,4899.63,600.0,Full-Time Employment,0.0,0.0,0.978,0.0,4600.4566,377.0,3006.74,384.0,MoneySpot,,4568831,0.0,28-01-2023,False,Other,2023-01-27,Orange,815.0,5156.0,4899.63
0062x00000DXLk3AAH,0010K00001xhwFzQAI,Merimbula,NSW,Australia,Loan Paid,Existing Client-Granted Loan Before,0.0,62.6,3808.1186,2.0,1.0,0.0,2.0,2.0,11081.3476,8.0,72.0,1055.3895,2128.31,2128.31,5.0,0.0,0.0,0.0,3250.0,599.0,0.0,1000,1320.0,5.0,9.714,Fortnightly,45.0,11081.35,2050.0,Full-Time Employment,15.0,0.0,0.0879,7.0,8513.24,965.0,4328.42,264.0,MoneySpot,0.0,4967975,10.0,31-03-2023,False,Living Expenses,2023-03-30,Orange,0.0,11766.0,11081.35
0062x00000DHm17AAD,0012x00000fmBq1AAE,Hinchinbrook,NSW,Australia,Loan Paid,Existing Client-No Loan Granted Ever,7.02,35.94,2017.2421,2.0,0.0,2.0,3.0,2.0,6037.3979,0.0,75.0,398.7408,2547.018,2680.67,1.0,0.0,0.0,0.0,2300.0,1499.0,900.0,800,1024.0,3.0,5.714,Fortnightly,29.0,6037.4,1050.0,Full-Time Employment,0.0,0.0,0.1978,0.0,4631.43,877.0,2630.96,341.33,MoneySpot,0.0,4797940,0.0,04-03-2023,False,Living Expenses,2023-03-04,Orange,475.0,6765.0,6037.4
0062x00000DX9UaAAL,0012x000003CuxdAAC,Boronia Heights,QLD,Australia,Loan Paid,Existing Client-Granted Loan Before,46.26,73.41,1981.604,1.0,0.0,2.0,4.0,1.0,7082.2008,0.0,52.0,0.0,723.1653,881.29,1.0,0.41,0.0,0.0,0.0,899.0,400.0,1000,1320.0,9.0,9.286,Weekly,31.0,7082.2,1000.0,Casual Employment,5.0,0.0,0.5385,1.0,6516.1133,535.0,2398.17,146.67,MoneySpot,0.0,4956898,3.0,29-03-2023,False,Travel Expenses,2023-03-29,Orange,3196.0,6908.0,7082.2
0062x00000EdwNdAAJ,0012x00000ha521AAA,Riverstone,NSW,Australia,Loan Paid,Existing Client-Granted Loan Before,0.0,71.37,0.0,4.0,0.0,0.0,1.0,4.0,14134.909,0.0,13.0,0.0,346.5423,15.0,0.0,0.27,0.0,1.0,3033.33,599.0,500.0,700,952.0,16.0,15.857,Weekly,32.0,14357.83,700.0,Part-Time Employment,0.0,0.0,0.022,0.0,3230.4933,176.0,176.0,59.5,MoneySpot,0.0,6451756,0.0,07-09-2023,False,Furniture or Appliances,2023-09-07,Green,0.0,16046.0,14357.83
0062x00000DYuM1AAL,0012x00000NxGFVAA3,australia,QLD,Australia,Loan Paid,Existing Client-No Loan Granted Ever,0.0,86.47,0.0,2.0,0.0,0.0,3.0,2.0,4474.8679,0.0,12.0,0.0,1842.57,1022.88,0.0,0.0,0.0,0.0,0.0,0.0,800.0,800,1024.0,3.0,5.857,Fortnightly,37.0,8432.46,1500.0,,0.0,0.0,0.0,0.0,2456.76,368.0,368.0,341.33,MoneySpot,0.0,5060134,0.0,14-04-2023,False,Other,2023-04-14,Orange,0.0,5170.0,8432.46
0062x00000FKRqCAAX,0012x000003Bu0jAAC,Riverwood,NSW,Australia,Loan Paid,Existing Client-Granted Loan Before,0.0,59.61,1683.1701,2.0,0.0,0.0,3.0,2.0,4764.3183,0.0,27.0,0.0,1943.85,1806.56,0.0,0.35,0.0,0.0,4766.67,1500.0,550.0,700,924.0,6.0,11.429,Fortnightly,39.0,4822.32,700.0,Part-Time Employment,0.0,0.0,0.0,0.0,4701.48,0.0,1807.68,154.0,MoneySpot,0.0,7392596,0.0,04-12-2023,False,Once off purchase,2023-12-04,Green,0.0,5685.0,4822.32
0062x00000DHfHAAA1,0012x00000g9xaKAAQ,Forestdale,QLD,Australia,Loan Paid,Existing Client-Granted Loan Before,35.59,26.36,688.492,4.0,0.0,1.0,4.0,4.0,6178.2835,0.0,6.0,0.0,1247.2728,2587.3,0.0,0.49,0.0,0.0,2925.0,400.0,1200.0,1000,1320.0,7.0,13.0,Fortnightly,42.0,6178.28,1000.0,Contract Employment,1.0,0.0,0.011,0.0,5186.5333,213.0,1180.5433,188.57,QuickCash,0.0,4790273,0.0,03-03-2023,False,Living Expenses,2023-03-03,Green,2343.0,6583.0,6178.28
0062x00000DUcrFAAT,0012x00000iGuSHAA0,Scarborough,WA,Australia,Loan Paid,New Client-New Loan,0.0,31.72,0.0,4.0,0.0,0.0,3.0,4.0,677.6666,0.0,0.0,0.0,677.6666,304.0,0.0,100.0,0.0,1.0,0.0,0.0,1000.0,1000,1320.0,3.0,12.0,Monthly,37.0,11648.89,1000.0,,0.0,0.0,0.1429,0.0,7565.53,0.0,882.7533,440.0,QuickCash,0.0,5376998,0.0,24-05-2023,False,Subsistence,2023-05-24,Orange,0.0,4327.0,11648.89
0062x00000E49rqAAB,0012x00000hXXBLAA4,Werrington,NSW,Australia,Loan Paid,Existing Client-Granted Loan Before,0.0,15.36,3103.6864,1.0,0.0,0.0,3.0,1.0,17621.3349,20.0,106.0,724.2917,2822.4684,2880.87,0.0,0.95,0.0,0.0,0.0,599.0,2040.0,1000,1400.0,10.0,19.0,Fortnightly,37.0,17627.51,2050.0,Full-Time Employment,20.0,0.0,0.0,6.0,17436.85,546.0,4218.42,140.0,QuickCash,0.0,5543931,0.0,08-06-2023,False,Travel Expenses,2023-06-08,Orange,0.0,17722.0,17627.51
0062x00000DGwG7AAL,0012x00000gAFC1AAO,Gray,NT,Australia,Loan Paid,Existing Client-Granted Loan Before,3.85,61.23,1595.0263,2.0,0.0,0.0,3.0,2.0,4469.2938,3.0,11.0,149.33,680.25,535.24,0.0,0.0,0.0,0.0,0.0,400.0,1600.0,750,1020.0,7.0,13.714,Fortnightly,43.0,9261.93,750.0,,15.0,0.0,0.0,5.0,6078.9166,776.0,1776.9666,145.71,QuickCash,0.0,4750264,0.0,25-02-2023,False,Living Expenses,2023-02-24,Green,190.0,4926.0,9261.93
0062x00000DsoHgAAJ,0012x00000gpImpAAE,Hurstville,NSW,Australia,Loan Paid,Existing Client-No Loan Granted Ever,0.0,86.12,2199.5349,2.0,0.0,0.0,3.0,2.0,6037.0382,0.0,18.0,96.0,1905.7616,1801.81,0.0,0.09,0.0,0.0,0.0,400.0,500.0,1000,1280.0,3.0,6.571,Fortnightly,27.0,5973.86,1000.0,,0.0,0.0,0.022,0.0,4912.89,105.0,3072.9266,426.67,MoneySpot,0.0,5266796,0.0,14-05-2023,False,Living Expenses,2023-05-13,Orange,0.0,7589.0,5973.86
0062x00000Eelx9AAB,0012x00000WVFWxAAP,Fortitude Valley,QLD,Australia,Loan Paid,Existing Client-Granted Loan Before,2.39,35.13,545.8333,3.0,0.0,4.0,5.0,3.0,7107.4493,0.0,0.0,0.0,4722.0,4722.0,1.0,0.0,0.0,1.0,4200.0,899.0,400.0,1000,1360.0,4.0,16.0,Monthly,33.0,7107.45,1000.0,Full-Time Employment,0.0,0.0,0.0,0.0,66.8666,0.0,666.1866,340.0,MoneySpot,0.0,6516344,0.0,14-09-2023,False,Living Expenses,2023-09-13,Orange,211.0,8818.0,7107.45
0062x00000D2ITDAA3,0012x00000g9WLlAAM,Hampton Park,VIC,Australia,Loan Paid,New Client-New Loan,0.0,68.78,1099.5424,2.0,0.0,0.0,3.0,2.0,4644.1288,1.0,60.0,522.4863,1470.3214,825.75,1.0,1.27,0.0,0.0,0.0,0.0,780.0,650,832.0,3.0,5.571,Fortnightly,22.0,4594.46,650.0,,1.0,0.0,0.0769,1.0,4076.5633,40.0,1625.2166,277.33,QuickCash,0.0,4438334,1.0,09-01-2023,False,Vehicle Expense,2023-01-09,Orange,0.0,8364.0,4594.46
0062x00000DXW8jAAH,0012x00000XB4vRAAT,Kirwan,QLD,Australia,Loan Paid,Existing Client-Granted Loan Before,0.0,88.24,5672.8632,2.0,0.0,0.0,4.0,2.0,6815.0062,10.0,69.0,960.4795,3136.77,3136.77,1.0,0.0,0.0,0.0,6273.54,1499.0,800.0,1000,1280.0,4.0,7.857,Fortnightly,41.0,6815.01,2050.0,Full-Time Employment,10.0,0.0,1.0,0.0,7319.13,2074.0,6249.7566,320.0,MoneySpot,0.0,4978459,2.0,01-04-2023,False,Vehicle Expenses,2023-04-01,Green,0.0,7494.0,6815.01
0062x00000DIjWPAA1,0012x00000dblLnAAI,Aratula,QLD,Australia,Loan Paid,Existing Client-Granted Loan Before,0.0,41.5,1863.7039,2.0,0.0,0.0,4.0,2.0,4679.0962,0.0,25.0,0.0,2153.6666,1990.0,0.0,0.0,0.0,0.0,4369.33,1499.0,1400.0,1000,1320.0,5.0,10.571,Fortnightly,39.0,5145.1,2500.0,Full-Time Employment,0.0,0.0,0.0,0.0,4307.3333,1076.0,1617.42,264.0,MoneySpot,0.0,4852734,0.0,13-03-2023,False,Relocation Expenses,2023-03-13,Orange,0.0,5550.0,5145.1
0062x00000DFoPYAA1,0012x00000VeO4tAAF,Gosford,NSW,Australia,Loan Paid,Existing Client-No Loan Granted Ever,0.0,33.11,282.1332,1.0,0.0,0.0,1.0,1.0,3072.9268,1.0,0.0,238.1914,467.6157,526.72,0.0,0.0,0.0,0.0,2787.49,899.0,1120.0,600,816.0,14.0,13.857,Weekly,54.0,3072.93,1000.0,Part-Time Employment,1.0,0.0,0.0,0.0,2182.2066,219.0,806.6866,58.29,QuickCash,0.0,4687590,0.0,15-02-2023,False,Vehicle Repairs & Maintenance,2023-02-15,Orange,0.0,3252.0,3072.93
0062x00000DWj4JAAT,0012x00000hWfZ5AAK,Saint Marys,NSW,Australia,Loan Paid,New Client-New Loan,0.0,0.0,0.0,0.0,0.0,0.0,0.0,0.0,0.0,0.0,10.0,0.0,0.0,0.0,0.0,100.0,0.0,0.0,0.0,0.0,300.0,900,1152.0,6.0,5.714,Weekly,23.0,2800.62,900.0,,1.0,0.0,0.022,0.0,2792.9533,0.0,0.0,192.0,QuickCash,0.0,4933019,0.0,25-03-2023,False,Other,2023-03-25,Orange,0.0,0.0,2800.62
0062x00000DWQqiAAH,0012x00000VcrLSAAZ,Holden Hill,SA,Australia,Loan Paid,Existing Client-No Loan Granted Ever,0.0,54.4,445.15,1.0,0.0,0.0,3.0,1.0,3337.636,0.0,8.0,695.4055,768.1138,773.67,0.0,0.1,0.0,0.0,3900.0,599.0,250.0,1000,1280.0,6.0,6.0,Weekly,28.0,4238.82,1000.0,Full-Time Employment,0.0,0.0,0.011,0.0,3328.4933,469.0,563.2966,213.33,MoneySpot,0.0,4916354,0.0,23-03-2023,False,Home Maintenance & Repairs,2023-03-23,Green,0.0,5257.0,4238.82
0062x00000D8aIlAAJ,0012x00000dziEgAAI,Homebush,NSW,Australia,Loan Paid,Existing Client-No Loan Granted Ever,4.66,78.01,973.1266,1.0,0.0,0.0,2.0,1.0,4314.1351,1.0,5.0,0.0,923.1875,906.05,0.0,3.25,0.0,0.0,3466.67,599.0,450.0,800,1024.0,6.0,6.143,Weekly,27.0,5107.47,2000.0,Part-Time Employment,1.0,0.0,0.033,0.0,3692.75,0.0,1126.46,170.67,MoneySpot,0.0,4540372,1.0,24-01-2023,False,Other Expenses,2023-01-24,Orange,250.0,5357.0,5107.47
0062x00000D8A29AAF,0010K000026MhNdQAK,Saint Marys,NSW,Australia,Loan Paid,Existing Client-Granted Loan Before,48.63,49.04,422.0951,1.0,0.0,4.0,4.0,1.0,5493.3537,1.0,16.0,0.0,629.3687,825.62,0.0,0.0,0.0,0.0,2058.33,400.0,390.0,1000,1360.0,14.0,14.0,Weekly,37.0,8574.87,1000.0,Unemployed,1.0,0.0,0.011,0.0,4456.1066,447.0,446.6666,97.14,Financier-2,0.0,4517429,0.0,20-01-2023,False,Living Expenses,2023-01-20,Orange,2778.0,5712.0,8574.87
0062x00000FTrYzAAL,0012x00000lH2SGAA0,Brunswick,VIC,Australia,Loan Paid,Existing Client-Granted Loan Before,0.0,56.08,199.6093,1.0,0.0,0.0,3.0,1.0,3425.8823,2.0,25.0,0.0,656.1757,657.9,0.0,0.0,0.0,0.0,660.0,400.0,364.8,1000,1440.0,24.0,24.429,Weekly,25.0,3504.22,1000.0,Part-Time Employment,2.0,0.0,0.0,0.0,3062.1533,220.0,974.14,60.0,QuickCash,0.0,7463191,0.0,11-12-2023,False,Living Expenses,2023-12-11,Green,0.0,3501.0,3504.22
0062x00000EdQSBAA3,0012x00000lGjUjAAK,Rockbank,VIC,Australia,Closed Lost,New Client-New Loan,0.0,79.29,369.3452,2.0,0.0,0.0,3.0,2.0,3821.7068,1.0,2.0,0.0,1536.0,1536.0,0.0,7.45,0.0,0.0,1530.0,2000.0,450.0,800,1216.0,17.0,33.571,Fortnightly,22.0,4104.76,5000.0,Full-Time Employment,1.0,0.0,0.0879,1.0,2048.0,0.0,170.0,71.53,MoneySpot,,6420473,0.0,04-09-2023,False,Vehicle Expenses,2023-09-04,Green,0.0,5286.0,4104.76
0062x00000EeQR1AAN,0012x00000XOf1oAAD,Cashmere,QLD,Australia,Loan Paid,Existing Client-Granted Loan Before,0.0,52.54,2062.249,2.0,0.0,0.0,3.0,2.0,6026.1619,0.0,36.0,0.0,2268.665,2134.3,1.0,9.36,0.0,0.0,4397.99,599.0,800.0,750,1020.0,7.0,14.429,Fortnightly,34.0,5001.69,750.0,Full-Time Employment,0.0,0.0,0.8352,0.0,4537.33,226.0,2457.4366,145.71,QuickCash,0.0,6487051,0.0,11-09-2023,False,Life Event Expenses,2023-09-11,Green,0.0,6189.0,5001.69
0062x00000DsnvkAAB,0012800001EkAf1AAF,Bathurst,NSW,Australia,Loan Paid,Existing Client-Granted Loan Before,20.09,59.79,7310.5671,2.0,0.0,4.0,4.0,2.0,8377.4587,3.0,0.0,576.0,1915.6971,2098.16,1.0,0.0,0.0,1.0,5200.0,599.0,300.0,1000,1360.0,7.0,13.714,Fortnightly,36.0,10523.84,2050.0,Full-Time Employment,3.0,0.0,0.0,0.0,2661.9133,3934.0,7861.4733,194.29,QuickCash,0.0,5266066,1.0,14-05-2023,False,Medical Expenses,2023-05-13,Orange,2837.0,14117.0,10523.84
0062x00000FVbFJAA1,0012x000003CxzrAAC,Raceview,QLD,Australia,Loan Paid,Existing Client-Granted Loan Before,31.88,43.66,345.077,2.0,0.0,4.0,2.0,2.0,8449.8323,0.0,15.0,0.0,1824.98,1843.08,0.0,27.72,0.0,0.0,0.0,899.0,800.0,800,1056.0,7.0,12.714,Fortnightly,48.0,8449.83,1000.0,,0.0,0.0,0.0,0.0,5876.48,383.0,1147.9133,150.86,QuickCash,0.0,7605131,0.0,22-12-2023,False,Other Expenses,2023-12-22,Orange,3222.0,10105.0,8449.83
0062x00000D7WOuAAN,0012x00000dc3E4AAI,Sadliers Crossing,QLD,Australia,Closed Lost,Existing Client-Granted Loan Before,0.0,82.54,1501.6456,2.0,1.0,0.0,3.0,2.0,4610.4548,6.0,9.0,0.0,1555.3828,1535.12,0.0,0.0,0.0,0.0,0.0,400.0,640.0,900,1188.0,5.0,9.429,Fortnightly,44.0,4610.45,900.0,Full-Time Employment,11.0,0.0,0.3187,4.0,3938.3933,440.0,1826.6066,237.6,MoneySpot,,4487778,10.0,21-01-2023,False,Living Expenses,2023-01-16,Green,0.0,4932.0,4610.45
0062x00000DIbWpAAL,0012x00000gpGHvAAM,Marrickville,NSW,Australia,Loan Paid,New Client-New Loan,0.0,27.51,993.0236,2.0,0.0,0.0,3.0,2.0,8906.7594,0.0,0.0,82.82,2899.8833,2991.7,1.0,0.53,0.0,1.0,0.0,0.0,1200.0,1000,1280.0,3.0,4.714,Fortnightly,35.0,8777.01,1000.0,,0.0,0.0,0.011,0.0,0.0,298.0,963.9133,426.67,QuickCash,0.0,4842955,0.0,11-03-2023,False,Medical - Dental,2023-03-11,Orange,0.0,9046.0,8777.01
0062x00000DZp9IAAT,0012x00000hYOg7AAG,Cranebrook,NSW,Australia,Loan Paid,New Client-New Loan,0.04,73.13,390.88,4.0,0.0,0.0,4.0,4.0,4766.4349,4.0,18.0,0.0,718.6163,810.28,0.0,18.72,0.0,0.0,0.0,0.0,50.0,600,768.0,6.0,5.857,Weekly,28.0,5452.67,600.0,,4.0,0.0,0.011,4.0,2634.9266,132.0,522.88,128.0,QuickCash,0.0,5116403,0.0,22-04-2023,False,Home Purchase,2023-04-22,Orange,4.0,9548.0,5452.67
0062x00000DXcM6AAL,0012x00000hXATWAA4,Yamanto,QLD,Australia,Closed Lost,New Client-New Loan,0.0,26.67,171.0937,2.0,0.0,0.0,2.0,2.0,4783.1969,1.0,4.0,0.0,1022.1016,875.76,0.0,0.0,0.0,0.0,0.0,0.0,1200.0,700,896.0,3.0,5.143,Fortnightly,28.0,4891.53,2500.0,,1.0,0.0,0.8022,0.0,4402.5366,0.0,180.0,298.67,MoneySpot,,4986831,0.0,07-04-2023,False,Moving - Bond,2023-04-02,Orange,0.0,5611.0,4891.53
0062x00000DYDNTAA5,0012x00000RpuBUAAZ,Coomera,QLD,Australia,Loan Paid,Existing Client-Granted Loan Before,30.93,92.15,2740.7846,1.0,0.0,4.0,3.0,1.0,5190.4113,14.0,60.0,1087.8399,903.7033,905.56,0.0,0.0,0.0,0.0,2162.33,599.0,300.0,950,1216.0,8.0,7.857,Weekly,32.0,5178.96,2050.0,Casual Employment,14.0,0.0,0.3956,4.0,5281.47,1085.0,2771.2066,152.0,MoneySpot,0.0,5017926,14.0,08-04-2023,False,Furniture or Appliances,2023-04-08,Green,1667.0,5389.0,5178.96
0062x00000DIGyJAAX,0012x00000gmeJUAAY,Stanthorpe,QLD,Australia,Loan Paid,Existing Client-No Loan Granted Ever,0.0,93.79,0.0,1.0,1.0,0.0,2.0,1.0,6072.6418,3.0,3.0,0.0,1197.8914,973.13,0.0,0.0,0.0,0.0,0.0,1499.0,600.0,1000,1280.0,6.0,5.857,Weekly,53.0,6949.84,1000.0,Full-Time Employment,3.0,0.0,0.0989,0.0,5590.16,114.0,114.0966,213.33,MoneySpot,0.0,4823603,3.0,09-03-2023,False,Vehicle Expenses,2023-03-09,Green,0.0,6344.0,6949.84
0062x00000D7dc1AAB,0012x00000g8xNhAAI,Pakenham,VIC,Australia,Loan Paid,Existing Client-Granted Loan Before,0.0,84.53,153.3333,4.0,0.0,0.0,2.0,4.0,4159.9733,5.0,14.0,426.68,928.392,1175.9,0.0,0.0,0.0,0.0,0.0,400.0,1000.0,1000,1320.0,10.0,10.143,Weekly,28.0,3094.64,2000.0,Full-Time Employment,5.0,0.0,0.0989,2.0,3094.64,71.0,422.9533,132.0,QuickCash,0.0,4493157,0.0,17-01-2023,False,Other Expenses,2023-01-17,Green,0.0,5556.0,3094.64
0062x00000D937XAAR,0012x00000fpL79AAE,South Gundagai,NSW,Australia,Loan Paid,Existing Client-No Loan Granted Ever,0.0,71.6,640.5506,2.0,0.0,0.0,1.0,2.0,4659.0824,0.0,24.0,0.0,1919.0414,1858.72,1.0,0.0,0.0,0.0,4489.8,899.0,250.0,750,960.0,3.0,5.571,Fortnightly,36.0,5624.28,750.0,Full-Time Employment,0.0,0.0,0.3516,0.0,5177.7633,358.0,519.1833,320.0,MoneySpot,0.0,4562247,0.0,27-01-2023,False,Travel Expenses,2023-01-27,Green,0.0,8908.0,5624.28
0062x00000DZ1ZdAAL,0010K000021FMQtQAO,Goonellabah,NSW,Australia,Loan Paid,Existing Client-Granted Loan Before,0.0,54.88,5084.5795,4.0,0.0,0.0,4.0,4.0,8860.9149,0.0,43.0,531.9006,3569.41,4134.74,1.0,0.0,0.0,0.0,6578.0,1499.0,1200.0,1000,1280.0,4.0,6.857,Fortnightly,41.0,10232.64,2050.0,Full-Time Employment,0.0,0.0,0.0,0.0,8328.6233,3075.0,5957.2066,320.0,MoneySpot,0.0,5067308,0.0,15-04-2023,False,Travel Expenses,2023-04-15,Orange,0.0,10799.0,10232.64
0062x00000DJ9n6AAD,0012x00000gpYIGAA2,Moruya,NSW,Australia,Loan Paid,New Client-New Loan,0.23,41.8,1066.185,2.0,2.0,0.0,3.0,2.0,7128.3405,2.0,42.0,158.4,3280.99,2843.91,1.0,0.0,0.0,0.0,0.0,0.0,210.0,600,768.0,3.0,5.0,Fortnightly,45.0,10719.75,600.0,Full-Time Employment,8.0,0.0,0.1758,2.0,5468.3166,776.0,1759.5766,256.0,QuickCash,0.0,4874392,11.0,16-03-2023,False,Vehicle - Repairs,2023-03-16,Orange,29.0,12431.0,10719.75
0062x00000DYAc6AAH,0010K0000280SXnQAM,Morawa,WA,Australia,Loan Paid,Existing Client-Granted Loan Before,5.66,78.81,1579.3033,2.0,3.0,2.0,4.0,2.0,3748.1345,6.0,32.0,769.302,1158.8516,1013.82,0.0,0.0,0.0,0.0,3250.0,400.0,740.0,600,768.0,4.0,7.0,Fortnightly,41.0,3345.39,2050.0,Casual Employment,6.0,0.0,0.5055,4.0,2903.3933,788.0,1780.8266,192.0,MoneySpot,0.0,5016453,5.0,07-04-2023,False,Travel Expenses,2023-04-07,Green,210.0,3704.0,3345.39
0062x00000DGey0AAD,0012x00000g9iUXAAY,Ryde,NSW,Australia,Loan Paid,Existing Client-Granted Loan Before,0.0,30.85,213.0,1.0,0.0,0.0,3.0,1.0,3547.124,0.0,9.0,0.0,788.2866,829.99,1.0,0.0,0.0,0.0,624.0,1499.0,0.0,1000,1360.0,14.0,14.143,Weekly,36.0,5868.48,1000.0,Self Employed,0.0,0.0,0.0879,0.0,788.2866,256.0,441.0,97.14,QuickCash,0.0,4733961,0.0,22-02-2023,False,Living Expenses,2023-02-22,Green,0.0,3231.0,5868.48
0062x00000FV9XuAAL,0012x00000kZzH7AAK,Emerald,QLD,Australia,Loan Paid,Existing Client-Granted Loan Before,13.34,49.84,788.5133,4.0,0.0,2.0,2.0,4.0,4783.1273,4.0,8.0,0.0,1745.7728,2007.27,0.0,0.0,0.0,0.0,0.0,599.0,1440.0,1000,1360.0,8.0,15.143,Fortnightly,36.0,4783.13,1750.0,,4.0,0.0,0.6813,0.0,4726.7466,108.0,936.4666,170.0,QuickCash,0.0,7568384,1.0,19-12-2023,False,Home Maintenance & Repairs,2023-12-19,Orange,653.0,4893.0,4783.13
0062x00000DrozXAAR,0012x00000gnZbqAAE,44 high street,NSW,Australia,Closed Lost,Existing Client-Granted Loan Before,0.0,77.9,3033.4166,1.0,0.0,0.0,3.0,1.0,7641.1247,1.0,72.0,1310.9382,750.1138,917.09,0.0,0.15,0.0,0.0,3534.69,400.0,400.0,1000,1360.0,14.0,14.0,Weekly,24.0,8485.3,4000.0,Part-Time Employment,1.0,0.0,0.0,1.0,3250.4933,1660.0,3105.23,97.14,QuickCash,,5195647,1.0,05-05-2023,False,Other Expenses,2023-05-04,Orange,0.0,13356.0,8485.3
0062x00000DqxPeAAJ,0010K00001o9sIAQAY,Palm Island,QLD,Australia,Loan Paid,Existing Client-Granted Loan Before,0.0,76.76,2016.1418,2.0,1.0,0.0,4.0,2.0,4257.5759,7.0,56.0,454.6337,1959.6516,2142.59,0.0,0.74,0.0,0.0,3250.0,599.0,110.0,1000,1360.0,8.0,15.286,Fortnightly,32.0,4257.58,2050.0,Full-Time Employment,7.0,0.0,0.5714,6.0,3919.3033,789.0,3768.2866,170.0,MoneySpot,0.0,5138815,2.0,28-04-2023,False,Vehicle Expenses,2023-04-27,Orange,0.0,4048.0,4257.58
0062x00000DFGsVAAX,0012x00000g8VosAAE,Inverell,NSW,Australia,Closed Lost,Existing Client-No Loan Granted Ever,0.0,62.98,744.6466,1.0,0.0,0.0,2.0,1.0,4741.6516,21.0,0.0,707.6438,730.5076,530.89,1.0,0.0,0.0,0.0,0.0,0.0,400.0,600,792.0,10.0,10.571,Weekly,31.0,4825.15,1000.0,,21.0,0.0,0.0769,8.0,3165.5333,430.0,971.3,79.2,MoneySpot,,4658075,4.0,15-02-2023,False,Medical Bill,2023-02-10,Orange,0.0,5589.0,4825.15
0062x00000FuB4zAAF,0010K00001btxhjQAA,Bentleigh East,VIC,Australia,Loan Paid,Existing Client-Granted Loan Before,0.0,62.58,155.0,1.0,0.0,0.0,4.0,1.0,5971.6122,0.0,9.0,0.0,1197.8507,1141.81,0.0,46.85,0.0,0.0,2600.0,899.0,790.0,1000,1360.0,14.0,13.714,Weekly,31.0,6285.95,1000.0,Full-Time Employment,0.0,0.0,0.2418,0.0,5190.6866,149.0,445.47,97.14,MoneySpot,0.0,8230149,0.0,2024-02-18,False,Life Event Expenses,2024-02-18,Orange,0.0,6995.0,6285.95
0062x00000FVmr4AAD,0010K00001jNDaWQAW,Victoria Park,WA,Australia,Loan Paid,Existing Client-Granted Loan Before,0.44,29.05,583.1548,2.0,0.0,0.0,3.0,2.0,6339.4983,6.0,24.0,0.0,2380.92,2380.92,0.0,0.0,0.0,0.0,3975.0,400.0,1400.0,1000,1360.0,8.0,16.714,Fortnightly,33.0,6339.5,1000.0,Full-Time Employment,6.0,0.0,0.022,4.0,4761.84,0.0,1263.92,170.0,QuickCash,0.0,7622071,0.0,24-12-2023,False,Home Maintenance & Repairs,2023-12-24,Orange,32.0,7268.0,6339.5
0062x00000DHUUrAAP,0012x00000cxSsGAAU,Kirrawee,NSW,Australia,Closed Lost,Existing Client-Granted Loan Before,0.61,82.83,1199.1844,1.0,0.0,0.0,3.0,1.0,211.5999,3.0,60.0,385.075,58.48,100.0,1.0,2.97,0.0,1.0,0.0,899.0,670.0,1000,1360.0,14.0,14.0,Weekly,24.0,4695.3,5000.0,Full-Time Employment,3.0,0.0,0.0989,1.0,0.0,1472.0,1564.5266,97.14,MoneySpot,,4781413,0.0,06-03-2023,False,Living Expenses,2023-03-01,Orange,27.0,4417.0,4695.3
0062x00000DGpwVAAT,0012x00000goMZcAAM,Belconnen,ACT,Australia,Loan Paid,New Client-New Loan,0.0,94.52,5034.1101,1.0,0.0,0.0,3.0,1.0,4943.2915,0.0,130.0,573.5714,1066.0716,1073.62,1.0,37.56,0.0,0.0,6933.33,899.0,750.0,750,960.0,6.0,5.857,Weekly,26.0,6844.33,750.0,Full-Time Employment,0.0,0.0,0.2747,0.0,6264.2866,587.0,5151.1933,160.0,MoneySpot,0.0,4745666,0.0,24-02-2023,False,Life Event Expenses,2023-02-24,Orange,0.0,6334.0,6844.33
0062x00000E3a9ZAAR,0012x00000iHvHrAAK,Redbank Plains,QLD,Australia,Loan Paid,New Client-New Loan,0.0,65.4,2123.3616,1.0,0.0,0.0,2.0,1.0,4750.7108,4.0,48.0,1653.9755,992.4376,906.23,0.0,0.0,0.0,0.0,4766.67,400.0,1880.0,1000,1360.0,14.0,14.429,Weekly,56.0,4794.16,2100.0,Full-Time Employment,4.0,0.0,0.033,3.0,4300.5633,1470.0,2019.5,97.14,MoneySpot,0.0,5499426,4.0,04-06-2023,False,Living Expenses,2023-06-04,Orange,0.0,5442.0,4794.16
0062x00000DWRO6AAP,0012x00000fmV8iAAE,Glenfield Park,NSW,Australia,Loan Paid,Existing Client-Granted Loan Before,0.0,87.62,1445.7218,1.0,0.0,0.0,3.0,1.0,5703.1836,0.0,21.0,0.0,982.2636,1061.5,1.0,6.37,0.0,0.0,4025.67,1499.0,400.0,1000,1320.0,10.0,10.0,Weekly,32.0,17078.82,2050.0,Full-Time Employment,0.0,0.0,0.1758,0.0,3601.6333,555.0,1901.43,132.0,QuickCash,0.0,4916866,0.0,23-03-2023,False,Vehicle Expenses,2023-03-23,Orange,0.0,15392.0,17078.82
0062x00000DUu7FAAT,0012x00000ILy6LAAT,Koonawarra,NSW,Australia,Loan Paid,Existing Client-Granted Loan Before,27.84,76.18,605.1733,2.0,0.0,2.0,3.0,2.0,3066.1094,0.0,8.0,0.0,979.08,1042.17,0.0,0.76,0.0,0.0,2600.0,599.0,400.0,800,1120.0,11.0,20.857,Fortnightly,56.0,3066.11,800.0,Full-Time Employment,0.0,0.0,0.0,0.0,2352.0866,94.0,699.4566,101.82,MoneySpot,0.0,5400205,0.0,26-05-2023,False,Vehicle Expenses,2023-05-26,Green,841.0,3020.0,3066.11
0062x00000D8W1XAAV,0010K00001xiH2MQAU,Upper Coomera,QLD,Australia,Loan Paid,Existing Client-Granted Loan Before,0.18,35.37,3013.4323,2.0,0.0,0.0,1.0,2.0,2601.6754,0.0,39.0,0.0,724.44,453.86,0.0,3.81,0.0,0.0,1950.0,899.0,1820.0,800,1088.0,14.0,13.714,Weekly,52.0,8347.67,800.0,Full-Time Employment,0.0,0.0,0.1319,0.0,2114.0666,691.0,3647.7833,77.71,QuickCash,0.0,4536358,0.0,23-01-2023,False,Vehicle Expenses,2023-01-23,Green,27.0,14712.0,8347.67
0062x00000DIOYnAAP,0012x00000TJKAVAA5,Everton Park,QLD,Australia,Loan Paid,Existing Client-Granted Loan Before,0.0,17.21,679.829,1.0,0.0,0.0,4.0,1.0,6449.115,5.0,18.0,0.0,1484.18,1505.23,0.0,0.8,0.0,0.0,6038.48,1499.0,2383.0,1000,1320.0,12.0,12.143,Weekly,43.0,6910.66,1000.0,Full-Time Employment,5.0,0.0,0.0,2.0,6373.6266,332.0,2196.6433,110.0,MoneySpot,0.0,4830552,0.0,09-03-2023,False,Living Expenses,2023-03-09,Orange,0.0,6123.0,6910.66
0062x00000DXFgbAAH,0012x00000dbVIUAA2,Parilla,SA,Australia,Loan Paid,Existing Client-Granted Loan Before,0.0,63.58,2851.4542,1.0,0.0,0.0,2.0,1.0,3383.8967,10.0,55.0,1176.9424,778.76,551.66,0.0,0.0,0.0,0.0,3843.77,400.0,0.0,700,924.0,9.0,8.857,Weekly,52.0,3383.9,5000.0,Full-Time Employment,10.0,0.0,0.4725,6.0,3374.6266,1264.0,2112.4066,102.67,MoneySpot,0.0,4962759,10.0,01-04-2023,False,Medical Expenses,2023-04-01,Green,0.0,3375.0,3383.9
0062x00000ECUbeAAH,0012x00000GcPkOAAV,Parramatta,NSW,Australia,Closed Lost,Existing Client-No Loan Granted Ever,0.0,81.8,0.0,1.0,0.0,0.0,2.0,1.0,3952.2645,0.0,6.0,0.0,388.9166,416.21,0.0,0.0,0.0,0.0,4333.33,400.0,245.0,650,1014.0,36.0,36.143,Weekly,29.0,5799.53,5000.0,Full-Time Employment,0.0,0.0,0.0,0.0,1585.1833,0.0,0.0,28.17,MoneySpot,,5882398,0.0,11-07-2023,False,Other Expenses,2023-07-10,Green,0.0,6576.0,5799.53
0062x00000DW3klAAD,0012x00000cmUg9AAE,Dudley Park,WA,Australia,Loan Paid,Existing Client-Granted Loan Before,0.0,90.76,1490.7798,2.0,0.0,0.0,1.0,2.0,5099.4619,0.0,56.0,52.8,2111.5342,2202.64,1.0,38.57,0.0,1.0,4795.58,599.0,600.0,1000,1280.0,3.0,5.286,Fortnightly,24.0,6250.47,1000.0,Full-Time Employment,0.0,0.0,0.3846,0.0,0.0,275.0,1927.17,426.67,QuickCash,0.0,4894062,0.0,19-03-2023,False,Living Expenses,2023-03-19,Green,0.0,6998.0,6250.47
0062x00000GE5yuAAD,0012x00000OJc8GAAT,Launceston,TAS,Australia,Closed Lost,Existing Client-Granted Loan Before,0.0,68.41,3350.0996,4.0,0.0,0.0,1.0,4.0,18941.5588,1.0,34.0,0.0,233.8835,1000.0,0.0,100.0,0.0,1.0,9200.0,1499.0,1200.0,700,952.0,14.0,14.286,Weekly,54.0,27168.37,2050.0,Full-Time Employment,1.0,0.0,0.022,0.0,8063.1133,1278.0,4008.3733,68.0,MoneySpot,,8443058,1.0,2024-03-13,False,Home Maintenance & Repairs,2024-03-13,Orange,0.0,22709.0,27168.37
0062x00000DtbeWAAR,0012x00000Gely4AAB,Ashmore,QLD,Australia,Loan Paid,Existing Client-Granted Loan Before,0.0,98.31,1452.8469,2.0,0.0,0.0,3.0,2.0,7130.7593,14.0,71.0,700.1048,2848.1633,3049.94,3.0,0.0,0.0,0.0,0.0,599.0,880.0,1000,1360.0,7.0,13.857,Fortnightly,44.0,7130.76,2050.0,,14.0,0.0,0.5495,0.0,5696.3266,1385.0,1955.56,194.29,QuickCash,0.0,5326624,3.0,19-05-2023,False,Travel Expenses,2023-05-19,Orange,0.0,9084.0,7130.76
0062x00000DFE2HAAX,0012x00000GdCCdAAN,Kangaroo Flat,VIC,Australia,Loan Paid,Existing Client-Granted Loan Before,0.0,73.27,648.6596,2.0,0.0,0.0,2.0,2.0,4406.3254,0.0,34.0,163.782,1823.6,1814.0,1.0,0.0,0.0,0.0,0.0,599.0,575.0,800,1088.0,14.0,13.714,Weekly,25.0,5529.31,800.0,Full-Time Employment,0.0,0.0,0.0879,0.0,3039.3333,905.0,1075.1266,77.71,MoneySpot,0.0,4656307,0.0,10-02-2023,False,Living Expenses,2023-02-10,Green,0.0,7507.0,5529.31
0062x00000D2Q67AAF,0012x00000fmFryAAE,Stratton,WA,Australia,Loan Paid,Existing Client-Granted Loan Before,0.18,56.57,0.0,4.0,0.0,0.0,3.0,4.0,7874.6951,2.0,62.0,573.9904,1908.1285,2279.41,0.0,0.0,0.0,0.0,0.0,400.0,440.0,1000,1320.0,10.0,10.571,Weekly,34.0,7874.7,1000.0,,2.0,0.0,0.0549,2.0,7452.7566,913.0,1995.24,132.0,MoneySpot,0.0,4444733,0.0,09-01-2023,False,Life Event Expenses,2023-01-09,Green,17.0,8952.0,7874.7
0062x00000DI1QHAA1,0012x00000BJEZcAAP,Mildura,VIC,Australia,Closed Lost,Existing Client-Granted Loan Before,0.0,91.28,2707.0165,1.0,2.0,0.0,2.0,1.0,3282.2472,26.0,71.0,992.4958,863.2763,936.79,1.0,0.0,0.0,0.0,3033.33,400.0,400.0,1000,1320.0,13.0,13.143,Weekly,22.0,3601.55,3500.0,Full-Time Employment,26.0,0.0,0.7582,10.0,3165.3466,911.0,5333.82,101.54,MoneySpot,,4812824,23.0,07-03-2023,False,Travel Expenses,2023-03-06,Green,0.0,3853.0,3601.55
0062x00000Ee3elAAB,0012x00000lHMRzAAO,Warwick,QLD,Australia,Loan Paid,New Client-New Loan,0.0,47.57,1796.7525,1.0,0.0,0.0,1.0,1.0,4501.5649,0.0,29.0,0.0,1035.9766,1037.4,1.0,0.0,0.0,0.0,0.0,0.0,300.0,700,924.0,12.0,11.571,Weekly,29.0,4526.91,700.0,full_time,0.0,0.0,0.0,0.0,4143.9066,0.0,1852.01,77.0,QuickCash,0.0,6459748,0.0,08-09-2023,False,vehicle_expenses,2023-09-08,Green,0.0,6470.0,4526.91
0062x00000DV2s0AAD,0012x00000goJZqAAM,Cronulla,NSW,Australia,Loan Paid,Existing Client-Granted Loan Before,0.0,81.9,790.963,2.0,0.0,0.0,3.0,2.0,9242.0147,2.0,20.0,0.0,3220.6816,3262.49,0.0,0.0,0.0,0.0,0.0,599.0,2099.0,750,1020.0,8.0,15.714,Fortnightly,34.0,9242.01,750.0,Full-Time Employment,2.0,0.0,0.4505,1.0,7008.03,363.0,1007.1366,127.5,Financier-2,0.0,5413271,0.0,29-05-2023,False,Home Maintenance & Repairs,2023-05-28,Green,0.0,9870.0,9242.01
0062x00000DGsi2AAD,0012x00000g9lFDAAY,Smithfield,SA,Australia,Loan Paid,Existing Client-Granted Loan Before,1.39,70.19,2402.2132,4.0,0.0,0.0,3.0,4.0,6522.3332,0.0,39.0,387.9676,1733.58,2251.52,1.0,0.0,0.0,0.0,0.0,899.0,1360.0,600,816.0,7.0,13.857,Fortnightly,57.0,6522.33,600.0,,0.0,0.0,0.0,0.0,5200.74,1103.0,2301.47,116.57,QuickCash,0.0,4747803,0.0,24-02-2023,False,Medical Expenses,2023-02-24,Green,109.0,7822.0,6522.33
0062x00000DsfbpAAB,0012x00000g9HJOAA2,Merewether,NSW,Australia,Loan Paid,Existing Client-Granted Loan Before,0.22,52.82,1209.0966,3.0,0.0,0.0,4.0,3.0,7902.91,4.0,29.0,23.5578,7902.91,7902.91,0.0,22.72,0.0,0.0,7900.0,599.0,250.0,1000,1400.0,4.0,18.0,Monthly,34.0,9336.24,2050.0,Full-Time Employment,4.0,0.0,0.1209,0.0,7902.91,2331.0,2331.08,350.0,QuickCash,0.0,5254787,2.0,12-05-2023,False,Life Event Expenses,2023-05-12,Orange,27.0,12253.0,9336.24
0062x00000DFpvdAAD,0012x00000SIWtPAAX,Enmore,NSW,Australia,Loan Paid,Existing Client-Granted Loan Before,0.0,67.28,1415.3066,4.0,1.0,0.0,5.0,4.0,6458.5367,10.0,33.0,0.0,1374.2362,1368.21,0.0,2.71,0.0,0.0,3683.33,599.0,1000.0,1000,1360.0,7.0,14.143,Fortnightly,25.0,5294.87,1000.0,Full-Time Employment,10.0,0.0,0.0549,5.0,3664.63,289.0,1733.63,194.29,MoneySpot,0.0,4688534,8.0,15-02-2023,False,Living Expenses,2023-02-15,Green,0.0,7205.0,5294.87
0062x00000DUntWAAT,0012x00000Zv6YWAAZ,Boulder,WA,Australia,Loan Paid,Existing Client-Granted Loan Before,46.91,66.77,688.6064,2.0,0.0,2.0,2.0,2.0,4165.8375,6.0,14.0,501.4308,840.0442,844.09,2.0,0.0,0.0,0.0,450.0,400.0,520.0,700,896.0,5.0,4.857,Weekly,46.0,4121.78,2050.0,Casual Employment,6.0,0.0,0.033,2.0,3153.03,520.0,688.6066,179.2,MoneySpot,0.0,5390484,6.0,25-05-2023,True,Life Event Expenses,2023-05-25,Orange,2239.0,4772.0,4121.78
0062x00000D8m5oAAB,0012x00000cwHZvAAM,Denham Court,NSW,Australia,Closed Lost,Existing Client-No Loan Granted Ever,0.24,78.5,1046.1833,2.0,0.0,0.0,3.0,2.0,3073.8657,3.0,0.0,0.0,1414.8216,1195.41,0.0,0.0,0.0,0.0,0.0,899.0,0.0,800,1024.0,3.0,6.143,Fortnightly,28.0,3390.13,5000.0,Part-Time Employment,3.0,0.0,0.0,1.0,2829.6433,0.0,1172.82,341.33,MoneySpot,,4549233,0.0,30-01-2023,False,Travel Expenses,2023-01-25,Orange,11.0,4531.0,3390.13
0062x00000DrncmAAB,0012x00000hZ42eAAC,Lansvale,NSW,Australia,Loan Paid,New Client-New Loan,8.85,87.96,1662.3914,2.0,0.0,2.0,2.0,2.0,9017.2005,5.0,37.0,0.0,1343.9057,1331.2,2.0,0.0,0.0,0.0,0.0,0.0,100.0,800,1088.0,7.0,13.857,Fortnightly,33.0,9720.59,3000.0,,5.0,0.0,0.0,5.0,5739.1733,648.0,2295.57,155.43,MoneySpot,0.0,5193961,4.0,04-05-2023,False,Education - School Fees,2023-05-04,Orange,1176.0,13284.0,9720.59
0062x00000EDaAoAAL,0012x00000XPcHZAA1,Burnside Heights,VIC,Australia,Loan Paid,Existing Client-Granted Loan Before,0.0,63.15,560.0,1.0,0.0,0.0,2.0,1.0,3601.6004,0.0,4.0,0.0,771.7112,738.88,0.0,0.0,0.0,0.0,2674.97,400.0,0.0,1000,1520.0,35.0,34.857,Weekly,31.0,7216.76,1000.0,Full-Time Employment,0.0,0.0,0.0,0.0,2057.8966,39.0,598.6666,43.43,QuickCash,0.0,5952350,0.0,20-07-2023,False,Living Expenses,2023-07-19,Green,0.0,4788.0,7216.76
0062x00000D6rzbAAB,0012x00000TtvcpAAB,PLYMPTON,SA,Australia,Loan Paid,Existing Client-Granted Loan Before,0.13,40.59,494.7166,3.0,0.0,2.0,4.0,3.0,7505.2467,3.0,33.0,1293.7958,7491.3433,7320.67,1.0,2.74,1.0,0.0,1875.12,899.0,480.0,750,990.0,3.0,9.429,Monthly,29.0,8753.91,750.0,Full-Time Employment,3.0,0.0,0.1099,0.0,7502.01,1332.0,2261.81,330.0,MoneySpot,0.0,4457062,0.0,11-01-2023,False,Vehicle Expenses,2023-01-11,Green,13.0,9286.0,8753.91
0062x00000D1WU3AAN,0012x00000L3Oj1AAF,Yarrabah,QLD,Australia,Loan Paid,Existing Client-Granted Loan Before,0.0,79.09,0.0,2.0,0.0,0.0,3.0,2.0,3790.4672,0.0,12.0,554.0179,1620.0357,1798.12,0.0,0.0,0.0,0.0,1231.97,400.0,200.0,1000,1360.0,7.0,14.429,Fortnightly,48.0,3790.47,1000.0,Unemployed,0.0,0.0,0.3077,0.0,3780.0833,638.0,638.0,194.29,MoneySpot,0.0,4394620,0.0,02-01-2023,False,Living Expenses,2023-01-02,Green,0.0,3903.0,3790.47
0062x00000D9iWEAAZ,0010K00001mBwKIQA0,Wyalkatchem,WA,Australia,Loan Paid,Existing Client-Granted Loan Before,0.0,82.23,309.8259,2.0,0.0,0.0,4.0,2.0,4343.6368,11.0,94.0,0.0,1999.264,1961.47,0.0,0.0,0.0,0.0,3466.67,1499.0,100.0,700,952.0,7.0,14.286,Fortnightly,29.0,4343.64,700.0,Full-Time Employment,11.0,0.0,1.0,0.0,3332.1066,844.0,1149.3166,136.0,MoneySpot,0.0,4595156,2.0,01-02-2023,False,Vehicle Expenses,2023-02-01,Green,0.0,4126.0,4343.64
0062x00000DA8VkAAL,0012x00000GdZvoAAF,Howlong,NSW,Australia,Loan Paid,Existing Client-Granted Loan Before,0.0,52.53,1279.9685,2.0,0.0,0.0,3.0,2.0,4617.4781,2.0,29.0,2690.3969,2125.305,2157.39,0.0,33.84,0.0,1.0,0.0,400.0,0.0,1000,1320.0,7.0,12.714,Fortnightly,36.0,4744.14,1200.0,Full-Time Employment,2.0,0.0,0.3626,0.0,0.0,1703.0,1703.04,188.57,QuickCash,0.0,4614892,2.0,04-02-2023,False,Vehicle Expenses,2023-02-03,Green,0.0,4994.0,4744.14
0062x00000DUkReAAL,0012x00000hZaIOAA0,Colyton,NSW,Australia,Closed Lost,Existing Client-No Loan Granted Ever,0.0,77.63,940.3666,2.0,0.0,0.0,3.0,2.0,1545.4571,0.0,7.0,0.0,235.7142,150.0,0.0,1.39,0.0,1.0,0.0,899.0,1200.0,1000,1280.0,3.0,6.143,Fortnightly,57.0,13003.44,5000.0,,0.0,0.0,0.0,0.0,0.0,0.0,1557.0866,426.67,MoneySpot,,5387500,0.0,25-05-2023,False,Medical Expenses,2023-05-25,Orange,0.0,12810.0,13003.44
0062x00000Ex2VJAAZ,0012x00000d8RYTAA2,Sanctuary Point,NSW,Australia,Loan Paid,Existing Client-Granted Loan Before,26.52,72.65,1126.5546,4.0,0.0,0.0,1.0,4.0,4111.1075,3.0,40.0,0.0,1688.86,1887.63,1.0,0.0,0.0,0.0,0.0,1499.0,1680.0,1000,1440.0,12.0,23.143,Fortnightly,50.0,5510.89,2050.0,Full-Time Employment,3.0,0.0,0.1209,0.0,3377.72,549.0,4798.6,120.0,MoneySpot,0.0,6634703,0.0,25-09-2023,False,Home Maintenance & Repairs,2023-09-25,Green,1953.0,7362.0,5510.89
0062x00000EcgHTAAZ,0012x00000WVfnNAAT,Crestmead,QLD,Australia,Loan Paid,Existing Client-Granted Loan Before,0.0,90.9,336.277,4.0,0.0,0.0,6.0,4.0,5442.3333,0.0,0.0,0.0,1814.1111,3000.0,0.0,0.68,0.0,1.0,6500.0,1499.0,2000.0,1000,1360.0,14.0,14.143,Weekly,39.0,12536.81,1000.0,Full-Time Employment,2.0,0.0,0.044,0.0,7081.96,213.0,557.8366,97.14,MoneySpot,0.0,6372051,0.0,30-08-2023,False,Living Expenses,2023-08-30,Orange,0.0,5909.0,12536.81
0062x00000DA5tOAAT,0012x00000BJ2NsAAL,MURGON,QLD,Australia,Loan Paid,Existing Client-Granted Loan Before,0.0,66.22,857.5028,1.0,1.0,0.0,2.0,1.0,4266.8956,4.0,51.0,860.31,981.9707,1256.74,0.0,26.81,0.0,0.0,0.0,899.0,400.0,700,952.0,14.0,13.714,Weekly,26.0,4266.9,1000.0,,4.0,0.0,0.033,0.0,4255.2066,213.0,2045.1666,68.0,MoneySpot,0.0,4612054,4.0,04-02-2023,False,Living Expenses,2023-02-03,Orange,0.0,4513.0,4266.9
0062x00000EMmalAAD,0012x00000goOXKAA2,Liverpool,NSW,Australia,Loan Paid,Existing Client-Granted Loan Before,0.0,99.22,2674.0473,1.0,0.0,0.0,2.0,1.0,7158.8884,0.0,51.0,0.0,929.5476,988.26,3.0,0.03,0.0,0.0,0.0,599.0,600.0,1000,1360.0,16.0,16.286,Weekly,44.0,9629.67,5000.0,Full-Time Employment,1.0,0.0,0.033,0.0,4028.04,1647.0,3536.8733,85.0,MoneySpot,0.0,6130507,0.0,07-08-2023,False,Living Expenses,2023-08-07,Orange,0.0,9890.0,9629.67
0062x00000DZaCDAA1,0012x00000BI1cMAAT,Camden South,NSW,Australia,Loan Paid,Existing Client-Granted Loan Before,0.0,36.74,920.2401,1.0,0.0,0.0,3.0,1.0,4798.4593,0.0,11.0,0.0,1093.7938,806.2,0.0,5.9,0.0,0.0,4042.53,599.0,350.0,1000,1360.0,14.0,14.0,Weekly,30.0,4798.46,2050.0,Full-Time Employment,0.0,0.0,0.011,0.0,4739.7733,442.0,642.2033,97.14,MoneySpot,0.0,5101200,0.0,20-04-2023,False,Vehicle Expenses,2023-04-20,Orange,0.0,4947.0,4798.46
0062x00000Dr2SZAAZ,0012x00000INF7MAAX,Cambooya,QLD,Australia,Loan Paid,Existing Client-No Loan Granted Ever,0.0,84.99,680.5222,4.0,0.0,0.0,1.0,4.0,4102.7666,1.0,33.0,0.0,1217.474,1707.94,0.0,0.34,0.0,0.0,0.0,400.0,720.0,700,896.0,3.0,4.857,Fortnightly,21.0,4669.7,1500.0,,1.0,0.0,0.0989,1.0,2029.1233,192.0,767.55,298.67,MoneySpot,0.0,5142398,0.0,27-04-2023,False,Medical Expenses,2023-04-27,Orange,0.0,7420.0,4669.7
0062x00000DIJG6AAP,0012x00000g9HTuAAM,Mickleham,VIC,Australia,Loan Paid,Existing Client-Granted Loan Before,13.33,45.97,255.3956,2.0,1.0,2.0,2.0,2.0,3444.1297,6.0,22.0,159.008,1365.2285,1473.19,2.0,1.32,0.0,0.0,2383.33,599.0,600.0,1000,1320.0,6.0,12.0,Fortnightly,31.0,3663.54,1000.0,Part-Time Employment,6.0,0.0,0.8571,2.0,3690.5866,274.0,385.32,220.0,MoneySpot,0.0,4826668,3.0,09-03-2023,False,Other Expenses,2023-03-09,Orange,505.0,3788.0,3663.54
0062x00000DJHJwAAP,0012800001OBcL8AAL,YARRABAH,QLD,Australia,Loan Paid,Existing Client-Granted Loan Before,0.0,46.57,2010.5464,2.0,0.0,0.0,2.0,2.0,3898.8336,1.0,31.0,1272.4306,1407.77,1657.67,0.0,6.01,1.0,0.0,2816.67,599.0,320.0,1000,1320.0,6.0,10.714,Fortnightly,56.0,4113.5,2050.0,Full-Time Employment,1.0,0.0,0.0,0.0,2815.54,1046.0,3110.7333,220.0,MoneySpot,0.0,4880878,0.0,17-03-2023,False,Living Expenses,2023-03-17,Orange,0.0,6934.0,4113.5
0062x00000FKoQtAAL,0012x00000OKlC9AAL,PERTH,TAS,Australia,Loan Paid,Existing Client-Granted Loan Before,9.74,57.53,4618.7644,2.0,0.0,4.0,3.0,2.0,9319.4507,3.0,23.0,0.0,1932.1683,2949.95,1.0,0.36,0.0,0.0,478.89,1499.0,1390.0,1000,1360.0,8.0,15.143,Fortnightly,30.0,10068.77,1000.0,Unemployed,3.0,0.0,0.5824,0.0,8179.7233,610.0,4752.89,170.0,QuickCash,0.0,7416021,0.0,06-12-2023,False,Vehicle Expenses,2023-12-06,Orange,1011.0,10370.0,10068.77
0062x00000DWfH8AAL,0012x00000hWdKQAA0,Manunda,QLD,Australia,Closed Lost,New Client-New Loan,0.0,71.39,93.8567,1.0,2.0,0.0,5.0,1.0,2881.7287,0.0,6.0,0.0,663.1875,297.5,1.0,0.0,0.0,0.0,0.0,0.0,1000.0,1000,1280.0,6.0,6.571,Weekly,34.0,2881.73,1000.0,Full-Time Employment,16.0,0.0,0.0,2.0,2652.75,0.0,832.4333,213.33,QuickCash,,4932159,15.0,25-03-2023,False,Other,2023-03-25,Orange,0.0,2653.0,2881.73
0062x00000DtbC4AAJ,0012x00000haEL1AAM,Blacktown,NSW,Australia,Closed Lost,New Client-New Loan,2.43,27.24,659.5,2.0,0.0,2.0,3.0,2.0,6778.5571,1.0,41.0,173.8095,2382.6485,1849.63,0.0,0.92,0.0,0.0,0.0,0.0,600.0,700,924.0,5.0,9.857,Fortnightly,49.0,7607.61,2500.0,,1.0,0.0,0.0,1.0,6088.7466,160.0,1757.1333,184.8,MoneySpot,,5326608,0.0,22-05-2023,False,To buy some furniture and fix my car,2023-05-19,Green,191.0,7853.0,7607.61
0062x00000DtmTEAAZ,0012800001IxEwaAAF,Kingston,TAS,Australia,Loan Paid,Existing Client-Granted Loan Before,0.07,69.71,3094.3254,4.0,0.0,0.0,7.0,4.0,9418.2638,3.0,21.0,680.96,261.1805,300.0,0.0,44.93,0.0,1.0,2968.33,899.0,1200.0,1000,1360.0,16.0,16.286,Weekly,67.0,11641.45,2050.0,Full-Time Employment,3.0,0.0,0.0,1.0,3008.3333,3338.0,3951.6266,85.0,MoneySpot,0.0,5346795,0.0,22-05-2023,False,Life Event Expenses,2023-05-22,Orange,13.0,18026.0,11641.45
0062x00000DGlS4AAL,0010K00001mBrE8QAK,Bargara,QLD,Australia,Loan Paid,Existing Client-Granted Loan Before,16.36,59.3,4665.4573,4.0,0.0,4.0,6.0,4.0,2350.8673,1.0,60.0,443.0362,339.485,502.06,0.0,0.19,0.0,0.0,3323.67,599.0,370.0,1000,1320.0,5.0,10.0,Fortnightly,42.0,6931.25,1000.0,Full-Time Employment,1.0,0.0,0.011,0.0,1144.1333,1318.0,5525.87,264.0,MoneySpot,0.0,4742082,1.0,25-02-2023,True,Vehicle Expenses,2023-02-24,Orange,1144.0,6992.0,6931.25
0062x00000DWakQAAT,0012x00000BGD3FAAX,Graceville,QLD,Australia,Loan Paid,Existing Client-Granted Loan Before,0.0,66.37,3007.9938,1.0,2.0,0.0,1.0,1.0,5080.514,4.0,89.0,716.9643,1169.2146,938.34,1.0,0.0,0.0,0.0,4028.14,599.0,0.0,1000,1320.0,10.0,10.571,Weekly,64.0,5080.51,1000.0,Full-Time Employment,4.0,0.0,0.033,0.0,5066.5966,996.0,4592.98,132.0,QuickCash,0.0,4924755,4.0,24-03-2023,False,Life Event Expenses,2023-03-24,Orange,0.0,5139.0,5080.51
0062x00000DrGqhAAF,0012x00000INqMMAA1,LAWSON,ACT,Australia,Loan Paid,Existing Client-Granted Loan Before,0.24,19.62,1199.7066,2.0,1.0,0.0,3.0,2.0,5498.1166,7.0,35.0,0.0,2530.64,2530.64,0.0,0.07,0.0,0.0,82000.0,0.0,1630.0,650,858.0,7.0,12.857,Fortnightly,39.0,5621.45,650.0,Full-Time Employment,8.0,0.0,0.1099,5.0,5061.28,141.0,2658.4766,122.57,QuickCash,0.0,5155462,4.0,28-04-2023,False,Vehicle - Repairs,2023-04-28,Orange,13.0,5344.0,5621.45
0062x00000FVVD7AAP,0012x00000n2VD4AAM,Sutherland,NSW,Australia,Closed Lost,New Client-New Loan,0.0,44.63,443.0933,1.0,0.0,0.0,3.0,1.0,4983.9654,0.0,3.0,0.0,959.1385,1006.0,0.0,0.0,0.0,1.0,4550.0,400.0,0.0,800,1088.0,14.0,14.0,Weekly,24.0,5075.3,1000.0,Full-Time Employment,0.0,0.0,0.0,0.0,0.0,0.0,443.0933,77.71,QuickCash,,7596488,0.0,22-12-2023,False,Living Expenses,2023-12-21,Orange,0.0,4988.0,5075.3
0062x00000FXBZ1AAP,0012x00000XDdU3AAL,Urangan,QLD,Australia,Loan Paid,Existing Client-Granted Loan Before,0.54,50.37,2732.4942,1.0,0.0,0.0,4.0,1.0,4947.4867,8.0,37.0,0.0,1138.6,1138.6,1.0,0.99,0.0,0.0,79000.0,899.0,1500.0,1000,1360.0,14.0,14.143,Weekly,44.0,4952.49,1000.0,Full-Time Employment,8.0,0.0,0.2308,0.0,4933.9333,499.0,2736.3066,97.14,QuickCash,0.0,7730607,0.0,2024-01-04,False,Home Maintenance & Repairs,2024-01-04,Orange,27.0,4973.0,4952.49
0062x00000F42bEAAR,0012x00000g8Tj1AAE,Dapto,NSW,Australia,Loan Paid,Existing Client-Granted Loan Before,0.0,32.12,0.0,1.0,0.0,0.0,1.0,1.0,5917.7794,1.0,24.0,0.0,1354.2272,1333.5,0.0,0.73,0.0,0.0,0.0,1499.0,1000.0,1000,1360.0,14.0,14.0,Weekly,52.0,4998.84,1750.0,,1.0,0.0,0.1209,0.0,4965.5,791.0,823.27,97.14,QuickCash,0.0,7100297,1.0,07-11-2023,False,Other Expenses,2023-11-07,Green,0.0,5918.0,4998.84
0062x00000D8nc5AAB,0012x00000TuCymAAF,Kununurra,WA,Australia,Loan Paid,Existing Client-Granted Loan Before,29.41,80.15,2327.0637,2.0,3.0,4.0,2.0,2.0,4005.0905,11.0,48.0,950.9613,1189.3785,1264.19,1.0,0.0,0.0,0.0,1461.33,400.0,764.0,1000,1360.0,7.0,14.0,Fortnightly,36.0,4215.43,1000.0,Full-Time Employment,11.0,0.0,0.7473,5.0,4215.4333,1144.0,2560.3766,194.29,QuickCash,0.0,4550251,8.0,25-01-2023,False,Vehicle Expenses,2023-01-25,Orange,1440.0,4896.0,4215.43
0062x00000DG3tVAAT,0012x00000g8LAtAAM,Yakamia,WA,Australia,Loan Paid,Existing Client-Granted Loan Before,0.0,62.26,1829.47,2.0,0.0,0.0,4.0,2.0,5460.0897,0.0,0.0,537.5422,1918.3671,1725.74,2.0,0.0,0.0,0.0,5176.46,1499.0,1400.0,1000,1360.0,7.0,14.0,Fortnightly,36.0,7180.5,1000.0,Full-Time Employment,0.0,0.0,0.0,0.0,6196.6033,556.0,4076.5133,194.29,QuickCash,0.0,4701222,0.0,17-02-2023,False,Living Expenses,2023-02-17,Green,0.0,5669.0,7180.5
0062x00000D27RQAAZ,0010K00001sFTwhQAG,Yuendumu,NT,Australia,Loan Paid,Existing Client-Granted Loan Before,9.29,55.98,1992.3177,2.0,0.0,2.0,4.0,2.0,9248.5248,0.0,47.0,1632.29,2036.8333,1840.0,0.0,0.32,1.0,0.0,3876.17,400.0,100.0,700,952.0,7.0,14.0,Fortnightly,30.0,6840.57,700.0,Full-Time Employment,0.0,0.0,0.2308,0.0,5119.6533,1248.0,3066.7266,136.0,MoneySpot,0.0,4427874,0.0,07-01-2023,False,Living Expenses,2023-01-06,Orange,1046.0,11248.0,6840.57
0062x00000DGz7mAAD,0012x00000BGUDbAAP,Osborne Park,WA,Australia,Loan Paid,Existing Client-Granted Loan Before,0.25,29.29,1309.8333,3.0,0.0,0.0,3.0,3.0,4321.93,0.0,11.0,220.0,4321.93,4906.19,3.0,13.88,0.0,0.0,0.0,400.0,433.0,650,884.0,4.0,15.857,Monthly,47.0,4438.6,650.0,Full-Time Employment,0.0,0.0,0.0,0.0,4321.93,189.0,1901.5833,221.0,MoneySpot,0.0,4753653,0.0,25-02-2023,False,Life Event Expenses,2023-02-25,Green,13.0,5058.0,4438.6
0062x00000DGmKJAA1,0012x000002dIJ8AAM,Emerald,QLD,Australia,Loan Paid,Existing Client-Granted Loan Before,40.49,48.97,2721.9443,4.0,0.0,2.0,3.0,4.0,5248.912,0.0,29.0,422.1088,650.0,700.0,1.0,0.05,0.0,1.0,5741.67,400.0,100.0,1000,1360.0,7.0,14.0,Fortnightly,46.0,8443.7,1000.0,Part-Time Employment,0.0,0.0,0.0,0.0,4798.78,453.0,5179.61,194.29,MoneySpot,0.0,4741595,0.0,23-02-2023,False,Furniture or Appliances,2023-02-23,Green,2354.0,5813.0,8443.7
0062x00000DscK2AAJ,0012x00000NxxS9AAJ,Pomona,QLD,Australia,Loan Paid,Existing Client-Granted Loan Before,0.0,26.51,1991.6639,4.0,1.0,0.0,4.0,4.0,2582.6666,4.0,17.0,0.0,969.0,969.0,0.0,0.0,0.0,1.0,1100.67,400.0,250.0,700,1008.0,12.0,22.857,Fortnightly,26.0,2639.33,700.0,Full-Time Employment,4.0,0.0,0.0769,1.0,0.0,0.0,1852.3666,84.0,Financier-2,0.0,5252300,3.0,14-05-2023,False,Living Expenses,2023-05-13,Green,0.0,3828.0,2639.33
0062x00000DW10vAAD,0012x00000ckavjAAA,WHITE ROCK,QLD,Australia,Loan Paid,Existing Client-Granted Loan Before,0.2,89.13,3655.8496,4.0,0.0,4.0,5.0,4.0,13077.2811,0.0,120.0,1307.901,492.7906,500.0,1.0,7.13,0.0,1.0,4333.33,599.0,0.0,600,792.0,10.0,10.571,Weekly,35.0,13835.38,5000.0,Contract Employment,0.0,0.0,0.0,0.0,2418.72,2190.0,7856.04,79.2,QuickCash,0.0,4890124,0.0,19-03-2023,False,Other Expenses,2023-03-18,Orange,30.0,14823.0,13835.38
0062x00000DIGJfAAP,0012x00000BFYv3AAH,Maroubra,NSW,Australia,Loan Paid,Existing Client-Granted Loan Before,16.99,42.45,597.3524,2.0,0.0,4.0,3.0,2.0,2958.2795,0.0,18.0,574.2582,1067.315,1077.11,0.0,0.0,0.0,0.0,1397.92,599.0,0.0,1000,1320.0,5.0,10.143,Fortnightly,55.0,2958.28,1000.0,Unemployed,0.0,0.0,0.5604,0.0,2699.0433,677.0,676.6366,264.0,QuickCash,0.0,4823141,0.0,08-03-2023,False,Child Expenses,2023-03-08,Orange,564.0,3318.0,2958.28
0062x00000DrUrPAAV,0012x00000g9EudAAE,Manjimup,WA,Australia,Loan Paid,Existing Client-No Loan Granted Ever,0.0,57.7,5923.8871,1.0,0.0,0.0,4.0,1.0,5749.3157,0.0,41.0,1199.3147,628.2316,549.52,0.0,0.0,0.0,0.0,571.0,2000.0,1200.0,800,1088.0,14.0,14.571,Weekly,41.0,7109.92,5300.0,Casual Employment,0.0,0.0,0.0,0.0,4915.83,713.0,4688.4566,77.71,MoneySpot,0.0,5171450,0.0,01-05-2023,False,Living Expenses,2023-05-01,Orange,0.0,8512.0,7109.92
0062x00000EwUTXAA3,0012x00000iKEN0AAO,Bacchus Marsh,VIC,Australia,Loan Paid,Existing Client-Granted Loan Before,0.0,46.27,1261.1328,2.0,0.0,0.0,3.0,2.0,4462.7202,0.0,20.0,0.0,2039.0385,2216.48,0.0,0.0,0.0,0.0,0.0,599.0,1955.35,1000,1360.0,8.0,16.143,Fortnightly,26.0,4468.32,1000.0,,0.0,0.0,0.1099,0.0,4757.7566,301.0,1709.2533,170.0,QuickCash,0.0,6591816,0.0,20-09-2023,False,Living Expenses,2023-09-20,Green,0.0,5970.0,4468.32
0062x00000FVbuvAAD,0012x00000n2cUwAAI,Kogarah,NSW,Australia,Closed Lost,New Client-New Loan,0.0,17.07,863.9039,1.0,0.0,0.0,3.0,1.0,9543.0405,18.0,53.0,247.331,2196.2069,2122.48,0.0,0.0,0.0,0.0,0.0,0.0,530.0,800,1056.0,12.0,11.857,Weekly,40.0,9543.04,800.0,,22.0,0.0,0.0549,4.0,9516.8966,506.0,999.06,88.0,QuickCash,,7605802,14.0,22-12-2023,False,Family expenses,2023-12-22,Orange,0.0,9547.0,9543.04
0062x00000D7HCwAAN,0012x00000Ve1t9AAB,North Geelong,VIC,Australia,Loan Paid,Existing Client-Granted Loan Before,0.0,23.31,751.3699,3.0,1.0,0.0,4.0,3.0,4705.2899,21.0,44.0,1130.9188,4705.2766,4338.5,2.0,0.0,0.0,0.0,4537.53,1499.0,1868.45,600,816.0,3.0,13.0,Monthly,45.0,4803.62,2300.0,Full-Time Employment,24.0,0.0,0.3297,11.0,4705.2766,392.0,962.84,272.0,MoneySpot,0.0,4475620,12.0,14-01-2023,False,Veterinary Expenses,2023-01-13,Orange,0.0,4991.0,4803.62
0062x00000DHfVbAAL,0012x00000VdyFoAAJ,WINDANG,NSW,Australia,Loan Paid,Existing Client-Granted Loan Before,0.0,36.13,1744.2463,1.0,0.0,0.0,2.0,1.0,6780.538,5.0,0.0,535.442,1560.453,1808.98,0.0,0.0,0.0,1.0,1200.0,400.0,1384.0,1000,1360.0,14.0,13.714,Weekly,45.0,6780.54,1000.0,Full-Time Employment,5.0,0.0,0.0659,0.0,0.0,433.0,3763.1566,97.14,MoneySpot,0.0,4790457,5.0,03-03-2023,False,Living Expenses,2023-03-03,Green,0.0,6929.0,6780.54
0062x00000DISygAAH,0012x00000gpCBPAA2,Manunda,QLD,Australia,Closed Lost,New Client-New Loan,0.0,35.5,1185.6912,1.0,0.0,0.0,3.0,1.0,3410.4556,1.0,30.0,0.0,679.163,698.26,0.0,0.27,0.0,0.0,0.0,0.0,1000.0,600,768.0,6.0,5.857,Weekly,31.0,3410.46,600.0,,1.0,0.0,0.0,0.0,2943.04,264.0,1255.0433,128.0,QuickCash,,4835181,0.0,10-03-2023,False,Holiday / Travel,2023-03-10,Green,0.0,3645.0,3410.46
0062x00000DGttuAAD,0012x00000WXL5IAAX,North Fremantle,WA,Australia,Loan Paid,Existing Client-Granted Loan Before,0.0,44.88,912.515,4.0,0.0,0.0,5.0,4.0,20627.2466,0.0,20.0,0.0,966.6559,666.5,2.0,0.03,0.0,0.0,29146.65,400.0,400.0,1000,1360.0,14.0,13.714,Weekly,36.0,20691.92,3000.0,Full-Time Employment,1.0,0.0,0.0,0.0,19655.3366,653.0,1176.6733,97.14,MoneySpot,0.0,4748601,0.0,24-02-2023,False,Vehicle Expenses,2023-02-24,Orange,0.0,21828.0,20691.92
0062x00000DVpWLAA1,0012x00000dyurIAAQ,Carlton,VIC,Australia,Loan Paid,Existing Client-Granted Loan Before,32.08,30.16,1342.8272,2.0,1.0,0.0,4.0,2.0,3782.9907,4.0,24.0,0.0,1741.2125,2034.31,1.0,0.0,0.0,0.0,0.0,599.0,950.0,650,884.0,8.0,15.0,Fortnightly,31.0,4881.82,650.0,Full-Time Employment,8.0,0.0,0.6923,2.0,2321.6166,207.0,1375.2933,110.5,Financier-2,0.0,5479173,8.0,02-06-2023,False,Medical Expenses,2023-06-02,Green,1204.0,3753.0,4881.82
0062x00000DJBXVAA5,0012x00000e0NT9AAM,Kensington,VIC,Australia,Loan Paid,Existing Client-No Loan Granted Ever,0.71,85.83,628.7002,1.0,0.0,0.0,3.0,1.0,5679.7471,0.0,9.0,290.1433,826.8946,1402.5,0.0,0.0,0.0,1.0,1402.0,1499.0,1380.0,750,960.0,3.0,6.0,Fortnightly,52.0,11755.89,750.0,Part-Time Employment,2.0,0.0,0.0,2.0,2086.6933,188.0,371.4933,320.0,MoneySpot,0.0,4875509,0.0,16-03-2023,False,Vehicle Expenses,2023-03-16,Orange,88.0,12281.0,11755.89
0062x00000DA4trAAD,0012x00000dA088AAC,Craigieburn,VIC,Australia,Loan Paid,Existing Client-Granted Loan Before,0.0,77.48,1265.0758,2.0,1.0,0.0,2.0,2.0,6150.4573,2.0,42.0,472.158,1971.7557,2003.38,0.0,0.41,0.0,0.0,3575.0,400.0,200.0,550,748.0,7.0,13.714,Fortnightly,31.0,4377.5,550.0,Full-Time Employment,2.0,0.0,0.022,2.0,4600.7633,841.0,1404.3833,106.86,Financier-2,0.0,4611415,2.0,03-02-2023,False,Home Maintenance & Repairs,2023-02-03,Green,0.0,6857.0,4377.5
0062x00000D7IlxAAF,0012x00000g9uSxAAI,Kippa-Ring,QLD,Australia,Closed Lost,New Client-New Loan,0.0,58.57,89.6733,4.0,0.0,0.0,3.0,4.0,461.6166,0.0,0.0,0.0,72.8868,150.0,0.0,0.0,0.0,1.0,1700.0,2000.0,730.0,1000,1280.0,6.0,5.857,Weekly,38.0,4073.57,1000.0,Casual Employment,0.0,0.0,0.0,0.0,0.0,0.0,129.6733,213.33,QuickCash,,4477136,0.0,14-01-2023,False,Vehicle Expenses,2023-01-14,Orange,0.0,4748.0,4073.57
0062x00000DHs5bAAD,0012x00000dyeMbAAI,Shailer Park,QLD,Australia,Closed Lost,Existing Client-Granted Loan Before,0.0,94.18,1330.987,1.0,1.0,0.0,3.0,1.0,2367.9244,20.0,42.0,0.0,497.1892,753.95,0.0,1.95,0.0,0.0,3466.67,400.0,0.0,1000,1360.0,14.0,14.571,Weekly,22.0,2891.49,1000.0,Part-Time Employment,20.0,0.0,0.3846,0.0,2154.4866,214.0,1478.7266,97.14,MoneySpot,,4804624,20.0,06-03-2023,False,Vehicle Expenses,2023-03-05,Green,0.0,2917.0,2891.49
0062x00000DXPl1AAH,0010K00001gkMrnQAE,Colyton,NSW,Australia,Loan Paid,Existing Client-Granted Loan Before,0.0,99.73,849.4613,4.0,0.0,0.0,5.0,4.0,5300.78,0.0,0.0,395.9503,140.819,20.0,0.0,0.59,0.0,1.0,7583.33,599.0,960.0,1000,1320.0,9.0,9.0,Weekly,34.0,9524.4,1000.0,Casual Employment,7.0,0.0,0.044,3.0,3557.37,756.0,785.1933,146.67,QuickCash,0.0,4971156,7.0,31-03-2023,False,Furniture or Appliances,2023-03-31,Orange,0.0,5953.0,9524.4
0062x00000DXOJtAAP,0010K00001xNWKQQA4,Charleville,QLD,Australia,Loan Paid,Existing Client-Granted Loan Before,0.0,89.68,3739.4397,2.0,3.0,0.0,3.0,2.0,4711.6025,22.0,62.0,2088.841,2168.6285,2312.31,1.0,0.0,0.0,0.0,2816.67,400.0,0.0,750,960.0,4.0,7.857,Fortnightly,56.0,4711.6,2050.0,Full-Time Employment,22.0,0.0,0.5165,17.0,5060.1333,2430.0,3816.7566,240.0,QuickCash,0.0,4970128,23.0,31-03-2023,False,Furniture or Appliances,2023-03-31,Green,0.0,5323.0,4711.6
0062x00000D1VgvAAF,0012x00000Trd7oAAB,ALKIMOS,WA,Australia,Loan Paid,Existing Client-No Loan Granted Ever,0.45,32.33,1564.2192,2.0,0.0,0.0,3.0,2.0,5381.8915,0.0,11.0,443.1429,2477.1457,2378.79,1.0,4.43,0.0,0.0,4550.0,1500.0,100.0,800,1024.0,3.0,5.429,Fortnightly,30.0,5440.52,800.0,Full-Time Employment,5.0,0.0,0.3187,3.0,5838.64,442.0,3612.5733,341.33,QuickCash,0.0,4393546,0.0,02-01-2023,False,Medical Expenses,2023-01-02,Orange,27.0,5891.0,5440.52
0062x00000FjQ3OAAV,0012x00000Nx9eOAAR,Cowandilla,SA,Australia,Loan Paid,Existing Client-Granted Loan Before,10.0,36.22,0.0,3.0,0.0,0.0,5.0,3.0,6546.0,0.0,2.0,0.0,5465.46,5759.01,0.0,0.0,0.0,0.0,112666.67,599.0,150.0,750,960.0,2.0,6.286,Monthly,22.0,7302.1,750.0,Contract Employment,0.0,0.0,0.0,0.0,5565.46,180.0,462.9166,480.0,QuickCash,0.0,8061568,0.0,2024-02-01,False,Vehicle Expenses,2024-02-01,Orange,756.0,7553.0,7302.1
0062x00000D9vxaAAB,0010K00001ty8e7QAA,Holt,ACT,Australia,Loan Paid,Existing Client-Granted Loan Before,0.0,75.81,5355.2838,4.0,1.0,0.0,3.0,4.0,5295.6666,4.0,71.0,1272.9424,1574.9375,1556.5,0.0,0.0,0.0,0.0,5793.67,599.0,1000.0,1000,1360.0,14.0,14.0,Weekly,40.0,5305.67,2050.0,Full-Time Employment,4.0,0.0,0.0549,4.0,4199.8333,1615.0,5111.09,97.14,MoneySpot,0.0,4604561,4.0,02-02-2023,False,Vehicle Expenses,2023-02-02,Green,0.0,6457.0,5305.67
0062x00000D7YwWAAV,0012x00000THj00AAD,Kallangur,QLD,Australia,Loan Paid,Existing Client-Granted Loan Before,17.12,69.84,2292.5726,4.0,0.0,4.0,1.0,4.0,8012.9599,4.0,67.0,966.8054,2211.09,2502.22,0.0,0.0,0.0,0.0,5439.97,899.0,1720.0,1000,1360.0,7.0,14.143,Fortnightly,37.0,10864.34,1000.0,Full-Time Employment,4.0,0.0,0.6813,3.0,7689.6266,1076.0,4034.7,194.29,QuickCash,0.0,4489150,2.0,16-01-2023,False,Medical Expenses,2023-01-16,Green,1793.0,10473.0,10864.34
0062x00000DXClsAAH,0012x00000fmOOTAA2,Morayfield,QLD,Australia,Loan Paid,Existing Client-Granted Loan Before,0.0,79.51,2264.5352,1.0,3.0,0.0,4.0,1.0,3230.8765,13.0,39.0,1.28,743.5445,870.76,0.0,0.0,0.0,0.0,0.0,599.0,0.0,800,1056.0,9.0,9.143,Weekly,24.0,3230.88,800.0,Part-Time Employment,13.0,0.0,0.3077,3.0,2726.33,143.0,2641.5766,117.33,Financier-2,0.0,4960301,10.0,30-03-2023,False,Medical Expenses,2023-03-29,Green,0.0,3628.0,3230.88
0062x00000DYqFCAA1,0012x00000SHYtaAAH,Stuart Park,NT,Australia,Loan Paid,Existing Client-Granted Loan Before,0.0,77.4,1986.0716,2.0,0.0,0.0,4.0,2.0,4680.0543,0.0,55.0,1536.1558,2154.108,1871.62,0.0,1.03,0.0,0.0,3683.33,599.0,400.0,1000,1320.0,5.0,10.143,Fortnightly,51.0,4680.05,2500.0,Full-Time Employment,0.0,0.0,0.033,0.0,3590.18,1851.0,3953.8533,264.0,MoneySpot,0.0,5055551,0.0,13-04-2023,False,Medical Expenses,2023-04-13,Orange,0.0,5160.0,4680.05
0062x00000DX1meAAD,0012x00000TsiirAAB,Wagga Wagga,NSW,Australia,Loan Paid,Existing Client-Granted Loan Before,0.0,61.22,831.2307,1.0,0.0,0.0,2.0,1.0,6408.0144,0.0,30.0,984.9424,1443.9415,1190.46,1.0,0.0,0.0,0.0,5773.82,899.0,800.0,1000,1320.0,9.0,9.143,Weekly,23.0,12247.06,5000.0,Full-Time Employment,1.0,0.0,0.0769,1.0,6257.08,723.0,1596.5533,146.67,QuickCash,0.0,4950245,1.0,29-03-2023,False,Relocation Expenses,2023-03-29,Orange,0.0,13364.0,12247.06
0062x00000D228iAAB,0010K0000273uw3QAA,Warrnambool,VIC,Australia,Loan Paid,Existing Client-No Loan Granted Ever,0.0,15.27,1527.0609,2.0,0.0,0.0,2.0,2.0,3893.455,5.0,26.0,0.0,1664.052,2003.96,0.0,0.0,0.0,1.0,2474.77,400.0,70.0,800,1024.0,3.0,4.714,Fortnightly,23.0,4080.92,1200.0,Full-Time Employment,5.0,0.0,0.0769,1.0,0.0,12.0,1736.8033,341.33,MoneySpot,0.0,4424199,4.0,06-01-2023,False,Living Expenses,2023-01-06,Orange,0.0,3870.0,4080.92
0062x00000D8bzCAAR,0010K00001gA7SQQA0,Highfields,QLD,Australia,Loan Paid,Existing Client-Granted Loan Before,0.24,73.53,1550.8628,4.0,0.0,0.0,3.0,4.0,1044.9999,2.0,33.0,1471.1064,11.6666,20.0,1.0,8.77,0.0,1.0,3432.0,1499.0,1020.0,650,884.0,7.0,14.143,Fortnightly,50.0,6846.33,650.0,Full-Time Employment,2.0,0.0,0.1099,2.0,0.0,1523.0,3997.4266,126.29,MoneySpot,0.0,4541521,2.0,24-01-2023,False,Travel Expenses,2023-01-24,Green,19.0,7797.0,6846.33
0062x00000DWFXVAA5,0012x00000gq6QIAAY,Burleigh Waters,QLD,Australia,Loan Paid,New Client-New Loan,0.45,52.15,3141.5595,2.0,0.0,0.0,3.0,2.0,8057.0488,7.0,45.0,384.0,2771.27,2701.7,0.0,22.45,0.0,0.0,0.0,0.0,530.0,1000,1280.0,3.0,5.286,Fortnightly,29.0,8065.61,1000.0,,7.0,0.0,0.0,4.0,6466.2966,535.0,3421.5966,426.67,QuickCash,0.0,4905242,0.0,21-03-2023,False,Purchase - Furniture,2023-03-21,Orange,44.0,9681.0,8065.61
0062x00000EwAugAAF,0012x00000lIlG0AAK,Brunswick,VIC,Australia,Loan Paid,New Client-New Loan,7.15,55.06,793.4899,1.0,0.0,4.0,4.0,1.0,4851.4367,0.0,3.0,0.0,811.4461,819.5,0.0,0.0,0.0,1.0,3900.0,400.0,0.0,700,952.0,16.0,16.571,Weekly,29.0,5208.37,2000.0,Full-Time Employment,0.0,0.0,0.5055,0.0,189.6,0.0,793.49,59.5,QuickCash,0.0,6567791,0.0,21-09-2023,False,Living Expenses,2023-09-21,Orange,421.0,5883.0,5208.37
0062x00000DXaEhAAL,0012x00000LRhq3AAD,Banksia Grove,WA,Australia,Loan Paid,Existing Client-Granted Loan Before,0.0,35.83,524.5589,2.0,0.0,0.0,3.0,2.0,12780.4293,8.0,31.0,192.0,5882.5,7059.0,0.0,0.7,0.0,0.0,7583.33,599.0,2000.0,1000,1280.0,3.0,6.571,Fortnightly,38.0,12907.43,1000.0,Full-Time Employment,8.0,0.0,0.1648,2.0,7843.3333,465.0,583.55,426.67,MoneySpot,0.0,4984280,1.0,02-04-2023,False,Living Expenses,2023-04-02,Green,0.0,9834.0,12907.43
0062x00000Ef40WAAR,0012x00000SHxXQAA1,Brinsmead,QLD,Australia,Loan Paid,Existing Client-Granted Loan Before,0.0,61.94,822.2334,2.0,0.0,0.0,3.0,2.0,3306.7387,0.0,30.0,0.0,1522.0071,2150.44,1.0,3.26,0.0,0.0,2141.76,899.0,1000.0,1000,1400.0,11.0,21.857,Fortnightly,51.0,3880.56,1000.0,Full-Time Employment,0.0,0.0,0.0879,0.0,3551.35,464.0,936.3666,127.27,MoneySpot,0.0,6538488,0.0,15-09-2023,False,Living Expenses,2023-09-15,Green,0.0,5337.0,3880.56
0062x00000D7PMpAAN,0012x00000cM5PIAA0,Sippy Downs,QLD,Australia,Loan Paid,Existing Client-Granted Loan Before,0.0,70.72,6185.5743,2.0,0.0,0.0,3.0,2.0,7405.4987,10.0,88.0,783.6944,3304.23,5063.79,1.0,0.52,0.0,0.0,5802.07,599.0,1200.0,1000,1360.0,7.0,13.571,Fortnightly,28.0,7405.5,1000.0,Full-Time Employment,12.0,0.0,0.2967,1.0,6608.46,1711.0,8059.7233,194.29,Financier-2,0.0,4482553,5.0,15-01-2023,False,Living Expenses,2023-01-15,Orange,0.0,8091.0,7405.5
0062x00000DG88oAAD,0012x00000gnxb4AAA,Yulara,NT,Australia,Closed Lost,New Client-New Loan,0.0,78.44,119.3397,2.0,0.0,0.0,4.0,2.0,3099.148,1.0,6.0,663.342,1426.4583,1563.71,0.0,0.0,0.0,0.0,0.0,0.0,600.0,700,896.0,3.0,5.0,Fortnightly,20.0,3174.65,700.0,,1.0,0.0,0.1868,0.0,2852.9166,73.0,114.4733,298.67,QuickCash,,4704275,0.0,17-02-2023,False,Event - Holiday - Present,2023-02-17,Green,0.0,3021.0,3174.65
0062x00000DWUTTAA5,0012x00000gmccRAAQ,Mokine,WA,Australia,Closed Lost,Existing Client-Granted Loan Before,0.0,38.57,723.8405,4.0,0.0,0.0,4.0,4.0,7070.3333,13.0,41.0,238.9881,3030.1428,789.0,0.0,0.0,0.0,1.0,11700.0,400.0,360.0,1000,1320.0,5.0,9.0,Fortnightly,40.0,7499.44,5000.0,Full-Time Employment,13.0,0.0,0.5495,5.0,0.0,281.0,333.1666,264.0,QuickCash,,4919044,1.0,23-03-2023,False,Vehicle Expenses,2023-03-23,Orange,0.0,8277.0,7499.44
0062x00000F2c8bAAB,0012x00000fmHxkAAE,Inverell,NSW,Australia,Closed Lost,Existing Client-No Loan Granted Ever,0.0,35.35,215.3592,1.0,0.0,0.0,2.0,1.0,5648.8978,1.0,0.0,215.9961,964.0938,818.78,0.0,0.0,0.0,0.0,0.0,400.0,1200.0,600,936.0,35.0,35.571,Weekly,32.0,5648.9,2050.0,Full-Time Employment,1.0,0.0,0.022,0.0,4177.74,391.0,390.7733,26.74,MoneySpot,,6982435,1.0,02-11-2023,False,Other Expenses,2023-10-28,Green,0.0,6046.0,5648.9
0062x00000DXIXgAAP,0012x00000cwEekAAE,Raby,NSW,Australia,Loan Paid,Existing Client-Granted Loan Before,0.0,93.5,3201.2433,2.0,0.0,0.0,2.0,2.0,4179.0735,0.0,44.0,330.0,1923.52,1923.52,0.0,0.0,0.0,0.0,4167.63,400.0,500.0,1000,1320.0,5.0,8.857,Fortnightly,27.0,6289.83,2050.0,Full-Time Employment,0.0,0.0,0.0,0.0,2564.6933,1661.0,3280.9733,264.0,MoneySpot,0.0,4964537,0.0,31-03-2023,False,Home Maintenance & Repairs,2023-03-31,Orange,0.0,5983.0,6289.83
0062x00000D93WwAAJ,0012x00000Vek1sAAB,Dalby,QLD,Australia,Loan Paid,Existing Client-Granted Loan Before,20.52,54.4,109.3083,1.0,0.0,2.0,2.0,1.0,2793.1886,1.0,40.0,613.2895,556.603,505.66,1.0,0.23,0.0,0.0,1950.0,400.0,100.0,1000,1360.0,14.0,13.714,Weekly,50.0,2919.86,1000.0,Casual Employment,1.0,0.0,0.2857,0.0,2440.35,663.0,1088.6466,97.14,QuickCash,0.0,4562552,0.0,27-01-2023,False,Vehicle Expenses,2023-01-27,Green,628.0,3059.0,2919.86
0062x00000DUcVOAA1,0012x00000Gb6ioAAB,Margate,QLD,Australia,Loan Paid,Existing Client-Granted Loan Before,0.0,79.94,1638.767,1.0,0.0,0.0,3.0,1.0,1710.9375,0.0,48.0,936.856,393.75,400.0,1.0,0.0,1.0,1.0,0.0,400.0,101.0,600,864.0,23.0,23.143,Weekly,55.0,1805.14,2200.0,,0.0,0.0,0.8022,0.0,0.0,155.0,1634.21,37.57,MoneySpot,0.0,5376659,0.0,24-05-2023,False,Travel Expenses,2023-05-24,Green,0.0,2852.0,1805.14
0062x00000DWE1EAAX,0012x00000g6q1RAAQ,Umina Beach,NSW,Australia,Closed Lost,Existing Client-Granted Loan Before,0.0,67.69,594.1966,4.0,1.0,0.0,1.0,4.0,404.4766,4.0,16.0,0.0,404.4766,32.74,1.0,0.0,0.0,1.0,0.0,400.0,1600.0,1000,1280.0,6.0,6.286,Weekly,43.0,7483.35,1000.0,Full-Time Employment,31.0,0.0,0.2857,13.0,618.4066,213.0,2376.1033,213.33,MoneySpot,,4903495,16.0,22-03-2023,False,Living Expenses,2023-03-20,Green,0.0,3485.0,7483.35
0062x00000DAjUOAA1,0012x00000gnK2dAAE,Findon,SA,Australia,Closed Lost,New Client-New Loan,29.81,27.69,452.2623,1.0,0.0,2.0,1.0,1.0,3615.4208,0.0,19.0,748.0422,474.9169,574.12,0.0,0.0,0.0,1.0,2166.67,400.0,0.0,1000,1280.0,6.0,5.857,Weekly,47.0,3730.21,1000.0,Casual Employment,0.0,0.0,0.0,0.0,1666.5866,582.0,1077.42,213.33,Financier-2,,4642706,0.0,08-02-2023,False,Home Maintenance & Repairs,2023-02-08,Green,1667.0,5592.0,3730.21
0062x00000DXf74AAD,0012x00000hXBolAAG,Inglewood,WA,Australia,Closed Lost,New Client-New Loan,0.0,40.11,53.3333,2.0,0.0,0.0,4.0,2.0,4593.4321,0.0,10.0,0.0,1497.1675,1858.19,0.0,0.0,0.0,0.0,3250.0,400.0,500.0,800,1024.0,3.0,5.571,Fortnightly,22.0,4762.9,2500.0,Full-Time Employment,0.0,0.0,0.7033,0.0,3152.8633,60.0,113.51,341.33,MoneySpot,,4988762,0.0,07-04-2023,False,Living Expenses,2023-04-03,Orange,0.0,3715.0,4762.9
0062x00000D9HFGAA3,0012x00000g9S2iAAE,Brewarrina,NSW,Australia,Loan Paid,Existing Client-Granted Loan Before,0.0,62.79,1338.0726,4.0,0.0,0.0,3.0,4.0,9060.8658,4.0,6.0,1170.8135,2524.655,2218.16,0.0,0.0,0.0,0.0,9201.28,400.0,200.0,1000,1320.0,5.0,9.571,Fortnightly,39.0,7625.23,3600.0,Full-Time Employment,4.0,0.0,0.011,2.0,7540.9133,515.0,514.6066,264.0,MoneySpot,0.0,4574576,2.0,29-01-2023,False,Travel Expenses,2023-01-29,Orange,0.0,14922.0,7625.23
0062x00000E78PrAAJ,0012x00000iKdBvAAK,Plympton,SA,Australia,Closed Lost,Existing Client-No Loan Granted Ever,0.0,78.11,3352.5113,2.0,0.0,0.0,3.0,2.0,16409.3105,0.0,28.0,0.0,2097.3416,2190.46,0.0,0.0,0.0,0.0,4745.0,599.0,1200.0,650,884.0,8.0,14.714,Fortnightly,44.0,16409.31,5000.0,Full-Time Employment,0.0,0.0,0.0,0.0,10774.5366,0.0,3712.58,110.5,MoneySpot,,5796003,0.0,02-07-2023,False,Vehicle Expenses,2023-07-01,Green,0.0,17247.0,16409.31
0062x00000DZuO8AAL,0012x00000hYS49AAG,Blacktown,NSW,Australia,Loan Paid,New Client-New Loan,0.0,51.74,1266.0045,2.0,1.0,0.0,4.0,2.0,4245.1375,2.0,7.0,422.4,1842.54,3076.65,0.0,0.0,0.0,0.0,4333.33,400.0,392.0,800,1024.0,3.0,5.714,Fortnightly,45.0,4601.47,800.0,Full-Time Employment,2.0,0.0,0.0769,2.0,4299.26,211.0,891.4733,341.33,MoneySpot,0.0,5123484,2.0,24-04-2023,False,Travel Expenses,2023-04-23,Green,0.0,5523.0,4601.47
0062x00000Ds1PCAAZ,0012x00000hXdkkAAC,CARINGBAH,NSW,Australia,Closed Lost,Existing Client-No Loan Granted Ever,0.0,45.42,3361.5951,1.0,0.0,0.0,2.0,1.0,9650.2423,4.0,25.0,0.0,1209.0422,1316.9,2.0,2.06,0.0,0.0,0.0,400.0,300.0,1000,1280.0,6.0,6.429,Weekly,30.0,13687.54,1000.0,,4.0,0.0,0.6813,3.0,3627.1266,890.0,3968.9933,213.33,MoneySpot,,5215493,4.0,12-05-2023,False,Living Expenses,2023-05-07,Green,0.0,12307.0,13687.54
0062x00000D26IIAAZ,0012x000003F4ugAAC,Maylands,WA,Australia,Loan Paid,Existing Client-Granted Loan Before,19.22,96.46,1852.654,1.0,1.0,2.0,2.0,1.0,4176.6152,3.0,44.0,504.5051,627.6269,685.28,1.0,0.0,0.0,0.0,0.0,400.0,300.0,800,1024.0,6.0,5.714,Weekly,23.0,4283.6,5000.0,,3.0,0.0,0.2418,1.0,3611.8166,563.0,2122.6166,170.67,MoneySpot,0.0,4427068,3.0,06-01-2023,False,Living Expenses,2023-01-06,Orange,905.0,4708.0,4283.6
0062x00000ECncDAAT,0012x00000cwmblAAA,Port Kennedy,WA,Australia,Loan Paid,Existing Client-Granted Loan Before,0.0,70.23,3598.867,2.0,0.0,0.0,3.0,2.0,10129.4501,0.0,49.0,0.0,2943.9671,3529.09,0.0,38.14,1.0,0.0,0.0,599.0,410.0,1000,1360.0,8.0,16.0,Fortnightly,24.0,10919.45,1000.0,Full-Time Employment,0.0,0.0,0.0769,0.0,6869.2566,733.0,3680.43,170.0,QuickCash,0.0,5900448,0.0,13-07-2023,False,Living Expenses,2023-07-13,Orange,0.0,13603.0,10919.45
0062x00000DrXEWAA3,0012x00000ddLyIAAU,Glendenning,NSW,Australia,Closed Lost,Existing Client-Granted Loan Before,0.0,99.31,3013.685,1.0,0.0,0.0,5.0,1.0,7839.4678,0.0,101.0,1112.918,1382.1576,1365.44,1.0,15.45,0.0,0.0,0.0,1499.0,200.0,1000,1360.0,14.0,13.714,Weekly,25.0,7839.47,5000.0,,0.0,0.0,0.1978,0.0,5989.35,2870.0,3787.0433,97.14,MoneySpot,,5173388,0.0,01-05-2023,False,Travel Expenses,2023-05-01,Orange,0.0,14095.0,7839.47
0062x00000DZtfSAAT,0012x00000GdwJrAAJ,Miranda,NSW,Australia,Loan Paid,Existing Client-Granted Loan Before,65.1,67.62,532.3217,2.0,0.0,4.0,4.0,4.0,3622.0121,11.0,0.0,0.0,762.5542,671.01,0.0,0.0,0.0,0.0,0.0,400.0,640.0,1000,1360.0,7.0,13.571,Fortnightly,53.0,3667.01,2050.0,Unemployed,11.0,0.0,0.033,4.0,2563.3,0.0,552.79,194.29,MoneySpot,0.0,5122668,6.0,23-04-2023,True,Vehicle Expenses,2023-04-23,Orange,2563.0,3937.0,3667.01
0062x00000DYZeKAAX,0012x00000cm2pIAAQ,Beresfield,NSW,Australia,Closed Lost,Existing Client-Granted Loan Before,0.0,82.98,0.0,1.0,0.0,0.0,2.0,1.0,4652.9907,0.0,0.0,0.0,1057.6223,829.64,0.0,0.0,0.0,0.0,5542.03,899.0,0.0,700,952.0,14.0,14.571,Weekly,35.0,4652.99,700.0,Full-Time Employment,0.0,0.0,0.0,0.0,4583.03,0.0,0.0,68.0,MoneySpot,,5040326,0.0,17-04-2023,False,Car Maintenance / Rego,2023-04-11,Orange,0.0,4740.0,4652.99
0062x00000DXfCZAA1,0012x00000gpOuDAAU,Blacktown,NSW,Australia,Loan Paid,Existing Client-Granted Loan Before,0.0,22.68,0.0,1.0,0.0,0.0,1.0,1.0,2048.1566,0.0,0.0,0.0,1536.1175,3250.0,0.0,0.0,0.0,1.0,0.0,599.0,520.0,700,924.0,5.0,9.286,Fortnightly,26.0,2048.16,2050.0,,0.0,0.0,0.0,0.0,0.0,0.0,206.5,184.8,MoneySpot,0.0,4988907,0.0,03-04-2023,False,Medical Expenses,2023-04-03,Orange,0.0,2049.0,2048.16
0062x00000DAGuDAAX,0012x00000KKaEwAAL,Penrith,NSW,Australia,Closed Lost,Existing Client-No Loan Granted Ever,20.55,20.75,103.8485,1.0,0.0,4.0,4.0,1.0,6872.0657,0.0,0.0,0.0,1272.3384,1211.39,1.0,0.0,0.0,1.0,0.0,2000.0,400.0,700,952.0,14.0,13.714,Weekly,30.0,6872.07,4000.0,,0.0,0.0,0.0,0.0,1343.4533,0.0,63.7333,68.0,MoneySpot,,4622097,0.0,10-02-2023,False,Home Maintenance & Repairs.,2023-02-05,Orange,1470.0,7150.0,6872.07
0062x00000EzAsUAAV,0010K00001utkDnQAI,Loxton,SA,Australia,Loan Paid,Existing Client-Granted Loan Before,14.53,63.07,1032.3051,2.0,0.0,2.0,1.0,2.0,3797.4152,0.0,13.0,0.0,1559.1016,1559.1,0.0,0.0,0.0,0.0,2600.0,899.0,1680.0,900,1260.0,10.0,20.0,Fortnightly,35.0,4131.08,900.0,Full-Time Employment,0.0,0.0,0.4505,0.0,3332.4033,194.0,1076.2866,126.0,MoneySpot,0.0,6790115,0.0,10-10-2023,False,Life Event Expenses,2023-10-10,Orange,654.0,4501.0,4131.08
0062x00000F4JcDAAV,0012x00000THTEcAAP,Tarneit,VIC,Australia,Loan Paid,Existing Client-Granted Loan Before,42.79,90.52,1156.6683,2.0,0.0,1.0,3.0,2.0,4035.9929,12.0,28.0,0.0,896.1428,903.07,1.0,0.06,0.0,0.0,3250.0,599.0,650.0,1000,1400.0,10.0,20.0,Fortnightly,48.0,4059.94,1000.0,Part-Time Employment,12.0,0.0,0.0879,4.0,4207.9766,307.0,1195.7933,140.0,MoneySpot,0.0,7125273,2.0,09-11-2023,False,Home Maintenance & Repairs,2023-11-08,Orange,2059.0,4811.0,4059.94
0062x00000D8ES1AAN,0012x00000g8eW4AAI,STRATHDALE,VIC,Australia,Loan Paid,Existing Client-No Loan Granted Ever,52.64,47.02,1192.8865,2.0,0.0,2.0,2.0,2.0,4215.2059,1.0,17.0,436.7496,769.3,725.21,3.0,0.0,2.0,0.0,1776.67,400.0,200.0,700,896.0,3.0,6.571,Fortnightly,39.0,4586.54,700.0,Part-Time Employment,1.0,0.0,0.7473,0.0,3937.4866,555.0,1235.67,298.67,MoneySpot,0.0,4521705,1.0,21-01-2023,False,Purchase - White Good/s,2023-01-21,Orange,2399.0,4557.0,4586.54
0062x00000DA05TAAT,0012x00000LQfkVAAT,Broken Hill,NSW,Australia,Loan Paid,Existing Client-Granted Loan Before,13.97,61.72,3688.4597,2.0,1.0,2.0,3.0,2.0,5188.1464,2.0,21.0,502.1792,2092.39,1961.89,0.0,0.0,0.0,0.0,1200.0,1500.0,960.0,850,1156.0,9.0,16.857,Fortnightly,33.0,5188.15,2000.0,Part-Time Employment,2.0,0.0,0.011,0.0,4874.4666,715.0,3771.6666,128.44,MoneySpot,0.0,4608349,1.0,03-02-2023,False,Vehicle Expenses,2023-02-03,Green,690.0,4939.0,5188.15
0062x00000Du1R8AAJ,0012x00000haWXAAA2,Horsham,VIC,Australia,Closed Lost,New Client-New Loan,0.0,22.35,0.0,2.0,0.0,0.0,1.0,2.0,3050.6308,0.0,4.0,0.0,1404.126,1493.11,0.0,0.77,0.0,0.0,0.0,0.0,310.0,800,1024.0,3.0,5.0,Fortnightly,21.0,2340.21,2000.0,,0.0,0.0,0.0,0.0,2340.21,0.0,175.0,341.33,MoneySpot,,5365650,0.0,27-05-2023,False,Other/Multiple  we will contact you to discuss.,2023-05-23,Orange,0.0,3514.0,2340.21
0062x00000D7C3GAAV,0012x000002bbxSAAQ,Newington,VIC,Australia,Loan Paid,Existing Client-Granted Loan Before,0.0,88.71,1492.6096,2.0,0.0,0.0,3.0,2.0,9105.1118,5.0,19.0,0.064,2188.0071,2012.06,0.0,0.0,0.0,0.0,3466.67,899.0,480.0,900,1188.0,5.0,9.857,Fortnightly,33.0,9105.11,900.0,Full-Time Employment,5.0,0.0,0.0549,0.0,5105.35,776.0,1758.2866,237.6,Financier-2,0.0,4471612,5.0,13-01-2023,False,Vehicle Expenses,2023-01-13,Orange,0.0,12682.0,9105.11
0062x00000DVz3sAAD,0012x00000Mi5x0AAB,St Albans,VIC,Australia,Loan Paid,Existing Client-No Loan Granted Ever,0.0,87.31,475.2665,1.0,0.0,0.0,3.0,1.0,4362.5621,0.0,8.0,28.9894,1003.9875,978.03,0.0,0.74,0.0,0.0,324.0,899.0,150.0,800,1024.0,6.0,5.714,Weekly,33.0,7737.04,5000.0,Casual Employment,0.0,0.0,0.011,0.0,2677.3,41.0,562.4866,170.67,MoneySpot,0.0,4888005,0.0,18-03-2023,False,Life Event Expenses,2023-03-18,Orange,0.0,2710.0,7737.04
0062x00000DHgrJAAT,0012x00000VeO4sAAF,REGENTS PARK,QLD,Australia,Loan Paid,Existing Client-Granted Loan Before,0.0,97.98,1679.2416,1.0,0.0,0.0,3.0,1.0,4902.0617,2.0,65.0,91.4129,979.6438,1001.0,0.0,4.9,0.0,0.0,2594.42,400.0,100.0,1000,1360.0,14.0,13.857,Weekly,35.0,5520.69,1000.0,Full-Time Employment,2.0,0.0,0.7253,0.0,5400.6933,156.0,1191.5133,97.14,MoneySpot,0.0,4791493,0.0,03-03-2023,False,Living Expenses,2023-03-03,Green,0.0,4897.0,5520.69
0062x00000DYbzaAAD,0012x00000hXhOIAA0,BRUNSWICK EAST,VIC,Australia,Loan Paid,Existing Client-No Loan Granted Ever,0.0,35.61,874.2899,4.0,0.0,0.0,2.0,4.0,7717.4859,0.0,9.0,0.0,1262.5,50.0,0.0,0.0,0.0,1.0,4225.0,1500.0,300.0,1000,1280.0,6.0,6.143,Weekly,29.0,7615.69,1000.0,Full-Time Employment,0.0,0.0,0.011,0.0,3057.9166,0.0,1029.08,213.33,MoneySpot,0.0,5043739,0.0,12-04-2023,False,Medical - Medication,2023-04-11,Orange,0.0,8490.0,7615.69
0062x00000DrjqGAAR,0012x00000hX2eNAAS,Leopold,VIC,Australia,Loan Paid,Existing Client-Granted Loan Before,0.0,83.79,871.5,4.0,1.0,0.0,1.0,4.0,5104.14,1.0,1.0,0.0,1480.875,2266.5,0.0,45.42,0.0,0.0,3250.0,599.0,0.0,600,792.0,7.0,13.143,Fortnightly,19.0,6119.14,600.0,Part-Time Employment,1.0,0.0,0.4286,1.0,3949.0,477.0,928.39,113.14,Financier-2,0.0,5188314,1.0,03-05-2023,False,Living Expenses,2023-05-03,Orange,0.0,6513.0,6119.14
0062x00000D7vffAAB,0012x00000FFsScAAL,St Albans,VIC,Australia,Loan Paid,Existing Client-Granted Loan Before,0.0,35.79,2338.5719,1.0,0.0,0.0,3.0,1.0,9340.4741,0.0,39.0,0.0,1498.1057,1529.87,1.0,0.0,0.0,0.0,3722.33,599.0,1400.0,800,1088.0,14.0,14.0,Weekly,32.0,9114.98,800.0,Full-Time Employment,0.0,0.0,0.0,0.0,6991.16,370.0,2021.9533,77.71,MoneySpot,0.0,4506775,0.0,19-01-2023,False,Travel Expenses,2023-01-19,Orange,0.0,9865.0,9114.98
0062x00000DYZL8AAP,0012x00000Tt2quAAB,Homebush,NSW,Australia,Loan Paid,Existing Client-Granted Loan Before,0.0,96.87,725.7033,1.0,0.0,0.0,4.0,1.0,7759.5068,0.0,20.0,213.33,630.1666,472.5,0.0,0.0,0.0,1.0,5325.32,400.0,200.0,700,896.0,3.0,6.143,Fortnightly,32.0,7474.11,2050.0,Full-Time Employment,0.0,0.0,0.0769,0.0,1682.7133,565.0,725.7033,298.67,MoneySpot,0.0,5040064,0.0,11-04-2023,False,Other Expenses,2023-04-11,Green,0.0,7669.0,7474.11
0062x00000DGEfcAAH,0012x00000XAphWAAT,Palmerston,ACT,Australia,Loan Paid,Existing Client-Granted Loan Before,0.21,39.83,2544.7646,2.0,0.0,0.0,2.0,2.0,5893.5322,3.0,30.0,0.0,2244.845,2244.67,1.0,0.5,0.0,0.0,0.0,1499.0,1230.0,600,816.0,7.0,14.571,Fortnightly,64.0,6094.87,600.0,,3.0,0.0,0.8242,0.0,4489.69,427.0,2160.5733,116.57,MoneySpot,0.0,4710858,3.0,18-02-2023,False,Home Maintenance & Repairs,2023-02-18,Green,13.0,6021.0,6094.87
0062x00000D2MhOAAV,0010K00002ARQ9YQAX,Jan Juc,VIC,Australia,Loan Paid,Existing Client-Granted Loan Before,0.0,9.09,310.0232,3.0,0.0,0.0,3.0,3.0,4697.5966,0.0,6.0,160.0,4697.5966,4754.0,1.0,66.54,1.0,0.0,0.0,0.0,600.0,1000,1360.0,4.0,13.714,Monthly,27.0,4914.74,1000.0,,0.0,0.0,0.011,0.0,4697.5966,0.0,336.6066,340.0,QuickCash,0.0,4441765,0.0,09-01-2023,False,Car,2023-01-09,Orange,0.0,6901.0,4914.74
0062x00000DHl3HAAT,0012x000008KJJtAAO,Tuart hill,WA,Australia,Loan Paid,Existing Client-No Loan Granted Ever,0.0,67.75,920.7662,4.0,0.0,0.0,3.0,4.0,3436.75,7.0,18.0,0.0,1472.8928,1659.0,0.0,55.47,0.0,0.0,2353.0,400.0,0.0,600,768.0,6.0,5.714,Weekly,32.0,3707.08,600.0,Full-Time Employment,7.0,0.0,0.3187,1.0,3436.75,402.0,647.3433,128.0,MoneySpot,0.0,4795186,7.0,04-03-2023,False,Medical Bill,2023-03-04,Orange,0.0,8351.0,3707.08
0062x00000FW2HIAA1,0012x00000lI5xTAAS,Nerang,QLD,Australia,Loan Paid,Existing Client-Granted Loan Before,16.83,70.44,1298.8993,2.0,0.0,2.0,4.0,2.0,8676.4715,6.0,30.0,643.06,2537.3616,2512.3,0.0,0.65,0.0,0.0,0.0,899.0,2600.0,600,816.0,8.0,16.429,Fortnightly,39.0,8687.47,2050.0,full_time,6.0,0.0,0.022,2.0,6465.1366,1205.0,2488.8033,102.0,QuickCash,0.0,7639420,0.0,26-12-2023,False,Child Expenses,2023-12-26,Orange,1502.0,8923.0,8687.47
0062x00000DX573AAD,0012x00000hWsy8AAC,Mosman,NSW,Australia,Loan Paid,New Client-New Loan,0.0,58.75,639.7433,2.0,1.0,0.0,2.0,2.0,7727.9107,2.0,0.0,0.0,3556.9566,2074.52,0.0,0.0,0.0,0.0,0.0,0.0,1235.0,800,1024.0,3.0,5.0,Fortnightly,24.0,8032.19,2500.0,,4.0,0.0,0.1429,2.0,7113.9133,0.0,1259.2766,341.33,MoneySpot,0.0,4953531,4.0,29-03-2023,False,Education - Course Fees,2023-03-28,Orange,0.0,8313.0,8032.19
0062x00000D2HIiAAN,0012x00000MiOwGAAV,Port Kennedy,WA,Australia,Loan Paid,Existing Client-Granted Loan Before,0.0,73.85,2284.0008,1.0,1.0,0.0,4.0,1.0,3341.2906,2.0,64.0,225.9989,817.26,817.26,1.0,40.67,0.0,0.0,3601.97,400.0,100.0,550,748.0,14.0,13.714,Weekly,55.0,3445.39,550.0,Full-Time Employment,2.0,0.0,0.6374,0.0,2996.62,447.0,2536.74,53.43,QuickCash,0.0,4437228,2.0,08-01-2023,False,Life Event Expenses,2023-01-08,Green,0.0,6302.0,3445.39
0062x00000D9E2JAAV,0012x00000gmcZNAAY,Griffin,QLD,Australia,Loan Paid,New Client-New Loan,0.0,21.67,1135.8901,2.0,0.0,0.0,3.0,2.0,5015.7144,2.0,0.0,0.0,2080.6133,2764.11,0.0,0.0,0.0,0.0,1900.0,2000.0,800.0,750,960.0,3.0,4.714,Fortnightly,26.0,5569.69,750.0,Part-Time Employment,2.0,0.0,0.0,1.0,4161.2266,0.0,1129.2966,320.0,QuickCash,0.0,4571645,0.0,28-01-2023,False,Living Expenses,2023-01-28,Orange,0.0,6140.0,5569.69
0062x00000DHcaIAAT,0012x00000fnLbNAAU,Doreen,VIC,Australia,Loan Paid,Existing Client-Granted Loan Before,0.0,6.01,770.11,3.0,0.0,0.0,3.0,3.0,4125.5132,0.0,8.0,0.0,4066.8833,3548.55,0.0,0.0,0.0,0.0,4223.54,400.0,770.0,1000,1360.0,4.0,15.0,Monthly,19.0,4406.79,1000.0,Part-Time Employment,0.0,0.0,0.0,0.0,4066.8833,341.0,1111.4433,340.0,QuickCash,0.0,4788949,0.0,03-03-2023,False,Living Expenses,2023-03-02,Green,0.0,4230.0,4406.79
0062x00000D8lrNAAR,0012x00000gAdbyAAC,Southbank,VIC,Australia,Loan Paid,New Client-New Loan,1.23,95.61,1389.0096,1.0,0.0,4.0,4.0,1.0,4690.4432,9.0,19.0,0.0,908.0118,1356.3,0.0,0.0,0.0,0.0,3683.33,400.0,1000.0,600,768.0,3.0,6.286,Fortnightly,24.0,6513.77,900.0,Full-Time Employment,13.0,0.0,0.033,6.0,3394.7766,0.0,2514.4966,256.0,QuickCash,0.0,4549064,12.0,25-01-2023,False,Living Expenses,2023-01-25,Orange,91.0,7379.0,6513.77
0062x00000Dsx3HAAR,0012x000003CxroAAC,Bondi,NSW,Australia,Loan Paid,Existing Client-Granted Loan Before,0.0,79.57,1832.5089,4.0,0.0,0.0,3.0,4.0,7388.3698,0.0,50.0,577.9167,1087.8887,1001.8,0.0,1.4,0.0,0.0,4116.67,400.0,700.0,1000,1360.0,7.0,13.429,Fortnightly,31.0,7530.7,5000.0,Part-Time Employment,0.0,0.0,0.0989,0.0,2901.0366,1715.0,2654.9766,194.29,Financier-2,0.0,5274638,0.0,17-05-2023,False,Travel Expenses,2023-05-17,Orange,0.0,9547.0,7530.7
0062x00000DVMPnAAP,0012x00000hWq9UAAS,Forestville,NSW,Australia,Loan Paid,Existing Client-Granted Loan Before,0.93,69.34,575.8909,2.0,0.0,0.0,5.0,2.0,2568.0335,4.0,35.0,0.0,1182.0,1182.0,0.0,0.0,0.0,0.0,2364.0,400.0,500.0,750,1050.0,11.0,21.571,Fortnightly,25.0,2568.03,750.0,Full-Time Employment,4.0,0.0,0.3736,2.0,2758.0,299.0,666.1666,95.45,Financier-2,0.0,5440579,0.0,30-05-2023,False,Living Expenses,2023-05-30,Green,26.0,2789.0,2568.03
0062x00000DVM1ZAAX,0012x00000g8BJyAAM,Paradise Point,QLD,Australia,Closed Lost,Existing Client-No Loan Granted Ever,0.0,22.46,885.8133,4.0,0.0,0.0,4.0,4.0,4512.2366,0.0,3.0,0.0,1146.7677,1103.0,1.0,0.0,0.0,1.0,5691.95,899.0,600.0,1000,1280.0,6.0,6.429,Weekly,56.0,4512.24,12400.0,Full-Time Employment,0.0,0.0,0.0,0.0,1071.9333,0.0,925.8133,213.33,MoneySpot,,5439920,0.0,31-05-2023,False,Living Expenses,2023-05-30,Orange,0.0,5066.0,4512.24
0062x00000DWBGGAA5,0012x00000BGUCYAA5,Wentworth Point,NSW,Australia,Loan Paid,Existing Client-Granted Loan Before,0.0,84.92,2656.1327,4.0,0.0,0.0,3.0,4.0,10892.4196,0.0,36.0,688.2857,372.816,5.0,1.0,1.81,0.0,1.0,3300.03,400.0,160.0,1000,1280.0,6.0,6.0,Weekly,57.0,11185.26,1000.0,Unemployed,0.0,0.0,0.0,0.0,0.0,743.0,3297.3733,213.33,QuickCash,0.0,4900020,0.0,21-03-2023,False,Vehicle Expenses,2023-03-20,Green,0.0,18455.0,11185.26
0062x00000EzUAsAAN,0012x00000TJSNPAA5,Riverview,QLD,Australia,Loan Paid,Existing Client-Granted Loan Before,0.0,42.01,0.0,1.0,0.0,0.0,1.0,1.0,5112.0318,0.0,1.0,0.0,910.732,1029.34,0.0,0.0,0.0,0.0,3640.0,599.0,0.0,800,1088.0,14.0,13.714,Weekly,33.0,5763.93,2100.0,Part-Time Employment,0.0,0.0,0.0,0.0,3035.7733,0.0,97.74,77.71,QuickCash,0.0,6812195,0.0,14-10-2023,False,Vehicle Expenses,2023-10-14,Orange,0.0,5031.0,5763.93
0062x00000Ey6ymAAB,0012x000004UrAJAA0,DULWICH HILL,NSW,Australia,Loan Paid,Existing Client-Granted Loan Before,0.0,49.38,2675.5532,3.0,0.0,0.0,2.0,3.0,6995.8933,0.0,8.0,0.0,6995.8933,6995.89,0.0,0.0,0.0,0.0,7563.28,899.0,2607.0,750,1020.0,4.0,15.714,Monthly,45.0,6995.89,750.0,Full-Time Employment,0.0,0.0,0.022,0.0,6995.8933,0.0,4221.17,255.0,MoneySpot,0.0,6711961,0.0,02-10-2023,False,Travel Expenses,2023-10-02,Orange,0.0,10990.0,6995.89
0062x00000DFIN5AAP,0012x00000gAPeSAAW,Southside,QLD,Australia,Loan Paid,Existing Client-Granted Loan Before,0.0,10.63,402.0,1.0,0.0,0.0,3.0,1.0,5799.7038,4.0,0.0,0.0,1292.5346,1797.18,1.0,0.0,0.0,1.0,7366.67,599.0,600.0,550,748.0,14.0,13.714,Weekly,26.0,6056.37,550.0,Full-Time Employment,4.0,0.0,0.044,2.0,0.0,259.0,421.7,53.43,Financier-2,0.0,4659484,0.0,11-02-2023,False,Home Maintenance & Repairs,2023-02-10,Green,0.0,6138.0,6056.37
0062x00000DIedPAAT,0012x00000g9mo2AAA,Kurunjang,VIC,Australia,Loan Paid,Existing Client-No Loan Granted Ever,0.0,25.84,166.6666,4.0,0.0,0.0,3.0,4.0,4114.3333,6.0,22.0,0.0,1371.4444,1450.0,0.0,0.0,0.0,0.0,0.0,599.0,400.0,1000,1280.0,6.0,6.571,Weekly,33.0,4114.33,1000.0,,6.0,0.0,0.2198,0.0,4114.3333,0.0,955.0,213.33,MoneySpot,0.0,4847332,3.0,12-03-2023,False,Medical Expenses,2023-03-11,Orange,0.0,5611.0,4114.33
0062x00000DHuKTAA1,0012x00000AE7WbAAL,Blue Haven,NSW,Australia,Loan Paid,Existing Client-Granted Loan Before,0.0,84.23,3076.832,1.0,0.0,0.0,2.0,1.0,3872.9252,9.0,35.0,0.0,854.2515,870.93,0.0,1.45,0.0,0.0,710.0,599.0,250.0,1000,1360.0,14.0,14.286,Weekly,26.0,3872.93,1000.0,Part-Time Employment,15.0,0.0,0.044,8.0,3701.7566,299.0,3109.3833,97.14,MoneySpot,0.0,4807147,12.0,06-03-2023,False,Living Expenses,2023-03-06,Green,0.0,4010.0,3872.93
0062x00000DZ7IzAAL,0012x00000hXHhbAAG,Ormeau,QLD,Australia,Loan Paid,Existing Client-No Loan Granted Ever,0.0,69.37,2136.9665,4.0,0.0,0.0,3.0,4.0,5083.3066,18.0,51.0,771.0345,2396.3316,2489.49,2.0,0.0,0.0,0.0,2526.0,0.0,2500.0,600,744.0,3.0,3.571,Weekly,49.0,6671.48,600.0,Full-Time Employment,21.0,0.0,0.2747,4.0,5918.5866,807.0,2462.3233,248.0,QuickCash,0.0,5074231,7.0,16-04-2023,False,Rental bond,2023-04-16,Orange,0.0,5719.0,6671.48
0062x00000D1iruAAB,0012x000002eGaCAAU,Cherbourg,QLD,Australia,Loan Paid,Existing Client-Granted Loan Before,23.35,98.59,1310.6937,2.0,0.0,2.0,3.0,2.0,5642.8765,2.0,18.0,380.2185,1343.6416,913.51,0.0,0.28,0.0,1.0,0.0,400.0,0.0,700,952.0,7.0,14.286,Fortnightly,41.0,6223.79,700.0,,2.0,0.0,0.011,1.0,1520.27,529.0,1397.08,136.0,MoneySpot,0.0,4407052,1.0,04-01-2023,False,Other Expenses,2023-01-03,Green,1520.0,6507.0,6223.79
0062x00000DG465AAD,0012x00000dwlwuAAA,Cedar Brush Creek,NSW,Australia,Loan Paid,Existing Client-Granted Loan Before,0.0,50.5,385.7766,0.0,0.0,0.0,0.0,0.0,0.0,0.0,50.0,836.4583,0.0,0.0,2.0,0.99,0.0,0.0,0.0,400.0,350.0,1000,1360.0,14.0,13.857,Weekly,32.0,6414.38,1050.0,,0.0,0.0,0.0989,0.0,0.0,1173.0,1579.4633,97.14,MoneySpot,0.0,4701355,0.0,17-02-2023,False,Other Expenses,2023-02-17,Orange,0.0,7194.0,6414.38
0062x00000DYZSEAA5,0012x000008K2tCAAS,Padbury,WA,Australia,Closed Lost,Existing Client-Granted Loan Before,0.13,63.9,4443.2129,2.0,0.0,0.0,3.0,2.0,8654.6582,1.0,52.0,718.58,3886.8571,2752.19,1.0,6.59,0.0,0.0,2600.0,400.0,100.0,1000,1280.0,4.0,7.286,Fortnightly,46.0,8654.66,2050.0,Full-Time Employment,1.0,0.0,0.022,0.0,9069.3333,2204.0,5402.5766,320.0,QuickCash,,5040157,1.0,16-04-2023,False,Vehicle Expenses,2023-04-11,Green,13.0,9363.0,8654.66
0062x00000DY6T0AAL,0012x000003EIWhAAO,Randwick,NSW,Australia,Loan Paid,Existing Client-Granted Loan Before,0.0,23.5,2022.1212,1.0,0.0,0.0,3.0,1.0,8975.2405,0.0,13.0,0.0,2065.5353,1693.69,0.0,0.0,0.0,0.0,0.0,899.0,350.0,1000,1320.0,9.0,9.0,Weekly,30.0,8980.24,2050.0,Full-Time Employment,0.0,0.0,0.0659,0.0,8950.6533,2127.0,2127.3833,146.67,MoneySpot,0.0,5011841,0.0,06-04-2023,False,Living Expenses,2023-04-06,Orange,0.0,9144.0,8980.24
0062x00000FuXWiAAN,0010K0000273mUsQAI,Chermside,QLD,Australia,Loan Paid,Existing Client-Granted Loan Before,26.31,50.69,232.5517,2.0,0.0,2.0,2.0,2.0,7029.8698,0.0,19.0,0.0,928.478,1036.33,1.0,0.0,0.0,0.0,975.0,599.0,1560.0,800,1088.0,7.0,14.0,Fortnightly,24.0,6903.63,1000.0,Part-Time Employment,0.0,0.0,0.0,0.0,3865.22,307.0,499.48,155.43,QuickCash,0.0,8253029,0.0,2024-02-22,False,Medical Expenses,2024-02-21,Orange,2318.0,8807.0,6903.63
0062x00000E5IdCAAV,0012x00000iIPaDAAW,Mitcham,VIC,Australia,Loan Paid,Existing Client-No Loan Granted Ever,5.58,46.6,0.0,1.0,0.0,0.0,7.0,1.0,6413.5958,0.0,4.0,0.0,852.2142,864.0,0.0,27.61,0.0,0.0,3744.0,899.0,600.0,800,1088.0,14.0,14.429,Weekly,21.0,6646.56,2050.0,Full-Time Employment,0.0,0.0,0.0,0.0,3977.0,0.0,1314.23,77.71,MoneySpot,0.0,5640691,0.0,17-06-2023,False,Medical Expenses,2023-06-17,Orange,441.0,7892.0,6646.56
0062x00000DWzTfAAL,0012x00000NRF6WAAX,Success,WA,Australia,Loan Paid,Existing Client-Granted Loan Before,0.0,97.28,2753.4973,1.0,0.0,0.0,2.0,1.0,9203.3332,0.0,0.0,0.0,1885.0,2300.0,0.0,12.55,0.0,1.0,3416.55,899.0,534.0,1000,1320.0,5.0,10.0,Fortnightly,27.0,13075.56,2050.0,Full-Time Employment,7.0,0.0,0.011,7.0,0.0,356.0,3608.3533,264.0,QuickCash,0.0,4948560,7.0,28-03-2023,False,Living Expenses,2023-03-28,Orange,0.0,14874.0,13075.56
0062x00000E5QIbAAN,0010K000021EWM3QAO,Blacktown,NSW,Australia,Loan Paid,Existing Client-Granted Loan Before,0.35,51.31,4400.1367,1.0,1.0,4.0,4.0,1.0,13768.8204,0.0,68.0,1056.0,1852.7123,1962.24,2.0,0.0,0.0,0.0,4586.83,899.0,500.0,1000,1360.0,16.0,16.571,Weekly,44.0,14381.97,5000.0,Full-Time Employment,34.0,0.0,0.011,10.0,14750.1633,3136.0,4972.03,85.0,MoneySpot,0.0,5652931,2.0,20-06-2023,False,Life Event Expenses,2023-06-20,Orange,53.0,14996.0,14381.97
0062x00000DX8KPAA1,0012x00000WYmSjAAL,Schofields,NSW,Australia,Loan Paid,Existing Client-Granted Loan Before,0.0,68.61,892.2212,1.0,1.0,0.0,3.0,1.0,3267.261,5.0,18.0,892.2222,859.3345,878.67,0.0,0.0,0.0,0.0,4744.83,599.0,360.0,1000,1320.0,9.0,9.143,Weekly,22.0,3267.26,1000.0,Full-Time Employment,9.0,0.0,0.8791,2.0,3150.8933,942.0,941.7033,146.67,MoneySpot,0.0,4956099,9.0,29-03-2023,False,Vehicle Expenses,2023-03-29,Green,0.0,3151.0,3267.26
0062x00000EcDqEAAV,0012x00000gpbOdAAI,Hamilton,NSW,Australia,Loan Paid,Existing Client-Granted Loan Before,0.0,44.53,645.4051,4.0,1.0,0.0,4.0,4.0,4292.1099,36.0,42.0,0.0,2087.5416,2114.0,1.0,1.05,0.0,0.0,0.0,599.0,1000.0,1000,1400.0,10.0,19.714,Fortnightly,31.0,4297.11,2050.0,,36.0,0.0,0.2857,8.0,4175.0833,82.0,978.2333,140.0,MoneySpot,0.0,6342937,5.0,27-08-2023,False,Other Expenses,2023-08-27,Orange,0.0,6468.0,4297.11
0062x00000EbAH6AAN,0010K00001mE9cmQAC,Seymour,VIC,Australia,Loan Paid,Existing Client-Granted Loan Before,0.0,79.02,1017.6051,2.0,3.0,0.0,2.0,2.0,2617.4345,11.0,44.0,0.0,1109.0,1109.0,1.0,0.0,0.0,0.0,2491.67,899.0,1200.0,750,1110.0,13.0,26.429,Fortnightly,49.0,2426.0,750.0,Part-Time Employment,11.0,0.0,0.2637,3.0,2218.0,124.0,1153.9333,85.38,MoneySpot,0.0,6272949,7.0,20-08-2023,False,Living Expenses,2023-08-20,Green,0.0,2773.0,2426.0
0062x00000DG4oCAAT,0010K00001igfTkQAI,CAPALABA,QLD,Australia,Loan Paid,Existing Client-Granted Loan Before,0.0,23.2,616.9428,4.0,1.0,0.0,1.0,4.0,4710.4266,1.0,12.0,688.2857,1675.3257,1897.28,0.0,5.08,0.0,0.0,3466.67,2000.0,400.0,800,1120.0,18.0,17.857,Weekly,37.0,4097.43,800.0,Full-Time Employment,1.0,0.0,0.011,0.0,3909.0933,590.0,589.6,62.22,QuickCash,0.0,4701871,1.0,17-02-2023,False,Living Expenses,2023-02-17,Green,0.0,6029.0,4097.43
0062x00000Dt4Q3AAJ,0012x00000hZrJhAAK,Cooma,NSW,Australia,Closed Lost,New Client-New Loan,0.0,0.0,0.0,0.0,0.0,0.0,0.0,0.0,0.0,0.0,2.0,704.0,0.0,0.0,1.0,0.0,1.0,0.0,3986.67,400.0,1200.0,600,768.0,6.0,6.143,Weekly,56.0,3870.86,600.0,Full-Time Employment,0.0,0.0,0.022,0.0,3563.31,0.0,170.0233,128.0,MoneySpot,,5284575,0.0,16-05-2023,False,Medical Expenses,2023-05-16,Orange,0.0,0.0,3870.86
0062x00000DXuuVAAT,0012x00000gmtibAAA,North Saint Marys,NSW,Australia,Loan Paid,Existing Client-Granted Loan Before,24.39,58.29,1364.4004,4.0,0.0,4.0,3.0,4.0,7624.0702,0.0,14.0,0.0,1947.0757,1825.23,0.0,0.0,0.0,0.0,2300.0,599.0,650.0,650,806.0,3.0,4.143,Weekly,37.0,7724.6,650.0,Full-Time Employment,0.0,0.0,0.0,0.0,6412.8433,128.0,1409.9133,268.67,Financier-2,0.0,5002065,0.0,05-04-2023,False,Vehicle Expenses,2023-04-05,Green,1870.0,7666.0,7724.6
0062x00000D8SWgAAN,0012x00000RsEMEAA3,Deception Bay,QLD,Australia,Closed Lost,Existing Client-No Loan Granted Ever,0.0,51.46,1465.3302,1.0,0.0,0.0,5.0,1.0,7088.5496,0.0,36.0,4.9728,917.9133,1029.0,1.0,0.39,0.0,0.0,2000.0,899.0,2000.0,1000,1400.0,18.0,17.714,Weekly,39.0,7088.55,3000.0,Full-Time Employment,0.0,0.0,0.0,0.0,2753.74,913.0,2655.19,77.78,MoneySpot,,4534098,0.0,24-01-2023,False,Medical Expenses,2023-01-23,Orange,0.0,8551.0,7088.55
0062x00000EwOs3AAF,0012x00000SIJhuAAH,Chester Hill,NSW,Australia,Loan Paid,Existing Client-Granted Loan Before,9.9,91.42,360.5,2.0,0.0,4.0,3.0,2.0,3438.7478,0.0,10.0,0.0,1150.2833,856.51,1.0,0.0,0.0,0.0,3250.0,599.0,0.0,650,910.0,10.0,20.143,Fortnightly,21.0,6802.08,650.0,Casual Employment,0.0,0.0,0.011,0.0,3076.8566,119.0,1494.3766,91.0,MoneySpot,0.0,6586276,0.0,20-09-2023,False,Home Maintenance & Repairs,2023-09-20,Orange,776.0,7833.0,6802.08
0062x00000DIqoeAAD,0012x00000gpOxHAAU,Wentworthville,NSW,Australia,Closed Lost,New Client-New Loan,0.0,78.04,0.0,4.0,0.0,0.0,4.0,4.0,3941.6666,0.0,3.0,0.0,1940.0,1980.0,0.0,0.35,0.0,0.0,8580.0,400.0,0.0,800,1024.0,6.0,6.429,Weekly,24.0,7011.67,1400.0,Full-Time Employment,0.0,0.0,0.0,0.0,1940.0,0.0,0.0,170.67,QuickCash,,4859066,0.0,18-03-2023,False,Living Expenses,2023-03-13,Orange,0.0,9796.0,7011.67
0062x00000ELbjfAAD,0012x00000kfezPAAQ,Cannon Hill,QLD,Australia,Loan Paid,New Client-New Loan,33.05,81.86,593.7153,1.0,1.0,4.0,3.0,1.0,9041.8302,8.0,13.0,0.0,1010.605,1001.56,0.0,0.0,0.0,0.0,0.0,0.0,4400.0,1000,1360.0,14.0,13.714,Weekly,36.0,9041.83,1000.0,,16.0,0.0,0.0,3.0,7346.3333,0.0,862.0333,97.14,QuickCash,0.0,6047202,8.0,29-07-2023,False,Vehicle Expense,2023-07-29,Orange,3304.0,9995.0,9041.83
0062x00000D9eBMAAZ,0012x00000g90xeAAA,Port Lincoln,SA,Australia,Loan Paid,Existing Client-Granted Loan Before,0.0,53.6,1742.1679,2.0,1.0,0.0,2.0,2.0,5125.2112,6.0,12.0,112.3244,2162.6183,2153.95,0.0,0.0,0.0,0.0,5633.33,400.0,540.0,1000,1320.0,5.0,10.0,Fortnightly,40.0,6568.05,3000.0,Full-Time Employment,6.0,0.0,0.0659,3.0,5530.9366,606.0,2291.8833,264.0,QuickCash,0.0,4592301,3.0,01-02-2023,False,Home Maintenance & Repairs,2023-01-31,Orange,0.0,5250.0,6568.05
0062x00000DGuvEAAT,0012x00000cL2YAAA0,Newtown,QLD,Australia,Loan Paid,Existing Client-Granted Loan Before,0.0,89.69,4907.9084,1.0,1.0,0.0,1.0,1.0,6360.0747,23.0,100.0,381.3424,1244.9871,1400.15,0.0,3.88,0.0,0.0,4005.98,400.0,0.0,1000,1360.0,14.0,14.429,Weekly,26.0,6768.22,1000.0,Full-Time Employment,23.0,0.0,0.978,2.0,5809.94,1337.0,5166.0266,97.14,QuickCash,0.0,4749719,16.0,25-02-2023,False,Travel Expenses,2023-02-24,Green,0.0,6874.0,6768.22
0062x00000DJ6E3AAL,0010K00001ze9snQAA,Edensor Park,NSW,Australia,Loan Paid,Existing Client-Granted Loan Before,0.0,91.75,659.75,1.0,0.0,0.0,3.0,1.0,9679.3509,0.0,9.0,0.0,2075.9581,920.44,0.0,0.0,0.0,0.0,3900.0,899.0,1680.0,750,990.0,10.0,10.0,Weekly,36.0,9707.68,750.0,Full-Time Employment,0.0,0.0,0.0,0.0,7611.8466,51.0,849.3266,99.0,MoneySpot,0.0,4871505,0.0,16-03-2023,False,Vehicle Expenses,2023-03-15,Orange,0.0,9806.0,9707.68
0062x00000DXVijAAH,0012x00000gntOyAAI,Chester Hill,NSW,Australia,Loan Paid,Existing Client-Granted Loan Before,0.0,57.04,631.6666,2.0,0.0,0.0,4.0,2.0,10991.355,10.0,44.0,444.9524,4067.9116,4075.82,1.0,1.0,1.0,0.0,6743.81,400.0,0.0,1000,1320.0,5.0,8.857,Fortnightly,32.0,13184.39,1000.0,Full-Time Employment,17.0,0.0,0.956,4.0,8135.8233,374.0,1207.1866,264.0,QuickCash,0.0,4977735,14.0,01-04-2023,False,Other Expenses,2023-04-01,Orange,0.0,13263.0,13184.39
0062x00000EeN2mAAF,0012x00000XE0vxAAD,Currans Hill,NSW,Australia,Closed Lost,Existing Client-Granted Loan Before,0.0,43.34,1579.8065,1.0,0.0,0.0,5.0,1.0,7263.5644,6.0,15.0,0.0,1413.125,1900.0,0.0,7.39,0.0,1.0,25000.0,599.0,620.0,550,858.0,36.0,35.714,Weekly,20.0,10852.29,3000.0,Full-Time Employment,10.0,0.0,0.0879,0.0,0.0,220.0,1538.0966,23.83,MoneySpot,,6483929,5.0,11-09-2023,False,Vehicle Expenses,2023-09-11,Green,0.0,7600.0,10852.29
0062x00000DW27yAAD,0012x00000Mj8U1AAJ,Cabramatta,NSW,Australia,Loan Paid,Existing Client-No Loan Granted Ever,0.0,80.23,995.5741,3.0,0.0,0.0,4.0,3.0,3486.3466,3.0,46.0,0.0,3486.3466,3301.0,0.0,0.0,1.0,0.0,0.0,400.0,400.0,800,1056.0,2.0,9.429,Monthly,29.0,3486.35,800.0,,3.0,0.0,0.1319,3.0,3486.3466,0.0,745.4033,528.0,MoneySpot,0.0,4892507,0.0,19-03-2023,False,Living Expenses,2023-03-19,Orange,0.0,4206.0,3486.35
0062x00000DX4jLAAT,0012x00000Tt0C7AAJ,Narre Warren South,VIC,Australia,Closed Lost,Existing Client-No Loan Granted Ever,0.0,71.72,2299.1598,2.0,0.0,0.0,3.0,2.0,3534.372,0.0,0.0,1688.1163,881.59,1149.9,0.0,1.49,0.0,0.0,5416.67,599.0,833.0,600,768.0,3.0,5.143,Fortnightly,51.0,8552.93,3600.0,Full-Time Employment,0.0,0.0,0.0,0.0,3745.9533,1073.0,2761.66,256.0,MoneySpot,,4953168,0.0,29-03-2023,False,Vehicle Expenses,2023-03-28,Orange,0.0,14404.0,8552.93
0062x00000DIWKjAAP,0012x00000clecJAAQ,SPRING MOUNTAIN,QLD,Australia,Loan Paid,Existing Client-Granted Loan Before,0.0,96.17,0.0,2.0,0.0,0.0,3.0,2.0,11279.7221,0.0,3.0,320.0,3355.2633,3635.77,0.0,0.0,0.0,0.0,11700.0,599.0,0.0,1000,1320.0,7.0,12.857,Fortnightly,26.0,10700.54,1000.0,Full-Time Employment,0.0,0.0,0.0549,0.0,9300.54,217.0,216.83,188.57,QuickCash,0.0,4837427,0.0,10-03-2023,False,Life Event Expenses,2023-03-10,Orange,0.0,10705.0,10700.54
0062x00000FiRtbAAF,0010K00001iKMxNQAW,Ellen Grove,QLD,Australia,Loan Paid,Existing Client-Granted Loan Before,6.41,37.3,768.4034,4.0,0.0,2.0,1.0,4.0,6775.405,0.0,40.0,0.0,2384.6328,2757.86,0.0,3.27,0.0,0.0,4576.0,899.0,800.0,1000,1320.0,7.0,12.857,Fortnightly,34.0,7324.47,1000.0,Full-Time Employment,0.0,0.0,0.0,0.0,6057.9833,423.0,731.9066,188.57,QuickCash,0.0,7984810,0.0,2024-01-24,False,Life Event Expenses,2024-01-24,Orange,494.0,7696.0,7324.47
0062x00000DV4wDAAT,0012x000003F0uzAAC,Allansford,VIC,Australia,Closed Lost,Existing Client-Granted Loan Before,93.81,76.59,682.4495,0.0,0.0,1.0,5.0,1.0,3766.0181,4.0,19.0,682.4538,477.5461,144.8,0.0,0.0,0.0,0.0,0.0,400.0,100.0,600,792.0,10.0,11.0,Weekly,31.0,3771.02,600.0,Unemployed,4.0,0.0,0.7143,1.0,3885.4233,733.0,778.7566,79.2,QuickCash,,5416342,1.0,28-05-2023,True,Relocation Expenses,2023-05-27,Orange,4203.0,4480.0,3771.02
0062x00000Ftf6TAAR,0012x00000nStZ7AAK,Harrisdale,WA,Australia,Closed Lost,New Client-New Loan,0.0,16.27,699.8466,1.0,0.0,0.0,2.0,1.0,4618.2872,0.0,0.0,0.0,1062.8388,1080.35,0.0,0.0,0.0,1.0,4420.0,400.0,0.0,1000,1280.0,6.0,6.0,Weekly,23.0,8442.02,1000.0,Full-Time Employment,0.0,0.0,0.0549,0.0,0.0,0.0,699.8466,213.33,QuickCash,,8193379,0.0,2024-02-17,False,Living Expenses,2024-02-14,Orange,0.0,4362.0,8442.02
0062x00000DYexDAAT,0012x00000hXlL1AAK,Redcliffe,WA,Australia,Closed Lost,New Client-New Loan,1.59,44.61,1216.9666,2.0,0.0,4.0,3.0,2.0,5177.8421,0.0,21.0,0.0,2347.3016,2179.23,0.0,0.0,0.0,0.0,0.0,0.0,1400.0,800,1024.0,3.0,6.143,Fortnightly,50.0,5177.84,9000.0,,0.0,0.0,0.0,0.0,4772.6533,0.0,1216.9666,341.33,MoneySpot,,5045693,0.0,13-04-2023,False,Education,2023-04-12,Orange,78.0,4893.0,5177.84
0062x00000DZp56AAD,0012x00000hYOeaAAG,Hillcrest,SA,Australia,Loan Paid,New Client-New Loan,0.0,68.76,2222.3806,1.0,0.0,0.0,4.0,1.0,23587.3731,6.0,45.0,0.0,1613.6776,1255.13,0.0,20.42,0.0,0.0,0.0,0.0,1000.0,1000,1280.0,6.0,5.857,Weekly,28.0,23323.38,9000.0,Full-time,6.0,0.0,0.044,5.0,6992.6033,0.0,2050.3966,213.33,MoneySpot,0.0,5116316,0.0,22-04-2023,False,Appliances or furniture,2023-04-22,Orange,0.0,34411.0,23323.38
0062x00000D8UzGAAV,0012x00000SI2NpAAL,Manildra,NSW,Australia,Loan Paid,Existing Client-Granted Loan Before,0.0,33.73,3858.7108,3.0,0.0,0.0,5.0,3.0,7409.4766,0.0,38.0,1587.1898,7409.4766,7392.33,2.0,11.41,0.0,0.0,7100.0,1500.0,403.0,1000,1320.0,3.0,10.571,Monthly,57.0,8566.16,2050.0,Full-Time Employment,0.0,0.0,0.011,0.0,7409.4766,2323.0,7043.32,440.0,MoneySpot,0.0,4535752,0.0,23-01-2023,False,Vehicle Expenses,2023-01-23,Green,0.0,8880.0,8566.16
0062x00000DrjHBAAZ,0012x00000hZ1bAAAS,Mawson Lakes,SA,Australia,Loan Paid,New Client-New Loan,0.0,84.64,564.3699,1.0,0.0,0.0,4.0,1.0,3082.128,0.0,14.0,0.0,655.9969,909.91,0.0,0.0,0.0,0.0,0.0,0.0,200.0,900,1152.0,6.0,6.286,Weekly,27.0,3222.13,900.0,Part-Time Employment,0.0,0.0,0.0,0.0,2842.6533,0.0,519.5133,192.0,QuickCash,0.0,5187585,0.0,03-05-2023,False,Short Term Loan,2023-05-03,Green,0.0,3903.0,3222.13
0062x00000DIfWZAA1,0012x00000INWovAAH,Ferntree Gully,VIC,Australia,Loan Paid,Existing Client-Granted Loan Before,6.92,82.71,111.5866,1.0,0.0,2.0,3.0,1.0,1878.8692,0.0,1.0,0.0,1221.68,833.6,0.0,0.22,0.0,0.0,1500.0,400.0,800.0,1000,1320.0,11.0,10.571,Weekly,25.0,1521.97,1000.0,Full-Time Employment,0.0,0.0,0.0,0.0,1438.2033,51.0,162.92,120.0,QuickCash,0.0,4848680,0.0,12-03-2023,False,Other Expenses,2023-03-12,Green,217.0,3132.0,1521.97
0062x00000ExLWXAA3,0012x00000MhCBoAAN,Cameron Park,NSW,Australia,Loan Paid,Existing Client-Granted Loan Before,0.0,86.02,6676.3354,2.0,0.0,0.0,2.0,2.0,4456.1967,0.0,52.0,257.803,2051.0714,1902.89,1.0,0.0,0.0,0.0,0.0,400.0,1660.0,900,1404.0,18.0,36.0,Fortnightly,26.0,4756.2,1500.0,,2.0,0.0,0.022,2.0,4785.8333,1393.0,7124.2233,78.0,QuickCash,0.0,6657083,1.0,27-09-2023,False,Living Expenses,2023-09-27,Green,0.0,5359.0,4756.2
